d63af0fc-8b3b-4617-9150-1c56efeaf07d,2024-07-02 06:48:00+00:00,"Für viele junge Menschen ist ein Ausbildungsplatz bei Siemens Healthineers die Erfüllung eines Traums. Spätestens im nächsten Jahr kann dieser Traum wieder für Dutzende Jugendliche wahr werden. „Wir suchen für 2025 noch junge Frauen und Männer, die den Beruf des Mechatronikers lernen wollen“, erklärt Standort-Leiter Bernhard Rupprecht bei der Begrüßung der Gäste, die der Konzern zur Baustellenbesichtigung eingeladen hatte. Interessierte könnten sich bereits jetzt für das kommende Jahr bewerben. Man bekomme zwar nach wie vor genügend Bewerbungen, müsse aber den Interessenten auch etwas bieten. „Früher konnten sich die Arbeitgeber die Bewerber aussuchen, heute suchen sich die Leute die Firma aus, in der sie arbeiten wollen.“ Derzeit bildet Siemens Healthineers mehr als 400 junge Menschen in ganz Deutschland aus. Nach Erlangen/Forchheim ist Kemnath mit zehn Prozent aller Azubis der zweitgrößte Ausbildungsstandort. Der Standort Kemnath ist verantwortlich für die deutschlandweite Mechatronikerausbildung. Aktuell werden hier 43 junge Menschen ausgebildet. Im September 2025 starten weitere 24 Frauen und Männer am Standort Kemnath ihre Ausbildung zum Mechatroniker. Wie Bernhard Rupprecht versichert, werde der Standort Kemnath auch künftig eine zentrale Rolle für das Unternehmen spielen. Hier werden bald auch Strahlentherapiegeräte, sogenannte Linearbeschleuniger, gefertigt. Dafür werden neue Fertigungslinien eingerichtet und bestehende Abschnitte modernisiert. Alle Gebäude am Standort werden zudem energetisch modernisiert. „Die Ausbildung war und ist ein ganz, ganz wichtiger Bestandteil unserer Unternehmensphilosophie“, erklärte Rupprecht. Siemens habe schon immer fast alle Lehrlinge auch übernommen und dadurch sei auch zu erklären, dass man einen nahezu 100-prozentigen Facharbeiteranteil habe. „Mechatroniker sind heutzutage fast überall gefragt. Doch wir behalten unsere Auszubildenden natürlich am liebsten selbst“, sagte Thomas Lange, der Leiter der technischen Ausbildung bei Healthineers, schmunzelnd. Ein großes Lob zollte Bürgermeister Roman Schäffler der Firma: „Siemens ist ein Vorzeigeunternehmen und einer der wichtigsten Arbeitgeber in der Stadt.“ Das neue Ausbildungs- und Bürogebäude, das „Education & Development Center“, entsteht exakt an der Stelle des alten, abgerissenen Bürogebäudes. Auf 5000 Quadratmetern in vier Geschossen beherbergt der 20-Millionen-Euro-Bau Büros für Forschung und Entwicklung (60 Prozent der Gesamtfläche auf drei Geschossen) sowie einen neuen Bereich für Ausbildung und Duales Studium (40 Prozent). Projektleiterin Madeleine Kugler, Oliver Maier, Projektleiter Ausbildung, und Thomas Lange erläutern den Gästen, was im Neubau genau gemacht wird und wer dort wo ab Anfang 2025 seinen Arbeitsplatz hat. Großer Wert auf Nachhaltigkeit Siemens Healthineers legt beim Neubau größten Wert auf Nachhaltigkeit“, betont Madeleine Kugler. Unter anderem wurde der Beton des abgerissenen Gebäudes zerkleinert und als „Schotter-Unterbau“ für das Fundament verwendet, umweltfreundliche Rohstoffe verbaut und beziehe das Mobiliar aus der Region. Das Gebäude sei CO₂-neutral, werde durch Luft-Wasser-Wärmepumpen beheizt beziehungsweise gekühlt. „Wir achten auf Nachhaltigkeit, vom begrünten Dach bis zu wassersparenden Armaturen. Auch Parkplätze für Hybrid- und E-Autos seien geplant.“"
d405c17f-06a0-44f1-a6b4-170bc1a653fc,2024-07-08 03:25:48+00:00,"Bundeskanzler Olaf Scholz (SPD) absolviert am Montag ein eintägiges Besuchsprogramm in Mittelfranken. Am Vormittag wird Scholz im Bundesamt für Migration und Flüchtlinge (BAMF) in Nürnberg erwartet. Der Kanzler will dort mit Behördenchef Hans-Eckhard Sommer und weiteren BAMF-Beschäftigten über aktuelle und künftige Aufgaben von Deutschlands oberster Flüchtlingsbehörde sprechen. Eine Kernaufgabe ist und bleibt die Entscheidung von Asylanträgen. Zum Artikel: Migrationspolitik: Was Bund und Länder jetzt vorhaben Bis Ende Juni erreichten das BAMF im Jahresverlauf mehr als 121.000 Asylanträge. Insgesamt hat die Behörde nach eigenen Angaben noch 236.000 Asylanträge abzuarbeiten. Darunter sind viele Fälle aus dem Vorjahr, als die Zahl der Menschen, die nach Deutschland geflüchtet waren, ungewöhnlich hoch auf über 350.000 angestiegen war. Die Kriegsflüchtlinge aus der Ukraine zählen nicht dazu, denn für sie ist das BAMF nicht zuständig. Die Behörde sieht sich nach Worten eines Sprechers auch so schon unter einer ""außerordentlichen Belastung"". Kanzler Scholz bei Medizintechnik-Unternehmen Am Nachmittag besucht Scholz den Medizintechnikhersteller Siemens Healthineers in Erlangen. In der Stadt war er zuletzt fast genau vor einem Jahr, als er ein Maschinenbau-Werk von Siemens in der Frauenauracher Straße besuchte. Kurz zuvor hatte der Siemens-Konzern verkündet, dort eine halbe Milliarde Euro für eine umfassende Erweiterung zu investieren. Bei Siemens Healthineers an der Hartmannstraße steht für den Bundeskanzler zunächst eine Führung durch die Produktion von Magnetresonanztomographen an. Die kurz als MRT bezeichneten Diagnosegeräte zählen zu den High-Tech-Produkten in der medizinischen Bildgebung. Nach Angaben eines Sprechers von Siemens Healthineers gehört das Unternehmen zur wachsenden Branche der so genannten ""Industriellen Gesundheitswirtschaft"". Sie erwirtschafte in Deutschland pro Jahr 100 Milliarden Euro. Es handele sich um eine krisensichere Branche - ""mit viel Entwicklung und Produktion in Deutschland"", fügt der Sprecher auf BR24-Anfrage hinzu. Nach einem Gespräch mit Firmenvorstand Bernd Montag und Vertretern des Betriebsrats wird Scholz vor der Belegschaft von Siemens Healthineers eine Rede halten. Im Unternehmen ist dafür eine Sonder-Betriebsratssitzung angesetzt, zu der bis zu 600 Mitarbeitende erwartet werden. Laut Bundeskanzleramt ist Olaf Scholz nach seiner Rede bereit, Fragen aus der Belegschaft zu beantworten. Bundeskanzler besucht Bauernhof"
ba917d68-4919-4a38-b810-0b68b9ecb36b,2024-07-08 07:34:00+00:00,"Hoher Besuch in Franken: Bundeskanzler Olaf Scholz (SPD) wird sich am Montag beim Bundesamt für Migration und Flüchtlinge über die aktuelle Situation bei den Asylverfahren in Deutschland informieren. Das Bundesamt arbeitet angesichts der Vielzahl der Anträge an der Kapazitätsgrenze. Scholz hatte sich zuletzt in der Asylfrage für die schnellere Abschiebung von Straftätern unter den Asylbewerbern ausgesprochen, auch in Herkunftsländer wie Afghanistan und Syrien. Bundesamt für Migration und Flüchtlinge Anschließend reist Scholz weiter zum Medizingerätehersteller Siemens Healthineers. Das Dax-Unternehmen zählt zu den Global Players in der Branche und stellt neben Hightech-Geräten wie Computertomografen auch technische Komplettlösungen für Kliniken zur Verfügung. Zum Abschluss wird Scholz am Abend auf einem biologisch arbeitenden Bauernhof in Markt Erlbach (Landkreis Neustadt an der Aisch/Bad Windsheim) erwartet. Vorschaubild: © Sebastian Christoph Gollnow/dpa"
7a158d5f-6db7-4699-857c-8c7f2d926463,2024-07-08 15:37:47+00:00,"Bundeskanzler Olaf Scholz (SPD) hat ein klares Bekenntnis zur gesetzlichen Rente abgegeben. Diese sei der größte Vermögenswert, den die Deutschen hätten, sagte Scholz vor bei einer Sonder-Betriebsversammlung des Medizingeräteherstellers Siemens Healthineers in Erlangen. Scholz garantiert stabiles Renteniveau: „Darauf kann sich jeder verlassen“ Die Bundesregierung werde in Deutschland ein stabiles Rentenniveau garantieren. „Darauf kann sich jeder verlassen.“ Noch in diesem Jahr werde die Koalition ein Gesetz beschließen, „das es für die nächsten zwei Jahrzehnte völlig festschreibt, damit man sich auf die Rente verlassen kann“. Überlegungen, die Rente mit 63 abzuschaffen, erteilte Scholz dagegen eine klare Absage. „Dass diese Möglichkeit besteht, werden wir nicht ändern.“ Zuvor hatte der Kanzler die Fertigung von Magnetresonanztomographen (MRT) bei Siemens Healthineers besichtigt und mit Beschäftigten diskutiert. Das weltweit tätige Dax-Unternehmen stellt neben Hightech-Geräten wie Computertomographen auch technische Komplettlösungen für Kliniken zur Verfügung. Am Vormittag hatte der Kanzler bereits das Bundesamt für Migration und Flüchtlinge (Bamf) im benachbarten Nürnberg besucht."
b9415219-46f6-4fa4-8028-9db72c0d9743,2024-07-08 16:11:00+00:00,Siemens Healthineers Darum taucht Kanzler Scholz auf der Betriebsversammlung auf
c75fb600-dd7e-49d8-9af4-6f44f6197efc,2024-07-09 12:00:00+00:00,"Im Viertelfinale war für die deutsche Fußball-Nationalmannschaft bei der EM gegen Spanien Schluss. Für seine anschließenden Worte erhält Fußball-Bundestrainer Nagelsmann nun Lob aus der Politik. Erlangen (dpa) – Bundeskanzler Olaf Scholz hat Bundestrainer Julian Nagelsmann für dessen Äußerungen nach dem Viertelfinal-Aus bei der Fußball-EM gelobt. «Ich fand sehr beeindruckend, was der Trainer gesagt hat», sagte Scholz vor Beschäftigten des Medizingeräteherstellers Siemens Healthineers in Erlangen. Nagelsmann habe gesagt, «Leute, guckt mal, was für ein schönes Land wir sind, welche Möglichkeiten wir haben. Wenn alle jetzt immer auf Depression machen, kommen wir ja auch nicht weiter. Wir müssen uns mal für uns selber und für das, was wir können, begeistern», rekapitulierte der SPD-Politiker die Äußerungen des Bundestrainers. «Und ich finde, das hat er völlig richtig formuliert. Und deshalb will ich sagen, das sollte in Zukunft die Stimmung in unserem Land sein. Wir können was, wir wollen was erreichen und wir reden darüber, wie wir das am besten zustande kriegen.» Nagelsmann hatte an ein besseres Miteinander im gesamten Land appelliert. Der Bundeskanzler äußerte sich zudem zur Frage, ob er auf Hand-Elfmeter entschieden hätte beim Viertelfinal-Spiel Deutschland gegen Spanien: «Ja, hätte ich. Aber die Antwort ist natürlich auch: Deshalb gibt es ja bei den Gerichten die Unparteilichkeit als Voraussetzung. Und das wäre ich natürlich nicht gewesen.» Das deutsche Team hatte gegen Spanien mit 1:2 nach Verlängerung verloren. Während eines Schusses aufs spanische Tor hatte Abwehrspieler Marc Cucurella den Ball an die Hand bekommen, was jedoch nicht als strafbares Handspiel gewertet wurde. Dies hatte im Anschluss für Diskussionen gesorgt. Bei seinem Besuch in Erlangen besichtigte der Kanzler die Fertigung von Magnetresonanztomographen (MRT) und nahm an einer Sonder-Betriebsversammlung des Unternehmens teil. Dabei konnten Beschäftigte dem Kanzler Fragen stellen."
36020031-9740-4cac-be2d-5f61d2417f28,2024-07-10 15:28:00+00:00,"Das Uniklinikum Erlangen verfügt seit Kurzem über das weltweit erste Gerät des Typs CIARTIC Move der Siemens Healthineers AG, wie die Friedrich-Alexander-Universität Erlangen-Nürnberg in einer Pressemitteilung berichtet. Dabei handelt es sich um einen selbstfahrenden, mobilen C-Bogen, der die intraoperative Bildgebung erheblich erleichtert und beschleunigt. CIARTIC Move wurde in den vergangenen drei Jahren von Siemens Healthineers gemeinsam mit der Unfallchirurgischen und Orthopädischen Klinik des Uniklinikums Erlangen entwickelt. „Wir hatten das große Privileg, das System gemeinsam mit Siemens Healthineers zu entwickeln und Input aus Anwendersicht zu geben“, erklärt Klinikdirektor Prof. Dr. Mario Perl. „Wir haben das Gerät präklinisch und klinisch getestet und sind rundum überzeugt davon. Die enge Zusammenarbeit zwischen Medizintechnik und Klinik birgt enormes Innovationspotenzial und hat dazu geführt, dass wir jetzt hier am Standort Erlangen das erste System dieser Art weltweit einsetzen können.“ CIARTIC Move ermöglicht eine automatisierte intraoperative Röntgenbildgebung in 3-D und 2-D. Dabei besteht auch die Möglichkeit, zunehmend Strahlung für die Patientin bzw. den Patienten und das medizinische Team einzusparen. Der neue C-Bogen (Bildwandler) stellt selbst feinste anatomische Details und metallische Objekte wie Schrauben und Drähte hochpräzise dar. Dabei erspart das Gerät OP-Teams viel Zeit und Aufwand. Dank des motorisierten Fahrgestells lässt sich der CIARTIC Move frei und kontinuierlich in beliebige Richtungen bewegen. Möglich wird dies durch omnidirektionale, holonome Räder. Diese erlauben akkurate Bewegungen – selbst auf sehr kleinem Raum. So kann der CIARTIC Move exakt dort über der Patientin oder dem Patienten platziert werden, wo er gebraucht wird. Dabei erfüllt der Bildwandler höchste Anforderungen an die Patientensicherheit. Dank berührungsempfindlicher Griffe kann das Gerät außerdem mühelos verschoben werden – während eines Eingriffs oder danach, wenn es in einem anderen OP-Saal benötigt wird. Das Fahrgestell ist zudem eine wichtige Voraussetzung für verschiedene Automatisierungsfunktionen. „Es gibt zum Beispiel einen integrierten Assistenten, der beim Positionieren des C-Bogens hilft“, erklärt Prof. Perl. „Das spart im OP-Saal viel Zeit. Vor Beginn eines Eingriffs speichere ich mir einfach die relevanten Positionen ab und rufe sie wieder auf, wenn ich sie brauche. Das spart auch Röntgenstrahlung ein, weil ich eben keine ‚Testschüsse‘ machen muss, sondern die richtige Position einfach und schnell reproduzieren kann.“ Während frühere C-Bögen manuell und teilweise unter Anstrengung zum OP-Tisch hin- und wieder weggefahren werden mussten, geschieht dies nun fast wie von selbst – gesteuert durch eine Fernbedienung. Das System merkt sich seine vorherige Position am OP-Tisch und nimmt sie auf Wunsch jederzeit automatisch wieder ein. „Das ist vor allem auch für das OP-Pflege-Team eine große körperliche und zeitliche Entlastung. Für alle ist das weniger Workload und weniger Stress“, so Mario Perl. „Für alle unsere Patientinnen und Patienten sind wir an sieben Tagen pro Woche, 24 Stunden täglich im Einsatz – auch und gerade für Notfälle mit schweren unfall- oder verletzungsbedingten Traumata“, sagt Prof. Perl. „Der CIARTIC Move ist dabei sehr wertvoll, weil er uns Operateure und Operateurinnen entlastet. Ich muss mich ab jetzt nicht mehr mit dem aufwendigen Manövrieren des C-Bogens beschäftigen, beziehungsweise dazu nicht mehr permanent mit der Operationstechnischen Assistenz kommunizieren und interagieren. Der Bildwandler wird jetzt automatisch auf Knopfdruck positioniert. Wenn ich operiere, kann ich mich dadurch viel besser auf die Patientin oder den Patienten fokussieren. Deshalb ist der neue C-Bogen ein Gamechanger für uns.“ Die Operationstechnische Assistentin Anna Danisha Jones stimmt zu: „Man hat dank des CIARTIC Move schneller Bilder, schneller Ergebnisse und der Operateur kann sich das System selbst so einstellen, wie er es braucht. Ich muss dadurch nicht mehr ständig am Gerät stehen und habe während der OP mehr Zeit für andere wichtige Aufgaben.“ Wie schnell soll sich der C-Bogen bewegen? Auf welchem Bodenbelag laufen seine Räder? Wie viele Positionen und Bilder soll das System speichern können? Zu diesen und vielen anderen Detailfragen tauschte sich das Team der Unfallchirurgie-Orthopädie des Uniklinikums Erlangen immer wieder mit Siemens Healthineers aus, und die Medizintechnikexpertinnen und -experten nahmen, wenn nötig, immer wieder Anpassungen an ihrer Entwicklung vor. „Am Ende ist ein System entstanden, das unsere Anforderungen perfekt erfüllt. Wir sind sehr stolz auf diese Zusammenarbeit“, freut sich Prof. Perl. Im Rahmen einer klinischen Zulassungsstudie von Dezember 2023 bis März 2024 wurde ein Prototyp des CIARTIC Move in der Unfallchirurgie-Orthopädie des Uniklinikums Erlangen getestet. Jetzt ist das weltweit erste zugelassene Gerät hier im Einsatz."
