9ba1161b-f644-4d8a-8496-c48ed0fd9cdf,2024-07-19 04:51:24+00:00,"Anfang vergangener Woche publizierte Nicholas Green vom Analysehaus Bernstein eine bemerkenswerte Studie zu Siemens. Die Siemens-Aktie sei «unglaublich günstig». Seit 2021 – dem Jahr, in dem Roland Busch Chef wurde – sei Siemensʼ Konglomeratsabschlag höher als in allen untersuchten Jahren seit 2014. Der Bewertungsrabatt sei im Vergleich zu den europäischen Rivalen Schneider Electric und ABB so gross wie noch nie. Das heisst: Siemensʼ Dreiteilung mit dem Börsengang der Medizintechniktochter Siemens Healthineers 2018 und dem Spin-off der krisengebeutelten Energietechnik in Gestalt von Siemens Energy 2020 hat für die Bewertung an der Börse bisher nichts gebracht. Selbst als das Energiegeschäft noch zum Konzern gehörte, bewertete die Börse Siemens relativ zu den Peers höher als heute. Siemens-Konglomeratsabschlag seit 2021 so hoch wie nie Der Bewertungsrabatt sei «nicht zu rechtfertigen», so Green. «Wir finden keine plausible Begründung dafür, dass der Konglomeratsabschlag heute höher ist als in der Vergangenheit – aber viele Gründe für das Gegenteil.» Er hat die Aktien seit vergangenem Herbst auf «Kaufen». Auch in der Analystenaufstellung von Bloomberg stehen den 21 Kaufempfehlungen nur zwei neutrale Einschätzungen und zwei Verkaufsempfehlungen gegenüber. Doch die Investoren folgen dem Rat der Analysten nicht. The Market meint: Die Investoren handeln mit einer grossen Portion Rationalität. Siemensʼ Hauptprobleme lassen sich in Rechenmodellen kaum abbilden. Das ist erstens: Konzernchef Roland Busch. Seit Jahrzehnten hatte Siemens keinen CEO mehr, der Aktionärsinteressen so umfassend ignoriert: Viele grosse Investoren wünschen etwa eine Reduzierung des Siemens-Anteils an Siemens Healthineers. Wenn Busch unter Druck gerät, wie vor einigen Monaten in Diskussionen mit dem aktivistischen Hedge Fund The Childrenʼs Investment Fund (TCI), reagiert er ausserdem immer wieder angefasst und emotional. Zweitens: Die andauernde Schwäche der wichtigsten Sparte, Digital Industries, ist wohl nicht komplett eingepreist. Siemens hat hierzu seit Frühjahr 2023 immer wieder überoptimistisch kommuniziert. The Market liegen Hinweise vor, wonach bereits ein Sparkurs im Geschäft mit der Automatisierung und der Digitalisierung von Fabriken eingeleitet wurde. Das Geschäft könnte insofern mittelfristig unter Druck bleiben. Beginnen wir mit zweitens: Investoren stösst auf, dass Siemensʼ Aussagen zu Digital Industries (DI) ständig von einer schlechteren Realität eingeholt werden. Das lange Warten auf den «industriellen Superzyklus» Im April 2023 schwärmte Siemens-Vorstand Cedrik Neike auf der Hannover Messe vor Investoren von einem «industriellen Superzyklus», der das Wachstum der Automations- und Softwaregeschäfte antreiben werde. Wenige Wochen später hob Siemens die Jahresprognose für DI an und kündigte milliardenschwere Investitionen an, inklusive einer neuen Fabrik in Singapur und einer Erweiterung des Werks im chinesischen Chengdu. Seit August 2023 stehen die Zeichen in der Fabrikautomation auf Abschwung: Siemens musste die gerade erst angehobene DI-Prognose gleich wieder senken. Kunden hätten im Covid-Boom ihre Lagerbestände aufgestockt und passten sie an die «entspanntere Situation bei den Lieferketten» an, begründete Busch. Seither erklärt Siemens alle paar Monate wieder, dass sich der Abbau der Lagerbestände hinziehe. Im März 2024 warnte Finanzchef Ralf Thomas überraschend vor einer längeren Schwächephase, wodurch sich am selben Tag 8 Mrd. € Börsenwert in Luft auflösten. Im Mai musste Siemens die Prognose für DI abermals kräftig stutzen und erwartet für das gesamte Geschäftsjahr (per 30. September) ein Umsatzminus von 4 bis 8% sowie 18 bis 21% operative Marge. Der Lagerabbau werde in China eher bis Ende des Kalenderjahres 2024 dauern, hiess es nun. In Europa und den USA sollten sich die Bestände bis Geschäftsjahresende im September normalisiert haben. Konkurrenten wie Schneider und ABB vertun sich weit weniger deutlich bei ihren Vorhersagen und schrumpfen nicht so stark, obwohl bei Siemens DI ein stärkeres Softwaregeschäft stabilisierend wirken sollte. Analysten mussten die Erwartungen für die DI-Sparte fortwährend zurücknehmen; deshalb ist die Konsensschätzung für das Konzernergebnis im dritten Geschäftsquartal (April bis Juni) seit Jahresbeginn immer weiter gesunken. Einige Indizien sprechen dafür, dass die Krise tiefere Gründe haben und länger dauern könnte – und dass Siemens die DI-Ergebnisse ein Stück weit aufhübscht. Nach Informationen von The Market werden bereits Sparmassnahmen gestartet. In der Zentrale der Digital-Industries-Sparte in Nürnberg-Moorenbrunn wurden Ende Juni alle Mitarbeiter mit Ausnahme der leitenden Angestellten aufgefordert, 90% ihres Jahresurlaubs bis Jahresende zu nehmen. Dort arbeiten mehr als 2600 Verwaltungsangestellte. Eine solche Regelung hat es bei Siemens so gut wie noch nie gegeben. Normalerweise kann Urlaub bis März des nächsten Jahres genommen werden. Mit dem Vorziehen erspart sich die DI-Sparte Rückstellungen, die für im Folgejahr genommenen Urlaub gebildet werden müssen, und verbessert damit einmalig ihr Ergebnis. Ein Siemens-Sprecher sagt hierzu nur, man habe Massnahmen getroffen, um die Kapazitäten temporär anzupassen. Gemäss Siemens-Kreisen sind auch andere DI-Standorte von Einschränkungen betroffen. Das deute darauf hin, dass bei DI nicht mit einer baldigen Erholung des Geschäfts gerechnet werde. Für Irritation sorgt, dass Aufsichtsrat Tobias Bäumler – ein Betriebsrat aus der Automatisierungssparte – Ende Juni privat gehaltene Siemens-Aktien für 42'000 € verkauft hat. Laut Analysten hat Siemens die Guidance für den 2023/24 geplanten Restrukturierungsaufwand für Digital Industries kürzlich auf über 100 Mio. € mehr als verdoppelt. DI hat zudem, ohne dies mitzuteilen, im April das Gaschromatographiegeschäft für 102 Mio. € an Valmet verkauft. Der Deal könnte das Ergebnis im dritten Quartal mit einem hohen zweistelligen Millionenbuchgewinn aufpolstern. Konzernquellen berichten, dass DI Abfindungsangebote vorbereite, um Stellen abzubauen. Angekündigt sei aber noch nichts. Siemens könnte die Verlängerung von Neikes Vorstandsvertrag abwarten, der Ende Mai 2025 ausläuft, bevor Neike die schlechten Nachrichten offenbart. Der nächste mögliche Termin für die Vertragsverlängerung wäre die Aufsichtsratssitzung am 7. August. Smart Infrastructure sichert die Konzernjahresprognose Zumindest dürfte Siemens im dritten Quartal wieder von einem starken Geschäft der zweiten Kernsparte, Smart Infrastructure (SI), profitieren, die im zweiten Quartal bei 5,1 Mrd. € Umsatz und einem operativen Gewinn von 854 Mio. € die höchsten Beiträge aller vier Sparten ablieferte. Getrieben wird das Geschäft unter anderem vom Bauboom bei Rechenzentren. Dank SI dürfte die Konzernjahresprognose gesichert sein: Vorgesagt sind 4 bis 8% Umsatzplus und ein Gewinn je Aktie von 10,40 bis 11 €. Die SI-Sparte mit Sitz in Zug, die der langjährige Siemens-Schweiz-Chef Matthias Rebellius führt, wird am 12. Dezember erstmals auf einem eigenen Kapitalmarkttag präsentieren. Dies wird erst der zweite Investorentag in der Ära Roland Busch sein, dieses Mal ohne Busch. Der Sinn für die Aktionärsinteressen fehlt Das führt zum ersten der anfangs genannten Problempunkte: In seinen dreieinhalb Jahren an der Spitze ist Busch mit seinen Aktionären nie warm geworden. Seine Story vom «fokussierten Technologieunternehmen» verfing nicht – wie auch, wo die Krise von Siemens Energy doch immer wieder schwere Einschläge in den Siemens-Zahlen hinterliess. Buschs Aufbruch ins «industrielle Metaversum» in Partnerschaften mit nahezu allen Silicon-Valley-Grössen schlägt sich in den Geschäftszahlen nicht nieder. Stattdessen musste Siemens im Juni die Auslieferungen neuer ICE des Typs 3neo an die Deutsche Bahn stoppen, wegen Mängeln bei Schweissnähten. Zu Beginn hofften Investoren noch, Busch werde die von seinem Vorgänger Joe Kaeser gestartete Aufspaltungsstrategie fortsetzen. Die Zugtochter Siemens Mobility ist ausgegliedert und könnte schnell an die Börse gehen. Siemensʼ Anteil an Healthineers von 75% liesse sich einfach via Spin-off an die Siemens-Aktionäre verteilen. Darin sähen Investoren den grössten Hebel zur Wertsteigerung. Christopher Hohn und sein Hedge Fund TCI machten Druck Im Lauf des Jahres 2023 nahmen diese Forderungen gegenüber Busch stark zu, hat The Market aus Investorenkreisen erfahren. An die Spitze dieser Bewegung setzte sich The Children’s Investment Fund (TCI), der aktivistische Hedge Fund des Londoner Multimilliardärs Christopher Hohn. Hohn oder seine Leute nahmen immer wieder an Präsentationen der Siemens-Spitze bei Investorenkonferenzen teil. Sie stellten Fragen zu einer Reduzierung oder einer kompletten Abspaltung des Healthineers-Anteils und hakten nach, wieso dies nicht geschehe. Doch Busch weigerte sich beharrlich, reagierte teils brüsk. Von einem Dinner Buschs mit Siemens-Investoren erzählen sich Teilnehmer, Busch sei so genervt gewesen, dass er massiv geworden sei: Er wolle diese «lächerliche» Diskussion nicht mehr führen. Siemens wollte dies auf Anfrage nicht kommentieren. TCI soll gemäss Finanzkreisen 2023 auch einen bedeutenden Siemens-Anteil unterhalb der Meldeschwelle von 3% erworben haben. Vergangenen Herbst machte sich der Hedge Fund auf die Suche nach Unterstützern und liess bei deutschen Fondsgesellschaften vorfühlen. Dabei soll es auch um Einflussnahme im Aufsichtsrat gegangen sein. Anfang 2025 läuft das Mandat von Chefkontrolleur Jim Hagemann Snabe ab. Da der ehemalige SAP-Co-Chef Snabe mit zwölf Jahren Gremiumszugehörigkeit gemäss deutschen Corporate-Governance-Regeln nicht mehr als unabhängig gilt, ist seine Wiederwahl kein Selbstläufer. Zuletzt ist es allerdings still geworden um TCI. Unter Investoren wird dies so interpretiert, dass TCI die Anteile verkauft habe – wegen Aussichtslosigkeit. Bei einem grossen deutschen Fondsanbieter heisst es mit derselben Begründung, man habe in den vergangenen Wochen die Siemens-Anteile weitestgehend veräussert und dafür Papiere der französischen Schneider Electric erworben. Die Franzosen bestechen nicht nur durch ihr stärker auf Elektrifizierung ausgerichtetes Portfolio, sondern auch durch ihren stabilen Track Record. Ein CEO, der emotional statt rational argumentiert und agiert, ist da auch keine Empfehlung. Unprofessionelles Agieren Buschs wie beim Thema Healthineers kam öfter vor. Als Siemens Energy die Bundesregierung vergangenen Herbst um staatliche Garantien bitten musste, verweigerte sich Busch wochenlang Gesprächen mit Regierungsvertretern. Obwohl Siemens mit 25% Grossaktionär war. Längst erschwert Buschs Kommunikationsschwäche die Besetzung wichtiger Rollen: Die Abteilungen für Investor Relations (IR) und für Media Relations sind seit über einem Vierteljahr ohne dauerhafte Leitung. Der oder die Neue an der IR-Spitze wird die dritte Person auf diesem Posten in Buschs Amtszeit sein. Siemensʼ strategischer Stillstand verärgert auch die eigenen Leute. «Als Aktionär hätte ich erwartet, dass der Technologe Busch starke Entscheidungen trifft, wie wir bei technologischen Durchbrüchen den grössten Hebel erzeugen können», sagt ein Siemens-Topmanager, der ein grösseres Paket Siemens-Aktien hält. Einige im Konzern sähen es als sinnvoll an, mit dem Erlös aus Verkäufen die Kernsparten Digital Industries und Smart Infrastructure mit passenden Softwareakquisitionen aufzubauen. Wie planlos Busch agiert, zeigte sich im Fall von Bentley Systems. Die US-Gesellschaft gilt als hervorragend positioniert bei Software für das Infrastruktur-Engineering. In den vergangenen Monaten buhlten zwei Siemens-Rivalen um Bentley: Schneider Electric und Cadence aus Kalifornien, die mit der Siemens-Tochter Mentor Graphics bei Chipdesignsoftware konkurriert. Für Siemensʼ SI-Sparte wäre Bentley ein geeigneter Software-Nukleus. Siemens hatte sogar 2016 schon etwa 13% erworben. Doch das Paket wurde kurz nach Bentleys Börsengang im Herbst 2020 in den konzerneigenen Pensionsfonds geschoben und schrittweise verkauft. Seither hat sich Bentleys Wert auf 15 Mrd. $ verzweieinhalbfacht. Statt den Konzern strategisch weiterzuentwickeln, bremst Busch bei fast allem, was sein Reich verkleinern würde. Beispiel Siemens Healthineers: Der Dax-gelistete Weltmarktführer bei grossen bildgebenden Geräten wie Magnetresonanztomographen laboriert seit über anderthalb Jahrzehnten am missglückten Einstieg in die Labordiagnostik; das Laborgeschäft hat stets underperformt. Der Healthineers-Vorstand wäre wohl offen für eine Trennung, doch der Grossaktionär zieht nicht mit. Siemens Healthineers kommt nicht vom Fleck Der Siemens-Aufsichtsrat wirkt wenig involviert. Ende Juni offenbarte Chefkontrolleur Snabe überraschend, er sei aus gesundheitlichen Gründen «viele Monate lang nicht aktiv» gewesen. Damit begründete er seinen Rücktritt als Northvolt-Aufsichtsratschef. Er hatte sich im Januar beim Schwimmen im Meer an einer Metallstufe unter Wasser am Schienbein verletzt, durch Keime ergaben sich Komplikationen und mehrere Operationen. Siemens erklärt gegenüber The Market, Snabe sei nur vier Wochen ausgefallen. Ausser der Hauptversammlung im Februar und der anschliessenden Aufsichtsratssitzung habe er alle anderen Sitzungen absolviert. Da der Aufbau eines Nachfolgers versäumt wurde, wird es 2025 wohl auf Snabes Verlängerung hinauslaufen. Sämtliche Zeichen bei Siemens stehen darauf, dass alles beim Alten bleibt. Also auch der Konglomeratsabschlag."
f239fb77-2f5c-4cb1-bea0-16811ba0443d,2024-07-19 10:54:49+00:00,"In der aktuellen Meldung zur wirtschaftlichen Lage in Deutschland zeichnet das Wirtschaftsministerium eine gemischte Stimmungslage: Die heimische Wirtschaft schwächelt – ebenso die Nachfrage im Ausland nach deutschen Industriegütern. Im ersten Halbjahr 2024 gab es 35 Prozent mehr Unternehmensinsolvenzen als im Vorjahreszeitraum. Und auch viele Betriebe beklagen Fachkräftemangel, hohe Energiekosten und hohe Steuern. Die Bundesregierung versucht, mit einer Wachstumsinitiative wirtschaftspolitische Impulse zu setzen, damit der Standort Deutschland attraktiver werde, kommentiert Finanzminister Christian Lindner den neuen Regierungsentwurf für den Bundeshaushalt 2025. Standortvorteil für Deutschland Dabei sei der Wirtschaftsstandort gar nicht so unattraktiv, findet Bernd Montag, Vorstandsvorsitzender von Siemens Healthineers im ARD Morgenmagazin. Dem Unternehmen, das Technik für Krankenhäuser entwickelt, gehe es gut: Aktuell bauen die Healthineers für 350 Millionen Euro einen zusätzlichen Standort in Oberfranken auf, weil in Erlangen kein Platz mehr ist. Im Morgenmagazin ruft Montag zu mehr Positivität in der deutschen Wirtschaft auf. Gut 1,5 Milliarden Euro stecken die Healthineers eigenen Angaben zufolge jedes Jahr in Forschung und Entwicklung. ""Das sind Bereiche, die uns in Deutschland liegen"", so der Healthineers-Chef. Für Firmen, bei denen es weniger um den Einsatz von Ressourcen, sondern eher um Forschung und Vernetzung gehe, sei Deutschland als Standort gut geeignet. Genug Fachpersonal vorhanden? ""Die Branche 'Industrielle Gesundheitswirtschaft' hat in Deutschland eine Million Mitarbeiter und wir finden immer gute Leute, die wir neu einstellen können"", sagt Montag. Trotz Fachkräftemangel. ""Im vergangenen Jahr hatten wir bei Siemens Healthineers 32.000 Bewerbungen und konnten 1.500 neue Mitarbeiter einstellen"", so Montag. Das liege daran, dass sein Unternehmen einen guten Ruf als Arbeitgeber habe, aber auch, dass die Menschen gerne für ein Unternehmen arbeiten würden, das der Gesellschaft einen Mehrwert bringe. Bei anderen Firmen sieht das allerdings anders aus. In den meisten Branchen herrscht ein großer Fachkräftemangel – der die wirtschaftliche Entwicklung zusätzlich ausbremst. Laut dem Institut der Deutschen Wirtschaft (IW) gebe es im ersten Quartal 2024 knapp 470.000 offene Stellen, für die es keine passend qualifizierten Arbeitslosen gibt. Im März hätten die Firmen im Schnitt vier von zehn offenen Stellen nicht neu besetzten können. In einer Pressemitteilung heißt es dazu: ""2024 gehen der deutschen Wirtschaft dadurch Produktionskapazitäten im Wert von 49 Milliarden Euro verloren."" ""Schlechte Stimmung bringt uns nicht weiter"""
5775136a-0663-4eaf-891f-c5087b51a41d,2024-07-22 23:02:00+00:00,"Die Absolventen der neunten und zehnten Klasse der Mittelschule Neunkirchen am Brand feierten ihren erfolgreichen Schulabschluss . Nahezu alle Schülerinnen und Schüler haben den Qualifizierenden Abschluss der Mittelschule beziehungsweise den Mittleren Schulabschluss erreicht. Der Abend stand unter dem Motto „Talente entdecken und schmieden“ und bot eine Vielzahl von Höhepunkten. Den Auftakt der Abendveranstaltung bildete ein von Jochen Schleicher und Horst Schmid gestalteter ökumenischer Gottesdienst, der unter dem Motto „You’ll never walk alone“ stand. Nachdem sich alle Gäste in der Mehrzweckhalle an der Mittelschule eingefunden hatten, heizte die Klasse 6a mit einer selbst verfassten Rap-Darbietung die Stimmung an. Im Anschluss begrüßte Rektorin Carmen Dornheim alle Anwesenden. Bürgermeister Martin Walz würdigte stellvertretend für seine Kollegen die hervorragenden Leistungen der Schüler . Anschließend ehrte er die erfolgreichsten Prüflinge der Schule: Marcel Braun, Kilian Rehm, Moritz Hamm und Timo Mirsberger (alle 9a) sowie Cecilia Christ, Christina Rauh und Elisa Schlund (alle 10M). Das Unternehmen Siemens Healthineers verlieh im Rahmen ihres Partnerschulprogrammes drei Preise an im Mint-Bereich besonders engagierte Schüler . Mitinitiator Reimund Köberlein überreichte die Preise an Moritz Brunner (9a), Raphael Glenn und Finn Müller (beide 10M). Die Preisträger durften sich über Bluetooth-Lautsprecher freuen. Gemeinsam mit Iris Maiwald-Endlinger bedankte sich die Jugendsozialarbeiterin Sandra Edelhäußer bei den scheidenden Mitgliedern des Anti-Mobbing-Teams. Über ein kleines Präsent mit Gutschein durften sich Erik Dietrich und Paul Schuster (beide 9a) sowie Cecilia Christ und Finn Müller (beide 10M) freuen. Rückblickend bedankten sich die Klassenelternsprecherinnen sowie die Abschlussschüler bei den Klassenlehrkräften Imke Töpfer und Reimund Köberlein mit sehr emotionalen Worten. Nach der Pause ließen die Klassenlehrer Töpfer und Köberlein die vergangenen Jahre Revue passieren. Anschließend überreichten sie den Absolventen ihre Zeugnisse und ein besonderes Andenken: ein Hufeisen aus der „Talentschmiede“ als Glücksbringer für den weiteren Lebensweg. Den feierlichen Abschluss des Abends gestaltete Cecilia Christ aus der Klasse 10M mit einem ergreifenden Soloauftritt. Ihre Interpretation von „Amazing Grace“ rundete den Abend perfekt ab. red"
28df7d9f-d2d0-4019-8d23-855358507a51,2024-07-24 00:07:22+00:00,"Auch in diesem Jahr haben die Mitarbeiter*innen von Siemens Healthineers Kemnath wieder eine Spendensammlung für wohltätige Zwecke durchgeführt. Hierzu wurden kleine Anstecker, genannt Maiabzeichen, zu einem wohltätigen Zweck verkauft. Die Spendensammlung wurde im Unternehmen von den Vertrauensleuten der IG Metall organisiert und durchgeführt. In Summe haben alle Mitarbeiter*innen von Siemens Healthineers aus Kemnath 700 € gespendet, die der Tafel Pegnitz kürzlich überreicht werden konnte. Empfängerin war die Kollegin Christine Wagner, die bei Siemens Healthcare in Kemnath arbeitet und die Vorsitzende der Tafel Pegnitz ist. Vielen Dank an alle Spender und auch an die Tafel Pegnitz für Ihre wichtige und hervorragende Arbeit!"
3b0646f2-2565-4e6b-95c0-38943c8764d5,2024-07-24 08:30:31+00:00,"Am 17. Juli bot sich für 29 Schülerinnen und Schüler der 8. Jahrgangsstufe aus Kemnath eine einmalige Gelegenheit: Im Rahmen des MINT-Erlebnistages bei Siemens Healthineers in Kemnath tauchten sie in die spannende Welt der Technik ein. Der Tag stand im Zeichen der praktischen Erfahrung und des spielerischen Lernens und bot den Jugendlichen einen faszinierenden Einblick in die MINT-Fachrichtungen Mathematik, Informatik, Naturwissenschaften und Technik. Praktische Erfahrungen sammeln Highlight des Tages war das Zusammenbauen und Löten eines elektronischen Würfels, bei dem die Jugendlichen ihr handwerkliches Geschick und ihre Feinmotorik unter Beweis stellen konnten. Das „Digger-Spiel“ führte sie in die Grundlagen der Prozessoptimierung ein. Dabei produzierten sie in Teamarbeit kleine Lego-Bagger in effizienten Produktionsschritten. Durch das Programmieren des „Hauses vom Nikolaus“ in der Roboterwerkstatt wurde den Schülern die Zusammenarbeit von Mensch und Maschine nähergebracht und die Bedeutung der Digitalisierung in der heutigen Arbeitswelt verdeutlicht. Nach einer Stärkung in der Kantine ging es mit einer Tour durch die Werkshallen weiter, wo die Schüler moderne Arbeitsplätze und fortschrittliche Technologien wie 3D-Drucker und Roboter in der Produktion hautnah erlebten. Austausch mit Mitarbeitern Der Tag wurde mit einer „Speed-Dating-Runde“ abgerundet, in der die Jugendlichen die Möglichkeit hatten, mit Mitarbeitern von Siemens Healthineers ins Gespräch zu kommen. Sie erfuhren mehr über die vielfältigen Arbeitsfelder, Berufsbilder sowie Ausbildungs- und Karrieremöglichkeiten bei Siemens Healthineers. Das positive Feedback der Schülerinnen und Schüler bestätigte, dass Siemens Healthineers in Kemnath nicht nur für seine Innovationskraft bekannt ist, sondern auch ein familiäres Arbeitsumfeld bietet, „in dem jeder Einzelne zählt“. Ein Tag, der nicht nur wertvolles Wissen vermittelte, sondern auch Begeisterung für Technik und die MINT-Berufsfelder weckte."
1016a22c-f01f-4dc0-926b-30f7d2d04027,2024-07-29 07:43:33+00:00,"Die Börse in Frankfurt eröffnete am Montag mit Gewinnen und der Dax stieg um 0,4 Prozent. Spitzengewinner waren Merck, Zalando und Siemens Healthineers, während Beiersdorf, Henkel und BASF am Ende der Kursliste standen. Eine mögliche Geldpolitikänderung der US-Notenbank und die Frage der Rentabilität von Investitionen in Künstliche Intelligenz (KI) stehen im Fokus der Anleger. Kursgewinne und Zinssenkungsspekulationen Zum Beginn des Handelstages am Montag verzeichnete die Börse in Frankfurt zunächst Kursgewinne. Gegen 9:30 Uhr wurde der Dax mit rund 18.490 Punkten berechnet, was einem Plus von 0,4 Prozent im Vergleich zum Handelsschluss am Freitag entspricht. An der Spitze der Kursliste rangierten Merck, Zalando und Siemens Healthineers, am Ende standen Beiersdorf, Henkel und BASF. Zinswende und Markterwartungen “Die Anleger erhalten in dieser Woche genau die Informationen über die Themen, die sie in den vergangenen Wochen am meisten umtrieben: Die Geldpolitik und die Profitabilität der Investitionen in Künstliche Intelligenz”, kommentierte Jochen Stanzl, Chef-Marktanalyst von CMC Markets. Er erwartet konkrete vorbereitende Schritte der US-Notenbank in Richtung Zinssenkung für September. “Alles andere wäre eine große Überraschung.” Technologieaktien und Künstliche Intelligenz Nach der starken Korrektur bei Technologieaktien widmen die Anleger verstärkt Aufmerksamkeit der Rentabilität von Investitionen in Künstliche Intelligenz. Laut Stanzl könnte sich dies auch auf die Bilanzpressekonferenz von Microsoft auswirken, die mit Open AI zusammenarbeitet. Auch Meta, das einen Open-Source-Ansatz bei der Entwicklung einer eigenen Künstlichen Intelligenz gewählt hat, müsse zeigen, wie Unternehmen KI monetarisieren können, sodass eine höhere Gewinnmarge für die Anleger übrig bleibt. Entwicklung der Devisen- und Ölpreise Die europäische Gemeinschaftswährung war am Montagmorgen etwas schwächer: Ein Euro kostete 1,0850 US-Dollar, ein Dollar war dementsprechend für 0,9217 Euro zu haben. Der Ölpreis stieg leicht: Ein Fass der Nordsee-Sorte Brent kostete gegen 9 Uhr deutscher Zeit 81,22 US-Dollar, das waren 9 Cent oder 0,1 Prozent mehr als am Schluss des vorherigen Handelstags."
0c7133d1-f220-458c-b117-abe4ddc51b45,2024-07-29 14:52:00+00:00,"Siemens Healthineers Exklusive Einblicke: So arbeitet die neue Mega-Fabrik von Stephan Großmann Fränkischer Tag TEILEN&nbsp Forchheim – In Forchheim entsteht das modernste Medizintechnik-Werk von Siemens Healthineers. Ein exklusiver Rundgang zeigt, wie der Weltkonzern Produktion und Digitalisierung am Main-Donau-Kanal vereinen will. Lässt sich Zukunft anfassen? Manchmal ja, meistens nein. Aber sichtbar machen, das lässt sie sich schon. Zumindest, was die Zukunft der Medizintechnik betrifft, hat der Standort Forchheim fortan ein immer stärkeres Wörtchen mitzureden. Von außen wirkt der Neubau an der Lände im Forchheimer Süden zwar monumental groß, aber noch nicht sehr futuristisch. Doch innerhalb der weiß-grau-gläsernen Fassade des neuen High-Energy Photonic (HEP) Centers von Siemens Healthineers hat das Morgen bereits begonnen."
a9f402db-597e-458e-aba4-4c5c1a359158,2024-07-29 14:56:47+00:00,"Nach der Affäre um Beatmungsgeräte zeichnet sich 2024 für Philips als Jahr der Wende ab. Im zweiten Quartal steigerte der niederländische Medizintechnikkonzern den Auftragseingang um 9 Prozent gegenüber der Vergleichsperiode des Vorjahres – es war das erste Mal seit zwei Jahren, dass das Orderbuch im Quartal wieder wuchs. Die Aktie des Konkurrenten von Siemens Healthineers verteuerte sich am Montag um elf Prozent."
