2209b500-177b-4fd5-b964-3360c920463b,2023-08-21 06:39:19+00:00,"Christian Baier Covestro holt neuen Finanzchef von Metro Der Finanzchef von Metro, Christian Baier, wechselt zum Kunststoffkonzern Covestro. Dort wird er Nachfolger von Thomas Toepfer, der zu Airbus geht. Übergangsweise übernimmt Covestro-Chef Markus Steilemann das Finanzressort. 21.08.2023, 10.26 Uhr Nach monatelanger Suche hat der Kunststoffkonzern Covestro einen Nachfolger für Finanzchef Thomas Toepfer (51) präsentiert. Christian Baier (46), der die Finanzen des Großhändlers Metro leitet, werde ab dem 1. Oktober 2023 Finanzchef von Covestro, teilte der Dax-Konzern am Montag mit. Bereits Mitte Februar war bekannt geworden, dass Toepfer den Konzern Ende August vorzeitig verlassen und in gleicher Position zum Flugzeugbauer Airbus wechseln wird. Im September wird Covestro-Chef Markus Steilemann (53) übergangsweise auch das Finanzressort führen. Der 46-jährige Baier hatte den Angaben zufolge seit 2011 verschiedene Führungspositionen bei der Metro inne und ist seit 2016 Mitglied des Vorstandes des Unternehmens. Mitte Juni hatte er dort seinen Abschied angekündigt, um ""etwas Neues anzupacken"", wie er damals sagte. Vor seiner Zeit bei Metro war der gebürtige Freiburger unter anderem von 2006 bis 2011 beim Finanzinvestor Permira tätig. Adnoc will Covestro übernehmen Baier tritt bei Covestro in einer aufregenden Zeit an: Um den Leverkusener Dax-Konzern schwirren seit Wochen Spekulationen über eine Übernahme durch den Ölriesen Adnoc aus Abu Dhabi. Eine Übernahme würde dem Ölkonzern, der auch Raffinerieprodukte und petrochemische Erzeugnisse herstellt, Zugang zu fortschrittlicheren Materialien verschaffen, die in Elektrofahrzeugen, Wärmedämmung für Gebäude sowie Beschichtungen, Klebstoffen und technischen Kunststoffen zum Einsatz kommen. Laut Insidern ist Adnoc bereit, 60 Euro je Aktie – insgesamt 11,6 Milliarden Euro – für Covestro zu zahlen. Covestro hat die Avancen von Adnoc oder ein konkretes Angebot bisher aber nicht bestätigt. Aufsichtsratschef Richard Pott (72) betonte Baiers ""langjährige Erfahrung im Kapitalmarkt"". Toepfers Aufgaben als Arbeitsdirektor von Covestro übernimmt Technologievorstand Thorsten Dreier (51). dri/dpa, Reuters"
e404dd31-5bb9-4b66-b294-5d62a1363aac,2023-08-21 06:41:07+00:00,"Es war eine der größten Pleiten in der britischen Luftfahrtgeschichte. Am 2. Oktober 2017 stellte Monarch Airlines ihre Flüge ein, die 36 Flugzeuge der damals fünftgrößten Fluggesellschaft des Landes blieben am Boden. 110.000 Reisende wussten nicht mehr, wie sie nach Hause können würden. Mit Monarch verschwand eine traditionsreiche Fluggesellschaft. Gegründet worden war sie 1967 von der Schweizer Familie Mantegazza. Die schweigsamen Milliardäre aus dem Kanton Tessin ergänzten mit der Fluglinie das Angebot ihres Reiseveranstalters Globus Travel Services. Nach langen Jahren des Erfolgs schlitterte die britische Fluglinie mit einer Flotte von Airbus A320 und A321 ab dem Jahr 2010 auch wegen der Konkurrenz durch Billigairlines zunehmend in die Krise. Schweizer Gründer stiegen aus, neue Eigner hatten keinen Erfolg Immer wieder mussten die Mantegazzas Monarch mit Geldspritzen helfen. Die Schweizer verkauften später ihren Anteil von 90 Prozent an der britischen Fluglinie an den Finanzinvestor Greybull Capital. Doch auch dessen neue Strategie, die unter anderem den Wechsel auf Boeing 737 Max beinhaltete, brachte nicht den erhofften Erfolg. Sechs Jahre nach dem Ende sieht es nun aber danach aus, dass Monarch wiedergeboren werden könnte, wie zuerst UK Aviation News berichtete. Im Januar wurde ein neues Unternehmen mit dem Namen im Handelsregister eingetragen. Und am Samstag (19. August) gab dieses bekannt: «Monarch Airlines und Monarch Holidays wurden gestern nach dem Ausstieg des Gründers und bisherigen Mehrheitsaktionärs der Unternehmen in neue Hände übergeben. Weitere Informationen werden in Kürze veröffentlicht». Wieder ein Ferienflieger Und auf Sozialen Medien und seiner Internetseite teilte das Unternehmen weiter mit: «Wir arbeiten hart daran, eine brandneuen Monarch zu bauen, nur für Sie.» Viel mehr ist aber nicht über die Pläne bekannt. Aufgrund der Gründung einer Airline und eines Reiseveranstalters scheint sich Monarch 2.0 als Ferienflieger positionieren zu wollen. Als Aufsichtsratspräsident der neuen Monarch amtiert Daniel Ellingham. Gemäß eigenen Angaben holte er sich einen MBA-Abschluss an der Luftfahrtuniversität Cranfield und beriet früher unter anderem Austrian Airlines und Swissair."
bc27b12c-92a4-47dc-8c18-d43d9e2774c0,2023-08-21 11:10:00+00:00,Das Rütli bekommt einen eigenen Airbus travelnews.ch
9e3d4110-0571-4fd9-9a3f-67c35bf5e311,2023-08-22 15:08:06+00:00,"Die Form von Passagierflugzeugen ist seit den späten 1950er-Jahren stets fast die gleiche geblieben – das will ein amerikanisches Unternehmen jetzt ändern. Dahinter steckt das Unternehmen Jet Zero – mit dem ambitionierten Ziel, das Reisen der Zukunft ab 2030 mit einem neuen Flugzeugdesign zu revolutionieren. Was ist dir an einem Passagierflugzeug am wichtigsten – mal abgesehen von der Sicherheit? Da ich ein Aviatik-Fan bin, achte ich sehr darauf, mit welchem Flugzeugtyp ich fliege.Mir ist es wichtig, dass ich komfortabel reise.Ganz klar: die Airline und die Crew.Solange ich von A nach B komme, ist mir alles andere egal.Ich fliege nie. Auch wenn die Flugzeughersteller Airbus und Boeing bereits mit der gleichen Idee experimentieren, hat sich noch niemand an die konkrete Umsetzung gewagt. Dennoch zwingen die hohen CO2-Emissionen die Aviatikbranche dazu, umzudenken und nach neuen Lösungen zu suchen. Genau hier setzt Jet Zero an und plant ein Flugzeug nach dem «Blended-Wing-Body-Prinzip». Zu diesem Zweck arbeitet das Unternehmen mit der US Air Force, der NASA und der FAA zusammen. Wie Jet Zero auf seiner Website schreibt, ist der Blended Wing ein natürlich stabiles Design, welcher keine Leitwerke benötigt. Der kürzere und breitere Rumpf des Flugzeugs selbst dient als Tragfläche und sorgt für Auftrieb. Durch die Reduzierung der benötigten Fläche ermöglicht das Design ein leichteres Flugzeug mit weniger Luftwiderstand. Dieses Konzept ist allerdings nicht ganz neu – die Flugzeugform ähnelt dem «Flying-Wing-Design», das von Militärflugzeugen wie dem B-2-Tarnkappenbomber verwendet wird. Wie Tom O’Leary, Mitgründer und CEO von Jet Zero, gegenüber CNN sagt, solle der Blended-Wing-Rumpf den Treibstoffverbrauch und die Emissionen um 50 Prozent senken. «Das ist im Vergleich innerhalb der Aviatik-Branche ein erstaunlicher Fortschritt.» US Air Force investiert 235 Millionen US-Dollar Durch die radikal neue Form würde sich auch das Innere des Flugzeugs verändern. Der breitere Rumpf kann zwar die gleiche Anzahl Passagiere befördern, die Sitzreihengestaltung sieht dementsprechend jedoch anders aus – je nachdem wie die einzelnen Fluggesellschaften sie konfigurieren. Obwohl die grossen Fluggesellschaften am neuen Design und der damit verbundenen Effizienzsteigerung interessiert sind, sind bei Jet Zero noch keine Bestellungen eingegangen. Dennoch will das US-Unternehmen neben einem Passagier- und Frachtflugzeug auch ein Tankflugzeug entwickeln. Für dieses eignet sich die Blended-Wing-Form dermassen gut, dass die US Air Force Jet Zero 235 Millionen US-Dollar zugesprochen hat, um einen Prototyp in Originalgrösse zu entwickeln und das Design zu validieren. Der Erstflug wird bis 2027 erwartet und soll wegweisend für die Entwicklung der kommerziellen Modelle sein."
f1da6c0c-c5a6-43b2-ac9a-2de0cae221e5,2023-08-23 16:36:27+00:00,"South African Airways (SAA), die nationale Fluggesellschaft Südafrikas, hat kürzlich ihre Rückkehr nach Brasilien mit Direktflügen von São Paulo nach Kapstadt und Johannesburg angekündigt und den Betrieb am 31. Oktober bzw. 6. November aufgenommen. Jede Strecke wird zweimal pro Woche bedient. Das Unternehmen hat gerade eine Änderung des Flugzeugs, das beide Strecken fliegen wird, in die Reservierungssysteme hochgeladen. Anstelle der zunächst angekündigten A340-300 wird künftig der Airbus A330-300 mit 46 Sitzplätzen in der Business Class und 203 Sitzen in der Economy für den Betrieb der Strecke zuständig sein. Die neu gestaltete Business Class des neuen A330-300-Flugzeugs von SAA bietet ein neues Schlafsitzdesign, das im voll ausgefahrenen Zustand fast 2 Meter lang ist. Jeder Sitzplatz verfügt über einen individuellen Gangzugang und noch mehr Stauraum. Die Passagiere werden an Bord mit einem erfrischenden Getränk und einem speziellen Set mit Reiseutensilien und Premium-Kosmetik begrüßt. Das ausgezeichnete À-la-carte-Menü umfasst eine Tafel mit den besten südafrikanischen Käsesorten und von Experten ausgewählten Weinen. Jeder Sitz verfügt über eine eigene Steckdose und lässt sich um 180 Grad neigen. Er ist aus feinsten Stoffen und Leder gefertigt. Für noch mehr Komfort sorgen die extragroßen Kissen und der gepolsterte Sitzbezug. Kopfhörer mit Geräuschunterdrückung helfen, Kabinengeräusche zu unterdrücken und Filme im Bordunterhaltungsservice anzusehen. Die Economy Class im A330-300 von SAA ist mit Sitzen ausgestattet schlank neu gestaltet, komfortabler und mit mehr Platz zwischen den Sitzen und für die Beine. Jeder Sitz ist mit einem 10-Zoll-Videobildschirm, USB-Anschlüssen und Steckdosen ausgestattet. Das Bordunterhaltungssystem ist auf dem neuesten Stand der Technik und verfügt über einfach zu bedienende Touchscreens, die viele Stunden Unterhaltung gewährleisten. Kunden erhalten ein Amenity-Set mit Socken, Schlafmaske, Zahnbürste und Zahnpasta. Es ist möglich, vor dem Flug spezielle Mahlzeiten und ein Kinderbett anzufordern. Auch für Kinder steht im Bordunterhaltungssystem ein Aktivitätspaket zur Verfügung. Für Reisende mit Rollstuhl oder Kleinkindern besteht die Möglichkeit, das größere Badezimmer im mittleren Teil der Kabine zu nutzen, das doppelt so groß ist und mit einem Wickeltisch ausgestattet ist. Von Oktober bis Dezember 2023 startet Flug SA 0226 um 12:55 Uhr in Kapstadt und landet um 16:35 Uhr in São Paulo. Der Rückflug, SA 0227, startet um 18:05 Uhr in São Paulo und landet um 06:40 Uhr in Kapstadt. Von Johannesburg aus startet der Flug SA 0222 um 11:20 Uhr und kommt um 16:15 Uhr in São Paulo an. Er kehrt als SA 0223 zurück, verlässt São Paulo um 17:45 Uhr und kommt um 07:45 Uhr in Johannesburg an. Lesen Sie auch: Embraer E195-E2 erhält Musterzulassung in China Günstig reisen: Flybondis Tipps für das Fliegen mit den günstigsten Tarifen LATAM schult rund 100 Partner-Reisebüros in Porto Alegre"
76f75084-d5f2-45f4-acd7-bb877a5983b2,2023-08-24 03:24:02+00:00,"Die 24 Langstreckenjets sind im Schnitt 17 Jahre alt. Deshalb gab Qantas im Mai bekannt, ihre Airbus A330 zu ersetzen. Sie kündigte für die zweite Hälfte dieses Jahres eine Ausschreibung an. Erwartet wurde, dass Airbus den A330 Neo ins Rennen schickt, Boeing die 787, von welcher die australische Fluggesellschaft selbst bereits 14 Exemplare betreibt. Ihre Schwester Jetstar besitzt elf Exemplare. Jetzt ist klar: Boeing kommt zu Zug. Bisher setzt Qantas die mittlere Dreamliner-Variante 787-9 ein, ihre Schwester Jetstar betreibt die kleinste Variante 787-8. Die neue Bestellung umfasst weitere vier Boeing 787-9, aber auch acht Exemplare der größeren Variante, 787-10. Ersatz für Airbus A380 und Airbus A330"
088e7ebc-0bae-44da-ab21-5bebf47b1e87,2023-08-24 10:56:37+00:00,"Die turbulente Geschichte um Boeings einstigen Katastrophenflieger 737 Max bekommt ein weiteres Kapitel. Der Airbus-Rivale hat festgestellt, dass sein größter Zulieferer Löcher falsch in ein Bauteil gebohrt hat, das für die Aufrechterhaltung des Kabinendrucks des Flugzeuges mit verantwortlich ist. Nun droht Boeing, die Lieferziele für sein mittlerweile meistverkauftes Modell zu verfehlen. ""Bei Werksinspektionen haben wir im hinteren Druckschott bestimmter 737-Flugzeuge Befestigungslöcher festgestellt, die nicht unseren Spezifikationen entsprachen"", erklärte Boeing in der Nacht zu Donnerstag laut einem Bloomberg-Bericht mit. Die Inspektionen hätten Hunderte von falsch ausgerichteten und doppelten Löchern in einigen Flugzeugen aufgedeckt. Die US-Bundesluftfahrtbehörde erklärte, das jüngste Problem stelle kein Sicherheitsrisiko dar, gleichwohl rutschten Boeing-Aktien vorbörslich fast 2 Prozent ab. Boeing wollte Produktion eigentlich beschleunigen Die neuen Komplikationen erreichen Boeing zur Unzeit. Denn der Konzern will die Produktion angesichts der erhöhten Nachfrage eigentlich beschleunigen und ringt parallel mit den Folgen eines Streiks des wichtigen Zulieferers Spirit AeroSystems. Die Firma stellt 70 Prozent der Rahmen für die Schmalrumpfjets her. Zuletzt im April hatte Boeing ein Problem offengelegt, bei dem Spirit die Halterungen, die den hinteren Rumpf mit dem Seitenleitwerk verbinden, nicht ordnungsgemäß installiert hatte. Boeing erklärte nun, der jüngste Defekt werde kurzfristige Auslieferungen verzögern. Zugleich prüfe der Flugzeughersteller, ob er sein jährliches Auslieferungsziel von mindestens 400 Jets des Typs 737 in diesem Jahr womöglich verfehle werde. Denn es sei unklar, wie viele Jets repariert werden müssten und wie lange die Überarbeitung dauern werde. Maschinen des Typs 737, die nicht betroffen seien, liefere Boeing weiter aus. Nach Abstürzen von 737-Max-Maschinen in Indonesien und Äthiopien in den Jahren 2018 und 2019 mit Hunderten Toten hatte Boeings Ruf massiv gelitten. Zugleich verlor der Konzern viel Geld. Aufsichtsbehörden hatten den Jet weltweit mit einem Flugverbot belegt. Fast zwei Jahre lange war Boeing Ziel von Untersuchungen, in deren Folge die Sicherheitskultur des Unternehmens scharf anprangert wurde. Das führte zu erheblichen Umsatzeinbußen und Strafen in Milliardenhöhe. Nachdem Boeing die Softwareprobleme beseitigt hatte und Piloten neu geschult hatte, wurde Ende 2020 das Flugverbot für das Modell in den USA aufgehoben. Andere Länder folgten später damit."
37a39568-b966-4693-89df-c046b295fc7f,2023-08-24 18:28:01+00:00,"Am selben Tag, an dem die australische Fluggesellschaft Qantas ihre Gewinne bekannt gibt, nutzt sie die Gelegenheit auch, um anzugeben, welche neuen Investitionen getätigt werden. Die Antwort war direkt: Es handelt sich um das neue Flugzeug, für das das Unternehmen offiziell eine neue Bestellung für den Airbus A350 und auch für die Boeing 787 bekannt gegeben hat. Die neuen Flugzeuge werden die derzeitige Flotte von Airbus A330 und A380 ersetzen, die bis 2032 vollständig aus dem Betrieb genommen werden soll. Der brandneue A350-1000 wird das Tor für den Großraumflugzeug in der Qantas-Flotte sein, die bereits die Boeing 787-9 betreibt 2017. Auch bei mittelgroßen Flugzeugen findet eine Flottenerneuerung statt, wo Qantas künftig neue Airbus A220 und A320neo erhalten wird. Die Auslieferung der neuen A350 und 787 aus diesem Auftrag soll zwischen 2026 und 2027 beginnen. Derzeit betreibt Qantas eine Flotte von 125 Flugzeugen, darunter 26 A330, 10 A380, 75 737-800 und 14 787-9. Offenbar sollte das australische Unternehmen angesichts der Bestellung des A737neo die 320 MAX nicht in seine Flotte aufnehmen. „Zusätzlich zu den 149 Firmenflugzeugen, die wir noch im Auftrag haben, werden wir die Inlandsflotte von Qantas und Jetstar sowie die Direktflüge von Project Sunrise nach London und New York weiter erneuern.“ Das Flugzeug wird im Laufe eines Jahrzehnts oder länger eintreffen und 20 Jahre lang Teil der Flotte sein. Sie werden neue Routen und bessere Reiseerlebnisse für Kunden sowie neue Arbeitsplätze und Beförderungen für unsere Mitarbeiter eröffnen.“. sagte Alan Joyce, CEO von Qantas. Qantas wird den Airbus A330 noch einige Jahre im Einsatz haben, da er auf mehreren stark nachgefragten nationalen und internationalen Strecken nach Asien und in die USA eingesetzt wird. Das Unternehmen kündigte an, die Passagierkabine in Kürze zu modernisieren, damit der Komfort für die Passagiere mit der Zeit nicht abnimmt. Siehe auch: Aufgrund der hohen Nachfrage wird Boeing eine neue Umrüstlinie für die 737-800 eröffnen Embraer-Jet erleidet in Russland schweren Unfall; Unter den Opfern ist auch der Anführer der Wagner-Gruppe Infraero wird zehn Flughäfen in Ceará betreiben"
05e6dec4-9e33-47f5-916f-0b67e8f08d8c,2023-08-25 09:49:18+00:00,"Fabia Söllner Thailand , 25.08.2023 - 11:49 Thai Airways hat angekündigt, seine gesamte Airbus A380 Flotte zu verkaufen. Sechs Airbusse können also erworben werden. Das Wichtigste in Kürze Thai Airways bietet seine gesamte A380-Flotte zum Verkauf an. Damit reagiert das Unternehmen auf die vergangenen, schweren Jahre. Thai Airways steht nach der Pandemie vor einem Wendepunkt. Das Unternehmen bietet seine gesamte Flotte von sechs Airbus A380 zum Verkauf an. Die Nationalairline Thailands hatte in der Krise bereits 34 Flugzeuge aus ihrem Bestand zum Verkauf angeboten. Darunter Boeing 747, 777, Airbus A300, A340 und Boeing 737. Die A380 blieben zunächst unberührt, berichtet «Aerotelegraph». Doch nun hat Thai Airways potenzielle Käufer aufgerufen, bis zum 12. September Gebote für die Superjumbos einzureichen. Eine Anzahlung von 50'000 US-Dollar ist Pflicht. Bieter aus sanktionierten Ländern sind ausgeschlossen. So dürfen Russland und der Iran also nicht an der Veräusserung teilnehmen. Die Flugzeuge werden im aktuellen Zustand verkauft und müssen in Bangkok abgeholt werden."
6ac93646-c788-49e6-b73f-e40a89ed4856,2023-08-25 17:20:00+00:00,"Niedersachsen und Mecklenburg-Vorpommern kaufen gemeinsam vier neue Polizeihubschrauber des Modells Airbus H145 – je zwei für jedes Bundesland. Der Zuschlag für die länderübergreifende Kooperation wurde an das Unternehmen Airbus Helicopters Deutschland erteilt. „Die gemeinsame Beschaffung erspart uns, so wie wir es erhofft hatten, viel Geld. Wir können unsere beiden Fluggeräte zusammen jetzt für knapp 40 Millionen Euro erwerben und sparen damit fast 20 Prozent gemessen an den erwarteten Kosten bei einer Einzelbeschaffung mit Listenpreisen. Darin eingeschlossen sind die Kosten für die Aus- und Weiterbildung unserer Piloten sowie die Zusatzausstattung“, sagt Mecklenburgs-Innenminister Christian Pegel. Seine niedersächsische Amtskollegin, die Ministerin für Inneres und Sport Daniela Behrens, sagt: „Unsere Polizei leistet tagtäglich hochprofessionelle Arbeit. Sie benötigt dafür die bestmögliche Ausrüstung und Einsatzmittel. Das gilt auf dem Land, auf dem Wasser und in der Luft. Um auch weiterhin die Rund-um-die-Uhr-Verfügbarkeit unserer Polizeihubschrauberstaffel zu gewährleisten, beschaffen wir gemeinsam mit Mecklenburg-Vorpommern die neuen Hubschrauber. Unsere länderübergreifende Kooperation spart Geld, Aufwand, Zeit bei der Beschaffung und sorgt gleichzeitig für wichtige Synergieeffekte bei der späteren Wartung und Instandhaltung sowie bei der Ausbildung der Pilotinnen und Piloten.“ Im August vor einem Jahr hat das das Logistikzentrum Niedersachsen den Auftrag für beide Bundesländer gemeinsam ausgeschrieben (siehe unsere Pressemitteilung Nr. 146/2022). Die neuen Hubschrauber der Vier-Tonnen-Klasse werden speziell für den Einsatz bei der Polizei konzipiert. Sie bieten eine Reihe von technologischen Fortschritten und Funktionen, die die Einsatzmöglichkeiten der Polizei erheblich erweitern: „Dank der größeren Kabine und der größeren Reichweite können wir mit den neuen Hubschraubern auch Gruppen von zum Beispiel Spezialkräften transportieren oder mehrere Personen über die Rettungswinde aufnehmen. Es sind die technischen Vorrüstungen für eine Handyortung an Board. Und für unsere Polizei in einem Küstenland ist es natürlich von großem Vorteil, dass die neuen H145 auch voll seeflugfähig sind“, sagt Christian Pegel. Weiter führt er aus: „Die Hubschrauber können zudem durch zusätzlich montierbare Behältnisse Wasser- oder Löschmittel transportieren und so die Feuerwehr aus der Luft unterstützen. Das hilft vor allem bei Bränden in schwer zugänglichen oder abgelegenen Gebieten, wo herkömmliche Methoden möglicherweise eingeschränkt sind. So sollen sie insbesondere bei Waldbränden unterstützen, wie sie auch bei uns im Land in den zurückliegenden Jahren immer häufiger und stärker zu verzeichnen sind.“ Ausgeliefert werden sollen die vier Hubschrauber ab 2025. „Wir erhalten unsere beiden Geräte voraussichtlich Ende 2025 und im Herbst des darauffolgenden Jahres“, so Christian Pegel. Beide Minister sind überzeugt: „Diese Investition wird dazu beitragen, die Sicherheit der Bürgerinnen und Bürger in unseren Ländern zu erhöhen. Die gemeinsame Anschaffung der Airbus H145 Polizeihubschrauber markiert einen wichtigen Schritt auf dem Weg zu einer noch effektiveren Polizeiarbeit und einer besseren Bewältigung von Herausforderungen im Bereich der inneren Sicherheit.“ Zugleich danken sie den Projektgruppen der Polizei beider Länder, die die gemeinsame Beschaffung möglich gemacht haben. Technische Daten Abmessungen: Länge: knapp 14 Meter; Rotordurchmesser: ca. 11 Meter; Höhe: ca. 4 Meter Leergewicht: ca. 1.950 Kilogramm (abhängig von der Konfiguration) Maximales Startgewicht: ca. 3800 kg Reisegeschwindigkeit: ca. 135 Knoten (ca. 250 km/h) Höchstgeschwindigkeit: ca. 150 Knoten (ca. 280 km/h) Reichweite: ca. 335 nautische Meilen (ca. 620 km) Flugdauer: abhängig von verschiedenen Faktoren, in der Regel bis zu ca. 3 Stunden (mit Standard-Tanks) Antrieb: zwei Turbinentriebwerke Besatzung: je nach Konfiguration und Einsatzrolle, typischerweise ein Pilot, ein Co-Pilot, ein Operator Passagierkapazität : je nach Konfiguration und Bestuhlung, in der Regel zwischen fünf bis acht Passagiere. (c) IM Mecklenburg-Vorpommern, 25.08.2023"
8ead0a2d-2e82-46ba-95e1-1c6064d18392,2023-08-26 04:46:04+00:00,"Airlines bieten gegen Aufpreis alles mögliche an, neben mehr Beinfreiheit oder einem freien Nachbarsitz kann man bald bei Corendon in einer Zone nur Erwachsene Platz nehmen. Die türkische Gesellschaft will das neue Angebot ab November testen und lässt sich die Sitze im vorderen Teil des Flugzeugs bezahlen. Geplant ist es, die Adults only-Sitze auf einem gemieteten Airbus A350-900 anzubieten, damit will man im Winter zwischen Amsterdam und Curaçao fliegen. Corendon beauftragt das Unternehmen World2Fly für das Wetleasing, in deren Jet dürfen im vorderen Bereich dann nur Passagiere ab 16 Jahren sitzen. Ein Preis wurde auch schon genannt, 45 Euro werden pro Strecke und Passagier für die Reservierung in der Erwachsenenzone fällig. Die erste Reihe der Sektion besteht zudem aus XL-Sitzen, um hier zu fliegen werden 100 Euro pro Flug fällig. In dem vorderen Bereich werden 102 Plätze ausschließlich für Erwachsene vorgesehen, welche von der restlichen Kabine abgetrennt sind. Laut aeroTELEGRAPH werden in der Maschine insgesamt 432 Passagiere transportiert werden können. Word2Fly kommt aus Spanien und betreibt aktuell drei Airbus A350-900, bald soll ein A330 die kleine Flotte des Carrier verstärken. Mit Flügen in die Karibik kennt man sich aus, im Streckennetz sind bereits Ziele in Kuba und der Dominikanischen Republik. Gegen Aufpreis: Kinderfreie „Adults Class“ ab Herbst | Frankfurtflyer Kommentar Corendon erhofft sich nach eigenen Angaben weniger Konflikte an Bord, doch hier geht es in erster Linie um Zusatzerlöse. Ohne weiteres Servicematerial oder großen Aufwand können so bis zu 102 Sitze jeweils 45 bis 100 Euro abwerfen. Die Idee ist nicht neu, in Asien wurde der Gedanke in der Vergangenheit schon bei mehreren Airlines umgesetzt. Ob Erwachsenenzone, Adults only oder Ruhebereich- bisher hat sich das Konzept nicht wirklich durchgesetzt. Vielleicht klappt es bei Corendon, wobei die Idee nicht nur Fans haben wird. Mit den Diskussionen werden sich die Mitarbeiter der Abfertiger am Check-In und die Flugbegleiter an Bord begnügen."
