642e4c07-0561-46a3-835a-b80721afdf88,2023-09-13 17:09:59,"Schüler aus ganz Deutschland schreiben Artikel über Wirtschaftsthemen, von denen die besten im Wirtschaftsteil der Zeitung veröffentlicht werden: Das geschieht im Schulprojekt „Jugend und Wirtschaft“, das die F.A.Z. gemeinsam mit dem Bundesverband deutscher Banken veranstaltet hat."
73f2e25b-a2d1-454b-9c79-df7a98e222e7,2023-09-14 04:00:00,"Entsprechend gibt es seit vielen Jahren eine eigene Entwicklungsabteilung, die nicht nur an aktuellen Helikoptermodellen arbeitet, sondern auch weiter in die Zukunft denkt. Schlagworte sind hier das sogenannte Flugtaxi „CityAirbus NextGen“ und der „Racer“, eine Mischung aus Helicopter und Flugzeug, das zusätzlich zum Rotorblatt auch über Tragflächen verfügt. 2025 will das Unternehmen bereits die Zulassung für den CityAirbus beantragen. Passend dazu wurde vor rund einem Jahr – im Juli 2022 – der Bau eines neuen Testzentrums für das Flugtaxi in Auftrag gegeben und damit noch einmal die tragende Rolle des Standorts in der Zukunftsvision des Unternehmens unterstrichen. Und auch sonst ist der Fokus des Unternehmens aktuell voll auf Zukunft gerichtet. Über 7 000 Menschen, zahlreiche hochleistungsfähige Computer, Maschinen, Heizungen und Leuchten – das Airbus-Werk in Donauwörth hat aktuell einen unfassbar hohen Energiebedarf. In Zeiten der Energiewende steht deshalb die Frage nach alternativen Versorgungslösungen und Einsparmöglichkeiten im Raum. Außerdem verpflichtete sich der Konzern bereits 2015 dazu, bis 2030 den Energieverbrauch um 20 Prozent und zusätzlich den Kohlenstoffdioxidausstoß um 63 Prozent zu verringern. Für den Standort in Donauwörth eine große Herausforderung, die durch verschiedene Maßnahmen umgesetzt werden soll. Angefangen bei den Mitarbeiter*innen, die zur Bildung von Fahrgemeinschaften oder der Nutzung der Bahn angeregt werden sollen, über die Erneuerung von Maschinen, bis hin zur Installation von LED-Beleuchtung. In diesem Zuge seien bisher rund 5 000 Glühbirnen ausgetauscht worden, so Guido Lumpe, Hauptverantwortlicher für das Energiemanagement am Standort in Donauwörth und teilte außerdem mit, dass man mittlerweile bereits 50 Prozent der Einsparziele erreicht habe. Einen noch größeren Einfluss auf die Energieversorgung soll sich aus der neuen Zusammenarbeit mit dem Unternehmen GP Joule, ansässig in Buttenwiesen, und aus der Installation von PV-Anlagen ergeben. Auf den Dächern der Fabrikhallen gingen die ersten drei großen Photovoltaikanlagen in Betrieb. Sie wurden auf Gebäuden errichtet, die eine solche Installation baurechtlich und statisch erlauben. Insgesamt wurden 2 759 Module verbaut. Sie sind in Ost-West-Richtung ausgerichtet. Damit lässt sich der Firma zufolge über den Tagesverlauf besonders viel Strom erzeugen. Jährlich sollen die PV-Anlagen auf den Airbus-Dächern eine Million Kilowattstunden Strom liefern. Dies entspricht etwa zwei Prozent des Jahresverbrauchs am Standort. Ein weiterer Solarpark auf dem Gelände des Parkplatzes sei aktuell nicht ausgeschlossen. „Eine Doppelnutzung wäre fantastisch“, so Lumpe. Außerdem bezieht Airbus seit Anfang 2023 alternativen Strom von einem Solarpark nahe Rettingen, der von der Firma GP Joule betrieben wird. Dort sollen jährlich mehr als 3,8 Millionen Kilowattstunden produziert werden. Innovation und ambitionierte Energie-Einsparziele, laut Forschungsleiter Johannes Plaum ein Themenfeld, das in den vergangenen Jahren immer mehr in den Fokus gerückt ist. Will heißen: Airbus erprobt aktuell bereits an einem Hubschrauber-Demonstrator, wie Treibstoff eingespart werden kann und das durchaus mit Erfolg. Demnach sei es durch einen Elektromotor, verbesserter Aerodynamik und weniger Bauteilen gelungen, den Spritverbrauch zu halbieren. Die aktuelle Situation zeigt: Airbus Helicopters versucht auch am Standort Donauwörth vieles, um sich für die Zukunft zu wappnen. Passend dazu erklärt Standortleiter Helmut Färber: „Wir sehen uns mittlerweile als Pioniere der nachhaltigen Luftfahrt.“ Ob dies im vorgegebenen Zeitplan des Unternehmens gelingt, werden die kommenden Jahre zeigen. Ein erster Schritt scheint zumindest bereits jetzt gemacht."
ea7152c7-fec9-4d06-bba1-ebc9394b04e8,2023-09-14 04:27:42,"Der A321 Neo mit Extra-Extra-Reichweite ist gerade ziemlich beschäftigt. Am Mittwochabend (13. September) um 21 Uhr verließ er das Werksgelände von Airbus und rollte auf Piste 32 L des Aéroport Toulouse-Blagnac. Nach dem Start nahm der A321 XLR Kurs Richtung Nordpol. Die Testmaschine mit dem Kennzeichen F-WWAB und der Seriennummer 11080 wird in den nächsten zehn Tagen das sogenannte Route Proving absolvieren, das auch Functional and Reliability Testing genannt wird. Damit will Airbus nachweisen, dass der A321 XLR bereit für die Zulassung, Serienfertigung und den Einsatz bei Fluggesellschaften ist. Rund 100 Stunden in der Luft Die Testmaschine wird auf ihrer Reise rund 15 Flüge hinter sich bringen und 100 Stunden in der Luft sein. Zuerst wird sie innerhalb von Europa unterwegs sein und gleich zu Beginn reiste er bis zur Nordspitze von Grönland und zurück. «Wir wollen also mal in die Warme, mal in die Kälte und zu unterschiedlichen Flugplätzen, was Infrastruktur, Lage, Wetter und Startbahnhöhen angeht», kommentiert Airbus’ Projektleiter Jim Fawcett. So werde die Testkampagne viel repräsentativer. Bestimmte der geplanten Strecken seien typisch für solche, wie sie Fluggesellschaften im realen Betrieb fliegen würden, so Airbus. Unter anderem wird der A321 XLR in der zweiten Hälfte der zehntägigen Testkampagne zwischen Europa und einem Flughafen in den USA hin- und herfliegen. Das Flugzeugmodell hat dank zusätzlicher Tanks eine Reichweite von bis zu 8700 Kilometer. Beladung mit Essen oder Abfallentsorgung In der ganzen Zeit werden die Fachleute von Airbus in Toulouse den Flieger beobachten. Sie seien in der Lage, anstehende Wartungsprobleme zu erkennen, da der Jet Daten direkt zu ihnen schickt, so der Flugzeugbauer. Doch nicht nur die Angestellten von der technischen Seite sind wichtig. Von entscheidender Bedeutung wird in den zehn Tagen auch sein, was am Boden passiert. An den angesteuerten Flughäfen wird Bodenpersonal mit dem A321 XLR so umgehen, wie wenn es ein ganz normaler Flug wäre. Partner werden Tankwagen, Catering-Laster oder Wasser- und Abfallentsorgungswagen zum Flieger schicken, damit getestet werden kann, wie sich der A321 XLR im Alltagsbetrieb bewährt. Kabinenpersonal und Gäste an Bord An Bord befinden sich neben der Cockpitcrew nicht nur Personen mit Ingenieursdiplom. Auch eine Kabinenbesatzung ist dabei, um den realen Flugbetrieb zu simulieren. Sie bewirten eine repräsentative Gruppe von rund 30 Fluggästen, die sich aus freiwilligen Airbus- und Airline-Mitarbeitenden zusammensetzt. Das Feedback aller Gruppen wertet Airbus danach aus, um allenfalls noch Änderungen vorzunehmen."
c625d157-4703-44a7-9db5-19b0f00d210b,2023-09-14 05:30:00,"Die deutsche Wirtschaft befindet sich in einer Schockstarre, wie Ökonomen es beschreiben. Die Rufe nach Hilfe vom Staat werden seit Monaten immer lauter, etwa nach einem Industriestrompreis und Bürokratieabbau. Allein an diesem Dienstag fordern die Arbeitgeberverbände eine „Renovierung“ des Wirtschaftsstandorts Deutschland, während die Wirtschaftsweise Veronika Grimm eine Stärkung von Investitionen verlangt und der Sparkassenverband mehr Tempo vor allem beim Faktor Energie. Doch die Unternehmen könnten auch selbst deutlich mehr beitragen, um ihre aktuelle Krise zu überwinden. Das zeigt eine Umfrage von ntv.de unter führenden Ökonomen. Unternehmen und Bevölkerung sollten nicht erwarten, „dass der Staat in Krisen durch Hilfen alle Lasten aus der Welt schafft“, stellt IFO-Präsident Clemens Fuest auf ntv.de-Anfrage klar. „Die Politik neigt dazu, derartige Versprechungen zu machen. Das ist ein Fehler.“ Die geforderte Reformbereitschaft gelte natürlich auch für Unternehmen. „In der Vergangenheit hat es hier Versäumnisse und Fehler gegeben, ein Beispiel ist der Abgasskandal in der Autoindustrie.“ Auf die Autoindustrie verweisen auch andere Wirtschaftswissenschaftler. Viele Unternehmen machten zwischen Finanzkrise und Coronapandemie vor allem im Export blendende Geschäfte und Rekordgewinne, wie Jens Südekum gegenüber ntv.de erläutert. „Allen voran die Automobilindustrie. Aber dabei haben viele wohl vergessen, darüber nachzudenken, womit sie morgen Geld verdienen wollen, wenn die alten Produkte am Ende des Lebenszyklus angekommen sind“, meint der Professor für Internationale Volkswirtschaftslehre an der Heinrich-Heine-Universität Düsseldorf. „Der Bereich Elektromobilität wurde so zum Beispiel ziemlich verschlafen, und es musste erst Elon Musk mit Tesla kommen, um die deutschen Autokonzerne aufzuwecken.“ Mehr geopolitischer Weitblick Auch Sebastian Dullien, wissenschaftlicher Direktor des Instituts für Makroökonomie und Konjunkturforschung der gewerkschaftsnahen Hans-Böckler-Stiftung, teilt ntv.de mit: „Die aktuellen Probleme des deutschen Automobilbaus haben ihre Ursachen zu einem beträchtlichen Teil auch in Versäumnissen des Managements, vom Diesel-Skandal über den verschleppten Einstieg in die Produktion von E-Autos bis hin zu schlechtem Management von Lieferketten in und nach der Coronapandemie.“ Unternehmen müssen Dullien zufolge ihre Lieferketten auf Zuverlässigkeit prüfen, dürften nicht mehr nur auf einen Zulieferer für Vorprodukte setzen und sollten die eigenen Arbeitsprozesse so gestalten, dass sie bei Schocks schnell reagieren können. Mehr Weitblick fordert der Ökonom zudem für die „anstehenden geopolitischen Veränderungen und die bevorstehende Dekarbonisierung“. Das sei effizient nur bei einer stärkeren Einbindung der Mitarbeiter möglich, „statt, wie es einige tun, die Mitbestimmung zu behindern“. Michael Hüther, Direktor des arbeitgebernahen Instituts der deutschen Wirtschaft (IW), verlangt ebenfalls mehr geopolitischen Weitblick von Unternehmen, wie er gegenüber ntv.de ausführt: „Der Fokus auf China könnte mittelfristig ein Risiko darstellen.“ Hüther empfiehlt mehr strategische Investitionen, wie zur Rohstoffbeschaffung. Nachholbedarf sehen Forscher daneben bei der Digitalisierung und Investitionen. „Der Kapitalstock ist vergleichsweise überaltert, viele digitale Technologien werden nur unterdurchschnittlich eingesetzt, insbesondere in kleinen und mittelständischen Unternehmen“, kritisiert Südekum. „Große Investitionen sind erforderlich. Natürlich kann und muss der Staat hierbei punktuell mit Förderprogrammen helfen, aber zuallererst sind die Unternehmen selber gefragt.“ Investitionsbedarf besteht laut Jan Schnellenbach, VWL-Professor an der Brandenburgischen Technischen Universität in Cottbus, vor allem bei Forschung und Entwicklung - vom Staat gefördert. „Arbeitslosigkeit ist ein Übergangsphänomen“ Denn Unternehmen müssten neue, innovative Produkte entwickeln, wie Schnellenbach ntv.de mitteilt. „Da stehen wir in Deutschland traditionell ganz gut da mit vielen sogenannten Hidden Champions, also Unternehmen, die die breite Öffentlichkeit oft gar nicht kennt, die aber sehr gut darin sind, kleine, hoch spezialisierte Nischenmärkte mit sehr fortgeschrittenen Produkten zu bedienen und die da auch entsprechend hohe Preise aufrufen können, weil es wenige oder gar keine ähnlich innovativen Wettbewerber auf den Weltmärkten gibt.“ Durch Produkte, für die die Zahlungsbereitschaft höher ist, steigt die Arbeitsproduktivität - laut Schnellenbach der wichtigste Beitrag von Unternehmen zu mittel- und langfristigem Wachstum. Eine höhere Produktivität werde daneben durch technischen Fortschritt in der Produktion möglich, vor allem mehr Automatisierung, Digitalisierung und Effizienz. Durch den Fortschritt bei künstlicher Intelligenz sei selbst in der Dienstleistungsbranche, etwa in Beratungsjobs, mehr Automatisierung möglich. Der dadurch kurzfristig mögliche Anstieg der Arbeitslosigkeit sei angesichts des demografischen Wandels mittel- und langfristig keine Bedrohung. „Wir müssen schauen, wie wir mit weniger Arbeitskräften ein hohes - und weiter wachsendes - Produktionsniveau erreichen können“, sagt der Ökonom. „Arbeitslosigkeit ist da allenfalls ein kurzfristiges Übergangsphänomen.“ Grüner und digitaler IW-Chef Hüther nennt es besorgniserregend, dass mehr als die Hälfte der Unternehmen einen unklaren Nutzen als Hürde für digitale Geschäftsmodelle angebe, und fordert mehr Offenheit dafür. Mithilfe der Digitalisierung könnten bis zu 13 Prozent Material und 11 Prozent Energie eingespart werden. Kosten senken und Ressourcen schonen würde ihm zufolge auch eine besser umgesetzte Kreislaufwirtschaft. „Nachhaltigkeit sollte als Geschäftsmodell ernst genommen werden, die grüne Transformation schnell umgesetzt werden, um wettbewerbsfähig in Zukunftsbranchen zu sein.“ Eine höhere Widerstandsfähigkeit von Unternehmen gegen Schocks wie aktuell bei den Energiepreisen entlässt den Staat nicht aus der Pflicht. Dieser könne und solle helfen, die aktuelle Unsicherheit infolge des russischen Angriffskriegs gegen die Ukraine zu verringern, findet Dullien. Gunther Schnabl, Professor für Wirtschaftspolitik und Internationale Wirtschaftsbeziehungen an der Universität Leipzig, sieht die entscheidende staatliche Hilfe allerdings in einem Weniger statt Mehr: „Nachdem in den letzten Jahren Krisen mit mehr Staatsausgaben, mehr Regulierung und einer immer expansiveren Geldpolitik der EZB begegnet wurde, brauchen wir jetzt eine ordnungspolitische Wende“, fordert er gegenüber ntv.de. „Jetzt brauchen wir eine Konsolidierung der Staatsausgaben sowie eine umfassende Deregulierung, um den Unternehmen wieder mehr Freiheit zu geben“, meint Schnabl. „Der aktuelle wirtschaftspolitische Aktionismus ist Gift für die Wirtschaft“, sagt der Volkswirt. „Ein schlankerer Staat und Investitionen statt Subventionen sind die Schlüssel für eine wirtschaftliche Belebung in Deutschland.“ Hüther sieht es als Wechselspiel: Die Transformation verlange ein Zusammenspiel aus staatlichem und unternehmerischem Handeln. „Der Staat muss die notwendigen Bedingungen dafür bereitstellen, aber die Unternehmen müssen die grüne und digitale Transformation umsetzten.“"
d75477b6-c8e9-4d2f-91b0-6015209f78f6,2023-09-14 06:55:00,"Leitzinsentscheid der EZB:Warum Deutschland zum Problemfall wird Die größte Volkswirtschaft der Eurozone steckt in der Krise. Deutschland steuert auf eine Rezession zu, die Inflation ist immer noch viel zu hoch. Ein Dilemma für die EZB."
330da5f8-6d0f-421d-9f2f-694750d0cdab,2023-09-14 08:49:18,"Baden-Württemberg ist einer Studie zufolge ähnlich innovativ wie das für seine Vielzahl an Tech-Firmen bekannte Kalifornien. Demnach schafft es das „Ländle“ hinter den US-Bundesstaaten Massachusetts sowie Kalifornien auf Platz drei der weltweit besonders innovativen Regionen, wie das arbeitgebernahe Institut der deutschen Wirtschaft (IW Köln) am Donnerstag zu seiner Untersuchung von 121 Gebieten weltweit mitteilte. Dabei wurden vom IW und sechs weiteren internationalen Forschungsinstituten 13 Indikatoren ausgewertet - darunter die Zahl der Gründungen, Ausgaben für Forschung und Entwicklung und die Anmeldung von Patenten. Auch andere Bundesländer sind weit vorn: Bayern liegt auf Rang sieben, Hessen auf Rang neun. Nachholbedarf haben dagegen Thüringen (46), Mecklenburg-Vorpommern (61) und Sachsen-Anhalt (79). Ostdeutschland habe wirtschaftlich immer noch aufzuholen und müsse vor allem bei der Forschung und Internationalisierung weiter vorankommen, schreiben die Autoren. Auf der anderen Seite punkteten die besonders innovativen Bundesländer mit einer recht hohen Zahl von qualifizierten Zuwanderern, einer starken Industrie und solide hohen Exportraten. Zudem investiere Süddeutschland besonders stark in Forschung und Entwicklung. Damit auch die anderen Regionen nachziehen und Deutschland insgesamt Herausforderungen wie Demografie, Digitalisierung und Klimaschutz meistern könne, brauche es einen breiten politischen Ansatz, fordern die Autoren. So sollte die Politik die Innovationskraft durch eine Ausweitung der Forschungsprämie und mehr Investitionen in Bildung stärker unterstützen und bürokratische Hürden abbauen. Um die Herausforderung der Demografie zu meistern, müsse zudem die qualifizierte Zuwanderung nach Deutschland weiter gestärkt werden. Ohne die Zuwanderung in die MINT-Bereiche (Mathematik, Informatik, Naturwissenschaft und Technik) der vergangenen Jahre wäre die Fachkräftelücke bereits heute um 386.000 höher."
06b90d50-3640-4f1d-9871-aaabd0b4318a,2023-09-14 10:21:58,"Die deutsche Chemieindustrie steckt in einer tiefen Krise. Die Produktion ist gebremst worden, die Umsätze sind rückläufig. Die Branche fordert wettbewerbsfähige Strompreise und Deregulierung. Die deutsche Chemieindustrie hat aus Kostengründen ihre Produktion im zweiten Quartal weiter gedrosselt. Die Hoffnung auf eine Erholung müsse angesichts einer zunehmenden Nachfrageschwäche verschoben werden, erklärte der Branchenverband VCI bei der Vorlage seines Konjunkturberichts. VCI-Präsident Markus Steilmann erneuerte die Forderung nach international wettbewerbsfähigen Strompreisen und Deregulierung. ""Natürlich nehmen wir als Branche wahr, dass die Politik nicht die Augen vor den aktuellen Problemen verschließt. Aber Worte sind noch keine Taten"", sagte Steilemann und beklagte ""immense Standortnachteile"". Nötig seien nun ein Brückenstrompreis und die Beibehaltung des Spitzenausgleichs. ""Die Zeit drängt."" Einige Unternehmen hätten schon dauerhafte Produktionsstilllegungen und die Verlagerung von Investitionen ins Ausland angekündigt, weitere könnten folgen. VCI: ""Chemieindustrie in tiefer Krise"" Die Chemiebranche befindet sich dem VCI zufolge in einer tiefen Krise. Im Zeitraum von April bis Juni verzeichnete sie demnach einen Umsatzrückgang um 15 Prozent im Vergleich zum Vorjahresquartal, während die Produktion um 8 Prozent zurückging. Außerhalb der wichtigen Pharmasparte ging die Produktion sogar um 14,2 Prozent zurück. Die Anlagen waren nur noch zu 77,3 Prozent ausgelastet. Angestrebt wird normalerweise ein Wert von an die 85 Prozent. Zumindest bei den Beschäftigtenzahlen macht sich die angespannte wirtschaftliche Lage nach Angaben des VCI zumindest noch nicht bemerkbar. Dazu trägt vor allem der Fachkräftemangel bei. Bei einzelnen Unternehmen stünden aber bereits Einstellungsstopps oder Kurzarbeit in besonders betroffenen Bereichen auf der Agenda. Düstere Zukunftsaussichten für zweites Halbjahr Die Unternehmen rechnen laut Verband für das zweite Halbjahr mit einer weiteren Verschlechterung der Geschäftslage. Für das Gesamtjahr ist der VCI pessimistischer geworden und rechnet nun mit einem Produktionsrückgang von 8 Prozent (zuvor minus 5 Prozent). Bei rückläufigen Preisen werde der Jahresumsatz voraussichtlich um 14 Prozent sinken. Ob und in welchem Umfang die Branche in Zukunft von einem globalen Aufschwung profitieren könne, sei angesichts der immensen Standortnachteile mehr als fraglich. ""Die Lage ist ernst und die Stimmung dementsprechend schlecht"", erklärte Verbandspräsident Steilemann."
0f4b2a71-691b-44ef-a289-2f32a9422c2d,2023-09-14 12:37:29,"Die Europäische Zentralbank setzt ihren Zinserhöhungskurs im Kampf gegen die Inflation mit der zehnten Anhebung in Serie fort. Sie hob die Schlüsselsätze wie bereits im Juli um einen viertel Prozentpunkt auf nun 4,5 Prozent an. Die schwächelnde Konjunktur unterbricht die Serie von Zinserhöhungen im Euroraum vorerst nicht: Die Europäische Zentralbank (EZB) hebt den Leitzins um weitere 0,25 Prozentpunkte auf 4,5 Prozent an. Das ist das höchste Niveau seit dem Start der Währungsunion 1999. Der an den Finanzmärkten richtungsweisende Einlagensatz, den Banken für das Parken überschüssiger Gelder erhalten, steigt somit von 3,75 auf 4,00 Prozent. Der EZB-Rat beschloss damit die zehnte Zinserhöhung in Folge seit Juli 2022. Mit den höheren Zinsen versucht die Notenbank, die hartnäckig hohe Inflation in den Griff zu bekommen. Forderungen nach Zinspause blieben unerhört Höhere Zinsen verteuern Kredite. Das kann die Nachfrage bremsen und hohen Teuerungsraten entgegenwirken. Weil teurere Kredite zugleich eine Last für die Wirtschaft sind, waren zuletzt Forderungen nach einer Zinspause lauter geworden. EZB-Präsidentin Christine Lagarde hatte nach der vorherigen Sitzung des EZB-Rates Ende Juli für die September-Sitzung sowohl eine weitere Zinserhöhung als auch eine Unterbrechung der beispiellosen Serie von Anhebungen nicht ausgeschlossen. Lediglich einer Zinssenkung erteilte die Französin bereits damals eine Absage. ""Bei der Festlegung der angemessenen Höhe und Dauer des restriktiven Niveaus wird der EZB-Rat auch künftig einen datengestützten Ansatz verfolgen"", teilten die Währungshüter nun mit. Viele Volkswirte gehen davon aus, dass die Euro-Wächter auf ihrem im Sommer 2022 eingeleiteten Straffungskurs mit einen Einlagensatz von nunmehr 4,00 Prozent den Zinshöhepunkt erreicht haben. Sie erwarten, dass die EZB den Schlüsselsatz für längere Zeit auf diesem Niveau halten wird, um die Inflation weiter einzudämmen. Stimmen aus der Wirtschaft Die Deutsche Industrie- und Handelskammer (DIHK) reagierte kritisch auf die erneute Zinsanhebung. ""Für die Unternehmen in Deutschland wird die Durststrecke noch länger"", erklärte Hauptgeschäftsführer Martin Wansleben. Denn dadurch verschlechterten sich die Finanzierungsbedingungen für die Unternehmen weiter, ""und das in einer Situation, in der Aufträge wegfallen und die Konjunktur droht abzudriften"". Wichtig sei nun, Investitionen zu ermöglichen, die das Angebot vergrößern. Helmut Schleweis, Präsident des Deutschen Sparkassen- und Giroverbandes (DSGV), hält die Entscheidung der EZB angesichts der nur langsam zurückgehenden Inflation zwar für ""verständlich"". ""Sie darf mit weiteren Zinserhöhungen jedoch nicht überziehen. Andernfalls würde sie die Wirtschaft zu stark dämpfen."" Die EZB müsse vielmehr den ""vollen Effekt ihrer bisherigen Schritte"" abwarten. ING-Analyst Carsten Brzeski erklärte, der EZB sei es vor allem um Glaubwürdigkeit gegangen. ""Die EZB hat einen Job und das ist die Wahrung der Preisstabilität."" Die Angst, die Inflation nicht unter Kontrolle zu bekommen und das Risiko, zu früh aus den Erhöhungen auszusteigen, sei größer gewesen als das steigende Rezessionsrisiko in der Eurozone. Brzeski rechnet aber damit, dass es die vorerst letzte Erhöhung war. Weit vom Ziel einer Inflationsrate von 2,0 Prozent entfernt Mittelfristig strebt die EZB für den Euroraum eine Inflationsrate von 2,0 Prozent an. Bei diesem Niveau sehen die Währungshüter Preisstabilität gewahrt. Doch von dieser Zielmarke ist die Teuerung nach wie vor weit entfernt. Im August schwächte sich der Anstieg der Verbraucherpreise im Währungsraum der 20 Länder nicht weiter ab. Die jährliche Inflationsrate verharrte einer erste Schätzung des Statistikamtes Eurostat zufolge bei 5,3 Prozent. Im vergangenen Jahr war die Inflation infolge des Ukraine-Kriegs, in dessen Folge die Preise für Energie und Nahrungsmittel in die Höhe schnellten, zeitweise zweistellig gewesen. Höhere Inflationsraten zehren an der Kaufkraft von Verbraucherinnen und Verbrauchern, die Menschen können sich für ihr Geld weniger leisten. Das bremst den privaten Konsum, der eine wichtige Stütze der Konjunktur ist."
8102f09a-8e62-42d6-b3cc-977af1debf4f,2023-09-14 13:37:44,"Westfälische Friedenskonferenz : „Die Wirtschaft kann eine Rolle für nachhaltigen Frieden spielen“ 14.09.2023, 15:37Lesezeit: 6 Min. Im Rathaus von Münster findet am Freitag die 1. Westfälische Friedenskonferenz statt.dpa 100 mittelständische Unternehmen haben eine neue „Westfälische Friedenskonferenz“ gegründet. Am Freitag kommen dafür prominente Redner zusammen. Miele-Geschäftsführer Reinhard Zinkann erklärt für die Veranstalter, worum es geht. Herr Zinkann, obwohl es den Westfälischen Friedenspreis erst seit 1998 gibt, ist er schon beinahe so renommiert wie der Aachener Karlspreis. Wie kam die Wirtschaftliche Gesellschaft für Westfalen und Lippe (WWL) – ein Zusammenschluss von 100 Unternehmen und Institutionen – darauf, einen Friedenspreis zu stiften? Zugang zu allen FAZ+ Beiträgen 11,80 € jetzt nur 0,99 € Jetzt Zugang 11,80 € für nur 0,99 € abonnieren? Mit einem Klick online kündbar Bayaz zum Koalitionsende: „Ein Kanzler kann sich nicht auf der Nase herumtanzen lassen“ Warum hat es Scholz so weit kommen lassen? Warum hat er die Lage der Wirtschaft so lange schön geredet? Das fragt sich (nicht nur) Danyal Bayaz. Ein Gespräch mit dem Grünen-Politiker über das Ampel-Aus. Nach dem Ampel-Aus: Was wird die erste Maßnahme einer CDU-Regierung, Herr Linnemann? Bürgergeld abschaffen, TTIP mit Trump angehen und Leistungen für Ukrainer in Deutschland einschränken: CDU-Generalsekretär Linnemann stellt vor, was seine Partei unmittelbar nach einer Regierungsübernahme vorhat. Wirtschaftsgeschichte: Sozialer Markt Die Soziale Marktwirtschaft hat zum Wohlstand in der Bundesrepublik Deutschland erheblich beigetragen. Die Geschichte der Wirtschaftsredaktion belegt, wie sehr darum gerungen wurde."
