2aae87e1-8821-4395-9487-8faf071ab04f,2023-07-17 06:18:22,"Gerade Mütter arbeiten oft weniger, als sie gerne möchten. In Zeiten des zunehmenden Fachkräftemangels ist das ein Widerspruch. Doch Arbeitgeber können dazu beitragen, ihn aufzulösen. Die junge Mutter Lisa Atzenbeck ist kreativ, hat Teamgeist und bei ihrem zweijährigen Sohn schon mehr als einmal Durchhaltevermögen bewiesen. Eigentlich wäre die studierte Kulturwissenschaftlerin mit diesen Eigenschaften eine perfekte Arbeitnehmerin - wenn sie nur so viel arbeiten könnte, wie sie gerne würde. Aber sie musste schnell lernen: Als Mutter ist es selbst in einer Großstadt wie München nicht leicht, zurück auf den Arbeitsmarkt zu kommen. Obwohl hier an allen Ecken nach Personal gesucht wird. Nur jede zweite Mutter geht einer Erwerbsarbeit nach Viele Eltern in Deutschland dürften sich bei diesem Beispiel an ihr eigenes Leben erinnert fühlen. Während gerade mal acht Prozent der berufstätigen Väter in Teilzeit arbeiten, geht nur jede zweite Mutter überhaupt einer bezahlten Arbeit nach. Und die, die es tun, sind laut Statistischem Bundesamt zu fast 70 Prozent in Teilzeit angestellt. Nicht nur, dass diese Mütter damit oft in Jobs festhängen, für die sie eigentlich überqualifiziert sind; sie zahlen auch wenig in die Rentenkasse ein, wodurch ihnen Altersarmut droht. Hinzu kommt: Allzu oft stellen sie ihre persönlichen Träume und Wünsche hintenan. Das klassische Modell ist oft einfacher Monika Wegat ist Jobcoach bei ""Power M"", einer Münchener Berufsberatungsstelle für Frauen. Sie begegnet solchen verpassten Chancen und heimlichen Wünschen jeden Tag; Wünsche, die untergegangen sind im Trubel des Kinderkriegen und Familienlebens. ""Aus diesen Wünschen wird oft ein späteres Bereuen"", berichtet sie. Wegat rät deshalb allen werdenden Eltern: ""Der wichtigste Aspekt ist tatsächlich, aktiv für die Vereinbarkeit von Familie und Beruf zu sorgen."" Denn viele Paare würden davon überrascht, wie schwierig es ist, gleichberechtigt Eltern zu sein, erzählt sie. Und wie leicht es ist, in die klassische Rollenverteilung zu rutschen: Der Vater nimmt vielleicht für ein, zwei Monate Elternzeit, weil er es nicht anders kennt. Danach aber geht er wieder voll arbeiten. Oft, weil er sich in der Verpflichtung sieht, das Geld nach Hause zu bringen. Millionen Menschen in der ""stillen Reserve"" Die Mutter kümmert sich entsprechend zunächst um das erste Kind, dann um das zweite - und ist dann nach einigen Jahren daheim verunsichert: ""Was kann ich eigentlich? Und wie sieht es denn im Arbeitsmarkt jetzt aktuell aus?"" Wenn zu dieser Familie dann auch noch eines der bundesweit etwa 378.000 Kinder gehört, für die es laut Bundesfamilienministerium keinen Betreuungsplatz in einer Kita oder Tagesbetreuung gibt, dann ist oft der Weg in die sogenannte ""stille Reserve"" geebnet. Zur ""stillen Reserve"" gehören in Deutschland über drei Millionen Menschen. Sie könnten einer Erwerbsarbeit nachgehen, tun es aber nicht. Zeitgleich melden sie sich aber auch nicht arbeitslos, sie sind also für die Arbeitsvermittlung unsichtbar. Oft steckt dahinter der Betreuungs- oder Pflegebedarf Familienangehöriger. Und: ""Viele dieser Menschen trauen sich gar nicht mehr zu, an den Arbeitsmarkt heranzutreten"", berichtet Coach Wegat aus ihrem Arbeitsalltag. Diese drei Millionen Menschen zu mobilisieren, würde sich enorm lohnen. Denn für sie gäbe es laut dem Forschungsinstitut der Bundesagentur für Arbeit, IAB, derzeit knapp zwei Millionen Stellen, die die Unternehmen mittelfristig nicht besetzen können. Eine Lücke, die allgemein mit dem Wort ""Fachkräftemangel"" beschrieben wird und sich in den nächsten Jahren zu einem großen Problem für die Wirtschaft entwickeln dürfte. Den Eltern Mut machen Die Gemengelage ist also komplex. Nach Wegats Einschätzung kann sie nur aufgelöst werden, wenn es für Familien leichter gemacht wird, ""aktiv für die Vereinbarkeit von Familie und Beruf sorgen"" zu können, wie sie es beschreibt. Daran müssten aber Politik und die Unternehmen aktiv mitwirken. Sie müssten vorleben, dass es in Ordnung oder sogar gewünscht ist, Kinder zu bekommen und Familien zu gründen - und kein Hindernis. Nur so könnten Beschäftigte mittelfristig Vertrauen zu ihren Unternehmen aufbauen und dort auch gehalten werden. Eine gute Möglichkeit sind hier Wiedereingliederungs-Programme und vor allem eine offene Kommunikation, die den Eltern Mut macht. Mit Geld allein ist das nicht erledigt. ""Ich möchte mir selbst Sachen leisten können"" Die junge Mutter Atzenbeck hat genau so eine offene Kommunikation erlebt: mit der Chefin des Theaters, in dem sie schon vor der Geburt ihres Sohnes 40 Stunden in der Woche gearbeitet hat. Die beiden haben sich auf einen Mittelweg geeinigt: Während der Sohn wöchentlich 25 Stunden betreut wird - mehr Zeit konnte Atzenbeck nicht buchen -, arbeitet sie vormittags im Theater, um den Social-Media-Auftritt zu betreuen und sich um Kartenreservierungen zu kümmern. Auch wenn sie das noch nicht ganz erfüllt - den Organisationsaufwand ist es ihr wert: ""Weil ich ich bin. Und nicht nur die Frau meines Partners. Und ich möchte mir selbst Sachen leisten können und dafür arbeiten gehen"", sagt sie. Und den nächsten Schritt wird Atzenbeck gemeinsam mit der Berufsberaterin angehen: Lisa will eine Agentur aufbauen, um selbstständig Künstler zu managen. Für die passende Infrastruktur sorgt sie erstmal selber."
299b0f15-3b73-4b1a-9e69-348320c3b960,2023-07-17 10:11:00,"Startseite Politik Hubschrauber-Deal für Bundeswehr - Pistorius in der Kritik Von: Andreas Apetz Der Hubschrauber-Deal der Bundeswehr sorgt bei einem US-Flugzeughersteller für Fragezeichen. In einem Brief wendet sich die Firma an den Verteidigungsminister. Berlin – Die Bundeswehr soll auf Vordermann gebracht werden. Dazu rief Bundeskanzler Olaf Scholz (SPD) kurz nach Beginn des Ukraine-Kriegs eine „Zeitenwende“ des deutschen Militärs aus. Einen der Knackpunkte stellen dabei die in die Jahre gekommenen Kampfhubschrauber des Bundes dar. Laut internen Warnungen, die Business Insider vorliegen, sind die Maschinen des Typs „Tiger“ schon ab 2029 nicht mehr einsatzfähig. Als schnelle Lösung plante das Verteidigungsministerium um Boris Pistorius (SPD) mit der Umrüstung ziviler Helikopter von Airbus. Nachdem es schon innerhalb der Bundeswehr massive Kritik an dem „Notfallplan“ gab, wird dem Ministerium nun Wettbewerbsverzerrung aus den USA vorgeworfen. Interne Kritik an neuen Bundeswehr-Hubschraubern: „Rein politische Entscheidung“ „Die Bundeswehr plant die Beschaffung von marktverfügbaren leichten Kampfhubschraubern“, bestätigte eine Sprecherin der Bundeswehr im Mai. Als Nachfolgemodell wurde der Hubschrauber H-145M von Airbus ins Auge gefasst. In der zivilen Variante ist dieser im Rettungswesen im Einsatz. Die Bundeswehr plant demnach, ihn mit Waffen zur Panzerabwehr auszustatten. Das Ministerium erklärte zur Frage nach konkreten Plänen lediglich, man arbeite derzeit an „zukunftsorientierten Lösungen“. Für den Kampf konzipierte Kampfhubschrauber sind derzeit offenbar nicht im Gespräch. Der schnelle Sonderweg des Verteidigungsministeriums kommt nicht überall gut an. In der Bundeswehr wird von einem „maximal schlechten Kompromiss“ gesprochen. Bei dem Vorhaben handle es sich um „eine rein politische Entscheidung, die am operationellen Bedarf vorbeigeht“, hieß es intern. Dies ergaben Recherchen von Business Insider. Ein Bundeswehr-Techniker hatte das Arsenal der Luftwaffe nach einer Inspektion zuletzt als „museumsreif“ beschrieben. Hubschrauber-Deal für Bundeswehr: US-Firma bittet um „fairen Wettbewerb“ Nun wendete sich ein direkter Konkurrent von Airbus mit einem Brief an das deutsche Verteidigungsministerium. Der US-Flugzeughersteller Bell Aircraft forderte in einem brisanten Schreiben ein Treffen zwischen Pistorius und dem Unternehmensmanagement auf und bat um einen „fairen Wettbewerb“, wie Business Insider berichtete. Laut dem aktuellen Schreiben an Pistorius haben die Bundeswehr und ihr Beschaffungsamt für Anfang 2023 eine Ausschreibung für Schulungshubschrauber angekündigt. Dem Flugzeughersteller Bell soll dabei signalisiert worden sein, dass ihr Hubschraubermodell vom Typ Bell 429 als „potenzieller Teilnehmer“ angesehen werde. Angeblich habe das Unternehmen erst aus den Medien vom geplanten Deal zwischen der Bundesrepublik und Airbus erfahren haben. US-Flugzeughersteller stellt „staatlichen Entscheidungsprozess“ infrage Bell Aircraft zeigt sich verwundert über die Entscheidung des Bundesverteidigungsministers. Die Meldungen über die Wahl des Hubschraubers H-145M von Airbus „werfen Fragen zum Stand eines möglichen Wettbewerbs und zum staatlichen Entscheidungsprozess auf“, wird der Bell-Manager in seinem Schreiben an den Minister zitiert. Der Flugzeughersteller habe „wiederholt seine Bereitschaft bekundet, sich an einem fairen Wettbewerb gemäß dem deutschen Vergaberecht zu beteiligen“, heißt es. In dem geforderten Treffen zwischen der Bell-Unternehmensspitze und Pistorius wolle man nun den Bell 429 für Ausbildungszwecke und den Kampfhubschrauber Viper für militärische Zwecke präsentieren. Laut eigener Aussage des Flugzeugherstellers würden beide Modelle die „wirtschaftlichste Lösung für Deutschland“ darstellen. Bell erklärte sich außerdem bereit, „für beide Programme Partnerschaftsstrategien mit deutschen Unternehmen zu entwickeln, die einen erheblichen lokalen Mehrwert“ hätten. Deutschland sichert langfristige Finanzierung der Verteidigung zu Bundeskanzler Scholz hat angesichts des russischen Angriffskriegs gegen die Ukraine zugesichert, dass die Bundesregierung langfristig zwei Prozent des Bruttoinlandsprodukts für Verteidigung ausgeben will. „Wir haben uns entschieden, dass wir diese zwei Prozent für die Verteidigung für die Bundeswehr aufwenden wollen. Nächstes Jahr werden wir das aus Haushaltsmitteln und dem Sondervermögen das erste Mal erreichen“, sagte der SPD-Politiker am Freitag (14. Juli) in seiner Sommer-Pressekonferenz in Berlin. „Und ich wiederhole hier, was ich bei vielen Gelegenheiten gesagt habe: Das wird auch so bleiben, auch wenn das Sondervermögen aufgebraucht ist“, ergänzte Scholz. Der Nato-Gipfel in der litauischen Hauptstadt Vilnius hatte sich kurz zuvor beschlossen: „Im Einklang mit unseren Verpflichtungen nach Artikel 3 des Vertrags von Washington verpflichten wir uns dauerhaft, jährlich mindestens 2 Prozent unseres Bruttoinlandsprodukts in Verteidigung zu investieren.“ Mit dieser Kompromissformulierung haben die Nato-Staaten beim Gipfel ihren Streit um die Höhe der nationalen Verteidigungsausgaben vorerst beigelegt. (aa/dpa)"
ed422a7f-a37d-4274-9205-a209259e6b60,2023-07-17 18:31:43,"Der Airbus A380 ist das größte je in Serienproduktion gebaute zivile Passagierflugzeug. Das eindrucksvolle Flugzeug ist 73 Meter lang und hat eine Spannweite von 80 Metern. Am Flughafen London Heathrow musste ein A380 der British Airways wegen des starken Seitenwinds am Samstag durchstarten. Auf der Videoaufnahme ist zu sehen, wie der Koloss bei der Landung in eine bedrohliche Seitenlage gerät, die Reifen des Flugzeugs qualmen. Die Piloten entscheiden sich schließlich für das Durchstartmanöver. Der Airbus A380-841 (Luftfahrzeugkennzeichen G-XLEA) kam aus San Francisco, als er um 14.19 Uhr versuchte, auf der Landebahn 27L zu landen, wie Airlive.net schreibt. Beim zweiten Anlauf – 15 Minuten nach dem Durchstarten – sei die Maschine sicher gelandet."
57e75e40-75b2-43cc-aa2d-057726df4630,2023-07-18 05:00:00,"Der Krieg in der Ukraine sorgt für Aufschwung. Warum das Land für Kapital aus West und Ost interessant wird und was Ökonomen zu den propagierten Wachstumszielen sagen. Deutschland ist die größte Volkswirtschaft Europas. Und wir Deutschen haben uns so sehr an diese wirtschaftliche Führungsrolle gewöhnt, dass uns die Vorstellung, wir könnten eines Tages nicht mehr die Nummer eins sein, wie eine schreckliche Dystopie vorkommt. Anzeige Zugegeben: Es dürfte auf absehbare Zeit keinem anderen europäischen Land gelingen, die Bundesrepublik vom Sockel zu stoßen. Mit einem Bruttoinlandsprodukt (BIP) von knapp 3,9 Billionen Euro steht Deutschland unangefochten an der Spitze. An zweiter Stelle liegt Frankreich mit rund 2,6 Billionen Euro, gefolgt von Italien mit einem BIP von 1,9 Billionen Euro. Anders sieht es aus, wenn man das BIP auf die Bevölkerung bezieht. Dann liegt Deutschland mit knapp 41.200 Euro pro Kopf nur noch im oberen Drittel der EU-Staaten. Spitzenreiter sind laut der europäischen Statistikbehörde Eurostat Luxemburg mit knapp 92.000 Euro und Irland mit knapp 83.000 Euro pro Kopf. Lese-Tipp: Sorgen wegen Deindustrialisierung? Warten auf das grüne Wirtschaftswunder! Während Deutschland in den vergangenen Jahren nur ein geringes Wachstum erlebt hat, erlebte die Wirtschaft in Polen einen regelrechten Boom. Lag hier das BIP pro Kopf im Jahr 2019 noch bei weniger als 23.000 Euro, so stieg es 2022 auf über 28.000 Euro. Das entspricht einem Wachstum von knapp 22 Prozent. Die Bundesrepublik kam im selben Zeitraum nur auf etwa neun Prozent. In Polen nutzen Populisten diesen Wohlstandszuwachs, um Stimmung für sich zu machen – oder gegen Deutschland. Jaroslaw Kaczynski, Chef der nationalkonservativen PiS-Partei und Vizepremier Polens, habe schon vor Beginn des Krieges in der Ukraine den Wettbewerb mit Deutschland beschworen, schreibt das Handelsblatt. Bis 2033 soll Polen beim BIP pro Kopf den EU-Durchschnitt erreichen (derzeit: 35.219 Euro). Und spätestens 2040 soll Deutschland eingeholt sein. Ökonomen halten Kaczynskis Vorstellungen zwar für deutlich übertrieben – aber den wirtschaftlichen Aufschwung in Polen kann niemand mehr leugnen. Seit dem Krieg in der Ukraine ist Polen zu einem Mekka für westliches Kapital geworden. Anzeige Motor dieser Entwicklung ist das Bestreben westlicher Unternehmen, ihre Lieferketten neu zu ordnen und die Produktion wieder nach Europa zu verlagern. Nach der Coronapandemie und mit Blick auf die wirtschaftliche Abkopplung von China sollen die Lieferketten risikoärmer werden. Lese-Tipp: Der deutsche Motor Europas – ein Auslaufmodell Polen profitiere aber auch davon, so das Handelsblatt, dass Russland als Investitionsstandort praktisch ausgeschieden sei und die Unternehmen nun nach Alternativen suchten. ""Derzeit entscheidet sich fast jedes vierte europäische Unternehmen bei Produktionsverlagerungen für Polen"", wird Piotr Arak, Chef des Polnischen Instituts für Wirtschaft (PIE), zitiert. In den vergangenen Jahren haben vor allem Unternehmen aus Luxemburg, Deutschland, den Niederlanden und Frankreich in Polen investiert. Mit einer hohen Produktivität, niedrigen Arbeitskosten, einer gut ausgebauten Infrastruktur und vielen qualifizierten Arbeitskräften sind die Bedingungen gut. Und nach Angaben der Polnischen Nationalbank investieren sie die erwirtschafteten Gewinne auch wieder in Polen. Aber auch für Unternehmen aus Weißrussland und der Ukraine ist das Land ein Sprungbrett auf den europäischen Markt. Jeder zehnte Investor komme inzwischen aus einem der beiden Länder, schreibt das Handelsblatt. Seit Beginn des Krieges in der Ukraine hätten sich bereits rund 22.000 ukrainische Firmen in Polen niedergelassen."
2a7df2f2-6261-4e61-abd1-1ef6f6e531b7,2023-07-18 06:06:00,"Im Safi Aviation Park, der sich auf dem Areal des Malta International Airports befindet, wird derzeit ein Airbus A330 für den Einsatz bei World2Fly vorbereitet. Es handelt sich um eine Maschine von Orbest. Dieser A330 von Orbest war ein gern gesehener Gast im Safi Aviation Park, wo sie für die Aufnahme in die World2Fly-Flotte vorbereitet wurde, da das Unternehmen weiterhin großes Interesse an seinen ACMI-Angeboten zeigt. Erst kürzlich hat Corendon Dutch Airlines das Luftfahrtunternehmen World2Fly mit der Durchführung von Langstreckenflügen ab Amsterdam beauftragt. Diese sollen im Winterflugplan 2023/24 mit Airbus A350-900 bedient werden. Derzeit verfügt World2Fly über drei Exemplare dieses Typs."
965a13cb-f200-4703-ba29-ad23e5c17111,2023-07-18 06:50:31,"Der Direktor des Instituts der deutschen Wirtschaft (IW), Michael Hüther, will dem Fachkräftemangel mit längeren Arbeitszeiten entgegenwirken. „Wir müssen wieder mehr arbeiten – so, wie es die Schweiz vormacht“, sagte der IW-Chef der „Rheinischen Post“. Dort, aber auch in Schweden würde eine Vollzeitkraft fast 300 Stunden mehr im Jahr arbeiten als in Deutschland. „Wir brauchen eine Ausweitung der individuellen Arbeitszeit im Jahr, nicht den unrealistischen Traum der Viertagewoche. Das kann über die Wochenarbeitszeit oder andere Urlaubsregelungen gehen, in Zeiten höherer Arbeitszeit- und Arbeitsortsouveränität durchaus vermittelbar“, so der Volkswirt weiter. „Wir müssen das Erwerbspotential besser ausschöpfen, um den Übergang in eine klimaneutrale Wirtschaft mit einer dann kleineren Bevölkerung zu schaffen. Ohne die Arbeitszeitverlängerung wären in den nächsten Jahren bestenfalls noch Wachstumsraten von 0,5 bis 0,75 Prozent möglich. Und die Inflation würde über Jahre bei drei bis dreieinhalb Prozent liegen.“"
18d9bfdc-f11c-4de9-b3f9-a8c832365590,2023-07-18 06:53:00,"Startseite Wirtschaft Putin „kannibalisiert“ Russland: Yale-Experten entlarven Kreml-Märchen – und zeichnen Weg in den Untergang Von: Richard Strobl Ist Russlands Wirtschaft trotz Ukraine-Krieg stark? Zwei Yale-Experten widersprechen Putins Darstellung nun deutlich – und ziehen ein hartes Fazit. Moskau/New Haven – Russland ist im Ukraine-Krieg zunehmend in die Defensive geraten. Dennoch scheint sich die russische Wirtschaft robust gegen westliche Sanktionen, auswandernde westliche Firmen und gestiegene Kosten durch den Krieg zu zeigen – so zumindest die Erzählung des Kreml. Doch zwei Wirtschaftswissenschaftler der renommierten Universität Yale widersprechen Wladimir Putins Darstellung nun vehement – und skizzieren sogar, dass der eingeschlagene Weg in Putins Untergang führen könnte. In einem Gastbeitrag im Time-Magazine fassen der renommierte Wirtschaftswissenschaftler Jeffrey Sonnenfeld (Professor für Managementpraktiken) und sein Kollege Steven Tian (Forschungsdirektor des Yale Chief Executive Leadership Institute) ihren Blick auf die russische Wirtschaftslage zusammen und werfen Putin eine „gnadenlosen Kannibalisierung der russischen Wirtschaftsproduktivität“ vor. Yale-Wissenschaftler nehmen Putins Wirtschafts-Märchen auseinander: „Verzweifeltes Russland“ Damit widersprechen sie Putins eigenem Narrativ, wie er den Ukraine-Krieg finanziere, deutlich. Und auch westlichen Kommentatoren widersprechen die beiden Wissenschaftler. Diese würden häufig davon ausgehen, dass Putin den Krieg dank hoher Rohstoffpreise, schwacher westlicher Sanktionen und der Umgehung dieser finanziert. Dem halten sie entgegen, dass die Rohstoffpreise sowohl für Öl, als auch für Gas heute günstiger seien, als noch vor der Invasion. Ebenso sei es bei Getreide, Weizen, Schnittholz, Metallen „und praktisch allen Waren, die Russland produziert“, heißt es in dem Beitrag. Beim Ölverkauf erreiche Russland – auch dank der Ölpreisobergrenze der G7 – kaum noch die Gewinnschwelle. Fazit der Wirtschaftsexperten: Die Welt hat russische Rohstoffe „weitgehend ersetzt, sodass Rohstoffexporte für das verzweifelte Russland derzeit kein Segen sind“. Nun weisen die Experten auf ein anderes Vorgehen Putins hin, um den Krieg zu finanzieren: Sie sprechen von der „Kannibalisierung der produktiven Wirtschaft Russlands“. Russlands Wirtschaft am Abgrund durch „drakonische Zufallssteuern“? So habe er „drakonische Zufallssteuern auf praktisch alles erhoben, was sich bewegt“. Die Experten nennen wiederholte Sondersteuerforderungen von Staatsunternehmen wie Gazprom. Zudem habe er auch Billionen von Rubel von Unternehmen und Oligarchen eingesammelt. Zudem erhob Putin demnach Steuern auf Unternehmen und Personen, die Russland nach der Ukraine-Invasion verließen. Später sei er dann dazu übergegangen „wahllos Geld und Eigentum (von diesen, d. Red.) zu beschlagnahmen“. Putin habe zudem „jeden Anspruch einer verantwortungsvollen Finanzpolitik aufgegeben“. So habe er Rekord-Haushaltsdefizite verzeichnet, Rekordsummen an Geld „aus dem Nichts“ gedruckt, Banken und Privatpersonen gezwungen, nahezu wertlose russische Schulden zu kaufen und Russlands Staatsvermögen um Hunderte Milliarden geschmälert und damit „Russlands Zukunft verpfändet“. Einige Experten würden sogar dazu übergehen, dass diese Maßnahmen Putins der russischen Wirtschaft mehr schaden würden, als die westlichen Sanktionen. „Unverhüllte Ausplünderung der russischen Wirtschaft“ durch Putins Regime im Ukraine-Krieg Nach Meinung der Yale-Wissenschaftler überrasche es angesichts der „unverhüllten Ausplünderung der russischen Wirtschaft“ kaum, dass die Bevölkerung und die Eliten zunehmend von Putin abrücken würden. Dies habe sich etwa bei Prigoschins Putschversuch gezeigt, als die Wagner-Söldner an diversen Check-Points einfach durchgewunken worden seien. Selbst die Regionalgouverneure hätten sich nicht schnell an Putins Seite gestellt. 21 von ihnen hätten sogar bis jetzt kein Bekenntnis zum aktuellen Präsidenten abgegeben. In einem großen historischen Bogen erinnern die Yale-Experten in diesem Zuge an die beiden großen russischen Revolutionen des vergangenen Jahrhunderts. Beide seien von wirtschaftlichen Problemen begleitet gewesen, die teils durch militärische Aktionen verursacht worden seien. Der Ukraine-Krieg koste Putin demnach eine Milliarde US-Dollar am Tag. Ebenso belastete der Erste Weltkrieg die Kassen von Zar Nikolaus vor seiner Abdankung im Jahr 1917. Vor dem Zusammenbruch der Sowjetunion hätten die steigenden Kosten des Kalten Krieges in Verbindung mit niedrigen Ölpreisen und einer Rezession zusammengewirkt. Yale Profs ziehen Russland-Fazit: Putin „zunehmend ungeliebt“ „Der Verlust von Kriegen scheint mit wirtschaftlicher Schieflage und einem Regimewechsel in Russland einherzugehen“, resümmieren Sonnenfeld und Tian in ihrem Beitrag. Putins Darstellung von einer weiterhin starken Wirtschaft nennen die beiden eine „Fassade“. Die Kriegskasse des Kreml werde nicht durch eine tatsächlich starke Wirtschaftsproduktivität gefüllt, sondern dadurch, dass das Land ausgepresst werde. Putin „zocke“ seine Landsleute ab, so die Experten. „Indem er den völligen wirtschaftlichen Zusammenbruch verhindert, indem er die Zukunft Russlands mit Hypotheken belastet, wird er von seinem Volk zunehmend ungeliebt und dadurch zunehmend geschwächt“ Dabei sei wirtschaftlicher Verfall nicht die einzige Kraft, die zum Zusammenbruch eines Regimes beitrage. Aber dieser sei eine „nachweislich mächtige Kraft“."
f7628922-c676-4feb-894a-a0edc9a67780,2023-07-18 11:40:07,"In einer Analyse stellt das „Wallstreet Journal“ fest, dass die wirtschaftliche Entwicklung in Europa immer weiter abflacht. Der Konsum in Europa geht drastisch zurück. So trinken die Franzosen weniger Wein, die Spanier sparen beim Olivenöl, die Finnen gehen nur noch bei Wind und Wetter in die Sauna, in Italien gibt es Krisensitzungen wegen steigender Nudelpreise und in Deutschland ist der Absatz von Bioprodukten eingebrochen. Der Wohlstandsverlust hat mehrere Ursachen Der Wohlstandsverlust in Europa ist seit dem Jahr 2000 zu beobachten. Der Bericht nennt dafür mehrere Gründe wie eine immer älter werdende Bevölkerung und das Streben nach mehr Freizeit. So arbeitet fast die Hälfte der deutschen Beschäftigten im Gesundheitswesen nur noch 30 Stunden pro Woche. Hinzu kommt die Kombination aus Pandemie und Ukraine-Krieg, die zu Produktionsengpässen und steigenden Energie- und Lebensmittelpreisen geführt hat, sowie die erstarkenden Gewerkschaften, die lieber die Vier-Tage-Woche als höhere Löhne fordern. Immer mehr Unternehmen investieren in den USA statt in Europa Auch die schwächelnde Wirtschaft in China mit einem Wachstum von nur noch 0,8 Prozent wirkt sich aus. Früher konnte sich Europa über den Export retten, der rund 50 Prozent des Bruttosozialprodukts der EU ausmacht. Jetzt befindet sich Europa seit Anfang des Jahres in einer Rezession, während die US-Wirtschaft derzeit um 2,3 Prozent wächst. Immer mehr Unternehmen investieren in den USA statt in Europa. Ex-Siemens-Chef: „Zug fährt leider weiter in die falsche Richtung"" Europäische Wirtschaftsführer schlagen bereits Alarm. Ex-Siemens-Chef Heinrich von Pierer warnt vor einem Abstieg des Wirtschaftsstandorts Deutschland. „Der Zug fährt leider weiter in die falsche Richtung“, sagte von Pierer der „Bild“-Zeitung. „Mit immer neuen Subventionen als Dauerveranstaltung, um Defizite auszugleichen, wird die Zeitenwende jedenfalls nicht gelingen, die Energiewende schon gar nicht.“ Auch der österreichische Unternehmer Stephan Zöchling warnt eindringlich vor einer Deindustrialisierung Europas und kritisiert, dass sich die Politik mehr auf „Orchideenthemen“ als auf die Lebensgrundlagen konzentriere."
