ec430d08-9bcc-4662-ac7c-cccc25289b08,2023-05-08 13:34:19+00:00,"Die ikonische und viel vermisste Marke TAM wird sehr bald vollständig vom brasilianischen Himmel verschwinden. Das letzte Airbus-Flugzeug, das in der alten Lackierung des Unternehmens flog, wurde an diesem Wochenende aus dem Betrieb genommen. Der Airbus A320 mit der Registrierung PT-MZY absolvierte gestern (07) seinen letzten Flug und beförderte Passagiere im Auftrag von LATAM. Zu dieser Zeit führte er den Flug LA3377 zwischen Recife und Guarulhos durch. Der Flug hatte Kommandant Robert Zwerdling als einen seiner Piloten, er hielt den historischen und aufregenden Moment durch den fest ASA-Kanal. Der PT-MZY stellt das Ende einer Ära dar, da von nun an kein Airbus-Flugzeug mehr die TAM-Lackierung trägt, was einen „Endpunkt“ in einer Geschichte darstellt, die 25 Jahre andauerte. Jetzt werden alle Flugzeuge von LATAM lackiert, dem Unternehmen, das aus der Fusion mit LAN hervorgegangen ist. Die Marke TAM hingegen fliegt weiterhin, aber jetzt nur noch auf der Boeing 767 und nur noch auf der PT-MSO, einem der drei Flugzeuge des Typs im Einsatz. Der Airbus A320 PT-MZY wurde ursprünglich 2001 an TAM ausgeliefert, und ist Teil der ersten Jet-Lieferung, die das Unternehmen Ende der 90er Jahre kaufte, als es auch sein erstes großes Airbus A330-Flugzeug erhielt. TAM war die erste brasilianische Fluggesellschaft, die das A320-Modell einsetzte, und startete damit eine Erfolgsgeschichte für das Modell im Land, die bis heute betrieben wird und wahrscheinlich noch viele Jahre andauern wird, da Brasilien bereits mehrere Modelle der neuen Generation A320neo hat. Das Ende der Lebensdauer des jetzt ehemaligen LATAM Airbus A320 wird demontiert, so wie seine „Brüder“ in den letzten Monaten in die USA gingen. Es wird erwartet, dass das Flugzeug noch in dieser Woche seinen Abschieds- und Rückflug in die Wüste durchführen wird. LATAM wird in Kürze neue Airbus A320neo-Flugzeuge erhalten und seinen Flottenerneuerungsprozess fortsetzen. Siehe auch:"
8a08cf75-22e0-4d17-8af0-f1d8991b8924,2023-05-08 13:52:55+00:00,"Manching. Seit nunmehr 20 Jahren sorgen die Deutsche Luftwaffe und das Unternehmen Airbus im oberbayerischen Manching gemeinsam dafür, dass unsere Tornado- und Eurofighter-Maschinen einsatzbereit sind. „Manching ist beispielgebend für die effiziente Zusammenarbeit zwischen der Bundeswehr und Rüstungsindustrie“, sagt Generalleutnant Ansgar Rieks, Stellvertreter des Luftwaffeninspekteurs. „Unsere Kooperation ist durch das klare Verständnis geprägt, dass wir – Luftwaffe und Industrie – zum gemeinsamen Erfolg auch für unser Land, die Allianz und unsere Verbündeten und Partner verpflichtet sind.“ Bundeswehrangehörige und Airbus-Beschäftigte arbeiten in den Kooperationen in Manching Seite an Seite in gemeinsamen Abteilungen und unter sogenannten „kooperativen Leitungsteams“. Die Vorteile liegen auf der Hand: Ein kostenintensives, doppeltes Vorhalten von Infrastruktur und Ressourcen entfällt; die Erkenntnisse aus dem operativen Betrieb bei der Luftwaffe und das industrielle Know-how bei Entwicklung und Fertigung ergeben eine umfassende Systembetreuung; die für den Einsatz notwendigen Kompetenzen bleiben der Luftwaffe erhalten. Verfügbarkeit der Eurofighter-Kampfflugzeuge kontinuierlich gesteigert Der Startschuss zur Zusammenarbeit fiel 2003, als die Luftwaffe und Airbus die „Eurofighter Kooperation Zelle“ (EKZ) gründeten. Seitdem verfolgen beide Seiten dort eine gemeinsame Mission: Sicherstellen, dass die deutsche Eurofighter-Flotte einsatzbereit ist, wenn und wo immer sie benötigt wird. In den vergangenen zwei Jahrzehnten konnte die Verfügbarkeit der Eurofighter-Kampfflugzeuge kontinuierlich gesteigert werden. Dabei deckt das EKZ-Team den erhöhten Inspektionsbedarf ab, der auch eine Folge des gestiegenen Flugstundenaufkommens im Laufe des Ukrainekrieges ist. Dazu Generalleutnant Rieks: „Diese Arbeit trägt dazu bei, um unsere Partner und Freunde an der NATO-Ostflanke zu schützen.“ Unterstützung bei der Verlegung in den indo-pazifischen Raum Am 1. April 2003 stellten Luftwaffe und Airbus darüber hinaus das „Systemunterstützungszentrum Eurofighter“ (SUZ EF) auf. Hier leisten alle gemeinsam technischen und logistischen In-Service-Support als Unterstützung für die Geschwader der Luftwaffe. Zudem kümmert sich das SUZ EF um Softwarepflege und -änderungen für den Eurofighter. Dabei führt das SUZ EF für die Luftwaffe eigenständig zertifizierte Änderungen für das gesamte Waffensystem durch. Das gilt auch für Soft- und Hardwareanteile, die ursprünglich nicht zum deutschen Entwicklungsanteil gehörten. Mehr als 40 solcher nationalen Änderungen wurden bereits in die deutsche Eurofighter-Flotte eingerüstet, um so direkt auf operationelle Anforderungen zu reagieren. Im September und Oktober 2022 unterstützte das SUZ EF die Luftwaffe übrigens auch bei der ersten Verlegung eines Eurofighter-Kontingents in den indo-pazifischen Raum („Rapid Pacific 2022“). Die Mission war ein voller Erfolg: Nach rund 40.000 Kilometern, gut 700 Flugstunden und mehr als 500 Luftbetankungen landeten alle sechs Eurofighter schließlich wieder sicher im Heimatstandort Neuburg an der Donau. Lebensverlängernde Maßnahmen für das Mehrzweckkampfflugzeug Tornado Das Team „Luftwaffe/Airbus“ sorgt zusätzliche für eine hohe Einsatzbereitschaft unserer Tornado-Flotte. Im „Systemunterstützungszentrum Tornado“ (SUZ Tornado), aufgestellt am 24. November 2004, entwickeln und pflegen die Spezialisten der Bundeswehr und Mitarbeiter aus der Industrie die Software des Kampfflugzeugs für Avionik, Missionsauswertung und das „Zentrum Elektronischer Kampf“. Die „Tornado Kooperation Zelle“ (TKZ), gegründet am 28. November 2014, kümmert sich um Instandsetzungsarbeiten, umfangreiche Grundüberholungen sowie lebensdauerverlängernde Maßnahmen (auch als Service Life Enhancement/SLE bekannt). Zu unserem Bildmaterial: 1. Arbeiten an einem Eurofighter-Kampfjet in Manching. (Foto: Deutsche Luftwaffe)"
8ec977fe-d068-4ec3-8138-fbb623b2b913,2023-05-09 04:01:11+00:00,"«Wir haben definitiv Pläne, Flugzeuge von Airbus zu kaufen, um die Flotte von Biman zu vergrößern», sagte Bangladesch Staatsminister für Zivilluftfahrt im März. Zunächst machte er keine näheren Angaben zur geplanten Order der staatlichen Fluglinie. Anfang Mai bestätigte er gegenüber der Zeitung The Business Standard jedoch, dass Biman Bangladesh Airlines sich zwei Airbus A350 F beschaffen wird. Ein anonymer leitender Angestellter der Fluggesellschaft sagte gegenüber dem Blatt, ursprünglich sei der Biman-Vorstand nicht bereit zum Airbus-Geschäft gewesen. Schließlich habe die Führungsetage auch mit Blick auf die Beziehungen zu Großbritannien und Frankreich doch zugestimmt. Zehn A350 und eine Partnerschaft Der Mitarbeiter wies daraufhin hin, dass auf die Fluggesellschaft, die bei den Jets bisher eine reine Boeing-Flotte betreibt, hohe Kosten für den Aufbau der Airbus-Flotte zukommen werden. Und der wird größer als nur die zwei A350-Frachter. Denn nun wurde bekannt, dass Biman Bangladesh zusätzlich acht Airbus-A350-Passagierjets erhalten soll. In Verbindung damit haben die Länder Bangladesch und Großbritannien eine Vereinbarung zu einer Luftfahrtpartnerschaft unterzeichnet. Sie sieht auch vor, dass der südasiatische Staat britische Kredite für den Kauf von Flugzeugen bei Airbus erhält. Aktuelle Flotte ist noch nicht alt Aktuell besteht die Flotte der Fluggesellschaft aus sechs Boeing 737-800, vier 777-300 ER, vier 787-8 und zwei 787-9 sowie vier Turboprops vom Typ De Havilland Canada Dash 8-400. Im Durchschnitt sind die 21 Flugzeuge nur knapp neun Jahre alt. Die sechs Dreamliner kommen sogar auf dein Durchschnittsalter von gut vier Jahren. Die beiden Airbus A350 F werden die ersten beiden reinen Frachtflieger der Airline. Die Zeitung The Daily Messenger kritisiert, dass Biman Bangladesh im Jahr 2022 sogar die Frachtkapazität ihrer Passagierflieger nur zu einem Bruchteil ausgenutzt habe. Zu wenig Crews, zu wenig Geld Außerdem würden viele der Flugzeuge aufgrund von mangelnden Cockpitcrews zu wenig genutzt und Langstreckenjets würden auf Kurzstrecken fliegen. Auch habe die Biman Schulden bei Kerosinlieferanten."
60448ca3-859f-4eb7-a8c6-9d0205ebdd23,2023-05-09 07:00:34+00:00,"Die Bundeswehr hat den ersten von 13 geschützten Verwundeten-Transport-Containern (GVTC) vom Hersteller Airbus Defence and Space (ADS) übernommen. Wie das Unternehmen mitgeteilt hat, dient dieser erste GVTC als Nachweismuster. Das bedeute, dass die Bundeswehr den Container auf Herz und Nieren testen und sein Sanitätspersonal darauf schulen und ausbilden werde. Nach positivem Ausgang des Leistungsnachweises und der Einsatzprüfung wird die integrierte Nachweisführung mit der Erklärung der Bereitschaft zur Übernahme durch die künftigen Nutzer/Betreiber abgeschlossen. Anschließend geht der GVTC in die Serienproduktion. Die zwölf Serien-GVTC sollen dann von 2024 bis 2026 an die Bundeswehr übergeben werden. Wie ADS schreibt, wurde der GVTC unter anderem mit den Partnerunternehmen Drehtainer GmbH und Binz Automotive entwickelt. Drehtainer liefert den Container mit integrierter Schutzausrüstung auf dem geforderten Level. Binz liefert die medizinischen Geräte und Ausrüstungsgegenstände für die Unterbringung und die (intensiv-)medizinische Betreuung der Verwundeten. Der GVTC basiert ADS zufolge auf dem internationalen ISO-Standard-20-Fuß-Container und wiegt nach früheren Angaben ca. 13,5 Tonnen. Mit rund sechs Metern Länge lasse er sich über ein integriertes Hakenabrollsystem problemlos auf vorhandene Bundeswehr-Lkw aufsetzen. Kräne oder andere Sondervorrichtungen werden nicht benötigt. Im GVTC können zwei Sanitätskräfte bis zu acht Patienten behandeln und beispielsweise ihre Vitalfunktionen und Sauerstoffsättigung überwachen, Defibrillationen durchführen oder Patienten über die integrierte Sauerstofferzeugungsanlage beatmen lassen. Seine Insassen und das Equipment an Bord seien im Container zudem vor chemischen Kampfstoffen, Beschuss und schweren Explosionen geschützt, so ADS weiter. Ein Stromerzeugungsaggregat ermögliche den autarken Betrieb über Stunden hinweg. Die Hochleistungs-Klimaanlage erlaube den Einsatz des GVTC auch unter extremen Klimabedingungen. Im geschützten Verwundeten-Transport-Container kann das Sanitätspersonal der Bundeswehr Verletzte sicher transportieren und medizinisch versorgen Im Juni 2021 hatte das BAAINBw die Lieferung der GVTC zum Stückpreis von ca. drei Millionen Euro in der Zeit von 2024 bis 2026 vereinbart (ESuT berichtete)."
873c864a-9b14-487b-a58a-7d6b67f1eb5f,2023-05-09 13:30:19+00:00,"Ryanair kauft gerne zu Krisenzeiten, wenn die Flugzeugbauer wenig andere Kundschaft haben. So kündigte der irische Billigflieger im Mai 2021 an, mindestens 100 Boeing 737 Max zu kaufen. Darunter befand sich erstmals auch die größte Variante Max 10. Anfang September 2021 erhöhte Ryanair den Druck, indem Chef Michael O’Leary Boeing einerseits in Aussicht stellte, noch deutlich mehr Jets zu kaufen. Und zwar bis zu 250 Exemplare, wenn der Preis stimme. Andererseits kokettierte er wie so oft in Verhandlungen mit einer möglichen Bestellung bei Airbus. Alles ohne unmittelbares Ergebnis. Denn kurz danach brach die Fluggesellschaft die Verhandlungen unter Verweis auf zu hohe Preise ab. 150 feste Orders, 150 Optionen Erst im März 2023 bestätigte O’Leary, dass die Verhandlungen mit Boeing wieder laufen. Und dieses Mal mit einem Ergebnis – einem großen: Ryanair bestellt bis zu 300 Boeing 737 Max 10, wie die Billigairline am Dienstag (9. Mai) mitteilt. Der Auftrag setzt sich zusammen einer festen Bestellung für 150 Jets sowie Optionen für 150 weitere Flugzeuge. Der angepeilte Lieferzeitraum ist 2027 bis 2033. Die Fluglinie stellt in Aussicht, mithilfe der Boeing 737 Max 10 bis zu 10.000 neue Jobs in Cockpit, der Kabine und Wartungshangars zu schaffen. Zudem will Ryanair ihre Passagierzahlen von 168 Millionen im Geschäftsjahr, das im März 2023 endete, steigern auf 300 Millionen im Geschäftsjahr, das im März 2034 endet. Herausforderung bei Turnaround-Zeit Sollte Ryanair alle Optionen nutzen, würde der Auftrag einen Wert von 40 Milliarden Dollar nach Listenpreisen erreichen. Allerdings gibt es bei großen Bestellungen stets hohe Rabatte. Bei einer Pressekonferenz zu der Bestellung sagte O’Leary, man habe den Preis dieses Mal nicht ganz so stark drücken können wie bei der vorherigen großen Bestellung. Die Hälfte der bestellten Flugzeuge soll alte Boeing 737-800 ablösen, die andere Hälfte wird die Flotte wachsen lassen. Ryanair wird die 737 Max 10 mit 228 Sitzen ausstatten. O’Leary erklärte, es werde eine Herausforderung, mit dieser Zahl von Fluggästen eine Turnaround-Zeit von 25 Minuten zu erreichen, wie man es bei den kleineren Fliegern schaffe. 189, 197 und jetzt 228 Sitze Damit dies funktioniere, werde man spezielle Trainingsprogramme für die Reisenden einrichten, damit diese lernen, schneller ein- und auszusteigen, scherzte der Ryanair-Chef. Mit Turnaround ist die Phase zwischen Ankunft und dem Start zum nächsten Flug gemeint."
9f4af9bf-dc0a-4cf8-820f-15b686fd8f3b,2023-05-10 05:00:00+00:00,"Startseite Lokales Hofgeismar Calden Gewerbepark Kassel Airport: Baubeginn in Calden wohl noch dieses Jahr Von: Daria Neu Vor einem halben Jahr fiel der Startschuss für den Bau des neuen Gewerbeparks Kassel Airport in Calden. Was ist seither passiert? Auf insgesamt 68 Hektar Fläche sollen sich langfristig große Logistikunternehmen, insbesondere flugbetriebsaffine Betriebe und Dienstleister ansiedeln und sowohl wirtschaftliches Wachstum als auch Arbeitsplätze ermöglichen – so weit der Plan des Projektteams, zu dem neben der Gemeinde Calden, der Stadt Kassel und dem Landkreis Kassel auch die Flughafen GmbH als Eigentümerin der Flächen und das Land Hessen als finanzieller Schirmherr gehören. Aber gibt es überhaupt schon Interessenten? Die Wirtschaftsförderung Region Kassel kümmert sich um die Standort- und Firmenbetreuung in der Stadt und im Landkreis Kassel. Laut Geschäftsführer Kai Lorenz Wittrock herrsche bereits ein reges Interesse bei zahlreichen Unternehmen, sowohl regional als auch überregional – und zwar auch hinsichtlich einer großflächigen Entwicklung. Namen könne er selbstverständlich noch nicht nennen. „Schon in diesem Jahr wäre ein Baubeginn auf der neuen Fläche möglich“, sagt Wittrock. Nach HNA-Informationen ist vor allem ein Unternehmen, das bereits in Calden sitzt und vor einigen Monaten die ZF Luftfahrttechnik übernommen hat, im Fokus: Airbus Helicopters. Es handelt sich um den größten Hersteller für kommerzielle Hubschrauber auf der Welt, der mittlerweile mit rund 750 Mitarbeitern im Kreis Kassel ansässig ist. Längst ist es kein Geheimnis mehr, dass das Projektteam großes Interesse daran hat, Airbus Helicopters auch im neuen Gewerbepark mitzudenken. Ob das Unternehmen selbst bereits mit diesem Gedanken liebäugelt, teilt Vark Helfritz, Geschäftsführer der Airbus Helicopters Technik GmbH mit: „Wir glauben an Calden. Uns gefällt der Standort sehr gut, wir wollen uns gerne in bestehende Strukturen einfügen und weiter wachsen.“ Aber: „Wir werden dies mit Bedacht tun und keine Schnellschüsse wagen.“ Helfritz betont: „Zunächst werden wir dabei erst einmal unsere eigene Infrastruktur und Flächen berücksichtigen. Fragen und Antworten zum Gewerbepark Kassel Airport Die Entwicklung von Gewerbeflächen ist eine große Herausforderung – vor allem mit Blick auf die knappe Ressource Boden und die damit verbundenen unterschiedlichen Erwartungen. Das findet jedenfalls Kai Lorenz Wittrock, Geschäftsführer der Wirtschaftsförderung Region Kassel, die sich um die Standort- und Firmenbetreuung in der Stadt und im Landkreis Kassel kümmert. Daher seien auch mit Blick auf die Entwicklung des neuen Gewerbeparks Kassel Airport viel Fingerspitzengefühl und sorgfältige Planung erforderlich. Dazu Fragen und Antworten. Warum ist der Gewerbepark für Unternehmen interessant? Nordhessenweit verfügen laut Wittrock nur noch der Landkreis und die Stadt Kassel über nennenswerte Gewerbeflächen und Großflächen. Allein das sorge für Interesse bei potenziellen Partnern. Neben dem Gewerbepark Kassel Airport denke er dabei unter anderem an den Sandershäuser Berg, den Gewerbepark Kassel-Niederzwehren und das Gewerbegebiet Hiddeser Feld. „Wir haben eine recht starke Wachstumsphase in der Region Kassel“, sagt der Geschäftsführer. Das bereits bestehende luftfahrtaffine Geschäft in Calden bilde seinen Alleinstellungscharakter. „Der Standort Calden ist ein europäischer Champion im Bereich Wartung.“ Das zeige sich zum Beispiel durch Airbus Helicopters. Die Firma habe allein 2022 etwa 100 neue Stellen geschaffen. Und auch sonst seien die Unternehmen auf Wachstumskurs. Welche Unternehmen sind bei der Neuansiedlung besonders im Fokus? Sowohl mit kleinen als auch großen Firmen führe die Wirtschaftsförderung Gespräche. Diese können aus dem näheren Umfeld, aber auch aus anderen Regionen kommen. Vor allem für luftfahrtaffine Unternehmen sei eine Ansiedlung im Gewerbepark äußerst attraktiv. Konkret könne aber noch keine Firma benannt werden. Welche Rolle spielt Airbus Helicopters mit Blick auf den neuen Gewerbepark? Airbus Helicopters ist eine der drei Divisionen im Airbus-Konzern neben Airbus Commercial und Airbus Defence and Space. Der Hersteller von Hubschraubern und Flugzeugbauteilen ist auf der ganzen Welt vertreten. Im Rahmen eines Ausschreibungsverfahrens hat Airbus Anfang des Jahres die ZF Luftfahrttechnik GmbH in Calden übernommen. Zuvor war Airbus schon mit Hubschrauberwartungsarbeiten in Calden tätig. Laut Geschäftsführer Vark Helfritz sei die Übernahme ein wichtiger Schritt für die Belegschaft am Standort gewesen, der ihnen Sicherheit mit Blick auf ihren Arbeitsplatz gegeben habe. Das Unternehmen wolle wachsen. Calden sei ein starker Kompetenzstandort, den es zu erhalten gelte. Airbus Helicopters arbeitet sowohl für den zivilen als auch für den militärischen Bereich. Aber? Das Unternehmen stehe in Calden nun ganz am Anfang. Helfritz betont: „Wir wollen uns nicht zu schnell und zu stark – und damit möglicherweise falsch – einbringen.“ Es müsse alles Schritt für Schritt entschieden und gut abgewogen werden. „Wir müssen den regulatorischen Rahmenbedingungen in der Luftfahrtindustrie folgen, sowie allen anderen gesetzlichen Vorgaben“, sagt Helfritz. „Wir haben zu diesem Zeitpunkt noch keine endgültigen neuen Konzepte in der Schublade.“ Sicher sei, dass man Calden sehr schätze. „Hier haben wir eine gute Anbindung mit eigenem Hubschrauberlandeplatz“, sagt Helfritz. „Und das in der Mitte Deutschlands.“ Der erste große Standort von Airbus Helicopters ist in Donauwörth, der zweite nun in Calden. Welche Firmen gibt es bereits rund um den neuen Gewerbepark Kassel Airport? Folgende Unternehmen sind unter anderem bereits am Flughafen angesiedelt; aus dem luftfahrtaffinen Bereich: Airbus Helicopters Technik GmbH (Hubschrauberwartung und -getriebebau), Air Lloyd Aerotechnics GmbH (Hubschrauberwartung), Piper Deutschland AG (Flugzeugverkauf und -wartung, Ersatzteile), Gadringer-Gurte GmbH (Herstellung und Instandhaltung von Anschnallgurten für die Luftfahrt). Weitere Betriebe sind: mba Automation GmbH (Sondermaschinenbau, Palettentechnik), Denk GmbH & Co. KG (Werkzeuge, Maschinen), Jost-Werke Deutschland GmbH (Achsen Systeme) und Terracamper GmbH (Camper Sonderanfertigungsbau)."
63db0069-689f-45e2-afda-3622654f6139,2023-05-10 15:19:14+00:00,"Einer von zwei Antrieben des Airbus A320neo ist störanfälliger als versprochen – besonders unter den klimatischen Bedingungen in Indien. Alles aus der Welt der Technik Ein Beitrag von: Peter Odrich Peter Odrich studierte Betriebswirtschaftslehre mit Schwerpunkt Verkehrsbetriebe. Nach 28 Jahren als Wirtschaftsredakteur einer deutschen überregionalen Tageszeitung mit langer Tätigkeit in Ostasien kehrte er ins heimatliche Grossbritannien zurück. Seitdem berichtet er freiberuflich für Zeitungen und Technische Informationsdienste in verschiedenen Ländern. Dabei stehen Verkehrsthemen, Metalle und ostasiatische Themen im Vordergrund. News-Alert: VDI nachrichten digital Alles, was Sie wissen müssen - der Blick auf die wichtigsten VDI nachrichten-Beiträge aus der Welt der Technik. Jeden Dienstag kostenfrei in Ihrem Postfach. Jetzt anmelden Stellenangebote NORDEX GROUP SCADA Projektingenieur (m/w/d) Hamburg, Rostock Bundesamt für Bauwesen und Raumordnung (BBR) Ingenieurinnen / Ingenieure (w/m/d) für Versorgungstechnik bzw. Gebäudeautomation Berlin Maschinenfabrik Herkules Meuselwitz GmbH CE-Koordinator (m/w/d) in der mechanischen Konstruktion Meuselwitz IU Internationale Hochschule GmbH Professur Bauingenieurwesen im Dualen Studium (m/w/d) Münster IU Internationale Hochschule GmbH Professur Bauingenieurwesen im Dualen Studium (m/w/d) Hamburg IU Internationale Hochschule GmbH Professur Bauingenieurwesen im Dualen Studium (m/w/d) Leipzig IU Internationale Hochschule GmbH Professur Bauingenieurwesen im Dualen Studium (m/w/d) Stuttgart IU Internationale Hochschule GmbH Professur Bauingenieurwesen im Dualen Studium (m/w/d) Frankfurt am Main IU Internationale Hochschule GmbH Professur Bauingenieurwesen im Dualen Studium (m/w/d) Hannover Technische Hochschule Mittelhessen W2-Professur mit dem Fachgebiet Veranstaltungswirtschaft mit den Schwerpunkten BWL und technisches Informationsmanagement Gießen Zur Jobbörse Das könnte Sie auch interessieren Empfehlungen des Verlags"
985abf2c-a4fc-4a90-9096-c175ddf10d97,2023-05-10 17:00:00+00:00,"Bereits seit 20 Jahren arbeiten die deutsche Luftwaffe und Airbus Defence and Space in Manching zusammen. Eine einst undenkbare, heute nicht mehr wegzudenkende Kooperation zwischen Militär und Industrie. Oder auch: Eine ""erfolgreiche Zweckehe"", wie sie der Kommandeur des Waffensystemunterstützungszentrums, Oberst Christian Lörch, bei der Jubiläumsfeier nannte. Hochrangige Vertreter beider Seiten hatten sich aus gegebenem Anlass am Montag im Jet-Hangar auf dem Airbus-Firmengelände versammelt."
d8669b4e-9380-44dc-9d18-2f7ff7fedcb2,2023-05-10 17:22:11+00:00,"Philippine Airlines hat mit Airbus ein Memorandum of Understanding (MoU) über den Kauf von neun A350-1000 unterzeichnet. unter dem Im Rahmen des Ultra Long Haul Fleet-Projekts der philippinischen Fluggesellschaft wird die A350-1000 auf Direktflügen von Manila nach Nordamerika, einschließlich der Ostküste der USA und Kanadas, eingesetzt. Das neue Flugzeug wird zwei A350-900 ergänzen, die bereits bei der Fluggesellschaft im Einsatz sind und derzeit Ziele in Nordamerika, Asien und Australien anfliegen. Wie die A350-900 werden auch die PAL A350-1000 in einem Premium-Layout mit separaten Business Class-, Premium Economy- und Economy Class-Kabinen konfiguriert. Siehe auch: In Echtzeit: Der letzte Airbus mit TAM-Bemalung hebt in die Wüste ab Eine weitere Stadt im Landesinneren von São Paulo wird nun mit der Boeing 737 von GOL angeflogen SAAB liefert offiziell zwei neue F-39 Gripen-Jäger an die FAB Kapitän Stanley K. Ng, Präsident und Chief Operating Officer von Philippine Airlines, sagte, die Reichweite der A350-1000 würde es der Fluggesellschaft ermöglichen, das ganze Jahr über transpazifische und transpolare Strecken nonstop in beide Richtungen zu fliegen. Dazu gehören einige der längsten kommerziellen Flüge der Welt, wie die, die die Philippinen mit New York und Toronto verbinden. Mit einer erweiterten Airbus A350-Flotte wird PAL wieder eine direkte Verbindung von den Philippinen nach Europa anbieten können. „Die A350-1000 kombiniert eine größere Reichweite mit der erhöhten Kapazität, die wir benötigen, um die zukünftige Nachfrage zu decken. Es ist das perfekte Flugzeug, mit dem PAL seine Expansionspläne nachhaltig erfüllen kann, und bietet den Passagieren höchsten Komfort an Bord. Wir sind bestrebt, unseren Passagieren das bestmögliche Reiseerlebnis zu bieten, und diese hochmodernen Flugzeuge werden es uns ermöglichen, genau das zu tun, während wir unsere Mission erfüllen, die Welt zu verbinden und Handel und Tourismus zu steigern.“ Christian Scherer, Commercial Director von Airbus, sagte: „Der A350 bringt die Passagiere weiter und mit mehr Komfort, bringt eine radikale Änderung der Treibstoffeffizienz und einen unmittelbaren erheblichen Beitrag zur Emissionsreduzierung.“ Dies sind die Eigenschaften, die den A350 zur Wahl der weltweit führenden Fluggesellschaften gemacht haben. Wir freuen uns auf die enge Zusammenarbeit mit unserem langjährigen Kunden Philippine Airlines, der sein Programm zur Modernisierung seiner Langstreckenflotte vorantreibt.“ Der Airbus A350 ist das modernste und effizienteste Großraumflugzeug und setzt neue Maßstäbe für interkontinentale Reisen. Es bietet die größte Reichweite aller derzeit produzierten Verkehrsflugzeuge und ist in der Lage, 8.700 Seemeilen oder 16.100 Kilometer nonstop zu fliegen. Ende April 2023 hatte die A350-Familie 928 Festbestellungen von 54 Kunden weltweit erhalten und ist damit eines der erfolgreichsten Großraumflugzeuge aller Zeiten. Rund 530 Flugzeuge befinden sich derzeit in den Flotten von 40 Fluggesellschaften, die hauptsächlich auf der Langstrecke fliegen."
