be0edbeb-4d6a-42e1-be74-d0cdd2e2592a,2023-08-01 09:03:03+00:00,"Im Herbst 2022 überraschte die estnische Wet-Lease-Anbieterin Nordica mit Stellenausschreibungen in Deutschland. Gesucht wurden Cockpit- und Kabinencrews für Jets der Airbus-A320-Familie in Hamburg und München. Für wen man im Einsatz sein wird, wollte die Airline, die zur staatlichen estnischen Nordic Aviation Group gehört, damals nicht verraten. Kurze Zeit später wurde aber bekannt, dass Nordica für die neu gegründete Condor-Schwester Marabu Personal suchte. Denn die Esten unterstützten die neue Airline vom Start an mit Airbus A320 Neo im Wet-Lease. Dank der Zusammenarbeit konnte Marabu schneller starten, als wenn sie ganz alleine den Flugbetrieb hätte aufbauen müssen. Knapp 7,2 Millionen Verlust Marabu ist aber nicht die einzige Kundin von Nordica, wie sich die Gruppe selbst abgekürzt nennt. Die Flotte der Nordic Aviation Group besteht aus 21 Flugzeugen, aufgeteilt auf ATR 72-600, CRJ 900 und Airbus A320. Betrieben werden sie von zwei verschiedenen Töchtern: Nordica und Xfly. Das Luftfahrtunternehmen fliegt unter anderem auch im Wet-Lease für SAS. Jetzt hat die Nordic Aviation Group mitgeteilt, sich in einer finanziellen Schieflage zu befinden. Nach vorläufigen Angaben hat das Unternehmen in den ersten sechs Monaten des Jahres einen Verlust von 7,2 Millionen Euro eingefahren. Der Umsatz lag bei 54,9 Millionen Euro. Fehlende Flieger und zu optimistische Strategie Grund für die Probleme sei zum einen, dass die Kosten die Einnahmen deutlich überstiegen, erklärt David O’Brock, Aufsichtsratsvorsitzender der Nordic Aviation Group. Hinzu komme auch der aktuell sehr schwierige Luftfahrtmarkt. Es fehle an Flugzeugen und passendem Personal, so das Unternehmen in einer Pressemeldung. Nach Ansicht von O’Brock ist ein weiterer Grund für den Engpass die Expansionsstrategie, die Nordica Ende des vergangenen Jahres beschlossen hatte. Diese sei zu optimistisch gewesen und habe sich negativ auf die finanzielle Situation des Unternehmens ausgewirkt. Neues Spitzenpersonal Helfen soll nun ein Sanierungsprozess, für den das Luftfahrtberatungsunternehmen Knighthood Global engagiert wurde. Viel Zeit lassen die Esten der Consultingfirma nicht. «Wir erwarten greifbare Ergebnisse, einschließlich eines konstant positiven Cashflows, bereits in den kommenden Monaten», erklärt David O’Brock. Erste personelle Konsequenzen hat es schon gegeben. Jan Palmér, Geschäftsführer der Nordic Aviation Group hat in der vergangenen Woche seinen Rücktritt eingereicht. Eigentlich wollte der 72-jährige seinen Posten erst zum Jahresende abgeben. Neuer Interimschef ist Remco Althuis, Leiter des Beratungsteams. Althuis war zuvor in leitenden Positionen bei KLM, Etihad Airways und Air Seychelles tätig. Marabu nicht betroffen Ein Marabu-Sprecher teilte auf Anfrage von aeroTELEGRAPH mit, dass man durch die finanzielle Schieflage von Nordica keine Auswirkungen auf Marabu erwarte."
d40dd7c5-e605-4920-8b68-d3b0fba104ae,2023-08-01 10:31:00+00:00,"Der Tarnkappenbomber F-35 wird künftig zu einem Teil in Nordrhein-Westfalen gefertigt, ab 2025 will Rheinmetall Rumpfmittelteile für den Kampfjet produzieren. Heute ist der Spatenstich. Am Dienstag hat der symbolische erste Spatenstich für die neue Rheinmetall-Fabrik in Weeze stattgefunden. Nordrhein-Westfalen hatte sich im Rennen um den Standort-Zuschlag durchgesetzt. Sachsen, Niedersachsen und Brandenburg gingen leer aus. Bei dem symbolischen ersten Spatenstich war NRW-Ministerpräsident Hendrik Wüst (CDU) dabei. Wüst betonte die Dringlichkeit von Militärgüter-Investitionen, damit die Bundeswehr stark sei und mit der besten Ausrüstung die Freiheit und Demokratie verteidigen könne. Die Standortentscheidung für NRW sei eine gute Nachricht. „Hier wird eine hochmoderne Fabrik gebaut, die über Jahrzehnte gute Arbeitsplätze sichern wird.“ Bis zu 450 neue Arbeitsplätze wird die Fabrik bieten. Andere Bauteile kommen von anderen Unternehmen. Bei Zulieferern könnten weitere 1500 Arbeitsplätze im Umfeld der Fabrik entstehen. Rheinmetall will ab 2025 in Weeze am Niederrhein in NRW sogenannte Rumpfmittelteile für mindestens 400 Tarnkappenbomber fertigen, 35 davon für Deutschland. Die Auslieferung soll 2026 beginnen. „Die Beteiligung von Rheinmetall an dem prestigeträchtigen Projekt ist eine gute Nachricht für Deutschland“, erklärte der Hauptgeschäftsführer des Bundesverbandes der Deutschen Sicherheits- und Verteidigungsindustrie (BDSV), Hans Christoph Atzpodien. Fast eineinhalb Jahre nach Beginn des Ukraine-Krieges investiert damit erstmals ein deutsches Rüstungsunternehmen in eine neue Fabrik, um dort einen Auftrag aus dem 100 Milliarden Euro schweren Sondervermögen der Bundeswehr abzuarbeiten. Rheinmetall ist Partner des US-Konzerns Lockheed Martin, der zusammen mit dem ebenfalls amerikanischen Unternehmen Northrop Grumman den Tarnkappenbomber F-35 fertigt. Der deutsche Wertschöpfungsanteil an dem Milliardenvorhaben ist allerdings eher gering. Deutschland zahlt 8,3 Milliarden Euro für 35 der Tarnkappenbomber, die zum Transport von Atombomben zertifiziert und somit Teil der sogenannten nuklearen Teilhabe sind. Wie viel Rheinmetall bekommt, ist unklar, es dürfte aber ein eher kleiner Teil sein. Rheinmetall: Kampfjet-Bauteile werden in Weeze gefertigt Die F-35 gilt als modernstes Kampfflugzeug der Welt. Sie wird auch für das nukleare Abschreckungskonzept der Nato gekauft, bei dem Verbündete Zugriff auf US-Atombomben haben. Der in die Jahre gekommene Tornado wird abgelöst. Wegen seiner Form und Außenbeschichtung ist die Maschine für gegnerisches Radar nur schwer zu entdecken. 2026 soll Deutschland die ersten F-35 bekommen. Deutsche Piloten werden damit zunächst in den USA trainieren. Ab 2027 sollen die Maschinen dann am Fliegerhorst Büchel in der Eifel stationiert werden. Aus Sicht von Klaus-Heiner Röhl vom Institut der deutschen Wirtschaft (IW) ist es durchaus bemerkenswert, dass der Auftrag für das Bauteil an Rheinmetall ging. „Es sollen Rumpfmitteilteile für 400 F-35 hergestellt werden, von denen Deutschland nur 35 bestellt hat“, sagte der Branchenkenner. Bei einem so kleinen Anteil wäre es auch denkbar gewesen, dass eine Firma eines anderen Nato-Staates zum Zuge kommt. Rheinmetall sei zugute gekommen, dass es bei anderen Rüstungsvorhaben schon seit langem Partner von US-Firmen sei. Airbus war auch an Auftrag für Kampfjet-Bauteile interessiert „Es wäre wünschenswert gewesen, wenn mehr deutsche Firmen bei dem Auftrag zum Zuge kommen würden und zum Beispiel bei der Wartung und anderen Dienstleistungen hinzugezogen werden.“ Der Flugzeugbauer Airbus hatte den Auftrag für die Rumpfmittelteile ebenfalls im Auge, dann aber Abstand davon genommen. Die Entscheidung gegen die Kooperation mit den Amerikanern für den Bau von F-35-Rumpfmittelteilen habe Airbus aus wirtschaftlichen Gründen getroffen, so ein Airbus-Sprecher. „Für uns hat sich daraus nach Prüfung der Fakten und Zahlen kein „Business Case“ ergeben.“ Spatenstich für Rheinmetall-Fabrik: Auftakt für weitere Investitionen? Es sieht allerdings nicht danach aus, als ob der Spatenstich in Weeze der Auftakt für weitere Investitionen in neue Standorte der deutschen Rüstungsbranche ist. Es seien noch immer keine Aufträge für den größten Teil des 100-Milliarden-Euro-Sondervermögens erteilt worden, die Firmen haben also noch keine Planungssicherheit. Die meisten Aufträge etwa für Munition könnten außerdem mit bereits bestehenden Produktionskapazitäten gestemmt werden, so der Branchenexperte Röhl. 100 Milliarden Euro klinge zwar nach viel, angesichts des immensen Bedarfs der jahrzehntelang kurzgehaltenen Bundeswehr sei es aber nicht ausreichend. Deutschlands Rüstungsbranche könne sich nicht gewiss sein, ob der Staat auch auf lange Sicht mehr Geld in die Verteidigung investiert und dadurch der Betrieb von Produktionsstandorten dauerhaft profitabel sei. „Aus der Politik kommen bisher keine Signale, den regulären Haushalt wesentlich aufzustocken.“ Aus diesem Grund seien deutsche Rüstungsfirmen eher zurückhaltend bezüglich Investitionen, erklärte Röhl. dpa/bani"
e98d6f30-f13b-4c1c-8701-e86f826a93e0,2023-08-02 11:03:20+00:00,"Die Internationale Raumstation ist in die Jahre gekommen, spätestens im Jahr 2030 will die amerikanische Weltraumagentur NASA die ISS ausmustern. Die Nachfolge soll eine privatwirtschaftlich betriebene Station antreten, dafür hatte die NASA Ende 2021 drei Unternehmenskonsortien mit der Konzeptentwicklung beauftragt, ein weiteres kam später hinzu. In eines dieser Konsortien kauft sich Airbus nun ein, die Europäer gründen dafür ein Gemeinschaftsunternehmen mit Voyager Space aus Denver, an dem sie eine Minderheitsbeteiligung halten werden. Das Unternehmen will die Raumstation mit dem Namen Starlab nicht nur bauen, sondern auch betreiben."
5de41f69-6104-4a67-9807-e10062849c2d,2023-08-02 11:52:03+00:00,"Die Internationale Raumstation (ISS) ist das wohl teuerste Einzelobjekt der Menschheitsgeschichte – und sie ist ein Auslaufmodell. Gegen Ende des Jahrzehnts, der genaue Zeitpunkt ist noch unklar, soll der Außenposten der Menschheit im All in Einzelteilen zum Absturz gebracht werden . Bereits jetzt laufen Planungen für die Zeit danach. Mehrere Unternehmen, allen voran die US-Firmen Axiom und Blue Origin haben mit Partnern bereits Ideen für kleinere kommerzielle Raumstationen präsentiert. Das sind große Worte. Ob Taten folgen, und wenn ja, wie schnell, wird sich zeigen. Beide Firmen hatten bereits im Januar eine Zusammenarbeit verkündet. Damals stand das Jahr 2028 als Starttermin für die geplante Station im Raum. In einer Ankündigung der US-Weltraumbehörde Nasa war zuvor sogar von 2027 die Rede gewesen. Davon ist nun aber nichts mehr zu hören. Das Weltraumgeschäft ist langwierig und kapitalintensiv, nur ein Bruchteil aller angekündigten Projekte werden umgesetzt. Andererseits ist das aktuelle Vorhaben wohl doch mehr als eine reine PR-Ankündigung. Das hat mit der Nasa zu tun. Die US-Weltraumbehörde hat vor rund anderthalb Jahren über das Teilunternehmen Nanoracks 160 Millionen Dollar in das Projekt investiert. Damals hatten auch die Firmen Blue Origin und Northrop Grumman Förderung in vergleichbarer Höhe erhalten, wenngleich etwas weniger als Nanoracks. Interessant für Europas Astronauten Das Ziel der Nasa: Nach dem Transport von Fracht und Astronauten zur bisherigen Raumstation will sie den Bau und Betrieb eines – deutlich kleineren – Nachfolgers im niedrigen Erdorbit privaten Firmen überlassen. Die Raumfahrtbehörde selbst will sich vor allem um ihr Mondprogramm »Artemis« kümmern, für das sie ebenfalls mit Privatunternehmen wie SpaceX zusammenarbeitet – und später dann womöglich auch um Flüge zu weiter entfernten Zielen wie dem Mars. Die Nasa-Anschubfinanzierung garantiert nicht, dass »Starlab« tatsächlich fliegen wird. Aber sie ist ein Indiz dafür, dass die US-Weltraumbehörde das Projekt ernst nimmt. Bei Airbus und Voyager heißt es, für die »Starlab«-Planungen habe man kürzlich die sogenannte Überprüfung der Systemanforderungen (SRR) absolviert. Dabei seien die Missions- und Sicherheitsanforderungen der Nasa erfolgreich berücksichtigt worden. Sollte das »Starlab« tatsächlich eines Tages im All sein, wäre die Station auf jeden Fall deutlich simpler als die ISS. Gleichzeitig soll nach Firmenangaben dieselbe Nutzlastkapazität für Experimente bereitstehen. Die Station soll, so Voyager, dauerhaft mit Menschen besetzt sein. Sie könnte auch ein mögliches Ziel für die Flüge europäischer Astronauten darstellen. Das »Artemis«-Programmes bietet der Esa zwar auch Fluggelegenheiten zum Mond. Doch um das Europäische Astronautenkorps auch nur einigermaßen auszulasten, werden weitere Flugdestinationen und -möglichkeiten nötig sein."
5a687b47-8d2c-49be-89f2-29b6550b6cb9,2023-08-02 12:01:32+00:00,"Der Airbus-Konzern ist ein transatlantisches Joint Venture mit dem US-Unternehmen Voyager Space eingegangen, um sich am Bau der nächsten Raumstation zu beteiligen. Die amerikanische Raumfahrtbehörde Nasa möchte sie Ende des Jahrzehnts als Ersatz für die dann rund 30 Jahre alte ISS im Erdorbit platzieren. Und sie will dies kommerzialisieren, ähnlich wie bereits den Astronauten- und Frachtransport zur ISS, der vor allem von Elon Musks Firma Space-X bedient wird. Die Nasa hatte für die ISS-Nachfolge Konzeptaufträge im Gesamtwert von rund 415 Millionen Dollar an die Nanoracks-Gruppe, zu der Voyager Space gehört, sowie Blue Origin und Northrop Grumman vergeben, allesamt US-Firmen. Die von Voyager Space geplante Raumstation Starlab soll nach Unternehmensangaben die erste kommerzielle Raumstation mit permanenter Besatzung werden. Sie soll sicherstellen, dass die Nasa weiterhin im niedrigen Erdorbit präsent ist, sie soll aber auch der europäischen Raumfahrtagentur Esa Arbeitsplätze für Astronauten bieten. Starlab soll etwa das halbe Volumen der ISS haben, aber Kapazitäten für ähnlich viele wissenschaftliche Experimente bieten. Bei etwa 70 Astronauten-Expeditionen wurden auf der ISS Tausende Versuche in der Schwerelosigkeit gemacht. Das Joint Venture will die neue Raumstation spätestens 2028 in die Erdumlaufbahn bringen, mit welcher Trägerrakete, ist aber noch unklar. Eigentlich wollte Voyager Space mit dem US-Konzern Lockheed Martin eine aufblasbare Station entwickeln, hat sich dann aber wegen der Kapazitäten doch für eine feste Struktur entschieden. Hier kommt nun Airbus ins Spiel, das unlängst auch das Raumstationskonzept Loop entwickelt hat. ""Ziel ist es, Starlab zu entwickeln, zu bauen und zu betreiben, um die ISS abzulösen"", sagte Airbus-Chef Michael Schöllhorn bei einer Telefonkonferenz. Starlab solle ""Wissenschaftlern und Forschern ein Zuhause bieten"". Dies nicht auf institutioneller Basis wie die ISS, sondern auf kommerzieller Grundlage. In Europa sollen Esa, nationale Raumfahrtagenturen und Industrie profitieren. ""Der Schwerpunkt liegt in Bremen"", sagte Schöllhorn zur europäischen Beteiligung. Es gehe nun darum, zu beweisen, dass es einen Markt für Weltraumforschung gibt Neben Airbus liefern auch US-Firmen Komponenten zu, doch ""Airbus ist unser wichtigster industrieller Partner"", sagte Voyager-Space-Chef Dylan Taylor. ""Airbus ist führend bei Weltraumhabitaten und Forschungshardware."" Mit Starlab wolle man vor allem Möglichkeiten für Forschung und Industrie im Orbit bieten. Er sprach von einem historischen Meilenstein, ""da wir definitiv in die Ära der kommerziellen Raumstationen eintreten"". Es gehe nun darum, zu beweisen, dass es einen Markt für Weltraumforschung gibt. Schwerpunkt solle zunächst die Kooperation mit Raumfahrtagenturen werden. Bei entsprechender Nachfrage könne er sich weitere Starlabs für andere Kunden vorstellen. Taylor nimmt an, dass die Nasa zwei Anbieter auswählen wird. Dabei werde der internationale Ansatz von Voyager Space ein Vorteil sein - dies sei der Schlüsselfaktor für den Erfolg der ISS. Er deutete an, das Projekt auch umsetzen zu wollen, sollte Voyager Space leer ausgehen. ""Nimmt man nur das kommerzielle Geschäft, das auf der ISS abgewickelt wird, so reicht das für eine Raumstation"", sagte er. Der Bedarf werde in den 2030er-Jahren steigen und reiche für ""mehrere kommerzielle Raumstationen"". Airbus-Chef Schöllhorn ergänzte, dass dies auch durch sinkende Preise und Militäraufträge begünstigt werde. Über Details zu Kooperation und Finanzierung wollten sich die Partner noch nicht äußern."
b655342a-bcaf-4bdb-8c5d-3df7571cbf6c,2023-08-03 06:31:00+00:00,"Startseite Wirtschaft Mega-Projekt für Rheinmetall: Rüstungsriese baut „Herzstück“ für Tarnkappenbomber Von: Patrick Freiwah In NRW entsteht eine Produktionsstätte mit enormer „verteidigungspolitischer Dimension“. Rheinmetall ist am Bau der modernen Kampfjet-Generation F-35A Lightning II beteiligt. Weeze/München - Mit einem symbolischen Spatenstich hat der Fabrikbau von Rheinmetall in Weeze (Nordrhein-Westfalen) begonnen. Der deutsche Rüstungsriese zieht auf dem Flughafengelände in Weeze (Kreis Kleve) eine Produktionsstätte für das Kampfflugzeug F-35 hoch, für die Fertigung der Generation F-35A Lightning II. Es handelt sich dabei nicht um das komplette Flugzeug, stattdessen wird mit der Rumpfmitte „das Herzstück“ hergestellt, erklärte Ingo Gerhartz, Chef der deutschen Luftwaffe, bei der Veranstaltung neben dem Regionalflughafen unweit der Grenze zu den Niederlanden. Bereits ab 2025 soll dort die Produktion des Gemeinschaftsprojekts beginnen. In der Rheinmetall-Fabrik werden den Plänen zufolge in Zusammenarbeit mit den US-Rüstungsfirmen Northrop Grumman und Lockheed Martin mindestens 400 F-35-Rumpfmittelteile hergestellt. Rheinmetall beteiligt sich an Produktion für neue Kampfjet-Generation F-35 Die F-35 gilt als modernstes Kampfflugzeug der Welt. Hersteller ist Lockheed Martin, Northrop Grumman einer der Hauptpartner, der bestimmte Bauteile wie Tragflächen und Sensorsysteme liefert. Rheinmetall wird in der hochmodernen NRW-Fabrik die mittlere Komponente des Jets produzieren. Weitere Länder sind an der Entstehung des Hightech-Flugzeugs beteiligt. Der hintere Teil kommt aus Italien von Leonardo. Die Endmontage der F-35A erfolgt in den Vereinigten Staaten, Italien und auch Japan. Bislang wurden die Rumpfmittelteile der F-35 ausschließlich von Northrop Grumman produziert. Bald kommt mit Rheinmetall ein weiteres Unternehmen hinzu, dessen Expertise in Sachen Luftfahrttechnik laut Deutscher Presse-Agentur (dpa) bislang wenig ausgeprägt ist. Hans Christoph Atzpodien vom Bundesverband der Deutschen Sicherheits- und Verteidigungsindustrie (BDSV) sei die Beteiligung von Rheinmetall an dem Projekt der westlichen Bündnispartner „eine gute Nachricht für Deutschland“, jedoch sei der hiesige Wertschöpfungsanteil an dem milliardenschweren Vorhaben „eher gering“. Rheinmetall profitiert von Sondervermögen - eine Menge Geld fließt jedoch in die USA Die finanzielle Dimension des Fabrikneubaus ist gewaltig: Rheinmetall investiert nach eigenen Angaben über 100 Millionen Euro, um eine Produktionsstätte auf dem neuesten Stand der Technik zu realisieren. Es ist das erste Mal, dass eine Produktionsstätte dank eines Auftrags aus dem 100 Milliarden Euro schweren Sondervermögen durch den Bund gebaut wird. Allerdings droht ein großer Teil der Investitionen an US-Firmen abzufließen, statt die heimische Industrie zu stärken. Ende 2022 gab das Bundesverteidigungsministerium bekannt, dass aus dem Finanztopf 35 Tarnkappenbomber F-35 für 8,3 Milliarden Euro bestellt werden. Als Baupartner war auch Rivale Airbus im Gespräch, mangels Wirtschaftlichkeit hat der Konzern angeblich abgewunken. Schließlich entfiel der Zuschlag dann auf Rheinmetall. Dessen Chef Armin Papperger erklärte: „Wir schaffen einen neuen Nukleus in der Luft- und Raumfahrttechnologie in Nordrhein-Westfalen“. Fakten zum „Tarnkappenbomber“ F-35: Gilt als modernster Kampfjet der Welt. Apps versorgen Piloten fortlaufend mit Analysen. In die Helme wird ein 360-Grad-Rundumblick projeziert. Außenbeschichtung soll die F-35 auf Radarschirmem beinahe unsichtbar machen. Höchstgeschwindigkeit 1,6 Mach: bis zu 1930 km/h schnell. Neue Rheinmetall-Fabrik in NRW: Kampfjet F-35 ersetzt Tornado der Bundeswehr NRW-Ministerpräsident Hendrik Wüst (CDU) erklärte bei der Zeremonie, angesichts geopolitischer Veränderungen habe das neue Werk „nicht nur eine wirtschaftliche, sondern auch eine verteidigungspolitische Dimension“. Die Entscheidung für den Standort NRW war nach der Prüfung einer Reihe von Optionen in mehreren Bundesländern getroffen worden, auch Sachsen und Brandenburg hatten sich beworben. Die Produktionsfläche soll sich über knapp 60.000 Quadratmeter erstrecken. Bei Rheinmetall sollen etwa 450 Jobs entstehen, im Umfeld der Zulieferer wird vom Rüstungskonzern mit 1500 weiteren Arbeitsplätzen gerechnet. Warum die Produktion von neuen F-35-Kampfjets gerade jetzt Hochlauf erhält: Die in die Jahre gekommenen Tornado-Kampfjets der Bundeswehr werden durch die neu entwickelten Tarnkappenbomber ersetzt. Die ersten acht Modelle F-35A Lightning II soll die Bundeswehr im Jahr 2026 bekommen. Auch vor dem Hintergrund des Ukraine-Kriegs kommt den Maschinen aufgrund der „nuklearen Teilhabe“ eine bedeutende Rolle: Im Ernstfall werden die Flugzeuge Atombomben der USA transportieren. (PF mit Material von dpa/afp)"
70405857-6a02-439a-988a-89d7be7d7b90,2023-08-03 06:40:35+00:00,"Voyager Space und Airbus Defence and Space wollen ein Gemeinschaftsunternehmen zum Bau und Betrieb der kommerziellen Raumstation Starlab gründen. Das kündigten die beiden Unternehmen am Mittwoch an. Es ist der nächste Schritt in der Zusammenarbeit: Im Januar hatte Airbus mitgeteilt, technische Designunterstützung und Expertise für Starlab bereitzustellen. Voyager erhielt im Dezember 2021 über Nanoracks (Teilunternehmen der Voyager Space Company) von der NASA einen Auftrag im Wert von 160 Millionen US-Dollar zur Entwicklung einer privaten Raumstation im niedrigen Erdorbit. Bislang ermöglicht die ISS internationale Forschung in der Mikrogravitation. Sie wird wahrscheinlich noch bis 2028 von den USA, Russland, Europa, Kanada und Japan betrieben. Als Nachfolge setzt die NASA auf ein Modell, in dem sie und andere Raumfahrtagenturen diese Forschungsmöglichkeiten als Dienstleistung von Unternehmen einkaufen. Auch Blue Origin und Northrop Grumman erhielten NASA-Gelder zur Entwicklung von privaten Raumstationen. ""Die Internationale Raumstation gilt in der Geschichte weithin als die erfolgreichste Plattform für globale Zusammenarbeit, und wir wollen mit Starlab auf diesem Erbe aufbauen. Wir gründen dieses Joint Venture, um die Nachfrage der globalen Raumfahrtagenturen zuverlässig zu bedienen und gleichzeitig neue Möglichkeiten für kommerzielle Nutzer zu eröffnen"", so Matthew Kuta, President von Voyager Space. Standort in Europa geplant Die Raumstation, die ein Labor, Gemeinschaftsbereiche, Crew-Suiten, einen Roboterarm und ein Energie- und Antriebsmodul umfasst, soll dauerhaft bemannt sein, ursprünglich geplant waren vier Astronauten. Airbus hat im April allerdings Entwürfe für ein Modul vorgestellt, das Platz für bis zu acht Astronauten bietet. Starlab soll frühestens 2028 in einen niedrigen Erdorbit gebracht werden. Airbus 2023 Im Juni erreichte Starlab mit der erfolgreichen Überprüfung der Systemanforderungen (Systems Requirements Review, SSR) einen wichtigen Meilenstein. Dabei werden die funktionalen, technischen, Leistungs- und Sicherheitsanforderungen der Station evaluiert. Das Joint Venture von Voyager und Airbus soll von den USA aus geführt werden, Starlab soll aber auch eine europäische Joint-Venture-Tochtergesellschaft bekommen. ""Dieses transatlantische Projekt mit Standorten auf beiden Seiten des Ozeans vereint die Interessen von Voyager und Airbus sowie unserer jeweiligen Raumfahrtagenturen. Es ist ein Wegbereiter für eine fortgesetzte europäische und amerikanische Führungsrolle im Weltraum, die die Menschheit voranbringt"", so Jean-Marc Nasr, Leiter von Space Systems bei Airbus."
661ba812-04fd-4082-ad5c-910778064039,2023-08-03 14:25:06+00:00,"Vier Airbus A320 Neo hat Austrian Airlines schon. Doch dabei bleibt es nicht. 2024 soll ein weiterer A320 Neo zur Flotte stoßen kündigte Airline-Chefin Annette Mann im Rahmen der Präsentation der Halbjahresergebnisse am Donnerstag (3. August) an. Zusätzlich komme noch ein «junger» A320 Ceo aus Lufthansa-Konzernbeständen hinzu.* Doch die österreichische Lufthansa-Tochter plant auch schon einen größeren Umbau der Airbus-Kurz- und Mittelstreckenflotte. Man werde sie in der zweiten Hälfte des Jahrzehnts verjüngen, kündigte Mann an, verriet aber noch keine weiteren Details. Airbus A321 kommen in die Jahre Austrians Betriebschef Francesco Sciortino hatte allerdings schon im April erklärt, dass sich die Airline auch den A321 Neo anschaut. Und reif ist die Zeit für eine Erneuerung durchaus. Gerade die A321-Teilflotte fliegt schon im würdigen Flugzeugalter: Der Methusalem OE-LBA wurde Ende 1995 ausgeliefert und zählt damit bereits knappe 27 Lenze. Aber auch das jüngste Exemplar, die OE-LBF, ist mit Baujahr 2001 nicht mehr taufrisch. Bei der A320-Flotte sieht es etwas besser aus – aber auch hier sind sechs der 33 Flieger schon über 20 Jahre alt. Erste Boeing 787 Anfang 2024 Bereits in der konkreteren Planung ist Austrian Airlines beim Rollover der Langstreckenflotte: Anfang 2024 erwartet sie die erste Boeing 787. Dieses Flugzeug wird vorerst zur Erweiterung der Flotte genutzt. Mit den nächsten drei Maschinen werden dann die restlichen Boeing 767 ausgeflottet, danach folgen die 777. Über ein neues Langstreckenziel wird man sich aber voraussichtlich frühestens im Winter 2024/25 freuen dürfen, wie Airline-Vorstand Michael Trestl erklärte. *Korrektur: Zuerst stand an dieser Stelle, der fünfte Airbus A320 Neo und der «junge» A320 Ceo würden noch in diesem Jahr zur Flotte hinzukommen. Korrekt ist aber, dass dies erst 2024 geschehen wird. Wir bitten, den Fehler zu entschuldigen."
