67b5de5c-ff68-4735-9a33-368e5680ae13,2023-07-11 08:35:36,"Die Zahl der neu gegründeten Start-ups in Deutschland steigt wieder – nach einem mauen vergangenen Jahr. Im ersten Halbjahr 2023 wurden im Vergleich zum vorherigen Halbjahr 16 Prozent mehr Firmen gegründet – nämlich knapp 1300, wie eine Studie des Bundesverbands Deutsche Start-ups in Zusammenarbeit mit dem Branchendienst Startupdetector zeigt. Deutsche Start-ups hatten einen langen Boom erlebt und 2021 Rekorde bei der Finanzierung durch Investoren verzeichnet. In der Pandemie bekam die Digitalisierung einen Schub – ob bei Finanzgeschäften, Essenslieferungen oder beim Onlineshopping. Doch mit dem russischen Krieg gegen die Ukraine, steigenden Zinsen und Unsicherheit in der Wirtschaft hatte sich der Markt gedreht: Investoren hielten sich zurück, Start-ups strichen reihenweise Jobs. Auch bei den Neugründungen ging es laut Start-up-Verband bergab – von knapp 3200 im Rekordjahr 2021 auf 2619 im Jahr 2022. Mit fast 1300 Neugründungen im ersten Halbjahr 2023 liegt die Zahl also weiter auf vergleichsweise niedrigem Niveau, ist aber besser als direkt zuvor. Berlin und Hamburg legen stark zu Vor allem Berlin sei nach dem Einbruch im vergangenen Jahr mit 40 Prozent mehr Neugründungen (262) zurückgekommen, hieß es. Berlin hatte die schwierigen Finanzierungsbedingungen im vergangenen Jahr besonders zu spüren bekommen. Prozentual ähnlich stark legte Hamburg mit 90 Gründungen zu. In München wuchs die Zahl der Gründungen dagegen nur leicht um zwei Prozent auf 95. Der Start-up-Verband wertete starke Gründungszahlen im Frühjahr sowie im Juni als Rückkehr zum Aufwärtstrend der vergangenen Jahre in Deutschland. Bemerkenswert sei, dass sich im Ranking der Gründungen pro Kopf Karlsruhe, Darmstadt und Heidelberg als drei forschungsnahe Standorte unter den Top Fünf befänden. Das zeige das Potenzial jenseits von Start-up-Hotspots wie Berlin und München. Miele sagte: »Um unsere Stärke in der Forschung besser zu nutzen, müssen wir das Thema Unternehmertum in den Hochschulen prominenter machen und rechtlich-bürokratische Hürden bei der Ausgründung senken.«"
edaecac6-f447-4d36-a1df-463ae9e15f73,2023-07-11 10:56:46,"Die Gewinne der Unternehmen in Deutschland sind einer Studie der OECD zufolge in den vergangenen Jahren stärker gestiegen als in vielen anderen Industriestaaten. Seit Ende 2019, dem letzten Quartal vor Ausbruch der Coronapandemie, hätten die sogenannten Stückgewinne um 24 Prozent zugelegt, teilte die Organisation für wirtschaftliche Zusammenarbeit und Entwicklung (OECD) am Dienstag in ihrem Beschäftigungsausblick mit. Die Lohnstückkosten wuchsen demnach mit 13 Prozent deutlich langsamer. »Der Anstieg der Stückgewinne liegt über dem OECD-Durchschnitt, der Anstieg der Lohnstückkosten dagegen darunter«, lautet das Fazit. »Der Abstand zwischen den beiden Werten ist in Deutschland deutlich größer als in Frankreich, Italien, Spanien und im Vereinigten Königreich.« Als Stückgewinn wird die Differenz zwischen Erlös und Kosten pro Einheit bezeichnet, während die Arbeitskosten für eine bestimmte Einheit auch Lohnstückkosten genannt werden. »In vielen OECD-Ländern sind die Gewinne stärker gestiegen als die Arbeitskosten, was wesentlich zum Preisdruck beiträgt«, sagte OECD-Analystin Anja Meierkord der Nachrichtenagentur Reuters mit Blick auf die Inflation. Das eröffne Spielraum, um weitere Lohnerhöhungen aufzufangen und so den Kaufkraftverlust zumindest für Geringverdiener abzufedern – ohne dass ein erheblicher zusätzlicher Inflationsdruck entsteht. »Dies gilt auch für Deutschland«, sagte Meierkord. Eine faire Verteilung der Inflationskosten könne einen weiteren Anstieg der Ungleichheit verhindern. Reallöhne gaben in Deutschland stärker nach als im OECD-Schnitt Die nach dem russischen Angriff auf die Ukraine beschleunigte Inflation hat der OECD zufolge die Reallöhne in fast allen der 34 untersuchten Mitgliedsländer sinken lassen. In Deutschland gingen sie demnach im ersten Quartal dieses Jahres um 3,3 Prozent im Vergleich zum Vorjahreszeitraum zurück. Im Verlauf der drei Jahre seit Beginn der Pandemie – Ende 2019 bis Ende 2022 – haben die Reallöhne um 3,2 Prozent nachgegeben, im OECD-Schnitt um 2,2 Prozent. Bei Geringverdienenden sei dies durch die im vergangenen Oktober erfolgte Erhöhung des Mindestlohns auf zwölf Euro pro Stunde etwas abgefedert worden. Inflationsbereinigt (real) sei dieser verglichen mit Anfang 2022 um 12,4 Prozent gestiegen und damit deutlicher als in den meisten anderen OECD-Ländern. Mit einer nach internationalen Standards berechneten Arbeitslosenquote von 2,9 Prozent weist Deutschland aktuell eine der niedrigsten aller OECD-Länder auf – trotz Rezession. Der Konjunkturausblick trübt sich zugleich ein. »Laut OECD-Prognosen wird die deutsche Wirtschaft 2023 stagnieren, da die hohe Inflation die Realeinkommen und Ersparnisse schmälert und den Konsum dämpft«, sagte Meierkord. Allerdings sei die Zahl der offenen Stellen in Deutschland zuletzt gesunken, ebenso die der geleisteten Arbeitsstunden. »Vor diesem Hintergrund stellt sich die Frage, ob der deutsche Arbeitsmarkt weiter so gut bleiben kann«, sagte die OECD-Expertin."
97ca5f9a-af1d-46f9-a489-09c189247d0f,2023-07-11 12:00:00,"Das Berufskolleg für Wirtschaft und Verwaltung hat 19 Berufsschulklassen verabschiedet. Die Absolventen hatten unter besonderen Umständen ihre Lehre absolviert. Das Berufskolleg Wirtschaft und Verwaltung hat kürzlich über 250 Absolventen der berufsschulischen Bildungsgänge verabschiedet. In einem festlichen Rahmen fanden die Zeugnisübergaben in der Ahauser Stadthalle statt, wie es in einer Pressemitteilung heißt. Bestens gelaunt und galant gekleidet folgten rund 500 Gäste der Einladung zur Ehrung der Absolventen. Als Vertreterin des Lehrerkollegiums führte Ellen Jezierska durch das Programm, das durch die musikalische Begleitung von Enna und Lisa Haskert zu einem besonderen Ereignis wurde. Veränderte Anforderungen In seiner Begrüßungsansprache wies Schulleiter Hendrik Brügging auf die besonderen Umstände hin, unter denen die Absolventen ihre Ausbildung durchlaufen haben. Eine Ausbildung, die geprägt war von der Corona-Pandemie, dem Kriegsgeschehen in der Ukraine, dem Erdbeben in der Türkei und in Syrien sowie vielen sich stetig ändernden Anforderungen im Privat- und Arbeitsleben. Qualifikationen entwickelt Er hob hervor, welche Kompetenzen von den Abschlussschülern erlangt wurden und wie die Schülerschaft Solidarität mit anderen unter Beweis gestellt hat. In der dualen Berufsausbildung wurden neben der Fachkompetenz viele weitere Qualifikationen entwickelt – beispielsweise kreatives, problemlösendes Denken und kritisches Reflektieren. Aus der Perspektive der ausbildenden Unternehmen blickte der ehemalige Geschäftsführer des AIW, Andreas Brill, auf die Zukunft der Prüflinge. Er stellte das Thema Glück in den Fokus seiner Rede. Anhand zahlreicher Zitate von prominenten Persönlichkeiten veranschaulichte er wichtige Aspekte. Mit den Augen der Azubis Nicht fehlen durfte die Betrachtung der durchlaufenen Ausbildung aus dem Blickwinkel der Auszubildenden. Diesen Einblick gewährte stellvertretend für alle Berufsschüler Amelie Schibelius, die just am Tag der Verabschiedung ihre Kammerprüfung zur Kauffrau für Groß- und Außenhandelsmanagement absolviert hatte. Sie betonte die besonderen Herausforderungen einer Ausbildung im dualen System, skizzierte eindrucksvoll die erworbenen Kompetenzen und die daraus resultierenden Chancen für das weitere Berufsleben. Publikum feiert Absolventen Den Höhepunkt der Veranstaltung stellte die Zeugnisübergabe dar. Schulleiter Hendrik Brügging, die Koordinatorin Dr. Vera Tekülve und die jeweiligen Klassenleitungen überreichten den Absolventen der insgesamt 19 Klassen ihre wohlverdienten Abschlusszeugnisse. Abschließend erfolgte die Ehrung der Jahrgangsbesten der jeweiligen Ausbildungsberufe. Mit einem großen Applaus wurden alle Absolventen am Ende der Veranstaltung vom begeisterten Publikum gebührend gefeiert."
67dc40aa-3424-478b-b900-eb21c3fbb85b,2023-07-11 12:19:33,"Sein Ressort hat nun den Referentenentwurf vorgelegt, mit dem die EU-Richtlinie zur Mindestbesteuerung bis Jahresende umgesetzt werden soll. Im Kern geht es darum, dass große Unternehmensgruppen überall auf der Welt mindestens 15 Prozent Steuern zahlen sollen - sie also nicht weiterhin ihre Gewinne so lange über Grenzen schubsen können, bis sie keine oder kaum Steuern zahlen müssen. Betroffen sind Konzerne, die in mindestens zwei der vier vorangegangenen Geschäftsjahre die Umsatzgrenze von 750 Millionen Euro erreicht oder überschritten haben. Die Mindestbesteuerung, der sich 138 Staaten angeschlossen haben, ist Teil einer großen internationalen Steuerreform, über die seit Jahren auf internationaler und europäischer Ebene verhandelt wurde - und teilweise noch wird. Das Vorhaben ruht auf zwei ""Säulen"". Die ""erste Säule"" dreht sich vor allem um das ""Wo"" der Besteuerung: Unternehmen sollen ihre Gewinne künftig dort versteuern müssen, wo sie entstehen. Im Zuge der Digitalisierung nämlich erwirtschaften etwa große Digitalkonzerne ihre Gewinne auch in Staaten, in denen sie keine Niederlassungen und Produktionsstätten und erst recht nicht ihren Hauptsitz haben. Die zum Teil hohen Steuern in diesen Ländern können sie auf diese Weise umgehen. Über diesen Teil der Reform wird noch verhandelt. Die ""zweite Säule"" ist die globale, effektive Mindestbesteuerung, die Deutschland und Frankreich 2018 vorgeschlagen haben, und die jetzt von Lindner in nationales Recht umgesetzt wird. Laut Gesetzentwurf rechnet das Finanzministerium durch die Mindeststeuer von 2026 an mit signifikanten Mehreinnahmen, wenn auch mit abnehmender Dynamik: 910 Millionen Euro werden 2026 erwartet, ein Jahr später 535 Millionen und 2028 noch 285 Millionen Euro. Es könnte allerdings noch mehr sein. Denn dem Entwurf nach würde die Mindestbesteuerung für sich genommen im Jahr 2026 für ein Einnahmeplus von einer Milliarde Euro sorgen, 2027 für 800 Millionen und 2028 für 600 Millionen."
ecf580f3-012e-4448-9c84-d29ce877b293,2023-07-11 13:00:00,"Der baden-württembergische Intralogistik-Spezialist Montratec freut sich über den größten Auftrag seiner Firmengeschichte: Europas größter Luft- und Raumfahrtkonzern Airbus setzt bei der Montage seines neuen Langstreckenflugzeugs A321 XLR auf moderne Intralogistik von Montratec, konkret auf das intelligente Monoschienen- und Shuttle-Transportsystem Montrac. Der Großauftrag von Airbus stellt für Montratec aus Niedereschach (Schwarzwald-Baar-Kreis) einen internationalen Durchbruch dar. „Mit unserem intelligenten, flexiblen und energieeffizienten Schienen- und Transportshuttle-System Montrac sorgen wir bei Airbus in Hamburg-Finkenwerder für eine hocheffiziente, automatisierte und äußerst energiesparsame Materialversorgung zwischen Lager und den einzelnen Arbeitsstationen“, erläutert Sven Worm, CEO der Montratec GmbH. Eigens für Airbus entwickelten Shuttles transportieren autonom gesteuert Kleinladungsträger Für das neue Langstreckenflugzeug A321 XLR hat Airbus am Standort Hamburg-Finkenwerder eine eigene Ausrüstungsmontagehalle errichtet. In dem 38 m hohen neuen XLR-Hangar erfolgt parallel die Ausrüstungsmontage von mehreren A321 XLR-Flugzeugrümpfen. Zur Prozessoptimierung setzt Airbus auf eine maßgeschneiderte Montrac-Intralogistikanlage für eine umfangreiche und individualisierte Automatisierung des Materialflusses vom Lager (Sequencer) zu den einzelnen Arbeitsstationen. Die eigens für Airbus entwickelten Montrac-Shuttles transportieren dabei autonom gesteuert Kleinladungsträger auf einer rund 1 km langen verzweigten Monoschienenstrecke. Diese verbindet den Sequencer mit zwei Montagebühnen, an die 13 doppelstöckige Arbeitsstationen angeschlossen sind. Zugriffsebenen werden von Shuttles je nach Bedarf autonom angesteuert Für eine optimale Raumnutzung verläuft zudem ein Teil der Monoschienentransportstrecke unterirdisch durch einen Tunnel, in dem das Montrac-System unter der Decke montiert ist. Jede Arbeitsstation besteht aus zwei Decks mit wiederum jeweils vier Zugriffsebenen, aufgeteilt in Elektrik, Mechanik, Hydraulik und Leergutrückführung, die von den Shuttles je nach Bedarf autonom angesteuert werden. Die Beladung der Montrac-Shuttles mit Kleinladungsträgern am Sequencer, der Transport zu den Montagebühnen und Arbeitsstationen sowie die bedarfsgerechte Anlieferung an die jeweiligen Zugriffsebenen sowie die Rückführung der leeren Kleinladungsträger laufen voll automatisiert ab. Dabei erfolgt der Vertikaltransport der Shuttles zu den Montagebühnen, Arbeitsstationen, Decks und Zugriffsebenen sowie die Rückführung des Leerguts zuverlässig über zahlreiche Montrac-Lifte. Somit ist eine manuelle Tätigkeit lediglich bei der Entnahme der Kleinladungsträger und Leergutrückgabe an den Arbeitsstationen sowie für die Leergutrückführung am Sequencer (Kompaktlager) notwendig. Intelligentes, flexibles Schienen- und Transportshuttle-System Aufgrund der intelligenten Hightech-Steuerung kennt jedes Transportshuttle genau seine Position und sein Transportziel und bringt so die richtigen Kleinladungsträger zur richtigen Zeit an die richtige Zugriffsebene bzw. zurück zum Sequencer. Und dies bei maximaler Systemverfügbarkeit, denn fällt ein Shuttle aus, kann es jederzeit individuell mit einem Handgriff aus dem laufenden System entfernt oder ausgetauscht werden, ohne dafür die Anlage zu stoppen. Dank der intelligenten Steuerung kennt auch ein ausgetauschtes Transportshuttle sofort das ursprüngliche Transportziel. Energieeffizient: Shuttles benötigen nur während der Fahrt Strom „Besonders bedeutend für Airbus war neben dem geringen Platzbedarf und der Zuverlässigkeit des Montrac-Systems vor allem die hohe Energieeffizienz aufgrund des minimalen Stromverbrauchs. Im Vergleich zu anderen Systemen, die meist dauerhaft laufen, benötigen die Niederspannungsantriebe der Montrac-Shuttles nur während der Fahrt Strom und hinterlassen einen minimalen CO2-Fußabdruck. Dadurch ergibt sich ein signifikantes Energieeinsparungspotenzial“, betont Montratec CEO Sven Worm . Das nach dem Baukastenprinzip aufgebaute Transfersystem Montrac besteht aus einem modularen Aluminium-Monoschienensystem mit integrierter Stromschiene, auf dem die speziell für Airbus entwickelten Montrac-Shuttles autonom gesteuert operieren und eigenständig die optimale Route zum jeweiligen Transportziel zurücklegen. Die flexible und platzsparende Konfiguration erlaubt ein anwenderspezifisches, individuelles Anlagenlayout, inkl. der Integration von Pufferzonen, dem Transport über mehrere Etagen und unter der Decke. Zudem ist jederzeit eine Anpassung an geänderte Prozessabläufe sowie eine beliebige Systemerweiterung möglich. Darüber hinaus können auch die Shuttles in Länge und Breite individuell an die Bedürfnisse von Airbus bzw. die zu transportierenden Güter angepasst werden."
79b9a916-29c3-4856-89bd-7d4190823299,2023-07-11 14:02:00,"Wer den Rastplatz Stadtwald an der A3 zwischen dem Frankfurter und Offenbacher Kreuz ansteuert, wird schnell Fluchtreflexe verspüren. Denn die unbewirtschaftete Rastanlage ist seit (zu) langer Zeit in einem katastrophalen Zustand. Das hat sich bei einer erneuten Überprüfung des ADAC Hessen-Thüringen und einem Vor-Ort-Besuch des hr gezeigt. Die Mängelliste ist laut ADAC lang: überfüllte Tonnen, überall Müll, stinkende mobile Toilettenkabinen, verschlossene WC-Anlagen, ein unangenehmer Urin-Geruch in der Luft, keine Behinderten-Toilette und Stolperfallen am Boden wegen zerbröselter Randsteine. ADAC-Sprecher Oliver Reidegeld resümierte nach seiner Stippvisite: ""Schon die Nase hat es ob der Geruchsbelastung schwer, es länger als ein paar Minuten auszuhalten."" Der Grund sei klar: Das Toiletten-Häuschen sei wie vor einem Jahr geschlossen worden, dafür seien vier mobile Toilettenkabinen aufgestellt worden. ""Die meisten Besucher nutzen daher direkt die ungemähte grüne Wiese."" Eklatante Mängel und ein Schlusslicht im Test Im vergangenen Jahr testete der ADAC bundesweit 50 unbewirtschaftete Rastplätze. Die vier aus Hessen belegten dabei die Plätze 42 und 48 bis 50. Die Noten: ""mangelhaft"" und dreimal ""sehr mangelhaft"". Der Automobilclub bescheinigte ""eklatante Mängel"". Besonders negativ fiel der A5-Parkplatz Brühlgraben bei Weiterstadt (Darmstadt-Dieburg) auf. Er wurde zum schlechtesten Rastplatz Deutschlands gekürt. Vier Wochen später schauderte es Besuchern trotz des Weckrufs für die verantwortliche Autobahn GmbH immer noch. Bei einer Überprüfung des ADAC an den vier kritisierten Raststätten hatte sich noch immer nicht viel gebessert. Nun, rund ein Jahr nach dem großanlegten Test, gibt es erneut Licht und Schatten – mit Positivem und Negativem in der Bilanz. ""Schlimm für Familien mit Kindern, unwürdig für Trucker"" Neben den kosmetischen und eigentlich schnell zu behebenden Kritikpunkten weist der Rastplatz Stadtwald zwischen Offenbach und Frankfurt auch bauliche Mängel auf. ADAC-Mann Reidegeld sagt: ""Der zertrümmerte Randstein von letztem Jahr ist heute noch vorhanden und wird auf dem unbeleuchteten Rastplatz nachts zur Stolperfalle."" Es sei nicht nachvollziehbar, warum offenkundige Mängel nicht beseitigt würden. Der Zustand am Stadtwald sei schlimm für Durchreisende und Familien mit Kindern. Und gleichzeitig für Trucker, die dort ihre Pausen machen müssen und mangels Stellplätzen im Rhein-Main-Raum zudem übernachten. Die für die Raststätten verantwortliche Autobahn GmbH versprach, die Reparatur der Randsteine kurzfristig in Auftrag zu geben. Das erscheint dringend nötig. Denn an den drei weiteren im Vorjahr getesteten und vier Wochen später erneut überprüften Rastplätzen hat sich insgesamt baulich immer noch wenig getan, um die Mängel zu beheben. Betroffen sind die Anlagen Am Pommer an der A7 (Kassel-Fulda), Nadelöhr an der A4 (Bad Hersfeld-Eisenach) und Brühlgraben an der A5 (Frankfurt-Darmstadt). An diesen drei Raststätten haben sich aber zumindest schon mal die allgemeine Sauberkeit und der Zustand der Sanitär-Anlagen gebessert. Sie machten einen sauberen und optisch akzeptablen Eindruck, wie der ADAC mitteilte. ADAC fordert ""Mindestmaß an Sauberkeit"" Das freut den ADAC-Verkehrsexperten Wolfgang Herda. ""Rastanlagen mögen am Rand der Autobahn liegen, trotzdem sollten Reisende hier ein Mindestmaß an Sauberkeit vorfinden, um sich zu erholen."" Der ADAC fordert im Sinne der Reisenden: ""Gerade in der Ferienzeit müssen die Reinigungsintervalle erhöht werden."" Dass es auch anders geht, zeigt etwa der Rastplatz Am Schäferborn an der A5. Er habe ein sauberes und modernes Erscheinungsbild, mit Lärmschutz und einer getrennten Ausweisung der Parkflächen für Pkw, Lkw und Behinderten-Parkplätze. Bei den aktuell vom ADAC getesteten bewirtschafteten Rastplätzen besteht auch noch erheblicher Verbesserungsbedarf, wie es auf einem aktuellen Test hervorgeht. Drei Anlagen in Hessen überprüft. Die Raststätten Werratal Süd an der A4, Alsbach West an der A5 und Großenmoor West an der A7 bekamen die Note ausreichend. Größte Defizite sieht der ADAC bei der Möglichkeit zum Superschnellladen von E-Autos (ab 150 kW). Diese sind entweder nicht vorhanden oder defekt. Kritik gab es für die beschränkte Auswahl an kalten Speisen, das hohe Preisniveau in den Restaurants und die teuren Tankstellen-Shops. Punkten konnten die Anlagen dagegen in den Bereichen Sanitär und barrierefreier Zugang. Der ADAC appellierte, dass Besucherinnen und und Besucher ihren Teil zum Zustand der unbewirtschafteten Rastplätze beitragen können. ""Neben dem Betreiber sind auch die Nutzer gefragt und aufgefordert, die Anlagen nicht noch mehr zu verschmutzen."" Weitere Informationen Das sagt die Autobahn GmbH zur ADAC-Kritik Den verdreckten Rastplatz am Stadtwald bezeichnete die zuständige Autobahn GmbH als ""gesellschaftliches Problem"". Trotz erheblichen Aufwands für die Reinigung komme es leider zum beschriebenen Zustand. Zu den Sanitäranlagen hieß es: Die Toiletten und das Gebäude müssten grundhaft saniert werden. Aktuell solle die Aufstellung eines Toilettencontainers die Lage verbessern. Derweil arbeitet die Autobahn GmbH an den Rastplätzen der Zukunft mit bundesweit einheitlichen Standards. Reiningungskonzepte sollen verbessert werden. Für mehr Sicherheit werde der Einsatz von Kameras geprüft. Künftig sollen die Anlagen hell und weiträumig ausgeleuchtet werden, die Aufenthaltsqualität mit neuen Sitzgruppen verbessert werden und sogar WLAN bereitgestellt werden. Ende der weiteren Informationen"
9da93455-aebc-4e27-92eb-f93143c6bcfa,2023-07-11 17:29:17,"Der US-Flugzeugbauer Boeing hat im Juni nach jüngsten Problemen am Mittelstreckenjet 737 Max erneut deutlich mehr Flugzeuge ausgeliefert. Insgesamt fanden 60 Passagier- und Frachtmaschinen den Weg zu ihren Käufern, wie aus der am Dienstag veröffentlichten Monatsstatistik des Konzerns hervorgeht. Nach den tödlichen Abstürzen zweier Mittelstreckenjets vom Typ 737 Max durfte das Modell mehr als anderthalb Jahre lang weltweit nicht mehr abheben. Nach mehreren Nachbesserungen wurden die Verbote im Großteil der Welt allerdings wieder aufgehoben. Im April hatte Boeing mit CEO David Calhoun (66) die Auslieferungen bei Mittelstreckenjets 737 Max deutlich gedrosselt. Als Grund hatte der Konzern Fertigungsmängel und nötige Inspektionen genannt. Die Auslieferungszahlen beim weltgrößten Flugzeugbauer und Konkurrenten Airbus mit CEO Guillaume Faury (55) entwickeln sich im Juni ebenfalls positiv. Im vergangenen Monat wurden 72 Maschinen ausgeliefert, teilte der Dax-Konzern bereits vergangene Woche mit. In den ersten sechs Monaten hat Airbus damit 316 Maschinen ausgeliefert. Um das Ziel von 720 Flugzeugen im laufenden Jahr zu erreichen, müssen die Auslieferungen in der zweiten Jahreshälfte allerdings in etwa das Juni-Niveau halten. Nach dem Geschäftseinbruch in der Corona-Krise steuert der Luftverkehr wieder auf das Niveau aus dem Jahr 2019 zu. Allerdings haben Flugzeughersteller und Zulieferer mit Engpässen bei Bauteilen, Rohstoffen und Arbeitskräften zu kämpfen. Diese dürften noch bis ins nächste Jahr oder gar bis 2025 anhalten, hatte Airbus-Chef Faury im April gesagt."
