1389f8d7-6ec4-4934-a65c-555893c66671,2023-09-07 14:05:00,"Startseite Wirtschaft Rüstungsdeal zwischen Rheinmetall und Lufthansa: Starke Allianz gegen Airbus Von: Patricia Huber Rheinmetall und Lufthansa Technik planen eine Zusammenarbeit. Ein neuer Schritt, der die Luftfahrttechnik-Sparte des Rüstungskonzerns stärken könnte. Düsseldorf/Hamburg – Der Rüstungskonzern Rheinmetall plant laut Medienberichten, bei der Instandhaltung des Tarnkappenbombers F35 mit der Technologieabteilung der Lufthansa zu kooperieren. Die Partnerschaft soll laut einem Bericht von Business Insider am 19. September besiegelt werden. Weder Sprecher von Rheinmetall noch von Lufthansa Technik wollten den Bericht am Dienstag kommentieren. Es wird auch erwartet, dass der bayerische Anbieter von Elektroniksystemen, ESG, Teil des Projekts sein wird. Rheinmetall: Neue Produktionsstätte ab 2025 Rheinmetall plant ab 2025, in einer neuen Produktionsstätte in Weeze (NRW) Rumpfkomponenten für das amerikanische Kampfflugzeug F35 zu produzieren. Der symbolische erste Spatenstich für die Anlage fand im August statt. Mit diesem Projekt beabsichtigt der Panzerhersteller, seine bislang eher kleine Luftfahrttechnik-Abteilung erheblich auszubauen. Rheinmetall produziert im Luftfahrt-Bereich derzeit bereits Drohnen. Die Herstellung des wichtigen Bauteils für das hochmoderne Flugzeug stellt eine neue Produktlinie dar. Es wird erwartet, dass in der neuen Fabrik bis zu 450 Arbeitsplätze geschaffen werden. Rheinmetall ist ein Auftragnehmer des US-Rüstungsunternehmens Northrop Grumman, das seinerseits für Lockheed Martin arbeitet. Lufthansa Technik und Rheinmetall: Starke Allianz gegen Airbus Lufthansa Technik, die seit vielen Jahren die Flugzeuge der Luftwaffen-Flugbereitschaft wartet, plant ihre Präsenz im Verteidigungsgeschäft zu verstärken. Die Hamburger könnten insbesondere die Wartung der Flugzeuge und die Bereitstellung von Ersatzteilen übernehmen, ähnlich wie sie es seit vielen Jahren für zivile Unternehmen tun. Mit dem neuen Deal machen Rheinmetall und Lufthansa auch dem Monopolisten Airbus Konkurrenz. Der deutsch-französische Flugzeughersteller hatte den F35-Deal abgelehnt, mit der Argumentation, dass sich das Geschäft nicht lohnen würde. Hier hat also nun insbesondere Rheinmetall die Chance genutzt, weiter auf einem neuen Markt vorzudringen. Hinzu kommt, dass sich Rheinmetall mit Lufthansa Technik einen äußerst starken Partner gesucht hat. Wie BI erklärt, hat sich Lufthansa Technik die drei größten Projekte aus dem Bundeswehr Sondervermögen geschnappt. Dabei handelt es sich um den Aufklärer Boeing P-8 Poseidon, den Transporthubschrauber Chinook und nun der F35. (ph)"
9861c9cc-55f5-46a9-a1b5-e7e4c4e4fb6a,2023-09-07 14:36:11,"Die deutsche Wirtschaft schwächelt, Experten und Wirtschaftsinstitute rechnen mit einer neuen Rezession. Die Gründe sehen sie im Ausland - aber die meisten in Deutschland selbst. In der deutschen Wirtschaft herrscht Flaute. Und die aktuellen Daten deuten es an: Ein belebendes Lüftchen ist nicht zu erwarten. Die Industrieproduktion ist im Juli um knapp zwei Prozent gegenüber Juli 2022 gesunken. Gestern kam die Nachricht vom Auftragseinbruch: Die Bestellungen an die Industrie sind um zwölf Prozent gefallen. ""Die Auftragsbücher sind leer, die Vorratslager sind voll, und das war noch nie ein gutes Zeichen für die Industrieproduktion in den kommenden Monaten"", sagt Carsten Brzeski, Chefvolkswirt bei der ING-Bank. Prognosen herabgesetzt Entsprechend negativ fallen die Prognosen für die deutsche Wirtschaft aus. So rechnet das ifo-Institut mit einem Rückgang der deutschen Wirtschaftsleistung um 0,4 Prozent in diesem Jahr. Noch pessimistischer ist das RWI - Leibniz-Institut für Wirtschaftsforschung, das mit einer um 0,6 Prozent schrumpfenden Wirtschaft rechnet. Im kommenden Jahr soll es dann wieder aufwärts gehen. Es fehlen die Abnehmer Doch woher soll das Wachstum kommen? Das deutsche Wirtschaftsmodell wackelt. ""Wir haben 20 Jahre ein exportorientiertes Geschäftsmodell gehabt"", sagt Brzeski. ""Wir haben immer den Vorteil gehabt, dass es irgendwo auf der Welt immer wieder ein Land gab, dass einen Aufholprozess durchgemacht hat und deshalb hohe Nachfrage nach Investitionsgütern hatte."" Ein solches Wachstumsland gibt es momentan nicht. China ist sehr viel schwächer durch die Krise gekommen als gedacht und hat sich langsamer wieder erholt als erwartet. Andere Länder arbeiten konsequent daran, ihre Wirtschaft zu stärken. Die USA sorgt mit ihrem ""Inflation Reduction Act"" für einen Investitionsboom in die Energiewende. Steuersenkungen sollen zudem ausländische Unternehmen anlocken. Planungssicherheit würde helfen Die deutsche Wirtschaft hört diesen Ruf wohl und könnte ihm auch in Teilen erliegen, befürchten Experten. Es sei also Zeit, sich um die heimische Wirtschaft zu kümmern, sagt ING-Analyst Brzeski. ""Wir haben in den letzten zehn, 15 Jahren zu wenig investiert in Infrastruktur, Bildung"", beklagt er. Es liege weder an der Pandemie, noch am Krieg in der Ukraine, dass die deutsche Wirtschaft stagniere, ""sondern das ist auch selbstgemacht, hausgemacht"". Einen ""Deutschland-Pakt"", wie ihn Bundeskanzler Olaf Scholz vorgeschlagen hat, hält der Ökonom durchaus für sinnvoll, doch müsse dieser für die kommenden Jahre geschmiedet werdet. Es reiche nicht aus, die Wirtschaft mit Subventionen durch den Winter zu bekommen. Eine der wichtigsten Subventionen, so hört man immer wieder, sei Planungssicherheit."
1a4b1e81-69f7-43ed-aa90-bcd418f34852,2023-09-07 14:45:44,"Schon seit langer Zeit beherrscht Novo Nordisk den Markt für Insulin-Produkte. Wegovy hat die Aktie des Konzerns auf ein neues Level gehoben. Am Donnerstag liegt der Börsenwert des Pharmaunternehmens bei 401 Milliarden Euro. Zum Vergleich: Das dänische Bruttoinlandsprodukt von 2022 beträgt 376 Milliarden Euro. Allein im letzten halben Jahr erwirtschaftete Novo Nordisk einen Umsatz von 14,45 Milliarden Euro - ein Anstieg um 30 Prozent im Vergleich zur ersten Hälfte des Vorjahres. In zwei Jahren sind 10 000 Mitarbeiter hinzugekommen, rund 59 000 Personen arbeiten inzwischen bei Novo Nordisk. Marktkapitalisierung hat sich seit 2020 verdreifacht Hinter der Abnehm-Spritze steckt kein Wundermittel, das die Fettzellen bei Injektion schmelzen lässt. Stattdessen sorgt der Wirkstoff Semaglutid für ein länger anhaltendes Sättigungsgefühl. Wer es sich einmal wöchentlich spritzt, bei dem sollen die Pfunde purzeln. Eine Studie, finanziert von Novo Nordisk, stellte nach 68 Wochen einen Gewichtsverlust von 15 Prozent gegenüber der Vergleichsgruppe fest. Ohne große Anstrengung abzunehmen, das klingt verlockend. Es wundert nicht, dass die Firma boomt, die das auf Spritzen-Druck lösen könnte. Vor knapp hundert Jahren stieg das Nordisk Laboratorium in das Insulin-Geschäft ein. Heute führt die fusionierte Novo Nordisk A/S den zugehörigen Weltmarkt an. Nachdem die amerikanische Food and Drug Administration Wegovy im Juni 2021 freigegeben hatte, stiegen der Aktienkurs und damit entsprechend auch die Marktkapitalisierung kräftig an. Auch die EU-Zulassung sowie die Werbung von Prominenten wie Elon Musk und Kim Kardashian im vergangenen März trieben den Hype voran. Eine Studie Anfang August löste einen weiteren Sprung aus. Ihr zufolge soll das Medikament das Risiko auf ""schwerwiegende kardiovaskuläre Ereignisse"" - wie zum Beispiel Herzinfarkte - um 20 Prozent senken können. Insgesamt hat sich der Börsenwert von Novo Nordisk seit 2020 nahezu verdreifacht. Derzeit ist Wegovy in Deutschland, Norwegen, Dänemark und den USA zugelassen und verfügbar. Oder besser, es wäre verfügbar. Das Unternehmen hinkt mit der Produktion der Nachfrage hinterher. Wie viel produziert werden kann, möchte es auf Anfrage nicht verraten. Es werde aber allein in diesem Jahr 25 Milliarden dänische Kronen (3,35 Milliarden Euro) für den Ausbau der Kapazitäten investieren, richtet ein Sprecher aus. In Deutschland ist das Medikament vorerst nur für Menschen mit einem Body-Mass-Index ab 30 oder ab 27 in Fällen einer gewichtsbedingten Begleiterkrankung vorgesehen. Doch die Abnehm-Spritze geht auch ins Geld. Die höchste Dosis kostet knapp 75 Euro. Wer es - wie in der Studie - 68 Wochen lang anwendet, müsste dann mehr als 5000 Euro auf den Tisch legen. Dänische Wirtschaft wächst wegen Novo Nordisk Der Erfolg des Unternehmens spiegelt sich auch in der dänischen Wirtschaft wider. ""Ohne Novo Nordisk wäre die Wirtschaft bereits im vergangenen Halbjahr leicht geschrumpft"", sagt die Wirtschaftsexpertin Birthe Larsen, Professorin an der Copenhagen Business School. Auch für 2023 wird wegen Novo Nordisk ein leichtes Wachstum prognostiziert, zuvor ging man von einem leichten Rückgang aus. Prinzipiell geht es der dänischen Wirtschaft laut Larsen gut. Der Erfolg von Novo Nordisk beschert dem Staat einen erweiterten finanziellen Spielraum. Larsen mahnt allerdings: ""Die Inflation ist immer noch ein großes Problem, daher sollte der Staat nicht zu viel ausgeben"". Dänemark profitiert, es könnte sich aber ein Problem ergeben, sollte Novo Nordisk in ein anderes Land abwandern. Dieses Szenario hält Larsen für eher unwahrscheinlich. Entscheidend wird auch sein, wie sich die Konkurrenz verhält. Sollte Novo Nordisk seine Stellung auf dem Pharmamarkt verlieren, ""hätte das wiederum Folgen auf die dänische Wirtschaft"". Ein solcher Wettbewerber ist das US-amerikanische Unternehmen Eli Lilly. Dieses möchte sein Medikament ""Mounjaro"", das zur Diabetes-Behandlung angewandt wird, nun auch als Mittel gegen Fettleibigkeit einsetzen. Die Zulassung dafür hat die Firma bereits beantragt. Trotz des finanziell starken Konkurrenten, dessen Börsenwert den von Novo Nordisk übersteigt, besteht vorerst kein Grund zur Sorge für die Dänen. Zum einen, da die Nachfrage für Wegovy enorm ist, zum anderen, weil sie noch anziehen wird, denn die Zahl adipöser Menschen steigt. Ob Medikamente wie Wegovy in Zukunft von der breiten Masse für den Beach-Body genutzt werden, bleibt abzuwarten. Über die Langzeitwirkungen wisse man laut Experten derzeit nicht viel."
0cec1c43-49d6-41c5-827b-78eaa6992627,2023-09-07 15:00:18,"Die Produktion in der deutschen Autoindustrie ist laut Statistischem Bundesamt im Juli um 9,4 Prozent eingebrochen. Das meldete die Behörde am Donnerstag. Die Financial Times spricht von „düsteren Aussichten“ für die Branche mit Folgen für ganz Europa. Die schlechten Zahlen aus der Kfz-Branche haben tatsächlich die gesamtdeutsche Wirtschaft nach unten gezogen: Insgesamt ging die Produktion um 0,8 Prozent im Monatsvergleich zurück. Die Produktion im produzierenden Gewerbe sank um 0,8 Prozent, im Jahresvergleich stand ein Minus von 2,1 Prozent. Drei führende Wirtschaftsforschungsinstitute prognostizieren für 2023 einen Rückgang der deutschen Wirtschaft zwischen 0,4 und 0,6 Prozent und eine hohe Inflation von sechs Prozent. Die negative Entwicklung in Deutschland hat auch Auswirkungen auf die Wirtschaft in der Eurozone: Die Europäische Statistikbehörde reduzierte ihre Wachstumsprognose für den Euroraum für das zweite Quartal auf magere 0,1 Prozent. Jüngste Sorgenkinder sind unter anderem Österreich und Italien, die teilweise auch stark im Segment der Automobilzulieferer sind. Das RWI-Leibniz-Institut für Wirtschaftsforschung geht von einem Rückgang des Bruttoinlandsprodukts (BIP) um 0,6 Prozent in diesem Jahr aus. Die Lage dürfte für die deutsche Autoindustrie nicht nur wegen des Wettbewerbs aus China weiter angespannt bleiben. Auch innerhalb der EU werden im Zuge des Kampfs gegen den Klimawandel härtere Maßnahmen ergriffen, die vor allem durchaus den Charakter von Protektionismus tragen. So berichtet die britische Großbank HSBS, Frankreich werde eine Steuer für schwere Autos einführen. Diese gegen SUV gerichtete Steuer soll im nächsten Jahr in Kraft treten. Die Steuer ist für Modelle ab einem Gewicht von 1,6 Tonnen korrigiert. Diese Änderung könnte laut HSBC besonders deutsche Autobauer treffen, da hauptsächlich deren Modelle unter die Vorschrift fallen. Das Land möchte rigoros gegen zu schwere Autos vorgehen. Einzelne Städte, darunter Paris und Lyon, planen sogar erhöhte Parkgebühren für zu schwere Autos. Die HSBC analysiert: „Durch die SUV-Steuer könnte der Absatz der deutschen Autohersteller in Frankreich sinken, wenn der Neuwagen beispielsweise 350 Kilogramm zu schwer ist, fallen bei Anschaffung zusätzliche 3500 Euro an.“ Frankreich scheint ohnehin aktuell gute Voraussetzungen für seine Autohersteller zu bieten: Einer der größten Automobilhersteller, Stellantis, meldete am Mittwoch, dass der Nettogewinn im ersten Halbjahr um 37 Prozent auf 10,92 Milliarden Euro gesteigert werden konnte. Stellantis, das unter anderem die Marken Peugeot, Opel und Maserati vertritt, sieht sich nach eigenen Angaben gut gerüstet, um die hohen Kosten zu meistern, „die in der Zukunft bei der Transformation zu einem klimaneutralen Konzern auf sie zukommen werden“."
dcd648d8-9525-423b-a070-f8ca1902df47,2023-09-07 15:03:02,"Die Türkei kämpft mit einer schweren Währungskrise. Die Lira hat drastisch an Wert verloren, die Inflation liegt bei schwindelerregenden 58,9 Prozent. Nun aber hat die Weltbank angekündigt, das Land mit einer Aufstockung ihrer Milliardenhilfen zu unterstützen. Der für das Schwellenland zuständige Direktor Humberto López sagte der staatlichen türkischen Nachrichtenagentur Anadolu, binnen drei Jahren sollten zusätzliche 18 Milliarden Dollar an die Türkei fließen. Die Türkei ist die größte Volkswirtschaft des Nahen Ostens, abgesehen von den Rohstoffmächten wie Saudi-Arabien. Diese kämen zu den ohnehin bereits vorgesehenen 17 Milliarden Dollar hinzu. Die Mittel sollten unter anderem für Direktkredite an die Regierung zur Stützung des Privatsektors verwendet werden. Dieses nunmehr auf insgesamt 35 Milliarden Dollar aufgestockte Paket sei eine Reaktion auf das »starke Engagement« der Regierung in Ankara, für gesamtwirtschaftliche Stabilität im Land zu sorgen. Erdoğans neues Team Damit spielt die Weltbank auf einen Kurswechsel an, den die Türkei in der Wirtschaftspolitik vollzogen hat. Bis zu den Präsidentschaftswahlen im Mai hatte Präsident Recep Tayyip Erdoğan mit – vorsichtig formuliert – unorthodoxen Ansätzen in der Geldpolitik Liraverfall und Preisauftrieb befeuert. Nach der Wahl aber setzte er ein Team international anerkannter Wirtschaftsexperten ein, darunter Finanzminister Mehmet Simsek und Zentralbankchefin Hafize Erkan. Ziele der in Washington angesiedelten Weltbank sind unter anderem die Armutsbekämpfung und die Wirtschaftsförderung – unter anderem durch die Vergabe von günstigen Krediten. Trotz Währungskrise und hoher Inflation lief die türkische Konjunktur im Frühjahr überraschend gut. Das Bruttoinlandsprodukt (BIP) legte von April bis Juni um 3,8 Prozent im Vergleich zum Vorjahreszeitraum zu. Zu dem hohen Wachstum beigetragen hatten aber auch Anreize der Regierung vor der Wahl im Mai. Sie erhöhte den Mindestlohn und gab Rekordbeträge für Sozialhilfe aus. Dadurch konsumierten die Türken mehr, was die Konjunktur ankurbelte. Die Notenbank ist zudem mittlerweile im Kampf gegen die Inflation dazu übergegangen, die Zinsen zu erhöhen. Bisher hatte sie diese – entgegen der vorherrschenden ökonomischem Lehrmeinung – gesenkt. Das hatte die Teuerung über Jahre befeuert. Der Kurs der türkischen Lira ist in den vergangenen zwei Jahren zum Dollar um rund 70 Prozent eingebrochen. Das macht Importe für das rohstoffarme Land teurer und trägt damit zur hohen Inflation bei, die die Kaufkraft schmälert."
4b259aed-23b8-49ad-867b-6bf795166f16,2023-09-07 17:03:13,"Die Regierungen von Deutschland, Frankreich und Spanien hatten sich erst vergangenen November nach jahrelangen intensiven Verhandlungen – das Grundsatzvorhaben war schon von 2019 – darauf geeinigt, Gelder für ein Industrieabkommen zur Entwicklung eines flugfähigen Demonstrationsmodells des künftigen Kampfflugzeugsystems der 6. Generation FCAS (französisch: SCAF) bis 2027/2028 freizugeben. Die Entwicklungskosten für diese Programmphase 1b sind mit rund 3,5 Milliarden Euro budgetiert. Auf Basis des Demonstrationsmodells soll dann getestet werden, ob sich das Projekt technologisch zur Serienreife realisieren lässt, was mit weiteren Kosten von wohl mehr als 100 Milliarden Euro verbunden sein dürfte. Falls eine Umsetzung realisierbar ist, soll das Muster in Kombination mit seinen loyalen Flügelmänner-Drohnen ab 2040 Rafále und Eurofighter ersetzen. Für Dassault nur drittwichtigstes Projekt Soweit jedenfalls der Plan – denn nun stören (erneut) kritische Stimmen die multinationale Zusammenarbeit. Dassault Aviation-Chef Eric Trappier hatte bereits vor mehr als zwei Jahren seine Ernüchterung über die Anlaufschwierigkeiten des trinationalen Projekts zum Ausdruck gebracht. Als Präsident der UIMM (Union des Industries et Métiers de Métallurgie, der Lobby der französischen Stahlindustrie) betonte Trappier nun am 29. August in seiner Rede auf der jährlichen Sommertagung des französischen Industrieverbands MEDEF, dass für sein Unternehmen aktuell die Weiterentwicklung des Kampfjets Rafále zum Standard F5 oberste Priorität habe. Zudem stehe auf der Prioritätenliste auch das vollständig finanzierte Programm zur Entwicklung des Tarnkappen-UCAV nEURON für den gemeinsamen Betrieb mit Rafále F-5 und die Realisierung einer Combat Cloud gemeinsam mit Thales vor dem SCAF-Vorhaben. Die Abkürzung steht beim französischen Hersteller übrigens für „Système de Combat Aérien Futur”, um das französisch-deutsch-spanische Programm vom britisch-italienischen Future Combat Air System Tempest zu unterscheiden, welches aber durch den Eintritt Japans ohnehin in Global Combat Air umbenannt wurde. Zwar sei laut Trappier die zukünftige Kampfflugzeug-Generation weiter „fest im Visier von Dassault”, seine Prioritätenreihung dürfte in der Zentrale des deutschen Programmpartners Airbus Defence & Space aber wohl trotzdem die Alarmglocken haben läuten lassen. Verstärkt wurden diese Alarmglocken wohl noch durch ein Statement des Chefs des Projektkommandanten Dassault im Interview mit „BFM-Business”: „Ob es 2040 tatsächlich erste Lieferungen geben wird? Nun, das wird die Zukunft zeigen. Die Würfel sind noch nicht gefallen. Wir sind kurz-, mittel- und sehr langfristig dabei, wollen aber eine echte Führungsrolle übernehmen. Das muss anerkannt werden. Wenn das von den anderen Partnern nicht anerkannt wird, wird es nicht funktionieren.” Angesichts der zunehmenden Anspannungen zwischen den Hauptakteuren könnte die Aussage auch dahingehend gedeutet werden, dass Frankreich beim SCAR einen Alleingang überlegt. Wirklich überraschend käme das nicht: In den 1990er-Jahren hat Frankreich beim Eurofighter-Projekt ähnlich agiert – heraus kam die nun spät auch im Export sehr erfolgreiche Rafále-Familie. Exporte als Raison d’état Gemäß der – im Gegensatz zu Deutschland – enormen Bedeutung von Rüstungsexporten für das Land bis direkt in den Elysée, wies Trappier dann auch auf die vielen Rafále-Verträge hin, die Dassault in den vergangenen Jahren unterzeichnet hat: „Unsere Auftragsbücher sind bis 2032 gefüllt und dabei haben wir die Verbuchung neuer Aufträge noch gar nicht abgeschlossen. Der ‚Rafále-Moment’ wird also noch einige Zeit andauern. Unser Angebot entspricht den Bedürfnissen der Militärs, und die Geopolitik spricht in jenen Ländern für Frankreich, die weder amerikanische noch russische Flugzeuge kaufen wollen.” „Unsere Auftragsbücher sind bis 2032 gefüllt und dabei haben wir die Verbuchung neuer Aufträge noch gar nicht abgeschlossen.“ Dassault-Chef Eric Trappier Erst im Sommer kündigte Indien seine Absicht an, 26 Rafále-M für seinen neuen Flugzeugträger kaufen zu wollen, während Indonesien weitere 18 (auf dann insgesamt 42) Maschinen bestellt hat, wodurch sich der Gesamtexportumsatz bis heute auf 311 Flugzeuge (neben Indien und Indonesien noch Ägypten, Katar, Griechenland, Kroatien und VAE) erhöhte. Das ist doppelt so viel wie beim Eurofighter (151), dem Saab Gripen (inklusive 102 langfristig geleaster) und Boeings Super Hornet (48). „Diese Länder werden das Muster voraussichtlich für Jahrzehnte betreiben und das bedingt für dessen Kompetenzerhalt für die nähere Zukunft die Zusammenarbeit mit diesen Kunden bei der Entwicklung des F-5-Standards bis 2030 und sogar eines F-6-Standards gegen Ende der 2030er Jahre”, so Trappier. Und Exporte sind – freilich in weit fernerer Zukunft – auch beim SCAF sehr wohl Thema. Parallele Entwicklungen zu Airbus-Anteilen Bereits im Juni berichteten Branchenkollegen von der Pariser Messe in Le Bourget (beispielsweise hier) darüber, dass Frankreich offenbar neue Initiativen im Bereich der Subsysteme des FCAS gestartet hat, die denjenigen entsprechen, die gemäß den Vereinbarungen eigentlich in der Verantwortung der Partner Deutschland oder Spanien liegen. Und auch im Juli während des RIAT in Fairford, wurden in den Chalets ähnliche Entwicklungen kolportiert: Frankreich hat demnach seinen ersten Hyperschallwaffen-/gleitertest durchgeführt (Véhicule Manœuvrant Expérimental oder kurz V-MaX) und nun bekannt gegeben, dass es Grundlagenforschung für ein echtes Hyperschall-Kampfflugzeug (Projekt ESPADON) betreibt, von dem es sagt, dass die Entwicklungen Teil einer SCAF-Fähigkeit sein könnten. Es handelt sich dabei aber um ein rein französisches Programm, keine Rede von „die Tür steht immer offen” oder ähnlichen Aussagen aus der Vergangenheit. Im Rahmen des Staatsbesuchs des indischen Premierministers Narendra Modi in Frankreich anlässlich der Parade zum Nationalfeiertag am 14. Juli wurde zwischen den beiden Regierungen eine Vereinbarung über eine „Zusammenarbeit im Bereich fortschrittlicher Luftfahrttechnologien” und bei der „gemeinsamen Entwicklung eines neuen Luftkampfsystems” geschlossen. Frankreichs Rüstungsforschungsagentur DGA hat zudem ein aktives (kein Blue Sky Thinking) Programm über eine Reihe von „Einweg-loyalen Flügelmännern” gestartet, die aus Transport- und Marinepatrouillenflugzeugen gestartet würden. Für jene sei das Zusammenwirken mit Rafále aber auch SCAF ein wesentlicher Treiber – nur wäre dieses ganze Begleitdrohnen-Business eigentlich Sache von Airbus. Ohne das bekannte Stealth-Nurflügler-UCAV nEURON zu erwähnen, sagte Frankreichs Chef des Luftwaffenstabs den Senatoren in einer Beweisaufnahme im Juli, dass die Luftwaffe eine rein französisch-MALE UAV/UCAV teste und evaluiere. Er nannte keinen Namen, aber in einer Unterhaltung mit Militär Aktuell in Paris wurde klar, dass es sich dabei um die sicher größte europäische Drohne Aarok von Turgis & Gaillard Aarok handelt, die auch bereits geflogen wurde. Der Hersteller war bisher außerhalb Frankreichs kaum irgendwo auf dem Radar, obwohl er bereits die ganzen Bordfahrzeuge für die französischen Träger herstellte. Aufgeworfene Fragen Was bedeutet das nun? Da ist zugegeben viel rüstungs- und industriepolitische Kaffeesudleserei dabei, aber warum sollte Frankreich und dessen Industrie versuchen, eine langfristige Weiterentwicklungs-Partnerschaft mit Rafále-Kunden aufbauen, wenn SCAF die einzige Option wäre? Warum sollte Frankreich zustimmen, ein neues Kampfflugzeug mit Indien zu entwickeln, anstatt beispielsweise zu versuchen, Indien – ja, samt seiner „byzantinischen Abläufe” – in den SCAF aufzunehmen? UCAVs/loyale Flügelmänner im SCAF liegen in der Verantwortung von Airbus Defence & Space, aber trotzdem investiert das Team Frankreich nun mehrere hundert Millionen Euro in die Entwicklung solcher Fähigkeiten. Wie hoch wird da die Wahrscheinlichkeit sein, dass diese Entwicklungen in einigen Jahren wieder eingestellt und verworfen werden? Und wenn widrigenfalls die deutschen Entwicklungen doch noch zu etwas gut sein sollten, was ist dann mit dem erbrachten Aufwand und den Mitteln bei Airbus und Hensoldt? Glaubt man vielleicht, dass einen die Typhoon-Partner Italien und Großbritannien doch noch in den Konkurrenten Tempest hineinbringen würden? Das Projekt schreitet im Vergleich mit großen Stiefeln vorwärts und der Eintritt Japans in „Global Combat Air” bedeutet, dass alles, was Berlin in finanziellem Bezug und Innovationen einbringen kann/könnte, wohl gegen irrelevant gehen könnte. Zudem sind auch hier ferne Exporte Teil der Konzeption und man erinnert sich an deutsche Exportverbote für so ziemlich jedes Verteidigungssystem (wie beispielsweise weitere Eurofighter für Riadh) in den Nahen Osten – eine Ausnahme bilden dort nur deutsche Panzer und Schützenpanzer. Fazit Aktuell scheint Deutschland politisch und industriell noch nicht zu sehen, dass das Land zunehmend an den Rand des zukünftigen Kampfflugzeugprogramms gedrängt wird. Die „Mathematik” der Durchführbarkeit des Programms sowohl für Tempest als auch für SCAF bewegt sich aber grundlegend und schneller werdend gegen Deutschland und damit gegen Airbus Defence & Space. Sowohl ein französischer Alleingang als auch Tempest/Global Combat Air können auf Partner verweisen, die über Ressourcen und Abnahmemärkte verfügen, die dazu führen könnten, dass Deutschland (und erst Spanien an dritter Stelle) weniger benötigt wird oder sogar aktiv unerwünscht ist. Und das gepaart mit einem sich bereits abzeichnenden (innen)politischen Momentum, welches den 100 Milliarden-Schockmoment der Scholz’schen Zeitenwende bezogen auf die Verteidigungsanstrengungen bereits wieder verblassen lässt."
