56e5f398-fdfd-4615-b9a9-d55825b84690,2023-08-28 08:45:00+00:00,"24RHEIN Welt Politik Flugzeug-Riese A400M über Deutschland: Was es damit auf sich hat Von: Nils Bothmann Jüngst war eine A400M von Airbus der Bundeswehr im Tiefflug über Deutschland zu sehen. Da könnte künftig noch öfter passieren. Köln – Es ist ein dicker Brummer, eines der größten und schwersten Flugzeuge in den Beständen der Bundeswehr: das Transportflugzeug Airbus A400M. Mit einem maximalen Abfluggewicht von 141 Tonnen kann die Maschine bis zu 114 Soldaten befördern. Das Flugzeug kann auch große Fahrzeuge und sogar Panzer an Bord nehmen. Laut Bundeswehr ermöglicht der Laderaum etwa den „Transport von unterschiedlichstem Material wie beispielsweise einem Kampfhubschrauber Tiger, ein leichter Unterstützungshubschrauber H145M, vier Geländewagen vom Typ Wolf oder ein Transportpanzer Fuchs beziehungsweise Schützenpanzer Puma“. Airbus A400M der Bundeswehr nach Wunstorf ausgeliefert In manchen Regionen Deutschlands konnten Anwohner eine A400M jüngst sehen und hören. Nach Angaben des Bereichs Ausrüstung, Informationstechnik und Nutzung der Bundeswehr (AIN) handelt es sich um die 42. Maschine dieser Art, die an die deutschen Streitkräfte ausgeliefert wurde. Die Luftwaffe hatte 53 Exemplare bestellt, bis 2026 sollen alle angekommen sein. Sprich: Auch in Zukunft wird die Maschine immer wieder über Deutschland zu sehen sein. In diesem Jahr ist es die erste Airbus A400M, die in die Hände der deutschen Streitkräfte überging. Das deutsche Unternehmen Airbus hat seinen Hauptsitz in Hamburg, gefertigt wurde die besagte Airbus A400 jedoch in Sevilla. Dort wurden im Juni auch Erprobungsflüge durchgeführt, um herauszufinden, ob man das Öffnen und Verriegeln der Laderampe optimieren kann. Unter Umständen muss die Maschine nämlich im Flug aus großer Höhe Ladung abwerfen. Zielort der Maschine war der Fliegerhorst Wunstorf in Niedersachsen, wo das Lufttransportgeschwader 62 stationiert ist. Dieses ist seit dem 1. Juli 2015 dem Luftwaffentruppenkommando in Köln-Wahn (Stadtbezirk Köln Porz) unterstellt. Die A400M in Zahlen Seit 2014 befindet sich die A400 im Bestand der Bundeswehr und ersetzt die C-160 TRANSALL, die Ende 2021 endgültig ausgemustert wurde. Die maximale Nutzlast des Transportflugzeugs beträgt 37 Tonnen, wobei die Ladung auch Auswirkungen auf die Reichweite hat. Bei voller Nutzlast kommt der Airbus-Transporter bis 3.300 Kilometer weit, bei 30 Tonnen Zuladungen 4.535 Kilometer und bei 20 Tonnen Zuladung 6.390 Kilometer. Bei Überführungen im Leerzustand, wie beim Flug von Sevilla nach Wunstorf, kann der Flieger sogar 8.700 Kilometer zurücklegen. So reagiert die Bevölkerung auf den Tiefflug der A400 Am Boden haben Menschen die A400M bei ihrer Überführung im Tiefflug gesehen. Was bedeutet Tiefflug nach Bundeswehr-Definition? Dies sind Flüge mit einer Höhe von unter 1.500 Fuß (ca. 457 Meter). Tiefflüge sind an Werktagen zwischen 7 Uhr und 17 Uhr erlaubt, dürfen bei Transportflugzeugen wie der A400M eine Mindestflughöhe von 500 Fuß (ca. 152 Meter) nicht unterschreiten. Ein Nutzer von X, ehemals Twitter, schreibt: „Durfte gestern auf einer Talsperre im sächsischen Vogtland einen aus der ‚Nähe‘ bestaunen. Schon mächtig gewaltig, dieses Flugzeug. Auch wenn es kurz etwas beängstigend war. War mit dem Boot am Angeln und einer ist vielleicht 100m genau über hinweg geflogen. Sau stark.“ Weniger begeistert waren die Anwohner des Kreises Soest, als eine A400M vom Fliegerhost Wunstorf vor wenigen Tagen im Tiefflug über die Stadt und den nahen Möhnesee donnerte, wie WA.de berichtet. Mehrere Maschinen des Typs waren im Juni auch für das Manöver Air Defender 2023 im Einsatz. Eine davon wurde für die Übung mit einer Spezialfolierung versehen. Insgesamt stellte die Bundeswehr fünf Airbus A400M für das gigantische Kampfjet-Manöver, ebenso wie unter anderem 30 Eurofighter und 16 Tornados. Nun haben die Streitkräfte eine weitere Maschine vom Typ Airbus A400M in ihrem Bestand – bis 2026 sollen noch elf weitere hinzukommen. (nbo) Fair und unabhängig informiert, was in Köln, Düsseldorf und NRW passiert – hier unseren kostenlosen 24RHEIN-Newsletter abonnieren."
cca14469-7a16-451b-b17a-7e1a01fbcbbf,2023-08-29 07:42:50+00:00,"Ein Urlaubsflieger aus dem norddeutschen Hamburg hat wegen schweren Unwetters seinen Zielort Ibiza nicht erreicht und musste auf Alicante ausweichen. Der Eurowings-Flug EW7514 mit 174 Reisenden habe am Sonntag nicht auf der Baleareninsel landen können und sei nach «ein paar Warteschleifen» auf die Stadt auf dem südspanischen Festland ausgewichen, teilte das Unternehmen am Dienstag auf Anfrage der Deutschen Presse-Agentur mit. RTL und «Bild» hatten zuvor unter Berufung auf Passagieraussagen über dramatische Minuten an Bord des Airbus berichtet. Eurowings betonte, es habe «zu keinem Zeitpunkt eine Gefahr bestanden». Es sei keine Notlandung in Alicante gewesen, sondern eine «Ausweichlandung». Die aus TV-Realityshows wie «Der Bachelor» bekannt gewordene Eva Benetatou hatte sich am Montagnachmittag bei Instagram zum Flug geäußert. Sie habe Angst um ihr Leben und das Leben ihres zweijährigen Sohnes gehabt, schilderte Benetatou. Blitzeinschlag nicht bestätigt Nach Angaben von Eurowings war ein Weiterflug im Laufe des Sonntags nicht mehr möglich, die Reisenden seien in Hotels untergebracht und am Montag nach Ibiza geflogen worden. Der Airbus sei nach Landung in Alicante «aufgrund der durchflogenen Wetterlagen von außen einer Sicht-Inspektion durch Techniker unterzogen» worden. Ein Blitzeinschlag habe sich nicht bestätigt."
f2495809-68b9-446f-b804-ce835044d463,2023-08-29 10:19:20+00:00,"Schon im März 2022 hatten die Hersteller Boeing und Airbus infolge der russischen Invasion in der Ukraine die Lieferung von Ersatzteilen, Wartung und technische Unterstützung für russische Fluggesellschaften eingestellt. Auch Leasingverträge für neue Flugzeuge wurden aufgrund von Sanktionen gekündigt. Die russischen Behörden haben seitdem immer wieder einen „komplett russischen Importersatz“, also ein eigenes, komplett in Russland hergestelltes Flugzeug versprochen. Nun präsentiert der russische Hersteller Suchoi, genannt nach dem Chefkonstrukteur Pawel Suchoi, die Ergebnisse seiner Arbeit. Das Unternehmen, das zu 100 Prozent zum russischen Luftfahrtkonsortium OAK gehört und letztendlich auch Teil des staatlichen Konzerns Rostec ist, hat am Dienstag in Komsomolsk am Amur, im russischen Fernost, einen Prototyp des neuen Flugzeugs SJ100 getestet. Das teilte das russische Ministerium für Industrie und Handel mit. Es hätten sich während des Tests ein stabiler Betrieb aller Haushaltssysteme, die Steuerbarkeit und die Stabilität in der Luft bestätigt, hieß es. Man feiert das Programm zur Importsubstitution von Systemen und Komponenten und den Erfolg „vieler Tausender Teams von Unternehmen aus der Flugzeugbau- und Funkelektronikindustrie, die Teil des Staatskonzerns Roctec sind“. Wegen der Sanktionen: Russland hat noch keine eigenen Triebwerke parat Russischen Entwicklern sei es gelungen, ihre eigenen Designlösungen und Technologien zu implementieren und in das Flugzeug einzubauen, darunter Avionik, Fahrwerk, Hilfsaggregat, integriertes Steuerungssystem sowie Stromversorgungssysteme, Klimaanlage, Brandschutz, lobt das Ministerium. Was es jedoch lieber nicht erwähnt: In dem neuesten „Ersatz-Flugzeug“ wird noch das französisch-russische SaM146-Triebwerk eingesetzt. Die Suchoi-Superjets schulden ihren schlechten Ruf genau den Problemen mit dem PowerJet SaM146: Die vom französisch-russischen dem Joint Venture PowerJet entwickelten Triebwerke hatten in der Vergangenheit immer wieder einen Konstruktionsfehler aufgewiesen, wie die russische Seite behauptete, insbesondere wegen der französischen Hochdruckkomponenten. Nach dem russischen Angriff auf die Ukraine war der französische Partner Safran Aircraft Engines aus dem Joint Venture ausgetreten, und die französischen Teile in den alten Triebwerken durften nicht mehr in Frankreich repariert werden. Bessere Triebwerke hat der russische Importersatz noch nicht zur Verfügung. Der zweite Prototyp soll irgendwann mit inländischen PD-8-Triebwerken fliegen, heißt das neue Versprechen, doch diese werden noch geprüft und getestet. Die Nachricht sorgt in Russland sowohl für Begeisterung als auch für Spott: Nach dem Absturz der neuesten Mondsonde Luna-25 ist das Vertrauen in die einheimischen Entwicklungen bei vielen weiter gesunken. Haben Sie Feedback? Schreiben Sie uns! briefe@berliner-zeitung.de"
20fe894b-3957-43a4-9312-975fd5977877,2023-08-29 10:58:04+00:00,"Ein Urlaubsflieger aus Hamburg hat wegen schweren Unwetters seinen Zielort Ibiza nicht erreicht und musste auf Alicante ausweichen. Der Eurowings-Flug EW7514 mit 174 Reisenden habe am Sonntag nicht auf der Baleareninsel landen können und sei nach „ein paar Warteschleifen“ auf Alicante ausgewichen, teilte das Unternehmen am Dienstag mit. RTL und „Bild“ hatten zuvor unter Berufung auf Passagieraussagen über dramatische Minuten an Bord des Airbus berichtet. Eurowings betonte, es habe „zu keinem Zeitpunkt eine Gefahr bestanden“. Es sei keine Notlandung gewesen, sondern eine „Ausweichlandung“. Die aus TV-Realityshows wie „Der Bachelor“ bekannt gewordene Eva Benetatou hatte sich am Montagnachmittag bei Instagram zum Flug geäußert. Sie habe Angst um ihr Leben und das Leben ihres zweijährigen Sohnes gehabt, schilderte Benetatou. Ein Eurowingssprecher sagte in Köln, der Airbus sei auf dem Weg nach Ibiza in Turbulenzen geraten und habe infolgedessen kurzzeitig an Höhe verloren. „Die Maschine hat aber ihre normale Reiseflughöhe rasch zurückgewonnen und ist – wie viele andere Flugzeuge an dem Tag auch – sicher auf dem Flughafen von Alicante gelandet.“ Das Flugzeug sei nach der Landung sorgfältig von Technikern überprüft worden. „Dabei wurden keinerlei Hinweise auf einen Blitzeinschlag gefunden.“ Moderne Verkehrsflugzeuge seien für solche extremen Belastungen ausgelegt und könnten auch einem solchen Unwetter problemlos standhalten. Das Flugzeug sei am nächsten Tag „ganz normal von Alicante zum Ziel Ibiza geflogen“. Nach Angaben des Unternehmens war ein Weiterflug im Laufe des Sonntags wegen des Unwetters zunächst nicht möglich. Die Reisenden seien in Hotels untergebracht und am Montag nach Ibiza geflogen worden. Der Sprecher stellte nach Gerüchten über angebliche Probleme bei der Flugzeug-Elektronik klar, dass bei einer Wetterlage mit starken Winden eine Landung grundsätzlich manuell erfolgen müsse. Der Autopilot dürfe unter solchen Umständen nicht übernehmen. Ein schweres Unwetter auf Mallorca und teilweise auch auf anderen Balearen-Inseln hatte zuletzt für Chaos im Flugverkehr gesorgt. Einige Flüge mussten gestrichen oder umgeleitet werden. Wegen der unwetterbedingten Streichung Dutzender Flüge mussten Hunderte Touristen die Nacht zum Montag auf dem Flughafen von Palma verbringen. Dort war die Lage den Montag über angespannt. Es gab lange Schlangen von gestrandeten Reisenden und genervte und schimpfende Passagiere, berichtete „Mallorca Diario“. Mitarbeiter des Bodenpersonals weinten vor Verzweiflung Die „Mallorca Zeitung“ schrieb unter Berufung auf Passagiere von einer „Rangelei“ zwischen Urlaubern und Bodenpersonal. Mitarbeiter von Airlines hätten sogar vor Verzweiflung geweint. Unter den Betroffenen seien auch viele deutsche Urlauberfamilien mit sehr kleinen Kindern, denen unter anderem die Windeln ausgegangen seien. (dpa)"
e2dc1843-4082-4276-bdcb-e34203a306a9,2023-08-29 12:40:09+00:00,"Eigentlich sollte Haeco die Wartung übernehmen. Doch aufgrund der westlichen Sanktionen als Reaktion auf den russischen Angriffskrieg gegen die Ukraine musste sich Aeroflot etwas anderes einfallen lassen. Das Hongkonger Unternehmen durfte die russischen Airbus A330 nicht mehr annehmen. So schickte die mehrheitlich staatliche russische Fluggesellschaft am 5. April 2023 den A330-300 mit dem Kennzeichen RA-73700 nach Teheran. Dort wird der 11,5 Jahre alte Flieger von den Spezialisten der iranischen Fluggesellschaft Mahan Air gewartet. Das wird aber offenbar länger dauern als zunächst erwartet. Weitere Airbus A330 könnten folgen Wie der russische Luftfahrt-Telegram-Kanal Aviatorshina erfuhr, erwartet Aeroflot mittlerweile die Rückkehr der RA-73700 erst im März 2024. Ursprünglich war als Termin September 2023 vorgesehen. Statt einem halben Jahr wird der A330 also fast ein ganzes Jahr im Iran bleiben. In dieser Zeit sollen gemäß den Informationen neben einer umfassenden Wartung auch zusätzliche Arbeiten am Fahrwerk und in anderen Bereichen des Flugzeuges vorgenommen werden. Aeroflot hat angekündigt, dass die Wartung der RA-73700 auch ein Test ist. Zeigt sich die Airline nach der Rückkehr der Maschine zufrieden, will sie weitere ihrer insgesamt zwölf A330 zur Wartung in den Iran schicken. Nun dürfte all das länger dauern."
d5da3864-97c9-4f4b-a5f2-98825a166eaa,2023-08-29 14:46:11+00:00,"Emirates-Airline-Chef Tim Clark musste seine Idee einfach loswerden. Und so setzte er sich vor einigen Wochen mit ein paar Unterlagen im Gepäck ins Flugzeug, um sich mit Airbus-Verkaufsvorstand Christian Scherer zu treffen. Clark hatte einmal aufgeschrieben, wie eine Neuauflage des Airbus A380 aussehen könnte, und wollte sie dem Airbus-Manager schmackhaft machen. Airbus sollte das Ding bauen, und Emirates würde es kaufen - so ähnlich wie der legendäre Pan-Am-Chef Juan Trippe Boeing Mitte der 1960er-Jahre dazu brachte, den Jumbo-Jet 747 zu entwickeln."
2cd43026-e9b3-4116-8104-d7dd448c53f8,2023-08-30 11:51:28+00:00,"Die beiden Niedersächsischen Polizeihubschrauber sollen 2026 einsatzbereit sein und kosten über 42 Millionen Euro. Niedersachsen bekommt zwei neue Polizeihubschrauber. | Foto: Über dts Nachrichtenagentur 27.08.2023, 06:00 Uhr, zuletzt aktualisiert: 30.08.2023, 13:51 Uhr Niedersachsen und Mecklenburg-Vorpommern kaufen gemeinsam vier neue Polizeihubschrauber des Modells Airbus H145 – je zwei für jedes Bundesland. Der Zuschlag für die länderübergreifende Kooperation wurde jetzt an das Unternehmen Airbus erteilt. Das berichtet das Niedersächsische Innenministerium. Lesen Sie auch: Verstärkung von oben: Der Polizeihubschrauber Phoenix Die gemeinsame Beschaffung erfolgt über das Logistikzentrum Niedersachsen (LZN), was Aufwand, Zeit und Geld spart. So konnte durch die Beschaffung beim LZN ein Preis von 42,7 Millionen Euro für die beiden niedersächsischen Hubschrauber erzielt werden. Ursprünglich veranschlagt waren im Landeshaushalt hingegen rund 46 Millionen Euro. Die beiden neuen Polizeihubschrauber werden voraussichtlich im Jahr 2026 einsatzfähig sein und eine wichtige Ergänzung zu den bestehenden Ressourcen der Polizei darstellen. Die beiden Hubschrauber werden dann zwei alte Modelle ablösen. Die Polizeihubschrauber-Staffel Niedersachsen verfügt derzeit über vier Polizeihubschrauber zweier unterschiedlicher Muster: zwei Maschinen des Typs EC 135 P2e (Kauf 2015) und zwei Maschinen des Typs McDonnell Douglas (MD) 902. Die beiden Hubschrauber MD 902 sind mittlerweile 22 und 21 Jahre alt und sollen durch die zwei neuen Modelle des Typs Airbus H145 ersetzt werden. Somit wird das Land Niedersachsen weiterhin über vier Polizeihubschrauber verfügen. Luftgestützte Überwachungs- und Einsatzkapazitäten weiter stärken Die Niedersächsische Ministerin für Inneres und Sport, Daniela Behrens, sagt: „Mit einer Fläche von über 47.700 Quadratkilometern ist der Einsatz von Polizeihubschraubern für die innere Sicherheit in Niedersachsen unabdingbar. Unsere Polizei leistet tagtäglich hochprofessionelle Arbeit. Sie benötigt dafür die bestmögliche Ausrüstung und Einsatzmittel – das gilt auf dem Land, auf dem Wasser und in der Luft. Um auch weiterhin die Rund-um-die-Uhr-Verfügbarkeit unserer Polizeihubschrauberstaffel zu gewährleisten, beschaffen wir gemeinsam mit Mecklenburg-Vorpommern vier neue Hubschrauber der 4-Tonnen-Klasse – je zwei für jedes Bundesland. Ich freue mich, dass wir den Zuschlag für den Auftrag nun erteilen konnten. Das ist ein bedeutender Schritt, um unsere luftgestützte Überwachungs- und Einsatzkapazitäten weiter zu stärken. Unsere länderübergreifende Kooperation spart Geld, Aufwand, Zeit bei der Beschaffung und sorgt gleichzeitig für wichtige Sy- nergieeffekte bei der späteren Wartung und Instandhaltung sowie bei der Ausbildung der Pilotinnen und Piloten.“ Wichtige Rolle bei der Brandbekämpfung Die neu erworbenen Hubschrauber, speziell für den Einsatz im polizeilichen Bereich konzipiert, bieten eine Reihe von technologischen Fortschritten und Funktionen, die die Einsatzmöglichkeiten der Polizei erheblich erweitern. Diese Hubschrauber der 4-Tonnen-Klasse zeichnen sich durch ihre hohe Wendigkeit und Reichweite, die fortschrittliche Sensorik sowie ihre Vielseitigkeit aus. Diese Vorteile ermöglichen es der Polizei, schnell auf die verschiedenste Einsatzlagen wie beispielsweise Verfolgungen und Suchaktionen reagieren zu können. Zudem spielen die fortschrittlichen Hubschrauber eine wichtige Rolle bei der Brandbekämpfung. Die Hubschrauber können Wasser- oder Löschmitteltransporte durchführen, um die Feuerwehreinsätze aus der Luft zu unterstützen. Schwer zugängliche oder abgelegene Brandherde können so erreicht werden, wo herkömmliche Methoden möglicherweise eingeschränkt sind. Die Entscheidung zur Anschaffung der Airbus H145 Polizeihubschrauber unterstreicht das Engagement von Niedersachsen und Mecklenburg-Vorpommern, die öffentliche Sicherheit und Ord- nung weiter zu verbessern. Die Zusammenarbeit bei dieser bedeutenden Investition verdeutlicht zudem die Vorteile einer länderübergreifenden Partnerschaft im Bereich der inneren Sicherheit. Technische Daten des Polizeihubschraubers Airbus H145 •Länge: 13,63 Meter •Rotordurchmesser: zirka 11 Meter •Höhe: zirka 4 Meter •Leergewicht: zirka 1.950 Kilo (abhängig von der Konfiguration) •Maximales Startgewicht: zirka 3.800 Kilo •Reisegeschwindigkeit: zirka 135 Knoten (250 km/h) •Höchstgeschwindigkeit: zirka 150 Knoten (280 km/h) •Reichweite: 335 nautische Meilen (620 km) •Flugdauer: Abhängig von verschiedenen Faktoren, aber in der Regel bis zu 3 Stunden (mit Standard-Tanks) •Antrieb: Zwei Turbinentriebwerke •Besatzung: Je nach Konfiguration und Einsatzrolle, typischerweise 1 bis 2 Piloten und 2 bis 3 zusätzliche Besatzungsmitglieder •Passagierkapazität: Je nach Konfiguration und Bestuhlung, in der Regel zwischen 5 bis 8 Passagiere mehr News aus der Region"
64a424b5-c09b-456e-95b3-4a2650d18522,2023-08-30 16:07:00+00:00,"Als Ehrengäste nahmen Hamburgs Erster Bürgermeister Peter Tschentscher und die Koordinatorin der Bundesregierung für die Deutsche Luft- und Raumfahrt, Anna Christmann (Foto), an der Hamburger Einweihungsfeier teil. Dabei durchflog eine Kameradrohne die Anlagen mit deren wichtigsten Produktionsschritten, deren Bilder live auf die Bühne übertragen wurden. Am Ende wurde ein A321-Rumpf feierlich in das erste Taktgestell gelegt, allerdings ein ""LR""-Rumpf, noch keine XLR. Bürgermeister Tschentscher sagte in seiner Rede, Hamburg sei der weltweit drittgrößte Luftfahrtstandort, der 40 Prozent des Außenhandels der Hafenstadt ausmache. 40.000 Mitarbeiter in 300 Unternehmen der Hansestadt arbeiteten für die Luftfahrt. Die Luftfahrtkoordinatorin lobte die A321XLR als das effizienteste Passagierflugzeug der Welt. Sie wünsche sich möglichst bald eine Ergänzung um den Betrieb mit neuen Kraftstoffen, wie synthetischem Kerosin (SAF) oder ""Power to Liquid"", also aus elektrischer Energie gewonnenem, flüssigen Treibstoff. Rümpfe reisen im Taktgestell Die rund 9600 Quadratmeter Fläche große Halle befindet sich an der Nordseite der Anlagen in Finkenwerder, neben den früheren A380-Ausrüstungshallen, die heute ebenfalls der A320-Produktion dienen, und unweit der dort im Freien aufgestellten Airbus-Museumsflugzeuge, wie der ""Super Guppy"". Acht bereits vormontierte Rumpfsektionen der A321XLR, jede etwa so groß wie ein ICE-Wagen, können dort zugleich ausgerüstet werden. Die Rümpfe ruhen auf 80 Tonnen schweren, maßgeschneiderten ""Taktgestellen"", auf denen sie auf einer u-förmigen Bahn durch die Ausrüstungshalle reisen, ohne dass die Arbeiter jeweils aussetzen müssen. 150 Sensoren pro Taktgestell überwachen dessen Bewegungen und Fortschritte im Produktionstakt. Express-U-Bahn zur Teileversorgung Neu ist die logistische Auslegung der Halle, in der bis zu 400 Mitarbeiter in Schichten arbeiten. Die Flugzeugbauer erhalten die von ihnen jeweils benötigte Ausrüstung über ein neuartiges Unterflur-Logistiksystem, das automatisch aus einem Hochregallager bestückt wird. Binnen Minuten wird jedes Teil in einer von 700, automatisch fahrenden, ""blauen Kisten"" über einen sogenannten ""Sequencer"" bedarfsgerecht an die jeweilige Fertigungsstation geliefert und an einem Fahrstuhlturm ausgegeben. Wegen der Unterschiedlichkeit der Ausrüstungsarbeiten sind in der neuen Halle 259 keine Roboter installiert worden. Menschen sind den Maschinen hier noch überlegen. Smarte Tools und Solarstrom Statt mit Druckluft werden viele Arbeiten durch Akkuwerkzeuge, sogenannte ""Smart Tools"", ausgeführt. Jeder Mitarbeiter hat einen Tablet-Computer, der ständig aktuelle Produktionsdaten kennt. Auf dem Dach der Halle gewinnen Solarpanele auf 3000 Quadratmetern Fläche Strom für Halle 259 und Nachbarhallen. In die Südseite der Halle ist ein Bürokomplex mit 186 Arbeitsplätzen integriert, aus dessen Hallenfenstern die direkt beteiligten Programmabteilungen ständig eine Übersicht über den Arbeitsstand in der Halle haben. Ergänzt wird dieser Trakt durch neue Pausenräume mit Spinden und Aufenthaltsbereichen. Auslieferungen ab dem zweiten Quartal Die erste Serien-Hecksektion einer A321XLR soll in etwa drei bis vier Wochen die neue Halle erreichen. Die ersten Serienrümpfe befinden sich bereits in der Strukturmontage. Dafür öffnet Airbus 2024 ebenfalls noch eine neue Halle, die, stärker automatisiert, ebenfalls für den Produktionshochlauf des Standardrumpf-Flaggschiffs A321XLR benötigt wird, für das bereits 570 Bestellungen vorliegen. Die neue Halle kann aber auch A321LR und reguläre A321neo bauen. Noch steht allerdings die EASA-Zulassung der schwersten Version der A320-Familie aus. Airbus plant für das zweite Quartal 2024 aber bereits die ersten Auslieferungen. André Walter, Chef der deutschen Verkehrsflugzeugsparte von Airbus, sagte, man werde alle eventuellen Änderungswünsche der EASA erfüllen, aber man erwarte keine großen Änderungen mehr."
