d871e95b-10c0-4ca8-96b1-a35e0540bccc,2023-08-07 14:42:49+00:00,"Deutschlands größter Raumfahrtkonzern OHB will seine Zukunft durch einen Einstieg des US-Finanzinvestors KKR sichern. Gut 20 Jahre nach dem Börsengang des Bremer Konzerns leitet die bei OHB dominierende Familie Fuchs den Rückzug vom Kapitalmarkt ein. KKR wird den rund 30 Prozent freien Aktionären ein Übernahmeangebot für ihre Anteile unterbreiten. Für den 61-jährigen Konzernchef Marco Fuchs muss die Entscheidung für das „Going Private“ aber nicht endgültig sein. Das OHB-Geschäft wuchs in neue Dimensionen. Doch zu einer Kapitalerhöhung kam es nie, weil sich die Familie nicht von ihrem Kapitalanteil von rund 70 Prozent trennen wollte. Das dämpfte die Fantasie in die OHB-Aktie und vereitelte auch Wachstumschancen, wie etwa eine OHB-Beteiligung an der Airbus-Flugzeugproduktion. Obwohl die Raumfahrt zu den Zukunftsmärkten gehört und mit „New Space“ derzeit eine Aufbruchstimmung herrscht, konnte OHB am Kapitalmarkt nicht mithalten. Nunmehr wird eine Neubewertung angestrebt. Das Unternehmen sei derzeit an der Börse unterbewertet, ist Fuchs überzeugt. Weil der Familienanteil nicht sehr stark sinken und der Konzern eine „deutsche Firma bleiben soll“, ist der Rückzug von der Börse die richtige Lösung, sagt Fuchs. Der Einstieg von KKR bei OHB erinnert an das ähnliche Vorgehen bei der Axel Springer SE (zu der auch WELT gehört). Auch dort wurde die Börsennotierung nach dem Aufkauf der Aktien eingestellt. Mit dem neuen Großaktionär KRR bricht OHB-Chef Fuchs mit einer Tradition. Die Familie – im Kern Marco Fuchs und seine Mutter Christa Fuchs – hatte im Herbst 2022 ihre Anteile von rund 70 Prozent in eine Familienstiftung eingebracht, aber seit gut 20 Jahren noch nie eine Kapitalerhöhung durchgeführt, weil sie ihren Kapitalanteil halten wollte. 44 Euro je Anteil für freie Aktionäre Jetzt erhöht KKR das OHB-Kapital um zehn Prozent, womit dem Konzern etwa 77 Millionen Euro frisches Eigenkapital zufließt. Damit sinkt aber erstmals seit gut zwei Jahrzehnten der Fuchs-Anteil auf 63 Prozent. Gleichzeitig will KKR den freien Aktionären ihre Aktien für 44 Euro je Anteil abkaufen, ein 37-Prozent-Aufschlag zum letzten Börsenkurs. Überdies wird KRR separat 30 Millionen Euro in die OHB-Beteiligung Rocket Factory Augsburg (RFA) über eine Wandelschuldverschreibung investieren. RFA ist eines von drei deutschen Start-up-Unternehmen, die eine neue Trägerrakete entwickeln. Insgesamt kann sich die Investition von KKR in den OHB-Einstieg auf über 300 Millionen Euro summieren. Der Einstieg von KKR bei RFA ist bemerkenswert, weil sich damit ein renommierter US-Investor an einem europäischen Raketenprojekt beteiligt. Mit der KKR-Kapitalspritze hat RFA damit insgesamt rund 80 Millionen Euro eingesammelt. Das reicht angeblich, um die Rakete bis Mitte 2024 zum Premierenflug auf die Startplattform in Schottland zu bringen. OHB mit inzwischen mehr als 3000 Beschäftigten und einer erwarteten Gesamtleistung von 1,2 Milliarden Euro in diesem Jahr will nach eigenen Angaben „der führende Anbieter von Raumfahrtlösungen für institutionelle und kommerzielle Kunden in Europa werden“. Der Bremer Konzern nimmt dabei eine Sandwichposition ein. Er gehört nicht zu den wirklich großen Playern im Markt wie Airbus, Thales Alenia Space oder US-Konzerne – ist aber ein bedeutender Mitspieler im Satellitengeschäft in unterschiedlichsten Anwendungsgebieten und will als weiterhin eigenständiges deutsches Familienunternehmen am Markt operieren. In der Öffentlichkeit wurde OHB vor allem bekannt, als der Bremer Konzern Aufträge für Galileo-Navigationssatelliten gegen den Konkurrenten Airbus gewonnen hat. Mit dem frischen Kapital des Finanzinvestors könnte es nunmehr auch zu kleineren Übernahmen kommen. KKR werde sicher auch dafür sorgen, sagte Fuchs, bei OHB „alles auf Trab zu bringen“."
27e6fb96-35e1-4f3b-9a4a-f43b8feed790,2023-08-07 22:00:00+00:00,"Airbus etwa, einer der weltweit führenden Flugzeugbauer, forscht aktuell unter anderem an zwei Wasserstoff-Optionen für den klimaschonenden Antrieb: dem Verbrennen von Wasserstoff in einer Gasturbine und dem Einsatz von Brennstoffzellen zur Umwandlung von Wasserstoff in elektrische Energie. Der Einsatz von Kerosin ist so nicht mehr nötig. Bei einem Antrieb via Brennstoffzelle und Elektromotor werden dann künftig nicht nur Kohlendioxide, sondern auch Stickoxide und Kondensationsstreifen beim Fliegen vermieden. Die deutschen Airbus-Standorte, darunter Ottobrunn bei München, konzentrieren sich unter anderem auf die Entwicklung der Brennstoffzellen-Technologien. Investitionen in diesem wichtigen Bereich verschaffen Airbus Optionen für die Architektur des zukünftigen klimafreundlichen ZEROe-Flugzeugs, das sich der Konzern als Ziel gesetzt hat. Entscheidend ist, wie schnell sich die Leistungsfähigkeit der Brennstoffzellen erhöhen lässt. Denn nur mit genug Power kann ein Flugzeug abheben. Um diesen Prozess zu beschleunigen, hat Airbus mit dem Automobilzulieferer ElringKlinger ein Gemeinschaftsunternehmen gegründet, das Brennstoffzellen zu einem leistungsfähigeren Modul zusammenfasst. In Ottobrunn erfolgen bereits die nächsten Tests. Im Systemhaus für elektrisches Fliegen werden sechs dieser Systeme zusammengeschaltet, um in die Megawatt-Klasse vorzudringen. Vorgesehen ist, dass ein Triebwerk eine Leistung von 2,5 Megawatt bringt. Auch beim Münchner Triebwerkhersteller MTU Aero Engines beschränkt man sich nicht auf die Entwicklung noch effizienterer Triebwerke. Fürs Fliegen der Zukunft spielt auch hier die Brennstoffzelle eine große Rolle. „Unter anderem treiben wir eine vollständige Elektrifizierung des Antriebsstrangs voran“, erklärt Lars Wagner, Vorstandsvorsitzender der MTU. „Hier hat für uns die Wandlung von flüssigem Wasserstoff in Strom mithilfe einer Brennstoffzelle das größte Potenzial.“ Aktuell arbeiten in München rund 100 Fachleute an einem neuen Antriebskonzept, der sogenannten „Flying Fuel Cell“ (FFC). Ein Entwicklungspartner ist das Deutsche Zentrum für Luft- und Raumfahrt (DLR). Eine Brennstoffzelle wandelt dabei flüssigen Wasserstoff in elektrische Energie um, mit der ein Elektromotor einen Propeller antreibt. Die Vorteile: Brennstoffzellen zeichnen sich durch einen hohen Wirkungsgrad aus. Zudem werden weder CO2 noch Stickoxide oder Partikel ausgestoßen. Emittiert wird lediglich Wasser. Die Klimawirkung sinkt damit laut MTU deutlich – um bis zu 95 Prozent. Aber es gibt auch neue Antriebskonzepte, die auf die Batterie als Stromquelle setzen. Der Luftfahrtzulieferer Diehl Aviation in Nürnberg entwickelt für den Luftfahrzeughersteller Volocopter Steuerungsgeräte für dessen Flug-Taxis. Diese im Fachjargon „eVTOL“ genannten Klein-Luftfahrzeuge werden elektrisch angetrieben und starten senkrecht. In wenigen Jahren sollen sie in kurzen Flügen innerhalb von Städten und Ballungsräumen eingesetzt werden. Auch zahlreiche andere Hersteller stecken gerade in der Entwicklung solcher Maschinen, auch Airbus. „Senkrechtes Starten mit mehreren Propellern stellt hohe Anforderungen an das Steuerungsgerät“, sagt Marc Häming, der bei Diehl die Entwicklung und Vermarktung von Innovationen betreut. Allerdings sei die Thematik für Diehl kein völliges Neuland. Steuerungsgeräte für aktuelle Fliegergenerationen gehören zum klassischen Geschäft von Diehl. Ein weiteres wichtiges Feld fürs nachhaltigere Fliegen bearbeitet Diehl in seinem Geschäftsbereich, der sich um das Innenleben des Flugzeugs dreht. Während des gesamten Lebenszyklus eines Fliegers entfallen auf die Kabine und ihren Betrieb zwischen 10 und 20 Prozent der gesamten Umweltauswirkungen, schätzen Experten. Allein die Innenausstattung macht bis zu 15 Prozent des Leergewichts eines Flugzeugs aus und wird im Laufe der Flugzeuglebensdauer mehrfach erneuert. Mit Innovationen lässt sich hier also immer wieder neu Gewicht sparen. Unter anderem geht es da um den Einsatz neuer Materialien. Sie sollen nachhaltiger in der Produktion und leichter sein. Zugleich haben sie aber auch wichtige Anforderungen zu erfüllen, etwa was den Brandschutz angeht. Das sei immer ein Spagat, ein Abwägen. Allerdings gibt es auch einfache Wege, mit denen man Gewicht sparen kann. Man muss nur darauf kommen. So hat Diehl Aviation ein System entwickelt, mit dem gebrauchtes Wasser aus dem Handwaschbecken für die Spülung der Flugzeugtoilette verwendet wird. Da rund ein Viertel des Frischwassers, das ein Flugzeug beim Start an Bord hat, für die Toilette bestimmt ist, hilft auch das ein wenig weiter. Diehl spricht von im Schnitt 90 Tonnen an CO2-Einsparung pro Flugzeug und Jahr."
d7969dd2-b3af-4758-920c-a5bf99ee8337,2023-08-08 01:00:00+00:00,"Herr Thomé, Sie sind seit Dezember vergangenen Jahres Deutschland-Chef von Airbus Helicopters. Was fasziniert Sie am Bau militärischer und ziviler Hubschrauber hier in Donauwörth?"
74fe62e1-5c3f-43ca-820c-cd10e426b164,2023-08-09 07:52:36+00:00,"Am Anfang standen die Sanktionen. Und schon bald folgten die Warnungen. Die zivile Luftfahrt in Russland sei nicht mehr sicher, erklärte die International Civil Aviation Organization (ICAO), eine Sonderorganisation der Vereinten Nationen, bereits im Juni vergangenen Jahres. Kurze Zeit später schloss sie Russland aus dem Entscheidungsgremium aus. Damit war Russland auf den Sicherheitsstatus von Butan oder Kongo zurückgefallen. Doch anderthalb Jahre nach Kriegsausbruch sind dort und in anderen Teilen der Welt die Boeing- und Airbus-Maschinen der russischen Airlines weiter im Einsatz. WELT erklärt, wie das möglich ist."
5ff3176d-e74b-4e08-bcad-df5ce03956b5,2023-08-09 10:27:33+00:00,"Airbus Helicopters baut seine Energieversorgung klimaverträglich um und setzt dabei vor allem auf Photovoltaik (PV). Doch das Repertoire der Energieoptimierungen reicht weiter. Alles aus der Welt der Technik Ein Beitrag von: Christian Dany arbeitet seit 2006 als freier Journalist im Themenkomplex Umwelt, Landwirtschaft und erneuerbare Energien. Gelernter Diplom-Ingenieur für Landespflege mit Studium an der FH Weihenstephan-Triesdorf. Nach fünfjährige Tätigkeit in einem Büro für Städtebau und Landschaftsplanung wechselte er nach einem Volontariat dann in den Journalismus. News-Alert: VDI nachrichten digital Alles, was Sie wissen müssen - der Blick auf die wichtigsten VDI nachrichten-Beiträge aus der Welt der Technik. Jeden Dienstag kostenfrei in Ihrem Postfach. Jetzt anmelden Stellenangebote NORDEX GROUP SCADA Projektingenieur (m/w/d) Hamburg, Rostock Bundesamt für Bauwesen und Raumordnung (BBR) Ingenieurinnen / Ingenieure (w/m/d) für Versorgungstechnik bzw. Gebäudeautomation Berlin Maschinenfabrik Herkules Meuselwitz GmbH CE-Koordinator (m/w/d) in der mechanischen Konstruktion Meuselwitz IU Internationale Hochschule GmbH Professur Bauingenieurwesen im Dualen Studium (m/w/d) Münster IU Internationale Hochschule GmbH Professur Bauingenieurwesen im Dualen Studium (m/w/d) Hamburg IU Internationale Hochschule GmbH Professur Bauingenieurwesen im Dualen Studium (m/w/d) Leipzig IU Internationale Hochschule GmbH Professur Bauingenieurwesen im Dualen Studium (m/w/d) Stuttgart IU Internationale Hochschule GmbH Professur Bauingenieurwesen im Dualen Studium (m/w/d) Frankfurt am Main IU Internationale Hochschule GmbH Professur Bauingenieurwesen im Dualen Studium (m/w/d) Hannover Technische Hochschule Mittelhessen W2-Professur mit dem Fachgebiet Veranstaltungswirtschaft mit den Schwerpunkten BWL und technisches Informationsmanagement Gießen Zur Jobbörse Das könnte Sie auch interessieren Empfehlungen des Verlags"
23de7cf5-7d58-425d-8eb2-777c814875c9,2023-08-10 04:00:00+00:00,"Seit zehn Jahren trägt ein Airbus A319 der Lufthansa den Namen der Stadt Frankenthal in die Welt. Mehr als 21.800 Flüge hat die Maschine inzwischen absolviert und über 1,9 Millionen Passagiere transportiert. Die „Frankenthal“ fliegt Ziele in ganz Europa, Nordafrika und im Nahen Osten an. Überzeugten Frankenthalern war schon immer klar: Eines Tages wird es für die Stadt hoch hinaus gehen. Zumindest auf ihren Namen und ihr Wappen"
6c3f866c-f6c5-4ca4-ac79-8e3c3be9b853,2023-08-10 08:36:50+00:00,"Flugverkehr der Zukunft Der komplexe Weg zum klimaneutralen Fliegen Auch in Baden-Württemberg forscht man in Sachen klimaneutrales Fliegen. Doch der Teufel steckt im Detail, und manchmal behindert auch die Bürokratie Auch Baden-Württemberg soll im Rahmen seiner Möglichkeiten nach dem Willen der Landesregierung einen weniger klimaschädlichen Flugverkehr erreichen. Neue Kraftstoffe und Technologien Im Visier ist der Einsatz alternativer Flugkraftstoffe, die Optimierung der Abläufe sowie die Entwicklung neuer effizienterer Technologien und Flugzeugtypen. Über den Weg dahin und die Erfolgsaussichten gibt es allerdings unterschiedliche Einschätzungen. Unser Korrespondent beantwortet die wichtigsten Fragen. Was sind die technologischen Ansätze, die für eine Umstellung verfolgt werden? Aktuell wird an drei technologischen Ansätzen geforscht: Synthetische Kraftstoffe (Sustainable Aviation Fuels/SAF, reFuels), Brennstoffzellenantriebe sowie rein elektrische Luftfahrzeuge. SAF ist ein Oberbegriff für alle nachhaltig produzierten Flugkraftstoffe. Die EU will ab 2025 die Beimischung von SAF stufenweise für herkömmliches Kerosin vorschreiben. Zu SAF zählen Power-to-liquid-Kraftstoffe (PtL)und Biokraftstoffe. Ausgangsmaterialien für Biokraftstoffe können zum Beispiel fetthaltige und cellulosehaltige Pflanzen oder auch Bioreste sein. Für PtL-Kraftstoffe wird aus Wasserstoff und Kohlendioxid ein Synthesegas erstellt. Aus dem Synthesegas, Pflanzen und Bioresten lässt sich dann in verschiedenen Verfahren Kerosin gewinnen. „Es wird sich in einigen Jahren zeigen, welcher Energieträger sich durchsetzt. Das Land fördert hier technologieneutral“, heißt es in einer Antwort des Verkehrsministeriums auf eine Anfrage der Grünen-Landtagsfraktion. Was genau passiert in dieser Sache in Baden-Württemberg und vor allem am größten Flughafen im Land in Stuttgart? Nicht nur große Flugzeughersteller wie Airbus, sondern auch das Stuttgarter Start-up H2Fly forschen an Wasserstoffflugzeugen, Kopf ist der Ulmer Professor Josef Kallo. Am 29. September 2016 hatte das Testflugzeug HY4 seinen Erstflug. Es hat einen Elektroantrieb, wird mit Brennstoffzellen und Batterien angetrieben und kann vier Personen mehrere hundert Kilometer weit transportieren. Für größere Flugzeuge müssen vor allem leichtere Brennstoffzellen und Batterien entwickelt werden. Daran wird bei H2Fly im Projekt Exzellenzzentrum für wasserstoffelektrische Luftfahrt am Flughafen Stuttgart gearbeitet. Wie weit ist das Projekt und wie sieht die Förderung des Landes aus? Das Land fördert seit 2022 den Aufbau des Exzellenzzentrums unter Leitung von H2FLY mit 5,5 Millionen Euro. Ziel ist es, eine bis zu 40 Sitzplätze fassende Dornier 328 mit wasserstoffelektrischem Antrieb zur Marktreife zu bringen. Am 30. Januar 2023 wurde zusammen mit H2Fly der Projektstart für den Bau eines Hydrogen Aviation Centers bekannt gegeben. Laut Landesregierung soll im zweiten Halbjahr 2024 mit dem Bau des Hangars in Stuttgart begonnen werden. Allerdings ist die Landesregierung überzeugt, dass Luftfahrzeuge mit Brennstoffzellenantrieb oder batterieelektrischem Antrieb aus „Gewichtsgründen voraussichtlich zunächst nur für Passagierkapazitäten mit bis zu 40 Sitzplätzen und begrenzte Reichweiten zur Verfügung stehen“, man sehe das Land dabei aber „sowohl im nationalen als auch im internationalen Vergleich in einer guten Ausgangsposition“. Welche Mitspieler gibt es noch neben dem Stuttgarter Flughafen und H2Fly? Dabei verweist das Land auch auf das Bruchsaler Unternehmen Volocopter und die Aerostack GmbH. Dies ist ein Joint Venture von Airbus und dem schwäbischen Autozulieferer ElringKlinger, um Brennstoffzellen für die Personenluftfahrt zu entwickeln. ElringKlinger soll seine Brennstoffzellentechnologie einbringen. Hinzu kommen Forschungseinrichtungen wie an der Universität Stuttgart und die DLR Institute für Bauweisen und Strukturtechnologie, für Verbrennungstechnik und für technische Thermodynamik, die ebenfalls vom Land gefördert werden. Zudem fördert das Land am DLR-Standort Lampoldshausen das Wasserstoff-Technikum und damit die Produktion von grünem Wasserstoff. Steht Baden-Württemberg damit gut da oder gibt es auch Kritik? Der FDP-Verkehrs- und Wirtschaftsexperte Hans Dieter Scheerer beklagt eine „negative Meinungsmache“ gegen das Fliegen. Immer wieder werde dogmatisch beispielsweise ein Verbot von Kurzstreckenflügen gefordert, obwohl diese „fast ausschließlich Zubringer zu langen internationalen Flügen“ seien. Zudem seien die regionalen Flughäfen, wie auch Baden-Baden/Karlsruhe, wichtige Wirtschaftsfaktoren mit unzähligen Arbeitsplätzen für ihre Region. „Im internationalen Vergleich hinken wir deshalb teilweise hinterher – speziell mit Blick auf die USA.“ Dort arbeiten Alaska Airlines und ZeroAvia an der Entwicklung des bisher größten emissionsfreien Flugzeugs der Welt. Ein ausgemustertes Flugzeug des Typs Bombardier Q400 mit 76 Sitzplätzen wird mit einem wasserstoffelektrischen Antriebssystem ausgerüstet. Im Juni 2023 besuchte eine baden-württembergische Regierungsdelegation den Sitz von Alaska Airlines in Seattle und zeigte sich beeindruckt von den Planungen des Unternehmens auf dem Weg zu „zero emission aviation“. „Um solche Innovationen letztendlich auch bei uns zu haben, muss nicht ein Umdenken der Menschen weg vom Fliegen, sondern der Landespolitik weg von einer falschen Anti-Fliegen-Ideologie stattfinden“, ist Scheerer überzeugt. Wie steht es um die Klimaneutralität des direkten Flughafenbetriebs in Stuttgart? Stuttgart soll „dauerhaft einer der leistungsstärksten und nachhaltigsten Flughäfen in Europa sein“, so der Anspruch der Landesregierung. Vieles ist in der Tat schon passiert, andere Dinge laufen oder sind in Vorbereitung. Am Flughafen werden die meisten Fahrzeuge bereits vollständig elektrisch betrieben. Eine große Ausnahme sind noch die schweren Tankwagen. Bis 2025 sollen die weitere Elektrifizierung schwerer Fahrzeuge erfolgen sowie der Ausbau der Wärmespeicher und der erneuerbaren Wärmeerzeugung vorangetrieben werden. Bis 2030 soll die Vorfeldflotte (Gepäckschlepper, Passagierbusse oder Pushback-Fahrzeuge) gänzlich klimaneutral betrieben werden. Für entscheidend hält der Flughafen die energetische Sanierung der Betriebsgebäude. Dazu zählen insbesondere die teilweise über dreißig Jahre alten Terminals. Die energetische Sanierung der Terminalgebäude 1 bis 3 soll laut Landesregierung zwischen 2035 und 2040 stattfinden. Läuft dies am Stuttgarter Flughafen alles reibungslos? „Bürokratie ist leider, wie mittlerweile in fast allen Bereichen unseres Lebens, eines der größten Probleme und Hindernisse“, ist der FDP-Landtagsabgeordnete Scheerer überzeugt und nennt ein Beispiel: Der Flughafen Stuttgart möchte auf einem Großteil der Grünflächen im Flughafengebiet Photovoltaikanlagen bauen, um so den Strom- und Energiebedarf für seine vollelektrische Fahrzeugflotte und für seine Kunden zu decken. „Diese PV-Anlagen werden aber von der unteren Naturschutzbehörde (Landratsamt Esslingen) nicht genehmigt, weil eventuell Rebhühner auf den Wiesen des Flughafens leben und die Anlagen dann einen größeren Mindestabstand zum Boden brauchen. Das kann aber auch nicht einfach so gebaut werden, da gleichzeitig die Einfallswinkel des Lichts beachtet und ein mögliches Blenden der Piloten ausgeschlossen werden müssen“, sagt Scheerer. Mehr zum Thema Rechte am Artikel erwerben Zur Startseite"
af3630f3-4a09-4615-ae7f-30b8318d313b,2023-08-10 16:45:00+00:00,"Gütersloh (din) - Wer schon mal mit einem Airbus in den Urlaub geflogen ist, der hat mit ziemlicher Sicherheit auch durch Produkte der Firma BSA geschaut. Der Gütersloher Kunststofftechnik-Spezialist fertigt Innenscheiben für den Flugzeughersteller. Die Geschichte dieses Start-ups beginnt nicht in… Glocke Plus Artikel Jetzt weiterlesen mit G+ Abo, Angebot auswählen oder anmelden. 79,00 € (ab dem 13. Monat zzt. 7,90 € mtl.) Mindestlaufzeit 12 Monate nach 12 Monaten monatlich kündbar 79,00 € für 12 Monate Alle Plus-Artikel auf www.die-glocke.de lesen für 0,99 € im ersten Monat testen Danach 7,90 € mtl. Monatlich kündbar 0,99 € im 1. Monat"
b0ec04c4-c052-4b04-8f84-7fe72f5993b9,2023-08-13 07:30:10+00:00,"Fast jeder Spitzenpolitiker der Ampel war bereits mit Korruptionsvorwürfen konfrontiert: Scholz rund um die „Cum-Ex“-Deals, Lindner wegen Absprachen mit „Porsche“, Habeck aufgrund der Verwandschaftsklüngel in seinem Ministerium. Nun der vielleicht nächste Fall von Vetternwirtschaft: im Verkehrsministerium unter FDP-Führung soll ein Abteilungsleiter einem befreundeten Unternehmer staatliche Subventionen in Höhe von insgesamt fast 100 Millionen Euro zugeschustert haben. Die Beiden kennen sich unter anderem vom gemeinsamen Skifahren. Die Bundesregierung nimmt derzeit Milliarden Euro in die Hand, um Kapitalist:innen beim Aufbau von Unternehmen in der Wasserstoffbranche zu subventionieren. So wurde etwa im Juni 2020 im Rahmen des 130-Milliarden-Euro Konjunkturpakets entschieden, 9 Milliarden Euro im Rahmen einer „nationalen Wasserstoffstrategie“ bereitzustellen. Erst kurz darauf, im Oktober 2020, wird nach Informationen des Handesblatts das Unternehmen „Cryomotive“ gegründet, das gleich „prominent im politischen Raum“ auftaucht, etwa bei einem runden Tisch der EU-Kommission zur europäischen „Clean Hydrogen Alliance“. Hier sollen gemeinsame Projekte mit Steuergeldern subventioniert werden, Deutschland stellt Milliarden bereit. Mit am Tisch sitzen Branchenriesen wie Airbus oder BMW – und der Kleinunternehmer von Cryomotive GmbH. Dieser Unternehmer soll vom Bund bereits 72,5 Millionen Euro erhalten, um ein Wasserstoffzentrum in Niederbayern aufzubauen. Aus dem EU-Topf sollen noch weitere 26 Millionen hinzukommen. Wie das Handelsblatt berichtet, war an diesen Prozessen auch ein Abteilungsleiter aus dem Verkehrsministerium – das unter Führung des FDP-Politikers Volker Wissing steht – „maßgeblich beteiligt“. Man kennt sich vom gemeinsamen Skifahren Das Anrüchige an der Sache: der Abteilungsleiter und der Unternehmer sind eng befreundet und sollen unter anderem gemeinsam Skiurlaube verbracht haben. Und noch eine weitere Person gehört mutmaßlich zu diesem Freundeskreis, nämlich eine Führungspersönlichkeit des Deutschen Wasserstoff- und Brennstoffzellenverbands DWV. Auch er hat Zuschläge für die europäischen Projektgelder bekommen. Pikant ist zudem, dass die Informationen über die mutmaßliche Vetternwirtschaft aus Kreisen der Bundesregierung selber durchgestochen worden sein sollen. Damit soll vermutlich von den jeweils eigenen Skandalen abgelenkt werden, denn davon gibt es reichlich: die Verbindungen von Christian Lindner zum Chef des Autobauers Porsche, dem er direkt und ungefiltert aus den Koalitionsverhandlungen berichtete („Porsche-Gate“), die Vetternwirtschaft beim Staatssekretär des grünen Wirtschaftsministers Robert Habeck, Patrick Graichen („Trauzeugen-Affaire“) oder der Warburg-Skandal rund um Bundeskanzler Olaf Scholz („Cum-Ex-Affaire“)."
