b9e2b26c-e768-4355-93b1-402c01bf16e6,2023-05-24 15:03:00+00:00,"Hamburg. Kranichlinie übernimmt in Finkenwerder 600. Airbus-Maschine. Carsten Spohr wagt eine Prognose für den kommenden Sommer. Eine spezielle Lackierung für ein historisches Ereignis: Eine silberfarbene 600 ziert den Rumpf des A321neo. Im firmentypischen Blau prangt über der Zahl der Schriftzug Lufthansa, daneben Airbus. Es ist der 600. Flieger, den der paneuropäische Hersteller mit seinem großen Werk in Hamburg an die deutsche Fluglinie ausgeliefert hat. Damit habe die Kranich-Linie mehr Exemplare erhalten „als jede andere Airline in der Welt“, sagte Airbus-Chef Guillaume Faury am Mittwoch bei einer Feierstunde auf dem Betriebsflughafen auf Finkenwerder. Airbus liefert 600. Jet an Lufthansa aus Die gemeinsame Geschichte beider Unternehmen begann am 25. Juni 1975 mit der Unterzeichnung des Kaufvertrags über drei A300 B2. Der A300 ist ein rund 54 Meter langer Großraumjet, von dem bis zum Produktionsende 2007 in Toulouse 561 Exemplare zusammengebaut wurden. Entwickelt wurde er für Kurz- und Mittelstrecken und maximal 345 Passagiere. Er war das erste Projekt der zu Airbus fusionierten Flugzeugwerke. Im Februar 1976 wurde das erste dieser Flugzeuge an die Kranich-Linie übergeben. Am 1. April 1976 war die Maschine erstmals im Linieneinsatz. „Lufthansa und Airbus sind Partner seit der ersten A300-Maschine“, sagte Faury und verwies auf viele historische gemeinsame Momente: „Seitdem hat die Airline im Durchschnitt jeden Monat ein Flugzeug von Airbus übernommen – das summiert sich auf 600 in bald 50 Jahren.“ 1994 übernahm Lufthansa den ersten A321-Jet Im Laufe der Jahre wurden Airbus-Jets verschiedenster Typen in die Lufthansa-Flotte integriert. Im Oktober 1989 war es der erste A320, der in Toulouse übergeben wurde. Anfang 1994 gab es die Premiere für den mit 44,50 sieben Meter längeren A321, der damals ausschließlich auf Finkenwerder endmontiert wurde. Zu den Höhepunkten zählte auch die Übernahme des ersten A380. Der Riesen-Airbus wechselte am 19. Mai 2010 erstmals in die Kranich-Formation. „Ich freue mich sehr auf den A380 – und auch schon sehr lange“, sagte Lufthansa-Chef Wolfgang Mayrhuber damals. Selbst den A380-Jet will Lufthansa reaktivieren Im Anschluss kühlte die Liebe allerdings stark ab. Neue Flieger wie Boeings Dreamliner und der Airbus-Großraumjet A350 können deutlich effizienter betrieben werden und gruben dem größten Passagierflugzeug der Welt das Wasser ab. Letztlich beendete Airbus die A380-Produktion vor zwei Jahren. Bei der Lufthansa schien das Schicksal des Riesenjets schon besiegelt, seine Ausmusterung galt in der Corona-Krise als beschlossene Sache. Doch nun haben erste A380-Maschinen den Langzeitparkplatz in Teruel (Spanien) verlassen und sollen zurück in den Liniendienst kehren. Airbus: Vom ausgelieferten A321neo hat Lufthansa 40 Flieger bestellt Von dem am Mittwoch übergebenen A321neo hat die Lufthansa 40 Exemplare bestellt. Bis Ende April waren 17 davon ausgeliefert. Sie haben im Vergleich zur Vorgängergeneration neue Triebwerke und sparen durch diese und andere Veränderungen Sprit. Bei der Einführung der Neo-Reihe – neo steht für new engine option, also die Möglichkeit, ein neues Triebwerk anzubauen – sprach man davon, etwa 15 Prozent Kerosin zu sparen. Die Performancewerte bezüglich des Treibstoffverbrauchs und damit auch der Emissionen seien besser, als beim Verkauf vereinbart gewesen sei, sagte Spohr im kurzen Gespräch mit unserer Redaktion: „Wir sind mit der Neo-Reihe sehr zufrieden.“ Spohr liebt die A320neo-Familie Das war bei dem Markteintritt der A320neo-Reihe nicht jeder Kunde. Hamburg ist für die Familie das Kompetenzzentrum. Etwa jeder zweite Flieger des Verkaufsschlagers wird an der Elbe endmontiert. Eigentlich hätte Qatar Airways Erstkunde des Jets sein sollen. Allerdings machten die Motoren des US-Herstellers Pratt & Whitney insbesondere bei hohen Temperaturen Probleme – und die herrschen in der Golfregion nahezu ganzjährig. Qatar verzichtete unter medialem Trommelwirbel. Die Lufthansa sprang ein und übernahm Anfang 2016 auf Finkenwerder den ersten A320neo. „Wir sind nicht nur der größte Airbus-Kunde, sondern auch einer der loyalesten Airbus-Kunden der Welt“, sagte Spohr. Die Anfangsprobleme seien verschwunden. Allerdings macht der US-Triebwerksbauer erneut Schwierigkeiten. Er kann nicht genug Motoren liefern, sodass es zu Verzögerungen kommt. Airbus kämpft zudem seit Monaten mit Problemen in der Zuliefererkette, sodass „wir deswegen diese Flugzeuge jeweils Monate zu spät bekommen“, sagte Spohr: „Wenn sie aber mal da sind, dann lieben wir sie.“ Faury: Die Leute wollen wie früher fliegen Schneller zurückgekehrt als erwartet ist nach der Corona-Krise offenbar die Lust der Menschen zu verreisen. „Die Leute wollen so wie früher fliegen“, sagte Faury: „Dies darf aber nicht auf Kosten künftiger Generationen gehen.“ Man arbeite bei der Dekarbonisierung der Luftfahrt mit Lufthansa zusammen, sagte der Airbus-Chef. Die A320neo-Familie und der moderne Großraumjet A350 spielten dabei eine vitale Rolle, denn sie würden den Treibstoffverbrauch im Vergleich zur Vorgängergenerationen um 25 Prozent senken. Im Auftragsbuch von Airbus stehen auch noch mehr als 40 A350 für die Kranich-Linie. Allerdings verbrennen auch diese Flieger Kerosin und stoßen klimaschädliche Gase aus. Faury verwies darauf, dass beide Maschinen bereits heute mit 50 Prozent Sustainable Aviation Fuel (SAF) – also nachhaltig erzeugtem Flugtreibstoff – fliegen könnten. Spohr hofft auf einen besseren Sommer als 2022 Allerdings gibt es SAF nicht in den erforderlichen Mengen, und es ist teuer. Auf Langstreckenflüge dürfte er zukünftig das Mittel der Wahl sein. Auf kurzen und mittleren Strecken hofft Airbus hingegen auf den Einsatz eines mit grün erzeugtem Wasserstoff angetriebenen Flugzeug, das 2035 auf den Markt kommen soll. Noch ist es aber ferne Zukunftsmusik. Viele Deutsche träumen dagegen schon von den Sommerferien – doch was werden sie dort an den Flughäfen erleben? Wieder ein Flugchaos mit vielen verlorenen Koffern, Verspätungen und gestrichenen Flügen? „Ich bin zuversichtlich, dass dieser Sommer besser wird als der letzte Sommer“, sagte Spohr: „Ob er schon so richtig gut wird, diese Aussage wage ich noch nicht.“ Lufthansa-Chef sieht das Umfeld als „herausfordernd“ an Allein die Lufthansa habe dieses Jahr 6000 Mitarbeiter eingestellt, aber es fehle in der Branche an vielen Stellen noch an Personal. In Fuhlsbüttel war dies jüngst vor allem bei den Luftsicherheitskräften zu spüren. Es kam wie im Vorjahr zu langen Wartezeiten an der Sicherheitskontrolle. Airbus lässt Passagierjets jetzt in China abwracken Luftfahrt-Zulieferer in Hamburg kämpfen mit Schwierigkeiten Wasserstoff-Flugzeug soll spätestens 2026 in Hamburg starten Es brauche mehr Mitarbeiter, bessere Technologien für die Sicherheitskontrollen – es gibt neue Scanner, bei denen Flüssigkeiten nicht mehr aus dem Handgepäck genommen werden müssen – und einen besseren Ablauf der Prozesse. Zudem werden im Juni Teile des deutschen Luftraums wegen der Nato-Übung „Air Defender“ gesperrt, so Spohr: „Es wird herausfordernd bleiben.“ Lufthansa: Für den 100. Geburtstag hat Spohr einen besonderen Wunsch Am Mittwoch war Spohr aber vor allem sehr glücklich über die einzigartige Zahl 600. „Es gibt nicht sehr viele europäische Erfolgsgeschichten wie die von Airbus“, sagte er. Immerhin ist der DAX-Konzern dem Erzrivalen Boeing enteilt und zum größten Flugzeugbauer der Welt aufgestiegen. Der Lufthansa-Chef zog Parallelen zu seiner Airline, die sich immer mehr zu einem wichtigen europäischen Spieler entwickele. Demnächst könnte nach Swiss, Austrian und Brussels auch noch eine italienische Airline zum Portfolio gehören. Die neue Fluglinie ITA Airways soll zum Teil einverleibt werden. Einen Wunsch hatte der Lufthansa-Chef zum Abschluss noch an seinen Gastgeber auf Finkenwerder: „Zum 100. Geburtstag von Lufthansa im Jahr 2026 wünschen wir uns das 700. Airbus-Flugzeug in unserer Flotte“, so Spohr – offen, ob sich das in den stark ausgebuchten Airbus-Werken realisieren lässt."
c2c4ac78-f1f2-41cd-8bb4-e48daa541fcb,2023-05-24 18:04:42+00:00,"Es ist das jüngste Modell, das Airbus auch als Geschäftsreiseflugzeuge anbietet: Der ACJ Two Twenty. 2020 hat sich der europäische Hersteller entschieden, auch die von Bombardier übernommene Flugzeugfamilie in einer Businessjet-Version anzubieten. Knapp zwei Jahre später präsentiert Airbus auf der Luftfahrtmesse Ebace in Genf erstmals die ACJ Two Twenty mit fertiger Kabine. Eine Airbus-Sprecherin erklärt gegenüber aeroTELEGRAPH, dass man seit dem Programmstart acht Maschinen des Typs verkauft habe. Hauptabnehmer ist mit sechs georderten Maschinen Comlux. Die Schweizer Firma ist auf Kauf, Verkauf, Betrieb und Chartergeschäft von Jets für VIP-Kunden spezialisiert. Die beiden weiteren Jets haben Privatkunden gekauft. Erst im Januar übergeben Der auf der Ebace gezeigte Jet ist erst im Januar ausgeliefert worden und trägt das Kennzeichen 9H-FIVE. Er gehört dem Hotel-Mogul Kabir Mulchandani und dessen Unternehmen Five Hotels aus Dubai. Der Unternehmer will das Flugzeug mit seiner Familie nutzen, aber auch wohlhabende Hotelgäste in der Maschine befördern. Airbus bietet die Maschine in 100 verschiedenen Kabinenkonfigurationen an. Aber auch der Kauf einer komplett leeren Maschine ist möglich. Lufthansa Technik hatte am 23. Mai angekündigt, Konfigurationen als Regierungsflieger sowie als Ambulanzflugzeug zu entwickeln. Mindestens 80 Millionen Euro aeroTELEGRAPH durfte einen Blick in die mindestens 80 Millionen Euro teure Maschine werfen. In der oben stehenden Bildergalerie sehen Sie die ACJ Two Twenty von innen."
9b1b515c-f3f9-448b-b27a-71bfa0cad925,2023-05-25 12:27:14+00:00,"Das System IRIS-T SLM hat seit seiner Indienststellung in der Ukraine eine hervorragende Leistungsfähigkeit unter Gefechtsbedingungen unter Beweis gestellt. Laut Kundenaussagen hat das System eine Trefferquote von 100 Prozent sogar in Angriffswellen mit über 12 Zielen erzielt. Die Beschaffung des Systems für die Bundeswehr ist ebenfalls geplant. Sowohl die hohe Lieferkadenz als auch die schnelle Befähigung und Ausbildung sowie die außerordentliche Leistungsfähigkeit von IRIS-T SLM ist der soliden Partnerschaft der drei beteiligten Unternehmen zu verdanken. Diehl Defence ist für IRIS-T SLM der Generalunternehmer und Systemintegrator aller Komponenten; ebenso liefert das Unternehmen das Startgerät und die Lenkflugkörper. HENSOLDT trägt das Multifunktionsradar TRML-4D bei. Von Airbus stammt die Gefechtsstand-Software IBMS-FC (Integrated Battle Management Software Fire Control). Diehl Defence, HENSOLDT und Airbus arbeiten seit Langem auf dem Gebiet der bodengebundenen Luftverteidigungssysteme zusammen. Zudem befindet sich der Lenkflugkörper IRIS-T SLX mit einer weiter gesteigerten Leistung von bis zu 80 km Reichweite und 30 km Höhenabdeckung in Entwicklung. Die Leistungsdaten können durch geringe Anpassungen an Radar und Gefechtsstand mit neuen Effektoren erreicht werden. Dabei behält IRIS-T SLM seine wesentlichen Eigenschaften als System für mittlere Reichweiten und kann weiterhin mit hoher taktischer Mobilität, Dislozierbarkeit der Startgeräte und Mehrfachzielbekämpfung bei geringem Personalaufwand agieren. Auch bei IRIS-T SLX sind HENSOLDT und Airbus Partner von Diehl Defence. Die gemeinsamen Lösungen von Diehl Defence, Airbus und HENSOLDT sind als rein deutsche Systeme nicht auf ausländische Technologie angewiesen und bieten deshalb ein Höchstmaß an Zulassbarkeit und Zertifizierbarkeit zum Betrieb in Deutschland und darüber hinaus eine höchstmögliche Versorgungssicherheit. Gleichzeitig sind sie mit der integrierten Luftverteidigungsarchitektur der NATO voll kompatibel und haben ihre Interoperabilität unter Beweis gestellt."
114ae9d3-0293-4439-aac3-96b40f93cf8a,2023-05-26 07:24:00+00:00,"Der Airbus ACJ Two Twenty ist der kleinste Bizliner des europäischen Flugzeugbauers, dessen Geschäftsfliegersparte Airbus Corporate Jets Airliner bis zu A330 und A350 in VIP-Konfiguration fertigt. Wirklich ""klein"" ist aber selbst die Two Twenty nicht. Weil das Flugzeug auf dem Airbus-Verkehrsflugzeug A220-100 (ehemals Bombardier CSeries) basiert, ist sein Passagierraum nach Angaben des Herstellers dreimal so geräumig wie bei Business Jets, die nicht von einem Linienflugzeug abstammen. Die Two-Twenty-Kabine erstreckt sich auf beeindruckende 73 Quadratmeter Fläche. Küche, Wohnzimmer, Schlafzimmer, Bad mit Dusche: Das Flugzeug ist eine Luxus-Dreizimmerwohnung über den Wolken! Sogar zwei 55-Zoll-Fernseher sind an Bord, Internet im Flug bedarf da keiner Erwähnung mehr. Die insgesamt sechs Kabinensektionen lassen sich modular zusammensetzen, so sind mehr als 100 Ausstattungskombinationen möglich. Auch Sonderwünsche sind bei dem 80 Millionen Euro teuren VIP-Jet realisierbar. Bis zu zwölf Stunden in der Luft Nicht weniger beeindruckend sind die Flugleistungen der ACJ Two Twenty: Die Reichweite beträgt 5650 Nautische Meilen, bis zu zwölf Stunden kann der Jet in der Luft bleiben. Für die Crew gibt es deshalb im vorderen Rumpfbereich einen Ruheraum. Christof Brenner Acht dieser Luxusflugzeuge hat Airbus bereits verkauft, Erstkunde ist Comlux. Das Unternehmen fertigt in Indianapolis die Innenausstattung des Bizliners. Die erste Maschine wurde Anfang des Jahres an die in Dubai ansässige Luxushotellkette Five ausgeliefert. Dementsprechend die Registrierung des Flugzeugs: 9H-FIVE, am Funk gesprochen ""Nine Hotel Five"". Normalerweise sehen nur gutbetuchte Hotelgäste und die Familie von Firmenchef und -gründer Kabir Mulchandani das Innere des Luxusjets. Selbst auf der Geschäftsfliegermesse EBACE in Genf, wo der Luxusjet jetzt erstmals präsentiert wurde, waren Einladungen für eine Besichtigung rar. Wir waren unter den wenigen Gästen, die während der Messe zum Fototermin an Bord durften. Die Galerie beweist: Die Two Twenty ist einzigartig!"
5806fa97-4568-4755-9f26-5db7f749d14a,2023-05-26 16:15:45+00:00,"ITA Airways, Italiens nationale Fluggesellschaft, hat im Rahmen einer Zeremonie in Toulouse ihre erste A330-900 übernommen, die von der Air Lease Corporation (ALC) (NYSE: AL) geleast wurde. Die A330neo wird im Juni in die Flotte von ITA Airways aufgenommen, um deren Langstreckenstrecken und neue interkontinentale Ziele zu bedienen. Die A330neo ist der Flugzeugtyp der neuesten Generation von Airbus, der die Flotte von ITA Airways ergänzt. Die Fluggesellschaft betreibt bereits alle Airbus-Flugzeugfamilien mit einer Flotte von 68 Airbus-Flugzeugen (4 A220, 50 A320-Familie, 8 A330-200 und 6 A350-900). Mit der Entscheidung für die A330neo festigt ITA Airways seine Strategie, ein reiner Airbus-Betreiber zu sein und ein neues Maß an Effizienz und Flexibilität zu erreichen. Mit der Einführung des ökoeffizienten A330neo der neuesten Generation modernisiert ITA Airways seine Flotte weiter, um seine ehrgeizigen Nachhaltigkeitsziele zu erreichen. Um dieses Ziel weiter zu unterstützen, wird der Auslieferungsflug mit einer 16-prozentigen Mischung aus nachhaltigem Flugtreibstoff (SAF) betrieben. Die A330neo bietet unschlagbare Betriebswirtschaftlichkeit und verfügt über eine preisgekrönte Airspace-Kabine mit mehr Passagierraum, ein neues Beleuchtungssystem, die neuesten Bordunterhaltungssysteme und vollständige Konnektivität in der gesamten Kabine. Siehe auch: Mit dem Recht auf einen unglaublichen Tiefpass erhält Argentinien seine neue Präsidenten-Boeing 757 GOL ist das erste brasilianische Unternehmen, das von der ANAC autorisierte digitale Navigation nutzt Brasilien feiert neuen LATAM-Flug nach Aruba mit Anschlussflug in Lima Der A330neo von ITA Airways mit dem Namen Gelindo Bordin, der an den italienischen Marathon-Olympiasieger erinnert, wird über eine Kabinenanordnung mit drei Klassen verfügen, die vom renommierten Designer Walter De Silva entworfen wurde. Es wird über 30 voll verstellbare Sitze in der Business Class, 24 Premium-Sitze und 237 Sitze in der Economy Class der neuesten Generation verfügen, davon 36 für die Comfort Economy Class. Alle Sitze werden mit On-Demand-Video- und Audioinhalten sowie vollständiger Wi-Fi-Konnektivität und einer individuell anpassbaren Umgebungsbeleuchtung in der gesamten Kabine ausgestattet sein. Der A330neo ist die neue Generation des beliebten Großraumflugzeugs A330. Mit Rolls-Royce Trent 7000-Triebwerken der neuesten Generation, neuen Flügeln und einer Reihe aerodynamischer Innovationen bietet das Flugzeug eine Reduzierung des Treibstoffverbrauchs und der CO25-Emissionen um 2 %. Der A330-900 ist in der Lage, 7.200 Seemeilen bzw. 13.334 km nonstop zu fliegen. Ende April hatte die A330-Familie insgesamt mehr als 1.775 Festbestellungen, davon 289 A330neos von 25 Kunden. Bisher wurden weltweit 100 A330neos ausgeliefert."
bc496a5a-2bf9-4bb1-883f-80d67f5110a9,2023-05-26 21:42:43+00:00,"Passagiere von Asiana Airlines, die sich auf dem Flug OZ-8124 von Jeju nach Daegu (Südkorea) befanden, waren heute überrascht (26), nachdem kurz vor der Landung die Nottür des Flugzeugs geöffnet wurde. Nach Angaben lokaler Medien stand ein Mann, der neben dem Notausgang saß, auf und begann absichtlich, den Öffnungshebel zu manipulieren, bis dieser sich öffnete. Dennoch landete der Airbus A321 (HL8256) mit 194 Passagieren an Bord sicher am Flughafen Daegu. Es wird geschätzt, dass das Flugzeug zum Zeitpunkt des Öffnens der Tür etwa 200 Meter hoch war, wie von berichtet Avherald-Website. Es gibt Berichte, dass Passagiere aufgrund der gefährlichen Situation ohnmächtig wurden und sich krank fühlten und dass der Mann, der verdächtigt wurde, die Tür geöffnet zu haben, nach der Landung versuchte, aus dem Flugzeug zu springen, um nicht festgehalten zu werden. Videos, die in sozialen Netzwerken kursieren, zeigen den Moment der offenen Tür, während das Flugzeug noch im Flug ist. Man erkennt den starken Luftstrom, der in die Passagierkabine strömt. Schauen Sie es sich im Video unten an: Nach der Landung wurden neun Passagiere mit leichten Verletzungen und Atembeschwerden ins Krankenhaus gebracht. Ö Ein 30-jähriger Mann, der verdächtigt wurde, die Tür absichtlich geöffnet zu haben, wurde von der Polizei festgenommen. Einige Leser fragten das Aeroflap-Portal, ob die Tür eines Flugzeugs tatsächlich geöffnet werden kann. Die Möglichkeit besteht jedoch, wenn das Flugzeug jedoch unter Druck steht und sich auf der Reiseflughöhe über FL 140 14.000 Fuß (4,230 km) befindet, ist es praktisch unmöglich, sie zu öffnen Im Falle des heutigen Unfalls befand sich das Flugzeug in geringer Höhe, sodass keine Druckbeaufschlagung erforderlich war und daher die Möglichkeit einer Öffnung besteht. Lesen Sie auch: Boeing nimmt die Auslieferungen der 737 MAX nach Produktionsproblemen wieder auf TAAG und GOL unterzeichnen eine Kooperationsvereinbarung im Güterverkehr ITA Airways übernimmt ihren ersten Airbus A330neo"
bf92a72d-bde1-4ecf-a525-70a4a5db04d0,2023-05-27 08:20:19+00:00,"Herr Spohr, mit 600 Flugzeugen hat keine Airline mehr Flugzeuge von Airbus erhalten als Lufthansa . Weniger als 20 Prozent Ihrer Flotte entfallen auf andere Hersteller. Was macht Airbus besser als Boeing ? Carsten Spohr: Airbus treibt Innovationen an neue Grenzen. Als Airbus im Jahr 1989 den A320 erstmals auslieferte, waren sie damit fast zwei Modellgenerationen vo­raus. Die Qualität der Flugzeuge hat uns nicht nur zum größten, sondern auch zu einem der treuesten Kunden gemacht."
e7d8d212-9845-48db-9c5a-6b6c957c7d59,2023-05-28 07:43:14+00:00,"Auf Russlands Angriff auf die Ukraine reagierte der Westen mit Sanktionen. Und die sorgen unter anderem dafür, dass russische Airlines keine Ersatzteile mehr bekommen für ihre Flugzeuge – zumindest nicht direkt aus den Ländern, in denen die Hersteller sitzen. Solange russische Unternehmen nicht in der Lage sind, entsprechende Teile nachzubauen, haben die Fluglinien des Landes zwei Möglichkeiten, wenn sie ihre Flieger flugtauglich halten wollen. Zum einen können sie eigene Maschinen als Ersatzteilspender nutzen. Bekanntestes Beispiel ist ein neuer Airbus A350, den Aeroflot ausschlachtete. Welche und wie viele andere Flugzeuge ebenfalls so genutzt werden, ist schwer zu bestimmen. Russische Airlines bekommen Teile aus Frankreich und den USA Die andere Möglichkeit sind Grauimporte, die über Staaten ohne Sanktionen laufen. Das russische Rechercheportal „Proekt“ hat diese Wege mithilfe der Datenbank „Import Genius“ untersucht. Im analysierten Zeitraum von März bis Ende August 2022 zeigte sich: Importe aus den USA, Frankreich und Deutschland wurden ersetzt durch Einfuhren unter anderem aus China, den Vereinigten Arabischen Emiraten, Usbekistan, Tadschikistan und Kirgisistan. Anzeige So lieferte etwa im Juni 2022 eine Firma namens Casper Aviation aus dem Emirat Umm al-Qaiwain an S7 Airlines für 42.000 Dollar ein elektronisches Teil für die Steuerung von Jets der Airbus-A320-Familie, hergestellt vom französischen Konzern Thales. Und für 144.600 Dollar ein Ersatzteil für die Kraftstoffzufuhr, gebaut von der Firma Woodward aus den USA. Importe aus arabischen Ländern nach Russland Aeroflot kaufte im Juli neue Flugzeugreifen der Marke Michelin für 255.700 Dollar – möglich gemacht durch die Firma „Arab Wadi Alrayan General Trading“ aus den Vereinigten Arabischen Emiraten und die russischen Firma „Kvant“. Unter den zehn größten Lieferanten von Flugzeugteilen nach Russland in der Zeit von März bis Ende August 2022 waren demnach vier aus den Emiraten, drei aus Tadschikistan, eine aus Kirgisistan, eine aus China und eine aus Jordanien. Die Nummer eins war die Firma „ATS Heavy Equipment“ aus Dubai mit Lieferungen im Wert von 2,6 Millionen Dollar. Ersatzteile aus ausgeschlachteten Flugzeugen Viele der Ersatzteile, die russische Airlines importieren, sind nicht neuwertig, sondern stammen aus ausgeschlachteten Fliegern in anderen Ländern. Laut „Proekt“ hat Russland vor dem Angriffskrieg und den Sanktionen nur Teile akzeptiert, die Zertifikate aus Kanada, den USA, der EU oder von den Bermudas vorwiesen. Mittlerweile haben unter anderem auch China, der Iran, die Emirate, Indien, Usbekistan, Ägypten und Südafrika grünes Licht. Von Timo Nowack"
8b0d6254-e820-4c16-ba08-2722b2bb8a2d,2023-05-29 17:38:05+00:00,"Qantas, die australische Fluggesellschaft, verabschiedete mit einer Zeremonie ihre erste Boeing 717. Das Flugzeug war auch das erste seiner Art, das im Land eingesetzt wurde, und das erste für das staatliche Unternehmen. Im Rahmen einer symbolischeren Zeremonie gab die Fluggesellschaft bekannt, dass alle Boeing 717-Flugzeuge bis Mitte 2024 ausgemustert werden und Platz für den neuen, effizienteren Airbus A220-300 gemacht werden. Die Boeing 717 mit dem Kennzeichen VH-NXI ist ein knapp über 23 Jahre altes Flugzeug, das seinen kommerziellen Flugbetrieb bei Impulse Airlines of Australia aufgenommen hat und derzeit unter dem Namen JetStar operiert. Siehe auch: Boeing 737 des neuen Frachtbetreibers in Brasilien ist in voller Lackierung zu sehen Embraer E2, der dem Palmeiras-Team dienen wird, präsentiert seine neue visuelle Identität Video: Passagier öffnet Flugzeugtür kurz vor der Landung Boeing nimmt die Auslieferungen der 737 MAX nach Produktionsproblemen wieder auf Das Flugzeug wurde im Dezember 1999 von der deutschen Leasinggesellschaft Bavaria International Aircraft Leasing übernommen und im April 2000 an die australische Gesellschaft übergeben. Die Registrierung lautete VH-IMP und war für die Beförderung von 115 Passagieren in einer einzigen Klasse konfiguriert. Drei Jahre später nahm JetStar den Betrieb des Flugzeugs auf, was etwas mehr als ein Jahr dauerte, bis es an National Jet Systems übertragen wurde, ein weiteres Unternehmen der Qantas-Gruppe, das weiterhin unter dem Registrierungsnamen, aber mit der visuellen Identität von operiert QantasLink. Das Flugzeug erhielt eine neue Konfiguration und startete mit 12 Passagieren in der Executive-Klasse und weiteren 98 in der Economy-Klasse. Diesmal wurde das Nummernschild auf VH-NXI geändert, wo es bis zu seinem letzten Betriebstag, diesem Montag (29), verblieb. Das Ziel der historischen Boeing 717 wird ein Unternehmen in Nordamerika sein, das bald seinen Auslieferungsflug antreten soll. Derzeit besteht die Flotte aus 20 Flugzeugen dieses Typs, und alle werden durch den neuen Airbus A220 ersetzt. Der Abzug der Flugzeuge wird schrittweise erfolgen, da die ersten A220 erst Ende 2023 ausgeliefert werden. „Es ist das Ende einer Ära für diese Boeing 717, die seit über zwei Jahrzehnten eine entscheidende Rolle bei der Verbindung der Australier mit unserem nationalen und regionalen Netzwerk gespielt haben.“ sagte Qantas-CEO Alan Joyce. „Es ist passend, dass die erste in diesem Land zugelassene Boeing 717 den Weg für einen weiteren völlig neuen Flottentyp ebnet, die A220, die die doppelte Reichweite der 717 erreichen kann und neue nationale und internationale Kurzstreckenstrecken eröffnet.“, vollendet."
