641821a0-2538-4e92-a646-b36b2f2d1b4d,2023-05-16 01:55:00+00:00,"Hamburg. Airbus will mehr Flugzeuge bauen, davon profitieren die Zulieferer. Doch das Geschäft mit dem Konzern hat auch Schattenseiten. Die Auftragsbücher sind voll, die Fertigung ist auf Jahre ausgelastet, die Produktionsraten werden hochgefahren: Die Weichen bei Airbus stehen wieder auf Wachstum. Dennoch wählte Guillaume Faury Anfang Mai deutliche Worte. „Wir blicken nach wie vor auf ein widriges Geschäftsumfeld“, sagte der Vorstandschef, als er einen Gewinneinbruch im ersten Quartal vermeldete: „Insbesondere die Lage der Lieferkette bleibt weiterhin angespannt.“ Mit der Aussage muss man automatisch in Richtung des Werks auf Finkenwerder blicken. Hamburg ist das Kompetenzzentrum beim Bau der A320-Familie, die der Verkaufsschlager des Konzerns ist. Mehr als drei Viertel aller ausgelieferten Maschinen gehören zu der Flugzeugreihe. Etwa jede zweite davon wird an der Elbe endmontiert. In diesem Jahr sollen konzernweit rund 50 Maschinen pro Monat gefertigt werden. Ende 2024 sollen es 65 sein, zwei Jahre später sogar 75. Gibt es mit dem Ratenhochlauf in der Hansestadt Probleme? Airbus: Hamburgs Luftfahrt-Zulieferer kämpfen mit Problemen Der Flugzeugbauer will sich dazu nicht konkret äußern. „Auf den Standort Hamburg heruntergebrochene Aussagen wollen wir nicht machen“, sagt Sprecher Daniel Werdung auf Anfrage. Die Hansestadt sei aber wie alle Airbus-Standorte von den Schwierigkeiten in der Zulieferkette betroffen, die voraussichtlich bis Ende 2024 anhalten dürften. Da überrascht es nicht, dass auch die hier angesiedelten vorgelagerten Unternehmen mit den Gegebenheiten hadern. „Die Hamburger Zulieferer kämpfen mit mehreren Problemen. Dazu gehören allgemeine wirtschaftliche Faktoren wie demografischer Wandel, Ukraine-Krieg und das Sterben von Unternehmen nach Corona, weil sie Schwierigkeiten haben, Kredite zurückzuzahlen – und zum Beispiel als Vorlieferanten wegfallen“, sagt Nils Stoll im Gespräch mit unserer Redaktion. Auftraggeber bezahlt Zulieferer oft erst nach Monaten Der Geschäftsführer des Barsbüttler Unternehmens Krüger Aviation kennt die Nöte. Denn neben seinem Hauptberuf ist er Erster Vorsitzender von Hanse-Aerospace, dem nach eigenen Angaben größten unabhängigen Verein von Zulieferern und Dienstleistern der Luft- und Raumfahrtindustrie. Bei den rund 120 Mitgliedsunternehmen sind etwa 14.000 Mitarbeiter beschäftigt. Der Jahresumsatz in der Branche wird mit etwa zwei Milliarden Euro angegeben. Zudem gibt es branchenspezifische Probleme – vor allem die Liquidität. „In der Branche gibt es Zahlungsziele von 120 Tagen und mehr“, sagt Stoll. Kleine und mittelständische Unternehmen müssten die von ihnen bei Konzernen wie zum Beispiel Mitsubishi oder Evonik eingekauften Materialien aber innerhalb von 30 Tagen zahlen. Das treibe die Vorfinanzierungen in die Höhe. Und Kredite sind infolge des Zinsanstiegs bekanntlich deutlich teurer geworden. Zulieferer: „Einfach mal so Preise bei Airbus erhöhen, ist nicht machbar“ Zusätzlich belastet die Inflation. „Wegen der stark gestiegenen Preise für Strom und Materialien ist die Kostenstruktur eine große Herausforderung für alle“, sagt Stoll. Häufig müssten Unternehmen eine Preisbindung über fünf Jahre eingehen. „Einfach mal so Preise bei Airbus zu erhöhen, ist nicht machbar“, sagt Stoll und ergänzt, dass er dafür auch Verständnis habe. Der Hintergrund sind die dicken Airbus-Auftragsbücher. Wenn Fluggesellschaften heute einen A320 bestellen, dürften sie das zumeist auf der Kurz- und Mittelstrecke eingesetzte Flugzeug wohl erst gegen Ende dieses Jahrzehnts erhalten. Bis dahin sind alle Bauplätze belegt. Der Verkaufspreis steht hingegen weitgehend fest. Airbus müsse sehr viel vorfinanzieren, bis der Konzern das Geld für das Flugzeug bekomme. „Entsprechend nehmen sie die Lieferanten mit in die Verantwortung“, sagt Stoll. Bei den großen Zulieferern – den sogenannten Tier-1-Suppliern, die direkt an den Flugzeugbauer liefern – sei das schon immer so gewesen. Nun schlage es aber auch auf die kleineren durch. Hamburger Zulieferer Diehl spürt die Probleme in der Lieferkette Zu den Tier-1-Zulieferern gehören Unternehmen wie Safran, Collins – und Diehl Aviation. Die Tochter des Nürnberger Konzerns liefert mit rund 600 Mitarbeitern in Hamburg in erster Linie komplette Bordtoiletten in unterschiedlichen Ausstattungen an Airbus. Dort werden die Module vor allem in die A320-Familie, aber auch in den Langstreckenjet A330 eingebaut. „Als Tier-1-Zulieferer spüren wir die problematischen Lieferketten ebenfalls deutlich“, sagt Unternehmenssprecher Guido van Geenen. Materialengpässe gebe es in der Luftfahrtindustrie schon seit geraumer Zeit, und auch die eigenen Lieferanten seien von Schwierigkeiten in der Beschaffung betroffen. Das Unternehmen kämpfte in den vergangenen Jahren mit großen Problemen und baute in Hamburg Hunderte Jobs ab. „Das Hochfahren der Produktion durch unseren Kunden Airbus ist für uns daher in aller erster Linie sehr positiv“, sagt van Geenen. Das sieht Stoll als Unternehmenschef von Krüger Aviation grundsätzlich auch so. Er erlebe Airbus als fairen, sehr mittelstandsgerechten Verhandlungspartner. „Wir kriegen klare und verlässliche Ansagen, was von uns an Materialien wann gewünscht wird und gute Unterstützung vom Konzern“, sagt er. Zulieferer-Verband: „Bei vielen ist Unzufriedenheit spürbar“ Die Barsbüttler Firma gewann in der Krise Aufträge, legte 2022 ein Rekordjahr hin und ist sowohl Tier-1- als auch Tier-2-Zulieferer. Gleitstücke aus Kunststoff, die für Landeklappen und Notrutschen benötigt werden, sowie Rohmaterialien liefert das Unternehmen direkt an Airbus. Die Spiegel für Wascheinheiten, bei denen man Weltmarktführer in der Flugzeugbranche ist, werden an Diehl geliefert, dort eingebaut und dann als fertiges Modul an Airbus geliefert. Doch einige Mitgliedsunternehmen von Hanse-Aerospace haben eine andere Meinung. „Die Gefühlslage bei den Hamburger Zulieferern ist gespalten“, sagt Stoll. „Bei vielen Mitgliedern ist eine gewisse Unzufriedenheit spürbar, weil sich der Ratenhochlauf nicht so schnell vollzieht wie einst angekündigt.“ Airbus hatte die Rate 65 eigentlich schon in diesem Sommer erreichen wollen, im vergangenen Juli aber den Zeitplan nach hinten geschoben. Danach folgten weitere Verschiebungen. Airbus-Zulieferer besorgt: Wann fährt der Konzern die Produktion hoch? „Zwar gehen alle davon aus, dass Airbus mit seinen Plänen ernst macht“, sagt Stoll: „Aber seitdem herrscht eine große Verunsicherung in der Zulieferbranche: Kommt der Ratenhochlauf? Kriegen wir ihn alle zusammen hin? Wann kommt er? Und kommt er wirklich in diesem Umfang?“ Alle Zulieferer kämpften derzeit damit, dass Bestellungen später als geplant abgenommen werden. Bisher produziere man daher noch nicht wirklich mehr, aber man stehe dafür in den Startlöchern. Wasserstoff-Flugzeug soll spätestens 2026 in Hamburg starten Richtfest für neues Besucherzentrum von Airbus Airbus lässt Passagierjets jetzt in China abwracken"
7046b16d-4a68-4654-9f4f-3fb97ae57593,2023-05-16 09:47:57+00:00,"Bei bp wird Abfall zum wichtigen Rohstoff. Die Flugtreibstoffsparte Air bp bietet mit ihrem Biojet eine Kraftstoffalternative aus nachhaltigen und erneuerbaren Rohstoffen. Darunter sind gebrauchtes Speiseöl und Abfälle aus Hausmüll oder der Forstwirtschaft. Den nachhaltigen Kraftstoff (Sustainable Aviation Fuel) liefert das Unternehmen unter der Marke bp Biojet an Fluggesellschaften und Flughäfen. Sein Vorteil: Biojet kann wie konventionelle Flugkraftstoffe über die bestehende Infrastruktur getankt werden. Für die klimafreundlichere Alternative braucht es also keinerlei technische Veränderungen. Weniger Treibhausgasemissionen im Flugverkehr bp Biojet reduziert die Treibhausgasemissionen über den gesamten Lebenszyklus des Produkts um bis zu 80 Prozent im Vergleich zum branchenüblichen fossilen Flugzeugtreibstoff. Ganz im Sinne der International Air Transport Association (IATA): Sie strebt für 2020 ein Nullwachstum der CO2-Emissionen und bis 2050 eine Reduzierung um 50 Prozent an. Air bp liefert Sustainable Aviation Fuel (SAF) seit dem Jahr 2010 und hat bis heute 16 Flughäfen und 20 Kunden weltweit damit versorgt. In Deutschland liefert das Unternehmen Bio-Kerosin seit Ende 2019 aus – beispielsweise für Transportflüge des Airbus A300-600ST Beluga von Hamburg. Wie wird aus Hausmüll Flugkraftstoff? Für bp Biojet werden nutzbare Abfälle gesammelt und einzelne Bestandteile daraus recycelt. Aus ihnen entsteht in einem speziellen Verfahren ein hochwertiges synthetisches Produkt: sogenanntes synthetische Kerosin. Dies wird in Verbindung mit regulärem Flugtreibstoff passend abgemischt und das fertige Produkt an die Flughäfen geliefert. Im letzten Schritt gelangt es dann direkt in die Tanks der Maschinen. Meilenstein 2016 hat bp als erster Anbieter nachhaltigem Flugkraftstoff über ein bestehendes Hydranten-Betankungssystem kommerziell vertrieben. Erster Versorgungspunkt war der norwegische Flughafen Oslo. Strategische Partnerschaften für nachhaltigere Innovationen Mit einer Investition von 30 Millionen US-Dollar startete bp 2016 eine strategische Partnerschaft mit dem Unternehmen Fulcrum BioEnergy. Fulcrum hat ein bisher einzigartiges Konzept entwickelt, um aus Müll Kraftstoff zu produzieren. Über einen Zeitraum von zehn Jahren will Air bp jährlich 190 Millionen Liter des Biokraftstoffs vom Hersteller abnehmen. Außerdem wird bp als bevorzugter Logistikpartner die Distribution des neuen Biojets an die Flughäfen unterstützen. Im Jahr 2018 vereinbarte Air bp außerdem eine Zusammenarbeit mit Neste, um SAF-Lieferketten zu entwickeln. Zusammen mit dem Unternehmen hat bp Auslieferungsflüge von Airbus mit Biojet versorgt. Forschung für mehr Kraftstoffprodukte auf Bio-Basis Seit 2016 setzt sich bp im Rahmen des Projekts Biomates dafür ein, biobasierte Materialien direkt im herkömmlichen Raffinerieprozess zu nutzen. Aktuell können Benzin oder Diesel erst nachträglich mit fertigen Biokraftstoffen gemischt werden. Mithilfe von Bio-Ölen soll dieses Verfahren verbessert werden. Nachhaltigere Grundstoffe können direkt in der Produktion eingesetzt werden. So lassen sich Hybridkraftstoffe herstellen, die ebenso kompatibel mit Verbrennungsmotoren sind wie herkömmliche Kraftstoffe. So könnten Emissionen wirkungsvoll und vor allem zügig reduziert werden."
cc50c958-fb48-4c8a-bb80-fc97dc457621,2023-05-16 11:48:02+00:00,"Bislang ist die junge deutsche Airline Leav Aviation eine reine Wet-Lease- und Charteranbieterin. So flog sie vergangenen Sommer unter anderem für Tui ab Düsseldorf Ziele im Mittelmeerraum an. Doch jetzt startet die Fluggesellschaft auch den Linienbetrieb. Ab sofort sind Leav-Flüge ab Köln buchbar. Mit dem Iata-Code KK fliegt die Airline ab der Stadt am Rhein ab Juni nach Kos, Rhodos und Heraklion. Nach Palma de Mallorca kann man bereits für diese Woche Flüge buchen. Auf der Webseite wirbt Leav unter anderem auch für Flüge auf die kanarischen Inseln. Buchbar sind diese aber noch nicht. Drei Tarife Buchbar sind drei verschiedene Tarife. Im günstigsten, der Leav Naked heißt, ist ausschließlich ein kleines Handgepäckstück bis fünf Kilogramm enthalten. Für einen Flug von Köln nach Mallorca zahlt man Anfang Juni etwas mehr als 200 Euro. Für 45 Euro mehr ist im Tarif «Dressed» noch ein größeres Handgepäckstück sowie ein Aufgabegepäckstück los 20 Kilogramm im Preis enthalten. Bis 32 Kilo schwer sein darf das Gepäck im teuersten Tarif «Splendid». Dort ist auch die Sitzplatzreservierung inklusive. Gegründet wurde Leav bereits 2021. Das Luftverkehrsbetreiberzeugnis (im Englischen Air Operator Certificate oder kurz AOC) hat sie allerdings erst seit Mai 2022. Zunächst waren die Flugzeuge der Airline ganz in Weiß unterwegs, doch zu Jahresbeginn hat das Unternehmen einem der Jets das eigene Design verpasst. Zwei Airbus A320 Aktuell gehören zur Flotte der jungen Airline zwei Airbus A320. Ein zwölfjähriger Airbus A320 mit dem Kennzeichen D-ANNE, der auch weiterhin rein Weiß trägt, und ein 14-jähriger A320 mit dem Kennzeichen D-ANDI. Gründer der Airline sind Daniel Broda und Johannes Klinsmann. Der ehemalige Easyjet-Kapitän Broda agiert als Geschäftsführer der Fluggesellschaft. Klinsmann war früher Mitglied der Geschäftsführung bei der 2019 untergegangenen Germania."
b1787611-a3f5-41fa-a0d5-35aaae8f71fd,2023-05-17 11:08:28+00:00,"Nach einem lange andauernden Konflikt haben Airbus und Qatar Airways einen Weg der Einigung gefunden, der Flugzeugbauer setzt nun die Lieferung der bestellten Airbus A350-1000 fort. Der Golf Carrier hat beschlossen, die kommenden Jets anders zu konfigurieren und dabei die Anzahl der Business Class Sitze zu verringern. Eine der ersten Destinationen der mit nur 24 Q-Suiten ausgestatteten Maschine wird Frankfurt sein. Der Streit führte die beiden Unternehmen vor Gericht, es ging um Lackschäden an Maschinen des Typs A350. Der Hersteller hatte sich mit fast allen Betreibern einigen können, Ausnahme war Qatar. Dies führte sogar dazu, dass bereits ausgelieferte Flugzeuge gegroundet und andere Bestellungen storniert wurden. Im Februar kam es dann zur „gütlichen und einvernehmlichen Einigung“, vergangene Woche hat man dann die Auslieferungen der übrigen A350-1000 wieder aufgenommen. Nach einer Pause von zwei Jahren ist mit der A7-ANT wieder ein nagelneues Flugzeug von Airbus in Doha gelandet, der Jet wird in der zukünftigen Heimat für den Linienbetrieb vorbereitet. Das Besondere: Die Airline wird die neue Tranche der A350-1000 anders konfigurieren und die Business Class Kapazitäten von 46 auf 24 reduzieren. Qatar kann damit die Economy-Sitzplätze um 44 steigern und somit insgesamt 371 Passagiere befördern."
52cc145e-b3bf-441f-bc7f-11c1b2b91187,2023-05-17 11:58:23+00:00,"Claudia Oeking (42), Director External Affairs und Geschäftsführerin bei Philip Morris, verlässt den Tabakkonzern und wechselt zu Airbus. Sie wird dort zum 1. September die Stelle als Head of Public Affairs für Deutschland übernehmen und damit die Nachfolge von Alexander Reinhardt antreten, der als Hauptgeschäftsführer zum Bundesverband der Deutschen Luft- und Raumfahrtindustrie wechselt. Oeking ist seit 2013 für Philip Morris tätig. Ihr Verantwortungsbereich deckt unter anderem die Unternehmens- und Wissenschaftskommunikation, die Hauptstadtrepräsentanz, Public Relations, Corporate Social Responsibility sowie die Fachbereiche zur Regulierung und Besteuerung ab. Vorher arbeitete sie unter anderem für EnBW. Ihre Karriere begann Claudia Oeking als Radiojournalistin."
9703f390-d3ee-494c-b678-4497b56cdfc8,2023-05-17 12:36:12+00:00,"Im Pride Month machen viele Unternehmen darauf aufmerksam, was die LGBTQ+-Gemeinschaft schon erreicht hat und was noch zu tun ist – und was sie selber für Gleichberechtigung und Akzeptanz von Minderheiten machen. 2022 gestaltete Lufthansa für den Monat ein Flugzeug um. Der Airbus A320 Neo mit dem Kennzeichen D-AINY und dem Taufnamen Lingen bekamt die Aufschrift Lovehansa. Das Wort Love wurde auf dem A320 Neo in Regenbogenfarben gestaltet, ebenso bekamen das Welcome-Panel am Eingang und die Winglets den farbenfrohen Look. Ursprünglich sollte die D-AINY nach ein paar Monaten allerdings wieder zurückverwandelt werden und wie alle anderen Flieger von Lufthansa aussehen. Doch die deutsche Fluggesellschaft hat beschlossen, sie als Lovehansa zu behalten, wie sie am Mittwoch (17. Mai) bekannt gab. «Sowohl nach innen als auch nach außen repräsentiert es unsere nicht-ausgrenzende Lufthansa-Identität.» In der oben stehenden Bildergalerie sehen Sie Fotos der Lovehansa-Maschine. Durch einen Klick aufs Bild öffnet sich die Galerie im Großformat."
71180340-63ca-4bc0-8cfa-200a63ceaee5,2023-05-17 15:27:39+00:00,"Dresden/Leipzig. Inflation, Klimakrise und Ressourcenmangel: Für Viele ist Fliegen eine Gewissensfrage. Die Globalisierung und der Klimawandel haben die Luftfahrtindustrie in den letzten Jahren stark herausgefordert. Dennoch betont Sachsens Wirtschaftsminister Martin Dulig, dass globale Vernetzungen schon immer existierten und auch in Zukunft weiterhin bestehen werden. Weiterlesen nach der Anzeige „Es geht jetzt um die Spielregeln“, sagt der SPD-Politiker wenige Tage vor dem Spatenstich am Flughafen Leipzig/Halle am Dienstag. Dort will der Flugzeugbauer Deutsche Aircraft ab Ende 2026 den Turboproptyp D328 Eco bauen – eine nachhaltigere Weiterentwicklung der Anfang der 90er Jahre gebauten Dornier 328. Derartige High-Tech-Flugzeuge könnten angesichts klimaneutraler Herstellung und einem vergleichsweise niedrigen Kerosinverbrauch dem innerdeutschen Flugverkehr ein größeres Zukunftspotenzial in Aussicht stellen als bislang gedacht. Die sächsische Luftfahrtbranche ist laut Dulig „klein, aber fein“. Sie könne auf eine lange Geschichte im Freistaat zurückblicken. Zu DDR-Zeiten etwa wurde in Dresden das legendäre Düsenflugzeug 152 gebaut. Nach dem Absturz einer Maschine und der späteren Einstellung der Produktion war es in der sächsischen Flugbranche lange Zeit ruhig. In der Zwischenzeit hat sich jedoch einiges getan. Nach Duligs Ansicht ist die Innovationsquote der Luftfahrtindustrie in Sachsen den meisten anderen Branchen weit voraus. Weiterlesen nach der Anzeige Lesen Sie auch Sohn des Bordingenieurs erinnert sich an tragischen Absturz der 152 Stasi-Akten offenbaren Ulbrichts Haltung zum Düsen-Flugzeug 152 Flugzeuglegende 152 findet neuen Standort am Flughafen Dresden Mit rund 160 Unternehmen und Forschungseinrichtungen, die insgesamt mehr als 7000 Mitarbeiterinnen und Mitarbeiter beschäftigen, erwirtschaftet der Luftfahrtstandort Sachsen laut Wirtschaftsministerium einen Umsatz von etwa 1,4 Milliarden Euro im Jahr. Bis zu 13 Prozent dieses Umsatzes fließen wieder in Forschung und Entwicklung. Welmarktführer fürs Umrüsten: Die Elbe Flugzeugwerke Ein bedeutender Teil des sächsischen Umsatzes, etwa 30 Prozent, wird von den Elbe Flugzeugwerken (EFW) erwirtschaftet. Das Unternehmen mit Sitz am Flughafen Dresden ist auf dem Weg zum Global Player und bereits heute Weltmarktführer bei der Umrüstung von Passagier- zu Frachtflugzeugen der Airbus-Familie. Die EFW beschäftigen über 2000 Mitarbeiter und betreiben sechs Umrüstlinien am Flughafen Dresden, auf denen verschiedene Maschinentypen für ihr Zweitleben als Frachter fit gemacht werden. Weiterlesen nach der Anzeige Laut EFW-Chef Jordi Boto ist Dresden für das Unternehmen nur „die Spitze des Eisbergs“, da heute 80 Prozent der industriellen Aktivitäten außerhalb der Landeshauptstadt stattfinden. Beschlüsse werden dennoch in Dresden gefasst. „Wir sind ein Unternehmen, das von Sachsen aus Entscheidungen trifft, die in die Welt hinaus gehen“, sagt Boto. Die EFW hätten insgesamt neun Standorte außerhalb Europas – unter anderem drei Standorte in China und einen in Singapur. Zudem soll es bald einen weiteren in der Türkei und zwei weitere in den USA geben. Die Kundennachfrage sei in den letzten Jahren stark gestiegen. Grund hierfür seien unter anderem das veränderte Konsumverhalten von Menschen, Unsicherheiten beim Schiffsverkehr sowie die logistischen Auswirkungen des Ukraine-Kriegs. Allein dieses Jahr will das Unternehmen mehr als 40 Flugzeuge weltweit umrüsten – neun davon in Dresden. Eine Verdopplung im Vergleich zum Vorjahr. Die Umrüstung eines Flugzeuges kann – je nach Maschine – bis zu einem halben Jahr dauern. Ziel ist es, nicht nur die Lebensdauer der Flieger zu verlängern, sondern die Maschinen so nachhaltig wie möglich umzurüsten. DLR baut neues Institutsgebäude in Dresden Die Entwicklung, Erprobung, Zertifizierung und Produktion neuer Fluggeräte ist heutzutage immer noch mit hohem zeitlichen Aufwand und finanziellen Risiken verbunden. Das Institut für Softwaremethoden des Deutschen Zentrums für Luft- und Raumfahrt (DLR) entwickelt moderne Methoden für den Luftverkehr von morgen, basierend auf Software. Das DLR ist nach eigenen Angaben die größte Forschungseinrichtung für Luft- und Raumfahrt in Europa. Derzeit entsteht in unmittelbarer Nähe der Technischen Universität Dresden (TUD) das neue Institutsgebäude, das Anfang nächsten Jahres in Betrieb genommen werden soll. Direkt gegenüber – im Rechnergebäude des Lehmann Zentrums – befindet sich der Hochleistungsrechner CARA - einer der leistungsstärksten Supercomputer in diesem Bereich. CARA soll die Einführung neuer Technologien für wirtschaftlicheres, umweltfreundlicheres und sichereres Fliegen beschleunigen. Mit Hilfe des Rechners können Flugzeuge virtuell entwickelt, in allen Komponenten getestet und für den Flug zugelassen werden. „Es geht nichts ohne Software“, erklärt Direktorin Sabine Roller. Das Institut versteht sich deshalb auch als Standort für die sächsische Wissenschaft. Weiterlesen nach der Anzeige Wertvolle Impulse kommen auch von anderen sächsischen Unternehmen und Forschungseinrichtungen wie dem Dresdner Leichtbau-Start-up Herone, dem Airbus-Zulieferer Diehl Aviation und der Professur für Flugmechanik und Flugregelung der TUD. Die Voraussetzungen für eine blühende Zukunft der Luftfahrtindustrie in Sachsen sind dem Wirtschaftsministerium zufolge gegeben. Nun gehe es darum, die Antriebstechnologien der Zukunft und das CO2-neutrale Fliegen schnellstmöglich voranzutreiben. DNN"
1ca1d47d-ff72-4678-98c1-52cf5a8482bc,2023-05-17 21:51:13+00:00,"Titan Airways, eine Charterfluggesellschaft, hat ihre letzte Boeing 757 aus der Flotte ausgemustert und das Unternehmen verfügt nun nur noch über Airbus-Flugzeuge in seiner Flotte. Vor seiner Pensionierung unternahm der Klassiker eine lange Weltreise, die am 4. Mai endete. Die letzte Reise der Titan Airways Boeing 757 führte nach Accra (ACC) und London (STN) und führte damit ihren letzten Flug im Auftrag des britischen Unternehmens durch. Am vergangenen Dienstag (16.) wurde das Flugzeug zum Flughafen Costwold geschickt, wo mehrere Langzeitflugzeuge gelagert werden können. Die alte Boeing 757 ist nun dem brandneuen und effizienteren Airbus A321neo gewichen, was für den europäischen Hersteller von Vorteil ist, da er endlich mit dem amerikanischen Modell des Single-Aisle-Modells mit großer Reichweite konkurrieren kann. Trotz der Übermittlung an den Flughafen Costwold wurden Informationen von der Portal Einfaches Fliegen, weisen darauf hin, dass das alte Flugzeug vollständig zerlegt und seine Teile wiederverwendet werden. Titans letzte Boeing 757 Als Abschluss einer langen Geschichte mit dem britischen Charterunternehmen wurde der ehemalige G-ZPAX im Juli 2000 hergestellt und ursprünglich an das spanische Unternehmen Iberia geliefert. Das Flugzeug wurde mit einer Konfiguration für 200 Passagiere in einer einzigen Klasse geliefert. Nach etwas mehr als sechs Jahren wurde Titan Airways Betreiber des nordamerikanischen zweimotorigen Flugzeugs und reduzierte die Anzahl der Sitze an Bord leicht auf 195. Und 2010 operierte das Unternehmen für etwas mehr als zwei Monate im Rahmen eines ACMI-Vertrags für EasyJet. Der ACMI-Vertrag bedeutet, dass Titan Airways nicht nur das Flugzeug, sondern auch die Besatzung charterte und sich um die gesamte Wartung und Versicherung des Flugzeugs sowie den gesamten Betrieb zwischen den Unternehmen kümmerte. Nach der Wiederaufnahme des Betriebs mit EasyJet hat die Charterfluggesellschaft die Boeing 757 für eine komfortablere Konfiguration und auch mit Executive-Sitzen umkonfiguriert, seitdem fliegt sie mit 48 Passagieren in der Executive- und 12 weiteren in der Economy-Konfiguration. Siehe auch: Cenipa schließt Pilotenfehler im Unfallbericht aus, bei dem Marília Mendonça ums Leben kam SAAB liefert offiziell zwei neue F-39 Gripen-Jäger an die FAB Embraer E190-E2 demonstriert seine Leistung auf kurzen Landebahnen in Südkorea Mit der Ankunft des neuen Airbus A321neo verabschiedete sich Titan von seinem legendären Flugzeug und übergab es an Jet2, das das Flugzeug zerlegen und seine Teile wiederverwenden wird. Derzeit umfasst die Flotte des Unternehmens acht Flugzeuge, zwei Airbus A8, vier A320-321 und zwei A200neo. Mit dem Abflug der 321 wird Titan Airways erstmals eine Flotte betreiben, die ausschließlich aus Airbus-Flugzeugen besteht."
cb4de629-a0a5-4e3d-8723-17cab6d518da,2023-05-19 07:45:49+00:00,"Vor gut 20 Jahren hat die Firma Airbus Helicopters in Donauwörth die erste Maschine vom Kampfhubschrauber Tiger an die Bundeswehr ausgeliefert. Die Serienproduktion in dem Werk lief 2018 aus – und nun zeichnet sich ab, dass der Helikopter keine große Zukunft mehr bei der Truppe hat. Der Bund will den Tiger nicht mehr mit neuer Technik bestücken, möchte den Bestand nach und nach abbauen und dann in etwa 15 Jahren endgültig ausmustern. Damit erfüllt sich der Wunsch des Unternehmens, dass die Bundeswehr weiter auf dieses Modell setzt und entsprechende Aufträge eingehen, nicht. Doch es zeichnet sich ab, dass Airbus Helicopters anderweitig mit dem Militär ins Geschäft kommt."
