d963cc2f-d7e7-4266-bcfa-c97a230b6ce5,2023-07-04 09:03:58+00:00,"So unterscheidet sich der Bedarf eines Geschäftspartners mit dem Schwerpunkt in der betrieblichen Vorsorge von dem eines Vermittlers, der sich überwiegend auf die Beratung und Betreuung von Privatkunden im Bereich der Biometrie oder der privaten Zukunftsvorsorge konzentriert. Wesentlich ist auch die Art der Kundenbetreuung und die Nutzung moderner Medien: Hier hat die Beratung über digitale Kanäle – beschleunigt durch Corona – erheblich an Bedeutung gewonnen. Bei komplexen Produkten wie Zukunftsvorsorge oder Absicherung der Arbeitskraft ist die persönliche Beratung jedoch nach wie vor unerlässlich. „Mit der neuen Aufstellung orientieren wir uns konsequent an den Bedürfnissen unserer Geschäftspartner. Wir straffen unsere Prozesse und schaffen damit noch mehr Raum für die individuelle Betreuung der Maklerinnen und Makler“, sagt Thomas Wiesemann, Vorstand Vertrieb der Allianz Lebensversicherung. Cluster und Segmente Konkret hat die Allianz basierend auf den spezifischen Anforderungen der Maklerinnen und Makler Cluster gebildet und jeweils ähnliche Cluster in Segmenten zusammengefasst. Im Segment „Großmakler/Global Broker“ werden Vermittlerinnen und Vermittler betreut, die ihren Schwerpunkt in der betrieblichen Vorsorge haben, während im Segment „Mittelstandsmakler“ Geschäftspartner mit einem breiteren, auch die private Zukunftsvorsorge und die Biometrie umfassenden Angebotsspektrum gebündelt werden. Maklerbetreuer jeweils nur für ein Segment Die Maklerbetreuerinnen und Maklerbetreuer werden künftig in jeweils nur einem Segment arbeiten, damit sie sich stärkenorientiert auf die spezifischen Anforderungen und Wünsche ihrer jeweiligen Geschäftspartner konzentrieren können. Das schafft Spielräume für eine noch passgenauere Betreuung. In der neuen Struktur verantwortet Marcel Basedow den bundesweiten Maklervertrieb. Oliver Nittmann leitet die für Vertriebe und Maklerpools tätigen Betreuungsteams, während Claudia Kamppeter den neuen Bereich „Vertriebsservice“ verantwortet. Im Vertriebsservice werden alle dezentralen, vertriebsunterstützenden Einheiten unter einem Dach gebündelt. Bedeutung wächst weiter Der Maklervertrieb ist eine der tragenden Säulen im Neugeschäft bei Allianz Leben. In den vergangenen Jahren ist die Allianz zum bedeutendsten Maklerversicherer in Deutschland geworden und will diese Position weiter ausbauen."
de90ae69-4e22-4b78-b754-dfd590f70f13,2023-07-04 11:16:00+00:00,"Welche Versicherer haben 2022 die höchsten Beitragseinnahmen eingefahren? Welcher Konzern konnte sein Prämienvolumen im Vergleich zum Vorjahr steigern und wer hatte Schwund zu verkraften? Am Dienstag veröffentlichte die FAZ zum 65. Mal ihre Beilage „Die 100 Größten“, darin enthalten ist auch eine Rangliste der 25 nach Beitragseinnahmen größten deutschen Versicherer, bezogen auf das Jahr 2022. Auf der Spitzenposition findet sich – wie bereits im Vorjahr 2021 – die Allianz Gruppe mit Prämieneinnahmen von rund 152,7 Milliarden Euro. Dahinter folgen auf Rang zwei und drei die Rückversicherer Munich Re mit einem Prämienvolumen von 67,1 Milliarden sowie die Talanx Gruppe mit 53,4 Milliarden. Beide Konzerne hatten 2022 bei ihren Beitragseinnahmen einen zweistelligen Zuwachs zu verzeichnen. Bei der Munich Re-Gruppe lag das Plus bei 12,7 Prozent, bei der zum Talanx-Konzern gehörenden Hannover Rück waren es 19,9 Prozent. Der Ranglistenanführer Allianz hatte hingegen nur einen Beitragszuwachs im einstelligen Bereich vorzuweisen (2,8 Prozent)."
7088436b-8f08-48ec-a6c9-d702811bd796,2023-07-05 05:22:00+00:00,"Startseite Wirtschaft Aufspaltung der Bahn - Was spricht dafür, was dagegen? Immer wieder werden Rufe nach einer Neustrukturierung der Bahn laut. Doch während die einen für mehr Flexibilität plädieren, fürchten andere bei einer Zerschlagung vor allem Nachteile für die Beschäftigten. Berlin - Aus Sicht der Monopolkommission, eines Beratungsgremiums der Bundesregierung, muss die Deutsche Bahn „umgebaut“ werden. Forderungen nach einer Neustrukturierung des bundeseigenen Konzerns mit seinen Hunderten Tochter-Unternehmen und Beteiligungen gibt es immer wieder. Erst im April hatten auch CDU und CSU ein entsprechendes Positionspapier veröffentlicht. Was versprechen sich die Befürworter von einem solchen Schritt - und was befürchten die Gegner? Was spricht für eine Umstrukturierung? Den radikalsten Fürsprechern einer neuen Bahn-Struktur schwebt vor allem eine vollständige Trennung der Infrastruktursparte vom Bahnbetrieb vor. Bislang ist all das vereint unter dem Dach des Deutsche-Bahn-Konzerns, der sowohl das Schienennetz verwaltet als auch eigene Verkehrsdienste darauf anbietet. Mit einer Aufspaltung könnte der bundeseigene Konzern schlanker und flexibler werden, argumentieren etwa CDU und CSU. Zum anderen hätten Wettbewerber einen transparenteren Zugang zu Daten, die das Schienennetz und den Zugverkehr betreffen. Eine Aufteilung stärke somit den Wettbewerb. Ein weiteres Argument für eine Neustrukturierung dreht sich um die Finanzierung der Schieneninfrastruktur. Das Bahnnetz ist seit Jahren dringend sanierungsbedürftig. Ein Problem ist vor allem das Geld. Als Bahn-Tochter muss die DB Netz langfristig Gewinne machen und diese an den Mutterkonzern abführen. Auch deshalb plant die Bundesregierung, die Netz-Sparte in eine gemeinwohlorientierte Gesellschaft zu überführen. Auf diese Weise „würden Gewinne innerhalb der Sparte verbleiben“, erwartet etwa der Interessenverband Allianz pro Schiene. Sie könnten dann in größerem Umfang für den Ausbau der Infrastruktur verwendet werden. Kritikern geht die Bundesregierung mit diesem Vorhaben aber nicht weit genug. Nach derzeitigen Plänen würde auch die neue Infrastrukturgesellschaft im Verantwortungsbereich des Konzernvorstands bleiben. Die Monopolkommission empfiehlt im jüngst veröffentlichen Sektorgutachten eine „weitgehende Unabhängigkeit der neuen Gesellschaft vom restlichen DB-Konzern“. „Dies gilt insbesondere im Hinblick auf die Transparenz der finanziellen Verflechtungen innerhalb des Konzerns und die Vermeidung personeller Verflechtungen zwischen den Konzernunternehmen“, heißt es dort. Was spricht gegen eine Aufspaltung? Einer der lautesten Gegner einer Neustrukturierung der DB ist die Eisenbahn- und Verkehrsgewerkschaft (EVG). Sie fürchtet bei einer Zerschlagung des Konzerns vor allem Nachteile für die Beschäftigten. „Arbeitsleistungen müssen weiterhin innerhalb des DB-Konzerns vergeben werden können - das bedeutet sichere und tarifgebundene Arbeitsplätze vor allem im Dienstleistungsbereich“, teilte EVG-Chef Martin Burkert am Dienstag mit. Die EVG fürchtet zudem, dass eine langjährige Debatte über die künftige Ausrichtung des Bahnkonzerns den Verkehrsträger Schiene langfristig lähmen könnte. „Was wir vielmehr brauchen, ist die auskömmliche Finanzierung der Infrastruktur“, macht Burkert deutlich. Ähnlich argumentiert auch die Allianz pro Schiene. „Die Steigerung der Qualität und der Kapazität des Netzes müssen oberste Priorität werden“, heißt es von dort. „Eine Verengung auf die Strukturfrage hilft dabei nicht.“ Entscheidend sei der politische Wille, die jahrzehntelange Unterfinanzierung der Schieneninfrastruktur zu beseitigen. dpa"
6fd42e2d-dee4-4196-9006-e0d1cb9ec59c,2023-07-05 06:13:32+00:00,"Der FC Bayern München und Unternehmen der Schwarz Gruppe übernehmen gemeinsam Verantwortung für einen schonenderen Umgang mit Ressourcen im Sport sowie für die digitale Sicherheit von Verein und Fans. Die langfristig angelegte Kooperation soll auch die FC-Bayern-Fans für Recycling und Kreislaufwirtschaft weiter sensibilisieren. Königsklasse der Abfallwirtschaft PreZero, einer der führenden Umweltdienstleister in Europa, verantwortet bereits seit drei Jahren die Entsorgung in der Allianz Arena und wird künftig die Abfallwirtschaft an den Standorten des FC Bayern München weiter optimieren. Ziel dabei ist es, in enger Zusammenarbeit mit dem Verein Wertstoffkreisläufe Schritt für Schritt zu schließen und somit Recyclingquoten zu verbessern. Innovative Wege, vermeintlichen Abfällen ein zweites Leben zu geben zeigte PreZero bereits mit dem Projekt „Herzrasen“, bei dem der Rasenschnitt der Allianz Arena zu Papiertüten für den offiziellen Fanshop verarbeitet wird. „Wir freuen uns, dass die Unternehmen der Schwarz Gruppe PreZero, STACKIT und XM Cyber Partner des FC Bayern werden. Darüber hinaus sind wir glücklich über unsere neue Getränkekooperation mit Saskia Mineralwasser. Die Zusammenarbeit ist langfristig ausgerichtet, und in den Bereichen Kreislaufwirtschaft und Digitalisierung wird sie der Beginn eines gemeinsamen Weges werden“, erläutert Andreas Jung, Marketingvorstand der FC Bayern München AG. Meisterliches Mineralwasser Das Mineralwasser der Lidl-Eigenmarke Saskia, die von der Schwarz Produktion hergestellt wird, wird künftig den Durst von Spielern sowie Fans in den Hospitality-Bereichen der Allianz Arena und Mitarbeitern des FC Bayern München stillen. Lidl liefert das Mineralwasser ab sofort für die Allianz Arena sowie alle Vereinsstandorte. Auch mit der Getränkepartnerschaft wollen die Partner in puncto Recycling und Kreisläufe einen Schwerpunkt setzen: Der Flaschenkörper der Saskia-Flaschen besteht zu 100 Prozent aus recyceltem PET. Das Recyclingsystem dieser Kreislaufflaschen leistet einen Beitrag zur Ressourcenschonung, indem durch die Unternehmen der Schwarz Produktion aus alten Flaschen neue Getränkeflaschen hergestellt werden. Im Rahmen der Partnerschaft mit dem FC Bayern München sollen den Fans die Themen Recycling und Kreislaufwirtschaft nähergebracht werden. Dazu sind Stadionaktionen sowie Online-Kampagnen geplant, die das Bewusstsein für Ressourcenschonung schärfen. Bandenwerbung der Lidl-Eigenmarke Saskia soll zusätzlich für Aufmerksamkeit sorgen. Volltreffer bei der Digitalisierung Mit dem Cloudangebot STACKIT und dem Cybersecurity-Dienstleister XM Cyber unterstützen die Unternehmen der Schwarz Gruppe den FC Bayern München dabei, die Digitalisierung voranzubringen. STACKIT und XM Cyber ermöglichen dem Verein beispielsweise die Daten der digitalen Club-Plattform sicher und datenschutzgerecht zu verwalten. XM Cyber wird darüber hinaus zum Schutz der gesamten IT-Landschaft des FC Bayern München beitragen – sowohl für Cloud- als auch für On-Premise und Hybridsysteme. „Mit den individuellen und skalierbaren Lösungen bieten STACKIT und XM Cyber dem FC Bayern München die optimalen Voraussetzungen für die digitale Transformation“, erläutert Rolf Schumann, Vorstandsvorsitzender von Schwarz Digital. Quelle/Bildquelle: Schwarz Gruppe"
246705c7-3cd3-491f-a8c7-693cac07fadd,2023-07-05 08:13:45+00:00,"Bisherige Mitglieder der Geschäftsführung sind Sebastian Voigt, Partner und Mitglied der Geschäftsleitung von hy, sowie Christoph Schwienheer. Sebastian Voigt wird sich zukünftig vollständig auf die hy Business Unit ""Pricing and Sales"" konzentrieren, während Christoph Schwienheer weiterhin als Teil der Geschäftsführung von hy Technologies tätig ist. Zur Person: Jan Hasse verfügt über umfangreiche Erfahrungen bei namhaften Unternehmen wie Allianz, Bertelsmann und PWC. Zuletzt war er als Director AI Innovations & Ecosystems bei Deloitte tätig, ehe er sein eigenes AI-Startup Cloe.ai gründete, um hier einen Self-Service Marktplatz für KI-Lösungen aufzubauen. ""Als ausgewiesener Experte im Bereich Künstliche Intelligenz versteht Jan Hasse sowohl die wirtschaftlichen Aspekte der KI-Beratung als auch die Entwicklung skalierbarer KI-Applikationen, die zu hy Technologies passen"", heißt es bei dem Springer-Unternehmen. Christoph Keese, Co-CEO der Axel Springer hy GmbH, sagt: ""Wir erleben derzeit eine beispiellose Begeisterung für die Schlüsseltechnologie Künstliche Intelligenz. Die nächste KI-Dekade wird Industrien, Unternehmen sowie unsere Lebens- und Arbeitsweise revolutionieren. Durch den Einsatz generativer KI werden sich tägliche Arbeitsroutinen drastisch ändern und bis zu 40 Prozent aller Tätigkeiten von KI beeinflusst werden. Angesichts dieser Entwicklung investieren wir in hy Technologies, die Daten- und KI-Business Unit von Axel Springer hy, um unseren Kunden dabei zu helfen, einen bedeutenden Mehrwert zu schaffen – und das auf verantwortungsbewusste Weise im Umgang mit der Technologie, begleitet von klaren Geschäftszielen."" Dr. Sebastian Voigt fügt hinzu: ""Bei hy ist es unser Anspruch, stets am Puls der Zeit zu sein, mutig und visionär voran zu schreiten. Daher freue ich mich sehr, Jan Hasse den Staffelstab zu überreichen, damit er gemeinsam mit Christoph Schwienheer hy Technologies zum AI Powerhouse aufbauen kann. Unser Kundenversprechen lautet: Turn AI into RoI.” Jan Hasse selbst sagt zu seiner neuen Führungsaufgabe: ""Als visionäre KI Boutique-Beratung glauben wir bei hy Technologies fest daran, dass die Zukunft eine Fülle von Chancen für unsere Kunden bereithält und wir werden mit Mut und Vision agieren, um sie bei der Erschließung des vollen Potenzials der Künstlichen Intelligenz zu unterstützen. Von der Strategie bis zur konkreten Umsetzung bieten wir unseren Kunden nicht nur ein breites Portfolio an Beratungsleistungen, sondern vor allem auch die Entwicklung von daten-basierten Produkten und KI-Unternehmen sowie ein umfangreiches Aus- und Weiterbildungsprogramm für Menschen ohne Programmierkenntnisse.” Hasse-Geschäftsführungskollege Christoph Schwienheer erklärt: „Unser Leistungs- und Produktportfolio bei hy Technologies spiegelt unsere Leidenschaft für disruptive KI-Technologien wider. In enger Zusammenarbeit mit unseren Kunden entwickeln wir maßgeschneiderte KI-Produkte und sind fest davon überzeugt, dass eine Integration von Künstlicher Intelligenz in ihre Geschäftsstrategien einen klaren Wettbewerbsvorteil verschaffen wird. Mit einer sicheren und skalierbaren KI-Plattform werden wir unsere Kunden in einer Welt des ständigen Wandels erfolgreich machen.”"
7695e2f8-9f21-4535-a94a-610b3a80fb73,2023-07-05 09:56:00+00:00,"Startseite Sport FC Bayern Bye, bye Katar: FC Bayern verkündet Zusammenarbeit mit Discounter Von: Florian Schimak Das Katar-Sponsoring hat der FC Bayern bekanntlich beendet. Nun vollzieht der Rekordmeister in dieser Richtung quasi eine 180-Grad-Wende. München – Für viele Fans war es eine frohe Botschaft: Der FC Bayern verlängert das Sponsoring mit Qatar Airways nicht. In der vergangenen Woche erklärte der Rekordmeister, dass der auslaufende Vertrag nach fünf Jahren zum 30. Juni nicht verlängert wird. „Der FC Bayern München und Qatar Airways haben erfolgreich zusammengearbeitet und voneinander gelernt“, hieß es in der Vereinsmitteilung. Bye, bye Katar: FC Bayern bald mit Discounter auf dem Ärmel? Nun stellt sich die Frage: Wer wirbt nun zukünftig auf dem Arm des FC Bayern? Bislang wurde dies noch nicht kommuniziert. Dennoch verkündeten die Münchner am Dienstag (4. Juli) eine neue Partnerschaft. Dabei gehen die Münchner ganz neue Wege und vollziehen quasi eine 180-Grad-Wende. „Der FC Bayern und Unternehmen der Schwarz Gruppe haben eine Kooperation vereinbart“, heißt es in der offiziellen Vereinsmitteilung: „In den kommenden Jahren werden die Lidl-Eigenmarke Saskia Mineralwasser, PreZero sowie die IT-Produkte XM Cyber und STACKIT zu Partnern des deutschen Rekordmeisters.“ FC Bayern geht neue Wege im Sponsoring: Von Qatar Airways zu Umweltdienstleister Von Katar zum Discounter? Wohl eher nicht. Das Mineralwasser der Lidl-Eigenmarke Saskia beliefert zukünftig lediglich die Allianz Arena. Auch PreZero, laut den Bayern „einer der führenden Umweltdienstleister in Europa“, steigt zwar nun noch tiefer beim Rekordmeister ein, auf den Ärmel kommt PreZero aber nicht. Bereits seit drei Jahren war das Unternehmen für die Entsorgung in der Arena zuständig, nun wird „die gesamte Abfallwirtschaft an den Standorten des FC Bayern“ übernommen. Weiter heißt es in der Pressemitteilung: „Ziel dabei ist es, Wertstoffkreisläufe Schritt für Schritt zu schließen und somit Recyclingquoten zu verbessern.“ Andreas Jung zeigt sich begeistert über die künftigen Partnerschaften. „Wir freuen uns, dass die Unternehmen der Schwarz Gruppe PreZero, STACKIT und XM Cyber Partner des FC Bayern werden“, sagte der Marketingvorstand der Münchner: „Darüber hinaus sind wir glücklich über unsere neue Getränkekooperation mit Saskia Mineralwasser. Die Zusammenarbeit ist langfristig ausgerichtet, und in den Bereichen Kreislaufwirtschaft und Digitalisierung wird sie der Beginn eines gemeinsamen Weges werden.“ Wer wirbt auf dem Ärmel des FC Bayern? Frische Millionen für Kane-Transfer benötigt Wie viel der FC Bayern bei der neuen Partnerschaft kassiert, wurde nicht mitgeteilt. Frisches Geld können die Bayern-Bosse aber gut gebrauchen, denn die erhoffte Verpflichtung von Wunschspieler Harry Kane gestaltet sich nicht ganz so einfach. Doch nun hat der Rekordmeister ein Transfer-Ass aus dem Ärmel gezogen. Welches Werbe-Ass künftig den Bayern-Ärmel ziert, steht jedoch noch nicht fest … (smk)"
0a6bb6dc-e26d-4cae-a0ec-656d893b73bd,2023-07-06 15:24:00+00:00,"Startseite Wirtschaft E-Autos: Allianz warnt vor erhöhtem Brandrisiko auf Schiffen – „Schäden in Milliardenhöhe“ Von: Lisa Mayerhofer Brände waren 2022 die Hauptursache für Totalverluste bei Schiffen. Das steigende Brandrisiko geht auch auf den vermehrten Transport von Elektrofahrzeugen zurück, erklärt die Allianz in einer Studie. München – Die Neuzulassungen für Elektroautos sind im vergangenen Jahr um 25 Prozent gestiegen – und 2023 wird es voraussichtlich noch einmal einen gewaltigen Sprung nach vorne geben. E-Mobilität spielt weltweit eine immer wichtigere Rolle. Das bedeutet, dass auch immer mehr Elektroautos und die Lithium-Ionen-Akkus, mit denen sie betrieben werden, verschifft werden – mit wachsenden Risiken. Elektroautos und Batterien: Brandgefahr durch Falschdeklarationen Auf dem Seeweg werden rund 90 Prozent des weltweiten Handels abgewickelt. Das berichtet die Allianz in ihrer aktuellen Schifffahrtsstudie. Darin weist der Münchner Versicherer auch darauf hin, dass Brände im vergangenen Jahr die Hauptursache für Totalverluste bei Schiffen war. Und das Risiko für Brände steigt – auch wegen des vermehrten Transports von Elektrofahrzeugen und sonstiger batteriebetriebener Güter. Im Gespräch mit Ippen.Media erklärt Justus Heinrich, Leiter der Schiffs- und Transportversicherung in der CEE-Region, die Thematik genauer. „Lithium-Ionen-Akkus sind eine wichtige Energiequelle und an sich nicht das Problem, weil sie grundsätzlich nicht häufiger brennen als andere Güter. Nur wenn sie sich entzünden, sind sie schwieriger zu löschen“, betont der Allianz-Experte. Das eigentliche Problem seien die Falschdeklarationen. Denn die Akkus sind als Gefahrgut klassifiziert. Das bedeutet: Sie brauchen einen speziellen limitierten Platz auf dem Containerschiff und die Verladung ist teurer. „Manche Unternehmen versuchen, Geld zu sparen und tricksen bei der Deklaration“, erklärt Heinrich. „Dann werden Container verladen, in denen sich laut Deklaration Glasflaschen oder Spielzeug befinden sollen – tatsächlich sind es aber Batterien oder Chemikalien.“ Das passiere recht häufig, so der Experte. Erst vor kurzem sei auf dem AGCS Marine Fachforum eine Auswertung vorgestellt worden, nach der mehrere hundert Container die Woche nachweislich, und alleine von einem Screening-Anbieter identifiziert, falsch deklariert waren. „Ich nehme an, dass die Dunkelziffer noch viel höher ist“, so Heinrich. Brände auf Schiffen: Schäden in Milliardenhöhe Falls dann ein Brand ausbricht, wird die Falschdeklaration zum massiven Problem. „Man hat nur ein kurzes Zeitfenster, in dem man sehr schnell reagieren muss, um den Brand noch unter Kontrolle zu bekommen“, so Heinrich. „Wenn die Akkus nicht an der dafür vorgesehenen Stelle verladen sind, verstreicht wertvolle Zeit, um beispielsweise für den Löschvorgang überhaupt erst den Weg frei zu räumen.“ Wenn der Brand dann weiter um sich greife, drohe nicht nur die Ladung Schaden zu nehmen, sondern der komplette Schiffsverlust. „Hinzu kommen Rettungs- und Umladungskosten. Bei einem großen Containerschiff kann der Schaden schlimmstenfalls Milliardenhöhe erreichen“, erklärt der Experte. Brände führten laut der Schifffahrtsstudie der Allianz zum Verlust von 64 Schiffen in den vergangenen fünf Jahren. Der Versicherer fordert deshalb striktere Vorschriften für die Verladungsdichte und Kennzeichnung von Gefahrgütern sowie mehr Fokus auf das Löschdesign bzw. Löschlösungen auf Containerschiffen. Eine Reederei aus Norwegen hat wegen der Brandgefahr schon massive Konsequenzen gezogen. Havila Kystruten hat zu Jahresbeginn den Transport von E-Autos auf ihren Schiffen gestoppt, berichtet die Tagesschau. Das Verbot sei das Ergebnis einer „Sicherheitsbewertung“."
1590c1c8-c681-4904-b14e-c8239afb6d03,2023-07-07 10:20:02+00:00,"Der Wasserstoffmotor ist startbereit. Dieses klare Signal sendet die diesjährige „Wasserstoffmotor Live“, veranstaltet von der Allianz Wasserstoffmotor e.V. 24 Austeller haben am 30. Juni auf dem Gelände des Karlsruher Instituts für Technologie das geballte Potenzial dieser Antriebstechnik gezeigt. Am Vorabend waren bereits über 500 Besucher auf das Ausstellungsgelände gekommen. Der Wasserstoffmotor demonstrierte in Karlsruhe seine Einsatzmöglichkeiten für vielfältige Anwendungen im Nutzfahrzeugsektor. Allerdings müssen in den kommenden Jahren noch massive Investitionen getätigt werden. „Die Infrastruktur ist und bleibt die offene Flanke für den Durchbruch des Wasserstoffmotors“, betonte Professor Thomas Koch, Vorsitzender der Allianz Wasserstoffmotor. Auf dem Podium v.l.n.r.: A. Franz (CEO Mahle), J-O. Röhrl (SVP Bosch) Michael Theurer (Staatssekretär), Prof. Dr. Thomas Koch (KIT / IfKM) Bild: Allianz Wasserstoffmotor e.V. Der bereits einsatzfähige Wasserstoffmotor ist ein Signal für den Aufbau einer Wasserstofftankstellen-Infrastruktur in Europa, sagte Arnd Franz, CEO von Mahle auf der „Wasserstoff Live“. Der Technologie-Mix, zu dem auch der Wasserstoffmotor zählt, ist nach den Worten von Franz für das Erreichen der ambitionierten EU-Klimaziele unverzichtbar. Franz: „Wasserstoff hat das Potenzial, viele Nutzfahrzeuge besonders schnell klimaneutral zu machen.“ Anwendungen des Wasserstoffmotors im Nutzfahrzeugsektor Für viele Anwendungen im Nutzfahrzeugsektor stellt für Jan-Oliver Röhrl, Bereichsvorstand bei Bosch Powertrain Solutions, der Wasserstoffmotor „die einzige sinnvolle Lösung“ dar. Gerade unter dem Aspekt der Nachhaltigkeit und der Resilienz sprechen viele Argumente für diesen Antrieb. So benötigt die Produktion des Wasserstoffmotors – anders als die Elektro-Batterie – keine knappen Rohstoffe wie Nickel, Iridium oder Lithium sowie keine Seltenen Erden, die ganz überwiegend aus China stammen. Michael Theurer, Staatssekretär im Bundesverkehrsministerium, hat ein Plädoyer für Technologieoffenheit und damit auch für den Wasserstoffmotor gehalten. Die Klimaschutzziele in Europa können Theurer zufolge nur mit Hilfe aller zur Verfügung stehenden Technologien erreicht werden. Der Staatssekretär hat auf der „Hydrogen Engine Live“ in Karlsruhe angekündigt, dass es Anfang 2024 einen Förderaufruf für 100 neue Wasserstofftankstellen in Deutschland geben wird. „Wir brauchen klimaneutrale Antriebe für die Straße“, sagte Theurer in seinem Vortrag vor 150 Vertretern aus Wirtschaft und Wissenschaft. Dem grünen Wasserstoff als klimaneutralem Kraftstoff komme dabei eine ganz entscheidende Rolle zu. „Technologie-Offenheit ist entscheidend. Wir brauchen Wasserstoff auch nicht nur als Champagner, sondern als Tafelwasser für die Antriebe der Zukunft.“ Wasserstoffmotor bietet viele Chancen „Wir sind mit dem Wasserstoffmotor bereits aus der Nische heraus“, wurde auch von Michael Brecht, Gesamtbetriebsratsvorsitzender von Daimler Truck, bestätigt. Gerade für den Standort Deutschland und seine Beschäftigten biete der Wasserstoffmotor viele Chancen. So könnten viele Unternehmen zeitnah und mit relativ geringem Aufwand die Produktion von Diesel- oder Benzinmotoren auf Wasserstoffmotoren umrüsten. „Die Fertigungsstrukturen für den Wasserstoffmotor sind in Deutschland vorhanden. Viele Arbeitsplätze könnten mit dem Wasserstoffmotor hierzulande erhalten werden“, sagte Brecht bei der Allianz Wasserstoffmotor. Er hat angekündigt, dass die IG Metall demnächst „mit voller Überzeugung“ der Wasserstoff-Allianz beitreten wird. Batterie-elektrisch, Brennstoffzelle oder Wasserstoffmotor? Tony Satterthwaite, Senior Vice President Cummins Inc., hat in seinem Vortrag die Investitionen des Energietechnikherstellers Cummins in die Wasserstoff-Technologie beleuchtet. Cummins Aktivitäten seien ein wichtiger Bestandteil von Amerikas Wasserstoffmotoren-Offensive, der nach dem Willen der US-Regierung auch die strategische Abhängigkeit von China reduzieren werde. „Der Motor zeigt unsere Verantwortung und unsere Möglichkeiten“, sagte Satterthwaite. „Vor fünf Jahren war der Wasserstoffmotor noch kein Thema und heute sind wir in der Lage unseren Kunden bezahlbare Angebote zu machen.“ Cummins werde auf allen großen Weltmärkten den Wasserstoffmotor produzieren, sagte der US-Manager. (ch) Mehr zum Thema Nachhaltigkeit"
