5c941888-c7ae-4b78-9ac7-29489002b89e,2023-07-25 08:55:00+00:00,"Es sind nur mehr eingefleischte Fußballfans, die wissen, dass die Heimstätte von Sturm Graz eigentlich einmal Liebenauer Stadion hieß. Heute kicken die ""Schwoazn"" in der Merkur-Arena. Der Stadionname bringt Geld in die Kasse des Fußballvereins. Und auch beim sonst traditionsbewussten SK Rapid Wien spielt man im Allianz-Stadion, obwohl die Ultras noch immer mit dem Namen Weststadion kokettieren. Doch der Verkauf des Stadionnamens ist längst keine Debatte der ""großen"" Vereine mehr. Zuletzt wurde im Gemeinderat von Matrei über den neuen Namen des Tauernstadions diskutiert. Hier können Sie sich für Ihr Kleine Zeitung-Benutzerkonto anmelden oder neu registrieren. Ihre derzeitigen Cookie Einstellungen lassen dies nicht zu. Wir verwenden für die Benutzerverwaltung Services unseres Dienstleisters Piano Software Inc. („Piano“). Dabei kommen Technologien wie Cookies zum Einsatz, die für die Einrichtung, Nutzung und Verwaltung Ihres Benutzerkontos unbedingt notwendig sind. Mit Klick auf „Anmelden“ aktivieren Sie zu diesem Zweck die Verwendung von Piano und werden über Ihren Browser Informationen (darunter auch personenbezogene Daten) verarbeitet. Die Datenschutzinformation von Kleine Zeitung können Sie hier einsehen."
3ef4acd2-af70-479c-a490-478199bb6a8f,2023-07-26 13:30:05+00:00,"Einstieg bei Xpeng So will Volkswagen das Elektrogeschäft in China retten Die Konkurrenz ist Volkswagen im Geschäft mit E-Autos in China enteilt. Vorstand Ralf Brandstätter will nun gegensteuern – mit einer neuen Allianz zwischen VW und Xpeng sowie einer erweiterten Partnerschaft zwischen Audi und SAIC. Von Christoph Seyerlein 26.07.2023, 15.30 Uhr Um im Geschäft mit Elektroautos in China nicht weiter abgehängt zu werden, holt sich Volkswagen Hilfe. Die Marke VW werde ihr eigens entwickeltes Elektroportfolio 2026 um zwei Modelle erweitern, die man gemeinsam mit dem chinesischen Hersteller Xpeng entwickle, kündigte Volkswagens China-Vorstand Ralf Brandstätter (54) am Mittwoch an. Beide Autos sollen in der Mittelklasse antreten, in der VW im Verbrennergeschäft in China mit den Modellen Passat und Teramont vertreten ist. Die Zusammenarbeit werde sich nicht rein auf die Elektromobilität beschränken, auch bei Software und autonomem Fahren will VW mit Xpeng kooperieren. Premiumtochter Audi wiederum werde die Partnerschaft mit SAIC ausbauen. Gemeinsam wolle das Duo ""mit Elektro-Modellen in einem Segment starten, in dem Audi in China bisher noch nicht vertreten ist"", hieß es. Sowohl die zusätzlichen VW- als auch Audi-Modelle sind vorerst rein für den chinesischen Markt vorgesehen. { iframeIsLoaded = true })"" x-embed-bridge-message=""if ($message.event === 'resize' && typeof $message.height === 'number') {iframeHeight = $message.height;} else if ($message.event === 'track') {$publish('SARAS_PUSH_DATA', $message.payload);}""> Der Deal mit Xpeng geht über eine reine Technologiepartnerschaft hinaus. Volkswagen kauft im Rahmen einer Kapitalerhöhung für 700 Millionen US-Dollar 4,99 Prozent der Anteile an dem chinesischen Hersteller. Das habe der Aufsichtsrat am Mittwoch so beschlossen. In einem Linkedinbeitrag zeigte sich Brandstätter mit Xpengs Chairman He Xiaopeng (45). Mit ihm und dem gesamten Team habe er sich in den letzten Monaten ""sehr vertrauensvoll ausgetauscht"". Mit Volkswagen wolle Xpengs Chef vor allem zusammenarbeiten, da kein anderer internationaler Autobauer die chinesische Kultur besser verstehe. Brandstätter betonte, die ""Entwicklungsverantwortung"" für die neuen Projekte übernehme die jüngst gegründete Volkswagen Group China Technology Company in Hefei in der Provinz Anhui. Dort sollen künftig mehr als 2000 Menschen in der Entwicklung und Beschaffung arbeiten, der Standort wird damit zum größten Entwicklungszentrum des Autobauers außerhalb Wolfsburgs. Eigens entwickelte E-Autos kommen schlecht an Bislang bietet Volkswagen in China Elektroautos an, die allesamt auf der eigenen MEB-Plattform aufbauen. Doch weder die ID-Fahrzeuge noch Audis Q4 und Q5 e-tron kommen bei den Kunden vor Ort an. Über viele Jahre Marktführer, hatte Volkswagen zuletzt den Spitzenplatz zuletzt an BYD abtreten müssen. Im zweiten Quartal brachte BYD in China 595.300 Neuwagen auf die Straße, Volkswagen 544.000. Gerade die Elektroautos von VW und Audi kommen in China bis dato nicht an. Zwischen April und Juni verkaufte der Konzern 23.433 Elektroautos, ein magerer Anteil von 4 Prozent am Gesamtabsatz. Der nun eingeschlagene Weg bedeutet einen Paradigmenwechsel in der China-Strategie des Konzerns. Hatten in der Vergangenheit Volkswagens Joint-Venture-Partner wie SAIC und FAW vom Know How des deutschen Autobauers profitiert, wendet sich nun das Blatt. ""In einem wettbewerbsintensiven und dynamischen Marktumfeld bauen wir auf die jeweiligen Kernkompetenzen der Partner. Wir schaffen so Synergien, um zusätzliche Produkte schneller auf den Markt zu bringen."" Lokale Partnerschafen seien ""ein wesentlicher Baustein"" der ""in China für China-Strategie"" des Konzerns. Heißt: Brandstätter koppelt das China-Geschäft immer mehr von der Zentrale in Wolfsburg ab. sey"
2ad0c97e-5cf4-4a68-b4ee-71c1483f22f6,2023-07-26 13:49:41+00:00,"Die Haftpflichtversicherung gehört zu den in Deutschland am meisten verbreiteten Policen – und offensichtlich sind die Kunden zu großen Teilen mit ihrem Anbieter zufrieden, im Vergleich mit anderen Policen ist das Beschwerdeaufkommen gering. Den Versicherungsombudsmann Wilhelm Schluckebier erreichten im vergangenen Jahr zu dieser Sparte 497 Beschwerden, 2021 waren es noch 561 gewesen. Die aktuelle BaFin-Beschwerdestatistik zeichnet für das Jahr 2022 ein ähnliches Bild: 271 Beschwerden bearbeitete die Behörde 2022 abschließend – ein Rückgang gegenüber dem Vorjahr, als das Beschwerdeaufkommen noch bei 295 Fällen gelegen hatte. Kundenärger auch bei InsurTechs Dabei verteilten sich die Beschwerden im vergangenen Jahr auf 64 Haftpflicht-Versicherer mit einer gesamten Vertragszahl von 62,5 Millionen. Die durchschnittliche Beschwerdequote bezifferte sich damit auf 0,43 pro 100.000 Policen. Beim Betrachten der Statistik fällt auf: Insurtechs sorgten für relativ großen Kundenärger. So hatten die Haftpflichtversicherer Luko aus Berlin – das sich am 9. März 2022 aus der Coya AG gegründet hat – und Getsafe aus Heidelberg mit die höchsten Beschwerdequoten zu verzeichnen. Zum Fintech Luko lagen der BaFin 21 Beschwerden vor, bei einer Vertragszahl von 27.310 kam das Unternehmen damit auf eine Beschwerdequote von 76,89 – und lag damit erheblich über dem Durchschnitt von 0,43. Bei der GVV-Kommunalversicherung war die Beschwerdequote mit 77,2 am höchsten, was allerdings in Zusammenhang mit dem verhältnismäßig geringen Vertragsbestand von 3.886 zu betrachten istt. De facto gingen bei der BaFin lediglich drei Beschwerdefälle zur GVV ein. Etwas unübersichtlicher gestaltet sich die Situation beim Heidelberger Fintech Getsafe: Hier kamen sechs Haftpflicht-Beschwerden auf 9.741 Verträge. Allerdings ist unter der Vertragszahl sowohl die Sparte Haftpflicht wie die Sparte Hausrat zusammengefasst, die sich so errechnende Beschwerdequote von 61,6 Prozent besitzt damit nur teilweise Aussagekraft. Zudem habe Getsafe, laut eigener Aussage, zum Ende des Geschäftsjahres 2022 bereits knapp 150.000 Policen in den Büchern gehabt, sei also innerhalb eines Jahres um das 14-Fache gewachsen. Die BaFin verfolgt in der Methodik Ihrer Beschwerdestatistik für solche Unternehmen einen speziellen Ansatz: ""Stark expandierende Versicherer, zu denen häufig neu gegründete Unternehmen gehören, werden durch die Nennung der Bestandszahlen nicht angemessen berücksichtigt, weil sich der im Laufe des Jahres erhöhte Bestand, aus dem sich die Beschwerden ergeben, nicht in der Statistik wiederfindet."" Allerdings bezieht sich die Beschwerdestatistik auch nur auf die Fälle, die beispielsweise in 2022 abschließend bearbeitet wurden. Darunter befinden sich regelmäßig auch Beschwerden, die bereits im Vorjahr bei der BaFin eingegangen sind und sich somit auch bei den schnell wachsenden Unternehmen noch auf den Bestand des Vorjahres beziehen. Das sind die Versicherer mit den meisten Beschwerden Versicherer Vertragsbestand Beschwerdefälle Beschwerdequote GVV-Kommunalversicherung 3.886 3 77,2 Luko Ins. AG 27.310 21 76,89 Getsafe 9.741 6 61,60 Versicherungskammer Bayern 15.159 8 52,77 Wie haben die Branchengrößen in der Behördenstatistik abgeschnitten? Betrachtet man die Haftpflichtversicherer mit einer Vertragszahl von mehr als zwei Millionen, zeigt sich: Die Kunden der großen Anbieter scheinen insgesamt zufriedener. Der Versicherungsriese Allianz hatte beispielsweise mit einem Vertragsbestand von 4.530.590 eine Beschwerdequote von 0,46 zu verzeichnen und lag damit nur leicht über dem Durchschnitt. Bei der HUK-Coburg befand sich die Beschwerdequote mit 0,34 sogar unterhalb des Mittelwerts. So schlugen sich die Branchenriesen Versicherer Vertragsbestand Beschwerdefälle Beschwerdequote Allianz Versicherung 4.530.590 21 0,46 Axa Versicherung 3.163.597 17 0,54 Generali Deutschland 2.215.183 10 0,45 HUK-Coburg Unternehmensgruppe 2.052.948 7 0,34 R+V 1.949.675 14 0,72 Die Bafin gibt in ihrer Beschwerdestatistik keine Auskunft darüber, ob die Beschwerden berechtigt waren oder nicht. Auch über die Beschwerdegründe macht sie keine Angaben."
76c0b7c1-c131-416e-8d19-1500b4a3ce7f,2023-07-26 14:42:00+00:00,"Agentur-Chef Erwin Maier ist stolz auf die vergangenen 20 Jahre: ""Wir durften sowohl persönlich als auch als Arbeitgeber wachsen und uns weiterentwickeln."" Im Jahr 2003 wurde das Unternehmen von Helga Kreiner-Jandl gemeinsam mit ihrem Schwiegersohn Erwin Maier und dessen Mutter gegründet. Ganz unter dem Motto: ""Vorne ist da, wo sich Kreiner auskennt"", wurde mit rund 100 Gästen beim Sporterlebnis Camp Pristavec in Obervellach gefeiert. ""Wir sind ein Familienunternehmen und werden diese Philosophie auch in der Zukunft beibehalten. Unsere zehn Mitarbeiter sind für uns wie eine Familie"", so Maier weiter. Kreiner-Jandl kann sich nun in den wohlverdienten Ruhestand verabschieden. Sie war die erfolgreichste Versicherungsverkäuferin in der Geschichte der Allianz Österreichs. Zum 20-Jahr-Jubiläum: Helga Kreiner-Jandl (Mitte) verabschiedete sich in den Ruhestand © Allianz Agentur Kreiner GmbH Maier: ""Unsere Vision für die nächsten 20 Jahre ist es, weiterhin verlässlicher Partner in allen Versicherungs- und Finanzierungsfragen zu sein. Als moderner Arbeitgeber wollen wir uns nachhaltig für die Region und die Zukunft unserer Kinder einsetzen."" Hier können Sie sich für Ihr Kleine Zeitung-Benutzerkonto anmelden oder neu registrieren. Ihre derzeitigen Cookie Einstellungen lassen dies nicht zu. Wir verwenden für die Benutzerverwaltung Services unseres Dienstleisters Piano Software Inc. („Piano“). Dabei kommen Technologien wie Cookies zum Einsatz, die für die Einrichtung, Nutzung und Verwaltung Ihres Benutzerkontos unbedingt notwendig sind. Mit Klick auf „Anmelden“ aktivieren Sie zu diesem Zweck die Verwendung von Piano und werden über Ihren Browser Informationen (darunter auch personenbezogene Daten) verarbeitet. Die Datenschutzinformation von Kleine Zeitung können Sie hier einsehen."
2c6f5f26-366b-40b0-b9b3-b68912492951,2023-07-26 17:12:00+00:00,"Zur Ausgabe Artikel 13 / 38 Katholische Kirche im Nationalsozialismus Eine unheilige Allianz Glaubensfestigkeit hat keineswegs immun gemacht gegen Ideologie und Lockangebote der Nazis. Das Beispiel Eichstätt zeigt, wie bereitwillig und rasch das katholische Kirchenvolk vor 90 Jahren zu Hitler überlief. Von Felix Bohr 26.07.2023, 19.12 Uhr • aus SPIEGEL Geschichte 6/2022 Sie können den Artikel leider nicht mehr aufrufen. Der Link, der Ihnen geschickt wurde, ist entweder älter als 30 Tage oder der Artikel wurde bereits 10 Mal geöffnet. SPIEGEL plus Anmelden Digital-Abo Sagen, was ist. Testen Sie das digitale Angebot und erfahren Sie, warum mehr als 400.000 Menschen den SPIEGEL abonnieren. Kennenlernangebot - 4 Wochen für € 1,– € 4,49 pro Woche für 52 Wochen € 78,- sparen Jetzt abonnieren Ihre Bezahlmöglichkeiten: Paypal Sepa Visa Mastercard ApplePay GooglePay Jederzeit kündigen. Weiterlesen mit SPIEGEL+ Mehr Perspektiven, mehr verstehen. Freier Zugang zu allen Artikeln, Videos, Audioinhalten und Podcasts Alle Artikel auf SPIEGEL.de frei zugänglich DER SPIEGEL als E-Paper und in der App Alle Artikel zum Anhören und exklusive Podcasts Preis wird geladen... Sie haben bereits ein Digital-Abonnement? SPIEGEL+ wird über Ihren iTunes-Account abgewickelt und mit Kaufbestätigung bezahlt. 24 Stunden vor Ablauf verlängert sich das Abo automatisch um einen Monat zum Preis von zurzeit € 21,99. In den Einstellungen Ihres iTunes-Accounts können Sie das Abo jederzeit kündigen. Um SPIEGEL+ außerhalb dieser App zu nutzen, müssen Sie das Abo direkt nach dem Kauf mit einem SPIEGEL-ID-Konto verknüpfen. Mit dem Kauf akzeptieren Sie unsere Allgemeinen Geschäftsbedingungen und Datenschutzerklärung."
585de8ed-a58e-4eb1-b88d-e4fd68a1b35a,2023-08-01 11:07:00+00:00,"Startseite Wirtschaft Nach E-Desaster: Volkswagen verbündet sich mit chinesischen Autobauern Von: Felix Lee Mithilfe chinesischer Partner und Konkurrenten will Volkswagen den Rückstand auf dem weltgrößten Pkw-Markt aufholen. Dazu schließt die Hauptmarke VW mit dem Autobauer Xpeng eine Kooperation. Audi wiederum übernimmt zeitweise die E-Plattform von SAIC. Die Bindung an China wird dadurch enger denn je. Diese Analyse liegt IPPEN.MEDIA im Zuge einer Kooperation mit dem China.Table Professional Briefing vor – zuerst veröffentlicht hatte sie China.Table am 27. Juli 2023. Dass angesichts mieser Verkaufszahlen im Volkswagen-Konzern etwas im Schwange ist, haben die meisten Automarktexperten geahnt. Und doch dürfte diese Nachricht wie eine Bombe einschlagen. Europas größter Autobauer will mithilfe chinesischer Konkurrenten den Rückstand insbesondere in der Elektromobilität aufholen und auf diese Weise seinen Absturz auf dem weltgrößten PKW-Markt aufhalten. Dazu arbeitet die Hauptmarke VW mit dem chinesischen E-Autobauer Xpeng ab sofort langfristig zusammen bei Elektromobilität, Software und selbstfahrenden Autos. Unterlegt werde die Allianz durch eine knapp fünfprozentige Beteiligung, für die Volkswagen 700 Millionen Dollar bezahle, teilte der Konzern am Mittwoch im Anschluss an eine Aufsichtsratssitzung in Wolfsburg mit. Newsletter von Table.Media Erhalten Sie 30 Tage kostenlos Zugang zu weiteren exklusiven Informationen der Table.Media Professional Briefings – das Entscheidende für die Entscheidenden in Wirtschaft, Wissenschaft, Politik, Verwaltung und NGOs. Geplant sind zunächst die gemeinsame Entwicklung zweier Elektro-Modelle für das Mittelklasse-Segment von VW. Sie sollen in der noch relativ neuen Fabrik der Wolfsburger im ostchinesischen Hefei in der Provinz Anhui gebaut werden und 2026 auf den chinesischen Markt kommen. VW baut den Standort Hefei derzeit zu einem neuen Produktions- und Entwicklungszentrum aus. Audi baut auf Elektro-Plattform von SAIC Damit nicht genug: Zugleich teilte der Konzern mit, dass die Volkswagen-Tochter Audi ein strategisches Abkommen mit dem Joint Venture-Partner SAIC unterzeichnet habe. Kern dieser Zusammenarbeit wird zunächst die Übernahme der Elektroplattform von SAIC für die Audi-Modelle A3 und A4 sein. Bis 2027 wolle Audi mit SAIC eine gemeinsame E-Plattform entwickelt haben. Das Problem, dass die Ingolstädter derzeit haben: Die E-Autos, die auf dem MEB-Baukasten von Audi aufbauen, sind aus Sicht der chinesischen Kunden zu schlecht vernetzt, sie laden zudem zu langsam und haben auch weniger Leistung als die chinesische Konkurrenz. SAIC soll also in den nächsten Jahren Schützenhilfe leisten, bevor sich Audi mit einer neuen Plattform auf den chinesischen Markt wagt. Die SAIC-Plattform soll für die Mittelklasse-Modelle ausgelegt sein, während Audi mit dem zweiten Partner FAW Elektro-Fahrzeuge der Oberklasse bauen will. Es wird das erste Mal sein, dass der VW-Konzern das Herzstück eines Elektroautos von chinesischen Partnern bezieht. China: Vom Schüler zum Meister Beide Beschlüsse zeigen, wie weit die chinesischen E-Autobauer der deutschen Konkurrenz bereits überlegen sind. Und was noch viel schwerer wiegt: Ohne Hilfe aus der Volksrepublik ist die chinesische Konkurrenz offenbar nicht mehr zu schlagen. SAIC ist zwar seit Beginn des Volkswagen-Geschäfts in China einer von zwei großen Joint Venture-Partnern. Doch dabei hat der chinesische Autobauer fast vier Jahrzehnte lang zu den Deutschen aufgeschaut und wollte von ihnen lernen. Das Verhältnis hat sich nun erstaunlich schnell umgekehrt. Xpeng ist klein VW versucht noch, die eigene Schwäche herunterzuspielen. „Wir kaufen keine Technologie ein, sondern entwickeln gemeinsam Fahrzeuge“, beteuert Volkswagen-China-Chef Ralf Brandstätter bei einer Telefonkonferenz mit Journalisten. Zumindest bis 2027 ist aber genau das geplant: der Einkauf von Technologie. Und ob der Volkswagen-Konzern wirklich mit den chinesischen Partnern künftig Elektroplattformen entwickeln wird, ist noch gar nicht ausgemacht. Die Gespräche laufen noch. Xpeng ist einer der vielen chinesischen Newcomer im E-Auto-Segment – und nicht einmal der Innovativste. Seit 2014 überhaupt erst auf dem Markt, gehört das private und von mehreren Internet-Konzern unterstützte Unternehmen mit Sitz in Guangzhou zu den eher kleineren Autobauern. Es rangierte laut dem Branchenverband CPCA bei E-Autos im ersten Quartal gerade mal auf Rang zwölf im Land. Das Unternehmen punktet eher durch clevere Marketing-Konzepte als durch Größe. VW findet sich in der Nische wieder Mit Abstand an der Spitze steht seit kurzem BYD. Der einstige Batterie-Hersteller hat Volkswagen als Nummer eins am Gesamtmarkt verdrängt, also einschließlich der noch dominierenden Verbrennerautos. VWs starke Position zwei liegt allein an den Verbrennern. In der Elektromobilität fristen VW und Audi ein Nischendasein. Bei den Batterie-Fahrzeugen gingen die Verkaufszahlen der Wolfsburger in der ersten Hälfte dieses Jahres im Vergleich zum Vorjahreszeitraum gar um 1,6 Prozent auf 62.400 Autos zurück. Angepeilt sind für das Gesamtjahr bisher rund 200.000. BYD verkauft zehnmal mehr E-Autos als VW. Und Audi hat in der Volksrepublik bei E-Autos komplett den Anschluss verloren, im ersten Quartal setzten die Ingolstädter gerade einmal gut 3.000 batteriegetriebene Fahrzeuge ab."
0b43d8e4-bc8f-42f8-a140-7f6563d7efc7,2023-08-01 15:15:26+00:00,"Allianz-Konzernchef Oliver Bäte, 58, wird auch nach Ablauf seines aktuellen Vertrags im September 2024 an der Spitze des größten europäischen Versicherers stehen. Offenbar haben sich die Aufsichtsräte der Obergesellschaft Allianz SE unter ihrem Vorsitzenden und Bäte-Vorgänger Michael Diekmann, 68, auf die Verlängerung des Vertrags geeinigt. Unternehmenskreise bestätigten entsprechende Meldungen. Zuerst hatte das ""Handelsblatt"" darüber berichtet. Die Allianz äußerte sich nicht. Der Aufsichtsrat wird sich formell erst im Herbst mit dem Thema befassen. Ebenfalls auf der Tagesordnung steht die Vertragsverlängerung für Vorstand Andreas Wimmer, 49. Er verantwortet unter anderem die Vermögensverwalter Pimco und Allianz Global Investors (AGI). SZ PlusGeldanlage :Das sind die besten Dividenden-Aktien im Dax In Zeiten der Inflation suchen Sparer eine kleine Nebeneinkunft. Das können die Dividenden sein, die Dax-Unternehmen in den nächsten Tagen und Wochen ausschütten. Der SZ-Dividendencheck zeigt, wo es am meisten gibt. Von Victor Gojdka Kein Wechsel in den Aufsichtsrat der Allianz Bäte war in den vergangenen Monaten erheblich unter Druck geraten, weil das Unternehmen nach Betrugsvorwürfen der US-Behörden gegen AGI insgesamt 5,4 Milliarden Euro an Geldstrafen und Schadenersatz an die Anleger in den problembeladenen Structured Alpha-Funds zahlen musste. Anders als der frühere Konzernchef Diekmann wird Bäte nach Ablauf seiner Zeit im Vorstand nicht in den Aufsichtsrat wechseln. Das hatte der Aufsichtsratsvorsitzende bei der Hauptversammlung im Mai bekanntgegeben. Jetzt sucht der Konzern nach einer Nachfolgerin oder einem Nachfolger für Diekmann. Sie oder er soll spätestens 2026 den Aufsichtsratsvorsitz übernehmen und muss bei Investoren, Großkunden und Mitarbeitern gut ankommen. Sehr wahrscheinlich wird es sich dabei nicht um ein aktuelles Mitglied des Aufsichtsrats handeln. Stattdessen hält die Allianz nach hochkarätigen Kandidatinnen und Kandidaten Ausschau, die nicht zwingend aus Deutschland kommen müssen."
15beaac3-bbc5-40ca-8956-c4f8280b60d0,2023-08-29 07:07:19+00:00,"Advertorial Artikel aus dem Handelsblatt Journal „Betriebliche Altersversorge und Kapitalanlage“ vom 24.05.2023 Lebenszyklus-Konzepte spielen in der modernen betrieblichen Altersversorgung eine immer größere Rolle. Kein Wunder – sie bieten für Unternehmen und Sparer gleichermaßen Vorteile. Die Zahlen sprechen eine klare Sprache: 65 Prozent der jungen Menschen achten bei der Wahl des Arbeitgebers darauf, ob er sich bei der betrieblichen Altersversorgung (bAV) für mehr Generationengerechtigkeit einsetzt1. Und 66 Prozent der Mitarbeitenden nennen eine attraktive betriebliche Altersversorgung als wichtigen Grund, ihrem Arbeitgeber die Treue zu halten2. Zahlen, die Altersvorsorgemodelle einkalkulieren müssen. Doch von Anfang an. Die Ziele der bAV Das Ziel eines bAV-Konzepts ist klar: Es soll eine attraktive Ergänzung zur gesetzlichen Rente bieten. Aus Sicht des Mitarbeitenden heißt das: Ansprechende Rendite und Stabilität. Und aus Sicht der Arbeitgeber: Die von ihm zugesagte Mindestleistung, etwa der Beitragserhalt, muss am Ende mit sehr hoher Zuverlässigkeit erreicht werden. Genau das leisten die modernen Lebenszykluskonzepte. Sie strukturieren eine Kapitalanlage so, dass sie zu den individuellen Anforderungen passt und alle Leistungsziele erfüllt. Für den Arbeitgeber bringt das große Vorteile: So kann etwa die Bildung von Rückstellungen nach HGB/IFRS in der Regel entfallen. Außerdem werden zusätzliche Zahlungsverpflichtungen über den geplanten Beitrag hinaus begrenzt. Auch die Mitarbeitenden profitieren: Die optimale Allokation, also die Mischung der Anlageklassen, wird für jeden Versorgungsberechtigten regelmäßig angepasst. Grundregel: Je länger die Laufzeit, umso mehr Renditechancen werden geboten, weil der Anteil risikoreicher Anlagen höher ist. Wer dagegen unmittelbar vor Rentenbeginn steht, hat ein hohes Sicherheitsbedürfnis. Trendwende – Shift von DB zu DC-like Systemen Ohnehin wandelt sich die bAV-Landschaft derzeit stark: Weg von Mindestverzinsungs-Garantien, hin zu den DCähnlichen Systemen. DC steht für Defined Contribution, bei denen nicht die Höhe der Auszahlung garantiert wird, sondern nur die Einzahlung. Kein Wunder, rund 60 Prozent der Arbeitgeber sind nicht mehr bereit, das Zinsrisiko zu tragen, belegt eine Erhebung des Beratungshauses WTW3. Die Zahl der Unternehmen, die auf die neuen Modelle umsteigen, dürfte zunehmen – gerade mit Blick auf die Direktzusage, den flexibelsten bAV-Durchführungsweg. Hier spielen die Lebenszyklus-Modelle wie die von Allianz Global Investors ihre Vorteile aus. Durch die Implementierung eines dynamischen Risikomanagements können Marktkorrekturen abgefedert werden. Gerade in den Jahren kurz vor dem Eintritt in die Rente ist das wichtig. Für den Arbeitgeber wird dadurch die Wahrscheinlichkeit zusätzlicher Zahlungsverpflichtungen gesenkt. Darüber hinaus arbeitet Allianz auch an einem Zugang zu alternativen Anlagen wie etwa Investments in erneuerbare Energien oder Infrastruktur. Anlagen also, auf die Anleger ansonsten nicht ohne Weiteres Zugriff haben. Das Besondere dabei: Zum einen kann die Investition ohne den üblichen J-Kurven-Effekt erfolgen. Das bedeutet, Anleger können sofort an den Chancen der illiquideren Private Markets-Anlagen partizipieren und müssen nicht wie üblich erst Jahre warten, bis über sogenannte Capital Calls sukzessive eine Investition erfolgt. Zum anderen investieren sie zusammen mit der Allianz in dieses Segment. Im Flaggschiff-Produkt ist zudem statt eines klassischen Rentenfonds das Allianz Portfoliokonzept als bessere Zinsanlage eingebaut: Ein Investment in das Sicherungsvermögen der Allianz Leben. Das sorgt für stabile Renditen und verbessert das Ertrags-Risikoprofil vor allem für ältere Mitarbeitende signifikant. Außerdem können auf Wunsch auch Lebenszyklus-Modelle dargestellt werden, die zum Beispiel 80 bis 100 Prozent der eingezahlten Beiträge garantieren. Die Chancen des Kapitalmarkts nutzen und dabei auf das breite Angebot eines erfahrenen Investmenthauses zugreifen – das sind für Mitarbeitende wie Unternehmen gute Argumente in Sachen bAV. Nicht nur Zahlen sprechen eine klare Sprache. de.allianzgi.com 1 Aon, „Betriebliche Altersversorgung: (…)“, Oktober 2021 2 WTW, „Global Benefits Attitudes Survey 2019/2020”, Juni 2020 3 WTW, „Trotz Fachkräftemangel (…)”, Oktober 2022"
