2bf1ce80-a786-42cb-8fb9-ddd7985dfe41,2023-07-07 19:08:00+00:00,"echo24 Leben Verbraucher Lidl-Wasser bald im Stadion: Schwarz-Gruppe wird neuer Sponsor von FC Bayern Von: Juliane Reyle Die Schwarz-Gruppe steigt beim FC Bayern ein: Unternehmen des Konzerns fördern den Fußball-Club durch ihre Leistungen – unter anderem auch mit Mineralwasser von Lidl. Der FC Bayern München und die Schwarz Gruppe, zu der auch das Unternehmen Kaufland gehört, gehen gemeinsame Wege. In einer Pressemitteilung veröffentlicht der Fußball-Club, dass er mit Unternehmen der Schwarz-Gruppe eine Kooperation vereinbart hat. In den kommenden Jahren wird der Konzern den FC Bayern mit der Lidl-Eigenmarke Saskia Mineralwasser, PreZero sowie den IT-Produkten XM Cyber und STACKIT unterstützen. Wie die „TZ“ berichtet, startet der FC München nicht nur eine Kooperation mit dem Discounter Lidl, sondern beendet auch die Zusammenarbeit mit Katar. Lidl-Mineralwasser und Kreislaufwirtschaft künftig auch beim FC Bayern München „Wir freuen uns, dass die Unternehmen der Schwarz Gruppe PreZero, STACKIT und XM Cyber Partner des FC Bayern werden. Darüber hinaus sind wir glücklich über unsere neue Getränkekooperation mit Saskia Mineralwasser. Die Zusammenarbeit ist langfristig ausgerichtet, und in den Bereichen Kreislaufwirtschaft und Digitalisierung wird sie der Beginn eines gemeinsamen Weges werden“, erklärt Andreas Jung, Marketingvorstand des FC Bayern. Kooperation mit FC Bayern München soll Kreislaufwirtschaft fördern Auch seitens der Unternehmen, die den deutschen Fußballclub fördern, sind die Stimmen optimistisch. Thomas Kyriakis, der Vorstandsvorsitzende von PreZero sagt: „Wir möchten gemeinsam unsere Stärken nutzen und ein Zeichen für einen verantwortungsvolleren Einsatz von Ressourcen setzen – sowohl im Sport als auch in der Gesellschaft. Wir sind stolz, zukünftig intensiv mit dem FC Bayern München zusammenzuarbeiten. Wir wollen gemeinsam mit dem Verein sowie seinen Fans und Partnern für mehr Aufmerksamkeit für den Bereich Kreislaufwirtschaft sorgen.“ Doch wegen seiner Kreislaufwirtschaft erntet Lidl bereits heftige Kritik. Generell soll Lidl eine schlechte Ökobilanz haben und diese verheimlichen. FC Bayern München erhält Wasser von Lidl – Abfallentsorgung durch PreZero Die Kooperation wird sich auch auf die Abläufe in den Stadien auswirken. In die Allianz-Arena soll künftig Wasser der Lidl-Eigenmarke Saskia geliefert werden. Und auch PreZero, ein Umweltdienstleister, der bereits seit drei Jahren die Entsorgung der Allianz verantwortet, wird durch die Kooperation in Zukunft die gesamte Abfallwirtschaft der Standorte des FC Bayern übernehmen."
1ffd2a77-1863-4ce5-8473-5ec3b56785d2,2023-07-09 13:23:39+00:00,"Vor einem Jahr haben die beiden Unternehmen die Übernahme vereinbart - doch noch steht die Genehmigung der Finanzaufsicht Bafin aus. Die Schieflage eines Lebensversicherers in Italien könnte jetzt dazu führen, dass der Deal doch noch scheitert oder für den Käufer des Bestandes deutlich teurer wird. Denn Mehrheitseigner von Viridium ist der Londoner Private-Equity-Investor Cinven. Cinven gehört auch der Mailänder Lebensversicherer Eurovita, der jetzt kurz vor der Zerschlagung steht. Die Bafin muss sich die Frage stellen: Ist ein Private-Equity-Unternehmen überhaupt geeignet, die Mehrheit an einem Lebensversicherer zu halten? Eurovita ist mit 18 Milliarden Euro Vermögen ein mittelgroßer Lebensversicherer. Mehr als 20 Banken vertreiben die Policen. Doch als 2022 die Zinsen nach oben kletterten, beschlossen viele Kunden, ihre Policen zu kündigen und das Geld lieber lukrativer anzulegen. In dem einen oder anderen Fall förderte auch die Bank die Entscheidung, die vorher die Verträge verkauft hatte. Sie konnte dann zweimal verdienen. Solche Kündigungswellen wie in Italien gibt es in Deutschland bislang nicht. Hier müssen die Kunden hohe Einbußen hinnehmen, wenn sie ihre Verträge vorzeitig kündigen. Außerdem ist die deutsche Kundschaft deutlich passiver, wenn es um Anlageentscheidungen geht. Doch ausgeschlossen sind vermehrte Kündigungen nicht. Nicht ohne Grund beobachtet die Bafin die Kündigungssituation und die Liquidität der Lebensversicherer genau. Der Mittelabfluss alarmierte 2022 die italienische Versicherungsaufsicht Istituto per la Vigilanza sulle Assicurazioni (IVASS). Sie verlangte vom Eigner in Großbritannien frisches Geld - 400 Millionen Euro sollte er einschießen. Als das Geld nicht kam, zog die Aufsicht im Februar 2023 die Notbremse und fror alle Guthaben ein. Die Kunden kommen bisher nicht an ihr Geld. Daran änderten auch die 100 Millionen Euro nicht, die Cinven schließlich zähneknirschend überwies. Das war zu wenig. Jetzt soll Eurovita nach dem Willen von IVASS aufgelöst werden. Die fünf größten italienischen Lebensversicherer, unter ihnen Generali und Allianz, sollen die Kunden unter sich aufteilen. Die Banken, die am Vertrieb gut verdient haben, werden verpflichtet, die Liquidität sicherzustellen. Die Verhandlungen über diese Lösung ziehen sich hin und sind notorisch schwierig, schließlich haben die beteiligten Seiten sehr unterschiedliche Interessen. Dass Cinven sich weigerte, die geforderten frischen Mittel von 400 Millionen Euro einzuschießen, muss nicht unbedingt böser Wille sein. Ein Private-Equity-Investor arbeitet immer mit fremdem Geld, seine Fonds werden meistens von großen Anlegern gespeist. Er kann nicht einfach Hunderte von Millionen nehmen und zur Rettung einer Gesellschaft verwenden, deren Zukunft zweifelhaft ist. Für die deutsche Finanzaufsicht stellt sich damit eine wichtige Frage: Ist ein Private-Equity-Investor ein geeigneter Mehrheitsaktionär für einen Lebensversicherer? Cinvens Tochtergesellschaft Viridium, an der Hannover Rück und Generali mit kleineren Anteilen beteiligt sind, wickelt aktuell 3,6 Millionen Verträge ab, die sie von anderen Versicherern übernommen hat. Als Viridium 2019 die Bestände der Generali Leben übernahm, hatte das noch für Schlagzeilen gesorgt. Inzwischen sind solche Deals mit Run-off-Spezialisten, wie die Branche sie nennt, Routine. Jetzt soll der Zurich-Bestand dazukommen. Aber darf die Bafin den Zurich-Deal einfach durchwinken? Was passiert, wenn Viridium irgendwann frisches Geld braucht, der Hauptaktionär aber - wie er in Italien demonstriert - zahlungsunwillig ist? Das würde extrem negativ auf die Aufsicht zurückfallen. Es ist dennoch unwahrscheinlich, dass die Behörde den Deal untersagt. Sie hat oft genug erklärt, dass der externe Run-off ein wichtiges Instrument bei möglichen Marktturbulenzen sein kann. Aber sie könnte Bedingungen stellen, zum Beispiel sehr hohe, mit Barmitteln unterlegte Garantien fordern. Ob das Geschäft dann noch attraktiv ist für Cinven und die Tochter Viridium, wird man sehen."
ffa2cb12-aebd-4574-a011-102232f4f697,2023-07-10 06:00:00+00:00,"Im Interview betrachten wir gemeinsam mit Klaus Hermann, Geschäftsführer von KH Versicherungen aus Münster, den wachsenden Trend nachhaltiger Altersvorsorgeprodukte. Welche Rolle spielen die Risiken und welche der Berater bei der Integration von Nachhaltigkeitspräferenzen in die Kundenberatung? Klaus Hermann gibt uns einen kurzen Einblick. 08:07 Uhr | 10. Juli | 2023 Im Interview mit Klaus Hermann, Geschäftsführer von KH Versicherungen aus Münster, betrachten wir den Trend nachhaltiger Altersvorsorgeprodukte. Welche Rolle spielen Risiken und Berater bei der Integration von Nachhaltigkeitspräferenzen in die Kundenberatung? Klaus Hermann gibt uns einen Einblick. | Quelle: Privat Hermann ist schon seit mehr als 30 Jahren in der Versicherungsbranche tätig – mit verschieden Stationen bei der Allianz und seit 2019 als Geschäftsführer der KH Versicherungen. Auch als Keynotespeaker und Kabarettist ist der Makler bekannt und trat schon im Fernsehen gegen Stefan Raab in dessen Show „Schlag den Raab“ an. Ein besonderes Augenmerk liegt bei ihm auf dem Thema Nachhaltigkeit und soziales Engagement: Im Namen des von ihm gegründeten Vereins tree4tree e.V. reiste er 2022 nach Lateinamerika und im April 2023 nach Malawi und sammelte so Spenden. procontra: Können Sie uns zu Beginn einmal erläutern, wie Sie die Nachhaltigkeitspräferenzabfrage in die Beratung ihrer Kunden integrieren? Klaus Hermann: Das Thema Nachhaltigkeit ist bei uns Bestandteil jeder Altersvorsorgeberatung und auch in den Jahresgesprächen mit den Firmenkunden. Wenn dem Kunden das Thema wichtig ist, zeigen wir die Palette der Möglichkeiten auf und geben Empfehlungen. procontra: Versicherungsprodukte mit nachhaltigen Mehrwerten sind immer mehr im Kommen. Können Sie solch einen Trend auch bei der Altersvorsorge ausmachen? Hermann: Ja, auf jeden Fall. Ich schätze, dass etwa jedem zweiten Kunden in der Altersvorsorge das Thema Nachhaltigkeit wichtig ist und er oder sie sich aktiv dazu beraten lässt. procontra: Wie würden Sie das Interesse ihrer Kunden an nachhaltigen Altersvorsorgeprodukten einschätzen? Hermann: In vielen Fällen geht der erste Impuls von mir aus. Viele meiner Kunden wissen, dass ich persönlich in dem Thema sehr engagiert bin, und hören mir aufmerksam zu. Sie verstehen dann schnell, dass auch die Kapitalanlage grün und nachhaltig sein kann. procontra: Eine grüne Altersvorsorge: Das klingt erst mal abstrakt. Wie genau funktioniert der Nachhaltigkeitsgedanke in Bezug auf die private Altersvorsorge? Hermann: So einfach und doch so schwer. Vom Grundgedanken möchte der Kunde die Kapitalanlage seiner Altersvorsorge bei Unternehmen anlegen, die es mit der Nachhaltigkeit ernst nehmen und Produkte anbieten, die bestmöglich einen Impact in Sachen Klima- und Umweltschutz bewirken. Gleichzeitig soll eine ansehnliche Rendite erzielt werden. Da ist das Feld der Möglichkeiten sehr groß. procontra: Bieten Sie nachhaltige Optionen im Bereich der Altersvorsorge an und wie unterscheiden sich diese von herkömmlichen Produkten? Hermann: Selbstverständlich machen wir das. Der Unterschied liegt in der Adresse der Anlage. Eine fondsgebundene Police, die ausschließlich in Wind-, Solar- und Wasserkraft und mondernste energetische Gebäude investiert ist ein echter Beitrag zum notwendigen ökologischen Transformationsprozess. Eine Fondspolice, die bei Shell investiert, mit der Begründung, das Unternehmen würde schließlich auch in große Windparks investieren ist eine Mogelpackung und inkonsequent – zumindest solange die Unternehmen weitere fossile Ressourcen erschließen. procontra: Können Sie sicherstellen, dass die in nachhaltige Altersvorsorge investierten Gelder tatsächlich auch „nachhaltig“ angelegt werden? Hermann: Wir suchen Versicherer, die eine glaubwürdige und authentische Nachhaltigkeitsstrategie verfolgen. Das fängt mit dem Verhalten der Vorstände an und hört beim ESG- Bericht auf. Danach checken wir die Produkte. Es geht immer besser, aber wir orientieren und stets an den Unternehmen, die es unserer Meinung nach zurzeit am besten umsetzen. Newsletter Jetzt bei unserem Newsletter anmelden Sie wollen nichts verpassen? Dann abonnieren Sie jetzt unseren Newsletter und bleiben stets informiert."
143eec94-af3a-4804-860b-801449b1566b,2023-07-10 10:28:38+00:00,"Honkai: Star Rail erwartet euch ab dem 19. Juli mit dem Update 1.2. Nach einer Pause von fast drei Monaten geht nun endlich die Hauptgeschichte weiter. Die Trailblazer, die sich aktuell in Xianzhou Luofu befinden, werden daran teilhaben, wie das Flaggschiff eine wichtige Entscheidung für die Allianz trifft. Außerdem kehrt Dan Heng nach einer langen Trennung zur Gruppe zurück. Die Hauptakteure der Quest waren Kafka (5-Sterne, Blitz) und Blade (5-Sterne, Wind), die beide im neusten Banner erhältlich sein werden. Blade soll außerdem in der Geschichte zu den Trailblazern stoßen. Somit erfahren Fans endlich mehr über seine Vergangenheit. Zu guter Letzt wartet Luka (4-Sterne, physisch) auf euch, der aus Belobog stammt und dem Pfad der Nichtigkeit folgt. Zudem garantiert das neue Update Yukong (4-Sterne, Imaginär), solltet ihr es schaffen ""Vergessene Halle: Erinnerungen an Xianzhou I"" abzuschließen. Natürlich wird es, wie im letzten Update, auch neue Aktionen geben. Dazu zählen ""Geschichten des Fantastischen"" am Hafen der Sternskiffe, ""Untergrund-Schatzsuche"", die euch mit einem neuen Chat-Design belohnt oder ""Die Reise der Sterne-Navigierer"" in der vergessenen Halle. Zudem können Trailblazer im Laufe der Geschichte die zwei neuen Szenen ""Alchemiekommission"" und ""Schuppenklamm"" erkunden."
86d26d34-b1f6-44e3-8b79-3ccea47ab205,2023-07-10 14:36:00+00:00,"Der württembergische Entsorger Prezero übernimmt die komplette Abfallwirtschaft beim FC Bayern München. Der Bundesligist hat mit diversen Unternehmen der Schwarz-Gruppe, unter anderem auch Prezero, eine Kooperation vereinbart. Seit drei Jahren ist Prezero bereits für die Entsorgung des Abfalls in der Allianz Arena, Spielstätte des FC Bayern, zuständig. Nun übernimmt das Neckarsulmer Unternehmen die gesamte Abfallwirtschaft an den Standorten des FC Bayern. Die Zusammenarbeit ist langfristig ausgerichtet, und in den Bereichen Kreislaufwirtschaft und Digitalisierung wird sie der Beginn eines gemeinsamen Weges werden, sagte der deutsche Fußballrekordmeister letzte Woche. „Wir wollen gemeinsam mit dem Verein sowie seinen Fans und Partnern für mehr Aufmerksamkeit für den Bereich Kreislaufwirtschaft sorgen“, sagte Thomas Kyriakis, Vorstandsvorsitzender von Prezero."
ef5742cf-34a9-44cf-b0b8-1e5681dc930a,2023-07-11 18:57:19+00:00,"Runter vom Bürostuhl, fertig, los: 1478 Läuferteams aus verschiedenen Unternehmen und Betrieben sind am Dienstag zum B2Run angetreten, einer inzwischen traditionsreichen Business-Sport-Veranstaltung. Mit 1700 Läuferinnen und Läufern stellte BMW in diesem Jahr das größte Einzelteam, gefolgt von Siemens und Allianz. Insgesamt sprinteten mehr als 30 000 Menschen durch den Olympiapark - womit die Veranstaltung nach gut 25 000 Teilnehmerinnen und Teilnehmern im vergangenen Jahr nun wieder an ihr Niveau aus Vor-Corona-Zeiten anknüpft. Und das trotz Hitze: Vor dem Start hatten die Organisatoren bei Instagram an die Teilnehmer appelliert, genug zu trinken. Wasser gab es außerdem am Wegesrand, und beim Zieleinlauf ins Olympiastadion alkoholfreies Bier. Manche Business-Menschen wären die Fünf-Kilometer-Strecke durch den Park aber auch einfach gemütlich gewalkt, hieß es vom Veranstalter. Der erste B2Run fand 2004 in München statt. Die Veranstaltung wurde bald zum Selbstläufer. Inzwischen gibt es die Firmen-Meisterschaft in 18 Städten. Der Erlös geht dabei an einen guten Zweck: In diesem Jahr unterstützen die Läufer die Knochenmark-Spender-Organisation DKMS."
ea16ce7a-0e8a-43ce-a9ab-facd9674369a,2023-07-12 11:00:00+00:00,"Die Depot-2030-Aktie befindet sich im Aufwind. Der AKTIONÄR HSR hat mit dem Topmanager Markus Löffler gesprochen. Schwer verständliche Superprodukte für verschwiegene Kunden wie die CIA haben den Mythos rund um Palantir genährt. Palantir hilft der Ukraine oder verhindert Terrorangriffe per Big-Data-Analyse. Auch mehr und mehr zivile Firmen vertrauen auf das Know-how der Techfirma. Seit unserem Treffen mit Palantir-Gründer Peter Thiel 2014 in Berlin verfolgen wir die Entwicklung der geheimnisvollen Firma genau. Thiel prognostzierte bereits damals: „Palantir ist eine grandiose Firma, von der Sie noch viel hören werden."" Der Milliardär sollte recht behalten. Die KI und Palantir sind im Jahr 2023 in aller Munde. Jetzt hat der AKTIONÄR HSR mit dem Senior Director of Enterprise Technology, der die geschäftliche Verantwortung für die DACH-Region trägt, Markus Löffler gesprochen. Der Physiker mit Erfahrung in der Quantenphysik war Senior Partner bei McKinsey und Global CTO bei der Allianz. Ziel: Ethische Nutzung der KI Löffler sagt im Teams-Call: „Wir sind schon jetzt einzigartig.“ Palantir ermögliche es Unternehmen, generative KI wie LLMs sicher, legal, compliant und ethisch einwandfrei anzuwenden. Der Topmanager, der auch in den USA viel mit Kunden spricht, erklärt: „Wir lösen die heikle Frage, welche Daten überhaupt verwendet werden dürfen. Eine der essenziellen Fragen, die wir klären, lautet: „Sind die Daten fürs Training geheim und gehören der Firma?"". Außerdem stellen wir sicher, dass die von Menschen dank KI getroffenen Entscheidungen dokumentiert werden. Wir haben die Stärke in der kontrollierten, ethischen Nutzung von KI.“ Ein aktuelles Beispiel ist eine Lösung für den Konzern Jacobs, der unter anderem in der Wasserwirtschaft tätig ist. Spannend: „Im Falle eines Sturms und einer Überschwemmung zum Beispiel setzt Jacobs LLMs ein, um schnellere, günstigere und wirtschaftlichere Entscheidungen zu treffen.“ Lesen Sie das komplette Interview und was Palantir zum Interesse an der neuen KI-Plattform AIP sagt, in der neuen Ausgabe des AKTIONÄR Hot Stock Report. Palantir ist seit Mai Teil des Depot 2030 und hat seit dem 35 Prozent zugelegt. Nun wurde in das Zukunftsdepot eine weitere Aktie mit KI-Impuls gekauft. Alle exklusiven Informationen und Details lesen Sie frühzeitig im HSR. Einfach hier freischalten. Start Depot 2030"
84475674-9405-4343-85ca-ea3f1d89eef8,2023-07-12 13:26:00+00:00,"Aufatmen bei der Allianz Lebensversicherung. Offenbar hat das Landgericht Stuttgart eine Klage der Verbraucherzentrale Baden-Württemberg (Az: 53 O 214/22) gegen Deutschlands größten Lebensversicherer abgewiesen. Das teilte Niels Nauhauser, Abteilungsleiter Altersvorsorge, Banken und Kredite bei der VZ BaWü, nach dem Verhandlungstermin am Dienstag auf Twitter mit. Die Verbraucherschützer wollen nun prüfen, ob sie gegen das Urteil Berufung einlegen. In dem Verfahren geht es um eine Klausel, die unter bestimmten Umständen die einseitige Kürzung des Rentenfaktors in Riester-Rentenversicherungen durch den Versicherer erlaubt. Die VZ BaWü wollte im Geschäftsgebaren der Allianz einen Verstoß gegen das Äquivalenzprinzip erkannt haben. Beim ersten Verhandlungstermin im April hatten die Richter noch vorsichtige Bedenken geäußert, ob die Klausel in ihrer konkreten Verwendungsform zulässig war. Auftrieb hatte den Klägern zudem ein vergleichbares Verfahren gegen die Zurich Lebensversicherung gegeben, die im Februar vor dem Landgericht Köln eine Niederlage kassiert hatte. Gegen diese Entscheidung geht die Zurich nun in Berufung und will, wenn nötig, bis vor den BGH ziehen. Das Recht, Riester-Rentenfaktoren bei einer starken Erhöhung der Lebenserwartung oder einer nicht nur vorübergehenden Renditesenkung der Kapitalanlagen einseitig zu senken, ist den Lebensversicherern sehr wichtig. Denn in der Branche existieren schätzungsweise mehrere Millionen Verträge mit solchen Klauseln. Sollte die Rechtsprechung hierzu in Richtung der Verbraucher kippen, drohen den Anbietern sehr hohe Nachforderungen."
c9e845af-ae7f-4d3d-8a8e-6603cf7f650c,2023-07-13 17:34:40+00:00,"Eine überraschende, aber absolut positive Nachricht: Die L-Mount-Allianz darf sich über zwei neue Mitglieder freuen. Samyang und Astrodesign ab sofort Teil der L-Mount-Allianz In den vergangenen Jahren gab es immer mal wieder Gerüchte, dass die L-Mount-Allianz im Laufe der Zeit weitere Mitglieder erhalten könnte. Zu den ursprünglichen Gründungsmitgliedern Leica, Panasonic und Sigma sind in der Zwischenzeit auch Leitz und DJI hinzugestoßen, sodass das Bündnis zuletzt fünf Mitglieder umfasste. Nun darf sich die L-Mount-Allianz über die Mitglieder Nummer sechs und sieben freuen: Samyang und Astrodesign. Samyang dürfte den allermeisten Fotografen ein Begriff sein, schließlich hat der Hersteller aus Südkorea im Laufe der Jahre unzählige Objektive mit Anschlüssen für verschiedene Spiegelreflexkameras und spiegellose Systemkameras hergestellt. Ein L-Mount-Objektiv war bisher noch nicht dabei, das dürfte sich nach der heutigen Ankündigung aber in Kürze ändern. Astrodesign hingegen sagt dem ein oder anderen vermutlich nichts, es handelt sich hier um ein im Jahr 1977 gegründetes Unternehmen aus Japan, das sich vor allem auf den professionellen Video- bzw. Broadcasting-Bereich spezialisiert hat. Der bisher spannendste Neuzugang Aus Fotografen-Sicht dürfte Samyang der bisher spannendste Neuzugang der L-Mount-Allianz sein. Gerade im günstigeren Preisbereich konnte sich Samyang über die Jahre einen guten Ruf erarbeiten. Ob ein Samyang Objektiv für Besitzer einer Leica Kamera interessant ist, sei mal dahingestellt, doch für Besitzer einer Panasonic S5 oder S5 II könnten die Gläser unter Umständen interessant sein. Wenn man ganz tief in die Glaskugel schauen möchte, könnte man auch spekulieren, ob mit Samyangs Beitritt nicht auch eine noch günstigere Panasonic Kamera Sinn machen könnte. Canon, Nikon und Sony versuchen die Einsteiger primär mit günstigen APS-C-Kameras ins eigene System zu locken, bei Panasonic fehlt eine solche Option. Entsprechende Gläser wären, vor allem dank Samyang und Sigma, aber grundsätzlich vorhanden. Und Gerüchte zu einer Panasonic Kamera mit APS-C-Sensor gab es vor einigen Jahren auch mal. So oder so sind die beiden Neuzugänge eine positive Nachricht für alle Besitzer einer L-Mount-Kamera. Wie bewertet ihr den Beitritt von Samyang und Astrodesign?"
85b6f868-8b3c-47ef-b836-8a5456ec6f7e,2023-07-14 09:35:00+00:00,"Die PKV befindet sich derzeit in einem Dilemma: Die Vollversichertenzahlen sinken sukzessive, die Schadenkosten legen auch inflationsbedingt und coronabereinigt wieder zu, die Alterung der Bestände setzt sich vor. Immerhin fahren die privaten Krankenversicherer mit Hilfe des Zusatzgeschäfts ordentlich Gewinn ein und auch die Zinswende wirkt sich positiv aus. Auch wenn die Beträge laut Assekurata in Zukunft wahrscheinlich nur moderat nach oben angepasst werden: Ein Grund zur Freude ist das für Kunden natürlich nicht. Und so bewerten die Versicherungsanalysten des Ratinghauses Morgen & Morgen die Beitragsstabilität von einem Viertel der PKV-Tarife aktuell als schlecht. Welchen Effekt die Gemengelage auf die diesjährige Bafin-Beschwerdestatistik hat, wird sich erst im kommenden Jahr zeigen. Für das vergangene Jahr vermeldet die Finanzaufsicht positive Werte. So ist die Anzahl der Verbraucherbeschwerden bei der BaFin 2022 rückläufig gewesen: Waren es im Vorjahr noch 1.088 Beschwerden, lag die Beschwerdeanzahl im vergangenen Jahr nur noch bei 736. Diese verteilten sich in beiden Jahren auf 33 PKV-Versicherer, in 2021 mit knapp 42 Millionen Versicherten im Bestand, im vergangenen Jahr waren es nur noch 36 Millionen Vertragskunden – hier werden sowohl Voll-, Pflege- sowie Zusatzversicherungen berücksichtigt. Daraus ergibt sich eine durchschnittliche Beschwerdequote von 2,04 pro 100.000 Policen. Im Vorjahr lag der Durschnitt noch bei knapp 2,6. Am häufigsten lagen die Kunden im Clinch mit ... Auch 2022 wurden wieder die Fälle von insgesamt 33 PKV-Versicherern überprüft, allerdings mit leichten Veränderungen: Dazugekommen sind Concordia, DEVK, Ottonova und NV, die mit nur einer Beschwerde allerdings zu vernachlässigen ist. Nicht mehr aufgeführt wird dafür die Hansemerkur Speziale, über die Millionen Fielmann-Kunden eine Brillenversicherung abgeschlossen haben. Durch die veränderte Zusammensetzung sind Gesamtbeschwerdezahlen nur schwer mit denen des Vorjahres zu vergleichen. Auch in diesem Jahr wurden für die DFV keine Versichertenzahlen geliefert. Der Anbieter kam 2021 auf 17 und im vergangenen Jahr nur noch auf 3 Beschwerden. Die Branchengrößen mit über zwei Millionen PKV-Versicherten schnitten dabei relativ gut ab. So kam die DKV mit 4,3 Millionen Vertragskunden auf eine Quote von 1,55, die Allianz Private Krankenversicherung mit 2,79 Millionen Kunden auf 1,34 und die Signal Iduna mit einem Bestand von 2,5 Millionen auf eine Quote von 1,16. In dieser Anbietergrößenordnung überschreitet einzig die Debeka, die mit 4,22 Millionen Bestandskunden der zweitgrößte Anbieter ist, mit einer Quote von 2,94 die diesjährige durchschnittliche Beschwerdequote von 2,04 pro 100.000 Policen. Mit ihr lagen in Bezug auf die Gesamtbeschwerdezahl die Kunden auch am häufigsten im Clinch: Mit insgesamt mit 124 Fällen ist die Anzahl am höchsten. Versicherer Versichertenanzahl Bestand Beschwerdefälle Beschwerdequote LANDESKRANKENHILFE 329.419 15 4,55 MÜNCHEN.VEREIN KV 453.955 20 4,41 AXA KRANKEN 1.734.263 73 4,21 INTER KV AG 388.537 25 6,43 Eine verhältnismäßig hohe Quote von mehr als drei Beschwerden auf 100.000 Verträge gab es nur bei vier Unternehmen (siehe Tabelle). Die Inter KV kommt mit 25 Beschwerden bei einem Bestand von 388.537 Versicherten dabei auf die höchste Beschwerdequote von 6,43. Auch im Vorjahr lag der Versicherer mit einer Beschwerdequote von 7,15 pro 100.000 Versicherten, dafür aber mit vergleichsweise geringer Beschwerdeanzahl (28) vorn. Laut Berechnung kommen bei Ottonova mit einer Quote von 11,48 zwar die meisten Beschwerden auf 100.000 Versicherte, aber: Allerdings haben sich nur drei Kunden über den Anbieter mit 26.122 Versicherten beschwert. Angemerkt sei an dieser Stelle, dass die BaFin-Statistik keine Aussage darüber tätigt, ob die Beschwerden berechtigt waren oder nicht. Eine weitere Anlaufstelle für unzufriedene Kunden ist zudem noch der PKV-Ombudsmann."
