e78ddcf6-989d-45b1-8401-2e7e9c4562ee,2023-04-24 03:31:00+00:00,"Startseite Wirtschaft Wer ist schuld an den hohen Lebensmittelpreisen? Lebensmittel haben sich um mehr als 20 Prozent verteuert. Zum großen Teil liegt das an den gestiegenen Rohstoff- und Energiekosten. Doch gibt es auch den Verdacht, dass große Lebensmittelkonzerne Kasse machen. Hamburg - Der Lebensmitteleinkauf im Supermarkt oder beim Discounter ist für viele Menschen zum Ärgernis geworden. Denn Lebensmittel haben sich in den vergangenen zwölf Monaten um mehr als 20 Prozent verteuert. Zum großen Teil liegt das an gestiegenen Rohstoffkosten. Doch immer häufiger wird auch der Verdacht geäußert, dass große Lebensmittelkonzerne die hohe Inflation zu unangemessenen Preisanhebungen nutzen und so die eigene Gewinnmarge steigern. „Mehr als ein Drittel des jüngsten Anstiegs der Lebensmittelpreise“ in Deutschland könne nicht mit den traditionellen Treibern wie den Rohstoffkosten oder der Entwicklung der Energiepreise erklärt werden, berichtete der Inflationsexperte des Kreditversicherers Allianz Trade, Andy Jobst, in einer am Montag veröffentlichte Studie. „Es scheint zunehmend Anzeichen für Gewinnmitnahmen zu geben sowie unzureichenden Wettbewerb in den Bereichen mit besonders starken Preissteigerungen, wie zum Beispiel bei Herstellern von Milchprodukten und Eiern, aber auch bei nicht-saisonalem Gemüse und Obst“, sagte der Branchenkenner. Verbraucherzentralen schlagen Alarm Mit seiner Einschätzung steht Jobst nicht allein. Die deutschen Verbraucherzentralen haben ebenfalls bereits Alarm geschlagen. „Manche Preissteigerungen bei Lebensmitteln sind weder gerechtfertigt noch nachvollziehbar“, urteilten sie kürzlich. Deshalb sei ein kritischer Blick der Politik und des Kartellamtes auf Handel und Lebensmittelhersteller notwendig, um zu prüfen, ob Unternehmen die Lage nutzen, um die eigenen Erträge zu verbessern. Der Handel sieht die Schuld vor allem bei großen Markenherstellern. Die Chefs der beiden führende deutschen Supermarktketten Edeka und Rewe, Markus Mosa und Lionel Souque, warfen in den vergangenen Monaten wiederholt großen internationalen Konsumgüterherstellern vor, Preiserhöhungen zu fordern, die nicht nachvollziehbar seien. Der Chef der Drogeriemarktkette Rossmann, Raoul Roßmann, sagte kürzlich der „Lebensmittel Zeitung“: „Auch Rossmann hat mit einigen Lieferanten, die überzogene Preiserhöhungen verlangen, Ärger.“ „Wir beobachten, dass insbesondere Lebensmittelhersteller hungrig nach Profiten sind. Sie haben die Preise wesentlich stärker erhöht als die Einzelhändler“, sagte der Allianz-Trade-Branchenexperte Aurélien Duthoit. Die Lebensmittelproduzenten hätten in Deutschland 2022 rund 18,8 Prozent gegenüber dem Vorjahr aufgeschlagen, der Lebensmitteleinzelhandel dagegen „nur“ 12,6 Prozent. Vorwürfe von mehreren Seiten zurückgewiesen Die Bundesvereinigung der Deutschen Ernährungsindustrie bezeichnete die Vorwürfe einer „der gesamten Branche unterstellten Bereicherung“ allerdings als „substanzlos“. Schon angesichts der Einkaufsmacht der vier großen deutschen Handelsketten erscheine es schwer vorstellbar, dass Hersteller unverhältnismäßig hohe Profite generieren könnten. Auch die großen Markenhersteller wollen das nicht auf sich sitzen lassen. „Wir weisen dies entschieden zurück“, hieß es bei der Deutschland-Tochter von Weltmarktführer Nestlé. Die Gewinnmarge sei 2022 in Europa spürbar gesunken. Das Unternehmen habe zusätzliche Kosten von mehrere hundert Millionen Euro nur zum Teil weitergereicht. Auch bei Coca-Cola hieß es: „Wir haben unsere Kostensteigerungen nicht vollumfänglich an unsere Kunden im Lebensmittelhandel und im Außer-Haus-Markt weitergegeben.“ Wettbewerber Unilever (Langnese, Pfanni, Dove) betonte, die Unternehmenskennzahlen machten deutlich, dass der Konzern im Jahr 2022 weder global noch in Europa in der Lage gewesen sei, gestiegene Rohstoffpreise und Energiekosten weiterzugeben. Der Konsumgüterriese Mars, der neben Schokoriegeln auch Lebensmittel wie den Nudel-Klassiker Miracoli und ein umfangreiches Tierfutterangebot von Whiskas bis Frolic vertreibt, wies die Vorwürfe ebenfalls zurück. Warnung vor einseitigen Schuldzuschreibungen Der Handelsexperte Martin Fassnacht von der Wirtschaftshochschule WHU in Düsseldorf warnte denn auch vor einseitigen Schuldzuschreibungen. „Ich glaube im Großen und Ganzen nicht, dass der Vorwurf der Preistreiberei gegenüber den Markenherstellern berechtigt ist. Das mag hier und da bei den ganz Großen zutreffen, die mit ihren starken Marken mehr Möglichkeiten haben, Preiserhöhungen durchzusetzen. Aber sonst eher nicht“, sagte er der Deutschen Presse-Agentur. Wenn der Handel lautstark darüber klage, dann geht es ihm nicht zuletzt um die eigene Profilierung gegenüber den Verbrauchern. Tatsächlich geraten die Preise hier und da mittlerweile wieder etwas ins Rutschen. Nachdem in den vergangenen Monaten schon Butter und Kaffee wieder etwas billiger wurden, senkten am Montag große Händler wie Kaufland, Lidl und Norma auch die Preise für zahlreiche Käseartikel vom Gouda bis zum Emmentaler dauerhaft. Grund dafür seien die gesunkenen Rohwarenpreise, hieß es. Hoffnung, dass die Welle der Preiserhöhungen im Lebensmittelhandel nun insgesamt rasch abebbt, wäre aber wohl verfrüht. Die Experten von Allianz-Trade erwarten jedenfalls, dass sich Nahrungsmittel in Deutschland in diesem Jahr noch einmal um mehr als zwölf Prozent verteuern. „Für das nächste Jahr sind die Aussichten bei der Teuerung von Lebensmittel besser“, sagte Jobst. Allerdings bedeute das in vielen Fällen eher eine Stagnation der Preise. „Durchgesetzte Preiserhöhungen werden erfahrungsgemäß nur selten zurückgenommen.“ dpa"
0f8e7b18-c366-469a-a08f-03c5b461e1b1,2023-04-24 08:49:52+00:00,"»Es scheint zunehmend Anzeichen für Gewinnmitnahmen zu geben sowie unzureichenden Wettbewerb in den Bereichen mit besonders starken Preissteigerungen«, sagte der Branchenkenner. Dabei gehe es zum Beispiel um Hersteller von Milchprodukten und Eiern, aber auch um nicht-saisonales Gemüse und Obst. Preissteigerungen noch nicht vollends an Verbraucher weitergegeben Mehr als ein Drittel der Verteuerung in den vergangenen Monaten könne in Deutschland nicht mit den traditionellen Treibern wie den Rohstoffkosten oder der Entwicklung der Energiepreise erklärt werden, sagte Jobst. Europaweit lagen die Lebensmittelpreise seiner Analyse zufolge im ersten Quartal um knapp 15 Prozent über dem Vorjahresniveau, in Deutschland sogar um rund 22 Prozent. Lesen Sie hier mehr dazu: Zockt der Einzelhandel die Verbraucher ab? Warum die niedrigeren Preise nicht bei den Kunden ankommen. »Wir beobachten, dass insbesondere Lebensmittelhersteller hungrig nach Profiten sind. Sie haben die Preise wesentlich stärker erhöht als die Einzelhändler«, sagte der Allianz-Trade-Branchenexperte Aurélien Duthoit. Die Lebensmittelproduzenten hätten in Deutschland 2022 rund 18,8 Prozent gegenüber dem Vorjahr aufgeschlagen, der Lebensmitteleinzelhandel dagegen »nur« 12,6 Prozent. Margen der Händler sinken Viele Einzelhändler hätten offenbar nicht alle gestiegenen Kosten an die Kunden weitergegeben. Das zeige sich auch in schrumpfenden Bruttomargen vieler Händler. Mit einem schnellen Ende der Preissteigerungen bei Lebensmitteln rechnen die Allianz-Trade-Experten daher nicht. Sie erwarten, dass sich Nahrungsmittel in Deutschland in diesem Jahr noch einmal um mehr als zwölf Prozent verteuern."
fb76e9e4-0dda-4384-becf-71ce83fae330,2023-04-24 12:00:00+00:00,"Der kräftige Anstieg der Lebensmittelpreise in den vergangenen Monaten ist nach Einschätzung des Kreditversicherers Allianz-Trade nicht nur auf die gestiegenen Rohstoffkosten und Energiepreise zurückzuführen. Wie die Deutsche Presseagentur (dpa) berichtet, seien nämlich teilweise die Verbraucherpreise noch darüber hinaus gestiegen. „Übermäßige Gewinnmitnahmen“ der Unternehmen hätten spürbar zur Lebensmittelinflation im vergangenen Jahr beigetragen, sagte der Inflationsexperte von Allianz-Trade, Andy Jobst, gegenüber der dpa. „Es scheint zunehmend Anzeichen für Gewinnmitnahmen zu geben sowie unzureichenden Wettbewerb in den Bereichen mit besonders starken Preissteigerungen, wie zum Beispiel bei Herstellern von Milchprodukten und Eiern, aber auch bei nicht-saisonalem Gemüse und Obst“, wird der Branchenkenner zitiert. Mehr als ein Drittel der Verteuerung in den vergangenen Monaten könne in Deutschland nicht mit den traditionellen Treibern wie den Rohstoffkosten oder der Entwicklung der Energiepreise erklärt werden, sagte Jobst. Europaweit lagen die Lebensmittelpreise Allianz Trade zufolge im ersten Quartal um knapp 15 Prozent über dem Vorjahresniveau, in Deutschland sogar um rund 22 Prozent. „Wir beobachten, dass insbesondere Lebensmittelhersteller hungrig nach Profiten sind. Sie haben die Preise wesentlich stärker erhöht als die Einzelhändler“, äußert sich zudem Allianz Trade-Branchenexperte Aurélien Duthoit. Die Lebensmittelproduzenten hätten in Deutschland 2022 rund 18,8 Prozent gegenüber dem Vorjahr aufgeschlagen, der Lebensmitteleinzelhandel dagegen „nur“ 12,6 Prozent. Viele Einzelhändler hätten offenbar nicht alle gestiegenen Kosten an die Kunden weitergegeben. Das zeige sich auch in schrumpfenden Bruttomargen vieler Händler. Mit einem schnellen Ende der Preissteigerungen bei Lebensmitteln rechnen die Allianz-Trade-Experten übrigens nicht. Sie erwarten vielmehr, dass sich Nahrungsmittel in Deutschland in diesem Jahr noch einmal um mehr als zwölf Prozent verteuern. „Für das nächste Jahr sind die Aussichten bei der Teuerung von Lebensmittel besser“, sagte Jobst. Allerdings bedeute das in vielen Fällen eher eine Stagnation der Preise. „Durchgesetzte Preiserhöhungen werden erfahrungsgemäß nur selten zurückgenommen.“"
8f70e361-023f-4ff8-9c81-860af841b573,2023-04-25 13:45:15+00:00,"Der Wasserstoffmarkt wächst zusammen: Sieben Großunternehmen haben angekündigt, ihre jeweiligen Wasserstoffaktivitäten im Norden und Nordwesten zu bündeln und aufeinander abzustimmen. So soll bis 2028 Wilhelmshaven als künftigen Standort für Wasserstoffimport und -produktion mit den industriellen Verbrauchszentren in Nordrhein-Westfalen und Niedersachsen vernetzt werden, heißt es in einem Letter of Intend, den die Unternehmen jetzt bekannt gaben, Vorhaben decken gesamte Werschöpfungskette ab Zu den Beteiligten zählen BP, Uniper, Gasunie, Nowega, NWO, Thyssengas und die Salzgitter AG. Über einen Nord-Süd-Korridor zwischen Wilhelmshaven und der Chemieregion Köln und über einen West-Ost-Korridor zwischen Wilhelmshaven und Salzgitter sollen Produzenten und Verbraucher verbunden werden. Die geplante Infrastruktur soll weiteren Unternehmen offenstehen, betonten die beteiligten Unternehmen. Die Unternehmen bringen mit verschiedenen Wasserstoffvorhaben ein, so dass die gesamte H2-Wertschöpfungskette abgedeckt ist. Wilhelmshaven wird zum Import- und Produktionsschwerpunkt BP und Uniper als industrielle Erzeuger und Verbraucher von Wasserstoff beabsichtigen, jeweils am Standort Wilhelmshaven ein Ammoniak-Importterminal zu errichten. Das angelandete Ammoniak soll dann vor Ort durch ein thermo-chemisches Verfahren („Cracken“) in Wasserstoff und Stickstoff zerlegt werden. Darüber hinaus plant Uniper den Aufbau einer Großelektrolyse in Wilhelmshaven, welche mit Hilfe von Offshore-Windstrom aus der Nordsee grünen Wasserstoff produzieren soll. Neue Leitungen bis 2028 Gasunie und Thyssengas hatten bereits Ende Februar ihre Plänen für einen H2-Nord-Süd-Korridor zwischen Wilhelmshaven und der Chemieregion Köln öffentlich gemacht. Die rund 400 Kilometer lange Transportverbindung soll bis 2028 durch Umstellung bestehender Transportleitungen sowie ergänzenden Neubau entstehen. Durch die Anbindung an das durch Gasunie geplante Wasserstoffnetzwerk Hyperlink im Norden und die von Nowega und Thyssengas verantworteten Teilprojekte der Wasserstoffinitiative GET H2 unterstütze der geplante Nord-Süd-Korridor den Aufbau eines integrierten Wasserstoffnetzes, hieß es in einer Presseinformation. So würden sowohl die BP Raffinerien im Emsland und im Ruhrgebiet als auch viele weitere potenzielle H2-Verbraucher entlang der Trasse erreicht. Darüber hinaus sind Gasunie und Nowega für den Aufbau des notwendigen West-Ost-Korridors zur Anbindung des Partners und Wasserstoffabnehmers Salzgitter verantwortlich. „Regulatorischer Rahmen fehlt“ Die Infrastrukturbetreiber Nowega und NWO bringen ebenfalls Teile ihres bestehenden Leitungsnetzes in die Allianz ein. Die Umstellung der Bestandsleitungen durch Nowega und NWO vermindere den notwendigen Neubaubedarf erheblich und ermöglichet eine großräumige Erreichbarkeit weiterer Ein- und Ausspeiser, hieß es weiter. Noch allerdings gibt es keine endgültige Investitionsentscheidung. Für teiel der Neubau-.Projekte haben die Unertnehmen die Anerkennung als als Project of Mutual Interest (PMI) bzw. Projects of Common Interest (PCI) bei der Europäischen Kommission eingereicht. Erste Entscheidungen über eine Anerkennung erwarten die Unternehmen für in dieses Jahr. Thomas Gößmann, Vorsitzender der Thyssengas-Geschäftsführung, betonte, die Allianz schaffe bis 2028 ein zentrales Element des künftigen Wasserstoffmarktes in Nordwestdeutschland. „Was nach wie vor fehlt ist ein regulatorischer Rahmen, der Planungs- und Investitionssicherheit schafft und den die Politik jetzt zeitnah liefern muss.“ (kw) Zum Weiterlesen: Zehn-Megawatt-Elektrolyseschub für klimaneutrales Stahlwerk Bremen EnBW startet Vermarktung von Grünem Wasserstoff"
7a72b822-ff3e-45c8-976c-3fe320e61a33,2023-04-26 06:31:46+00:00,"In der letzten Fraktionssitzung informierten sich die Mitglieder der FDP-Fraktionsversammlung über den Glasfaserausbau in Hemer. Hierzu hatte die FDP-Fraktion Ralf Stratmann, der als Head of Expansion Region North für Unsere Grüne Glasfaser GmbH & Co. KG, für den Glasfaserausbau in Hemer verantwortlich ist zu Gast. Zu Beginn stellte Stratmann das Unternehmen vor, welches ein Joint Venture der Telefonica und der Allianz darstellt und in den nächsten Jahren rund 5 Milliarden Euro in Deutschland in den Ausbau des Glasfasernetzes investieren möchte. Dadurch sollen bis 2026 mindestens 2,2 Millionen Haushalte an das Glasfasernetz angeschlossenen werden, dazu gehören auch tausende Haushaltungen in Hemer. Im weiteren Verlauf erläuterte Ralf Startmann die technischen Vorteile der Glaserfaser: „Die Netze sind nicht nur stabiler, es können deutlich höhere Übertragungsraten erreicht werden und nebenher wird auch noch 60% Energie eingespart.“ Als wichtigsten Baustein stellte er die sog. POPs vor. Diese Point of Presence sind kleine (etwas kleiner als eine Garage) Verteileinheiten, die jeweils bis zu 4.000 Wohneinheiten versorgen können. In Hemer werden im gesamten Stadtgebiet 4 bis 6 solcher POPs aufgestellt. Und in Bezug auf Hemer stellte Stratmann klar: „Für die Stadt Hemer fallen keinerlei Kosten beim Ausbau an! Wir machen das auf eigene Rechnung.“ Bei der häufig anzutreffenden Problematik der Mehrfacheigentümer von Grundstücken, auf die Ratsmitglied Peter Brand in der Fragestunde hinwies, antwortete Ralf Stratmann eindeutig: „Wenn nicht alle Eigentümer einem Anschluss zustimmen, wird die UGG keinen Anschluss legen, das ist rechtlich eindeutig!“ Zum Ende bedankte sich der Fraktionsvorsitzende Arne Hermann Stopsack, für eine informative Veranstaltung bei Ralf Startmann, der seinerseits noch eine Bitte an die FDP-Mitglieder hatte: „Wenn Sie von Bürgern und Bürgerinnen gefragt werden, was mit den aktuellen Verträgen geschieht, dann sagen Sie den Menschen bitte, dass sie auf keinen Fall schon im Vorfeld ihre aktuellen Verträge kündigen sollen. Außerdem können die Menschen selbstverständlich ihre alten Rufnummern behalten. Dies gilt auch für die sehr alten 3 und 4-stelligen Telefonnummern. Und - mit ganz wenigen sehr speziellen Ausnahmen - können natürlich auch die E-Mail-Adressen behalten werden.“"
48d3c37f-c3b6-4f57-9dcb-0705ca7d4ac9,2023-04-28 06:22:15+00:00,"Die Versicherungsgruppe Baloise hat eine Lücke in der Konzernleitung geschlossen. Dabei soll ein anderer Konzern eine Rolle gespielt haben. Die Basler Baloise-Gruppe hat einen bedeutenden Personalentscheid getroffen. Der Verwaltungsrat habe per Juli den 52-jährigen Clemens Markstein zum neuen Chef der Schweizer Einheit und Konzernleitungsmitglied der Baloise Gruppe ernannt, teilte das Unternehmen in einem Communiqué am Freitag mit. Markstein folgt damit auf Michael Müller, der zum gleichen Zeitpunkt als Chef der Baloise-Gruppe hochgerutscht. Konstanz in Führung Die Wahl von Markstein sendet ein wichtiges Signal. Der Basler Versicherer setzt – wie schon mit Müller – auf Konstanz, weil er erneut eine interne Lösung präferiert. Die wichtigsten Geschäfte der Gruppe soll jemand führen, der auch aus diesem Bereich kommt. Markstein stiess bereits im Jahr 2009 als Leiter Produktmanagement Unternehmenskunden zur Geschäftsleitung des Konzernbereichs Schweiz von Baloise. Allianz-Konzern lässt grüssen Seit Mai 2017 ist er Leiter Operations & IT und arbeitete somit bereits jahrelang mit Müller, der den amtierenden CEO der Gruppe Gert de Winter ablösen wird, zusammen. Nach dem Studium als Wirtschaftsingenieur startete er seine berufliche Laufbahn für kurze Zeit als Berater bei der Boston Consulting Group. Danach arbeitete er aber in unterschiedlichen Rollen beim Versicherungsriesen Allianz in Deutschland und in der Schweiz, bevor er zu Baloise wechselte. Lösung für anderes Problem An dieser Stelle kommt der andere Versicherungskonzern ins Spiel. Wie Recherchen von muula.ch ergaben, soll Markstein auch ein heisser Anwärter auf den CEO-Posten bei der Allianz Suisse gewesen sein. Der deutsche Versicherungskonzern kommt nämlich derzeit aus den Negativschlagzeilen in der Schweiz nicht heraus und daher soll der aktuelle Allianz-Suisse-Chef Ruedi Kubat in der Münchner Konzernzentrale in Ungnade gefallen sein, wie muula.ch über aktuelle Strategiespiele der Assekuranz berichtete. Zürich und München Allianz und der designierte Baloise-Schweiz-Chef Markstein kennen sich aber einander gut. Im Jahr 1999 wechselte er als Vorstandsassistent im Ressort Informatik zur Allianz Versicherung. Solche Assistenzjobs sind in dem deutschen Konzern wichtige Karriereposten. Nach Erfahrungen als Bereichsleiter im Vertrieb sowie in Operations arbeitete er von 2003 bis 2006 unter anderem als Bereichsleiter für die Unfall- und Krankenversicherung für die Allianz in Zürich. Im Jahr 2006 wechselte er dann zurück zur Allianz in München und leitete bis 2009 ein internationales Programm zur Harmonisierung der Finanzorganisation der Tochtergesellschaften. Er wäre also bestens für den Chefposten in der Schweiz geeignet gewesen. Die Baloise schnappten ihn mit der Ernennung nunmehr weg. Fusion geplatzt? Neben der internen Lösung und dem Allianz-Suisse-Szenario hat die Personalie aber noch eine dritte Dimension. Nachdem der Helvetia-Konzern in St. Gallen mit Fabian Rupprecht einen neuen Gruppen-CEO gefunden hat, wie auch muula.ch berichtete, ist der Zug für einen Merger zwischen Baloise und Helvetia, wie er derzeit in den Medien diskutiert wird, abgefahren beziehungsweise unwahrscheinlicher geworden. Beide Versicherer hatten Vakanzen bei wichtigen Posten und dadurch waren erneut Spekulationen aufgekommen, dass ein Zusammenschluss nunmehr möglich sei, da üblicherweise solche Deals regelmässig an den Egos der Personen und der Aufteilung von Pöstchen scheitern. Alle Optionen offen Mit Markstein schlug nach Helvetia nun auch die Baloise einen Pflock ein und will somit allein weiteragieren. Wenn eine Firma allerdings den Leiter IT zum Chef macht, erklärt sie indirekt, entweder keine grossen Würfe zu wollen und einen risikolosen Weg zu gehen. Oder aber man hält sich alle Optionen offen. 28.04.2023/kut."
d340b596-d691-4435-881b-85d0d87037f6,2023-04-28 07:32:48+00:00,"Am Freitag tagte das Parteipräsidium der ÖVP, um sich zu beratschlagen, aber nur sehr kurz. Es gab keinen Entschluss für eine Koalition. Stattdessen bekräftigte Haslauer noch einmal, dass es eine breite Allianz für die Zukunft brauche. ""Es ist mir in den Gesprächen einmal mehr klar geworden, vor welchen Herausforderungen das Land steht."" Das Thema Wohnen, die Teuerung, die Sozialpolitik, die Erneuerung der Infrastruktur - all das gehe nur gemeinsam. Die FPÖ könne sich eine solche Dreierkoalition vorstellen, sagte Haslauer. Nun wolle man nach der Absage am Donnerstag der SPÖ noch einmal die Chance geben, eingehend darüber nachzudenken, auch über die Vorteile einer solchen Koalition. Am Dienstag müsse eine Entscheidung fallen Über das verlängerte Wochenende soll es eine Nachdenkpause geben. Am Dienstag will das ÖVP-Präsidium noch einmal zusammentreten. Dann müsse aber eine Entscheidung fallen. ""Die Hand Richtung SPÖ ist ausgestreckt"", sagte Haslauer am Freitag. Es sei kein taktisches Manöver, sondern seine ernste Absicht. ""Es ist eine Allianz, die Salzburg in die Zukunft führen soll."" Inhaltlich gebe es keine unüberwindbaren Gegensätze zwischen ÖVP, FPÖ und SPÖ. Haslauer will nun noch einmal in Kontakt mit der SPÖ treten. ""Es wäre halt ein anderer Weg."" Man habe gesehen bei der Wahl, wie stark der Protest sei, und dass die Leute sich aber auch nach einer Zusammenarbeit in der Politik sehnen würden, und nicht nach Streit. ""Man muss einmal die Hand reichen. Das ist ja auch nicht so leicht für mich"", sagt Haslauer zu einer Dreiervariante von ÖVP, FPÖ und SPÖ."
