a8701c7c-0920-4c98-a008-c4df4642870b,2023-04-11 12:14:00+00:00,"Es geschah in der Nacht vom 9. auf den 10. Februar. Trotz Sicherheitsmaßnahmen hackten unbekannte Täter die Beratungssoftware und die Cloud-Lösung des Berliner Software-Anbieters Smart Insurtech. Daraufhin musste die Hypoport-Tochter beide Produkte vom Netz nehmen und ihre Kunden sowie die zuständige Datenschutzbehörde informieren. Auch der Dokumentenservice des Hauses war nach Unternehmensangaben „in Teilen betroffen“. Auch dort musste Smart Insurtech einzelne Anwendungen offline nehmen. Wie lange es dauert, bis Kunden die Programme wieder nutzen können, vermag das Unternehmen bislang noch nicht zu sagen. Die Verantwortlichen stellen sich derzeit wohl auf einen längeren Ausfall ein. Entsprechend hoch dürften die Kosten sein – vom Reputationsschaden ganz zu schweigen. Kein Einzelfall: Im Dezember vergangenen Jahres meldete WWK einen Phishing-Angriff. Cyber-Kriminelle hatten Phishing-Mails an zahlreiche Mitarbeiter des Unternehmens verschickt. Zwar sei es den Tätern nicht gelungen, in die Kernsysteme des Unternehmens vorzudringen, erklärte der Versicherer aus München. Allerdings könne man den Diebstahl von Kundendaten aus E-Mail-Postfächern der Mitarbeiter nicht ausschließen, warnte der Versicherer und riet seinen Kunden, bei verdächtigen Mails vorsichtig zu sein. Und im April vergangenen Jahres legte eine Cyber-Attacke Teile der IT-Infrastruktur der Baloise lahm – vor allem die Systeme der Basler Deutschland waren damals betroffen. Bereits ein Jahr zuvor hatten Hacker bei der Haftpflichtkasse zugeschlagen und dabei zahlreiche Daten erbeuten können. Versicherer machen Verluste Insgesamt zählten die Cyber-Versicherer im Geschäftsjahr 2021 knapp 3.700 Schäden durch Hackerangriffe. Dafür leisteten sie rund 137 Millionen Euro. Dazu kamen Schäden aus den Vorjahren, für die zusätzliche Rückstellungen gebildet Jörg Asmussen, Hauptgeschäftsführer des Gesamtverbandes der Deutschen Versicherungswirtschaft (GDV). An Beiträgen verbuchten die Unternehmen rund 178 Millionen Euro. Damit sind die Cyber-Versicherer 2021 erstmals in die Verlustzone gerutscht. „Unter dem Strich betrug die Schaden-Kostenquote fast 124 Prozent, nach 65 Prozent ein Jahr zuvor“, erklärt Asmussen. Jedem eingenommenen Euro in der Sparte standen somit Ausgaben für Schäden und Verwaltung von 1,24 Euro gegenüber. Zugleich wächst das Geschäft mit der Absicherung gegen Hacker-Attacken rapide. Ende 2021 besaßen knapp 243.000 Kunden eine Cyber-Versicherung – ein Viertel mehr als ein Jahr zuvor. Ähnlich stark legten die Vertragszahlen auch im ersten Halbjahr 2022 zu. Hälfte der Anträge abgelehnt „Immer mehr Unternehmen haben das Risiko erkannt und suchen neben der Verbesserung ihrer IT-Security nach wirksamen Instrumenten, um ihre Bilanz zu schützen“, erklärt Thomas Pache, Cyber-Chef bei Aon Deutschland. Mittlerweile übersteige die Nachfrage nach Cyber-Versicherungen das Angebot. Hintergrund seien die Anforderungen der Cyber-Versicherer an das IT-Sicherheitsniveau von Unternehmen. „Sofern diese erfüllt sind, bietet der Cyber-Versicherungsmarkt weiterhin Lösungen“, sagt Pache. Doch viele Firmen erfüllen diese Mindeststandrads nicht, moniert der GDV-Chef. Er fordert insbesondere mittelständische Unternehmen auf, sich stärker gegen Cyber-Attacken zu wappnen. „Die Angriffe werden immer professioneller und häufiger, aber das Niveau der IT-Sicherheit stagniert seit Jahren“, sagt Asmussen. Der Mittelstand habe die Potenziale bei der Prävention bei Weitem noch nicht ausgeschöpft, bei den meisten Unternehmen bestünden noch große Sicherheitslücken. „Ohne ein angemessenes Niveau an Cyber-Resilienz und -Kontrollen wird es für Kunden schwierig sein, eine Cyber-Versicherung abzuschließen“, meint auch Andreas Fürst, Senior Cyber-Experte der Allianz. „Mehr als die Hälfte der von potenziellen Kunden eingereichten Unterlagen erfüllen unsere Checkliste der erforderlichen Kontrollen noch immer nicht vollständig, sodass wir kein Angebot abgeben“, sagt er. Konzerne helfen sich selbst Auch Großkonzerne beklagen sich über mangelndes Angebot. Bei ihnen sind allerdings weniger die Sicherheitsvorschriften, sondern vielmehr die Deckungssummen das Problem. Während früher Versicherer regelrecht um neue Großkunden buhlten, haben mittlerweile viele Konzerne Schwierigkeiten, eine Police mit ausreichender Deckungssumme zu finden. Im April 2022 nahm die Industrie die Sache daher selbst in die Hand. Sieben Konzerne, darunter Airbus, Michelin und BASF, riefen in Brüssel einen eigenen Cyber-Versicherer ins Leben. Das Unternehmen heißt Mutual Insurance and Reinsurance for Information Systems, kurz Miris, und agiert als Versicherungsverein auf Gegenseitigkeit. Das heißt die Mitglieder, deren Anzahl zwischenzeitlich auf zwölf gestiegen ist, teilen sich die Risiken. „Ziel von Miris ist es, den Versicherungsschutz bei Cyber-Risiken, die nicht oder nur unzureichend durch den bestehenden Versicherungsmarkt abgedeckt sind, zu gewährleisten“, heißt es von der BASF. In den ersten zwei Jahren bietet Miris jedem Mitglied eine Deckung von bis zu 25 Millionen Euro. „Abhängig von der versicherungstechnischen Leistung von Miris wird die gewähr te Kapazität im dritten Jahr voraussichtlich auf 30 Millionen Euro steigen“, erklärt die BASF-Sprecherin. Laut Medienberichten sollen bereits 40 weitere Unternehmen ihr Interesse an einer Miris-Mitgliedschaft bekundet haben. Prämien bis 200 Prozent höher Die von DAS INVESTMENT befragten Cyber-Chefs mehrerer Versicherungsgesellschaften sehen die Miris-Gründung als eine sinnvolle Ergänzung zum bestehenden Angebot. Und zudem als Zeichen für das zunehmende Interesse der Gewerbekunden. In den nächsten Jahren werde sich die Cyber-Police zu einer Standardversicherung für Firmen entwickeln, heißt es etwa von der Allianz. Allerdings müssen die Kunden wohl bereit sein, dafür wesentlich mehr Geld als früher in die Hand zu nehmen. Oliver Schulze, Leiter Cyber-Versicherung bei der Gothaer, spricht von einer „deutlichen Verhärtung des Cyber-Marktes“. Diese führe unter anderem dazu, dass die bis dahin teilweise sehr niedrigen Einstiegsprämien in der Cyber-Industrieversicherung „eine Anpassung an die sich real ergebende Risikosituation erfahren haben“, so Schulze. Die Prämienerhöhungen fielen dabei je nach Ausgangslage teilweise sehr unterschiedlich aus. Andere Verantwortliche werden da konkreter. So spricht Aon-Cyber-Chef Pache von Prämien, die „teilweise zwischen 100 und 200 Prozent über den Beiträgen von 2020“ liegen. Die Baloise berichtet über Anpassung im zweistelligen Prozentbereich bei Kunden ab einem Jahresumsatz von 10 Millionen Euro“. Bei kleineren Kunden habe man die Prämien hingegen nicht erhöht. Auch die VHV, Württembergische und die R+V haben nach eigenen Angaben auf flächendeckende Prämienerhöhungen bisher verzichten können. Die Württembergische setzt stattdessen auf individuelle Risikoprüfung sowie auf zielgerichtete Präventionsmaßnahmen zur Eindämmung von Cyber-Kriminalität. Die R+V hat ein neues Produkt eingeführt, das neben den klassischen Cyber-Risiken auch vor den finanziellen Folgen von wirtschaftskriminellen Handlungen wie Betrug oder Diebstahl über das Internet oder durch Mitarbeitende im Unternehmen schützt. „Dadurch sind für Unternehmen mit einem Umsatz bis zu 20 Millionen Euro einige Risiken günstiger und für Unternehmen mit einem Umsatz über 20 Millionen Euro einige Risiken etwas teurer geworden“, sagt Stefan Schmutterer, Cyber-Experte bei der R+V. Und wie geht es weiter? „Im Großkundensegment sind die Prämiensteigerungen nahezu abgeschlossen“, meint Pache. Der Wettbewerb im Bereich der ergänzenden Versicherungen nehme wieder zu. „Durch die steigende Anzahl an Alternativen konnten wir insbesondere im Bereich über 50 Millionen Euro Versicherungssumme bereits erste Prämien reduzieren“, so der Cyber-Verantwortliche bei Aon. Im KMU-Segment verlaufe diese Marktentwicklung zeitlich verzögert. Schadenersatz und Prävention Und was bekommt der Kunde im Gegenzug? Die Leistungen einer Cyber-Versicherung gliedern sich grob in drei Bausteine. Zum einen trägt sie die direkten Kosten für eine Cyber-Attacke. Dazu gehören die Soforthilfe und die Kosten für die Forensik, also für die Ursachenermittlung. Auch Krisenkommunikation und PR-Maßnahmen sowie Systemverbesserungen nach der Cyber-Attacke fallen in diese Kategorie. Der zweite Baustein ist die Abdeckung von Drittschäden. Hier geht es unter anderem um die Befriedigung oder Abwehr von Ansprüchen Dritter, Vertragsstrafen wegen der Verletzung von Geheimhaltungspflichten und Datenschutzbestimmungen und vertragliche Schadenersatzansprüche. Der dritte Baustein einer umfassenden Cyber-Versicherung schließt die konkreten Cyber-Eigenschäden eines Unternehmens durch Cyber-Diebstahl, -Erpressung oder -Betrug ein. Die eigene Betriebsunterbrechung, das Wiederherstellen von Daten, der Ersatz von IT-Hardware gehören dazu. Außerdem bieten viele Versicherer Präventionsmaßnahmen an. Bei der R+V sind das Beratungsgespräche zu Cyber-Risiken und Schulungen für IT-Verantwortliche durch externe Dienstleister. Außerdem lernen R+V-Kunden in Workshops mit externen Partnern, wie sie im Schadenfall möglichst schnell und effizient reagieren können. Die Württembergische stellt ihren Kunden und deren Beschäftigten kostenlos ein Cyber-Portal zur Verfügung, das unter anderem digitale Kurse mit Lernvideos und interaktiven Prüfungen sowie realistische Phishing-Simulationen enthält. Die HDI bietet seit kurzem einen neuen Baustein Cyber-Security an. Schließt ein Unternehmen mit einem Jahresumsatz bis 5 Millionen Euro diesen Baustein ab, verzichtet HDI auf die Risikofragen. Dafür erhält der Kunde eine jährliche Basisüberprüfung des Dienstleisters Perseus Technologies, der nachschaut, ob die gängigen Mindeststandards eingehalten werden. Die Prüfung wird dabei an die aktuelle Bedrohungslage angepasst. „Die Ergebnisse selbst sehen wir nicht und Kunden haben auch keine negativen Auswirkungen auf den Versicherungsschutz zu befürchten“, betont Sören Brokamp, Leiter Produktmanagement Cyber bei HDI. Damit könne man „das Schutzniveau der Kunden erhöhen und beim Risikomanagement helfen“. Cogitanda, Hiscox, Allianz Die Rating-Agentur Assekurata hat den Markt für Cyber-Versicherungen zuletzt im Sommer 2022 untersucht. Dabei nahmen die Forscher die Tarifbedingungen, den Leistungsumfang und die Transparenz der Cyberpolicen unter die Lupe. Jeder Tarif wurde dabei anhand von zehn Hauptprüfpunkten mit über 60 Kriterien analysiert. Vier Tarife schnitten „sehr gut“ ab. Die Bestnote „1,0“ erreichte der auf Cyber-Risiken spezialisierte Versicherer Cogitanda mit seinem Tarif Cyber Pro+. Es folgen die Konkurrenten Hiscox mit Cyber Clear (1,3), Allianz mit Cyber Schutz 3.0 (1,4) und VHV Versicherung mit Cyberprotect 3.0 (1,5). 14 weitere Tarife schnitten „gut“ ab, lediglich zwei Policen bekamen die Note „ausreichend“."
1525f20c-9520-44dd-9ff1-8d41a5e15b8b,2023-04-11 13:17:38+00:00,"Der Aktienkurs stürzte nach dieser Mitteilung um fast 50 Prozent auf nur noch 1,24 Dollar ab. Vor einem Jahr kostete die Aktie noch rund 20 Dollar, 2013 lag der Kurs einmal bei fast 100 Dollar. Tupperware ist seit Jahren auf Schrumpfkurs. 2022 fiel der Umsatz des Unternehmens um 18 Prozent auf 1,3 Milliarden Dollar. Zehn Jahre zuvor war es noch fast doppelt so viel. Inmitten der Lockdowns in der Corona-Pandemie erlebte Tupperware zwar einen zwischenzeitlichen Wachstumsschub, der war aber sehr schnell wieder vorbei. Vorstandschef Miguel Fernandez sagte bei der Vorlage von Geschäftszahlen im März, das Unternehmen habe das vergangene Jahr mit Optimismus begonnen, seine wirtschaftliche Situation zu verbessern, aber dies sei nicht gelungen. Der Haushaltswarenhersteller verfolgt seine Geschichte bis 1946 zurück. Gründer Earl Tupper, ein Chemiker, nahm Deckel von Farbeimern als Inspiration dafür, luftdicht verschließbare Vorratsdosen aus Plastik für den Haushalt zu entwickeln. Das sollte Familien in der Zeit nach dem Zweiten Weltkrieg helfen, ihre Lebensmittel länger frisch zu halten und somit Geld zu sparen. Erste „Tupperware Party“ fand 1948 statt Tupper tat sich anfangs noch schwer, Verbrauchern den Nutzen seiner Produkte zu erklären, und so entstand die Idee, die Behälter direkt zu Hause bei der potentiellen Klientel vorzuführen. Die erste „Tupperware Party“ fand 1948 statt, und diese Verkaufsmethode war so erfolgreich, dass der Hersteller sich bald ausschließlich darauf konzentrierte und seine Dosen aus Geschäften entfernte. Tupperware wurde zum Kult, und andere Unternehmen nahmen sich das Direktvertriebsmodell zum Vorbild. Aber parallel zu den Umsatzrückgängen schrumpft nun auch schon seit einiger Zeit die Zahl der aktiven Tupperware-Berater. 2022 waren es 284.000, vor fünf Jahren gab es noch mehr als doppelt so viele. Direktvertrieb bleibt bis heute der Kern des Geschäfts, allerdings schloss das Unternehmen im vergangenen Herbst eine Allianz mit dem großen US-Händler Target, der seither Tupperware-Waren in seinen Filialen verkauft. Tupperware teilte jetzt mit, Finanzberater angeheuert zu haben, um zusätzliche Finanzquellen zu erschließen. Außerdem werden Kostensenkungen und der Verkauf von Immobilien geprüft. Weiterhin gab das Unternehmen zu, womöglich gegen Kreditbedingungen zu verstoßen, weil es seinen Jahresbericht nicht fristgerecht eingereicht habe. Aus diesem Grund sei es auch von der New York Stock Exchange vor einem Delisting seiner Aktien gewarnt worden."
79b58da3-ec8c-40f1-8bc9-37fc18aa2176,2023-04-13 06:00:13+00:00,"Cyber-Vorfälle, makroökonomische Entwicklungen und Änderungen in der Gesetzgebung sowie Regulierung sind laut dem Allianz Risk Barometer aktuell die Top-Risiken für Finanzdienstleistungsunternehmen. Das Fazit des Reports war laut dem bayerischen Versicherer sehr deutlich: Cybervorfälle sind das größte Risiko für Finanzdienstleister. Martin Zschech, Global Industry Solutions Director für Finanzinstitute bei AGCS, erklärt, dass obwohl Finanzdienstleister in erheblichem Umfang in die Cybersicherheit investieren, die Befragten die Gefährdung immer noch hoch einschätzen. Das Allianz Risk Barometer (mehr hier) zitiert unter anderem Zahlen von securitymagazine.com, laut denen allein der Bankensektor im Jahr 2021 einen Anstieg der Ransomware-Angriffe um mehr als 1.300 Prozent verzeichnet habe (mehr hier). Die Angriffsmethoden entwickeln sich schnell weiter. So können beispielsweise Open-Source-KI-Tools verwendet werden, um hochgradig personalisierte Spear-Phishing-Angriffe auszuführen. Gleichzeitig bedeutet die wachsende Abhängigkeit der Finanzinstitute von Drittanbietern, wie z. B. Cloud-Computing-Diensten, dass Cyberangriffe sich über ein Unternehmen hinaus auf das gesamte Finanzsystem auswirken können.” Martin Zschech, Global Industry Solutions Director für FS bei AGCS Häufig sind laut dem Risk Barometer auch Mitarbeiter, Auftragnehmer oder Kunden unwissentlich in Vorfälle verwickelt. Schulungen und Technologie könnten dazu beitragen, menschliche Fehler zu minimieren. Darüber hinaus müssten Finanzdienstleister die wachsende Regulierung und die Weiterentwicklung des Datenschutzes laufend in ihrem operativen Betrieb umsetzen. Compliance-Anforderungen wachsen Die Einhaltung von Vorschriften sei nach Cyber-Sicherheit und Inflation eine der größten Herausforderungen für Finanzdienstleister, da sich Gesetze und Auflagen im Zusammenhang mit der Digitalisierung und ESG-Themen (Umwelt, Soziales, Unternehmensführung) ständig weiterentwickeln würden. Die Durchsetzung der Vorschriften habe sich zudem intensiviert, und die Unternehmen würden häufiger zur Rechenschaft gezogen. Gleichzeitig würden die zunehmenden Sanktionen, etwa als Reaktion auf den Einmarsch Russlands in der Ukraine, die Unternehmen vor noch nie dagewesene Herausforderungen stellen. Laut Zschech würde der wachsende Fokus auf ESG-Themen Finanzdienstleistern die Möglichkeit bieten, eine Vorreiterrolle im Bereich Nachhaltigkeit zu übernehmen, aber die Erfüllung von Vorschriften und Richtlinien werde auch in Zukunft Rechtsrisiken schaffen. Letztendlich müssten die Institute angesichts der vielfältigen regulatorischen Anforderungen, auch rund um Offenlegungspflichten, ihre Compliance-Aktivitäten laufend verbessern und Daten und Technologien intelligent einsetzen."
2ec3b448-c201-45de-8563-4a055043a6bd,2023-04-13 11:45:00+00:00,"Nix gewesen, noch nicht einmal Spesen: Seit Jahren schaut Bundeskanzler Olaf Scholz als bekennender Sparbuch-Fan bei den Erträgen auf sein Erspartes in die Röhre, während am Aktienmarkt Milliarden an die Anleger ausgeschüttet werden. Und das wird auch 2023 so sein. Wie die Société Générale schreibt, hätte rund ein Viertel der 40 DAX-Konzerne sogar eine höher als erwartete Ausschüttung an die Aktionäre in Aussicht gestellt, etwa die Hälfte der Unternehmen wird ihre Dividende erhöhen. Unter dem Strich, so die Bank, steige die Ausschüttung gegenüber dem Vorjahr um drei Prozent und das, obwohl mit Linde ein besonders ausschüttungsstarker Konzern dem DAX den Rücken gekehrt hat. Eine aktionärsfreundliche Dividendenpolitik ist allerdings kein Alleinstellungsmerkmal des DAX. Berechnungen der DZ Bank Research ergeben, dass die 100 größten Unternehmen hierzulande die Rekordsumme von voraussichtlich 62 Milliarden Euro auszahlen werden, im Jahresvergleich ein erstaunliches Plus von zehn Prozent, wenn man das durch Ukrainekrieg, Lieferkettenprobleme und Inflation abermals schwierige Geschäftsumfeld berücksichtigt. Die Leistung der Konzerne bei der Einbindung ihrer Investoren ist umso beeindruckender, da sie eine hohe Konstanz aufweist (Grafik). Seit Jahren steigen die Ausschüttungen an, allen Krisen zum Trotz und teilweise sehr deutlich. Europas Top-Versicherer, die Allianz, wird Anleger mit einer Dividende von 11,40 Euro verwöhnen, was einer Rendite von 5,2 Prozent entspricht. Seit 2003 hat sich der Ausschüttungsbetrag je Aktie in etwa versiebenfacht. Die Münchener sind allerdings nicht die Einzigen, die den Shareholder-Value-Gedanken vorleben. Für die aktuelle Titelstory hat DER AKTIONÄR elf nationale und internationale Unternehmen gescreent, bei denen neben einer konstanten Aus­­schüttungspolitik die Aussichten für das operative Geschäft ebenfalls überzeugen – damit sich die Anleger schon heute auf das kommende Jahr freuen können."
706f3a5b-57a8-4c92-ad1d-792682c471ce,2023-04-14 13:22:43+00:00,"Die Allianz SE, Deutschlands größte Versicherungsgesellschaft, gefällt sich in ihrer Führungsrolle. Die Geschäfte laufen gut, die Aktionäre erhalten eine Rekordausschüttung, und Konzernchef Oliver Bäte genießt öffentliche Auftritte, sei es beim Weltwirtschaftsgipfel in Davos oder im amerikanischen Fernsehsender CNN. Auch die meisten Mitarbeiter sind zufrieden."
e87f7767-e4e2-4a52-955f-44da470ef7f4,2023-04-14 16:49:51+00:00,"Auf Nachfrage sagte ein Sprecher der Bafin nur: ""Wir können uns nicht zu einzelnen Gesellschaften äußern."" Die Allianz war ebenfalls nicht auskunftsfreudig. ""Hierzu beziehen wir keine Stellung"", teilte eine Sprecherin mit. ""Wir sind jedoch jederzeit bestrebt, alle behördlichen und regulatorischen Anforderungen zu erfüllen."" Das Solvenzkapital der Allianz, das sie für die Übernahme von Risiken aus Versicherungsverträgen und aus Kapitalanlagen vorhält, belief sich Ende 2022 auf 38,8 Milliarden Euro. Sollte der Aufschlag kommen und fünf Prozent betragen, wie von der Bafin bei früherer Gelegenheit angedeutet, müsste der Versicherer das Solvenzkapital um 1,94 Milliarden Euro aufstocken. Das wäre ein empfindlicher Schock für den Konzern und sein Renommee bei Investoren und Kunden. Konzernchef Oliver Bäte versucht seit Jahren, die Allianz als High-Tech-Unternehmen darzustellen, das durch schnelle Digitalisierung technisch auf Augenhöhe mit Internetgiganten wie Amazon kommen will. Erst vor Kurzem musste die Allianz mit einem großen Skandal in den USA fertigwerden, der Geldstrafen und Schadenersatzzahlungen von knapp sechs Milliarden Dollar mit sich brachte. Außerdem darf die Investmenttochter AGI zehn Jahre lang keine Fonds in den USA verkaufen. Mit einem operativen Rekordergebnis und einer höheren Dividende für das Jahr 2022 versuchte der Konzern, den Skandal in den Hintergrund zu drängen. Die Mängel in der IT dürften das Ansehen der Gruppe bei Investoren deutlich schwächen. IT wird nun strenger kontrolliert Im Dezember 2022 hatte die Bafin zum ersten Mal eine neue Gangart bei der Beurteilung der IT angekündigt. Unter den EU-Aufsichtsregeln Solvency II sollen die Eigenmittel von Versicherern ausreichend sein, um die Risiken abzudecken. Die Bafin sieht schlechte Zustände bei der IT als weiteres Risiko und will deshalb vorübergehende Kapitalzuschläge erheben. Das versteht die Aufsicht nicht als Geldstrafe, sondern als Risikopuffer. Im Februar 2023 hatte Frank Grund, Chef der Versicherungsaufsicht bei der Bafin, im Interview mit der SZ das Vorgehen bestätigt: ""Wir legen großen Wert darauf, dass die Sicherheitsmaßnahmen auf der Höhe der Zeit sind."" Die Aufsicht habe einige Prüfungen vorgenommen. ""Das Ergebnis ist recht ernüchternd."" Im Falle Allianz mehren sich in jüngster Zeit die Berichte über akute IT-Probleme. So berichtete das Handelsblatt, die Bafin habe von der Gruppe dringend eine Straffung der IT-Struktur verlangt, die aktuell in vielen verschiedenen Einheiten betrieben wird. Die Allianz hat seit Jahren große IT-Probleme. Ein Grund ist das Festhalten des Konzerns an einer einst bei der österreichischen Tochter programmierten Software, die bei vielen Experten als veraltet gilt. Doch statt die Programme zu ersetzen, versuchte der Konzern, sie anderen Versicherern anzubieten. Das 2018 begonnene Projekt scheiterte: Kaum ein Konkurrent war bereit, seine Daten von einem von der Allianz betriebenem und veralteten System verwalten zu lassen. Im April 2022 wurde das Projekt beendet. Auch der mit hohem Aufwand entwickelte europäische Direktversicherer Allianz Direct kommt in Deutschland nicht in Schwung. Jetzt soll eine Kooperation mit dem einst verpönten Vergleichsportal Check24 das Projekt retten."
