c3dbf39e-cd60-4a1d-b52a-b1509cf40972,2022-06-15 15:03:04+00:00,"Die L-Mount-Allianz wächst und erhält mit DJI, dem führenden Hersteller von Drohnen, das inzwischen fünfte Mitglied. Neues Mitglied in der L-Mount-Allianz Leica konnte in diesem Jahr eigentlich schon zwei neue Partnerschaften bzw. Kooperationen verkünden, so kooperiert das Unternehmen zukünftig beispielsweise mit Xiaomi und zusammen mit Panasonic wurde die neue L² Technology ins Leben gerufen. Jetzt darf man sich in Wetzlar darüber hinaus aber auch über ein neues Mitglied in der L-Mount-Allianz freuen. Die Allianz, zu deren Gründungsmitgliedern Leica zählt, wird ab sofort nämlich durch DJI verstärkt. Das chinesische Unternehmen ist neben Leica, Panasonic, Sigma und Leitz nun das fünfte Mitglied der L-Mount-Allianz. “Wir freuen uns, mit DJI einen neuen und renommierten Partner aus dem Bereich der professionellen Filmproduktion in der L-Mount-Allianz begrüßen zu dürfen“, so Matthias Harsch, CEO der Leica Camera AG. Sein Kollege Stephan Schulz ergänzt: „DJI ist mit seinen innovativen Konzepten eine echte Bereicherung für die Allianz. Dies unterstreicht deutlich die Relevanz des zukunftsweisenden L-Mount-Standards, der nun noch mehr Vorteile für passionierte und professionelle Kreative bietet.“ Zenmuse X9 nun mit L-Mount-Anschluss DJI ist zwar vor allem für die Produktion von Kameradrohnen bekannt (hier wurde erst kürzlich die neue DJI Mini 3 Pro vorgestellt), hat mit dem modularen DJI Ronin 4D System (siehe Beitragsbild oben) und der dazugehörigen Vollformatkamera Zenmuse X9 aber auch spannende Produkte für Video-Profis im Angebot. Interessant ist hier unter anderem, dass das Bajonett auswechselbar ist – und nun durch einen Anschluss für L-Mount-Objektive erweitert wird. Bisher standen Objektivanschlüsse für DL-Mount (DJIs eigenes Bajonett), Sony E-Mount und Leica M-Mount zur Verfügung. Des Weiteren hat DJI angekündigt, dass die Zenmuse X9 ab August auch Videos in Apple ProRes 4444 XQ aufzeichnen kann."
aca82f88-8f0b-4fb3-987e-17effac40d26,2023-04-03 09:03:00+00:00,"Capital Group, eine der größten Investmentgesellschaften der Welt mit einem verwalteten Vermögen von gut 2 Billionen Euro, hat Arne Tölsner mit sofortiger Wirkung zum Leiter der Kundenbeziehungen (Head of Client Group) für Deutschland, Schweiz und Österreich ernannt. Er wird an Grant Leon, Leiter Kundenbeziehungen Europa (Head of European Client Group), berichten und zudem Mitglied der European Management Group werden. In dieser neu geschaffenen Position wird Tölsner unter anderem für den Ausbau und die Vertiefung von Beziehungen zu institutionellen Anlegern und zu intermediären Kunden in der Dach-Region verantwortlich sein. Er wird die lokalen Client Group Teams in Frankfurt, Zürich und Genf leiten und seinen Fokus darauf legen, Anlagelösungen Investoren zugänglich zu machen. Tölsner hat mehr als 30 Jahre Branchenerfahrung. Er kommt von Allianz Global Investors (AGI). Bei dem Asset Manager der Allianz war er zuletzt als Leiter des Vertriebs (Head of Distribution) für Deutschland, die Schweiz und Österreich verantwortlich. Er war insgesamt fast 22 Jahre bei AGI in verschiedenen leitenden Positionen aktiv. Im Laufe seiner Karriere, die 1992 bei der Dresdner Bank in Hamburg begann, sammelte er mehrjährige internationale Erfahrungen in Dubai und Hongkong. Zudem war er von 1999 bis 2001 in verantwortungsvoller Positionen bei ABN Amro. Über die Capital Group Capital Group ist einer der ältesten und größten Investmentmanager der Welt und feierte 2021 sein 90-jähriges Bestehen. Das Unternehmen managt Multi-Asset-, Aktien- und Anleihestrategien für unterschiedliche Investoren. Heute arbeitet das Unternehmen mit Finanzintermediären und -instituten zusammen und managt über 2,1 Billionen US-Dollar in langfristigen Anlagen für Investoren aus aller Welt."
393ac8bf-b496-4d2a-ac90-9a245e8002dd,2023-04-03 18:10:53+00:00,"Dormagen. Mit dem Ziel, außerordentliches unternehmerisches Engagement sichtbar zu machen, schreiben die Stadtmarketing- und Wirtschaftsförderungsgesellschaft (SWD) und die Lokale Allianz gemeinsam in diesem Jahr zum ersten Mal den Preis „Xcellence Made in Dormagen“ aus. „Viele unserer Unternehmen in Dormagen sind herausragend, Hidden Champions ihrer Branche, Vorreiter in Bezug auf Technologien, in besonderer Weise gesellschaftlich engagiert oder vorbildliche Arbeitgeber. Mit dem Xcellence-Preis möchten wir ins Rampenlicht rücken, was die Wirtschaft hier am und für den Standort leistet“, erklärt Wirtschaftsförderin Lidia Wygasch-Bierling (SWD), die den Unternehmerservice betreut. Der Preis „Xcellence Made in Dormagen“ nimmt drei Zukunftsthemen in den Blick: Er wird in den Kategorien Innovation und Digitalisierung, Nachhaltigkeit sowie soziales Engagement verliehen. Maßnahmen, die in dieses Spektrum fallen, können innovative Verfahren und Produkte sein, ebenso Lösungen, die den CO2-Fußabdruck des Unternehmens verringern. Im Bereich soziales Engagement kommt beispielhaft besonderer Einsatz für Inklusion oder Integration von Mitarbeitern infrage. Weitere Beispiele und der Bewerbersteckbrief, den interessierte Unternehmen ausfüllen können, sind im Internet unter www.swd-dormagen.de zu finden. Die Bewerbungsfrist für „Xcellence Made in Dormagen“ endet mit Ablauf des 31. Mai 2023. Ansprechpartnerin auf Seiten der SWD ist Lidia Wygasch-Bierling. Sie ist unter Tel. 02133/257-436 bzw. per Email an lidia.wygasch-bierling@swd-dormagen.de erreichbar und gibt gerne Auskunft. Der Baustein „Xcellence“ ist eine Weiterentwicklung der 2018 ins Leben gerufenen Kampagne „Made in Dormagen“. Sie will Aufmerksamkeit für die Wirtschaft vor Ort schaffen. „Jedes Unternehmen in Dormagen sorgt mit seiner Leistungskraft für einen stabilen Wohn- und Wirtschaftsstandort und ist natürlich auch ein potenzieller Arbeitgeber. Wir verstehen unsere Aufgabe als Wirtschaftsförderung darin, gute Standortbedingungen zu schaffen. Sichtbarkeit für jeden Partner und seine Aktivitäten ist dabei ein wichtiger Aspekt“, betont SWD-Geschäftsführer Michael Bison. Klemens Diekmann, Geschäftsführer der energieversorgung dormagen gmbh (evd) und Sprecher der Lokalen Allianz, erweitert den Blick um die Facette Industrieakzeptanz: „Wenn die Menschen hier am Ort erfahren, was in ihrer Stadt produziert und entwickelt wird und ihre Lebenswirklichkeit betrifft, wächst das Verständnis und die Akzeptanz für alles, was diese wirtschaftliche Tätigkeit mit sich bringt“, so Diekmann."
ab9ee481-eff2-4cca-81f2-cf2779145a57,2023-04-04 01:58:19+00:00,"Befestigungsspezialist Novus Dahle setzt künftig auf das von Metabo initiierte Akku-System CAS. Welche Branchen davon hauptsächlich profitieren. Wenn es um Befestigungstechnik und Bürotechnik geht, kommt Novus Dahle ins Spiel: Seit 1950 hat das deutsche Unternehmen mit Sitz in Lingen an der Ems unter der Marke Novus Tacker für professionelle Anwender im Programm. Akku-System CAS Jetzt hat sich das Unternehmen als 36. Partner der von Metabo initiierten, markenübergreifenden Akku-Allianz CAS angeschlossen. Künftig stattet Novus Dahle seine Akkutacker mit dem CAS-Akkusystem aus. Für Dachdecker, Messebauer und Raumausstatter Novus Dahle bringt auf Basis der CAS-Akkutechnik zwei akkubetriebene Novus-Tacker auf den Markt: den J-550 speziell für Stoffarbeiten wie Polstern, Bühnenbau oder Möbelbau und den J-551 zur Befestigung von Folie bei Isolationsarbeiten, beim Dachbodenausbau oder beim Messebau. Die neue Akkutacker-Range vereint Geschwindigkeit, Präzision, Ergonomie und Langlebigkeit. Mit der Serienschussfunktion können drei Schuss pro Sekunde abgegeben werden. „Unsere neuen Werkzeuge schaffen mit einem 18-Volt-Akkupack mit 2.0 Amperestunden über 3.000 Schuss. Damit sind diese Akkutacker fast allen kabelgebundenen Tackern in der Leistung überlegen und zugleich flexibler und komfortabler,“ erklärt Indenkämpen. Die lange Tacker-Nase und ein Distanzanschlag sorgen für präzises Arbeiten, und durch den Tiefenanschlag können die Klammern unabhängig von der Härte des Untergrunds optimal versenkt werden. Beim J-550 können Feindrahtklammern A und H und beim J-551 Flachdrahtklammern D und G verwendet werden. Die Klammern können 6 bis 14 Millimeter lang sein. Beide Geräte verarbeiten zudem Nägel E mit 16 Millimetern Länge. Durch die ergonomische Griff-Form und den optimalen Schwerpunkt liegen die Akku-Tacker sicher und bequem in der Hand. Die beiden Modelle werden auf der BAU-Messe in München am 17. April 2023 vorgestellt. „Wir wünschen Novus Dahle eine gute Messe und Auftakt der Produkte,“ sagt Jansen. Und die beiden aktuellen Modelle sind erst der Anfang, die Akkutacker-Range soll weiter ausgebaut werden. CAS Novus Dahle Seit 1949 gibt es das inhabergeführte niedersächsische Unternehmen, und seit 1990 hat es Akku-Produkte im Programm. „Wir nehmen einen kompletten Relaunch unserer Marke Novus und unseres Tacker-Sortiments vor – mit dem klaren Fokus auf professionelle Anwender. Vor diesem Hintergrund ist die CAS-Allianz für uns ein idealer Partner, da wir uns hier als Spezialist in einer Gemeinschaft mit anderen Spezialisten wiederfinden,“ sagt Indenkämpen. Die 36 Mitglieder der Allianz haben aktuell mehr als 300 Maschinen in der 18-Volt-Klasse auf dem Markt, welche alle mit den Akkupacks und Ladegeräten des CAS-Akkusystems kompatibel sind und sich entsprechend untereinander kombinieren lassen. Affiliate Fotos: Novus Dahle/emco Group; Metabo"
56424b06-9937-4fb5-b1f6-181e12574e79,2023-04-04 12:27:00+00:00,"Startseite Wirtschaft Nord Stream 1: Allianz und Munich Re erneuern Versicherungsschutz für umstrittene Pipeline Von: Robert Wallenhauer Trotz Ukraine-Krieg und Anschlägen auf Nord Stream 1 erneuern Versicherer den Schutz der umstrittenen Pipeline. Die Unternehmen wetten damit auch auf eine Zukunft mit besseren Beziehungen zu Russland. London/Frankfurt - Die deutschen Versicherer Allianz und Munich Re haben Insidern zufolge die Absicherung der nach einer Explosion stark beschädigten Gasleitung Nord Stream 1 erneuert. Das sagten fünf mit dem Vorgang vertraute Personen aus der Versicherungs- und Energiehandelsbranche der Nachrichtenagentur Reuters. Die Versicherungspolice beziehe sich auf Schäden an der Pipeline sowie Geschäftsunterbrechungen, sagte ein Insider. Das lässt darauf schließen, dass eine Reparatur der Leitung trotz der massiven Schäden nicht völlig ausgeschlossen ist. Nord Stream 1 führt von Russland aus durch die Ostsee nach Deutschland, jährlich konnten 55 Milliarden Kubikmeter Gas durch die Leitungen transportiert werden. Sie war elf Jahre lang für europäische Kunden die wichtigste Pipeline für russisches Gas, bis im September 2022 ihre beiden Röhren bei Explosionen zerstört wurden. Dass die Pipeline nun erneut Versicherungsschutz erhält, steht in Kontrast dazu, dass Deutschland die Abhängigkeit von russischem Erdgas reduzieren will. Nord Stream: Bundesregierung stellt sich nicht gegen die Versicherer Einer der Insider sagte allerdings, dass die Bundesregierung sich nicht gegen die Entscheidung der Versicherer gestellt habe. Die Unternehmen und das Bundeskanzleramt lehnten eine Stellungnahme ab. Ein Sprecher des Wirtschaftsministeriums erklärte, Versicherungsschutz sei nicht Teil der Unterstützung gewesen, welche die Regierung der Pipeline in der Vergangenheit gewährt habe. Russland hält über eine Tochtergesellschaft des staatlichen Energiekonzerns Gazprom eine Mehrheit an Nord Stream 1. Aus dem Westen sind E.On, Wintershall DEA, Engie und Gasunie beteiligt. Die Unternehmen haben ihre Anteile entweder vollständig oder signifikant abgeschrieben. E.On-Finanzchef Marc Spieker sagte zuletzt, die Betreibergesellschaft konzentriere sich im Moment darauf, die Frage zu klären, wie die beiden zerstörten Leitungen versiegelt und entwässert werden könnten. Ob die Leitungen irgendwann repariert würden, sei pure Spekulation, sagte er. Spekulation auf bessere Beziehungen zu Russland Einige der deutschen Anteilseigner machen sich nun dafür stark, die beschädigte Leitung zumindest zu erhalten, sollten sich die Beziehungen zu Russland eines Tages wieder bessern, sagten zwei Insider. Die Bundesregierung würden einen derartigen Schritt akzeptieren, sagte einer der Fachleute. Die Europäische Union hat Sanktionen gegen die russische Ölbranche auf den Weg gebracht; Gaslieferungen sind rechtlich weiterhin erlaubt. Allerdings kommt nur noch vergleichsweise wenig russisches Gas in Deutschland an; die Bundesregierung setzt stattdessen auf verflüssigtes Erdgas aus anderen Quellen. Ein russischer Diplomat hatte erklärt, dass die Regierung in Moskau Schadenersatz für die Schäden an der Pipeline verlangen könnte. Unklar ist, ob das durch Versicherungen abgedeckt ist. Mehrere Versicherer beteiligt Vor der russischen Invasion in der Ukraine waren Insidern zufolge eine Reihe von europäischen Versicherungen an der Absicherung der Pipeline beteiligt, darunter Zurich und einige Teilnehmer des Versicherungsmarktes Lloyd‘s of London. Einer der Insider sagte, eines der Syndikate von diesem Marktplatz stelle weiterhin ebenfalls eine Absicherung für die Pipeline bereit. Details wurden nicht genannt. Lloyd‘s of London lehnte eine Stellungnahme ab, auch Zurich äußerte sich nicht. (Reuters/row)"
ff09400c-92ff-499f-a476-7b49569c6d26,2023-04-06 11:20:29+00:00,"Ende März wurde zum Beispiel ein vorläufiges Insolvenzverfahren für die Schuhgeschäftskette Reno angeordnet. Schon einige Monate davor hatte es die Schuhhändler Görtz und Salamander erwischt. Auch Details zum Insolvenzverfahren der Kaufhauskette Galeria Karstadt Kaufhof erregten zuletzt Aufmerksamkeit. Arbeitnehmer und Gläubiger betroffen Das IWH erfasst die monatlichen Insolvenzen von Kapitalgesellschaften und Personengesellschaften auf Grundlage der Bekanntmachungen der Insolvenzgerichte. Firmeninsolvenzen sind eine wichtige Kennzahl, denn sie bedrohen Arbeitsplätze und Forderungen von Banken oder Lieferanten bei den betroffenen Firmen. Sie sind zu unterscheiden von Verbraucherinsolvenzen, die private Haushalte betreffen. Der starke Anstieg im März ist kein Ausreißer. Ein Rückblick auf das vergangene Jahr zeigt, dass die Firmeninsolvenzen sich von 639 im Januar schrittweise auf 931 im Dezember erhöht haben. „Die Zeiten ungewöhnlich niedriger Insolvenzzahlen sind vorerst vorbei“, sagt Steffen Müller, Leiter der IWH-Abteilung, die sich unter anderem um Insolvenzforschung kümmert. Laut Müller lassen die IWH-Frühindikatoren für die kommenden Monate allerdings keinen weiteren Anstieg der Insolvenzen mehr erwarten. Die internationale Kreditversicherung Allianz Trade rechnet für das Jahr 2023 insgesamt mit einer höheren Zahl von Insolvenzen als im Vorjahr. „Insgesamt erwarten wir in diesem Jahr rund 15 Prozent mehr Pleiten als 2022 und damit eine Normalisierung des Insolvenzgeschehens“, sagte Milo Bogaerts, Chef von Allianz Trade, im März mit Blick auf Deutschland. Die meisten der März-Insolvenzen entfielen gemäß IWH auf das bevölkerungsreiche Bundesland Nordrhein-Westfalen, während der Anstieg der Insolvenzen in Schleswig-Holstein am stärksten war. Die IWH-Wissenschaftler erfassen zudem die Zahl der von den Insolvenzen betroffenen Arbeitnehmer. So waren von den 959 Insolvenzen im März 8022 Arbeitsplätze betroffen. Im Februar war die Zahl der durch Insolvenzen bedrohten Arbeitsplätze mit 11.585 so hoch wie seit Juni 2021 nicht mehr. Nicht alle Beschäftigten eines Unternehmens verlieren durch dessen Insolvenz sofort ihre Arbeit. Oft lassen sich die Arbeitsplätze durch eine Fortführung des Geschäfts retten."
5ed6b9c8-a7e1-4b0e-950a-0f54b45ba118,2023-04-08 05:00:00+00:00,"An der Johann-Julius-Hecker-Schule im Marzahner Norden startet bald das Projekt „Talent Company“. Die Beteiligten unterzeichneten dazu am 30. März eine Kooperationsvereinbarung in der Schule. Ziel ist es, Schülern nach dem Schulabschluss den Einstieg in das Arbeitsleben zu erleichtern. Initiiert wurde das Projekt von der Strahlemann-Stiftung mit Sitz im südhessischen Heppenheim. Ihren Angaben zufolge starten Jugendliche in Deutschland mit der Planung ihres beruflichen Weges deutlich zu spät. Dabei sollte die Berufsorientierung in der Schule schon frühzeitig helfen, eigene Interessen, Stärken und berufliche Wünsche zu erkennen. Damit werde ein nahtloser Anschluss in die Berufswelt ermöglicht, heißt es. Eine „Talent Company“ ist ein Fachraum für Berufsorientierung. Dieser soll bestehende Berufsorientierungsmaßnahmen der Schule bündeln und durch gezielte Vernetzung mit regionalen Ausbildungsbetrieben erweitern. 62 dieser Fachräume wurden von der Stiftung bereits deutschlandweit eingerichtet, zwei davon in Berlin. Zum kommenden Schuljahr 2023/2024 folgt nun auch die Johann-Julius-Hecker-Schule, eine integrierte Sekundarschule. „In der ‚Talent Company‘ wird über Infoveranstaltungen und Workshops der kooperierenden Unternehmen zukünftig die Vielfalt der Berufsbilder in der Region abgebildet“, erklärt Alexander Hübner, Projektverantwortlicher der Strahlemann-Stiftung. Es gehe darum, praxisnahe Einblicke in das Berufsleben zu geben und die Jugendlichen dabei zu unterstützen, ihren Traumberuf zu finden. Der Fachraum werde eine farbenfrohe Einrichtung mit internetfähigen Computern, Präsentationstechnik, Arbeitsbereich sowie Lounge-Ecke. Ein weiteres wichtiges Element Laut Schulleiterin Jana Harwardt spielen die Berufs- und Praxisorientierung in der täglichen Arbeit des gesamten Teams an der Johann-Julius-Hecker-Schule eine sehr wichtige Rolle. Das neue Projekt sei da ein weiteres wichtiges Element und werde die Kooperation zwischen Schule und Wirtschaft stärker unterstützen. Die „Talent Company“ biete ein starkes Netzwerk von Firmen, zeige transparent Ausbildungsinhalte und biete den Jugendlichen Beratung, Chancen und Möglichkeiten für den Berufseinstieg. Um die „Talent Company“ umsetzen zu können, arbeitet die Strahlemann-Stiftung mit mehreren Partnern zusammen. Dazu gehören die N&B-Stiftung, die Dieter-Schwarz-Stiftung, die Unternehmen Norma und Allianz sowie der Verein Schlaufuchs aus Berlin. „Berufsvorbereitung ist wichtig und sinnvoll. Der Kontakt zwischen Unternehmen und zukünftigen Auszubildenden wird früh und ohne große Hindernisse aufgebaut. Die Jugendlichen erhalten einen realistischen Eindruck von den jeweiligen Berufsbildern“, sagt Kubilay Arslan, Verkaufsleitung bei Norma, zu dem Projekt, das auch vom Bezirk unterstützt wird. Die Schirmherrschaft übernimmt Eckhard Baumann, Leiter des Vereins Straßenkinder und des Kinder- und Jugendhauses „Bolle“ in Marzahn."
a0839795-0a6e-4ca5-aea2-517ea9824326,2023-04-11 09:58:06+00:00,"Die jüngste Bankenkrise dürfte sich einer Studie zufolge auf die Anzahl der Firmenpleiten auswirken. Eine zurückhaltende Kreditvergabe könnte 2023 mehr Unternehmen als erwartet in Schwierigkeiten bringen. Der Kreditversicherer Allianz Trade erwartet in Folge der jüngsten Bankenturbulenzen im laufenden Jahr mehr Firmenpleiten. Für Deutschland rechnet die Studie mit einem Anstieg um gut ein Fünftel, also 22 Prozent, zum Vorjahr auf etwa 17.800 Fälle im laufenden Jahr. ""Durch die nun noch restriktivere Kreditvergabe der Banken dürften mehr Unternehmen in Schwierigkeiten geraten als noch zu Jahresbeginn erwartet"", so die Einschätzung der Expertinnen und Experten. Bislang hatte der Kreditversicherer einen Anstieg der Unternehmensinsolvenzen hierzulande um 15 Prozent vorhergesagt. Demnach hinterlassen die Probleme von Banken in den USA und der Schweiz auch Spuren in Deutschland: ""Mit den deutlich steigenden Zinsen laufen eher schwach finanzierte Unternehmen Gefahr, in Schwierigkeiten zu geraten"", erklärte der Vorstandschef von Allianz Trade in Deutschland, Österreich und der Schweiz, Milo Bogaerts. Eine Pleitewelle sei das gleichwohl nicht, auch wenn ein zweistelliger Zuwachs zunächst den Anschein erwecke, so Bogaerts. Gibt es eine Kreditklemme? Hintergrund ist die Annahme, dass Banken aufgrund der Turbulenzen künftig weniger Kredite vergeben könnten, um die Risiken in ihren Bilanzen durch Kreditausfälle zu reduzieren. Eine sogenannte Kreditklemme wiederum könnte sich schwächend auf das Wirtschaftswachstum auswirken, was in der Folge zu weiteren Kreditausfällen führen könnte. Einer aktuellen Studie der Unternehmensberatung EY zufolge wollen viele Banken angesichts des Energiepreisschubs und der schwachen Konjunktur tatsächlich ihre Kreditvergabe drosseln. Zwei von drei deutschen Geldhäusern gehen von einem Rückgang der Kreditvergabe aus, nur 15 Prozent erwarten einen Anstieg, wie eine Umfrage ergab. Der Erhebung zufolge müssen Unternehmen und Privatkunden bei Kreditanträgen außerdem mit höheren Anforderungen rechnen. Laut EY-Umfrage wollten 76 Prozent der befragten Institute voraussichtlich schärfere Anforderungen an Dokumentation und Sicherheiten stellen. Bei 64 Prozent der Geldhäuser würden für Neukunden die Kreditnebenkosten steigen. 43 Prozent der befragten Bankmanagerinnen und Bankmanager rechneten außerdem mit mehr Ablehnungen von Anträgen. 21 Prozent der Institute gingen davon aus, keine neuen Kreditlinien zu gewähren. Aber es gibt auch andere Einschätzungen: Das Münchner Ifo-Institut kam anhand einer eigenen Umfrage jüngst zu dem Schluss, dass Unternehmen in Deutschland wieder leichter an Kredite kommen. Berichteten im Dezember noch 30 Prozent der Unternehmen von Zurückhaltung der Banken bei der Kreditvergabe, waren es im März nur noch 22,7 Prozent. ""Die Turbulenzen bei einigen internationalen Banken haben keine Auswirkung auf die Kreditvergabe in Deutschland"", folgerte der Leiter der Ifo-Umfragen, Klaus Wohlrabe. Firmenpleiten zogen 2022 an Amtlichen Daten zufolge war die Zahl der Firmenpleiten in Deutschland im vergangenen Jahr erstmals seit der weltweiten Finanzkrise 2009 wieder angezogen. Im Jahr 2022 haben die deutschen Amtsgerichte nach endgültigen Ergebnissen 14.590 beantragte Unternehmensinsolvenzen gemeldet, berichtete das Statistische Bundesamt. Das bedeutet einen Anstieg um 4,3 Prozent gegenüber dem Vorjahr. 2021 wurde mit 13.933 Fällen der niedrigste Wert seit Einführung der Insolvenzordnung 1999 registriert. Allerdings sei zu beachten, dass von März 2020 bis Mai 2021 die Insolvenzantragspflicht für überschuldete Unternehmen infolge der Corona-Pandemie ganz oder teilweise ausgesetzt worden war, so die Statistiker. Seit 2009 war die Zahl der Unternehmensinsolvenzen im Jahresvergleich stets zurückgegangen. Inflation und Konsumzurückhaltung ""Hauptursachen für die Firmeninsolvenzen im letzten Jahr waren die hohen Energiekosten, die bestehenden Probleme in den Lieferketten und die hohe Inflation. Hinzu kam die Konsumzurückhaltung bei den Verbrauchern, die aufgrund der hohen Energiepreise und der Inflation weniger Geld zur Verfügung hatten. Die resultierenden Kaufkraftverluste belasteten die Unternehmen ebenfalls"", begründete Frank Schlein, Geschäftsführer der Wirtschaftsauskunftei CRIF die Daten des vergangenen Jahres. Nach Anzahl der betroffenen Beschäftigten war die größte Insolvenz des vergangenen Jahres die Pleite von Galeria Karstadt Kaufhof mit rund 17.000 Arbeitnehmern. Dahinter folgte die Insolvenz der MV Werften mit mehr als 2000 Beschäftigten. Bekannte Namen waren ferner die Modekette Orsay und der Schuhhändler Görtz. ""Anlass zur Vorsicht"" Trotz des prognostizierten Anstiegs werde Deutschland selbst Ende 2023 das Niveau von vor der Pandemie noch nicht erreicht haben, prognostizierte Bogaerts. ""Das dürfte erst nach einer weiteren Zunahme der Insolvenzen um sechs Prozent im Jahr 2024 wieder leicht überschritten werden."" Die weltweiten Insolvenzzahlen werden nach Einschätzung von Allianz Trade im laufenden Jahr von zuletzt vergleichsweise niedrigem Niveau ebenfalls um gut ein Fünftel (21 Prozent) anziehen. Auch hier erwartet der Kreditversicherer, dass erst 2024 das Niveau des Vor-Corona-Jahres 2019 wieder annähernd erreicht sein wird. ""Deutschland steht im europäischen Vergleich weiterhin gut da"", erklärte Bogaerts. ""Allerdings hat sich die Dynamik bei der Zunahme der Pleiten im Zuge der Normalisierung inzwischen an das weltweite Geschehen angeglichen."" Grund zur Panik sei dies nicht, Anlass zur Vorsicht aber schon, meinte Bogaerts."
