92efc47d-8587-48c5-8785-2f33c8b0056e,2023-04-16 17:51:48+00:00,"Zwischen bunten Überseecontainern ruft ein Plakat dazu auf, die »Allianz für das Auerhuhn« zu unterstützen. Ein anderes verspricht: »New Economy is calling!« Artenschutz und Digitalträume: Das passt in der alten Lokhalle im südbadischen Freiburg ebenso gut zusammen wie die teuren Designermöbel zur Wand voller Secondhand-Briefkästen, die von der hier ansässigen Firmenvielfalt künden. Hier ganz im Süden der Republik hat der Co-Working-Anbieter Grünhof eine seine drei Filialen und betreibt gemeinsam mit der städtischen Wirtschaftsförderung ein Innovations- und Gründerzentrum. Die mit bunten Containern gefüllte Lokhalle ist die instagramabelste Grünhof-Location. Der Ort vereint symbolträchtig Stillstand und Aufbruch: In den Achtzigerjahren wurde hier noch der Orientexpress restauriert, dann schlummerte das knapp 120 Jahre alte Industriedenkmal lange vor sich hin. Seit einigen Jahren ist wieder Leben in der Bude: Die 18 Container, umgebaut zu Büroräumen und einer Teeküche, verbunden durch Gänge und Treppen aus Metallgitter, locken Start-ups und Freelancer, Ökovisionäre und Techies. Sie mieten sich hier tageweise oder fest ein, holen sich Kaffee an der Infobar und versuchen in ihren Boxen »outside the box« zu denken. Rund zwölf Quadratmeter Bürofläche bieten die kleinsten Container, in denen zwei Personen arbeiten können. Wer ein festes Büro will, muss Grünhof-Mitglied werden und zahlt 279 Euro pro Person im Monat. Die Co-Working-Branche stecke in der Krise, sagen die einen; ihr gehöre die Zukunft, behaupten die anderen. Und wer genauer hinschaut, merkt: Beides stimmt. »Der früher als Chance gehypte Drittort« spielte nach dem Ende der Pandemie »so gut wie keine Rolle mehr«, bilanzierte das Wirtschaftsmagazin »Capital«: Die meisten Firmen hätte ihre Mitarbeitenden nach dem Ende der Coronapandemie entweder zurück in die Zentralen geholt oder im Homeoffice gelassen. Das Geschäftsmodell Co-Working sei riskanter als zunächst angenommen, gerade kleinere Anbieter müssten um ihre Existenz fürchten. Das Start-up Independesk, bekannt aus der Fernsehshow »Die Höhle der Löwen«, meldete gar Insolvenz an. Die gemeinwohlorientierte Genossenschaft CoWorkLand, die Menschen bei der Gründung von Co-Working-Spaces unterstützt und sich als Netzwerk und Buchungsplattform versteht, hat ihre Mitgliederzahl zwischen 2020 und 2022 von 30 Genossen auf mehr als 250 gesteigert. »In unserem Netzwerk können wir beobachten, dass die meisten Gründer nach eineinhalb Jahren gut über die Runden kommen«, sagt CoWorkLand-Mitgründer Ulrich Bähr. »Aber es gibt kein allgemeingültiges Erfolgsrezept. Was an welchem Ort funktioniert, muss man erst herausfinden, das Konzept muss sich entwickeln.« Martina Knittel, 40, eine der Grünhof-Gründerinnen, kann das bestätigen. »Uns geht es gut«, sagt sie. »Es ist wichtig, dass die Community selbst zu den Angeboten beiträgt. Sonst kommt man in ein reines Dienstleisterverhältnis, und das zerstört die Magie des Orts. Es ist ein schwieriger Spagat. Klar sind wir auch Dienstleister, aber wir sind eben auch eine Gemeinschaft. Unser Kern sind nicht die Schreibtische – unser Kern ist der Kontakt, ist das Gespräch.« Vor mehr als zehn Jahren hatte sie ein neues Projekt gesucht, nachdem sie ein soziales Start-up mit aufgebaut hatte, das Bibliotheken in der Mongolei, Kambodscha und Sri Lanka bei der Gründung und der Eigenfinanzierung half. Mit ihrem heutigen Mitgeschäftsführer und Partner Hagen Krohn kam sie auf die Idee mit dem Grünhof. »In Freiburg gab es einfach noch nichts, wo sich Menschen wie wir treffen konnten. Zwar gab es schon vor zehn Jahren die ersten Co-Working-Spaces und Arbeitsnetzwerke – aber dort haben uns die gemeinsamen Werte gefehlt.« Eine kleine ehemalige Gaststätte, der Grünhof, wurde 2013 die Keimzelle des Unternehmens. »Wir haben selbst renoviert und Schreibtische reingestellt. Angefangen haben wir mit kleineren Start-up-Programmen. Es ging um einen Ort des Machens: Leute zusammenzubringen, die etwas tun, das die Welt nicht schlechter und im Idealfall sogar besser macht.« Am Anfang sei das Geschäftsmodell »ultraprekär« gewesen. »Co-Working war vor zehn Jahren noch relativ neu, und wir haben jeden, der reinkam, ausführlich beraten, ohne Geld dafür zu nehmen. Es war dann natürlich sehr schwierig, davon zu leben.« Vor allem Start-ups, die Nachhaltigkeit als Ziel haben, halfen sie beim Start. Diese Doppelorientierung sei schwer gewesen, sagt Knittel. »Anfangs waren wir für die Ökos die bösen Kapitalisten und für die harten Wirtschaftsleute die weichen Ökos, die sie als Akteure nicht recht ernst genommen haben. Mittlerweile ist das nicht mehr so. Aber wir haben eine Weile gebraucht, um dazu zu stehen, dass wir selbst Geld verdienen wollen und auch anderen dabei helfen, Geld zu verdienen – und trotzdem für unsere Werte kämpfen und einstehen.« Heute besteht der Grünhof aus zwei Teilen: einer GmbH mit Gewinnabsichten und einem gemeinnützigen Verein fürs Soziale. Die Tagestickets sind wichtig für das Konzept, weil so immer wieder neue Leute und Impulse kommen. Allerdings ist die Vernetzung, mit der so viele Co-Working-Spaces werben, alles andere als ein Selbstläufer. Das weiß auch Knittel: »Die Menschen vernetzen sich nicht von allein. Du kannst nicht einfach Menschen in einen Ort schmeißen und dann entsteht da was. Wir haben, sobald wir uns das leisten konnten, einen Communitymanager eingestellt. Eine Person, die sich nur drum kümmert, dass die Menschen einander kennenlernen, dass Neues entsteht.« Das kann über niederschwellige Formate passieren, Frühstücke oder Feste, bis zu mehrmonatigen Entwicklungsprogrammen. Einmal im Monat gibt es eine große Versammlung, außerdem Workshops und Diskussionen. Knittel beschreibt die steile Lernkurve, die die Gründer nahmen, bis das Konzept trug. »Am Anfang haben wir erst mal alle reingelassen. Dann haben wir angefangen, Auswahlgespräche zu führen und uns auch von einigen Leuten getrennt. Uns ist grundsätzlich jeder willkommen. Ein Ort, der noch kein Gesicht hat, zieht viele Suchende an. Und es fällt uns sehr schwer, jemandem zu sagen: Du passt hier nicht rein. Wir haben da zum Teil sehr gehadert. Mittlerweile reguliert sich das selbst, weil auch wir klarer geworden sind. Wir haben einen detaillierten Fragebogen und ein eigenes Intranet. Wer will, kann sich dort vorstellen.« Vor einer der Konstanten gemeinschaftlichen Arbeitslebens ist aber auch ein »communitybasierter Co-Working-Space« nicht gefeit: Je mehr Menschen zusammenkommen, desto weniger Verantwortung spürt die einzelne Person. Davon kündet ein Zettel in der Teeküche der Lokhalle: »Die Küche ist Chaos?«, fragt er. Die Lösung: Man soll ein Foto vom Chaos machen, selbst aufräumen und danach den »glänzenden Zustand« ablichten. Mit den Vorher/Nachher-Bildern bekommt man dann an der Infobar einen Gratiskaffee. Eine hübsche Idee, die aber leider selten funktioniert. Demnächst wollen die Grünhof-Macher eine zweite Spülmaschine einbauen lassen – damit wenigstens niemand Tassen einfach abstellt, nur weil der Spüler gerade läuft. Der Fachkräftemangel ist einer der wesentlichen Treiber für den Co-Working-Markt. »Wir haben mittlerweile auch mehr Firmenkunden. Etliche Schweizer Unternehmen brauchen Fachkräfte – und die Macht der Mitarbeitenden ist größer geworden, sich den Arbeitsort auszusuchen. Wir haben also etliche, die von hier aus für Schweizer Firmen arbeiten. Oder für Firmen, die irgendwo im Schwarzwald sitzen. Diese Leute haben gemerkt, dass ihnen so ganz allein im Homeoffice auch etwas fehlt, dass sie sich mehr Struktur wünschen.« »Schönes Zusammenspiel von Anonymität und ständig neuen Begegnungen« Knittel glaubt, dass der Arbeitsort »so ein bisschen das alte Dorf ersetzt: Das hat viel mit Identität zu tun und mit Heimatgefühl. Jemand, der hierhin kommt, weiß, dass hier bestimmte Menschen sind, dass bestimmte Werte gelten. Das kann man auch kritisch betrachten, weil es natürlich auch eine Blase ist, die sehr stark auf sich selbst bezogen sein kann. Aber gerade für viele, die viel reisen, ist der Grünhof ein Anker.« Marius Kanzinger, 31 Jahre alt, könnte als Prototyp des neuen hypermobilen Arbeitnehmers durchgehen. Der selbstständige Unternehmensberater arbeitet außerdem an einem Corporate Start-up mit. »Da geht es um berufliche Auszeiten wie Workation und Sabbatical – und das macht super viel Spaß, auch weil da so viel Tempo drin ist.« Er glaubt: »Die Flexibilisierung der Arbeitswelt ist nicht mehr aufzuhalten. Ich merke es gerade selbst, weil ich dabei bin, für unser Corporate Start-up ein neues Team zusammenzustellen. Menschen wollen selbst aussuchen können, wo sie arbeiten – das kann auch bedeuten, dass sie dann trotzdem feste Zeiten und einen festen Ort wählen.« Kanzinger hat viele Arbeitsorte. »Mal von zu Hause aus, in den Büros meines Arbeitgebers, aber auch sehr gern im Co-Working-Space oder in einem Café. Ich bin gern unterwegs, verbinde Reisen auch ins Ausland mit Arbeit, besuche Freunde und suche mir dann vor Ort oft einen Co-Working-Space zum Arbeiten.« Beim Grünhof hat er ein Viertel-Abo, sodass er 25 Prozent seiner Arbeitszeit dort verbringen kann. »Ich kenne das Konzept schon seit der Gründung. In Freiburg weiß man: Wenn man sich beruflich in Richtung Start-ups orientieren möchte, kann man sich an die Leute vom Grünhof wenden. Die wissen, welche Unternehmen gerade am Entstehen sind. Und wenn ich den Kopf freibekommen möchte, fahre ich auf den Lorettoberg – da gibt es eine tolle große Wiese, ich schalte meinen Hotspot zum Arbeiten ein und genieße den schönen Blick über die Stadt. Und ein guter Freund von mir hat ein abgelegenes Häuschen im Schwarzwald mit Glasfaseranschluss und ich kann auch gut von dort aus arbeiten.« Er sieht die Arbeit im Co-Working-Space als »schönes Zusammenspiel von Anonymität und ständig neuen Begegnungen«. Es sei inspirierend, nicht nur im eigenen Unternehmen zu arbeiten, sondern zwischendurch neuen Input aus anderen Firmen zu bekommen. Womöglich gibt es für ihn bald noch eine Möglichkeit, urbane Vernetzung und die Sehnsucht nach Natur zu verbinden. Die Grünhof-Macher denken in Richtung Land. »Wir sind noch in der Diskussion, aber im Grunde wäre der nächste logische Schritt aus der Stadt raus«, erzählt Martina Knittel, »in den Schwarzwald etwa, sodass man mit dem Team auf eine Hütte fahren kann.«"
a09131da-90c6-47ee-b0c1-cefc3a2e7377,2023-04-17 17:18:24+00:00,"Eine Zugfabrik, die «bis zu eintausend Arbeitsplätze schaffen» könnte. Diese Zahl machte im März 2023 im portugiesischen Parlament die Runde, anlässlich einer Anhörung von Infrastrukturminister João Galamba, der Pläne der Regierung zur Entwicklung der nationalen Bahnindustrie und des Schienenverkehrs vorstellte. Den Bau einer solchen Fabrik hat der Schienenfahrzeughersteller Stadler im Sinn. Anfang April 2023 hat das Unternehmen von Verwaltungsratspräsident Peter Spuhler eine strategische Vereinbarung mit dem portugiesischen Industriekonzern Salvador Caetano unterzeichnet, wie Stadler-Sprecherin Gerda Königstorfer Informationen von CH Media bestätigt. Beabsichtigt ist, dass die beiden Firmen in Ovar südlich der Hafenstadt Porto ein gemeinsames Werk zum Bau von Rollmaterial errichten. Als dessen vorläufiges «Hauptziel» genannt wird die Endmontage von 117 Triebzügen, welche die Staatsbahn Comboios de Portugal (CP) beschaffen will. Wert des Auftrags: 819 Millionen Euro. Ohne Werk kaum Aussicht auf Grossauftrag Dazu muss man wissen: Die CP hat diese Ausschreibung im Jahr 2021 gestartet. Bis zum Ende der Angebotsfrist Mitte Februar 2022 hat CP sechs Bewerbungen erhalten: von der spanischen Stadler-Tochter Stadler Rail Valencia, der italienischen Tochter der japanischen Hitachi Rail, der spanischen CAF, der chinesischen CRRC, einem Konsortium aus der deutschen Siemens und der spanischen Talgo sowie einem Konsortium aus der französischen Alstom und der portugiesischen Engineering- und Baufirma Domingos da Silva Teixeira (DST). Vergeben ist der Auftrag noch nicht. Aber laut der Ausschreibung ist klar: Neben Bewertungskriterien wie Preis, Leistung, Erfüllung technischer Anforderungen und so weiter können Bieter mehr Punkte sammeln, wenn sie die portugiesische Wirtschaft einbinden und ein Produktionswerk in Portugal bauen. Zudem hat Minister Galamba ziemlich deutlich gemacht, dass Bewerbungen ohne nationale Fertigung praktisch aussichtslos seien. In diesem Lichte sind denn auch die Pläne Stadlers zum Bau einer Zugfabrik in Ovar zu sehen sowie die Absicht, auch portugiesische Zulieferer zu berücksichtigen. Auch das Zusammenspannen mit Salvador Caetano soll die Chancen auf einen Zuschlag für den CP-Grossauftrag erhöhen. In einer Mitteilung, die lediglich auf Portugiesisch vorliegt, lässt sich Peter Spuhler wie folgt zitieren: «Ich bin überzeugt, dass die Allianz mit einem der wichtigsten Unternehmen in Portugal unser Angebot für die Lieferung neuer Züge an CP wesentlich verbessert. Salvador Caetano ist ohne Zweifel der bestmögliche Verbündete, um unser Ziel zu erreichen.» «Ein optimaler Rahmen» Gerda Königstorfer sekundiert, «wir glauben, dass eine Partnerschaft mit einem portugiesischen Unternehmen die beste Option ist». Und: «Die Vergabe des Auftrags von CP würde einen optimalen Rahmen schaffen, um für ein mögliches Werk die nötige Grundauslastung zu gewährleisten.» Königstorfer macht klar: Gemeinsam errichtet wird in Portugal eine Fabrik für die Endmontage von Schienenfahrzeugen «im Falle des Zuschlags lokaler Ausschreibungen». Also entweder der CP-Grossauftrag oder beim Gewinn möglicher künftiger portugiesischer Aufträge. In Abhängigkeit unter anderem davon, wann ein portugiesisches Werk bereit wäre, sei es auch «denkbar», dass dort zumindest ein Teil jener 22 Triebzüge, die CP im Oktober 2020 für 158 Millionen Euro bei Stadler bestellt hatte, gefertigt werde. Mit diesem Auftrag war Stadler damals der Einstieg in den Markt Portugal gelungen. Seither folgten Bestellungen von 14 Zügen für die Metro Lissabon im Wert von 114,5 Millionen Euro und von 16 Lokomotiven für Medway, die grösste private Güterbahngesellschaft auf der iberischen Halbinsel, für 93 Millionen Euro. Das geplante portugiesische Werk würde in Stadlers Division Spanien integriert. Diese betreibt seit Anfang 2016 einen Standort in Valencia, der hoch ausgelastet und auf Lokomotiven sowie Stadtbahnen der Typen Tramlink und Citylink spezialisiert ist. Kommt hinzu, dass Stadler und Salvador Caetano auch beabsichtigen, in Guifões, einem Vorort Portos, ein Werk für Service und Unterhalt zu errichten. Dieses könnte wohl auch die Instandhaltung der bereits bestellten 22 CP-Züge erledigen. Der grösste Bushersteller und mehr Vorerst bleibt abzuwarten, wen die CP mit der Fertigung der 117 Züge beauftragt. Informationen aus Portugal zufolge haben Stadler, CAF und das Konsortium aus Alstom und DST die besten Chancen, und von Alstom/DST heisst es, die beiden Firmen planten ebenfalls den Bau einer Fabrik im Land. Salvador Caetano, gegründet 1946, ist unter anderem der grösste Bushersteller Portugals. Der Konzern beschäftigt in 41 Ländern 7300 Mitarbeitende und setzt im Jahr 2,9 Milliarden Euro um. Er ist zudem in der Autoproduktion, im Autoimport, im Luftfahrtsektor und so weiter aktiv und betreibt in Ovar bereits eine Fabrik zum Bau von Toyota-Fahrzeugen. Mit Stadlers Hilfe wolle Salvador Caetano nun auch in die Schienenfahrzeugindustrie einsteigen. Und was sagt Stadler über die «bis zu eintausend Arbeitsplätze», die in Portugal geschaffen werden könnten? Gerda Königstorfer: «Mit diesem Projekt wird Stadler zur Schaffung von qualifizierten Arbeitsplätzen in dieser Region wesentlich beitragen.»"
248b441a-4661-4948-bfe2-9a41b3e22c12,2023-04-19 07:19:14+00:00,"Der Allianz-Konzern will einem Bericht zufolge bei der zuletzt mit vielen Problemen kämpfenden Neobank N26 aussteigen. Der Versicherer suche Käufer für seinen Anteil in Höhe von rund fünf Prozent und peile dabei einen Erlös von mehr als 150 Millionen US-Dollar (137 Mio. Euro) an, berichtete die „Financial Times“ (FT) unter Berufung auf mit der Angelegenheit vertraute Personen. N26 würde bei dem angepeilten Ausstieg der Allianz, die seit 2018 an der Bank beteiligt ist, nur noch mit rund drei Milliarden US-Dollar bewertet werden. Das wären rund zwei Drittel weniger als noch bei der letzten Finanzierungsrunde im Oktober 2021, bei der N26 rund 900 Millionen Dollar eingesammelt hatte und noch mit rund neun Milliarden Dollar bewertet worden war. Der Münchener Konzern ist über seine Beteiligungsgesellschaft Allianz X an N26 beteiligt. 2018 hatte die Allianz als einer der wichtigsten Investoren in einer Finanzierungsrunde über insgesamt 160 Millionen Dollar teilgenommen. In dem Zuge war der Wert von N26 auf weniger als eine Milliarde Dollar taxiert worden. Wie viel die Allianz genau an dem Berliner Fintech-Unternehmen hält, ist nicht bekannt. Nach Recherchen der „FT“ sind es aktuell etwas mehr als fünf Prozent. Damit sei Allianz X einer der größten Investoren der Bank, die zuletzt unter anderem Probleme mit der Aufsicht hatte und deshalb nicht mehr so viele Kunden aufnehmen durfte. Allianz schon länger unzufrieden mit Allianz X Die Allianz selbst wollte sich zu den Informationen gegenüber der gewöhnlich gut informierten britischen Zeitung nicht äußern, wie es in dem Bericht weiter hieß. N26 habe mitgeteilt, dass sie derzeit keine Kenntnis über einen Verkaufsprozess habe und sich nicht zu Spekulationen über die Bewertungsfragen seitens der Investoren äußere. Trotz der inzwischen wieder deutlich gesunkenen Bewertung würde die Allianz nach „FT“-Berechnungen beim Gelingen der geplanten Platzierung noch mit einem deutlichen Buchgewinn aus der N26-Beteiligung aussteigen können. Für N26 wäre der Ausstieg aber ein Nackenschlag bei der Suche nach neuen Investoren. Die Allianz ist schon länger unzufrieden mit der bekanntesten Beteiligung ihrer Risikokapitaltochter Allianz X. Vor etwas mehr als einem Jahr hatte Allianz-X-Chef Nazim Cetin in einem Interview mit dem „Handelsblatt“ Kritik an N26 geübt. „Die Wachstumsschmerzen sind nicht gut“, sagte er damals. Allerdings fügte er in dem Gespräch auch hinzu, er sei überzeugt, dass das Management Lösungen für die Probleme finden werde. In der sonst eher verschwiegenen Branche der Beteiligungsunternehmen ist öffentliche Kritik eher ungewöhnlich."
8148889d-060a-4a17-81d5-30f3a01e0940,2023-04-19 10:31:41+00:00,"Bei den Firmenpleiten in Deutschland zeichnet sich wegen der wirtschaftlichen Flaute und steigender Zinskosten ein Anstieg ab. Die Zahl der beantragten Regelinsolvenzverfahren lag im Februar um 13,2 Prozent über dem Vormonatsniveau, wie das Statistische Bundesamt am Mittwoch mitteilte. Im Februar habe es bereits eine Zunahme um 10,8 Prozent gegeben. Diese Statistik bildet nur Geschäftsaufgaben ab, die im Zuge eines Insolvenzverfahrens ablaufen – nicht jedoch solche aus anderen Gründen beziehungsweise vor Eintritt akuter Zahlungsschwierigkeiten. In den vergangenen Monaten hatten insbesondere viele Schuhhändler wie Görtz , Reno, die HR-Handelsgruppe, aber auch die große Kaufhauskette Galeria Karstadt Kaufhof sowie Modehändler Peek & Cloppenburg Insolvenzanträge gestellt. Der Verband der Insolvenzverwalter (VID) sieht ungeachtet der steigenden Zahlen keinen Grund zur Panik. ""Der zuletzt deutliche Anstieg der Unternehmensinsolvenzen deutet im langjährigen Vergleich nur auf eine Normalisierung des Insolvenzgeschehens hin"", sagte der VID-Vorsitzende Christoph Niering (60). ""Dieses liegt aber schon lange auf niedrigem Niveau: Bereits vor der Corona-Pandemie ist die Zahl der Unternehmensinsolvenzen über ein Jahrzehnt kontinuierlich gesunken."" Staatliche Hilfen wendeten Insolvenzen ab Trotz Corona- und Energiekrise lag die Zahl der Firmenpleiten 2020, 2021 und 2022 auf historisch niedrigem Niveau. Grund dafür waren umfangreiche staatliche Hilfen wie die teilweise Aussetzung der Insolvenzantragspflichten, die Ausweitung des Kurzarbeitergelds, finanzielle Hilfen sowie der Vollstreckungsstopp der Finanzbehörden und Krankenkassen. Nun zeichnet sich eine Trendwende ab. Höhere Produktionskosten, wachsende Personalausgaben, deutlicher Zinsanstieg: Wegen schwieriger Rahmenbedingungen sagen Experten mehr Firmenpleiten in Deutschland voraus. Der Kreditversicherer Allianz Trade erwartet in diesem Jahr eine Zunahme um 15 Prozent. Insolvenzen um ein Fünftel gestiegen zum Vorjahr Die tatsächlich bei den Amtsgerichten beantragte Zahl der Unternehmensinsolvenzen lag im Januar bei 1271, wie das Statistikamt mitteilte. Das sind 20,2 Prozent mehr als ein Jahr zuvor. Im Dezember hatte der Anstieg bei 19,7 Prozent gelegen. Die meisten Unternehmensinsolvenzen entfielen zu Jahresbeginn auf das Baugewerbe mit 246 Fällen (+19,4 Prozent), das besonders unter den steigenden Zinskosten leidet. Danach folgte der Handel (einschließlich Instandhaltung und Reparatur von Kraftfahrzeugen) mit 204 Verfahren (+27,5 Prozent). ""Der Online-Handel und das veränderte Konsumverhalten der Kunden führen in vielen Fällen zu wirtschaftlichen Schwierigkeiten"", hieß es dazu beim VID. ""Galeria Karstadt Kaufhof ist derzeit das prominenteste unter vielen Beispielen."""
