eb2bed8d-1e84-476a-93dd-e62dc0eee073,2023-06-13 07:22:48+00:00,"Velbert. Ein historisches Porsche-Cabriolet, ein sogenannter James-Dean-Porsche, ist in Velbert geklaut worden. Nach dem Auto wird international gefahndet Unbekannte Täter haben am Montag (12. Juni) einen auffälligen Porsche-Oldtimer gestohlen. Die Polizei hat den gestohlenen Sportwagen zur internationalen Fahndung ausgeschrieben und bittet um sachdienliche Hinweise. Auf einem Parkplatz in Velbert abgestellt Der Halter des Cabriolets hatte seinen Wagen gegen 16.45 Uhr auf dem Hinterhof eines Getränkemarktes an der Friedrichstraße abgestellt und mit einer Lenkradkralle gesichert. Als der Velberter rund zwei Stunden später wieder zu seinem Auto zurückkehrte, war der Oldtimer verschwunden. Vor Ort fand er nur noch sein aufgeflextes Lenkradschloss vor. Auch interessant Zur Fahndung ausgeschrieben Der Velberter alarmierte daraufhin die Polizei, die den Wagen im Rahmen einer ersten Fahndung jedoch nicht mehr auffinden konnte. Daher hat die Polizei den Oldtimer nun zur internationalen Fahndung ausgeschrieben und bittet um sachdienliche Hinweise zu dem Verbleib des Cabriolets. Zu dem Wagen gibt es die folgende Beschreibung: Porsche 550 Spyder (Typ: VW 1500, KAEFER/ 119) Replica (Nachbau); das Kennzeichen lautet ME - YS 268H; „James Dean Porsche“; Schilder von Porsche auf der Motorhaube und am Heck; Original Porsche-Schriftzug am vorderen Kotflügel links und rechts; Kilometerstand: 4000 Km. Das Auto ist rund 50.000 Euro wert. Hinweise gesucht Die Polizei fragt:Wer kann Angaben machen zum Verbleib des Porsche? Sachdienliche Hinweise nimmt die Polizei in Velbert jederzeit unter der Rufnummer 02051 946-61110 entgegen."
b1d8aee2-c025-4f7a-b9bf-9351c12f4882,2023-06-13 12:49:00+00:00,"Startseite Wirtschaft Porsche und E-Antriebe: Passen Klimaschutz und Porsche-Mentalität zusammen? Von: Leon Fasse Ein Sportwagen hat röhrig zu sein, laut, am besten noch im Nachbarort zu hören. Das ist zumindest die Meinung vieler Autofans – doch wie geht ein Autobauer damit um, der vermehrt auf E-Antriebe setzt? Stuttgart - Zu teuer, zu bonzig, zu laut, zu viel Schnickschnack: Wer sich an Porsche abarbeiten will, kann etliche solcher Punkte finden. Während etwa die meisten Autobauer ihre neuen vollelektrischen Modelle ins Schaufenster stellen, soll der 911er noch bis auf Weiteres mit einem Verbrennermotor röhren. Und komplett elektrisch bringt Porsche bislang nur ein Modell auf die Straße. Vom Zeitgeist lassen sich die Stuttgarter also offenbar nicht treiben. Und dennoch - oder gerade deswegen - ist Porsche 75 Jahre nach der Erstzulassung seines ersten Sportwagens so erfolgreich wie nie. Fragt sich nur: Bleibt das so, wenn die Elektromobilität Einzug hält? Von Nachkriegs-Österreich bis heute: Die bewegte Geschichte der Porsche-Sportwagen 35 PS, knapp 600 Kilogramm Gewicht und eine Spitzengeschwindigkeit von 135 Kilometern pro Stunde: Was heute so gar nicht nach Sportwagen klingt, war 1948 eine kleine Technik-Revolution. Der Porsche 356 erinnert mit seinen runden Scheinwerfern und seiner schnittigen Form aber immerhin optisch an seine etlichen Nachfolger. Am 8. Juni 1948 erhielt der in Gmünd in Österreich gefertigte Ur-Porsche seine Erstzulassung - das gilt als Geburtsstunde des Porsche-Sportwagens. Seither hat sich viel getan: Rennsporterfolge, die Entwicklung des 911er im Jahr 1963 - auch hier gibt es also einen Geburtstag zu feiern – und Wachstum. Aber auch der drohende Niedergang der 90er Jahre, mit dem heute meistverkauften Modell Cayenne, die Flucht ins SUV-Segment und eine verlorene Übernahmeschlacht mit Volkswagen. Kaum geändert hat sich hingegen das Logo, das vorne auf den Fahrzeugen prangt. Seit 1952 wird das Wappen mit dem Pferd in der Mitte verwendet. Und auch wenn Porsche Anfang Juni eine Modernisierung vorstellte, die in einem drei Jahre langen Prozess entstanden sein soll, ist das Wappen mit dem Bezug zu Stuttgart, dem goldenen Hintergrund und den schwarz-roten Balken doch weitestgehend gleich geblieben. Psychologe: Porsche-Klientel unverändert Was sich nicht verändert hat, ist die Porsche-Klientel, wie der Wirtschaftspsychologe Rüdiger Hossiep von der Universität Bochum beobachtet. Die beschreibt er so: „Porsche-Fahrer wollen ausstrahlen, dass sie solvent, sportlich und gut drauf sind. Für viele – gerade für Männer – ist es auch ein Jugendtraum.“ Auch Porsche selbst spricht von der „hohen Loyalität“ seiner Kundschaft. Das habe sich auch nicht mit der Einführung der SUV geändert. Und mit der Einführung des einzigen vollelektrischen Modells Taycan seien auch neue Kundengruppen erschlossen worden. Um herauszufinden, welche Menschen so ein Auto anzieht, lohnt ein Blick in Hossieps Umfragen. Demnach liegen Porsche-Fahrer auf den Dimensionen Sportlichkeit, Faszination, Genuss, Außenwirkung, Statusbewusstsein und etlichen weiteren deutlich über dem Schnitt aller Autofahrer. Weniger wichtig als dem Durchschnitt sind ihnen demnach die Regelkonformität, die Sicherheit und die Funktionalität. Bei einem Auto, bei dem das Zündschloss links montiert ist, weil das früher beim 24-Stunden-Rennen von Le Mans einen Startvorteil versprach, sind das keine besonders überraschenden Ergebnisse. Porsche-Gewinn steigt konstant Ein Porsche sei „ein Spielzeug für Leute, die gut Geld verdienen, gut unterwegs sind und dann aber auch zeigen wollen, dass sie Spaß am Leben haben“, drückt es der Autoexperte Ferdinand Dudenhöffer aus. Das habe auch etwas damit zu tun, sich dynamisch zu bewegen. Porsche-Kunden seien zudem Menschen, die sich über Konventionen hinwegsetzen und Unternehmer spielen wollen, meint er. Auch deshalb sei Finanzminister Christian Lindner (FDP) so in Porsche verliebt. Dass sich mit so einem „Spielzeug“ gutes Geld verdienen lässt, zeigt ein Blick auf die aktuellen Zahlen der Zuffenhausener. Die Gewinne steigen kontinuierlich und von einer Marge - also dem Anteil des operativen Gewinns am Umsatz - von zuletzt 18,2 Prozent können die allermeisten Autobauer nur träumen. Zudem rangiert Porsche kein Jahr nach dem Börsengang bereits im Dax und hat bei der Börsenbewertung die Konzernmutter VW schon lange hinter sich gelassen. Psychologen im Zwist: Passt E-Antrieb und Porsche zusammen? Nur was wird aus dem Spaß, wenn künftig nicht mehr der Boxermotor hinterm Rücken röhrt, sondern die Batterie für den Antrieb sorgt? Für Psychologe Hossiep geht das nicht wirklich zusammen. „Ein Leben mit einem elektrischen Porsche-Sportwagen ist möglich, aber sinnlos.“ Für Sportwagenfahrer gehörten Haptik, Geruch, Geräusche oder Vibrationen dazu. Das aus dem Lautsprecher kommen zu lassen, sei für viele undenkbar. „Da kann man sich genauso in einen Fahrsimulator setzen.“ Etwas anders sieht das Dudenhöffer: Elektroautos beschleunigten schneller als ein konventionelles Fahrzeug, das passe wieder zur Dynamik. „Von daher glaube ich, das passt eigentlich sehr gut zusammen.“ Die Zeit, in der Geschwindigkeit mit Krach unterlegt werde, gehe zu Ende. „Von daher glaube ich, Porsche wird überleben.“ Elektroversion des 911 nicht geplant Konkret plant Porsche, 2030 mehr als 80 Prozent der Neufahrzeuge vollelektrisch auszuliefern. Doch dieses Ziel ist 2022 in die Ferne gerückt: Weil deutlich weniger Exemplare des Taycan verkauft wurden, verringerte sich der reine E-Anteil von 13,7 Prozent auf 11 Prozent. Der Grund hierfür seien Versorgungsengpässe, heißt es vom Unternehmen. Auch Anfang 2023 setzte sich der Abwärtstrend fort. Andererseits investiert Porsche in eine eigene Produktion von eFuels in Chile und setzt auf den potenziell klimafreundlichen Kraftstoff, um die große Bestandsflotte zu dekarbonisieren. Letztlich dürfte es dabei aber auch darum gehen, den Klassiker 911 weiter an den Mann und die Frau zu bringen. Denn eine vollelektrische Version des 911 soll es laut Unternehmen zumindest nach heutigem Stand nicht geben. Derweil plant die VW-Sportwagentochter jedoch die ultimative Krönung im E-Portfolio. Porsche 911: Kommt eine Hybridversion? Die Batterien müssten deutlich leichter und kleiner werden, um das klassische Konzept eines 2+2-Sitzers mit dem Motor hinter der Hinterachse umzusetzen, erläutert eine Sprecherin. Man denke aber über eine sehr sportliche Hybridversion des 911 nach. „Der 911 wird noch so lange als Verbrenner zu kaufen sein, solange es genug Kunden gibt, die Verbrenner-Fahrzeuge nachfragen und solange die Regularien es erlauben.“ Die Nachfrage sei ungebrochen hoch. (dpa, lf)"
196d9daa-9e42-4135-bcea-876a5617405b,2023-06-14 15:30:00+00:00,"Die 24 Stunden von Le Mans sind Geschichte: Bei der 100. Ausgabe wird neben dem Triumph von Ferrari auf der Strecke, abseits der Strecke die umfangreiche Spendenaktion von Porsche in Erinnerung bleiben. 'Racing for Charity' sammelte pro gefahrener Porsche-Rennrunde Geld für benachteiligte Kinder in Deutschland und Krisengebieten. Passend zum 75-jährigen Jubiläum von Porsche Sportwagen wurde die erzielte Summe fast verdoppelt: Auf 911.000 Euro. Porsche in Le Mans: Mehr Rennrunden, mehr Spenden Das heißt: Für jede gefahrene Rennrunde der drei Werks-Porsche 963 in Le Mans flossen 750 Euro in den Spendentopf. Das macht bei 733 Runden der Hybrid-Prototypen eine Gesamtsumme von 549.750 Euro. Anlässlich des Jubiläums wurde diese Summe im Stil der ikonischen Marke auf 911.000 Euro aufgestockt. Porsche verteilt die Spenden auf drei gemeinnützige Institutionen. Je 350.000 Euro gehen an die Vereine Kinderherzen retten und Interplast Germany. Damit wird Kindern in Entwicklungsländern und in Krisengebieten geholfen. Der Hauptfokus liegt auf Herzkrankheiten, Verkrüppelungen und Verbrennungen. Aufgrund mangelnder Expertise und fehlender medizinischer Einrichtungen werden diese Verletzungen oft falsch behandelt. Interplast hilft Kindern vor Ort und bildet ortsansässige Chirurgen aus. In 14 Tagen werden so ungefähr 100 Kinder behandelt und mit der besseren Ausbildung für ortsansässige Chirurgen wird ihnen langfristig geholfen. Kinderherzen retten operiert von Deutschland aus. 911.000 Euro für Kinder im In- und Ausland ""Wir werden das Geld verwenden, um Kinder mit Herzfehlern oder koronaren Erkrankungen aus unterentwickelten Ländern nach Freiburg zu bringen"", freut sich Professor Friedhelm Beyersdorf, Gründer von Kinderherzen retten, über die Spende. Mit einer Operation könne vielen Kindern ein normales Leben ermöglicht werden. ""Die Kleinen sind anschließend so gesund, als hätten sie nie Probleme mit dem Herzen gehabt."" Die restlichen 211.000 Euro gehen an die Ferry-Porsche-Stiftung. Damit wird versucht, schwerkranke Kinder und deren Familien im Alltag zu unterstützen und zu entlasten. Die Stiftung wurde zum 70. Jubiläum von Porsche 2018 ins Leben gerufen und setzt sich zum Ziel, Familien unbeschwerte Momente in schwierigen Zeiten zu schenken. Porsche: Motorsport und Menschen Teil der DNA ""Porsche stellt sich von jeher seiner sozialen Verantwortung als Unternehmen. Nun haben wir diese Maxime mit der Initiative 'Racing for Charitiy' erstmals auch im Motorsport erfolgreich umgesetzt"", erklärt Michael Steiner, Mitglied des Vorstandes der Porsche AG, Forschung und Entwicklung. Und betont: ""Motorsport und Menschen sind zentraler Bestandteil unserer DNA."" Zusätzlich erhielt Porsche noch vor Rennbeginn vom Veranstalter Automobile Club de L'Ouest für die Spendenaktion den ersten Platz des 'Sustainable Endurance Award'. Grund: Bei Porsche steht mit ihrem umfangreichen sozialen Engagement der Mensch im Mittelpunkt. 2022 unterstützte Porsche mehr als 150 gemeinnützige Projekte in den Kernfeldern Sport, Kultur, Umwelt und Soziales sowie Bildung und Wissenschaft."
e1229a9c-7c52-43fc-bff5-e3c113a6c19f,2023-06-15 03:32:40+00:00,"Blumes Batteriezellenpläne Wie Porsche mit einer Gigafabrik angreift Porsche-Chef Oliver Blume stärkt seine Elektrostrategie mit einer eigenen Gigafabrik für Batteriezellen – Akkus für bis zu 200.000 Autos im Jahr. Der bisherige Joint-Venture-Partner Customcells wird herausgekauft, hat aber schon einen neuen Großkunden. Von Michael Freitag 15.06.2023, 12.24 Uhr Sie können den Artikel leider nicht mehr aufrufen. Der Link, der Ihnen geschickt wurde, ist entweder älter als 30 Tage oder der Artikel wurde bereits 10 Mal geöffnet. manager magazin plus Jetzt weiterlesen. Mit dem passenden manager Abo. Einen Monat für € 0,99 testen. Jederzeit kündbar. Ihre Vorteile: manager magazin+ und Harvard Business manager+ im Paket Alle Inhalte von m+ und HBm+ auf der Seite manager-magazin.de und in der manager-Nachrichten-App Der Inhalt der gedruckten Magazine inkl. E-Paper (PDF) Jetzt für € 0,99 testen Ihre Vorteile: Alle Inhalte von m+ auf der Seite manager-magazin.de und in der manager-Nachrichten-App m+-Newsletter mit besonderen Leseempfehlungen Der Inhalt des gedruckten Magazins inkl. E-Paper (PDF) Jetzt für € 0,99 testen Sie sind bereits Digital-Abonnentin oder -Abonnent? Hier anmelden Weiterlesen mit manager+ Immer einen Einblick voraus Ihre Vorteile mit manager+ manager magazin+ in der App Harvard Business manager+ in der App Das manager magazin und den Harvard Business manager lesen als E-Paper in der App Alle Artikel in der manager-App Preis wird geladen... Sie haben bereits ein Digital-Abonnement? manager+ wird über Ihren iTunes-Account abgewickelt und mit Kaufbestätigung bezahlt. 24 Stunden vor Ablauf verlängert sich das Abo automatisch um einen Monat zum Preis von zurzeit 24,99€. In den Einstellungen Ihres iTunes-Accounts können Sie das Abo jederzeit kündigen. Um manager+ außerhalb dieser App zu nutzen, müssen Sie das Abo direkt nach dem Kauf mit einem manager-ID-Konto verknüpfen. Mit dem Kauf akzeptieren Sie unsere Allgemeinen Geschäftsbedingungen und Datenschutzerklärung ."
5cc03af2-98fa-4bae-a4de-f414a7c6eed9,2023-06-15 13:55:26+00:00,"Im #DealMonitor für den 15. Juni werfen wir einen Blick auf die wichtigsten, spannendsten und interessantesten Investments und Exits des Tages in der DACH-Region. Alle Deals der Vortage gibt es im großen und übersichtlichen #DealMonitor-Archiv. INVESTMENTS Nelly +++ Lakestar, arc investors, b2venture und Motive Ventures investieren 15 Millionen Euro in Nelly. Das Berliner FinTech, das von Lukas Eicher, Niklas Radner, Rasmus Schults und Laurids Seibel gegründet wurde, setzt auf eine Software für Arztpraxen, die sich um Patientenaufnahme, Rechnungsstellung und Bezahlung kümmert. Embedded Capital, btov Partners, Global Founders Capital (GFC), Calm/Storm, Gaingels sowie Business Angels wie Verena Pausder und Diana zur Löwen investierten zuvor bereits 4 Millionen Euro in Nelly. Das frische Kapital soll das “Wachstum in Deutschland weiter beschleunigen”. Nelly wird nach eigenen Angaben “bereits von mehr als 450 Praxen und 350.000 Patient:innen genutzt”. Im aktuellen Insider-Podcast haben wir über das geplante Investment von Lakestar schon berichtet. Die Pre-Money-Bewertung liegt nach unseren Informationen bei rund 50 Millionen. Mehr über Nelly Sparetech +++ Insight Partners und Headline investieren 10 Millionen Euro in Sparetech. Das Unternehmen aus Stuttgart, das 2018 von den Ex-Porsche-Ingenieuren Martin Weber und Lukas Biedermann gegründet wurde, entwickelt “eine Kollaborations-Plattform auf der produzierende Unternehmen ihren Bestand an Ersatzteilen digitalisieren, den Bedarf verwalten, Ersatzteile verschiedener Anbieter vergleichen und passende Teile bestellen können”. Headline und Business Angels wie Gisbert Rühl, Pitch-Gründer Christian Reber, Stefan Gross-Selbeck und Martin Böhringer invesierten zuvor bereits 5 Millionen Euro in Sparetech. Mehr über Sparetech Meshcapade +++ Der amerikanische Investor Matrix, das 3D-Unternehmen CLO sowie Business Angels wie Nate Mitchell, Matthew Ball, William O’Farrell, Andrew Hamel, Gary Bradski investieren 6 Millionen US-Dollar in Meshcapade. Das Unternehmen aus Tübingen, 2018 von Talha Zaman, Naureen Mahmood und Michael Black als Spin-off des Max-Planck-Institut für Intelligente Systeme ausgegründet, kümmert sich um die automatische Erstellung von menschlichen 3D-Avataren. “We solve the hard computer vision problem of converting your data into accurate digital humans so you can focus on your core business”, heißt es auf der Website. Vivalyx +++ “Transplantations-Experten, Professoren, ein Angel-Fund, der geschäftsführende Gesellschafter eines LifeScience-Unternehmens sowie der Profifußballer Mario Götze” investieren eine siebenstellige Summe in Vivalyx. Das Aachener LifeScience-Startup, 2022 von Andreas Schumacher, Benedict Doorschodt, René Tolba, Christian Bleilevens, Malte Brettel und Marius Rosenberg gegründet, entwickelt eine Technologie zur Revitalisierung von Spenderorganen. Konkret geht es um die Organkonservierungsflüssigkeit. Startup-Jobs: Auf der Suche nach einer neuen Herausforderung? In der unserer Jobbörse findet Ihr Stellenanzeigen von Startups und Unternehmen."
da169d44-5a4d-4f75-b991-d04ea4a08f57,2023-06-15 22:00:00+00:00,"Beim Wort „Presse“ denken viele an so etwas wie eine Zitronenpresse. Aber schauen wir uns mal eine Presse an, die Karosserieteile von Autos fertigt: Das modernste Presswerk der Welt steht vor den Toren von Halle. Es ist ein Gemeinschaftswerk von Porsche und dem Maschinenbauer Schuler aus Göppingen. Neben den insgesamt sechs riesigen Pressen wirken die Mitarbeiter winzig klein. Bis Jahresende werden dort rund 180 Kollegen arbeiten. Das Presswerk in Halle schafft pro Minute 20 sogenannte Hübe – und jedes Mal kommt ein Karosserieteil heraus, zum Beispiel eine Motorhaube oder eine Heckklappe für den Porsche Macan, der im nahe gelegenen Leipzig vom Band rollt. Dieses Presswerk setzt neue Maßstäbe im Prozessmanagement. Jedes Teil erhält eine Kennung und wird während des Produktionsprozesses verfolgt. Alle Abläufe sind vernetzt und können mit künstlicher Intelligenz optimiert werden. So werden zum Beispiel Fehler schneller erkannt. Die Schuler Group gibt’s übrigens schon seit mehr als 180 Jahren. Ihre Anlagen sind überall gefragt, wo Metall in Form gebracht werden muss. Vom Dübel bis zur Auto-Verkleidung: Wo auch immer Kunststoff in Form gebracht wird, sind Spritzgieß-Maschinen von Arburg gefragt, einem der führenden Hersteller und Arbeitgeber von 3.600 Leuten. Produziert wird ausschließlich im Schwarzwald-Ort Loßburg. Der neueste Star unter den Arburg-Maschinen ist die „Jubiläumsmaschine“ – sie heißt so, weil sie im 100. Jahr der Firmengeschichte eine ganz neue Maschinen-Generation einläutet. Besonders an ihr ist, dass sie weder rein hydraulisch noch rein elektrisch funktioniert, sondern hybrid, also mit einer Kombination beider Techniken. Dadurch benötigt sie bis zu 50 Prozent weniger Energie und stößt bis zu zwölf Tonnen weniger CO2 pro Jahr aus. „Wir haben den Nerv der Zeit genau getroffen“, freut sich Gerhard Böhm aus der Geschäftsführung. Die Kunden – im Bild links bei einer Veranstaltung im Betrieb – seien vom neuen Spritzguss-Star begeistert. Wir benutzen sie (hoffentlich) mindestens zweimal täglich. Doch wo kommt unsere Zahnbürste eigentlich her? Ganz oft aus einer Maschine made im Schwarzwald! Vor über 120 Jahren leitete das Unternehmen Zahoransky aus Todtnau mit der Entwicklung des ersten Bürsten-, Bohr- und Stopfautomaten ein neues Zeitalter der Bürstenproduktion ein. Mehr als 4.000 Kunden hat das Unternehmen heute weltweit, und es hält mehr als 700 Patente. Mit seinen Innovationen hat Zahoransky zum Beispiel dafür gesorgt, dass wir im Zahnbürsten-Regal viele verschiedene Modelle mit unterschiedlichen Designs finden. Die Maschine „Cube“ (links zu sehen) markiert einen Meilenstein. Sie ist völlig neu konzipiert – verschiedene Zahnbürstenmodelle können damit ganz einfach auf einer einzigen Maschine hergestellt werden. 40 Bürsten pro Minute schafft schon die Basiseinheit dieser Maschine. Wer mehrere solche Einheiten koppelt, kann in der gleichen Zeit noch viel mehr Bürsten herstellen. Schon mal darüber nachgedacht, wer eigentlich in den Großküchen im Betriebsrestaurant, im Hotel oder in der Mensa den Abwasch erledigt? Oft ist es eine Maschine von Winterhalter mit Hauptsitz in Meckenbeuren (Bodenseekreis). Zum Beispiel eine „MTR“ – wie auf dem Bild rechts zu sehen, hier im Hotel Bad Schachen. So eine MTR, das steht für „Mehrtank-Korbtransportspülmaschine“, schafft bis zu 6.600 Teller pro Stunde. Solche Anlagen sind bis zu sieben Meter lang. Hinten kommt das Geschirr strahlend sauber raus – und absolut hygienisch: Die Maschine vernichtet laut Unternehmen 99,999 Prozent aller Keime. Dank optimiertem Nachspülsystem verbraucht die Maschine bis zu 30 Prozent weniger Wasser im Vergleich zur Vorgänger-Serie. Mit optionaler Abluft-Wärmerückgewinnung können bis zu 12 Kilowattstunden Energie pro Stunde gespart werden, mit einer Wärmepumpe bis zu 18 Kilowattstunden."
d8a59aba-34d8-4bb8-810f-f6887b11af4e,2023-06-16 05:30:51+00:00,"Ein Analyst hat kürzlich einen Kommentar zur Porsche SE-Aktie veröffentlicht, der den Anlegern Grund zur Freude bereiten dürfte. Porsche SE-Aktie: Berenberg-Analyst Gourvil sieht Renditechancen Im Mittelpunkt steht Romain Gourvil von der Berenberg Bank. Der Experte hat in einer neuen Studie die Porsche SE-Aktie aufgenommen und direkt Renditepotenzial in Aussicht gestellt. Demnach liegt das Kursziel des Berenberg-Analysten bei 76 Euro – mit der Empfehlung „Buy“. Zum Vergleich: Am Mittwochmittag notierte die Porsche SE-Aktie bei 58,2 Euro (Stand: 14.06.2024, 14:15 Uhr). Sollte sich das Kursziel bewahrheiten, wäre also eine Rendite von satten 30,5 Prozent möglich. Gourvil betonte, dass der Abschlag zum inneren Wert der Aktie mit den Beteiligungen an der Volkswagen AG und der Porsche AG viel zu hoch sei. Der Experte hält die Porsche SE-Aktie demnach für eine attraktivere und günstigere Option, um in den Golf-Hersteller und den Sportwagenbauer zu investieren. Volkswagen Aktie: Kaufen oder Verkaufen? Hier weiterlesen ... Porsche SE-Aktie: Bernstein-Experte Daniel Roeska weist auf VW-Risiken hin Eine deutlich andere Einschätzung gab es zuletzt übrigens von Daniel Roeska von Bernstein Research. Der Experte beließ sein Kursziel für die Porsche SE-Aktie Anfang Juni bei 58 Euro. Das wäre ein (kleines) Minus im Vergleich zum oben genannten Kursstand. Roeska konzentrierte sich in seiner Studie vor allem auf die Elektromobilität. So habe der Aufstieg von Tesla und BYD die europäischen Autobauer am stärksten getroffen. Die Premium-Anbieter Mercedes-Benz und BMW hätten am meisten zu verlieren angesichts der Abhängigkeit ihrer Marken von Technologieführerschaft, seien aber auch am besten positioniert, um den Wandel zur E-Mobilität zu meistern. Volkswagen hingegen habe wohl seine frühen Vorteile wieder verspielt. Die Porsche SE Hintergrund: Die Porsche SE ist die Dachgesellschaft des VW-Imperiums und wird von den Familien Porsche und Piëch kontrolliert. Die Holding hält Beteiligungen an der Volkswagen AG und der Porsche AG. Neben diesen „Kernbeteiligungen“ ist die Porsche SE auch in anderen Unternehmen investiert – in der Regel aber nur temporär. Dazu zählen aktuell unter anderem die Raumfahrtfirma Isar Aerospace und der Ladeinfrastruktur-Anbieter ABB E-Mobility."
9976dd69-4c40-4e80-b6ed-422aa8920cc6,2023-06-16 07:10:23+00:00,"Porsche hat 2021 bekannt gegeben, im Rahmen des Gemeinschaftsunternehmens Cellforce mit dem Unternehmen Customcells, einem Start-up von Fraunhofer-Wissenschaftlern, Batteriezellen für besonders leistungsfähige Elektroautos zu fertigen. Das treibt die Volkswagen-Tochter nun offenbar allein und in größerem Umfang voran. Die Premiummarke wolle das Werk in Kirchentellinsfurt nahe dem schwäbischen Tübingen auf eine Jahreskapazität von 20 Gigawattstunden (GWh) auslegen, berichtet das Manager Magazin unter Berufung auf Insider. Porsche strebe eine „Gigafabrik“ für Hochleistungszellen an. 180.000 bis 200.000 eigene Autos pro Jahr solle sie versorgen, möglicherweise auch Wettbewerber beliefern. Investieren müsste man in das Werk wohl mehr als eine Milliarde Euro. Customcells mit Stammsitz in Itzehoe steigt dem Bericht zufolge aus dem Projekt aus, da es nicht über die Mittel für die nun deutlich ehrgeizigeren Pläne des Partners verfügt. Porsche habe Cellforce im Mai zu einem nicht bekannten Preis komplett übernommen. Die Serienproduktion in Kirchentellinsfurt solle im Frühjahr 2024 beginnen, zunächst noch „in sehr kleinem Volumen“. In Großserie könne es dann in zwei oder drei Jahren losgehen, heißt es. Ein möglicher Kandidat für die Performance-Zellen könnte eine Serie der kürzlich präsentierten Supersportwagen-Studie Mission X sein. In Zukunft könnten dann auch die Topversionen der in höherer Stückzahl gebauten Elektroautos von Porsche die potenteren Akkus nutzen. Customcells wendet sich derweil einem anderen Großprojekt zu: Gemeinsam mit dem US-Batteriespezialisten OneD Battery Sciences will man Batteriezellen mit deutlich höherem Ladetempo entwickeln, die zudem günstiger werden sollen. Mit General Motors soll bereits ein Abnehmer bereitstehen. 2030 will Porsche mehr als 80 Prozent der Neufahrzeuge vollelektrisch ausliefern. Bisher kommen Zellen von Lieferanten aus Asien zum Einsatz. Neben den Cellforce-Akkus dürften zukünftig auch Energiespeicher von Volkswagen verwendet werden, der Mutterkonzern baut für mehr Synergien eigene Fabriken. Der deutsche Akkufertiger Varta kommt anders als geplant bei Performance-Zellen nach Informationen des Manager Magazins doch nicht zum Zug."
