bd09d41a-773e-4d2b-8ccb-9e30d382c38a,2024-08-21 07:31:00,"Startseite Wirtschaft Russlands Wirtschaft in der Zwickmühle: Putin geht neue Wege um sein Gas nach Europa zu bringen Von: Bona Hyun Die Kursk-Offensive überschattet Russlands Wirtschaftsprobleme. Putin sucht nach neuen Möglichkeiten im europäischen Gas-Geschäft. Moskau/Baku – Die russische Wirtschaft steht vor einem Gas-Dilemma. Dies könnte ein Faktor sein, der Präsident Wladimir Putin dazu veranlasst, während seines Besuchs in Aserbaidschan die ukrainische Offensive in Kursk unerwähnt zu lassen. Stattdessen konzentrieren sich die Diskussionen auf potenzielle Energieprojekte. Die Situation könnte kaum günstiger sein, da ein bedeutender Gasvertrag zwischen Russland und der Ukraine Ende 2024 ausläuft. Ein Schatten über Russlands Wirtschaft: Kursk-Offensive und möglicher Gas-Deal mit Aserbaidschan? Am 18. August trafen sich die Präsidenten Putin und Ilham Aliyev und vereinbarten eine engere Zusammenarbeit. Nach den Gesprächen in Baku erwähnte Putin den Bau kleiner Tankschiffe als gemeinsames Vorhaben. Diese Tankschiffe, die sowohl auf Flüssen als auch auf See eingesetzt werden können, sollen Öl aus dem Kaspischen und dem Schwarzen Meer ins Mittelmeer und somit auf den Weltmarkt transportieren. Beide Parteien begrüßen die Intensivierung der Zusammenarbeit. „Ich möchte anmerken, dass wir sehr zufrieden sind mit dem Niveau des Zusammenwirkens unserer Länder“, äußerte Aliyev gegenüber Putin. Es scheint jedoch, dass die Zusammenarbeit beider Länder nicht nur bei geplanten Ölprojekten Halt machen würde. Putin freut sich auf eine mögliche Lösung für Russlands Wirtschaft: Bald getarntes Gas aus Russland? „Beobachter gehen seit geraumer Zeit davon aus, dass Russland versuchen wird, sein Gas über Aserbaidschan nach Europa zu bringen“, so Michail Krutichin, russischer Wirtschaftsanalyst und Experte für den Gasmarkt, gegenüber dem ZDF. Könnte also bald wieder russisches Gas nach Europa fließen? Der ukrainische Energieexperte Mykhailo Gonchar vermutet ebenfalls, dass Putin und Aliyev Pläne schmieden könnten, russisches Gas durch die Ukraine zu leiten und es als aserbaidschanisches Gas zu tarnen. Aserbaidschan hat nicht viel Gas, erklärt Gonchar. „Gazprom hingegen hat viel Gas, weil es den europäischen Markt verloren hat“, sagte der Experte gegenüber der Euromaidanpress. Für Putin könnte dies eine Chance sein, wieder in das europäische Gasgeschäft einzusteigen. Aufgrund der Kursk-Offensive: Putin sucht nach Möglichkeiten für Gasgeschäfte Aktuell könnte der russische Präsident aufgrund der fortschreitenden Kursk-Offensive besorgt um seine Gas-Pipeline nach Europa sein. Gazprom pumpt sein Gas durch die Stadt Sudscha in der Oblast Kursk, die laut ukrainischen Angaben von Kiew eingenommen wurde, in die EU-Mitgliedsstaaten. Von Sudscha aus geht der Transit durch die Ukraine weiter in die Slowakei und nach Österreich. In den ersten zehn Monaten des Jahres 2023 flossen zwölf Milliarden Kubikmeter russisches Gas über die Ukraine nach Europa, wie Daten von S&P Global belegen. Dies geht auf einen Transitvertrag der Ukraine zurück, der noch vor dem russischen Überfall auf die Ukraine mit Russland abgeschlossen wurde. „Früher wurde dieser Transit als unbedeutender Gasfluss betrachtet, der vernachlässigt werden konnte. Jetzt aber sucht Putin verzweifelt nach Möglichkeiten, auf den europäischen Gasmarkt zurückzukehren“, erläutert Gonchar gegenüber der Euromaidanpress. Angesichts der Rekordverluste von Gazprom und offenbar scheiternden Gasverhandlungen mit China könnte Putin daran interessiert sein, den Gasfluss nach Westen fortzusetzen. Auslaufendes Gasabkommen zwischen Russland und Ukraine – Aserbaidschan im Blickpunkt Die Ukraine hat bisher kein Interesse daran gezeigt, das Transitabkommen zu verlängern oder zu erneuern. Ab 2025 will die Ukraine kein russisches Gas mehr weiterleiten, so Olexij Tschernyschow, Chef des staatlichen ukrainischen Energiekonzerns Naftogaz, in einem Interview mit dem US-Auslandssender Radio Liberty. Es gibt jedoch offenbar Gespräche, Gaslieferungen über die Ukraine auf andere Weise zu ermöglichen. Im Gespräch ist der Vorschlag, russisches Gas durch aserbaidschanisches Gas zu ersetzen. „Die ukrainischen Behörden und die EU sind an uns herangetreten, um uns bei der Verlängerung dieses Vertrags zu unterstützen“, bestätigte auch Präsident Aliyev im Juli. Gleichzeitig wies er darauf hin, dass Verhandlungen mit Russland zu diesem Thema stattfinden, ging jedoch nicht weiter ins Detail. Ob Aserbaidschan jedoch über ausreichende Kapazitäten verfügt, um russisches Gas zu ersetzen, ist ungewiss. Die Europäische Union, die seit 2022 daran arbeitet, ihre Gasimporte aus Aserbaidschan zu erhöhen, hat sich bisher nicht zu möglichen Verhandlungen geäußert. (bohy mit Material der dpa)"
9e916efa-0436-4a10-9c5d-50d843c1bed2,2024-08-21 07:54:00,"Lorenzo FulviRedaktor Auto&Mobilität Beim Batteriekonzern Varta mit Sitz im baden-württembergischen Ellwangen (D) kriselts schon seit geraumer Zeit. Varta klagte unter anderem über anhaltende Probleme in den Lieferketten oder über Billig-Konkurrenz aus China. Zudem legten Hacker im Februar die Computersysteme und die damit verbundene Produktion des Batterieherstellers wochenlang lahm. Aktie auf Absturz, Sanierungsplan steht fest So hat sich der strauchelnde Batteriehersteller nun mit Gläubigern und Investoren auf einen Rettungsplan geeinigt. Dieser beinhaltet eine Verlängerung von Krediten und einen drastischen Schuldenschnitt – von knapp 500 Millionen Euro auf 200 Millionen. Danach soll das Grundkapital von Varta auf null gesetzt werden. Infolgedessen scheiden die aktuellen Börsenaktionäre kompensationslos aus, und der Konzern verliert seine Börsennotierung. Die Angst vor einem Totalverlust liess die Aktie bereits im Juli einbrechen: Innert weniger Tage fiel diese von über zehn auf 1.50 Euro. Mittlerweile hat sich der Kurs wieder etwas erholt und schwankt aktuell um die zwei Euro. Zum Vergleich: Anfang 2021 stieg die Aktie auf über 180 Euro! Porsche übernimmt ein Drittel Zu den weiteren Schritten des Rettungsplans gehören Finanzspritzen. So sollen unmittelbar nach dem Kapitalschnitt zum einen eine Gesellschaft von Varta-Mehrheitseigner Michael Trojaner (MT Investco), zum anderen Autobauer Porsche mit jeweils 30 Millionen Euro einsteigen. Darauf folgt, dass nach allen Massnahmen MT Investco und Porsche je 32 Prozent vom Batteriehersteller halten, die restlichen Finanzierer zusammen 36 Prozent. Die Porsche AG teilte mit, dass sie mehrheitlich Vartas Autobatterie-Tochterfirma V4Drive Battery übernehmen wolle. Diese Firma baut unter anderem die Lithium-Ionen-Akkus, die im Hybrid-Antrieb des neuen Porsche 911 Carrera GTS eingesetzt werden. Der Zuffenhausener Autobauer hat sich zudem bereiterklärt, sich mit weiteren Partnern an der Neuaufstellung von Varta zu beteiligen. Wie Porsche in einer Pressemitteilung schreibt, seien die Voraussetzungen für den Abschluss der Mehrheitsübernahme von V4Drive kartellrechtliche Freigaben in verschiedenen Ländern sowie eine erfolgreiche Umsetzung des Rettungsplans der Varta AG. Das Sanierungskonzept soll die Finanzierung bis Ende 2027 sicherstellen. Ob dieser Plan klappt, wird sich in den kommenden Monaten und Jahren zeigen."
eb58273e-c534-487b-b52b-01ca19b8bd3f,2024-08-21 08:16:26,"Cum-Cum-Aktiendeals Wie der Fiskus illegale Milliarden verschenkt Stand: 21.08.2024 10:16 Uhr Rund 30 Milliarden Euro könnte sich Deutschland von Banken zurückholen, die sich an illegalen Cum-Cum-Aktiendeals beteiligt haben. Doch die Ermittlungen laufen nach wie vor schleppend. Woran liegt das? Von Susett Kleine und Esther Neumeier, RBB ""Die Finanzlobby hat hier beste Arbeit geleistet"", sagt die ehemalige Kölner Cum-Cum-Chefermittlerin Anne Brorhilker und seufzt. ""Anders kann man sich das überhaupt nicht erklären, dass sich der Staat diese riesigen Einnahmen durch die Lappen gehen lässt."" Für eine derart schleppende Aufarbeitung gibt es für die ehemalige Oberstaatsanwältin keine rationale Erklärung. Hätte Deutschland die geschätzten 30 Milliarden Euro aus Steuerschäden bereits zurückgeholt, gäbe es eine andere Situation bei der aktuellen Haushaltsdebatte. Die Grundlagen, um bei Tätern durchzugreifen, seien längst geschaffen, denn ""das oberste Finanzgericht hat entschieden, dass diese Geschäfte steuerlich nicht legal sind. Danach folgten weitere Urteile, und auch das Bundesfinanzministerium hat das zuletzt im Jahr 2021 noch einmal bekräftigt"", erklärt Brorhilker. Seit Juni dieses Jahres arbeitet sie als Geschäftsführerin beim Verein ""Finanzwende"". Bei Cum-Cum-Aktienkreisgeschäften wurden, stark vereinfacht, Steuern erstattet, auf die kein Anspruch besteht. ""Es ist also Betrug gegenüber dem Staat"", so Brorhilker. Bundesländer geben kaum Auskunft Der RBB hat für tagesschau.de alle Finanzministerien der Länder zum aktuellen Stand der Aufarbeitung befragt. In Bremen, Brandenburg und dem Saarland sind den Behörden bisher keine Cum-Cum-Fälle dieser Art bekannt. Zehn weitere Bundesländer gaben keine konkrete Auskunft. Nur Rheinland-Pfalz, Baden-Württemberg und Hessen haben detailliert geantwortet. In Hessen konnten seit 2021 gerade einmal zwei Fälle steuerrechtlich rechtskräftig abgeschlossen werden. Bisher soll das Bundesland damit knapp 13,7 Millionen Euro zurückgeholt haben. Allerdings geht man in Hessen, mit dem Bankenstandort Frankfurt am Main, von einem sehr viel höheren Steuerschaden aus. 95 Verdachtsfälle werden derzeit noch geprüft. Die Gesamtsumme der zu Unrecht erstatteten Kapitalertragsteuer soll laut hessischem Finanzministerium hier bei knapp vier Milliarden Euro liegen. Bisher nur ein Bruchteil zurückgefordert In Rheinland-Pfalz hingegen wurden innerhalb der vergangenen drei Jahre acht Fälle abgeschlossen, knapp 11,7 Millionen Euro rechtskräftig zurückgeholt. Drei Fälle waren Ende 2023 noch offen. Dabei geht es um rund 20,6 Millionen Euro. Baden-Württemberg hingegen hat bis Ende 2023 in 67 Cum-Cum-Fällen circa 480 Millionen Euro zurückgeholt. Diese Beträge sind in Anbetracht der geschätzten 30 Milliarden Euro nur ein Bruchteil des Gesamtschadens. Warum läuft die Aufarbeitung so schleppend? Im Jahr 2021 hatte die Bundesregierung im Koalitionsvertrag beteuert, man werde ""alles dafür tun, missbräuchliche Dividendenarbitragegeschäfte zu unterbinden"". Und weiter ""dafür sorgen, dass erlittene Steuerschäden konsequent zurückgefordert und eingezogen werden"". Nun soll zwar eine neue Bundesoberbehörde entstehen, die Finanzkriminalität effektiv bekämpfen soll, doch Fälle von Cum-Cum oder Cum-Ex sollen von dem neuen Bundesamt gar nicht angefasst werden. Zwar ist bei übergeordneten Betriebsprüfungen das bereits bestehende Bundeszentralamt für Steuern zuständig, das dem Bundesfinanzministerium untersteht. Dennoch schiebt Bundesfinanzminister Christian Lindner die Verantwortung vor allem auf die Länder. Auf Nachfrage betont der FDP-Politiker, es sei die Aufgabe der Steuerverwaltung und der Steuerfahndung der einzelnen Landesbehörden, Cum-Cum-Fälle aufzuklären und Täterinnen und Täter zur Rechenschaft zu ziehen. Einige Länder schreiben dazu, grundsätzlich habe die Verfolgung von Steuerhinterziehung und organisiertem Steuerbetrug Priorität. Allerdings seien die mit Cum-Cum verbundenen Vorgänge sehr komplex und zeitaufwändig. Vorbild Frankreich Die ehemalige Oberstaatsanwältin Brorhilker kritisiert: ""Die Finanzverwaltung tut sich unendlich schwer, die Gelder zurückzuholen, und auch die Staatsanwaltschaften und Ermittlungsbehörden in Deutschland sind viel zu schwach aufgestellt, um diese Geschäfte systematisch zu verfolgen."" Besonders ärgert sie daran, dass die Behörden mit zweierlei Maß messen würden. Bei Drogenkriminalität verfolge man beispielsweise jeden Fall. Im Bereich der organisierten Wirtschaftskriminalität werde öfter mal weggeschaut. Anders in Frankreich. Hier wurde laut Brorhilker extra eine Staatsanwaltschaft gegründet und systematisch ausgestattet. Sie soll sich insbesondere um die Aufarbeitung von Cum-Cum-Fällen kümmern. Im Zuge dessen wurden alle Banken, die in Bezug auf mögliche Geschäfte in Betracht kamen, durchsucht, erzählt sie kämpferisch. ""Es geht also einiges, wenn man nur will."""
674d17ec-780b-4b9b-aba2-73e4b7caec6a,2024-08-21 08:49:19,"Update vom 21.08.2024: Am 21. Juli hat der Batteriehersteller Varta, im Rahmen eines “finanziellen Neustarts” beim Amtsgericht Stuttgart ein ""Restrukturierungsvorhaben nach dem Unternehmensstabilisierungs- und Restrukturierungsgesetz (StaRUG)"" eingereicht. Auf dieser Basis konnte sich der österreichische Grossaktionär Michael Tojner mit seinen Finanzgläubigern und strategischen Investoren auf ein Sanierungskonzept einigen. Dabei nehmen die Gläubiger einen Schuldenschnitt von 485 auf 200 Millionen Euro hin. Zusätzlich steuern sie noch 60 Millionen Euro in Form von vorrangig besicherten Darlehen für die Sanierung des Unternehmens bei, berichtet ""Elektrobranche"". Ein frisches Kapital von 60 Millionen Euro investiert Michael Tojner zusammen mit dem deutschen Sportwagenbauer Porsche. Damit wird Porsche zum Miteigentümer von Varta. Weitere Investoren könnten in Zukunft noch hinzukommen, heisst es weiter. Leer gehen die Kleinaktionäre aus, da Varta von der Börse genommen wird. Laut Varta-Chef Michael Ostermann habe man alles versucht, sie mit an Bord zu nehmen, doch rechtlich gesehen sei dies nicht möglich. Viele Aktionäre bemängeln diese Aussage, denn Varta konnte aufgrund des fehlenden geprüften Jahresabschlusses keinen Prospekt erstellen, was notwendig gewesen wäre für eine breite Kapitalerhöhung. Kritisiert wird auch die Rolle von Michael Tojner in der aktuellen Situation. Denn er bleibt trotz seiner zahlreichen Fehlentscheidungen mit 30 Millionen Euro an den Vermögenswerten des Unternehmens beteiligt. Originalmeldung vom 22.07.2024: Batteriekonzern Varta kämpft ums Überleben Der deutsche Batteriehersteller Varta ist hochverschuldet. Im Kampf ums Überleben hat das Unternehmen ein Restrukturierungsvorhaben angekündigt - dabei sollen Alt-Aktionäre aus dem Unternehmen gedrängt werden, wie ""Finanzen.net"" berichtet. Der Hersteller ist schon länger schwer angeschlagen und versucht deshalb mittels Verfahren einen ""finanziellen Neustart"" zu erreichen, wie Varta mitteilt. Das Unternehmen reichte am Sonntag, 21. Juli, beim Amtsgericht Stuttgart ein ""Restrukturierungsvorhaben nach dem Unternehmensstabilisierungs- und Restrukturierungsgesetz (StaRUG)"" ein. Dieses Gesetz soll verhindern, dass operativ lebensfähige Unternehmen Bankrott gehen. Es bedeutet aber auch, dass Aktionäre und Gläubiger keine Rechte mehr besitzen. Wertverlust der Aktien Varta verkündete zwar die Sicherung von Arbeitsplätzen und den Schutz von Gläubigerinteressen. Jedoch sehen die Restrukturierungspläne eine Herabsetzung des Grundkapitals auf null Euro vor. Dadurch würden sämtliche bestehenden Aktien ihren Wert verlieren und Varta könnte nicht mehr an der Börse gehandelt werden. Grosse Gläubiger zeigen sich den Plänen gegenüber skeptisch, wie ""Finanzen.net"" weiter berichtet. Die Möglichkeit nach dem Kapitalschnitt frische Mittel zu geben und damit an Varta beteiligt zu sein, bliebe dem Mehrheitsaktionär Porsche vorbehalten. Dies entspreche nicht einer fairen Gleichbehandlung. Insgesamt schulde Varta institutionellen Kreditgebern, darunter Banken und Hedgefonds, rund eine halbe Milliarde Euro in Form eines Konsortialkredits und Schuldscheinen. Die Varta-Aktie habe indes bereits rund 80 Prozent an Wert verloren."
b815e88a-f262-4697-9568-a3421a8c2130,2024-08-21 13:44:57,"Die Bundesregierung will die Attraktivität des Finanzstandorts Deutschland stärken und die Finanzierungsmöglichkeiten für junge, dynamische Unternehmen weiter verbessern. Finanzminister Christian Lindner verschickte am Mittwoch nach Angaben aus Ministeriumskreisen einen entsprechenden Gesetzentwurf an seine Kabinettskollegen. Es ist ein weiterer Schritt, um die jüngst beschlossene Initiative zur Stärkung des Wirtschaftswachstums umzusetzen. Ziel dieser Initiative ist es, die Konjunkturschwäche in der Bundesrepublik zu überwinden und die Beseitigung struktureller Probleme zumindest anzugehen. Zu diesen Problemen zählen etwa der Fachkräftemangel, die hohen Energiepreise, überbordende Bürokratie und die unzureichende Investitionstätigkeit der Unternehmen. Das Kabinett hatte das Paket Anfang Juli parallel zum Haushaltsentwurf für 2025 beschlossen. Es soll das Wirtschaftswachstum bereits im kommenden Jahr um bis zu 0,6 Prozentpunkte erhöhen. Das jetzt auf den Weg gebrachte sogenannte Zukunftsfinanzierungsgesetz II sieht unter anderem Steuererleichterungen für die Beteiligung von Fonds an gewerblichen Personengesellschaften vor. Auch Gewinne aus dem Verkauf von Anteilen an einer Kapitalgesellschaft sollen steuerlich bessergestellt werden, wenn sie reinvestiert werden. Zudem will Lindner durch eine Vereinheitlichung der Steuer- und Aufsichtsregeln mehr Rechtssicherheit für Investitionen in erneuerbare Energien und Infrastrukturprojekte schaffen. Meldepflichten für Finanzinstitute sollen deutlich reduziert werden Darüber hinaus plant die Regierung, der Finanzindustrie eine Vielzahl an Prüf-, Melde- und Anzeigepflichten zu erlassen. So soll unter anderem das sogenannte Mitarbeiter- und Beschwerderegister bei der Aufsichtsbehörde Bafin abgeschafft werden, in das die Institute seit 2012 die Namen von Mitarbeitern in der Anlageberatung sowie Kundenbeschwerden über ebendiese Mitarbeiter eintragen müssen. Durch die Reform werden die Firmen von durchschnittlich rund 40 000 Anzeigen im Jahr entlastet. Zudem werden die Meldepflichten für Millionenkredite reduziert. Um attraktiver für Fachkräfte zu werden und die Aktienkultur zu stärken, sollen Unternehmen ihre Mitarbeiter zudem leichter am Firmenkapital beteiligen können. Dazu will Lindner den kürzlich schon einmal erhöhten Steuerfreibetrag für Beschäftigte deutlich von derzeit 2000 auf 5000 Euro anheben."
46a009d0-d531-47b9-9657-1ba58b856e94,2024-08-21 15:00:00,"Startseite Lokales Freising Allershausen Spatenstich für „weiteren Meilenstein“: Thyssenkrupp baut Fertigungshalle in Allershausen Von: Nico Bauer Die Gemeinde Allershausen freut sich auf einen weiteren globalen Partner: Am Mittwoch erfolgte der Spatenstich für eine Produktionshalle der Thyssenkrupp Automotive Systems. Allershausen – Der Gewerbepark Allershausen direkt neben der Autobahn A 9 begann mit der Ansiedlung des Unternehmens Yaskawa und die potenzielle Erweiterung nutzt derzeit die Spedition Dachser. Mit dem Spatenstich für eine Halle mit 19 300 Quadratmetern Grundfläche wurde nun die Erweiterung des Gewerbeparks gestartet. Hier wird das Unternehmen Thyssenkrupp Automotive Systems einziehen und als Zulieferer für BMW in München mit rund 200 Beschäftigten arbeiten. Beim Spatenstrich hatten die Redner den Druck, sich angesichts dunkler Regenwolken kurz zu fassen. Und es gelang: Der Spatenstich gelang zwei Minuten vor dem Regenguss und das war dann auch symbolisch für die Baustelle. Thyssenkrupp Automotive Systems hat einen großen Auftrag bei BMW bekommen, Achsen für die Elektroautos der New Car Line zu fertigen. Am liebsten würde man sofort starten. Steffen Schmidt, der CEO von Thyssenkrupp Automotive Systems, hatte schon konkrete Zeitpläne im Kopf. Im Frühjahr wolle man mit dem Innenausbau der Halle beginne für erste Vorserien „und heute in einem Jahr steht hier ein komplettes Werk“. Der künftige Mieter machte beim Spatenstich klar, dass der Aufbau eines neuen Produktionsstandortes in Deutschland durchaus außergewöhnlich ist. „Der Trend geht zur Internationalisierung“, sagte Schmidt. In diesem Fall aber war die Nähe zu München und BMW wichtig. Nach einer ersten Suchrunde für den geeigneten Standort landete man in der zweiten Runde schnell bei Allershausen. Pluspunkte waren die Anbindung an die Autobahn und die Nähe zu Ingolstadt. Thyssenkrupp Automotive Systems arbeitet mit allen großen Autokonzernen (BMW, Audi, Mercedes, Porsche, VW) zusammen. „Das ist ein weiterer Meilenstein für die Entwicklung unseres Gewerbeparks“, sagte der Allershausener Bürgermeister Martin Vaas, dem die Festtagsstimmung beim Spatenstich anzumerken war. Man habe durch solche Zuzüge „einen einzigartigen Standort in der Region“. Allershausenss Rathauschef lobte die Pläne eines nachhaltigen Bauprojekts und sieht nun „eine Steigerung der Qualität als Wohn- und Gewerbestandort“. Gastgeber der Veranstaltung war Sebastian Kuhlen, Vorstandsmitglied des Unternehmens Dibag, das Bauherr und Vermieter ist. Zwischenzeitlich gab es Bestrebungen für eine direkte Ansiedlung des Autokonzerns BMW. Diese Tür ist mit der Ansiedlung von Thyssenkrupp Automotive Systems auch noch nicht geschlossen. Kuhlen berichtete, dass man die Tektur für den Bauantrag bereits digital beim Landratsamt eingereicht habe und mit der baldigen Genehmigung rechnet. In die Richtung von Thyssenkrupp-Vertreter Steffen Schmidt sprach er deutliche Worte: „Wir wissen genau, dass sie es eilig haben.“ Sebastian Kuhlen hat keinerlei Zweifel an einem schnellen Bauverlauf mit dem Unternehmen Bremer, das beim Spatenstich auch prominent vertreten war durch den Geschäftsführer Volker Richert. Kuhlen dankte dem Allershausener Gemeinderat, „der sich die Entscheidung nicht leicht gemacht hat. „Wir haben sehr großes Vertrauen in die Gemeinde und den Standort Allershausen.“"
6f133e51-4c10-4e95-a9b1-2e1c89916de7,2024-08-21 16:25:25,"Fans des ""ersten Sportwagen der Bundesrepublik"" treffen sich im Harz Rund 100 klassische Porsche vom Typ 356 werden unter anderem in Goslar zu sehen sein. Das Porsche 356 Club-Jahrestreffen findet im September im Harz statt. | Foto: Achim Kubiak 21.08.2024, 18:25 Uhr Harz. Die Städte Wernigerode und Goslar sind vom 6. bis 8. September Schauplatz des Porsche 356 Club-Jahrestreffens, das der Porsche 356 Club Deutschland e.V. für die Fahrer aus Deutschland dieses Sportwagens ausrichtet. Anlässlich des 49. Club-Jahrestreffen werden fast 100 klassische Porsche vom Typ 356 im Harz erwartet. Darüber informiert der Porsche 356 Club Deutschland e.V. in einer Pressemitteilung. Lesen Sie auch: Mit der Dampflok durch den Oberharz Interessierte Auto- und Oldtimerfans haben am Samstag, 7. September, die Chance, die Fahrzeuge bei der Abfahrt vom HKK Hotel in der Pfarrstraße 41 in Wernigerode von 9 bis 10.30 Uhr und am gleichen Tag auf dem Parkplatz vor der Kaiserpfalz in Goslar von 11 bis 14 Uhr an- und abfahren zu sehen. Die Ausfahrt am Samstagvormittag führt die Strecke vom HKK Hotel Wernigerode über Elbingerode, Hasselfelde, Braunlage, Sankt Andreasberg, Altenau und Clausthal-Zellerfeld nach Goslar. Am Samstagnachmittag führt die Strecke von Goslar nach Altenau, Torfhaus und Braunlage zurück nach Wernigerode. Club fast 40 Jahre alt Alle Porsche 356 sind aus den 1950er und 1960er Jahren und befinden sich laut Verein in einem exzellenten Zustand. Gegründet wurde der Porsche 356 Club Deutschland e.V. am 24. Mai 1975 unter dem Namen ""Porsche 356 Vereinigung"" von 25 Gleichgesinnten. Sie hatten es sich zur Aufgabe gemacht, keine Mittel zu scheuen, um möglichst viele Porsche 356 zu erhalten. Bereits Ende 1975 stand eine Namensänderung in ""Porsche 356 Euroclub"" an, da mittlerweile die Porsche-Oldtimer-Szene europaweit auf den Club aufmerksam geworden ist. 1982 erhielt der Club schließlich seine heutige Bezeichnung. Der erste Sportwagen der Bundesrepublik Ferry Porsche, Sohn des Käfer-Konstrukteurs Ferdinand Porsche, hatte unmittelbar nach dem Zweiten Weltkrieg in Österreich begonnen, seine Idee vom ""sportlichen Volkswagen"" zu verwirklichen. Der erste Porsche, das Modell 356/1, war im Juni 1948 fahrbereit. Die ""Nummer 1"" wie auch die folgenden 52 Exemplare wurden in aufwändiger Handarbeit im österreichischen Gmünd gefertigt. Die industrielle Serienfertigung startete knapp zwei Jahre später: Im Frühjahr 1950 rollte der erste in Deutschland gebaute 356 aus der Werkhalle in Stuttgart-Zuffenhausen. Der Sportwagen hatte eine Leistung von 40 PS, die Spitzengeschwindigkeit betrug 140 km/h. Das Coupé kostete rund 10.000 DM, das Cabriolet 12.000 DM. Elf Jahre nach der Premiere des 356 wurde das Modell überarbeitet. Den Porsche 356 B stellte das Unternehmen 1959 auf der IAA in Frankfurt vor. Die Stoßstangen waren größer und höher gesetzt, genauso wie in Scheinwerfer. Aber nicht nur die äußeren Veränderungen waren auffällig. Anfänglich mit einer Motorstärke von 60 beziehungsweise 75 PS ausgestattet, steigerte Porsche die Leistungskraft des Wagens 1960 auf 90 PS, die Spitzengeschwindigkeit auf 180 km/h. 911er als Nachfolger Die Fachwelt feierte den temperamentvollen, drehfreudigen Motor, die überragenden Fahreigenschaften und die Kurvenstabilität. Bis 1965 wurden von dieser Baureihe mehr als 75.000 Exemplare produziert. Mit der Baureihe 356 begründete Porsche seine Philosophie, Sportwagen zu entwickeln und zu bauen, die sich durch überlegene Technologie, außergewöhnliche Qualität und unverwechselbares Design auszeichnen. Dies gilt auch für den Nachfolger des 356, die Baureihe 911, die seit 1963 mittlerweile in der achten Generation gebaut wird. mehr News aus Goslar"
