0e442d37-109b-4dd4-963c-5981a1fc1a5a,2023-06-24 05:32:00+00:00,"Deutschland ist eine florierende Wirtschaft und beherbergt einige der weltweit größten und erfolgreichsten Unternehmen. Viele von ihnen bieten ihren Mitarbeiterinnen und Mitarbeitern nicht nur ein gutes Gehalt, sondern auch herausragende Sozialleistungen. Doch welche von ihnen zahlen mit Abstand das beste Gehalt? Wir haben es für dich herausgefunden. Diese deutschen Unternehmen zahlen das höchste Gehalt Personen mit hoher Qualifikation und Erfahrung werden in der Regel mit einem höheren Gehalt belohnt als jene, die diese Vorteile nicht aufweisen können. Allerdings spielen nicht nur die eigenen Kenntnisse und Fähigkeiten eine Rolle bei der Frage nach dem Verdienst, sondern auch das Unternehmen, für das man arbeitet. Doch welche Firma zahlt hierzulande das beste Gehalt? Die Jobplattform Glassdoor hat auf Anfrage von T-Online versucht, diese Frage zu beantworten. Das ist das Ergebnis: Platz 5: BCG Platinion zahlt hohes Gehalt BCG Platinion ist eine Tochtergesellschaft der Boston Consulting Group (BCG), die zu den weltweit größten und führenden Unternehmens- und Strategieberatungen zählt. Das Unternehmen bietet maßgeschneiderte IT-Strategien und -Konzepte für Unternehmen an und ist neben seinen fünf deutschen Standorten auch international vertreten. BCG Platinion beschäftigt weltweit über 750 Mitarbeiter an mehr als 40 Standorten und vergütet seine Angestellten mit einem durchschnittlichen Gehalt von 87.000 Euro brutto pro Jahr. Platz 4: Porsche Consulting Porsche Consulting, eine Beratungsgesellschaft, die vom Sportwagenhersteller Porsche gegründet wurde, ist mit 12 Standorten weltweit vertreten und beschäftigt 670 Mitarbeiterinnen und Mitarbeiter. Im Jahr 2019 erzielte Porsche Consulting einen Umsatz von 203 Millionen Euro. Das Unternehmen zahlt seinen Angestellten durchschnittlich 87.682 Euro brutto pro Jahr. Lesetipp: „Air Defender“: So hoch ist das Gehalt eines Kampfpiloten bei der Bundeswehr Platz 3: Überdurchschnittliches Gehalt bei Kearney Als eine der weltweit größten und renommiertesten Unternehmensberatungen hat die in Chicago ansässige Firma ihren festen Platz. Mit 60 Büros in über 40 Ländern und einer Belegschaft von über 3.600 Mitarbeitern zählte Kearney im Jahr 2018 einen Umsatz von 1,4 Milliarden US-Dollar (ca. 1,2 Milliarden Euro). Im Jahr 2016 wurde Kearney zum bestbezahlenden Arbeitgeber in den USA gekürt. In Deutschland schafft es das Unternehmen mit einem durchschnittlichen Jahresgehalt von 91.061 Euro brutto auf den beeindruckenden dritten Platz. Platz 2: Nokia Auf Platz 2 befindet sich der Telekommunikationskonzern Nokia. Das Unternehmen hat seinen Hauptsitz in Espoo, Finnland, und beschäftigt weltweit über 98.000 Mitarbeiterinnen und Mitarbeiter in 130 Ländern. In Deutschland verdienen die Mitarbeitenden durchschnittlich 96.620 Euro brutto. Nokia war von 1990 bis 2012 ein bedeutender Mobilfunkhersteller von Weltrang und lange Zeit Marktführer in der Branche. Im Jahr 2019 erwirtschaftete das Unternehmen einen Umsatz von 23,3 Milliarden Euro. Lesetipp: Öffentlicher Dienst: So viel Geld kannst du als Beamter verdienen Platz 1: Bain & Company zahlt das höchste Gehalt in Deutschland Bain & Company, eine Unternehmensberatungsfirma mit Hauptsitz in Boston, sichert sich den Spitzenplatz als bestbezahlender Arbeitgeber in Deutschland. Mit einem Schwerpunkt auf Strategieberatung durchbricht das Unternehmen die Marke von 100.000 Euro brutto bei der Vergütung seiner Mitarbeiterinnen und Mitarbeiter. Durchschnittlich verdient eine Angestellte oder ein Angestellter bei Bain & Company stolze 100.048 Euro brutto pro Jahr. Das Unternehmen betreibt insgesamt 63 Büros in 8 Ländern und erzielte im Geschäftsjahr 2019 einen Umsatz von 4,3 Milliarden US-Dollar (ca. 3,8 Milliarden Euro). Bain & Company hat bereits mehrere Auszeichnungen für seine Leistungen erhalten. Beratungsunternehmen zahlen ein überdurchschnittliches Gehalt Die Auflistung enthält auffallend viele Beratungsunternehmen, von denen sich allein vier in den Top 5 befinden. An der Spitze steht Bain & Company, das mit einem durchschnittlichen sechsstelligen Jahresgehalt besonders herausragt. Dieses Gehalt ist mehr als doppelt so hoch wie das durchschnittliche Bruttogrundgehalt eines Arbeitnehmers in Deutschland, das laut Statistischem Bundesamt im Jahr 2022 bei 49.260 Euro brutto jährlich lag. Interessanterweise fehlt der Finanzsektor vollständig in der Rangliste. Dies kann jedoch darauf zurückzuführen sein, dass Boni und Prämien bei der Analyse nicht berücksichtigt wurden. Quellen: T-Online, Statistisches Bundesamt"
7581cfc0-9f60-44e3-ac55-993e4bb06f1c,2023-06-26 13:42:28+00:00,"Mehrere Betriebsräte der Volkswagen-Tochter Porsche wehren sich vor dem Arbeitsgericht Stuttgart gegen die Kürzung ihrer Bezüge. Sowohl das Unternehmen als auch die Arbeitnehmervertretung bestätigten am Montag entsprechende Klagen. Die ersten Klageschriften seien bei Gerichten in Stuttgart und Leipzig eingegangen, weitere sollten folgen – auch vom Betriebsratsvorsitzenden Harald Buck. Beide Arbeitsgerichte waren zunächst nicht für eine Stellungnahme erreichbar. Zuerst hatte die »Stuttgarter Zeitung« am Montag darüber berichtet . Hintergrund der Klagen ist, dass die Betriebsräte prüfen lassen wollen, ob die vom Unternehmen vorgenommene Anpassung der Vergütung angesichts der neuen Rechtsprechung des Bundesgerichtshofs (BGH) rechtens ist. Vor dem Hintergrund eines Strafprozesses gegen VW-Manager hatte der BGH zu Jahresbeginn die langjährige Praxis für unzulässig erklärt, die Gehälter von Betriebsräten nach deren »hypothetischer Entwicklung« zu bemessen. Aus Sorge vor dem Vorwurf der Untreue haben mehrere Unternehmen daraufhin die Bezüge korrigiert. »Um Rechtssicherheit zu erreichen, müssen wir vor Gericht ziehen«, wurde Gremiumschef Buck von der »Stuttgarter Zeitung« zitiert. »Das ist für uns Betriebsräte nicht einfach, denn wir arbeiten alle schon sehr lange und sehr gerne für Porsche.« Ihm persönlich falle es schwer, nach mehr als 30 Jahren guter Zusammenarbeit gegen das Unternehmen zu klagen. Eine Porsche-Sprecherin sagte am Montag: »Porsche wird zunächst den Ausgang der Verfahren abwarten – zu laufenden Verfahren äußern wir uns nicht.« Das Unternehmen könne die Position der Betriebsräte allerdings gut nachvollziehen. »Wir teilen das Interesse, über die Gerichtsverfahren mehr Rechtsklarheit in dem gesamten Themenkomplex zu erhalten.« Auch bei Volkswagen wehren sich Arbeitnehmervertreter vor Gericht gegen die Kürzungen ihrer Bezüge. Der Konzern hatte ebenfalls sein Interesse an Rechtssicherheit betont. Nach dem BGH-Urteil hatte Porsche laut der Sprecherin »bei einer geringen Anzahl von Betriebsratsmitgliedern Anpassungen an der Vergütung vorgenommen«."
68e6c97a-f86f-4fe6-bfab-2bb0083d2ce5,2023-06-26 14:42:07+00:00,"Mehrere Betriebsräte der Volkswagen-Tochter Porsche wehren sich vor dem Arbeitsgericht Stuttgart gegen die Kürzung ihrer Bezüge. Sowohl das Unternehmen als auch die Arbeitnehmervertreter bestätigten am Montag entsprechende Klagen. Die ersten Klagen seien bei Gerichten in Stuttgart und Leipzig bereits eingegangen, weitere sollten folgen – auch vom Betriebsratsvorsitzenden Harald Buck. Beide Arbeitsgerichte waren zunächst nicht für eine Stellungnahme erreichbar. Zuerst hatte die ""Stuttgarter Zeitung"" darüber berichtet. Hintergrund ist, dass die Betriebsräte prüfen lassen wollen, ob die vom Unternehmen vorgenommene Anpassung der Vergütung angesichts der neuen Rechtsprechung des Bundesgerichtshofs (BGH) rechtens ist. Vor dem Hintergrund eines Strafprozesses gegen VW-Manager hatte der BGH zu Jahresbeginn die langjährige Praxis für unzulässig erklärt, die Gehälter von Betriebsräten nach deren ""hypothetischer Entwicklung"" zu bemessen. Aus Sorge vor dem Vorwurf der Untreue haben mehrere Unternehmen daraufhin die Bezüge korrigiert. ""Um Rechtssicherheit zu erreichen, müssen wir vor Gericht ziehen"", wurde Gremiumschef Buck von der ""Stuttgarter Zeitung"" zitiert. ""Das ist für uns Betriebsräte nicht einfach, denn wir arbeiten alle schon sehr lange und sehr gerne für Porsche."" Ihm persönlich falle es schwer, nach mehr als 30 Jahren guter Zusammenarbeit gegen das Unternehmen zu klagen. Eine Porsche-Sprecherin sagte am Montag: ""Porsche wird zunächst den Ausgang der Verfahren abwarten – zu laufenden Verfahren äußern wir uns nicht."" Das Unternehmen könne die Position der Betriebsräte allerdings gut nachvollziehen. ""Wir teilen das Interesse, über die Gerichtsverfahren mehr Rechtsklarheit in dem gesamten Themenkomplex zu erhalten."""
dc7234bf-a53a-4e0a-aefa-f9c4f6d0b2c8,2023-06-27 08:26:42+00:00,"Stadion wird umbenannt Megadeal für VfB Stuttgart: Porsche steigt als Investor ein Von t-online, mics Aktualisiert am 29.06.2023Lesedauer: 3 Min. Paukenschlag beim VfB Stuttgart: Der Fußballbundesligist schließt ein ""Weltmarken-Bündnis"" mit Porsche und Mercedes. Mit weitreichenden Folgen – auch für die Mercedes-Benz Arena. Lange hat der VfB Stuttgart nach einem weiteren großen Investor in die AG gesucht – die ausgegliederte Profiabteilung, die auch das Bundesligateam umfasst. Nun ist er endlich gefunden: Es ist laut einer Mitteilung mit der Porsche AG ausgerechnet der zweite große Autokonzern aus Stuttgart neben dem Ankerinvestor, der Mercedes-Benz Group. Dem Vernehmen nach soll der Sportwagenbauer in einer ähnlichen Größenordnung einsteigen wie Mercedes. Porsches Tochterunternehmen MHP soll zudem die Namensrechte der Mercedes-Benz Arena übernehmen. Das Stadion soll dann in ""MHP-Arena"" umbenannt werden. Eine entsprechende Absichtserklärung sei am Dienstag unterzeichnet worden. Die finalen Verträge sollen in den kommenden Tagen ausgearbeitet werden. Dem VfB winken so bis zu 100 Millionen Euro. Mercedes-Benz hatte 2017 für rund 41 Millionen Euro insgesamt 11,75 Prozent der Anteile an der VfB Stuttgart AG erworben. 2022 ist außerdem der Ausrüster Jako als kleiner Investor mit 1,16 Prozent der Anteile eingestiegen. Dafür bezahlte die Hohenloher Firma dem Vernehmen nach rund vier Millionen Euro. Das berichtete der kicker im März 2022. VfB Stuttgart: Mercedes-Benz bleibt als Ankerinvestor erhalten Der Untertürkheimer Autobauer soll dem Bundesligisten als Partner und Sponsor weiterhin zur Seite stehen: ""Mercedes-Benz bleibt in der einzigartigen Kooperation Ankerinvestor, Exklusivpartner und Mobilitätspartner des VfB"", heißt es in der Mitteilung des VfB. Zum Verzicht von Mercedes-Benz auf das Namensrecht des Stadions schreiben die Schwaben: ""Dieses Recht wird sich MHP für zunächst zehn Jahre sichern. Die Management- und IT-Beratung aus Ludwigsburg, die zum Porsche-Konzern gehört, engagiert sich zusätzlich als Teamplay-Partner des VfB."" ""Hier kommt die Champions League der Investoren unter einem Dach zusammen"" Alexander Wehrle, Vorstandsvorsitzender der VfB Stuttgart AG Heute sei ein großartiger Tag für den VfB, äußerte sich Präsident Claus Vogt laut der Mitteilung. ""Die geplante Zusammenarbeit mit Porsche, MHP und Mercedes-Benz verspricht, sowohl die AG als auch den e.V. nachhaltig zu stärken. Der Schulterschluss des VfB mit diesen starken Marken sendet eine klare Botschaft aus Württemberg in die Fußballwelt. Hier kommt die Champions League der Investoren unter einem Dach zusammen."" Dem Vorstandsvorsitzenden Alexander Wehrle zufolge könnte das Gesamtvolumen der Investoren einen Umfang von mehr als 100 Millionen Euro umfassen. Das sei ""das größte Paket in der Geschichte des VfB Stuttgart"", wird er zitiert. ""Die Toparbeitgeber und Weltmarken Mercedes-Benz, Porsche und MHP gemeinsam beim VfB – mehr geht nicht."" Möglich werde dies, so Wehrle, ""durch das großzügige Entgegenkommen von Mercedes-Benz"". Porsche-Deal langfristiges Bekenntnis zum VfB Mercedes-Benz-Vorständin Britta Seeger kündigte indes an, dass ihr Unternehmen ""auch in Zukunft ein integraler Teil der VfB-Familie sein"" wolle. ""Als langjähriger Hauptsponsor und guter Nachbar ist es uns wichtig, dass der VfB mit neuen Sponsoren aus der Region auch für die Zukunft finanziell stabil aufgestellt ist. Wir freuen uns daher auf die künftige Zusammenarbeit mit den neuen Partnern MHP und Porsche."" Für Porsche soll der Deal derweil ein langfristiges Bekenntnis sein: ""Der VfB Stuttgart ist der größte Verein am Stammsitz unseres Unternehmens. Uns eint eine große Tradition und wir sind beide tief in der Region verwurzelt. Gemeinsam mit MHP wollen wir unseren Teil dazu beitragen, die Zukunft des VfB möglichst erfolgreich zu gestalten"", wird Lutz Meschke, stellvertretender Vorstandsvorsitzender der Porsche AG, zitiert. Die Porsche AG soll laut VfB-Mitteilung den Sponsorenpool erweitern und Partner des Fußballnachwuchses und der Fußballschule werden. Die Beteiligung der Porsche AG an der VfB Stuttgart AG soll zusätzlich das Eigenkapital und die Liquidität des Bundesligisten erhöhen. Stuttgarter Mercedes-Benz Arena wird zur MHP-Arena MHP ist eine Management- und IT-Beratung aus Ludwigsburg, die zum Porsche-Konzern gehört. Das Unternehmen will sich der Mitteilung zufolge zusätzlich als Teamplay-Partner des VfB bei Themen wie CSR, eSports, Frauen- und Mädchenfußball, Leichtathletik sowie im Nachwuchsleistungszentrum engagieren. Zudem wird MHP Partner der VfB Stuttgart Bildungsakademie. ""Gleichzeitig wäre die Umbenennung des Stadions in MHP-Arena sicher ein nationaler Leuchtturm für unser Unternehmen, der unsere Marke zusätzlich emotionalisiert und unseren Wachstumskurs unterstützt"", wird Ralf Hofmann, Mitgründer, Gesellschafter und Vorsitzender der Geschäftsführung von MHP, zitiert. Bekannt war bislang, dass Mercedes sein Sponsoring beim Bundesligaklub aus Bad Cannstatt deutlich zurückfahren möchte. Bisher ist dessen Tochterunternehmen, die Mercedes-Benz Bank, Trikotsponsor des VfB. Stand jetzt wurde dafür noch kein Nachfolger präsentiert. Der VfB hofft laut der Mitteilung nun, dass sich in den kommenden Tagen ""zusätzliche starke Marken"" für das Sponsoring interessieren, wie Rouven Kasper, Vorstand Marketing und Vertrieb des VfB Stuttgart, demnach erklärte."
47fedd59-1d62-4973-9ea6-56a2e45aa550,2023-06-27 09:35:32+00:00,"Der von der Coronakrise gebeutelte VfB Stuttgart darf sich auf eine gewaltige Finanzspritze freuen. Automobilhersteller Porsche soll als Investor beim Klub aus der Fußball-Bundesliga einsteigen. Das Unternehmen aus der baden-württembergischen Landeshauptstadt werde „in der Größenordnung“ Anteile an der VfB AG erwerben wie einst Mercedes-Benz, erklärte VfB-Vorstandschef Alexander Wehrle bei einer gemeinsamen Pressekonferenz im Stadion der Stuttgarter am Dienstag. Für diesen Sommer seien fünf Prozent vorgesehen und innerhalb der nächsten zwölf Monate dann eine weitere Tranche. Mercedes hatte 2017 für 11,75 Prozent der Anteile an der ausgegliederten Profiabteilung der Schwaben 41,5 Millionen Euro bezahlt. Zusätzlich zu seinem Einstieg in die AG wird Porsche beim VfB mehrere Sponsoring-Pakete übernehmen – vor allem im Nachwuchsleistungszentrum. Mercedes bleibt dem Klub als Ankerinvestor und Sponsor erhalten, gibt das Namensrecht am Stadion zum 1. Juli aber an das Porsche-Tochterunternehmen MHP ab. Die aktuell im Umbau befindliche Arena soll demnach mindestens für die nächsten Jahre MHP-Arena heißen. Auch das Engagement von Mercedes als Trikot- und Ärmelsponsor des VfB endet. Diese Rechte will der Klub zur neuen Saison noch vermarkten. Das Gesamtvolumen dieses „Weltmarken-Bündnisses“, wie die Stuttgarter es nannten, beläuft sich laut Wehrle auf gut 100 Millionen Euro. Die letzten Formalitäten sollen bis Ende Juli geklärt sein. Schon jetzt sei es aber „ein großer, historischer Tag für den VfB Stuttgart“, sagte Präsident und Aufsichtsratschef Claus Vogt. (dpa)"
ac911928-cbbb-478c-89ec-917b708d2fe0,2023-06-27 13:52:03+00:00,"ANZEIGE Stuttgart / Ludwigsburg – Eine bedeutende Veränderung steht den Fans und Zuschauern der Heimspiele des VfB Stuttgart bevor: Die Heimstätte des Bundesligisten soll ab 01.07.23 nicht mehr Mercedes-Benz-Arena, sondern “MHPArena Stuttgart” heißen. Wie der Verein aus Cannstatt am Dienstag bekannt gab, hat sich das auf IT-Beratung spezialisierte Tochterunternehmen der Porsche AG die Namensrechte am Stadion für die nächsten zehn Jahre gesichert. Zusätzlich plant das Unternehmen, Team- und Fairplay-Partner des VfB Stuttgart zu werden. Dies umfasst Bereiche wie CSR, Frauenfußball, Akademie, Leichtathletik und eSport. Für MHP stellt die Partnerschaft mit dem VfB Stuttgart die logische Erweiterung ihrer bisherigen Sponsoringaktivitäten in der Region Stuttgart dar. Dr. Ralf Hofmann, Mitgründer, Gesellschafter und Vorsitzender der Geschäftsführung, spricht von einem “regionalen Engagement mit nationaler und internationaler Strahlkraft”. ANZEIGE Hofmann: “Nationaler Leuchtturm für unser Unternehmen” Die Management- und IT-Beratung ist bereits Namensgeber der MHPArena in Ludwigsburg, der Heimat des Basketball-Bundesligisten MHP Riesen. Hofmann erklärt: “Mit unserem geplanten Engagement wollen wir erneut gesellschaftliche Verantwortung in unserer Heimatregion übernehmen. Gleichzeitig wäre die Umbenennung in “MHPArena” sicherlich ein nationaler Leuchtturm für unser Unternehmen. Dies würde unsere Marke zusätzlich emotionalisieren und unseren Wachstumskurs unterstützen.” Die MHP Management- und IT-Beratung GmbH ist ein Beratungsunternehmen mit Sitz im Film- und Medienzentrum in Ludwigsburg. Es wurde 1996 von CEO Ralf Hofmann und Lutz Mieschke in Karlsruhe gegründet und ist seitdem auf Erfolgskurs. Im Jahr 1998 stieg der renommierte Autobauer Porsche bei MHP ein. Das Unternehmen beschäftigt mittlerweile mehr als 4.500 Mitarbeiter an 19 Standorten weltweit und erwirtschaftet einen Jahresumsatz von über 700 Millionen Euro (2022). ag / red"
424ca64d-c95c-4fa2-831f-787159fb4ef4,2023-06-27 14:58:43+00:00,"Der von der Corona-Krise gebeutelte VfB Stuttgart darf sich auf eine gewaltige Finanzspritze freuen: Automobilhersteller Porsche soll als Investor beim Fußball-Bundesligisten einsteigen. Das Unternehmen aus der baden-württembergischen Landeshauptstadt werde ""in der Größenordnung"" Anteile an der VfB AG erwerben wie einst Mercedes-Benz, erklärte VfB-Vorstandschef Alexander Wehrle (48) bei einer gemeinsamen Pressekonferenz im Stadion der Stuttgarter am Dienstag. Für diesen Sommer seien fünf Prozent vorgesehen und innerhalb der nächsten zwölf Monate dann eine weitere Tranche. Mercedes hatte 2017 für 11,75 Prozent der Anteile an der ausgegliederten Profiabteilung 41,5 Millionen Euro bezahlt. Zusätzlich zu seinem Einstieg in die AG wird Porsche beim VfB mehrere Sponsoring-Pakete übernehmen - vor allem im Nachwuchsleistungszentrum. Das Gesamtvolumen beläuft sich laut Wehrle auf gut 100 Millionen Euro. Die letzten Formalitäten sollen bis Ende Juli geklärt sein. Der stellvertretende Porsche-Chef Lutz Meschke (57) betonte, der Einstieg gehe ""im engen Schulterschluss"" mit Mercedes vonstatten. ""Wir kommen nicht etwa, um jemanden zu ersetzen. Vielmehr ist es unsere Absicht, die Kräfte zu bündeln – aus der Region und für die Region."" Außerdem will der Stuttgarter Sportwagenbauer Mercedes als Namensgeber von dessen Stadion ablösen. Das ehemalige Gottlieb-Daimler-Stadion soll künftig den Namen ""MHP Arena"" tragen, nach der Ludwigsburger IT- und Management-Beratungs-Tochter der Porsche AG. Mercedes gibt das Namensrecht am Stadion zum 1. Juli an die Porsche-Tochter ab. Die aktuell im Umbau befindliche Arena soll demnach mindestens für die nächsten zehn Jahre MHP-Arena heißen. Ursprünglich hatte sich das Unternehmen die Namensrechte an dem Stadion für 30 Jahre gesichert. Im November letzten Jahres hatte das manager magazin unter Berufung auf Insider berichtet, dass Mercedes-CEO Ola Källenius (54) sein Engagement bei dem Fußballverein spürbar reduzieren wolle. Trikotsponsor gesucht In der Pressemitteilung des VfB Stuttgart heißt es auch, dass in der neuen Konstellation das Engagement von Mercedes-Benz als Haupt- und Trikotpartner endet. Diese Rechte will der Club zur neuen Saison noch vermarkten. ""Mit dem neuen starken Bündnis im Rücken sind wir zuversichtlich, dass die Vermarktung unserer Toprechte auf der Brust wie auch dem Ärmel in den kommenden Tagen an Fahrt aufnimmt (...)"", so Marketing-Vorstand Rouven Kasper. Mercedes bleibt dem Club als Ankerinvestor und Sponsor erhalten. Der VfB Stuttgart wäre der dritte Bundesliga-Klub, an dem sich ein Unternehmen aus dem Volkswagen-Konzern beteiligt. Der VfL Wolfsburg ist vollständig im Besitz von VW, am FC Bayern München hält die Tochter Audi – neben Adidas und der Allianz – 8,33 Prozent. MHP ist bereits Namensgeber des Basketball-Bundesligisten ""MHP Riesen"" aus Ludwigsburg, dessen Sporthalle ebenfalls als ""MHP Arena"" bezeichnet wird."
