ebbb3fb4-baab-4cf3-928c-83d19bc1b62e,2023-06-02 03:22:00+00:00,"echo24 Heilbronn Porsche wird Teil des KI-Innovationsparks in Heilbronn – das ist geplant Von: Lisa Klein Für das Projekt ist es ein großer Meilenstein: Porsche kommt nach Heilbronn und mietet sich in den KI-Innovationspark ein – als eines der ersten überregionalen Unternehmen. Die Bilder der Pläne für den „Innovation Park Artificial Intelligence“ (IPAI) könnten auch aus einem Science-Fiction-Film stammen. Heilbronn hat sich im landesweiten Wettbewerb als geeigneter Standort durchgesetzt und den Zuschuss für einen Innovationspark für Künstliche Intelligenz (KI) ergattert. 50 Millionen Euro gehen von der Landesförderung für das Projekt nach Heilbronn. Weitere 50 Millionen Euro fließen von der Schwarz-Stiftung in das KI-Projekt. Porsche kommt nach Heilbronn und mietet sich in den KI-Innovationspark ein Die Schwarz Gruppe, zu der Lidl und Kaufland gehören, erwartet durch den Innovationspark ein Zusammenwirken mit Unternehmen, die sich in dem Park ansiedeln. Das Projekt soll also nicht nur das Thema KI antreiben, sondern auch große Unternehmen in die Region Heilbronn locken. Mit Erfolg, wie die „Heilbronner Stimme“ exklusiv (Artikel hinter der Bezahlschranke) berichtet: Porsche wird Teil des KI-Innovationspark IPAI. Porsche reiht sich damit als eines der ersten überregionalen Unternehmen in das Projekt ein, neben Konzernen aus der Region wie Audi und Würth. Christian Gleichauf, Chefkorrespondent Wirtschaft bei der „Heilbronner Stimme“, ordnet in einem Kommentar ein, was „Porsche kommt“ für den KI-Innovationspark IPAI und Heilbronn bedeutet. Heilbronn konnte Porsche für sich gewinnen – Startschuss für den „Porsche Digital Campus“ „Das ist zugleich der Startschuss für den Aufbau des Porsche Digital Campus von Porsche AG und Porsche Digital GmbH“, schreibt die „Heilbronner Stimme“. Der Stuttgarter Autobauer plant, seinen Digital Campus langfristig auf weitere Standorte in Europa sowie Nordamerika und Asien auszuweiten – wobei die Einmietung in den Heilbronner KI-Stadtteil den Anfang markiert. Die Stadt Heilbronn bezeichnet den Innovationspark als „das größte Ökosystem für Künstliche Intelligenz (KI) in Europa“. Etwa 23 Hektar groß soll der Innovationspark am Standort Steinäcker werden – ein kreisrunder KI-Stadtteil, der nach Fertigstellung Platz für rund 5.000 Beschäftigte bietet. Insgesamt sollen auf dem Gelände laut Entwurf über 30 Gebäude entstehen. Geplant ist ein Baustart im Jahr 2024. Das Thema Künstliche Intelligenz wird immer präsenter und auch für Unternehmen, die Arbeitswelt und auch im Alltag immer relevanter. Bereits jetzt nutzen Firmen KIs im Alltag – darunter auch Aldi."
15bda0e7-f7fe-44a9-bf27-42ef5788876b,2023-06-03 03:00:00+00:00,"Man kennt sie – die Branchen, die gut zahlen und die Unternehmen, deren klingende Namen gut für den Lebenslauf sind. Erst vor wenigen Tagen veröffentlichte der Personaldienstleister Randstad die attraktivsten Arbeitgeber Österreichs. Und zwar aus Sicht potenzieller Bewerberinnen und Bewerber. Ganz oben auf der Liste: AVL List, Siemens und Porsche. Firmen mit viel Prestige und offenbar auch vielen Vorteilen, da Gehalt und Sozialleistungen für die Befragten zu den wichtigsten Kriterien zählten. Eine Grundvoraussetzung, um heute als attraktiver Arbeitgeber zu gelten, ist das aber nicht. Das beweisen zwei heimische Unternehmen, deren Bedingungen schwierig sein mögen – das Problem der Personalnot aber nur aus den Erzählungen anderer kennen. Gesundes Wachstum Start-ups rangieren für qualifizierte Bewerber oft auf den unteren Rängen der Beliebtheit. Personal wird schnell aufgebaut, in schlechten Zeiten rigoros abgebaut (Stichwort Bitpanda und GoStudent) und nach erfolgreichem Unternehmensverkauf ohne Gewinnbeteiligung mit leeren Händen stehen gelassen (wobei sich das ab 2024 bessern soll). Attraktiv klingt anders, weshalb der Linzer Software-Entwickler teamecho einen anderen Weg eingeschlagen hat. „Das Letzte, was wir wollen, ist, zu viele Mitarbeiter aufzubauen und dann kündigen zu müssen“, sagt Co-Gründer Markus Koblmüller. Wachstum passiere nur, wenn es die ökonomische Lage zulasse. Aktuell wird die Größe von 30 Mitarbeitern gehalten. Und das mit überaus attraktiven Angeboten. © Teamecho David Schellander (links) und Markus Koblmüller achten in ihrem Start-up auf ausreichend Flexibilität © teamecho teamecho 30 Mitarbeiter sind bei teamecho beschäftigt. Die meisten in Linz, manche auch in Wien 35-Stunden-Woche 2021 führte das Unternehmen die 35-Stunden-Woche bei vollem Gehalt ein, die auf vier oder fünf Tage aufgeteilt werden kann. Kombiniert wird diese mit flexibler Arbeitszeit: „Das heißt bei uns: Gleitzeit ohne Kernarbeitszeit“, erklärt Koblmüller. Mitarbeiter dürften völlig frei einteilen, wann sie arbeiten möchten, sofern keine Zusatzkosten anfallen (z. B. bei Nachtarbeit). Da 50 Prozent der Arbeitszeit im Homeoffice verrichtet wird, kommt das Team, auf Einladung der Firma, einmal monatlich zu einem Event zusammen. Jedoch handelt es sich bei diesen Vorteilen um reine Hygienefaktoren, merkt Koblmüller an. „Das ist aus unserer Sicht nur die halbe Miete, weil es auch die richtigen Motivatoren braucht.“ Um diese zu erfassen, setzen sie ihr eigens programmiertes Stimmungsbarometer ein, das gleichzeitig das Geschäftsmodell des Start-ups ist. teamecho Die Firma: teamecho ist ein 2015 gegründeter Software-Entwickler mit Sitz in Linz. Es entwickelte ein digitales Stimmungsbarometer, das die Mitarbeiterzufriedenheit anonym erhebt Attraktiv weil: 35-Stunden-Woche, Flexibilität, Afterwork-Events, gesundes Unternehmens-Wachstum „Wir versuchen, eine Vorreiterrolle einzunehmen, weil wir auch unsere Kunden unterstützen wollen, ein guter Arbeitgeber zu sein“, sagt Koblmüller. Das Barometer analysiert Mitarbeiterzufriedenheit, Betriebsklima und Unternehmenskultur. Im vergangenen Jahr beobachtete das Gründerteam im eigenen Unternehmen einen Trend nach oben. Ein Indiz, dass Mitarbeiter hier auch weiterhin arbeiten und bleiben wollen. Einfach menschlich Bei Matthias Wirl, Inhaber des Familienunternehmens Wäscherei Wirl bleiben die Mitarbeiter auch. Manche sogar länger als der 34-Jährige alt ist. Warum? An den vielen Vorteilen kann es nicht liegen, denn „die Arbeit, die wir machen, ist nicht leicht, nicht gut bezahlt und hat eigentlich nicht viel zu bieten“, gesteht sich Wirl ein. Eine Arbeitszeitreduktion ist bei einer Wäscherei, die auch am Wochenende und feiertags wäscht, kaum drin. Die Frage nach Homeoffice- oder Remote-Arbeit stellt sich für diese Art der Tätigkeit ebenso wenig. © KURIER/Jeff Mangione 56 Mitarbeiter sind bei der Otto Wirl GmbH in 1220 Wien beschäftigt, viele davon aus Ungarn © KURIER/Jeff Mangione Matthias Wirl führt seine Wäscherei in vierter Generation – die klassischen Benefits kann er nicht bieten, dafür ein familiäres Umfeld Dennoch: An Personal mangelt es dem Inhaber in vierter Generation nicht. Braucht er neue Mitarbeiter, findet sich im Handumdrehen jemand. Meist angeworben durch die eigenen Angestellten. „Die Mitarbeiter sind bei mir wohl so zufrieden, dass sie die Arbeit auch ihrer eigenen Familie antun wollen“, scherzt Wirl. Sein größter Fokus liegt auf dem Betriebsklima und dem guten Miteinander. Braucht ein Mitarbeiter spontan frei, muss früher gehen oder will Zeitausgleich konsumieren, versucht Wirl allen Wünschen nachzukommen. „Das ist alles ganz unterschwellig und unkompliziert bei uns.“ Denn er weiß: Mitarbeiter, die bei ihm angestellt sind, werden andernorts oft schlecht behandelt. Er aber bietet Unterstützung, wenn Amtsbriefe eintrudeln und nicht verstanden werden. Oder wenn sich die Wohnungssuche als schwierig gestaltet. Die Mitarbeiter wissen das zu schätzen: Als Wirl mit seiner Firma schwierige Zeiten durchlebte, sollen manche angeboten haben, gratis zu arbeiten. „Das hat mich gerührt“, erzählt Wirl. Wäscherei Wirl Die Firma: Wäscherei Wirl ist ein 1930 gegründetes Familienunternehmen, das bis zu zehn Tonnen Wäsche pro Tag reinigt und mit acht LKW an Kunden in Wien, Niederösterreich und Burgenland ausliefert Attraktiv weil: Menschliches Miteinander und wertschätzender Umgang, flexibles Eingehen auf persönliche Bedürfnisse, Team darf sich Dienste untereinander ausmachen, gute Arbeitsbedingungen stehen immer vor potenziellem Zusatz-Gewinn Keine Gewinn-Geierei „Es ist ein Centgewerbe. Zu schauen, dass jeder leistet, was er leisten muss und dazwischen menschlich und sozial sein, ist ein schwieriger Spagat“, berichtet Wirl. Ein Spagat, der ihm nur gelingt, weil er sein eigener Eigentümer ist, sagt er. Große Kunden, die viel einfordern, aber nicht angemessen zahlen, lehnt er ab. „Ich muss nicht jedes Jahr 100.000 Euro Gewinn machen. Mir ist lieber, es geht sich alles aus und die Kosten sind gedeckt.“"
b657d98f-c9ae-42d4-a822-c85eae29459b,2023-06-05 06:54:28+00:00,"Der europäische Betreiber von Schnellladesäulen Ionity passt zur Sommerzeit die Konditionen seines Abonnement-Modells „Ionity Passport“ an. Die Monatsgebühr wird günstiger, dafür steigen die Kosten pro Kilowattstunde Strom. An den bisherigen 0,79 Euro/kWh für das Ad-hoc-Laden ändert sich nichts. Das Passport-Abo wurde im Oktober 2021 eingeführt. Für Neuabschlüsse ab dem 6. Juni entfällt die Mindestvertragslaufzeit von bisher zwölf Monaten. Der Ionity Passport ist nun mit einer Frist von einem Monat kündbar, damit soll er sich auch für einzelne Monate mit langen Fahrten, etwa für den Urlaub, rechnen. Die Monatsgebühr sinkt von 17,99 auf 11,99 Euro. Bisher konnten Ionity-Kunden gegen die 17,99 Euro den Ladepreis deutlich auf 35 Cent pro Kilowattstunde (kWh) senken. Mit dem neuen Preismodell liegen die Konditionen pro geladener Kilowattstunde Strom „immer 20 Cent unter dem aktuell gültigen Tarif Ionity Direct“. Wer beispielsweise mit Ionity Passport in Deutschland lädt, zahlt 0,59 Euro/kWh statt dem Ad-hoc-Preis in Höhe von 0,79 Euro/kWh. Abweichungen von diesem Preis können sich in einigen europäischen Ländern aufgrund der jeweiligen Landeswährung, länderspezifischer Mehrwertsteuersätze oder lokaler Besonderheiten ergeben. Das Passport-Abo lässt sich über die Ionity-eigene Smartphone-App buchen. Das Unternehmen wirbt, dass sich das Abo im Vergleich zum Ionity-Direct-Tarif (0,79 Euro/kWh) schon ab 60 kWh pro Monat rechne. Das entspreche „rund zwei Ladevorgängen oder einer Strecke von 300 Kilometern (km) mit einem Elektroauto bei einem durchschnittlichen Verbrauch von 20 kWh/100km“. Ionity Passport berücksichtige „die veränderten Markt- und Kundenanforderungen“, heißt es von Ionity zur Begründung für das neue Preismodell. Das von den Autoherstellern BMW, Ford, Mercedes-Benz und Volkswagen mit Audi und Porsche gegründete Unternehmen betreibt derzeit nach eigenen Angaben mehr als 480 „Ladeparks“ mit über 2300 HPC-Ladepunkten in 24 Ländern. Jeder Ladepunkt biete bis zu 350 kW Ladeleistung."
83319b2b-5f7c-4b47-82f2-8e1a2ed8b81b,2023-06-06 02:15:00+00:00,"Hamburg. Der Sportwagenbauer errichtet in Rahlstedt seinen dritten Standort in der Stadt. Und setzt dabei ungewöhnliche Autohaus-Ideen um. Porsche baut in Hamburg einen dritten Standort. Am Montag startete das Vorhaben mit einem symbolischen Spatenstich. Mit dem Neubau des „Porsche Approved Service Zentrums“ in Rahlstedt stärke das Unternehmen seine Präsenz in der Hansestadt und erweitere sein Serviceangebot für den Hamburger Osten, teilte der Sportwagenhersteller mit. Die Eröffnung ist für September 2024 geplant. Bei dem Zentrum in der Victoriaallee handelt es sich den Angaben zufolge um ein neues Standortformat, dessen Fokus auf Werkstattservice, Elektromobilität und dem Verkauf von Gebrauchtwagen liegt. Mit der Etablierung des neuen Formats untermauere der Stuttgarter Autobauer die Bedeutung von Hamburg als Standort mit langer Porsche-Tradition. Porsche: In Hamburg werden Sportwagen künftig mit Regenwasser gewaschen Neben den bestehenden Porsche-Zentren in der Stadtmitte sowie im Nordwesten Hamburgs schaffe das Unternehmen auf einem Grundstück von rund 8500 Quadratmetern einen weiteren Anlaufpunkt für bestehende und neue Kunden. Mit der Eröffnung würden rund 30 Beschäftigte in den Bereichen Gebrauchtwagen sowie Service & Ersatzteile neu eingestellt. „Wir sind sehr glücklich darüber, die Porsche-Familie mit einem dritten Standort in Hamburg zu vergrößern und unseren Kundinnen und Kunden in der Metropolregion noch näher zur Seite zu stehen“, sagte Steffen Knies, Vorsitzender der Geschäftsführung der Porsche-Niederlassung Hamburg. Das Grundstück in Rahlstedt habe durch die gute Anbindung und die Nähe zur Autobahn eine „sehr attraktive Lage“. Steffen Henssler: Profi-Diebe stehlen wertvollen Porsche des TV-Kochs A7: Rätselhaft: Warum kam der Porsche von der Überholspur ab? Tankstellen in Hamburg: Immer mehr bieten Autostrom an Das Servicezentrum setze „neue Maßstäbe in puncto Nachhaltigkeit“, heißt es. So komme man durch die Nutzung von aufbereitetem Regenwasser für die Fahrzeugwäsche in der Regel ohne Frischwassereinsatz aus. Auf den Dächern mit „insektenfreundlicher Bepflanzung“ sei eine Fläche von fast 1000 Quadratmetern mit Photovoltaik-Modulen belegt. Porsche: Rund 10.000 Autos der Marke sind in Hamburg zugelassen Dabei wird der Solarstrom auch für die Aufladung von Elektrofahrzeugen genutzt: Vier Schnellladeplätze seien öffentlich zugänglich und rund um die Uhr nutzbar, heißt es. Zusätzlich stünden den Kundinnen und Kunden des Zentrums sieben exklusive Wechselstrom-Ladeplätze zur Verfügung."
ec5a38b6-2e33-406a-b5d4-37289d02cdaf,2023-06-06 08:43:33+00:00,"Der Hobby-Rennfahrer Misha Charoudin, der nach einem Test auf dem Nürburgring vor kurzem gefährliche Instabilität des Model S Plaid beim Beschleunigen kritisierte, ist nach eigenen Angaben keineswegs ein Tesla-Hasser – aber trotzdem sät er Zweifel an dem Nordschleifen-Rekord, den das Unternehmen am Samstag mit diesem Elektroauto meldete. In einem Instagram-Beitrag nach der Tesla-Meldung wiederholte er, dass die serienmäßige Federung des Model S Plaid „schrecklich“ sei, und schrieb teslamag.de auf Nachfrage, „definitiv“ sei sie bei der Rekord-Fahrt nicht genutzt worden. Außerdem soll die Tesla-Bestzeit ohnehin schon von einem anderen Serien-Elektroauto geschlagen worden sein. Tesla laut Ring-Betreiber regelkonform Zunächst einmal ist dazu festzuhalten, dass der bislang nur von Tesla gemeldete Nordschleifen-Rekord für serienmäßige Elektroautos tatsächlich offiziellen Charakter hat. Das stand zwar auch am Dienstag noch nicht als Meldung auf der Nürburgring-Seite, aber der Sprecher der Betreiber-Gesellschaft bestätigte es auf telefonische Nachfrage; zudem ist unter der Rubrik Rekordzeiten für „Elektro (Serie)“ zumindest das Video von der Plaid-Fahrt zu sehen. Nachdem ein Model S Plaid im September 2021 eine offizielle Nordschleifen-Bestzeit gefahren war und Porsche sie knapp ein Jahr später mit einem Taycan Turbo S unterbot, hat also jetzt wieder Tesla die Nase vorn. Zu der Behauptung von Charoudin, das verwendete Model S sei nicht im Serienzustand gewesen, sagte der Nürburgring-Sprecher, das sei überprüft worden. Eine vorherige Abnahme durch den TÜV stelle in dieser Klasse sicher, dass das jeweilige Fahrzeug der Serie entspricht und dass es für den Straßenverkehr zulassungsfähig ist, und die Organisation nehme diese Prüfungen sehr genau. Konkret zu den Reifen an dem Rekord-Tesla sagte der Sprecher, ein E-Prüfzeichen darauf belege, dass sie für den Straßenverkehr zugelassen und damit auch für die Serienklasse regelkonform seien. Die von Charoudin angezweifelte Rekordzeit dürfte also Bestand haben. Zusätzlich schrieb der YouTuber auf Instagram aber, ohnehin sei sie schon wieder gebrochen. Bekannt gegeben werde das wahrscheinlich bald „am 75. Geburtstag von jemandem/etwas“. Damit ist offensichtlich Porsche gemeint, das an diesem Donnerstag den 75. Jahrestag der Zulassung des 356 als dem ersten Sportwagen des Unternehmens feiert. Tatsächlich wurden auf dem Nürburgring bereits Exemplare des Taycan mit auffälligem Heckflügel gesehen. Nach Gerüchten handelt es sich dabei um eine kommende GT-Version des Porsche-Elektroautos mit 1000 PS, also in der Nähe des Plaid-Tesla. Neuer Porsche-Rekord mit Taycan erwartet Theoretisch wäre denkbar, dass Porsche einen bereits gefahrenen Nordschleifen-Rekord bis später in dieser Woche zurückhält, um ein besonderes Highlight für den Jahrestag bieten zu können. Der Nürburgring-Sprecher versicherte allerdings, ihm sei nichts dergleichen bekannt, und normalerweise werde er zumindest eine Woche vorher in die Kommunikationsplanung einbezogen."
b256ca40-7d5b-476c-980f-14718fe5beab,2023-06-08 04:00:54+00:00,"Um Praktika kommt heutzutage kein Absolvent herum. Oft sind diese nicht wirklich lukrativ vergütet. Mercedes, Porsche und Co. zahlen ihren Praktikanten aber offenbar ein enorm gutes Gehalt. Was die Stationen für Berufsanfänger noch attraktiver macht. In der Auto-Hauptstadt Deutschlands, Stuttgart, bewerben sich jährlich Tausende junge Menschen in der Hoffnung auf einen begehrten Platz bei einem der führenden Auto-Unternehmen. Die attraktive Vergütung bei den prestigeträchtigen Firmen ist nur einer der vielen Anreizpunkte. Mercedes, Porsche, Bosch und Co. zahlen ihren Praktikanten nämlich teils enorme Löhne. Der beste Start für die Karriere in der Automobilindustrie Die Automobilbranche ist in Deutschland nicht nur die prestigeträchtigste, sie ist auch mit die finanziell stärkste. Hohe Gehälter für alle Mitarbeiter quer durch die Unternehmen, die international anerkannte, hochwertige Karossen herstellen, sind hier an der Tagesordnung. Wer das Glück hat, eine Stelle in der Fahrzeugentwicklung, -technologie oder -fertigung zu erhalten, kann meist mit einem hohen Startgehalt rechnen. Junge Facharbeiter sind da Gold wert und um diese anzuwerben, bieten die Autohersteller attraktive Startlöhne. So zahlt nicht nur Mercedes bereits seinen Praktikanten ein überdurchschnittlich hohes Anfangsgehalt. Dementsprechend lohnt es sich für die Auszubildenden gleich in doppelter Hinsicht. Sie bekommen die Möglichkeit, in einem traditionsreichen Automobilunternehmen wertvolle Erfahrungen zu sammeln und gleichzeitig ein gutes Gehalt zu verdienen. Mercedes und Co. sind bei jungen Arbeitnehmern äußerst beliebt Bei einem der führenden Autohersteller gearbeitet zu haben, kann einem jungen Uni-Absolventen in der Zukunft viele Türen öffnen. Selbst wenn es sich “nur” um ein Praktikum gehandelt hat. Zudem bieten viele Unternehmen ihren Praktikanten auch hohe Übernahmechancen und Festanstellungen an. Ein weiterer Bonus neben der attraktiven Vergütung. Die Vergütung variiert von Unternehmen zu Unternehmen und ist abhängig von der Art des Praktikums. Weitere Punkte wie Vorerfahrungen, der Standort und die Abteilung kommen selbstverständlich noch hinzu. Mercedes liegt dabei beim Gehalt, welches das Unternehmen seinen Praktikanten zahlt, im oberen Drittel. Zwischen 12.500 Euro und 24.900 Euro sind hier drin. Porsche bewegt sich in einem ähnlichen Spektrum. Angehende Praktikanten können hier ein Gehalt zwischen 12.500 Euro und 27.300 Euro erwarten. Lediglich bei Bosch gibt es im Vergleich dazu etwas weniger, und zwar durchschnittlich 15.400 Euro brutto im Jahr."
271cf841-adfd-4caf-bc6a-54a1c5349ade,2023-06-08 12:30:39+00:00,"1948 entwickelte Ferry Porsche den ersten Porsche-Sportwagen. Seitdem ist die Marke im Motorsport und Luxussegment nicht mehr wegzudenken. Nun muss das Unternehmen die Wende zur Elektromobilität meistern. Michael Brauns ""Goldstück"" braucht einen Moment, dann blubbert der 75 PS starke Motor los und weißer Rauch entweicht zwei kleinen Rohren am Heck des Wagens. Im Leerlauf gibt der ehemalige Besitzer einer Sanitärfirma etwas Gas und drückt dann den zierlichen Gangwahlhebel nach vorne. Der Wagen rollt durch Stuttgart-Zuffenhausen am Porsche-Sitz vorbei. Am Ortsausgang gibt Braun Gas und ist kaum noch zu verstehen. ""Das ist Leidenschaft. Das ist der Fahrspaß an Porsche. Der Motor ist das, was wir gerne hören beim Fahren"", schwärmt er und strahlt. Ein Radio gibt es in seinem ""Goldstück"", das eigentlich dunkelgrün ist, daher nicht. Anfänge in Österreich, Durchbruch in Stuttgart Bis 1966 baute Porsche insgesamt 77.766 Fahrzeuge mit dem Zahlenkürzel 356, die ersten 52 noch im österreichischen Gmünd. ""Ferry Porsche suchte nach einem leichten, effizienten Fahrzeug, das die Energie bestmöglich umwandelt in Fahrdynamik"", erzählt der Leiter des Porsche Museums in Stuttgart, Achim Stejskal. Im Museum laufen die letzten Arbeiten vor Beginn der Sonderausstellung zum 75-jährigen Jubiläum. ""Und das war der 356, ein 585 Kilogramm schweres Leichtbaufahrzeug aus Aluminium mit einem modifizierten Käfer-Motor, den es damals schon gab mit 35 PS."" Der erste Prototyp wurde am 8. Juni 1948 zugelassen - die Geburtsstunde von Porsche Sportwagen. Bald darauf erblickt auch der erste Porsche 911 das Licht der Welt. Kein Modell steht so sehr für Porsche, wie der 911. Der 911er als Symbol der ganzen Marke Neue technische Entwicklungen, die zuvor im Motorsport getestet wurden, hielten Einzug. ""Das Fahrzeug fuhr schneller, es fuhr eleganter. Es hatte mehr Platz, mehr Pferdestärken"", sagt Museumsleiter Stejskal. ""Das Fahrzeug konnte man, so hat es Ferry Porsche einmal sehr eindrucksvoll gesagt, in der afrikanischen Wüste fahren, aber eben auch auf den Straßen von New York."" Der 911 stehe symbolisch für all das, was Porsche ausmache, so Stejskal: ""Kraft, Dynamik, aber auch Design und Sportlichkeit gepaart mit Alltagstauglichkeit."" Der Porsche 911 ist längst zum Symbol des Stuttgarter Autobauers geworden. Und so verwundert es auch nicht, dass Porsche für seinen Börsengang im vergangenen Jahr das Kürzel ""P911"" ausgewählt hat. Es ist eine Zahlenkombination, die international funktioniert. Wertvoller als Konzernmutter Volkswagen ""Porsche verfolgt eine wertorientierte Unternehmensstrategie"", sagt Helena Wisbert von der Ostfalia Hochschule für angewandte Wissenschaften in Braunschweig. ""Sie produzieren also immer ein Fahrzeug weniger, als es der Markt gerne wünscht. Das funktioniert im Luxus- und Sportwagensegment sehr gut"", erläutert die Professorin für Automobilwirtschaft. Seit dem Börsengang im vergangenen September haben sich die Porsche Wertpapiere um mehr als 40 Prozent im Wert gesteigert. Das Unternehmen ist auf dem Papier inzwischen wertvoller als der Autoriese Volkswagen. Mit Blick auf das Verbrenner-Aus im Jahr 2035 in der EU sieht Wisbert aber noch einiges zu tun: ""Porsche steht jetzt sehr gut da, aber das ist eben noch diese alte klassische Verbrennerwelt. Und in Zukunft hat Porsche eben diese große Transformation in Richtung Elektromobilität noch vor sich."" 80 Prozent E-Fahrzeuge bis 2030 Aktuell bieten die Stuttgarter nur einen vollelektrischen Porsche an, den Porsche Taycan. In der sportlichsten Variante fährt der Sportwagen mit umgerechnet 761 PS. Je nach Modell sollen die Kunden mit einer Batterieladung bis zu 500 Kilometer weit kommen. Im Realbetrieb werden es wohl deutlich weniger sein. Porsche habe noch einen weiten Weg vor sich, ist sich Automobilexpertin Wisbert sicher, denn: ""Der Taycan als vollelektrisches Auto macht jetzt gerade elf Prozent des Absatzes von Porsche aus."" Bis 2030 wollen die Stuttgarter aber 80 Prozent der Neuwagen mit Elektroantrieb ausliefern. Oldtimer-Fan Michael Braun in Stuttgart findet diesen Schritt richtig: ""Die Elektrotechnik wird die Zukunft sein. Die Elektrotechnik bringt so viel Leistung. Da brauchen sie keinen Verbrennermotor mehr."" Ihm selbst, gibt er zu, würde aber wohl bei der lautlosen Fortbewegung etwas fehlen. Das Blubbern seines historischen Porsche 356 4-Zylinders ist eben etwas ganz Besonderes."
cd0dcedc-7573-4097-b6cf-5796aa33a4d9,2023-06-08 19:02:19+00:00,Mission X. Porsche
