830fbc8d-feee-4571-875c-9520bd1d967c,2023-02-20 08:14:43,"Automobil Der Porsche 356 wird 75 Anbieter zum Thema Der Porsche 356 feiert sein 75-jähriges Jubiläum. Er ist das erste Modell von Porsche und gleichzeitig die Keimzelle für den Aufstieg zur volumenstärksten Sportwagenmarke der Welt – ein Rückblick. Zu gerne wäre er in jungen Jahren Rennfahrer geworden, aber Ferry Porsche fügte sich dem Verbot seines Vaters, des spätestens durch die Konstruktion des Volkswagen Käfer und der Auto-Union-Silberpfeile legendären Ingenieurs Ferdinand Porsche. Vor 75 Jahren wurde Ferrys Traum vom eigenen Sportwagen mit Motorsport-Genen dann doch Wirklichkeit, realisiert in einer Baracke im österreichischen Gmünd: Dort debütierte der Typ 356 „Nr. 1“ Roadster als erster jemals gebauter Porsche. Bildergalerie Bildergalerie mit 12 Bildern Mehr noch, dieser Racer mit Mittelmotor und Gitterrohrrahmen, ansonsten aber lediglich modifizierten VW-Käfer-Komponenten, setzte die Keimzelle für den Aufstieg von Porsche zur volumenstärksten Sportwagenmarke der Welt. 1948/49: Produktionsbeginn des Porsche 356 Bereits vom Winter 1948/49 an wurden in Gmünd die Modelle Porsche 356/2 Coupé und Cabriolet in Serie gebaut, jetzt aber mit Heckmotor. Für diesen Serienanlauf benötigte das junge Unternehmen Geld, deshalb hatte Porsche den Roadster mit der berühmten Fahrgestellnummer 356-001 schon am Tag der Zulassung für 7.000 Franken an den Schweizer Unternehmer Rupprecht von Senger verkauft. Tatsächlich faszinierte das Sportgerät mit robuster Käfertechnik von Senger so sehr, dass er noch 1948 gemeinsam mit dem Schweizer Autohändler Bernhard Blank eine Bestellung über 50 Porsche 356 platzierte. Nun kam die Karriere des Porsche 356 richtig in Fahrt, kontinuierlich beschleunigt durch spektakuläre Rennsiege, die 1950 nach Stuttgart verlagerte Produktion und durch immer schnellere Varianten wie den Speedster. Nicht erst der 911, sondern schon der frühe 356 sicherte Porsche weltweiten Ruhm – als Marke, die wie sonst nur Ferrari auf eine lückenlose Rennhistorie blicken kann. Siegreiche Rennhistorie „Rennsiege sind gut fürs Geschäft“, nach diesem Motto feierte der Porsche Nr. 1 seine Pressevorstellung am 4. Juli 1948 im Umfeld des Grand Prix der Schweiz in Bern – bevor er wenige Tage später in Innsbruck vor größerem Publikum sein erstes Rundstreckenrennen gewann. Dem 585 Kilogramm leichten Mittelmotor-Roadster genügte ein auf 26 kW/35 PS frisierter VW-Boxermotor, um weitaus stärkere Rivalen zu schlagen. Nach Innsbruck gab es kein Halten mehr, kaum ein Klassiker, den der Porsche 356 nicht erfolgreich bestritt: Die 24 Stunden von Le Mans ebenso wie die Mille Miglia, Targa Florio oder die Carrera Panamericana. Und im französischen Montlhéry erzielte Richard Frankenberg 1951 mit einem 356 SL den ersten Langstrecken-Weltrekord für Porsche, aber auch für das Nachkriegs-Deutschland. Im Jahr 1952 konnte Porsche stolz auf 75 Siege verweisen, 24 Monate später betrug die Ausbeute bereits damals unfassbare 420 Erfolge. Tatsächlich war der Porsche-Vierzylinder eine sensationell zuverlässige Fahrmaschine, mit der Porsche sofort in die Phalanx schneller und oft dramatischer geformter Freudenspender einbrach, die meist Alfa-, Austin-Healey-, Jaguar- oder Triumph-Logos trugen. Urheberrecht Streit um Porsche-911-Design geht weiter Porsche wird zum Kult in Amerika „Win on Sunday, sell on Monday“, diesem Credo folgten die Sportwagen-süchtigen Amerikaner noch mehr als die Europäer – und da kam der 3,87 Meter kleine Porsche 356 gerade recht. Im Herbst 1950 übernahm der ehemalige Rennfahrer und erfolgreiche New Yorker Autoimporteur Maximilian Hofman den US-Vertrieb der als „German Automotive Jewel“ angepriesenen Porsche Sportwagen. Ob in Watkins Glen oder auf Racetracks in Kalifornien, die kostspieligen, aber flinken „Cars for Connaisseurs“ mit ihren kleinen luftgekühlten Boxeraggregaten setzten neue Dynamik-Maßstäbe im Startfeld leistungsstärkerer Sechs- und Achtzylinder. Porsche wurde Kult in Amerika, und so überraschte es nicht, dass auch Hollywood-Stars und Hobby-Racer wie James Dean und Steve McQueen den 1954 aufgelegten 356 Speedster erwarben. Selbst in einem Muscle-Car-Kino-Epos wie „Bullit“ durfte ein 356 Cabriolet nicht fehlen und obwohl Blues-Idol Janis Joplin eine Hymne gegen den Konsum sang: „My friends all drive Porsches“, besaß sie selbst einen psychedelisch bemalten Porsche 356. Automobiler Sympathieträger Ursprünglich hofften Ferry Porsche und sein Team auf eine Serie von rund 500 Porsche 356; tatsächlich wurden es bis zum Produktionsende im Jahr 1965 fast 78.000 Exemplare der in rundliche Formen gekleideten Sportler. Für das Design des Ur-356 zeichnete Erwin Komenda verantwortlich, der schon die Konturen des VW Käfer geprägt hatte. Vor allem aber war der Typ 356 ein Sportwagen nach dem persönlichen Geschmack von Ferry Porsche, wie dieser einmal erklärte. Jetzt Newsletter abonnieren Verpassen Sie nicht unsere besten Inhalte Geschäftliche E-Mail Bitte geben Sie eine gültige E-Mailadresse ein. Mit Klick auf „Newsletter abonnieren“ erkläre ich mich mit der Verarbeitung und Nutzung meiner Daten gemäß Einwilligungserklärung (bitte aufklappen für Details) einverstanden und akzeptiere die Nutzungsbedingungen. Weitere Informationen finde ich in unserer Datenschutzerklärung. Aufklappen für Details zu Ihrer Einwilligung Stand vom 15.04.2021 Es ist für uns eine Selbstverständlichkeit, dass wir verantwortungsvoll mit Ihren personenbezogenen Daten umgehen. Sofern wir personenbezogene Daten von Ihnen erheben, verarbeiten wir diese unter Beachtung der geltenden Datenschutzvorschriften. Detaillierte Informationen finden Sie in unserer Datenschutzerklärung. Einwilligung in die Verwendung von Daten zu Werbezwecken Ich bin damit einverstanden, dass die Vogel Communications Group GmbH & Co. KG, Max-Planckstr. 7/9, 97082 Würzburg einschließlich aller mit ihr im Sinne der §§ 15 ff. AktG verbundenen Unternehmen (im weiteren: Vogel Communications Group) meine E-Mail-Adresse für die Zusendung von redaktionellen Newslettern nutzt. Auflistungen der jeweils zugehörigen Unternehmen können hier abgerufen werden. Der Newsletterinhalt erstreckt sich dabei auf Produkte und Dienstleistungen aller zuvor genannten Unternehmen, darunter beispielsweise Fachzeitschriften und Fachbücher, Veranstaltungen und Messen sowie veranstaltungsbezogene Produkte und Dienstleistungen, Print- und Digital-Mediaangebote und Services wie weitere (redaktionelle) Newsletter, Gewinnspiele, Lead-Kampagnen, Marktforschung im Online- und Offline-Bereich, fachspezifische Webportale und E-Learning-Angebote. Wenn auch meine persönliche Telefonnummer erhoben wurde, darf diese für die Unterbreitung von Angeboten der vorgenannten Produkte und Dienstleistungen der vorgenannten Unternehmen und Marktforschung genutzt werden. Falls ich im Internet auf Portalen der Vogel Communications Group einschließlich deren mit ihr im Sinne der §§ 15 ff. AktG verbundenen Unternehmen geschützte Inhalte abrufe, muss ich mich mit weiteren Daten für den Zugang zu diesen Inhalten registrieren. Im Gegenzug für diesen gebührenlosen Zugang zu redaktionellen Inhalten dürfen meine Daten im Sinne dieser Einwilligung für die hier genannten Zwecke verwendet werden. Recht auf Widerruf Mir ist bewusst, dass ich diese Einwilligung jederzeit für die Zukunft widerrufen kann. Durch meinen Widerruf wird die Rechtmäßigkeit der aufgrund meiner Einwilligung bis zum Widerruf erfolgten Verarbeitung nicht berührt. Um meinen Widerruf zu erklären, kann ich als eine Möglichkeit das unter https://contact.vogel.de abrufbare Kontaktformular nutzen. Sofern ich einzelne von mir abonnierte Newsletter nicht mehr erhalten möchte, kann ich darüber hinaus auch den am Ende eines Newsletters eingebundenen Abmeldelink anklicken. Weitere Informationen zu meinem Widerrufsrecht und dessen Ausübung sowie zu den Folgen meines Widerrufs finde ich in der Datenschutzerklärung, Abschnitt Redaktionelle Newsletter. Ein Auto, das schon 1950 so viel kostete wie gleich zwei Volkswagen Käfer und das deshalb für die allermeisten Deutschen auch in Jahren des Wirtschaftswunders ein ewiger Traum blieb. Aber Porsche gelang das Kunststück, den kostspieligen 356 als automobilen Sympathieträger gesellschaftlich zu verankern. Dazu trugen nicht nur die internationalen Sporterfolge bei, ebenso wichtig waren die über 700 Auftritte des Porsche 356 auf Kino-Leinwänden und in frühen TV-Sendungen. Nicht zu vergessen die zahllosen Porsche-Spielzeugautos, die Kinderzimmer eroberten oder die schnellen Porsche 356 im Polizeidienst. Kontinuierliche technische und optische Modifikationen „Das Auto für heute und übermorgen“, lautete ein Werbeslogan. Damit der 356 diesem Anspruch gerecht wurde, spendierte Porsche seinem ersten Erfolgsträger kontinuierliche technische und optische Modifikationen. War etwa der Ur-356er an der zweigeteilten Mittelscheibe erkennbar, wurde diese ab 1952 durch eine einteilige Scheibe ersetzt. Zur Freude der stets leistungshungrigen Porsche-Fans folgten auf den Porsche mit 1,1-Liter-Vierzylinder ein 160 km/h schneller 1300 S, eine 1,5-Liter-Version – damals die Obergrenze für wichtige Rennkategorien – und schließlich der 51 kW/70 PS leistende 1500 S mit einer Nockenwelle, die der spätere Unternehmenschef Ernst Fuhrmann entwickelt hatte. Im Herbst 1955 löste der umfassend weiterentwickelte 356 A mit Panorama-Frontscheibe den Ur-356 ab. Unter der hinteren Haube arbeiteten jetzt auch 1,6-Liter-Boxer als 1600 Super mit respektablen 55 kW/75 PS, der 1500 GS Carrera knackte allerdings sogar die damals noch magische 100-PS-Marke. Mit so viel Power katapultierte sich der 356 Carrera in den kleinen Club der 200-km/h-Supercars. Als Sonnenkönige sorgten dagegen weiterhin Cabriolet und Speedster mit flacher Frontscheibe für Furore. Aber auch die Evolutionsstufen Carrera B (1959-1963) und Carrera C (1963-1965) wirkten wie ein Jungbrunnen auf den 356. Den Höhepunkt seiner Karriere erreichte dieser Kultsportler deshalb erst, als sein Nachfolger vom Typ 911 schon in den Startlöchern stand. Elektromobilität Porsche will eigene E-Bike-Antriebe entwickeln Der erste deutsche Nachkriegssportwagen Welche historische Relevanz der Porsche 356 hat, erklärt Experte Frank Meißner von der Oldtimer-Bewertungsorganisation Classic Analytics: „Der 356 kann für sich den Titel Ur-Porsche in Anspruch nehmen, er war der erste deutsche Nachkriegssportwagen und seine legendäre Form lebt noch heute im aktuellen 911 fort. Mittlerweile ist es auch eher diese Form und weniger die reinen Fahrleistungen, die Oldtimerfans zum 356 greifen lassen. Und auch die Renditeaussichten: Zahlreiche 356er-Modelle durchbrechen heutzutage locker die 100.000-Euro-Schallmauer.“ (ID:49201995)"
675bc2ae-ca9c-4cc6-9b32-1d074153963e,2023-02-21 08:55:00,"Im zweiten Teil unserer Artikel-Serie beantwortet der ehemalige deutsche Tennisprofi Michael Berrer Fragen aus dem facettenreichen Themenbereich ""Mentale Gesundheit"". Ex-DTB-Spieler Michael Berrer ist voll im Leben nach der Tenniskarriere angekommen. Der heute 42-jährige Stuttgarter, der in seiner aktiven Sportlerlaufbahn bis auf Platz 37 des ATP-Rankings klettern konnte, arbeitet heute als Unternehmensberater und Mentalcoach. Zu seinen Klienten gehören Sportler als auch namhafte Unternehmen wie Porsche. Ziel ist es für Berrer immer, das Potential seiner Kunden so weit wie möglich auszuschöpfen. Auch tennisnet.com stand und steht der Davis-Cup-Starter Rede und Antwort. In einer mehrteiligen Artikel-Serie gibt der sympathische Baden-Württemberger Einblick und Expertisen zum Thema ""Mentale Gesundheit"". tennisnet.com: Beginnen wir die heutige Session mal mit einer richtig schönen Allgemeinfrage: Was kann man dennaus dem Sport ürs Leben mitnehmen? Michael Berrer: Ich glaube ganz, ganz viel. Zuallererst mal Motivation, sich Ziele setzen. Ich brauche schon im Leben ab und zu mal Ziele. Das kann man nicht immer machen. Ich bin kein Freund davon zu sagen: ‚Was wollen Sie in fünf Jahren mal sein?‘ Das finde ich in der heutigen Zeit ein bisschen komisch. Aber man kann ja natürlich auch so arbeiten. Auf jeden Fall: Zielsetzung ist ganz, ganz wichtig. Was motiviert mich? Was treibt mich morgens aus dem Bett? Das war beim Tennis ja ein „no brainer“. Also ich wusste, ich muss jetzt auf die Laufbahn gehen, weil ich will ja in drei Wochen mit Nadal drei Sätze spielen können. Also in Konsequenzen denken. Wenn ich das jetzt tu, dann habe ich da zwar keinen Bock drauf, aber ich muss es machen. Das ist das Gleiche wie: Ich muss eine Rechnung stellen, damit ich in drei oder in acht Wochen mein Geld auf dem Konto habe. Das mache ich nicht gerne, aber das muss ich einfach. Also das heißt, da so in diesen Ketten denken. Ein Sportler muss immer in Ketten denken, auch langfristig. Ich mache mit 16 Jahren das, damit ich mit 20 on top bin. Und wenn mal etwas nicht so klappt, wie es soll? Dann sind wir beim Thema Widerstandsfähigkeit. Wie gehe ich mit Rückschlägen um? Und das ist für mich eines der wichtigsten Themen. Ich merke immer, wie Menschen komplett aus dem Ruder geworfen werden, wenn mal was nicht so klappt. Aber mal ganz ehrlich: Im Tennis ist es ja nicht anders. Wenn du am Dienstag verlierst, spielst du am Samstag, wenn es blöd läuft, schon in der Quali beim nächsten Turnier. Also Chancen gibt es genug, und ich muss relativ schnell einen Mechanismus finden, wie ich damit umgehe. Und ich habe für mich halt gemerkt, das Erste ist mal die Akzeptanz, zu sagen, okay, es ist jetzt so. Keiner kann die Zeit mehr zurückdrehen. Vielleicht kann man mal kurz analysieren, woran es lag. „Lessons learned“ ist auch nicht ganz unwichtig, macht man in den seltensten Fällen. Und dann aber auch abhaken und sich wieder auf das Nächste vorbereiten oder die nächsten Dinge tun, damit es wieder erfolgreich wird. Es ist eigentlich ein ganz einfacher Prozess. Und dann kannst du auch geradezu nicht mehr in eine Negativ-Phase kommen, weil du bist ja schon wieder mit dem nächsten Spiel beschäftigt. Das finde ich ganz enorm wichtig. Man kann das Ganze ja vielleicht noch kleinteiliger sehen, weil im Endeffekt ist ja jeder Punkt, den man spielt eine Mini-Entscheidung. Wenn ich am Netz stehe, volliere ich jetzt nach rechts oder links? Und das kann natürlich in die Hosen gehen. Aber dann kann ich nicht sofort sagen, heute ist ein mieser Tag, sondern ich muss für den nächsten Punkt wieder ready sein. Das heißt, man muss sich da als Tennisspieler ja eigentlich ständig neu fokussieren, neu aufbauen. Und das ist ja sicher etwas, was man im im Privatleben wahnsinnig gut verwenden kann - oder auch im Berufsleben. Absolut. Ich glaube, das ist eben das Gute am Sport. Du hast einen Vorteil, du kriegst eine direkte Konsequenz. Du kriegst ein sofortiges Feedback. Manchmal ist es nicht so, aber in den meisten Fällen schon. Und ich bin ein großer Verfechter des richtigen Mindset, dazu gehört ein gutes körperliches Auftreten, egal wie es eigentlich gerade um einen steht. Wenn du morgens in die Firma kommst und da sitzen sechs Leute mit dir im Büro, und du bist richtig schlecht drauf. Natürlich kannst du dann einfach der sein, der die Energie von allen rauszieht. Das kann passieren. Ich erwarte aber schon von den Leuten zu 80 %, dass sie mit einem guten Mindset reinkommen. Und sich dann aber auch jemanden suchen, wo sie sich mal auskotzen oder ausheulen können. Und das hat halt auch viel mit der Selbst-Gesprächsführung zu tun. Es ist immer wieder erstaunlich, wenn du in unteren Ligen bei Verbandsspielern unterwegs bist. Da wird jeder Ball kommentiert, da wird nur negativ geredet. Und das sind Dinge, die muss man üben. Das heißt, man muss üben, positive Selbstgespräche zu führen. Weil du bist ja dein bester Freund. Und wenn ich einen Vortrag vor 600 Führungskräften halten muss, dann rutscht auch mir das Herz in die Hose. Aber dann? Dann stelle ich mir halt vor, wie das danach super sein wird und wie die alle froh sein werden. Dann gebe ich mir noch mal die Doppel-Faust wie auf dem Tennisplatz, gehe da rein und mach es. Und ganz ehrlich: das Schlimmste, was passieren kann, ist in den meisten Fällen nicht so, dass die Welt davon untergeht, sondern dass irgendwas halt nicht passt. Wenn man zu oft an das Schlimmste denkt, kann der Fokus ja nicht richtig ausgerichtet sein, oder? So ist es. Im Sport musst du sehr schnell den Fokus auf Dinge richten können und auch ausblenden. Das ist heutzutage schon schwierig, finde ich. Eine Sekunde da auf Instagram, dann da auf der Website, dann da, da, da, … Das ist für mich schon ein Learning, es zu schaffen, Dinge, die nicht relevant sind, auszublenden und sich auf die wesentlichen Dinge, die wichtigen, zu fokussieren. Das beurteilen zu können, worauf ich die Aufmerksamkeit richten sollte. Das habe ich, glaube ich, im Sport gelernt. Und ich glaube, das ist sehr, sehr wichtig. Das heißt, da kann mir jemand recht reinschreien, mich irritieren wollen und ich versuche es zu schaffen, meine Aufmerksamkeit auf dem Relevanten gerichtet zu lassen Und das Vierte, was wir im Sport lernen können, - selbst als Tennisspieler - ist das Thema „Teaming“. Man stelle es sich so vor: Wir Tennisspieler bezahlen unsere Trainer, damit sie uns kritisieren. Aber ohne diese Kritik werde ich nicht besser. Also eine mega interessante Situation. Einige Firmen machen das mittlerweile sehr, sehr gut, dass sie ein eigenes Screening-Programm für Sportler haben, die sie in ihr Unternehmen holen. Weil letztendlich sind wir ja wie CEOs, die Leute bezahlen, damit sie uns als Berater besser machen. Und diese Erkenntnis ist so wahnsinnig wichtig: Dass man es alleine nicht schafft."
b84055f2-19b6-476e-9fe8-b42db3fc4458,2023-02-22 12:27:00,Industrie: Der Irrglaube vom Staat als Retter der Wirtschaft WELT
6166c217-60b6-48ba-85a7-9945803315c9,2023-02-22 15:42:40,"„Für die Mehrzahl der Unternehmen ist das Thema Russland abgeschrieben“: So lautet das Fazit des Ost-Ausschusses der Deutschen Wirtschaft knapp ein Jahr nach dem russischen Überfall auf die Ukraine. Manager in seinem Alter sagten, dass sie in ihrem Berufsleben wohl keine Rückkehr zum Russlandgeschäft mehr erleben würden, berichtete Michael Harms, Geschäftsführer des Ost-Ausschusses, am Mittwoch auf einer Pressekonferenz in Berlin. „Das heißt also zehn Jahre.“ Normale Wirtschaftsbeziehungen mit Russland werde es auf absehbare Zeit nicht geben."
5ad117c0-5063-47bf-abb6-da72d6c782f0,2023-02-23 00:04:00,"Die deutsche Rennlegende Hans Herrmann ist 95 Jahre alt. Auch die Repräsentanten von Mercedes und Porsche werden wieder ihre Aufwartung bei dem Mann machen, der diesen Unternehmen so viele große Rennsport-Erfolge beschert hat. Als noch junger Reporter und Sprecher habe ich Hans persönlich erst kennengelernt, als er seine Laufbahn als F1-Pilot schon hinter sich hatte. Erste Kontakte mit ihm ergaben sich Anfang der 1960er-Jahre bei der Europa-Bergmeisterschaft und bei diversen Flugplatzrennen. Damals war Hans Nummer-1-Fahrer im Werksrennstall von Carlo Abarth, steuerte alles vom kleinen Abarth 1000 TC über den GT 2000 bis hin zum Spyder. Von da an entwickelte sich ein fast freundschaftliches Verhältnis. Auf meine Fragen gab er mir immer ehrliche Antworten und wertvolle Tipps. Das Flugplatzrennen Wien-Aspern 1963 war eines der ersten Rennen, bei dem ich als Streckensprecher gleich drei Abarth-Siege von Hans Herrmann an einem Tag begleiten durfte. Ausgerechnet vom ebenso strengen wie gefürchteten Carlo Abarth bekam Hans damals auch das größte Kompliment: «Ich kenne keinen Rennfahrer, der mit so wenig Risiko so schnell Autofahren kann.»"
2afebec1-ec85-458f-8b73-f67cecc5f33e,2023-02-23 10:07:24,"Die Audi AG und der Betriebsrat ringen aktuell um die Mitarbeiterbeteiligung am milliardenschweren Rekordgewinn. Der soll für das Geschäftsjahr 2022 bei weit über sieben Milliarden Euro liegen. Die genauen Zahlen präsentiert der Autobauer erst Mitte März. Boni sollen gedeckelt werden Eine Beteiligung am Gewinn erhalten bei der Audi AG derzeit über 55.000 Mitarbeiter. Wie Insider BR24 berichten, möchte das Management gerne die Boni deckeln. Bei deren Berechnung soll es künftig eine Obergrenze geben. An Gewinnen jenseits von 5,3 Milliarden Euro sollten die ""Audianer"" dann nicht mehr beteiligt werden. Details gibt das Unternehmen noch nicht bekannt. Der Sprecher des Betriebsrats Ralf Mattes bestätigt, dass Arbeitgeber und Arbeitnehmer derzeit über die ""Weiterentwicklung der Audi Ergebnisbeteiligung (AEB) sprechen"". Nähere Angaben macht aber auch er nicht. Was Teil der Ergebnisbeteiligung ist - und was nicht Im Kern geht es darum, welche Möglichkeiten die aus dem Jahr 2019 stammende Grundsatzerklärung ""Audi.Zukunft"" dem Unternehmen eröffnet. Damals hatten sich Arbeitgeber und Arbeitnehmer verpflichtet, über die Ergebnisbeteiligung neu zu verhandeln, wenn der Gewinn des Autobauers die Marke von 5,3 Milliarden Euro übersteigt. Das ist bereits in Geschäftsjahr 2021 passiert. Damals erzielte Audi einen Gewinn von 5,5 Milliarden Euro. Insider berichten, dass Audi nun Gewinne jenseits der 5,3 Milliarden Euro nicht mehr mit seinen Mitarbeitern in gewohnter Weise teilen möchte. Gerne würde das Management zudem die Gewinne der Audi-Töchter Lamborghini, Bugatti und Ducati aus dem Gewinn der Audi AG herausrechnen. Betriebsrat will Gewinnbeteiligung ab dem ersten Euro Doch nicht nur die Audi-Spitze hat Wünsche, sondern auch der Betriebsrat. Geht es nach den Vertretern der Arbeitnehmer, soll der Autobauer seine Mitarbeiter künftig schon ab dem ersten Euro am Gewinn beteiligen. Bisher profitieren die ""Audianer"" erst ab einem Gewinn von 1,2 Milliarden Euro. Außerdem möchte der Betriebsrat, dass die Audi-Mitarbeiter in erfolgreichen Jahren noch einen extra Zuschuss zur Altersvorsorge erhalten. Auf der Wunschliste steht auch eine so genannte ""soziale Komponente“, also ein Festbetrag, der an alle Mitarbeiter gleichermaßen ausgeschüttet werden soll, unabhängig von ihrem individuellen Einkommen. Bislang orientiert sich die Erfolgsbeteiligung am individuellen Einkommen. Besserverdiener profitieren deshalb mehr als zum Beispiel ein Facharbeiter. Bislang schüttet Audi zehn Prozent des Gewinns, der 1,2 Milliarden Euro übersteigt, an seine Mitarbeiter aus. Audi zahlt 5.670 Euro - BMW 9.000 Euro Audi hat für das Geschäftsjahr 2021 im Schnitt eine Erfolgsbeteiligung von 5.670 Euro gezahlt. Damit lag Audi im Vergleich mit anderen Autobauern im Mittelfeld - deutlich über Volkswagen, aber deutlich unter BMW und Porsche. BMW zahlte für das Geschäftsjahr 2021 im Schnitt 9.000 Euro Bonus und bei Porsche waren es 7.900 Euro. Auch bei Porsche macht man sich Gedanken über eine Deckelung: Wie eine Sprecherin erklärt, ""schließt Porsche fünfstellige Beträge aus“. Heißt: Bei 10.000 Euro wäre dann auch dort Schluss."
