4b19b198-5418-4b04-b79a-8a26ff18d74b,2023-06-19 19:30:15+00:00,"Bei Porsche spezifiziert die Leitlinie „Verhaltensgrundsätze“ die wichtigsten Grundsätze und Erwartungen an Compliance in drei Aspekten: als Mitglied der Gesellschaft, als Geschäftspartner und am Arbeitsplatz. Eine weitere Leitlinie mit dem Titel „Verhaltensgrundsätze für Geschäftspartner“ führt aus, dass Porsche von seinen Geschäftspartnern die Einhaltung geltender Gesetze, die Anerkennung ethischer Grundwerte sowie nachhaltiges Handeln erwartet. Beide Leitlinien machen explizit auf das Hinweisgebersystem von Porsche aufmerksam. Ferner hat der Vorstand die Gesellschaftsrichtlinie „Compliance Management“ verabschiedet. Hier geht es um die Verpflichtung von Porsche, für die Einhaltung von Gesetzen und Richtlinien zu sorgen. Compliance-Organisation und Compliance-Maßnahmen Das Compliance Management System („CMS“) von Porsche bildet den präventiven Rahmen für die Gesamtheit aller Grundsätze, Maßnahmen und personenunabhängigen Prozesse, die der Gewährleistung und Umsetzung von Compliance in sechs sogenannten Compliance-Themenfeldern dienen. Damit soll eine Verhinderung oder zumindest wesentliche Erschwerung von Gesetzesverstößen und/oder Richtlinienübertretungen in diesen Themenfeldern gewährleistet werden. Potenzielle Regelverstöße können Mitarbeiter an eine entsprechend eingerichtete und kommunizierte interne Hinweisgeberstelle melden. Extern stehen Mitarbeitern und Externen zwei Ombudsleute zur Verfügung, die nach deutschem Recht der anwaltlichen Schweigepflicht unterliegen. Die genannten internen und externen Ansprechpartner des Hinweisgebersystems können über verschiedene Meldewege kostenfrei, jederzeit und auch anonym erreicht werden. Eingegangene Hinweise werden von Porsche aufgegriffen, selbstverständlich unter Einhaltung geltender datenschutz-, arbeits- und mitbestimmungsrechtlicher Vorschriften. Die Hinweisgeber haben vonseiten Porsche keine arbeitsrechtlichen Konsequenzen oder sonstige Benachteiligungen zu befürchten. Auf festgestellte Verstöße reagiert Porsche unter Einhaltung datenschutz-, arbeits- und mitbestimmungsrechtlicher Vorschriften. Geeignete Gegenmaßnahmen werden abhängig vom Untersuchungsergebnis im Einzelfall eingeleitet, und individuelles Fehlverhalten wird abhängig vom Untersuchungsergebnis im Einzelfall sanktioniert. Insgesamt war das Hinweisgebersystem von Porsche bei 63 von 168 eingegangenen Hinweisen zuständig für die weitere Bearbeitung. Im Rahmen der Plausibilisierung wurden von diesen 63 Hinweisen 34 als plausibel bewertet. 13 der 34 plausiblen Hinweise wurden als potenziell schwere Regelverstöße kategorisiert und im Hinweisgebersystem von Porsche untersucht. Schwerpunkte des potenziellen Fehlverhaltens waren Verstöße gegen das Geschäftsgeheimnisgesetz sowie Vermögensdelikte (u. a. Betrug/Untreue). In acht Fällen wurde ein schwerer Regelverstoß festgestellt und Sanktionsmaßnahmen wurden ergriffen. Vier Untersuchungen endeten ohne Feststellung eines Regelverstoßes. Ein Fall war bis zum Ende des Jahres 2022 noch nicht abgeschlossen. Seit 2021 führt die zentrale Abteilung „Compliance“ ein sogenanntes Compliance-Monitoring durch. Neben Gesprächen mit Führungskräften umfasst es risikoorientierte Aktivitäten wie die stichprobenartige Durchsicht von Compliance-relevanten Geschäftsvorgängen. Die Ergebnisse werden in einem Bericht zusammengefasst, der bei erkanntem Verbesserungsbedarf auch geeignete Maßnahmen beschreibt. Im Rahmen der Compliance-Kommunikation von Porsche lag im Jahr 2022 ein Schwerpunkt bei Intranetbeiträgen. Diese haben sich mit Themen wie der Aktualisierung des Flyers zu den Verhaltensgrundsätzen oder dem weltweiten Antikorruptionstag befasst. Daneben gab es verschiedene interne Kommunikationsmaßnahmen der Compliance-Themenverantwortlichen wie Infosessions, Beiträge in Ressortkreisen und Mitteilungen an Führungskräfte. Compliance-Schulungen Die Compliance-Themenverantwortlichen führen in Zusammenarbeit mit dem Personalbereich Compliance-Schulungen bei Porsche durch. Grundlage ist eine themenspezifische Planung. Sie legt die relevanten Zielgruppen und inhaltlichen Schwerpunkte risikobasiert fest. Verbindliche Schulungsformate gibt es für Führungskräfte, Nachwuchsführungskräfte und neue Mitarbeiter. Hinzu kommen organisierte Schulungen der Compliance-Themenverantwortlichen, etwa zu gesetzlich erforderlichen oder zu aktuellen Themen für bestimmte Fachbereiche und Zielgruppen oder auf Anfrage. Im Jahr 2022 wurden bei Porsche 5.817 Mitarbeiter in Präsenz- und virtuellen Veranstaltungen und 57.337 Teilnehmer mittels digitaler Lernmodule zum Thema Compliance geschult. 17.296 Mitarbeiter von Porsche und 7.458 Mitarbeiter der relevanten deutschen Tochtergesellschaften absolvierten das digitale Lernmodul „Verhaltensgrundsätze“. Dieses stellt die gleichnamige Leitlinie vor und informiert über das Hinweisgebersystem sowie die Kontaktdaten des Compliance Helpdesks. Auch die Inhalte der Konzernrichtlinie „Vermeidung von Interessenkonflikten und Korruption“ sowie „Menschenrechte“ sind Gegenstand der Schulung. Zum Ende des Jahres 2022 betrug die Schulungsquote bei Porsche und den relevanten deutschen Tochtergesellschaften in Präsenz- und virtuellen Veranstaltungen innerhalb der festgelegten Zielgruppe durchschnittlich 93 % für die definierten Compliance-Themenfelder. Zum Thema „Betrugsprävention“ pilotierte Porsche 2022 ein digitales Lernmodul in der Beschaffung. Weiterführende Informationen zum Compliance-relevanten Schulungs- und Kommunikationsangebot bei Porsche finden Beschäftigte im Intranet. Neben den relevanten Konzern- und Gesellschaftsrichtlinien gibt es dort auch Informationen zur Compliance-Kultur und -Organisation, außerdem Auskünfte zu Ansprechpartnern und Meldewegen. Filme, Flyer, Handkarten und Broschüren runden das Angebot ab. Integrität organisatorisch verankern Das Thema Integrität ist im Unternehmen bei einer zentralen Managementfunktion angesiedelt. Sie ist innerhalb des Vorstandsressorts Personal- und Sozialwesen im Bereich „Mitarbeiterentwicklung und Unternehmenskultur“ verankert. Ziel des Integritätsmanagements ist es, Integrität nachhaltig in der Unternehmenskultur zu verankern. Führungskräfte und Mitarbeiter sollen befähigt werden, nach ethischen Grundsätzen, mit Verantwortung, aus Überzeugung und standhaft zu handeln. Die Leitlinie „Verhaltensgrundsätze“ betont neben dem Grundsatz ehrlichen, integren und ethisch korrekten Verhaltens jedes Einzelnen auch die besondere Vorbildfunktion von Vorständen und Führungskräften. Ferner ist Integrität ein fester Bestandteil des Führungsleitbilds, des „Porsche Codes“, und hat somit für die Zusammenarbeit einen hohen Stellenwert. Auch in unternehmenseigenen Prozessen und Entscheidungen ist Integrität fest verankert – insbesondere in den Personalprozessen zu Onboarding, Recruiting, Personalentwicklung, Vergütung und Disziplinarwesen. Die Mindeststandards hierzu gibt die Konzernrichtlinie „HR Compliance“ vor. Im Recruiting-Prozess etwa kommen bereits im Auswahlverfahren Integritätsaspekte zur Sprache. Auch beim Entwicklungsweg zur Führungskraft im Tarif sowie ins und im Management wird ein besonderes Augenmerk auf das Thema gelegt. Wo immer Entscheidungsvorlagen bei den Topgremien von Porsche eingereicht werden, ist die Prüfung der Integrität Bestandteil des Prozesses. Programm zur Stärkung der Integritätskultur Im Rahmen des Programms „Together4Integrity“ (T4I) hat Porsche das Themenfeld „Kultur und Integrität“ international eingeführt. Im Programm wurden langfristige Maßnahmen erarbeitet, die auf eine Stärkung der Integritätskultur zielen. Für die lokale Umsetzung gemäß Zeit- und Meilensteinplanung sind die Geschäftsleitungen der aktuell 97 Tochtergesellschaften im T4I-Scope, inklusive Porsche, verantwortlich. Je nach örtlichen Gegebenheiten können Maßnahmenpakete und Implementierungszeiten variieren. Die Tochtergesellschaften des Unternehmens können jedoch für die lokale Umsetzung die zentral entwickelten Konzepte als Basis nutzen. Über den Umsetzungsstand der T4I-Maßnahmen im Unternehmen informiert ein zentrales Berichtssystem mit Härtegradlogik. Neben den Maßnahmen des Themenfelds „Kultur und Integrität“ umfasst es auch die Mindeststandards zu Integrität aus der Porsche-Konzernrichtlinie „HR Compliance“. Auch in den T4I-Gremien wird regelmäßig über den Fortschritt berichtet. Der hohe Stellenwert des Themas Integrität zeigt sich auch in der halbjährlichen Berichterstattung des Umsetzungsstands an das Gremium „Compliance Council“, in der anlassbezogenen Berichterstattung an den Vorstand sowie im jährlichen Integritätsbericht im Aufsichtsrat. Die Berichterstattung an die Geschäftsführung und sonstige relevante Gremien ist Gegenstand der T4I-Maßnahmen im Themenfeld „Kultur und Integrität“. Stärkung des Integritätsbewusstseins Integres Handeln im Arbeitsalltag setzt u. a. die Fähigkeit voraus, integre Entscheidungen zu treffen. Hierzu wurde im Jahr 2022– im Kontext des neuen Entwicklungswegs ins Management – das Training für neu eingestellte bzw. ernannte Manager von Porsche weiterentwickelt. Im Zentrum steht ein Kompetenzmodell, das die für integre Entscheidungen notwendigen Fähigkeiten identifiziert und stärkt. Damit bietet das Training eine Orientierungs- und Anwendungshilfe für moralische Entscheidungsdilemmata. Seit dem dritten Quartal 2022 wird das Training bedarfsbezogen bei Integritätsschulungen für Führungskräfte im Tarif eingesetzt. Hier leistet es einen wichtigen Beitrag zum Transfer des Themas Integrität in die Praxis. Zudem wurden speziell für Führungskräfte neue Dialogformate entwickelt. Diese unterstützen sie dabei, mit ihren Teams ein gemeinsames Verständnis von Integrität zu entwickeln und die Integrität im Team zu fördern. Generell ist Integrität bei Porsche zielgruppenspezifisch in Trainingsformate für neue und bestehende Mitarbeiter integriert. Netzwerke und Tools Das interdisziplinäre Multiplikatorennetzwerk zu „Marke, Kultur und Integrität“ bietet Mitarbeitern von Porsche eine Plattform für Erfahrungsaustausch, Impulse und Vorträge. Es unterstützt seine Botschafter dabei, das Thema Integrität in den Fachbereichen zu verankern. Im Intranet stehen den Mitarbeitern Informationen zu Integrität gebündelt zur Verfügung. Hier finden Nutzer auch die interne Podcastreihe zur Unternehmenskultur, die u. a. auch Beiträge zu Integrität behandelt. Führungskräfte bei Porsche können in einem eigenen Bereich zu Integrität auf einen Werkzeugkasten zugreifen. Dort sind Tools zur Selbstreflexion, Formate für Dialoge und weitere Informationen und Impulse rund um das Thema Integrität verfügbar. In ihrer Vorbildfunktion können Führungskräfte damit eigene Workshops durchführen, um ihr Integritätsverständnis zu schärfen und Maßnahmen zur Verbesserung der gelebten Integrität gemeinsam mit ihren Mitarbeitern zu definieren und umzusetzen. Im Jahr 2022 wurden die Maßnahmen u. a. um ein Workshopformat erweitert, in dem sich das Team aktiv mit Situationen und Entscheidungen im Alltag beschäftigt, die integres Handeln erfordern. Im Rahmen der Transferphase des jährlichen Führungslabs für alle disziplinarischen Führungskräfte bei Porsche erhielten diese die Möglichkeit, Vertiefungsformate zum Thema Integrität wahrzunehmen, so z.B. zum Thema psychologische Sicherheit als Voraussetzung für eine „Speak-up-Kultur“. Integrität als Thema in Mitarbeiterbefragungen Porsche strebt an, Integrität im Arbeitsalltag zu verankern und überall und auf allen Ebenen mit Leben zu füllen. Befragungen helfen zu verstehen, wo das Unternehmen aktuell steht. Eine Abfrage zu integrem und regelkonformem Verhalten in der Unternehmensorganisation ist beispielsweise Teil der jährlichen Mitarbeiterbefragung, des „Stimmungsbarometers“. Daraus lässt sich ablesen, wie sich die Integritätskultur entwickelt und welche zusätzlichen Maßnahmen abgeleitet werden können. Im Jahr 2022 wurden im Unternehmen rund 31.000 Mitarbeiter befragt. Die Ergebnisse des „Stimmungsbarometers“ werden anschließend in den Organisationseinheiten besprochen. Diese verpflichtenden Durchsprachen fügen sich in den sogenannten Teamdialog zu Kultur und Werten des Unternehmens ein – einen offenen Austausch auf Augenhöhe zur gelebten Zusammenarbeit innerhalb der Organisationseinheit. Ziel des Formats ist die gemeinsame Erarbeitung von Maßnahmen durch Führungskräfte und Mitarbeiter, um die Zusammenarbeit im Team zu verbessern. Der Teamdialog ist Gegenstand der T4I-Maßnahmen. Wird ein festgelegter Schwellenwert zu Integrität im „Stimmungsbarometer“ unterschritten, so greift innerhalb von Porsche ein Sonderprozess, um die Ursachen für die Bewertung herauszuarbeiten und bei Bedarf geeignete Maßnahmen zu veranlassen. Dabei werden das Personalwesen und der jeweilige Vorgesetzte miteinbezogen. Die Ergebnisse der jährlichen Mitarbeiterbefragung zu integrem Verhalten bei Porsche zeigen, dass sich die Integritätskultur auf einem hohen Niveau befindet. Die Frage nach der Möglichkeit jedes Einzelnen, sich integer zu verhalten, wurde mit der höchsten Kategorie der zugrunde liegenden fünfstufigen Skala bewertet. Seit 2019 ist die Integritätsfrage konstant auf dem dritten Platz aus insgesamt 24 Fragen im „Stimmungsbarometer“. Damit wurde das Niveau der Vorjahre bestätigt."
c057669b-7f8f-4b63-8943-ad7bf7155f46,2023-06-20 13:00:00+00:00,"Hattingen. Liebhaber von alten VW- und Porsche-Modellen kommen in Hattingen auf ihre Kosten. Alle Fakten zu Termin und Tickets – und schöne Bilder von 2022. Chrom und Stahl – das funktioniert in Hattingen: Beim Hoffmann Speedster Classic Day treffen sich historische Volkswagen und Porsche auf dem Gelände des LWL-Museums Henrichshütte, diesmal am Sonntag, 9. Juli. +++ Sie wollen keine Nachrichten aus Hattingen verpassen? Dann können Sie hier unseren Newsletter abonnieren. Jeden Abend schicken wir Ihnen die Nachrichten aus der Stadt per Mail zu. +++ >>> Hier gibt es die schönsten Fotos aus dem Vorjahr: „Der Classic Day ist eine Veranstaltung für Fans, Freunde und Fahrer von VW Käfer, Karmann Ghia, Porsche 911/912, VW Bus 1-4, VW Golf 1-3, VW 181, Porsche 356 und allen anderen Modellen“, so die Veranstalter von E-Mags Media. Eine feste Baujahrs-Begrenzung gebe es nicht, „eher eine gefühlte“. „Das Vintage-Feeling ist entscheidend. Niemand muss seinen Garagennachbarn zuhause lassen.“ >>> Mehr Nachrichten aus Hattingen und Sprockhövel >>> Lesen Sie auch: Netz-Hit: Berührender Dank einer Mutter an Sanitäter Oliver Altstadtfest in Hattingen: „Rock am Bunker“ ist gerettet Hattingerin (73) meistert Alltags-Fitnesstest für Senioren Blankenstein brutzelt: Frikadellen-Contest trifft Geschmack Offene Gartenpforte: Hattinger zeigen ihren Traumgarten Es gibt Programm auf der „Show & Shine“-Bühne. Eine Jury wird zudem alle auf dem Gelände vertretenen Fahrzeuge bewerten und mit Siegerschleifen kennzeichnen. Zudem lockt ein Food Festival, u.a. mit Burgern, Hot Dogs & Fries, Bratwurst-Kreationen, Crêpes, Pizza, American Soft Ice und Kaffee-Spezialitäten – und Cocktails. >>> Folgen Sie unserer Redaktion auf Facebook – hier finden Sie uns Teilnehmer-Tickets gelten pro Fahrzeug inklusive einer Person und kosten zehn Euro. Jede weitere Person zahlt zehn (Erwachsene) oder fünf Euro (Jugendliche). Kinder unter sechs Jahren haben freien Eintritt frei. Der Eintritt ins LWL-Museum Henrichshütte ist enthalten. Wer spontan kommen will: Teilnehmer- & Besucher-Tickets gibt es auch vor Ort an den Tageskassen."
3877ee39-87cd-4ce3-9669-f686d77e8288,2023-06-21 04:53:19+00:00,"Zur Ausgabe Artikel 7 / 38 Volkswagens Dramatochter Cariad Warum Porsche das nächste Softwaresolo startet Volkswagen- und Porsche-Chef Oliver Blume hat die Softwaretochter Cariad neu sortiert. Das Vertrauen in die Programmierer fehlt jedoch weiter. Blumes Entwickler bei Porsche legen ein Alternativprojekt auf. Von Michael Freitag 21.06.2023, 06.53 Uhr • aus manager magazin 7/2023 Sie können den Artikel leider nicht mehr aufrufen. Der Link, der Ihnen geschickt wurde, ist entweder älter als 30 Tage oder der Artikel wurde bereits 10 Mal geöffnet. manager magazin plus Jetzt weiterlesen. Mit dem passenden manager Abo. Einen Monat für € 0,99 testen. Jederzeit kündbar. Ihre Vorteile: manager magazin+ und Harvard Business manager+ im Paket Alle Inhalte von m+ und HBm+ auf der Seite manager-magazin.de und in der manager-Nachrichten-App Der Inhalt der gedruckten Magazine inkl. E-Paper (PDF) Jetzt für € 0,99 testen Ihre Vorteile: Alle Inhalte von m+ auf der Seite manager-magazin.de und in der manager-Nachrichten-App m+-Newsletter mit besonderen Leseempfehlungen Der Inhalt des gedruckten Magazins inkl. E-Paper (PDF) Jetzt für € 0,99 testen Sie sind bereits Digital-Abonnentin oder -Abonnent? Hier anmelden Weiterlesen mit manager+ Immer einen Einblick voraus Ihre Vorteile mit manager+ manager magazin+ in der App Harvard Business manager+ in der App Das manager magazin und den Harvard Business manager lesen als E-Paper in der App Alle Artikel in der manager-App Preis wird geladen... Sie haben bereits ein Digital-Abonnement? manager+ wird über Ihren iTunes-Account abgewickelt und mit Kaufbestätigung bezahlt. 24 Stunden vor Ablauf verlängert sich das Abo automatisch um einen Monat zum Preis von zurzeit 24,99€. In den Einstellungen Ihres iTunes-Accounts können Sie das Abo jederzeit kündigen. Um manager+ außerhalb dieser App zu nutzen, müssen Sie das Abo direkt nach dem Kauf mit einem manager-ID-Konto verknüpfen. Mit dem Kauf akzeptieren Sie unsere Allgemeinen Geschäftsbedingungen und Datenschutzerklärung ."
0b655a5c-4830-4df9-8e6e-012921a96e7b,2023-06-21 15:11:07+00:00,"Volkswagen-Chef Oliver Blume (55) traut dem Autohersteller trotz Problemen etwa bei der Softwaretochter Cariad und der Kernmarke VW ein deutliches Gewinnwachstum zu. Um die Kosten für das milliardenschwere Investitionsprogramm bis 2027 zu stemmen, soll die Rendite von Europas größtem Autobauer auf bis zu 10 Prozent klettern, wie aus der Präsentation für den Kapitalmarkt am Mittwoch hervorging. Zum Ende des Jahrzehnts wurde die Spanne auf neun bis elf Prozent angehoben. Im vergangenen Jahr lag die bereinigte Rendite bei 8,1 Prozent. Der Umsatz soll nach dem Willen des Wolfsburger Konzerns bis 2027 jedes Jahr um 5 bis 7 Prozent steigen. Vor allem in China und Nordamerika will Volkswagen wachsen. In China hatte der Konzern in den letzten Jahren deutlich Marktanteile verloren. Die Markengruppen erhielten erstmals eigene Renditevorgaben, um den Konzern insgesamt auf ein höheres Niveau zu heben, erläuterten Konzernchef Oliver Blume und Finanzchef Arno Antlitz (53) während einer Telefonkonferenz mit Journalisten im Vorfeld des Analystentreffens. ""Es ist wie im Fitnesscenter"", sagte Blume. Jede Marke trainiere und je fitter sie werde, umso besser werde der Konzern. Audi, die die in ""Progressive"" umbenannte Premiumgruppe mit den Luxusautobauern Bentley, Lamborghini und dem Motorradhersteller Ducati anführt, soll die Rendite auf 14 Prozent steigern. Bisher lag das Ziel bei neun bis elf Prozent. Der börsennotierte Sportwagenbauer Porsche will in den nächsten Jahren mehr als 20 (18,6) Prozent erreichen. Die Gruppe ""Trucks"", bekannt als Traton mit Marken wie Scania, MAN, Navistar und dem Südamerikageschäft, soll neun Prozent erzielen. Konzernchef Blume, der in Personalunion auch Porsche führt, betonte, dass Einsparungen nicht im Vordergrund des Umbaus stünden, vielmehr werde die Effizienz gesteigert und Synergien zwischen den Marken besser genutzt werden. Ohne die Senkung der Arbeitskosten wird Volkswagen dabei allerdings nicht auskommen, wie Antlitz einräumte. Die Maßnahmen würden noch von den Marken erarbeitet. Wie Volkswagen weiter ankündigte, wolle er in den kommenden Jahren den Aufwand für Sachinvestitionen sowie Forschung und Entwicklung spürbar senken. Die Investitionsquote soll bis 2027 auf unter 11 Prozent des Umsatzes sinken. Für dieses Jahr haben die Wolfsburger noch einen Anteil von 14,5 Prozent der Erlöse für Investitionsausgaben eingeplant. Blume kündigte zudem eine unabhängige Untersuchung des Werks im chinesischen Xinjiang noch in diesem Jahr an. Darüber sei man im Austausch mit Partner SAIC."
c954fa2b-9ae8-4918-a1fb-8070551eba33,2023-06-21 15:43:19+00:00,"Kapitalmarkttag : VW-Chef verdonnert Marken zu Effizienz Von Christian Müßgens, Hamburg 21.06.2023, 17:43Lesezeit: 3 Min. Zwei Männer und ein Elektrobus: VW-Konzernchef Oliver Blume (links) und VW-Finanzvorstand Arno Antlitz posieren vor dem E-Bulli ID. Buzz.Reuters Der Wolfsburger Konzern steht unter wachsendem Druck. Jetzt plant Konzernchef Oliver Blume den Befreiungsschlag. Die Marken sollen rentabler werden. Auch für heikle Themen in China gibt es neue Pläne. Vom Elektrosportwagen Porsche Taycan bis zum E-Bulli ID Buzz: Die 200 Analysten, Banker und Investoren, die am Mittwoch zum Kapitalmarkttag von Volkswagen gekommen waren, konnten sich aus dem gesamten elektrischen Sortiment des Wolfsburger Konzerns bedienen und die Autos zur Probefahrt über den Hockenheimring jagen. Ohne Abo weiterlesen Dies ist kein Abo. Ihre Registrierung ist komplett kostenlos, ohne versteckte Kosten. Oder 3 Monate für 1 € pro Monat Zugang zu allen FAZ+ Beiträgen erhalten und immer aktuell informiert bleiben. Jetzt weiterlesen Dies ist kein Abo. Ihre Registrierung ist komplett kostenlos, ohne versteckte Kosten. Gleich geschafft! Bitte bestätigen Sie Ihren Account über den Bestätigungslink in der gesendeten E-Mail"
aa317b5e-223e-4ee1-9ff8-ba39bc063a90,2023-06-21 16:29:11+00:00,"Die genauen Gründe für die Zahlungsunfähigkeit waren zunächst nicht bekannt. Insolvenzverwalter Zanker sprach nur allgemein von »Liquiditätsschwierigkeiten«. Allgaier hatte nach früheren Angaben mit den Folgen des Ukrainekriegs, steigenden Preisen für Energie und Logistik sowie höheren Personalkosten zu kämpfen. Außerdem war die Nachfrage in der Sparte Automobilzulieferung gesunken. Das Unternehmen aus Uhingen bei Stuttgart beliefert große Autohersteller, darunter Porsche, mit Blechteilen, ist aber auch im Werkzeugbau und in der Verfahrenstechnik aktiv. »Die Kunden werden wie gewohnt beliefert«, betonte Zanker. Ein Porsche-Sprecher wollte sich zu Allgaier nicht äußern. Man wisse aber, dass die Autozulieferer vor besonderen Herausforderungen stünden. »Auswirkungen auf unsere Lieferketten können vor diesem Hintergrund nicht ausgeschlossen werden.« Das Unternehmen ist auch deshalb bekannt, weil es bis zum Verkauf von 89 Prozent der Anteile an die chinesische Westron-Gruppe der Familie des ehemaligen Arbeitgeberpräsidenten Dieter Hundt gehörte. Allgaier beschäftigt rund 2000 Mitarbeiter, davon 1600 in Deutschland. Die Töchter im Ausland seien nicht direkt von der Insolvenz betroffen, sagte Zanker. Die Krise währt schon länger Der Insolvenzverwalter kündigte Gespräche mit Lieferanten und Kunden an, um den Betrieb zu stabilisieren. Zudem will er auf die Suche nach neuen Investoren gehen. Das Unternehmen galt seit Längerem als Sanierungsfall und hat in den Jahren seit 2020 eine Restrukturierung hinter sich. Operativ habe Allgaier damit 2020 und 2021 wieder schwarze Zahlen geschrieben, hieß es bei der Übernahme durch Westron vor einem Jahr. Der neue Eigentümer habe zudem frisches Eigenkapital eingebracht. Ende 2022 räumte Allgaier aber ein, seine Umsatzerwartungen verfehlt zu haben. Der Insolvenzantrag gilt Pluta zufolge für die Holdinggesellschaft der Gruppe. Für die in Deutschland tätigen Tochterfirmen sollen in Kürze aber ebenfalls Insolvenzanträge gestellt werden. Das betreffe unter anderem die Allgaier Automotive GmbH und die Allgaier Process Technology GmbH, hieß es. Die ausländischen Gesellschaften befinden sich demnach nicht in einem Insolvenzverfahren. Der Konzern beschäftigt in Deutschland rund 1600 Menschen. Ihre Löhne und Gehälter sind für drei Monate durch das Insolvenzgeld gesichert. Weltweit arbeiten nach Angaben von Zanker insgesamt rund 2000 Menschen in der Gruppe."
491ce7b9-af27-415a-add4-cc9d0aff9298,2023-06-21 18:19:26+00:00,"Vor fast einem Jahr hat der frühere Arbeitgeberpräsident Dieter Hundt sein Lebenswerk, den Autozulieferer Allgaier Werke, in chinesische Hände gegeben. Nun ist das Unternehmen in die Insolvenz gerutscht. Grund für den Antrag beim Amtsgericht Göppingen seien Liquiditätsschwierigkeiten, teilte der vorläufige Insolvenzverwalter Fritz Zanker von der Kanzlei Pluta mit. Der Mittelständler beliefert große Autohersteller, darunter Porsche, mit Blechteilen, ist aber auch im Werkzeugbau und in der Verfahrenstechnik aktiv. Der Geschäftsbetrieb läuft weiter."
