64030dad-4e7a-494c-bb4e-825d3d19a9cf,2023-02-01 11:49:00,"Man könnte die zwei Frauen und den Mann der Frankfurter Bauaufsicht auch Airbnb-Jäger nennen. Sie suchen in der Stadt nach illegalen Kurzzeitappartements, möblierten Residenzwohnungen und anderen unangemeldeten Ferienwohnungen, wie sie eben bei Airbnb angeboten werden. An einem Januartag zum Beispiel bereiten sie einen unangekündigten Hausbesuch vor. Sie vermuten dort eine unerlaubte Ferienwohnung. ""Es gab Hinweise von Nachbarn"", sagt eine der Mitarbeiterinnen des Teams, die öffentlich lieber nicht ihren Namen nennt. Nachbarn helfen mit Frankfurt war die erste Stadt in Hessen, die illegalen Ferienwohnungen den Kampf ansagte. Seit 2018 gilt dort die Ferienwohnungssatzung. Sie zieht Airbnb-Appartements und Co. enge Grenzen. Nur nach Genehmigung dürfen Wohnungen vermietet werden - und dann auch nur temporär. Um dem Vorhaben die nötige Durchschlagkraft zu verleihen, gibt es seit 2018 eben jene Airbnb-Jäger. Offiziell heißen sie Team Wohnraumschutz. Die drei Vollzeitkräfte suchen online auf den einschlägigen Portalen, kontaktieren Vermietende und statten immer wieder Hausbesuche ab, manchmal auch frühmorgens. ""Dabei müssen wir priorisieren. Die Arbeit ist ganz schön aufwendig"", sagt die Leiterin der städtischen Bauaufsicht, Simone Zapke. Auch manche Frankfurterinnen und Frankfurter scheinen dabei gerne ehrenamtlich mitzuhelfen. ""Ein Teil der Hinweise kommt von Nachbarinnen und Nachbarn. Die stören sich daran, weil es plötzlich so einen Trubel im Haus gibt"", berichtet Zapke. Das bisher höchste Bußgeld Frankfurts Die Bilanz des Teams nach fünf Jahren Arbeit: 1.050 illegal vermietete Appartements wurden aufgespürt, zwei Millionen Euro an Bußgeld eingenommen. Die Hälfte davon ging sogar auf die Rechnung von nur einem Anbieter - das bisher höchste verhängte Bußgeld in der Geschichte der Stadt Frankfurt, wie Zapke schildert: ""Das war ein Haus, das als Studierendenwohnheim genehmigt worden war. Aber statt Studis mit wenig Geld ein Dach über den Kopf zu geben, wurde das Ganze hochpreisig an Geschäftsleute kurzzeitvermietet."" Aber es geht in Frankfurt nicht nur um den Schutz von Wohnraum. Dieser soll auch bezahlbar bleiben. Denn Airbnb-Wohnungen führen dazu, dass Mietpreise an einem Ort steigen. Das zeigen mehrere Studien. Studie: Airbnb und Co. lassen Mieten steigen Berechnet hat das zum Beispiel der Ökonom Kevin Tran für das Deutsche Institut für Wirtschaftsforschung (DIW). Er und Kollegen haben 2020 am Beispiel von Berlin untersucht, welchen Effekt Kurzzeit-Ferienwohnungen auf den lokalen Wohnungsmarkt haben. Ein Ergebnis: ""Sind professionelle, also dauerhafte Airbnb-Wohnungen in der Nähe, steigen im Umkreis von 250 Metern die Mieten bei Neuvermietungen zwischen 15 bis 44 Cent pro Quadratmeter."" Tran sagt, der Effekt potenziere sich mit der Zahl der Kurzzeit-Appartements an einem Fleck. ""Bei drei dauerhaften Airbnb-Wohnungen in der Nähe kann das schon mal 100 Euro mehr Miete ausmachen"", legt der Ökonom dar. Ähnliche Studien gibt es aus verschiedenen Städten weltweit - alle mit ähnlichen Ergebnissen. Die simple Erklärung der Forscher: Gibt es aufgrund der dauerhaften Nutzung mancher Bleiben als Airbnb-Unterkünfte weniger Wohnungen auf dem freien Mietmarkt, wird für die mehr Geld verlangt. Airbnb: ""Konstruktiver Austausch"" mit Städten Doch was halten die Anbieter von den strikten Regeln? Und was tun sie, um gegenzusteuern? Airbnb, der mit Abstand größte Anbieter in Deutschland, teilt schriftlich nur knapp mit: ""Wohnraumschutz ist für Airbnb ein wichtiges Thema, weshalb wir uns für einen konstruktiven Austausch mit Städten einsetzen, um zu fairen und verhältnismäßigen Regeln für Homesharing und zum Schutz von Wohnraum beizutragen."" Die Frankfurter Bauaufsicht-Leiterin Zapke sieht durchaus noch Luft nach oben, was einen ""konstruktiven Austausch"" mit Airbnb betrifft: ""Wenn es beispielsweise um Daten der Vermieter geht, gibt es eine Zusammenarbeit. Aber wir müssen da schon häufiger nachhaken und sind deshalb recht froh, dass wir inzwischen gesetzliche Grundlagen haben, die das etwas erleichtern."" Juristisch scheint sich die Stadt Frankfurt auf sicherem Eis zu bewegen. Die Gerichte haben schon mehrfach und in verschiedenen Instanzen die Auflagen und Strafen der Ferienwohnungssatzung bestätigt. ""In einem Fall ist unser Bußgeld sogar vom Gericht nach oben korrigiert worden, von 21.000 Euro auf 23.000 Euro"", sagt Zapke. Anfängliche Kritik ist verstummt Auch aus den Reihen der Frankfurter Stadtpolitik bekommt das Team Wohnraumschutz Rückenwind. Gab es vor fünf Jahren noch einige Kritik daran - die Linke und die linke Wählervereinigung ÖkoLinx wollten die Satzung noch schärfer, dagegen ging sie der FDP, der AfD und den rechtspopulistischen Bürgern für Frankfurt viel zu weit -, ist die Kritik inzwischen verstummt. Gerade erst wurde die Ferienwohnungssatzung im Stadtparlament neu beschlossen - einstimmig. Sie gilt nun weitere fünf Jahre bis 2028. Das Team Wohnraumschutz hat jedenfalls genug zu tun, wie die Mitarbeiterin, die anonym bleiben möchte, sagt. Sie erzählt, dass manche Airbnb-Vermieter versuchen, eine Ausnahmeerlaubnis zu erbetteln. ""Neuerdings rufen Investoren direkt bei uns an. Die sagen dann: Wir haben uns eine Wohnung in Frankfurt extra dafür gekauft, um die gewinnbringend als Ferienwohnung zu vermieten."" Oder, so schildert es die Mitarbeiterin weiter, potenzielle Interessenten für eine Eigentumswohnung riefen an und sagten: Sollten sie keine Ferienwohnung daraus machen, dann könnten sie eine Wohnung gar nicht erst kaufen, weil sie so teuer sei. Bauaufsicht-Leiterin Zapke schüttelt da nur den Kopf: ""Solche Fälle können wir natürlich nicht genehmigen. Aber immerhin: Manche scheinen uns jetzt zu kennen."""
46dae6af-105f-4c0d-b51a-4487f0036ce8,2023-02-01 15:23:29,"911 Yuan - dafür gibt es im Porsche-Kosmos normalerweise ein Modellauto, ein Leder-Schlüsseletui oder einen Design-Tankdeckel. In China haben dagegen jüngst hunderte Interessenten dafür einen leibhaftigen Panamera zum Schnäppchenpreis zu reservieren versucht. Mit einer Online-Anzahlung über die umgerechnet 124 Euro wollten sie sich einen Panamera der aktuellen Baureihe für schlanke 124.000 Yuan (16.900 Euro) sichern – ganz offiziell beim Porsche-Zentrum Yinchuan in Nordchina. Laut Preisliste kostet das Basismodell dort ab 973.000 Yuan. Als die ersten umgehend wegen der konkreten Vertragsabwicklung vorstellig wurden, war der Schreck groß – und zwar bei Kunden, Händler und Porsche . Denn hinter dem vermeintlichen Schnäppchen stand keine aggressive Verkaufsförderung für den langsam in die Jahre kommenden Sportviertürer. Es liege stattdessen ""ein schwerer Fehler im angegebenen Verkaufspreis"" vor, bemerkte Porsche laut der Wirtschaftsnachrichtenagentur Bloomberg, die zuerst über den Fall berichtet hatte . Einer bekam ein Porsche-Schnäppchen In den folgenden Stunden werden die Verantwortlichen Stoßgebete in Richtung Weibo geschickt haben. Auf dem chinesischen Kurznachrichtendienst wurden schon einige große Namen in die Knie gezwungen: Mercedes war zuletzt vor einem Jahr dran wegen eines Werbespots mit weiblichen Modells, die in den Augen der Nutzer zu europäisch geschminkt waren. H&M und Nike wurden vor einiger Zeit gegrillt, weil sie vorsichtig erkennen ließen, dass die Arbeitsbedingungen an ihren chinesischen Produktionsorten vielleicht doch noch weiter verbessert werden könnten. Und Starbucks und Apple mussten sich gegen den Vorwurf erwehren, Chinesen überteuerte Produkte zu verkaufen. Der Vorwurf würde bei Porsche natürlich ins Leere laufen. Trotzdem einigte sich der Luxushersteller schnell mit dem Kunden, der als erster 911 Yuan überwiesen hatte. Man habe sich im Hinblick auf den konkret vom Porsche-Zentrum Yinchuan beworbenen Panamera auf ein ""verträgliches Ergebnis geeinigt"", teilte die Firma unter Vermeidung weiterer Ausführungen mit. Alle anderen Kunden seien kontaktiert worden mit dem Versprechen, binnen 48 Stunden ihr Geld zurückzubekommen. Über zusätzliche Modellautos, Schlüsseletuis oder Design-Tankdeckel wurde nichts bekannt."
cf68d056-3cdc-4c4f-8a2e-d7130b1b239b,2023-02-01 15:41:59,"Vom Investitionsvolumen von bis zu drei Milliarden Dollar entfallen auf ZF 185 Millionen Dollar. ZF werde im Gegenzug auch Aktien von Wolfspeed für eine Minderheitsbeteiligung an dem börsennotierten Unternehmen erhalten. Baubeginn soll bereits im ersten Halbjahr 2023 sein. Bei vollständigem Betrieb werde die Fabrik mehr als 600 Menschen beschäftigen, dazu kommen Jobs im Umfeld, insgesamt sollen es rund 1000 Arbeitsplätze sein. Hergestellt werden sollen im Saarland Siliziumkarbid-Halbleiter, mit denen die Reichweite von Elektroautos gesteigert werden könnte. Sie kommen aber auch in Energie- und Industrieanlagen zum Einsatz. Es wird zudem ein gemeinsames Forschungs- und Entwicklungszentrum errichtet, an dem wiederum ZF die Mehrheit haben wird. Das Projekt sei ein integrierter Teil des ""wichtigen Vorhabens von gemeinsamem europäischen Interesse (Important Project of Common European Interest - IPCEI) für Mikroelektronik und Kommunikationstechnologien"", teilte ZF mit. ""Diese Initiativen stärken die Widerstandsfähigkeit der europäischen Lieferketten und unterstützen gleichzeitig den Europäischen Green Deal und die strategischen Ziele von Europas digitaler Dekade"", sagte Holger Klein, Vorstandsvorsitzender von ZF. Ein großer Teil der Investition wird über Subventionen finanziert Ensdorf ist die Heimat des früheren CDU-Wirtschaftsministers Peter Altmaier. ""Die gute alte Zeit schafft die Voraussetzung für die gute neue Zeit"", sagte Scholz. Denn das Werk wird dort auf dem Gelände eines ehemaligen Kohlekraftwerks entstehen, das mehr als 50 Jahre Strom aus Kohle produzierte, und soll etwa ein Drittel größer sein als Wolfspeeds bestehende Chipfabrik in den USA, sagte Firmenchef Gregg Lowe, der beim Festakt Deutsch gesprochen hat. Der Start der Produktion sei für 2027 geplant. Von den bis zu drei Milliarden Dollar Kosten dürfte ""ein großer Teil"" über Subventionen finanziert werden, ergänzte Lowe. Dem müsse die EU-Kommission zustimmen. Wolfspeed habe sich nach Prüfen einiger möglicher Standorte in Europa für Deutschland entschieden, wegen der guten Lage im Herzen Europas und wegen der gut ausgebildeten Arbeitskräfte. ""Wir haben uns einfach ins Saarland verliebt"", sagte Lowe. Das Unternehmen erhofft sich Lowe zufolge eine besonders profitable Produktion. ""Das Niveau an Qualität und Ausbildung von Technikern in Deutschland ist sehr, sehr hoch"", lobte er: ""Unsere Aufgabe ist nur, sie für Halbleiter-Maschinen auszubilden, und dafür haben wir vier Jahre Zeit."" Es solle eine ""bahnbrechend innovative"" Entwicklungs- und Produktionsstätte geschaffen werden. ZF erhalte eine Minderheitsbeteiligung an der Fabrik in Ensdorf, hieß es weiter. Die Kontrolle und die operative Leitung der neuen Fabrik liegt bei Wolfspeed. ZF und Wolfspeed arbeiten schon seit 2019 in einer strategischen Partnerschaft zusammen. Im Saarland sollen ""bahnbrechende Innovationen"" entwickelt werden, hieß es. Ford hat den Standort im Saarland zur Disposition gestellt Für das Saarland ist die Meldung auch deshalb ein Erfolg, weil das Land seit Jahren gegen den Strukturwandel kämpft - und weil zuletzt mehrere größere Ansiedlungen nicht geklappt hatten. Im vergangenen Juni gab der Automobilhersteller Ford bekannt, seine Elektroautos von 2025 an im spanischen Valencia bauen zu wollen, es war auch eine Entscheidung gegen den Standort in Saarlouis, gegen ein Werk mit 4600 Beschäftigen. Wenige Monate später verkündete dann der chinesische Batteriezellenhersteller Svolt, sich zunächst in Brandenburg anzusiedeln. Dort hatte sich auch der US-Elektroautobauer Tesla angesiedelt. Das Saarland, so schien es, drohte am Strukturwandel zu scheitern. Wenn jetzt Wolfspeed kommt und auf einem alten Kraftwerksgelände Arbeitsplätze schaffen will, wird das an der Saar als Trendwende interpretiert. Als Beleg dafür, dass das Land es schaffen kann, weg vom Verbrenner zu kommen, hin zur Elektromobilität und zu neuen Technologien. Die saarländische Ministerpräsidentin Anke Rehlinger sprach von einem ""wirtschaftlichen Aufbruch"" und einem Leuchtturmprojekt."
18babc9f-3f28-45d6-ad64-6a50568c4b25,2023-02-01 15:42:40,"Der amerikanische Präsident Joe Biden stiess im April 2022 eine Warnung in Richtung russischer Oligarchen aus: «Wir werden ihre Jachten, ihre Luxushäuser und anderen unrechtmässigen Gewinne beschlagnahmen.» Dann stolperte Biden über das Wort Kleptokratie, und schliesslich meinte er: «Das sind böse Kerle.» Biden machte klar: Die Sanktionen gegen die russischen Geschäftsmänner, die meistens mit dem Adjektiv kremlnah versehen werden, sind ein wichtiger Pfeiler der westlichen Reaktion auf den russischen Angriffskrieg. Die Mär von der Oligarchie Der Fokus auf die russischen Milliardäre zeugt aber weniger von einer überzeugenden Sanktionsstrategie als von einem gelernten Reflex aus der Globalisierungskritik. Die Reichen und in weiterer Folge die weltumspannenden Konzerne sind demnach die bestimmenden Akteure, die Macht ausüben und für die Ungleichheit auf der Welt verantwortlich sind. Die Welt hat sich jedoch verändert. Der Krieg in der Ukraine und der Konflikt zwischen den USA und China, der alten und der neuen Supermacht, lassen die Kritik an einer vermeintlich grenzenlosen Wirtschaft ins Leere laufen. Denn einmal mehr zeigt sich, dass es Regierungen sind, die die Wirtschaft instrumentalisieren und den Wohlstand und die Grundlagen für Frieden gefährden. Augenfällig ist die Entwicklung in Russland: Die Idee hinter den Sanktionen ist, dass die betroffenen Milliardäre dermassen geschädigt werden, dass sie entnervt auf den Kremlherrscher Wladimir Putin Druck ausüben, seine irrwitzigen Pläne fallenzulassen. Doch die Oligarchen sind schon lange keine Oligarchen mehr. Die Milliardäre, die im Westen mit ihren Jachten und Fussballklubs das Bild des politisch mächtigen Geschäftsmannes prägten, sind in ihrem politischen Einfluss beschnitten. Sie gehören nicht zum inneren Kreis um Putin, der die Oligarchen vielmehr verstaatlicht hat. Einst mächtige Magnaten unterwarfen sich dem Diktat des Kremls. Unter Putin ist der Einfluss des Staatsapparates und vor allem seiner Vertrauten auf die Wirtschaft gewachsen, entstanden ist daraus ein feudalistisches System. Diese Entwicklung beschränkt sich nicht auf Russland. In Saudiarabien feierte Kronprinz Mohammed bin Salman seinen Einstand damit, dass er Dutzende Mitglieder des Königshauses und Geschäftsmänner unter dem Vorwurf der Korruption im Luxushotel Ritz Carlton festsetzen liess. Erst als die unfreiwilligen Gäste zusagten, einen erheblichen Teil des Vermögens dem Staat abzutreten, durften sie das Hotel verlassen. Und in China verschwand der einst reichste Mann des Landes, Jack Ma, in der Versenkung und musste Schritt für Schritt die Kontrolle über seinen Konzern abgeben. Wer neben der Kommunistischen Partei und Staats- und Parteichef Xi Jinping zu einflussreich wird, wird auf Normalmass zurückgestutzt. In den vergangenen Jahren verengte sich insgesamt der Spielraum für private Unternehmen in China. Kritik von links und rechts Die Klage, dass in einer Welt der Hyperglobalisierung, wie auch immer diese definiert ist, Regierungen und Nationalstaaten nichts zu sagen hätten und von Konzernen und gesichtslosen, globalisierten Eliten regiert würden, kommt aus dem linken und rechten politischen Spektrum. Die Kritik blendet häufig aus, dass die internationale Arbeitsteilung wohl das grösste und erfolgreichste Programm ist, um Armut und globale Ungleichheit zu bekämpfen. Es stimmt, dass die Globalisierung, die nach dem Fall des Kommunismus und dem Aufstieg Chinas den Turbo einschaltete, zu Gewinnern und Verlieren führte. Was banal klingt, ist politischer Zündstoff. Zu den Gewinnern zählten vor allem die Bevölkerungsschichten in asiatischen Ländern, besonders in China, die ihr Einkommen steigern konnten. Die Verlierer hingegen waren häufig in den «Rostgürteln» westlicher Industrieländer zu finden, die vom weltweiten Strukturwandel abgehängt wurden. Abgeschwächte Ungleichheit Der Ökonom Branko Milanovic, der als führender Experte für globale Ungleichheit gilt, schreibt in seiner jüngsten Studie, dass in den vergangenen 30 Jahren die grösste Umschichtung von Einkommen seit der industriellen Revolution stattgefunden habe. Gleichzeitig findet er, dass zwischen 2008 und 2018 weltweit die Einkommen der ärmsten Familien am stärksten gewachsen seien mit rund 7 Prozent jährlich; die globale Mittelschicht erlebte derweil einen Zuwachs von 6 Prozent, und die Mittelschicht in den Industrieländern sowie die Reichsten sahen ihre Einkommen mit 2 Prozent wachsen. Das stellt einen Kontrast dar zum früheren Befund, dass zwischen 1988 und 2008 die Einkommen der mittleren Schichten in den reichen Ländern und der Allerärmsten nicht gewachsen sind. Auch andere Daten zeigen, dass sich negative Folgen der Globalisierung abgeschwächt haben: Ab 2010 ging das grosse Exportwachstum Chinas stark zurück, weil in China die Löhne zuvor gestiegen waren. Die Politik vor allem in den USA (Stichwort: Trump) und im Vereinigten Königreich (Brexit) kümmerte sich erst spät um Globalisierungsverlierer und bot in den vergangenen Jahren oft Lösungen für Probleme der Vergangenheit. Neben den ungleichen Verteilungswirkungen führte die Globalisierung aber tatsächlich zu Spannungen mit nationalstaatlicher Souveränität und demokratischer Legitimation. Nationale Regierungen machten jedoch häufig ihre Hausaufgaben wie die Förderung von Weiterbildungsmöglichkeiten oder soziale Abfederungen nicht und verwendeten die Globalisierung als Sündenbock für eigene Versäumnisse. «Merkantilisten aller Länder, vereinigt euch!» Der Krieg in der Ukraine hat eine weitere Annahme der bisherigen Weltordnung zum Einstürzen gebracht: Freier Handel bringt nicht zwangsläufig Frieden. Diese Lektion hatte die Welt bereits angesichts des Ersten Weltkriegs lernen müssen. Kurz vor Kriegsausbruch hatte Norman Angell das Buch «Die grosse Illusion» veröffentlicht, in dem er aufzeigen wollte, dass die ökonomischen Kosten eines Krieges so hoch seien, dass moderne Industriestaaten keinen Nutzen aus einer kriegerischen Auseinandersetzung ziehen können. Die Hoffnung erwies sich als grosse Illusion. Während der Hochphase der Globalisierung in den 1990er und 2000er Jahren herrschte eine ähnliche Vision wie diejenige von Angell: Die ehemals kommunistischen Staaten und China würden durch die wirtschaftliche Integration zu einem strategischen Partner des Westens. Und der freie Fluss von Menschen, Gütern, Kapital und Ideen werde, angetrieben durch die Digitalisierung, zu gemeinsamen Interessen und Frieden führen. Dies erwies sich als Irrtum. China stieg vielmehr zu einem strategischen Konkurrenten der USA auf, und Russland hat das Trauma des Verlusts seines Imperiums bis heute nicht verwunden. Seit der Pandemie und dem Aufkommen von Lieferkettenproblemen ist oft die Rede von Re-, Off- und Friend-Shoring, der Fragmentierung der Welt, der Entkoppelung der chinesischen und amerikanischen Wirtschaft, der Eindämmung des strategischen Gegners, einem neuen kalten Krieg oder gar einem weltweiten heissen Krieg. Die grösste Gefahr für die Globalisierung sind nicht mehr deren Exzesse, nein, es ist die Geopolitik. «Merkantilisten aller Länder, vereinigt euch!», lautet offenbar die Devise. Unter den Schlagworten nationaler Sicherheit, Job-Garantie und Entkarbonisierung werden in der westlichen Welt protektionistische Schranken aufgebaut. Globalisierung ist kein Selbstzweck Weltweit ist die aggressive Industriepolitik wieder auf dem Vormarsch, die USA lancieren mit der Inflation Reduction Act einen Subventionswettlauf im Bereich der grünen Technologien, wobei China schon seit langem viel Geld in die Hand nimmt, um Wirtschaftszweige zu fördern. Die EU reagiert mit einem gross angelegten Industrieplan. Die USA, der bisherige Hüter des freien Welthandels, hantieren vermehrt mit Exportkontrollen, um Russland und vor allem China in Schach zu halten. Ausserdem nehmen in westlichen Ländern die Investitionsprüfungen ausländischer Unternehmen zu. Die deutliche Zunahme von Wirtschaftssanktionen in den vergangenen Jahren zeigt auch, dass Handelspolitik verstärkt als Teil der Aussenpolitik verstanden wird. In den Handelszahlen und weltweiten Investitionen lässt sich diese Entwicklung noch nicht ablesen, das internationale Handelssystem – und damit eine wichtige Grundlage des weltweiten Wohlstands – ist durch diese Entwicklung aber mehr als nur gefährdet. Globalisierung ist kein Selbstzweck, und die vergangenen dreissig Jahre freier Weltmärkte waren historisch gesehen wohl die Ausnahme und nicht die Norm. Auch ist es richtig, dass die Regeln der Weltwirtschaft von demokratisch legitimierter Politik und nicht von einem rein ökonomischen Kalkül und von internationalen Gremien geprägt sein sollen. Die Welt driftet aber nicht in Richtung eines fröhlichen Nebeneinanders demokratischer Nationalstaaten, die miteinander emsig handeln und in einem Wettbewerb der Systeme stehen. Vielmehr entwickelt sich ein schädliches Nullsummenspiel zum Schaden aller. Dies gilt es zu verhindern."
