bba49d6d-d80d-4a51-bfc2-9699daed0592,2023-02-07 04:00:03,"Aktuell ist noch nicht genug Energie aus Wind und Solar vorhanden, um grünen Wasserstoff in großen Mengen herzustellen. Laut der Umweltschutzorganisation Greenpeace muss sehr genau abgewogen werden, wo in Deutschland künftig grüner Wasserstoff produziert werden kann, weil die Herstellung sehr viel Wasser benötige. Der enorme Bedarf an grünem Wasserstoff werde nicht ausschließlich vor Ort produziert werden können. Wasserstoff ist Klimaschutz und die neue Wirtschaftskraft, so wird der Energieträger der Zukunft momentan fast überall beworben. Vor allem, wenn er grün ist. Denn nur dann wird er in der sogenannten Elektrolyse, dem Verfahren, bei dem Wasserstoff entsteht, mit Wind- und Solarenergie hergestellt, sauber. Das Verfahren ist recht simpel, erklärt Johannes Wege von HYPOS, einem Netzwerk, das Wirtschaft und Forschung rund um den Wasserstoff vereint. Bei der Elektrolyse werde mit elektrischem Strom das H2O-Molekül (Wasser) in H2 und O, also Sauerstoff gespalten. ""Wenn dieser Strom, den wir dafür nutzen, regenerativ hergestellt wurde, dann sprechen wir von grünem Wasserstoff, weil dieser keine CO2-Emissionen verursacht. Wir können nicht einfach nur Leitungswasser nutzen, dieses muss vorbehandelt werden. Wir sprechen da von deionisiertem Wasser, was destilliertem Wasser sehr nahekommt"", erklärt Wege. Deshalb, meint Karsten Smid von Greenpeace, müsse da zukünftig schon sehr genau abgewogen werden, wo die Produktion in Deutschland Sinn ergibt, denn in Folge der Klimakrise werde deutlich, dass sich der Wasserhaushalt extrem verändere: ""Gerade in Brandenburg und Sachsen gab es extreme Dürrejahre. Allerdings ist es auch so, dass Industrieprozesse oftmals wesentlich mehr Wasser verbrauchen als die Herstellung von Wasserstoff. Da muss ich mir den Standort genau angucken. Aber wenn ich den richtig wähle, kann ich das auch in Deutschland in einem begrenzten Umfang machen."" Import von grünem Wasserstoff aus Afrika Wo dieser begrenzte Umfang genau liegt, lasse sich Stand heute noch nicht genau abschätzen, sagt Smid. Doch der enorme Bedarf an grünem Wasserstoff, da ist sich der Experte sicher, werde nicht ausschließlich vor Ort produziert werden können. Deshalb setzen alle Beteiligten, auch die Bundesregierung, auf den Import von grünem Wasserstoff, vor allem wohl aus Afrika: ""Da sind die heißen Wüstenregionen, die auch oftmals windreich sind, sehr gute Standorte. Aber natürlich fehlt mir dort das Wasser. Genau da kann ich dann aber den Strom an die Küsten transportieren und dort dann das Wasser mit Hilfe von Meerwasserentsalzungsanlagen erzeugen"", erklärt Smid. Wichtig sei allerdings, dass zusätzliche Anlagen gebaut werden. Damit die eh schon knappe Ressource Wasser vor Ort nicht noch knapper werde und es zu Verteilungskämpfen komme: ""Diese zusätzlichen Anlagen müssten dort mit Projekten entstehen, gemeinsam mit der Bevölkerung. Da ist es auch ganz wichtig, dass genügend Süßwasser produziert wird, vielleicht Teile auch zur Versorgung der Menschen vor Ort. Genauso wie es sinnvoll ist, auch den grün erzeugten Strom dort erst einmal vor Ort zu nutzen und nur einen Teil zu importieren."" Denn, so Karsten Smid von Greenpeace: Nicht nur wir Europäer haben ein Recht auf sauberes Wasser und sauberen Strom, sondern definitiv auch die Menschen in Afrika."
e1711d26-4dfc-499a-bccc-1815e7793fed,2023-02-07 07:03:24,"In Deutschland werden bislang weit weniger Häuser und Wohnungen energieeffizient modernisiert, als es nach Einschätzung von Fachleuten zur Einhaltung der Klimaziele notwendig wäre. „Jedes Jahr werden nur rund 500.000 Wohneinheiten energetisch vollständig saniert“, sagte Ralph Henger, Wohnungsmarktexperte beim Institut der deutschen Wirtschaft in Köln, der Deutschen Presse-Agentur. Bei rund 42,5 Millionen Wohnungen in Deutschland liegt die jährliche Sanierungsquote damit bei etwas mehr als einem Prozent. „Um unsere Klimaziele zu erreichen, müssten es aber doppelt so viele sein“, sagt Henger. In einer Umfrage des Bundesverbands deutscher Wohnungs- und Immobilienunternehmen (GdW) vom Dezember 2022 nannten 84 Prozent der befragten Wohnungsunternehmen die gestiegenen Materialkosten als wesentliche Modernisierungsbremse. 57 Prozent sahen die gestiegenen Finanzierungszinsen und 55 Prozent die fehlenden Bau- und Handwerkskapazitäten als Hindernis. „Die aktuellen Rahmenbedingungen reichen nicht aus, um genügend Gebäudeeigentümer davon zu überzeugen, in ihr Gebäude zu investieren und energetische Effizienzmaßnahmen durchzuführen“, sagte Henger. Da ein großer Teil der Bevölkerung sich steigende Mietkosten nicht leisten könne, müssten Modernisierungen vor allem bezahlbar bleiben, sagt eine Sprecherin des Immobilienkonzerns Vonovia. Ohne Hilfe der Politik sei die Branche langfristig aber nicht in der Lage, in die Energiewende zu investieren und gleichzeitig Mieten stabil zu halten. Ziel der Bundesregierung ist, dass der Gebäudebestand in Deutschland bis 2045 klimaneutral wird. Neben dem nachhaltigen Neubau liegt der Fokus staatlicher Förderungen vor allem auf der Sanierung bestehender Gebäude, da man sich hier den größeren Klimaschutzeffekt verspricht. Immobilienunternehmer fordern kommunale Wärmeplanung Im vergangenen Jahr hatte der Staat nach Angaben des Bundesamts für Wirtschaft und Ausfuhrkontrolle (Bafa) rund 2,6 Milliarden Euro an Fördergeldern für die energetische Sanierung ausgezahlt, 85 Prozent mehr als noch im Jahr zuvor. Das Fördergeld soll helfen, Wohnungen und Häuser so zu modernisieren, dass sie dauerhaft Energie einsparen – zum Beispiel durch die Erneuerung von Heizungsanlagen, die Dämmung von Dächern und Außenwänden oder den Austausch von Fenstern und Haustüren. Der GdW kritisiert, die Bundesregierung setze den Fokus auf „teure energetische Einzelmaßnahmen mit viel zu geringer Wirkung“. Trotz der Milliardeninvestitionen stagniere der Energieverbrauch der Haushalte. Anstatt die energetische Erneuerung einzelner Wohneinheiten anzugehen, sei es sinnvoller und günstiger, „die Energieversorgung der Gebäude im Quartierszusammenhang CO₂-arm zu machen“, sagte GdW-Präsident Axel Gedaschko. Er schlägt etwa eine kommunale Wärmeplanung und einen Abbau von Hürden beim Mieterstrom vor. Dieser wird in unmittelbarer Nähe zum Abnehmer – zum Beispiel von Solaranlagen auf dem eigenen Dach – produziert. „Dann klappt's auch mit der CO₂-Reduktion und den Klimazielen“, sagte Gedaschko. (dpa)"
b352a44b-3059-47d9-8776-8df334139378,2023-02-07 09:53:13,"Gut 5000 Todesopfer, 16.000 Verletzte und Tausende Vermisste in der Türkei und Syrien. So lautete am Dienstagmorgen die schreckliche Bilanz einen Tag nach dem schwersten Erdbeben in der Region seit Jahren. Auch die wirtschaftliche Infrastruktur wurde von den wiederholten Erdstößen mit einer Stärke von 7,7 tief getroffen. Tausende Häuser sind zerstört, Kliniken und andere öffentliche Einrichtungen beschädigt, Straßen teils nicht befahrbar. Die Höhe des wirtschaftlichen Schadens ist nicht annähernd absehbar, er wird aber in die Milliarden gehen."
b470c7ac-b3ec-4180-b673-6cd3f7e22309,2023-02-07 13:02:13,"Frau Zhang, Sie sind Initiatorin des „Female Impact Summit“, der am Freitag erstmalig stattfindet. Neben sehr wenigen Männern, die im Programm auftreten, haben Sie 120 Frauen in den Capital Club geladen. Was passiert da? Mit dem Summit möchte ich vorwiegend Frauen aus unterschiedlichen Generationen und Bereichen der Wirtschaft zusammenbringen: von Konzernvorständinnen, Familienunternehmerinnen bis hin zu Gründerinnen und Influencerinnen. Es ist ein bunter Mix zum Austausch und zur gegenseitigen Inspiration. Ursprünglich ist die Idee im vergangenen Jahr in der Pandemie entstanden. Denn dadurch, dass viel mehr digital passierte, habe ich einige neue, spannende Impulsangeberinnen außerhalb meines bestehenden Netzwerkes kennengelernt. Und schon seit Jahren gebe ich einen größeren Neujahrsempfang – nur diesmal wird es so sein, dass ich speziell etwas Frauen widmen möchte."
3e5a9fc2-5738-4244-bffd-d5e9fb6ea68f,2023-02-07 21:42:55,"Es ist seit 2013 die 5. Auflage des Verzeichnisses, das wirtschaftliche Erfolgsgeschichten aus Südwestfalen ins Rampenlicht rückt. 14 Unternehmen sind jetzt neu in diese Riege aufgenommen worden. „Mit der Weltmarktführer-Kampagne haben die südwestfälischen Industrie- und Handelskammern einen wichtigen Beitrag zum Regionalmarketing Südwestfalen geleistet“, sagte Ralf Stoffels, Präsident der SIHK zu Hagen. „Das Weltmarktführer-Verzeichnis stellt Leuchttürme der regionalen Wirtschaft heraus. Sie sind sozusagen Botschafter Südwestfalens, gleichwohl es noch weit mehr erfolgreiche Unternehmen in der Region gibt“, betonte Ralf Stoffels. Sie alle leisteten zudem einen wichtigen Beitrag gegen den Fachkräftemangel, weil sie die Stärken der Region in Kombination mit den Karrieremöglichkeiten herausstellten. „Deshalb freue ich mich auch, dass sich inzwischen mehr als 300 Unternehmen als Mitglieder im Verein Wirtschaft für Südwestfalen engagieren und damit aktiv das Regionalmarketing unterstützen.“ Auch die IHKn gehörten von Anfang an zu den Motoren des Regionalmarketings. Staatssekretär Christoph Dammermann: „Für die Öffentlichkeit ist es immer wieder erstaunlich, wie viele Weltmarktführer es in einzelnen Industriebranchen in Nordrhein-Westfalen gibt. Es sind nicht zwangsläufig nur die großen Konzerne, sondern vielmehr auch kleine und mittlere, oftmals familiengeführte Unternehmen, die in ihrer jeweiligen Produktpalette Bestleistungen erbracht haben und damit weltweit präsent sind. Daher freut es mich als Wirtschaftsstaatssekretär unseres Landes ganz besonders, dass sich die IHKs in Südwestfalen zum Ziel gemacht haben, diese ‘hidden champions‘ auch in der 5. Auflage ihres Weltmarktführerverzeichnisses in ihren Regionen, aber auch darüber hinaus, bekannt zu machen.“ Im Anschluss erhielten die neu aufgenommenen Weltmarktführer und Bestleister ihre Urkunden. Neu aufgenommen ins Verzeichnis der Weltmarktführer und Bestleistungen wurden: Borbet GmbH - Weltmarktführer für Leichtmetallräder (Hallenberg) Busch-Jaeger Elektro GmbH - Weltmarktführer für SCHUKO-Steckdosen (Lüdenscheid) Deutsche Holzveredelung Schmeing GmbH & Co. KG - Weltmarktführer für Kunstharzpressholz als thermische Isolierung für Flüssiggastanklager und als elektrische Isolierung für Großformatoren (Kirchhundem) dy-pack Verpackungen Gustav Dyckerhoff GmbH - Technologieführer in Europa bei papierbasierten Verpackungslösungen für feine Pulver (Wenden) Kirchhoff GmbH & Co. KG - Weltmarktführer in der Herstellung und Bearbeitung von kundenspezifischen Sonderflanschen für den Bereich Sanitär und Heizung (Drolshagen) Julius Klinke GmbH & Co. KG - Weltmarktführer für Klavierbestandteile und komplexe Präzisionsdrehteile (Neuenrade) KRACHT GmbH - Weltmarktführer für Durchflussmesstechnik (Werdohl) Lübke & Vogt GmbH & Co. KG - Weltmarktführer für kleine technische Gummiformteile in großen Serien (Sundern) MAGNA BDW technologies Soest GmbH - Weltmarktführer für dünnwandige PKW-Strukturbauteile aus Aluminium-Guss (Soest) Georg MENSHEN GmbH & Co. KG - Weltmarktführer von Kunststoffverschlüssen und Systemverpackungen (Finnentrop) P.J. Prause Durotec GmbH - EU-Marktführer für Blattfedern aus Faserverbundwerkstoffen im Flachformat (Arnsberg) SCHELL GmbH & Co. KG Armaturentechnologie - Weltweit führender Hersteller von Armaturen für die Gebäudeinstallation im Produktsegment Eckventile (Olpe) SCHMITZ u. Söhne GmbH & Co. KG - Weltmarktführer für gynäkologische und urologische Untersuchungsstühle (Wickede) Walter Stauffenberg GmbH & Co. KG - Weltmarktführer für Befestigungssysteme für Rohr- und Schlauchschellen in der Hydraulik (Werdohl)"
63dde09f-ce8c-4230-b8c9-e5598eabf71d,2023-02-08 04:30:00,"Anton Siluanow hat den derzeit vermutlich schwersten Job der gesamten Kremlführung. Der 59-Jährige ist russischer Finanzminister und sah sich im abgelaufenen Januar einem Loch im Staatshaushalt in Höhe von 1,77 Billionen Rubel, umgerechnet rund 23,1 Milliarden Euro, gegenüber. Weiterlesen nach der Anzeige Bereits im ersten Monat des Jahres macht das damit 60 Prozent des Fehlbetrages aus, den Russland eigentlich für das gesamte Jahr eingeplant hat. Was nur bedeuten kann: Es muss eisern gespart oder das Tafelsilber muss verkauft werden. Weil sich Sparen und das Führen eines Krieges nachgerade ausschließen, hat sich der Kreml dazu entschlossen, an die Ersparnisse zu gehen. Und so vermeldete die russische Nachrichtenagentur Tass unkommentiert unter Berufung auf das russische Finanzministerium, man habe im Januar 2,27 Milliarden chinesische Yuan (umgerechnet rund 309 Millionen Euro) am Devisenmarkt verkauft. Weiterlesen nach der Anzeige Dazu kämen 3,6 Tonnen Gold aus der staatlichen Reserve. Das entspricht rund 200 Millionen Euro. „Die dadurch erzielten Mittel wurden zur Deckung des Defizits auf das Konto des Staatshaushalts überwiesen“, so die Mitteilung. Rückgang der Öl- und Gaseinnahmen um 46 Prozent Die Haushaltslücke war entstanden, weil die Einnahmen aus Erdöl- und Erdgasverkäufen im Vergleich zum Vergleichsmonat des Vorjahres drastisch zurückgegangen sind – und zwar um 46 Prozent. Insgesamt nahm der russische Staat 35 Prozent weniger ein als im letzten Friedensmonat 2022. Was einerseits bedeutet, dass die Sanktionen greifen und dem russischen Staat allmählich das Wasser abgraben. Was aber andererseits heißt, dass Russlands Militärmaschine weiterläuft, solange sie aus den Reserven geschmiert werden kann. Nach Darstellung des russischen Finanzministeriums verfügt das Land derzeit über Reserven in Höhe von 10,4 Milliarden Euro, 307,4 Milliarden Yuan und 551,2 Tonnen Gold. Das wäre erheblich weniger als noch im November 2022 gemeldet (siehe Grafik). Die finanzielle Situation für den Aggressor wird also zunehmend ungemütlicher. Dabei sollen die Ausgaben für das Militär 2023 noch einmal um 71 Milliarden US-Dollar steigen, wie das russische Wirtschaftsportal RBK berichtet. Auch die Ausgaben für Posten wie „nationale Sicherheit“, zu der unter anderem die Polizei gehört, sollen um dieselbe Summe klettern. Größere Ausgaben werden zudem für Soldaten, ihre Familien, Rentnerinnen und Rentner sowie Mindestlöhne fällig, um so den sozialen Frieden zu wahren. Wie geht das, bei sinkenden Staatseinnahmen? Weiterlesen nach der Anzeige Der Harvard-Ökonom Ken Rogoff sagte jüngst auf dem Weltwirtschaftsforum in Davos, er „glaube nichts, was die Russen sagen, wenn es um Zahlen geht“. Das betrifft zum Beispiel das offiziell nur um knapp über 3 Prozent geschrumpfte Bruttoinlandsprodukt. Auch die Weltbank geht im laufenden Jahr von einer lediglich um 3,3 Prozent geschrumpften russischen Wirtschaft aus. Doch Stimmen von Ökonomen und detaillierte Wirtschaftsdaten lassen eine andere Bewertung realistisch erscheinen. „Das Bruttoinlandsprodukt ist in Kriegszeiten kein aussagekräftiges Instrument“, erklärte der angesehene russische Ökonom Sergej Gurijew Ende Januar bei der „Global Economy Lecture 2023″ an der österreichischen Nationalbank in Wien laut „Handelsblatt“. Das BIP habe keine Aussagekraft über die wirkliche wirtschaftliche Lage im Krieg, weil die Rüstungsproduktion drastisch hochgefahren werde, sagt Gurjiew, Vorstand der Pariser Elitehochschule Sciences Po, der 2013 aus Russland geflohen ist. So entstehen zwar zahlreiche Güter, diese landen allerdings nie auf dem für alle zugänglichen Markt. Die westlichen Sanktionen gegen Russland bezeichnete Gurijew als effektiv. Weiterlesen nach der Anzeige Potemkin-Indikatoren Der aus Russland geflohene frühere Vizeenergieminister Wladimir Milow nennt die offiziellen Daten über das BIP oder über eine Erholung des Rubel-Kurses „Potemkin-Indikatoren“. Sie wären ein Indikator für die tatsächliche wirtschaftliche Situation. Aussagekräftiger seien dagegen der Rückgang des privaten Konsums 2022 um fast 10 Prozent oder der um 7,5 Prozent geringere Wasserverbrauch im Land. Dieser ist für die Industrieproduktion und Ölförderung wichtig. Rogoff prophezeit dem Land daher eine Welle „unvorstellbare Armut“, verglichen mit dem jetzigen Lebensstandard: „Schauen Sie sich den Iran an, schauen Sie sich Nordkorea an, schauen Sie sich Venezuela an, schauen Sie sich Kuba an. Darauf steuert Russland zu“, so der ehemalige Chefökonom des Internationalen Währungsfonds. „Das wird die Transformation der russischen Wirtschaft: sie gehen zurück vom 21. ins 20. Jahrhundert. Das ist sehr traurig, aber das ist, was man auch in Kuba, im Iran und in Nordkorea sehen kann“, berichtet auch der russische Ökonom Guriew in der „Tiroler Tageszeitung“. Neben dem Verkauf von Devisen- und Goldreserven scheint der Kreml zunehmend Pensionskassen zu plündern. Bereits 2022 soll Siluanow laut Bloomberg etwa 30 Milliarden Dollar entnommen und dem Haushalt zugeführt haben, sodass der sogenannte Wohlfahrtsfonds nur noch 148 Milliarden Dollar stark sei. Der Wohlfahrtsfonds wurde 2008 gegründet und investiert in Aktien und andere Anlagen, um das russische Pensionssystem zu finanzieren. Weiterlesen nach der Anzeige „Danach bleiben noch die Sozialausgaben. Die Armutsquote in Russland wird sicher deutlich steigen. Irgendwann wird Russland wieder so aussehen wie die Sowjetunion, ein graues Land mit autoritärem Militär und einer unterdrückten Bevölkerung“, prophezeite der Militärökonom Marcus Keupp, Dozent an der Militärakademie der ETH Zürich, im Magazin „Capital“. Zudem werden die Rücklagen der Staatsunternehmen geplündert – in Form höherer Dividenden (mehr als 50 Prozent der Gewinne) und zu leistender Einmalzahlungen. Gazprom hat als „Cashcow“ ausgedient So mussten bereits 2022 Aktionäre des Staatskonzerns Gazprom trotz eines Rekordjahres „freiwillig“ auf ihre Dividende in Höhe von 20 Milliarden Euro verzichten. Der Hauptaktionär, der russische Staat, ließ auf der Hauptversammlung abstimmen. Ergebnis: Kraft seiner Mehrheit von 50,3 Prozent der Aktionäre verzichteten alle auf die Auszahlung der Dividende. Der Betrag wurde angesichts der „militärischen Spezialoperation“ dem Staatshaushalt zugeführt. Doch zumindest das wird sich nicht wiederholen: Gazprom hat angesichts des Embargos längst als „Cashcow“ ausgedient. Ohne diese Plünderungen hätte das russische Staatsdefizit bereits im letzten Jahr 64 Milliarden Dollar betragen – trotz der guten Einnahmen für Öl und Gas aufgrund astronomisch hoher Gaspreise. Dieses Jahr wird es dem Kreml schwerfallen, die Löcher kreativ zu stopfen. Die Ausgaben für einen zunehmend totalitär geführten Krieg werden steigen und die Einnahmen aus dem Öl- und Gasgeschäft werden kollabieren. Weiterlesen nach der Anzeige Ein weiteres, für die russische Wirtschaft elementares Problem ist der Mangel an Arbeitskräften: „Schätzungsweise fehlen der russischen Wirtschaft jetzt eine Million qualifizierte Arbeitskräfte. Neben den Mobilisierten sind auch die 700.000 Menschen eingerechnet, die geflohen sind“, so der Militärökonom Keupp. „Der Arbeitskräftemangel trifft Moskaus Wirtschaft empfindlich. Gerade der Finanz- und Dienstleistungssektor ist in Russland sehr IT-intensiv. (…) Diese langfristigen Folgen darf man nicht unterschätzen. Sollte Putin eine zweite, dritte oder vierte Mobilisierungswelle starten, wird die Wirtschaft schnell zugrunde gehen“, glaubt Keupp. Inzwischen bereitet die EU ihr zehntes Sanktionspaket gegen Russland vor – dieses Mal soll es auch um Strafmaßnahmen gegen die mächtige Atomindustrie des Landes gehen. Uran, Brennstäbe und Nukleartechnik durften bislang ungehindert importiert werden. Das soll sich ändern."
7178e108-b83f-4275-9948-5cfa37534d8b,2023-02-08 06:00:00,"Jedes Jahr bringt das Magazin „Stern“ eine Rangliste der beliebtesten Arbeitgeber heraus. In Zeiten des Fachkräftemangels eine wohl immer bedeutendere Veröffentlichung. Nur drei Arbeitgeber aus dem Kreis Ravensburg und dem Bodenseekreis sind unter den 650 gelisteten Unternehmen zu finden. Die Industrie- und Handelskammer (IHK) hat dafür eine Erklärung und sagt: „Die Region bietet hochattraktive Arbeitsplätze.“ Doch was steckt überhaupt hinter dem Ranking? Jedes Jahr beauftragt das Magazin „Stern“ das Marktforschungsunternehmen „Statista“ mit einer bundesweiten Umfrage unter Arbeitnehmern. Gesucht werden dabei die beliebtesten Arbeitgeber Deutschlands. Mehr als 43.000 Beschäftigte wurden dabei zu ihren eigenen Firmen, aber auch anderen Unternehmen ihrer Branche befragt. Dabei wurden nur Unternehmen bewertet, die mindestens 500 Beschäftigte in Deutschland haben. Der „Stern“ listete Ende Januar die 650 Top-Arbeitgeber dann in einer Gesamtrangliste und in 24 Unterkategorien auf. Wer sind die großen Gewinner? Der Gewinner der Gesamtrangliste 2022 ist Porsche – die übrige Tabellenspitze ist eine Ansammlung der bekanntesten Firmen Deutschlands. Unter anderem BMW, BASF, Adidas und DM tummeln sich unter den ersten zehn. Die besten Arbeitgeber aus dem südlichen Württemberg sind aus Biberach: Boehringer Ingelheim auf Platz 10 und Liebherr auf Platz 12. Welche Unternehmen aus der Region Bodensee-Oberschwaben sind dabei? Unternehmen aus dem Schussental, dem Allgäu oder vom Bodensee sucht man in der Top-50-Liste vergeblich. Nur in den Unterkategorien wird man fündig. Der Baumaschinenhändler Zeppelin aus Friedrichshafen belegt beispielsweise in der Kategorie „Schienen-, Schiffs- und Flugzeugbau“ Platz 5. In der Gesamtrangliste verpasst das Traditionsunternehmen mit dem 67. Rang nur knapp die Top 50. Der zweitbeliebteste Arbeitgeber der Region ist ebenfalls aus Friedrichshafen: In der Kategorie „Automobil und Zulieferer“ landet ZF auf Rang 10 – hinter dem direkten Branchenkonkurrenten Bosch (6. Platz), aber vor Continental (13. Platz). Der größte Arbeitgeber Friedrichshafens belegt in der Gesamtrangliste Platz 92. Als drittes Unternehmen aus der Region Bodensee-Oberschwaben schafft es Vetter in die „Stern“-Liste. Der Pharmadienstleister belegt Platz 25 in der Kategorie „Pharma und Medizintechnik“. Die regionalen Konkurrenten Boehringer Ingelheim (1. Platz), Zeiss aus Oberkochen bei Aalen (11. Platz) und Karl Storz aus Tuttlingen (17. Platz) liegen vor den Ravensburgern. In der Gesamtrangliste landet Vetter auf dem 221. Platz. Bei Vetter freue man sich über diese Platzierung, sagt Geschäftsführer Peter Sölkner auf Nachfrage der „Schwäbischen Zeitung“. Dies unterstreiche die Bedeutung und die positive Wahrnehmung des Familienunternehmens. Was sagen andere große Arbeitgeber der Region? Andere große Arbeitgeber der Region fehlen jedoch. Wie beispielsweise die Stiftung Liebenau in der Kategorie „Gesundheit und Soziales“ – in der vergleichbare soziale Träger gelistet sind. So ein Ranking könne schon eine Entscheidungshilfe bei der Arbeitgeberwahl sein, sagt Pressesprecher Ulrich Dobler. „Aus der Praxis wissen wir, dass bei diesen Entscheidungen vor allem standortbezogene Kriterien – wie zum Beispiel die Entfernung zwischen Arbeits- und Wohnort und persönliche Empfehlungen – wichtige Kriterien sind.“ Die Stiftung Liebenau macht sich also nicht verrückt. Durch die wachsenden Klick-Zahlen auf der Karriereseite habe man Gewissheit, dass ein konstantes Interesse an der Stiftung Liebenau als Arbeitgeber besteht, sagt Dobler. Ein weiteres Unternehmen, das man im Ranking hätte erwarten können: Hymer aus Bad Waldsee. Enttäuscht sei man nicht, „das wäre übertrieben“, sagt Unternehmenssprecher Frank Heinrichsen. „Es würde uns natürlich freuen, in solch einem erlauchten Kreis aufzutauchen – aber das hat für uns keine übermäßige Bedeutung.“ Eine gewisse Bekanntheit werde jedoch wichtiger, so Heinrichsen. Hymer müsse sich verstärkt über die Region hinweg nach Mitarbeitern umschauen. „Das passiert bereits und dabei merken wir, dass wir schon eine gewisse Strahlkraft haben.“ Warum ist Bodensee-Oberschwaben dennoch eine Top-Arbeitgeberregion? Warum so wenige Arbeitgeber aus der Region vertreten sind, beantwortet die IHK Bodensee-Oberschwaben. „Stern“ und „Statista“ berücksichtigen nur große Unternehmen, auf den Top-Platzierungen sind zudem nur echte Platzhirsche gelistet. Dagegen stehe die industrielle Struktur der Region, „die stark von mittelständischen Unternehmen geprägt ist“, sagt IHK-Pressereferent Moritz Schwier. Man wisse zudem nicht, inwieweit die Umfrage bei einigen Unternehmen aktiv herumgereicht wurde. Dadurch könne das Ergebnis für den einen besser, für den anderen schlechter ausfallen, so Schwier. Grundsätzlich findet die IHK, dass die Region gar nicht so schlecht vertreten ist. Neben Zeppelin, ZF und Vetter seien weitere Arbeitgeber im Ranking vertreten, bei denen nur der Hauptsitz außerhalb Oberschwabens liegt. Zum Beispiel Airbus (18. Platz), Rolls-Royce Power Systems (173. Platz), Claas (233. Platz) und Diehl (495. Platz). „Die Unternehmen der Region Bodensee-Oberschwaben bieten hochattraktive Arbeitsplätze in zahlreichen Zukunftsfeldern“, sagt Schwier – und seit Jahren werde bei vielen Unternehmen einiges für die Arbeitnehmer investiert. Die Herausforderungen des Arbeitgeberstandortes Bodensee-Oberschwaben würden woanders liegen. „So ist zum Beispiel der Wohnraum knapp und teuer, die Verkehrsanbindung ausbaufähig und die Versorgung mit schnellem Internet und Mobilfunk in vielen Gebieten weiterhin völlig unzureichend“, sagt Schwier. „Hier muss angesetzt werden, um für Fachkräfte Wohnraum und Attraktivität der Region zu ermöglichen. Die Unternehmen tun ihrerseits bereits sehr viel.“"
