9a745877-6ee1-44ca-befe-a581fb5d663f,2023-03-10 16:01:55,"Nach Ansicht von Kanzler Scholz wird die deutsche Wirtschaft deutlich wachsen. Als Grund sieht er den Wandel zu klimafreundlichen Technologien mit milliardenschweren Investitionen. Die Wirtschaftsverbände sind weniger optimistisch. Die Wirtschaft klagt über hohe Energiepreise, Inflation und den Krieg in der Ukraine, doch für Bundeskanzler Olaf Scholz ist das kein Grund, pessimistisch in die wirtschaftliche Zukunft zu blicken. Im Gegenteil: Bei einem Treffen mit Spitzen der deutschen Wirtschaftsverbände auf der Handwerksmesse in München zeigte er sich zuversichtlich. ""Wir haben allen Grund, optimistischer in die Zukunft zu blicken als noch vor einem Jahr, was unser eigenes Land betrifft"", sagte der Kanzler. Es sei gelungen, Deutschland in kürzester Zeit unabhängig von russischen Energieimporten zu machen und eine Energie- und Wirtschaftskrise zu verhindern. Auch auf den kommenden Winter sei man vorbereitet, betonte er. ""Milliardenschwere privatwirtschaftliche Investitionen"" Scholz' Zuversicht geht noch weiter: Der SPD-Politiker sieht wirtschaftliche Hochzeiten für Deutschland: ""Zunächst mal gehe ich davon aus, dass Deutschland vor einer Phase großen Wachstums liegt."" Scholz begründete seinen Optimismus mit dem Ziel, dass Deutschland bis 2045 Klimaneutralität erreichen müsse. Die Umsetzung des Klimaschutzgesetzes setze ""milliardenschwere, hunderte milliardenschwere privatwirtschaftliche Investitionen"" in einem Ausmaß voraus, ""wie wir das über viele Jahrzehnte gar nicht mehr gewohnt waren"". Als Beispiele nannte Scholz Investitionen in neue Erzeugungsanlagen für Windkraftanlagen auf hoher See oder an Land. Auch in das Stromnetz, neue Produktionstechniken und Produktionsverfahren, die Dämmung und den Neubau von Häusern sowie die Infrastruktur werde investiert. Während Deutschland diese Aufgabe zu bewältigen habe und dabei wachse, ruckele es manchmal auch, so Scholz - wohl im Hinblick auf koalitionsinterne Streitpunkte. Dies sei aber ""das bessere Problem"". ""Erheblicher Nachholbedarf"" Im Gegensatz zum zuversichtlichen Kanzler ist die deutsche Wirtschaft im Dauer-Sorgen-Modus: Zwar stellten die Spitzen der vier großen Wirtschaftsverbände BDI, BDA, DIHK und ZDH der Ampelregierung ein eher positives Zeugnis für ihre Krisenpolitik aus - mahnten aber, sich für die Zukunft zu wappnen. Deutschland brauche eine längerfristige Strategie, um weltweit erfolgreich zu bleiben, sagte der Präsident des Bundesverbandes der Deutschen Industrie (BDI), Siegfried Russwurm, schon vor dem Treffen. Deutschland habe hier ""noch erheblichen Nachholbedarf"". Problematisch seien die hohen Energiekosten, die Inflation, aber auch die Bürokratie. Zugleich habe Deutschland im weltweiten Vergleich die höchsten Steuern, was der globalen Wettbewerbsfähigkeit der Industrie ""ganz schön zu schaffen"" mache. Fachkräftemangel bekämpfen In einem gemeinsamen Positionspapier klingen die Verbände noch dramatischer: ""Der Verlust industrieller Wertschöpfung ist keine theoretische Gefahr mehr. Er findet bereits statt."" Sie fordern eine Steuersenkung für Kapitalgesellschaften auf 25 Prozent, die Beschleunigung von Planungs- und Genehmigungsverfahren, flexiblere Arbeitszeitmodelle hin zu Wochenhöchstarbeitszeiten, modernere Ruhezeitregelungen und eine schnellere Zuwanderung von Fachkräften. Auch Scholz erklärte die Sicherstellung von Fachkräften zur drängenden Herausforderung, sowohl durch Ausbildungen an Hochschulen als auch im Handwerk. Unter anderem müsse man sicherstellen, die Erwerbstätigkeit von Frauen durch gute Kinderbetreuung zu steigern und dafür zu sorgen, dass das Arbeitsleben möglichst lange attraktiv bleibe. Mit Blick auf die Zuwanderung von Arbeitskräften erklärte Scholz, dass sich diese ""in diesem Jahr erheblich beschleunigen"" werde. Experten sehen keine Pleitewelle Trotz der pessimistischen Töne aus der Wirtschaft sehen Fachleute bisher keine Anzeichen für einer Pleitewelle deutscher Unternehmen. In der Breite der Wirtschaft waren zuletzt zwar die Insolvenzzahlen auf Jahressicht gestiegen, lagen aber immer noch unter den langjährigen Werten."
12f5422e-7110-47ce-90a9-7990f487d168,2023-03-11 07:04:00,"Startseite Region Main-Taunus Sulzbach Frankfurt, Hamburg oder China: Produkte von Sulzbacher Firma sind weltweit gefragt Von: Walter Mirwald Die Elektrotechnische Firma Geiss aus Sulzbach sorgt mit ihren Produkten dafür, dass alles rund läuft. Sulzbach - Wer an dem Anwesen Bahnstraße 28 vorbeikommt, ahnt nicht, dass dort eine elektrotechnische Fabrik ihren Sitz hat, die in der Herstellung von Klemmbrettern für Elektromotoren ein führender Anbieter in Deutschland ist. Die Sulzbacher Firma „Ing. Erich Geiss GmbH & Co. KG“ ist ein Unternehmen mit weltweiten wirtschaftlichen Kontakten auf allen Kontinenten. Dessen Produkte sind in zahlreichen prominenten Bauwerken installiert und sorgen dort dafür, dass alles rund läuft. Auf dem Frankfurter Flughafen sind 26 000 in Sulzbach produzierte elektrotechnische Teile in den Beförderungsbändern für Gepäck installiert. In der Hamburger Elbphilharmonie stehen zwei Orgeln des Bonner Orgelbauers Klais mit technischen Teilen aus dem Haus Geiss. Im Gotthard-Tunnel in der Schweiz sind aus Sulzbach gelieferte elektrotechnische Elemente in den Brandlüftern eingebaut. In der Schalke-Arena kann der Boden auf- und zugeschoben werden - mit Hilfe von Klemmbrettern aus Sulzbach. Geiss: Nur wenige Sulzbacher kennen das Unternehmen Geschäftsführer Hans-Werner Geiss könnte die Aufzählung endlos lang fortsetzen. Er nennt als weitere greifbare Referenzgrößen den Berliner Funkturm, den Frankfurter Deutsche Bank Park und das Münchner Olympiastadion: „Dort steckt überall Geiss-Technologie drin.“ Geiss-Technologie steckt auch im großen Weihnachtsbaum im Main-Taunus-Zentrum und in der Weihnachtspyramide am Sulzbacher Dalles. Und zum krönenden Abschluss: Auch der zurzeit höchste Outdoor-Aufzug der Welt, der 330 Meter hohe und vollverglaste Bailong Elevator in China, ist mit Geiss-Elementen erbaut. Nur wenige Sulzbacher wissen, welch riesiges Rad in ihrem Wohnort von einem beachtlichen Gewerbesteuerzahler in der Gemeinde gedreht wird. Der 68 Jahre alte Geschäftsführer Hans-Werner Geiss, dem rund 50 Mitarbeiterinnen und Mitarbeiter, darunter seine 35 Jahre alte Tochter Claudia, zur Seite stehen, macht kein großes Aufhebens über sein weit verzweigtes Unternehmen. Aber das Kreisblatt durfte hinter die Kulissen schauen. Gründer des Unternehmens ist Hans-Werners Vater, der Ingenieur Erich Geiss, der 1981 im Alter von 69 Jahren starb. Erich Geiss startete 1947 mit einer reinen Vertriebstätigkeit für Firmen aus Frankfurt am Main und Hannover. Eines Tages erkannte er, überzeugt von seinem Wissen und seinen Fähigkeiten, dass er die Teile, die er vertreibt, auch selbst produzieren kann. Produkte aus Sulzbach: Zentraler Punkt in Elektromotoren der vielfältigsten Art 1956 fiel dann am Standort in der Sulzbacher Bahnstraße der Startschuss zur Produktion elektrotechnischer Komponenten wie Klemmbretter, Klemmleisten, Klemmbrettverbindungen, Schleifringkörpern oder Kollektoren. Mit vier Fachkräften ging es los. Die Fabrikanlage wurde auf dem firmeneigenen Betriebsgelände zwischen der Bahnstraße und der Straße „Am Schäfergraben“ sukzessiv erweitert. Heute gehört auch eine Fabrikhalle in der Wiesenstraße 10 zu dem Unternehmen. Dort ist ein Lager, und dort befindet sich die Automaten-Dreherei, in der die Schrauben für die Klemmbretter gedreht werden. In Hochzeiten beschäftigte das Unternehmen 100 Angestellte im Schichtbetrieb. „Aufgrund der wirtschaftlichen Situation und der Durchrationalisierung haben wir die Zahl heruntergeschraubt“, sagt Geiss, der einst in Frankfurt bei Tewes Industriekaufmann gelernt hat, bevor er in das väterliche Unternehmen eingestiegen ist. Mit in Sulzbach produzierten Klemmbrettern wurde die „Ing. Erich Geiss GmbH & Co. KG“ weltbekannt. Aber was verbirgt sich hinter dem Paradestück „Klemmbrett“? Geiss: „Schleifringkörper sorgen für die Stromübertragung in rotierenden Teilen.“ So sind die Geiss-Produkte zentraler Punkt in Elektromotoren der vielfältigsten Art, sogar in E-Loks und Schiffen in den USA. Firma aus Sulzbach: „Wunderbare Kontakte“ In der Sulzbacher Produktionsstätte stehen viele Maschinen, mit denen die Klemmbretter, die am Ende aussehen wie kleine Legosteine, in denen Schrauben stecken, produziert werden. Die Formen sind in den Druckpressen und Stanzautomaten in verschiedenen Größen eingestellt, Granulat wird eingegeben, erhitzt, gepresst, und so werden die Kleinteile hergestellt. Für die Endkontrolle ist die aus Italien stammende Lucia Cece zuständig, die bereits seit 32 Jahren in der Firma arbeitet. Dann werden die Teile verpackt und über Speditionen in die weite Welt verschickt. So international wie die Geschäftsbeziehungen, ist auch das Personal aufgestellt. „Menschen aus vielen Nationen sind bei uns beschäftigt“, sagt Geiss. Hans-Werner Geiss hat immer noch Spaß an seiner Arbeit: „Es macht Freude, weil ich rund um den Globus wunderbare Kontakte habe.“ Also vom kleinen Sulzbach mit gefragten Produkten in die weite Welt. Und wenn sich in der Adventszeit am Großen Dalles wieder die Weihnachtspyramide dreht, wissen jetzt die Sulzbacher: Hier steckt Geiss-Technologie aus dem Ort mit drin. (Walter Mirwald) Krise macht kreativ: Während das Geschäft mit dem Zwieback stagniert, setzt ein Traditionshersteller aus dem Hochtaunuskreis auf eine neue Kreation – mit Hanf."
18a2e767-5359-4e51-b337-5b758b1d7988,2023-03-11 13:18:28,"Im März 1873 und damit nur knapp drei Jahre nach ihrer Gründung in Berlin eröffnete Deutschlands heute größtes Kreditinstitut seine Türen in London als Deutsche Bank London Agency. 150 Jahre später ist die Deusche Bank, auch wenn sie wegen des Brexits einige hundert Arbeitsplätze nach Mailand, Paris, Amsterdam und Frankfurt verlagert hat, größter Arbeitgeber in der City. 6000 bis 7000 Mitarbeiter arbeiten dort für die Deutsche Bank. Nach den Feiern zum 150. Jubiläum steht im Oktober schon das nächste Ereignis an: der Umzug aus dem Winchester House in ein neues Gebäude schräg gegenüber."
52b3facd-9622-47bf-8434-fb953814fe7a,2023-03-12 11:30:00,"„Goodbye Britain, it was nice knowing you“, prangte im Mai 1975 auf der ersten Seite des Wall Street Journals. Das Land war am Boden. Alle wussten, Großbritannien war der „sick man of Europe.“ Die Inflation hatte 25 Prozent erreicht. Seit dem Ölpreisschock von 1973, als sie bei neun Prozent lag, hatte sie sich hochgeschaukelt. Arbeitnehmer aller Industrien streikten für höhere Löhne. Die Unternehmen gewährten sie und setzen ihre Preise höher. Der Teufelskreis der Lohn-Preis-Spirale begann. Aus heutiger Sicht gleicht die Situation der in Deutschland im Jahr 2023. Vor einem Jahr traf ein Gaspreisschock das Land. Die Inflation liegt wie damals in Großbritannien bei knapp neun Prozent. Angestellte von Post, Bahn, im öffentlichen Dienst und zahlreichen Industrien gehen für höhere Löhne auf die Straße. Mit Steuersenkungen gegen die Inflation Doch die Entstehung der starken Inflation der 70er-Jahre in Großbritannien zeigt, was wirklich passieren muss, damit die Preise sich immer weiter hochschaukeln. Und sie zeigt ebenso, wie weit Deutschland von so einer Situation entfernt ist. Die Geschichte der Lohn-Preis-Spirale in Großbritannien beginnt Ende der 1960er Jahre. Es ist die Zeit der sogenannten „incomes policy“. Unter der Vereinbarung halten Gewerkschaften ihre Lohnforderungen verlässlich unter der Inflationsrate. Die Unternehmen halten im Gegenzug Preisanstiege gering. Jahrelang reicht das, um in Großbritannien die Inflation im Zaum zu halten. Doch als die Produktivität nach Jahren des Wachstums sinkt, geht die Rechnung plötzlich nicht mehr auf. 1969 erreicht die Inflation 5,5 Prozent, 1970 sogar 6,4 Prozent. Der konservative Tory-Politiker Edward Heath macht sich die Situation zu nutze. Er verspricht, die Inflation zu verringern. Die Wirtschaft durch Steuersenkungen anzukurbeln. „Dies würde mit einem Schlag den Preisanstieg verringern, die Produktion steigern und die Arbeitslosigkeit verringern.“, verspricht er. Mit der Ölkrise eskaliert die Situation Tatsächlich aber steigt die Inflation schneller als die Jahre zuvor. Bereits fünf Monate nach seinem Amtsantritt liegt der Kaufkraftschwund bei sieben Prozent. Die Gewerkschaften fordern massive Lohnerhöhungen: Kraftwerksangestellte wollen 18 Prozent mehr, Krankenhausbeschäftigte 30 Prozent, Polizisten 35 und Lehrer 37 Prozent mehr. Den unglücklichen Heath treffen bald darauf die nächsten Schocks. Das strauchelnde Unternehmen Rolls Royce steht vor der Insolvenz. Tausende Arbeitsplätze auf der Kippe. Statt der angekündigten Liberalisierung gibt Heath immer mehr Geld aus für Unternehmensrettungen auch ungesunder Firmen, die Erhaltung von Arbeitsplätzen und Staatsinvestitionen, um die Wirtschaft zu modernisieren. Die Ausgaben bringen Großbritannien aber auch ein saftiges Defizit ein. Die Situation eskaliert, als die OPEC im Oktober 1973 ein Ölembargo verhängt. Die Preise in Großbritannien schießen weiter in die Höhe. Zu dieser Zeit wittert auch die Gewerkschaft der Bergarbeiter ihre Chance und streikt für eine Lohnerhöhung. Heath ruft Neuwahlen aus und verliert. Die Labour-Partei, die nun an die Macht kommt, gibt den Bergarbeitern ihre Lohnerhöhung. Der Preis: Eine jährliche Inflation von 25 Prozent. Der Winter der Unzufriedenheit Die kommenden Jahre sind von Streiks durchzogen. Immer wieder einigen sich Arbeitgeber und Arbeitnehmer auf höhere Löhne. Diejenigen, die in Gewerkschaften organisiert waren, profitieren dabei mehr als andere. Aus Angst vor Streiks setzten sich auch Politiker dafür ein, die Löhne öffentlicher Industrien zu erhöhen. Doch all das hilft nicht gegen das größte wirtschaftliche Problem: Die Gewinne der Arbeitgeber schrumpfen. Die Produktivitätszuwächse sind zu gering, um die immer höheren Löhne zu bezahlen. Und für die Gewerkschaften wird es immer schwieriger, Reallohnsteigerungen durchzusetzen. 1975 ist Großbritannien hochverschuldet und die Inflation ist auf dem Höchststand von 25 Prozent angelangt. Also beginnt das Land zu sparen. Bis 1978 gelingt es der Labour-Partei und den Gewerkschaften so sogar, die Inflation auf einen einstelligen Wert zu reduzieren. Denn trotz steigender Preise einigen sie sich auf geringere Lohnsteigerungen. Doch im „Winter der Unzufriedenheit“ 1978-79 ist die Geduld vieler Arbeiter auf Gehaltsverzicht aufgebraucht. Autoarbeiter, Lastwagenfahrer und schließlich auch schlecht bezahlte Klinikmitarbeiter streiken für höhere Löhne. Die Inflation steigt wieder auf 12 Prozent. Erst die folgende Regierung unter Margeret Thatcher schafft es, sie zu einem hohen Preis zu zähmen. Sie hebt die Zinsen, löst eine Rezession aus und katapultiert die Arbeitslosigkeit 1982 zum ersten Mal seit den 1930er Jahren auf über vier Millionen, von sechs auf zwölf Prozent. Doch so hart die Maßnahmen auch waren, erst so bekam das Land die Inflation wieder in den Griff. Die Geschichte von Großbritannien der 1970er kann eine Mahnung sein, wie Regierungen, Zentralbanker und Arbeitnehmer nicht handeln sollten. Doch die Unterschiede sind groß. Heute sind nur 17 Prozent der Arbeitnehmer in Gewerkschaften organisiert, die Zentralbanken können unabhängig die Zinsen hochsetzen, um die Inflation einzudämmen, und noch liegen auch die Lohnerhöhungen mit etwa sechs Prozent unter der Inflationsrate im vergangenen Jahr. Den Satz „Goodbye Germany, it was nice knowing you“ wird das Wall Street Journal ziemlich sicher nicht titeln. Von Deutschland muss sich sobald hoffentlich niemand verabschieden."
735b77ae-40bd-475c-bcab-ca75fd9accb9,2023-03-13 08:22:00,"Mehr als 300 Euro – so viel kostete eine Megawattstunde Gas im August 2022. Zwar ist der Gaspreis inzwischen deutlich unter diesen Rekordwert gesunken, eine Rückkehr auf das Niveau von vor dem russischen Angriffskrieg ist jedoch unwahrscheinlich. Das liegt nicht zuletzt daran, dass Deutschland das russische Pipeline-Gas durch das im Durchschnitt der vergangenen Jahre etwa 30 Prozent teurere Flüssiggas (LNG) ersetzen muss. Der Preisaufschlag rührt vor allem daher, dass die Verflüssigung und der Transport per Spezialschiff aufwendig sind. Und auch die weltweit gestiegene Nachfrage nach LNG ist ein Preistreiber. All dies trägt dazu bei, dass auch Strom auf absehbare Zeit teurer bleiben dürfte als in früheren Jahren. Denn Gaskraftwerke spielen als flexibles Gegenstück zu den wetterabhängigen erneuerbaren Energien in der deutschen Stromerzeugung eine wichtige Rolle. Im Dezember 2022 lag die Produktion in den energieintensiven Branchen in Deutschland im Schnitt um fast 20 Prozent unter dem Niveau von Ende 2021. Viele Industrieunternehmen haben auf die hohen Gas- und Strompreise bereits reagiert und ihre Fertigung energieeffizienter gestaltet oder auf alternative Energieträger umgestellt. Einige Branchen allerdings – beispielsweise die Chemieindustrie oder die Metallerzeugung – benötigen überdurchschnittlich hohe Energiemengen, um die Produktionsprozesse in Gang zu halten; teils ist Gas auch ein unabdingbarer Produktbestandteil. Diese Industriezweige konnten zuletzt kaum anders, als ihre Produktion angesichts der teuren und knappen Energiegüter zu drosseln (Grafik): Im Dezember 2022 lag die Produktion in den energieintensiven Branchen in Deutschland im Schnitt um fast 20 Prozent unter dem Niveau von Ende 2021. Teilen auf: Teilen auf X Teilen auf LinkedIn Teilen auf Xing Teilen auf Facebook Teilen auf WhatsApp Teilen per E-Mail Download: Grafik (JPG) herunterladen Grafik (EPS) herunterladen Tabelle (XLSX) herunterladen Besonders groß war das Produktionsminus in der chemischen Industrie mit nahezu 30 Prozent, in der Papierindustrie ging die Produktion um 18 Prozent und in der Metallerzeugung um 10 Prozent zurück. Das Verarbeitende Gewerbe insgesamt musste die Fertigung lediglich um weniger als 3 Prozent reduzieren. Auch im Vergleich zu den anderen EU-Ländern wurden die energieintensiven Branchen in Deutschland deutlich stärker vom Anstieg der Energiepreise getroffen. Hohe Energiekosten haben Folgen für den Standort D Damit belasten die hierzulande hohen Preise für Gas und Strom die internationale Wettbewerbsfähigkeit der energieintensiven Branchen. Geraten die Unternehmen in wirtschaftliche Schieflage, gehen Arbeitsplätze und damit Einkommen verloren, was zu einem Rückgang des privaten Konsums führt. Zudem müssen die Betriebe Geld für Energie ausgeben, das sonst für Investitionen hätte verwendet werden können. All dies bedeutet Wohlstandsverluste: Studien zufolge hat die Energiekrise in Deutschland im Jahr 2022 zu Realeinkommenseinbußen von etwa 64 Milliarden Euro – annähernd 2 Prozent des Bruttoinlandsprodukts – geführt. Die energieintensiven Unternehmen kommen vor dem Hintergrund des Energiepreisanstiegs kaum umhin, ihre Produktion am Standort Deutschland zunehmend zu hinterfragen. Die Politik ist gefordert Umso wichtiger wäre eine Politik, die die Betriebe stärker dabei unterstützt, auf klimaneutrale Energiequellen wie grünen Strom und Wasserstoff umzustellen. Die Bundesregierung sowie die Regierungen der Länder haben zwar angesichts der akuten Energiepreisproblematik eine Reihe von Sofortmaßnahmen beschlossen, um Haushalte und Unternehmen zu unterstützen. Diese Maßnahmen können jedoch nur erfolgreich sein, wenn sie mit einer umfassenderen und längerfristigen politischen Agenda zur Verbesserung der heimischen Standortbedingungen einhergehen."
5e65d197-9235-4f05-a74d-ef9456e7794a,2023-03-13 09:04:25,"Viele Menschen sind besorgt angesichts der aktuell mitunter hohen Lohnforderungen von Gewerkschaften und den damit verbundenen Streiks und Unterbrechungen des täglichen Lebens. Die Gewerkschaft Verdi beispielsweise fordert 10,5 Prozent mehr Lohn für die Beschäftigten im öffentlichen Dienst, also beispielsweise für Kita-Erzieher*innen und Busfahrer*innen. Das scheint vielen überzogen und nicht wenige malen ein Bild des Schreckens, was es bedeuten könnte, wenn solche Lohnforderungen durchgesetzt würden. Aber wären deutliche Lohnsteigerungen wirklich schädlich für Wirtschaft und Gesellschaft in dieser Krise? Fakt ist: Wenn man die Inflationsrate von knapp acht Prozent im Jahr 2022 und vermutlich von fünf bis sechs Prozent im Jahr 2023 berücksichtigt, dann würde eine Lohnerhöhung von 10,5 Prozent noch nicht einmal die Inflation ausgleichen. Vor diesem Hintergrund erscheinen Gewerkschaftsforderungen wie im Fall von Verdi erst einmal nicht unangemessen. Doch die Kritiker*innen führen weitere Argumente ins Feld – etwa, dass so hohe Lohnforderungen die Arbeitgeber*innen überfordern und manchen nachhaltig schaden würden. Es gibt sicherlich einige Institutionen und Unternehmen im öffentlichen Dienst, die bei solchen Lohnerhöhungen in finanzielle Probleme geraten könnten. Wir sollten jedoch nicht vergessen, dass der Staat einer der großen Gewinner der Inflation ist. Denn höhere Preise bedeuten auch höhere Steuereinnahmen. Wieso also sollte der Staat nicht zumindest einen Teil dieser höheren Steuereinnahmen in Form besserer Löhne für seine Beschäftigten nutzen? Manche Kritiker*innen sehen zudem eine sogenannte Lohn-Preis-Spirale auf Deutschland zukommen. Sie befürchten also, dass überzogene Lohnforderungen die Inflation dauerhaft erhöhen könnten und damit einen wirtschaftlichen Schaden anrichten. Eine solche Spirale ist jedoch derzeit nicht in Sicht. Gleichzeitig sind die Gewinne vieler, vor allem großer Unternehmen deutlich gestiegen. Wir müssen uns somit eher um eine Gewinn-Preis-Spirale Sorgen machen als um überzogene Lohnforderungen. Es gibt zumindest sechs Gründe, weshalb deutliche Lohnerhöhungen in den kommenden Jahren nicht nur nicht schädlich, sondern sogar nützlich für Wirtschaft und Gesellschaft als Ganzes sein könnten. Die Erfahrungen aus anderen Ländern und auch die Einführung des Mindestlohns in Deutschland zeigen, dass Lohnerhöhungen die Mobilität der Beschäftigten deutlich erhöhen. Wettbewerb erhöht die Beschäftigung In anderen Worten: Mehr Beschäftigte wechseln den Arbeitsplatz, hin zu produktiveren Jobs. Für einzelne Unternehmen mag dies schädlich sein, aber für die Wirtschaft als Ganzes bedeutet es einen Gewinn. Zum zweiten erhöhen deutliche Lohnsteigerungen in manchen Sektoren den Wettbewerb zwischen den Unternehmen. Das setzt Anreize für Unternehmen, mehr in ihre Beschäftigen zu investieren und sie produktiver zu machen. Der dritte Vorteil eines solchen Wettbewerbs ist, dass er die Beschäftigung erhöht, da es sich für manche Menschen lohnt, Arbeit aufzunehmen oder die Arbeitszeit auszuweiten. Dies alleine wird das Fachkräfteproblem in Deutschland sicherlich nicht lösen, aber die Mobilisierung dieser stillen Reserve auf dem Arbeitsmarkt kann zumindest einen Beitrag dazu leisten. Deutliche Lohnerhöhungen haben zudem noch drei weitere, indirekte Vorteile für Wirtschaft und Gesellschaft: Vor allem Lohnsteigerungen, die Menschen mit geringen Einkommen zu Gute kommen, erhöhen die gesamtwirtschaftliche Nachfrage und können somit mittelfristig einen wichtigen Wachstumsimpuls setzen. Höhere Löhne für Menschen mit geringen Einkommen helfen zudem, die Sozialsysteme zu entlasten — denn weniger Menschen müssen aufstocken oder soziale Leistungen in Anspruch nehmen. Zudem haben Lohnerhöhungen im öffentlichen Dienst eine wichtige Signalwirkung für andere Branchen. Auch solche Branchen, die nicht von Tarifverträgen abgedeckt sind, wären gezwungen, bessere Arbeitsbedingungen und höhere Löhne für ihre Beschäftigten anzubieten, um diese nicht zu verlieren. Auch wenn Studien zeigen, dass diese Mechanismen zu Lohnerhöhungen in vielen Branchen führen können, so ist es recht wahrscheinlich, dass die Ungleichheit bei Löhnen steigt. Denn es sind vor allem die Jobs im Niedriglohnbereich, die fast nie über Tarifverträge abgedeckt sind und in denen die Verhandlungsmacht der Beschäftigten gegenüber ihren Arbeitgeber*innen klein ist. Daher wird in den kommenden Monaten unweigerlich die berechtigte Frage aufkommen, ob nicht auch der Mindestlohn weiter steigen muss, damit Menschen mit geringen Einkommen nicht nur besser gegen die hohe Inflation geschützt werden, sondern auch um eine steigende Lohnungleichheit zu verhindern. Zwar ist der Mindestlohn erst im vergangenen Jahr auf zwölf Euro erhöht worden, aber für viele der Betroffenen hat die Inflation diese Erhöhung bereits aufgefressen. Streiks und Unterbrechungen des täglichen Lebens sind nie schön. Aber deutliche Lohner-höhungen für die große Mehrheit der Beschäftigten hätten für Wirtschaft und Gesellschaft als Ganzes deutlich mehr Vor- als Nachteile. Die Hoffnung ist, dass die Sozialpartner möglichst schnell eine kluge Lösung finden und sich darauf fokussieren, wie Lohnerhöhungen Investitionen in Beschäftigte und Produktivität verbessern helfen können."
c9462265-1feb-4708-9485-676b1e7dd6e7,2023-03-13 13:37:26,Bayerisch-Schwäbische Wirtschaft 3/2023 digitalmagazin.b4bschwaben.de
