8bf9e9cd-bc06-4faf-a410-f3fb019faef1,2023-11-22 08:41:00+00:00,"Für Ajit und Ann-Kathrin Thaiba Shrestha lief anfangs alles reibungslos. Das Ehepaar aus dem mittelhessischen Weilburg wollte in diesem Jahr sein Haus verkaufen, fand direkt Käufer. Ende Juli waren sich alle Beteiligten über die Konditionen einig und unterzeichneten einen Vertrag beim Notar. ""Ohne Probleme ging das über die Bühne"", erzählt Ann-Kathrin Thaiba Shrestha: ""Doch dann ging das Warten los."" Warten musste das Ehepaar auf die DSL-Bank, die Baufinanzierungstochter der Deutschen Bank. Die beiden sind dort Kunden, hatten das Haus damals selbst mit Krediten der Bank erstanden. Die haben sie nicht abgezahlt, wollten sie ablösen durch die Kaufsumme. Dafür bedarf es einer Änderung im Grundbuch - dort ist noch die DSL-Bank als kreditgebendes Unternehmen eingetragen. Doch obwohl die DSL-Bank unverzüglich alle nötigen Dokumente bekommen hat, hat sie bislang keine Genehmigung erteilt. Der Übergabetermin ist geplatzt Drei Monate nach dem Notartermin hatten die Verkäufer Ende Oktober die Schlüsselübergabe geplant. Der Termin rückte näher, doch das Paar hörte nichts von der Bank. Allmählich wurden die Eheleute nervös und versuchten ihrerseits, die Bank zu kontaktieren. Mehrmals wöchentlich riefen sie die Hotline an. ""Man wartet, eine Stunde, zwei Stunden, dann geht endlich jemand dran und sagt knallhart, wir wären nicht die einzigen, andere Fälle würden weiter zurückliegen, wir sollten weiter warten"", berichtet Ajit Thaiba Shrestha. E-Mails an die Bank seien unbeantwortet geblieben. Und so platzte letztlich der Übergabetermin. Mittlerweile haben sich die Weilburger an Martin Heinzelmann gewendet, einen Anwalt für Bankrecht aus Frankfurt. Er erklärt, die DSL-Bank müsse eine sogenannte Löschungsbewilligung ausstellen. Dafür gebe es zwar keine gesetzlichen Fristen, aber nach Meinung des Anwalts handelt es sich um eine Routinetätigkeit: ""Das sollte die Bank in einer Woche schaffen"", so Heinzelmann. Dass sie sich dagegen Monate Zeit lässt, ist seiner Meinung nach nicht zu rechtfertigen: ""Ich gehe davon aus, dass nicht genügend geschultes Personal da ist, einen anderen Grund erkenne ich nicht."" Seit einem IT-Umzug hakt es mächtig Der Anwalt setzte der Bank erneut eine Frist und plante schon, sie im Auftrag seiner Mandanten zu verklagen. Da meldete sich auf Anfrage des Hessischen Rundfunks die Deutsche Bank, zu der die DSL-Bank gehört. Eine Sprecherin sagte, man bereite das gewünschte Dokument vor und wolle es in den nächsten Tagen an den Notar schicken. Dort ist bislang nichts angekommen. Den Betroffenen will die Bank den entstandenen Schaden ersetzen. Der dürfte sich auf mehrere tausend Euro belaufen. ""Wir bedauern sehr, dass es in diesem Fall zu dieser Verzögerung gekommen ist"", heißt in einer schriftlichen Stellungnahme. Als Grund nennt die Deutsche Bank eine IT-Umstellung, dabei wurden die Kunden der DSL-Bank mit ihren eigenen Kunden auf einer Plattform zusammengeführt. Seitdem hakt es bei der DSL-Bank offenbar mächtig. Der Konzern räumt ein, dass es teilweise länger dauere, Kundenanliegen zu bearbeiten. Außerdem sei der Kundenservice auf Grund der hohen Menge an Anfragen schlechter zu erreichen. Wie viele Kunden in Folge der IT-Umstellung Probleme haben, lässt die Bank offen. Um die Probleme zu beheben, habe man die Kapazitäten bei den Teams erhöht und eine neue Software in Betrieb genommen. Die Finanzaufsicht hat die DSL-Bank im Visier Der IT-Umzug verursacht innerhalb des Deutsche-Bank-Konzerns schon seit Monaten massive Probleme. Tausende Kunden haben sich deshalb bereits bei der Finanzaufsicht BaFin beschwert. Die hat in Folge einen Sonderbeauftragten geschickt, die Mängel auch bei der DSL-Bank zusammen mit der Bank rasch, vollständig und dauerhaft abzustellen. Angesichts des aktuellen Falls ist aber mehr als fraglich, ob bisher wirklich große Fortschritte gemacht wurden. Die lahme Bearbeitung der Bank bringt auch die Käufer des Hauses in die Bredouille. ""Wir machen uns mittlerweile große Sorgen, dass der Häuserkauf platzen könnte"", sagt Robin Fürbeth. Für die monatelange Verzögerung zeigt er wenig Verständnis: ""Es ist komisch, dass solche Probleme in so einem großen Unternehmen nicht schneller behoben werden können."" Da man selbst bei der DSL-Bank nicht Kunde sei, könne man dort gar nicht aktiv werden und fühle sich machtlos. Immerhin hat das Ehepaar die eigene Wohnung nicht direkt gekündigt, sonst hätte es schon vor der Tür gestanden."
a6f24e30-0484-426c-b98f-bf2e6ada8177,2023-11-22 15:42:00+00:00,"Absprachen im Anleihehandel Deutsche Bank war Kartell-Mitglied – und vermeidet Millionenbußgeld Die Deutsche Bank gesteht, an einem rechtswidrigen Kartell im Anleihen-Handel mitgewirkt zu haben. Die Bank profitiert von einer Kronzeugenregelung und entkommt einer hohen Strafe. Das schützt sie aber nicht vor möglichen Klagen von Geschädigten, so die EU-Kommission. 22.11.2023, 16.42 Uhr Die Deutsche Bank hat die Beteiligung an einem rechtswidrigen Kartell eingeräumt und dies der zuständigen EU-Behörde gestanden. Weil es von einer Kronzeugenregel profitiert, muss das Unternehmen keine Strafe zahlen, wie die EU-Kommission am Mittwoch mitteilte. Die an illegalen Absprachen beteiligte niederländische Rabobank wurde hingegen mit einer Strafe von 26,6 Millionen Euro belegt. Konkret geht es unter anderem um Preisabsprachen sowie den Austausch über Strategien beim Handel mit Anleihen. Nach Angaben der EU-Kommission hat die Deutsche Bank durch ihre Zusammenarbeit ein Bußgeld von knapp 156 Millionen Euro verhindert. Die Absprachen haben den Angaben zufolge zwischen 2006 und 2016 stattgefunden. Die Kommission betonte, dass alle, die durch das Verhalten der Banken benachteiligt wurden, vor nationalen Gerichten Schadensersatz verlangen könnten. Dies gelte auch, wenn Kartellteilnehmern die Geldbuße erlassen worden sei. Die Europäische Kommission hat der Deutschen Bank und der Rabobank im Dezember vergangenen Jahres vorgeworfen, sich beim Handel mit Staatsanleihen abgesprochen und so eventuell Preise beeinflusst zu haben. Seinerzeit hieß es, dass Händler der beiden Banken zwischen 2005 und 2016 sensible Geschäftsinformationen ausgetauscht und so ihre Handelsstrategien und Preise abgesprochen hätten – etwa per E-Mail oder in Online-Chats. Unter anderem ging es um in Euro denominierte Staatsanleihen, die im Europäischen Wirtschaftsraum – dem neben den EU-Staaten auch Länder wie Norwegen und Island angehören – auf Sekundärmärkten gehandelt wurden. Die EU-Kommission hatte zunächst versucht, im Gespräch mit den Banken einen Vergleich in der Sache zu finden. Da es keine Fortschritte gegeben habe, sei dann das normale Kartellverfahren eingeleitet worden. EU-Wettbewerbskommissarin Margrethe Vestager (55) erklärte seinerzeit: ""Für das Funktionieren eines wirksamen Wettbewerbs ist es von grundlegender Bedeutung, dass die Wirtschaftsakteure ihre Preise unabhängig festlegen. Die Bürger müssen darauf vertrauen können, dass die Finanzinstitute keine Praktiken anwenden, die den Wettbewerb auf den Märkten für den Handel mit Anleihen einschränken."" rei/DPA"
e8e9142e-bb08-4f06-a96e-127231e8beb6,2023-11-23 14:23:57+00:00,"Zuvor hatte viele Jahre lang stets Paul Achleitner, der Chefkontrolleur der Deutschen Bank, die Rangliste angeführt, doch der hat seinen Posten im Mai 2022 nach zehn Jahren an Alexander Wynaendts abgegeben. Wynaendts erhielt im vergangenen Jahr rund 496.000 Euro von der Deutschen Bank. Im kommenden Jahr, wenn Wynaendts sein Gehalt dann über die gesamten 12 Monate erhält, dürfte der Chefkontrolleur der Deutsche Bank wieder ganz oben stehen. Die geringste Vergütung unter den Dax-Aufsichtsratsvorsitzenden erhielt Wolfgang Büchele von Merck mit 112.000 Euro. Insgesamt sind die Bezüge von Deutschlands Kontrolleuren im Dax im vergangenen Jahr gestiegen. Im Schnitt erhielten die Aufsichtsratsvorsitzenden der 40 Dax-Unternehmens rund 393.000 Euro, das waren laut der DSW-Aufsichtsratsvergütungsstudie rund 7,7 Prozent mehr als ein Jahr zuvor. Innerhalb der Aufsichtsratsgremien bleibt es bei der traditionellen Staffelung: Der Vorsitzende des Gremiums erhält im Schnitt mehr als dreimal so viel wie ein einfaches Aufsichtsratsmitglied, das in den 40 Dax-Unternehmen im Schnitt rund 117.000 Euro erhielt. Deutlich weniger als im Dax-40 verdienen die Aufsichtsräte in der zweiten und dritten Börsenliga: Im M-Dax der 50 mittelgroßen Unternehmen lagen die durchschnittlichen Gehälter der Aufsichtsratsvorsitzenden bei rund 212 000 Euro, einfache Aufsichtsratsmitglieder erhielten rund 68.000 Euro. Im S-Dax der 70 kleineren Unternehmen verdienten die Aufsichtsratsvorsitzenden durchschnittlich rund 134 000 Euro und einfacher Aufsichtsräte rund 50 000 Euro. DSW-Hauptgeschäftsführer, Marc Tüngler hält es grundsätzlich für richtig, dass die Vergütung der Aufsichtsräte steigt, weil die Arbeit der Kontrolleure seit Jahren immer anspruchsvoller werde."
3170c248-3eca-43fe-b639-7f16def32946,2023-11-24 14:50:21+00:00,"Wenn es um die Frage nach digitalen Kompetenzen und der zugehörigen Verantwortung in den Führungsetagen geht, dann sind die DAX40-Unternehmen aus der Finanzbranche ganz vorne zu finden. Umso erstaunlicher, dass bei der Berichterstattung von Kennzahlen zur Digitalisierung im Bestands- und Innovationsgeschäft aber die Vertreter anderer Branchen mehr zu bieten haben. Das sind zentrale Ergebnisse zur Finanzindustrie aus dem aktuellen DAX Digital Monitor (Website), der von der FOM Hochschule und der Universität Duisburg-Essen in Kooperation mit der QCI Corporation erstellt wurde. von Prof. Dr. Dirk Stein, Professor FOM Hochschule und Prof. Dr. Tobias Kollmann, Universität Duisburg-Essen Der “DAX Digital Monitor” untersucht auch in seiner vierten Ausgabe die Geschäftsberichte der DAX40-Unternehmen in Deutschland und analysiert dabei die berichteten Maßnahmen zur „Digitalisierung“, den Umfang und die Einheitlichkeit der Berichterstattung zur „Digitalisierung“ sowie die Verankerung eines Digital Leadership mit den zugehörigen Digitalkompetenzen auf der Top-Führungsebene. Auch die nicht-finanzielle Berichterstattung wird in diese Analyse mit einbezogen. Ein zusätzlicher Schwerpunkt in diesem Jahr waren die Darstellungen zur Corporate Digital Responsibility (CDR) und dem Einsatz der Künstlichen Intelligenz (KI). Vorweg: Banken und Versicherer haben einen Nachholbedarf bei der Corporate Digital Responsibility (CDR) und auch der Künstlichen Intelligenz (KI). Beides steckt noch in den Kinderschuhen.” Finanzindustrie beim Digital Leadership ganz vorne dabei Ein erster Blick auf die Aspekte „Digitalisierungsverantwortung und -kompetenz auf Vorstands- und Aufsichtsratsebene“ sowie der „Digitalisierung als Vergütungskomponente auf Vorstandsebene“ zeigt, dass die DAX-Unternehmen der Finanzindustrie hier ganz vorne zu finden sind. Sowohl Allianz, Commerzbank, Deutsche Bank, Deutsche Börse, Hannover Rück als auch Münchener Rück erfüllen weitgehend alle Kriterien, die für ein zugehöriges Digital Leadership herangezogen wurden.” Es gibt zunächst eine feste Zuordnung des Themenfeldes Digitalisierung zu einem Vorstandsmitglied. Jedoch nur als Doppelfunktion mit einer weiteren Aufgabe (z.B. CEO oder CTO). Einen eigenständigen Digitalchef leistet sich kein Unternehmen aus dieser Gruppe. Das ist umso erstaunlicher, als das gerade die Finanzindustrie von der Digitalisierung besonders betroffen ist. Auch in den jeweiligen Aufsichtsräten scheint es Mitglieder mit einer entsprechenden Digitalkompetenz zu geben. Doch hier ist Vorsicht geboten: Was auf dem Papier der Geschäftsberichte in der entsprechenden Skill-Matrix gut aussieht, muss nicht unbedingt einer Überprüfung Stand halten. Denn die zugehörige Empfehlung des Corporate Governance Kodex ist es, dass sich die Aufsichtsratsmitglieder in einer Selbstbewertung bestimmte Kompetenzfelder zuordnen können. Diese aktuelle Vorgehensweise öffnet natürlich Tür und Tor für ein sog. Digital Washing, bei dem die eigenen Kompetenzen einen „digitalen Anstrich“ bekommen. Ob diese Selbsteinschätzung wirklich objektiv messbaren Kriterien entsprechen und wie die im Falle der Digitalisierung überhaupt aussehen könnten, bleibt zunächst offen.” Es wird auch den DAX-Unternehmen der Finanzbranche dringend empfohlen, hier nochmals selbstkritisch die digitalen Kompetenzen im Aufsichtsrat zu reflektieren. Finanzindustrie bei Kennzahlen zur Digitalisierung eher unauffällig Das Themenfeld „Kennzahlen zur Digitalisierung“ wurde erstmals in der Vorjahresstudie mit aufgenommen, da die DAX40-Unternehmen begonnen hatten, Ergebniskennzahlen zu ihrer Digitalisierung bzw. digitalen Transformation zu berichten. Die berichteten Kennzahlen untermauern und belegen dabei die Anstrengungen der DAX40-Unternehmen in ihre digitale Transformation. Das erzeugt aus Kunden- und insbesondere aus Investorensicht Vertrauen in die Absicht der zukunftsgerechten Unternehmensgestaltung durch die Unternehmensführung. Aber: Genauso wie es unzählige Ansätze zur digitalen Transformation gibt, existieren auch unzählige Möglichkeiten Kennzahlen zur Digitalisierung zu berichten. BASF berichtet zum Beispiel über die „Anzahl erreichter Kunden über digitale Angebote“, Beiersdorf über das „Wachstum des E-Commerce-Geschäfts“ oder Brenntag über den „Beitrag der Digitalisierung zum operativen EBITA“. Derartige Hinweise findet man bei den DAX-Unternehmen der Finanzbranche kaum. Allianz berichtet, dass das Potenzial der Digitalisierung zum Ergebnisbeitrag intern zwar diskutiert wird, jedoch werden in der Geschäftsberichterstattung dazu keine konkreten Erfolgskennzahlen berichtet.” Jetzt könnte man unterstellen, dass diese Unternehmen eine gesonderte Ausweisung deswegen unterlassen, weil ihr Geschäft schon durch und durch digital ist. Dennoch: Kennzahlen sind eine wichtige Verpflichtung für die digitale Transformation und verhindern ein bloßes Lippenbekenntnis der Unternehmensführung in diesem Bereich. Vielleicht ist es gerade die Finanzbranche, die mit gutem Beispiel vorangehen sollte und ein einheitliches KPI-System für die Digitalisierung mit einer Vergleichbarkeit der berichteten Maßnahmen für die Aktionäre entwickeln sollte. Finanzindustrie bei Künstlicher Intelligenz noch zurückhaltend Das Thema „Künstliche Intelligenz“ (KI) wird in der aktuellen Geschäftsberichterstattung über alle DAX40-Unternehmen hinweg nur an insgesamt 205 Textstellen verwendet.” Das deutet darauf hin, dass sich das Thema KI bei vielen DAX40-Unternehmen noch im Anfangsstadium befindet. Das gilt auch für die Vertreter der Finanzbranche. Während z.B. Porsche von einer „KI als wesentlicher Faktor für den Geschäftserfolg“ ausgeht, wissen Allianz, Commerzbank, Deutsche Bank & Co. noch nicht genau, wohin die Reise in diesem Bereich geht. Sie erwähnen die allgemeine Künstliche Intelligenz in der Geschäftsberichterstattung sehr zurückhaltend. Die Deutsche Bank berichtet im KI-Kontext, dass dadurch die Tragfähigkeit der Geschäftsmodelle von Banken in Frage steht. Die Münchner Rück berichtet immerhin von einem konkreten KI-Anwendungsfall zur Vorhersage von Klimakatastrophen für das Versicherungsgeschäft. Auch das weiterführende Thema einer „Generative Artificial Intelligence“, ausgelöst von ChatGPT, findet in keinem Geschäftsbericht der DAX-Unternehmen der Finanzbranche eine Berücksichtigung. Die DAX-Unternehmen wurden von dieser Entwicklung sprichwörtlich überrollt und im Jahr 2024 wird das in den Geschäftsberichten vermutlich deutlich anders aussehen, denn die Erwartungen an den geschäftlichen Nutzen von KI sind enorm.” Finanzindustrie mit Nachholbedarf bei Corporate Digital Responsibility Nicht zuletzt aufgrund der wachsenden Bedeutung der Künstlichen Intelligenz wird auch die Corporate Digital Responsibility (CDR) für die DAX-Unternehmen in Zukunft eine zunehmende Bedeutung bekommen. Warum? Weil die Verantwortung für die, auch und insbesondere bei der KI, eingesetzten Daten eine neue Bedeutung bekommen wird, und dies unmittelbar auf das Vertrauen bei Geschäftspartnern und Kunden im Umgang mit ihren Daten durchschlagen wird. Als Vorreiter in Sachen CDR kann die Telekom genannt werden, die sich seit 2017 mit diesem Thema beschäftigt und CDR dem Sustainable Development Goal 9 (SDG 9) zuordnet.” Die Telekom und Zalando veröffentlichen zudem jährlich einen eigenständigen CDR-Bericht. Porsche hat zudem in der Geschäftsberichterstattung 2022 bestätigt, dass CDR integraler Bestandteil der Porsche Strategie 2030 ist. Und bei den Vertretern der Finanzindustrie? Fehlanzeige! Das heißt wiederum nicht, dass das Thema Datenverantwortung und Digitalisierungs- bzw. Datenethik überhaupt keine Rolle in der Geschäftsberichterstattung der Finanzindustrie spielt. Es ist jedoch aus Stake- und Shareholdersicht nicht transparent, welche Kriterien und Normen den individuellen Maßnahmen der Unternehmen unterliegen. Die Münchener Rück berichtet in diesem Kontext wie folgt: „…ethische Digitalisierung zu einem integralen Bestandteil der Geschäftsstrategie gemacht und…“ Das folgt dem Beispiel Porsche, jedoch fehlt hier im Vergleich zu Porsche noch die Bezugnahme zu einer diesbezüglichen CDR-Norm, wie beispielsweise der CDR-Kodex der CDR-Initiative. Es wäre aber hilfreich, wenn sich auch die DAX-Unternehmen der Finanzindustrie freiwillig einer CDR-Initiative anschließen würden, damit sich ein klarer Kriterienkatalog für die Berichterstattung herausbildet. Gelingt dies nicht, so muss der Gesetzgeber aktiv werden, denn digitale Ethik und Verantwortung werden und müssen ein fester Bestandteil unserer Unternehmenskultur werden.”"
d5418ffc-1ce9-4962-b473-02912d37a735,2023-11-27 17:26:56+00:00,"Die bAV als Stabilitätsanker und wichtiger Motivator Die Bindung und Gewinnung qualifizierter Mitarbeitender ist für Unternehmen zu einer existenziellen Herausforderung geworden. Die betriebliche Altersvorsorge ist für sie deshalb eine Möglichkeit, attraktiver für Mitarbeitende zu sein. Die Herausforderung und gleichsam die Chance besteht darin, das Instrument wirksam zu kommunizieren und die Vorteile der bAV auch im aktuellen Kontext zu erklären. Denn ein Grund für das zurückgehende Interesse und die nachlassende Teilnahme der Mitarbeitenden an der bAV ist laut Umfrage auch die gestiegene Inflation. Dass die Bildung von Rücklagen, die von den Unternehmen ja sogar bezuschusst werden müssen, kein Kostenfaktor, sondern eine rentable Investition in die eigene finanzielle Absicherung im Alter ist, wird dabei oft verdrängt. Nachholbedarf bei kleinen Unternehmen Die Größe der Unternehmen in Deutschland entscheidet oft darüber, ob und in welchem Umfang sich Arbeitnehmende informiert fühlen. Firmen mit 1.000 oder mehr Mitarbeitenden informieren nach Aussage von 55 % der Befragten ausreichend über die bAV. Nur 39 % bestätigen dies für Arbeitgeber mit weniger als 50 Mitarbeitenden. Rund ein Drittel aller Teilnehmenden der Umfrage gibt an, ausreichend gut informiert zu sein und den Informationen auch zu vertrauen. Bei kleineren Firmen fühlt sich nicht einmal ein Viertel der Mitarbeitenden ausreichend informiert (24 %), und nur 30 % vertrauen den gegebenen Informationen. bAV eröffnet vielfältige Möglichkeiten Wie Unternehmen von der betrieblichen Altersvorsorge-Beratung der Deutschen Bank profitieren können Die Umsetzung des Rechtsanspruchs auf eine bAV in die Praxis stellt jedoch insbesondere kleinere mittelständische Unternehmen oft vor große Herausforderungen. Schließlich müssen bei der Einführung der bAV unter anderem arbeitsrechtliche, betriebswirtschaftliche, steuerliche und versicherungstechnische Aspekte berücksichtigt werden. Pauschale Lösungen gibt es nur selten. Denn das Anforderungsprofil einer kleinen, jungen Firma zum Beispiel unterscheidet sich erfahrungsgemäß deutlich von dem eines großen, etablierten Unternehmens. Eine regelmäßige Überprüfung der einmal gewählten Vorsorgelösungen ist deshalb ebenso wichtig wie das Aufsetzen eines ersten Konzepts. Der Beratungsbedarf der Firmen, die sich mit dem Thema bAV beschäftigen, ist entsprechend groß. Die Deutsche Bank hat die vielfältigen Bedürfnisse insbesondere kleinerer und mittelgroßer Unternehmen bereits vor Jahren erkannt und bietet individuell passende Unterstützung an. Die regionalen Berater-Teams vor Ort haben jahrelange Erfahrung mit den Themen Versicherung, Vorsorge und speziell bAV. Das Service-Angebot der Deutschen Bank ist auf die Zielgruppe mittelständischer Unternehmen mit unterschiedlichen Größen und Anforderungen zugeschnitten und umfasst mehrere Bereiche. Das bAV-Service-Angebot der Deutschen Bank im Überblick: Detaillierte bAV- und Versorgungsanalyse: Die Unternehmensziele werden in das bAV-Konzept integriert, um diese perfekt aufeinander abzustimmen. Individuelles Vorsorgekonzept: Der spezielle Service für Unternehmen, Geschäftsführende und Inhaber*innen umfasst von der Einrichtung über die Ausrichtung bis hin zur Übertragung alle Aspekte der bAV. Reduzierung von Haftungsrisiken: Unternehmen können auf Musterversorgungsordnungen zurückgreifen oder sich über externe Partner eine Versorgungsordnung bis hin zu einer Betriebsvereinbarung bei Großbetrieben erstellen lassen. Dokumentationsservice: Für die Personalakte können die relevanten Dokumente bereitgestellt werden. Information von Mitarbeitenden: Fachleute der Deutschen Bank informieren auf Veranstaltungen, im persönlichen Gespräch oder via Gehaltsbeileger über die bAV – ganz nach Wunsch des Arbeitgebers. Kompetente bAV-Ansprechpartner*innen: Die Deutsche Bank bietet Beratung bei administrativen Angelegenheiten und Verwaltungsfragen. Expertennetzwerk: Auch komplexe Fälle können aufgrund der langjährigen Erfahrung und des breiten Netzwerks der größten deutschen Bank gelöst werden."
