d627c7d5-4345-4dac-bd9d-272fd41ac5eb,2023-11-02 07:00:00+00:00,"Deutsche Bank will 250 Postbank-Standorte schließen Zukunft der Filiale in Lünen noch ungewiss Leonie Freynhofer Redakteurin Die Deutsche Bank kündigt an, 250 der 550 Postbank-Filialen in Deutschland zu schließen. Gibt es auch für Kundinnen und Kunden in Lünen bald eine Umstellung? 2 Min Lesezeit Maßnahmen noch verhandelt Zur Startseite"
68660944-5bb1-4588-91b8-988ae15207cd,2023-11-04 16:42:00+00:00,"Es ist noch nicht einmal ein Jahrzehnt her, da hatte die Postbank noch deutlich mehr als 1000 Niederlassungen. Und wer sich die Mühe macht, seine Erinnerung noch um ein paar Jahre auszuweiten, erinnert sich sogar noch daran, dass die Deutsche Postbank AG mal Mitglied im Deutschen Aktien-Index (Dax) war, also zur Beletage der deutschen Wirtschaft mit entsprechendem Marktwert gehörte. Mehr als 150 Milliarden Euro Bilanzsumme hatte die Bank noch 2015, die als eines der Folgeunternehmen aus der Privatisierung der Deutschen Bundespost hervorging. Fast 30 Jahre ist das her. Aber Tradition bedeutet eben nicht zwangsläufig Erfolg und damit auch nicht zwangsläufig Zukunftsfähigkeit. Und so sorgt die Postbank seit geraumer Zeit mit eher weniger guten Nachrichten für Schlagzeilen. Die jüngste ist der von Deutsche-Bank-Privatkundenchef Claudio de Sanctis kürzlich in der „Financial Times“ verkündete Plan, noch einmal 250 Niederlassungen der Postbank zu schließen. Damit wird fast die Hälfte der Filialen, von denen jede fünfte in Nordrhein-Westfalen liegt, bis Mitte 2026 geschlossen. Wo wie viele Niederlassungen zumachen, steht noch nicht fest. Der Kahlschlag trifft beileibe nicht nur die Bankklientel, sondern auch andere Kundinnen und Kunden. Nämlich jene, die in den Niederlassungen auch gern mal ein Paket aufgegeben haben, beispielsweise vor Weihnachten, oder Briefmarken gekauft haben. Aber auch das wird ab 2026 in jeder dritten der verbleibenden 300 Filialen nicht mehr möglich sein. Da bleiben der Kundschaft zwei Möglichkeiten: mit dem Missstand zu leben oder sich einen anderen Anbieter zu suchen. Wobei es durchaus sein kann, dass auch der andere Anbieter – ob nun Sparkasse, Volks- oder Privatbank – irgendwann weitere Niederlassungen schließt. Bis dahin gäbe es aber Hilfe mit einem Kontoumzugs­service. Vermutlich wäre das Filialsterben auch viel früher über die Bühne gegangen, hätte es da nicht einen alten Vertrag mit dem früheren Postbank-Eigentümer Deutsche Post gegeben. In diesem war über Jahre die Zahl der Filialen, die binnen zwölf Monaten geschlossen werden konnten, erst auf 50, später auf 100 gedeckelt worden. So lange musste die Deutsche Bank also Filialen durchschleppen, die wie bei den Wettbewerbern nicht mehr rentabel zu betreiben waren – vor allem deshalb, weil die Kunden nicht mehr in die Niederlassung kamen, sondern zumindest ihre Standard-Bankgeschäfte lieber online erledigen. So hat die Deutsche Bank also häppchenweise abgeschnitten bei einem Tochterunternehmen, bei dem die Strategie von Deutschlands größter Bank nie so ganz klar war: Erst sollte die Postbank 2015 nach der faktischen Komplettübernahme ausgegliedert werden, 2016 über die Börse oder an einen Investor verkauft werden, ehe sie dann mit dem Privatkundengeschäft der Deutschen Bank verschmolzen wurde. Die Niederlassungen sollten künftig auch als Technikzentren dienen, sagte de Sanctis, und der Ort sein, „wo man Beratung bekommt, aber auch wo man hingeht, wenn man Probleme mit seiner App hat. Und wir müssen herausragend sein, wenn es um Lösungen dafür geht.“ Zwischen dem Anspruch, herausragende digitale Dienstleistungen anzubieten, und der Wirklichkeit klafft indes seit geraumer Zeit eine Lücke. Seit Monaten wirkt die Postbank auf viele eher wie ein Ort für digitales Chaos. Nach einem Umzug von Postbank-Daten auf die IT-Systeme der Deutschen Bank hatten sich nämlich massenhaft Kunden beschwert, die teils wochenlang keinen Zugriff auf ihre Konten hatten, von deren Konten unberechtigterweise Geld abgebucht worden war oder bei denen Lastschriften nicht funktionierten. Mehr als 1600 Kunden sollen sich in den ersten neun Monaten dieses Jahres beschwert haben, wie Verbraucherschützer sagen. Dass es dabei in erster Linie um Kundschaft mit Pfändungsschutzkonten ging, deren Inhaber nicht gerade zu den Betuchtesten gehören, machte die ganze Angelegenheit fast noch schlimmer. Sogar die Finanzaufsicht Bafin fühlte sich bemüßigt, einzugreifen, und schickte der Bank einen Sonderbeauftragten ins Haus, der dafür sorgen soll, dass der Kundenservice schnell wieder läuft. Bis Jahresende sollen alle Probleme gelöst sein, unter Umständen soll es sogar Entschädigungen für Teile der Kundschaft geben. Der Imageschaden ist damit freilich nicht behoben – und dem folgt jetzt das nächste Streichkonzert bei den Filialen. Wie üblich in solchen Fällen werden den Schließungen auch Arbeitsplätze zum Opfer fallen. Wie viele das sein werden, ist noch offen. Gespräche mit den Vertretern der Belegschaft stehen noch aus."
d0dc261d-87f0-40c6-b329-53c65bcee6fb,2023-11-07 07:40:53+00:00,"Erstmals gibt die Mobilitätsplattform einen Einblick in ihre Daten Der Atlas offenbart die freundlichsten Städte, die beliebtesten Ziele und vieles mehr Umfrage: Nutzer der Uber-App verteilen sich über alle Altersschichten und ein Drittel von ihnen besitzt kein eigenes Auto mehr Uber Deutschland-Atlas hier zum Download Berlin, 7. November 2023 – Rund zehn Jahre ist die Mobilitätsplattform Uber in Deutschland aktiv und veröffentlicht nun die erste Ausgabe des “Uber Deutschland-Atlas”. Darin gibt das Unternehmen einen tiefen und umfassenden Einblick in die Daten hinter der Uber-App. Uber blickt dabei auf die letzten zwölf Monate. Neben Zahlen und Fakten zu den 19 Städten, in denen Uber aktiv ist, gibt es auch zahlreiche Vergleiche zwischen den einzelnen Städten und Infos über die Nutzerinnen und Nutzer der App. Menschen aus aller Welt in Deutschland unterwegs Die Daten der Mobilitätsplattform zeigen, dass die Nutzer der Uber-App in Deutschland im letzten Jahr aus 193 Ländern kamen. Sie mussten im Durchschnitt 5 Minuten auf das vermittelte Fahrzeug warten und wurden durchschnittlich mit 4,88 Sternen von den Fahrerinnen und Fahrern der Taxi- und Mietwagenunternehmen bewertet. Auf mehr als jeder fünften Fahrt gaben sie dabei ein Trinkgeld. Das höchste Trinkgeld lag bei 55 Euro. Club oder Hotel? Hauptsache mit der Uber-App – Die beliebtesten Ziele Viele Clubs sind in der Liste der beliebtesten Ziele in Deutschland zu finden. Dafür hat sich Uber die Ziele angeschaut, zu denen die meisten Fahrten vermittelt wurden, ausgenommen waren Flughäfen, Bahnhöfe und Messen. Spitzenreiter ist dieses Jahr das legendäre Berghain in Berlin, gefolgt vom Sisyphos. Außerdem in den Top 50 landen die Heinrich-Heine-Allee in Düsseldorf, der Marienplatz in München, der Deutsche Bank Park in Frankfurt und das Odonien in Köln. Darüber hinaus zeigt der Deutschland-Atlas von Uber auch die beliebtesten Reiseziele der Deutschen im Ausland. Einsame Spitze ist Lissabon. Auf Platz zwei und drei folgen Wien und Amsterdam. Das beliebteste Ziel außerhalb Europas ist Dubai. Ein wenig überraschend: Erst auf Platz 15 landet mit Las Vegas ein Ziel in den USA auf der Liste. Was man nicht im Kopf hat…: Das vergessen die Deutschen Deutschlands vergesslichste Einwohner leben in München. Nirgendwo sonst werden mehr Gegenstände während der Fahrt vergessen. Auf Platz 2 und 3 folgen die Düsseldorfer und die Kölner. Die Berliner, die als chaotisch gelten, landen hingegen nur auf Platz 6. Die Deutschen vergaßen am häufigsten, unter anderem Telefone, Geldbörsen und Schlüssel, aber daneben auch manche skurrile Dinge. Dazu zählen zwei bemalte Rattenfallen, zwei Eimer Teig, einen Eimer und einen Mopp, eine gefrorene Ente, ein Paket mit wichtiger Rücksendung (Hochzeitsaudio-Gästebuch) sowie ein Tamagotchi und Nüsse. Mit Hilfe des Uber-Kundenservices konnten Besitzer und vermisste Gegenstände in den meisten Fällen schnell wieder zusammengebracht werden. In Augsburg und Hannover leben die freundlichsten Nutzer Der Uber Deutschland-Atlas offenbart außerdem, dass die freundlichsten Nutzer in Augsburg und Hannover zu leben scheinen. Dort bekamen die Nutzer mit 4,92 Sternen im nationalen Vergleich die höchste durchschnittliche Bewertung von den Fahrerinnen und Fahrer. Ein Münchner war dagegen derjenige, der die App am meisten genutzt hat. Er ließ sich unglaubliche 1081 Fahrten vermitteln. Das entspricht fast drei Fahrten pro Tag. Dicht dahinter folgt ein Nutzer aus der Hauptstadt Berlin mit 993 Fahrten. Die durchschnittliche Fahrt ist mehr als sechs Kilometer lang, doch es gibt auch zahlreiche, extreme Ausnahmen. Die längste Fahrt führte nämlich vom Flughafen Berlin-Brandenburg zum Flughafen Zürich. Diese dauerte fast neun Stunden und war mehr als 860 Kilometer lang. Das andere Extrem sind sehr kurze Fahrten. So ließ sich ein Fahrgast in Oberursel im Taunus lediglich 41 Meter kutschieren. Work hard, play hard: Augsburger leben am Limit Ganz besondere Nutzer leben offensichtlich in Augsburg. Die Zahlen des Deutschland-Atlas von Uber zeigen nämlich, dass sich diese im Vergleich mit den anderen Städten am häufigsten in der Nacht, aber auch am Morgen Fahrten gebucht haben. Sie sind sowohl die Nachtschwärmer als auch die Frühaufsteher der Nation. Außerdem landen sie auch in der Rangliste der tierfreundlichsten Nutzer ganz vorne, denn in Augsburg war der Anteil der Buchungen der Uber Pet-Option am höchsten. Auf Nummer sicher gehen vor allem die Essener und Essenerinnen. Sie bestellten am häufigsten Fahrten vorab – über die Option “Uber Reserve”. Am meisten Trinkgeld gab es in Mannheim, gefolgt von München und Hannover. Nutzer kommen aus allen Altersschichten, besitzen immer seltener ein eigenes Auto und Nachhaltigkeit ist ihnen wichtig Für den Deutschland-Atlas führte Uber auch eine Umfrage unter seinen Nutzern durch. Es zeigt sich, dass die Altersverteilung zwischen 25- bis 65-jährigen sehr gleichmäßig ist. Die Nutzer schätzen vor allem das praktische und bequeme Nutzererlebnis der Uber-App (70 Prozent). Außerdem geben sie an, dass sie die App nutzen, weil sie in verschiedenen Ländern nutzbar ist (33 Prozent). Mehr als ein Drittel der Befragten gab außerdem an, dass sie kein eigenes Auto mehr besitzen und deshalb Fahrten von Uber vermitteln lassen. Aus den Zahlen lässt sich außerdem ablesen, dass der Vermittlungsservice von Uber immer mehr in Deutschland ankommt: 77 Prozent der Befragten buchten ihre allererste Fahrt über die App hier im Land. Die Wichtigkeit des Themas Nachhaltigkeit zeigt sich auch in den Ergebnissen. Mehr als zwei Drittel der Befragten würden bis zu fünf Minuten länger auf das vermittelte Fahrzeug warten, wenn es emissionsfrei ist. Bildmaterial finden Sie hier (Honorarfrei für aktuelle Berichterstattung) Uber Deutschland-Atlas hier aufrufen oder als PDF downloaden Über Uber Uber ist ein Technologieunternehmen, das Menschen per Smartphone-App weltweit auf Knopfdruck mit verschiedensten Services verbindet. Die Mobilitätsplattform verschafft ihren Nutzern weltweit unter anderem Zugang zu alternativen Beförderungsmöglichkeiten, zu Essenlieferdiensten sowie zu Frachtservices. Uber ist in mehr als 10.000 Städten in 71 Ländern aktiv und revolutioniert die Art und Weise, wie Menschen sich fortbewegen. In Deutschland ist der Fahrtenvermittlungsservice von Uber in 19 Regionen verfügbar: In Berlin, München, Düsseldorf, Frankfurt/M., Wiesbaden, Mainz, Köln, Hamburg, im Großraum Stuttgart und in der Region Duisburg sowie in Essen, Leverkusen, Neuss, Bergisch Gladbach, Bonn, Hannover, Mannheim, Augsburg und Heidelberg."
2004ce39-b943-4276-b9cf-c9958dd8e923,2023-11-08 07:00:00+00:00,"Seit Monaten klagen die Kunden der Postbank: Daueraufträge werden nicht ausgeführt, der Service läuft nicht, beim Hilfetelefon der Bank nimmt keiner ab. Laut Verbraucherzentralen gingen von Jahresbeginn bis September 1700 Kundenbeschwerden über die Postbank und den Baufinanzierer DSL-Bank ein – beide Unternehmen sind Töchter der Deutschen Bank. Grund für die Probleme soll die Umstellung von IT-Systemen sein. Jetzt könnte man denken, dass der Finanzkonzern mit einer großen Service-Offensive auf die Krise reagiert, etwa mehr Mitarbeiter in die Filialen schickt. Doch die Deutsche Bank geht einen anderen Weg: Sie will die Hälfte aller Postbank-Zweigstellen dicht machen. „Blanker Hohn“ – so kommentieren das die Verbraucherzentralen. Filialdichte in zehn Jahren halbiert Es ist ein Trend, der seit Jahren anhält: 2022 sank die Gesamtzahl der Filialen um 1266 auf 20 446. Zehn Jahre zuvor waren es noch fast doppelt so viele. Der erste Grund für das große Zweigstellen-Sterben ist naheliegend: Durch Online- und Mobile-Banking kommen immer weniger Kunden in eine Filiale. Die Banken selbst wollen diesem Trend aber gar nicht entgegensteuern. Denn jeder der seinen Zahlungsverkehr von der heimischen Couch aus erledigt, reduziert die Kosten für Personal und Miete. Eine der wichtigsten Kennzahlen im deutschen Finanzwesen, an der die Mitarbeiter gemessen werden, ist die Online-Quote. Also die Anzahl der Kunden, die rein digital versorgt werden. Wenn es nach den Banken geht, müssen sich auch die weniger internetaffinen, meist älteren Deutschen mit dem Online-Banking anfreunden. Eine Umfrage des „Economist“ unter 305 Bankmanagern weltweit ergab schon 2021: 65 Prozent der Befragten glauben, dass das Filialmodell bis 2026 „tot“ sein werde. Fusionen auch Grund für Filialsterben Der Schrumpfungsprozess sei in allen Banksektoren zu sehen, heißt es laut Bundesbank. So habe der Abbau bei den Großbanken im vergangenen Jahr bei fast acht Prozent gelegen, die Zahl der Filialen sank damit auf 3719 Zweigstellen. Bei den Regionalbanken sei das Filialnetz gleichzeitig auf 954 Zweigstellen geschrumpft. Die Sparkassen hätten zudem 441 Filialen geschlossen, die Genossenschaftsbanken 416. Die Gesamtzahl der Kreditinstitute in Deutschland sank laut Bundesbank im vergangenen Jahr um 61 auf 1458 Geldhäuser, vor allem wegen Zusammenschlüssen von Genossenschaftsinstituten."
897e9164-f76c-4926-818e-9879fb79d627,2023-11-09 11:04:25+00:00,"Die Postbank ging 1994 im Rahmen der zweiten Postreform aus der Deutschen Bundespost hervor. Dieser Reform lag das Poststrukturgesetz von 1989 zugrunde, das die alte Post in die Unternehmen Deutsche Bundespost Postdienst, Deutsche Bundespost Postbank und Deutsche Bundespost Telekom aufteilte. In der zweiten Reform wurden die drei Unternehmen dann auf die Privatisierung vorbereitet. Heute gehört die Marke Postbank in Berlin und dem gesamten Bundesgebiet zur Deutschen Bank. Ihr Schwerpunkt liegt auf dem sogenannten standardisierte Privatkundengeschäft. Berlin: Postbank will rund 150 Filialen schließen Wie die Postbank BERLIN LIVE mitteilte, werden von den aktuellen 550 Filialen rund 150 schrittweise geschlossen. Mitte 2026 soll es dann also im gesamten Bundesgebiet nur noch etwa 300 Standorte geben. Aktuell betreibt die Postbank in Berlin 37 Filialen. Wie viele davon geschlossen werden, ist noch unklar. Ein Sprecher der Postbank erklärte gegenüber BERLIN LIVE, dass die Schließung mit der fortschreitenden Digitalisierung zusammenhinge. „Wir stellen fest, dass unsere Mobile- und Online-Angebote zunehmend stärker genutzt werden, und zwar über alle Altersgruppen hinweg,“ so der Sprecher. Die Zukunft der Postbank liegt mittelfristig im Internet-Banking Die Postbank sieht sich laut Eigenaussage „mittelfristig“ als eine „Mobile-First-Bank“, deren Produkte und Services „bequem über Mobiltelefon, Tablet“ und die „persönliche Beratung in einem gestrafften Filialnetz“ angeboten würden. Auch wenn die Umstrukturierung wegen des gesellschaftlichen Wandels in Deutschland nachvollziehbar ist, so dürften die Schließungen bei den älteren Postbank-Kunden auf wenig Gegenliebe stoßen. Laut dem Deutschen Städte- und Gemeindebund besaß in Deutschland 2021 nur die Hälfte aller Menschen über dem Lebensalter von 65 Jahren ein Smartphone. Postbank-Kunden müssen im Zweifel Bargeld bei der Deutschen Bank abheben Selbst wenn alle Menschen in Deutschland ein Smartphone oder internetfähiges Endgerät fürs Online-Banking nutzen würden, muss man aktuell davon ausgehen, dass sie im Alltag immer wieder auf Bargeld angewiesen sind. Mehr News aus Berlin Wie die Postbank BELRIN LIVE erklärte, könnten die Kunden der Postbank und Deutsche Bank sämtliche Filialen der beiden Bankunternehmen kostenlos nutzen – um beispielsweise Bargeld abzuheben, Überweisungen zu tätigen, Daueraufträge einzurichten und Kontoauszüge auszudrucken."
e53b1733-f35d-4ae8-ab33-a715b370c920,2023-11-09 14:20:23+00:00,"In den Filialen der Postbank können die Kundinnen und Kunden normalerweise nicht nur Bankgeschäfte erledigen, sondern auch etwa Briefmarken kaufen oder Pakete aufgeben und abholen. Dafür können sie am Tag der Betriebsversammlung auf die Partner-Filialen der Deutschen Post ausweichen. Zu der Betriebsversammlung in München wurden auch Mitarbeiterinnen und Mitarbeiter aus anderen Teilen Bayerns erwartet, weshalb an diesem Donnerstag auch an weiteren Orten im Freistaat Filialen geschlossen bleiben. Gegen Mittag wird die Betriebsversammlung im Mathäser für eine Demonstration am Stachus unterbrochen. Denn viele Mitarbeitende der Postbank fürchten aktuell um ihre Jobs. Ende Oktober war bekannt geworden, dass die Deutsche Bank, der Mutterkonzern der Postbank, bis Mitte 2026 insgesamt 250 der derzeit noch 550 Standorte schließen will. In 100 der verbleibenden Filialen sollen dann nur noch Bankdienstleistungen angeboten werden. Welche Filialen von den Schließungen betroffen sind, ist noch nicht bekannt. In dieser Woche hatte die Gewerkschaft Verdi auch schon bei Betriebsversammlungen in Hamburg und Stuttgart zu Protesten aufgerufen. ""Wir wollen Klarheit für die Leute, welche Filialen betroffen sind"", sagt Tina Scholze von Verdi Bayern. In München gehe es um 150 Menschen, die derzeit an den Standorten beschäftigt sind. Die Postbank selbst will keine regionalen Angaben zu ihren Filialen oder der Zahl ihrer Kunden in München machen. Bei der Postbank hat es zuletzt durch den Umzug von Daten auf die Systeme der Deutschen Bank massive IT-Probleme gegeben - zum Ärger vieler Kunden. ""Die Beschäftigten haben bei den Umstrukturierungen den Kopf hingehalten und jetzt bekommen sie die Ohrfeige"", sagt Scholze. Verdi setzt sich für eine Verlängerung des Kündigungsschutzes für die Mitarbeitenden ein. ""DB = Desaströse Betriebsabläufe"" steht auf einem Plakat Etwa 100 Menschen ziehen gegen Mittag begleitet von der Polizei vom Mathäser über die Kreuzung zum Brunnen am Stachus. In der Luft wehen Verdi-Fahnen, ein paar wenige selbstgebastelte Plakate werden hochgehalten. ""DB = Desaströse Betriebsabläufe"" liest man darauf zum Beispiel. Die Mitarbeitenden haben aus der Presse von den geplanten Filialschließungen erfahren. Mit ihrem Protest wollen sie zeigen, dass aus ihrer Sicht etwas schiefläuft. Eine Frau, die seit Jahrzehnten in München für die Postbank arbeitet und anonym bleiben möchte, sagt: ""In unserer Filiale hat natürlich jeder Angst."" Viele Kunden hätten ihre Konten bereits aufgelöst, weil ihnen der Weg zur Bank inzwischen zu weit sei. Seit 2021 sind in der Stadt bereits zehn Standorte der Postbank weggefallen. Dass die Deutsche Bank sie zu einer ""Mobile First""-Bank umbauen will, ist offenbar nicht für alle attraktiv. ""Ich wünsche mir, dass alle Filialen erhalten bleiben"", sagt eine weitere Demo-Teilnehmerin, die ihren Namen nicht nennen möchte. Den Glauben an eine Lösung wollen sich die Postbank-Mitarbeitenden am Stachus noch nicht nehmen lassen. ""Wenn man pessimistisch ist, ist es schon zu spät"", sagt die Frau."
38775a51-8b2f-4e7f-9e00-328ba36832e2,2023-11-10 18:32:42+00:00,"Die Immobilienpreise sind durch die jahrelange Niedrigzinsphase in vielen Teilen der Welt aufgebläht. Innenstädte mit ihren Warenhäusern und Shoppingcenter auf der grünen Wiese sind nicht mehr überall 1-A-Lagen, weil Verbraucher immer öfter im Internet einkaufen und sich auf Einzelhandelsflächen oft nur noch wenige Verbraucher verlieren. Auch wenn es sich im Nachhinein leicht sagen lässt: Diese Trends hätte man erkennen können. Sie galten schon vor Corona. Bei der ins Taumeln geratenen Signa -Gruppe kommt noch Intransparenz und eine hohe Abhängigkeit allein von Gründer René Benko hinzu, die Kreditgeber hätte abhalten können. Doch gerade auch öffentlich-rechtliche Landesbanken sind auf den schillernden Selfmademan hereingefallen, während die Deutsche Bank, die selten einen Skandal auslässt, diesmal abseits steht und sich darüber freuen darf. Auch wenn Eigenkapitalgeber von Benko-Projekten wie die Fondsgesellschaft Commerz Real und der Versicherer R+V mehr zittern müssen, so werden auch die Banken kaum ungeschoren aus der Signa-Sache herauskommen. Zwar werden etliche Objekte weiter gebaut und betrieben werden können, selbst wenn Benkos Reich nicht fortbestehen sollte, was noch unklar ist. Insofern sind die Kredite keineswegs in Gänze verloren. Aber es ist schon bedenklich, welch schlechtes Timing gerade deutsche Landesbanken im Immobiliengeschäft zeigen. Bei der eigentlich vorsichtigen Helaba kommt eine Belastung insofern mit Ansage, als Beobachter seit Jahren kritische Fragen zum hohen Gewicht der Gewerbeimmobilienfinanzierungen in der Bilanz stellen: 44 Milliarden bei einem Gesamtgeschäftsvolumen von 212 Milliarden Euro sind eben keine kleine Nummer, sondern eine Unwucht. Die Helaba kann sich noch freuen, dass sie beim Kauf der Berlin Hyp gegen die LBBW den Kürzeren zog. Für diese Landesbank aus Stuttgart, deren Gewerbeimmobilienportfolio sich durch Berlin Hyp auf 56 Milliarden Euro in etwa verdoppelte, ist diese Last angesichts einer Bilanzsumme von 364 Milliarden Euro bekömmlicher. Ungemein gewachsen ist auch das Immobiliengeschäft der Bayern LB. Bei einer Bilanzsumme von 273 Milliarden Euro macht es 67 Milliarden Euro aus. Damit ist die nicht ungefährliche Unwucht Immobilienkredite in der Bilanz der Bayern LB fast so groß wie bei der Helaba."
