79e5d904-fea5-4ef7-beb5-0af097609aaa,2023-03-17 15:50:43,"Asoka Wöhrmann hat sich seinen Abschied von der Spitze der Deutsche-Bank-Fondsgesellschaft DWS kräftig vergolden lassen. Er erhielt eine Abfindung von 8,15 Millionen Euro, heißt es im Geschäftsbericht der DWS für das zurückliegende Jahr, der am Freitag zeitgleich mit dem der Deutschen Bank veröffentlicht wurde. Die Deutsche Bank hält knapp 80 Prozent an der börsennotierten Fondsgesellschaft, deren Aufsichtsratsvorsitzender und damit verantwortlich für die Vergütung der Vorstände Karl von Rohr ist, einer der Stellvertreter von Deutsche-Bank-Chef Christian Sewing. Zusätzlich erhielt Wöhrmann eine Vergütung von 5,67 Millionen Euro, inklusive einer variablen Vergütung von 3,17 Millionen Euro. Wie ein Sprecher der Fondsgesellschaft auf Nachfrage erläuterte, schied Wöhrmann zwar bereits im Juni vergangenen Jahres aus dem Vorstand aus, sein Vertrag endete aber erst Anfang dieses Jahres. Wöhrmann musste im Sommer seinen Stuhl bei der DWS räumen, weil sich die Fondsgesellschaft dem Verdacht ausgesetzt sieht, Finanzprodukte als nachhaltiger deklariert zu haben, als sie tatsächlich waren. Die Ermittlungen der Bafin dauern noch an. Nachfolger von Wöhrmann wurde der Deutsche-Bank-Manager Stefan Hoops. Er verdiente nach seinem Amtsantritt im Juni 2022 rund 3,78 Millionen Euro, davon entfielen 2,21 Millionen Euro auf variable Vergütungskomponenten. Die DWS konnte 2022 zwar an das Ergebnis des Vorjahres anknüpfen, die bereinigten Erträge aber nicht steigern."
7e6a1adc-b71a-4ea2-8042-bca4e6a173aa,2023-03-17 16:31:51,"Die Landschaft im Norden Kenias ist atemberaubend schön. Prinz William nutzte sie als Kulisse für seinen Heiratsantrag. Mit seiner Kate weilte er in einem Safaripark namens Lewa nahe dem berühmten Mount Kenia. Der Park und seine Luxuslodge sind bekannt für wilde Tiere und prominente Gäste. Auch Schwedens Prinzessin Victoria, Ex-Premier Boris Johnson und Rockstar-Koch Anthony Bourdain waren schon hier, um Giraffen und Nashörner zu bestaunen. Mittlerweile aber liefert diese Landschaft noch etwas anderes, wovon Leute aus dem Westen nicht genug bekommen können: CO₂-Zertifikate. Mit der Luxuslodge eng verbunden ist der Northern Rangelands Trust (NRT). 1,8 Millionen Tonnen CO₂ will er jedes Jahr der Atmosphäre zu entziehen, indem er die Hirten im Hinterland der Lodge zu einem ""traditionellen nomadischen Weidesystem"" bewegt. Konzerne wie Netflix, Salesforce, Meta (Facebook) oder Beiersdorf kaufen dafür Zertifikate. Doch nun gibt es Zweifel, ob die Zertifikate des Vorzeigeprojekts halten, was sie versprechen. Ein Bericht der Menschenrechtsorganisation Survival International stellt vor allem die Annahmen des Projekts und seine Messmethoden infrage. Im Zentrum stehen dabei einmal mehr die Standards von Verra, dem größten Zertifizierer auf dem freiwilligen Emissionsmarkt. Ein Milliardengeschäft in tiefer Krise Wenn Unternehmen ihre selbst gesteckten Klimaziele erreichen wollen, müssen sie ihre Emissionen oft mit CO₂-Zertifikaten kompensieren. Die Natur ist dabei ein wichtiger Partner, insbesondere der Schutz von Wäldern. Die Branche boomt, setzt mittlerweile jährlich eine Milliarde um – und steckt in einer tiefen Krise. Eine Recherche der ZEIT, des Guardian und von SourceMaterial legte jüngst nahe, dass diese Waldschutzzertifikate größtenteils wertlos für das Klima sind. Neben den Wäldern etabliert sich jedoch eine zweite Art von Naturschutzzertifikaten. ""Soil Carbon"" nennen sie sich: Bodenkohlenstoff. Die Idee dahinter ist, Landwirtschaft so zu ändern, dass Böden und ihre Vegetation mehr Kohlenstoff speichern. Unter den ""natürlichen Klimalösungen"" könnte Bodenkohlenstoff künftig 25 Prozent ausmachen, schätzt eine Studie in Nature Sustainability. Sechs Gigatonnen CO₂ würden sie demnach jedes Jahr kompensieren. Das sind mehr als die Emissionen der USA. Auf dem Emissionsmarkt sind die Zertifikate auch deshalb attraktiv, weil Böden der Atmosphäre aktiv CO₂ entziehen, anstatt es nur zu vermeiden. Auf diesen Markt drängt der Northern Rangelands Trust aus Kenia. Sein Schutzprojekt dürfte das weltweit größte Kompensationsprojekt für Bodenkohlenstoff sein. Mindestens 300 Millionen US-Dollar hofft NRT mit dem Projekt in 30 Jahren zu erwirtschaften, bislang hat es 15 Millionen Dollar bei seinen Kunden eingenommen. Um zu verstehen, wie es dazu kam, muss man die Geschichte des Safariparks kennen. Der Park war einmal eine Rinderfarm. In den Neunzigerjahren sattelte die Besitzerfamilie auf Safaritourismus um und begann, sich im Wildtierschutz zu engagieren; zum Buckingham Palace pflegte sie gute Kontakte. Aus diesem Engagement für Flora und Fauna entstand der gemeinnützige NRT, unter dessen Führung weite Teile des Landes unter den Schutz sogenannter Conservancies gestellt wurden: kleinere Schutzgebiete, von denen der Trust betont, dass sie von lokalen Bewohnern verwaltet sind."
ac3e1276-01ff-41ed-8df1-e1bcecd0846a,2023-03-17 17:14:00,"Die schwarz-grüne Landesregierung holt sich Unterstützung von politisch unabhängigen Wirtschaftsexperten ins Boot. Dazu hat sie den Hessischen Zukunftsrat Wirtschaft gegründet. Dieser kam am Freitag das erste Mal zusammen. Für den Expertenrat hat die Regierung Vertreterinnen und Vertreter von Unternehmen, Gewerkschaften, Hochschulen und Forschungseinrichtungen versammelt. Die Expertinnen und Experten sollen Empfehlungen für das Regierungshandeln in der nächsten Legislaturperiode erarbeiten, wie Ministerpräsident Boris Rhein (CDU) und Wirtschaftsminister Tarek Al-Wazir (Grüne) mitteilten. Den Vorsitz übernehmen die Vorstandsvorsitzende des Darmstädter Energieversorgers Entega, Marie-Luise Wolff, und der Wirtschaftsprofessor Volker Wieland. Wieland ist geschäftsführender Direktor des Institute for Monetary and Financial Stability (IMFS) an der Frankfurter Goethe-Universität. Erste Empfehlungen im August Der Zukunftsrat Wirtschaft wird erste Handlungsempfehlungen voraussichtlich Mitte August vorstellen. Themenschwerpunkte des Gremiums sollen die Digitalisierung, die Dekarbonisierung, die Arbeit der Zukunft und die strategische Positionierung des Wirtschaftsstandorts Hessen auf nationaler und internationaler Ebene sein. ""Wir müssen digitale Technologien optimal nutzen, weniger Ressourcen verbrauchen und dabei bis zum Jahr 2045 klimaneutral werden"", betonten Rhein und Al-Wazir in einer gemeinsamen Mitteilung. Der neu einberufene Rat solle der Landesregierung auf dem Weg dahin wichtige Impulse liefern. Ziel sei es dabei, den Wirtschaftsstandort Hessen weiterzuentwickeln. Opposition kritisiert Ratlosigkeit Die Landtagsopposition äußerte sich kritisch. Die Einberufung des Zukunftsrats Wirtschaft offenbare die Konzept- und Ratlosigkeit der schwarz-grünen Koalition, mahnte der Wirtschaftsexperte der AfD-Fraktion, Andreas Lichert: ""Braucht Hessens Wirtschaft wirklich eine neue Runde 'Buzzword Bingo' mit Modevokabeln wie Digitalisierung oder Dekarbonisierung?"" Die FDP im Landtag vermutet hinter dem neuen Expertenrat politisches Kalkül. ""Mit Blick auf das nahende Ende der Legislaturperiode und die bevorstehende Landtagswahl ist ihnen offenbar aufgefallen, dass die hessische Wirtschaft bei ihnen viel zu lange unter Radar lief"", sagte Stefan Naas, wirtschaftspolitischer Sprecher der Fraktion. Vor allem die Zukunft der Innenstädte sei ein zentrales Thema, das angegangen werden müsse. ""Das ist schon ernüchternd"" Auch der Deutsche Gewerkschaftsbund (DGB) Hessen-Thüringen äußerte sich nach dem ersten hessischen Wirtschaftsgipfel in der Staatskanzlei unzufrieden. Statt einer Antwort auf die Vorschläge der Gewerkschaft sei ein neues Gremium der Landesregierung gekommen, kritisierte DGB-Chef Michael Rudolph: ""Das ist schon ernüchternd. Aber wir geben die Hoffnung nicht auf, dass die Anstrengungen auch zu gemeinsamen Handlungen führen."""
9e0891f8-a91b-4e14-9f28-9db6a984c307,2023-03-17 17:48:34,"Deutschland wird der OECD zufolge trotz verbesserter Konjunkturaussichten in diesem Jahr langsamer wachsen als die meisten anderen großen Industrienationen. Die Organisation für wirtschaftliche Zusammenarbeit und Entwicklung (OECD) hob zwar am Freitag ihre Prognosen für die deutsche Wirtschaft an und erwartet nun, dass das Bruttoinlandsprodukt 2023 um 0,3 und 2024 um 1,7 Prozent zulegen wird. Im November hatte sie noch mit einem Minus von 0,3 Prozent für 2023 gerechnet und für das kommende Jahr nur ein Plus von 1,5 Prozent erwartet. Schlechter abschneiden dürfte in diesem Jahr aber demnach nur noch Großbritannien, für das ein Minus von 0,2 Prozent erwartet wird. Zum Vergleich: Die Euro-Zone insgesamt soll um 0,8 Prozent wachsen, die USA um 1,5 Prozent und Japan um 1,4 Prozent. Die Erholung der Weltwirtschaft insgesamt bleibe fragil. ""Für 2024 rechnen wir mit einem höheren Wachstum in Deutschland als in den anderen Ländern"", sagte die Vize-Direktorin der OECD-Wirtschaftsabteilung, Isabell Koske. ""Der Aufschwung ist auf einen hohen Auftragsbestands im Exportgeschäft, eine Belebung der Investitionen und auch die Lockerungen der Covid-Maßnahmen in China zurückzuführen."" Das verringere die Engpässe in den Lieferketten und erhöhe die Nachfrage nach deutschen Exporten. Keine Entwarnung gibt die OECD in Sachen Inflation. Die Teuerungsrate soll in diesem Jahr bei 6,7 Prozent liegen und erst 2024 merklich nachgeben und zwar auf 3,1 Prozent. ""Aufgrund der verzögerten Weitergabe der Energie- und Erzeugerpreise an die Endverbraucher sowie des steigenden Lohndrucks wird die Inflation in Deutschland auch 2023 voraussichtlich höher bleiben als im EU-Durchschnitt"", sagte Koske dazu. Durch die steigenden Zinsen, verringerten Engpässen in den Lieferketten und sinkender Großhandelspreise für Energie werde sich der Preisdruck aber allmählich abschwächen. Größtes Risiko seien die hohen Energiepreise."
e58f6847-01bb-492f-a36c-07de2d42deaf,2023-03-17 19:38:42,"Die Hoffnung auf ein schnelles Ende der Krise um die Credit Suisse könnte sich als verfrüht erweisen. Für die krisengeplagte Großbank wird nämlich auch das Geschäft mit anderen Finanzinstituten immer schwieriger, wie die Nachrichtenagentur Reuters berichtet. Mindestens vier große Häuser, darunter die Deutsche Bank und Societe Generale, hätten ihre Geschäfte mit der Credit Suisse oder deren Wertpapieren eingeschränkt, erklärten mehrere Personen mit direkter Kenntnis der Angelegenheit. Diese Einschränkungen verschärfen die Probleme der Bank, die nach einer Reihe kostspieliger Fehlschläge versucht, ihr Geschäft umzubauen und wieder auf die Beine zu kommen. Gleichzeitig verdeutlichen die Einschränkungen, welche Sorgen andere global agierende Institute offenbar vor einer Ausweitung der Krise haben. Die Credit Suisse hat eine Horrorwoche hinter sich. In einem Interview hatte der Chairman der Saudi National Bank, die größte Anteilseigner der Credit Suisse ist, eine höhere Beteiligung an der Schweizer Bank ausgeschlossen. In dem hochnervösen Umfeld war daraufhin der Aktienkurs eingebrochen, die Bank kämpft seither mit einem Vertrauensschwund von Anlegern und Kunden. ""Wir erfüllen und übertreffen im Grunde alle regulatorischen Anforderungen. Unsere Kapital- und Liquiditätsbasis ist sehr stark"", sagte zwar Konzernchef Ulrich Körner (60) im Laufe der Woche. Am Mittwochabend stellten sich die Schweizerische Nationalbank (SNB) und die Finanzmarktaufsicht Finma hinter die Credit Suisse. Wenige Stunden später begann das Institut einen Notfallkredit im Volumen von 50 Milliarden Franken anzuzapfen. Die Anleger beruhigte die Intervention der Zentralbank nicht. Auch am Freitag brach der Aktienkurs der Credit Suisse ein, um weitere 8 Prozent. Auch die Preise für Kreditausfallversicherungen bewegten sich weiter in schwindelerregender Höhe. ""Das Grundproblem der Credit Suisse bleibt das mangelnde Vertrauen der Kunden"", erklärte Analyst Daniel Bosshard von der Luzerner Kantonalbank. Entscheidend ist nun, wie sich die Kunden verhalten. ""Ob die Einleger ausreichend beruhigt sind, um die Abflüsse in den nächsten Tagen einzudämmen, ist unserer Ansicht nach eine Schlüsselfrage"", sagte Frédérique Carrier, Leiterin der Anlagestrategie bei RBC Wealth Management. Kommt es nicht bald zu einer Stabilisierung, halten Experten Staatshilfen, eine Aufspaltung oder eine Übernahme für mögliche nächste Schritte. Die Vorsicht der anderen Geldinstitute ist daher alarmierend. Die Deutsche Bank etwa habe diese Woche den Beleihungswert von Credit-Suisse-Wertpapieren gesenkt, so die Nachrichtenagentur Reuters mit Bezug auf einen Geschäftspartner der Bank. Diese Papiere, etwa Anleihen, werden von Vermögensverwaltungskunden als Kreditsicherheiten gestellt, wenn sie sich bei der Deutschen Bank Geld leihen oder andere Geschäfte besichern wollen. Zuvor hatte die Deutsche Bank diese Wertpapiere mit 70 bis 80 Prozent des Nennwerts bewertet, so die Person gegenüber Reuters. Die Deutsche Bank lehnte eine Stellungnahme ab. Die französische Bank Société Générale habe ihre Positionen mit der Credit Suisse als Gegenpartei bereits in den vergangenen Wochen verringert, halte im Moment an ihnen fest, baue sie aber nicht weiter auf, sagten zwei mit der Situation vertraute Personen gegenüber Reuters. Die britische Großbank HSBC überprüfe ihr Exposure zur Credit Suisse, habe aber noch keine Entscheidung getroffen, diese zu verringern, sagte ein weiterer Insider. Das Institut beobachte die Situation genau und werde Anfang nächster Woche entscheiden. Beide Institute lehnten eine Stellungnahme ab. Eine weitere Person berichtete über eine internationale Bank, die zumindest ihr unbesichertes Exposure verringert habe."
61cf6780-05ec-4e7d-8bdd-3e097e9add13,2023-03-17 23:00:28,"Die wichtigsten Arbeitsgeräte für Landwirt Hermann Greif sind seine Traktoren. Der Bio-Bauer aus Oberfranken hat eine Biogasanlage und bestellt mit seinem Sohn und einem Mitarbeiter gut 100 Hektar Grünland und Ackerflächen. Fünf Schlepper sind am Betrieb im Einsatz. Aktuell wird auf den Feldern gedüngt, zur Erntezeit ist dann richtig großer Maschineneinsatz gefragt. Aber anders als ""normale"" Autofahrer bezahlen Landwirte für ihre Traktoren und Landmaschinen keine Kfz-Steuer. Zum Artikel: Was sind umwelt- und klimaschädliche Subventionen? Ziel vor 100 Jahren: Motorisierung der Landwirtschaft Das ist seit über 100 Jahren so. Als die Kfz-Steuer in Deutschland 1922 eingeführt wurde, war das politische Ziel bezüglich der Steuerbefreiung für Traktoren die ""Motorisierung der Landwirtschaft"". Ein Ziel, das mittlerweile längst erreicht ist. Moderne Landwirtschaft ohne Landmaschinen ist heute undenkbar. Kritiker bemängeln sogar, viele Bauernhöfe seien heute übermechanisiert. Steuerbefreiung soll abgeschafft werden Nun heißt es vom Bundesrechnungshof, die Landwirte würden die Kfz-Steuerbefreiung zu Unrecht erhalten. Die Subvention sei überholt und sollte abgeschafft werden. Man wolle Dauerförderungen vermeiden. Außerdem sei fraglich, ob so eine ""effiziente, nachhaltige und klimafreundliche Fortentwicklung des Steuerrechts"" gelingt. Betroffen wären rund 1,7 Millionen Fahrzeuge, die derzeit in Deutschland von der Kfz-Steuer befreit sind. Wobei dazu auch Fahrzeuge von Diplomaten, der Polizei, der Feuerwehr, dem Zoll oder dem Katastrophenschutz zählen. Auch gemeinnützige oder mildtätige Organisationen können ihre Autos von der Steuer befreien lassen, sowie Menschen mit einer Schwerbehinderung. Landwirte wollen grünes Nummernschild behalten Sichtbar ist die Steuerbefreiung für Traktoren am Nummernschild: Die Buchstaben sind grün statt schwarz. Und das soll so bleiben, fordert Landwirt Hermann Greif, der als oberfränkischer Bezirkspräsident auch Funktionär des Bayerischen Bauernverbandes ist: ""Wir fahren auf Feldern, Wiesen und in den Wäldern. Und wir sind in der Regel nicht auf Straßen, die mit der Kfz-Steuer eigentlich erhalten werden. Deswegen haben diese Steuern in der Landwirtschaft nichts verloren."" Welche Kosten kommen auf die Landwirte zu? Dieses Argument entkräftet der Bunderechnungshof. Denn die Kfz-Steuer ist keine zweckgebundene Einnahme für den Bund. Das Geld, das von den zahlenden Verkehrsteilnehmern eingenommen wird, muss nicht für Straßen- und Autobahnen verwendet werden. Es könnte für Hermann Greif mit seinen Traktoren und großen Anhängern also künftig teuer werden: ""Wenn diese Steuerbefreiung wegfällt, dann sind das 3.000 bis 4.000 Euro, die ich zusätzlich im Jahr aufwenden muss – eine Riesenbelastung. Letztendlich muss ich das weitergeben, das wird sich dann irgendwann im Preis bei den Nahrungsmitteln widerspiegeln."" Auch ""Agrardiesel"" wird subventioniert Die Kfz-Steuerbefreiung ist aktuell eine wichtige Subvention für die Landwirtschaft. Im Jahr 2022 erhielten die deutschen Landwirte zusätzlich zu den EU-Subventionen in Höhe von über sechs Milliarden Euro noch zusätzlich knapp 2,7 Milliarden Euro vom Bund, zum Beispiel als Investitionshilfen für Klimaschutzmaßnahmen oder Zuschüsse für Beiträge zur Unfallversicherung. Davon machte die Kfz-Steuerbefreiung 485 Millionen Euro aus. Und weitere 440 Millionen Euro für den sogenannten ""Agrardiesel"". Denn von den 47 Cent Steuern pro Liter Diesel, die ein normaler Verbraucher bezahlt, erhält der Landwirt rund 21 Cent retour. Vor einem Jahr hatte Bayerns Finanzminister Albert Füracker (CSU) sogar gefordert, die Subvention für Agrardiesel noch weiter zu erhöhen, um die Landwirte zu entlasten. Bund der Steuerzahler auf Seiten der Landwirte Wenn es um das Thema Steuerausgaben und Subventionen geht, meldet sich meist der Bund der Steuerzahler besonders kritisch zu Wort. Beim Thema Agrardiesel und Kfz-Steuerbefreiung für die Landwirtschaft ist das aber anders. Michael Jäger vom Bund der Steuerzahler in Bayern befürchtet, dass die Bauern ihre Mehrkosten direkt an die Verbraucher weiterreichen, so wie es Landwirt Hermann Greif bereits angekündigt hat: ""Zahlen wird es am Schluss der Verbraucher. Oder die Produktion wandert aus Deutschland in den Osten ab - mit niedrigen Löhnen und niedrigen Kosten. Insofern sagen wir: Hände weg von dieser Kfz-Steuer."" Noch bis Ende November prüft das Bundesfinanzministerium die Kfz-Steuerbefreiungen. Dann steht fest, ob die Vergünstigungen für die Landwirte bestehen bleiben oder tatsächlich gestrichen werden."
8c935ec6-df8c-46b9-b437-6403239484e9,2023-03-18 22:38:00,"Wachstum mit Grenzen - Brandenburg verzeichnet 2022 so viele Investitionen wie nie zuvor Fr 17.03.23 | 21:06 Uhr | Von Katrin Neumann und Andreas Koenig Unternehmen haben in Brandenburg in 2022 so viel investiert wie noch nie. Trotz schwierigen Umfeldes sei es gelungen, eine Reihe neuer Firmen nach Brandenburg zu locken. Alle Probleme löst das aber nicht. Von Katrin Neumann und Andreas Koenig Rekordinvestition in Brandenburg durch Tesla-Effeke Wichtigste Branchen: Mobilität, Holzbau und Digitalisierung Umweltschützer fordern: Grünflächen auf dem Dach im Gegenzug für versiegelte Böden Die Wirtschaftsförderung (WFBB) hat am Freitag Bilanz gezogen. Unterm Strich steht ein Rekord-Investitionsvolumen von 1,84 Milliarden Euro in Brandenburg. 9.683 Arbeitsplätze seien geschaffen und stabilisiert worden, ein Großteil davon bei Tesla. Laut Wirtschaftsminister Jörg Steinbach (SPD) ein ""besonderes Ergebnis"" vor dem Hintergrund der Energiepreiskrise und der Inflation. dpa/S. Kahnert Wirtschaft sieht großes Potential - Studie sieht Brandenburg in der Batterieindustrie vorn Laut einer aktuellen Studie wird Brandenburg zum Zentrum der Batterieindustrie in Deutschland. Schon jetzt arbeiten tausende Brandenburger in der Branche. In der Lausitz seien die Bedingungen gut, aber die Unternehmen sehen auch Nachholbedarf. Immer mehr Tesla-Zulieferer kommen in die Region Die Investitionen von Tesla sind in der Vorzeigebilanz für das Jahr 2022 noch gar nicht drin. Man kenne den Betrag des Elektroautoherstellers noch nicht genau, sagt Wirtschaftsminister Steinbach. Was aber eingerechnet ist, ist der sogenannte Tesla-Effekt. Heißt, die Zulieferkette, die der Automobilhersteller anzieht, macht sich deutlich bemerkbar. Tesla braucht Batteriekomponenten und könnte sie von BASF in Schwarzheide und möglicherweise in Zukunft vom chinesischen Batteriezellenhersteller SVolt in Lauchhammer (beide Oberspreewald-Lausitz) bekommen. Die wiederum sind auf Zellfertiger wie Microvast in Ludwigsfelde (Teltow-Fläming) angewiesen. Es schließen sich weitere Dienstleister und Logistiker an. Die Wertschöpfungsketten seien geschlossen. Von einem ""mehrfachen Tesla-Effekt"" ist sogar die Rede, denn die Ansiedlung all dieser Unternehmen sorge für Bekanntheit und dafür, dass die Welt jetzt wüsste, wo Brandenburg eigentlich liegt. Noch wichtiger als die Investitionen an sich sind die fast 10.000 Arbeitsplätze, die damit geschaffen und gesichert werden. Hier lässt sich der Tesla-Anteil ziemlich genau beziffern: 6.600 Arbeitsverträge wurden in Grünheide im vergangenen Jahr unterschrieben. Imago Images/Schöning Filialen auch in Berlin und Brandenburg - Otto schließt Spielwaren-Plattform ""Mytoys.de"" Boom-Branchen: Mobilität, Holz und Digitalisierung Neben Mobilität sorgen die Holzverarbeiter in Brandenburg für Wirtschaftsaufschwung. Renggli International investiert 67 Millionen Euro in Eberswalde (Kreis Barnim) und schafft 200 Arbeitsplätze, Classen Industries bewegt 40 Millionen Euro und bindet 31 Arbeitnehmer in Baruth/Mark (Kreis Teltow-Fläming) an sich. Im selben Ort investiert Binderholz 5,1 Millionen Euro, damit verbunden sind 15 Arbeitsplätze. Google will sein neues Rechenzentrum in Mittenwalde (Kreis Dahme-Spreewald) bauen, die Flächen sind bereits gekauft und hunderte Arbeitsplätze sollen folgen. dpa/Heiko Rebsch Interview | Studie zu Beschäftigung - Ukrainische Geflüchtete arbeiten außergewöhnlich oft selbständig Viele der nach Deutschland geflohenen Ukrainer:innen sind erwerbstätig, oft auch selbständig, obwohl nur wenige Deutsch sprechen. Sind Ukrainer:innen besonders arbeitsfreudig? Ein Interview mit Volkswirtschafts-Professor Herbert Brücker. ""Trendwende Zuzug"" bei den Jüngeren 305 Ansiedlungen, Erweiterungsinvestitionen und Gründungen gab es 2022 in Brandenburg. 80 Prozent der Nachfrage komme aus der Industrie. Das bedeutet zum einen steigende Gewerbesteuer für die Gemeinden und zum anderen ein Phänomen, das es so seit der Wende erstmalig gäbe. Arbeits- und Fachkräfte ziehen aus anderen Bundesländern nach Brandenburg, vor allem aus den westlichen. Steinbach sieht hier eine ""Trendwende"". Außerdem sorge das neue globale Positiv-Image dafür, dass auch internationale Fachleute nach Brandenburg kommen wollen. Da sei allerdings noch Luft nach oben. Denn so erfreulich der Investitionsboom sei, der Kampf um qualifizierte Arbeitnehmer sei groß und spiele eine entscheidende Rolle. Wie man das seit Jahren schwelende Problem lösen will, konnte der Minister heute nicht beantworten. dpa/Maxym Marusenko Krieg in der Ukraine - Brandenburger Landwirte mit Betrieb in der Ukraine bangen um Mitarbeiter Seit Kurzem können in der Ukraine auch landwirtschaftliche Mitarbeiter zur Armee eingezogen werden. Für die Höfe kann das ein Problem werden - wie für den von zwei Brandenburgern, die seit einigen Jahren in der West-Ukraine wirtschaften. Süden beliebter bei Invesoren als der Norden Außerdem wusste er nicht zu sagen, warum der Süden Brandenburgs bei Investoren deutlich beliebter ist als der Norden. Nachdem der sogenannte ""Berliner Speckgürtel"" gesättigt ist, was verfügbare Gewerbeflächen angeht, bleiben brandenburgische Peripherie. Eine Erklärung für die südliche Vorliebe der Unternehmer fand Steinbach am Freitag nicht, verwies aber erneut darauf, dass die Prignitz als ""neue Mitte zwischen Berlin und Hamburg"" gelte, die an Bedeutung gewinnen werde. Zu spürbar mehr Sog in die Prignitz und Ostprignitz-Ruppin hat das bislang nicht verholfen. Tomaten aus Spanien - Afrikanische Erntehelfer bekommen Hungerlöhne für unsere Tomaten Hungerlöhne für Arbeiter, Umweltschäden durch die Produktion - das seit Januar geltende Lieferkettengesetz soll das verhindern. Tatsächlich landet weiterhin Ware in Berliner und Brandenburger Supermärkten, die unter menschenunwürdigen Bedingungen produziert wurde. Von A. Bartocha und J. Wiese Die Grenzen des Wachstums Für dieses Jahr hoffe man auf neue Rekorde bei Investition und Arbeitsplätzen. Aber wo sind die Grenzen? Und sind immer mehr Gewerbegebiete und Produktionshallen in den Kommunen wirklich wünschenswert? ""Das müssen die Kommunen leisten"", schiebt Steinbach die Verantwortung ab und meint damit, dass Bürger und Bürgerinnen selbst abwägen sollen, wie viele und welche Flächen in ihrem Umfeld zur Verfügung stehen sollen. Man werde ""nicht gegen den Willen der Menschen"" handeln. ""Die Kommune muss sagen, was erträglich ist und was nicht"", so Steinbach. dpa/J. Woitas Bis 2050 - Studie: Klimawandel-Folgen kosten Deutschland bis zu 910 Milliarden Euro Natur könnte unter Wirtschaftswachstum leiden Sendung: rbb24 Inforadio, 17.03.2023, 16:40 Uhr"
