54375bcb-320f-4ea2-9ecb-b4507efaf6f5,2023-03-24 14:59:05,"Ein möglicher Grund: Die Kosten für Ausfallversicherungen waren gestiegen. Wollten sich Anleger gegen einen Anleiheausfall bei der Deutschen Bank versichern, mussten sie dafür in den vergangenen Tagen deutlich mehr zahlen. Um einen Anlagebetrag von zehn Millionen Euro abzusichern, waren noch Mitte der Woche nur rund 140 000 Euro nötig, am Freitagmittag jedoch bereits mehr als 200 000 Euro. Auch viele Aktienanleger nahmen das wohl als Paniksignal: Ist bei der Deutschen Bank etwas im Busch? Das Problem schien jedoch eher am Markt für Kreditausfallversicherungen zu liegen, an dem nur etwa 20 große Banken überhaupt Kurse für solche Absicherungen stellen. Sichern sich bei Unruhen im Bankenwesen plötzlich viele Großanleger stärker ab, trifft dies auf ein strukturell viel zu geringes Angebot. ""Über die tatsächliche Verfassung einer Bank sagt das aber wenig aus"", sagt Bankenexperte Versondert. Scholz: ""Kein Grund zur Sorge"" Der Kurseinbruch der Deutschen Bank ist Bundeskanzler Olaf Scholz zufolge kein Grund zur Sorge. ""Es gibt keinen Anlass, sich irgendwelche Gedanken zu machen"", sagte Scholz am Freitag nach einem EU-Gipfel in Brüssel. ""Die Deutsche Bank hat ihr Geschäftsmodell grundlegend modernisiert und neu organisiert und ist eine sehr profitable Bank"", sagte der SPD-Politiker auf die Frage, ob die Deutsche Bank die nächste Credit Suisse sei. Börsenexperten beurteilen die Lage der Deutschen Bank am Freitag als stabil, aber strategieschwach. Beim Geschäft mit Privatkunden laufe man Sparkassen, Volksbanken und der ING-Bank hinterher, heißt es in Frankfurt. Im internationalen Geschäft spiele die Bank keine führende Rolle mehr. Auch sein Renditeziel von acht Prozent erreichte Bankchef Christian Sewing kürzlich nur, weil ihm ein Steuer-Sondereffekt in die Hände spielte. ""Der Kursverlust jetzt ist kein Kompliment für die Strategie der Bank"", sagt Aktienexperte Stefan Müller. ""Man darf aus dem Kursverfall der Aktien jedoch nicht auf die fundamentale Lage der Bank schließen."" Gleichzeitig gilt die Deutsche Bank geschäftsstrategisch nicht für jeden Börsianer als gutes Vorbild. ""Die Deutsche Bank und die Credit Suisse haben anders als andere Großbanken das globale Investmentbanking fortgesetzt. Zwar hat die Deutsche Bank seit 2020 die Rückkehr in die Gewinnzone geschafft, doch jetzt fragen sich die Finanzmärkte: Wer ist denn nach der Credit Suisse die nächste schwache Großbank, die in Schwierigkeiten kommt"", sagt Bankenexperte Dieter Hein vom Analysehaus Fairesearch. ""Und da ist die Deutsche Bank vorne mit dabei, weil das Geschäftsmodell nicht als nachhaltig profitabel angesehen wird"", so Hein. Ein weiterer Unruhefaktor: Viele Unternehmen schichten ihre Kontoeinlagen aktuell auf verschiedene Banken um, bereits in der vergangenen Woche hatten Unternehmen und Investoren schätzungsweise rund 100 Milliarden US-Dollar von Konten in sogenannte Geldmarktfonds geschoben. Sie bieten ebenfalls eine kleine Rendite, gelten als relativ sicher, sind formell aber eben keine Bankkonten. Für private Einleger gilt in Deutschland eine gesetzliche Einlagensicherung bis 100 000 Euro pro Person und Bank, Privatbanken versprechen noch mehr abzusichern."
e6a229a4-10a3-44e6-895d-94e12f47db40,2023-03-24 15:03:40,"Das belegt auch die neueste Erfolgsmeldung. Nach Informationen der Süddeutschen Zeitung wird im Mai in Danzig ein zusätzliches Schiff festmachen, mit weiteren 135 000 Tonnen Rohöl für Schwedt. Für eine Raffinerie, die in der Spitze pro Monat eine Million Tonnen verarbeiten kann, ist das kein Pappenstiel. Möglich sei das durch die Verlängerung der Treuhandverwaltung geworden, sagt Michael Kellner (Grüne), der sich als Parlamentarischer Staatssekretär im Wirtschaftsministerium seit dem vorigen Jahr auch um die Zukunft der Raffinerie kümmert. ""Die Treuhand wirkt und die Zusammenarbeit mit Polen funktioniert."" Selten hat sich ein Grüner so über eine Öllieferung gefreut. Die Zukunft der PCK-Raffinerie war lange ungewiss. Denn nicht nur über die Druschba-Pipeline war sie direkt mit Russland verbunden, sondern auch über den Mehrheitseigner - das war der russische Ölkonzern Rosneft. Mitte September aber übernahm der Bund die Treuhandverwaltung über das Unternehmen. Das sollte dem Augenblick zuvorkommen, in dem die russische Seite den Ölexport stoppt - und gleichzeitig jene Zeit vorbereiten, in der Deutschland auf russisches Öl verzichtet. Ein solches Embargo hatte Kanzler Olaf Scholz schon im vorigen Frühjahr für den Januar 2023 zugesagt. Gerade für die Hauptstadt ist die Raffinerie wichtig, auch aus ganz praktischen Gründen. Sie versorgt den Flughafen mit Kerosin und die Tankstellen Berlins und Brandenburgs mit Benzin und Diesel. Ein Engpass in Schwedt wäre also rund um das Kanzleramt sehr unmittelbar spürbar. Das erklärt, warum jeder zusätzliche Öl-Tanker nun abgefeiert wird. In Danzig lassen sich auch große Tanker entladen Erst vorige Woche Dienstag hatte das Bundesverwaltungsgericht eine Rosneft-Klage gegen die Treuhandverwaltung abgewiesen. Der Bund verlängerte sie noch am selben Tag um weitere sechs Monate - gerade rechtzeitig, denn einen Tag später wäre sie ausgelaufen. Damit besteht nun wieder Rechtssicherheit - auch für den Shell-Konzern, der mit 37,5 Prozent an der Raffinerie beteiligt ist. Er hat auch das Extra-Cargo organisiert, das im Mai in Danzig gelöscht werden soll. Von Danzig aus führt, ebenso wie von Rostock, eine Pipeline nach Schwedt. Anders als in Rostock lassen sich aber in Danzig auch große Tanker entladen. Dafür ist die Durchleitung an die Oder komplizierter, das polnische Röhrensystem ist ziemlich ausgelastet. Die Zeiten allerdings, in denen die Regierung in Warschau schon aus Prinzip keine Raffinerie in russischer Hand mit Öl versorgen wollte, sind vorbei. Erstens, weil der Bund Rosneft faktisch entmachtet hat, und zweitens, weil die Raffinerie auch Teile Westpolens mit Kraft- und Heizstoffen versorgt. ""Ich bin der polnischen Seite dankbar für die kontinuierliche Unterstützung in den vergangenen Monaten"", sagt auch Staatssekretär Kellner. Weiteres Öl hatte zuletzt der italienische Eni-Konzern, ebenfalls Teilhaber, in Kasachstan eingekauft. Allerdings haben diese Lieferungen einen Haken: Sie laufen teilweise auch durch russische Röhren. An die Auslastung einstiger Zeiten kann die Raffinerie dennoch nicht anknüpfen, aber immerhin arbeitet sie derzeit zu 60 Prozent. Fürs Erste jedenfalls: Im April und Mai geht sie erst einmal in eine teilweise Revision, wie sie alle paar Jahre üblich ist. Vorübergehend arbeitet dann nur eine Hälfte der Anlage, während die andere stillsteht. Dafür reicht das Öl aus Rostock."
549a2f43-0baa-4a0a-83fd-7a43dc01b6c7,2023-03-24 16:45:54,"Im Lauf des Tages war der Börsenkurs der Deutschen Bank in Frankfurt allerdings zeitweise zweistellig um mehr als 13 Prozent eingebrochen. Hintergrund dürfte sein, dass Anleger sich unsicher sind, wie sie die geldpolitischen Perspektiven und Gefahren der Bankenturbulenzen einordnen sollen. In dieser Lage hob Scholz hervor: »Die Deutsche Bank hat ihr Geschäftsmodell grundlegend modernisiert und neu organisiert und ist eine sehr profitable Bank.« Womöglich halfen diese stärkenden Worte des Kanzlers: Das Institut konnte seine Verluste an der Börse am Nachmittag jedenfalls wieder eindämmen. Wie Scholz warb auch die Chefin der Europäischen Zentralbank (EZB), Christine Lagarde, um Vertrauen in das System. Europas Bankensektor sei sehr »widerstandsfähig«, versicherte sie. Sie berichtete den europäischen Staats- und Regierungschefs am zweiten Tag des EU-Gipfels über mögliche Risiken durch den Zusammenbruch zweier kleinerer US-Banken und durch die Not-Übernahme der Schweizer Credit Suisse durch die UBS-Bank. Scholz will Banken- und Kapitalmarktunion ausbauen Außer bei Deutschen Bank sackten die Kurse auch bei anderen Banken kräftig ab. Die Commerzbank war zeitweise zehn Prozent im Minus, auch französische und britische Institute gerieten in den Strudel. Grund war vor allem ein starker Anstieg der Kosten für Kreditausfallversicherungen. Frankreichs Präsident Emmanuel Macron machte Spekulation für die jüngste Talfahrt verantwortlich. »Die Eurozone ist die Region, in der die Banken am solidesten sind«, sagte Macron. Lagarde sagte den Staats- und Regierungschefs in Brüssel laut einem EU-Vertreter, der Bankensektor verfüge »über eine solide Kapital- und Liquiditätsdeckung«. Scholz hob hervor, dass es in der Eurozone und der Europäischen Union »striktere, klarere Regeln« als in vielen anderen Ländern der Welt gebe. Das sei das Ergebnis jahrelanger Arbeit nach der großen Finanzkrise 2008 und 2009. Die jüngste Entwicklung sei jedoch Ansporn, da weiter zu machen und die Banken- und Kapitalmarktunion auszubauen, sagte der Kanzler. Eurogruppen-Präsident Paschal Donohoe mahnte bei der Bankenunion rasche Fortschritte an. »Wir fordern weitere Anstrengungen zur Vollendung unserer Bankenunion«, hieß es auch in der gemeinsamen Gipfelerklärung. Umstritten sind dabei vor allem Pläne für eine gemeinsame europäische Einlagensicherung. Für Einlagen besteht in Deutschland ein gesetzlicher Schutz bis zu einer Summe von 100.000 Euro pro Person und Bank. Die Regeln waren 2015 in der EU verschärft und vereinheitlicht worden. Deutsche Sparer profitieren zudem von freiwilligen Einlagensicherungsfonds der Banken, um auch Verluste oberhalb von 100.000 Euro auszugleichen."
6a77f232-5e2d-42cc-ac80-04b83ba6e95b,2023-03-27 03:15:34,"Die aktuellen Herausforderungen für die deutsche Wirtschaft sind einzigartig komplex. Gefordert sind pragmatische Problemlösungen statt politischer Scheinlösungen, die Vernunft und Realität ausblenden und sich von Ideologie und Moralismus leiten lassen. Ein angebliches „Geheimpapier“ der EU-Kommission zeigt die aktuelle Gefährdung der Wettbewerbsfähigkeit Europas auf. Vor allem der deutsche Mittelstand stehe vor großen Herausforderungen. Die Energiekrise bedrohe die deutsche Industrie „in einer Phase beispiellosen Wandels“ wesentlich stärker als ihre globalen Konkurrenten in den USA und in China. Einer Umfrage zufolge sollen 34 Prozent der Top-Manager planen, ihre Investitionen vorübergehend auszusetzen oder zu verringern. 15 Prozent beabsichtigen, dauerhaft auf Investitionen zu verzichten. Die deutschen Industriegewerkschaften halten wegen der hohen Strompreise mehrere hunderttausend Arbeitsplätze für gefährdet. Angesichts der Tatsache, dass die deutsche Industrie mit die höchsten Stromkosten in Europa tragen müsse, fordert die IG Metall die Einführung eines speziellen Industriestrompreises zum Erhalt der Wettbewerbsfähigkeit. Andernfalls drohe „kurz oder lang“ das Verschwinden der Stahlerzeugung, der Aluminiumindustrie und anderer energieintensiver Branchen aus Deutschland. Auch für die Chemieindustrie besteht nach Einschätzung der IG BCE das Risiko, dass Produktionsstätten verlagert und Anlagen geschlossen werden. Das bedeute dann „den ersten Schritt zur Deindustrialisierung Deutschlands“. Der BDI fordert die EU-Kommission auf, Europa in schnellerem Tempo attraktiver für den weltweiten Wettbewerb zu machen. Und an die Bundesregierung appelliert der Industrieverband, den Standort Deutschland durch eine Anpassung der Steuerpolitik voranzubringen. Damit die Bundesrepublik nicht länger ein Höchststeuerland für Unternehmen bleibe, solle die Steuerbelastung auf 25 Prozent gesenkt werden. Damit liege der Standort zumindest im internationalen Mittelfeld. Planwirtschaft oder Marktwirtschaft? Für zusätzliche Verunsicherung der Automobilindustrie sorgt die geplante Abgasnorm Euro 7, die wie ein Damokles-Schwert über der Branche und ihren 785.000 Beschäftigten schwebt. Die neue Norm soll den Schadstoff-Ausstoß massiv reduzieren. Bis 2035 sollen die Emissionen von PKW um 35 Prozent und diejenigen von Bussen und LKW um über 50 Prozent sinken. Die CDU-Fraktion im Bundestag hat die fachlich zuständige grüne Umweltministerin jetzt vor einem Verlust von bis zu 300.000 Arbeitsplätzen gewarnt. Und der Verkehrsminister (FDP) moniert die Verteuerung von Neuwagen, die Mobilität zum Luxusgut werden lasse. Ab 2035 sollen bekanntlich laut Beschluss des EU-Parlaments überhaupt keine Verbrenner-Motoren mehr zugelassen werden, was der Öko-Lobby offenbar nicht ausreicht. So fordert Greenpeace ein Vorziehen des Verbots neuer Diesel- und Benzinfahrzeuge (einschließlich Hybridfahrzeugen) auf spätestens 2028. Außerdem müssten alle Verbrennungsmotoren „bis 2040 von Europas Straßen verbannt“ werden. Dagegen spricht sich der BDI für echte Technologieoffenheit aus und lehnt ein faktisches Aus für Verbrenner ab. Derzeit sind 48,8 Mio. PKW in Deutschland zugelassen. Der Anteil der batterieelektrischen Fahrzeuge beträgt mit 1,013 Mio. gerade einmal 2,1 Prozent. „Schuss ins Knie“? Auch im Heizungsbereich setzt die amtierende Bundesregierung auf Verbote statt auf Vernunft. SPD und Grüne wollen den Einbau neuer Gas- und Ölheizungen ab 2024 untersagen. Die Wirtschaftsweise Prof. Veronika Grimm bezeichnet diesen Plan als falsch. Durch solche Verbote könne sich die Regierung „ins Knie schießen“. Es sei mit Ineffizienzen zu rechnen, wenn etwa Betriebe kein Gas zum Heizen nutzen könnten. Fraglich sei, ob die Sanierung von Häusern sowie die Herstellung und der Einbau von Wärmepumpen überhaupt schnell genug erfolgen könnten, um die Gasheizungen zu ersetzen. Das kürzlich erklärte Ziel der Bundesregierung, bis 2030 pro Tag vier bis fünf neue Windräder aufzustellen und täglich mehr als 40 Fußballfelder voller Solaranlagen zu installieren, erscheint ebenso ambitioniert wie illusorisch. Der bayerische Ministerpräsident bezeichnete die Verbotspläne von Wirtschaftsminister Habeck als „Angriff auf die Mittelschicht und sozial Schwächere“. Söder weiter: „Diese Pläne treiben den Stromverbrauch weiter nach oben und könnten am Ende zu einer Rationierung von Strom führen. Die Grünen haben offenkundig den Bezug zur Lebensrealität komplett verloren. Sie sind inzwischen eine reine Luxuspartei, die sich nur um gut verdienende Großstadtbürger kümmert und stattdessen Arbeitnehmer und den ländlichen Raum bewusst vernachlässigt.“ Mit ihrem „ideologischen Verbot“ der Kernenergie und der Gasförderung blieben die Grünen „ein Blackout- und Wohlstandsrisiko“. Der CSU-Vorsitzende warf den Grünen zugleich vor, die normale Bevölkerung aus dem Blick verloren zu haben: „Die Grünen leben in einer Fantasie- und Verbotswelt. Sie sind die Verbotspartei Nummer 1: Fleisch-, Böller-, Autowasch-, Werbe- und Luftballonverbote sind nur eine kleine Auswahl ihrer Pläne. Sie wollen letztlich eine andere Republik und die Deutschen umerziehen. Die meisten Menschen wollen aber nicht nach der grünen Pfeife tanzen.“ Gralshüter der Moral Vor allem die grünen Bundesminister argumentieren regelmäßig mit der Attitüde, alleinige Sachwalter und Gralshüter der politischen Moral zu sein. Ein besonders eklatanter Bruch zwischen Anspruch und Wirklichkeit, zwischen Schein und Sein stellt die Energiepolitik dar. Es sind dieselben grünen Spitzenpolitiker, die mit Verve für ein Verbot von Kernkraft und Fracking in Deutschland eingetreten sind, gleichzeitig aber stillschweigend hinter den Kulissen den Bezug von Atomstrom aus europäischen Nachbarländern und von Fracking-Gas aus den USA dulden oder sogar fördern. Erstaunlich ist, wie gut und unbeschwert solche Protagonisten offenbar mit dieser speziellen Variante einer kognitiven Dissonanz leben können. Während die Partei gegenüber den deutschen Wählern sehr bemüht ist, das Gesicht in puncto Konsequenz und Glaubwürdigkeit zu wahren, erfolgt der energiepolitische Umgang mit anderen Ländern und internationalen Institutionen eher pragmatisch und flexibel. Das zeigt sich vor allem im Kontakt mit der EU-Kommission und dem Atomstrom-Lieferanten Frankreich. Während Ende April die letzten deutschen Kernkraftwerke stillgelegt werden, befinden sich in unserem westlichen Nachbarland 56 Atommeiler am Netz. Während hierzulande der finale Ausstieg als Erlösung gefeiert wird, macht Frankreich das Motto „Kernkraft – ja bitte“ zur Devise gegen Klimakollaps und Energienotstand. Mit Frankreich, den Niederlanden, Polen, Finnland, Bulgarien, Kroatien, Tschechien, Ungarn, Rumänien, Slowenien und der Slowakei haben sich bereits 11 Länder zu einer Atom-Allianz zusammengeschlossen. Die französische Energieministerin hat den Auftritt Deutschlands contra Kernenergie als „heuchlerisch“ bezeichnet. Auf Druck Frankreichs hat die EU-Kommission schon Ende 2021 vorgeschlagen, neben modernen Gaskraftwerken auch die Atomenergieerzeugung mit dem grünen Gütesiegel für umweltverträgliche Investitionen zu versehen. Der deutsche Widerstand soll sich seinerzeit in engen Grenzen gehalten haben. Die Dimension der hier praktizierten Doppelmoral ist selbst für politische Verhältnisse erstaunlich. Ein nicht ganz unwesentlicher Aspekt findet in der öffentlichen Meinungsbildung erstaunlicherweise kaum Beachtung: Selbst wenn Deutschland seinen Anteil am weltweiten CO2-Ausstoß von derzeit 1,8 Prozent auf den (theoretischen) Wert von Null reduzieren könnte, wäre dies für die globale Bilanz zwar symbolisch schön, aber faktisch irrelevant, weil die zunehmenden Schadstoffbelastungen anderer Länder die deutsche Senkung überkompensieren. Zum Vergleich: Der Anteil Chinas lag 2021 bei 30,9 Prozent. Dass die gut gemeinte Hoffnung, am deutschen Wesen soll die (Öko-)Welt genesen, naiv und trügerisch ist, liegt auf der Hand und führt auf Irrwege. Hilfreich wären mehr Augenmaß und Realitätssinn für das sinnvollerweise Machbare. „Finanzieller Kontrollverlust“ Aus gegebenem Anlass hat der Bundesrechnungshof die Bundesregierung – mit Blick auf den Schuldenberg von mittlerweile 2,1 Billionen Euro – vor dem finanziellen Kontrollverlust gewarnt. Die Dynamik und die Folgen der Verschuldung drohten die Tragfähigkeit der Bundesfinanzen und damit auch die staatliche Handlungsfähigkeit ernsthaft zu gefährden. Um das Heft des Handelns in der Hand zu behalten, müsse die Bundesregierung alle Ausgaben neu priorisieren und den Haushalt konsequent auf die Kernaufgaben ausrichten. Es dürften keine neuen Maßnahmen mehr beschlossen werden, ohne ihre langfristige Finanzierung zu klären. Rechnungshofpräsident Kay Scheller, der schon mehrfach seine richterliche Unabhängigkeit eindrucksvoll unter Beweis gestellt hat, merkt an: „Für stabile Bundesfinanzen bedarf es jetzt klarer, kluger und auch schmerzhafter Entscheidungen. Permanent in neue Schulden auszuweichen, ignoriert die Realität und übergeht die Interessen vor allem der jungen Generation.“ Unter anderem schlägt der Rechnungshof vor, dass die in den vergangenen drei Jahren aufgenommenen Kredite schneller als geplant getilgt werden und Sondervermögen abgewickelt werden. Diese kreditfinanzierten Töpfe neben dem regulären Haushalt umgingen die Schuldenbremse. Wie sich die EZB-Zinserhöhungen in der Realität auswirken, zeigt ein Blick in den Bundeshaushalt: Die dort gebuchten Zinsausgaben haben sich von rund 4 Mrd. Euro in 2021 auf etwa 40 Mrd. Euro in 2023 verzehnfacht. „83 Mio. Versuchskaninchen“ Massive Grundsatzkritik an der Ampelregierung übt Prof. Hans-Werner Sinn. Der Ökonom fordert in einem Interview das Ende deutscher Alleingänge: „Deutschland ist dabei, durch seine extremistische Klimapolitik die eigene Industrie zu ruinieren, und wir setzen damit ein Negativbeispiel für die ganze Welt.“ China und andere Schwellenländer würden „einen Teufel tun, uns zu folgen, wenn wir unsere Unternehmen mit Energieverboten aus dem Land jagen und den Lebensstandard der Bevölkerung ruinieren."
160d218c-d6d2-4821-840e-10f6b9a09734,2023-03-27 05:01:25,"Stockach. Die neue Wirtschaftsförderin der Stadt Stockach, Regina Schlecker, konnte am Donnerstag den ersten ""Stockacher Businesstreff"" als Austauschrunde der lokalen Unternehmer in den Räumen der ""ETO Gruppe"" mit ihrem Hauptsitz in Stockach durchgeführt werden. Bürgermeister Rainer Stolz freute sich, über die doch ganz gute Resonanz auf diese Premiere, denn gerade in den aktuellen Zeiten der vielen Herausforderungen ist es für die Unternehmen ganz wichtig, zusammen zu reden und sich über neue Wege zu informieren. Dieser Business-Talk solle nun in Zukunft möglichst zwei Mal im Jahr durchgeführt werden ´, machte er den neuen Weg der Wirtschaftsförderung in der Stadt deutlich. Die Gäste konnten an diesem Nachmittag auch einiges an interessanten Wegen in die Zukunft erfahren. Wie Dr. Michael Schwabe als Vorsitzender der Geschäftsführung der ETO Gruppe, die dieses Jahr ihren 75. Geburtstag feiern kann und letztes Jahr den 30. Jahrestag des Umzugs von Uhldingen nach Stockach feierte, was dem Unternehmen, es hat inzwischen 2.400 Mitarbeiter an global acht Standorten, ganz neue Entwicklungsmöglichkeiten eröffnete. Stellte das sehr intensiv im Umbau befindliche Unternehmen vor. Denn vom klassischen Automobilzulieferer gehe der Weg schon seit einigen Jahren in immer mehr Komponenten der Elektronik bis hin sogar zur künstlichen Intelligenz unter dem Leitsatz ""Bewegung erzeugen"" und sei dafür sogar schon von der Fachzeitschrift ""Chip Deutschland"" zum ""Digital Innovator"" ernannt worden. Längst sei man neben dem Automobilbereich schon in Bereiche wie Medizintechnik oder Lebensmittelerzeugung vorgedrungen, mit einer hohen Quote an Patenten und sehe das Unternehmen gar als ""Ökosystem"". ""Wir werden unser Hauptprodukt mittelfristig abgeben können, weil wir eine neue Basis geschaffen haben"", blickte Dr. Michael Schwabe in die Zukunft. Neue Netzwerke entstehen Nicht nur wenn Unternehmen sich neuen Herausforderungen stellen, steht die Frage nach Fachkräften ganz oben. Um die ganze Region neu ins Rampenlicht zu stellen und gerade hoch qualifizierten Nachwuchs zu bekommen, ist gerade aus dem ""Denkraum Bodensee"" das Projekt ""BIT Bodensee Institut für Technologie"" erwachsen. Am 17. März habe man den Förderkreis begründen können, an dem unter anderem das Unternehmen ETO wie auch die Stadt Stockach beteiligt sind. Wie Dr.-Ing. Markus Unger, Geschäftsführer IWT Wirtschaft und Technik GmbH als Projektleiter erklärte, sei es Ziel, dieses ""Institut"" bis in drei Jahren auf den Weg gebracht zu haben. Es wäre eine Vernetzung der vielen Hochschulen am Bodensee und könnte die Möglichkeiten auch durch hochschulübergreifende Studien für die Region verbessern. Das sei auch ein Angebot in Richtung Mittelstand (KMU's) für die Region unterstrich Unger in seiner Präsentation. Und das ging dann gleich mit Alexandra Boger von der HTWG Konstanz weiter, die die vielen Vernetzungsmöglichkeiten für Unternehmen über Projekte mit der Konstanzer Hochschule vorstellte. Die HTWG selbst habe sich bereits in vielen Punkten mit den 28 Hochschulen um den See in der DACH-Region (Deutschland, Österreich, Schweiz) vernetzt. Aktuell sei man am Aufbau einer Forschungsinitiative für Mobilität und Nachhaltigkeit (bzi40.eu). Beste Beispiele für Kooperationen zwischen Wissenschaft und Wirtschaft sind für sie die Reallabore. Ein solches ist gerade mit dem Unternehmen ""Fondium"" in Singen im Aufbau, unter anderem zur Dekarbonisierung der Industrie. Die Gewinnung neuer Fachkräfte für die Unternehmen der Region verspricht auch das Franchiseunternehmen ""Kontaktschmiede"", das als ""Talente für die Region"" auch ungewöhnliche Wege beschreitet. Wie deren Geschäftsführer Philipp Gotterbarm erklärte, sieht er das Potenzial für die Unternehmen, was in zehn Hochschulen, mit geschätzt 50.000 Studierenden, für man für die regionale Wirtschaft gewinnen könnte. Talk mit Führung Wie der Umbau der ETO Gruppe schon fortgeschritten ist, konnten die Gäste des ersten Stockacher Business-Talk gleich im Anschluss bei einer kleinen Werksführung erleben, denn die Künstliche Intelligenz ist dort schon am Werk, dafür wurden eigene Projekteinheiten als ""Töchter"" gebildet. Dr. Schwabe gestand, dass er selbst sich das alles inzwischen erklären lasse, denn die Technik werde immer komplexer. Das war viel Stoff für den abschließenden Talk."
