b6ee8f5f-e401-4dc2-b07b-0baac398c55c,2023-11-14 08:16:45+00:00,"Die Menschheit wird im Schnitt immer älter – das ist mittlerweile eine olle Kamelle, die fast jeder Anleger schon mal gehört hat. Tatsächlich wird der „Megatrend Demographie“ vor allem Aktien von Medizintechnik- und Pharmaunternehmen wie zum Beispiel Novo Nordisk in Zukunft dauerhaft stützen. Aber darum geht es mir heute nicht. Von der Faustegel für die persönliche Aktienquote hast du sicher schon mal gehört: 100 minus Lebensalter, dazu raten die meisten Bankberater immer noch. Deshalb hatten viele Experten bisher befürchtet, dass die Millionen Babyboomer in den Industriestaaten, die bis 2030 in Rente gehen, einen Ausverkauf bei Aktien auslösen werden. Dann, so die These, würden sie vermehrt in Anleihen umschichten, um ihren angesparten Wohlstand abzusichern. Warum mehr Rentner Aktien sogar beflügeln Doch eine aktuelle Studie der Deutschen Bank kommt nun zu einem völlig anderen Ergebnis. Ihre Experten sagen: Die Alterung der Gesellschaft wird die Aktienkurse sogar beflügeln. Und das kommt so: Weil die Menschen eine höhere Lebenserwartung haben, muss ihr angespartes Geld länger reichen. Deshalb sind sie geradezu gezwungen, einen höheren Anteil in Aktien zu investieren, um höhere Renditen zu erzielen. Zumal die kommende Rentner-Generation bereits einen deutlich höheren Aktienanteil im Portfolio aufweist als frühere Generationen. Sie hat also bereits gelernt, mit dem Aktien-Risiko umzugehen. Weil die Inflationsraten dauerhaft hoch bleiben werden, werden Aktien aus bestimmten Branchen als natürlicher Hedge gegen die Inflation eingesetzt. Gesucht sind dann vor allem Value-Aktien mit hoher Dividendenrendite. Mit wachsendem Wohlstand der Bevölkerung in den Schwellenländern werden auch deren Einwohner stärker für das Alter vorsorgen – und dafür vor allem Titel aus den entwickelten Industrieländern wählen, weil sie diese als solide betrachten. Selbst wenn die Senioren Teile ihrer Aktien-Portfolien verkaufen, wird dieses Geld umgehend in den Konsum fließen – wovon wiederum andere Aktien profitieren. Überhaupt steigen die Konsumausgaben der Rentner aufgrund der höheren Lebenserwartung seit Jahren an. Die Unternehmen werden versuchen, das schrumpfende Angebot an Arbeitskräften durch mehr Automatisierung zu ersetzen. Dadurch steigt ihre Rentabilität, was den Aktienkursen zusätzlich hilft. Auf der Negativseite steht allerdings ein nachlassendes Wirtschaftswachstum aufgrund der schrumpfenden Erwerbsbevölkerung. Nach Schätzungen des IWF führt eine Abnahme der Erwerbstätigen um ein Prozent oder ein Prozent weniger Bevölkerungswachstum zu einem Prozent weniger BIP. US-Aktien weiterhin stark gefragt Interessant ist aber auch: In fast allen Szenarien, die die Deutsche Bank betrachtet, sind vor allem US-Aktien gefragt. Dies liegt zum einen an ihrer bereits jetzt schon überdurchschnittlich hohen Rentabilität. Zum anderen daran, dass auch Anleger aus den Schwellenländern bevorzugt in US-Werte investieren. Und der dritte Grund ist, dass die Alterung der Bevölkerung in den USA aufgrund der Migration langsamer voranschreitet als in vielen anderen Industrienationen. „Die USA haben einen unterschätzten demografischen Vorteil“, schreiben die Analysten der Deutschen Bank. Der Anteil der Altersgruppe der 30- bis 44-Jährigen an der Bevölkerung, die als Schlüsselgruppe für wirtschaftliche Innovation und Konsum gelten, werde bis 2030 weitgehend unverändert bleiben. „Das steht im Gegensatz zu Europa, wo die Gruppe der 30- bis 44-Jährigen weiter schrumpfen wird.“ Anteil der Erwerbsbevölkerung an der Gesamtbevölkerung Der Denkfehler beim Thema China Aber nicht nur in Europa, auch in vielen Entwicklungsstaaten schreitet die Alterung der Gesellschaft voran – sogar schneller als in den Industrienationen, wenn auch von einem niedrigeren Niveau aus. Einige Experten sagen deshalb beispielsweise für China bereits ähnliche Schwierigkeiten voraus wie zuvor Japan. Schließlich wird dort laut OECD-Schätzungen die Gesamtbevölkerung bis zum Jahr 2100 um für uns unfassbare 300 Millionen Menschen schrumpfen. Grund ist die niedrige Geburtenrate nach einer jahrzehntelangen Ein-Kind-Politik. Doch auch das sehen die Experten der Deutschen Bank anders. Sie beobachten, dass in China die Gruppe der besonders innovativen und konsumfreudigen 30-44-jährigen bereits wieder wächst. „Das deutet darauf hin, dass sich die chinesischen Märkte noch erheblich zulegen könnten“, schreibt die Deutsche Bank. Mehr Kommentare und Analysen erhalten Sie einmal wöchentlich im kostenlosen Newsletter von „Rene will Rendite“. Hier abonnieren!"
eadf3f12-3853-40d6-9c0f-8afb7ffb6c99,2023-11-15 11:15:00+00:00,"Als erste deutsche Universalbank erhält die Commerzbank eine Kryptoverwahrlizenz. Im ersten Schritt strebt die Bank an, ihren institutionellen Kunden eine sichere, regulatorisch konforme und zuverlässige Plattform für die Verwahrung von Kryptowerten auf Basis der Blockchain-Technologie zur Verfügung zu stellen. „Mit dem Erhalt der Lizenz haben wir einen wichtigen Meilenstein erreicht“, sagt Dr. Jörg Oliveri del Castillo-Schulz, Leiter des operativen Geschäfts der Commerzbank. Die Verwahrlizenz solle die Grundlage bilden, um Kunden im Bereich der digitalen Vermögenswerte zu begleiten. Neben der Commerzbank arbeitet beispielsweise auch die Deutsche Bank an einer entsprechenden Lizenz. So habe David Lynne, der das Firmenkundengeschäft der Deutschen Bank leitet, auf einer Konferenz verraten, dass das größte Deutsche Bankhaus bei der Bafin im Juni eine Kryptoverwahrlizenz beantragt hat. Auch die Fondstochter DWS bemühe sich derzeit um die entsprechende Lizenz bei der Bafin. DZ hat seit Anfang des Monats Verwahrplattform Es ist die zweite Lizenz, die von der Bafin in jüngster Zeit verliehen wurde. Die DZ Bank startet ebenfalls mit ihrer eigenen Digitalverwahrplattform für Kryptoassets. Die DZ Bank richtet sich mit dem Angebot zunächst an institutionelle Kunden. Auf die Kryptoverwahrlizenz wartet die DZ Bank noch. Die DZ Bank will über die Plattform künftig auch Privatkunden ermöglichen, direkt in Kryptowährungen zu investieren. Angekündigt hatte das Institut die Pläne bereits im November 2022. Über die Commerzbank Die Commerzbank ist Partner von rund 26.000 Firmenkundenverbünden sowie knapp 11 Millionen Privat- und Unternehmerkunden in Deutschland. In zwei Geschäftsbereichen – Privat- und Unternehmerkunden sowie Firmenkunden – bietet die Bank ein Portfolio an Finanzdienstleistungen."
262ad0c5-c247-4205-a8f2-5123845bdb2e,2023-11-15 12:44:31+00:00,"Die Commerzbank hat als erste Universalbank von der deutschen Finanzaufsicht Bafin eine Lizenz erhalten, um digitale Wertpapiere wie die Kryptowährungen Bitcoin und Ether sowie über eine Blockchain ausgegebene Anleihen und Fonds verwahren zu dürfen. Bislang hat die Bafin acht solcher Kryptoverwahrlizenzen vergeben, etwa an Tochtergesellschaften amerikanischer Unternehmen wie Coinbase und Bitgo oder an Fintechs wie Upvest, Tangany und Bitpanda. Nahezu alle Großbanken und Fondsgesellschaften in Deutschland arbeiten zwar an einem Kryptoverwahrangebot, und viele wie Deka und DZ Bank haben auch eine Lizenz bei der Bafin beantragt. Doch es dauert bis zu deren Erhalt oft mehr als ein Jahr. Deshalb hat etwa die kleine Privatbank Hauck & Aufhäuser mit Kapilendo 2021 ein Fintech gekauft, das schon über eine Kryptoverwahrlizenz verfügte. Die Commerzbank hat nun aus eigener Kraft eine Kryptoverwahrlizenz erhalten, vor dem großen Rivalen Deutsche Bank mit der DWS, die auch an einer Lösung zur Verwahrung digitaler Wertpapiere arbeiten. Über ihre weiteren Pläne hielt sich die Commerzbank am Mittwoch bedeckt. In einem ersten Schritt strebe sie an, ihren institutionellen Kunden, also etwa Versicherern, Pensionskassen und Fondsgesellschaften, eine „sichere, regulatorisch konforme und zuverlässige Plattform für die Verwahrung von Kryptowerten auf Basis der Blockchain-Technologie zur Verfügung zu stellen“, hieß es in einer kurzen Pressemitteilung der Commerzbank. Von Privatkunden ist darin nicht die Rede. Vor kurzem hatte die Fondsgesellschaft Union Investment erstmals Fondsanteile der Metzler-Bank über eine von diesem Bankhaus bereitgestellte Blockchain gekauft. Digitale Anleiheemissionen etwa von Siemens und der KFW gibt es schon länger. Als nächste Wertpapiergattung könnten digitale Investmentzertifikate hinzukommen, die bei Privatkunden sehr beliebt sind. Allen gemeinsam ist: Die Transaktionen werden kryptografisch verschlüsselt und für alle zuvor ausgewählten Teilnehmer zugänglich gespeichert. Man spricht hier auch von einem dezentralen Kassenregister (Distributed Ledger Technology, DLT). Ein Vorteil: Wertpapiere können schnell(er) und ohne die Deutsche Börse und ihre Verwahrstelle Clearstream gehandelt, gebucht und verwahrt werden. Die Wertschöpfungskette ändert sich."
5ede3657-8015-452f-9089-b7d65419d307,2023-11-16 10:21:00+00:00,Witten. Schon wieder ist ein Geldautomat in der Nacht in Witten gesprengt worden. Betroffen ist diesmal die Deutsche Bank. Das ist bislang bekannt.
23488d8b-028a-485f-9c27-53361e1e5646,2023-11-21 06:00:00+00:00,"Know-Your-Customer-Prozesse sind für die Compliance von Banken essenziell. Doch laut des aktuellen KYC Trend Reports 2023 gehen zu viele Firmenkunden beim Onboarding verloren, obwohl die Budgets in Deutschland hoch sind. × Gut jede fünfte deutsche Bank (22 Prozent) investiert 50 bis 60 Prozent ihres Compliance-Budgets in Know-Your-Customer-Prozesse (KYC). Das ist im weltweiten Vergleich ein Spitzenwert. Zu diesem Ergebnis kommt der internationale KYC Trend Report des Softwareanbieters Fenergo, für den in diesem Jahr erstmals auch Daten des deutschen Bankenmarkt erhoben wurden. Von den mehr als 1.100 Bankentscheidern, die im Zeitraum von September bis Oktober 2023 befragt wurden, sind 204 als Chief Operations Officer, Chief Compliance Officer, Chief Risk Officer und Chief Information Officer für deutsche Finanzhäuser tätig. Kosten liegen über 2.500 Euro pro Kunde ""Vor allem Online-Banken haben die digitale Transformation von Finanzinstituten beschleunigt. Doch es gibt immer noch zahlreiche Defizite in der deutschen als auch globalen Bankenbranche, die immense Kosten verursachen"", konstatiert Alex Hase, Regional Director bei Fenergo. Vielen Unternehmen mangele es an effizienten Know-Your-Customer-Prozessen. Deutsche Geldhäuser geben im Durchschnitt 2.627 Euro für den KYC-Prozess pro Firmenkunde aus und liegen damit zehn Prozent über dem globalen Durchschnitt. Dennoch bestätigen 43 Prozent der Befragten, bereits Kunden wegen ineffizientem Onboarding verloren zu haben. Weltweit liegt dieser Anteil im Schnitt bei 47,5 Prozent. Die drei wichtigsten Gründe, weswegen Neukunden noch vor dem Onboarding die Bank verlassen, sind redundantes Datenmanagement, wiederholte Anfragen nach denselben Daten und eine schlechte digitale Journey"", fasst Hase zusammen. Prozess bindet zu viel Manpower Mehr als ein Viertel der Banken benötigt in Deutschland zwischen 121 und 150 Tagen für die Durchführung einer KYC-Prüfung von Geschäftskunden mit einem mittleren Risiko. Der globale Mittelwert liegt mit 95 Tagen deutlich darunter. Bei 27 Prozent der hiesigen Finanzinstitute kann der Prozess sogar zwischen 151 und 180 Tagen dauern. Und das, obwohl durchschnittlich pro Finanzhaus rund 1.800 Beschäftigte in Vollzeit an den Prüfungen beteiligt sind. 42 Prozent der deutschen Institute geben sogar an, dass sie zwischen 2.000 und 3.000 Mitarbeitende in diesem Bereich einsetzen. Im globalen Vergleich ist die Zahl mit rund 1.500 Angestellten deutlich geringer."
7f229b0a-b773-4288-b718-9e22707b480c,2023-11-21 15:26:00+00:00,"Startseite Wirtschaft Neues Dax-Ranking offenbart die größten Klimasünder – und die überraschendsten Klimaschützer Von: Amy Walker Eine neue Studie hat herausgefunden, wie ernst die deutschen Top-Unternehmen ihre eigenen Klimaziele nehmen – und wie schnell sie sie bisher umgesetzt haben. Frankfurt – Die Energiewende ist die zentrale Herausforderung der aktuellen Zeit. Dabei müssen alle – Einzelpersonen wie Unternehmen – ihr eigenes Verhalten verändern und anpassen, damit Deutschland und die EU bis spätestens 2050 treibhausgasneutral wird. Doch wie sehr geben sich die größten deutschen Unternehmen, die im Dax vertreten sind, aktuell damit Mühe? Diese Frage hat sich die Frankfurter Fondsgesellschaft Union Investment gestellt und in einer Untersuchung herausgefunden, wie die Dax-Firmen in einem Klima-Ranking abschneiden. Die meisten Dax-Konzerne haben nur unzureichende Klimaziele Über die Ergebnisse der Studie berichtete zuerst das Manager Magazin. Dort wird Co-Autor und Nachhaltigkeitsanalyst Johannes Böhm mit den Worten zitiert: „Nur die Hälfte aller Dax-Konzerne haben sich überhaupt ausreichende Ziele gesetzt. Die Ziele der anderen Hälfte sind unzureichend“. Analysiert haben die Studienautoren neben den Zielen der Unternehmen auch die tatsächlich erreichte Reduktion der CO₂-Emissionen zwischen 2017 und 2022. Demnach haben neun der insgesamt 39 Dax-Konzerne in diesem Zeitraum ihre CO₂-Emissionen erhöht, anstatt sie zu senken, 25 Unternehmen haben ihre Emissionen „nicht in ausreichendem Ausmaß gesenkt“, so der zweite Autor, Jakob Haerle. Ganze 80 Prozent planen, erst 2050 klimaneutral zu werden – fünf Jahre später als es eigentlich im deutschen Klimaschutzgesetz vorgesehen ist. Doch es gibt auch Lichtblicke. So führt die Deutsche Telekom das Ranking an, seit 2017 hat der Konzern es geschafft, seine Treibhausgasemissionen um 85 Prozent zu senken. Nach eigenen Angaben plant das Unternehmen sogar bis 2025 CO₂-neutral zu wirtschaften. Wie das Manager Magazin berichtet, hat der Chef der Telekom, Tim Höttges, einen besonderen Anreiz, diese Ziele auch zu erreichen. Denn seine Bonuszahlungen hängen zum Teil daran, ob er und die Deutsche Telekom das schaffen, was sie versprechen. Ebenfalls weit oben im Klima-Ranking stehen RWE, Bayer, Mercedes-Benz und die Commerzbank. Schlusslichter sind Infineon und Brenntag, die ihre Emissionen seit 2017 sogar erhöht haben. Das Ranking der Dax-Konzern nach Klima-Gesichtspunkten Doch die Liste erzählt eben nur einen Teil der Geschichte. So mag es vielleicht stimmen, dass RWE seine Emissionen um 32 Prozent gesenkt hat und auch ambitionierte Ziele für die Zukunft hat. Gleichzeitig bleibt der Energiekonzern, der vor allem auch im Kohlegeschäft steckt, einer der größten Emittenten des Landes. Dem Magazin zufolge emittiert RWE im Jahr 90 Millionen Tonnen CO₂ aus. Insgesamt hat Deutschland 2022 744 Millionen Tonnen CO₂ ausgestoßen. Das Ranking der Dax-Unternehmen im Überblick: 1. Deutsche Telekom 2. RWE 3. Bayer 4. Mercedes-Benz 5. Commerzbank 6. SAP 7. BMW 8. Heidelberg Materials 9. Symrise 10. Continental 11. Eon 12. Beiersdorf 13. Airbus 14. Porsche 15. Allianz 16. Deutsche Bank 17. Siemens 18. Siemens Energy 19. Henkel 20. Volkswagen 21. Siemens Healthineers 22. Sartorius 23. Merck 24. Rheinmetall 25. Münchener Rück 26. Covestro 27. BASF 28. Vonovia 29. Zalando 30. Hannover Rück 31. MTU Aero Engines 32. Fresenius 33. DHL Group 34. Qiagen 35. Deutsche Börse 36. Adidas 37. Daimler Truck 38. Brenntag 39. Infineon Ins Ranking miteingeflossen sind aber auch weitere Kriterien, nicht nur die Treibhausgasminderung. So haben die Studienautoren ebenfalls berücksichtigt, welche Ziele sich die Unternehmen im Dax gesetzt haben und ob die Unternehmensführung einen finanziellen Anreiz erhält, wenn diese erreicht werden. Dabei fällt auf, dass der Studie zufolge nur ein einziges Dax-Unternehmen keine Ziele zur Treibhausgasminderung vorweisen konnte: Zalando. Einige Dax-Konzerne knüpfen Boni an Klimaziele Finanziellen Anreiz für das Erreichen der Klimaziele im eigenen Unternehmen erhalten aber nur wenige Top-Führungskräfte. Der Studie zufolge haben 17 der Dax-Unternehmen keine oder nur eine niedrige Vergütung für ihre Chefs, wenn sie sich im Bereich Klimaschutz besondere Mühe geben. Dazu gehören auch Firmen im Mittelfeld des Rankings, wie Porsche, Allianz oder die Deutsche Bank. Hohe finanzielle Anreize gibt es aber bei neun Dax-Firmen: Neben der Telekom geben auch Konzerne wie SAP, BMW und Heidelberg Materials ihren Chefs besonders hohe Boni, wenn sie Klimaziele möglich machen."
59d76905-251c-4267-ba5b-26d66a9ae3f0,2023-11-22 05:40:54+00:00,"Es ist High Noon im verschachtelten Immobilien- und Detailhandels-Imperium des österreichischen Unternehmers René Benko. Vor allem die Immobilienfirmen der Gruppe – Signa Prime und Signa Development – brauchen dringend Liquidität. Mindestens 500 Millionen Euro an Zahlungsrückständen sind laut Insidern bereits aufgelaufen, weitere 200 Millionen werden in zwei Wochen aus einer auslaufenden Anleihe fällig. Aber niemand scheint mehr bereit, Benko mit zusätzlichem Geld auszustatten, und dies aus gutem Grund: Es ist völlig unklar, ob frische Mittel den Untergang nur hinauszögern – und ob das Geld allenfalls sogar in die Taschen von Gläubigern oder Managern fliesst. Insolvenz droht Die Signa-Gruppe hat den Sanierungsexperten Arndt Geiwitz eingesetzt, um den Kollaps zu verhindern. Er soll ein Stillhalteabkommen zwischen Signa und den Gläubigern der Gruppe orchestrieren. Die Banken und andere Gläubiger würden ein paar Wochen lang darauf verzichten, bei ausbleibenden Zinszahlungen Kredite fällig zu stellen – dem Vernehmen nach bis Ende Januar 2024. Geiwitz soll damit in erster Linie Zeit gewinnen, um herauszufinden, was an Reserven noch da ist, um mit möglichen Investoren zu reden und vor allem auch, um noch nicht offiziell Insolvenz anmelden zu müssen. Wirklich zahlungsfähig scheint Signa ja derzeit nicht zu sein, schliesslich zahlt das Unternehmen seit Wochen keine Rechnungen mehr. Aber solange Geiwitz’ Stillhalteabkommen vorweisen und zudem glaubhaft machen kann, dass es eine realistische Chance gibt, frisches Geld zu organisieren, ist das Unternehmen in einer Art Grauzone und kann weiterarbeiten, ohne sich dem Vorwurf der Insolvenzverschleppung auszusetzen. Damit Geiwitz’ Plan aufgeht, müssen verschiedenste Arten von Gläubigern mitmachen, nicht zuletzt die Halter der erwähnten Anleihe, die ausläuft. Viel hängt allerdings auch von der Haltung der Banken ab. Machen sie mit, entweder um ihre eigenen Kredite zu retten oder um eine grössere Krise abzuwenden? Die letzten grossen Bankenkrisen entstanden jedenfalls nach dem Platzen von Immobilienblasen: In der Schweiz in den 1990er Jahren, später in der grossen Finanzkrise von 2008. Benko hängt von Banken ab, nicht umgekehrt Ein Kenner von Benkos Firmennetzwerk hält kurzfristige Stillhalteabkommen, also einen Verzicht darauf, bei ausbleibenden Zinszahlungen gegen Signa vorzugehen, von ein paar Wochen für realistisch. Geiwitz soll die Zeit erhalten, sich einen Überblick über die undurchsichtige Buchhaltung zu verschaffen. Danach muss gemäss dem Branchenkenner aber klar sein, dass das Unternehmen eine «positive Fortführungsprognose» hat. Das bedeutet nicht nur, dass das Geschäftsmodell aufgeht, sondern auch, dass Geiwitz und Benko neue Geldgeber gefunden haben. Länger dürften die Banken nicht stillhalten, denn sie haben dabei wenig zu gewinnen. Dass sich bisher noch keine der deutschen Banken gemeldet hat, liegt gemäss der Quelle daran, dass Signa deren Kredite noch bedient und selbst die Nachschussforderungen erfüllt habe, zu denen die Europäische Zentralbank (EZB) die Institute gedrängt haben soll. Noch hätten die deutschen Banken gar keine Handhabe gehabt, um Signa den Stecker zu ziehen. Ihre harte Haltung können sich die Banken leisten, weil sie Benko in aller Regel nur hypothekarisch besicherte Kredite gewährt haben (siehe Zusatz). Im Falle einer Insolvenz erhalten sie Immobilien oder Liegenschaften mit Bauprojekten, die sie weiterführen oder verkaufen können. Das gilt für deutsche, aber auch für Schweizer Banken – etwa eine Gruppe um Credit Suisse und eine Reihe von Kantonalbanken, welche Signa für Projekte bei Globus einen grösseren Kredit gewährten. Banken haben Recovery-Abteilungen, die sich mit der Verwertung von Sicherheiten beschäftigen. Gemäss Christian Kraft, dem Leiter des Kompetenzzentrums Immobilien an der Hochschule Luzern, fällt es den Banken daher nicht schwer, Immobilien für eine gewisse Zeit selber zu bewirtschaften: sich um die Vermietung zu kümmern oder praktisch fertiggestellte Wohnungen zu verkaufen. Doch je früher eine Baustelle ins Stocken gerät, desto schwieriger wird es für die Banken. Bei Signa gehört zu diesen Problemfällen etwa die Gänsemarkt-Passage in Hamburg, wo ausser einer grossen Baugrube noch wenig zu sehen ist. Auch beim Grossprojekt Elbtower ist noch weniger als die Hälfte gebaut. Es sind hohe Investitionen und viel Fachwissen in der Projektentwicklung nötig, bis solche Liegenschaften Ertrag abwerfen. Fachwissen, über das die Banken meist nicht verfügen. Zudem drängt die Zeit: Eine längere Zeit stillstehende Baustelle führt laut Branchenkennern automatisch zu Kostensteigerungen von 30 bis 50 Prozent bis zur Fertigstellung. Das berappt entweder die Bank, oder sie holt einen neuen Geldgeber ins Projekt, der sich das teuer bezahlen lässt. Alternativ suchen die Banken daher Entwickler, die ihnen diese Projekte abkaufen; meist mit sehr grossen Abschlägen. «Solche Partner gibt es, aber der Markt war ihnen bisher zu heiss», sagt Kraft. In Deutschland dürften einige Projekte je nach Lage mit einem Abschlag auf den Bilanzwert von 50 oder mehr Prozent veräussert werden, schätzt er. Selbst manche Banken, die konservativ belehnt haben, müssten wohl einen Abschreiber in Kauf nehmen. Den Gläubigern kommt immerhin zugute, dass sich viele Signa-Immobilien an guter Lage befinden. Spezialfall Julius Bär Mindestens eine Bank steckt allerdings in einer anderen Lage: Die Privatbank Julius Bär. Laut mehreren Quellen hat sie Benko nicht nur gut besicherte Hypothekarkredite gewährt, sondern ein anderes Darlehen. Zu vernehmen war weiter, dass dieser Kredit wohl bereits fällig sei. Eine offizielle Bestätigung hierzu gibt es aber nicht. Die Bank äussert sich nicht zu möglichen Kundenbeziehungen. Allerdings hat Julius Bär am Montag bei der Bekanntgabe ihres Zwischenresultats mitgeteilt, dass sie ihre Rückstellungen für notleidende Kredite um 82 Millionen Franken erhöht hat. Ein Grossteil dieser Wertberichtigung erfolgte seit Anfang November – und dürfte auf den Fall Signa zurückzuführen sein. Die Anleger reagierten heftig: Weil die Bank gleichzeitig die Erwartungen der Finanzanalysten bezüglich wichtiger Kennzahlen verfehlte, fiel der Aktienkurs seit Wochenbeginn um über 10 Prozent. Bleiben Bärs Kreditausfälle mit Benko unter 100 Millionen Franken, kann die Bank das gut wegstecken. In guten Jahren erzielt sie rund eine Milliarde Franken an Gewinn, und sie weist eine hohe Eigenkapitalquote auf. Bereits fragen Finanzanalysten aber, ob die Bank Bär, die stärker als andere Privatbanken auf die Vergabe von Krediten gesetzt hat, mit ihren Risikokontrollen ein generelles Problem habe. Gemäss Insidern bekam Benko selbst 2022 noch Geld von der Bank. Weshalb genau hat Bär ein grösseres Benko-Engagement aufgebaut zu einer Zeit, in der andere sich zurückgehalten haben? Diese Frage bleibt, selbst wenn sich der Schaden in Grenzen hält. Ist Benko «too big to fail»? Auch grundsätzlich kann man sich fragen, warum zahlreiche Banken so lange zu Benko gehalten haben. Denn Warnsignale waren da, und einige haben darauf reagiert. Die Deutsche Bank etwa geschäftet schon seit längerem nicht mehr mit dem Österreicher. Ein wichtiger Grund für die Largesse der Finanzinstitute war das Zinsumfeld vergangener Jahre. Bis 2022 lagen die Zinsen auch in Deutschland und der Schweiz auf historisch tiefem Niveau. Die Bankkunden liessen ihr Vermögen auf dem Konto liegen, und die Banken suchten händeringend nach Möglichkeiten, diese Gelder zu investieren. Immobilien waren eine der wenigen Anlageklassen, die noch Rendite abwarfen. Viele Banken dachten wohl, dass sie mit dem Fokus auf Hypotheken ihren eigenen Schaden auch bei allfälligen Problemen der Signa-Gruppe in Grenzen halten könnten. Aber es fehlte der Blick aufs Ganze: Was passiert, wenn viele Banken gleichzeitig ihre Kredite fällig stellen? Signa ist immerhin einer der grössten privaten Immobilienentwickler und -besitzer in Europa. Laut einem Branchenexperten ist zumindest in Deutschland die Gefahr einer Ansteckung auf dem Markt für gewerbliche Immobilien real. Wenn an einem Ort ein Benko-Projekt mit grossen Abschlägen liquidiert wird, wirkt sich dies auch auf den Wert der anderen Projekte in der Umgebung aus. Allenfalls kommt es dann auch dort zu Abwertungen, was zu einer unheilvollen Spirale führen und auch an sich gesunde Immobilienfirmen aus dem Tritt bringen kann. Dies wiederum könnte dann auch bei der Bank zu neuen Abschreibern führen. Das gilt umso mehr, als Benko in Deutschland nicht der erste Entwickler wäre, der Insolvenz anmeldet. So dürfte sich doch mancher Banken-CEO dazu durchringen, Benko mit einem Stillhalteabkommen für einige Wochen eine letzte Chance zu geben. Aber wenn nach dieser Frist die Vereinbarungen nicht eingehalten werden, wird es wohl heissen: Geld oder Immobilie."
