e1f73d53-ec62-47a9-85f4-45c13e49d02d,2023-03-01 04:25:20,"Nicht umsonst sind Bankgeschäfte immer noch Vertrauensgeschäfte. Denn es geht um das Geld der Kunden, um das Erfüllen von tiefen Wünschen oder um geplatzte Sehnsüchte. Sehen Sie hier die Top-30 der vertrauens-würdigen (!) Kreditinstitute. 19 Prozent der Deutschen haben 2022 in einer großen Umfrage angegeben, dass sie sehr viel Vertrauen in die Deutsche Bank haben. Demgegenüber hatten etwa 40 Prozent der Befragten großes bis sehr großes Vertrauen in die Sparkassen. Es gibt also einen großen Unterschied, welchen Instituten die Menschen vertrauen. Die großen Abweichungen sind allerdings erstaunlich, denn in der Vertrauensfrage liegt im Kern die Frage nach der Existenzberechtigung einer Bank. Wem ich nicht vertraue, dem gebe ich nicht mein Geld. Und dessen Finanzratschlägen folge ich nicht. Den gleichen Rückschluss erlaubt eine der Definition für Vertrauen: „Vertrauen ist der psychologische Zustand eines Entscheidungsträgers, der eine positive Erwartung in das Verhalten, die Absichten oder die Funktionsfähigkeit von Personen oder Systemen ausdrückt und zu einer freiwilligen Erbringung einer riskanten Vorleistung veranlasst.“ Top-30 Ranking: Deutschlands vertrauenswürdigste Kreditinstitute Wer sich diese Tragweite auf der Zunge zergehen lässt, findet in den Top-30 von „Deutschlands vertrauenswürdigsten Kreditinstituten“ wichtige Best Practices für die eigene Vertrauensarbeit: Hamburger Sparkasse, Aareal Bank, Münchener Hypothekenbank, Hauck Aufhäuser Lampe Privatbank, Sparda-Bank Nürnberg, Santander Consumer Bank, Merkur Bank, Volksbank Karlsruhe, BNP Paribas, Stadtsparkasse Düsseldorf, Berenberg Bank, Volksbank Trossingen, Volksbank Niederrhein, GLS Bank, Revolut, UmweltBank Aktiengesellschaft, BANK, Deutsche Apotheker- und Ärztebank, Volksbank Albstadt, ProCredit Bank, Sparkasse Nürnberg, Baader Bank, BayernLB Bayerische Landesbank, Degussa Bank, Targobank, Sparkasse Wittgenstein, Volksbank Pforzheim, KfW IPEX-Bank, Sparkasse KölnBonn, Triodos Bank. Das Ranking beruht auf einer Studie, die das IMWF Institut für Management- und Wirtschaftsforschung für das F.A.Z.-Institut – einem Unternehmen der Frankfurter Allgemeinen Zeitung – durchgeführt hat. Untersucht wurden die Vertrauenswürtdigkeit von 1.400 Kreditinstituten aufgrund von 660.000 Aussagen in digitalen Kanälen zu diesen Aspekten im Zeitraum vom 1. Juli 2021 bis zum 30. Juni 2022. Wer an der Studie interessiert ist, kann sie sich unter Info@IMWF.de gerne anfordern. Marktforschung zur Vertrauenswürdigkeit von Kreditinstituten Im Ranking spiegelt sich die Marktforschung zur Vertrauenswürdigkeit von Kreditinstituten wider. Großbanken sind unter den 30 Besten nicht zu finden. Stattdessen gelingt es Sparkassen sowie Volksbanken, das Ranking über weite Strecken zu dominieren. Privatbanken und kleinere Banken komplettieren das Bild. Angesichts dieses Rankings ist es auf Sicht nicht zu erwarten, dass aus der Stärke des Heimatmarktes heraus auf absehbare Zeit eine deutsche Bank als großer Spieler auf dem internationalen Parkett reüssiert. Wer sich von der Vertrauensfrage leiten lässt, geht eher zu den regionalen oder kleineren Instituten. Stakeholder- statt Shareholder-Orientierung Eine wesentliche Ursache liegt in der Shareholder-Orientierung der großen Häuser, die stark auf ihren Mehrwert an den Kapitalmärkten ausgerichtet sind. Regionale und kleinere Institute sind hingegen stark in der Stakeholder-Orientierung, also im Engagement für verschiedendste gesellschaftliche Gruppen. Sie verdienen sich dadurch ihre „Licence to operate“ und generieren eine Nähe zu den Kunden, die Vertrauen schafft."
05047020-eb04-462e-8a96-596e565e03b8,2023-03-01 05:24:23,"Ab 1. März arbeiten die Deutsche Bank und die Umweltorganisation WWF in den kommenden zwei Jahren an einer Strategie, den Unternehmensbereich Privatkundenbank nachhaltiger zu gestalten. Die Deutsche Bank stand zuletzt als größter Geldgeber des Energiekonzerns RWE in der Kritik, als dieser das Dorf Lützerath trotz großer Proteste von Klimaaktivistinnen und -aktivisten für den Braunkohletagebau weiter abbaggerte. Der Verein Facing Finance vermutet dahinter eine Marketingstrategie."
3eb57bea-a0f2-4105-8fb1-42f62ae55fb1,2023-03-01 14:07:08,"Nach den vorläufigen Daten des Statistischen Amtes Estlands ist das Bruttoinlandsprodukt (BIP), das die Entwicklung der estnischen Wirtschaft widerspiegelt, im vierten Quartal 2022 um 4,1 % gegenüber dem gleichen Zeitraum 2021 gesunken. Das BIP nach aktuellen Preisen betrug 10 Milliarden Euro. Robert Müürsepp, leitender Analyst des Statistischen Amtes, sagte, dass das BIP nach aktuellen Preisen im vierten Quartal 2022 um 11,9 % gestiegen sei. „Am Ende des Jahres gab es einige Anzeichen für eine Verlangsamung der rasanten Inflation, aber die Auswirkungen der Inflation auf das Wirtschaftswachstum waren immer noch ähnlich wie in früheren Perioden. Inflationsbereinigt ist ein deutlicher Rückgang der Steuereinnahmen und der Wertschöpfung zu verzeichnen“, erklärte Müürsepp. Im vierten Quartal war die Rezession breit angelegt, und nur wenige Wirtschaftszweige verzeichneten ein Wachstum. Den größten positiven Beitrag leistete die Landwirtschaft. Die Wirtschaft wurde auch durch die Bereiche Kunst, Unterhaltung und Erholung, Beherbergung und Gastronomie sowie öffentliche Verwaltung und Verteidigung ein wenig angekurbelt. Der größte negative Beitrag kam aus dem Bereich Information und Kommunikation, aber auch alle anderen wichtigen Sektoren – Grundstücks- und Wohnungswesen, Baugewerbe, verarbeitendes Gewerbe, Handel – haben das Wirtschaftswachstum beeinträchtigt. Der Bereich Erbringung von freiberuflichen, wissenschaftlichen und technischen Dienstleistungen, der normalerweise zu den Triebkräften der Wirtschaft gehört, leistete im vierten Quartal ebenfalls einen negativen Beitrag. „Auf dem Papier melden die Unternehmen ein starkes Wachstum, aber das ist das Ergebnis schnell steigender Preise – wenn wir den Effekt der Inflation herausrechnen, ist die Wirtschaftsleistung gesunken“, bemerkte Müürsepp. Der private Verbrauch setzte seinen Abwärtstrend fort (-1,9 %). Sein Wert war der niedrigste seit dem ersten Quartal 2021. Am stärksten sanken die Ausgaben der Haushalte für Bildung, sonstige Waren und Dienstleistungen sowie für Einrichtungsgegenstände. Ein erheblicher Rückgang wurde auch bei den Ausgaben für Nahrungsmittel und Gesundheit registriert. In einigen Ausgabengruppen gab es jedoch trotz der stark gestiegenen Inflation einen Zuwachs. Der stärkste Anstieg war bei den Ausgaben für Restaurants und Hotels sowie für Freizeit und Kultur zu verzeichnen. „Im Allgemeinen scheinen die Haushalte weniger für Waren auszugeben, während der größte Anstieg bei den Ausgaben für Freizeit und damit verbundene Dienstleistungen zu verzeichnen ist“, so Müürsepp. Ende 2022 gab es auch einen Rückgang bei Konsumausgaben des Staates, die um 1,3 % sanken. Die Investitionen stiegen im vierten Quartal um 13,1 % und heben sich damit vom allgemeinen Trend ab. Die größten positiven Auswirkungen hatten die Investitionen der nichtfinanziellen Kapitalgesellschaften in Fahrzeuge (164%) und in sonstige Bauten (20%) sowie die Investitionen der privaten Haushalte in Wohnungen (29%). Die größten negativen Auswirkungen hatten die Investitionen der nichtfinanziellen Kapitalgesellschaften in sonstige Maschinen und Ausrüstungen (-34%). Müürsepp sagte, dass der Außenhandel ebenfalls von den vorherrschenden Abwärtstrends betroffen war. Die Exporte gingen um 6,5 % zurück. Die Wachstumsrate der Importe verlangsamte sich und lag bei 3,3 %. Im Warenverkehr gingen sowohl die Exporte als auch die Importe zurück. Die Exporte und Importe wurden vor allem durch den Handel mit Strom, Erdöl und Erdgas, chemischen Erzeugnissen sowie Computern und elektronischen Geräten beeinflusst. Im Dienstleistungsverkehr gingen die Ausfuhren leicht zurück (-0,7 %), während die Einfuhren weiter kräftig zunahmen (15,7 %) – hier wirkten sich vor allem der Handel mit EDV-Dienstleistungen und verschiedene Transportdienstleistungen aus. Nach den saisonbereinigten Daten sank das BIP um 1,6% gegenüber dem dritten Quartal 2022 und um 4,4% gegenüber dem vierten Quartal 2021. Im Jahr 2022 insgesamt sank Estlands BIP um 1,3%. Den größten positiven Beitrag leistete das Beherbergungs- und Gaststättengewerbe, das sich von der Coronavirus-Krise erholt hat. Einige andere Wirtschaftszweige trugen in geringerem Maße ebenfalls positiv zum BIP bei. Die größten negativen Beiträge zum BIP im Jahr 2022 kamen aus dem Immobiliensektor, dem Energiesektor, dem Handel, der Landwirtschaft und dem Finanzsektor. Im vergangenen Jahr stieg der private Verbrauch um 2,6 %, während der Staatsverbrauch auf dem Niveau von 2021 blieb. Die Investitionen gingen im Jahr 2022 insgesamt um 10,9 % zurück. Die Wachstumsrate der Exporte (5,0 %) war der der Importe (5,8 %) recht ähnlich. Dennoch waren die Nettoexporte das zweite Jahr in Folge negativ – Estlands Importe von Waren und Dienstleistungen waren 200 Millionen Euro höher als seine Exporte. Damit verzeichnet Estland eine negative Außenhandelsbilanz."
81be2ec1-116a-4c28-a162-9b67f20b557a,2023-03-01 15:08:25,"Thyssen-Krupp, einer der größten Klimasünder des Landes, will also grün werden. Bisher steht allein die Stahlsparte des Industriekonzerns für 2,5 Prozent aller deutschen CO₂-Emissionen. Die Direktreduktionsanlage soll den Ausstoß um ein Fünftel kappen. Würde die Firma alle vier Hochöfen in Duisburg nach und nach durch diese Öko-Alternativen ersetzen, wäre die Produktion am Ende komplett klimaneutral. Dieses Ziel hat sich das Unternehmen für 2045 gesetzt. Nordrhein-Westfalens Ministerpräsident Hendrik Wüst nannte das Vorhaben am Mittwoch ""eines der wichtigsten Projekte für die industrielle Transformation"" seines Bundeslands. Der CDU-Politiker besuchte das Stahlwerk; Thyssen-Krupp präsentierte dort Details des Bauauftrags. Rivale Salzgitter aus Niedersachsen lässt ebenfalls eine Direktreduktionsanlage hochziehen, die sogar ein Jahr früher einsatzbereit sein soll. Diese enormen Investitionen sind nötig, damit Stahlherstellung in Deutschland überhaupt eine Zukunft hat. Schließlich zwingen die ehrgeizigen Klimaschutz-Ziele der EU die Branche dazu, ihren gigantischen Kohlendioxid-Ausstoß zu senken. Als Hebel dient das europäische Emissionshandels-System: Industriebetriebe müssen CO₂-Zertifikate vorweisen können, also Verschmutzungsrechte, wenn sie Klimagase in die Atmosphäre blasen wollen. Und deren Preis wird in einigen Jahren kräftig steigen, so hat es die EU gerade erst beschlossen. Das verteuert grauen Stahl; so lautet der Fachbegriff für die bislang üblichen klimaschädlichen Produkte. Der ""Champagner der Energiewende"" muss es richten Die Zukunft gehört daher grünem Stahl aus Direktreduktionsanlagen. Allerdings benötigen die Werke dafür Pipelines mit Zugriff auf enorme Mengen an klimafreundlich hergestelltem Wasserstoff, und die Kosten dieses Rohstoffs - den Experten spöttisch ""den Champagner der Energiewende"" nennen - dürfen wiederum nicht zu hoch sein. Ob beide Voraussetzungen erfüllt sein werden, ist unklar: Die Milliardeninvestitionen der Stahlkonzerne sind also eine Wette darauf, dass Deutschland eine funktionierende und bezahlbare Wasserstoffversorgung aufbauen kann. Damit die Firmen trotz der Ungewissheit investieren, unterstützt der Staat sie üppig. Thyssen-Krupp erhält von der Landesregierung 700 Millionen Euro, was die höchste Subvention ist, die Nordrhein-Westfalen jemals gezahlt hat. Die Bundesregierung überweist dem Unternehmen mehr als das Doppelte obendrauf. Das soll nicht nur Teile der Baukosten abdecken, sondern auch in den Anfangsjahren den Betrieb subventionieren. Die EU-Kommission hat die dicken Schecks noch nicht gebilligt, doch das soll bis Sommer geschehen. Den Auftrag für die Direktreduktionsanlage und andere Maschinen erteilte Thyssen-Krupp dem Düsseldorfer Anlagenbauer SMS. Für den ist es die größte Order in der mehr als 150-jährigen Firmengeschichte; er erhält dafür 1,8 Milliarden Euro. Daneben fallen weitere Baukosten an, was Thyssen-Krupps Gesamtinvestitionen über die Zwei-Milliarden-Euro-Marke hebt. Thyssen-Krupps Vorstandsvorsitzende Martina Merz sagt, ihr Unternehmen bringe das teure Projekt ""trotz aller Herausforderungen und Unsicherheiten schon jetzt auf den Weg"", weil die Zeit dränge: ""Wenn wir die Klimaziele erreichen und den Industriestandort sichern wollen, müssen wir jetzt handeln und jetzt investieren."" Bernhard Osburg, der Chef der Stahltochter mit ihren 26 000 Beschäftigten, sagt, das Vorhaben schaffe ""die Basis für die grünen Stahlmärkte von morgen"". Die Nachfrage nach grünem Stahl übersteigt das Angebot Und diese Märkte werden lukrativ sein: So plant Europas größter unabhängiger Stahlhändler Klöckner & Co, dass Stahl mit niedrigem CO₂-Ausstoß bis 2030 für mehr als die Hälfte seines Angebots stehen soll. Ein Sprecher der Duisburger Firma warnt sogar, dass noch für bis zu 15 Jahre die Nachfrage nach grünem Stahl die Mengen überschreiten werde, die Thyssen-Krupp und seine Rivalen überhaupt produzieren könnten. Das deckt sich mit der Einschätzung von Nicole Voigt. Die Unternehmensberaterin der Boston Consulting Group (BCG) sagt, dass wichtige Stahlverbraucher wie die Autoindustrie oder Haushaltsgerätehersteller auf klimafreundlichen Stahl setzten - und gar nicht genug Angebot finden würden. Daher werde der Preis für Öko-Stahl ""wahrscheinlich deutlich"" über dem für grauen liegen. Klingt erfreulich für Thyssen-Krupp. Trotzdem sei es nicht ausgemacht, ""dass sich die massiven Investitionen in Direktreduktionsanlagen in jedem Fall rechnen"", mahnt Stahlexpertin Voigt. ""Denn dafür müssten zunächst die Kosten für die Versorgung mit grünem Wasserstoff sinken."" Der wird in Elektrolyseuren gewonnen. Dort spaltet Strom Wasser in Wasser- und Sauerstoff auf. Stammt die Elektrizität von Wind- und Solarparks, ist das Gas klimafreundlich und wird ""grüner Wasserstoff"" genannt. Der soll in Europas gesamter Industrie Kohle und Erdgas ersetzen, aber dafür sind Mengen nötig, die in der EU gar nicht hergestellt werden können: Es ist ausgeschlossen, ausreichend Ökostrom für all die Elektrolyseure zu produzieren. Deshalb wird Europa grünen Wasserstoff importieren müssen aus Regionen, die einfach und viel Wind- und Sonnenstrom produzieren können. Etwa per Pipeline aus Nordafrika oder per Tankschiff aus Australien. Doch die Transportkosten sind immens, weil Wasserstoff vor der Beladung der Schiffe auf minus 253 Grad gekühlt werden muss, damit das Gas flüssig wird. Das ist noch einmal 90 Grad kühler als bei Flüssigerdgas. BCG-Beraterin Voigt sagt daher, es könnte wirtschaftlicher sein, Eisenschwamm - das feste Eisen, das die Direktreduktionsanlagen produzieren - ""lieber dort herzustellen, wo man günstig viel grünen Wasserstoff gewinnen kann, und ihn dann für die Weiterverarbeitung nach Deutschland zu transportieren"". Die Anlage schafft Sicherheit für Abnehmer Für Thyssen-Krupp heißt das: Sinken die Wasserstoffkosten nicht deutlich, sollten die Essener die nächste Direktreduktionsanlage vielleicht lieber in Marokko hochziehen und sich in Duisburg darauf beschränken, das grüne Eisen aus Nordafrika zu grünem Stahl weiterzuverarbeiten. Beraterin Voigt hält es trotzdem für vernünftig, dass Konzerne wie Salzgitter und Thyssen-Krupp zumindest ihre ersten Direktreduktionsanlagen in Deutschland bauen: ""Das schafft Sicherheit für die Abnehmer, dass in einigen Jahren grüner Stahl im Angebot sein wird, und es schafft Sicherheit für die Wasserstoffhersteller, dass es Nachfrage nach grünem Wasserstoff geben wird."" Thyssen-Krupp ersetzt nun einen von vier Hochöfen mit so einer Öko-Anlage. Klar ist, dass auch die anderen drei Duisburger Hochöfen in einigen Jahren abgeschaltet werden. Unklar ist, wo ihre grünen Nachfolger hochgezogen werden."
9796f8f1-9116-4446-9ea9-613e0fbbb003,2023-03-01 15:46:00,"Die Spartipps von Regina Feist aus Homberg (Efze) sind gefragt. Als ""Budget_Gina"" erklärt sie etwa auf Instagram und TikTok ihren tausenden Followern wöchentlich, wie sie mit ihrem Geld haushalten können. Dafür lässt sich die 30-Jährige jeden Monat einen Teil ihres Gehalts bar auszahlen und verteilt 10-, 20- und 50-Euro-Scheine in Umschläge aus Klarsichtfolie. Da gibt es zum Beispiel die Kategorien ""Wohnung"", ""Freizeit"", ""Geschenke"" und ""Kind"". Den Großteil ihres Geldes hat sie dabei immer noch auf ihrem Konto und zahlt damit etwa die Gas- und Stromrechnung. Bei Einkäufen bedient sich die Nordhessin aus den passenden Umschlägen, steckt das Geld in ihren Geldbeutel und zahlt getrennt nach Kategorien. Das Wechselgeld wandert zurück in die Umschläge, die in einem liebevoll gestalteten Budget-Planer stecken. Es ist eine Art Haushaltbuch, in das Feist ihre Einnahmen und Ausgaben einträgt, regelmäßig Kassensturz macht und das Budget für einzelne Umschläge immer wieder anpasst. Bleibt Geld übrig, kommt es in den Umschlag ""Urlaub"". Und die 30-Jährige spart auch ganz gezielt, etwa für die Taufe ihres Sohns im Sommer. Den Überblick behalten Vor einem halben Jahr hat die junge Mutter mit diesem differenzierten Ausgabesystem angefangen und seitdem etwa 5.000 Euro beiseitegelegt. Selbst wenn die Methode umständlich erscheint, hilft sie Feist, den Überblick zu behalten, wie sie sagt: ""Ich habe immer gespart. Aber als ich in Elternzeit gekommen bin, habe ich gemerkt: Das Geld wird knapper, dazu wird alles teurer."" Mittlerweile arbeitet sie wieder in Vollzeit im öffentlichen Dienst. Auch an ihren Spartipps in den Sozialen Medien verdient sie und bietet das für ihr System nötige Zubehör zum Kauf an. ""Cash Stuffing"" nennt sich dieses Sparmodell, das in den Sozialen Medien viele Anhänger hat. Wörtlich übersetzt bedeutet es, Bargeld zu stopfen - zum Beispiel in die erwähnten Umschläge. Ziel ist es, Geld bewusster auszugeben und zu sparen, ohne dabei auf etwas zu verzichten. App hilft womöglich besser Dass junge Menschen das Bargeld neu für sich entdecken und ihre Finanzen wortwörtlich im Griff haben wollen, findet Katharina Lawrence von der Verbraucherzentrale Hessen grundsätzlich gut. ""Sie haben dann mehr Hemmungen, Geld auszugeben - das erzeugt einen regelrechten Schmerz"", hat Lawrence beobachtet. Allerdings hat die neue Sparmethode nach Ansicht der Verbraucherschützerin auch Nachteile. Das viele Bargeld zu Hause könne Diebe anlocken, und Verbraucher bekämen keine Zinsen darauf. ""Dafür muss ich das Ersparte erst wieder zur Bank tragen"", sagt Lawrence. Beim Sparen helfen könnten genauso gut Apps zur Finanzplanung, doch teilweise gebe es dabei Probleme beim Datenschutz. Diesbezüglich unbedenklich und dazu noch kostenfrei sei die App, die die Verbraucherzentrale selbst herausgegeben habe. Damit könnten insbesondere Kinder und Jugendliche ihr Taschengeld verwalten, empfiehlt Lawrence. Jeder dritte Einkauf per Karte Mit ""Cash Stuffing"" könnte das Bargeld ein Comeback erleben, nachdem es in den vergangenen Jahren an Bedeutung verloren hat. Nach Angaben der Europäischen Zentralbank wurde 2022 an der Ladenkasse bei jedem dritten Mal die Karte gezückt. 2019 sei erst jede vierte Zahlung eine Kartenzahlung gewesen. Auch der Online-Handel wird laut EZB immer wichtiger. Dort werde ohnehin bargeldlos bezahlt. Gerade bei Jugendlichen und jungen Erwachsenen in Deutschland ist das beliebt. Das zeigt eine Umfrage unter mehr als 1.000 Teilnehmern im Alter von bis zu 25 Jahren, deren Ergebnisse die Wiesbadener Wirtschaftsauskunftei Schufa 2022 veröffentlicht hat. Demnach zahlt die große Mehrheit der Befragten lieber bargeldlos: mit Karte oder dem Smartphone. Nur rund ein Drittel zahlt lieber bar. Junge Leute sparen Das Bargeld spielt also bei vielen im Alltag eine immer kleinere Rolle - sparen wollen sie trotzdem, wie Ole Schröder, Mitglied im Schufa-Vorstand, berichtet: ""Fast alle Befragten geben an, dass ihnen ein finanzielles Polster wichtig ist, um auf Notfälle vorbereitet zu sein."" Die meisten hätten dazu nach eigenen Aussagen einen guten Überblick über ihre Einnahmen und Ausgaben. Allerdings räumten 40 Prozent der Befragten der Schufa-Studie auch ein, dass sie schon einmal den Überblick über ihre Finanzen verloren hätten. So hätten sie im Rahmen von Online-Einkäufen mindestens einmal zu zahlen vergessen und teilweise deswegen sogar eine Mahnung erhalten. Wer im Alltag dagegen überwiegend bar spart und zahlt, dem kann zumindest so etwas nicht passieren."
590f7e04-4d73-493b-a646-f556f73f6fe0,2023-03-01 16:33:05,"In Spanien wird die Einhaltung der Verpflichtung zur Arbeitszeiterfassung bereits streng kontrolliert. Verstöße werden sanktioniert. Das sorgt bei manchen Unternehmen für Verunsicherung. Andere begrüßen das Vorgehen. Während in Deutschland ein konkretes Gesetz zur Regelung der Arbeitszeiterfassung noch auf sich warten lässt, ist man in Spanien schon deutlich weiter. Dort gibt es bereits seit dem Jahr 2019 ein solches Gesetz. Im selben Jahr hatte der Europäische Gerichtshof (EuGH) die Pflicht zur Arbeitszeiterfassung in den Staaten der EU festgestellt. Inspekteure sollen Arbeitszeiterfassung kontrollieren Spaniens Arbeitsministerin Yolanda Díaz (kommunistische Partei Spaniens), die gleichzeitig das Amt der zweiten Vizepräsidentin innehat, lässt die Einhaltung des Gesetzes streng kontrollieren. Zuletzt entsandte sie Inspekteure in verschiedene Madrider Büros von großen Wirtschaftsprüfungsunternehmen wie PWC oder KPMG. Die Inspekteure sollten laut Angaben spanischer Medien bei den Beschäftigten um Zugang zu deren E-Mails bitten. Auf diese Weise sollte festgestellt werden, ob auch nach dem Ende der registrierten Arbeitszeit noch geschäftliche Nachrichten verschickt wurden. Nachdem in Deutschland das Bundesarbeitsgericht im September 2022 entschieden hatte, dass die Pflicht zur Arbeitszeiterfassung auch in Deutschland besteht, und das ab sofort, herrscht hierzulande bei vielen Unternehmen Unsicherheit über die Details. So ist zum Beispiel noch unklar, ob auch Führungskräfte ihre Arbeitszeiten erfassen müssen. Diese Fragen werden sich hoffentlich mit der Vorlage eines Gesetzesentwurfs klären, den das Bundesarbeitsministerium für dieses Frühjahr angekündigt hat. Regelungen zur Arbeitszeiterfassung in Spanien – hohe Strafen möglich In Spanien muss sichergestellt werden, dass die Mitarbeiter durchschnittlich nicht mehr als 40 Stunden pro Woche arbeiten. Es müssen die Zeiten des Arbeitsantritts und des Arbeitsendes aller Mitarbeiter erfasst werden. Ausnahmen gibt es lediglich für CEOs und Geschäftsführer. Ein bestimmtes System zur Arbeitszeiterfassung schreibt das spanische Gesetz nicht vor. Möglich sind sowohl die schriftliche Erfassung auf Basis eines Dokuments wie zum Beispiel eines Stundenzettels als auch eines digitalen Zeiterfassungssystems. Unternehmen müssen die erfassten Arbeitszeiten über einen Zeitraum von vier Jahren aufbewahren. Bei einem Verstoß drohen in Spanien hohe Strafen, die bei 750 Euro für einfache Verstöße beginnen und bis zu 225.00 Euro bei schweren Verstößen betragen können. In Deutschland ist zumindest derzeit noch nicht mit Strafzahlungen bei Verstößen zu rechnen. Das wird sich aber ändern, wenn ein entsprechendes Gesetz in Kraft getreten ist. Anfang Februar wurde von der spanischen Arbeitsinspektion ein Verfahren gegen drei Filialen der Deutschen Bank in Spanien eingeleitet. Sie soll mutmaßlich gegen die Pflicht zur Arbeitszeiterfassung verstoßen haben. Der Vorwurf der spanischen Gewerkschaft CCOO lautet, die registrierten Stunden entsprächen nicht der tatsächlich geleisteten Arbeitszeit. Die Deutsche Bank sieht sich dagegen im Einklang mit den geltenden Regelungen. Ein früherer Streit zwischen CCOO und Deutscher Bank hatte vor einigen Jahren zum Urteil des EuGH geführt, das die EU-weite Pflicht zur Arbeitszeiterfassung vorsieht. Unsicherheit und Akzeptanz bei spanischen Unternehmen Die verpflichtende Arbeitszeiterfassung sorgt bei einigen Unternehmen in Spanien für Unsicherheit. So wird zum Beispiel bei Unternehmensübernahmen genau geprüft, ob und wie die Zeiterfassung erfolgt. Kommt es hier zu Auffälligkeiten, ist das ein Grund für genauere Untersuchungen."
