076257a6-41a3-4b7a-a129-581e2c690ed7,2024-10-27 17:03:00+00:00,"Startseite Wirtschaft Kubas Wirtschaft in der Krise – Der Strom ist zurück, die Resignation bleibt Von: Klaus Ehringfeld Fast vier Tage saßen zehn Millionen Menschen auf Kuba im Dunkeln. Die Hoffnung auf Besserung ist verflogen. Kubas Wirtschaft steckt in der Krise. Havanna – Der Strom ist seit ein paar Tagen zurück auf Kuba, jedenfalls in weiten Teilen. Kaum gingen Kühlschränke und Elektroherde am späten Sonntagabend oder am Montag wieder, da brieten und kochten die Menschen Hähnchenschenkel und Schweinekoteletts, die zuvor mehrere Tage in den Kühlschränken vor sich hin rotteten. Wer weiß, wann der Strom wieder verschwindet. Kuba ohne Strom – „Mir war zum Heulen zumute“ Das Fleisch, auf Kuba unerschwinglich oder schlicht nicht zu bekommen, haben viele Menschen von Angehörigen aus den USA erhalten und oft für besondere Anlässe aufbewahrt. Aber als am Freitag plötzlich auf der gesamten 1000 Kilometer langen Insel der Strom ausfiel und knapp vier Tage lang wegblieb, war es eine Frage der Zeit, bis das Fleisch bei tropischen 30 Grad zu vergammeln begann. „Spätestens am Sonntag war mir zum Heulen zumute“, erzählt Fernanda Contreras. „Wir sind ja an stundenlange Abschaltungen gewohnt, daran, dass das Wasser ausbleibt und alles so teuer ist, aber vier Tage ohne Licht und Strom ist selbst für uns Kubaner hart.“ Protest mit Kochtöpfen – Blackout in Kuba Kein Strom bedeutet für die überwiegende Mehrheit der zehn Millionen Kubanerinnen und Kubanern nicht nur Dunkelheit, sondern auch: Keine Klimaanlage läuft, nicht mal ein Ventilator, kein öffentlicher Nahverkehr, weil die Ampeln nicht funktionieren, kein Wasser, weil die Pumpen mit Strom betrieben werden, kein Fernsehen geht und weitenteils kein Internet. Nur Krankenhäuser und große internationale Hotels tauchten in diesen Tagen die Zwei-Millionen-Metropole Havanna da und dort in fahles Licht. Und die vielen Feuerstellen, die von den Menschen auf den Straßen aufgebaut wurden, um wie ganz früher mit Holz zu kochen. Der Rest der Insel lag weitgehend im Dunkeln. Aber wirklich hell ist es auf Kuba Anfang der Woche auch mit dem Strom nicht geworden, eine dunkle Depression hat sich über das ganze Land gelegt. Wut und Widerstand scheinen im Moment der Resignation gewichen. Zwar meldeten Medien wie „El Toque“ 28 kleinere Proteste, aber es waren vor allem die sogenannten Cacerolazos, bei denen die Menschen aus Ärger über die Verhältnisse auf ihre leeren Kochtöpfe schlagen. Mancherorts brannten Müllcontainer. Aber angesichts der Drohung von Präsident Miguel Díaz-Canel, jedes Anzeichen von Aufstand kompromisslos niederzuschlagen, widmeten sich die Menschen lieber der Bewältigung des eigenen Alltags. Spätestens jetzt ist vielen die Hoffnung gewichen, dass die Regierung die immer größer werdenden Probleme der Insel noch lösen kann. „Die Inflation frisst alles auf“ – Kuba in der Krise Das Leben in Kuba gleicht im Moment der „Periodo Especial“ zu Beginn der 1990er nach dem Zusammenbruch der Sowjetunion. Seinerzeit sackte die Wirtschaftskraft der Insel um 35 Prozent ab, der Außenhandel gar um gut 80 Prozent. Dem letzten kommunistischen Eiland im kapitalistischen Meer drohte zeitweise sogar der wirtschaftliche Untergang. Nur durch hartes Sparen und homöopathische Dosen von Kapitalismus blieb Kuba auf Kurs. Der Dollar wurde zugelassen, Devisenläden wie in der DDR wurden aufgebaut. Lebensmittel rationiert, Strom regelmäßig abgeschaltet, und das Schlangestehen war routinierte Übung. Und heute? Alles auf „Déjà-vu“. Die Menschen sind genauso wie damals tagesfüllend damit beschäftigt, irgendwie alles Notwendige fürs Überleben zu organisieren. Die Libreta, das sozialistische Rationierungsheftchen, gibt nur noch kleine Mengen an Brot, Reis, Kaffee und Bohnen her. Die hohen Preise sind für die Menschen auf der Insel neu und umso erschreckender. „Die Inflation frisst alles auf. Das kannten wir hier nicht“, sagt Fernanda Contreras. Tatsächlich liegt die offizielle Jahresteuerungsrate auf der Insel nach offiziellen Daten bei rund 30 Prozent. Unabhängige Ökonomen schätzen, dass die Teuerung in Wahrheit bei weit über 100 Prozent liegt. Und dann noch der „Megaapagón“. Dieser Megastromausfall. Präsident Miguel Díaz-Canel sieht sein Land nur als Opfer des US-Embargos, der fehlenden Treibstofflieferungen aus dem Bruderstaat Venezuela, der Hurrikans. Kein Wort darüber, dass die Regierung keine entscheidenden Veränderungen vorgenommen hat, um die kollabierte Staatswirtschaft zu modernisieren oder die Landwirtschaft in die Lage zu versetzen, dass sie das eigene Volk wenigstens mit Zucker oder Mais versorgen kann.Auch der Auch Kubas Tourismus leidet – wichtige Devisenquelle bleibt damit aus Denn der Planwirtschaft gelingt es nicht annähernd, notwendige Alltagsgüter für den Bedarf der eigenen Bevölkerung zu produzieren. Und nicht nur das Öl und der Treibstoff für die Kraftwerke, sondern auch Lebensmittel für monatlich Millionen von Dollar müssen im Ausland eingekauft werden. Aber wenn dem Staat schon die dafür notwendigen Devisen fehlen, dann erst recht dafür, die Stromkraftwerke aus Sowjetzeiten zu modernisieren. Denn die neue Krise trifft eine ohnehin schon gebeutelte Wirtschaft. Das kubanische Bruttoinlandsprodukt ist im vergangenen Jahr laut UN-Wirtschaftskommission für Lateinamerika und die Karibik (Cepal) um 1,9 Prozent gesunken und wird in diesem Jahr voraussichtlich nur um 0,5 Prozent wachsen. Die Wirtschaftskraft liegt nach offiziellen Angaben immer noch unter dem Niveau von 2019. Und die Touristen und Touristinnen, neben den Überweisungen der Auslandskubaner die wichtigste Devisenquelle der Insel, bleiben aus. Gerade mal die Hälfte der Urlauber aus Vor-Corona-Zeiten kommen – und dann sind es immer mehr Russen, die wenig Geld ausgeben, und immer weniger Kanadier, US-Amerikaner und Europäer, die sich in den Ferien gerne spendabel zeigen."
f8ec3bfa-493a-47bd-83ed-285d24c2fad7,2024-10-27 19:10:00+00:00,"Auch wenn es um die wirtschaftliche Lage schwach aussieht, das Reisen lassen sich Bundesbürger nicht nehmen. Mallorca, Fuerte Ventura oder Ägypten - die Lieblingsreiseziele der Deutschen werden sowohl im Sommer als auch im Winter bereist."
0c214f06-6616-4338-8ae4-bc361970f956,2024-10-28 09:44:00+00:00,Vor Wirtschaftsgipfeln in Berlin:DIHK fordert niedrigeren Strompreis für Firmen Wie kann die Bundesregierung die Wirtschaft entlasten? Nach Ansicht der Deutschen Industrie- und Handelskammer würden Firmen vor allem von niedrigen Stromkosten profitieren.
87bb1b1f-f54c-4062-930e-00b71467a561,2024-10-28 10:10:00+00:00,"Sparkassen-Präsident Ulrich Reuter zeigt sich beunruhigt angesichts der Dauerflaute der deutschen Wirtschaft. »Wir sind sehr besorgt über die Konjunkturlage in Deutschland«, sagte der Chef des Deutschen Sparkassen- und Giroverbandes (DSGV) in einem am Montag veröffentlichten Interview mit der Nachrichtenagentur Reuters. »Wir wissen, dass Deutschland nicht erst in den letzten drei, vier Quartalen in Problemen steckt, sondern dass es eigentlich schon seit ein paar Jahren ständig nach unten geht.« Er hoffe sehr, dass die Bundesregierung in den nächsten Monaten aktiv wird. Nichtstun »wäre am schwierigsten«. »Wir müssen uns von den bürokratischen Fesseln befreien und einen klaren und auch zukunftsorientierten Pfad für mehr Wettbewerbsfähigkeit finden«, sagte Reuter. »Das muss unser Hauptaugenmerk sein. Alles andere muss die Politik dahinter zurückstellen.« Bundeskanzler Olaf Scholz (SPD) und Wirtschaftsminister Robert Habeck (Grüne) haben bereits eigene Pläne mit unterschiedlichen Visionen für die Wirtschaft vorgestellt. Finanzminister Christian Lindner kündigte eigene Vorschläge an. »Die Richtung stimmt ja bei all diesen Vorschlägen«, sagte Reuter. »Man muss nur ein Paket daraus machen – und das wird sich die Wirtschaft sehr wünschen: sich einigen und weitermachen.« Der Internationale Währungsfonds (IWF) traut Deutschland dieses Jahr nur noch eine Stagnation zu, 2025 dann ein Wachstum von 0,8 Prozent. Alle anderen großen Industrienationen schlagen sich demnach besser als Deutschland. Der IWF verwies auf die anhaltende Schwäche der Industrie und Probleme auf dem Immobilienmarkt."
413ee1ec-f471-4ea0-93ec-46a503f1266b,2024-10-28 15:00:55+00:00,"Der Kanzler lädt zum Industriegipfel - doch die Koalitionspartner bleiben außen vor. Dass die FDP nun zu einer Konkurrenzveranstaltung bittet, hat den Ton zwischen SPD und Liberalen erneut verschärft. Besonders in der Wirtschaftspolitik wird der unterschiedliche Kurs der drei Ampel-Koalitionäre gerade deutlich. Sinnbildlich dafür stehen zwei Termine, die für den morgigen Dienstag anberaumt sind. Zum einen hat Kanzler Olaf Scholz ins Kanzleramt geladen. Dort trifft er am Nachmittag Industrieverbände, Gewerkschaften und ausgewählte Unternehmen zu einem Industriegipfel, um über Wege aus der Wirtschaftsflaute zu sprechen. Wirtschaftsminister Robert Habeck (Grüne) und Finanzminister Christian Lindner (FDP) bleiben außen vor. Die FDP-Fraktion im Bundestag bittet nun ihrerseits zu einem weiteren Wirtschaftstreffen, das bereits am Vormittag stattfinden soll. Geladen sind Arbeitgeberverbände (BDA), Industrie und Handelskammer (DIHK), der Zentralverband des Deutschen Handwerks (ZDH) und Familienunternehmen. Lindner ist Gast in dieser Runde, auch FDP-Fraktionschef Christian Dürr nimmt daran teil. Esken: ""Schon ein bisschen kindisch"" SPD-Co-Chefin Saskia Esken kritisierte das Alternativtreffen. Natürlich sei es normal, dass Parteien mit der Wirtschaft redeten. ""Dass es aber an dem Tag stattfindet, wo der Bundeskanzler zu seinem Industriegipfel ins Bundeskanzleramt eingeladen hat, ist schon ein bisschen kindisch"", sagte Esken den TV-Sendern RTL/ntv. Inhaltlich sprach sie sich für mehr private Investitionen neben staatlichen Maßnahmen aus. ""Es gibt eine Menge Vermögen, das in Deutschland auf der hohen Kante liegt, derzeit nicht investiert wird"", sagte sie bei RTL und ntv. Esken sprach sich auch weiter für eine Reform der Schuldenbremse aus. ""Investitionen, die sich rentieren, die auch über Jahre wirksam werden, die müssen über Schulden, über Kredite finanzierbar werden."" Miersch und Dröge drängen auf Lösungen SPD-Generalsekretär Matthias Miersch mahnte vor den Gesprächen mehr Lösungsorientierung an. ""Alberne Ränkespiele müssen aufhören. Ich erwarte, dass meine Koalitionspartner jetzt konzentriert und lösungsorientiert arbeiten"", sagte Miersch den Zeitungen der Mediengruppe Bayern. ""Verschiedene Ansätze können Durchbrüche bringen, wenn es echte Bereitschaft zur Zusammenarbeit gibt."" Ähnlich äußerte sich die Grünen-Fraktionschefin Katharina Dröge. ""Wir brauchen keine Konkurrenz-Gesprächskreise von Finanzminister und Kanzler, sondern gemeinsame Lösungen in der Bundesregierung"", sagte sie der Nachrichtenagentur dpa. Kubicki attackiert den Kanzler Vonseiten der FDP hingegen richtet sich scharfe Kritik an Scholz' Industriegipfel. FDP-Vize Wolfgang Kubicki verteidigte die Veranstaltung seiner Partei und stellte dabei gar die Kompetenz des Regierungschefs infrage: ""Da es der deutschen Wirtschaft hundsmiserabel geht, macht ein Austausch mit Wirtschaftsvertretern immer Sinn"", sagte Kubicki der Süddeutschen Zeitung. ""Es ist gut, dass die FDP diese Gespräche führt. Wir dürfen das keinesfalls Dilettanten überlassen."" FDP-Fraktionschef Dürr sagte im ZDF, es gehe nicht um eine ""Parallelveranstaltung"". Angesichts der großen Probleme der Wirtschaft sei der FDP aber ""die industriepolitische Perspektive für die Großindustrie ein bisschen zu eng."" Forderungen aus der SPD nach mehr staatlichen Investitionen wies Dürr zurück. Nicht mehr Steuerzahlergeld sei die Lösung, sondern Entlastungen und ein echter Bürokratieabbau. Bei staatlichen Investitionen sei das Land schon besser geworden. 90 Prozent der Investitionen würden aber von privaten Unternehmen getragen. Für diese müssten die Rahmenbedingungen verbessert werden. Merz sieht Regierung am Ende CDU-Chef Merz warf der Bundesregierung mit Blick auf die beiden separaten Treffen ""Kindergartenspiele"" vor. ""Nein, diese Regierung ist nicht mehr handlungsfähig. Sie ist am Ende"", sagte Merz am Sonntagabend in der ARD. ""Und das werden wir in den nächsten Tagen auch nochmal durch diese Gipfel und wie sie alle heißen, eindrucksvoll bestätigt bekommen. Da geht leider nichts mehr."" Wirtschaft fordert gemeinsame Strategie Und was sagen die, um die es morgen geht? Die Wirtschaft dringt auf eine stärkere Senkung der Energiekosten als bisher geplant. ""Niedrigere Preise für wenige Großbetriebe und bürokratische Förderprogramme allein sind dafür kein ausreichendes Konzept"", sagte der Präsident der Deutschen Industrie- und Handelskammer (DIHK), Peter Adrian, der Rheinischen Post. Der BDI fordert, dass die Bundesregierung in der Wirtschaftspolitik an einem Strang zieht. Statt ""unterschiedlicher Thesenpapiere und Gesprächsformate"" sei eine ""gemeinsame wirtschaftspolitische Strategie"" nötig, die Wachstumskräfte stärke, heißt es aus dem Verband. Dafür müssten die staatlichen Rahmenbedingungen verbessert und Unternehmen von Fesseln befreit werden, die derzeit Investitionen ausbremsten. Besondere Brisanz erhält der Industriegipfel durch die Zuspitzung der Krise des größten deutschen Autokonzerns VW. Nach Informationen des ARD-Hauptstadtstudios wird auch VW-Chef Oliver Blume anwesend sein. ""Wir erhoffen uns konstruktive Beratungen, an deren Ende konkrete Maßnahmen stehen, die die Wettbewerbsfähigkeit des Standorts Deutschland fördern und die Rahmenbedingungen für den Hochlauf der E-Mobilität verbessern"", sagte ein VW-Sprecher. Scholz und die ""industriepolitische Agenda"" Dass bereits nach der morgigen Runde bei Scholz konkrete Lösungen präsentiert werden, ist allerdings eher unwahrscheinlich. Die Inhalte sollen nach den Vorstellungen des Kanzlers vertraulich bleiben. Eine Pressekonferenz nach dem Treffen wird es nicht geben. Scholz hatte den Gipfel vor knapp zwei Wochen in einer Regierungserklärung im Bundestag angekündigt. Er soll der Auftakt für mehrere Gespräche mit Wirtschaftsvertretern sein. Das Ziel des Kanzlers: ""Eine neue industriepolitische Agenda"". ""Das, was dabei rauskommt, werde ich diesem Parlament vorschlagen, auch auf den Weg zu bringen, damit es vorangeht in Deutschland"", hatte er versprochen. Ergebnisse seien von dem Treffen nicht zu erwarten, sagte auch der stellvertretende Regierungssprecher Wolfgang Büchner. Der Kanzler wolle vielmehr hören, welche Reformen über die von der Ampel-Regierung bereits beschlossenen Schritte hinaus nötig seien, um die Wirtschaft wieder in Schwung zu bringen. Das Treffen sei nur der Auftakt für eine Reihe von Gesprächen des Kanzlers mit der Wirtschaft. Die Koalitionspartner Grüne und FDP sollten bei späteren Treffen dabei sein, hieß es."
c03f6f03-41c7-4f52-88d3-9e3f0fb1a361,2024-10-28 17:28:57+00:00,"Nicht nur für die Autoindustrie ist es ein Schock: Laut VW-Betriebsrat stehen mindestens drei Werke auf der Kippe. Für Beobachter hat sich der Schritt seit Langem angekündigt, denn trotz Gewinnen kämpft der Konzern mit Problemen. Drei Volkswagen-Werke stehen laut Betriebsrat auf der Kippe, Zehntausende Stellen auch. Für große Teile der deutschen Öffentlichkeit war diese Botschaft ein Schock. Kenner der Branche sind von den Ankündigungen allerdings nicht überrascht: ""Das hat sich seit Monaten angekündigt"", sagt Helena Wisbert, Direktorin des CAR - Center Automotive Research in Duisburg, gegenüber tagesschau.de. Ein eindeutiges Vorwarnzeichen: Im September hatte der Konzern aus Wolfsburg eine seit rund 30 Jahren geltende Beschäftigungsgarantie auslaufen lassen. Dennoch sagt Wisbert: ""Das sind sehr harte Einschnitte. So heftige Einsparungen haben wir bisher noch nicht gesehen, sollten sie so kommen."" Insgesamt beschäftigt Volkswagen in Deutschland 120.000 Menschen - allein 10.000 Stellenstreichungen können also rund jeden zwölften Arbeitsplatz treffen. Kämen die Werksschließungen wie angekündigt, würde etwa jede dritte Produktionsstätte dichtmachen - wenn es bei der Zahl bleibt. Nach Angaben des Volkswagen-Konzernbetriebsrats könnten sogar mehr Werke auf der Kippe stehen. ""Alle deutschen VW-Werke sind von diesen Plänen betroffen. Keines ist sicher"", heißt es in einer entsprechenden Pressemeldung. Insgesamt gibt es hierzulande zehn VW-Produktionsstätten. Volkswagen will weitere Details zu Einsparungen erst am Mittwoch bekannt geben. Krise trotz Gewinnen Doch was sind die Gründe für einen so einschneidenden Schritt? Auf dem Papier steht Volkswagen bislang gut da. 2023 verbuchte der Konzern laut Jahresbericht gar einen neuen Rekordumsatz von rund 332,3 Milliarden Euro - das entspricht einem Plus von rund 15,5 Prozent. Auch beim Gewinn verzeichnete Europas größter Autobauer ein Plus: Das operative Ergebnis der Volkswagen AG wuchs von 2022 auf 2023 auf rund 22,58 Milliarden Euro. Im Gegensatz zum kräftig gewachsenen Umsatz war das aber nur ein eher kleiner Zuwachs von rund zwei Prozent. Für dieses Jahr musste der Konzern seine Erwartungen nach unten korrigieren, es wird weniger statt mehr Autos ausliefern. Auch die Gewinnprognose ist nach unten korrigiert worden, bleibt aber deutlich im positiven Bereich. Dem Konzern fehlt es an Wachstumsperspektiven. Gerade auf dem wichtigen Absatzmarkt Asien sinkt die Nachfrage rapide. In China, wo zuletzt immerhin etwa jeder dritte Volkswagen verkauft wurde, laufen günstigere und innovativere inländische E-Autohersteller den Wolfsburgern inzwischen deutlich den Rang ab. Im zweiten Quartal 2024 lieferten die Wolfsburger fast ein Fünftel weniger Autos nach China aus. Der europäische Absatzmarkt alleine kann das nicht ausgleichen. Konkurrenzfähige E-Autos für Asien und Co. Beobachter sind sicher: Der Wettbewerbsdruck durch chinesische und andere ausländische Autobauer werde nur noch größer. Und: Volkswagen habe die Transformation hin zur Elektromobilität und innovativeren Digitalsystemen verschlafen. Das sieht auch Automobilexpertin Wisbert so. Jetzt an dem EU-weiten Verbrenner-Aus zu wackeln, mit der Hoffnung die deutsche Autoindustrie zu retten, hält sie für den falschen Weg: ""Die zentralen Märkte sind in Asien. Und für die braucht es konkurrenzfähige E-Autos."" Auch DIW-Chef Marcel Fratzscher hatte dies kürzlich betont: ""Die Entscheidung gegen den Verbrennungsmotor und für die Batterietechnik ist seit langem gefallen und wurde und wird nicht in Deutschland getroffen, sondern weltweit und insbesondere in den großen Märkten wie China und den USA"", so Fratzscher. ""Volkswagen zahlt überdurchschnittliche Gehälter"" Das zweite Problem aus Sicht vieler Experten: zu hohe Kosten. ""Volkswagen zahlt überdurchschnittliche Gehälter, dabei ist man anders als die Premiumhersteller wie BMW und Mercedes bereits in den günstigeren Marktsegmenten unterwegs, und das wird noch zunehmen"", sagt Wisbert. Zwar habe Volkswagen neue Arbeitsplätze in den Bereichen Digitalisierung und Elektrifizierung geschaffen. An anderer Stelle wurden aber keine Streichungen vorgenommen. Für sie ist klar: ""An Kostensenkungen kommt das Unternehmen nicht vorbei, um konkurrenzfähig zu bleiben."" In eine ähnliche Richtung stößt auch Stefan Bratzel, Direktor des Center of Automotive Management (CAM). ""Die Arbeitskosten in Deutschland sind in Vergleich zu anderen Produktionsländern in Europa, etwa in Portugal oder Polen, deutlich höher"", sagte er gegenüber tagesschau24. Autoexperte: Nicht nur an Arbeitern sparen Auch er hält Sparmaßnahmen daher für notwendig - allerdings nicht nur an einer Stelle: ""Es kann nicht sein, dass nur bei den Werkern gespart wird. Es muss sicherlich auch auf den höheren Rängen bis hin zum Vorstand ein Sparbeitrag geliefert werden."" Er denkt etwa an die Dividendenauszahlungen. Die lagen zuletzt für das Geschäftsjahr 2023 bei insgesamt 4,5 Milliarden Euro. Damit sei es aber nicht getan, betonen sowohl Bratzel als auch Wisbert. Freiwerdende Mittel durch Einsparungen müssten in Innovationen und mehr Flexibilität fließen, damit der Konzern sich für die Zukunft aufstellen kann, finden sie. Gespräche auf Industriegipfel Am Dienstag wird Volkswagenchef Oliver Blume am Industriegipfel im Bundeskanzleramt teilnehmen. Bundeskanzler Olaf Scholz hatte sich zuvor in die Debatte eingeschaltet. Der SPD-Politiker ließ über einen Sprecher mitteilen: Es gehe jetzt darum, Arbeitsplätze zu erhalten und zu sichern. Sollte das Volkswagen-Management möglicherweise in der Vergangenheit falsche Entscheidungen getroffen haben, dann dürften die jetzt nicht zu Lasten der Arbeitnehmerinnen und Arbeitnehmer gehen. VW teilte dem ARD-Hauptstadtstudio mit, man erhoffe sich konstruktive Beratungen und konkrete Maßnahmen, die die Wettbewerbsfähigkeit des Standorts Deutschland fördern, sowie Rahmenbedingungen, um den Hochlauf der E-Mobilität zu verbessern. Das Bundeswirtschaftsministerium verwies auf tagesschau.de-Anfrage auf zwei Maßnahmen, die schon auf den Weg gebracht worden seien: zum einen beschleunigte Abschreibungen für neu angeschaffte Elektrofahrzeuge. Zum anderen werde bei der Dienstwagenregelung die Deckelung für die Nutzung der Elektrofahrzeugbegünstigung von 70.000 Euro auf 95.000 Euro angehoben."
