4901db0d-ab09-4ad4-baba-356c64e96e64,2024-10-18 12:40:49+00:00,"Zum dritten Mal in Folge hat die Europäische Zentralbank ihre Zinsen um je einen Viertelpunkt gesenkt. Der für die Sparer wichtige Satz für Bankeinlagen bei der EZB beträgt jetzt 3,25 Prozent. Schon im Dezember könnte er auf drei Prozent sinken und 2025 noch weiter, wenn die Notenbank ihren Kurs beibehält Angeschlagene Konjunktur im Euroraum ankurbeln Vor allem die deutsche Wirtschaft mit dem zweiten Rezessionsjahr in Folge ist auf die niedrigeren Leitzinsen der EZB dringend angewiesen. Die gute Nachricht dabei ist, dass spätestens 2025 weitere Zinssenkungen folgen werden. Für den gesamten Euroraum ist laut EZB-Präsidentin Christine Lagarde keine Rezession zu befürchten. Andererseits ist auch die Inflationsgefahr weitgehend gebannt. Die Verbraucherpreise waren zuletzt innerhalb eines Jahres um weniger als 2 Prozent gestiegen. Und die Notenbank hat also Spielraum, den Fuß von der Bremse zu nehmen. Die höheren Zinsen seit 2022 hatten die Wirtschaft zusätzlich belastet, obwohl es wegen Corona, Lieferengpässen und Ukraine-Krieg ohnehin schon schlecht lief. Die EZB konnte sich die zwischenzeitlichen zehn Zinserhöhungen trotzdem leisten, weil die Arbeitslosigkeit im Euroraum mit 6,4 Prozent vergleichsweise niedrig ist. Günstige Kredite für mehr Investitionen und auch für mehr Konsum Einzig die Sparer sind die Leidtragenden dieser Entwicklung, weil die Guthabenzinsen auf jeden Fall noch weiter fallen werden. Auch die Zinsen für Baukredite sind im Vorfeld der letzten Entscheidungen des EZB-Rates bereits gefallen, weil Banken und Finanzmärkte die laufende Entwicklung bereits vorwegnehmen. Das heißt: Die Kreditgeber haben weitere Zinssenkungen in ihren aktuellen Angeboten bereits eingepreist. Bauen und Immobilienfinanzierungen nahe drei Prozent sind wieder möglich. Das hilft der angeschlagenen Bauwirtschaft und stabilisiert die Immobilienpreise. Beides hat für Wachstum und Wohlstand eine große Bedeutung. Mehr Leasing, billigere Ratenkredite, Chance auf Umschuldung nutzen Autokunden können inzwischen wieder von preiswerten Finanzierungen und Leasing-Angeboten profitieren. Auch sonst ist der Kauf auf Pump mit Ratenzahlungen und Verbraucherkrediten leichter geworden. Wer sich in den letzten beiden Jahren zu höheren Zinsen verschuldet hat, kann die niedrigeren Sätze jetzt oder im nächsten Jahr dann für eine Umschuldung nutzen und die laufende Zinsbelastung reduzieren. Einige Baufinanzierungen, die vor kurzen noch zu teuer waren, müssen nun vielleicht nicht mehr am Geld scheitern. Weitgehende Zustimmung der Finanzexperten zu den Zinssenkungen Eine Rückkehr zur alten Nullzinspolitik, die das Handeln der EZB sechs Jahre lang bis 2022 bestimmte, halten die Experten nicht mehr für möglich. Aber mit weiteren Zinssenkungen sei fest zu rechnen. Ein Grund ist, die schwache Wirtschaftsentwicklung und der Umstand, dass die Konjunktur immer noch gebremst werde. ""Der EZB sitzt die Angst um die wirtschaftliche Entwicklung im Nacken."" Thomas Gitzel, Chefökonom der VP Bank Der wunde Punkt bei einer weiteren Lockerung der Geldpolitik bleibe jedoch der zähe Rückgang der Kerninflationsrate, also der Preissteigerung ohne Energie und Nahrungsmittel. Dahinter verberge sich ein noch immer starker Preisanstieg im Dienstleistungssektor, der von hohen Lohnabschlüssen gespeist werde. ""Wie stark der Leitzins zurückgeht, wird von der Lohnentwicklung abhängen. Die Arbeitnehmerforderungen lassen darauf schließen, dass die Leitzinsen im Vergleich zur Vor-Corona-Ära auf erhöhtem Niveau zum Liegen kommen werden"", so Gitzel. Kritik an der EZB kommt von Sebastian Dullien vom gewerkschaftsnahen IMK-Institut: ""Angesichts der Verzögerung, mit der die Geldpolitik wirkt, und der anhaltenden Wirtschaftsschwäche ist es höchste Zeit, die geldpolitische Restriktion zu beenden."" Davon sei die EZB aber noch weit entfernt, so Dullien: Die Zinsen würden selbst nach der für Dezember zu erwartenden Leitzinssenkung auf drei Prozent die Wirtschaftsentwicklung weiter bremsen."
6498ae40-5600-4843-8616-deb5e4a3a27c,2024-10-18 17:56:00+00:00,Warum Deutschlands Wirtschaft von der Ukraine abhängt zdf.de
82c07228-78d0-43f3-8c50-ebb47897563d,2024-10-20 08:29:00+00:00,"Startseite Wirtschaft Trump-Sieg als „negativer Schock“ für deutsche Wirtschaft – laut Studie Von: Max Schäfer Ein möglicher weiterer „Schock“ durch Donald Trump könnte die deutsche Wirtschaft hart treffen. Die schwache Konjunktur könnte im Fall eines Sieges anhalten. Washington, D.C./Düsseldorf – Ein Sieg Donald Trump bei der US-Wahl am 5. November 2024 hätte drastische Folgen für die deutsche Wirtschaft. Sollte der Republikaner seine Drohungen nach härteren Zöllen umsetzen, könnte das die Wirtschaftsleistung in Deutschland in den zwei Jahren nach Einführung der Handelshemmnisse um etwa ein Prozent schwächen. Das geht aus einer Studie des Instituts für Makroökonomie und Konjunkturforschung der Hans-Böckler-Stiftung hervor, die am Donnerstag, 17. Oktober, veröffentlicht wurde. Trump kündigte für den Fall eines Sieges bei der US-Wahl an, Zölle in Höhe von 60 Prozent auf chinesische Produkte einzuführen. Auf Importe aus anderen Ländern sollen die Zölle zehn bis 20 Prozent betragen. Die IMK-Forschenden haben die Folgen der restriktiven Handelspolitik in mehreren Szenarien durchgerechnet. Im ersten Szenario fallen die Zölle für den Rest der Welt niedriger aus, im zweiten betragen diese 20 Prozent. Zusätzlich reagiert China dabei mit heftigen Gegenmaßnahmen, was angesichts des Handelskonflikts aus der ersten Amtszeit des Republikaners zu erwarten ist. Donald Trumps Zölle könnten als „negativer äußerer Schock“ der deutschen Wirtschaft massiv schaden Im Falle der harten Zölle und der Reaktion Chinas würde das Bruttoinlandsprodukts (BIP) Deutschlands in den ersten beiden Jahren nach Einführung der Zölle um mehr als ein Prozent niedriger ausfallen als ohne diese Maßnahmen. Danach gehen die Auswirkungen zurück, bleiben laut den Ökonomen jedoch bis zum Ende ihrer Simulation spürbar. Die Wirtschaftspolitik Donald Trumps könnte zudem die schwache Wirtschaftslage noch andauern lassen. „Ein weiterer negativer äußerer Schock könnte zu einer Verfestigung der aktuellen Stagnationsphase beitragen“, warnt das IMK. Der „Zollschock“ drohe zu einem Zeitpunkt, in dem sich die Industrie noch nicht vom „Energiepreisschock“ in Folge des Krieges in der Ukraine erholt habe und wegen der „aggressiven Industriepolitik“ Chinas und der USA unter Druck stehe. Im Gegensatz zu Trump: Bei Harris-Sieg drohen deutscher Wirtschaft nur „marginale“ Einbußen Ähnlich sieht es auch die Deutsche Industrie- und Handelskammer (DIHK). „Das stagnierende Wirtschaftswachstum in Deutschland bekäme einen weiteren Knüppel zwischen die Beine“, erklärte deren Außenwirtschaftschef Volker Treier IPPEN.MEDIA. Laut der IMK-Studie wären die Wachstumseinbußen der deutschen Wirtschaft bei einem Wahlsieg von Kamala Harris „marginal“. Auch die Kandidiatin der Demokraten sei „nicht als Verfechterin des Freihandels einzuordnen“. In ihrer Zeit als Vizepräsidentin hat Joe Biden die von Trump verhängten Zölle beibehalten und selbst auf einzelne Güter weitere Zölle gelegt. Deshalb sei vorstellbar, dass sich auch Harris protektionistischer Mittel bediene, jedoch seien umfangreiche Zollerhöhungen von der Demokratin nicht zu erwarten. Donald Trumps Zölle würden die Wirtschaft in den USA hart treffen Die größten Folgen hätte Trumps Politik jedoch in den USA selbst. Zwar wirken sich alle drei Szenarien, auch das von Harris, laut der Studie „wachstumsdämpfend“ aus. Grund sind steigende Konsumentenpreise und die dadurch sinkende Kaufkraft der Privathaushalte. Zudem dürfte die steigende Inflation die US-Notenbank Federal Reserve zu einem restriktiven Kurs veranlassen, was ebenfalls das Wachstum dämpfe. Besonders im Fall, dass Trump die härtesten Zölle umsetzt und China mit Gegenmaßnahmen reagiert, prognostizieren die Forschenden ein um bis zu vier Prozent niedrigeres BIP Ende 2025. „Im vierten Quartal 2026 wären es sogar mehr als fünf Prozent“, erklärte das Institut. Dabei erreiche Trump sogar sein Ziel, die heimische Produktion zu stärken und nicht mehr auf ausländische Produkte zurückgreifen zu müssen. „Da allerdings die anderen, wachstumshemmenden Effekte für die US-Wirtschaft stärker sind, überwiegen unterm Strich die BIP-senkenden Effekte deutlich“, erklärten die Forschenden."
e90e1717-a30e-410e-a716-979418e5e0ec,2024-10-21 02:56:00+00:00,"Startseite Wirtschaft EU-Staat will vermehrt russisches Gas kaufen – und stärkt damit Russlands Wirtschaft Von: Lars-Eric Nievelstein Europa entfernt sich von russischem Öl und Gas. Es existieren jedoch Ausnahmen. Ungarn plant, die Partnerschaft mit Gazprom zu vertiefen. Budapest – Zum Jahreswechsel ist Schluss. Die Ukraine will die Durchleitung von russischem Gas durch ihre Pipelines einstellen. Der bedeutende Liefervertrag, der auch für die Energieversorgung einiger europäischer Staaten verantwortlich war, läuft aus und es gibt derzeit keine Pläne für eine Verlängerung. Dies hat zu Beschwerden von Ländern wie Ungarn und der Slowakei geführt, die diese Ressourcen weiterhin benötigen. Während die Slowakei eine Alternative gefunden hat, geht Ungarn nun einen Schritt weiter und handelt gegen die westliche Strategie. Ungarn plant erweiterte Gaskäufe – und könnte Russlands Wirtschaft damit stärken Ungarn geht einen anderen Weg als viele europäische Länder, die sich bemühen, ihre Abhängigkeit von russischem Öl und Gas zu reduzieren. Es wird berichtet, dass Gespräche zwischen Budapest und Gazprom, dem russischen Gasgiganten, über zusätzliche Gaskäufe im Jahr 2025 begonnen haben. Dies wurde vom ungarischen Außenminister Peter Szijjarto in einem Interview mit der vom Kreml kontrollierten RIA Novosti bestätigt. Dies könnte dazu führen, dass Ungarns Abhängigkeit von russischem Gas zunimmt. Szijjarto erklärte: „Wir haben bereits eine Vereinbarung unterschrieben, die das letzte Quartal 2024 betrifft und bei dem es um zusätzliche Gaslieferungen geht“. Er fügte hinzu: „Aktuell befinden wir uns in Verhandlungen über einen Deal im nächsten Jahr.“ Diese neue Vereinbarung könnte größere Gaslieferungen ermöglichen, da Ungarn plant, auf die Turkstream-Pipeline zuzugreifen, die unter dem Schwarzen Meer verläuft. Ungarn bezieht derzeit etwa 4,5 Milliarden Kubikmeter russisches Gas pro Jahr. Im Jahr 2021 hatte das Land einen 15-jährigen Vertrag mit Gazprom abgeschlossen, so der Kyiv Independent. Szijjarto ist bereits in der Vergangenheit durch Gas- und Ölgeschäfte mit Russland aufgefallen – im April 2024 reiste er nach Moskau, um zusätzliche Gaslieferungen für Ungarn über die langfristig vereinbarten Mengen hinaus zu sichern. Unterstützt die EU nicht genug bei der Abkehr von russischem Gas? Laut dem ungarischen Außenminister decken russische fossile Brennstoffe etwa 70-80 Prozent des jährlichen Bedarfs Ungarns. Im Jahr 2022 kaufte Ungarn Erdgas im Wert von 10,6 Milliarden US-Dollar (9,7 Milliarden Euro) – dieses Gas war das am meisten importierte Produkt des Landes. Der Hauptlieferant war Russland, der Lieferungen im Wert von 5,58 Milliarden US-Dollar (5,14 Milliarden Euro) lieferte. Das hatten Daten des Observatory of Economic Complexity (OEC) gezeigt. Ungarn hat in der Vergangenheit kritisiert, dass die Europäische Union zwar die Abkehr von russischem Gas fordert, aber nicht genug Unterstützung leistet, um diesen Schritt zu ermöglichen. Csaba Marosvari, Ungarns Minister für Energiesicherheit, erklärte im September, dass insbesondere kleinere Länder ohne Zugang zum Meer Hilfe benötigen, um sich von russischem Öl und Gas zu lösen. Marosvari forderte mehr Fördermittel aus EU-Töpfen, wie Reuters berichtete. Russisches Gas für Europa – Risiken der Turkstream-Pipeline Die Turkstream-Pipeline steht schon seit einiger Zeit im Fokus der EU, da sie dazu genutzt werden kann, russisches Gas „getarnt“ nach Europa zu leiten. Der türkische Energieminister Alparslan Bayraktar erklärte, dass das staatliche Unternehmen BOTAS in der Lage ist, sieben bis acht Milliarden Kubikmeter Erdgas durch Bulgarien nach Zentraleuropa zu leiten. Das Risiko besteht darin, dass BOTAS und Gazprom Gespräche führen, um ein „Hub“ für russisches Gas zu entwickeln. Es besteht die Befürchtung, dass im „Turkish Blend“, einem Gasmix, den die Türkei nach Europa leiten will, ein großer Anteil an russischem Gas enthalten sein könnte. Wenn die EU verhindern will, dass Russland durch Gasverkäufe nach Europa profitiert, muss sie die Gaslieferungen durch Turkstream stoppen, argumentierte das Online-Magazin Politico. Eine Explosion an den Nord-Stream-Pipelines hatte zuvor dazu geführt, dass der russische Präsident Wladimir Putin kein Gas mehr direkt nach Deutschland liefern kann. Die Einnahmen Russlands aus Öl und Gas haben zuletzt einen Rückschlag erlitten."
524ba133-af4b-49cd-8901-c87e0ee12e57,2024-10-21 12:56:34+00:00,"Noch einmal: Trauen Sie der Ampelkoalition zu, dass sie die nötigen Veränderungen zur Stärkung der Wirtschaft schafft? Regierungsauftrag heißt auch Regierungsverpflichtung. Die Ampel ist für vier Jahre gewählt. Die deutsche Wirtschaft hat deshalb die klare Erwartung an diese Bundesregierung, die Rahmenbedingungen so zu verändern, dass erfolgreiches Wirtschaften wieder möglich wird. Außerdem: Was wäre denn die Alternative? Es ist ja nicht so, dass wir nach einem Platzen der Koalition automatisch sofort eine handlungsfähige neue Regierung bekommen würden, die die nötigen Reformen umsetzt. Wir brauchen jetzt schnelle Entscheidungen, noch in diesem Herbst. Noch mehr Zeitverschwendung kann Deutschland sich nicht leisten. Was wäre also zu tun? Wir erwarten echte Fortschritte beim Bürokratieabbau. Bisher sind das nur Buchstaben auf Papier. In den Unternehmen spürt man davon nichts. Zudem brauchen wir endlich eine wirksame Strategie gegen den Arbeits- und Fachkräftemangel. Die abschlagsfreie Rente ab 63 muss abgeschafft werden, und wir brauchen eine grundlegende Reform des Bürgergeldes. Die Beschäftigten brauchen wieder mehr Netto vom Brutto. Da braucht es endlich ein Stoppschild bei den Sozialabgaben. Die Liste ist lang. Wie viel hilft die 49 Punkte umfassende Wachstumsinitiative, die die Regierung im Sommer angekündigt hat? Die Wachstumsinitiative soll 0,5 Prozentpunkte Wirtschaftswachstum bringen. Das soll ein großer Wurf sein? Ich erwarte von dieser Bundesregierung deutlich mehr Ambition. So ganz verstehen wir noch nicht, ob Sie der Ampelkoalition das zutrauen. Ist sie die geeignete Kraft für diese Wende? Noch einmal: Es ist doch keine Frage des Zutrauens! Diese Ampelregierung wurde für vier Jahre gewählt, und ich erwarte, dass sie ihren Job erledigt. Angesichts der Wirtschaftszahlen sollte die Politik daran arbeiten, verloren gegangenes Vertrauen wieder zurückzugewinnen mit Maßnahmen zur Stärkung der Wettbewerbsfähigkeit dieses Standortes, anstatt sich in politische Schaukämpfe zu verheddern. Für die SPD hängt die Zukunft der Koalition stark davon ab, dass diese schnell das sogenannte Rentenpaket beschließt. Lässt sich Deutschland auch mit diesem Rentenpaket auf einen guten Wachstumskurs bringen? Dieses Rentenpaket wäre das bisher teuerste Sozialgesetz des Jahrhunderts – und das mitten im demographischen Wandel. In den nächsten 20 Jahren würde es uns mehr als 500 Milliarden Euro kosten, durchschnittlich 25 Milliarden Euro pro Jahr. Und es dient ja nicht etwa dazu, irgendwelche Rentenkürzungen abzuwenden. Es geht lediglich darum, dass die jährlichen Rentenerhöhungen höher ausfallen sollen – übrigens zugunsten der bestversorgten Rentnergeneration in der Geschichte dieses Landes. Verlierer sind die jungen Menschen, die künftig mehr in die Versicherung einzahlen, als sie später herausbekommen. Das ist nicht nur generationenungerecht. Es untergräbt auch die Akzeptanz in das System der gesetzlichen Rente. Also schlecht fürs Wirtschaftswachstum? Eindeutig. Dieses Paket würde die ohnehin zu hohen Sozialabgaben noch weiter hochtreiben. Zugleich droht es aufgrund noch stärker steigender Steuerzuschüsse den Bundeshaushalt zu sprengen. Natürlich geht das radikal auf Kosten der finanziellen Spielräume für Infrastruktur, Bildung, Verteidigung und Sicherheit. Mit Generationengerechtigkeit hat eine solche Politik wirklich gar nichts mehr zu tun. Wir werden alle länger arbeiten müssen, das lässt sich doch allein am demographischen Wandel ablesen. Deutschland leidet doch jetzt schon unter Fach- und Arbeitskräftemangel. Die SPD sieht das anders. Im Hinblick auf die Koalition deshalb die Frage: Wie sollte sich die FDP dazu verhalten? Mit dem Vorschlag des Generationenkapitals der FDP oder der Ablösung der Riester-Verträge, um transparente Sparanreize zu schaffen, ist man ja schon einmal auf einem guten Weg. Aber es steht mir nicht zu, der FDP irgendwelche taktischen Ratschläge zu geben. Aber es geht ja nicht um Taktik, sondern eine Grundsatzfrage. Oder nicht? Und die habe ich Ihnen beantwortet: Dieses Rentenpaket ist das unfairste und teuerste Sozialgesetz dieses Jahrhunderts. Ein politisches Grundproblem liegt darin, dass wir in Deutschland gar keine offenen Debatten über diese Zielkonflikte führen. Wir Arbeitgeber werben schon lange dafür, dass die Regierung einmal im Jahr dem Bundestag einen Bericht mit einer Gesamtschau liefern sollte, wie es um die Leistungs- und Zukunftsfähigkeit aller fünf Sozialversicherungszweige steht. Bisher traut sich leider kein Politiker, die Zielkonflikte zwischen mehr Sozialleistungen und höheren Finanzierungslasten offen anzusprechen, weil er um seine Wiederwahl fürchtet. Aber das wird so nicht mehr lange funktionieren. Denn der Beitragsanstieg wird immer stärker, und das merken die Menschen ja. Nimmt man alle offiziellen Ankündigungen zusammen, steigen die Sozialbeiträge nach heutigem Stand bis spätestens 2028 auf 44 Prozent des Bruttolohns... ... und das beeinträchtigt unsere Wettbewerbsfähigkeit enorm. In den Aufschwungzeiten des vergangenen Jahrzehnts waren es noch unter 40 Prozent. Wir müssen uns wieder darauf besinnen, dass dieser Wert eine Obergrenze ist. Sonst wird weniger in Deutschland und mehr im Ausland investiert. Es geht hier um Investitionen, die sich in den 2030er-Jahren auszahlen werden. Ich mache mir große Sorgen um die wirtschaftliche Zukunft unseres Landes. Die Ampelregierung plant auch ein „Tariftreuegesetz“. Unternehmen sollen vom Staat keine Aufträge mehr erhalten, falls sie sich nicht vorher auf eine dafür zu erlassende Arbeitsbedingungen-Rechtsverordnung verpflichten. Können Sie uns erklären, wie das funktionieren wird? Wir benachteiligen damit massiv unser eigenes Wirtschaftssystem. Das Gesetz ist realitätsfern und mittelstandsfeindlich. Für die Praxis bedeutet es mehr Komplexität, hohen Verwaltungsaufwand und zusätzliche Kosten. Wenn das Vergaberecht noch komplizierter wird, haben Unternehmen bald gar kein Interesse mehr an öffentlichen Aufträgen. Noch einmal: Soll die FDP all dem zustimmen, damit die Koalition dann vielleicht nebenbei auch noch etwas zur Stärkung der Wirtschaft beschließt? Die gesamte Bundesregierung ist in der Pflicht, Rahmenbedingungen für profitables Wirtschaften zu schaffen. Und sie muss erkennen, dass Deutschland in einer Rezession steckt. Sie muss endlich handeln. Das weiß auch die FDP. SPD und Grüne versprechen, dass bald der Min­destlohn auf 15 Euro oder mehr steigt. Wie lange machen die Arbeitgeber noch in der Mindestlohnkommission mit? Ich fordere die Bundesregierung und insbesondere die Sozialdemokratie auf, die Mindestlohnkommission und deren Beschlüsse zu respektieren. Wir haben in diesem Land, vom Grundgesetz geschützt, die Tarifautonomie. Die Gehälter werden in diesem Land von den Sozialpartnern ausgehandelt – Ende der Debatte. Der Mindestlohn darf nicht zum Spielball der Politik werden. Dieses Spiel muss aufhören. Haben Sie den jüngsten Beschluss des SPD-Vorstands dazu genau gelesen? Ja, das haben wir. Ich habe ihn gleich zweimal gelesen, weil er so bemerkenswert ist: Dort steht sinngemäß, dass die heutige Höhe des Mindestlohns zwar nicht den Vorstellungen der SPD entspricht. Aber da steht nicht, dass die SPD die Höhe des Mindestlohns durch gesetzliche Eingriffe ändern will. Und das glauben Sie? Wir werden das sehen. Zuerst: Wettbewerbsfähigkeit muss man sich erarbeiten. Das kann man nicht herbeisubventionieren. Und der Strom muss billiger werden, und zwar für alle: für Handwerksbetriebe, ob Bäcker oder Metzger, für Handelsbetriebe, für Landwirte, für die Industrie und natürlich für die Bürger. Leider ist es durch übereilte Entscheidungen der Vergangenheit, allen voran den kompromisslosen Ausstieg aus der Kernenergie, schwierig geworden, dies ohne Abstriche vom Klimaschutz und ohne enorme Belastungen öffentlicher Kassen zu erreichen. Mit der Zielmarke 2045 ist Deutschland noch über das EU-Ziel 2050 hinausgegangen. Aus heutiger Sicht war das zu ehrgeizig, weil die Politik – nicht erst die Ampel – wichtige Hausaufgaben schuldig geblieben ist. Denken Sie an den Stromnetzausbau. Ich sage daher sehr klar: Wir sollten den Klima-Zeitplan so weit strecken, dass er realistisch wird. Das Verbrennerverbot war falsch und sollte in dieser engen Form keinen Bestand haben. Es schädigt das Rückgrat der deutschen Wirtschaft. Aber bitte kein Missverständnis: Ich will nicht die Klimaziele infrage stellen. Es geht darum, sie zu realisieren – und zwar technologieoffen. Haben Sie keine Sorge, dass eine leichte Verschiebung Proteste von Klimaaktivisten provozieren würde? Aber wir können doch erst recht nicht in Kauf nehmen, dass unsere Wirtschaft kaputtgeht und wir unseren Wohlstand vernichten. Ich bin überzeugt, dass man Klimaneutralität mit ökonomischer Prosperität und sozialer Sicherheit verbinden kann. Wenn aber der Zeitplan zu ehrgeizig gesteckt wurde, müssen wir ihn anpassen. Alles andere läuft eher darauf hinaus, dass das ganze Projekt dieser Transformation an Zustimmung und damit Legitimation verliert. Würde etwa kein Stahl mehr in Deutschland mehr hergestellt, wäre das gut für die deutsche Klimabilanz. Wie sehr sind Sie dafür, die hiesige Stahlproduktion zu erhalten? Was für eine Frage! Deutschland ohne eigene Stahlproduktion, das wäre in jeder Hinsicht eine Katastrophe. Wandert sie in Länder mit weniger strengen Auflagen ab, ist fürs Klima gar nichts gewonnen. Und für die deutsche Wirtschaft gilt: Würde die Grundstoffindus­trie abwandern, verschwindet auch schnell die verarbeitende Industrie. Es wäre das Ende des Industriestandorts Deutschland. Auch wenn Sie die Ampelkoalition noch nicht aufgeben wollen: Wie sicher sind Sie sich, dass eine unionsgeführte Bundesregierung die Wirtschaft spürbar stärken würde? Zumindest sind viele Punkte, die die Rahmenbedingungen für den Wirtschaftsstandort Deutschland verbessern würden, in das neue Grundsatzprogramm der CDU eingeflossen. Das ermutigt mich. Sie will Energiekosten und Unternehmensteuern senken, Investitionen erleichtern, Arbeitsanreize stärken und lähmende Bürokratie wie die des Lieferkettengesetzes abbauen. Das wirkt konkreter und entschlossener, als ich es von der amtierenden Regierung je gehört habe. Ist Ihnen das schon konkret genug? Natürlich hat es eine Oppositionspartei immer leichter, ihre Positionen zu formulieren als eine Regierungskoalition. Aber wenn das Grundsatzprogramm der CDU auch nur in Teilen in Kraft gesetzt wird, wäre das ein wesentlicher Fortschritt. Sehen Sie bei der Union denn auch Konzepte, die Sozialbeiträge wieder in Richtung 40 Prozent zu bringen? Mir ist klar, dass das nicht leicht wird. Und natürlich nehme ich wahr, dass es auch in der Union Ideen gibt, die Leistungen der Sozialversicherung noch auszuweiten. Aber es gibt immerhin ein Bekenntnis zu dem 40-Prozent-Ziel – einen politischen Willen, sich daran zu messen. Das ist schon deutlich mehr, als die Ampelparteien dazu geboten haben. Sie haben dieses Ziel offenbar schon aufgegeben."
