9020372d-b210-46d9-b15b-cd3a38b569a3,2024-10-09 12:29:54+00:00,Herbstprognose: Wirtschaft erneut in der Rezession ZDFheute
188ddf91-dc6b-41df-ab90-918959bd1f48,2024-10-09 13:04:00+00:00,"Die für dieses Jahr erwartete Trendwende bleibt weiter aus: Auf den Rückgang der Wirtschaftsleistung im vergangenen erwartet die Bundesregierung nun einen weiteren in diesem Jahr. Mit minus 0,2 Prozent soll sich die Rezession auch 2024 fortsetzen, wie Wirtschaftsminister Robert Habeck am Mittwoch bei der Vorstellung der Herbstprojektion mitteilte. Die wirtschaftliche Erholung soll mit 1,1 Prozent Wachstum 2025 und 1,6 Prozent 2026 (jeweils inflationsbereinigt) erst in den Jahren danach einsetzen. Über die Zahlen haben bereits am Sonntag verschiedene Medien berichtet. „Die Lage ist insgesamt nicht zufriedenstellend“, räumte Habeck bei der Pressekonferenz in Berlin ein. Der Vizekanzler verwies dabei erneut auf die Folgen des russischen Angriffskrieges auf die Ukraine und die dadurch gestiegenen Preise, vor allem im Energiebereich. „Die hohe Inflation ist das Biest, das die Menschen ärmer gemacht hat“, so Habeck. „Neben konjunkturellen Risiken schlagen jetzt die strukturellen Probleme Deutschlands zu Buche, und das inmitten großer geoökonomischer Herausforderungen“, erklärte der Grünen-Politiker. Als Beispiele nannte er die Folgen des demografischen Wandels, eine schwierige Wettbewerbsposition Deutschlands sowie die weiter schwächelnde Nachfrage aus dem In- und Ausland. Habeck: „Deutschland ist ein Land voller Stärke und Stärken“ „Das sind Versäumnisse nicht der letzten Jahre, sondern eher Jahrzehnte“, sagte Habeck. Seit der Jahrtausendwende ist die deutsche Wirtschaft durchschnittlich um ein Prozent gewachsen; in den letzten Jahren stagnierte sie bestenfalls noch. Ihr künftiges Potenzial liegt mittelfristig nur bei 0,6 Prozent. Und doch gab sich der Bundeswirtschaftsminister optimistisch. „Wir werden uns daraus befreien“, sagte Habeck. Was die Ampel-Koalition während der Krisen geleistet habe, nannte er „imposant“. Das sehe man auch daran, dass nun vor allem die konjunkturellen Risiken sinken würden: Das Inflationsziel der EZB werde man im kommenden Jahr wieder erreichen und die Lohnabschlüsse vor allem im Niedriglohnsektor steigern, wodurch die Menschen wieder mehr Geld zur Verfügung hätten. „Deutschland ist ein Land voller Stärke und Stärken“, sagte Habeck. Viele Firmen seien Weltmarktführer, das Land die drittgrößte Volkswirtschaft der Welt. Dazu gebe es eine exzellente Forschungslandschaft und die Start-up-Landschaft vibriere. Reform der Schuldenbremse mit FDP und Union nicht realisiebar Entscheidend sei, „dass die Wachstumsinitiative jetzt voll umgesetzt wird“. Das im Juli von Habeck, Finanzminister Christian Lindner (FDP) und Kanzler Olaf Scholz (SPD) erarbeitete Paket aus Steuererleichterungen, stärkeren Arbeitsanreizen und geringeren Strompreisen ist noch nicht umgesetzt. Über zentrale Maßnahmen sind sich die drei Parteien zudem weiter uneins. Nicht Teil der Wachstumsinitiative, aber aus Habecks Sicht ebenfalls wirksam auf dem Weg aus der konjunkturellen sowie strukturellen Misere sei eine Reform der Schuldenbremse. „Wenn es dort mehr Spiel geben würde, würden wir als Volkswirtschaft wirklich einmal aus dem Quark kommen“, sagte Habeck. Eine Änderung der Schuldenregeln schließt FDP-Finanzminister Lindner allerdings weiter aus. Und auch die Union erneuerte am Mittwoch ihre ablehnende Haltung in dieser Hinsicht. Man wolle „an der Schuldenbremse im Bund und in den Ländern in der bewährten Form festhalten“, heißt es in einem aktuellen Beschluss ihrer haushalts- und finanzpolitischen Sprecher aus Bund und Ländern. Die aktuelle Ausrichtung der Finanzpolitik sieht allerdings eine Mehrheit der Ökonominnen und Ökonomen kritisch. „In einer konjunkturellen Schwäche wie der aktuellen sollte nach allen gängigen Lehrbüchern die Finanzpolitik expansiv ausgerichtet sein“, sagte etwa Sebastian Dullien, wissenschaftliche Direktor des Instituts für Makroökonomie und Konjunkturforschung (IMK) der Hans-Böckler-Stiftung. Mit Ausgabenkürzungen und Abgabenerhöhungen sei sie aktuell stattdessen leicht restriktiv. Die sich daraus ergebenden negativen Folgen für die Konjunktur könne auch das Ampel-Wachstumspaket nicht ausgleichen. Die deutsche Wirtschaft ist 2024 um 0,3 Prozent geschrumpft. Getragen von einer sinkenden Inflation, ging die Ampel-Koalition in ihrer letzten Prognose davon aus, dass das Bruttoinlandsprodukt 2024 wieder um 0,2 Prozent steigen würde. Doch auch wenn die Inflation mit 1,6 Prozent im September so niedrig war wie seit Februar 2021 nicht, zog der Konsum nicht so stark an wie erhofft."
14f8be83-ab0d-4858-924a-87edadc042ed,2024-10-09 13:11:58+00:00,"Die Bundesregierung erwartet für das laufende Jahr eine sinkende Wirtschaftsleistung. Für 2024 wird mit einem Rückgang um 0,2 Prozent gerechnet, sagte Bundeswirtschaftsminister Robert Habeck (Grüne) bei der Vorstellung der Herbstprojektion der Bundesregierung. Bislang war mit einem Wachstum von 0,3 Prozent gerechnet worden. Bereits im vergangenen Jahr war die deutsche Wirtschaft preisbereinigt um 0,3 Prozent geschrumpft. Nun dürfte das Jahr erneut in der Rezession enden. Grund dafür ist vor allem Unsicherheit bei Unternehmen und Bürgern. Das nach wie vor hohe Zinsniveau bremst Investitionen, Firmen sind wegen der unbeständigen wirtschafts- und geopolitischen Lage vorsichtig, private Haushalte sparen, statt in Wohneigentum oder Konsum zu investieren. Bessere Prognose für 2025 Zu Beginn des kommenden Jahres rechnet die Regierung dann wieder mit einer Belebung des privaten Konsums, einer Erholung der Nachfrage nach Industriegütern und mehr Investitionen. Positiv zu bewerten seien bereits jetzt die deutlich abgeschwächte Inflation, gestiegene Einkommen und sinkende Zinsen, sagte Habeck. Das alles werde den Konsum ankurbeln. Für 2025 rechnet die Regierung mit einem Wachstum von 1,1 Prozent – statt 1,0 Prozent in ihrer Frühjahrsprognose. Im Jahr 2026 sollen es demnach 1,6 Prozent sein. Bundesregierung will Wirtschaftswachstum ankurbeln Entscheidend sei, ""dass die Wachstumsinitiative jetzt voll umgesetzt wird"", sagte Habeck. Die Initiative umfasst 49 Maßnahmen, etwa finanzielle Anreize für Überstunden, Verlängerungen von Maßnahmen für niedrigere Strompreise, eine bessere Betreuung von Kindern und eine Neuregelung der Steuerklassen. ""Auch die Bundesländer sind aufgerufen, hier ihren Beitrag zum Wachstum zu leisten"", sagte Habeck. In der Bundesregierung wird befürchtet, dass die Länder eine Reihe von Maßnahmen im Bundesrat blockieren, weil sie dadurch weniger Steuern einnehmen würden. Führende Wirtschaftsforschungsinstitute zeigten sich zuletzt skeptisch, ob das Paket überhaupt den nötigen Impuls bringen kann. Viele Maßnahmen sind noch nicht umgesetzt. Auch Habeck räumte ein, es seien zusätzliche Maßnahmen nötig. Habeck fordert Reform der Schuldenbremse Nach Ansicht des Ministers könnte eine Reform der Schuldenbremse der deutschen Wirtschaft aus der Krise helfen. Das wirksamste und schnellste Instrument für mehr Wachstum seien Investitionsanreize, sagte der Grünenpolitiker. Hier setze die Schuldenbremse in den Landesverfassungen und im Bundeshaushalt jedoch Grenzen. ""Wenn es dort mehr Spiel geben würde, würden wir als Volkswirtschaft wirklich einmal aus dem Quark kommen"", sagte Habeck. Zudem schlug er zusätzliche Maßnahmen wie eine deutliche Senkung der Netzentgelte und Bürokratieabbau zum Beispiel beim Datenschutz vor. ""Maßgabe sollte sein: Nur was in der Praxis als Erleichterung ankommt, zählt"", sagte Habeck. Die Korrektur der Konjunkturprognose kommt nicht überraschend. Zuletzt hatten auch die großen Wirtschaftsforschungsinstitute ihre Erwartungen nach unten korrigiert. Sie rechnen mit einem Minus von 0,1 Prozent. Auf Grundlage der Herbst- und Frühjahrsprojektionen wird das Steueraufkommen geschätzt. Bund, Länder, Gemeinden und Sozialversicherungen orientieren sich bei der Aufstellung ihrer Haushalte daran."
d201bed6-7455-45ad-a87f-5f29cf2d4e1e,2024-10-09 13:33:49+00:00,"Robert Habeck (Grüne) beginnt mit dem, was aus seiner Sicht ""selbstverständlich"" ist: Deutschland sei ein Land ""voller Stärke"", habe ""einen innovativen Mittelstand"" und ""exzellente Fachkräfte"", sagt der Wirtschaftsminister bei der Vorstellung der Herbstprojektion am Mittwoch. Nur was dann folgt, sind Wirtschaftsdaten, bei denen man sich unweigerlich fragt, wie lange diese Selbstverständlichkeit noch gilt. Aus einem angenommenen Plus für die Wirtschaft ist erneut ein Minus geworden. Habecks Experten im Ministerium gehen mittlerweile davon aus, dass die Wirtschaftsleistung in diesem Jahr um 0,2 Prozent schrumpfen und nicht wie bisher erwartet um 0,3 Prozent wachsen wird. Schon im vergangenen Jahr war das Bruttoinlandsprodukt (BIP) um 0,3 Prozent gesunken. ""Die Lage ist insgesamt nicht zufriedenstellend"", sagt Habeck. Wenigstens der Ausblick gibt Hoffnung, im kommenden Jahr soll es wieder ein kleines Plus geben. Was den Wirtschaftsminister vor allem positiv stimmt: ""Es gibt echte Fortschritte bei der Inflation und der Kaufkraft."" Ein Überblick, was die deutsche Wirtschaft gerade besonders bremst – und was ihr helfen könnte: Der Staat investiert zu wenig Marode Brücken, Wohnungsmangel in Großstädten, verspätete Züge: Es ruckelt an vielen Stellen in Deutschland. Gemessen an der Wirtschaftsleistung gibt kaum ein Land so wenig für seine öffentliche Infrastruktur aus wie Deutschland, und das schon seit vielen Jahren. Unternehmenschefs wie Ökonomen sind sich einig: Der Staat muss mehr investieren – in den Städtebau, in Bildung und Forschung und in die klimafreundliche Transformation der Wirtschaft. Tatsächlich wird der Bund in diesem Jahr so viel Geld ausgeben wie nie zuvor. 70,5 Milliarden Euro sind im Haushalt für Investitionen eingeplant. Gut vier Milliarden gehen etwa in den Wohnungsbau, acht Milliarden in den Ausbau von Autobahnen und Bundesstraßen. Ein Rekord also. Nur: Mehr hilft mehr – so einfach ist es bei Staatsausgaben nicht. Das liegt an der Inflation: Seit 2019 sind beispielsweise die Baukosten um rund 40 Prozent gestiegen – es braucht also viel mehr Geld, um die gleiche Anzahl an Wohnungen zu bauen. Unter Ökonomen ist umstritten, ob es überhaupt kurzfristig etwas bringen würde, wenn jetzt sofort mehr Staatsgeld fließen würde. Michael Grömling vom arbeitgebernahen Institut der deutschen Wirtschaft (IW) in Köln ist skeptisch. Staatliche Investitionen seien zwar sehr wichtig, um strukturelle Defizite aufzuholen, aber ""konjunkturell bringt das erst mal nichts, weil die Umsetzung ja auch dauert"". Aufträge für den Straßenbau zum Beispiel müssten auch erst mal vergeben werden, dafür braucht es Personal und weitere Ressourcen. ""Wenn Sie heute anfangen, eine Straße zu planen, rollt der erste Bagger bestenfalls in zwei Jahren."" Sebastian Dullien, wissenschaftlicher Direktor des gewerkschaftsnahen Instituts für Makroökonomie und Konjunkturforschung (IMK) der Hans-Böckler-Stiftung sieht das anders: ""Jede Mehrinvestition würde jetzt helfen"", jede Milliarde Euro, die ausgegeben werde, sei ein Impuls – insbesondere in der Baubranche, da die Kapazitäten dort nicht ausgelastet seien. ""Das würde sich ziemlich schnell in einem höheren Bruttoinlandsprodukt niederschlagen."" Offenkundig sind die Staatsausgaben aber insgesamt zu niedrig, um Deutschland aus der Rezession zu holen. Das liegt auch daran, dass die Investitionen der Unternehmen ebenfalls zurückgegangen sind. Sie können nicht kompensieren, was der Staat zu wenig ausgibt. Das Barometer des ifo Instituts für die Investitionserwartungen fiel im März auf minus 0,1 Punkte, nach plus 1,2 Punkten im November. Noch mehr staatliche Investitionen müssen allerdings auch finanziert werden. Entweder durch höhere Steuern oder durch mehr Schulden. Den Weg der Schulden versperrt die Schuldenbremse – und mit der FDP in der Regierung ist eine Abkehr davon nicht zu machen. Höhere Steuern will allerdings auch keiner, erst recht nicht im Wahljahr 2025. Fraglich, wie lange der Staat mit den Einnahmen noch auskommen wird. Denn in einer Rezession nimmt der Staat noch weniger Steuern ein: Ein Prozent weniger Wirtschaftsleistung führt, grob gesagt, zu gut zehn Milliarden Euro weniger Steueraufkommen. Die Lücke im Haushalt wird also immer größer, und es ist fraglich, ob sich die aktuelle Planung so überhaupt aufrechterhalten lässt. Die Steuerschätzung Anfang November jedenfalls dürfte für die Ampelregierung wohl wenig Erfreuliches bringen. Verbraucher sparen lieber Die Inflationsrate ist rückläufig, die Löhne sind gestiegen. ""Da würde man schon denken, dass wieder mehr konsumiert wird"", sagt Patrick Höppner vom ifo Institut. Doch die Verbraucherinnen und Verbraucher in Deutschland verhalten sich anders: Sie verfügen zwar real wieder über mehr Geld, aber geben es ungern aus. Die Prognose der Gesellschaft für Konsumforschung (GfK) für Oktober fällt zwar etwas besser aus als im Vormonat, aber dafür war sie zuvor stark eingebrochen. Im September ist die Inflation voraussichtlich auf 1,6 Prozent gegenüber dem Vorjahresmonat gesunken. Allerdings liegt das vor allem an sinkenden Energiepreisen. Rechnet man die Preisentwicklung bei Lebensmitteln und Energie heraus, bekommt man die sogenannte Kerninflation, die im September mit 2,7 Prozent erwartet wird. Vor allem die für viele Menschen sehr sichtbaren Dienstleistungen verteuern sich mit einer Rate von 3,8 Prozent weiterhin stärker. Von Preisstabilität könne man daher noch nicht sprechen, sagen manche Ökonomen. Die Gründe, warum die Verbraucher ihr Geld zusammenhalten, liegen Höppner zufolge ohnehin vor allem in einer allgemeinen Verunsicherung. Die speise sich vor allem aus den gehäuften Berichten über die schlechte Wirtschaftslage, Insolvenzen, Ankündigungen von Personalabbau oder Werkschließungen bei großen Betrieben. Die Sparquote der Deutschen, ohnehin schon eine der höchsten der Welt, ist im ersten Halbjahr 2024 noch einmal um 0,5 Prozentpunkte auf 11,3 Prozent des verfügbaren Einkommens gestiegen. ""Auch einmalige Inflationsausgleichsprämien wurden eher auf die hohe Kante gelegt"", sagt Höppner. An der Zurückhaltung der Konsumentinnen wird sich dem ifo Institut zufolge dieses Jahr wohl auch nicht mehr viel ändern – und darunter leidet vor allem der Einzelhandel. ""Die Einzelhändler sehen immer weniger Möglichkeiten für Preiserhöhungen. Auch die Beschäftigung wird kurzfristig eher zurückgehen als steigen"", sagt Höppner. Daneben hätten viele Einzelhändler große Lagerbestände angehäuft und planen nun, ihre Bestellungen an Handelswaren zu verringern. Immerhin schätzen die privaten Haushalte in Deutschland ihre Finanzen in den nächsten zwölf Monaten wieder etwas positiver ein als zuletzt. Die Einkommenserwartung ist laut der Gesellschaft für Konsumforschung nach einem starken Einbruch im August im September wieder leicht gestiegen, ebenso wie die Neigung, neue Produkte anzuschaffen. Konkurrent China wird immer stärker Die deutsche Industrie ist besonders stark auf den Weltmarkt ausgerichtet, Beispiel Automobilsektor: Der Auslandsumsatz machte dort mit rund 190 Milliarden Euro im ersten Halbjahr rund 70 Prozent des Gesamtumsatzes aus. Ähnliches gilt für den Maschinenbau und die Chemie. ""In der gesamten deutschen Industrie ist die Exportquote sehr hoch, insgesamt liegt sie bei 60 bis 70 Prozent"", sagt Michael Grömling vom IW. Doch die Nachfrage aus dem Ausland schwächelt: Im ersten Halbjahr schrumpfte etwa die Ausfuhr von Autos um 2,4 Prozent zum Vorjahreszeitraum – und damit deutlich stärker als die deutschen Exporte (minus 1,6 Prozent). Dafür gibt es eine Reihe von Gründen, auf die weder die deutsche Politik noch die Unternehmen viel Einfluss haben. ""Wir haben eine Weltwirtschaft im Krieg"", sagt Grömling mit Verweis auf den russischen Angriffskrieg gegen die Ukraine und den Krieg im Nahen Osten. Hinzu käme die Wirtschaftskrise in China und Unsicherheiten, die mit der bevorstehenden US-Wahl einhergehen. ""Das würgt eine traditionell weltoffene Wirtschaft wie Deutschland fundamental ab."" Das Problem: Vor allem an der Konkurrenz aus China wird sich so schnell nichts ändern, im Gegenteil. Die chinesische Immobilienkrise macht die Chinesen vorsichtig und hält sie vom Konsum ab. Die Regierung versucht, die schwindende Nachfrage im eigenen Land mit Exporten zu kompensieren und vertreibt die hochsubventionierten Produkte billig im Ausland. China verfolge eine ""aggressive Exportstrategie"", sagt Wirtschaftsminister Habeck am Mittwoch. Zum anderen werden chinesische Produkte konkurrenzfähiger, gerade in der E-Mobilität. Chinesische Marken sind im Hinblick auf Technik und Digitalisierung den deutschen schon voraus. Noch wichtiger ist allerdings, dass China sich mit seiner ""Made in China 2025""-Strategie schon vor knapp zehn Jahren das Ziel gesetzt hat, in wichtigen Schlüsselbranchen Weltmarktführer und unabhängiger von Importen zu werden. Dazu gehörten auch die wichtigsten Industriezweige Deutschlands. ""Und das wird eben ziemlich rücksichtslos durch Industriepolitik umgesetzt"", sagt Dullien vom IMK. Mit Qualitätssteigerungen kämen deutsche Unternehmen dagegen nicht an. ""Wenn in China vorgesehen ist, dass diese Produkte nicht mehr oder weniger importiert werden, dann hat man einfach ein Problem."" Auf ein ähnliches Problem stoßen deutsche Unternehmen auf dem US-Markt. Seit dem Inflation Reduction Act werden Investitionen unter der Bedingung subventioniert, dass die Produktion in den USA stattfindet. Nun sind ausgerechnet die USA und China die beiden großen Wachstumsmärkte für Deutschland. ""Wenn beide so eine aggressive Industriepolitik betreiben, ist es für Deutschland schwierig, da mitzuhalten."" Besserung ist auch in den USA nicht in Sicht. ""Sollte Donald Trump wieder Präsident werden, dann wird es noch schlimmer."" Trump hat im Wahlkampf bereits hohe Zölle auf chinesische Produkte, aber auch gegenüber dem Rest der Welt in Aussicht gestellt. Wie kommen wir da wieder raus? Die Prognose des IW kommt erst im November, sie werde Michael Grömling zufolge aber auch nur mager ausfallen. Dem IMK zufolge sind Wachstumsraten von mehr als einem Prozent, wie sie die Bundesregierung für 2025 erwartet, nach aktuellem Datenstand unrealistisch. Das Institut rechnet mit 0,7 Prozent und nicht wie die Bundesregierung mit 1,1 Prozent für 2025. ""Das ist nicht beeindruckend, aber wir sehen zumindest nicht, dass die Entwicklung jetzt in den freien Fall übergeht"", sagt Sebastian Dullien. Ein Hoffnungsschimmer: Beim Maschinenbau etwa führten die angekündigten verbesserten Abschreibungsbedingungen aus der Wachstumsinitiative dazu, dass aktuell weniger investiert wird, da ab dem 1. Januar 2025 die Konditionen besser sind. Der wichtigste Faktor für Grömling vom IW: ""Es braucht eine geopolitische Entspannung."" Nur so gewännen Unternehmen weltweit die nötige Zuversicht, um wieder zu investieren. Doch darauf kann Deutschland allenfalls diplomatisch versuchen, hinzuwirken. Für Sebastian Dullien vom IMK hätte die Bundesregierung hingegen durchaus weitere Hebel. Zum Beispiel industriepolitisch auf das reagieren, was China und die USA betreiben – also zum Beispiel die E-Mobilität wieder stärker fördern. In der energieintensiven Chemie wiederum spiele die Unsicherheit bei den Energiepreisen eine große Rolle. Hier würde ein Brückenstrompreis helfen, wie ihn etwa der Ökonom Tom Krebs fordert. Allerdings hat die Ampelregierung als Reaktion auf das Urteil des Bundesverfassungsgerichts zum Haushalt sowohl die Pläne zum Industriestrompreis gestrichen als auch den sogenannten Umweltbonus beim Kauf von E-Autos. ""Man hat in den Abschwung hinein weiter gespart"", kritisiert Dullien diese Entscheidungen."
399ff7ce-5a1d-4117-b795-853a295dacb9,2024-10-09 13:51:59+00:00,"Die Bundesregierung hat ihre Konjunkturprognose deutlich nach unten korrigiert: Sie geht nun von einem Rückgang der Wirtschaftsleistung um 0,2 Prozent in diesem Jahr aus. Es wäre das zweite Rezessionsjahr in Deutschland. Deutschland sei ""ein Land voller Stärken und voller Stärke"" - so begann Bundeswirtschaftsminister Robert Habeck heute die Vorstellung der Herbstprojektion in Berlin, die dann allerdings erstmal die Schwächen der deutschen Wirtschaft hervorhob. Denn die Bundesregierung rechnet für dieses Jahr mit einem Rückgang der Wirtschaftsleistung um 0,2 Prozent. Damit korrigiert sie ihre Frühjahrsprognose zur Entwicklung des Bruttoinlandsprodukts deutlich nach unten. Im Frühjahr war die Regierung noch von einem leichten Plus von 0,3 Prozent ausgegangen. Die wirtschaftlichen Rahmenbedingungen seien im Moment nicht zufriedenstellend, sagte Habeck. Fehlende Innovationsbereitschaft sei das größte Problem für die deutsche Wirtschaft. Damit steckt die deutsche Wirtschaft in der Konjunkturkrise fest: Bereits im vergangenen Jahr war die Wirtschaftsleistung preisbereinigt um 0,3 Prozent zurückgegangen. Zwei Rezessionsjahre in Folge gab es für die deutsche Wirtschaft zuletzt 2002 und 2003. Als Reaktion führte die damals regierende rot-grüne Regierung umfassende Arbeitsmarktreformen durch, die Experten zufolge die Wende einleiteten. Hilft das Wachstumspaket? Ein wichtiges Instrument, um Deutschland aus der aktuellen Krise zu führen, sei das Wachstumspaket der Ampel-Regierung mit Steuererleichterungen, Arbeitsanreizen und Strompreis-Vergünstigungen, sagte der Bundeswirtschaftsminister. ""Wenn sie umgesetzt werden, und zwar vollständig, dann wird die Wirtschaft stärker wachsen, wieder mehr Menschen in Arbeit kommen"", so Habeck. ""Deshalb müssen die Maßnahmen der Wachstumsinitiative jetzt entschlossen von allen umgesetzt werden."" Außerdem schlägt der Wirtschaftsminister zusätzliche Maßnahmen vor: Eine deutliche Senkung der Netzentgelte und Bürokratieabbau zum Beispiel beim Datenschutz. ""Maßgabe sollte sein: Nur was in der Praxis als Erleichterung ankommt, zählt"", sagte Habeck. Erholung wohl erst 2025 Mit diesen Maßnahmen soll die Wirtschaft aus der Krise geführt werden: Für das kommende Jahr ist die Bundesregierung etwas optimistischer und erwartet ein Plus von 1,1 Prozent. Sie hofft, dass dann der private Konsum wieder anzieht und auch mehr Industrieprodukte im Ausland gekauft werden. Dann könnten sich die deutschen Firmen wieder mehr Investitionen zutrauen. Streit über die Schuldenbremse Habeck sprach sich außerdem für eine Reform der Schuldenbremse aus. Das wirksamste und schnellste Instrument für mehr Wachstum seien Investitionsanreize, sagte der Grünen-Politiker. Hier setze die Schuldenbremse in den Landesverfassungen und im Bundeshaushalt jedoch Grenzen. ""Wenn es dort mehr Spiel geben würde, würden wir als Volkswirtschaft wirklich einmal aus dem Quark kommen"", so der Minister. Unterstützung kam vom Ökonomen Achim Truger, Mitglied im Sachverständigenrat Wirtschaft, den sogenannten ""Wirtschaftsweisen"": Die Bundesregierung solle ""eine Notlage erklären und die Schuldenbremse aussetzen"", sagte Truger den Sendern ntv und RTL. Dies sei angesichts der ""dramatischen"" konjunkturellen Lage gerechtfertigt. Dagegen positionierte sich die FDP. Generalsekretär Bijan Djir-Sarai sagte der Nachrichtenagentur dpa, es sei wichtig, mit der Illusion aufzuräumen, ""maßlose Schulden könnten unsere Wirtschaft wiederbeleben"". Auch FDP-Chef Christian Lindner forderte einen Kurswechsel in der deutschen Wirtschaftspolitik statt Änderungen an der Schuldenbremse: ""Mit Bürokratie und Steuerlast, aber - offen gesagt - auch mit planwirtschaftlichem Klimaschutz und ansteigender Umverteilungspolitik wurde unsere Wirtschaft über Jahre gefesselt."" ""Niedergang ist hausgemacht"" Kritik an Habeck kommt derweil aus der Wirtschaft. Der Verband der Familienunternehmer forderte eine Senkung der Unternehmenssteuern. Die Energiepolitik müsse neu aufgestellt werden, die Sozialversicherungen brauchten Reformen. ""Keine andere Industrienation steckt in der Rezession fest, dieser Niedergang ist hausgemacht"", sagte Verbands-Präsidentin Marie-Christine Ostermann. Die Bilanz von Wirtschaftsminister Robert Habeck sei größtenteils desaströs. Er dürfe nicht schweigen zu der ""Explosion der Lohnzusatzkosten"", also steigenden Beitragssätzen in der Pflegeversicherung und für das Rentensystem."
