70106260-658f-4abe-b663-3b3ad8f3b150,2024-10-01 04:35:11+00:00,"Die deutsche Wirtschaft fürchtet, dass ihr die immer strengeren Klimaschutzvorschriften die Luft abschnüren werden. Schon jetzt seien die Vorgaben zum Treibhausgasausstoß kaum zu erfüllen und erhöhten die Kosten, noch schlimmer werde es, wenn die EU ihre Emissionsziele weiter verschärfte, kritisieren die Deutsche Industrie- und Handelskammer DIHK und der Verband kommunaler Unternehmen VKU. „Die Formulierung immer neuer, höherer Klimaziele führt zu einer tiefen Verun­sicherung in der Breite der Wirtschaft“, sagte DIHK-Hauptgeschäftsführer Achim Dercks der F.A.Z. am Montag in Berlin."
d2fff56b-fab1-4b20-97ad-629e9f123c0e,2024-10-01 05:30:00+00:00,"Hätte Volkswagen bloss auf Robert Habeck gehört. Wer im Jahr 2025 kein Elektroauto für unter 20 000 Euro anbiete, werde im Markt scheitern. Davor warnte der Grünen-Politiker den Automobilkonzern vor fünf Jahren. Tatsächlich wirkt es so, als stünde VW gegenwärtig nah dran am Scheitern. Die Verkaufszahlen sind mau, die Geschäftszahlen sind mies, und das Management denkt über Werkschliessungen und Entlassungen nach. Für das günstigste Strommodell von VW werden derweil rund 40 000 Euro fällig. Mit Habeck sitzt somit nicht nur der erste Grünen-Politiker an der Spitze des deutschen Wirtschaftsministeriums, sondern offenbar auch ein Prophet. So scheint es jedenfalls. Wirft man einen zweiten Blick auf die VW-Misere, stellt sich die Sache etwas anders dar. Denn was man dem Konzern nicht vorwerfen kann, ist, dass er sich nicht bemüht hätte. Im Gegenteil, kein anderer deutscher Autohersteller hat konsequenter auf Stromer gesetzt. Milliarden hat der Konzern aufgebracht, um an Elektromotoren zu tüfteln, weitere Milliarden hat er für neue Fabriken springenlassen. Was auch daran liegen dürfte, dass der grösste Anteilseigner von VW der deutsche Staat ist. Und für ihn steht fest: Die Zukunft des Automobils ist elektrisch. Bis 2030 soll Deutschland zum «Leitmarkt für Elektromobilität» werden, 15 Millionen E-Autos sollen dann durch deutsche Städte und über deutsche Autobahnen rollen. So wünscht es sich Habecks Ministerium von der Autoindustrie – und hat deshalb Subventionen in Milliardenhöhe lockergemacht. Auch VW hat davon profitiert. Steuergeld in Höhe von mindestens 6,4 Milliarden Euro ist seit 2016 auf den Konzern-Konten gelandet. Ein Grossteil davon stammte direkt aus der Kasse von Habecks Ministerium. Der Konzern versprach, mit den Zuschüssen neue, elektrische Antriebe zu entwickeln. Und scheiterte: Technisch hechelt man der chinesischen und der amerikanischen Konkurrenz hinterher. Die Probleme von VW lassen sich jedoch nicht allein den Ingenieuren oder dem Management in die Schuhe schieben. Sie spiegeln vielmehr eine fatale Wirtschaftspolitik wider, die tief in der Denkweise der deutschen Regierung verwurzelt ist. Sie basiert auf einem fragwürdigen politischen Selbstverständnis beziehungsweise einem ökonomischen Unverständnis – für das Wirtschaftsminister Habeck exemplarisch steht. Denn der Grünen-Politiker versteht sich primär nicht «nur» als Minister – als Leiter einer Verwaltung also, die den bestmöglichen Rahmen für Unternehmen und Betriebe schafft. Nein, sein Anspruch ist es, die Wirtschaft zu lenken, zu steuern und zu führen. Zwar erlebt interventionistische Wirtschaftspolitik weltweit gerade eine Renaissance. Selbst die Vereinigten Staaten, einst eine Bastion des freien Marktes, greifen nunmehr zu milliardenschweren Subventionen. Doch kaum jemand betreibt diesen neuen Interventionismus mit solchem Eifer wie Deutschlands Wirtschaftsminister. Wo andere Pragmatismus walten lassen, sieht Habeck offenbar seine Mission: den Staat zum Dirigenten der Wirtschaft zu machen. Er werde «aktiv dafür sorgen», dass die Schlüsselindustrien im Land blieben, sagte Habeck nach Amtsantritt. Kurz darauf schob er ein langes Strategiepapier nach. En détail diktierte er darin, dass in Deutschland auch weiterhin Glas geblasen, Zement gemischt und Papier geschöpft werden müsse. Das Subventionsbudget explodiert Koste es, was es wolle: Das gesamte Subventionsbudget der Bundesregierung, also direkte Finanzhilfen und Steuervergünstigungen, liegt im laufenden Jahr bei 67 Milliarden Euro. Es ist damit mehr als doppelt so hoch wie im Schnitt der zehn Jahre vor Beginn der Corona-Pandemie. Glaubt man Habeck, ist das gut angelegtes Geld, schliesslich gilt es die «industrielle Transformation» zu stemmen, wie er bei jeder Gelegenheit die Welt wissen lässt. Transformiert wird dabei vor allem in eine Richtung: hin zur Klimaneutralität. Von den insgesamt 138 direkten Finanzhilfen hatten im vergangenen Jahr 83 einen Bezug zu den in der Nachhaltigkeitsstrategie der Bundesregierung verankerten Umwelt- und Klimaschutzzielen, wie das Forschungsinstitut IW vorrechnet. Mit geplanten Ausgaben von insgesamt 39 Milliarden Euro machten sie rund 86 Prozent des gesamten Finanzhilfevolumens aus. Was aber kommt heraus, wenn der Staat Milliarden verteilt, die an Vorgaben dazu geknüpft sind, was, wie und zu welchem Preis produziert werden soll? In der Regel kein innovatives Produkt, das von Konsumenten nachgefragt wird – und damit auch keine reale Wertschöpfung. Das kann man dieser Tage bei Volkswagen mitverfolgen. Aus Furcht, bei der nächsten Förderrunde leer auszugehen, hat sich der Konzern lieber dem Druck aus dem auch politisch besetzten Aufsichtsrat gebeugt als sich den Erwartungen der Kunden und dem Wettbewerb der Konkurrenz zu stellen. Trotz den Schwierigkeiten bei VW scheint Habeck nichts dazugelernt zu haben. Im Gegenteil, bei einem eilig ausgerufenen Autogipfel stellte der Minister jüngst den Autoherstellern neue Unterstützung in Aussicht. Was zeigt: Ein Markteingriff kommt selten allein, sondern zieht immer neue Interventionen nach sich. Verstaatlichungen auf dem Energiemarkt Habecks Ausgabeneifer beschränkt sich nicht auf die Automobilbranche. ThyssenKrupp hat der Wirtschaftsminister Geld für den Bau eines «grünen Werks» versprochen, um die Stahlindustrie im Land zu halten. Den Chiphersteller Intel wiederum will er mit Milliarden nach Magdeburg locken. Mögen die Branchen noch so unterschiedlich sein, gemeinsam haben die beiden Unternehmen eines: Es ist schlecht um sie bestellt. Wenn auch aus unterschiedlichen Gründen. ThyssenKrupp leidet seit langer Zeit unter einer schwachen Nachfrage und den hohen deutschen Energiekosten. Intel hingegen kämpft mit Qualitätsproblemen. Was die These des Ökonomen Moritz Schularick zu staatlichen Subventionen unterstreicht: Der Staat mag zwar nicht in der Lage sein, die Erfolgsunternehmen von morgen zu identifizieren. Die Verlierer von gestern finden aber mühelos ihren Weg zum Staat und zu seinen Fördertöpfen. Noch fragwürdiger erscheint Habecks Subventionspolitik auf dem Energiemarkt. Dort hatte er 2023 zunächst auf die Abschaltung der letzten verbliebenen Kernkraftwerke bestanden und damit auf eine sichere, kostengünstige Stromproduktion verzichtet. Was, wohlbemerkt, auf dem Höhepunkt der grössten Energiekrise geschah, der sich sein Land jemals ausgesetzt sah. Weil sich dann allerdings Versorgungslücken abzeichneten, legte der Grünen-Politiker eine Kraftwerksstrategie vor, die den Bau neuer Gaskraftwerke vorsieht. Das staatliche Subventionsvolumen taxierte er dafür auf mindestens 16 Milliarden Euro. Ähnliches Spiel bei der Energieinfrastruktur: Angesichts hoher Ausbaukosten lohnt sich der Betrieb der deutschen Stromnetze für private Betreiber kaum mehr – trotz versteckten, milliardenschweren Subventionen, die von den Verbrauchern über die sogenannten Netzentgelte monatlich beglichen werden. Habeck setzt hier jetzt direkt auf die Verstaatlichung. Bei drei von insgesamt vier Betreibern hat sich der Staat bereits Beteiligungen gesichert. Den Einstieg beim letzten verbliebenen Unternehmen ohne öffentlichen Anteilseigner strebt der Minister an. Was Habeck von Hayek lernen kann Die hochmütige Vorstellung, dass politische Führungskräfte die optimale Ausrichtung einer Volkswirtschaft bestimmen können, ist dabei alles andere als ein neues Phänomen. Schon der österreichische Ökonom Friedrich August von Hayek warnte vor dieser «Anmassung des Wissens» und mahnte zu Demut. Hayek erkannte: Der Markt ist vor allem ein Informationssystem. Preise sind Signale, die uns Menschen helfen, uns an Ereignisse und Veränderungen anzupassen, von denen wir nichts wissen. Und auch nichts wissen können, denn kein menschliches Individuum und auch keine künstliche Intelligenz verfügt über das gesamte Wissen, das dafür notwendig wäre. Habecks Milliardensubventionen stehen somit nicht nur betriebswirtschaftlich auf wackeligen Beinen. Sie sind auch ein Angriff auf die Grundpfeiler der freiheitlichen Wirtschaftsordnung. Denn mit jedem Euro, den er verteilt, verfälscht er die Marktsignale und erodiert damit das System, das seinem Land Wohlstand und Freiheit gebracht hat. Flankiert wird das von seinen Bemühungen, den Markt an anderer Stelle gleich ganz ins staatliche Korsett zu zwängen. Doch Habeck sollte wissen: Am Ende einer zentralistisch gesteuerten Planwirtschaft steht nicht der klimaneutrale Wohlfahrtsstaat, sondern der Kollaps. Gewiss, ein leidenschaftlicher Sozialist ist Habeck nicht. Er beginnt den Tag nicht mit Marx-Exegese und beschliesst ihn nicht mit Engels-Lektüre. Seine Kritik an den bestehenden Verhältnissen kommt vielmehr sanft und subtil daher. Statt von «Fünfjahresplänen» zu schwadronieren, spricht er lieber vornehm von «Pfaden», die der Staat der Wirtschaft weisen müsse. Statt von der Weltrevolution zu träumen, strebt er lieber die Weiterentwicklung der deutschen Wirtschaftsordnung hin zu einer «sozial-ökologischen Marktwirtschaft» an. Doch der Kern seiner Politik bleibt unverkennbar: Intervention, Regulierung, Subvention – die unheilige Dreifaltigkeit der Planwirtschaft. Doch auch die Habecksche Idee von einem dritten System, das gleich weit vom Sozialismus wie vom Kapitalismus entfernt ist und die Vorteile beider vereint, während es ihre Nachteile vermeidet, ist alles andere als neu. Der österreichische Ökonom Ludwig von Mises hat sie als das entlarvt, was sie ist: als «reinen Unsinn» nämlich."
900c2970-9450-4450-a4a9-96b843990337,2024-10-01 09:11:18+00:00,"Berlin, 01. Oktober 2024. „Der Wiederaufstieg der deutschen Wirtschaft gelingt nur, wenn wir auch endlich den Bürokratie-Ballast hinter uns lassen. Weisen wir die Beamtenhegemonie in ihre Schranken. Die erste Hürde ist geschafft, die nächsten müssen jetzt schnell genommen werden. Bestehende Ausnahmen bei der „One in, one out“-Regelung müssen abgeschafft werden. Und es muss ein quantifizierbares Abbauziel beim Erfüllungsaufwand gesetzt werden. Wir appellieren an die Politik: Weg mit den vielen Zetteln. Nehmen Sie die Vorschläge des Normenkontrollrats sowie der Wirtschaft ernst.“"
47643e6e-1d2c-458f-bc5d-7adf14d9ba92,2024-10-01 15:18:00+00:00,"Startseite Politik Gaza: Die Wirtschaft am Abgrund Von: Stephan Kaufmann Der Wiederaufbau von Gaza wird Jahrzehnte dauern und Milliarden kosten. Alle Infrastruktur muss praktisch von Null aufgebaut werden. Israel zahlt einen hohen ökonomischen Preis für die Konflikte im Nahen Osten. Das Haushaltsdefizit steigt immer höher, die Wirtschaftsleistung wächst kaum noch, Ratingagenturen stufen die Kreditwürdigkeit des Landes herunter. Die ökonomischen Schäden sind jedoch nichts im Vergleich zu jenen in den palästinensischen Gebieten. Die Wirtschaft des Gaza-Streifens ist quasi ausgelöscht, die des Westjordanlandes im freien Fall. Sollte es je zu einem Friedensschluss kommen, ist völlig unklar, wovon die Palästinenser:innen einst leben sollen – und wer für den jahrzehntelangen Wiederaufbau zahlen wird. Laut israelischen Regierungsangaben rechnet man damit, dass die Kosten des laufenden Krieges sich bis Ende 2025 auf rund 66 Milliarden Dollar belaufen werden, das entspricht zwölf Prozent des Bruttoinlandsprodukts (BIP) Israels. Diese Berechnung beinhaltet allerdings nicht die sich anbahnende Ausweitung der Kämpfe gegen die Hisbollah im Libanon. Um den Krieg zu finanzieren und die Wirtschaft zu stützen, macht die israelische Regierung immer mehr Schulden. Die Ratingagentur Fitch prognostiziert für dieses Jahr ein Haushaltsdefizit von fast acht Prozent des BIP, 2023 waren es 4,1 Prozent. Insgesamt aber scheint es, als könne sich Tel Aviv die Konflikte ökonomisch leisten: Die Schuldenquote ist mit 70 Prozent des BIP moderat. Der Zins, den die Regierung auf zehnjährige Anleihen zahlen muss, ist zwar auf 4,9 Prozent gestiegen, liegt damit aber immer noch unter den Werten von Ländern wie Chile oder Polen. Laut Finanzministerium dürfte die Wirtschaftsleistung Israels dieses Jahr noch um rund ein Prozent wachsen, nächstes Jahr sogar wieder um 4,4 Prozent. Katastrophal ist hingegen die Lage in den palästinensischen Gebieten. Das zeigt ein Bericht der Weltbank vom September 2024. Zwar fasst die Weltbank diese Schäden in gängige ökonomische Indikatoren wie BIP, Arbeitslosigkeit oder Armutsquote. Tatsächlich aber kann von „Wirtschaft“ in Palästina nicht mehr die Rede sein, im Gaza-Streifen ist die ökonomische Basis untergegangen. Das BIP der gesamten palästinensischen Gebiete schrumpfte im ersten Quartal 2024 um über ein Drittel – einem Rückgang von 25 Prozent im Westjordanland stand der Quasi-Zusammenbruch der Wirtschaft des Gaza-Streifens gegenüber. Das betraf auch den Agrarsektor. Er beschäftigte 2020 offiziell nur rund 13 Prozent der Arbeitskräfte in Gaza, zählt man die informellen Jobs dazu, hingen jedoch rund 90 Prozent an der Landwirtschaft. Laut Weltbank ist inzwischen allerdings der Ertrag von 63 Prozent aller Anbauflächen gesunken. Die Folge: Für fast zwei Millionen Menschen in Gaza ist die Ernährung nicht mehr gesichert, 350 000 Menschen – oder 15 Prozent der Bevölkerung – haben so gut wie keinen Zugang zu Nahrungsmitteln mehr. 95 Prozent der Haushalte schränken ihre Nahrungsaufnahme ein, zwei von drei Haushalten nehmen nur noch eine Mahlzeit pro Tag zu sich, und „90 Prozent der Kinder unter zwei Jahren leiden unter extremer Nahrungsmittelarmut“, so die Weltbank. Auf Grund des nahezu vollständigen Stillstands des Wirtschaftslebens sind die meisten Haushalte in Gaza ohne jede Einkommensquelle. Die meisten Unternehmen sind beschädigt oder zerstört, die Belegschaften sind auf der Flucht. Die verbleibende wirtschaftliche Aktivität findet im informellen Sektor statt: Lebenswichtige Güter werden auf dem Schwarzmarkt verkauft, wo sich die Anbieter – insbesondere im Transportgewerbe – die katastrophale Situation zu Nutze machen, um die Preise zu erhöhen. Die Kosten für Basisgüter lagen im August in Gaza um 250 Prozent über dem Stand ein Jahr zuvor. Den Menschen mangelt es allerdings nicht nur an Geld. Gaza ist schlicht unbewohnbar geworden. Das Bildungssystem ist kollabiert, seit Oktober 2023 erhält keines der 625 000 Schulkinder mehr Unterricht. Laut Schätzungen sind etwa 95 Prozent aller Schulen zerstört oder beschädigt. Das gleiche im Gesundheitssystem: Die Zerstörung der Wasser- und Energieversorgung sowie ein Mangel an Generatoren haben 80 Prozent der Krankenhäuser zur Grundversorgung funktionsunfähig gemacht. Von ehemals 3500 ist die Zahl sämtlicher Krankenhausbetten auf 1500 geschrumpft – und das angesichts von mindestens 30 000 schwer Verwundeten durch die Kämpfe. Ein eventueller Wiederaufbau von Gaza würde eine komplette Erneuerung der Infrastruktur bedeuten. „Was wir in Gaza sehen, haben wir in der ganzen Geschichte des Städtewesens noch nicht gesehen“, sagte Mark Jarzombek, Architekturprofessor am Massachusetts Institute von Technology, der Finanzagentur Bloomberg. Jarzombek hat die Geschichte des Wiederaufbaus nach dem Zweiten Weltkrieg studiert. „In Gaza ist nicht nur die physische Infrastruktur zerstört, sondern die grundlegenden Institutionen einer Gesellschaft.“ Allein die Beseitigung der Trümmer würde viele Jahre dauern. „Über Generationen“, so Jarzombek, werde Gaza mit dem Wiederaufbau kämpfen – wenn er überhaupt in Angriff genommen wird."
eeafbf70-0fac-4b06-8070-9c2115a806af,2024-10-01 16:02:00+00:00,"Startseite Wirtschaft OPEC-Land will mehr Öl fördern – Und könnte Russlands Wirtschaft damit schaden Von: Lars-Eric Nievelstein Saudi-Arabien beabsichtigt, seine Ölproduktion zu intensivieren. Dies könnte erhebliche Konsequenzen für Russlands Wirtschaft mit sich bringen. Riad – Die Einnahmen aus Öl und Gas sind mit die wichtigsten Treiber für Russlands Wirtschaft. Wer diese verringert, wie es zum Beispiel die G7-Staaten mit dem Ölpreisdeckel vorhatten, greift indirekt die Kriegskasse des russischen Präsidenten Wladimir Putin an. Ein neuer Schritt aus Saudi-Arabien könnte genau das bewirken. Saudi-Arabien plant höhere Ölproduktion – und könnte Russlands Wirtschaft schaden Saudi-Arabien will Medienberichten zufolge die Ölproduktion erhöhen. Offenbar ist das Land, eine der wichtigsten Ölfördernationen weltweit, bereit, das Ziel von 100 US-Dollar pro Barrel Crude-Öl aufzugeben. Laut der Financial Times deutet das darauf hin, dass Saudi-Arabien niedrigere Ölpreise akzeptieren würde. Die Entscheidung geht direkt gegen eine Entscheidung von OPEC+-Mitgliedern, die noch Anfang September zugestimmt hatten, die Produktion eher zu senken anstatt zu erhöhen, um die Preise hochzuhalten. Früher im September war der Ölpreis für die Marke Brent Crude Rohöl unter 70 US-Dollar gefallen – so niedrig war er seit Dezember 2021 nicht mehr gewesen. Die Ölproduktion soll ab dem 1. Dezember 2024 steigen. Wie das Nachrichtenportal Newsweek unter Berufung auf nicht näher genannte Experten berichtete, soll dieser Schritt Saudi-Arabiens direkt der russischen Wirtschaft schaden. Eine höhere Ölproduktion und die niedrigeren Preise sollen Russlands Wirtschaft „strapazieren“, während das Land immer noch in der Ukraine Krieg führt. Die ersten Auswirkungen sind bereits ersichtlich: Wie die Nachrichtenagentur Reuters berichtete, fielen die Ölpreise am gestrigen Donnerstag (26. September) bereits um mehr als drei Prozent. Russlands Wirtschaft braucht Öl-Einnahmen – EU will „Gewinne noch härter treffen“ Für Russland sind die Ölpreise einer der wichtigsten wirtschaftlichen Faktoren. Laut dem Observatory of Economic Complexity (OEC) machten Exporte von Crude Petroleum noch im Jahr 2022 etwa 27,3 Prozent aller Exporte des Landes aus. Raffiniertes Petroleum hatte einen Anteil von fast 14 Prozent. Die wichtigsten Abnehmer für russisches Öl waren im Juni 2024 China, Indien und einige verbleibende EU-Länder. Um Russlands Wirtschaft zu schwächen, ist das Absenken der Ölpreise ein dementsprechend starkes Instrument. Aus genau diesem Grund haben die westlichen Verbündeten der Ukraine dies in den eingesetzten wirtschaftlichen Sanktionen berücksichtigt und einen Preisdeckel auf russische Öl-Exporte gelegt. Russisches Öl darf, um im Westen gehandelt zu werden, maximal 60 US-Dollar pro Barrel kosten. Im Dezember 2022 hatte EU-Kommissionspräsidentin Ursula von der Leyen noch angekündigt, diese Grenze flexibel halten zu wollen. „Die G7 und alle EU-Mitgliedstaaten haben sich dazu entschieden, Russlands Gewinne noch härter zu treffen und seine Fähigkeit, in der Ukraine Krieg zu führen, weiter zu beschränken. Dies wird uns weiterhin dabei helfen, die weltweiten Energiepreise zu stabilisieren. Davon profitieren alle Länder rund um den Globus, die aktuell mit zu hohen Ölpreisen konfrontiert sind“, erklärte von der Leyen damals. 40 Dollar pro Barrel möglich – sorgt Saudi-Arabien für einen Preiskampf? Dabei stellt sich die Frage: Wie tief kann der Ölpreis nun fallen? Laut dem Analysten Tamas Varga handelt es sich bei dem Schritt Saudi-Arabiens lediglich um eine Rücknahme einer vorher beschlossenen Produktionskürzung. Pro Monat soll durch Saudi-Arabiens Produktionsplus ein zusätzliches Rohölangebot von rund 180.000 Barrel pro Tag entstehen. „Zweifellos wird es das globale Ölgleichgewicht lockern, aber gleichzeitig wird es die freien Produktionskapazitäten der OPEC verringern“, sagte Varga gegenüber Reuters. „Es wird höchstwahrscheinlich im Jahr 2025 zu einem Anstieg der Lagerbestände führen und die Preise unter moderatem Druck halten.“ Für viel wichtiger aber hält der Analyst die Möglichkeit eines Angebotskriegs, den Saudi-Arabiens Schritt ankündigen könnte. Sollte es zu einem solchen kommen, geht er von einem „schmerzhaften Einbruch“ aus. Der Barrel-Preis könnte auf bis zu 40 US-Dollar sinken – was den Preisdeckel der G7 sogar noch deutlich unterbieten würde. Russlands Einnahmen aus Öl waren im Sommer zurückgegangen. Das Centre for Research on Energy and Clean Air ging von einem Rückgang der Exporteinnahmen aus Rohöl um fünf Prozent aus, auf 664 Millionen Euro pro Tag. Laut dem Institut brauche es einen niedrigeren Preisdeckel für Öl, um Russlands Wirtschaft weiter zu schwächen. (Laernie mit Material von Reuters)"
