435cf913-d679-4324-9b0d-1af62053b462,2024-07-09 09:58:00+00:00,"Die Geschichte schien perfekt: Jonas Andrulis, ehemaliger Apple-Manager und KI-Experte, baut in Deutschland an der großen Hoffnung für generative Künstliche Intelligenz, an einem europäischen Champion, der es mit den dominanten US-Playern aufnehmen kann. Sicher, verlässlich, leistungsstark. Ein Ausrufezeichen setzte die Firma, als sie Ende des vergangenen Jahres eine Finanzierungsrunde über 500 Mio. Dollar verkündete, eingesammelt beim Who’s who der deutschen Wirtschaft: Beteiligt waren unter anderem Lidl-Eigentümer Dieter Schwarz über sein neu gegründetes KI-Zentrum Ipai, der Softwarekonzern SAP sowie der Industriegigant Bosch. Das passte perfekt zu Andrulis’ Story: ein deutscher KI-Herausforderer, eng verdrahtet in die deutsche Wirtschaft, finanziert mit deutschem Kapital. Es gibt nur einen Haken bei der Geschichte: Eine Finanzierung über 500 Mio. Dollar ist so nie geflossen. Stattdessen erhielt das Unternehmen deutlich weniger Kapital als die halbe Milliarde, die Aleph Alpha Öffentlichkeit und Medien glauben ließ. Interne Unterlagen, die Capital vorliegen, belegen, dass in der Finanzierungsrunde etwas mehr als 100 Mio. Euro in das Start-up gesteckt wurden. Das geht etwa aus dem bislang unveröffentlichten Jahresabschluss 2023 hervor. Demnach befanden sich zum Jahresende 2023 – kurz nach der Finanzierungsrunde – rund 108 Mio. Euro auf dem Konto des Start-ups, eine Erhöhung von 102 Mio. Euro im Vergleich zum Vorjahr. In der Bilanz lassen sich auch sonst keine weiteren Spuren des restlichen Geldes finden. Capital-Recherchen erhärten Verdacht Laut einer Präsentation für Investoren der betreffenden Finanzierungsrunde, die Capital ebenfalls vorliegt, war Aleph Alpha ohnehin nur auf der Suche nach 100 Mio. Dollar. Erste Zweifel an dem tollkühnen Announcement hatte der Blogger Thomas Knüwer Ende Juni geäußert. Die Capital-Recherchen erhärten den Verdacht nun. Auf Anfrage will sich das Unternehmen nicht konkret zu der offensichtlichen Diskrepanz äußern. Stattdessen verweist ein Firmensprecher auf zwei Zeitungsartikel, die „zu den Besonderheiten und der Zusammenstellung der Finanzierungsrunde“ Auskunft gäben: Zum einen ist das ein „Handelsblatt“-Text aus dem vergangenen Sommer, der über eine Zusammenarbeit von Aleph Alpha mit dem Heilbronner Ipai-Zentrum berichtete und in dem es über die Finanzierungsvorhaben des Ipai hieß: „Über die nächsten zehn Jahre sollen mehr als 300 Mio. Euro investiert werden, die Aleph Alpha indirekt zugutekommen werden.“ Davon könnten allerdings auch andere Firmen profitieren, „da alle gemeinsamen Forschungsergebnisse offengelegt werden sollen“. Zum anderen ist das ein Artikel aus der britischen „Financial Times“ über die eigentliche Finanzierungsrunde im November, in dem es schon damals hieß, nur rund ein Viertel des Geldes sei eine Eigenkapitalbeteiligung – der Rest setze sich „aus Forschungszuschüssen und Zusagen für die gemeinsame Geschäftsentwicklung zusammen, die die Aktionäre nicht verwässern werden“, schrieb die Zeitung unter Berufung auf Personen aus dem Firmenumfeld. Es war also schon damals zumindest im Ansatz bekannt, dass es beim großen Aleph-Alpha-Funding nie wirklich um 500 Mio. Dollar an frischem Kapital ging. Trotzdem verbreitete die Firma das Narrativ der halben Milliarde. „Großer PR-Stunt“ Unter Start-ups, insbesondere im boomenden KI-Bereich, ist es nicht unüblich, das eigene Funding etwas größer darzustellen – etwa, wenn Rechenpower gegen Anteile getauscht werden. Das Training der eigenen Sprachmodelle ist extrem kostspielig, dafür benötigen die KI-Anbieter Rechenleistung, die sie einkaufen müssen – oder im Tausch gegen Anteile bekommen. Im Fall von Aleph Alpha wurde allerdings offenbar sehr großzügig gerechnet, wie das Beispiel mit der Ipai-Kooperation zeigt. „Man wollte hier dem Anschein nach unbedingt zeigen, dass man auch in Deutschland KI-Megarunden zusammenbringt“, sagt Tech-Experte Philipp Klöckner darüber. Für „einen großen PR-Stunt“ habe die Firma offenbar „sämtliche Finanzmittel, Umsatz- und Lizenzzusagen, Leistungsversprechen und sonstige Förderungen aufaddiert“. Damit, so Klöckner, habe man „vor allem das genaue Gegenteil bewiesen: Nämlich dass es nicht möglich ist, in Deutschland derlei Mittel zu mobilisieren“. Der Aleph-Alpha-Chef beharrte dabei noch Anfang des Jahres auf den offiziellen Angaben zur 500-Millionen-Runde: „Das Geld wird komplett fließen und ist auch nicht durch zum Beispiel Rechenleistung oder Ähnliches eingeschränkt oder künstlich großgerechnet“, sagte Andrulis der „Frankfurter Allgemeinen Zeitung“. „Aber wir haben natürlich auch nicht alles am Tag null auf dem Konto.“ Von dieser Aussage scheint Aleph Alpha nun offenbar Abstand zu nehmen, wie die Reaktion des Sprechers zeigt. Umsatzziele weit verfehlt Mit dem aufgeblasenen Announcement hat die Firma den eigenen Erfolgsdruck unterdessen selbst hochgeschraubt – und muss sich nun daran auch messen lassen. Aktuell, so scheint es, wird das zum Problem. Wie mehrere Medien berichten, sind viele Anwender mit der Qualität des Aleph-Alpha-Sprachmodells Luminous überhaupt nicht zufrieden. Das schlägt sich offenbar auch in den Geschäftszahlen nieder: Wie interne Unterlagen zeigen, visierte das Unternehmen Anfang 2023 für das laufende Jahr einen Umsatz von 6 Mio. Dollar (5,5 Mio. Euro) an, für 2024 prognostiziert die Firma 20 Mio. Dollar (18,5 Mio. Euro). Tatsächlich knackte Aleph Alpha ausweislich des Jahresabschlusses im vergangenen Jahr nicht einmal die Grenze von 1 Mio Euro, bei rund 18,9 Mio. Euro Verlust. Dabei setzt Aleph Alpha – im Gegensatz zu OpenAI und dessen frei zugänglichem ChatGPT-Produkt – ausschließlich auf zahlende Großkunden. Nun liegen alle Erwartungen auf der Präsentation eines neuen Sprachmodells, das Aleph Alpha seit Längerem angekündigt hat. Zusätzlich arbeitet das Unternehmen an einem Umbau des Geschäftsmodells: Seit Kurzem will man neben der eigenen KI namens Luminous auch Sprachmodelle anderer Anbieter anbinden. Update 9. Juli, 19.00 Uhr: Nach Veröffentlichung des Artikels hat ein Sprecher von Aleph Alpha ein Statement nachgereicht. Wir veröffentlichen es zu Transparenz hier in voller Länge: ""Wie bereits in den führenden europäischen Wirtschaftsmedien Handelsblatt und Financial Times berichtetet und in der Pressemitteilung vom 06. November 2023 erläutert, handelt es sich um eine strukturierte Finanzierungsrunde, wobei sich das Gesamtinvestment von über 500 Millionen US-Dollar aus Mitteln zur eigenen Unternehmensentwicklung von Aleph Alpha, Investitionen in Research zur (Weiter-)Entwicklung der Modelle und die gemeinsame Geschäftsentwicklung mit den Investoren zusammensetzt. Die drei Komponenten sind folgendermaßen strukturiert: Erstens die Equity Finanzierung in Höhe von 110 Millionen Euro, zweitens die Forschungsfinanzierung zur Förderung von Forschung und Entwicklung der Aleph Alpha Modelle in Höhe von 300 Millionen Euro und drittens eine Komponente in Form von Auftragszusagen in Höhe von 60 Millionen Euro. Der gesamte Investitionsumfang der Finanzierungsrunde belief sich auf 470 Millionen Euro, was umgerechnet zum Tag des Signings mehr als 500 Millionen US-Dollar entsprach. Um die Zusammenarbeit mit dem Innovation Park Artificial Intelligence (IPAI) zu vertiefen wurde die Aleph Alpha Research als neue Gesellschaft für anwendungsorientierte KI-Forschung und Entwicklung gegründet, die von Samuel Weinbach und Dr. Yasser Jadidi fachlich geleitet wird. Weinbach und Jadidi werden zukünftig einen starken Fokus auf die Zusammenarbeit mit forschungsstarken Universitäten setzen. Die 300 Millionen Euro fließen in voller Höhe in die Forschungsarbeit und das Modelltraining der Aleph Alpha Research, sind an keine Bedingungen geknüpft und stehen niemandem sonst zur Verfügung. Die Aleph Alpha Modelle werden in dieser Gesellschaft weiterentwickelt und an die Anwendungsbereiche angepasst - dementsprechend werden die Gesamtzuwendungen sukzessive fließen, da verschiedene Entwicklungsstufen vorgesehen sind."""
5f1312d1-7251-4aa1-9970-7af9aee19a86,2024-07-09 10:59:00+00:00,"Die Aktie des deutschen Softwarekonzerns SAP hat kürzlich ein Allzeithoch erreicht. Für weitere Kursanstiege bei den Walldorfern könnten jetzt die Analysten von UBS und JPMorgan sorgen. Die Schweizer Bank UBS erhöhte sogar das Kursziel. UBS-Analyst Michael Briest hob das Kursziel für die SAP-Aktie von 191 auf 222 Euro an und behielt die Bewertung auf „Buy“ bei. Trotz allgemeiner wirtschaftlicher Unsicherheiten sieht Briest bei SAP gut prognostizierbare Gewinne. Dies werde durch die starke Nachfrage nach Migrationsservices, die fortlaufenden Wartungsverträge und die robusten Cloud-Wachstumsprognosen untermauert. Für das zweite Quartal erwartet Briest keine großen Überraschungen, wobei das Wachstum der Cloud-Einnahmen voraussichtlich konstant bei 25 Prozent liegen werde. Er betont jedoch, dass außerordentliche Posten die Ergebnisse ""verzerren"" könnten. Auch der gestiegene Fokus auf Kapitaleffizienz und die bemerkenswerten Fortschritte bei der Cash-Conversion seien weitere Gründe für Optimismus – insbesondere im Hinblick auf das Free-Cash-Flow-Ziel von acht Milliarden Euro für 2025. Auch die US-Bank JPMorgan ist optimistisch und bewertet SAP weiterhin mit ""Overweight"" und einem Kursziel von 205 Euro. Laut Analyst Toby Ogg bleibe SAP unter den europäischen Software- und IT-Unternehmen seine erste Wahl. Die Walldorfer böten eine überzeugende Kombination aus beschleunigtem Umsatzwachstum, dessen Potenzial noch unterschätzt werde, sowie einer Verbesserung der Margen. Mit Material von dpa-AFX"
245c7dfd-e723-40cb-ae66-52ea1bc37019,2024-07-10 07:05:00+00:00,"Der geplante Milliardendeal zwischen Oracle und dem KI-Startup xAI von Elon Musk (53) ist geplatzt. Der xAI- und Tesla-Chef Musk erklärte am Dienstag auf seinem Kurznachrichtendienst X, man werde nun selbst ein Datenzentrum mit 100.000 Prozessoren des Typs H100 von Nvidia bauen. Zuvor hatte der Branchendienst „The Information“ berichtet, die Gespräche über den Deal mit einem potenziellen Wert von zehn Milliarden US-Dollar (9,24 Milliarden Euro) seien beendet worden. Unter anderem habe Oracle die von Musk verlangte Bauzeit als unrealistisch betrachtet, hieß es unter Berufung auf mehrere an den Verhandlungen beteiligte Personen. Zudem habe der SAP-Konkurrent Bedenken zur Stromversorgung geäußert. Musk plant „mächtigstes Trainings-Cluster der Welt“ Das Geschäft sollte eine bestehende Abmachung erweitern, bei der xAI Nvidia-Chips für die künstliche Intelligenz (KI) von dem Cloud-Anbieter mietet. Musk schrieb auf X jedoch, xAI müsse schneller sein als jedes andere KI-Unternehmen, um im Wettbewerb bestehen zu können. „Wenn unser Schicksal davon abhängt, mit Abstand der Schnellste zu sein, müssen wir das Lenkrad selbst in die Hand nehmen, statt auf dem Rücksitz zu sitzen.“ Eine Oracle-Stellungnahme lag zunächst nicht vor. Gegenwärtig bietet xAI den Chatbot Grok an, eine generative KI, die damit grundsätzlich die gleiche Technologie wie ChatGPT des Microsoft-Partners OpenAI nutzt. Musk erklärte nun, der Nachfolger Grok 2 sei mit 24.000 von Oracle gemieteten H100-Chips trainiert worden und dürfte vermutlich kommenden Monat veröffentlicht werden. Das neue System mit 100.000 Stück der H100 werde „der mit großem Abstand mächtigste Trainings-Cluster der Welt“, schrieb Musk weiter. Der Chip ist das Flaggschiff von Nvidia und stammt aus dem Jahr 2022. Insbesondere mit ihm hat der US-Konzern im vergangenen Jahr einen Marktanteil von 80 Prozent erreicht."
4564ad40-e4d8-444a-a829-ef7555b509bc,2024-07-10 17:10:16+00:00,"Die Spekulationen um die Zukunft von AVM sind beendet: Mit Imker Capital Partners mit Sitz in London übernimmt ein europäisches Family Office den deutschen Netzwerkanbieter. Das europäische Family Office Imker Capital Partners aus London beteiligt sich mehrheitlich an dem Berliner Unternehmen. Imker Capital Partners wird von prominenten Persönlichkeiten aus der Wirtschaft, darunter der Niederländer Teun van Rappard, unterstützt. Van Rappards Vater, Rolly van Rappard, ist ein Mitbegründer des bekannten Private-Equity-Unternehmens CVC. Fritzbox-Hersteller gilt als deutsches Vorzeigeunternehmen AVM, 1986 von vier Studenten in Berlin gegründet, gilt als Vorzeigeunternehmen der deutschen IT-Branche. Es hat sich seit jeher auf Eigenentwicklungen spezialisiert und gilt als eine Perle der deutschen IT-Branche. Das Unternehmen, das sich auf Eigenentwicklungen spezialisiert hat und vor allem durch seine „Fritzbox“ bekannt ist, erzielte 2023 mit seinen 890 Mitarbeitenden einen Umsatz von 580 Mio. €. Branchenexperten schätzen den Unternehmenswert von AVM auf bis zu 1 Mrd. €. Nun hat AVM den Generationswechsel für das Unternehmen geregelt, heißt es in einer Mitteilung. Die Gründer und geschäftsführenden Gesellschafter Johannes Nill, Peter Faxel und Ulrich Müller-Albring bleiben Minderheitsgesellschafter und Beiräte im Unternehmen. Imker Capital Partners: Ein gut vernetzter Finanzinvestor Imker Capital Partners mit Hauptsitz in London ist über das luxemburgische Unternehmen Rucio auch an SAP Fioneer beteiligt. Teun van Rappard, ein prominenter Niederländer, ist einer der Anteilseigner von Imker. Sein Vater, Rolly van Rappard, ist ein Mitbegründer des weltweit agierenden Private-Equity-Unternehmens CVC, das in Deutschland unter anderem an der Parfümeriekette Douglas beteiligt ist und in Europa Investments wie beim maltesischen Buchmacher Tipico tätigt. Teun van Rappard ist ein regelmäßiger Gast auf dem Weltwirtschaftsforum in Davos, bleibt jedoch weitgehend aus der Öffentlichkeit zurückgezogen. AVM-Verkauf zeichnete sich ab Im vergangenen Jahr hatte AVM bestätigt, dass es Zukunftsoptionen prüfe. Seitdem wurde in der Branche spekuliert, wie diese Optionen aussehen werden. Mit dem neuen Investor kann davon ausgegangen werden, dass das in Deutschland sehr erfolgreiche Geschäftsmodell von AVM zumindest vorerst beibehalten wird. AVM-CEO Johannes Nill beschreibt die zukünftigen Pläne des Unternehmens: „Wir sind den Generationswechsel aktiv und systematisch angegangen, um den Erfolg von AVM fortzuschreiben. Wir freuen uns, Imker als neuen Investor zu begrüßen, da sie unsere Vorstellungen zur Zukunft von AVM teilen.“ Das Engagement von Imker sei ein wichtiger Meilenstein in der Geschichte des Unternehmens. AVM plant weiteres Wachstum durch neue Produkte und eine verstärkte Internationalisierung. AVM im Visier des Bundeskartellamts Die Bekanntgabe des Investments erfolgt nur wenige Tage, nachdem das deutsche Bundeskartellamt gegen AVM eine Geldstrafe von 16 Mio. € wegen systematischer vertikaler Preisbindung verhängt hat. Eingeleitet wurde das Verfahren nach einer anonymen Eingabe im Hinweisgebersystem (BKMS) des Bundeskartellamtes und weiteren Hinweisen aus dem Markt mit einer Durchsuchung im Februar 2022. „Wir werfen AVM vor, über Jahre hinweg die freie Preisbildung beim Vertrieb seiner Produkte an Endverbraucherinnen und -verbraucher eingeschränkt zu haben“, sagte Bundeskartellamt-Präsident Andreas Mundt. Durch Abstimmungen mit Elektronikfachhändlern über Anhebungen von Endverbraucherpreisen sei darauf hingewirkt, den Preiswettbewerb gegenüber den Endverbraucherinnen und -verbrauchern einzuschränken."
64240c05-c852-4117-ab98-307a760ce42b,2024-07-12 06:15:00+00:00,"In unserer dreiteiligen Interview-Reihe schildern Johann Zrenner, einer der beiden Unternehmensgründer und geschäftsführender Gesellschafter, sowie Andreas Spangler, Bereichsleiter Innovation, den Aufstieg der IGZ-Gruppe, beschreiben den Markenkern, der Innovation und Bodenständigkeit verbindet. Hasso Plattner hat SAP zum wertvollsten deutschen Konzern gemacht. Jetzt tritt er ab. Was haben Sie als SAP-Ingenieure dem Softwarekonzern zu verdanken – und wie abhängig sind Sie von dessen Entwicklung? Johann Zrenner: Unsere Gründungsidee war, dass ein Kunde, der die SAP-Software, die er schon im Haus für die Buchhaltung und Verwaltung verwendet, auch für die Logistik nutzen kann. Man kann die marktbeherrschende Stellung von SAP in Europa mit der von Microsoft bei der Textverarbeitung vergleichen. Mehr als 98 Prozent der Konzerne und großen mittelständischen Unternehmen verwenden sie. Wir beobachten ständig den Markt, und fühlen uns deshalb sicher. Unser Claim kommt allerdings daher, dass wir anders arbeiten als andere SAP-Beratungshäuser, die sich auf eine reine Beratungstätigkeit beschränken. Wir planen Software mit Ingenieursanspruch wie Maschinenbauer, das ergibt eine völlig andere Qualität. Wir konzipieren sie ingenieursgerecht. Johann Zrenner Witron entwickelt Logistiksysteme für Lebensmittelkonzerne – wo gibt es Berührungspunkte, worin unterscheiden Sie sich? Johann Zrenner: Wir haben nur wenig Berührungspunkte. Witron hat sich entschieden, nicht auf SAP-Standard-Software zu setzen. In Parkstein geht man den Weg, sich mit Individualsoftware absolut auf den Lebensmittelhandel zu spezialisieren. Andreas Spangler: In Kurzform, wir können Logistik und wir können SAP, diese Kompetenz haben wir als erste entwickelt. Was war die Kernidee Ihres Start-ups: Welche Vision hatten Sie von der Entwicklung Ihres Unternehmens? Andreas Spangler: SAP war damals noch nicht so weit, die eigene Software auch für die Logistik zu nutzen. Dieser Mehrwert ist in Zusammenarbeit mit uns entstandenen. Gab es bereits die Nachfrage von Kunden nach dieser Zusatzfunktion? Johann Zrenner: Ja. Und für SAP gab es einen weiteren naheliegenden wirtschaftlichen Grund für die neue Produktentwicklung. Die meisten Firmen hatten bereits eine kaufmännische Software, man suchte nach neuen strategischen Feldern. Logistik war in dieser Situation ein neues, wichtiges Feld. Wir waren 1999 zum richtigen Zeitpunkt da. Wo liegt der große Vorteil, Verwaltungs- und Logistik-Software zu kombinieren? Andreas Spangler: Der Vorteil, mit SAP Standard-Software, die der Kunde bereits im Einsatz hat, auch die Logistik steuern zu können, liegt auf der Hand. Er braucht keine zusätzlichen Programme zu kaufen, und man vermeidet außerdem Schnittstellen-Verluste. Wir waren die ersten, die dieses Potenzial erkannt haben. Als IGZ gegründet wurde, war es erstmals möglich, SAP auch für Logistik zu nutzen. Inzwischen machen das auch andere Anbieter, aber wir sind seit langem Marktführer. Sie schafften es als erstes Unternehmen weltweit, die SAP-Software für Schenker auf kleinen mobilen Stapler- und Handterminals ablaufen zu lassen. Können Sie an diesem Beispiel den Mehrwert für den Kunden beschreiben? Andreas Spangler: Vor 30 Jahren ist ein Lagerarbeiter mit einer Papierliste durch das Lager gelaufen. Er hat auf seiner Liste händisch mit einem Stift angekreuzt, was er aus dem Lager entnommen hat, eine Mitarbeiterin im Büro hat die Angaben auf der Liste anschließend eingegeben. Unser Stapler oder ein Handterminal hat schon in unserem ersten Projekt 1999 bei Schenker angezeigt, welche Waren aufgeladen werden müssen. Dabei wird der Artikel automatisch gescannt und verbucht, womit auch die Restbestände gleich angeglichen werden. Das lief alles über Ihre Software ohne eigene Hardware? Andreas Spangler: Es war die Zeit, ab der man mit Datenverbindungen zu vernünftigen Preisen auf die Systeme der Kunden zugreifen konnte. Wir konnten uns von hier aus auf die Systeme unserer Kunden verbinden, man musste keine teuren Maschinen kaufen. Die Auftragslage war blendend. Die Software-Scheune ist Ihr Markenzeichen: Hatten Sie einen persönlichen Bezug zur Scheune 1.0., die, glaube ich, Architekt Peter Brückner umgebaut hat? Ich bin in Falkenberg geboren. Die landwirtschaftliche Scheune unserer Eltern war die einzige Möglichkeit, schnell Büroraum zu schaffen. Johann Zrenner Johann Zrenner: Mein Vater war damals Bürgermeister. Bei der ersten Scheune war Brückner noch nicht dabei, das war Architekt Emil Lehner. So entstand unser erstes Büro für 25 Mitarbeiter. Andreas Spangler: Die Scheune ist für IGZ das, was die Garage für Bill Gates war. Sie haben Ihre Standortwahl mit der Mentalität der fleißigen, zuverlässigen und gut ausgebildeten Nordoberpfälzer begründet. Inwieweit war die Location für Sie ein Statement, es der Welt zu zeigen, dass Innovation auf Weltniveau in der Steinpfalz möglich ist? Johann Zrenner: Wir wollten Arbeitsplätze in der Region schaffen. Ich hätte mir, als ich nach dem Studium in Regensburg zurückkam, auch gewünscht, solche Perspektiven zu Hause vorzufinden. Damals gab es noch nicht so viele Möglichkeiten. Aber es stimmt, ich finde, die Oberpfälzer werden noch immer unterschätzt. Dabei ist Innovation und Technologieführerschaft unsere DNA. Es ist kein Zufall, dass wir jährlich mit Preisen ausgezeichnet werden. Johann Zrenner Sie sind inzwischen ein innovativer Lernort der OTH: Wie stark profitieren Sie von der Hochschule in puncto Ingenieursausbildung? Andreas Spangler: Mit unserem Know-how konnten wir die OTH-Studiengänge positiv beeinflussen und ein Stück weit an unsere Erfordernisse anpassen, sodass wir ebenfalls profitieren. Johann Zrenner: Wir helfen der Hochschule, eine praxisnahe Ausbildung umzusetzen. Es hilft auch den Studenten, die direkt bei uns starten können. Das ist eine Win-win-Situation. Können Sie alle freien Stellen mit Absolventen aus der Region besetzen? Johann Zrenner: Wir haben 50 Prozent gelernte Informatiker aus Wiesau oder solche, die unsere eigene Ausbildung durchlaufen haben, weil unser Bedarf inzwischen wesentlich höher ist. Die anderen 50 Prozent sind studierte Ingenieure, Informatiker und Mathematiker – darunter auch viele, die in Nürnberg, München oder Regensburg studiert haben und wieder zurück in die Heimat wollen. Wir haben eine Gemeinsamkeit: Ihre Familie hat das Zoigl-Braurecht, unser Verein Bohème hat die sechs Zoigl-Denkmäler an den Standorten der echten Zoiglbrauer gestiftet. Wie passen integrative Zoigl-Kultur, innovative Technologie und ihre Unternehmenskultur zusammen? Johann Zrenner: Im IGZ-Kundenrestaurant wird unser eigener Zoigl ausgeschenkt. Mein Vater war 40 Jahre lang Braumeister. Unsere Kunden lieben den Falkenberger Zoigl. In der innovativen technischen Welt ist das etwas Bodenständiges, mit einer Geschichte dahinter. Wir haben immer noch den Bottich, und die Hausbrauer tragen ihn immer noch aus. Deshalb hat unser Alt-Bürgermeister Herbert Bauer auch darauf bestanden, dass wir als Zoigl-Denkmal die Austräger bekommen … … Falkenberg hat als einziger Standort wegen dessen Beharrlichkeit sogar zwei Skulpturen bekommen … Johann Zrenner: Das stimmt und wir haben uns damals sehr gefreut, dass Norbert Neugirg zu uns kam, und wir mit einem Sponsoring unterstützen konnten. Wie passt diese volkstümliche Tradition zur kühlen Technologie, mit der Sie arbeiten? Johann Zrenner: Auch die Entscheider von Konzernen sind Menschen, die sich mal gerne bei einem Seidl Bier unterhalten. Wenn beim Kunden die Logistik steht, arbeiten wir am Herzen der Industrie – wenn die Bänder bei VW stillstehen, ist das ein Riesenproblem. Ob Bosch, Bayer, Hilti oder Boss, die Führungskräfte kommen immer selbst her und schauen sich den Prozess bei uns an. Wenn wir die Logistik implementieren, ist man einige Zeit verheiratet. Deshalb war es uns immer wichtig, wie wir das Alleinstellungsmerkmal unserer Technologie visualisieren können. Warum bauen wir jetzt Scheunen mit Fachwerk? Die Architektur materialisiert die Werte von IGZ, die Genauigkeit, die Massivität des Materials. Johann Zrenner"
6e7b3530-c437-4165-a0d7-cf1d41dab814,2024-07-14 14:08:03+00:00,"Bei SAP in Walldorf gibt es einen Supermarkt, in dem der Technologiekonzern seinen Kunden vorführt, was er kann. Nimmt man Dosen aus dem Regal, wird dies von Sensoren erfasst – und beim Hinausgehen kann man nichts klauen, weil die Kasse alles sieht. Der Mann, der die Daten sammeln lässt, trägt weiße Sneaker und sitzt gut gelaunt in einem Konferenzsaal um die Ecke. Seit 2019 führt Christian Klein, 44, die Geschäfte bei SAP. Zeit also für ein Gespräch über Selbstkritik, deutsche Versäumnisse in Sachen Digitalisierung und die Frage, was Europa tun muss, damit es zwischen China und den USA technologisch bestehen kann."
77897397-cf7f-4f12-a596-be00b9d43be2,2024-07-17 05:03:27+00:00,"Deutschlands wertvollstes Unternehmen, die Software-Schmiede SAP, plant massive Änderungen bei den Home-Office-Regeln, wie die „Bild“-Zeitung berichtet. Rückkehr ins Büro und neue Gehaltsmodelle Danach sollen ab dem Jahr 2025 die SAP-Mitarbeiter für Leistung und Teamfähigkeit bewertet werden. Laut „Bild“ wird sich die Bewertung in der Entlohnung niederschlagen. Vorstandschef Christian Klein fordert, dass die Mitarbeiter mindestens drei Tage pro Woche im Büro arbeiten müssen. Bisher haben sie die Möglichkeit, komplett von zu Hause aus zu arbeiten. Kritik soll Leitung von SAP verbessern - und die der Mitarbeiter Klein betont in dem Bericht die Wichtigkeit von offener Kritik: „Es geht mir um Offenheit, jedem Mitarbeiter zu sagen, wie er besser werden kann.“ Klein sei wichtig, dass sich jeder Mitarbeiter durch Feedback weiterentwickeln kann. Die geplanten Änderungen sorgten bereits für Streit unter der Belegschaft. Das gelte besonders für das heikle Thema Homeoffice, berichtet „Bild“ weiter. Doch SAP-Chef beziehe klar Stellung: „Man könnte beim Homeoffice bleiben, gleiche Gehälter zahlen, auf Feedback an Mitarbeiter verzichten. Aber davon hätte ich nichts – und auch SAP nicht“, stellt Klein in dem Bericht klar. Ende 2023 beschäftigte SAP weltweit 107.602 Mitarbeiter, davon 25.300 in Deutschland."
