d5a2e05c-1fd6-497c-abc0-0d2da9cf41f5,2023-08-14 09:44:46+00:00,"40 Dax-Konzerne Überraschende Zahlen: So viel verdienen die Bosse von Deutschlands Top-Unternehmen! DAX-Vorstände verdienen im Jahr 2022 weniger Die „DSW-Vorstandsvergütungsstudie 2023“ veröffentlichen jedes Jahr die Vorstandsgehälter der 40 im Deutschen Aktienindex (DAX) vertretenen Unternehmen. Mit dabei auch: Volkswagen, Deutsche Bank, BMW, Deutsche Telekom, SAP – es sind die Schwergewichte der deutschen Wirtschaft. Wie die Studie zeigt, verdienten die Vorstände der 40 Dax-Unternehmen im Jahr 2022 durchschnittlich 3,3 Millionen Euro – und damit 8,4 Prozent weniger als im Vorjahr. Damit verringerte sich der Gehaltsunterschied zu den Beschäftigten der Firmen so stark wie selten zuvor. Da gleichzeitig die Löhne der Beschäftigten der DAX-Unternehmen stiegen, verringerte sich die Gehaltsschere innerhalb der Firmen. Die Vorstände verdienten durchschnittlich das 38-Fache ihrer Mitarbeitenden – statt das 48-Fache wie im Jahr zuvor. Lese-Tipp: Mittleres Gehalt in Deutschland – das ist der Durchschnitt „Der wesentliche Grund für das Gehaltsminus: Viele Vorstände haben ihre festgelegten Ziele nicht erreicht“, sagt Studienleiter Gunther Friedl von der Technischen Universität München (TUM). Entsprechend sanken die variablen Teile ihrer Vergütung: Die an jährliche Ziele gekoppelten Boni fielen 19 Prozent geringer aus. Auch die an längerfristige Kriterien, wie etwa die Aktienkursentwicklung, gekoppelten Zahlungen gingen um 7,7 Prozent zurück. Die Chef-Gehaltstabelle: So viel verdienen Deutschlands Top-Manager Chef-Bezahlung im internationalen Vergleich „Die Zahlen zeigen, dass das Vergütungssystem im Großen und Ganzen funktioniert“, sagt Friedl. „Auch wenn die Entlohnung der Vorstände für die Beschäftigten in weit entfernten Dimensionen spielt, so ist doch klar: Die Unterschiede können schrumpfen – und es kommt heute maßgeblich auf die Leistung an.“ Die Vorstandsvorsitzenden erhielten 2022 im Schnitt 5,1 Millionen Euro. Damit fällt ihr Verdienst im internationalen Vergleich weiterhin niedrig aus. Lese-Tipp: Gehälter im Vergleich: Was verdienen Angestellte in ihren Berufen"
f02d7d0e-9978-4e5c-8e94-a6a21dbd6078,2023-09-01 13:17:03+00:00,"Europas größter Softwarehersteller SAP hat einen neuen Chef für seine Geschäfte rund um Künstliche Intelligenz (KI) beim US-Softwareriesen Microsoft gefunden. Walter Sun übernehme zum 1. September den Posten bei den Walldorfern, hieß es am Freitag von SAP. Er trete die Nachfolge von Feiyu Xu an, die im Sommer das Unternehmen verlassen hatte. „Ich glaube, dass wir bei SAP die Gelegenheit haben, Betriebsabläufe in Firmen grundlegend zu verändern, indem wir KI in viel größerem Umfang in der Geschäftspraxis einsetzen“, sagte Sun, der zuletzt für KI-Funktionen der Microsoft-Bürosoftware verantwortlich war. Diese basieren auf dem Programm ChatGPT der Microsoft-Beteiligung OpenAI. Weiteren Angaben zufolge war Sun unter anderem auch außerordentlicher Professor an der Seattle University. „Mit ihm konnten wir einen führenden Manager im Hinblick auf Unternehmens-KI für uns gewinnen“, sagte SAP-Produktentwicklungsvorstand Thomas Saueressig. Sun war den Angaben zufolge seit 2005 bei Microsoft. Der Softwareriese hat seine zögerliche Haltung zur Künstlichen Intelligenz aufgegeben und will jetzt an die Spitze der Bewegung. SAP-Chef Christian Klein setzt auf KI als Wachstums- und Gewinntreiber, weil Kunden für diese neuen Funktionen bis zu 30 Prozent Preisaufschläge zahlten. Im Juli verkündete der Konzern, er beteilige sich an der deutschen KI-Hoffnung Aleph Alpha. Im Mai hatte SAP Partnerschaften mit Microsoft, Google und IBM angekündigt. Im Herbst will SAP die neue KI-Strategie samt neuen Angeboten im Detail vorstellen."
8a60144b-f641-44da-bcbb-7df244d2b8a5,2023-09-04 05:31:00+00:00,"Startseite Panorama Neue SAP-Personalchefin kommt von Siemens Energy Gina Vargiu-Breuer wird neue Personalchefin bei SAP. Bei dem Software-Riesen übernimmt die 48-Jährige den Posten von Sabine Bendiek, die den Konzern verlässt. Walldorf - Der Softwarekonzern SAP hat eine neue Personalchefin gefunden. Gina Vargiu-Breuer sei zum 1. Februar 2024 als Chief People Officer und Arbeitsdirektorin in den Vorstand berufen worden, teilte das Dax-Unternehmen in Walldorf mit. Die 48-Jährige kommt vom Energietechnikunternehmen Siemens Energy, wo sie laut Mitteilung den globalen Personalbereich aufgebaut und die Personalstrategie des Konzerns verantwortet hat. Vargiu-Breuer sei für drei Jahre in den Vorstand berufen worden und werde ihren Sitz in der Firmenzentrale in Walldorf haben. Sie ist Nachfolgerin von Sabine Bendiek. Ende März hatte SAP bekannt gegeben, dass Bendiek ihren bis Ende 2023 laufenden Vertrag auf eigenen Wunsch nicht verlängern werde. Bendieks Rolle als Chief Operating Officer übernehme Strategiechef Sebastian Steinhäuser ab nächstem Jahr zusätzlich, hieß es laut Mitteilung. dpa"
24a95b22-74c6-4cdf-be3f-6a75daee5ad3,2023-09-04 07:23:16+00:00,SAP holt Microsoft-Manager als KI-Chef ECOreporter.de
0e691c05-60e4-4e96-bbe0-5f40bd4b7980,2023-09-05 12:00:00+00:00,"Die Abnehmspritze Wegovy des dänischen Pharmakonzerns Novo Nordisk erfreut sich großer Beliebtheit. Der Hype um Wegovy hat Novo Nordisk nun sogar dazu verholfen, das wertvollste Unternehmen Europas zu werden: Das Unternehmen überholte am Dienstag den französischen Luxusgüterriesen LVMH. Novo Nordisk erreichte eine Marktkapitalisierung von umgerechnet 424 Mrd. Dollar – deutlich vor LVMH mit 411 Mrd. Euro. In den letzten Tagen lieferten sich die beiden Unternehmen ein regelrechtes Kopf-an-Kopf-Rennen: Der Börsenwert der Dänen stieg schon am Freitag auf 421 Mrd. Dollar, womit sich Novo Nordisk für zwei Stunden vor LVMH schob, dessen Marktkapitalisierung zur gleichen Zeit 420,97 Mrd. Dollar betrug. Wenig später überholte allerdings LVMH wiederum Novo Nordisk. Nun zementierte das dänische Unternehmen seine Dominanz. Novo Nordisk ist damit aktuell mehr wert als die Dax-Schwergewichte SAP, Siemens, Telekom und Mercedes-Benz zusammen. Abnehmmedikament Wegovy als Kursspritze Die Novo-Nordisk-Aktie hat ihren Preis seit 2020 verdreifacht. Allein im August stieg das Papier um fast 20 Prozent, nachdem eine Studie einen klaren Nutzen seines Adipositas-Medikaments bei Herz-Kreislauf-Erkrankungen aufgezeigt hatte. Nun führt Novo Nordisk sein Abnehmmedikament Wegovy auf dem britischen Markt ein – bislang war es in den USA, Dänemark, Norwegen und seit Ende Juli in Deutschland erhältlich. Die monatlichen Ausgaben für Privatpatienten in Großbritannien werden auf etwa 199 bis 299 Pfund geschätzt. Im vergangenen Jahr hat Novo Nordisk sein Geschäft mit Abnehmspritzen erheblich ausgebaut, vor allem die Nachfrage in den USA war immens. Zeitweise konnten Patienten das Medikament nicht mehr bekommen. Der Umsatz stieg um 26 Prozent auf umgerechnet 24 Mrd. Euro. Damit ist das Unternehmen mittlerweile größer als die Pharmasparte von Bayer. Ein Drittel dieses Umsatzes entfällt auf das Produkt Ozempic. Das ist ein werkstoffgleiche Medikament, welches aber gegen Diabetes verschrieben wird. Wegovy wird speziell gegen Übergewicht verschrieben, hat aber einen deutlich höheren Preis. Was Sie sonst noch über Novo Nordisk wissen sollten"
6ddbfc7c-5f92-4e93-9618-f59fdb0a164b,2023-09-05 12:00:55+00:00,"Entlassungen großer Teile der Belegschaft Der deutsche Spielwarenhersteller Haba aus Bad Robach (HABA FAMILYGROUP) scheint in eine Krise geraten zu sein. Nach bestätigten Informationen gab es zuletzt stärkere Umsatzeinbußen. Um das Unternehmen neu auszurichten und am Markt zu behaupten, wird es Entlassungen geben. Zusätzlich stehen einige Umstrukturierungen an, wie die Unternehmenssprecherin, Ilka Kuntzelmann, Reich der Spiele gegenüber erläuterte. Die Hintergründe für die Situation Die wirtschaftliche Schieflage geht auf verschiedene Ursachen zurück. Einer der Gründe soll eine Umstellung auf SAP gewesen sein, die massive Probleme verursachte. In der Folge sollen Kundenbestellungen im eigenen Online-Shop aus technischen Gründen nicht zügig und verlässlich abgewickelt worden sein. Zuvor hatte das im Familienbesitz stehende Unternehmen bereits das Einstellen von Jako-o angekündigt. Der Online-Shop und Versand führte Kinderkleidung und Spielzeug aus dem eigenen Bestand und gehört zu den Urgesteinen der deutschen Webshops. Die neue Haba-Firmenwebseite ist bereits mit Online-Shop-System unter haba-play.com erreichbar. Die Gestaltung ist etwas anders und könnte ebenfalls zu einer schwächeren Online-Performance beigetragen haben. Ein weiterer Aspekt sind die Inflation und die gestiegenen Material- und Energiekosten. Zumindest die Branche der Gesellschaftsspiele leidet unter dem nach dem Boom der Corona-Zeit schwierigen wirtschaftlichen Umfeld, das ein schnelles Umdenken und eine Kostenminimierung erfordert. Neue Geschäftsführung berufen Wie bisher wird Sabine Habermaass die Inhaberfamilie in der Geschäftsführung vertreten. Zusätzlich sollen Dr. Mario Wilhelm und Stefanie Frieß das Unternehmen aus der Krise führen. Diese ersetzen das bisherige Management, das nach Unternehmensaussagen einige Entscheidungen getroffen hatte, „die sich im Nachhinein als falsch herausgestellt haben.“ Der angestoßene Transformationsprozess beinhaltet eine Foksusierung auf die Kernmarken Haba und Haba Pro. Diese Neuausrichtung der Geschäftsbereiche hat das Ziel, sich entsprechend gestärkt zukunftsfähig den aktuellen Herausforderungen stellen zu können. Entlassungen möglichst „weich“ umsetzen Dabei spielen auch Entlassungen eine Rolle, die speziell für ein Familienunternehmen, das sich der Region verbunden fühlt, ein schwerer Schritt sind. Haba gilt im Kreis Coburg zudem als einer der größten Arbeitgeber. Um der betroffenen Belegschaft den Zugang zu einer neuen Arbeitsstelle zu erleichtern, finden derzeit sogar Job-Börsen mit Unternehmen aus der Region auf dem Firmengelände statt. Wie viele Personen den Job verlieren ist unklar. Nach Medienberichten wie von Der Fränkische Tag könnten im chlimmsten Fall bis zu 650 Stellen betroffen sein. Von Seiten des Unternehmens heißt es gegenüber Reich der Spiele: „Der Transformationsprozess der HABA FAMILYGROUP läuft derzeit ebenso wie die intensiven Gespräche mit dem Betriebsrat. Daher können wir zum aktuellen Zeitpunkt keinerlei Informationen darüber geben, wie viele Mitarbeiterinnen und Mitarbeiter letztlich von einem möglichen Stellenabbau betroffen sein könnten.“ Politik kündigt Unterstützung an Die verantwortlichen Politiker zeigten sich getroffen. Der Coburger Landrat Sebastian Straubel äußerte sich nach Medienberichten mit den Worten: „Der im Raum stehende Stellenabbau ist ein schwerer Schlag für unseren gesamten Wirtschaftsstandort.“ Da Haba eine enorme Bedeutung hat, sicherte der Landkreis bereits Unterstützung zu, indem unter anderem die Möglichkeiten der Wirtschaftsförderung voll ausgeschöpft werden sollen. Dabei spielt auch eine Rolle, dass Haba in der Region produziert und weitere Unternehmen von der Neuausrichtung betroffen sind. Haba ist ein klassisches Familienunternehmen Die stärkste Marke der inhabergeführten Habermaass Family GmbH ist Haba selbst. Das Unternehmen existiert seit 1939 und hat sich seitdem stetig entwickelt. In der Spielwaren- und Gesellschaftsspielbranche gilt Haba als Traditionsunternehmen, das auf hochwertige Materialien setzt. Bei den Kinderspielen ist Obstgarten ein Klassiker. Aber auch neue Titel haben viele Auszeichnungen gewonnen. Darunter gewann das Unternehmen mit Tal der Wikinger, Funkelschatz, Diego Drachenzahn, Der schwarze Pirat und Klondike fünfmal den Titel beim Kinderspiel des Jahres sowie mit Ringel Rangel, Leinen los und Kayanak dreimal den vorher vergebenen Sonderpreis Kinderspiel des Jahres. Damit ist Haba Rekordhalter bei diesen Auszeichnungen. Update: Haba hat Insolvenz angemeldet"
7133d346-00f1-4347-a70c-4d1b85e09930,2023-09-06 06:00:00+00:00,"Zwei Großbaustellen gleich nebeneinander, die am Ende auch noch gemeinsam fertigzustellen sind. Mit dem Projekt A|SAP hat HPE eine Lösung entwickelt, die schnell, einfach und sicher dem Kunden die Cloud ins eigene Haus bringt. E3 sprach mit Timo Graumann, der als Business Development Manager zu einem der Erfinder dieses einfachen und pragmatischen Konzepts zählt. E3: Was bedeutet das neue Projekt für den SAP-Anwender? Timo Graumann: A|SAP ist ein vollständig gemanagter Cloud-Service für den Betrieb von SAP-Workloads, wobei die Infrastruktur an einem Standort nach Wahl des Kunden bereitgestellt wird. Das ausschließlich auf den SAP-Betrieb zugeschnittene Cloud-Service-Angebot basiert auf dem Edge-to-Cloud-HPE-GreenLake-Konzept und nutzt folglich sämtliche Vorteile dieser Cloud-Strategie. E3: Worin liegt der Unterschied zwischen einem Cloud-Service bezogen vom Hyperscaler und HPE GreenLake? Graumann: Mit GreenLake bekommt der Kunde eine Cloud im eigenen Rechenzentrum beziehungsweise an einem von ihm vorgegebenen Standard. Damit behält der Kunde die volle Kontrolle. Er muss nicht die IT-Souveränität und die Hoheit über seine eigenen Daten vergleichbar wie bei der Nutzung von Public Cloud Services vollständig aus der Hand geben. Ein solche Entscheidung kostet viel Zeit für Analyse und Risiko Bewertung und stellt quasi eine Revolution in der IT-Strategie der jeweiligen Firma dar. Teilweise Jahrzehnte lang entwickelte und bewährte IT-Sicherheit und IT-Gouvernance müssen vollständig hinterfragt und neu aufgesetzt werden. Mit A|SAP bekommt der Kunde eine Cloud in sein bestehendes SAP–Umfeld integriert. Also keine Revolution, sondern vielmehr eine kontrollierte Weiterentwicklung bewährter Verfahren und Prozesse, bei der der Kunde das Sagen hat und nicht externe weltweit agierende IT-Großunternehmen. E3: Wer hat den größten Nutzen? Graumann: Alle SAP-Kunden, die den schnellen und einfachen Weg in die Cloud suchen, finden mit A|SAP eine sofort umsetzbare Lösung. Ob zur Migration nach S/4 oder wenn Cloud-Vorteile für den aktuellen SAP-Betrieb genutzt werden sollen, mit A|SAP erhält der Kunde einen hoch standardisierten Infrastruktur-Service oder den um SAP-Basis-Services erweiterten Plattform-Service, PaaS. E3: Was bedeutet standardisiert im Zusammenhang mit A|SAP? Graumann: Auf Basis einer Vielzahl von SAP- und SAP-Hana-In-stallationen haben wir fünf unterschiedlich große Cloud-Service-pakete vordefiniert und bepreist. Hieraus wählt der Kunde nur noch anhand seines aktuellen Sizings seiner SAP-Umgebung aus, welches dieser Pakete er benötigt. Damit sind Leistungsumfang, Servicelevel, Vertragsrahmen sowie der Servicepreis für 60 Monate definiert. Zusätzlich kann das Angebot einfach um Backup erweitert werden. E3: Das klingt nach einer fixen Lösung. Graumann: Ganz und gar nicht. Der Kunde kann zwar jedes A|SAP–Paket so nehmen, wie es von uns designt wurde, muss es aber nicht. Da sich A|SAP aus dem modularen HPE-GreenLake-Konzept zusammensetzt, können sämtliche Komponenten, Betriebsservices und Levels bis hin zum Vertrag selbst individuell angepasst werden. Folglich kann der Kunde neben dem Installationsort auch jede beliebige Modifikation seiner Cloud-Lösung entscheiden. Soll es allerdings besonders schnell gehen, dann bietet sich einfach an, mit der passenden Größe zu starten, schließlich ist dafür alles bereits vorbereitet und für eine schnelle Lieferung eingeplant. E3: Und das wirkt sich auf die Kosten aus? Graumann: Aktuelle Projekte zeigen, dass Einsparungen von mehr als 30 Prozent gegenüber vergleichbaren Public-Cloud-Angeboten möglich sind! So ergibt sich zum Beispiel für eine mittlere Konfiguration der Größe M mit zwei Terabyte für bis zu zwölf Hana–Datenbanken, einem garantierten Verfügbarkeits-SLA von 99,99 Prozent ein Monatspreis von unter 60.000 Euro. E3: Wie reagiert der Markt auf HPE GreenLake beziehungsweise auf die spezifische SAP-Ausprägung? Graumann: Die jüngste IDC-Studie hat HPE GreenLake bei den Cloud-Anbietern bereits auf Platz drei gerankt. Was dem extremen Wachstum geschuldet ist, das wir derzeit in dem Segment verzeichnen. SAP selbst bietet die Logik von A|ASP im Rahmen ihres Rise with SAP an. Das bedeutet nichts anderes: Besteht der Kunde auf eine Bereitstellung der SAP Cloud Services mit Rise im eigenen Rechenzen-trum, kann er HPE GreenLake über SAP ordern. Auch dieser Infrastrukturservice, der in diesem Fall Teil des SAP-Vertrages ist, ist ein standardisierter und vorkonfektionierter HPE-GreenLake-Service. E3: Warum sollen die SAP-Kunden gerade jetzt in die Cloud und warum mit HPE einsteigen? Graumann: Die Frage ist schnell beantwortet. Die S/4-Migrationen binden enorme Personalressourcen, die ohnehin kaum am Markt verfügbar sind; und die Zeit fängt an zu drängen. Cloud Computing kann dabei wenigstens in Teilen eine Lösung sein, auf jeden Fall wird Personal des Kunden von Standard-IT-Aufgaben entlastet. Mit HPE GreenLake, „the cloud that comes to you“, sind die grundsätzlichen Bedenken bezüglich Datenhoheit und IT-Souveränität, die häufig gegen den Einsatz einer Cloud sprechen, von Anfang an -gelöst. Unsere Erfahrungen als Marktführer mit rund 34.000 SAP–Hana-Implementierungen aus über 20.000 Kundenprojekten sind in die Lösung eingeflossen, ebenso können die Kunden auf unsere bekannten Consulting- und Service-Fachkräfte in bewährter Form zurückgreifen. Somit sollte ein schneller und sicherer Einstieg in die Cloud für SAP möglich sein, ohne dass dabei die gesamte IT-Strategie, inklusive der Sicherheitsstandards, hinterfragt und völlig neu aufgesetzt werden muss. E3: Danke für das Gespräch."
