3d14bb55-476d-4156-8c77-0198228fb48f,2024-07-18 06:01:00+00:00,"Lange Zeit mussten sich SAP-Anwender mit Drittanbieter-Werkzeugen helfen, wenn sie die Bereiche Entwicklung und Fertigung effizient miteinander verbinden wollten. Das war mit einigen Nachteilen verbunden: So erhöht sich etwa Komplexität des Systems, wodurch die Fehleranfälligkeit der Prozesse steigen kann. Anwender benötigen Knowhow und müssen sich um die Wartung kümmern. Doch die SAP hat auf ihre Kunden gehört. Mit der Einführung von Production Engineering & Operations (PEO) entstand eine integrierte Software, die die Bereiche Entwicklung und Fertigung verbindet. PEO wurde ursprünglich von SAP für Industriebereiche wie Aerospace & Defence oder den Sondermaschinebau entwickelt – also Bereiche mit hochkomplexen Produkten und einer vergleichsweise langen Durchlaufzeit. Doch auch die diskrete Industrie profitiert von PEO, da die Software Prozesse wie Auftragsmanagement und Produktionssteuerung (Production Order Management & Control), Arbeitsdurchführung (Operations) sowie Rückverfolgung und Qualitätssicherung (Tracking & Genealogy) umfasst. Ganzheitlicher Fertigungsprozess Bislang bot das Kernsystem von SAP keine geeignete Schnittstelle für die Datenübergabe in SAP PP (SAP Production Planning and Control) – weswegen Anwender mit Listen ohne 3D-Modelle hantieren mussten. S/4Hana hingegen ist durch PEO mit der neuen TDMI-Schnittstelle (Team Data Management Interface) ausgestattet. So lassen sich etwa Engineering-Stücklisten mit 3D-Modellen und zusätzlich mit PMI-Daten (Produkt Manufacturing Information) wie Toleranzangaben oder Schweißpunkten anreichern und in das SAP-Kernsystem transferieren. Das ermöglicht granular aufgelöste und komplexe Arbeitsabläufe, die mit 3D-Stücklisten verknüpft sind. Ein integriertes QM-Modul stellt außerdem eine fertigungsbegleitende Prüfung zur Verfügung. Das Modul kann sowohl mit Konstruktionsstücklisten (EBOM), als auch mit allen Arten von Fertigungsstücklisten (MBOM) agieren. Sie werden in PEO einem Change Record zugeordnet, auf dessen Basis sich eine Impact-Analyse (Wirkungsanalyse) durchführen lässt. Sie ist das zentrale Tool zur Analyse, Planung und Ausführung der Änderungen an MBOMs – etwa Arbeitsplänen oder Fertigungsaufträgen und unterstützt so die Fertigung bei der schnellen und effizienten Bestimmung aller Fertigungsobjekte, die potenziell von einer Änderung betroffen sind. So entsteht ein fließender Übergang der Stücklisten aus der Entwicklung in die Produktion mit der Versionierung von EBOMS und MBOMs. Von beiden können unterschiedliche Versionen aktiv sein und in der diskreten Fertigungssteuerung zum Einsatz kommen. Mitarbeiter im Fokus Ein Standard-Prozess beginnt damit, dass aus dem PLM-System eine geänderte oder neue Stückliste für ein Produkt übergeben wird – es wird also die EBOM in eine MBOM umgewandelt. Früher nutzen SAP-Anwender Drittanbieter-Tools für diese Aufgabe – SAP PEO ist dazu ohne Hilfsmittel in der Lage. Die MBOM ist dann die Grundlage für alle folgende Schritte (Maschinen und Assemblierung). Maschinen können theoretisch 24/7 produzieren, der maßgebliche Faktor für dieses Ziel ist aber der Mensch. Er programmiert die Maschine, bedient und überwacht sie, versorgt sie mit neuen Materialien, stellt die Qualität der Teile sicher und assembliert am Ende die Baugruppen. Auch in diesem Bereich unterstützt PEO. Mit der Funktion ‚Vorgangsaktivitäten‘ erhalten Fertigungsplaner ein Werkzeug, um einzelne Produktionsvorgänge des Arbeitsplans in multiplen Aktivitäten darzustellen. Damit lässt sich der Detaillierungsgrad in der Produktion erhöhen. Dabei haben sie, beispielsweise im Vergleich zu den bekannten Untervorgängen aus dem ERP-System, volle Funktionalität. Alle Aspekte eines Arbeitsablaufs wie Komponentenzuordnung, Arbeitsanweisungen, Prüfmerkmale, Fertigungshilfsmittel, Dokumente, Abnahmen, Qualifikationen und Maßnahmenbearbeiter lassen sich so Vorgangsaktivitäten zuordnen. Zuständige Mitarbeiter wissen dadurch zu jeder Zeit, was zu tun ist und können im System jeden Schritt dokumentieren. Dies kann die Basis für künftige Zertifizierungen des Fertigungsprozesses schaffen. Denn PEO stellt durch seine Integration erweiterte Funktionen zur Aufzeichnung von Daten für serialisierte Teile und Chargen sowie die Rückverfolgbarkeit der Produkte und ein detailliertes Produktionsaktionsprotokoll zur Verfügung. Vor allem im Maschinenbau- und Anlagenbau werden die Produkte oft zunächst im Werk fertiggestellt, geprüft und vom Kunden abgenommen. Im Anschluss müssen sie demontiert und zum Kunden transportiert werden, wo sie dann an ihrem endgültigen Standort final montiert werden. Dieser Prozess ist in der Demontage-BOM (DBOM) abgebildet, die sich auch mit PEO verwalten und administrieren lässt. Produktvariation kein Problem Kurzfristige Änderungen von Kunden adressiert PEO mit dem Change Record. Damit lässt sich nicht nur kurzfristig die Fertigung beeinflussen, sondern das Tool ist auch die Basis für eine Impact-Analyse (Wirkungsanalyse). Speziell die App ‚Impact Analysis‘ schließt somit eine Lücke, die bisher in vielen SAP-Projekten identifiziert wurde. Sie unterstützt so die Fertigung bei der schnellen und effizienten Bestimmung aller Fertigungsobjekte, die potenziell von einer Änderung betroffen sind – etwa Arbeitspläne, Stücklisten, Fertigungsaufträge, oder Bestellungen. Ein verknüpftes, integriertes QM-Modul ermöglicht außerdem eine fertigungsbegleitende Prüfung. Die ebenfalls integrierte Change-Record-App ermöglich außerdem Änderungen an MBOMs, etwa Arbeitsplänen oder Fertigungsaufträgen, direkt zu planen und durchzuführen. Damit stellt sie das zentrale Tool zur Analyse, Planung und Ausführung der Änderungen dar. Integriert, aber kostenpflichtig PEO ist ab der Version 1810 fester Bestandteil von S/4Hana und lässt sich über das Customizing aktivieren. Für die Nutzung erhebt SAP Lizenzgebühren. Die 3D-Integration in PEO ist hingegen nicht Teil des Funktionsumfangs von S/4Hana. Um sie zu nutzen, müssen Anwender das ebenfalls kostenpflichtige Werkzeug Visual Enterprise Manufacturing Planner (VEMP) implementieren."
09522a3a-5d77-40ba-917f-67a96aa55414,2024-07-18 08:30:51+00:00,"Performance und Teamfähigkeit: Das sind die beiden Kriterien, anhand derer der Softwarekonzern SAP die Leistung seiner Mitarbeitenden künftig bewertet. Ein erster Test der neuen Feedback-Variante läuft derzeit im Top-Management, 2025 soll dann die ganze Belegschaft in „Performer“, „Achiever“ und „Improver“ eingeteilt werden. Verantwortlich für den Kulturwandel ist SAP-CEO Christian Klein. Gegenüber der Süddeutschen Zeitung hat er jetzt erklärt, was die neue Einteilung ändern soll. Performer, Achiever, Improver: SAP-Chef will mehr kritisches Feedback Geht es nach Klein, sind Gespräche über das Verbesserungspotenzial von Mitarbeitenden bei SAP „ein bisschen zu kurz gekommen in den letzten Jahren“. Auf die konkrete Einordnung der Belegschaft in Performer, Achiever und Improver geht der CEO im Interview nicht weiter ein. Er spricht lieber darüber, dass eine Kultur, in der sich alle „gegenseitig auf die Schulter klopfen“, das Unternehmen nicht weiterbringen würde. Kritische Gespräche seien nicht immer angenehm, so Klein, er selbst habe in der Vergangenheit aber immer wieder davon profitiert: „Wenn mir nicht jemand immer wieder offen gesagt hätte, was ich weniger gut mache, dann würde ich nicht hier sitzen.“ Bisher hat SAP auf einen kontinuierlichen Dialog mit den Mitarbeitenden gesetzt, das Konzept war extern auch als „SAP-Talk“ bekannt. Auf die Frage, ob ihm die letzten Jahre zu „larifari“ gewesen seien, antwortet der Konzernchef wie folgt: „Es gab mal ein Bewertungssystem, das abgeschafft wurde, weil gefühlt irgendwann alle High Performer waren. Wenn jeder High Performer ist und sich niemand mehr traut, offenes Feedback zu geben, ergibt das keinen Sinn. Das ist auch eine kulturelle Frage: Ich werde kritisiert – und damit muss ich umgehen können.“ Der Preis für „richtige Entscheidungen und die Zukunftsfähigkeit von SAP“? Mit Kritik umgehen: Das muss Klein im Zuge der Umstrukturierung selbst immer wieder. Allein in Deutschland sollen 2.6oo Stellen wegfallen, weltweit ist eine Kürzung von 8.000 Arbeitsplätzen geplant. Anfang 2024 hat der Betriebsrat einen offenen Protestbrief gegen die geplante Einführung von Präsenztagen formuliert, rund 2.000 Beschäftigte haben ihn unterzeichnet. „Wir fühlen uns von einem Unternehmen verraten, das uns bis vor kurzem dazu ermutigt hat, von zu Hause zu arbeiten“, hieß es da, und weiter: „Die Prioritäten der Kollegen liegen aktuell nicht auf den Zielen des ersten Quartals, sondern auf der Suche nach einem stabilen Job, in dem sie sich wertgeschätzt und respektiert fühlen.“ Nach der Mitarbeitendenzufriedenheit gefragt, gibt sich Klein im Interview mit der Süddeutschen Zeitung zielorientiert. „Unsere Restrukturierung wird hart“, so der Konzernchef, er müsse aber nun mal abwägen, was das Beste für das Unternehmen sei. „Wenn die Mitarbeiterzufriedenheit kurzfristig abnimmt, dann kann ich trotzdem noch in den Spiegel schauen und sagen: Christian, okay, das ist nicht schön, aber es ist der Preis für richtige Entscheidungen und die Zukunftsfähigkeit von SAP.“"
8bce92aa-c772-42a6-b4ae-e53a4a0cdb87,2024-07-19 07:58:00+00:00,"Zur Ausgabe Artikel 4 / 37 Enfore in der Krise Techstar Marco Börries soll Beschäftigte über Monate nicht bezahlt haben Mit Enfore wollten der deutsche Techpionier Marco Börries und ein Ensemble von Starinvestoren das ganz große Rad drehen und ein „zweites SAP“ erschaffen. Nur läuft es nicht rund. Beschäftigte warten seit Monaten auf ihr Gehalt, Börries vertröstete sie mehrfach. Von Jonas Rest 19.07.2024, 09.58 Uhr • aus manager magazin 8/2024 Sie können den Artikel leider nicht mehr aufrufen. Der Link, der Ihnen geschickt wurde, ist entweder älter als 30 Tage oder der Artikel wurde bereits 10 Mal geöffnet. manager magazin plus Jetzt weiterlesen. Mit dem passenden manager Abo. Einen Monat für € 0,99 testen. Jederzeit kündbar. Ihre Vorteile: manager magazin+ und Harvard Business manager+ im Paket Alle Inhalte von m+ und HBm+ auf der Seite manager-magazin.de und in der manager-Nachrichten-App Der Inhalt der gedruckten Magazine inkl. E-Paper (PDF) Jetzt für € 0,99 testen Ihre Vorteile: Alle Inhalte von m+ auf der Seite manager-magazin.de und in der manager-Nachrichten-App m+-Newsletter mit besonderen Leseempfehlungen Der Inhalt des gedruckten Magazins inkl. E-Paper (PDF) Jetzt für € 0,99 testen Sie sind bereits Digital-Abonnentin oder -Abonnent? Hier anmelden Weiterlesen mit manager+ Immer einen Einblick voraus Ihre Vorteile mit manager+ manager magazin+ in der App Harvard Business manager+ in der App Das manager magazin und den Harvard Business manager lesen als E-Paper in der App Alle Artikel in der manager-App Preis wird geladen... Sie haben bereits ein Digital-Abonnement? manager+ wird über Ihren iTunes-Account abgewickelt und mit Kaufbestätigung bezahlt. 24 Stunden vor Ablauf verlängert sich das Abo automatisch um einen Monat zum Preis von zurzeit 24,99€. In den Einstellungen Ihres iTunes-Accounts können Sie das Abo jederzeit kündigen. Um manager+ außerhalb dieser App zu nutzen, müssen Sie das Abo direkt nach dem Kauf mit einem manager-ID-Konto verknüpfen. Mit dem Kauf akzeptieren Sie unsere Allgemeinen Geschäftsbedingungen und Datenschutzerklärung ."
447e5585-f5dd-470a-84e3-dfcddbfb4cc4,2024-07-20 07:11:00+00:00,"Es klang wie eine Ohrfeige für alle Beschäftigten, die gerne im Homeoffice arbeiten. Der ehemalige Trigema-Geschäftsführer Wolfgang Grupp hatte im vorigen Jahr gesagt: „Wenn einer zu Hause arbeiten kann, ist er unwichtig. Je mehr die Leute studiert haben, desto mehr Homeoffice wollen sie – aber bei mir könnten sie sich dann auch gleich arbeitslos melden, weil sowieso keiner merkt, ob sie arbeiten oder nicht.“ Auch Google holt Mitarbeiter ins Büro SAP-Chef Christian Klein benutzte diese Woche in einem Interview mit der „Süddeutschen Zeitung“ weniger drastische Sätze, doch seine Botschaft war klar: Deutschlands wertvollstes Unternehmen (Marktkapitalisierung von 220 Milliarden Euro) will seine Mitarbeiter zurück ins Büro holen. SAP-Mitarbeiter sollen künftig mindestens drei Tage in der Woche am jeweiligen Standort arbeiten. Bislang gab es eine Wahlfreiheit. Eine folgenreiche Entscheidung für weltweit rund 107.000 Mitarbeiter, die für den Software-Giganten tätig sind. Ein weiterer Gigant, google, hatte seine Beschäftigten schon 2023 zurück in die Büros beordert. Zeichnet sich ein neuer Trend bei der Präsenzpflicht im Job ab? Die „Schwäbische Zeitung“ hat bei großen Arbeitgebern in der Region nachgefragt. Ravensburger: Zwei Tage Homeoffice Bei der Ravensburger Gruppe existiert eine Betriebsvereinbarung zu der Thematik. „Mobiles Arbeiten kann bei Ravensburger zwischen Mitarbeiter und Führungskraft im Umfang von bis zu zwei Tagen pro Woche oder maximal 40 Prozent der Arbeitszeit vereinbart werden“, teilt Unternehmenssprecher Heinrich Hüntelmann mit. Dies sei flexibel gestaltbar. Jedoch hätten Termine Vorrang, die eine Präsenz des Mitarbeiters erfordern. Soll heißen: Präsenz ist erwünscht, Homeoffice aber nicht verboten. Ähnlich bei Vetter Pharma mit zirka 6300 Beschäftigen. Der Ravensburger Pharmadienstleister hatte nach der Covid-Pandemie für seine deutschen Standorte ein 60/40 Homeoffice-Modell etabliert. Konkret bedeute dies, dass Mitarbeitende an zwei Tagen pro Woche beziehungsweise acht Tagen pro Monat mobil arbeiten können. „Als international tätiger Pharmadienstleister und moderner Arbeitgeber bieten wir unseren Mitarbeitenden, deren Stellenprofil das Arbeiten außerhalb der Arbeitsstätte erlaubt, gerne die Möglichkeit mobil zu arbeiten“, teilt Unternehmenssprecher Markus Kirchner mit. Viele Mitarbeiter schätzen das Arbeiten aus dem Homeoffice. Flexibilität, Zeitersparnis, weniger Ablenkung - die Liste der Vorteile ist lang. Eine weltweit angelegte Studie des Immobilien-Beratungsunternehmens JLL ergab jedoch, dass 33 Prozent der befragten Unternehmen nach Beendigung der Corona-Pandemie eine Präsenzpflicht eingeführt hatten. Weitere 27 Prozent könnten sich vorstellen, dies demnächst zu tun. Stadt Aalen: Bis zu 60 Prozent Homeoffice Die Stadt Aalen teilt in der Sache mit: „Für die Stadt Aalen halten wir am vereinbarten Modell fest. Beschäftigte der Stadt können in der Regel 20 Prozent, in Ausnahmefällen bis zu 40 Prozent ihrer Arbeitszeit im Homeoffice verbringen. Wird ein Arbeitsplatz von zwei Mitarbeitenden benutzt (Desk-Sharing), sind 60 Prozent Homeoffice möglich. Unsere MA schätzen diese Flexibilisierung sehr."" 40 bis 60 Prozent arbeiten von daheim also, weiterhin eine hohe Quote. So praktiziert es auch Weltmarktführer ZF. Der Technologiekonzern bietet seinen knapp 170.000 Mitarbeitern – sofern die Arbeitsaufgabe dies zulässt – verschiedene Möglichkeiten des außerbetrieblichen Arbeitens an. 40 bis 60 Prozent der Arbeitszeit verbringen die Mitarbeiter dabei im Büro, den anderen Teil mit mobiler Arbeit bzw. im Homeoffice. Ohne Homeoffice kündigt fast jeder Zweite Dazu muss man wissen: Laut einer YouGov-Umfrage würden 47 Prozent der Beschäftigten in Deutschland den Job kündigen, wenn die Chefs das Homeoffice einschränken. Möglicherweise ermöglicht der Waagen-Hersteller Bizerba aus Balingen seinen Mitarbeitern deshalb maximale Freiheiten. Das Unternehmen teilt mit: „Bei Bizerba legen wir großen Wert auf flexible Arbeitsmodelle, die es unseren Mitarbeiterinnen und Mitarbeitern ermöglichen, dort zu arbeiten, wo es am effektivsten ist. Mobiles Arbeiten ist grundsätzlich möglich, wo immer die Art der Arbeit dies zulässt. Digitale und hybride Arbeitsformen sind bei uns gang und gäbe. Aktuell haben wir keine Pläne, unsere Regelungen für mobiles Arbeit zu ändern.“ Bei der Hymer GmbH & Co. KG in Bad Waldsee könne das Homeoffice nicht allen Mitarbeitern angeboten werden. Der Grund: Die Produktion der Reisemobile erfordert die Anwesenheit in den Produktionshallen. In Abteilungen, wo es möglich ist, würden die Beschäftigten auch Homeoffice nutzen. Eine gesetzlich verankertes Recht auf Homeoffice gibt es in Deutschland nicht. Wenn sich Arbeitnehmer und Arbeitgeber einig sind, können sie allerdings eine Betriebsvereinbarung treffen."
0054f1f1-68c2-40f3-ab4b-d0880354cbea,2024-07-20 10:00:00+00:00,"Digitaler Fortschritt oder Ausbeutung? Wie überlange Arbeitszeiten und ständige Erreichbarkeit zum Burnout führen. Worauf Sie achten sollten. ""Die Digitalisierung hat einen revolutionären Wandel ausgelöst"", erklären Katja Koch und Katharina Vollus für die MHP Management- und IT-Beratung. Neue Marktchancen entstehen, während etablierte Geschäftsmodelle infrage stehen. Anzeige Dieser Megatrend verlangt mehr als eine oberflächliche Anpassung bestehender Unternehmen – er erfordert tiefgehende Transformationsprozesse. Katja Koch und Katharina Vollus Wie weit diese Veränderungen gehen, zeigt sich derzeit in vielen Betrieben am Beispiel ""SAP HANA"", bei den Produkten anderer Softwareanbieter ist die Situation ähnlich: Das Programm ist eine Datenbank und Software-Plattform. SAP HANA (High-performance ANalytic Appliance) ist eine Multi-Model-Datenbank, die Daten in Ihrem Arbeitsspeicher statt auf einer Festplatte speichert. […] Unternehmen können so riesige Datenmengen in nahezu Echtzeit verarbeiten, Daten unmittelbar abfragen und zu datengestützten Unternehmen werden. SAP Produktwerbung Bis 2027 müssen Unternehmen von ihrem alten SAP-System zum neuen System S/4HANA wechseln, denn ab diesem Zeitpunkt werden ältere Systeme vom Anbieter nicht mehr unterstützt. Die Umstellung stellt für die Betriebe einen enormen Arbeitsaufwand dar. Die Veränderungen sind eine Herausforderung für Unternehmen und Belegschaften. Projektarbeit wird Standard, Neuerungen häufen sich. ""Fehlende oder ineffiziente Kommunikation führt zu Missverständnissen und Verzögerungen. Oftmals werden wichtige Informationen nicht rechtzeitig oder gar nicht weitergegeben, was zu erheblichen Problemen in der Projektumsetzung führt"". Oft fehle es in den Unternehmen an ""Ressourcen und Kompetenzen, um ein Digitalisierungsprojekt erfolgreich umzusetzen. Anzeige Dies betrifft sowohl die finanziellen Mittel als auch das Fachwissen der Mitarbeiter"", erläutert Christian Bäcker im Focus. Er ist Geschäftsführer der Proven-Impact GmbH, die Unternehmen bei der Digitalisierung berät. Moderne Methoden unterstützen jedoch den Faktor ""Mensch"": ""Agile Projektmanagementmethoden wie Scrum oder Kanban können helfen, den Projektumfang besser zu kontrollieren"", erläutert der Experte. Diese Methoden ermöglichen eine schrittweise Vorgehensweise, bei der der Projektumfang regelmäßig überprüft wird. Durch kontinuierliches Feedback können ""Änderungen schneller erkannt und gesteuert werden"". Denn Kommunikation sei ""das Rückgrat jedes Projekts"". Schattenseiten der agilen Projektarbeit Für viele Beschäftigte bei SAP, Siemens, T-Systems oder anderen Großunternehmen wurden die Schattenseiten der Projektarbeit immer sichtbarer. Der besondere Charakter dieses Ansatzes ist, Angestellte in Teams eigenverantwortlich nach ökonomischen Prinzipien arbeiten zu lassen. Aufträge werden so vom einzelnen Beschäftigten fast nur noch nach dem Kosten-Nutzen-Prinzip betrachtet. Der Einzelne wird in eine Position gestellt, in der er nicht mehr vom Vorgesetzten angewiesen, sondern unmittelbar durch den Druck des Marktes gesteuert wird. Denn für viele Angestellte bedeutet die gewachsene Verantwortung eine Intensivierung der Arbeit und den Zwang zu überlangen Arbeitszeiten. Die Folgen sind verschwimmende Grenzen von Arbeits- und Privatsphäre. Dazu existieren ausreichend wissenschaftliche Ausarbeitungen. Eine Studie der Gesellschaft für Projektmanagement (GPM) zeigt eine im Vergleich zur allgemeinen Bevölkerung besonders hohe Verbreitung von Erschöpfungszuständen unter Beschäftigten, die in mehrere Projekte gleichzeitig involviert sind. Mehr als ein Drittel der befragten Personen unterliegen einem erhöhten Burnoutrisiko. Fehlmanagement mit Folgen für die Beschäftigten Am Beispiel SAP HANA lassen sich die Auswirkungen neuer Technik auch auf die Beschäftigten darstellen. Denn Unternehmensberater empfehlen bereits jetzt, umfassende Umstrukturierungen anzugehen, die sich auf Arbeitsabläufe, Tätigkeiten und Abteilungsstrukturen auswirken werden. Obwohl 2027 noch einige Jahre entfernt ist, sollte der Aufwand, der mit der Migration verbunden ist, keinesfalls unterschätzt werden. Zudem bieten diese kommenden Jahre auch die einmalige Gelegenheit, andere wichtige Geschäftsprozesse, wie den elektronischen Datenaustausch (EDI), zu aktualisieren. ecosio InterCom, Beratungsfirma aus München Unternehmensberater Baecker beschreibt auch das Versagen der Manager. Ein häufiges Problem sei, dass ""die tatsächlichen Bedürfnisse des Unternehmens nicht ausreichend analysiert werden"". Denn ohne Bedarfsanalyse bestehe das Risiko, dass ""Lösungen implementiert werden, die nicht den spezifischen Anforderungen des Unternehmens entsprechen"", so Baecker, der sich als ""Digital Transformation Strategist"" bezeichnet, in der Süddeutschen Zeitung. Bei schief laufenden Digitalisierungsprojekten stehen ""viel Geld und eine Menge an Reputation auf dem Spiel"", so Christian Bäcker. Die Folgen für die Belegschaften spielen dabei keine Rolle. Das Nicht-abschalten-Können, ständige Erreichbarkeit oder häufige Videokonferenzen sind enorme Stressfaktoren, die auf agile Projektarbeit zurückzuführen sind. Seit Jahren fordert die IG Metall deshalb eine Anti-Stress-Verordnung. Anders als bei Gefahrstoffen, Lärm oder mangelnder Beleuchtung fehlen ausgerechnet bei psychischer Belastung klare Anforderungen an die Arbeitgeber IG Metall-Vorstand Hans-Jürgen Urban Ziel des Arbeitsschutzes muss es sein, die Arbeitsbedingungen und den Arbeitsablauf so umzusetzen, dass der arbeitende Mensch die Tätigkeit ohne Schädigungen über ein Arbeitsleben hinweg ausüben kann. Eine ausreichend präzise Anti-Stress-Verordnung könnte zur Bewältigung des Problemdrucks einen wichtigen Beitrag leisten. Die gesetzlichen Anforderungen müssen verbindlicher, konkreter und transparenter werden. Die derzeitigen Diskussionen um die Vier-Tage-Woche verdeutlichen, dass die Arbeitszeitbegrenzung immer auch ein Instrument des Arbeitsschutzes war und ist. Der Technikeinsatz erfordert eher eine Begrenzung der Arbeitszeit, um den Stress nicht weiter auszuweiten. So wird auch Arbeitszeitverkürzung ein Thema in Tarifverhandlungen bleiben."
