a7887297-3b43-41a6-a955-fabcb09a8579,2024-07-24 14:27:51+00:00,"Der Umbau bei SAP wirkt sich auf die Mitarbeiterzufriedenheit. Laut einer internen E-Mail, die der „ WirtschaftsWoche “ vorliegt, vertrauen nur noch 56 Prozent der Mitarbeiter dem Vorstand. Dies bedeutet einen Rückgang von zwölf Prozentpunkten im Vergleich zum Vorjahr. Außerdem würden lediglich 70 Prozent der Beschäftigten SAP als „großartigen Arbeitsplatz“ empfehlen, ein Minus von zehn Prozentpunkten. Vertrauen sinkt Auch das Vertrauen in die Umsetzung der SAP-Strategie ist gesunken. Es beträgt jetzt nur noch 69 Prozent, ein Rückgang von drei Prozentpunkten. SAP-Arbeitsdirektorin Gina Vargiu-Breuer erklärt in der E-Mail: „Wir sind uns darüber im Klaren, dass unser globales Restrukturierungsprogramm sowie andere Veränderungen wie die Rückkehr ins Büro einen wesentlichen Einfluss auf diese Ergebnisse haben.“ SAP will mehr sparen und effizienter wirtschaften. Dafür baut der Softwarekonzern fleißig Stellen ab. Insgesamt sollen 10.000 Mitarbeiter das Dax-Unternehmen verlassen, berichtet die „ tagesschau “. Bis 2025 soll der Stellenabbau beendet werden. Dann soll SAP 200 Millionen Euro weniger Kosten haben. Ein Teil des Geldes soll dann in neue Jobs fließen, die sich mit Künstlicher Intelligenz beschäftigen. Denn auch SAP will am KI-Boom teilhaben. Wert der SAP-Aktie wächst konstant Die SAP-Aktie ist seit Jahresbeginn stetig angestiegen. Die Wertpapiere des Dax-Konzerns werden aktuell bei 195,16 Euro gehandelt. Das ist eine Wertsteigerung seit Jahresbeginn von mehr als 42 Prozent."
b6febfc6-7015-4bc1-9680-600fe78be833,2024-07-25 08:35:00+00:00,"Die Aktie von SAP hat in dieser Woche nach starken Quartalszahlen ein neues Allzeithoch erreichen können. Auch zahlreiche Analysten äußerten sich positiv zu der Entwicklung beim größten europäischen Softwarekonzern. Zuletzt erhöht sie reihenweise die Kursziele für die Aktie von SAP. Die US-Investmentbank Goldman Sachs hat das Kursziel von 225 auf 240 Euro erhöht. Die Einstufung für die Aktie von SAP lautet weiterhin „Buy“. Goldman-Analyst Mohammed Moawalla betonte, dass die jüngsten Quartalszahlen des Softwarekonzerns die Stärke des Cloud-Geschäfts unterstrichen hätten. Er hob seine Schätzungen für den Barmittelzufluss der Jahre 2026 bis 2028 an und sieht die Aktie trotz der überdurchschnittlichen Entwicklung seit Jahresbeginn noch nicht als anspruchsvoll bewertet an. Auch die US-Bank JPMorgan wird optimistischer. Sie hat das Kursziel für SAP von 205 auf 220 Euro angehoben. Das Votum lautet weiterhin „Overweight“. ""Die Show geht weiter"", schrieb Analyst Toby Ogg in seiner am Mittwoch vorgelegten Studie zu SAP. Ogg lobte die anhaltende Wachstumsdynamik, die bereits positiven Auswirkungen der Restrukturierung und die damit gesunkenen Risiken für den operativen Ergebnisausblick (Ebit). Das Analysehaus Jefferies sieht das Kursziel nach dem jüngsten Quartalsbericht nun bei 225 Euro (bisher: 210 Euro), die Kaufempfehlung wurde bestätigt. Es habe noch mehr gute Nachrichten aus Walldorf gegeben, so Analyst Charles Brennan. Die Resultate untermauerten den Ruf des Softwareherstellers als einer der langfristig besten Wachstumswerte im Sektor."
ebc67e95-45c9-4ef6-9dcd-78deee52acc7,2024-07-25 08:50:03+00:00,"Family Business. Gleiss Lutz berät die Inhaberfamilie beim Verkauf des Management- und Technologieberatungsunternehmens Camelot an Accenture. Wirtschaftskanzlei Gleiss Lutz begleitet laut einer Aussendung den Verkauf des SAP- und Lieferkettenspezialisten Camelot an den Beratungsmulti Accenture. Die Camelot-Gruppe ist laut den Angaben auf SAP-Transformationsberatung mit Fokus auf Supply Chain Management, Daten und Analytik spezialisiert. Das Kundenportfolio umfasse große und mittelständische Unternehmen aus der Chemie-, Pharma-, Konsumgüter- und Fertigungsindustrie. Neben dem Hauptsitz in Mannheim unterhält Camelot Niederlassungen in den USA, den Vereinigten Arabischen Emiraten, Indien, Polen, Serbien, Spanien und der Schweiz. Rund 700 Beschäftigte sollen im Zuge der Übernahme zu Accenture wechseln. Die Kanzlei berate regelmäßig Unternehmerfamilien und Familienunternehmen bei Umstrukturierungen, Transaktionen, in Nachfolgefragen etc. Unter anderen hat man demnach auch den Gesellschafter des österreichischen Automobil-Zulieferers ZKW beim Verkauf der Gruppe an die südkoreanische LG Corporation beraten. Der Camelot-Deal Mit der Übernahme will Accenture seine SAP- und KI-basierten Supply-Chain-Kompetenzen stärken, um Kunden beim Aufbau intelligenter und widerstandsfähiger Lieferketten zu unterstützen, heißt es. Der Vollzug der Transkation unterliege üblichen Bedingungen, einschließlich der erforderlichen behördlichen Genehmigungen. Accenture ist ein weltweit tätiges Beratungsunternehmen mit 750.000 Mitarbeitern. Im Gleiss Lutz-Team waren Jochen Tyrolt (Federführung, Partner), Martin Schockenhoff (Of Counsel, beide Stuttgart), Nico Holtkamp (Hamburg), Christoph Meissner (Berlin), Nikolas Frey, Bosede Staudenmayer und Valentin Zemmrich (alle Stuttgart, alle M&A). Dabei waren auch Martin Viciano Gofferje (Partner, Berlin), Oliver Wolf, Nils Kraus (beide Stuttgart), Julia Wohlmuth (Frankfurt, alle M&A), Johann Wagner (Partner), Hendrik Marchal (Counsel), Michael Gröber, Markus Günther (alle Steuerrecht, alle Hamburg), Herwig Lux (Counsel), Christopher Noll (beide IP/Tech, beide Stuttgart), Johannes Hertfelder (Partner), Alexandra Bruch, Tim Seiter (alle Kartellrecht, alle Stuttgart), Rut Steinhauser (Partner), Josefine Chakrabarti (Counsel), Anke Siemer-Arcq (alle Arbeitsrecht, alle Berlin), Carsten Fitting, Andreas Duttig (beide Gesellschaftsrecht, beide Stuttgart), Manuel Klar (Counsel, Datenschutzrecht, München), Jacob von Andreae (Partner), Aylin Hoffs und Matthias Hahn (alle Öffentliches Recht/Außenwirtschaftsrecht, alle Düsseldorf)."
a30428de-d83b-4692-8223-80b4dda0296f,2024-07-25 10:02:00+00:00,"Europas führender Softwarehersteller SAP dehnt sein Stellenabbauprogramm aufgrund der hohen Bereitschaft der Mitarbeitenden zur Annahme aus. Statt der ursprünglich geplanten 8.000 Arbeitsplätze sollen nun 9.000 bis 10.000 der aktuellen Stellen wegfallen, wie das Unternehmen am Montagabend nach Börsenschluss in den USA bekanntgab. Zum Ende des zweiten Quartals beschäftigte SAP 105.315 Mitarbeitende – fast 3.000 weniger als drei Monate zuvor. Trotz schwierigen Bedingungen: SAP-Umsatz steigt um 10 Prozent Trotz der schwierigen wirtschaftlichen Bedingungen erzielte SAP im zweiten Quartal ein besseres operatives Ergebnis als erwartet. Das bereinigte Ergebnis vor Zinsen und Steuern (EBIT) stieg im Jahresvergleich um 33 Prozent auf 1,94 Milliarden Euro. Der Umsatz legte um 10 Prozent auf 8,29 Milliarden Euro zu. Besonders das Cloudgeschäft bewies sich als Wachstumstreiber mit einer Steigerung von 25 Prozent. Im Gegensatz dazu sank der Nettogewinn im zweiten Quartal um 69 Prozent auf 918 Millionen Euro. Dieser Rückgang ist hauptsächlich auf den signifikanten Sonderertrag aus dem Verkauf der US-Tochter Qualtrics im Vorjahr zurückzuführen. Durch Stellenabbau spart SAP Personalkosten ein Das Dax-Schwergewicht hielt an seiner Jahresprognose für 2024 fest. Aufgrund der Erweiterung des Stellenabbauprogramms und den damit verbundenen höheren Kosteneinsparungen, rechnet SAP für 2025 mit einem zusätzlichen operativen Ergebnis von 0,2 Milliarden Euro. Die Umsatzerwartungen für das kommende Jahr bleiben unverändert. Nach Bekanntwerden der Nachrichten stiegen die in den USA gehandelten Aktien des Dax-Konzerns um gut vier Prozent im nachbörslichen Handel. Auch bei der DKB werden aktuell Stellen abgebaut. Die Bank plant bis 2025 zwischen 600 und 700 Stellen zu streichen. Hintergrund für den Stellenabbau sind die steigenden Kosten und die zu erwartenden Gehaltserhöhungen in der laufenden Tarifrunde."
017a6916-1c8c-4914-bee6-57b2d2fc3a96,2024-07-25 11:38:00+00:00,"Startseite Wirtschaft Stellenabbau bei SAP: Unternehmen verliert offenbar Vertrauen der Mitarbeiter Von: Olivia Kowalak SAP muss das Vertrauen seiner Mitarbeiter einbüßen. Im Rahmen des Umstrukturierungsprogramms verbreitet sich ein Klima des Unmuts innerhalb des Unternehmens. Walldorf – Der Software-Riese SAP steckt seit Monaten in einem umfangreichen Restrukturierungsprogramm. Dazu gehört im Rahmen dessen auch, bis zu 10.000 Stellen zu streichen. Wie nun aus einer aktuellen SAP-Mitarbeiterbefragung, die der Wirtschaftswoche (WiWo) vorliegt, hervorgeht, schwindet zunehmend das Vertrauen in die Chefetage des Unternehmens. „Wir sind uns darüber im Klaren, dass unser globales Restrukturierungsprogramm sowie andere Veränderungen wie die Rückkehr ins Büro einen wesentlichen Einfluss auf diese Ergebnisse haben“, zitierte die WiWo SAP-Arbeitsdirektorin Gina Vargiu-Breuer aus einer vertraulichen E-Mail. SAP-Umstrukturierungsprogramm: Positive Effekte trotz schwindenden Mitarbeitervertrauens Der Befragung zufolge gaben nur 56 Prozent der Mitarbeiter an, dem Walldorfer Konzernvorstand noch zu vertrauen. Im Vergleich zum Jahr 2023 ergibt sich daraus ein Rückgang von zwölf Prozent. Lediglich 72 Prozent der SAP-Beschäftigten würden demnach den Konzern auch als „großartigen Arbeitgeber“ weiterempfehlen. Hier zeichnet sich im Vorjahresvergleich ein Minus von zehn Prozentpunkten ab. So sank auch das Vertrauen in die SAP-Strategie um drei Prozentpunkte auf 69 Prozent. Das Programm zeigt allerdings seine erhoffte Wirkung. Der Konzern teilte zu Beginn der Woche positive Quartalsergebnisse mit. Der operative Gewinn nahm währungsbereinigt um 35 Prozent zu und erreichte damit einen Wert von 1,94 Milliarden Euro. Dies sei vor allem dem Cloud-Geschäft zu verdanken, das im Q2 2024 um ein Viertel stieg. Die SAP-Aktie stieg infolgedessen um sieben Prozent und erreichte ein neues Allzeithoch. SAP baut Stellen ab – 10.000 Stellen betroffen Das Walldorfer-Unternehmen bestätigte in dem Bericht zudem, dass von dem Restrukturierungsprogramm nicht wie zuvor angekündigt 8.000 Jobs weltweit, sondern bis zu 10.000 Stellen betroffen sein werden. Dies soll in Deutschland über ein Freiwilligen- und Vorruhestandsprogramm geschehen. Überraschenderweise hatten sich bis Ende Juni 5.300 SAP-Mitarbeiter für jenes Programm registriert. Ursprünglich ging man von etwa der Hälfte aus. Die erhöhte Annahmequote der Abfindungsangebote führte dementsprechend auch zu steigenden Kosten. Statt 2,2 Milliarden Euro schätzt man diese voraussichtlich auf drei Milliarden Euro. Alte Methoden kehren zurück: SAP schafft unzufriedenes Betriebsklima Die wieder eingeführte Präsenzpflicht für Beschäftigte erzeugte ein Klima des Unmuts. Wie es im WiWo-Bericht hieß, gelten seit Anfang Mai drei Bürotage verpflichtend für jeden Mitarbeiter. Der europäische SAP-Betriebsrat zeigte sich empört über die Regelung: „SAP, wie wir es kannten, ist vorbei“, schrieb er in einer internen Mail. „Wir fühlen uns von einem Unternehmen verraten, das uns bis vor kurzem dazu ermutigt hat, von zu Hause zu arbeiten“, hieß es darin weiter. Der Konzern verlor darüber hinaus durch Kontrollsysteme massiv an Vertrauen. So wurde zu Jahresbeginn ein Bewertungssystem eingeführt. Dies schlug bei Ankündigungen hohe Wellen und setzte eine öffentliche Debatte in Gang. „Es soll Leistungsträger geben, ‚Performer‘ genannt, die bei Bonuszahlungen besonders berücksichtigt werden. Die Mehrheit der Mitarbeiter dürfte in die Kategorie ,Achiever‘ fallen, die die Erwartungen erfüllen. Und dann gibt es noch sogenannte ,Improver‘, die sich verbessern müssen“, beschrieb das Handelsblatt das System. Bereits im Jahr 2017 stoppte SAP jährliche Benotungen der Beschäftigten aufgrund des dadurch entstehenden, schlechten Betriebsklimas. „Die bisherigen Ratings haben mehr Unzufriedenheit geschürt als sie Positives gebracht haben“, sagte der damalige Personalchef von SAP Deutschland, Wolfgang Fassnacht. Keine Auszeit für Väter: FDP blockiert Gesetzesentwurf Eine ursprünglich geplante Väterzeit von eineinhalb bezahlten Monaten ist ebenso aufgefallen. Mehrere Millionen Euro sollten demnach in die Partnerzeit fließen. „Ich bedauere den Rückzug sehr, gerade auch wegen der Planbarkeit für die zukünftigen Väter. SAP hätte sich das leisten können“, hieß es damals vom Betriebsratsvorsitzenden, Eberhard Schick. Grund dafür war ein nicht umgesetzter Gesetzesentwurf der Ampelkoalition, der aus dem Koalitionsvertrag hervorgeht. „Die Bundesregierung hat die im Koalitionsvertrag vereinbarte Regelung zur sogenannten Väterzeit nicht wie geplant umgesetzt. Wir nehmen dies zum Anlass, unsere eigenen Pläne in diesem Bereich ebenfalls zu überprüfen“, erklärte SAP in einer Stellungnahme. Das Vorhaben sollte Anfang 2024 in Kraft treten, jedoch wurde es von Bundesfinanzminister Christian Lindner (FDP) wegen Unstimmigkeiten bei der Finanzierung blockiert."
36f68719-94ba-4691-901a-022d7dfb5318,2024-07-25 13:10:00+00:00,"Dabei war das Bild einmal ein ganz anderes: Vor drei Jahren lag der Wert noch bei 80 Prozent. Seitdem geht es nahezu ungebremst nach unten. Rekordbeteiligung Rund 83.000 Mitarbeiter hatten sich an der aktuellen Umfrage im April beteiligt – so viele wie noch nie zuvor. Insgesamt beschäftigte SAP vor den Stellenstreichungen, die noch in vollem Gange sind, rund 108.000 Angestellte. Die straften nun nicht nur den Vorstand ab: Die Zufriedenheit mit der Kommunikation der Manager auf der Ebene unter dem Vorstand (L1) verlor 7 Prozentpunkte und rutschte auf 65 Prozent. Auch das Zutrauen in SAPs Fähigkeit, die Strategie umzusetzen, sank leicht – um 3 Prozentpunkte auf 69 Prozent. Generell schlägt die steigende Desillusion in der Belegschaft auf die Ergebnisse durch. Einen regelrechten Abrutsch erlitt SAP als Arbeitgeber: Nur noch 79 Prozent der Teilnehmenden empfehlen den Konzern – ganze 10 Prozentpunkte weniger als ein halbes Jahr zuvor. Spürbar weniger Mitarbeiter gaben außerdem an, stolz darauf zu sein, bei SAP zu arbeiten – oder begeistert auf die Zukunft von SAP zu schauen (je minus 6 Prozentpunkte). „Klares Verbesserungspotenzial“ Die neue Personalvorständin Gina Vargiu-Breuer (49) schrieb im Intranet an die SAPler, man erkenne an, dass das globale Restrukturierungsprogramm und die Rückkehr ins Büro (Anwesenheit an drei Tagen pro Woche ist wieder verpflichtend) „signifikante Treiber“ der Ergebnisse seien. Aber: Alle „Shifts“ seien notwendig, um das Ziel zu erreichen, „die Nummer 1 bei Unternehmensanwendungen und Marktführer bei Business-Kl“ zu werden. Während die wichtigen Werte für das Topmanagement stetig sinken, sieht es tatsächlich längst nicht überall schlecht aus. Der Index für Chancengleichheit und Diversität erreicht 90 Prozent und liegt damit nur minimal unter dem Vorjahreswert von 92 Prozent. 87 Prozent der Mitarbeiter geben außerdem an zu wissen, was sie in ihrer alltäglichen Arbeit tun müssten, um die SAP-Strategie voranzutreiben (vorher: 89 Prozent)."
91ba5230-60f4-4e4c-a90b-9e13edd02f90,2024-07-26 11:30:36+00:00,"Dass die Beschäftigten vom ökonomischen Erfolg eines Unternehmens ebenfalls profitieren, ist einer der wichtigsten, ständig wiederholten Glaubenssätze des Kapitalismus. Beim momentan wertvollsten DAX-Konzern SAP wird gerade deutlich, wie wenig das stimmt. – Ein Kommentar von Paul Gerber SAP boomt. Das deutsche Unternehmen mit Sitz im badischen Walldorf hat im zweiten Quartal 2024 einen Vorsteuergewinn von 1,94 Milliarden Euro eingefahren. Seit Jahrzehnten verkauft das Unternehmen Softwarelösungen für andere Unternehmen und ist damit in seiner Sparte zu einem der weltweit führenden Anbieter für Datenbanken-Software aufgestiegen. Die Angebote der deutschen Softwareschmiede sind für viele Unternehmen so unverzichtbar geworden, dass Kenntnisse im Umgang mit SAP-Software zu einer zentralen Qualifikation bei vielen Stellenausschreibungen geworden sind. Es ist nicht alles Gold, was glänzt Auch der Börsenkurs spiegelt die aktuell sprudelnden Gewinne wider: Mit 196,98 Euro pro Aktie erreichte der Kurs erst am Dienstag ein Allzeithoch. Ein Jahr zuvor schwankte dieser Wert noch um 125 Euro. Das Unternehmen ist somit momentan das wertvollste deutsche Börsenunternehmen. Jedoch spiegelt sich dieser Erfolg offenbar – zumindest nicht bei allen Mitarbeiter:innen – auch in ihrer Zufriedenheit mit dem Unternehmen wider: Beobachter:innen der Branche wie Christina Kyriasoglou zufolge rumort es kräftig in der Firmenzentrale. Aufreger sind unter anderem die von der Konzernspitze durchgesetzte Rückkehr zur Büropflicht an drei Tagen die Woche, sowie die Einführung eines neuen Bewertungssystems, mit dessen Hilfe die Angestellten regelmäßig als „Over- oder Underperformer” eingestuft werden. Anders als in vielen anderen deutschen Großkonzernen ist auch der Einfluss der DGB-Gewerkschaften bei SAP noch relativ begrenzt, und die Bezahlung findet nicht flächendeckend anhand von Tarifverträgen statt. Einzelnen Betriebsratsmitgliedern zufolge gibt es teils erhebliche Gehaltsunterschiede, wie auch der Spiegel berichtete. Gemeinsam kämpfen gegen Armutslöhne und niedrige Sozialleistungen Arbeiter:innen ergreifen die Flucht Vor allem aber baut SAP mitten in seinem Höhenflug kräftig Stellen ab: zunächst waren schon 8.000 gestrichene Stellen angekündigt worden, zuletzt hat das Unternehmen seine Erwartungen sogar auf 9.000 oder 10.000 Stellenstreichungen erhöht – laut Angaben von SAP selbst aus dem Grund, dass das Abfindungsprogramm besser als erwartet angenommen werde. Will heißen: Mehr Mitarbeiter:innen als gedacht sehen den Stellenabbau als Chance, um mit einer Abfindung in der Tasche dem Unternehmen den Rücken zu kehren. Klar: Gerade in der IT-Branche werden viele Fachkräfte händeringend gesucht, und es ist nicht unwahrscheinlich, dass viele der Angestellten relativ „weich“ fallen, wenn sie die Abfindung nehmen und SAP verlassen. Einige können vermutlich sogar ihre Bezahlung bei einem anderen Unternehmen deutlich in die Höhe treiben. Dennoch bleibt offensichtlich: Auch bei SAP sind die Gewinnerwartungen an der Börse gerade dann am höchsten, wenn das Unternehmen mit Veränderungen der Arbeitsbedingungen oder Personalkürzungen Einsparungen bei der eigenen Belegschaft vorantreibt und dabei auch noch erfolgreich zu sein scheint. Schleichender Stellenabbau: Das deutsche Modell der Massenentlassung Im Wettbewerb mit den eigenen Konkurrenten sieht die Lage von SAP derweil alles andere als sicher aus: In der IT-Branche tobt derzeit ein heftiger Konkurrenzkampf darum, welches Unternehmen sich die größeren Marktanteile im Bereich KI-Anwendungen und Cloud-Angeboten sichern kann. Letztere sehen vor, dass Unternehmen ihre Software nicht mehr vor Ort bei sich installieren müssen, sondern die Anwendungen über die Groß-Server des Softwareanbieters laufen. Auch SAP will das eigene Geschäft in diese Richtung umstellen."
18332482-f291-499e-9d6e-ca1958f814e0,2024-07-26 14:27:25+00:00,"Europas größter Softwarehersteller SAP mit Sitz in Walldorf (Rhein-Neckar-Kreis) streicht mehr Stellen als zunächst geplant - auch, weil mehr Beschäftigte gehen wollen. Der Konzern hatte dafür ein Programm aufgelegt. Das soll Kosten senken. Bis zu 10.000 Arbeitsplätze weniger bei SAP Statt den geplanten 8.000 Stellen sollen 9.000 bis 10.000 der derzeitigen Jobs abgebaut werden. Das hat das Unternehmen aus Walldorf am Montagabend mitgeteilt. Das Programm läuft bereits. Der Stellenabbau bei SAP funktioniert vor allem mit Abfindungen und Frühverrentungen. Es wird von den Mitarbeitenden so gut angenommen, dass das Unternehmen mit seinem Stellenabbau schneller vorankommt als gedacht. Im Juni wurde bekannt, dass alleine in Deutschland mehr als 5.000 Menschen an den Programmen teilnehmen wollen - mehr als doppelt so viele wie erwartet. Stellenabbau bringt dem Walldorfer Konzern Millionen Durch den Stellenabbau steigen zunächst die Kosten, unter anderem für die Abfindungen. Der Umbau soll - statt ursprünglich geplanten zwei Milliarden Euro - jetzt drei Milliarden Euro kosten. Diese Umstrukturierung muss laut SAP aber sein, um fit für die Zukunft zu werden - mit Künstlicher Intelligenz (KI). Dafür müssen ""neue"" Jobs her und ""alte"" weg. Dieser Umbau scheint sich auszuzahlen, auch wenn er teuer ist. Denn die SAP berichtet, dass die Kosten im SAP-Alltagsgeschäft bereits deutlich sinken. So macht der Konzern im zweiten Quartal gut 900 Millionen Euro Gewinn. Auch der Umsatz steigt um zehn Prozent gegenüber dem Vorjahr - auf mehr als acht Milliarden Euro. Die Prognose für das laufende Jahr bestätigte das Unternehmen, die Umsatzaussichten für das kommende Jahr bleiben ebenfalls unverändert."
e5fa8850-fd12-4de5-aa95-77aeb92df394,2024-07-27 14:00:00+00:00,"Cloud und KI bescheren dem Softwarekonzern ein glänzendes Quartal. Der Personalabbau wird ausgeweitet und spart mittelfristig Kosten. Analysten erhöhen ihre Kursziele. Deutschlands wertvollster Börsenkonzern ist in den vergangenen Tagen noch ein Stück wertvoller geworden. Mit einer Marktkapitalisierung von 240 Milliarden Euro ist SAP nun rund 100 Milliarden mehr wert als die Nummer 2, Siemens. Überraschend gute Quartalszahlen und ein ausgeweiteter Stellenabbau katapultierten die Aktie am Dienstag auf ein Rekordhoch bei fast 197 Euro. Der Marktführer für Geschäftssoftware macht vor allem Geld mit der Cloud. Zwischen April und Juni steigerte er seinen Umsatz um insgesamt zehn Prozent auf 8,3 Milliarden Euro – erstmals seit Anfang 2019 gab es wieder ein zweistelliges Plus. Ein „blitzsauberes Quartal“, kommentierte das Analysehaus Jefferies. Das Wachstum im Cloud-Geschäft bleibe unverändert hoch, kündigte SAP-Chef Christian Klein bei der Bilanzvorlage an. Ein besonderer Katalysator seien „die KI-Funktionen, die wir weiter ausbauen werden“. 300 Millionen Nutzer hat der Konzern mittlerweile. Zugleich laufen dem Konzern die Mitarbeiter in Scharen davon. Das ist durchaus beabsichtigt: Der angekündigte Stellenabbau wurde von 8.000 auf 10.000 erhöht. Es geht nicht nur darum, teure ältere Mitarbeiter via Abfindungen durch günstigere jüngere zu ersetzen. Es soll auch mehr Know-how in Sachen KI ins Unternehmen strömen. Anleger haben mit der Aktie gut verdient. Knapp 40 Prozent ist der Kurs in diesem Jahr bereits gestiegen, auf Sicht von zwölf Monaten sind es mehr als 60 Prozent. Ob sich dieser Aufwärtstrend weiter fortsetzt und welche Kursziele Analysten und Redaktion festsetzen, lesen Sie in der aktuellen Ausgabe von €uro am Sonntag. Zur neuen Ausgabe Weitere Themen im Heft: Autobauer senden Alarmsignale Tesla und andere Hersteller können mit ihren Zahlen in dieser Woche nicht überzeugen. Vor allem die Gewinne sind stärker belastet. Investoren reagieren enttäuscht (S.6) Erfrischendes Ergebnis Geschickter Vertrieb, starke Marken: Warren Buffetts Lieblingsfirma erhöht nach einem erfolgreichen Quartal die Ziele (S.14) An China-Zöllen der EU scheiden sich die Geister Das Ökonomen-Barometer legt im Juli wieder etwas zu. Doch die Hoffnungen auf einen Aufschwung in Deutschland erhalten einen kräftigen Dämpfer. Kontrovers diskutiert werden die China-Zölle der EU (S.16) Nicht mehr im Höhenflug Die Panne beim Cybersicherheits-Unternehmen Crowdstrike rückt die Unternehmen mit dem Geschäftsmodell Software as a Service in den Fokus. Vor dem Kurssturz lief es bei vielen Firmen schon nicht mehr so rund (S.42) €uro am Sonntag: Über 25 Prozent sparen im Aktionsabo! Behalten Sie die Börsenwoche stets im Blick: €uro am Sonntag zeigt Ihnen, was die Märkte bewegt und was das für Ihr Geld bedeutet. Pünktlich zum Sonntag erhalten Digitalabonnenten ein zusätzliches Update mit allen relevanten News nach Redaktionsschluss sowie den Schlusskursen aus Deutschland und den USA in Euro. Testen Sie noch heute 3 digitale Ausgaben €uro am Sonntag im Aktionsabo zum Vorteilspreis von 9,90 Euro. Sie sparen über 25 Prozent."
