4c773299-fc80-45ba-8f3d-c6ec63e502a8,2023-12-15 16:27:59+00:00,"Diese KOM-Ausgabe widmet sich dem Schwerpunkt #Corporate mit folgenden Themen: MEINUNG Kommentar Der Fall Gil Ofarim verdeutlicht, dass Unternehmen sich auch auf unwahrscheinliche Szenarien vorbereiten müssen. IM WORTLAUT Mercedes-Benz Interview mit Marketing- und Kommunikationschefin Bettina Fetzer über die Vorteile der Zusammenführung beider Disziplinen. TITEL: CORPORATE Unternehmen und NGOs Firmen suchen den Dialog mit NGOs und Aktivisten. Das zahlt sich nicht immer aus. Corporate Influencer 15 Markenbotschafter kommunizieren seit Kurzem für K+S auf Linkedin. Sie sollen Lust auf Bergbau machen. Sprechfähig werden M.M. Warburg wird wie keine andere Bank mit Cum-Ex in Verbindung gebracht. Kommunikationschefin Christina Eistert will jetzt andere Themen setzen. Mal lustig sein Einige Unternehmen versuchen es in Social Media mit Humor. Das passt nicht zu allen. Globale Town Hall Warum der Softwarekonzern SAP regelmäßig weltweit alle Mitarbeitenden zusammenschaltet. Nix mehr los auf X? Unternehmen notieren auf X sinkende Reichweiten und weniger Interaktion. Ist es Zeit, das Netzwerk zu verlassen? Spielerischer Ansatz Siemens hat ein 3D-Spiel entwickelt, um intern seine Unternehmensziele zu vermitteln. Wie funktioniert das? ESSAY Zu viel Schweigen Alexander Gutzmer erwartet von der Kulturszene mehr Offenheit und Dialogbereitschaft. Wenn es darauf ankommt, fehle es ihr dagegen an Haltung. PRAXIS Hapag-Lloyd Der Logistik-Konzern hat seine Kommunikation in einem Newsroom organisiert. Wie arbeitet das Team? CEOs auf Linkedin Landau Media hat ausgewertet, welche CEOs auf Linkedin erfolgreich sind und warum das so ist. KOM fragt Kommunikationsverantwortliche erklären, welche Tools sie für hilfreich halten. Datenbasiert arbeiten Maike Molling von E.ON Energie Deutschland beschreibt, wie sich interne Kommunikation auswerten lässt und weshalb Zahlen notwendig sind. WISSENSCHAFT Purpose Kommunikatoren spielen in der Vermittlung eines Purpose eine zentrale Rolle – genauso wie CEOs. MEDIEN Fröhliches Wechseln Im Politikjournalismus gab es reichlich Bewegung. Welche Wechsel 2023 besonders auffielen. AGENTUREN Kurz vorgestellt Alicia Altvatter von Weber Shandwick beantwortet den Agenturfragebogen. Verband Geschäftsstelle, Talent Award, Forschungssprecher des Jahres, Standpunkt, Interview."
803b8223-5348-4bc3-a886-1d4548675f36,2023-12-16 16:55:01+00:00,"16.12.2023, 17:55Lesezeit: 3 Min. Veranstaltungsort Dubai: An der diesjährigen Klimakonferenz nahmen 70.000 Menschen teil.Reuters Von Deutscher Bank über SAP bis zu Bayer: Zu den regelmäßigen Weltklimakonferenen am Jahresende kommen immer mehr Unternehmenschef. Dabei geht es um Teilhabe am Klimadialog – und nicht zuletzt ums Geschäft. Mit dem ganz großen Wurf hat wohl ohnehin niemand gerechnet. Zu enttäuschend waren die Ergebnisse der vergangenen Klimakonferenzen – und erst recht ihre halbherzige Umsetzung in den jeweils folgenden Jahren. Einen Rückgang der globalen CO2-Emissionen gab es nur im Corona-Ausnahmejahr 2020, eine Trendwende ist nicht in Sicht. Ohne Abo weiterlesen Dies ist kein Abo. Ihre Registrierung ist komplett kostenlos, ohne versteckte Kosten. Oder 3 Monate für 1 € pro Monat Zugang zu allen FAZ+ Beiträgen erhalten und immer aktuell informiert bleiben. Jetzt weiterlesen Dies ist kein Abo. Ihre Registrierung ist komplett kostenlos, ohne versteckte Kosten. Gleich geschafft! Bitte bestätigen Sie Ihren Account über den Bestätigungslink in der gesendeten E-Mail"
6800604f-4de9-4e95-8b2a-7e39674df974,2023-12-18 06:00:00+00:00,"Daten regieren das digitale Zeitalter. Moderne Unternehmen nutzen Daten, um neue Produkte rascher als bisher zu entwickeln und Innovationen voranzutreiben - doch dazu müssen sie flexibel sein. In einem äusserst umkämpften Markt sind Unternehmen darauf angewiesen, dass sie ihre Geschäftsprozesse schnell an neue Gegebenheiten anpassen können. Hierfür ist eine flexible und leistungsstarke IT-Infrastruktur die optimale Lösung. Firmen, die ihre Hardware ineffizient nutzen, stossen nicht nur immer wieder und oft unvorhergesehen an Leistungsgrenzen, sie müssen sich auch mit höheren Kosten abfinden. Und sie nehmen zudem negative Auswirkungen auf ihre Nachhaltigkeit in Kauf. Datenverarbeitung in Echtzeit mit SAP HANA Das Sammeln von Daten ist nur die Spitze des Eisbergs. Die komplexere und anspruchsvollere Aufgabe besteht darin, die Daten zu analysieren und aus ihnen neue Erkenntnisse zu gewinnen. Hier kommt die Datenbank und Softwareplattform SAP HANA zum Zug. SAP HANA ist in der Lage, riesige Datenmengen in Echtzeit zu verarbeiten, da sie eine analytische und transaktionsorientierte Verarbeitung ermöglicht. Die In-Memory-Architektur von SAP HANA erlaubt es, dass Workloads um ein Vielfaches einfacher und schneller ausgeführt werden können. Mit den integrierten Analysetools und Algorithmen für maschinelles Lernen (ML) können Unternehmen eigene Innovationen noch schneller vorantreiben. Mehr Leistung, weniger Maschinen Der Einsatz von SAP HANA setzt eine Hardware-Infrastruktur voraus, die maximal auf die Anforderungen abgestimmt, leistungsstark und zuverlässig ist. Mit IBM Power erhalten Unternehmen eine SAP-zertifizierte Lösung, die datenintensive Workloads effizient und in Höchstgeschwindigkeit verarbeitet. IBM-Power-Systeme sind über die Jahre viel leistungsfähiger geworden. Wurden früher für einen Workload beispielsweise drei IBM-Power8-Server benötigt, reicht heute bereits ein einziges IBM-Power10-System aus. Dies hat zur Folge, dass Unternehmen weniger Komponenten im Einsatz und weniger Restriktionen haben. Mit den Möglichkeiten der IBM-Power-Technologie sind Unternehmen agiler und flexibler, um auf neue Geschäftsfälle reagieren zu können. Die Hardware-basierte Virtualisierung mit IBM PowerVM bietet im Sizing und in der Architektur grösstmögliche Flexibilität. Stellen Unternehmen nach Inbetriebnahme etwa fest, dass sie sich in ihrem Sizing verschätzt haben, bietet IBM Power die nötige Skalierbarkeit, um Optimierungen vorzunehmen. Bei Servern von anderen Herstellern kann ein falsches Sizing schlimmstenfalls dazu führen, dass ein zusätzlicher Server beschafft werden muss oder viel zu grosse Systeme angeschafft wurden. Agile Infrastruktur für optimale Auslastung IBM Power10 bietet Unternehmen verschiedene Infrastrukturmodelle: On-Premises, als private, öffentliche und Hybrid Cloud sowie Infrastructure-as-a-Service (IaaS). Das Virtualisierungssystem in der Cloud-Umgebung ist dasselbe, das auch On-Prem im Einsatz ist, wodurch Unternehmen ihre Systeme mit einem einzigen Management-Tool bewirtschaften können. Möchte ein Unternehmen lokale Ressourcen sparen, bietet sich die Kombination in Form einer hybriden Cloud-Umgebung an. Mit IBM Power können Unternehmen Test- und Produktionssysteme nicht nur auf der gleichen Infrastruktur bewirtschaften, sie sind zudem in der Lage, neue Ressourcen während des laufenden Betriebs bereitzustellen - somit ist ein System-Down nicht notwendig, um Ressourcen zu verteilen. IBM Power verfügt über eine Betriebszeit von 99,999 Prozent und integrierte Speicherschutz-Systeme, die Probleme automatisch erkennen und beheben, bevor sie zu Ausfällen führen. Überdies zeichnen sich IBM-Power-Systeme durch ihre geringe Latenz aus und ermöglichen damit den Anwenderinnen und Anwendern eine bessere User Experience. Bei SAP HANA on IBM Power steht Agilität im Zentrum. IT-Verantwortliche haben die Möglichkeit, CPU-Kerne in kleineren Segmenten den einzelnen Applikationen und Geschäftsanwendungen zuzuordnen und dynamisch zu wechseln. Dies sorgt für äusserst hohe Flexibilität in der Memory-Konfiguration und gewährleistet, dass Ressourcen auf effiziente Art und Weise zur Verfügung stehen. IBM setzt bei seinen Power-Servern auf die Technik Open Memory Interface (OMI), die einen hohen Datendurchsatz erlaubt und geht damit einen neuen Weg, Memory anzusprechen. Gegen Cyberbedrohungen gewappnet - ohne Leistungseinbusse Es vergeht kein Tag, an dem nicht über neue Cyberangriffe berichtet wird. Der Schutz der eigenen IT-Infrastruktur muss für Unternehmen höchste Priorität haben. Mit IBM-Power-Servern sind ihre Anwendungen und Daten mit transparenten Speicherverschlüsselungen maximal geschützt. Workloads auf Power10-Servern profitieren von der Vollspeicherverschlüsselung und werden durch kryptografische Algorithmen beschleunigt. Nicht nur der Verkehr zwischen CPU und Disk ist verschlüsselt, sondern auch der Datenverkehr zwischen CPU und Memory. Unternehmen können mit Power10 militärtaugliche Verschlüsselungsmethoden wie Advanced Encryption Standard (AES) noch schneller als auf vorgängigen Power-Servern nutzen. Nachhaltig und kosteneffizient dank möglichst wenig Ressourcen Die Implementierung von IBM-Power-Systemen ermöglicht einen Konsolidierungseffekt: Weil weniger Systeme benötigt werden, reduziert sich nicht nur die Stellfläche, auch der Kühlungsaufwand und somit die Energiekosten reduzieren sich markant. Unternehmen reduzieren insgesamt ihren CO2-Austoss und verkleinern ihren Footprint. Damit leisten IBM-Power-Systeme einen wichtigen Beitrag für eine nachhaltige Zukunft. Im Vergleich zu herkömmlichen x86-basierten Servern im selben Performance-Segment bietet IBM Power einen geringeren Energieverbrauch von bis zu 50 Prozent und mehr. Es lohnt sich daher insbesondere für Unternehmen, die ein Nachhaltigkeitsreporting (ESG-Reporting) vorlegen müssen, zweimal zu überlegen, welche Systeme sie künftig einsetzen möchten. SAP HANA on IBM Power mit Bechtle Schweiz Das Duo SAP HANA on IBM Power eignet sich für Unternehmen in allen Branchen, die auf reaktionsschnelle Services und höchste Verfügbarkeit angewiesen sind. Auch für Unternehmen, die noch vor der Migration zu SAP S/4 HANA stehen, empfiehlt sich der Wechsel zu IBM-Power-Servern. Denn ist der Wechsel zur Power-Plattform einmal erfolgt, gestaltet sich die Migration zu S/4 HANA deutlich einfacher und kostensparender. Bechtle Schweiz unterstützt Unternehmen bei Lifecycle-Projekten und hilft seinen Kunden bei der Bestandesaufnahme, damit eine bestmögliche Architektur implementiert werden kann. Eine neue Infrastruktur erfordert neues Know-how, das sich jedoch effizient aneignen lässt. Ist die Infrastruktur einmal in Betrieb, läuft sie über mehrere Jahre problemlos. So überwiegen die daraus resultierenden Benefits den initialen Aufwand mehr als nur deutlich. Ihre Ansprechpartnerin Bechtle Schweiz AG Maike Zöllner Business Development Manager Tel. +41 56 556 61 65 maike.zoellner@bechtle.com www.bechtle.ch Unsere Standorte: Basel, Bern, Mägenwil, Pratteln, Rotkreuz, St. Gallen, Morges und Petit-Lancy"
67d69e6d-b25c-4514-a831-1cec4aa67914,2023-12-18 06:00:00+00:00,"„Wunderbar wandelbar – Gemeinsam neue Perspektiven schaffen“ lautete das Motto des Jahreskongresses 2023 der Deutschsprachigen SAP-Anwendergruppe e. V. (DSAG) auf der Messe Bremen. Es ging um den digitalen Wandel, besonders den technologischen Wandel mit dem Fokus u. a. auf KI, um den ökologischen und den ökonomischen Wandel. Dementsprechend stellte sich die Frage: Wie „wunderbar wandelbar“ sind die Unternehmen, SAP und das Partnerökosystem? Laut DSAG-Investitionsreport 2023 ist über die Hälfte der Befragten noch nicht sehr weit mit der digitalen Transformation. Bezüglich der eingesetzten Enterprise-Resource-Planning(ERP)-Lösungen zeigt sich, dass immer mehr Unternehmen auf S/4 Hana umsteigen, was auch mit dem Ende der Standardwartung für die Business Suite 2027 zusammenhängen dürfte. Aber rund die Hälfte der befragten Unternehmen hat die Migration noch vor sich. Zudem sind viele der Umstellungen aktuell technische Migrationen und echte Transformationen sowie Cloud-ERP noch Zukunftsmusik. „Vor dem Hintergrund der Ankündigung bei der SAP-Bilanzpressekonferenz im Juli dieses Jahres, dass maßgebliche Innovationen zukünftig nur noch Kunden mit einem Rise- oder Grow-Vertrag angeboten werden, wird es spannend zu beobachten, wie sich die Kunden hinsichtlich ihrer Transformationsprojekte entscheiden“, sagt Jens Hungershausen, DSAG-Vorstandsvorsitzender. „Wir werden mit SAP weiter im Austausch bleiben, um gemeinsam eine für alle Parteien zielführende Lösung zu erarbeiten.“"
deccf162-04ba-40e4-b096-b2240e136716,2023-12-18 06:00:00+00:00,"Ein Intel-Prozessor eignet sich gleich gut für Spiele, Textverarbeitung, Videoschnitt und Datenbanken. Damit hat Intel die Welt erobert. IBM ist in der Business-Community beheimatet und trimmte seine Power-Prozessoren auf die Anforderungen von Geschäftsprozessen und Datenbanken. Schnell war den Experten klar, dass die Prozessorarchitektur von IBM Power mehr Vorteile für Hana bringt als die Universalgenies von Intel. Mit Christian Nett, Senior SAP on Power Technical Architect bei IBM Deutschland, und Peter Kindiger, Business Development Manager, IBM Power Systems bei TD Synnex, sprach das E3-Magazin über die aktuelle Entwicklung. E3: Wie sieht die typische Serverlandschaft mittelständischer Unternehmen beim Thema SAP Hana aus? Christian Nett, IBM: Viele dieser Firmen haben bisher nur eine kleine SAP-Landschaft auf Hana migriert. Oft handelt es sich dabei um den SAP Solution Manager, weil damit die kostenlose Nutzung von SAP Hana als Datenbank verbunden ist. Diese Kunden haben die S/4-Migration mit der Umstellung ihrer ERP-Architektur noch vor sich. Da die Unternehmen noch klassische Datenbanken wie Oracle, IBM DB2, Microsoft SQL Server, SAP ASE etc. mit deutlich geringerem Ressourcenbedarf einsetzen, haben sie oft auch nur eine kleine Zahl physischer SAP-Server mit relativ wenig Hauptspeicher und CPUs. Dies ändert sich aber, wenn im Zuge der S/4-Migration der Wechsel auf Hana als Datenbank ansteht. E3: Vor welchen Herausforderungen stehen mittelständische Unternehmen, die entweder auf Hana migrieren oder ihre Hana-Kapazitäten erweitern wollen? Nett: SAP Hana benötigt deutlich mehr Hardware als klassische Datenbanken. Bei der CPU-Leistung ist es etwa der Faktor drei und beim Speicher deutlich mehr: meist das 10- bis 20-Fache. Der Memory-Bedarf hängt von der unkomprimierten Größe der klassischen Datenbank auf der Festplatte beziehungsweise SSD ab und macht etwa die Hälfte aus. Bei einer Datenbankgröße – unkomprimiert – von zwei Terabyte auf IBM DB2 benötigt SAP Hana etwa ein TB-Hauptspeicher. Daneben ist auch das Lastverhalten komplett anders als bei klassischen Datenbanken und beim SAP-Applikationsserver. SAP Hana parallelisiert sehr stark und hat dadurch sehr hohe Peaks im Verhältnis zur durchschnittlichen CPU-Last: meist zwischen fünf und 20 Prozent. Dies macht Hana zusammen mit dem SAP-Applikationsserver zur Ideallösung für eine Workload-Konsolidierung, da die Server in der Regel ein umgekehrtes CPU-zu-Memory-Verhältnis haben: einen hohen Rechenleistungs-, aber geringen Hauptspeicherbedarf. E3: Welche Lösungen gibt es? Nett: Virtualisierte IBM-Power-Server können den von SAP Hana ausgelösten hohen Ressourcenbedarf stark reduzieren und dadurch die neuen SAP-S/4-Hana-Landschaften performant und kostengünstig betreiben. E3: Wie lautet das häufigste Vorurteil gegenüber IBM Power? Peter Kindiger, TD Synnex: Viele IT-Experten glauben, Power sei teuer und nur für Großkunden geeignet! Hier werden aber häufig Äpfel mit Birnen verglichen. Bei IBM Power kostet beispielsweise die Virtualisierung keinen Aufpreis. Außerdem laufen auf den Power10-Maschinen je nach Modell bis zu 16 produktive Hana-Instanzen. Hinzu kommt, dass der Hauptspeicher um das 2,4-Fache schneller ist oder eine zwei Mal höhere Bandbreite hat als bei üblichen Industrie-DIMMs. Und die Ausfallsicherheit liegt bei garantierten 99,999 Prozent. Durch all diese Vorzüge relativiert sich der Preis sehr schnell. Nett: Man muss immer vergleichen, welche SAP-Workloads auf den Maschinen betrieben werden können. Wenn man eine TCO-Berechnung durchführt, die auf den zu betreibenden SAP-Landschaften basiert, ist IBM Power in nahezu allen Fällen die günstigste Lösung. Inzwischen gibt es auch kleinere Power-Systeme mit zwei bis acht Terabyte-Hauptspeicher, bei denen sogar der TCA-Wert, Total Cost of Acquisition, ohne den Konsolidierungseffekt kleiner ist als bei Mitbewerbersystemen. E3: Welche Argumente sprechen für den Umstieg von der Intel-x86-Plattform auf Power10-Server? Kindiger: Wer wirklich Energie sparen will, kommt um IBM Power Systems nicht herum. Hier geht es in erster Linie um Konsolidierung. Mit den Entry-Servern L1022 und L1024 lassen sich bis zu vier produktive Hana-Instanzen betreiben plus weitere Workloads für Test- oder Demo-Umgebungen. Bei der großen E1080 erhöht sich der SAP-Produktivanteil sogar auf 16 Instanzen. Ein weiterer wichtiger Vorteil: Mit Capacity on demand kann ein Unternehmen innerhalb des Systems wachsen, ohne weitere Investitionen in die Hardware tätigen zu müssen. Weitere elementare Pluspunkte der Power-Plattform sind die integrierte Sicherheit und die Ausfallsicherheit. IBM-Power-Server gibt es bereits ab vier Cores mit 32 GB Hauptspeicher bis hin zu 240 Cores mit 64 Terabyte. E3: Wie entwickelt sich der Markt mit Hana im Segment zwei bis sechs Terabyte? Nett: Die meisten Hana-Datenbanken im Mittelstand sind kleiner als sechs Terabyte. Viele Kunden müssen bis spätestens 2030 komplett auf SAP S/4 beziehungsweise SAP Hana wechseln. Deshalb entwickelt sich dieses Segment im Moment rasant und IBM partizipiert stark bei diesem Wachstum. E3: In welchen Bereichen sehen Sie die neuen Power-L-Systeme und für welche Unternehmen sind sie interessant? Kindiger: Die L-Modelle sind die optimale Wahl für den Betrieb von Linux Workloads. Der Fokus liegt auf SAP Hana mit einer Größe zwischen zwei und acht Terabyte. Mit dieser Leistung zielt IBM eindeutig auf den Mittelstand. E3: Wie sieht die Preisgestaltung der Modelle L1022 und L1024 aus? Kindiger: Konkrete Preisangaben sind schwierig, da jede Power-Maschine variabel ausgestattet werden kann. Auf jeden Fall sind die für Hana konzipierten L-Modelle preislich so attraktiv, dass sie mit jeder x86-Architektur für mittelständische Unternehmen mithalten können. Wenn man berücksichtigt, dass die Virtualisierung PowerVM ohne Zusatzkosten inklusive ist, sind die beiden Power-Systeme L1022 und L1024 sogar unschlagbar günstig – in der Anschaffung und im Betrieb. IBM verspricht einen Return of Invest von 137 Prozent in sieben Monaten! Für den Support sorgt der BM Power Expert Care. Die Laufzeit beträgt zwischen drei und fünf Jahren bei einer wählbaren Reaktionszeit von 30 Minuten bis vier Stunden. Ergänzend zur Hardware bietet IBM einen umfangreichen Software-Support an. Hier werden sämtliche IBM-Produkte abgedeckt: von Betriebssystemen wie SLES for SAP über Red Hat oder PowerVM bis IBM i und AIX. E3: Wie zukunftssicher ist die Power-Plattform und welche Neuerungen sind in den nächsten Jahren zu erwarten? Nett: Die IBM-Power-Plattform ist sehr zukunftssicher. Wir haben eine Roadmap, die weit über das Jahr 2037 hinausreicht. Am Nachfolger von Power10 wird bereits gearbeitet. Zuvor wird es jedoch auch noch Erweiterungen für die Power10-Generation geben, beispielsweise im Hauptspeicherbereich. Im Detail darf ich darüber aber noch nicht sprechen. Kindiger: Wie man von IBM hört, ist der Power-11-Chip bereits fertig entwickelt. Von daher bietet der Umstieg auf IBM Power ein hohes Maß an Zukunftssicherheit. E3: Danke für das Gespräch. ibm.com"
307b05a8-0e8c-43b7-b519-13ee8253ed10,2023-12-18 14:24:00+00:00,"Private-Equity-Firma Blackstone Wenn die frühere SAP-CEO im Taylor-Swift-Video tanzt Jedes Jahr veröffentlicht der US-Finanzinvestor Blackstone ein selbstironisches Weihnachtsvideo, in dem nahezu alle Führungskräfte auftreten. 2023 parodieren sie einen eigenen Popsong. Und in weißer Pelzjacke performt Jennifer Morgan. 19.12.2023, 13.00 Uhr Es ist gute Tradition, dass sich die Führungsriege von einer der weltgrößten Private-Equity-Firmen zu Weihnachten nicht ganz ernst nimmt. Seit 2018 veröffentlicht der Wall-Street-Gigant Blackstone jedes Jahr kurz vor den Festtagen ein selbstironisches und aufwendig produziertes Video. Im vergangenen Jahr etwa suchten Co-Gründer und CEO Stephen Schwarzman (76) und seine Topleute nach der geheimen Formel für ihren Erfolg. In ihrem 2023er Weihnachtsvideo performen sie als Popstars – und nahezu alle Vorstände und Führungsleute tanzen im Glitzerfummel auf der Bühne mit. Die Story in dem Video: Blackstone-President Jonathan Gray (53) wünscht sich, angeturnt durch den Welterfolg von Taylor Swift (34), eine ähnliche Tournee des Investors. Die anderen Führungskräfte sind skeptisch, bis Schwarzman „I love it!“ sagt. Man sieht in dem Fünf-Minuten-Clip die Vorbereitungen – und am Ende das Ergebnis: ein Musikvideo, in dem nahezu alle Topleute von Blackstone mitmachen, darunter auch Finanzchef Michael Chae oder Vorständin Christine Anderson. Als Leadsängerin tritt in weißer Pelzjacke phasenweise Jennifer Morgan (52) auf. Die frühere Co-CEO von SAP war 2020 wenige Monate nach ihrem Ausscheiden beim deutschen Software-Konzern zu Blackstone gewechselt. Dort ist sie aktuell Global Head of Portfolio Operations. Auch Gründer Schwarzman, der für das Jahr 2022 eine Gesamtvergütung von mehr als 1,2 Milliarden Dollar erhielt, lässt sich im lilafarbenen Glitzersakko einen Auftritt nicht nehmen. Empfohlener externer Inhalt An dieser Stelle finden Sie einen externen Inhalt von YouTube, der den Artikel ergänzt und von der Redaktion empfohlen wird. Sie können Ihre Zustimmung jederzeit wieder zurücknehmen. {$dispatch('toggle')}, 250);""> Externen Inhalt anzeigen Ich bin damit einverstanden, dass mir externe Inhalte angezeigt werden. Damit können personenbezogene Daten an Drittplattformen übermittelt werden. Mehr dazu in unserer Datenschutzerklärung. In der Finanzwelt stieß das Video, in dem Blackstone auch wenig dezent auf die mehr als eine Billion Dollar verwalteten Kapitals hinweist, auf geteiltes Echo. Ein Hedgfonds-Manager kommentierte in britischen Medien: „Was für eine Clown-Truppe!“ Und die britische „Financial Times“ merkte süffisant an, dass – Oh, Wunder! – die Kommentare unter dem Youtube-Video gesperrt seien. Blackstone ist einer der größten Private-Equity-Investoren der Welt. Insgesamt verwaltete das US-Unternehmen zuletzt 1007 Milliarden Dollar Kapital für institutionelle Investoren, Privatkunden und Family Offices. In den ersten neun Monaten des Jahres blieb bei 6,7 Milliarden Dollar Umsatz ein Nettogewinn von 2,3 Milliarden Dollar hängen. lhy"
