8d0cbb07-c75c-463e-bafa-00202e67f046,2023-09-08 14:30:00+00:00,"SAP plant, LeanIX zu übernehmen. Mit den Tools des Bonner Start-ups will der DAX-Konzern seine Suite für die Geschäftstransformation abrunden. Offiziell sind keine Details zum Kaufpreis bekannt. Es wird aber kolportiert, dass er über eine Milliarde Euro liegt. Anzeige LeanIX wandelt damit auf den Spuren von Signavio. Denn wie die Berliner Kollegen soll das Bonner Start-up seinen Platz unter dem SAP-Dach finden. LeanIX ergänzt die vorhandene Prozessmanagement- und Mining-Umgebung von Signavio um Enterprise Architecture Management (EAM). In Kombination sollen Unternehmen damit einen umfassenden Durchblick auf Zusammenspiel von Anwendungs- und IT-Landschaft erhalten, die in eine KI-gesteuerte Prozessmodernisierung, respektive -optimierung, fließt. Die Kundenliste des 2012 gestarteten EAM-Spezialisten umfasst über tausend Firmen – darunter namhafte Konzerne wie Adidas, Bosch, Dropbox, Santander oder Volkswagen. Die Tools von LeanIX dienen zur Visualisierung der IT-Anwendungslandschaft. Die üblichen EAM-Funktionen ergänzt das Value Stream Management (VSM), mit dem Entwickler unter anderem automatisiert ihre Services inventarisieren und ordnen können. Zudem zählt eine SaaS-Managementplattform zum Produktportfolio, mit deren Hilfe sich Einsatz und Lizenzen von SaaS-Anwendungen kontrollieren lassen. Entsprechendes Know-how hatten sich die Bonner im Frühjahr 2021 mit der Übernahme von Cleanshelf gesichert. Erst im Juli dieses Jahres lancierte LeanIX hierfür das Renewals Board-Feature zum aktiven Management künftiger SaaS-Vertragsausgaben. Im August verkündete das Unternehmen, mit Microsoft zusammenzuarbeiten, um einen KI-gestützten Assistenten für das Enterprise-Architektur-Management auf den Markt zu bringen. Dieser basiert auf einem speziellen, auf Azure gehosteten GPT-3.5-Turbo-Sprachmodell und soll Aufgaben wie Automatisierung der Dokumentation, Recherche von Nachfolgetechnologien oder Empfehlungen zur Architekturgestaltung übernehmen. Frage bleibt: Warum der Ankauf? Dass die Kombination der EAM-Features von LeanIX in SAPs Signavio Prozess-Transformationssuite Sinn ergibt, liegt auf der Hand – insbesondere wenn es darum geht, den Umstieg in die Cloud im Rahmen des Angebots RISE with SAP zu vereinfachen. Warum dies zwingend durch eine Übernahme und nicht durch eine enge Kooperation erfolgt, wirft indes Fragen auf. Schließlich pflegt LeanIX bereits eine langjährige Partnerschaft mit Signavio, die schon vor der Übernahme der Berliner durch SAP begann. Diese wurde im Juli 2022 noch einmal bekräftigt. Freuen dürfen sich indes die Investoren des als ""Soonicorn"" gehandelten Start-ups, zu denen Goldman Sachs, Insight Partners sowie Digital Transformation Capital Partners (DTCP) und damit die Telekom zählen. Denn auch wenn die beteiligten Unternehmen zum Kaufpreis keine Angaben machten, wird über eine Höhe von 1,2 Milliarden Euro spekuliert. Er fiele damit sogar noch ein wenig höher aus als der Betrag, den SAP vor zwei Jahren für Signavio auf den Tisch gelegt haben soll. Anzeige Der Abschluss der Akquisition von LeanIX wird für das vierte Quartal 2023 erwartet, abhängig von den üblichen rechtlichen Bedingungen und behördlichen Genehmigungen."
2f199430-c552-4a77-87a4-b1490f0d4cb7,2023-09-12 05:58:30+00:00,"SAP-Konkurrent Oracle mit langsamerem Cloud-Wachstum Der SAP-Konkurrent Oracle hat im ersten Quartal die Erwartungen verfehlt. Die Kunden seien wegen des unsicheren Wirtschaftsausblicks bei Cloud-Dienstleistungen zurückhaltend. Die Aktie gibt deutlich nach. 12.09.2023, 08.06 Uhr Das Wachstum des Cloud-Geschäfts beim Software-Konzern Oracle hat sich im vergangenen Quartal verlangsamt. Der Cloud-Umsatz stieg im Jahresvergleich um 30 Prozent auf 4,6 Milliarden US-Dollar (4,3 Milliarden Euro). Im Vierteljahr davor hatte es noch einen Zuwachs von mehr als 50 Prozent gegeben. Die Aktie verlor im nachbörslichen Handel am Dienstag zeitweise mehr als fünf Prozent. Insgesamt legten die Oracle-Erlöse im Ende August abgeschlossenen ersten Geschäftsquartal um neun Prozent auf 12,45 Milliarden Dollar zu. Unter dem Strich stieg der Gewinn um 56 Prozent auf 2,4 Milliarden Dollar. Oracle ist auf Datenbanken-Software spezialisiert, baut aktuell aber auch das Geschäft mit Cloud-Infrastruktur aus und konkurriert in dieser Sparte insbesondere mit Microsoft und Amazon. cwi/ Reuters, dpa-afx"
6207bf91-cfb8-4217-9fc8-87e924a9e705,2023-09-12 10:34:10+00:00,"SecurityBridge, Anbieter von Cybersicherheitslösungen für SAP-Kunden, hat den niederländischen SAP-Sicherheits-Spezialisten Protect4S erworben. Durch die Akquisition profitieren SAP-Kunden von einer umfassenden One-Stop-Shop-Softwareplattform, die ihre Sicherheitslage über sämtliche Technologie-Stacks hinweg verbessert. SecurityBridge, 2012 gegründet und mit Sitz in Ingolstadt, ermöglicht es Unternehmen mit seiner innovativen und ganzheitlichen Cybersecurity-Softwareplattform, ihre geschäftskritischen SAP-Systeme zu überwachen sowie Angriffe in Echtzeit zu erkennen und abzuwehren. Protect4S aus Wageningen/NL hat sich auf die Automatisierung und Vereinfachung von SAP-Cybersecurity spezialisiert, um den Zugang zu SAP-Sicherheit für Unternehmen aller Größen sicherzustellen. Das Security Vulnerability Research Team des niederländischen IT-Spezialisten sorgt durch seine technische Forschung im Bereich SAP dafür, dass die Zero-Day Schwachstellen erkannt und behoben werden können. Durch die nun erfolgte Akquisition erweitert SecurityBridge nicht nur seine Fachkompetenz und Innovationskraft, sondern baut zudem seine Branchenführerschaft weiter aus. Neben der Verstärkung der internationalen Aktivitäten festigt SecurityBridge zudem seine Präsenz im wichtigen Mittelstandsmarkt. „Seit unserer Firmengründung vor mehr als zehn Jahren haben wir es uns zur Aufgabe gemacht, Kunden die besten am Markt erhältlichen Lösungen zu bieten und in der gesamten Branche zum Synonym für SAP-Sicherheit zu werden“, erklärt Christoph Nagy, Geschäftsführer von SecurityBridge. „Die Akquisition unseres Mitbewerbers Protect4S ermöglicht es uns nun, , unser Portfolio durch die anerkannten Sicherheitsexperten zur Erforschung von Schwachstellen in den kritischen Unternehmensapplikationen von SAP zu ergänzen sowie gleichzeitig unsere Position als Marktführer für Cybersecurity im SAP-Ökosystem erfolgreich auszubauen.“ Ivan Mans, CTO von SecurityBridge, ergänzt: „Mit der Übernahme von Protect4S wollen wir kollektive Talente, Erfahrungen und Technologien nutzen, um unseren Kunden einen noch besseren und umfangreicheren Schutz zu bieten. Wir freuen uns darauf, gemeinsam mit unseren Kolleginnen und Kollegen von Protect4S an stetig besseren SAP-Sicherheitslösungen zu arbeiten.“ „Seit einigen Jahren befinden wir uns in einer starken Wachstumsphase und konnten dadurch unseren Kundenstamm von einigen SAP-Anwenderunternehmen in den Niederlanden auf über 50 Organisationen weltweit ausdehnen. Der Zusammenschluss mit SecurityBridge ermöglicht es uns, unseren Einfluss weiter zu stärken und unsere bisherige Mission fortzuführen. Wir sind sehr beeindruckt von der SecurityBridge-Plattform und blicken der gemeinsamen Zukunft mit Freude und Zuversicht entgegen“, kommentiert Onno Coenen, CEO von Protect4S. Durch den Zusammenschluss wollen SecurityBridge und Protect4S neue Standards im Bereich der SAP-Sicherheit setzen und gemeinsam, als global agierendes Unternehmen, die SAP-Kunden mit anpassungsfähigen Sicherheitslösungen für die effektive Bekämpfung von Cyber-Bedrohungen versorgen. Joris van de Vis, Mitbegründer von Protect4S, ergänzt: „Mein persönlicher Antrieb war es schon immer, durch die Erforschung von Schwachstellen in SAP-Systemen zu einer sichereren Welt beizutragen. Daraus leitet sich unsere Mission ab und gemeinsam mit dem SecurityBridge-Team können wir dieses Ziel effektiver und effizienter erreichen.“"
55bce00a-2d1d-44b7-9b3d-f1ce15afa040,2023-09-12 12:55:00+00:00,"Am Patchday im September hat der deutsche Softwarehersteller SAP in BusinessObjects Business Intelligence Platform und CommonCryptoLib „kritische“ Sicherheitslücke geschlossen. Darüber hinaus sind noch weitere Anwendungen attackierbar. Anzeige Die Schwachstellen Wie aus einem Beitrag hervorgeht, ist die Lücke (CVE-2023-40622) in BusinessObjects Business Intelligence Platform am gefährlichsten. Nach einer erfolgreichen Attacke soll ein authentifzierter Anwender Informationen einsehen und die Software komplett kompromittieren können. Durch das erfolgreiche Ausnutzen der zweiten kritischen Schwachstelle (CVE-2023-40309) sollen Angreifer die Authentifizierung von CommonCryptoLib umgehen können. Außerdem ist es möglich, dass Angreifer Daten in BusinessObjects Business Intelligence Platform manipulieren (CVE-2023-42472 „hoch“). Die verbleibenden Lücken sind größtenteils mit dem Bedrohungsgrad „mittel“ eingestuft und betreffen unter anderem NetWeaver. Hier können Angreifer beispielsweise für DoS-Attacken ansetzen. Darüber hinaus hat SAP noch mehrere ältere Sicherheitshinweise aktualisiert."
53d4d35b-c157-4a18-87fb-dc66be1a4344,2023-09-14 06:00:00+00:00,"Migrationen können eng mit Modernisierungs- und Innovationsthemen verzahnt werden. Die Basis bilden Open-Source-Prinzipien, Technologien und Lösungen wie offene Hybrid-Cloud-Plattformen. Bis 2027 müssen SAP-Anwender ihre Datenbanken auf Hana und Applikationen auf S/4 migrieren. Die Transformation ist mit technischen und fachlichen Herausforderungen verbunden. Parallel müssen Unternehmen hinsichtlich Wettbewerbs- und Zukunftsfähigkeit neue Themen adressieren und in der IT abdecken. Schließlich führt in der SAP-Welt kein Weg an der Nutzung moderner Anwendungen, Technologien und Architekturen vorbei. Dazu zählen hybride Multi-Cloud-Plattformen, die Cloud-native Entwicklung mit Containern und Microservices, Automatisierungslösungen, KI und ML, Data Analytics, Big Data oder IoT. Ein Hindernis bei der erforderlichen Modernisierung der Legacy-Systeme stellen vielfach die alten Lösungskonzepte, Schnittstellen und Integrationen dar, die nicht Cloud-fähig und nur in speziellen Konfigurationen nutzbar sind, etwa Backup- oder Monitoring-Tools oder Abap-basierte Add-ons aus der ECC-Landschaft. Unternehmen sollten hier die Chance ergreifen, diese Anwendungen in der SAP-Peripherie in ihre Migrationsstrategie zu integrieren und parallel zu modernisieren. Das übergeordnete Ziel ist eine Transformation der oftmals siloartig gewachsenen SAP-Landschaft in eine integrierte Unternehmens-IT als Teil einer Innovationsstrategie. Viele Unternehmen verfolgen dabei traditionell eine schrittweise Vorgehensweise: Erst nach abgeschlossener Migration wird die Modernisierung in Angriff genommen. Konkret erfolgt der Modernisierungsprozess üblicherweise in vier Phasen: von der Analyse zu Vorprojekten und zum SAP-Housekeeping, also der Optimierung der Datenhaltung, über die eigentliche technische Migration in die Zielarchitektur bis hin zur Modernisierung und Integration innovativer Lösungen. Dieses Vorgehen entspricht einer eher SAP-fokussierten Inside-Out-Betrachtung, etwa mit einer Übertragung von ERP-Systemen in die Cloud unter Nutzung des Rise-with-SAP- Angebots, gewissermaßen nach dem Motto Lift und Shift. Die Integration und Realisierung von Outside-In-Mehrwerten aus dem Nicht-SAP-Bereich werden dabei bis an das Ende der Migrationsphase verschoben. Für diesen Ablauf gab es bisher einen nachvollziehbaren Grund: Wenn bei Migrationen gleichzeitig Modernisierungen und Optimierungen vorgenommen wurden, hat dies die Projektdauer oft verlängert. Nun kann bei einer IT- Migration die Innovation von Anfang an ein integraler Projektbestandteil sein. Die Basis für die Umsetzung von Konzepten, die Migrationsszenarien mit Modernisierungs- und Innovationsthemen verbinden, sind Open-Source-Techniken, Cloud-native Entwicklungsmodelle, zertifizierte Enterprise-Kubernetes-Plattformen und Automatisierungslösungen, konkret etwa Red Hat OpenShift und Red Hat Ansible Automation Platform. Immer mehr SAP-Partner, Tools und Lösungen nutzen daher genau diesen Unterbau für die Integration der SAP-Landschaft in eine agile Prozessumgebung. Mit einem Open-Source-basierten Stack kann die Modernisierung unmittelbar starten. Ohne lange Projektvorlaufzeiten sind für Unternehmen nach einer Analysephase mit der Ermittlung des Innovationspotenzials Quick Wins und ein schneller ROI erzielbar. Die Migration wird dabei nicht beeinträchtigt und es besteht volle Transparenz über den Projektfortschritt. Eine offene Hybrid-Cloud-Umgebung dient dabei als Basis für die Modernisierung und Erweiterung der vorhandenen Abap-Eigen-entwicklungen. Und nicht zu vergessen: Durch die Cloud-agnostische Multi-Hybrid-Cloud-Nutzung gewinnen die Unternehmen eine maximale strategische Flexibilität. Gemäß dem Leitgedanken „Develop once – deploy anywhere“ können sie wahlweise On-premises-Umgebungen, Hyperscaler-Infrastrukturen oder das Rise-with-SAP-Angebot nutzen. Als Brückenbauer für die im Rahmen der Modernisierung erforderliche Automation hat sich Ansible etabliert – und zwar nicht nur für die technische Migration, sondern gerade auch mit Self-Services für die übergeordneten Innovationsthemen. Prinzipiell unterstützt Ansible in der SAP-Landschaft eine schnelle, effiziente und zuverlässige Bereitstellung und Verwaltung von SAP-Workloads. So wird Ansible zum Beispiel bei Hana-Deployments und -Konfigurationen genutzt. Ein entscheidender Punkt darf dabei nicht vergessen werden: Aus Ansible heraus kann inzwischen auch in ein laufendes SAP-System hinein automatisiert werden, um zum Beispiel Benutzerberechtigungen auszulesen und in ein anderes System einzupflegen. Zudem wird Ansible bei Hybrid-Cloud-Deployments verwendet, also bei der automatisierten Bereitstellung und Verwaltung von traditionellen und neuen containerisierten SAP-Workloads sowie von Nicht-SAP-Anwendungen. Das Ökosystem rund um Ansible wächst kontinuierlich, sodass immer Use Cases im SAP-Kontext orches-trierbar und automatisierbar sind, zum Beispiel rund um Themen wie Compliance, Governance, Security oder Sustainability. Hierbei geht es dann um die Verknüpfung verschiedener Systeme und Unternehmensprozesse über SAP hinaus und um die durchgängige Automatisierung. Eine solche Innovationstätigkeit ist für die Wettbewerbsfähigkeit von Unternehmen in der heutigen Zeit unverzichtbar. Die Beispiele KI und ML belegen dies eindrucksvoll. Nicht zuletzt durch den Hype rund um ChatGPT gewinnen sie zunehmend an Relevanz, auch bei SAP-Anwendern. Dabei kann ML in verschiedensten SAP-Bereichen effizient genutzt werden, etwa bei der Stammdatenanalyse, der Optimierung von Produktionsabläufen und Lieferketten oder der Qualitätskontrolle. Viele Unternehmen entwickeln und trainieren derzeit Modelle mit SAP-Daten, die sie anschließend in Produktivumgebungen betreiben. Eine ideale Basis für diesen Entwicklungs- und Deployment-Prozess ist wiederum eine offene Hybrid-Cloud-Plattform. Die SAP-Migration kann mit der Innovation beginnen. Es muss nicht mehr die Entscheidung zwischen Migration und Modernisierung getroffen werden, beides ist gleichzeitig und in derselben Geschwindigkeit durchführbar. Unter dem Motto „Drive by Innovation“ mit einer engen Verzahnung von Migration und Innovation."
2c490e61-8708-492b-95e8-51e117571f6b,2023-09-14 09:18:32+00:00,"Der Softwarekonzern SAP hat angekündigt, ab nächstem Jahr in Deutschland Väter und alle anderen Partner ab der Geburt ihres Kindes sechs Wochen bezahlt freizustellen. ""Wir wollen damit zeigen, dass Familienvereinbarkeit und Karriere machen keine Widersprüche sind"", sagte der Personalchef von SAP in Deutschland, Cawa Younosi. Der Dax-Konzern rechnet mit 700 bis 800 Vätern pro Jahr in Deutschland, wenn mehr als 90 Prozent der Berechtigten das Angebot annehmen. Das Unternehmen geht von Kosten in Höhe von jährlich mehreren Millionen Euro aus. In Deutschland ist ein bezahlter Sonderurlaub für Partner und Partnerinnen nach der Geburt eines Kindes bislang nicht gesetzlich geregelt. Bundesfamilienministerin Lisa Paus (Grüne) strebt eine sogenannte Familienstartzeit an, bei der Partnerinnen und Partner nach der Geburt eines Kindes eine zweiwöchige bezahlte Auszeit bekommen. Die Lohnfortzahlungen sollen den Plänen zufolge nicht die Arbeitgeber tragen müssen. Stattdessen sollen sie durch ein Umlageverfahren finanziert werden. Der Gesetzentwurf wird derzeit innerhalb der Bundesregierung beraten."
b3941808-0be2-4f33-ad72-c6dff9a93dd5,2023-09-14 09:45:58+00:00,"Der Softwarekonzern SAP ist bei der Vereinbarkeit von Familie und Beruf in die Offensive gegangen. Das Dax-Unternehmen aus Walldorf teilte am Donnerstag der Belegschaft in Deutschland mit, ab dem kommenden Jahr Väter und andere Partner nach der Geburt ihres Kindes sechs Wochen bezahlt freizustellen. „Wir wollen damit zeigen, dass Familienvereinbarkeit und Karrieremachen keine Widersprüche sind“, sagte der Personalchef von SAP in Deutschland, Cawa Younosi. Er rechne mit 700 bis 800 Vätern pro Jahr, wenn mehr als 90 Prozent der Berechtigten das Angebot annehmen. Dabei sollen Kosten in Höhe von jährlich mehreren Millionen Euro anfallen."
6ecce1af-7eac-4bd2-bded-eb927aecd63f,2023-09-14 11:49:21+00:00,"SAP stellt Väter nach der Geburt eines Kindes sechs Wochen bezahlt frei, damit sie sich um die Neugeborenen kümmern können. Das soll die Vereinbarkeit von Familie und Karriere stärken. Auch andere Konzerne zeigen sich offen. Der Softwarekonzern SAP hat angekündigt, ab dem kommenden Jahr in Deutschland Väter oder andere Partner oder Partnerinnen ab der Geburt ihres Kindes sechs Wochen bezahlt freizustellen. ""Wir wollen damit zeigen, dass Familienvereinbarkeit und Karrieremachen keine Widersprüche sind"", sagte der Personalchef von SAP in Deutschland, Cawa Younosi. Die Regierungsparteien SPD, Grüne und FDP hatte in im Koalitionsvertrag vereinbart, eine zweiwöchige bezahlte Auszeit für Partner oder Partnerinnen nach der Geburt eines Kindes einzuführen. Für diese Vorhaben werden verschiedene Begriffe verwendet, darunter ""Vaterschaftsurlaub"" und ""Väterzeit"", da sie in der Regel Vätern zugutekommt. 700 und 800 Väter könnten profitieren Bundesfamilienministerin Lisa Paus hatte am Dienstag auf eine ""Familienstartzeit"" verwiesen. Dieser Ansatz sieht vor, dass dem Partner oder der Partnerin Zeit eingeräumt wird, sich um die Mutter zu kümmern und sie während ihrer Genesung zu unterstützen. Der Gesetzentwurf befinde sich derzeit in der Beratung innerhalb der Bundesregierung, so die Grünenpolitikerin. Bereits im November des vergangenen Jahres hatte Ministerin Paus in einem Interview die Einführung für das Jahr 2024 in Aussicht gestellt, jedoch wollte sich das Ministerium auf Anfrage nicht zu einem konkreten Zeitpunkt offiziell äußern. Der DAX-Konzern SAP geht davon aus, dass in Deutschland jährlich zwischen 700 und 800 Väter von dieser Maßnahme Gebrauch machen könnten, sofern mehr als 90 Prozent der Berechtigten das Angebot in Anspruch nehmen. Mit dieser groß angelegten Initiative werden voraussichtlich Kosten in Millionenhöhe pro Jahr entstehen. SAP als Vorreiter Dass SAP mit dem Programm ein Vorreiter zu sein scheint, zeigen Anfragen bei mehreren DAX-Unternehmen. Die meisten heben in ihren Antworten bestehende Angebote hervor und betonen, sich an neue Gesetze halten zu wollen. Keines der angefragten Unternehmen ging jedoch so weit wie SAP. Vereinzelt gab es auch Kritik an dem Vorhaben der Ampelkoalition. So begrüßte Siemens zwar den Ansatz einer Väterzeit zur Förderung der Gleichverteilung der familiären Betreuungsarbeit zwischen den Geschlechtern. ""Aus Siemens-Sicht sollte jedoch - wie beim Elterngeld - die Freistellung aus Steuermitteln finanziert werden und nicht den Arbeitgebern aufgebürdet werden"", teilte der Münchener Konzern mit ""Eine zusätzliche Väterzeit halten wir vor dem Hintergrund unserer bereits bestehenden Angebote und der damit möglichen Flexibilität nicht für notwendig"", teilte der Autozulieferer und Reifenhersteller Continental mit. Reaktionen von DAX-Unternehmen ""Das bestehende Elternzeitmodell ist ein Erfolg"", teilte Thomas Ogilvie, Personalvorstand der DHL Group, mit. Die bisherigen Möglichkeiten seien gut etabliert und würden von Vätern wie Müttern gerne in Anspruch genommen. Das Unternehmen sehe keine Notwendigkeit für Änderungen und gewähre derzeit lediglich einen Tag Sonderurlaub für die Geburt und die Elternzeit, aber keine weiteren Freistellungen. Der Sportwagenbauer Porsche begrüßte die Pläne der Bundesregierung. ""Eine bezahlte Freistellung zu Beginn der Vaterschaft trägt zur besseren Vereinbarkeit von Familie und Beruf bei"", teilte eine Sprecherin mit. Zugleich bedauere Porsche, dass das Bundeskabinett die Einkommensgrenze pro Familie für den Anspruch auf Elterngeld halbiert habe. Beiersdorf und die Deutsche Telekom unterstützten Maßnahmen zur besseren Vereinbarkeit von Familie und Beruf. Beim Pharma- und Technologiekonzern Merck stehe man dem Thema ergebnisoffen gegenüber. Da das Unternehmen mit seinem Angebot bereits sehr gut aufgestellt sei, plane es momentan keine Erweiterungen. Mangelnder Sonderurlaub für Väter In zahlreichen Unternehmen in Deutschland gibt es einer aktuellen Umfrage zufolge keinen Sonderurlaub für Väter nach der Geburt eines Kindes. Das sei in 44 Prozent der befragten Unternehmen der Fall, geht aus einer Befragung des Instituts für Demoskopie Allensbach im Auftrag des Familienministeriums hervor. Demnach gewähren 26 Prozent der befragten Unternehmen einen Tag, bei weiteren 26 Prozent sind es zwei Tage.Nur vier Prozent gewähren mehr als zwei Tage. Dass fast der Hälfte der Unternehmen der Nachwuchs ihrer Beschäftigten nicht einmal einen einzigen Tag Sonderurlaub wert ist, spreche Bände über deren Wahrnehmung in Sachen Vereinbarkeit von Beruf und Familie, teilte Elke Hannack, stellvertretende Vorsitzende des Deutschen Gewerkschaftsbundes, mit. Es sei gut und richtig, dass die Familienstartzeit jetzt endlich kommen soll. ""Wir setzen darauf, dass die Koalition sie schnell ins Gesetzblatt bringt."" Das wäre ein wichtiges Signal, um die partnerschaftliche Vereinbarkeit von Familie und Beruf von Anfang an zu stärken. BDA: ""Bestehende Maßnahmen ausreichend"" Die Bundesvereinigung der Deutschen Arbeitgeberverbände (BDA) begrüßte das Bestreben vieler Eltern, mehr Verantwortung mit der Geburt ihrer Kinder zu übernehmen. Dafür brauche man allerdings keine neuen gesetzlichen Ansprüche. Elternzeit und Elterngeld gäben Familien bereits seit längerem die Möglichkeit, ab der Geburt im Beruf eine Pause einzulegen. ""Die Politik muss sich entscheiden, ob sie neue Freistellungsansprüche umsetzen möchte - oder ob sie den Arbeitskräftemangel lindern möchte"", so die BDA. Beides zusammen gehe nicht. Eine einseitige finanzielle Belastung für Unternehmen wäre zudem inakzeptabel."
a86127d1-9b7f-4440-93f1-1efdc2e7bcf4,2023-09-15 11:00:00+00:00,"Schon im November 2022 sprach Familienministerin Lisa Paus (Bündnis 90/Die Grünen) davon, eine ‚Familienstartzeit‘ einführen zu wollen. Bis 2024 wollte man den sogenannten ‚Vaterschaftsurlaub‘ umsetzen. Dabei handelt es sich um eine geplante zweiwöchige, bezahlte Auszeit für Partner*innen, um die Mutter zu entlasten und Familien gemeinsame Zeit zu ermöglichen. Zum aktuellen Zeitpunkt (September 2023) befindet sich ein Entwurf zur Familienzeit (aka Väterzeit oder Vaterschaftsurlaub) jedoch noch in der Beratung innerhalb der Bundesregierung. Einen Zeitpunkt, ab dem der Entwurf umgesetzt werden kann, gibt es aktuell auch nicht. Wie es schneller und scheinbar unbürokratischer gehen kann, zeigt nun ein großes deutsches DAX Unternehmen. 6 Wochen bezahlt frei für Partner*innen Der Softwarekonzern SAP hat angekündigt, seinen Mitarbeitenden bereits ab dem kommendem Jahr ab der Geburt ihres Kindes sechs Wochen bezahlt freigeben zu wollen. „Wir wollen damit zeigen, dass Familienvereinbarkeit und Karrieremachen keine Widersprüche sind“, sagte der Personalchef von SAP in Deutschland, Cawa Younosi. Die Zeit sollen Eltern nutzen, um ihr Baby gemeinsam kennenzulernen. Zudem soll die Unterstützung für die Mutter in den ersten sechs Wochen, dem sogenannten Wochenbett, gefördert werden. Auch lesen: Vater-Tochter-Beziehung: Das macht sie so besonders Macht das SAP Beispiel Schule? Mit seinem Vorhaben des sechswöchigen bezahlten Sonderurlaubs ist SAP bisher allein auf weiter Unternehmer-Flur. Andere große DAX-Unternehmen hätten sich auf Anfragen auf bestehende Angebote für Mitarbeiter und Mitarbeiterinnen berufen. Aber, so äußerte ein Großteil von ihnen, man wolle sich an neue Gesetze halten. Lesetipp: Deshalb sind berufstätige Mütter gute Vorbilder Die Bundesvereinigung der Deutschen Arbeitgeberverbände (BDA) äußert sich kritisch zur geplanten ‚Familienstartzeit‘. Sie vertritt die Meinung, dass die aktuellen Maßnahmen zur Unterstützung von Familien, sprich Elternzeit und Elterngeld, ausreichend förderlich seien. Vor allem die Mehrbelastung für Arbeitgeber, die den Sonderurlaub laut vorläufiger Pläne allein stemmen müssten, kritisiert die BDA."
