32ac7174-b5e9-43ec-9c8b-86470ef29761,2023-12-11 07:19:00+00:00,"Startseite Wirtschaft „Viele Mitarbeiter überschätzen ihre Leistung“: SAP-Management will Mitarbeitern strenge Noten geben Von: Amy Walker Das SAP-Management arbeitet einem Medienbericht zufolge an einem strengen Bewertungssystem für Mitarbeitende. Wer schlechte Noten hat, soll keine Boni bekommen. Berlin – Beim Softwareunternehmen SAP geht es zurück in die Schule: Nach dem Willen des Managements um Vorstandssprecher Christian Klein sollen die Mitarbeitenden künftig für ihre Leistung Noten bekommen. Darüber berichtet das Handelsblatt. Demnach soll es konkret drei Bewertungen geben, in die die Führungskräfte ihre Mitarbeiter einteilen: „Performer“ für die größten Leistungsbringer, „Achiever“ für das Mittelfeld und „Improver“ für diejenigen, die sich noch verbessern müssten. Der Konzernchef spricht im Zusammenhang mit diesem System nach Angaben der Wirtschaftszeitung von einer „Winning Culture“, also eine Gewinnerkultur, die bei SAP damit Einzug halten soll. Wer eine gute Note erhält, soll für Bonuszahlungen stärker berücksichtigt werden, heißt es weiter. Und wer schlecht bewertet wird, soll einen „Performance Improvement Plan“ verdonnert bekommen, was wohl gezielte und verpflichtende Coachings beinhalten soll. So wie beim Nachsitzen in der Schule. Betriebsräte von SAP sehen Benotung kritisch Mit diesem Benotungssystem will SAP dem Vernehmen nach drei bis fünf Prozent der Belegschaft in der unteren Kategorie einordnen. Wer zwischen den Zeilen liest, versteht auch, wie das wirken soll: Diese „unteren“ Prozent sollen systematisch unter Druck gesetzt werden und möglicherweise sogar zur Kündigung überredet werden. Schließlich ist es in Deutschland nicht so einfach, jemandem einfach zu kündigen – stattdessen muss mit Druckmitteln gearbeitet werden. „Das hält niemand lange psychisch durch“, sagt ein Betriebsratsmitglied gegenüber dem Handelsblatt. Doch ob das System wirklich kommt, ist fraglich. Denn dazu müssten Gewerkschaften und Betriebsräte zustimmen, darüber wird aber noch verhandelt. Der Betriebsratsvorsitzende der SAP SE, Eberhard Schick, sagte dazu deutlich: „Ein Bewertungssystem, welches systematisch vermeintliche Minderleister identifiziert, halte ich für sehr problematisch. Irgendwelche Quoten für Abteilungen würden das noch verschärfen. Solche Maßnahmen würden das Arbeitsklima bei SAP nachhaltig verschlechtern.“ Einige äußerten sogar die Befürchtung, dass durch das neue System auch viele gute Mitarbeiter gehen könnten, wenn sie sich mit der Unternehmenskultur nicht mehr identifizieren könnten. Psychologin findet Bewertungen gut: „Viele überschätzen ihre Leistung“ Im Gespräch mit ntv nennt die Psychologin und Unternehmensberaterin Laura Klimecki aber auch positive Seiten eines Bewertungssystems. „Die schlimmste Bestrafung für gute Mitarbeiter ist, einen schlechten zu tolerieren. So demotiviere ich die, die sehr gut performen.“ Da könne es für das Betriebsklima sogar förderlich sein, wenn die Guten das Gefühl haben, dass ihre Leistung auch gesehen wird. Und: „Viele Menschen überschätzen ihre eigene Leistung“, sagt Klimecki. Vor allem Männer neigen ihren Aussagen zufolge dazu, sich selbst zu überschätzen. Frauen hingegen schätzen sich häufiger schlechter ein, als sie sind. Es gehe bei einem Bewertungssystem also auch darum, zwischen Fremd- und Selbstwahrnehmung zu trennen."
5383ea40-4c33-45ee-9454-8c133e4f09bf,2023-12-11 10:27:28+00:00,"Die 20-70-10-Regel: darum gehts Das deutsche Unternehmen SAP teilt seine Mitarbeiter neu in drei Leistungskriterien ein. Dies vorgemacht hat der als steinharter Geschäftsmann bekannte US-Amerikaner Jack Welch. Er selbst erklärte seine 20-70-10-Regel nach seiner Laufbahn als nicht zielbringend. Performer, Achiever, Improver: Der deutsche Software-Gigant SAP wird seine über 100’000 Angestellten neu in eine der drei Kategorien unterteilen. Performer sollen Boni erhalten, Improver Nachhilfe. Während Konzernchef Christian Klein diese Massnahme gerade um die Ohren fliegt, gilt es klarzustellen: Neu ist diese Idee nicht. Die Bewertung der Belegschaft nach Leistungskategorien hat der beinharte US-Amerikaner Jack Welch eingeführt. Der 2020 verstorbene Geschäftsmann war 20 Jahre lang CEO des Konglomerats General Electric. Dabei führte der Quartalsdenker die 20-70-10-Regel ein: Die besten 20 Prozent der Angestellten sollten belohnt, die 70 Prozent in der Mitte gefördert und die schwächsten zehn Prozent entlassen werden. Welch selbst fand die Regel später dumm Jahre nach seinem Rücktritt räumte Welch ein, es sei eine dumme Idee gewesen. Schliesslich gehörten Mitarbeiter genauso zu den wichtigsten Anspruchsgruppen («Stakeholders») einer Firma, wie dies etwa Kunden tun. «Wenn Statistiken mit grossen Datenmengen hinterlegt sind, haben solche Formeln eine gewisse Berechtigung. Wenn man diese Formel aber auf kleine Mengen, beispielsweise auf kleinere Teams anwendet, sind die Resultate nicht realistisch», ordnete Personalexpertin Ursula Blumenthal auf Anfrage von 20 Minuten ein. Wo siehst du dich nach der Welch-Regel? Ganz klar: Ich bin in den Top 20 Prozent.Wahrscheinlich bin ich in der Mitte (70 Prozent).Ich gehöre wohl zu den zehn Prozent Wackelkandidaten.Diese Regel ist doch völliger Schwachsinn.Ich möchte nur das Resultat der Umfrage sehen. Ungerechtigkeiten, Frust, Demotivation «Diese erzwungenen Leistungseinteilungen führen dann zu Ungerechtigkeiten und viel Frust bei allen Mitarbeitenden», relativiert sie gleichzeitig. Das wiederum führe eher zu einer grossen Demotivation. Doch das ist nicht das einzige Problem dieser Regel. Wie diverse Studien zeigen, sind in Grossunternehmen jeweils rund 20 Prozent der Gesamtbelegschaft leistungsschwach. Heisst: Jeder Fünfte bringt nicht die im Vorfeld einkalkulierte Leistung. Bleibt zu bezweifeln, dass das Vorgehen nach Welch – vielerorts «härtester Manager der Welt» genannt – diese Prozentzahl senken würde."
7e608532-7493-4c5f-a4b8-79c07bd35af5,2023-12-11 16:56:26+00:00,"Beide Centric-Produkte haben von der SAP erneut die Built-Zertifizierung für die SAP Business Technology Plattform erhalten. Centric Cloud Solutions gab heute bekannt, dass die Produkte Centric Employee File und Centric Document Builder von der SAP erneut die Built-Zertifizierung für die SAP Business Technology Plattform (BTP) und SAP-Integration erhalten haben. Beide Lösungen helfen Unternehmen, effiziente und vollständig integrierte HR-Dokumentenprozesse aufzubauen und interagieren nahtlos mit der Technologie der SAP. „Damit unsere Kunden die Potentiale voll integrierter, digitaler Dokumentenprozesse nutzen können, müssen unsere Lösungen nahtlos mit ihren SAP-Systemen zusammenarbeiten"", sagt Jens-Peter Hess, Geschäftsführer von Centric Deutschland. „Deshalb entwickeln wir unsere Lösungen ausschließlich auf der SAP Business Technology Platform und erneuern regelmäßig unsere Zertifizierungen. Unsere Kunden haben dadurch Investitionssicherheit. Sie setzen Spitzentechnologie ein, die sich problemlos in bereits genutzten Lösungen integrieren lässt."" Mit Centric HR-Dokumente einfach verwalten und erstellen Centric Employee File ist eine wertvolle Ergänzung zu SAP HCM und SAP SuccessFactors, denn die Digitale Personalakte bringt alle Dokumente und Daten zu jedem Mitarbeiter in einer Ansicht zusammen. Alle Workflows und Genehmigungsprozesse rund um Arbeitsverträge, Zeugnisse, Personalstammdaten und sonstige Informationen zu einem Mitarbeiter können direkt aus der Anwendung heraus gesteuert werden. Centric Document Builder unterstützt Personalabteilungen bei der Erstellung von HR-Dokumenten mit Hilfe von Vorlagen, Textbausteinen und Regeln. Die aktuellen Stammdaten werden dabei direkt aus SAP HCM oder SAP SuccessFactors übernommen und die fertigen Dokumente in den Personalakten abgelegt. Ein Beispiel für die Vorteile der vollen SAP-Integration dieser Lösung ist das automatische Auslösen von Dokumentenerstellungs-prozessen im Centric Document Builder durch Ereignisse aus SAP SuccessFactors. Spotlight-Status für eine der erfolgreichsten SAP-Apps Als Spotlight App gehört Centric Employee File zu den 2 % der erfolgreichsten Apps im SAP Store und ist dort unter dem folgendem Link erhältlich: https://store.sap.com/dcp/en/product/display-2001008930_live_v1/employee-file-for-sap-solutions Centric Document Builder ist im SAP Store unter folgendem Link erhältlich: https://store.sap.com/dcp/en/product/display-2001012328_live_v1/document-builder-for-sap-solutions Das SAP Integration and Certification Center (SAP ICC) hat zertifiziert, dass Centric Employee File (Version 6.0), und Centric Document Builder (Version 4.0) auf SAP BTP aufbauen und mit SAP SuccessFactors-Lösungen unter Verwendung des SuccessFactors Extension Centers integriert sind. SAP BTP unterstützt Unternehmen dabei, ihre Geschäftsprozesse und -daten mit SAP- und Drittanbieteranwendungen zu verbinden."
b1fa7ad8-1c3e-4ca8-b30d-677370e9eca0,2023-12-12 11:00:00+00:00,"CAPITAL: Herr Hüttmann, der Dax-Konzern SAP will Mitarbeitende stärker nach Leistung bewerten und sogar Noten geben. Ist das zeitgemäß? AXEL HÜTTMANN: Dieses Konzept kommt sicherlich aus dem vergangenen Jahrtausend, aber es ist auch heute noch absoluter Standard. SAP kehrt lediglich zu etwas zurück, was in den meisten Unternehmen in Deutschland ohnehin existiert. Deswegen bin ich erstaunt, wie viel Diskussion es jetzt darum gibt. Die Welle von Emotionen, die da losgebrochen ist, wirkt fast wie eine Art Glaubenskrieg. Nur weil ein Leistungssystem Standard ist, muss es nicht sinnvoll sein. Ich bin überzeugt, dass es nicht grundsätzlich schlecht ist. Denn es zwingt zu ehrlicher Kommunikation mit den Mitarbeitenden. Früher haben Manager lange im stillen Kämmerlein diskutiert, wer befördert wird. Die Kriterien, an denen Leistung bemessen wurde, waren oft unklar. Auch heute können sich Menschen in einem Gespräch noch missverstehen. Eine Bewertung ist hingegen eindeutig, auch wenn sie manchmal schmerzhaft ist. Sie eröffnet mir als Mitarbeiter auch die Chance, zu lernen und zu wachsen. Welche standardisierten Leistungsbewertungssysteme sind heute üblich in deutschen Unternehmen? SAP wendet jetzt ein individuelles System an, bei dem Einzelpersonen relativ holzschnittartig bewertet werden. Es gibt Systeme auf kollektiver Ebene, wo man als Team bestimmte Ziele erreichen muss. Dabei werden alle gleich bewertet, auch wenn einer vielleicht mehr zum Erfolg oder Misserfolg beigetragen hat als ein anderer. Andere Konzepte arbeiten mit strukturierten Fragenkatalogen, die zunächst von den Mitarbeitern und dann von den Führungskräften bearbeitet werden. Davon geht der Trend allerdings weg, weil es oft zu Pseudodiskussionen führt. Am Ende muss schließlich ein aggregierter Wert rauskommen. Das System von SAP soll Mitarbeitende offenbar in drei Klassen einteilen: „Performer“, „Achiever“ und „Improver“. Welche anderen deutschen Unternehmen machen das ähnlich? Ich schätze, dass 70 Prozent der Dax-Unternehmen irgendeine Art der Leistungsbeurteilung haben, also Mitarbeitende nach Potenzial und Performance bewerten und in eine Matrix einsortieren. Die Skalen unterscheiden sich vielleicht, aber die Logik der einschlägigen Softwaresysteme, wie Success Factors und Workday, funktioniert ähnlich. Die verkauft SAP ja sogar selbst. Bisher hat SAP bewusst auf standardisierte Leistungen verzichtet. Warum jetzt die Kehrtwende? Das kann ich nicht beurteilen. Aber die Masse der Mitarbeitenden bei SAP macht einen ordentlichen Job, 90 Prozent werden ihre Erwartungen voraussichtlich erfüllen. Es geht darum, die Personen herauszufinden, die außergewöhnlich gute Leistungen erbringen und die, mit denen man nicht zufrieden ist. Siemens ist beispielsweise ein anderes großes deutsches Unternehmen, das mit sogenannten Growth Talks, also Wachstumsgesprächen, qualitativ bewertet. Bei Google, Apple und anderen im Silicon Valley ist das genauso. Eine quantifizierte Beurteilung gibt es dann aber trotzdem einmal im Jahr, damit man weiß, wer welche Gehaltserhöhung bekommt oder befördert werden kann. Und aus unternehmerischer Sicht ist das vollkommen nachvollziehbar. Es geht bei der Performance-Bewertung also auch darum, besonders gute Mitarbeitende zu identifizieren? Ja, das ist eine Seite der Beurteilung: Wen befördere ich? Wem gebe ich Projekte, die erfolgskritisch sind? Was bei SAP letztlich genau an die Bewertung geknüpft sein wird, also ob das Boni, Karrierechancen oder etwas anderes ist, weiß man noch nicht. Klar ist aber, dass das Unternehmen entwicklungsorientiert denkt und das muss für mich als Mitarbeitender nicht kritisch sein. Wer am unteren Ende der Skala landet, soll Weiterbildungsangebote bekommen. Inwiefern dient das Modell aber auch dazu, die Leistungsschwachen auszusortieren? Theoretisch macht das Modell das möglich, praktisch ist es aber nur bedingt zum Aussortieren geeignet. In Deutschland könnte ich auf dieser Basis niemanden entlassen, dafür müssen schon massive Verfehlungen für vorliegen. Der SAP-Betriebsrat hält es für sehr problematisch, eventuell vermeintliche „Minderleister“ zu stigmatisieren. Würden Sie die Einschätzung teilen? Aus meiner Sicht geht es vor allem darum, wie man über die Bewertung redet und welche Konsequenzen daraus folgen. Dass jemand die Erwartungen nicht erfüllt, kann ja unterschiedlichste Gründe haben: im persönlichen Umfeld, im Team, vielleicht sind die Erwartungen gar nicht klar oder es ist wirklich ein Haltungsthema. Für den einzelnen Betroffenen kann das eine kritische Situation sein, aber häufig merkt der Rest der Belegschaft ohnehin, wer mitzieht und wer sich eher zugunsten anderer ausruht. Wenn dann die Richtigen identifiziert werden, finden das die, die sich anstrengen eher hilfreich als schädlich. Einige könnten sich unter Druck gesetzt fühlen, mehr Leistung zu bringen. Der Betriebsrat hat bereits davor gewarnt, das Arbeitsklima könne sich verschlechtern. Es wird mit Sicherheit Menschen geben, die die neue Bewertung als stressig empfinden. Aber es gibt so viele Unternehmen, die dieses System haben und bei denen das Betriebsklima gut ist. Das Entscheidende ist die kulturelle Wirkung von so einer Maßnahme und dass man regelmäßiges Feedback etabliert. Dann muss am Ende niemand von einer Bewertung überrascht sein. Was bedeutet der Kurs der „Performance-Kultur“ für die Außenwirkung des Unternehmens, gerade mit Blick auf die Attraktivität für Fachkräfte und junge Bewerber? Nach meinem Gefühl wird die Attraktivität von SAP als Arbeitgeber kaum darunter leiden. Wenn ich Leistung als negativ empfinde und davon gestresst bin, dann schreckt mich das vielleicht ab. Aber eigentlich möchte doch jeder erfolgreich im Job sein und in einem erfolgreichen Unternehmen arbeiten. Ich sehe in dem Kurs eher ein klares Zeichen an Bewerber: Wer Dienst nach Vorschrift machen und bloß keinen Stress haben möchte, ist für ein agiles Softwareunternehmen wahrscheinlich nicht der Richtige."
982e2692-ca72-4c27-87a9-ba75437a6522,2023-12-12 14:58:13+00:00,"Die Bundesregierung gibt Milliardensummen für Produkte großer IT-Konzerne wie Microsoft und Oracle aus und nimmt dabei die starke Herstellerabhängigkeit in Kauf. Das geht aus einer Antwort auf eine Kleine Anfrage der Linken-Politikerin Anke Domscheit-Berg zum Thema Digitale Souveränität und Open-Source-Lösungen hervor. Darin gibt die Bundesregierung teilweise Zahlen zu Rahmenverträgen heraus. Neben der Antwort veröffentlichte Domscheit-Berg zudem eine Analyse der Angaben. Letztere umfasst auch Daten zu einzelnen Fragen aus der Anfrage, die die Bundesregierung zur Verschlusssache erklärt hat. Demnach umfassen laufende IT-Rahmenverträge zwischen dem Bund und den zehn größten Vertragspartnern 13,6 Milliarden Euro. Der Großteil von etwa zwölf Milliarden geht an über 20 Software-Hersteller aus Japan, Indien, Israel, China und vor allem aus den USA. Der Rest fließt an deutsche Unternehmen, darunter an den Softwareriesen SAP und das IT-Sicherheitsunternehmen Secunet. Zu vernachlässigen ist das Vertragsvolumen von 20.000 Euro, das kleine IT-Unternehmen aus Deutschland untereinander aufteilen müssen. Die hohen Ausgaben der Ampel für proprietäre Software und IT-Leistungen stehen im Widerspruch zu ihrer Ankündigung im Koalitionsvertrag: Man wolle sich zugunsten der Digitalen Souveränität von proprietärer Software unabhängig machen und stattdessen vermehrt auf Open-Source-Lösungen setzen. Für die Bundes-IT vergibt sie nun unter anderem großzügige Aufträge an Microsoft und Oracle. Allein diese Rahmenverträge belaufen sich auf gut sechs Milliarden Euro, wobei die Rahmenverträge mit Oracle von 4,8 Milliarden Euro den Löwenanteil ausmachen. Einer davon ist ein Einzelvertrag mit einem Volumen von 4,6 Milliarden Euro, der zudem auf sieben Jahre ausgelegt ist. Kaum Geld für Open Source Dagegen sehen die Ausgaben des Digitalministeriums für Open-Source-Software (OSS) eher mager aus. Laut Domscheit-Berg geht aus den Angaben, die die Bundesregierung als Verschlusssache erklärt hat, hervor, dass das Ministerium unter Volker Wissing (FDP) seit Ende 2021 aus dem Budget für Software-Entwicklung von mehr als 22 Millionen Euro lediglich 121.000 Euro für OSS ausgegeben hat. Auch die Ausgaben für IT-Dienstleistungen, die mit proprietärer Software arbeiten, lagen deutlich über denen für OSS, fasst Domscheit-Berg unter Verschluss stehende Angaben zusammen. IT-Dienstleistungen im Zusammenhang mit proprietärer Software, die separat von Entwicklungsaufträgen eingekauft wurden, hätten 99,5 Prozent des Gesamtvolumen von ca. 3,5 Milliarden Euro beansprucht. Die Ausgaben für OSS beliefen sich auf 18,6 Millionen Euro. Dabei sah es im vergangenen Jahr danach aus, als würde die Ampel OSS stärken. Sie richtete die Plattform OpenCoDE ein, auf der Software für die Verwaltung öffentlich geteilt und weiterentwickelt werden soll. Sie engagierte sich für den offenen Arbeitsplatz openDesk, der frei sein soll von proprietärer Software. Und sie installierte eine Behörde, deren einziger Zweck es ist, digitale Souveränität zu erreichen: das Zentrum für digitale Souveränität (ZenDiS). Zaghafte Bemühungen Doch das ZenDiS steckt noch in der Findungsphase. Künftig solle es der öffentlichen Verwaltung die Arbeit an OSS-Lösungen unterstützen, wobei es die rechtlichen und operativen Anforderungen berücksichtigt. Das Ziel sei ein leistungsfähiges deutsches und europäisches OSS-Ökosystem, so die Bundesregierung in ihrer Antwort. Zwar bewertet die Ampel solche Abhängigkeiten als kritisch und lässt mit dem ZenDiS und OpenCoDE Schritte in Richtung Digitaler Souveränität erkennen. Zu den Zielen des ZenDiS gehöre etwa auch, das Bewusstsein für den Mehrwert von OSS in der öffentlichen Verwaltung wie auch in der Gesellschaft zu stärken. Gleichzeitig erklärt sie, dass sie nicht weiß, ob OSS ein effektives Mittel sei, um Abhängigkeiten zu lösen. Das Vertragsvolumen mit Oracle jedenfalls habe „keinen unmittelbaren Einfluss auf die Digitale Souveränität.“ „Reine Lippenbekenntnisse“ Dass die Bundesregierung auf IT-Rahmenverträge mit Herstellern von proprietärer Software setzt, ist mehrfach problematisch. So können Verwaltungen breit gefasste Rahmenverträge für beliebig viele Einzelverträge nutzen, ohne jedes Mal neu ausschreiben zu müssen. Damit ersparen sie sich zwar den Aufwand, den Vergabeprozesse mit sich bringen. Allerdings führt dies dazu, dass Behörden Aufträge weniger an kleine Unternehmen vergeben, die OSS-Lösungen anbieten. Auch ist es gesetzlich nicht verpflichtend, OSS einzusetzen. Laut Entwurf für das neue Onlinezugangsgesetz (OZG) sollen Behörden „IT-Komponenten dort, wo es technisch möglich und wirtschaftlich ist, als OSS bereitstellen“ und ihr vor solcher Software den Vorrang geben, „deren Quellcode nicht öffentlich zugänglich ist oder deren Lizenz die Verwendung, Weitergabe und Veränderung einschränkt“. Doch zu bewerten, was „technisch möglich“ und was „wirtschaftlich“ ist, bleibt der jeweiligen Behörde überlassen, die die Komponente bereitstellt und weitere vergaberechtliche Vorgaben in ihre Entscheidung einpreisen muss. Doch auch an anderer Stelle hakt es. Die Bundesregierung hat keine klaren Zielvorgaben für den Einsatz von OSS aufgestellt, bis zu welchem Zeitpunkt an welcher Stelle OSS implementiert sein soll. So hat sie etwa noch keine konkrete, übergreifende Strategie entwickelt, wie sie Schnittstellen für OSS standardisieren kann. Das wäre besonders wichtig für die Interoperabilität. Zudem könnte eine solche Strategie ermöglichen, sich einen Überblick über die verwendete OSS zu verschaffen. Erste Pläne dazu hat die Bundesregierung schon gefasst, etwa die Zentralstelle Lizenzmanagement Bund (ZLB), die Daten zusammenführen und veröffentlichen soll. Das sei laut Domscheit-Berg eine sinnvolle Maßnahme, aber auch „schon lange überfällig“. Die aktuellen Zahlen zeigen nun: Die Ampel kauft wie ihre Vorgängerregierungen teure proprietäre Software für viel Geld ein. „Nicht einmal der für die Digitalstrategie zuständige Minister Wissing hält sich an das, was er darin angekündigt hat“, sagt Domscheit-Berg. Für die Entwicklung von OSS habe er lediglich 0,5 Prozent seines Budgets für Softwareentwicklung ausgegeben. OSS zu fördern und Digitale Souveränität bei IT-Entscheidungen als Richtschnur zu sehen, seien deshalb „reine Lippenbekenntnisse“, so die Abgeordnete."
573e7b50-b296-463f-8151-a0cf14ce4d22,2023-12-15 10:09:00+00:00,"Zur Ausgabe Artikel 9 / 40 Restrukturierung in Walldorf Wie die SAP-Oberen die Belegschaft auf das große Beben einstimmen SAP steht Anfang 2024 eine tiefgreifende Restrukturierung ins Haus, inklusive Sparprogramm. Rouven Westphal, Aufsichtsrat und enger Vertrauter des Co-Gründers Hasso Plattner, setzt schon mal den Ton. Von Christina Kyriasoglou 15.12.2023, 11.09 Uhr • aus manager magazin 1/2024 Sie können den Artikel leider nicht mehr aufrufen. Der Link, der Ihnen geschickt wurde, ist entweder älter als 30 Tage oder der Artikel wurde bereits 10 Mal geöffnet. manager magazin plus Jetzt weiterlesen. Mit dem passenden manager Abo. Einen Monat für € 0,99 testen. Jederzeit kündbar. Ihre Vorteile: manager magazin+ und Harvard Business manager+ im Paket Alle Inhalte von m+ und HBm+ auf der Seite manager-magazin.de und in der manager-Nachrichten-App Der Inhalt der gedruckten Magazine inkl. E-Paper (PDF) Jetzt für € 0,99 testen Ihre Vorteile: Alle Inhalte von m+ auf der Seite manager-magazin.de und in der manager-Nachrichten-App m+-Newsletter mit besonderen Leseempfehlungen Der Inhalt des gedruckten Magazins inkl. E-Paper (PDF) Jetzt für € 0,99 testen Sie sind bereits Digital-Abonnentin oder -Abonnent? Hier anmelden Weiterlesen mit manager+ Immer einen Einblick voraus Ihre Vorteile mit manager+ manager magazin+ in der App Harvard Business manager+ in der App Das manager magazin und den Harvard Business manager lesen als E-Paper in der App Alle Artikel in der manager-App Preis wird geladen... Sie haben bereits ein Digital-Abonnement? manager+ wird über Ihren iTunes-Account abgewickelt und mit Kaufbestätigung bezahlt. 24 Stunden vor Ablauf verlängert sich das Abo automatisch um einen Monat zum Preis von zurzeit 24,99€. In den Einstellungen Ihres iTunes-Accounts können Sie das Abo jederzeit kündigen. Um manager+ außerhalb dieser App zu nutzen, müssen Sie das Abo direkt nach dem Kauf mit einem manager-ID-Konto verknüpfen. Mit dem Kauf akzeptieren Sie unsere Allgemeinen Geschäftsbedingungen und Datenschutzerklärung ."
