7a73cee1-aff2-464b-a0ed-d4e4cfc6a4e1,2023-12-01 10:00:00+00:00,"Nachhaltigkeit Cloud-only? SAP Green Ledger bilanziert den CO2-Ausstoß Anbieter zum Thema Wollen Unternehmen nachhaltig wirtschaften, müssen sie künftig eine Umweltbilanz vorweisen. „SAP Green Ledger“ erfasst die Emissionen entlang der Lieferkette. Während Marktbeobachter den Funktionsumfang der Applikationen loben, kritisieren Anwendervertreter den alleinigen Cloud-Fokus. Ökologie als Ziel: Mit der auf der diesjährigen Hausmesse „Sapphire“ vorgestellten Initiative Green Ledger unterstützt SAP die Unternehmen dabei, ihre CO2-Emissionen zu reduzieren. Die Umweltbilanz soll künftig nach Meinung der Walldorfer genauso wichtig werden wie die Finanzberichterstattung. Michael McComb, Global Head of Sustainability Communications bei SAP, sagt dazu: „Der Green Ledger unterstützen Kunden dabei, Nachhaltigkeitsdaten zu erfassen, damit sie über eine genaue und gemeinsam nutzbare Aufzeichnung verfügen.“ Der Green Ledger besteht zunächst aus einer aktualisierten Version der Applikation SAP Sustainability Footprint Management, mit der sich Emissionsdaten über die gesamte Wertschöpfungskette hinweg berechnen lassen, und dem „SAP Sustainability Data Exchange“ für den Austausch von Nachhaltigkeitsdaten mit Lieferanten und Partnern. Beide Produkte sollen noch in diesem Jahr in „SAP S/4 HANA Cloud“ verfügbar sein. Podcast und Artikel: Die SAP-Vision eines Netzwerks intelligenter Unternehmen SAP-SVP Herzig: „Intelligente Systeme laufen bei uns in der Cloud“ DSAG-Jahreskongress: SAP-User hadern mit ihrem Softwarelieferanten On-Premises-User kritisieren SAPs Cloud-Strategie Nachhaltigkeit ist für die SAP kein völlig neues Thema. Bereits auf der „Sapphire 2020“ hat CEO Christian Klein dieses Thema in seiner Keynote fokussiert. Unter dem „Banner Climate 21“ sollten SAP-Applikationen den Unternehmen dabei helfen, ihre Treibhausemissionen zu erfassen und zu reduzieren. In einer auf mehrere Jahre angelegten Roadmap will SAP mit Innovationspartnern zusammenarbeiten, um Nachhaltigkeitskennzahlen in das Lösungsportfolio von SAP zu integrieren. So sollen Kunden helfen die CO2-Bilanz ihrer Produkte und ihres Geschäftsbetriebs analysieren und zu optimieren. Der Softwarehersteller sieht sich hier in einer guten Position. Laut Klein nutzen 85 Prozent der Betriebe mit den höchsten CO2-Emissionen SAP-Systeme, und das betrachtet er als Chance: „Wenn Branchen wie Versorger, Landwirtschaft und Transport ihre Emissionen mit IT reduzieren, entspricht das einer möglichen Einsparung von 26 Gigatonnen CO2.“ EU-Richtlinien erzwingen künftig das CO2-Reporting Richtlinien und Taxonomien der EU verpflichten die Unternehmen künftig dazu, Nachhaltigkeit und soziale Standards in ihrem Geschäftsbetrieb und bei ihren Zulieferern nachzuweisen. Die Unternehmen ziehen dabei mit, wie die Studie ‚ERP in der Praxis 2022/2023‘ des IT-Consultinghauses Trovarit zeigt: Das erstmals abgefragte Thema „Nachhaltigkeit“ ist auf Platz 5 von 18 Themen gelandet. Trovarit Vorstandsvorsitzender Karsten Sontow. erläutert: „Obwohl die gesetzlichen Regularien dazu großenteils noch in der Vorbereitung sind, befassen sich die Unternehmen schon heute damit, wie sie einen Beitrag zum Klimaschutz leisten und zukünftige Vorgaben erfüllen können. So fordern beispielsweise Automobilhersteller von ihren Lieferanten, dass sie ihre Aktivitäten in Richtung CO2-Neutralität nachweisen, damit sie künftig als Geschäftspartner akzeptiert werden.“ Die Bilanzierung des CO2-Ausstoßes könne kaum ohne die Stamm- und Bewegungsdaten aus dem ERP-System erfolgen: „Viele Informationen zur Ermittlung des CO2-Ausstoßes in der Lieferkette lagern in den ERP-Stammdaten, zum Beispiel: Welche Materialien werden gekauft, wie schwer sind sie und wo haben die Lieferanten ihren Sitz. Darüber hinaus können ERP-Systeme einen relevanten Beitrag zur Reduzierung von CO2-Emissionen leisten, wenn diese im Zuge von Dispositionsentscheidungen mitberücksichtigt werden.“ Datenerfassung und Daten-Management sind große Hürden Die Hürden für ein exaktes CO2-Reporting sind allerdings hoch. „Die Bilanzierung von Emissionen ist ungenau, solange sie sich auf Branchenschätzungen stützt und nicht auf tatsächliche Daten“, berichtet SAP-Manager McComb. Die SAP-Tools, die in den Green Ledger integriert sind, sollen im Vergleich dazu einen überprüfbaren Datensatz liefern: „Wir erhöhen die Genauigkeit und Granularität der Daten und gehen von den Top-Down-Durchschnittswerten zu einem Bottom-Up-Ansatz über, der dem Finanzstrom in einem Unternehmen ähnelt.“ Eine weitere Hürde ist das Zusammenführen der Daten, wie Nikolaus Hagl, Leiter des Geschäftsbereichs Public & Energie bei SAP Deutschland berichtet: „Das Daten-Management muss bei einem solchen Reporting im Mittelpunkt stehen. Die Schlüsselkennzahlen werden idealerweise nicht nur unternehmensintern, sondern entlang der gesamten Lieferkette berechnet.“ Auch, wenn die Details zu Green Ledger noch unklar sind, erscheint dieses Konzept nach Ansicht von Marktbeobachtern durchaus glaubwürdig. So formuliert es Rohit Chandrasekhar, Director SHIFT (Business Transformation/Wandel) bei PWC UK: „Sobald Unternehmen ihre Emissionen genau bilanzieren können, haben sie die Möglichkeit, den Schaden für die Umwelt zu reduzieren, indem sie nachhaltig wirtschaften und auf erneuerbare Energien setzen, um den Planeten für künftige Generationen zu erhalten.“ Jetzt Newsletter abonnieren Täglich die wichtigsten Infos zu RZ- und Server-Technik Geschäftliche E-Mail Bitte geben Sie eine gültige E-Mailadresse ein. Mit Klick auf „Newsletter abonnieren“ erkläre ich mich mit der Verarbeitung und Nutzung meiner Daten gemäß Einwilligungserklärung (bitte aufklappen für Details) einverstanden und akzeptiere die Nutzungsbedingungen. Weitere Informationen finde ich in unserer Datenschutzerklärung. Aufklappen für Details zu Ihrer Einwilligung Stand vom 30.10.2020 Es ist für uns eine Selbstverständlichkeit, dass wir verantwortungsvoll mit Ihren personenbezogenen Daten umgehen. Sofern wir personenbezogene Daten von Ihnen erheben, verarbeiten wir diese unter Beachtung der geltenden Datenschutzvorschriften. Detaillierte Informationen finden Sie in unserer Datenschutzerklärung. Einwilligung in die Verwendung von Daten zu Werbezwecken Ich bin damit einverstanden, dass die Vogel IT-Medien GmbH, Max-Josef-Metzger-Straße 21, 86157 Augsburg, einschließlich aller mit ihr im Sinne der §§ 15 ff. AktG verbundenen Unternehmen (im weiteren: Vogel Communications Group) meine E-Mail-Adresse für die Zusendung von redaktionellen Newslettern nutzt. Auflistungen der jeweils zugehörigen Unternehmen können hier abgerufen werden. Der Newsletterinhalt erstreckt sich dabei auf Produkte und Dienstleistungen aller zuvor genannten Unternehmen, darunter beispielsweise Fachzeitschriften und Fachbücher, Veranstaltungen und Messen sowie veranstaltungsbezogene Produkte und Dienstleistungen, Print- und Digital-Mediaangebote und Services wie weitere (redaktionelle) Newsletter, Gewinnspiele, Lead-Kampagnen, Marktforschung im Online- und Offline-Bereich, fachspezifische Webportale und E-Learning-Angebote. Wenn auch meine persönliche Telefonnummer erhoben wurde, darf diese für die Unterbreitung von Angeboten der vorgenannten Produkte und Dienstleistungen der vorgenannten Unternehmen und Marktforschung genutzt werden. Falls ich im Internet auf Portalen der Vogel Communications Group einschließlich deren mit ihr im Sinne der §§ 15 ff. AktG verbundenen Unternehmen geschützte Inhalte abrufe, muss ich mich mit weiteren Daten für den Zugang zu diesen Inhalten registrieren. Im Gegenzug für diesen gebührenlosen Zugang zu redaktionellen Inhalten dürfen meine Daten im Sinne dieser Einwilligung für die hier genannten Zwecke verwendet werden. Recht auf Widerruf Mir ist bewusst, dass ich diese Einwilligung jederzeit für die Zukunft widerrufen kann. Durch meinen Widerruf wird die Rechtmäßigkeit der aufgrund meiner Einwilligung bis zum Widerruf erfolgten Verarbeitung nicht berührt. Um meinen Widerruf zu erklären, kann ich als eine Möglichkeit das unter https://support.vogel.de abrufbare Kontaktformular nutzen. Sofern ich einzelne von mir abonnierte Newsletter nicht mehr erhalten möchte, kann ich darüber hinaus auch den am Ende eines Newsletters eingebundenen Abmeldelink anklicken. Weitere Informationen zu meinem Widerrufsrecht und dessen Ausübung sowie zu den Folgen meines Widerrufs finde ich in der Datenschutzerklärung, Abschnitt Redaktionelle Newsletter. Die aktuell verfolgten Wege würden dieses Ziel nicht erreichen. Unternehmen müssten stattdessen den Faktor Nachhaltigkeit in ihren Kernapplikationen abbilden. Hohe Funktionsvielfalt versus alleiniger Cloud-Fokus Das Lösungsportfolio der SAP bietet den Unternehmen laut Chandrasekhar viele Funktionen, um ihre Klimaziele zu erreichen. Die Applikation „Sustainability Footprint Management“ erlaube es, CO2-Emissionen sowohl in einzelnen Produkten als auch in der gesamten Lieferkette nachzuverfolgen. So könnten Unternehmen diejenigen Bereiche identifizieren, wo sie dank einer gesteigerten Effizienz nachhaltiger wirtschaften. „Die Green-Ledger-Initiative integriert sich mit SAP S/4HANA Cloud und ermöglicht es Unternehmen, die den CO2-Ausstoß bis auf die Ebene der Transaktionen nachzuhalten“, lobt der PWC-Analyst. Bei der Deutschsprachigen SAP-Anwendergruppe, kutz: DSAG, steht der alleinige Cloud-Fokus heftig in der Kritik, seit SAP CEO Christian Klein angekündigt hat, dass Innovationen wie Künstliche Intelligenz und Green Ledger künftig ausschließlich für Kunden verfügbar sein sollen, die „S/4 HANA Cloud Public Edition“ oder „S/4 HANA Cloud Private Edition“ über Verträge im Rahmen von „Rise with SAP“ oder „Grow with SAP“ nutzen. Kunden, die eine gehostete Hyperscaler-Implementierung außerhalb von Rise with SAP verwenden, hätten ebenso das Nachsehen wie On-Premises-Anwender. DSAG-Vorstandsvorsitzender Jens Hungershausen äußert: „Wir fordern, dass die SAP sämtliche Innovationen für S/4 HANA Public Cloud oder S/4HANA Private Cloud in gleichem Umfang auch für S/4 HANA on Premises zur Verfügung stellt.“ Darüber hinaus habedie DSAG mit SAP Gespräche aufgenommen, um Anwendern Wege in die Cloud aufzuzeigen und gleichzeitig ihre On-Premises-Investitionen zu schützen. (ID:49812603)"
4bd0cd13-8851-45e3-88c0-67c7ce8b9ff9,2023-12-01 12:58:21+00:00,"Die EU-Kommission legte schon 2022 in ihren neuen Richtlinien zur besseren Vereinbarkeit von Privatleben und Beruf verbindlich fest, dass die Mitgliedstaaten Vätern nach der Geburt ihres Kindes künftig einen Anspruch auf mindestens zehn Tage bezahlten „Vaterschaftsurlaub“ gewähren müssen. Die Regierung versprach im Koalitionsvertrag die gesetzliche Verankerung – die Umsetzung der EU-Richtlinie blieb bisher jedoch aus. Nun hat Bundesfamilienministerin Lisa Paus gegenüber der Funke-Mediengruppe mitgeteilt, einen entsprechenden Gesetzesentwurf im kommenden Jahr – also 2024 – umzusetzen. Zeit wird es: Aufgrund der Verzögerung hat die EU-Kommission bereits ein Vertragsverletzungsverfahren gegen Deutschland eröffnet. Keine konkrete Zeitangabe Wann das neue Sonderurlaub-Gesetz 2024 kommen soll, gibt Familienministerin Paus zwar nicht bekannt. Aber sie schließt aus, dass es noch in diesem Jahr passiert. Begründet wird dies mit der aktuell angespannten wirtschaftlichen Lage, in der man kleine und mittelständische Unternehmen nicht zusätzlich mit der neuen Regelung belasten wolle. Nicht nur Väter sollen profitieren Wie genau die neue Regelung, die laut Paus im Mutterschutzgesetz verankert werden soll, ausgestaltet sein wird, bleibt ebenfalls abzuwarten. Im Koalitionsvertrag hatten sich die Regierungsparteien jedoch bereits darauf verständigt, den Anspruch auf bezahlten Sonderurlaub nach der Geburt eines Kindes nicht nur Vätern einzuräumen. Obwohl die EU-Kommission in ihren Standards explizit von „Vaterschaftsurlaub“ spricht, plant die Ampel demnach, auch Partnerinnen und alleinstehenden Elternteilen nach der Geburt eine zehntägige, bezahlte Freistellung von der Erwerbsarbeit zu ermöglichen. So könnten auch gleichgeschlechtliche Elternpaare und Alleinerziehende profitieren. Das Familienministerium hatte daher als Alternative zu den Begriffen „Vaterschaftsurlaub“ und „Väterzeit“ bereits eine sogenannte „Familienzeit“ ins Gespräch gebracht. Ob und unter welchen Bedingungen hier eine Übertragung der Urlaubstage möglich sein soll, ist erstmal weiterhin offen. Ebenso wie die Frage nach der Finanzierung: Wer genau die zehn Tage Sonderurlaub für den Elternteil nach der Geburt bezahlen soll – Arbeitgeber:innen oder der Staat – wird sich dann erst im kommenden Jahr zeigen. Wie es gehen könnte, zeigte vor einigen Monaten bereits der Softwarekonzern SAP: Das Unternehmen kündigte an, Väter und Partner:innen ab 2024 nach der Geburt für sechs Wochen bezahlt freizustellen. Ziel: mehr Familienvereinbarkeit, bessere Aufgabenteilung Paus teilte mit, dass die neue Regelung zum Vaterschaftsurlaub „ein weiterer wichtiger Baustein für die Vereinbarkeit von Familie und Beruf"" sei. Das Hauptaugenmerk bei der Umsetzung läge dabei auf einer Stärkung der Bindung zwischen Eltern und Kind nach der Geburt sowie der Erschaffung besserer Rahmenbedingungen für eine partnerschaftliche Aufteilung der Familienarbeit zwischen den Elternteilen. Aktuell können Partner:innen nach der Geburt eines Kindes Elternzeit und Elterngeld beantragen – die neue Urlaubsregelung würde diesen Anspruch um zehn zusätzliche Tage mit der Familie ergänzen. Lese-Tipp: Elternzeit, Elterngeld – wer blickt da durch? Hier erfährst du mehr zu den Themen!"
84d54c22-48ab-4b6a-9f37-19a17a41d9e7,2023-12-04 07:50:22+00:00,"Anzeige Seit elf Jahren ist Apple unangefochten an der Spitze – nicht in Sachen Smartphones, da hat weltweit gesehen Konkurrent Samsung laut Statista-Angaben die Nase vorn. Doch im Markenranking „Best Global Brands“ des Beraters Interbrand landet das Tech-Unternehmen aus Kalifornien seit 2012 immer wieder auf Platz eins. So auch im Jahr 2023. Apple ist damit mit einem Marktwert von mehr als einer halben Billion US-Dollar offiziell die wertvollste Marke der Welt. Alle Achtung ... Im Vergleich zum Vorjahr konnte der iPhone-Hersteller damit seinen Markenwert noch einmal um gut vier Prozent steigern. Auf Platz zwei folgt Apples einstiger Erzfeind Microsoft, der laut Analyse der Berater von Interbrand einen Markenwert von über 316 Milliarden US-Dollar hat. Das entspricht einem Wachstum von gut 14 Prozent. Den dritten Platz belegt Online-Shopping-Gigant Amazon, der etwa ein Prozent an Markenwert zulegen konnte, mit nun knapp 277 Milliarden US-Dollar. Das liest sich alles wenig überraschend – doch aus deutscher Sicht gibt es einige Gewinner in dem internationalen Ranking. Anzeige Best Global Brands 2023: Diese drei deutschen Marken haben es unter die 20 wertvollsten der Welt geschafft Während die meisten Firmen in dem Ranking aus dem Technik- und Software-Bereich kommen, können sich gleich zwei deutsche Automobilhersteller unter den zehn wertvollsten Marken der Welt behaupten. So landet Mercedes-Benz auf Platz Sieben und konnte sich im Vergleich zum Vorjahr um einen Rang verbessern. Der schwäbische Autohersteller hat um gut neun Prozent zugelegt und hat inzwischen einen Markenwert von 61,414 Milliarden US-Dollar. Damit überholt Mercedes Coca-Cola im Markenranking. Zu den Gewinnern des Jahres zählt auch eindeutig BMW. Als dritte Automobilmarke neben Mercedes und Tesla sowie als zweite europäische Marke landet der Konzern mit einem Markenwert von rund 51 Milliarden US-Dollar erstmals in den Top Ten der wertvollsten globalen Marken. Im Vorjahr landete BMW noch auf Platz 13. Anzeige Und noch ein drittes deutsches Unternehmen ist unter den Top 20 zu finden: der Softwarehersteller SAP. Das weltweit drittgrößte Softwareunternehmen kommt auf einen Markenwert von gut 33 Milliarden US-Dollar laut Interbrand. Lesen Sie auch Unter den Top 100 des Rankings finden sich übrigens auch noch weitere deutsche Firmen: Auf Platz 31 die Allianz, Adidas belegt Rang 42, Siemens den 53. und Logistiker DHL den 84. Rang. Hier noch einmal die Top 20 der „Best Global Brands“ in der Übersicht: In Klammern steht der Markenwert. Apple (502,68 Milliarden US-Dollar) Microsoft (316,659 Milliarden US-Dollar) Amazon (276,929 Milliarden US-Dollar) Google (260,260 Milliarden US-Dollar) Samsung (91,407 Milliarden US-Dollar) Toyota (64,504 Milliarden US-Dollar) Mercedes-Benz (61.414 Milliarden US-Dollar) Coca-Cola (58,046 Milliarden US-Dollar) Nike (53,733 Milliarden US-Dollar) BMW (51,157 Milliarden US-Dollar) McDonalds (50,999 Milliarden US-Dollar) Tesla (49,937 Milliarden US-Dollar) Disney (48,258 Milliarden US-Dollar) Louis Vuitton (46,543 Milliarden US-Dollar) Cisco (43,354 Milliarden US-Dollar) Instagram (39,342 Milliarden US-Dollar) Adobe (34,991 Milliarden US-Dollar) IBM (34,921 Milliarden US-Dollar) Oracle (34,622 Milliarden US-Dollar) SAP (33,078 Milliarden US-Dollar) Allerdings gehen die Krisen auch nicht an den globalen Top-Marken spurlos vorbei, wie Interbrand in einer Pressemitteilung meldet. Insgesamt habe sich das Wachstum verlangsamt. So sei der Gesamtmarkenwert aller Unternehmen nur noch um 6 Prozent auf 3,3 Billionen US-Dollar gewachsen. Im Vorjahr 2022 waren es noch 16 Prozent gewesen. Zudem gibt es nur einen einzigen Neueinsteiger in den Top 100 des Rankings: Kaffeekapsel-Hersteller Nespresso mit einem Markenwert von sechs Milliarden US-Dollar auf Rang 98. Wieso der iPhone-Hersteller eigentlich nach wie vor so beliebt ist, könnte vielleicht auch daran liegen:"
f8a3451d-9438-4811-b6d1-5b5432e15a75,2023-12-04 12:47:37+00:00,"Die Aktie des Rüstungskonzerns Rheinmetall gehört zu den besten DAX-Werten 2023. Zusammen mit Adidas und SAP kämpft das Papier um den Spitzentitel des Jahres. Mitte November hat die Aktie bei 294,70 Euro ein neues Allezeithoch markiert. Danach folgte eine kurze Verschnaufpause. Nun nimmt das Papier erneut Anlauf auf die Rekordmarke. Befügelt wird Rheinmetall dabei auch von einem postiiven Analystenkommentar. Analystin Virginia Montorsi von der Bank of America (BofA) sorgte am Montagmorgen mit ihrem Kursziel von 410 Euro für Rheinmetall für Aufmerksamkeit. Bislang lag ihre Zielmarke für die Aktie bei 300 Euro. Zudem stufite sie die Aktie von „Neutral“ auf „Buy“ hoch. Sie begründete ihre Kaufempfehlung für den Rüstungskonzern und Autozulieferer mit einer mehrjährigen Wachstumsstory und unvergleichbarem Potenzial im Munitionsgeschäft. Dabei sei die Bewertung der Rheinmetall-Aktien im Branchenvergleich günstig. Zudem dürfte ein Bericht des Stockholmer Friedensforschungsinstituts Spiri für Unterstützung sorgen. Die Einnahmen der 100 größten Rüstungskonzerne der Welt sind trotz des Ukrainekriegs zwar zurückgegangen, so Sipri. Gleichzeitig haben die Firmen aber deutlich mehr Aufträge akquiriert. Sipri rechnet deshalb für die kommenden Jahre mit beträchtlich höheren Gewinnen. Die vier deutschen Firmen auf der Sipri-Liste – Rheinmetall, Thyssenkrupp, Hensoldt und Diehl – meldeten dagegen ein Einnahmeplus von 9,1 Milliarden Dollar, was im Durchschnitt 1,1 Prozent Zuwachs bedeutet. Als Wichtigstes Unternehmen wurde Rheinmetall genannt, das mit Einnahmen von 4,55 Milliarden Dollar von Platz 31 auf Platz 28 vorrückte."
0f548f25-60a6-4d3e-b787-0f542fd81b11,2023-12-04 20:20:00+00:00,"Sie sind die mächtigsten und einflussreichsten Aktien im DAX: SAP und Siemens. Zudem laufen beide Aktien gut. Doch auf welches Papier sollten Anleger jetzt setzen? Mit 10,5 Prozent Anteil am DAX ist SAP der einflussreichste Wert im deutschen Leitindex. Jedes Prozent, welches die SAP-Aktie gewinnt oder verliert, sorgt alleine für eine Bewegung von 0,1 Prozentpunkten beim DAX. Und bei Siemens ist das nicht viel weniger: 8,75 Prozent Anteil hat der Industrie-Konzern am DAX. Zuletzt brachten beide Papiere auch schöne Renditen, doch auf welche Aktie sollten Anleger jetzt setzen? SAP-Aktie bereits am Ende des Wachstums angelangt? Im Jahr 2023 hat die SAP-Aktie um sehr starke 52 Prozent im Wert zugelegt und befindet sich somit in einem kräftigen Aufwärtstrend. 50-Tage-Linie und 200-Tage-Linie hat das Unternehmen weit hinter sich gelassen. Kurzfristig könnte es hier zu einer kleinen Korrektur kommen, auch weil die Analysten bei Bloomberg kein Kurspotenzial mehr sehen: Zwar raten zwei Drittel der Analysten zum Kauf, doch das durchschnittliche Kursziel liegt mit 137 Euro schon 6 Prozent unter dem aktuellen Kurs. BÖRSE ONLINE setzte aber das Kursziel jüngst erst von 145 Euro auf 165 Euro rauf und rät weiter zum Kauf. Fundamental sieht es bei der SAP-Aktie auch weiter gut aus, allerdings nicht famos: Für 2024 liegt das KGV bei 24 und die Dividendenrendite bei 1,60 Prozent. Die Bewertung ist somit durchaus etwas höher. Der Gewinn je Aktie soll von 5,26 Euro in 2023 aber auf 6,15 Euro in 2024 steigen. Und in den vergangenen 5 Jahren brachte die SAP-Aktie inklusive Dividende 76 Prozent Rendite. Beim DAX waren es nur 44 Prozent. Doch wie sieht es bei der Siemens-Aktie aus? Siemens-Aktie mit Comeback Bei Siemens war das Jahr erst so gut gestartet, bevor es seit Sommer eine harsche Korrektur gab. Diese fand ihren Höhepunkt in dem Fiasko rund um die Tochter Siemens Energy. Teils wurde Siemens an einem Tag um 5 Prozent mit nach unten gerissen. Doch dann setzte die Erholung ein und beförderte die Siemens-Aktie innerhalb kurzer Zeit um rund 30 Prozent nach oben. Damit ist das Papier wieder über der 50-Tage-Linie und auch über der 200-Tage-Linie. Für die ganz große neue Euphorie sollte Siemens aber zunächst ein neues höheres Hoch bilden. In den vergangenen 5 Jahren steht auch dank einer starken Dividende insgesamt eine Rendite von 94 Prozent zubuche. Damit schlug Siemens nicht nur den DAX sondern auch SAP deutlich. Und auch für die Zukunft sehen die Analysten bei Bloomberg viel Potenzial: 92 Prozent der Analysten raten zum Kauf der Siemens-Aktie mit einem Kursziel von 181 Euro. Derweil rät BÖRSE ONLINE sogar zum Kauf mit einem Ziel von 200 Euro. Fundamental ist Siemens dazu auch nicht teuer: Für 2024 steht ein KGV von 13,4 zubuche und eine Dividendenrendite von 3,43 Prozent. Der Gewinn je Aktie soll von 10,37 Euro in 2023 auf 11,47 Euro in 2024 steigen. Doch für welche Aktie sollen sich Anleger jetzt entscheiden? Zweikampf der DAX-Schwergewichte Wir schlagen eine 60/40-Aufteilung für neu anzulegendes Kapital vor: 60 Prozent sollten in die Siemens-Aktie fließen, weil diese besser bewertet ist, eine höhere Dividende bietet und langfristig bislang besser abschnitt. Die anderen 40 Prozent sollten in die SAP-Aktie investiert werden. Anleger beachten aber, dass es kurzfristig nach dem starken Kurssprung eine kleine Korrektur geben könnte. Langfristig dürfte auch SAP weiter deutlich wachsen, allerdings ist die Bewertung aktuell anspruchsvoller und die Analysten sehen momentan weniger Kurspotenzial. Und lesen Sie auch: Neue Zins-Chance: 10 Prozent Zinsen p.a. mit der Siemens-Aktie – So funktioniert es"
