04136d59-dcfd-4bfd-9c18-2be1f865601b,2023-08-08 17:12:49+00:00,"Falsche Behauptungen zum Glasfaserausbau: Stadt stellt klar Die Stadt Wolfenbüttel haben Hinweise erreicht, dass im Rahmen des Marketings falsche Behauptungen über städtische Genehmigungen gemacht werden und dass auf dieser falschen Grundlage sogar die Kündigung bereits abgeschlossener Verträge empfohlen wird. Symbolbild | Foto: Pixabay 08.08.2023, 19:12 Uhr Wolfenbüttel. Der Glasfaserausbau in Wolfenbüttel schreitet weiter voran: Mehrere Unternehmen, sind aktuell dabei, ihre Leitungen für schnelles Internet im Stadtgebiet zu verlegen. Doch offenbar wird hierbei auch mit falschen Behauptungen gearbeitet. Die Stadt Wolfenbüttel sieht sich zu einer Klarstellung in Form einer Pressemeldung genötigt. „Die Stadt begrüßt den privatwirtschaftlichen Ausbau der Glasfasernetze in Wolfenbüttel sehr“, betont Stadtbaurat Klaus Benscheidt. Allerdings zeigt er sich irritiert über die Praktiken einiger Vertriebsmitarbeiter, die derzeit Verträge für Glasfaseranschlüsse einwerben. So haben die Stadt Wolfenbüttel Hinweise erreicht, dass im Rahmen des Marketings falsche Behauptungen über städtische Genehmigungen gemacht werden und dass auf dieser falschen Grundlage sogar die Kündigung bereits abgeschlossener Verträge empfohlen wird. Eingriff in den fairen Wettbewerb Die Stadt stellt hiermit ausdrücklich klar, dass die Unternehmen, die in Wolfenbüttel Glasfaserleitungen verlegen dafür unter Beachtung der rechtlichen und technischen Rahmenbedingungen Genehmigungen von der Stadt bekommen. Aktuell sind das LilaConnect und die Deutsche Telekom. „Dafür, dass jetzt offenbar vereinzelt versucht wird, mit falschen Behauptungen über städtische Genehmigungen in den fairen Wettbewerb der Unternehmen einzugreifen und ein inakzeptables Bild der Stadt zu zeichnen, habe ich überhaupt kein Verständnis,“ stellt der Stadtbaurat klar. Kein Auftrag durch die Stadt Die Unternehmen handeln eigenverantwortlich auf Grundlage des Telekommunikationsgesetzes und sind hierfür nicht von der Stadt beauftragt. Die Unternehmen haben Anspruch auf Genehmigungen für die Leitungsverlegungen und werden dabei selbstverständlich gleichbehandelt. Informationen rund um den Glasfaserausbau in Wolfenbüttel bekommen interessierte Einwohnerinnen und Einwohner ausschließlich bei den ausbauenden Unternehmen und den weiteren Anbietern, welche die Glasfaserleitungen nach den Regelungen des Telekommunikationsgesetzes mitnutzen dürfen. mehr News aus Wolfenbüttel"
945dcf35-eee7-4fd7-9445-75ebb413bca6,2023-08-09 20:29:00+00:00,"1N Telecom irritiert zahlreiche Verbraucher mit nicht bestellter Werbepost. Das Düsseldorfer Unternehmen preist darin etwa einen DSL-Tarif oder kostenlose Festnetztelefonate zu Mobilfunknummern an. Die Briefe sind persönlich adressiert und enthalten die Nummer des aktuellen Anschlusses der Betroffenen bei der Deutschen Telekom. Kunden der Deutschen Telekom unterschrieben das Angebot in dem Glauben, nur einen Tarifwechsel vorzunehmen, warnen Verbraucherschützer. Tatsächlich schlössen sie aber einen neuen Vertrag ab und veranlassten damit einen Anbieterwechsel. Nähmen Betroffene die Kündigung bei der Telekom zurück, gerieten sie oft noch stärker in die Bredouille. Anzeige ""Auch wenn sich das Logo in Farbe und Design auf dem Werbeschreiben unterscheidet, verwechseln viele 1N Telecom mit der Deutschen Telekom"", erklärte Kathrin Bartsch, Rechtsexpertin der Verbraucherzentrale Niedersachsen, am Mittwoch. In der Annahme, es handele sich lediglich um eine Tarifanpassung, unterschrieben Telekom-Kunden das Angebot. Sie bemerken laut Bartsch den Irrtum meist erst ""wenn ein Willkommensschreiben der 1N Telekom im Briefkasten liegt oder die Deutsche Telekom nach dem Kündigungsgrund fragt"". Ein möglicher Grund: Der entscheidende Satz: ""Ferner kündige ich hiermit meinen bisherigen Vertrag bei der Telekom und beauftrage die Mitnahme (Portierung) meiner Rufnummer"" steht erst im Auftragsformular, nicht bereits im Anschreiben. Wollen Übertölpelte zurück zur Telekom und halten dabei Fristen nicht ein, aktiviert 1N Telecom den Anschluss nicht. Vielmehr kündigen die Düsseldorfer ihrerseits außerordentlich und fordern Schadensersatz, berichtet Bartsch. Verbraucher sähen sich mit Forderungen von rund 400 Euro für die Nichterfüllung des Vertrags konfrontiert. Ob diese Höhe gerechtfertigt sei, lasse sich letztlich nur gerichtlich klären- Rücktritt binnen 14 Tage möglich ""Ein ungewollter Vertrag kann grundsätzlich fristgerecht und nachweislich widerrufen werden"", erläutert die Verbraucherzentrale. Das sei innerhalb von 14 Tagen ab Vertragsschluss möglich. Wichtig sei, den Widerruf gut zu dokumentieren und auch den alten Anbieter zu informieren. Das sollte die Rufnummernportierung verhindern. Sei es für einen Widerruf bereits zu spät, sollten sich Betroffene gut überlegen, ob der Anbieterwechsel nicht doch eine Option ist. Sie können dann ordentlich kündigen, damit der ungewollte Vertrag mit der Mindestlaufzeit endet. Viele Ratsuchende fragen die Verbraucherschützer, woher 1N Telecom die Daten hat. Sie sollten beim Datenschutzbeauftragten des Unternehmens nachfragen – auch, auf welcher Rechtsgrundlage der Kontakt erfolgt ist. Dafür stehen kostenlose Musterbriefe zum Download bereit. Eine weitere Option, sich vor ungewollter Werbepost zu schützen, sei der Eintrag in die vom Deutschen Dialogmarketing Verband (DDV) erstellte Robinson-Liste. DDV-Mitgliedsfirmen werden darüber informiert, dass postalische Werbung unerwünscht ist. Gericht verbietet unlautere Klauseln Anzeige Vor der Verbraucherzentrale Niedersachsen haben schon deren Kollegen in Rheinland-Pfalz, Sachsen und Thüringen Alarm wegen 1N Telecom geschlagen. Der Bundesverband der Verbraucherzentralen (vzbv) und die Schutzinstitution für Baden-Württemberg haben den Anbieter unter dem Vorwurf mehrerer Rechtsverstöße verklagt. Dabei erreichten sie vor Gericht, dass 1N Telecom bestimmte Vertragsklauseln nicht mehr anwenden darf. Darin hieß es etwa, Kunden müssten ihre bisherige Rufnummer übertragen. Die Rede war auch von drohender Kündigung, wenn Verbraucher mit mehr als dem doppelten Monatsbetrag im Rückstand sind. Ferner muss das Unternehmen mittlerweile eine E-Mail-Adresse zur Kontaktaufnahme angeben."
3fd9fa75-a437-41fd-906e-19ab98675bcd,2023-08-10 11:44:00+00:00,"5 Euro sind es, die zahlreiche Vodafone-Bestandskunden jetzt monatlich mehr zahlen müssen. Vodafone hat vielen Bestandskunden in den vergangenen Monaten eine Preiserhöhung zukommen lassen – selbstverständlich mit der Möglichkeit der (außerordentlichen) Kündigung. Und auch 1&1 hat für viele Bestandskunden die Preise erhöht. Doch was macht der größte deutsche Festnetzanbieter, die Deutsche Telekom? Werden auch hier die Kunden künftig mehr zahlen müssen als eigentlich vereinbart. Telekom-Chef Tim Höttges nutzte die Vorstellung der aktuellen Quartalszahlen, um dazu Stellung zu beziehen. Telekom-Chef: Preiserhöhung wäre notwendig Eigentlich, so ließ er durchblicken, müsse man die Preise deutlich anheben. Man müsse feststellen, das Lebensmittelpreise im vergangenen Jahr teilweise im zweistelligen Prozentbereich angehoben wurden, während die Preise im Telekommunikationssektor sogar um ein Prozent fielen. Man müsste die Preise in vielen Bereichen erhöhen, weil die Kosten für die Telekom gestiegen seien. Der Energiebereich dürfte neben den Personalkosten dabei wohl der ausschlaggebende Treiber sein. Doch Höttges beruhigte zumindest bestehende Kunden. „Wir sind nicht in der Lage, aufgrund der extrem hohen Wettbewerbsintensität, auch befeuert durch die virtuellen Netzbetreiber oder durch die Drittnutzer auf unseren Netzen, die Preise an die Kunden weiterzugeben“, so der Telekom-Chef. Man wolle die Marktanteile und die Kunden behalten – bei einer hohen Kundenzufriedenheit. Damit ließ er durchblicken, dass er fürchtet, bestehende Kunden mit einer Preiserhöhung aufzuschrecken und theoretisch sogar verlieren zu können. Ähnliches war Vodafone passiert. Zudem ist der Telekom – wohl auch aufgrund der ohnehin schon hohen Preise – wichtig, dass die Kunden zufrieden sind. Dazu hat man sich schon vor geraumer Zeit den Slogan „Kunden zu Fans machen“ als Maßstab gegeben. Marktdruck für Preiserhöhung zu hoch „Mir ist der Kunde, den ich betreuen darf, wichtiger als die schnelle Mark, die sich der eine oder andere Anbieter derzeit wünscht“, führte Höttges weiter aus. Dabei hatte aber auch die Telekom in der Vergangenheit schon an der ein oder anderen Stelle die Preise angehoben. Dabei ging es aber einerseits um die Tarife für Neukunden, die im April im DSL-Markt um 3 Euro monatlich stiegen. Auch Optionen wie Magenta Sport wurden zuletzt für Neukunden spürbar teurer. Andererseits zoge die Konditionen aber auch bei Bestandskunden an. Aber nur in seit Jahren nicht mehr vermarkteten Tarifen, etwa reinen Festnetzanschlüssen ohne Internet. In Kürze wird die Telekom für Neukunden auch Festnetztarife mit einer Laufzeit von nur einem Monat anbieten."
0b43cacf-4830-460a-b6c7-ce0dd8a772b0,2023-08-10 14:43:23+00:00,"Wegen Bürokratie : Telekom droht mit Abkehr von Deutschland Von Jonas Jansen 10.08.2023, 16:43Lesezeit: 4 Min. Geld verdient er in Amerika: Telekom-Chef Tim Höttges geht mit den Marktbedingungen in Europa hart ins Gericht.Lucas Bäuml Der Telekom-Vorstandsvorsitzende Tim Höttges kritisiert die Regulierung in Europa – und kündigt an, sich stärker in den USA umzuschauen. Denn dort brummt das Geschäft. Die Deutsche Telekom kritisiert die Regulierung und die wirtschaftlichen Rahmenbedingungen in Deutschland und droht damit, künftig noch stärker als bisher auf die Vereinigten Staaten zu setzen. „Die Überregulierung, die muss aufhören. Wenn das nicht passiert, werden immer mehr Unternehmen abwandern“, sagte der Telekom-Vorstandsvorsitzende Tim Höttges am Donnerstag zur Vorlage der Halbjahreszahlen von Deutschlands größtem Telekommunikationskonzern. Ohne Abo weiterlesen Dies ist kein Abo. Ihre Registrierung ist komplett kostenlos, ohne versteckte Kosten. Oder 3 Monate für 1 € pro Monat Zugang zu allen FAZ+ Beiträgen erhalten und immer aktuell informiert bleiben. Jetzt weiterlesen Dies ist kein Abo. Ihre Registrierung ist komplett kostenlos, ohne versteckte Kosten. Gleich geschafft! Bitte bestätigen Sie Ihren Account über den Bestätigungslink in der gesendeten E-Mail"
3e4eec36-241f-4047-9529-e5b6084752c4,2023-08-10 17:03:00+00:00,"Telekom-Chef Timotheus Höttges findet die deutsche Wirtschaftspolitik zu verbraucherorientiert. Die Verantwortlichen müssten sich die Frage stellen, wieso die Unternehmen immer weniger in Deutschland investierten: „Es muss sich dringend etwas ändern“, forderte der Telekom-Chef bei der Vorstellung der Zahlen seines Unternehmens im zweiten Quartal. Er kritisiert die Wirtschaftspolitik dafür, dass vor allem auf niedrige Preise geachtet werde. Die Unternehmen erhielten zu wenig Chancen für Wachstum: „Wir müssen wachsen, um Wohlstand zu wahren“, so Höttges. Auch die Telekom stelle sich die Frage, ob sich Investitionen in Deutschland weiter lohnten oder man auf andere Märkte umschwenken müsse: „Sollten sich die Weichenstellungen nicht ändern, sehen wir uns gezwungen, Investitionen ins Ausland zu verlagern.“ Was den Telekommunikationsmarkt betrifft, sieht Höttges falsche Weichenstellungen. Das betreffe beispielsweise die diskutierte Diensteanbieterverpflichtung auf dem Mobilfunkmarkt. Der Bund kann Netzbetreibern vorschreiben, anderen Mobilfunkanbietern, die kein eigenes Netz haben, Kapazitäten zu vermieten. Die können dann über die fremden Netze eigene Angebote vermarkten. Darüber ist beispielsweise Freenet groß geworden. Diese Regelung gab es früher, seit einigen Jahren gibt es nur noch ein „Verhandlungsgebot“ zwischen den Firmen. Die Bundesnetzagentur muss in den nächsten Monaten über die Bedingungen für eine Neuvergabe von Mobilfunkfrequenzen entscheiden, für die Nutzungslizenzen Ende 2025 auslaufen. Höttges hält die Einführung einer Dienstanbieterverpflichtung für falsch. Es gebe bereits intensiven Wettbewerb. Nach einem weiteren Kundenwachstum im zweiten Quartal hat die Deutsche Telekom ihre Gewinnprognose leicht erhöht. Für das Gesamtjahr erwartet der Dax-Konzern jetzt ein um Sondereffekte bereinigtes Betriebsergebnis vor Zinsen, Steuern und Abschreibungen (Ebitda AL) von rund 41 Milliarden Euro erwartet, nach zuvor rund 40,9 Milliarden Euro. Der bereinigte operative Gewinn wuchs im zweiten Quartal um 1,5 Prozent auf zehn Milliarden Euro. „Unsere Geschäfte entwickeln sich trotz komplexer Marktumfelder positiv“, sagte Höttges. Sowohl das europäische als auch das US-Geschäft trügen zur Anhebung der Gewinnprognose bei. Der Eindruck sei falsch, dass der Geschäftserfolg vorrangig aus dem Geschäft der US-Tochter T-Mobile US stamme. Höttges stimmte die Beschäftigten des Unternehmens auf einen Sparkurs ein. Zusätzlichen Personalabbau schloss er dabei nicht aus. Seit vielen Jahren baut die Telekom laut Illek jedes Jahr 3000 bis 4000 Stellen in Deutschland ab. Auch die Telekom spüre die Auswirkungen durch deutlich höhere Preise bei Energie und Material. Anders als andere Industrien könne das Unternehmen aufgrund des Wettbewerbsdrucks höhere Kosten nicht durch Preiserhöhungen kompensieren. Das Unternehmen wolle aber die Investitionen nicht zurückfahren. „Wir müssen also effizienter werden und unsere Strukturen überprüfen“, sagte Höttges. Das Augenmerk gelte den indirekten Kosten im Unternehmen. Besonders in den Zentralfunktionen und unternehmensinternen Dienstleistungen: „Helfen sollen uns dabei Digitalisierung und auch Künstliche Intelligenz. Aber auch ganz klassisch, indem wir sparen.“"
b6d3afdd-de93-477d-acae-441692749379,2023-08-10 22:00:00+00:00,"Magenta bzw. Magenta Telekom ist der Markenname, unter dem die T-Mobile Austria GmbH, ein Tochterunternehmen der Deutschen Telekom, in Österreich ihre Telekommunikations-Dienstleistungen anbietet. Dazu gehören Mobilfunk-, Festnetz-, Internet- und TV-Angebote sowie verschiedenste Lösungen für Privat- und Businesskunden. Mit einem Marktanteil von 25,3 % ist Magenta Telekom der zweitgrößte Mobilfunkanbieter in Österreich, hinter A1 mit 38,2 % und vor Drei mit 21,9 % (Marktanteile Q4/2022). Das Unternehmen bedient in Österreich rund 5,2 Millionen Kunden. Per Ende 2022 hatte Magenta rund 4,5 Millionen SIM-Karten ausgegeben. 663.000 Kunden nutzten das Highspeed-Kabelinternet bzw. DSL-Angebot des Unternehmens. Mit rund 2.200 Mitarbeiterinnen und Mitarbeitern konnte das Unternehmen im Jahr 2022 einen Umsatz von rund 1,39 Mrd. € erwirtschaften. Aktueller CEO ist Rodrigo Diehl (geb. 1975). Die T-Mobile Austria GmbH entstand durch die Übernahme von max.mobil, das im Oktober 1996 als erstes privates Mobilfunkunternehmen in Österreich gestartet war. Im April 2000 übernahm die Deutsche Telekom max.mobil zur Gänze. Zwei Jahre später, mit 18. April 2002, wurde der Markenname max.mobil durch „T-Mobile Austria“ ersetzt. T-Mobile Austria hat in der Folge seine Position am Mobilfunkmarkt kontinuierlich ausgebaut, auch durch Übernahmen weiterer Unternehmen. Meilensteine der weiteren Entwicklung waren etwa die Übernahmen des Mobilfunkbetreibers tele.ring im Jahr 2005 und die darauf folgende Integration des Unternehmens sowie von UPC Austria im Jahr 2019. Die Marke tele.ring wurde bis März 2020, zuletzt nur noch als Diskont- und Wertkarten-Angebot weitergeführt. Mit Mai 2019 wurde ein großes Rebranding vollzogen. Das Unternehmen T-Mobile Austria tritt seither in Österreich unter dem Markennamen „Magenta“ bzw. „Magenta Telekom“ oder „Magenta T“ auf. Im von stetigen Innovationen Mobilfunk-Business stand und steht das jetzige „Magenta“ in einem permanenten, geradezu sportlichen Wettkampf mit den Mitbewerbern, besonders A1 und Drei. 2008 konnte das Unternehmen für sich verbuchen, als erster Netzbetreiber das damals in der ersten Generation verfügbare Apple iPhone im Sortiment zu haben. 2009 brachte T-Mobile/Magenta das erste Android-Gerät und 2012 das erste Windows-Phone-8 nach Österreich. Einen ähnlichen Wettlauf gab es beim Start der 4G LTE-Netze. T-Mobile/Magenta rühmt sich, im Oktober 2010 das erste LTE-Netz Österreichs in Innsbruck in Betrieb genommen zu haben. Der Breitband-Internetausbau wurde in der Folge konsequent vorangetrieben. 2019 ersteigerte das Unternehmen Lizenzen für den österreichweiten Betrieb eines 5G-Mobilfunknetzes. Der Auf- und Ausbau der 5G-Versorgung hat seither technisch und netzwerkseitig Top-Priorität. Magenta bietet österreichweit Mobilfunk-Netzwerkverfügbarkeit von 97 %. Für Privatkunden bietet Magenta Mobilfunk, Internet und TV in verschiedenen Paketen und Tarifen an. Die jeweiligen Angebote unterscheiden sich grundsätzlich in den darin enthaltenen Datenübertragungsraten, Datenvolumen, Gesprächsminuten sowie der geografischen Gültigkeit der Inklusiv-Tarife. Für den darüber hinausgehenden Bedarf können Zusatzpakete erworben werden. Wie allen weiteren Mobilfunkanbieter gestaltet auch Magenta seine Produkte, Produktbündel und Preise immer wieder neu. Hinzu kommen laufend Aktionen. Für konkrete Produkt- und Preisinformationen finden Sie daher in der Folge die jeweiligen Links zur Website des Unternehmens. Magenta bietet zudem Smartphones, Tablets und Smartwatches verschiedener Hersteller an, darunter Apple, Samsung, Xiaomi und Huawei. Kunden können diese Geräte in Kombination mit verschiedenen Tarifen zu teilweise sehr günstigen Konditionen erwerben. T-Mobile Austria/Magenta hat 2015 den Status ""klimaneutral"" erlangt. Darüber hinaus wurde 2012 ein Energiemanagement etabliert und das Unternehmen hat sich zum Ziel gesetzt, bis 2040 für die gesamte Wertschöpfungskette die Klimaneutralität zu erreichen. Weitere Teile der #greenmagenta Initiative sind die Umstellung auf elektronische Abrechnung, Öko-Kassenbons und rePet-Tragetaschen. 2011 hat Magenta den #TUN-Fonds und den #TUN-Award ins Leben gerufen. Seither werden jährlich Preisgelder für innovative Klimaschutz-Projekte vergeben. Mit einem Rückkaufprogramm forciert Magenta die Wiederverwendung von gebrauchten Geräten, Magenta hat zudem das nach Nachhaltigkeitskriterien produzierte „Fairphone“ im Angebot und unterstützt etliche weitere Projekte wie Aufforstungs-Initiativen oder die Klimaschutzinitiative „Glacier“. Das Unternehmen hat ein Leitbild formuliert, in dem Toleranz, Meinungsfreiheit und soziale Inklusion und digitale Inklusion zentrale Punkte darstellen. Um die digitale Inklusion zu unterstützen, wurden verschiedene Initiativen wie ConnectedKids ins Leben gerufen. Eine Workshop-Reihe zur Verbesserung der Medienkompetenz von Lehrkräften, Kindern, Jugendlichen und Eltern. Im Jahr 2020 wurde gemeinsam mit der Caritas das ""Plaudernetz"" ins Leben gerufen. Dessen Ziel ist, Menschen zu vernetzen und der Einsamkeit entgegenzuwirken. Das Plaudernetz wurde mit dem World Summit Award Austria ausgezeichnet. Ein weiteres Projekt gegen die Vereinsamung älterer Menschen, das gemeinsam mit der Caritas umgesetzt wird, ist die Installation von Internet-Routern in Caritas Pflegewohnheimen, die den Bewohnerinnen und Bewohnern Videoanrufe ermöglichen. Auch lobby.16, die Bildungsinitiative für Jugendliche mit Fluchterfahrung, wird durch ein Angebot an Lehrplätzen von Magenta unterstützt."
79513f55-1f69-4269-9bef-686756b10cfc,2023-08-11 09:19:00+00:00,"Startseite Wirtschaft Telekom-Chef droht mit Investitionsverlagerungen ins Ausland Für viel Geld hat die Deutsche Telekom ihr 5G-Handynetz im Inland verbessert und ihr Festnetz mit Glasfaser auf ein neues Level gehievt. Wie geht es auf lange Sicht weiter? Bonn - Telekom-Chef Tim Höttges hat die Bundespolitik davor gewarnt, die für die Digitalisierung dringend benötigten Investitionen mit falschen Regeln abzuwürgen. „Sollten sich die Rahmenbedingungen nicht ändern, sehen wir uns gezwungen, unsere Chancen noch stärker im Ausland und damit vor allem in den USA zu nutzen“, sagte der Vorstandsvorsitzende in Bonn. In den USA sei der Umsatz pro Kunde in der Telekommunikationsbranche drei Mal höher als hierzulande. Nach Darstellung von Höttges lohnten sich Investitionen hier kaum, auch weil die Preise für Telekommunikationsdienstleistungen niedrig seien. Die Telekom gibt derzeit Milliarden aus, um im deutschen Festnetz Glasfaser zu verlegen und das 5G-Handynetz auszubauen. Die Ertragsperle des Bonner Konzerns ist allerdings die amerikanische Tochter T-Mobile US. Noch investiere man „patriotisch“, sagte Höttges mit Blick auf die Inlandsinvestitionen. „Das können wir aber nur tun, weil wir die Bilanz von unserem amerikanischen Geschäft im Rücken haben - wir könnten nicht so viel investieren, wenn wir nicht den enormen Cashflow und die enorme Finanzstärke aus den USA hätten.“ Höttges stellte klar, dass es bei den Inlandsinvestitionen zu einem Kurswechsel kommen könnte. „Wir müssen uns ganz nüchtern die Zahlen legen - wir sind ein Unternehmen und da geht es nicht darum, patriotische Entscheidungen zu treffen.“ Vielmehr müsse man Investitionsentscheidungen gegenüber Aktionären rechtfertigen. Seine Firma habe „sehr viele hochprofitable Möglichkeiten, um ihr Geschäft zu erweitern“, sagte Höttges und machte deutlich, dass diese Stand heute nicht in Deutschland seien. Kritik an der Mobilfunk-Frequenzen-Versteigerung Die Kritik von Höttges bezieht sich unter anderem auf die gängige Praxis, dass die Bundesrepublik alle vier bis fünf Jahre Mobilfunk-Frequenzen versteigert und die Netzbetreiber dafür Milliarden bezahlen. „Wir regulieren komplett an den Themen vorbei.“ Anstatt für die richtigen Rahmenbedingungen für einen guten Netzausbau zu sorgen, veranstalte der Staat „artifizielle Auktionen, die extrem viel Geld verschlingen, was hinterher irgendwo im Staatssäckel verschwindet, aber nicht in der Infrastruktur“. Im kommenden Jahr gibt es vermutlich die nächste Mobilfunk-Auktion. Es ist allerdings möglich, dass es diesmal keine Versteigerung gibt, sondern dass Frequenzen zugeteilt werden und sich die Firmen zu ambitionierten Ausbauauflagen verpflichten. Bei der anstehenden Vergabe könnte es zudem zu einer sogenannten Diensteanbieterverpflichtung kommen, bei der Mobilfunkfirmen ohne eigenes Netz - etwa Freenet - Zugriff auf die etablierten Netze bekommen. Solch eine Regelung, die von Bundespolitikern überwiegend positiv gesehen wird und den Wettbewerb ankurbeln könnte, ist ein rotes Tuch für den Manager - er will nicht, dass seine Firma Konkurrenten auf das teuer gebaute eigene Handynetz lassen muss. Freie Verhandlungen sollte es geben, aber keinen Zwang zur Netzöffnung, so Höttges. Die Diensteanbieterverpflichtung hätte negative Konsequenzen für die Ausbauintensität in Deutschland, warnte der Firmenchef. Nach seiner Darstellung würden die hohen Investitionen in das Netz entwertet, wenn die Konkurrenz mit demselben Netz am Markt auftrumpfen könnte. Der Netzbetreiber bekäme zwar Miete, die wäre laut Höttges aber zu niedrig. „Das ist nicht gut für den Gesamtmarkt, das ist nur gut für den Diensteanbieter.“ Um Deutschland und Europa wettbewerbsfähig zu halten, seien andere Rahmenbedingungen nötig. „Wir brauchen einen Schulterschluss zwischen Politik und Unternehmen“, sagte der Manager. „Nur gemeinsam können wir Europas Wirtschaftsordnung zukunftsfähig machen.“ Die Deutsche Telekom legt Quartalszahlen vor Die Deutsche Telekom hat nach ihrer Tochter T-Mobile US ebenfalls die Jahresziele feingeschliffen. Für 2023 soll nun ein branchenübliches Ergebnis vor Zinsen, Steuern und Abschreibungen inklusive Leasingkosten (Ebitda AL) von 41,0 Milliarden Euro zustande kommen, wie das im Dax notierte Unternehmen in Bonn mitteilte. Das ist aber nur minimal mehr als bislang erwartet. Das Ziel für den freien Barmittelzufluss (Free Cashflow) bleibt bei mehr als 16 Milliarden Euro. Bereits vor zwei Wochen hatten die Amerikaner Hand an ihren Ausblick gelegt. In der Vergangenheit war der Mutterkonzern aus Bonn dann regelmäßig gefolgt. Unterdessen gewann die Telekom in Deutschland im zweiten Quartal unter eigenen Marken 319.000 Mobilfunkkunden für sich - fast zwei Drittel mehr als von Analysten erwartet. Der Wettbewerber Telefonica Deutschland (O2) hatte einen ähnlich starken Zuwachs gemeldet, während der britische Konkurrent Vodafone netto 24.000 Verträge zählte. Auf Konzernebene ging der Umsatz des zweiten Quartals gegenüber dem Vorjahr um 2,4 Prozent auf 27,2 Milliarden Euro zurück. Das lag vorrangig an schwächeren Verkäufen von Endgeräten, von denen bei Telekomunternehmen kaum etwas hängen bleibt. In den USA fährt T-Mobile zudem das Leasing von Mobilfunk-Endgeräten zurück. Mit Dienstleistungen wie Sprach- und Daten-Übertragungen verdienen sie dagegen deutlich mehr. Der Service-Erlös stieg um 1,4 Prozent. Entsprechend stieg das operative Ergebnis inklusive Leasingkosten (Ebitda AL) der Monate April bis Juni um 1,5 Prozent auf gut 10 Milliarden Euro. Unter dem Strich verdiente die Deutsche Telekom mit 1,5 Milliarden Euro gut 5 Prozent mehr. dpa"
