5601ec49-c776-4343-a290-16ae1cf24a3a,2023-02-10 11:28:22+00:00,"Meitingen, 10. Februar 2023 MEDIENINFORMATION 4.420 Glasfaser-Anschlüsse für Markt Meitingen Zentrum und Herbertshofen Gigabit Geschwindigkeit möglich Kostenfreien Hausanschluss sichern: www.telekom.de/glasfaser Anschluss des Gebäudes bis 30.04.2023 beauftragen _______________________________________________________________ Die Telekom baut in der Marktgemeinde Meitingen im Zentrum und in Herbertshofen ein Glasfasernetz für rund 4.420 Haushalte und Unternehmen. Die Arbeiten beginnen im Mai dieses Jahres. Das neue Netz ermöglicht Privatkund*innen hohe Bandbreiten bis 1 Gbit/s (Gigabit pro Sekunde). Außerdem können Unternehmen aus Meitingen Zentrum und Herbertshofen künftig Geschäftskundentarife bis 100 Gbit/s buchen. Damit haben Kund*innen einen superschnellen Anschluss für digitales Lernen und Arbeiten, Streaming und Gaming, alles gleichzeitig. Erster Bürgermeister Dr. Michael Higl hebt die Bedeutung von schnellen Internetverbindungen hervor: „Glasfaser ist die Schlüsseltechnologie für unsere digitale Gesellschaft. Das neue Netz erhöht die Attraktivität unserer Kommune. Es sichert die Zukunftsfähigkeit als Wohn- und Wirtschaftsstandort. Der Glasfaseranschluss steigert außerdem den Wert einer Immobilie.” „Der Wechsel auf das Glasfasernetz gestaltet sich einfach und unkompliziert. Wer sich vor Baustart bis zum 30.04.2023 für einen Glasfaser-Anschluss entscheidet, bekommt ihn kostenfrei. Hauseigentümer*innen sparen damit 799,95 Euro“, sagt Christian Stern, Regiomanager der Telekom. Was jetzt wichtig ist Der Glasfaseranschluss kommt nicht von allein ins Haus. Wer als Immobilienbesitzer*in einen Glasfaseranschluss haben will, muss der Telekom das Einverständnis geben, den neuen Anschluss zu legen. Auch wer zur Miete wohnt, kann den Glasfaseranschluss bei der Telekom beantragen: Sie kontaktiert die Vermieter*innen. Dann wird besprochen, wo die Glasfaser ins Haus kommt und wie sie im Haus verläuft. Auch Mieter können Glasfaser bekommen Jeder Mieter kann einen Glasfaseranschluss bestellen. Solange dem Vermieter keine Kosten entstehen, kann dieser seine Zustimmung nicht verweigern. Die Telekom wird die Baumaßnahme mit dem Eigentümer abstimmen. Gleiches gilt für Eigentümer in Mehrparteienhäusern: Auch sie können einen Glasfaseranschluss beantragen. Es ist sinnvoll, im Zuge des Glasfaser-Ausbaus alle Wohnungen mit einem Anschluss auszustatten. Denn ein Glasfaseranschluss bedeutet für den Eigentümer eine erhebliche Wertsteigerung. Außerdem ist eine Immobilie mit Glasfaseranschluss für die Zukunft bestens gerüstet. Auch lässt sie sich einfacher vermieten oder verkaufen. Darüber hinaus bietet der Glasfaser-Anschluss alle Möglichkeiten für digitale Anwendungen: Zum Beispiel Homeoffice-Anbindung, Smart Home, IP-TV, Streaming Dienste, Online Gaming oder auch Telemedizin. Mehr Informationen zur Verfügbarkeit und den Tarifen der Telekom: Telekom Partner H & M electronics, Schloßstraße 2B, 86405 Meitingen www.telekom.de/glasfaser Hotline 0800 22 66 100 (kostenfrei) Für Unternehmen aus Meitingen Hotline 0800 33 01300 (kostenfrei) E-Mail: vollglas@telekom.de www.telekom.de/vollglas Deutsche Telekom AG Corporate Communications Dr. Markus Jodl, Pressesprecher Tel.: 0228 181 – 49494 E-Mail: medien@telekom.de Weitere Informationen für Medienvertreter*innen:"
d56d4c2a-f48d-4fcf-85c9-e3f29dc284ab,2023-02-13 06:00:14+00:00,"Das neue Joint Venture der größten Telekommunikationsanbieter Europas wird eine technische Plattform für digitale Werbung in Europa betreiben. Beteiligt sind die Deutsche Telekom AG, Orange SA, Telefónica SA und Vodafone Group Plc zu jeweils gleichen Teilen. Das Ziel: Den Werbemarkt revolutionieren. Die Europäische Kommission habe die Gründung gemäß der EU-Fusionskontrollverordnung genehmigt, teilten die Unternehmen jetzt mit. Joint Venture mit Sitz in Belgien Die neu gegründete Joint-Venture-Holding wird ihren Sitz in Belgien haben. Das Management sei unabhängig von den bisherigen vier Firmen. Es werde unter Aufsicht eines von den Anteilseignern ernannten Aufsichtsrats geleitet, teilte die Telekom als einer der Eigner mit. Das Joint Venture ist das Ergebnis eines von Vodafone initiierten und von den vier Betreibern durchgeführten Projekts. Das Ziel ist, eine technische Lösung für digitale Werbung in Europa zu entwickeln. Die Plattform sei nach Angaben der Unternehmen von Anfang an so konzipiert, dass sie mit den europäischen Datenschutzrichtlinien wie GDPR und der ePrivacy-Richtlinie konform ist. Einen ersten Test in Deutschland gab es bereits, weitere könnten in Frankreich und Spanien erfolgen, um die Plattform weiterzuentwickeln. Dabei beabsichtigen sie, diese Plattform jedem Netzbetreiber in Europa zur Verfügung zu stellen. Neue Plattform wurde schon von Telekom und Vodafone getestet Auf der Testplattform gibt erst die ausdrückliche Zustimmung der Verbraucher Marken die Möglichkeit, über Verlage und Medienhäuser mit ihnen zu kommunizieren. Die einzigen Daten, die dann weitergegeben werden sollen, ist demnach ein pseudonymisierter, digitaler Token. Dieser soll nicht zurückverfolgbar sein. Die Verbraucher können mit einem einzigen Klick ihre Zustimmung erteilen oder verweigern und auch alle anderen bereits erteilten Zustimmungen widerrufen. Das tun sie entweder auf der Website der Marke oder des Verlags oder über ein zentrales Datenschutzportal. Die Plattform sei speziell darauf ausgerichtet, dir als Verbraucher mehr Kontrolle, Transparenz und Schutz deiner Daten zu bieten. Aktuell würden diese in großem Umfang von großen, außereuropäischen Akteuren gesammelt, verbreitet und gespeichert."
2cb29a0e-16fd-48c9-a8b1-7ee525fef84a,2023-02-15 16:31:00+00:00,"Startseite Wirtschaft Kabelpanne auf Baustelle löst Chaostag bei Lufthansa aus Viele Lufthansa-Passagiere hatten am Mittwoch mit Ausfällen und Verspätungen zu kämpfen. Die Ursache war vergleichsweise banal, hatte aber gravierende Auswirkungen auf den Betrieb. Frankfurt/Main - Ein schwarzer Tag für die Infrastruktur in Deutschland: Beim dringend notwendigen Ausbau einer Bahnstrecke zwischen Frankfurt und Kassel kappt ein Bagger Glasfaserkabel der Lufthansa. Deren Back-up geht am nächsten Morgen in die Knie. Wie konnte es dazu kommen, und was bedeutet das für die Passagiere? Die wichtigsten Fragen und Antworten. Wie kam es zu den Problemen bei der Lufthansa? Nach einigen hektischen Stunden war am Mittwochmorgen die Ursache für die Computerprobleme gefunden. Es waren keine ruchlosen Hacker am Werk, sondern ahnungslose Bauarbeiter hatten an einer Bahnstrecke in Frankfurt bereits am Dienstagabend vier Glasfaserkabel der Deutschen Telekom durchtrennt. Warum sind die Systeme der Lufthansa erst etliche Stunden nach dem Schaden zusammengebrochen? Die Glasfaserleitungen wurden tatsächlich bereits am Dienstag beschädigt. Die Deutsche Telekom wies um 21.06 Uhr auf Twitter darauf hin, dass ein Betonbohrer die Leitungen gekappt habe. Zu diesem Zeitpunkt liefen die Systeme der Lufthansa noch. Es spricht viel dafür, dass die Lufthansa über Ersatzleitungen verfügte, auf die am Dienstagabend umgeleitet wurde. Über die Gründe, warum diese Ersatzleitungen dann am Mittwoch den Datenverkehr nicht bewältigen konnten, kann nur spekuliert werden. Das ist auch Gegenstand interner Untersuchungen. Verfügt die Lufthansa nicht über ausreichende Ausweichleitungen? Bei Betreibern von kritischer Infrastruktur ist es eigentlich Standard, sich doppelt und dreifach abzusichern, sagt Rüdiger Trost, Experte der IT-Sicherheitsfirma Withsecure. Dabei versuche man auch, Flaschenhals-Konstruktionen zu vermeiden. „Fällt ein IT-System unerwartet aus, so gibt es ein Ersatzsystem, das die Arbeit übernimmt, vergleichbar mit einem Ersatzreifen im Auto.“ Warum das Umschalten auf die Ersatzleitungen am Mittwoch zu den Ausfällen führte, muss noch geklärt werden. Wie viele Passagiere waren betroffen? Das ist nicht genau bekannt. „Hier hat keiner Zeit, das genau zusammenzurechnen“, hieß es bei der Lufthansa. Die Planer müssten nicht nur die aktuellen Verwerfungen aufarbeiten, sondern auch den für Freitag geplanten Verdi-Streik an sieben deutschen Flughäfen vorbereiten. Am Frankfurter Flughafen gab es am Mittwoch laut Betreiber Fraport rund 230 Annullierungen vor allem von Lufthansa-Flügen. Bei einer durchschnittlichen Besetzung kommen hier rund 40.000 Passagiere zusammen. Was kostet die Panne? Wer haftet? Der Schaden dürfte schnell in die Millionenhöhe gegangen sein, und die Lufthansa wird sich mutmaßlich an ihre Dienstleister halten. Eine Bahnsprecherin sagte, die Frage nach der Haftung komme zu früh. „Derzeit klären wir zusammen mit der Telekom und dem bauausführenden Unternehmen, wie es zu dem Schaden kommen konnte.“ Auch die Lufthansa will statt eindeutiger Schuldzuweisungen zunächst die Sachlage klären. Gab es sowas schon einmal? Zu Flugausfällen oder Verspätungen aufgrund von IT-Problemen kommt es im Luftverkehr immer wieder. Erst im Januar legte eine Computerpanne bei der US-Flugaufsichtsbehörde FAA den Luftverkehr in den Vereinigten Staaten großteils lahm. Insgesamt waren dadurch in den USA mehr als 10.000 Flüge verspätet. Mehr als 1300 fielen aus. Durch den Programmierfehler brach ein System zusammen, das Piloten sicherheitsrelevante Informationen zu bevorstehenden Flügen gibt. Daher erteilte die FAA für einige Stunden ein Startverbot. Im Sommer 2022 war der Luftraum über der Schweiz stundenlang gesperrt, weil es bei der Flugsicherung Skyguide zu einem Hardware-Defekt kam. Betroffen waren gut 7000 Passagiere. 70 Flüge wurden gestrichen. Was passiert mit umgeleiteten Maschinen und Passagieren? Die Lufthansa musste am Mittwoch die an anderen Flughäfen gestrandeten Umsteiger unterbringen und versuchen, sie auf einen Flug noch am Mittwoch oder Donnerstag umzubuchen. Dabei kommen keineswegs nur konzerneigene Flüge infrage, sondern auch Verbindungen anderer Gesellschaften. Zu deutschen Zielen und ins nahe Ausland standen Bahnverbindungen zur Verfügung. Ein größeres Problem entsteht beim Gepäck, das ohne die weitergereisten Passagiere in Frankfurt gestrandet ist. Die Auflösung eines derartigen Kofferbergs kann Wochen und Monate dauern, wie sich zuletzt in München zeigte. Bekommen Passagiere ihr Geld zurück? Auf den Ticketkosten sitzen bleiben sie nicht. Die geltenden Fluggastrechte sehen Folgendes vor: Fällt der Flug aus oder verspätet sich um mehr als drei Stunden, muss die Airline eine Alternative anbieten - das kann ein anderer Flug oder die Umwandlung des Tickets in eine Bahnfahrkarte sein. Wenn ein Flug storniert wird oder sich um mehr als fünf Stunden verspätet, haben Passagiere neben der Ersatzbeförderung noch eine zweite Option: das Geld zurückverlangen. Dann müssen sie sich selbst darum kümmern, wie sie ans Ziel kommen. Gibt es Entschädigungen? Beim Anspruch auf mögliche zusätzliche Entschädigungszahlungen nach EU-Recht bis zu 600 Euro ist die zentrale Frage, ob der Ausfall der IT-Systeme im Verantwortungsbereich der Lufthansa liegt oder nicht. Wenn nicht, würde man von einem außergewöhnlichen Umstand sprechen, und das Unternehmen müsste nicht zahlen. Es gibt unter Rechtsfachleuten verschiedene Ansichten, ob der hier vorliegt. Wie lange wird es dauern, bis die Auswirkungen behoben sind? Der Ausfall hat die Umläufe der meisten Lufthansa-Maschinen durcheinandergebracht. Das ist bei Langstreckenmaschinen problematischer als bei Kurzstreckenjets, die in der Regel abends wieder an ihrem Ausgangsort landen. Im Lufthansa Aviation Center am Frankfurter Flughafen stand den Planern eine Nachtschicht bevor, um den Einsatz von Maschinen und Crews neu zu organisieren und die Passagiere entsprechend umzubuchen. Wenig hilfreich ist dabei der für Freitag angekündigte Verdi-Streik an sieben deutschen Flughäfen, der auch die Drehkreuze Frankfurt und München lahmzulegen droht. Um einen schnellen Wiederanlauf am Samstag zu gewährleisten, müssen die Jets daher bereits am Donnerstagabend an die richtige Position gebracht werden. Mit einigen Verspätungen ist daher auch am Donnerstag zu rechnen. Ist die Bahn wegen der Umsteiger überlastet? Nein, nach Angaben der Deutschen Bahn wurde lediglich eine „leicht erhöhte Nachfrage“ in den Zügen verzeichnet. „Täglich fahren rund 200 Fernverkehrszüge den Frankfurter Flughafen an. Damit ist der Bahnhof Frankfurt Flughafen der sechstgrößte Bahnhof Deutschlands“, teilte der Konzern mit. „Aufgrund der sehr guten Fernverkehrsanbindung des Frankfurter Flughafens hatten die umgestiegenen Fluggäste gute Reisealternativen und die Züge in der Regel auch ausreichend Kapazitäten.“ Der Wochentag spielte dabei auch eine Rolle: Mittwochs ist im Fernverkehr gewöhnlich nicht so viel los wie freitags kurz vor dem Wochenende. dpa"
25bf8fa4-1c90-47bc-bf70-314b31f063b9,2023-02-15 20:50:00+00:00,"Diese 20 deutschen Unternehmen verfügen über sehr hohe Cashflows und dadurch eine niedrige Bewertung nach dem KCV. Welche Aktien jetzt besonders günstig sind und im Geld schwimmen. Von Roland Frank und Marian Kopocz Diese 20 deutschen Aktien haben viel Cash und sind günstig bewertet Diese deutschen Aktien aus dem Frankfurter Prime-Standard weisen die niedrigsten Kurs-Cashflow-Verhältnisse (KCV) auf. Dabei ist das Immobilienunternehmen Accentro Real Estate aktuell der nach Kurs-Cashflow-Verhältnis (KCV) günstigste Wert mit 0,76. Doch direkt dahinter folgen bereits Schwergewichte wie Volkswagen mit einem KCV von niedrigen 1,22 oder ProSieben mit 1,39. Interessant ist, dass auch Hapag-Llloyd in der Liste auftaucht. Die Reederei profitierte von einer Sonderkonjunkturund zahlte sehr hohe Dividenden. Bald soll das Geschäft und auch die Ausschüttung aber wieder auf ein normaleres Niveau absinken. Doch auch die Deutsche Lufthansa mit einem Wert von 2,27. die Deutsche Telekom mit 3,02 oder BMW mit 3,09 zählen zu den günstigsten deutschen Aktien nach KCV. Wichtiges zum Kurs-Cashflow-Verhältnis (KCV) Oft achten Anleger bei der Bewertung von Aktien auf das KGV, manchmal noch auf das KBV, aber selten auf das KCV. Denn letztere Kennzahl steht für das Kurs-Cashflow-Verhältnis. Dieses teilt den Kurs einer Aktie durch den erzielten Cashflow je Aktie und die daraus ermittelte Zahl sollte so klein wie möglich sein. Anders als beim KBV oder KGV gibt es hier aber keinen absoluten Wert der als niedrig oder hoch angesehen wird. Man vergleicht das KCV gerne innerhalb einer Branche. Oft schauen Anleger nicht auf das KCV. Dabei kann auch diese Kennzahl eine Unterbewertung einer Aktie zeigen. Denn den Cashflow kann ein Unternehmen zur Schuldentilgung, für Investitionen in zukünftige Geschäfte, für Dividenden und für Aktienrückkäufe benutzen. Ein hoher Cashflow und ein niedrige KCV können daher nicht schaden. Wichtig: Bei Banken und Finanz-Unternehmen wie etwa Versicherungen, sollte man nicht auf das KCV achten. Dieses ist sehr niedrig, wird aber von Buchhaltungsregeln zu niedrig ausgewiesen. Deswegen haben wir sie aus unserer Tabelle gestrichen. Die Datengrundlage für unsere Auswertung waren deutsche Aktien im Prime Standard der Deutschen Börse."
0137f861-3336-47ac-9bda-fff0d19750cf,2023-02-16 03:58:00+00:00,"Startseite Frankfurt Flughafen Frankfurt erwacht - IT-Systeme wieder hochgefahren Von: Patryk Kubocz, Florian Dörr Eine IT-Störung bei der Lufthansa sorgt für deutliche Einschränkungen am Mittwochvormittag. Die Deutsche Flugsicherung sperrt den Frankfurter Flughafen. +++ 16.35 Uhr: Endlich die erlösende Nachricht für tausende gestrandete Passagiere am Frankfurter Flughafen. Wie die Lufthansa auf der Social-Media-Plattform Twitter vermeldet, stabilisiert sich der Flugverkehr aktuell wieder. Gegenüber der Deutschen Presseagentur (dpa) sagte ein Sprecher, die Computersysteme konnten am Mittwochnachmittag wieder hochgefahren werden. Auf ihrem Informationsaccount Lufthansa News geht der Luftfahrtkonzern davon aus, dass sich die Lage im Laufe des Tages und Abends beruhige. „Für Donnerstag wird eine weitestgehend planmäßiger Flugbetrieb erwartet“, lässt die Lufthansa über Twitter verkünden. Insgesamt 230 Flüge annulliert - 114.000 Passagiere sollten am Mittwoch befördert werden +++ 16.15 Uhr: Aufgrund der IT-Störung am Frankfurter Flughafen durch gekappte Glasfaserleitung an einer Bahn-Baustelle kam es zu massiven Flugausfällen. Wie hoch die Zahl nun ausfällt, ordnet der Flughafenbetreiber Fraport gegenüber der Deutschen Presseagentur (dpa) ein. Bis zum Nachmittag sein rund 230 Starts und Landungen annulliert worden. Zwar stabilisiere sich der Betrieb am Frankfurter Flughafen wieder, wie Fraport berichtet, dennoch dürfe stark bezweifelt werden, dass die geplanten 114.000 Passagiere befördert und insgesamt 1000 Starts und Landungen für den kompletten Mittwoch nachgeholt werden können. IT-Störungen legen Flughafen Frankfurt lahm - Verdi möchte dennoch streiken +++ 15.35 Uhr: Trotz der massiven Flugausfälle am Mittwoch aufgrund einer IT-Störung hält die Gewerkschaft Verdi an den geplanten gemeinsamen Streiks der Bodenverkehrsdienste, Luftsicherheit und dem öffentlichen Dienst fest. „Man sieht keinen Grund, daran etwas zu ändern“, sagte eine Sprecherin gegenüber der Deutschen Presseagentur (dpa). Just heute rief die Gewerkschaft zum Streik am 17. Februar in einer Pressemitteilung auf. Demnach sollen die Flughäfen Stuttgart, Hamburg, Dortmund, Hannover, Bremen und die Lufthansa-Drehkreuze München und Frankfurt am Main bestreikt werden. Für die am Freitag stattfindende Münchener Sicherheitskonferenz gäbe es eine Notdienstvereinbarung. Regierungsmaschinen sollen dabei normal abfertigt werden, sagt die Sprecherin der Gewerkschaft gegenüber der dpa. Flughafen Frankfurt lahmgelegt - Landungen sind wieder möglich +++ 15.06 Uhr: Wie ein Sprecher des Frankfurter Flughafenbetreibers Fraport der Deutschen Presseagentur (dpa) mitteilt, sind nach mehreren Stunden des Wartens wieder Landungen möglich. Aufgrund mehrerer gekappter Glasfaseranschlüsse an der Ausbaustelle der S-Bahn Linie 6 in Frankfurt durch die Deutsche Bahn entstand eine IT-Störung, die den ganzen Flugverkehr lahmlegt. Reiserechtler erklärt: Können Passagiere aufgrund der IT-Störung ihr Geld zurückfordern? +++ 14.50 Uhr: Tausende Passagiere stecken seit Mittwochmorgen am Frankfurter Flughafen fest und können aufgrund durchtrennter Glasfaseranschlüsse nicht an ihr Ziel kommen. Doch trifft die Lufthansa Schuld, wenn bei Bauarbeiten der Deutschen Bahn ein Schaden entsteht? Der auf Reiserecht spezialisierte Anwalt Paul Degott aus Hannover schätzt die Situation gegenüber der Deutschen Presseagentur (dpa) ein. „Wenn ein System von der Lufthansa ausfällt, ist das ein hausgemachtes Problem. Das führt dazu, dass Fluggäste Ansprüche auf Ausgleichszahlungen haben“, sagt Degott der dpa. Basierend auf der Fluggastrechte-Verordnung der Europäischen Union können Passagiere bei kurzfristigen Stornierungen oder Verspätungen von über drei Stunden eine Entschädigung einfordern. Diese belaufe sich zwischen 250 und 600 Euro pro Passagier. Auch das Fluggastrechte-Portal Airhelp schreibt auf seiner Website: „Fluggesellschaften sind auch im Falle einer technischen Störung für Verspätungen verantwortlich.“ Ab einer Verspätung von drei Stunden können Passagiere eine alternative Beförderung verlangen. Darüber hinaus müssen Airlines für die Versorgung ihrer Passagiere sorgen. Ab einer Verspätung von fünf Stunden können die kompletten Kosten für den Flug zurückgefordert werden. Dann müssen Passagiere auf eigene Faust eine Alternativroute zu ihrem Ziel finden. Flughafen Frankfurt lahmgelegt - Telekom-Kabel wurde bei Bauarbeiten der Deutschen Bahn durchtrennt +++ 13.45 Uhr: Nach den massiven Störungen des Luftverkehrs aufgrund eines IT-Problems am Frankfurter Flughafen, hat ein Sprecher der Lufthansa einen groben Zeitplan gezeichnet, wie der weitere Tag ablaufen wird. Wie die Deutschen Presseagentur (dpa) mitteilt, rechnet der Luftfahrtkonzern mit einer Behebung der IT-Probleme am Nachmittag. Dies heißt aber nicht, dass auch am Nachmittag die ersten Flugzeuge wieder vom Frankfurter Flughafen starten können. „Bis zu einer Normalisierung des Flugbetriebs wird es noch länger dauern“, sagt der Sprecher gegenüber der dpa. Derweil ist inzwischen klar, auf welcher Baustelle das Glasfaserkabel der Telekom durchtrennt wurde. Wie die Deutsche Bahn am Mittwochmittag bekannt gab, wurde das Kabel beim Ausbau der viergleisigen Ausbau S-Bahn Linie S6 in Frankfurt beschädigt. Der Unfall sei am Dienstagabend, gegen 19 Uhr, geschehen. Die Bahn habe die Telekom daraufhin umgehend über den Schaden informiert. „Die Deutsche Bahn bittet ausdrücklich alle Fluggäste für die entstandenen Unannehmlichkeiten um Entschuldigung“, heißt es in der Mitteilung der Bahn weiter. IT-Störung bei Lufthansa: Beschädigtes Telekom-Kabel legt Flughafen Frankfurt lahm +++ 13.15 Uhr: Die Lufthansa bestätigt auf der Social-Media-Plattform Twitter, den Hintergrund für die IT-Probleme am Frankfurter Flughafen. „Bei Bauarbeiten in Frankfurt wurden Glasfaserkabel eines Telekomdienstleisters beschädigt, die einen Ausfall der IT-Systeme der Lufthansa am Flughafen in Frankfurt zur Folge hatten“, ließ der Luftfahrtkonzern über seinen Informationsaccount Lufthansa News verkünden. Auch die Deutsche Telekom bestätigt diesen Vorfall, laut einer Meldung der Deutschen Presseagentur (dpa). Laut einem Sprecher des Telekommunikationsdienstleisters habe ein Bagger bei der Bauarbeit an einer Bahnstrecke mit einem Erdbohrer mehrere Glasfaserleitungen durchtrennt. Der Sprecher versichert gegenüber der dpa, die „Arbeiten zur Behebung der Störung laufen auch Hochtouren“. Indes teilt die Lufthansa auf Twitter mit, sie rechne mit einer Behebung der Probleme erst am frühen Abend. Nach Sperrung der Frankfurter Landebahn: Weltweiter Luftfahrtverkehr läuft weiter +++ 12.50 Uhr: Die IT-Störungen der Lufthansa, die seit Mittwochmorgen ein Check-in und Boarding unmöglich machen, betreffen nur das Drehkreuz Frankfurt, wie ein Unternehmenssprecher von der Deutschen Presseagentur (dpa) zitiert wird. Die Süddeutsche Zeitung berichtete indes, dass sämtliche Flüge weltweit ausgesetzt seien. „Der Betrieb an den anderen Konzern-Drehpunkten läuft normal weiter“, dementiert der Lufthansa-Sprecher die Aussage der Süddeutschen Zeitung. Nur ein Flug von Zürich nach Frankfurt sei gestrichen worden. Es sei nicht richtig, dass weltweit alle Flüge abgesagt worden seien, zitiert die dpa den Sprecher. Flugsicherung Langen sperrt Flughafen Frankfurt – Lufthansa nennt Hintergründe +++ 11.59 Uhr: Nach den massiven IT-Problemen unter anderem am Flughafen Frankfurt hat die Lufthansa weltweit sämtliche Flüge ausgesetzt. Das berichtet die Süddeutsche Zeitung. Das Unternehmen selbst, das am Airport an der Mainmetropole beheimatet ist, hat sich inzwischen auch offiziell zu der Großstörung geäußert. Demnach scheint das IT-Problem lokalisiert: „Seit heute Morgen sind die Fluggesellschaften der Lufthansa Group von einem IT-Ausfall betroffen, der durch Bauarbeiten in der Region Frankfurt verursacht wurde. Dies hat leider zu Flugverspätungen und -ausfällen geführt.“ Berichten zufolge sind Bauarbeiten der Bahn ursächlich für die Probleme. Ein Bagger soll ein Glasfaserkabel beschädigt haben. Die Lufthansa selbst rät Fluggästen etwa am Flughafen Frankfurt, auf die Bahn umzusteigen. „Wir arbeiten mit Hochdruck an einer Lösung. Bis dahin bitten wir alle betroffenen Gäste, die mit LH-Inlandsflügen innerhalb Deutschlands fliegen, ein Bahnticket zu buchen und eine Erstattung auf http://lh.com zu beantragen“, heißt es. Wann die IT-Probleme, die nicht nur den Flughafen Frankfurt, sondern etwa auch jenen in München betreffen, gelöst sind, das ist aktuell noch unklar. Flugsicherung sperrt Flughafen Frankfurt: Massive Probleme durch IT-Ausfall bei Lufthansa Update vom Mittwoch, 15. Februar, 11.19 Uhr: Die Deutsche Flugsicherung reagiert auf die IT-Probleme bei der Lufthansa und leitet keine Flugzeuge mehr an den Airport. So soll verhindert werden, dass sich die Flugzeuge sammeln, weil sie nicht mehr starten können. Durch die Störung ist seit den Morgenstunden ein Einchecken und Boarding nicht mehr möglich. Nachdem die Flieger nun den Flughafen Frankfurt nicht mehr anfliegen können, werden sie nach ersten Informationen nach Köln, Düsseldorf oder Nürnberg umgeleitet. Massive Probleme durch IT-Ausfall bei Lufthansa am Flughafen Frankfurt Erstmeldung vom Mittwoch, 15. Februar, 10.30 Uhr: Probleme am Mittwochvormittag (15. Februar) am Flughafen Frankfurt: Nach ersten Informationen sorgt ein IT-Ausfall bei der Lufthansa für massive Einschränkungen im weltweiten Flugverkehr. Es soll zu zahlreichen Ausfällen kommen, Tausende Passagiere sind betroffen. Zur Situation am Flughafen Frankfurt schreibt etwa ein Nutzer bei Twitter: „#FlughafenFrankfurt hat aktuell einen #Systemausfall. Nicht klar, wie es weitergeht. Ankommende Flüge sind in Warteschleife oder werden umgeleitet.“ Viele Passagiere wie auch Flieger sitzen fest. Flughafen Frankfurt: Hintergründe von großer Störung aktuell noch unklar Die Hintergründe der Störung, die auch den Flughafen Frankfurt betrifft, sind noch unklar. Es wurde ein Krisenstab gebildet. Betroffen von der Lufthansa-Störung sind die IT-Systeme für das Einchecken ebenso wie für das Boarding. (fd) Weitere Informationen folgen."
