f771871f-0d33-4e9a-9583-0f8318cbd08a,2023-08-29 09:27:30+00:00,"Die beste Festnetz-Hotline im DACH-Raum kommt aus der Schweiz. Es ist jene von Sunrise, wie dem aktuellen Vergleichstest der Zeitschrift Connect zu entnehmen ist. Darin erhält Sunrise in der Gesamtbeurteilung 471 von 500 möglichen Punkten und die Note ""sehr gut"". Zum Vergleich: In Österreich erhält Anbieter Magenta Austria die höchste Punktzahl mit 462 und in Deutschland ist es die Deutsche Telekom mit 449 Punkten. Sunrise punktet mit Kompetenz, Salt mit Geschwindigkeit In der Rangliste der drei getesteten Schweizer Festnetzanbieter Salt, Sunrise und Swisscom änderte sich im Vergleich zum Vorjahr nichts, wie Connect anmerkt: Sunrise stand schon im vergangenen Jahr an der Spitze. Dieses Jahr aber habe das Unternehmen weitere sechs Punkte zugelegt. Einen Fortschritt attestiert Connect hinsichtlich der Kompetenz (302 von 325 möglichen Punkten). Salt erhält bei diesem Kriterium 286, Swisscom 280 Punkte. Salt (insgesamt 454 Punkte) steht auf dem zweiten Platz. Connect lobt den Telko für die überragende Erreichbarkeit der Hotline und für die Wartezeit, die ""geradezu sensationell kurz"" ausfalle. Hier vergeben die Testpersonen 32 von 35 möglichen Punkten, gleich viel wie Sunrise, während sie für Swisscom 26 Punkte übrig haben. Alle drei sind gleich freundlich Der grösste Schweizer Telko Swisscom landet mit 434 Punkten - aber nach wie vor mit der Note ""sehr gut"" - auf dem 3. Platz. Das Unternehmen habe ""leichte Qualitätseinbussen"" zu verzeichnen, urteilt Connect. So sei zwar das Fachwissen der Hotline-Mitarbeitenden allgemein enorm, ""doch einige wenige tanzten aus der Reihe"". Negativ fiel auch die längere Wartezeit auf. Laut der Vergleichstabelle dauerte es im Schnitt 1 Minute und 20 Sekunden zwischen dem Ende der Bandansage und der Annahme des Anrufs durch Swisscom-Mitarbeitende. Bei Sunrise waren es im Schnitt dagegen 20, bei Salt gar nur 19 Sekunden, bis der Anruf entgegen genommen wurde. Und auch in der Kategorie Erreichbarkeit erhält Swisscom weniger Punkte als die Mitbewerber, nämlich 91 von 100 möglichen. Derweil kriegen Sunrise und Salt jeweils die Gesamtpunktzahl. Fast gleich auf sind die drei Anbieter bezüglich des Sprachdialogsystems: Hier vergibt Connect 14 von 15 möglichen Punkten an Swisscom und Sunrise und 13 an Salt. Gar keine Unterschiede gibt es beim Kriterium Freundlichkeit: Hier erzielen alle drei getesteten Schweizer Telkos 23 von 25 möglichen Punkten. Die Zeitschrift Connect kontaktierte die drei Telkos für den Test jeweils 50 Mal zu unterschiedlichen Zeiten und mit unterschiedlichen Anliegen."
f8d34d6c-cfa1-4633-a4a0-bda638f2dcca,2023-08-30 09:46:00+00:00,"Startseite Smartphone FAIRPHONE 5 Fairphone 5: Hier könnt ihr das nachhaltige Smartphone kaufen 30. August 2023 um 11:46 Uhr Fairphone hat das Fairphone 5 vorgestellt und ihr könnt das Smartphone ab sofort für 699 Euro vorbestellen - allerdings nur bei diesen Händlern. Das niederländische Unternehmen Fairphone ist für seine nachhaltig und fair produzierten Handys bekannt. Mit dem Fairphone 5 hat das Unternehmen nun einen Nachfolger für das 2021 erschienene Fairphone 4 5G vorgestellt. Es kann ab dem 30. August vorbestellt werden und soll kurze Zeit später, am 14. September, ausgeliefert werden. Die unverbindliche Preisempfehlung lautet 699,99 Euro. Doch nicht bei jedem Händler werden Fairphone-Fans fündig. Nachfolgend haben wir alle Optionen zum Kauf für euch aufgelistet: So könnt ihr das Fairphone 5 kaufen Erste Anlaufstelle für Interessenten ist natürlich der Webshop des Herstellers. Hier gibt es nicht nur das Handy selbst zu kaufen, sondern auch passende Ersatzteile und Zubehör. Bei Fairphone 699 Euro* Zum Shop Anzeige Neben der eigenen Webseite von Fairphone wird das Fairphone 5 in Kürze auch bei folgenden Händlern angeboten werden: Bei Deutsche Telekom Fairphone 5 kaufen* Zum Shop Anzeige Bei Fairphone 5 kaufen* Zum Shop Anzeige Bei Fairphone 5 kaufen* Zum Shop Anzeige Bei Fairphone 5 kaufen* Zum Shop Anzeige Bei Fairphone 5 kaufen* Zum Shop Anzeige Bei Fairphone 5 kaufen* Zum Shop Anzeige Bei memolife Fairphone 5 kaufen* Zum Shop Anzeige Bei Fairphone 5 kaufen* Zum Shop Anzeige Während die oben genannten Anbieter sich an die von Fairphone ausgegebene unverbindliche Preisempfehlung von 699 Euro halten, gibt es das Handy bei Gomibo schon günstiger. Der Anbieter verkauft es für 687 Euro. Bei Gomibo Fairphone 5 kaufen* Zum Shop Anzeige Ausverkauf des Vorgängers: Hier könnt ihr kräftig sparen Durch den Release eines neues Smartphones werden die Vorgänger-Modelle in der Regel um einiges günstiger. Dementsprechend wird auch das Fairphone 4 in den kommenden Wochen im Preis sinken. Wenn ihr also nach einer etwas günstigeren Version sucht, bekommt ihr das Fairphone 4 aktuell schon für unter 500 Euro."
d7321876-355c-48d0-9fc7-dd5f155d22a4,2023-08-31 15:36:00+00:00,"Die Deutsche Telekom eröffnet in ihren T-Labs in Berlin ein „Quantum Lab“. Es soll im Rahmen der angewandten Forschung helfen, Quantentechnologie in kommerzielle Telekommunikationsnetze zu integrieren. Im ehemaligen Fernmeldeamt 1 in Berlin eröffnete die Deutsche Telekom heute, am 31. August 2023, das Quantum Lab. Das riesige Gebäude wurde 1929 von der damaligen Deutschen Reichspost für die Handvermittlung von Telefon-Fernverbindungen errichtet. Einst war es die größte Vermittlungsstelle Europas, heute forscht hier die Forschungs- und Entwicklungseinheit der Telekom, die T-Labs, für die Zukunft. Und deren neue Einrichtung, das Quantum Lab, soll sich der Integration der Quantentechnologie in kommerzielle Telekommunikationsnetze widmen. Wesentlicher Schwerpunkt dabei ist die Quantenkommunikation und deren Potenzial für die Entwicklung leistungsfähigerer Kommunikationsnetze. Die Forschungen finden in Kooperation mit den Technischen Universitäten in Berlin, Dresden und München sowie dem Fraunhofer Heinrich Hertz Institut (HHI) und weiteren Partnern statt. Lesen Sie auch: „Quantentechnologien: Die Natur machts vor“ „Die Forschung im neuen Lab wird sich auf die Nutzung der Quantenverschränkung konzentrieren“, heißt es in einer Pressemitteilung der Telekom anlässlich der Eröffnung. Bei der Quantenverschränkung können zwei oder mehr verschränkte Teilchen nicht mehr als einzelne Teilchen mit definierten Zuständen beschrieben werden, sondern nur noch das Gesamtsystem als solches. Dieses physikalische Phänomen verspräche einen tiefgreifenden Wandel in der Telekommunikation, so die Pressemeldung. Dazu zählten auch die Quantenkryptografie für eine auch zukünftig sichere Kommunikation sowie Kommunikationsnetze mit verbesserter Latenzzeit, Durchsatz und Ausfallsicherheit. Zu den Projekten, denen sich das Quantum Lab ab sofort widmet, gehört die Verteilung von Schlüsseln für die Kommunikationsverschlüsselung, Q-Key Distribution genannt. Bei Verschlüsselungsalgorithmen besteht die Notwendigkeit, den Schlüssel auszutauschen, denn nur wenn der Empfänger den Schlüssel kennt, mit dem der Sender verschlüsselt hat, kann der Empfänger entschlüsseln. Quantenkommunikation bietet dazu neue Möglichkeiten, so lässt sich diese Kommunikation beispielsweise nicht mehr unentdeckt abhören. Somit fiele ein Schlüsseldiebstahl durch Anzapfen der Leitung sofort auf. Quantum Lab der deutschen Telekom stellt weltweit einmalig Testnetz für die Forschung bereit Ein zentrales Element des Quantum Labs ist das sogenannte Saser-Netz. Saser steht für „Save and Secure European Routing Test-Net“; es wurde vom Bundesministerium für Bildung und Forschung (BMBF) gefördert und dient als eine Testnetzinfrastruktur für die Forschung. „Es kann optische Ende-zu-Ende-Kanäle in voll vermaschten DWDM-Netzen bereitstellen“, erklärt Ralf-Peter Braun, der das Saser-Netz einst aufgebaut hat, während der Eröffnungsveranstaltung. Im Quantum Lab stecken quantenoptische Infrastruktur und über 2000 km Glasfasernetz. Gemeinsame Standards für Quantentechnik – Normungsgremien veröffentlichen Roadmap Als Dense Wavelength Division Multiplexing (DWDM) wird eine Technologie bezeichnet, die Datensignale aus verschiedenen Quellen zusammenfügt, also multiplext, damit sie über eine einzige Glasfaser übertragen werden können. Dabei bleibt jeder Datenstrom vollständig getrennt von den anderen Datenströmen. „Somit können verschiedenste Projekte gleichzeitig und unabhängig durchgeführt werden, wobei das Saser Testnetz ausschließlich durch die Deutsche Telekom betrieben wird, das so auch einmalig in der Welt existiert“, erörtert Braun. Eigentlich längst im Ruhestand, ist der Elektronikingenieur und Spezialist weiterhin für eine Tochtergesellschaft der Telekom als Consultant tätig. Bereits im März hatte die Deutsche Telekom ein Quantum-as-a-Service-Angebot aufgelegt. Geschäftskunden können dabei auf echte Quantencomputingumgebungen zugreifen und Anwendungsfälle entwickeln und testen."
8d1d41f5-4efe-4bab-8b51-8311ed70c2c3,2023-08-31 17:21:34+00:00,"Anbieter zum Thema In weniger als drei Wochen wird die Digital X 2023 die Stadt Köln in eine Digitalisierungswerkstatt verwandeln. Besucher erleben dort die Zukunft mit teleoperiertem Fahren auf den Straßen, smarten Robotern und Top-Sprechern. Insgesamt werden mehr als 250 Top-Speaker kontrovers diskutieren und ihre Sichtweisen und Erfahrungen mit den 50.000 erwarteten Besuchern auf Digital X 2023 teilen. Zu den Sprechern zählt der US-amerikanische Schauspieler, Regisseur und Produzent George Clooney. Er ist politisch engagiert und setzt sich für den Klimaschutz und Menschenrechte ein. Zu den zahlreichen Auszeichnungen seines humanitären Engagements zählen der Peace Summit Award 2007, der auf dem achten Weltgipfel der Friedensnobelpreisträger verliehen wurde, und der Robert F. Kennedy Ripple of Hope Award 2010. Im August 2016 gründeten George und seine Frau Amal die Clooney Foundation for Justice. Digital X 2023 gibt neue Denkanstöße und Impulse Als Mitbegründer der schwedischen Band ABBA hat Björn Ulvaeus einen besonderen Einblick in das Musikbusiness und den Einfluss der Digitalisierung auf die Musikindustrie und deren Potenzial. Amy Webb wird mit ihrem Auftritt auf der Digital X 2023 erstmals in Europa sprechen. Das Forbes Magazin nannte sie eine der „fünf Frauen, die die Welt verändern“. Die Futuristin, Technologie-Analystin und Gründerin des Future Today Institute ist bekannt für ihre präzisen Vorhersagen und Analysen über zukünftige Technologietrends wie AI und deren Auswirkungen auf Unternehmen und Gesellschaft. Keiner verkörpert das Motto „Be digital. Stay human“ (auf Deutsch „Wir. Menschlich digital“) so sehr wie Neil Harbisson. Der britische Künstler und Cyborg Aktivist ist der erste Mensch auf der Welt mit einer implantierten Antenne im Schädel. Sie ermöglicht dem farbenblinden Harbisson anhand von Schallwellen sowohl sichtbare als auch unsichtbare Farben wie Infrarot und Ultraviolett wahrnehmen zu können. Constanze Kurz ist Informatikerin, Sachbuchautorin und Sprecherin des Chaos Computer Clubs. In ihren Blogs, Essays und in ihrer vierzehntägigen Kolumne „Aus dem Maschinenraum“ (2010-2019) in der Frankfurter Allgemeinen Zeitung macht sie auf Sicherheitslücken und Monopole im Bereich der neuen Technologien aufmerksam.Tom Buhrow, Intendant des WDR, hat eine bedeutende Rolle bei der Förderung der Digitalisierung in dem Fernsehsender übernommen. Er betont die Bedeutung der öffentlich-rechtlichen Programme für den gesellschaftlichen Zusammenhalt im digitalen Zeitalter. Trends und Innovationen auf der Digital X 2023 Innovationen, die gestern noch Zukunftsmusik waren, sind inzwischen im Markt angekommen. Für große Unternehmen ebenso wie für Mittelstand und öffentliche Hand. Die Digital X 2023 zeigt innovative Technologien und Lösungen, die das Potenzial haben, Geschäftsprozesse zu optimieren und neue Wachstumschancen zu erschließen. Geschäftskunden können die neuesten Produkte und Dienstleistungen ausprobieren. Und bei Live-Vorführungen herausfinden, wie sie diese in ihrem eigenen Unternehmen einsetzen können. Die niederländische Firma RanMarine Technology hat eine autonom schwimmende Drohne zur Gewässerreinigung entwickelt. Dank präziser Positionsbestimmung kann sie nicht nur auf dem abgesteckten Kurs effizienter Müll sammeln, sondern übermittelt auch ortsbezogene Wasserqualitätsdaten. Mira und die Telekom präsentieren, wie die Zukunft des Nahverkehrs mit teleoperiertem Fahren aussehen kann. In Köln bringen sie in einem ferngesteuerten Fahrzeug Gäste entlang der Kölner Ringe vom Rudolfplatz zum Mediapark. In einer Hydraulikbagger-Fahrerkabine von Komatsu lernen Interessierte per VR-Brille die Dimensionien solcher Großgeräte kennen. Mithilfe einer Simulation können sie den Bagger bedienen und fahren. Gemeinsam mit weiteren Dienstleistern entwickelte Telekom MMS dafür eine 3D-Anwendung auf einer VR-Trainings- und Collaboration Plattform. Arzneimittel aus dem 3D Drucker zeigt Digital Health Systems. Die gedruckten Medikamente ermöglichen den Zugang zu personalisierten Wirkstoffen in individueller Dosis und optimieren so Wirksamkeit und Verträglichkeit für die Patienten. Besucher iauf Entdeckerreise Die Digital X bietet Information und Inspiration: Geschäftskunden ebenso wie Privatleute erweitern ihr Wissen und entdecken neue technologische Möglichkeiten – spielerisch leicht: Auf dem Robotic Playground können sich Menschen interaktiv mit Robotern auseinandersetzen: Ein Roboter-Hunderudel reagiert auf Menschen. Ein Roboterarm bewegt sich zu einer Klanginstallation und erzeugt Seifenblasen. In der Nähe schwingen Roboterarme ein Springseil. Ein anderer Roboter meißelt live eine Marmorskulptur. Jetzt Newsletter abonnieren Verpassen Sie nicht unsere besten Inhalte Geschäftliche E-Mail Bitte geben Sie eine gültige E-Mailadresse ein. Mit Klick auf „Newsletter abonnieren“ erkläre ich mich mit der Verarbeitung und Nutzung meiner Daten gemäß Einwilligungserklärung (bitte aufklappen für Details) einverstanden und akzeptiere die Nutzungsbedingungen. Weitere Informationen finde ich in unserer Datenschutzerklärung. Aufklappen für Details zu Ihrer Einwilligung Stand vom 11.01.2024 Es ist für uns eine Selbstverständlichkeit, dass wir verantwortungsvoll mit Ihren personenbezogenen Daten umgehen. Sofern wir personenbezogene Daten von Ihnen erheben, verarbeiten wir diese unter Beachtung der geltenden Datenschutzvorschriften. Detaillierte Informationen finden Sie in unserer Datenschutzerklärung. Einwilligung in die Verwendung von Daten zu Werbezwecken Ich bin damit einverstanden, dass der WIN-Verlag GmbH & Co. KG, Balanstraße 73, Gebäude Nr. 21A, EG, 81541 München, einschließlich aller mit ihr im Sinne der §§ 15 ff. AktG verbundenen Unternehmen (im weiteren: Vogel Communications Group) meine E-Mail-Adresse für die Zusendung von redaktionellen Newslettern nutzt. Auflistungen der jeweils zugehörigen Unternehmen können hier abgerufen werden. Der Newsletterinhalt erstreckt sich dabei auf Produkte und Dienstleistungen aller zuvor genannten Unternehmen, darunter beispielsweise Fachzeitschriften und Fachbücher, Veranstaltungen und Messen sowie veranstaltungsbezogene Produkte und Dienstleistungen, Print- und Digital-Mediaangebote und Services wie weitere (redaktionelle) Newsletter, Gewinnspiele, Lead-Kampagnen, Marktforschung im Online- und Offline-Bereich, fachspezifische Webportale und E-Learning-Angebote. Wenn auch meine persönliche Telefonnummer erhoben wurde, darf diese für die Unterbreitung von Angeboten der vorgenannten Produkte und Dienstleistungen der vorgenannten Unternehmen und Marktforschung genutzt werden. Falls ich im Internet auf Portalen der Vogel Communications Group einschließlich deren mit ihr im Sinne der §§ 15 ff. AktG verbundenen Unternehmen geschützte Inhalte abrufe, muss ich mich mit weiteren Daten für den Zugang zu diesen Inhalten registrieren. Im Gegenzug für diesen gebührenlosen Zugang zu redaktionellen Inhalten dürfen meine Daten im Sinne dieser Einwilligung für die hier genannten Zwecke verwendet werden. Recht auf Widerruf Mir ist bewusst, dass ich diese Einwilligung jederzeit für die Zukunft widerrufen kann. Durch meinen Widerruf wird die Rechtmäßigkeit der aufgrund meiner Einwilligung bis zum Widerruf erfolgten Verarbeitung nicht berührt. Um meinen Widerruf zu erklären, kann ich als eine Möglichkeit das unter https://kontakt.vogel.de/de/win abrufbare Kontaktformular nutzen. Sofern ich einzelne von mir abonnierte Newsletter nicht mehr erhalten möchte, kann ich darüber hinaus auch den am Ende eines Newsletters eingebundenen Abmeldelink anklicken. Weitere Informationen zu meinem Widerrufsrecht und dessen Ausübung sowie zu den Folgen meines Widerrufs finde ich in der Datenschutzerklärung, Abschnitt Redaktionelle Newsletter. In der interaktiven KI Gallery entsteht Digital Art: Mittels Sensoren wird anhand diverser Parameter wie Mimik, Gestik, Körpertemparatur), der emotionale Zustand analysiert und daraufhin ein kreatives, von KI generiertes Portrait generiert. Und wer über den Kinetic Walkway im Stadtgarten läuft, hilft mit seiner Bewegung nutzbaren Strom zu erzeugen. Die elektrischen Pflastersteine bestehen aus elektromagnetischen Induktionsgeneratoren, die sich durch das Gewicht menschlicher Schritte vertikal verschieben und so Energie erzeugen. Digital X – ein Forum des Austauschs Die Digital X bietet Geschäftskunden die Möglichkeit, über den Tellerrand zu schauen und neue Perspektiven auf die digitale Strategie zu entwickeln. Sei es beim Netzwerken in der Kölschen Nacht mit kölschen Stimmungsbands wie Brings, Cat Ballou und Kasalla. Oder bei dem Telekom Street Gig, wo die US-Weltstars Thirty Seconds to Mars exklusiv ihr neues Album präsentieren. Und mit dem Equal eSports Festival werden die Kölner Rheinterrassen am 20. und 21. September 2023 zum Hotspot der E-Sports-Szene. Die Deutsche Telekom setzt mit ihrer Initiative ein klares Zeichen für mehr Gleichberechtigung und Diversität in der Gaming-Welt. Zeitgleich zur diesjährigen Digital X findet am 20. und 21. September in Köln die DMEXCO statt. In diesem Jahr kooperieren die beiden Veranstaltungen und bieten Besuchern des jeweiligen Events die Möglichkeit, mit ihrem Ticket beide Veranstaltungen zu besuchen. (sg)"
de21c12a-af88-4ebf-92fb-fd0445696ebf,2023-09-01 19:22:00+00:00,"echo24 Heilbronn Großflächiger Internetausfall im Landkreis Heilbronn – Störung behoben Von: Julia Cuprakowa Der Landkreis Heilbronn ist von einem großflächigen Internetausfall betroffen gewesen. Der Grund: ein Kabelschaden. Die Techniker haben die Störung behoben. Update, 19 Uhr: Nach einem großflächigen Internetausfall im Landkreis Heilbronn ist die Störung nun behoben, wie ein Reporter der „Heilbronner Stimme“ berichtet. Bad Wimpfen, Bad Friedrichshall und Neckarsulm haben wieder eine stabile Internetverbindung. Großflächiger Internetausfall im Landkreis Heilbronn – Kabelschaden als Ursache Erstmeldung, 1. September, 17 Uhr: In Bad Wimpfen, Bad Friedrichshall und Neckarsulm gibt es derzeit einen großflächigen Internetausfall. Dies berichten zahlreiche Nutzer verschiedener Internetanbieter auf lokalen Facebook-Seiten. Die Deutsche Telekom bestätigt die Angaben. Die Ursache für den Ausfall sei ein Kabelschaden, teilt das Unternehmen am Freitagabend (1. September) mit. Mitarbeiter der Telekom seien bereits vor Ort und Tiefbauarbeiten sind im Gange, um das Problem zu beheben, sagte Telekom-Sprecher Pascal Kiel. Genauere Informationen lägen noch nicht vor, wie die „Heilbronner Stimme“ berichtet. Großflächiger Internetausfall im Landkreis Heilbronn – Störung soll bis zum Abend behoben sein Nach Angaben einiger Nutzer aus dem Raum Heilbronn soll die Störung bereits seit den Mittagsstunden bestehen. Nutzer, die bei der Störungshotline der Telekom angerufen haben, berichten, dass die Techniker der Telekom bereits an der Behebung der Störung arbeiten. Dies bestätigt nun auch die Telekom. In den Abendstunden, so die Ankündigung der Telekom, soll das Internet wieder funktionieren. Bereits im September 2021 waren zahlreiche Haushalte in Bad Wimpfen, Bad Friedrichshall, Neckarsulm und Oedheim fast einen Tag lang ohne Internet. Damals hatte eine Fremdfirma ein Telefonkabel der Deutschen Telekom an der Landesstraße unter der A6 zwischen den Böllinger Höfen und Heilbronn-Biberach beschädigt. Mitarbeiter der Telekom waren stundenlang unter der Brücke damit beschäftigt, den Schaden zu beheben. Am Abend gegen 19 Uhr war das beschädigte Kabel durch ein neues ersetzt, wie die „Heilbronner Stimme“ abschließend berichtet."
