24b07b78-471c-41b3-a8f8-09169c83e64d,2023-02-03 08:38:32+00:00,"Krefeld, 3. Februar 2023 MEDIENINFORMATION Glasfaser für Krefeld– Ausbauplanungen konkretisiert Über 22.000 Haushalte können an das neue Glasfaser-Netz angeschlossen werden Gigabit Geschwindigkeit möglich Jetzt kostenfreien Hausanschluss sichern Informieren, registrieren oder vorbestellen auf www.telekom.de/glasfaser-krefeld _______________________________________________________________________________ Bis Ende 2023 können in Krefeld mehr als 22.000 Haushalte und Unternehmensstandorte an das neue Telekom Glasfasernetz angeschlossen werden. Dieser umfassende Glasfaserausbau schafft die optimale Infrastruktur, um die Krefelder Haushalte und Unternehmen zeitnah in die digitale Zukunft zu führen. Interessierte Kund*innen können sich bereits jetzt für die neuen Glasfaser-Anschlüsse registrieren und die schnellen Anschlüsse dann als Erste nutzen. Das neue Netz ermöglicht Gigabit-Bandbreiten. Es ist so leistungsstark, dass Arbeiten und Lernen zuhause, Video-Konferenzen, Gaming und Streamen gleichzeitig möglich sind. Die Ausbauarbeiten haben bereits in mehreren Stadteilen begonnen und die Telekom hat aktuell die kommenden Schritte ihrer Ausbauplanung nochmals zeitlich konkretisiert und auf ihrer eigens eingerichteten Internetseite www.telekom.de/glasfaser-krefeld veröffentlicht. Damit der Ausbau nicht am Haus oder der Wohnung vorbeizieht, müssen die Anwohner*innen rechtzeitig tätig werden. „Beim Glasfaser-Ausbau wird das Glasfaser-Kabel zunächst bis ins Haus und bei zusätzlicher Buchung eines Telekom Glasfaser Produkt auch kostenfrei bis in die Wohnung / Büro gezogen“, erklärt Joachim Schad, Regionalmanager der Telekom. „Dafür brauchen wir die Genehmigung der Eigentümer*innen. Schließlich betreten wir Privatgrund. Den Anstoß können auch die Mieter*innen geben, indem sie sich bei uns melden.“ Die Telekom wird dann mit den Vermieter*innen Kontakt aufnehmen und klären, wie die Glasfaser ins Haus kommt und wie die Glasfaser im Haus verläuft. Schon jetzt können sich Immobilienbesitzer*innen in Krefeld mit Eingabe der Adresse auf www.telekom.de/glasfaser-krefeld ihren Hausanschluss vorbestellen. Auch telefonisch ist dies unter 0800 22 66 100 möglich. Auch Mieter*innen können Glasfaser bekommen Jeder Mieter kann einen Glasfaseranschluss bestellen. Solange dem Vermieter keine Kosten entstehen, kann dieser seine Zustimmung nicht verweigern. Die Telekom wird die Baumaßnahme mit dem Eigentümer abstimmen. Gleiches gilt für Eigentümer in Mehrparteienhäusern: Auch sie können einen Glasfaseranschluss beantragen. Mit einem Glasfaser-Anschluss ist die Immobilie für die Zukunft bestens gerüstet. Auch lässt sie sich einfacher vermieten oder verkaufen. Darüber hinaus bietet der Glasfaser-Anschluss alle Möglichkeiten für digitale Anwendungen: Zum Beispiel Homeoffice-Anbindung, Smart Home, IP-TV, Streaming Dienste, Online Gaming oder auch Telemedizin. Kund*innen, die in einem Gebiet wohnen, das aktuell noch nicht vom Glasfaser-Ausbau profitiert, können sich unter www.telekom.de/glasfaser-krefeld ebenfalls registrieren: Die Telekom meldet sich, sobald der Netzausbau startet. Mehr Informationen zur Glasfaser Verfügbarkeit und den Glasfasertarifen der Telekom: Telekom Shop Krefeld, Schwanenmarkt 42, 47798 Krefeld Telekom Shop Krefeld-Uerdingen, Niederstr. 1, 47829 Krefeld www.telekom.de/glasfaser-krefeld Hotline 0800 22 66 100 (kostenfrei) Für Unternehmen aus Krefeld Hotline 0800 330 6709 (kostenfrei) E-Mail: vollglas@telekom.de www.telekom.de/jetzt-vollglas Deutsche Telekom AG Corporate Communications George-Stephen McKinney, Pressesprecher Tel.: 0228 181 – 49494 E-Mail: medien@telekom.de Weitere Informationen für Medienvertreter*innen:"
5d59e9f0-6079-4569-90ef-5807a908a161,2023-02-07 08:06:48+00:00,"Anzeige Erscheint die Stadt Augsburg im Südwesten Bayerns als zu hektisch, so wohnt man besser in Gablingen, einer beschaulichen Gemeinde wenige Kilometer entfernt, umgeben von Feldern und Wiesen. Doch schon bald dürfte es laut werden in dem kleinen Ort mit nicht einmal 5000 Einwohnern. Die Deutsche Telekom hat ihre Bagger angekündigt, um Glasfaserkabel unter Straßen und Gehwege zu legen. Was in ländlichen Gebieten andernorts sehnlich erwartet wird, ruft hier Kopfschütteln hervor. Denn erst vor wenigen Wochen hat die Deutsche Glasfaser ihre Baustellen wieder zugeschüttet. Wenn sich die Telekom durch den Ort gegraben hat, haben die Gablinger zwei Glasfasernetze. Anzeige Tatsächlich befindet sich Deutschland in einem gigantischen Infrastrukturkraftakt, wie es ihn seit Jahrzehnten nicht mehr gegeben hat. Bis 2030 soll jeder Haushalt in Reichweite eines Glasfasernetzes sein, mit dem sich die Internetgeschwindigkeit im Vergleich zu bisherigen Anschlüssen um ein Vielfaches steigern lässt. Mehr zum Thema Internet und Netzausbau Weltplus ArtikelJeder hat 2 bis 5 Möglichkeiten Festgeschrieben ist dieses Ziel in der Gigabitstrategie der Bundesregierung. „Wir wollen den Übergang von Kupfer- auf Glasfasernetze zügig, wettbewerbskonform, verbraucherfreundlich und ökologisch nachhaltig gestalten“, heißt es darin. Doch dafür müssen erst Straßen aufgerissen werden, um die alten Kupferleitungen zu ersetzen. Anzeige Die Telekom und ihre Konkurrenten haben für das nationale Glasfaserprojekt in den kommenden Jahren 50 Milliarden Euro zugesagt. Schon jetzt zeigt sich: Geld ist gar nicht das Problem. Die Unternehmen finden schlichtweg nicht genügend Bautrupps und Bagger, um den Boden umzugraben. Selbst mithilfe von Tiefbauern aus Süd- und Osteuropa gelingt ihnen das nicht. Deshalb müssen sie vorsortieren und entscheiden, wer seinen Glasfaseranschluss jetzt bekommt und wer später. Überbau in zahlreichen Regionen Deutschlands Ein Doppelausbau ist dabei so unnötig wie ein zweiter Stromanschluss. „Die Überbauung sorgt für eine Doppelbelegung bereits versorgter Gebiete, während unterversorgte Regionen auf den Ausbau von schnellem Glasfasernetz weiter warten“, sagt Timo von Lepel, Geschäftsführer bei der Kölner Telefongesellschaft Netcologne. „Volkswirtschaftlich ist das nicht sinnvoll.“ Dennoch passiert genau das häufig. „Aktuell beobachten wir Überbauaktivitäten in Köln, bei Augsburg, in München, aber auch in zahlreichen anderen Gegenden Deutschlands“, schreibt der Bundesverband Glasfaseranschluss (Buglas) in einem Brandbrief an Digitalminister Volker Wissing. Das Schreiben liegt WELT AM SONNTAG vor. Die Hälfte der glasfaserausbauenden Unternehmen des Verbandes berichtete von Überbauaktivitäten oder entsprechenden Plänen der Telekom in ihrem jeweiligen Netzgebiet, heißt es darin. Lesen Sie auch Weltplus ArtikelNetz, Tarif und Tempo Wütend äußert sich auch der Verband der Anbieter von Telekommunikations- und Mehrwertdiensten (VATM): „Allein schon die bloße Drohung mit strategischem Überbau ermöglicht der marktmächtigen Telekom, andere Wettbewerber zu verdrängen und von dem eigenen flächendeckenden Ausbau abzuhalten“, sagt Geschäftsführer Jürgen Grützner. Dabei hatten sich die Telekom und ihre Konkurrenten einen Masterplan ausgedacht, um Deutschland schnell zur Glasfasernation zu machen. Weil absehbar war, dass weder der große Konzern noch die vielen kleineren Netzbetreiber, zu denen auch Stadtwerke gehören, ein nationales Netz bauen können, sollte es zu einer großen Kooperation kommen. „Hat offenbar einen Strategiewechsel gegeben“ Ein Name war schnell gefunden: Open Access. Wer ein Netz baut, soll es auch anderen zur Verfügung stellen, diskriminierungsfrei und zu fairen Konditionen. Ein Doppelausbau wäre dadurch unnötig. Nun droht das große Kuscheln zu scheitern. „Seit einem guten halben Jahr häufen sich die Überbauprojekte der Telekom“, berichtet Nelson Killius, Chef des Telekommunikationsanbieters M-net in München. „Es hat dort offenbar einen Strategiewechsel gegeben.“ Und NetCologne-Chef von Lepel stellt fest: „Die Tonart der Telekom wird aggressiver.“ Dabei hat sich der Marktführer in der Vergangenheit immer wieder zu Open Access bekannt. „Wir nutzen in ganz Deutschland Glasfasernetze von Partnern, allerdings unterscheiden sich die Kooperationsformen stark“, sagt ein Telekom-Sprecher. Den Planungen zufolge will das Unternehmen mehrere Millionen Haushalte mit Kooperationen an das Glasfasernetz anschließen. „In einigen Gebieten haben wir uns aber dazu entschieden, unser Glasfasernetz eigenständig auszubauen, weil wir keinen bedarfsgerechten Zugriff auf das bereits bestehende Netz bekommen konnten.“ Dass inzwischen das Tischtuch zwischen der Telekom und einigen Konkurrenten zerschnitten ist, liegt an einem Geburtsfehler von Open Access. Offenbar gibt es kein gemeinsames Verständnis, was sich hinter einem offenen Zugang verbirgt. Die Unternehmen müssen die Preise, zu denen sie sich gegenseitig auf die Netze lassen, bei jeder Kooperation neu aushandeln. Bereits die Überbau-Ankündigung habe Folgen Oftmals kommt es nicht zur Einigung. Darüber hinaus sind viele Details für Open Access nicht verbindlich geregelt. Es fehlen nicht nur technische Standards, auch Fristen für eine mögliche Entstörung oder der Serviceumfang müssen immer wieder individuell ausgehandelt werden. Das ist gerade mit kleineren Netzbetreibern mühsam. Die Folgen sind gravierend. „Der strategische Überbau insbesondere der Telekom schadet wegen der knappen Ressourcen nicht nur den Zielen der Gigabitstrategie“, sagt der digitalpolitische Sprecher der FDP-Fraktion, Maximilian Funke-Kaiser. „Oft zerstört allein die Ankündigung eines Überbaus die Ausbaupläne eines Glasfaseranbieters, da die überbauten Teile eines Netzes ausschlaggebend für die Gesamtrentabilität eines Ausbauplans sind.“ Da es zum derzeitigen Zeitpunkt in den Glasfasernetzen kein marktbeherrschendes Unternehmen gibt, bauen die Firmen ohne Regulierung. Im Grunde ist alles erlaubt, auch der Überbau. Dass es beim nationalen Glasfaserprojekt zu Problemen kommt, ist also nicht überraschend. Auch nicht für die Bundesregierung. Lesen Sie auch „Mit der deutlich steigenden Investitionstätigkeit auf den Glasfasermärkten kann jedoch auch der Überbau zunehmen“, formuliert sie in ihrer Gigabitstrategie. Man werde die weitere Entwicklung genau beobachten und gegebenenfalls regulatorische Maßnahmen einleiten. Doch dafür gibt es offenbar keine Handhabe. „Eigenwirtschaftlich ausbauende Telekommunikationsunternehmen sind durch das Telekommunikationsgesetz nicht gehindert, eigene Netze zu verlegen, auch wenn bereits Netzinfrastrukturen vorhanden oder im Bau sind“, sagt ein Sprecher des Bundesministeriums für Digitales und Verkehr (BMDV). Ähnlich äußert sich auch die Bundesnetzagentur. Die Telekom-Konkurrenten wollen sich damit nicht zufriedengeben und sprechen nach Informationen von WELT AM SONNTAG derzeit bei Bundestagsabgeordneten vor, um den Druck zu erhöhen. „Rosinenpicken“ erschweren Abgesehen davon bleiben ihnen nur Appelle übrig: „Das Bundesministerium für Digitales und Verkehr sollte Möglichkeiten finden, ein solches Vorgehen zu verhindern – immerhin ist die Telekom noch mit über 30 Prozent in staatlicher Hand“, sagt Stephan Albers, Geschäftsführer beim Bundesverband Breitbandkommunikation (Breko). Alles andere verlangsame den Ausbau der zukunftsfähigen Infrastruktur. Tatsächlich steigt inzwischen auch der Druck aus der Politik, wo über Parteigrenzen hinweg Unmut geäußert wird. Jens Zimmermann, digitalpolitischer Sprecher der SPD-Fraktion, nennt den Überbau ein „großes Ärgernis“. Reinhard Brandl, digitalpolitischer Sprecher der CDU/CSU-Fraktion, fordert offen ein härteres Vorgehen: „Wir sollten das Telekommunikationsgesetz dahingehend ergänzen, dass den Kommunen ermöglicht wird, den Überbau eines bestehenden Glasfasernetzes so lange nicht zu genehmigen, bis nicht die gesamte Kommune mindestens einmal mit Glasfaser erschlossen ist“, sagte er der WELT AM SONNTAG. Dadurch soll das „Rosinenpicken“ erschwert werden, bei dem die Unternehmen in ländlichen Regionen nur die Häuser mit Glasfaser versorgen, deren Erschließung nicht allzu teuer ist. Lesen Sie auch Ähnlich äußert sich die digitalpolitische Fraktionssprecherin der Linken, Anke Domscheit-Berg: „Ein Überbau von Glasfasern dort, wo bereits ein Glasfasernetz mit Open-Access-Zugang für alle Wettbewerber besteht, sollte verboten werden, mindestens bis zum Erreichen des Gigabitzieles für alle Haushalte in Deutschland.“ Dafür müsse eine rechtliche Grundlage geschaffen werden. Eine Änderung des Telekommunikationsgesetzes wünscht sich auch Reinhard Sager, Präsident beim Deutschen Landkreistag. „So könnte sichergestellt werden, dass einmal verlegte Glasfaserkabel auch von anderen Anbietern genutzt werden, natürlich gegen ein angemessenes Nutzungsentgelt“, sagte er. Es müsse verhindert werden, dass Glasfasernetze nachträglich ungesteuert überbaut werden. Wie machtlos die Kommunen derzeit sind, zeigt auch der Fall in Gablingen bei Augsburg. Bürgermeisterin Karina Ruf (CSU) hatte vergeblich versucht, ein erneutes Aufreißen der Straßen zu verhindern. Sie machte den Vorschlag, dass die Telekom für ihren Ausbau die Baustellen der Deutschen Glasfaser mitnutzt. Letztere lehnte ab. „Alles auf Aktien“ ist der tägliche Börsen-Shot aus der WELT-Wirtschaftsredaktion. Jeden Morgen ab 7 Uhr mit unseren Finanzjournalisten. Für Börsenkenner und -einsteiger. Abonnieren Sie den Podcast bei Spotify, Apple Podcast, Amazon Music und Deezer. Oder direkt per RSS-Feed."
6adc7ee7-c41c-493d-b0e7-459d1201feb7,2023-02-07 14:18:00+00:00,"Beckum (mag) - Auf dem Weg zu einem umfassenden Glasfasernetz ist die Beckumer Stadtverwaltung einen weiteren Schritt weitergekommen. „Die Umsetzung konkretisiert sich“, fasste Bürgermeister Michael Gerdhenrich am Dienstagmorgen bei einem Pressetermin im Rathaus zusammen. Kurz zuvor hatte er den so genannten „Letter of Intent“ mit Vertreter der „Deutschen Telekom“ unterzeichnet. Politisch beschlossen Eine gemeinsame Absichtserklärung war bereits im Hauptausschuss am 13. Dezember beschlossen worden („Die Glocke“ berichtete). Die Deutsche Telekom plant den Glasfaseranschluss demnach für etwas 18700 Haushalte in ungefähr 9700 Gebäuden für alle Kernbereiche Beckums. Starten soll der Ausbau im dritten Quartal 2023 in Beckum-Nordwest mit Roland, Neubeckum, Beckum-Nordost mit Vellern, Beckum-Südost und Beckum-Südwest sollen Schritt für Schritt bis voraussichtlich Ende 2025 mit Glasfaser versorgt werden, wie bei dem Pressetermin deutlich wurde. Das Unternehmen habe zwar ein wirtschaftliches Ziel, mache den Ausbau jedoch nicht vom Erreichen einer Quote abhängig, wie Vertreter der Telekom erklärten. „Die Art der Vermarktung ist etwas Besonderes“, betonte Bürgermeister Michael Gerdhenrich. Er unterstrich, wie wichtig das Projekt für Beckum ist. Beckum ist laut Deutscher Telekom die erste Kommune im Kreis Warendorf, in der das Unternehmen den Glasfaserausbau auf diese Weise vorantreibt. Es sind Tiefbauarbeiten auf etwa 180 Kilometern erforderlich. Für die Hausanschlüsse rechnet das Unternehmen mit weiteren 25 Kilometern. Mitbewerber im Rennen Zunächst werden die Langtrassen entlang der Häuser gebaut. Wer bis Ende 2023 sein Interesse bekundet, bekommt den Hausanschluss kostenlos, und zwar unabhängig von der späteren Tarifwahl. Auch Mitbewerber wie „1&1“, „O2“ oder „Vodafone“ sind im Rennen und bieten ihre Produkte auf dem Netz der Telekom an. Die Vorvermarktung soll im 2. Quartal 2023 beginnen. Förderprogramm läuft Außerhalb der Kernbereiche, in den Außenbereichen und Bauerschaften, erfolgt bereits der Glasfaserausbau durch die „Deutsche Glasfaser Wholesale GmbH“ mittels des staatlichen Förderprogramms „Weiße Flecken“."
fa0d5d2b-b85b-4a19-95ae-c71713253abc,2023-02-09 07:49:20+00:00,"Neuburg an der Donau, 9. Februar 2023 MEDIENINFORMATION Glasfaser-Ausbau läuft: Was Kund*innen jetzt wissen müssen Die ersten 100 Kund*innen sind am Glasfaser-Netz 6.250 Haushalte und Unternehmen können angeschlossen werden Jetzt noch kostenfreien Hausanschluss sichern _______________________________________________________________ Viele werden sie schon gesehen haben. Bautrupps, die in Neuburg an der Donau den Glasfaser-Ausbau vorantreiben. Die ersten 100 Kund*innen haben bereits Glasfaser im Haus. Das Glasfasernetz ist so leistungsstark, dass Arbeiten und Lernen zuhause, Video-Konferenzen, Gaming und Streamen gleichzeitig möglich sind. Mit dem Anschluss an das Glasfaser-Netz steigern Immobilienbesitzer*innen zusätzlich den Wert ihrer Immobilie. Außerdem sind die Anschlüsse gut fürs Klima, weil das Glasfasernetz weniger Energie verbraucht als das bestehende Kupfernetz. Was Kund*innen jetzt wissen müssen? Was passiert nach dem ich mich für einen Glasfaser-Anschluss angemeldet habe? Die Telekom startet die Detailplanung, sobald ihr vom Eigentümer des Gebäudes eine Genehmigung vorliegt, das Haus an das Glasfaser-Netz anzuschließen. Nimmt die Telekom oder ein Subunternehmer mit mir Kontakt auf? Die von der Telekom mit dem Ausbau beauftragte Baufirma nimmt mit der Kund*innen Kontakt auf. Die Baufirma ist vom Ausbau bis zur Inbetriebnahme der Ansprechpartner für alle notwendigen Rücksprachen. Für den Ausbau ist ein vor Ort Termin notwendig. Wie lange dauert so ein Termin? Bei diesem Termin wird unser Ausbaupartner vor Ort alle notwendigen Arbeiten auf dem Grundstück und im Gebäude mit Ihnen besprechen. Für den Termin sollte man sich ausreichend Zeit nehmen, damit alle Fragen geklärt werden können. In der Regel sollte der Termin nicht länger als eine Stunde in Anspruch nehmen. Im Zuge der Installation des Hausanschlusses werden vorab Terminvorschläge auch per Email durch den Absender: glasfaser.eigentuemer@telekom.de versendet. Für einen schnellen und reibungslosen Ablauf der Installation kann zeitnah einer der vorgeschlagenen Termine gewählt werden. Wie lange dauert es, den Hausanschluss dann zu verlegen? Bei diesem Termin werden die im Besichtigungstermin besprochenen Arbeiten ausgeführt. Dabei werden Leitungen von der Straße bis in das Gebäude verlegt und im Haus mit dem Abschlusspunkt verbunden. Ihre Immobilie ist danach mit unserem Glasfaser-Netz verbunden. Hat ein Besichtigungs-Termin vorab mit Ihnen als Eigentümer stattgefunden, müssen Sie bei Diesem Termin nicht persönlich vor Ort sein. Leiten Sie in diesem Fall die Einladung einfach an Ihre(n) Mieter, Hausmeister/Hausverwaltung oder einer Person ihres Vertrauens weiter, um unseren Technikern den Zugang zum Gebäude bzw. Kellerräumen zu ermöglichen. Die Arbeiten sollten in der Regel in wenigen Stunden erledigt sein. Wird mein alter Anschluss sofort stillgelegt? Der alte Telefonanschluss verbleibt im Boden. Hier wird nichts geändert. Das Glasfaserkabel wird auf jedem Grundstück neu verlegt. Es ist unabhängig nutzbar und damit unabhängig von alten auf dem Grundstück befindlichen Leitungen. Kund*innen können also zunächst weiter ihren alten Anschluss nutzen und später auf ein Produktangebot via Glasfaser umsteigen. Der Glasfaser-Anschluss kostet aber auch nicht mehr und geht bereits bei 50 Mbit/s los. Wie lange dauert es, den Hausanschluss zu legen? Muss ich mir dafür einen Tag Urlaub nehmen oder wie läuft das ab? Das ist ratsam, weil die Arbeiten vor Ort auch im Gebäude zum Beispiel im hauseigenen Keller ausgeführt werden müssen. Es ist auch wichtig, dass für Rücksprachen immer jemand vor Ort ist, der sich auskennt und Entscheidungen treffen kann. Muss ich auf ein Glasfaser-Produkt wechseln? Nein, wer sich einen Hausanschluss legen lässt, muss nicht sofort Telefon, Internet und Fernsehen über Glasfaser beziehen. Kunden*innen können ihre bisherigen Verträge weiter nutzen. Wer sich jetzt entscheidet, erspart aber sich und seinen Nachbar*innen, dass später noch einmal die Straße aufgemacht werden muss, um seinen Hausanschluss herzustellen. Außerdem werden einmalig 799,95 € Anschlussgebühr fällig. Muss ich zur Telekom wechseln, wenn ich mir einen Hausanschluss legen lasse? Nein, die Telekom baut ein Netz, das auch für andere Anbieter offen ist. Ob ein Anbieter seine Produkte wie Telefon, Internet und Fernsehen über das Glasfaser-Kabel der Telekom anbietet, muss bei den jeweiligen Anbietern erfragt werden. Behalte ich nach dem Wechsel auf einen Glasfaser-Anschluss meine Telefonnummer? Ja, an der Telefonnummer ändert sich nichts. Brauche ich neue Geräte für die Nutzung des Glasfaser-Anschlusses? Ob ihr Router Glasfaser-fähig ist, hängt von dem jeweiligen Typ ab. Hier hilft ein Blick ins Handbuch des Routers. Die Telekom bietet eigene Glasfaser-Router an. Diese können gekauft oder gemietet werden. Man kann aber auch Router anderer Anbieter nutzen. Es gibt keinen Router-Zwang. Kund*innen sind in der Wahl frei. Alte Router können häufig mit einen Glasfaser-Modem fit für die neue Aufgabe gemacht werden. Wo kann ich mich persönlich beraten lassen? Telekom Shop Neuburg Färberstraße 2, 86633 Neuburg an der Donau Telekom Shop Ingolstadt Am Westpark 6, 85057 Ingolstadt Telekom Shop Ingolstadt Am Stein 5, 85049 Ingolstadt Sie interessieren sich für den Glasfaserausbau in Ihrer Region und möchten weitere Informationen erhalten? Unter der Internetseite www.telekom.de/events können Sie sich jederzeit die im Archiv befindlichen Informationsveranstaltungen als Stream anschauen. Am 15. März findet um 16:30 Uhr eine digitale Informationsveranstaltung für den Ortsteil Neuburg Sehensand statt. Hier können auch über den Chat direkte Fragen an unsere Kundeberater gestellt werden. Deutsche Telekom AG Corporate Communications Dr. Markus Jodl, Pressesprecher Tel.: 0228 181 – 49494 E-Mail: medien@telekom.de Weitere Informationen für Medienvertreter*innen:"
7898fbfa-7753-42ab-b8f1-94bb9d2ebb28,2023-02-10 10:55:37+00:00,"KI und Ethik Deutsche Telekom verabschiedet Manifest zur KI-Nutzung Anbieter zum Thema Das Manifest setzt in den deutschen Konzerneinheiten den Rahmen für die Verarbeitung von Beschäftigtendaten in KI-Systemen. Die Deutsche Telekom und der Konzernbetriebsrat (KBR) haben ein Manifest zur Nutzung von „Künstlicher Intelligenz“ (KI) verabschiedet. „Damit schaffen wir die besten Voraussetzungen auch im Bereich der internen KI die führende digitale Telco zu werden“, so Personalvorstand Birgit Bohle zur Bedeutung der Vereinbarung. Damit wahre man die Interessen und schütze die Daten der Mitarbeiter. Es sei dabei nun klar geregelt, welche Standards für die Einführung von KI-Systeme gelten sollen. Auf dieser Basis will die Telekom die Entwicklung und den Einsatz neuer KI-Systeme, die viele Chancen bieten, beschleunigen. KI-Einsatz darf Mitarbeiter keinen Schaden zufügen Das Manifest regelt etwa, dass der Einsatz von KI-Systemen keine negativen Auswirkungen auf die Sicherheit, Gesundheit und Grundrechte von Beschäftigten haben darf. Beispielsweise kann die KI für Personalentscheidungen zwar Vorschläge machen, sie trifft aber nie die Entscheidung, wie es beispielhaft heißt. Das sei ein gutes Verhandlungsergebnis für KBR-Vorsitzende Kerstin Marx: „Das KI-Manifest bietet uns die Möglichkeit, positive Anwendungen von KI zur Vereinfachung, Erleichterung und Steigerung der Effizienz unserer Arbeitsprozesse zu nutzen.“ Es sei wichtig zu betonen, dass der Einsatz von KI-Systemen sowohl Chancen als auch Risiken für die Beschäftigten berge. Während KI monotone Arbeiten übernehmen kann, muss demnach sichergestellt sein, dass sich durch ihren Einsatz keine negativen Auswirkungen auf die Beschäftigten ergeben. Neue Einsatzmöglichkeiten für Künstliche Intelligenz Auch habe man nun eine sinnvolle Ergänzung zu den bestehenden Leitlinien zu Digitaler Ethik zum Umgang mit KI. geschaffen: Durch das Training von KI-Systemen stelle man sicher, dass die KI diskriminierungsfrei bleibt. Beispiele der Vergangenheit, wie der von Microsoft entwickelte Chatbot Tay, der auf Twitter eine rassistische Persönlichkeit erlernte, zeigten schließlich, dass auch in diesem digitalen Umfeld verantwortungsbewusst gehandelt werden müsse. Die Telekom setzt aber schon heute Künstliche Intelligenz ein. Zum Beispiel bei der Prozessgstaltung, zur Steigerung der Qualität von internen Dienstleistungsangeboten oder zur Verbesserung des Kundenservices, wie betont wird. Man habe heute schon circa 180 solcher Systeme im Einsatz, die aber mit der Verarbeitung von Beschäftigtendaten nichts zu tun hätten. Die KI hilft der Telekom unter anderem bereits bei der Planung der Verlegung von Glasfasern, als „Chatbot“ im Service oder bei der Vermeidung von Störungen, weil damit die Technik proaktiv rechtzeitig neu gestartet wird, bevor es zu einem gravierenden Fehler kommt. (ID:49188448)"
