3f9e7bc4-32e9-4597-bd85-f03e7c04ecf7,2023-08-14 09:12:34+00:00,"Das Lädchen in der Kölner Innenstadt ist so klein, dass es als Boutique durchgehen könnte: Gebirgsfotos an den Wänden, Stehpflanzen in den Ecken. In der Mitte zwei Autos, sorgsam platziert wie im Museum. Jung und hip soll das Ganze wirken, und der Eindruck ist in gewisser Weise auch echt. Denn die chinesische Firma BYD („Build Your Dreams“), die hier ihre E-Autos präsentiert, ist ein Neuling auf dem deutschen Markt. Erst im Dezember 2022 hat das Unternehmen die Filiale eröffnet, ausgerechnet in einem ehemaligen Tesla-Store. Gut verarbeitet und überzeugend im Crashtest Der Filialleiter hat früher bei Mercedes gearbeitet, was man fast schon als Symbol für den Branchenzustand deuten könnte: Laut Statistischem Bundesamt stammten im ersten Quartal 2023 bereits 28, 2 Prozent aller nach Deutschland importierten E-Autos aus China, Tendenz steigend. Die meisten Modelle sind gut verarbeitet, überzeugen im Crashtest und bieten brauchbare Software. Billige B-Ware aus Fernost? Das war einmal. Heute muss die deutsche Autoindustrie, die E-Mobilität lange verschmäht hat, um Marktanteile kämpfen. Die Auswahl ist groß: BYD bietet den kleinen SUV Atto 3, den größeren Tang und die Limousine Han. Ora punktet mit dem Funky Cat, der wie ein VW Käfer aussieht. Nio verkauft Modelle, deren Batterien an Wechselstationen binnen Minuten ausgetauscht werden können. Hinzu kommen die von Chinesen aufgekauften europäischen Traditionsmarken Volvo und MG. Auch deutsche Firmen nutzen chinesische E-Autos Verständlich also, dass sich immer mehr Unternehmen fragen, mit welchen Marken sie ihre Dienstwagen-Flotten bestücken – warum nicht mal einen China-Stromer probieren?! „Wir sind ein technologieoffenes Unternehmen“, heißt es etwa von Siemens, „daher schließen wir grundsätzlich keine Hersteller aus.“ Auch die Deutsche Telekom gibt auf Nachfrage an, eine geringe Zahl von Volvo- und Polestar-Fahrzeugen zu nutzen. Der Pharmakonzern Merck nutzt nach eigenen Angaben ebenfalls einige Volvos. Was vordergründig logisch erscheint, hat einen Haken: Spionage. Moderne Autos sind mit derart vielen Sensoren, Kameras und Mikrofonen bestückt, dass sie sich perfekt zur Überwachung der Insassen eignen. Selbst im Kleinwagen Funky Cat steckt serienmäßig eine hochauflösende Innenraum-Kamera, inklusive Gesichtserkennung. „Wo sind Sie hingefahren? Was haben Sie mit wem gesprochen? Das ist alles erfassbar“, warnt May-Britt-Stumbaum, China-Expertin am Center for Intelligence and Security Studies (CISS) der Universität der Bundeswehr. Natürlich sei nicht jedes chinesische Auto gleich ein Spionage-Auto. „Je nach politischer Lage ist die Wahrscheinlichkeit aber hoch, dass Informationen abgezapft werden. Immerhin ist in China jede Firma verpflichtet, mit dem Staat zusammenzuarbeiten.“ Hochtechnologie-Branche besonders anfällig für Spionage Noch deutlicher wird der Verfassungsschutz in seinem aktuellen Jahresbericht: Demnach ist die Volksrepublik aktuell „die größte Bedrohung in Bezug auf Wirtschafts- und Wissenschaftsspionage.“ Die Staats- und Parteiführung strebe eine globale Technologieführerschaft an, die spätestens im Jahr 2049 erreicht werden solle. Besonders gefährdet sind laut Verfassungsschutz jene Branchen, die an Hochtechnologien arbeiten: Quantenforschung, Künstliche Intelligenz, Hyperschalltechnik, Überwachungs- und Biotechnologie. Moderne Autos sind schon ohne das Eingreifen staatlicher Akteure anfällig für Überwachung und Manipulation. Den US-amerikanischen Hackern Charlie Miller und Chris Valasek ist es mehrfach gelungen, Autos per Laptop komplett fernzusteuern. Das wohl Aufsehen erregendste Experiment absolvierten sie im Jahr 2015 für die Zeitschrift Wired:Vom Wohnzimmer aus übernahmen sie die Kontrolle über einen Jeep Cherokee. Klimaanlage, Radio, Scheibenwischer: Die Hacker hatten die totale Kontrolle, während der Reporter hilflos am Steuer saß. Am Ende lenkten sie das Fahrzeug in einen Graben. Auto-Standort lässt sich orten Neuere Recherchen des BR-Magazins „kontraste“ legen nahe, dass sich die Probleme eher verschlimmert statt verbessert haben – und dass sie längst nicht nur einen Hersteller betreffen. So lassen sich Standorte von Fahrzeugen offenbar auch dann noch orten, wenn die Besitzer diese längst verkauft haben. Das Handy mit dem Bordcomputer erst gar nicht verknüpfen? Sicherlich eine Möglichkeit, die Überwachung zumindest einzuschränken. Aber wer macht das schon bei einem Neuwagen, der genau diesen Komfort bietet. Dass sich ein Geheimdienst auch in Mikrofone und Kameras einhacken kann, erscheint da nur logisch. Noch leichter geht's, wenn die passende Hard- und Software direkt auch China stammt. Doch es erscheint fraglich, ob diese Botschaft in Deutschland schon angekommen ist. Während beim Ausbau des 5 G-Netzes leidenschaftlich über den Huawei-Konzern diskutiert wird, ist es seltsam stumm im Autobereich. Als die Mietwagen-Firma Sixt im vergangenen Jahr angekündigte, 100.000 E-Autos der Marke BYD zu kaufen, blieb der große Aufschrei aus. Lediglich die BILD-Zeitung schimpfte, die Anschaffung sei eine „Entscheidung für die chinesische Diktatur, die Hongkong unterworfen hat, die Taiwan bedroht, die Menschen in Lager sperrt.“ Heute betont Sixt: Die Bestellungen zögen sich über sechs Jahre und machten nur einen einstelligen Prozentbereich an der Gesamtflotte aus. Kundendaten teile man nicht mit Lieferanten. Auch andere Hersteller umgehen den Datenschutz Rein rechtlich ist die Sache klar: Laut EU-Datenschutzgrundverordnung (DSGVO) müssen Unternehmen auflisten, welche Informationen sie erheben und speichern. Doch die Sache hat einen Haken. „Häufig muss man bereits bei der Übergabe eines neuen Fahrzeugs seitenlange Datenschutz-Bestimmungen unterschreiben“, moniert der ADAC – „und damit stimmt man meist auch Ausnahmen vom Datenschutz zu.“ Neutrale Untersuchungen, ob und wie Positionsdaten, Kamerabilder und Audio-Aufzeichnungen genutzt werden, gebe es kaum. Dabei sind es längst nicht nur chinesische Hersteller, die ein fragwürdiges Verhalten an den Tag legen. Im Frühjahr sorgte ein Bericht für Furore, wonach Tesla-Mitarbeitende zahlreiche Videos fremder Innen- und Außenkameras geteilt hatten – darunter von einem Mann, der sich nackt seinem Fahrzeug nähert."
c85e8157-5029-4fba-8cf7-1cd60535c777,2023-08-15 08:58:02+00:00,"Lüneburg. „Auch wenn sich das Logo in Farbe und Design auf dem Werbeschreiben unterscheidet, verwechseln viele 1N Telecom mit der Deutschen Telekom“, erklärt Sabine Oppen-Schröder, Verbraucherberaterin der Verbraucherzentrale Niedersachsen. In der Annahme, es handele sich lediglich um eine Tarifanpassung, unterschreiben Kundinnen und Kunden der Deutschen Telekom ein Werbeangebot der 1N Telecom, schließen dadurch einen neuen Vertrag ab und veranlassen somit einen Anbieterwechsel. Weiterlesen nach der Anzeige „Bemerkt wird der Irrtum meist erst, wenn ein Willkommensschreiben der 1N Telekom im Briefkasten liegt oder die Deutsche Telekom nach dem Kündigungsgrund fragt“, so Oppen-Schröder. Wer keinen neuen Vertrag abschließen wollte, zieht dann oftmals die Kündigung bei der Deutschen Telekom zurück – gelöst sei das Problem damit allerdings nicht. Bis zu 400 Euro für Nichterfüllung des Vertrags drohen Wird die Kündigung zurückgenommen, überträgt die Deutsche Telekom die Rufnummer nicht. Die Folge: 1N Telecom aktiviert den Anschluss nicht. „Ratsuchende werden aufgefordert, die Kündigung gegenüber der Deutschen Telekom aufrecht zu erhalten. Kommen sie dem nicht nach, kündigt die 1N Telecom außerordentlich und macht damit auch einen Schadensersatzanspruch geltend“, erklärt Oppen-Schröder. Weiterlesen nach der Anzeige Verbraucherinnen und Verbraucher sollen rund 400 Euro für die Nichterfüllung des Vertrags zahlen. Ob die Höhe gerechtfertigt ist, könne letztlich nur gerichtlich geklärt werden. Was tun, wenn der Vertrag mit 1N Telecom nicht gewollt ist? „Ein ungewollter Vertrag kann grundsätzlich fristgerecht und nachweislich widerrufen werden. Das ist innerhalb von 14 Tagen ab Vertragsschluss möglich“, so Oppen-Schröder. Wichtig sei es, den Widerruf gut zu dokumentieren und auch den alten Anbieter zu informieren. In diesem Fall sollte dann auch die Rufnummerportierung gestoppt werden. Ist es für einen Widerruf bereits zu spät, sollten sich Betroffene hingegen gut überlegen, ob der Anbieterwechsel nicht doch eine Option ist. Sie können dann direkt die Kündigung aussprechen, damit der ungewollte Vertrag mit der Mindestlaufzeit endet. Gegen Werbebriefe vorgehen Verbraucherinnen und Verbraucher können einer Werbenutzung widersprechen und die Daten sperren lassen. Viele Ratsuchende fragen sich, woher 1N Telecom die Daten hat. Sie sollten beim Datenschutzbeauftragten des Unternehmens nachfragen – auch, auf welcher Rechtsgrundlage der Kontakt erfolgt ist. Die Verbraucherzentrale Niedersachsen bietet hierfür kostenlose „Musterbriefe Datenschutz“ an. Weiterlesen nach der Anzeige Eine weitere Möglichkeit, sich vor ungewollter Werbepost zu schützen: Verbraucherinnen und Verbraucher können sich in die vom Deutschen Dialogmarketing Verband (DDV) erstellte Robinson-Liste eintragen. Die Unternehmen, die dem DDV angeschlossen sind, erhalten dann die Nachricht, dass keine Werbung per Post gewünscht wird. Bei Fragen hilft die kostenlose Beratung der Verbraucherzentrale Niedersachsen – vor Ort, telefonisch und per Video. LZ"
fd16790d-fe8c-4b6a-9d54-77de81e2bda8,2023-08-18 12:51:00+00:00,"Ob Einzelhandel, Pharmaindustrie, Automobilhersteller oder Telekommunikation – der Arbeitsmarkt in Deutschland hat viel zu bieten. Wir stellen Ihnen in diesem Artikel eine Auswahl der 13 Arbeitgeber vor, die deutschlandweit die meisten Arbeitgeberinnen und Arbeitgeber beschäftigen. Alle Mitarbeiterzahlen beziehen sich auf den Zeitraum zwischen Anfang 2021 und Ende 2022. Platz 13: Deutsche Telekom (94.000) Die deutsche Telekom beschäftigt weltweit rund 211.00 Mitarbeiterinnen und Mitarbeiter, wovon rund 94.000 in Deutschland angestellt sind. Das Leistungsspektrum des Telekom-Konzerns umfasst neben dem Ausbau und der Wartung der Netz- und Glasfaser-Infrastruktur auch die Bereitstellung diverser Telekommunikationsangeboten. Insbesondere der eigene Streaming-Dienst Magenta TV konnte in den vergangenen Jahren hohe Gewinne einfahren. Platz 12: Robert Bosch GmbH (135.000) Die Robert Bosch GmbH gilt als einer der größten Automobilzulieferer der Welt. Dabei reicht das Portfolio von kleinen Stellmotoren und Steuergeräten hin zu Wischblättern für Scheibenwischer und Zündkerzen. Laut Statista arbeiteten im Jahr 2021 weltweit rund 400.000 Mitarbeiterinnen und Mitarbeiter für den Konzern. Etwa 135.000 davon waren in Deutschland beschäftigt. Platz 11: BMW (149.475) Der bayerische Automobilhersteller mit Sitz in München zählt zu den weltweit größten Fahrzeugherstellern und hat im Jahr 2021 laut Statistaüber 111 Milliarden Euro umgesetzt. Der Konzern beschäftigte Ende 2022 149.475 Mitarbeiterinnen und Mitarbeiter. Besonders die Ausstattung der bayerischen Polizei mit Dienstwagen sowie die Bereitstellung vieler dienstlich genutzter Fahrzeuge in Ministerien und Kommunen verhelfen BMW jährlich zu hohen Umsatzzahlen. Mit der M GmbH verfügt BMW auch über eine eigene Rennsport- und Sportwagenabteilung im Firmenportfolio. Platz 10: Rewe (161.000) Der deutsche Einzelhändler Rewe zählt mit etwa 3600 Ladenflächen in ganz Deutschland zu dem am zweithäufigsten vertretenen Einzelhändler der Bundesrepublik. Die Abkürzung Rewe steht für ""Revisionsverband der Westkaufgenossenschaften"". Der Firmensitz der Rewe GmbH befindet sich in Köln. Zum Jahreswechsel waren ca. 161.000 Mitarbeiterinnen und Mitarbeiter bei dem Einzelhandelskonzern beschäftigt. Platz 9: Daimler (172.425) Die Daimler AG ist ein deutscher Automobil- und Nutzfahrzeuge-Hersteller. Neben der Abteilung ""Personenkraftwagen"" (Mercedes-Benz) ist die Nutzfahrzeugsparte (Daimler Truck) sowie die Rennsport- und Sportwagen-Abteilung (AMG) mit Sitz im schwäbischen Affalterbach ein wichtiges Standbein der Daimler AG. Im Jahre 2021 arbeiteten 172.425 Mitarbeiterinnen und Mitarbeiter für den Automobilkonzern. Platz 8: Deutsche Post (190.000) Die Deutsche Post gilt als das größte Logistikunternehmen der Welt. Beinahe in jedem Land verbindet man die gelben Fahrzeuge der Deutschen Post und der DHL Group mit der Auslieferung von Waren. In Deutschland sind laut Angaben des Unternehmens aktuell rund 190.000 Mitarbeiterinnen und Mitarbeitern beschäftigt. Täglich werden von diesen rund 59 Millionen Briefe sowie 4,6 Millionen Pakete zugestellt. Platz 7: Deutsche Bahn (211.000) Täglich nutzen in Deutschland zigtausende Menschen das Angebot der Deutschen Bahn. In über 500 verschiedenen Bereichen arbeiteten im Jahr 2021 rund 211.000 Arbeitnehmerinnen und Arbeitnehmer für den ehemaligen Staatskonzern. Neben der Personenbeförderung sind besonders die Bereiche Netzausbau sowie die Wartung von Gleis- und Signalanlagen ein wichtiges Standbein der Deutschen Bahn. Platz 6: Evangelische Kirche (240.000) Neben Gemeindepädagoginnen und Pädagogen, Pfarrerinnen und Pfarrern sowie Angestellte in der Verwaltung beschäftigt die evangelische Kirche in Deutschland hauptsächlich Erzieherinnen und Erzieher. Für die Evangelische Kirche arbeiteten laut Statista 2022 rund 240.000 Mitarbeiterinnen und Mitarbeiter. Platz 5: Volkswagen (296.000) Die Volkswagen AG beschäftigte 2021, laut dem offiziellen Geschäftsbericht, weltweit 672.789 Mitarbeiterinnen und Mitarbeiter von denen rund 44 Prozent (296.000) in Deutschland angestellt waren. Der Volkswagenkonzern zählt mit seinen Tochtergesellschaften Porsche, Audi, Seat, Skoda etc. zu den umsatzstärksten Automobilherstellern der Welt. Bei der Vorstellung neuer Fahrzeuge wird sich international nach den Standards der VW-Gruppe orientiert. So gilt beispielsweise der VW Golf mittlerweile als Gattungsbegriff für kompakte Limousinen mit Schrägheck. Platz 4: Edeka (405.000) Die ""Einkaufsgenossenschaft der Kolonialwarenhändler"" wurde 1898 gegründet und ist mittlerweile unter der Bezeichnung Edeka bekannt. Edeka ist der größte Einzelhändler in Deutschland und beschäftigt nach eigenen Angabenüber 405.000 Angestellte. Zur Edeka Gruppe gehören unter anderem die Discounter-Kette Netto sowie verschiedene regionale Ketten wie etwa Super 2000, Naturkind oder nah&gut. Platz 3: Bund (500.000) Der Bund als Arbeitgeber umfasst neben den Angestellten des Bundestags und der Bundesregierung auch die Bundespolizei sowie die Bundeswehr. Darüber hinaus gibt es eine breite Palette an Berufen, die direkt auf Bundesebene angesiedelt sind. Darunter fallen unter anderem Zollbeamte sowie Amtsärzte. 2021 arbeiteten rund eine halbe Million Menschen direkt oder indirekt für den Bund. Platz 2: Schwarz Gruppe (550.000) Die Schwarz Gruppe mit Sitz im baden-württembergischen Neckarsulm ist die Muttergesellschaft von Lidl und Kaufland und stellt somit einen der größten deutschen Einzelhändler dar. Gegründet wurde die Unternehmensgruppe bereits 1930. Heute arbeiten über eine halbe Million Arbeitnehmerinnen und Arbeitnehmer für die Schwarz Gruppe. Platz 1: Caritas Hilfswerk der Katholischen Kirche (690.000) Die Katholische Kirche beschäftigt in Deutschland eine Vielzahl an Arbeitnehmerinnen und Arbeitnehmern. Besonders im Caritas Hilfswerk der Katholischen Kirche, welches in Freiburg im Breisgau seinen Geschäftssitz hat, wird das bewusst. Hier arbeiten beinahe 700.000 Menschen. Über 20 Prozent davon arbeiten in der Pflege. Mit Abstand die meisten Menschen sind in Deutschland jedoch bei kommunalen Arbeitgebern, wie etwa Krankenhäusern, Schulen, der öffentlichen Verwaltung oder der Polizei beschäftigt. Schätzungsweise waren 2021 etwa 2,4 Millionen Arbeitnehmerinnen und Arbeitnehmer für kommunale Arbeitgeber tätig."
ae02a458-49f3-4bae-9f53-4355104b8df9,2023-08-18 18:43:17+00:00,"Zahlreiche Kunden der Deutschen Telekom dürften in den vergangenen Monaten stutzig geworden sein. In einem Werbebrief wird für einen anderen Telefontarif geworben - dabei ist der Absender ein ganz anderes Unternehmen. Dem Gebahren von 1N Telecom wird nun ein Riegel vorgeschoben. Das Düsseldorfer Unternehmen 1N Telecom darf seine aktuellen Werbebriefe nicht mehr bundesweit an Festnetzkunden und an Kunden der Deutschen Telekom verschicken. Das hat das Landgericht Düsseldorf per einstweiliger Verfügung auf Antrag der Deutschen Telekom entschieden. Die Anschreiben an die Kunden seien in der Aufmachung irreführend und machten nicht ausreichend deutlich, dass es sich nicht um einen bloßen Tarifwechsel handele, sondern es um einen Wechsel des Telekommunikationsanbieters gehe. Die 8. Kammer für Handelssachen untersagte 1N Telecom außerdem, eine auf Basis des Anschreibens erfolgte Kündigung als Anbieterwechsel an die zuständige Schnittstelle zu übermitteln. Dies hatte die Deutsche Telekom beantragt, weil der zugrundeliegende Vertrag ""unlauter zustande gekommen ist"", erklärte ein Telekom-Anwalt. Der Düsseldorfer Mitbewerber hatte nach Angaben seines Anwalts Elmar Kloss im April 2023 bundesweit ""eine Million"" und im Juni ""weitere 4000 Schreiben an Festnetzkunden verschickt"". Auch zahlreiche Kunden der Deutschen Telekom waren persönlich und mit Telefonnummer angeschrieben worden. Die Kundendaten habe das Unternehmen dem Telefonbuch entnommen, sagte Kloss. In den Schreiben warb 1N für einen bestimmten DSL-Tarif. In dem nüchtern und geschäftsmäßig gehaltenen Schreiben fehlte den Düsseldorfer Richtern der klare Hinweis, ""dass es sich nicht nur um einen Wechsel ihres Tarifs, sondern um einen Wechsel des Anbieters handelt"", betonte der Richter. Nach Angaben der Deutschen Telekom und des Verbraucherzentrale Bundesverbands glaubten bundesweit zahlreiche Telekom-Kunden an ein Tarifwechsel-Schreiben des Bonner Telekommunikationsriesen und unterschrieben. Erst später hätten sie den Anbieterwechsel bemerkt. Bei Widerruf der Zustimmung und Ausstieg aus dem Vertrag habe 1N Telecom eine Schadenersatzpauschale in Höhe von knapp 420 Euro verlangt. Auch dies untersagte das Landgericht. Das Geschäftsgebaren des Unternehmens ist schon länger Gegenstand gerichtlicher Auseinandersetzungen."
14bfb5dd-e43f-48ad-a266-2cad1708a7a9,2023-08-21 09:27:00+00:00,"Nach den Wettbewerbern Deutsche Telekom und Telefónica (O2) hat nun auch Vodafone als dritter deutscher Netzbetreiber eine 5G-Abdeckung von mehr als 90 Prozent erreicht, verkündet Vodafone via Pressemitteilung. Die Abdeckung bezieht sich auf den Anteil der Haushalte, die innerhalb des 5G-Netzes des Düsseldorfer Unternehmens liegen. "" Wir kommen gut voran und haben nun schon 14.200 Standorte auf 5G aufgerüstet"", sagt die Technikchefin von Vodafone Deutschland, Tanja Richter. Das Unternehmen hat rund 26.000 Mobilfunk-Standorte in Deutschland. Vodafone: 5G jetzt für 90 Prozent der Bevölkerung Vodafone hat sein Ausbautempo zuletzt angezogen. Ende Juli 2022 war das Unternehmen nur bei 66 Prozent Haushaltsabdeckung, nun sind es 24 Prozentpunkte mehr. Allerdings ist der Wert nur mäßig aussagekräftig, schließlich wollen die Menschen überall ein gutes Netz und nicht nur dort, wo viele Menschen wohnen, wo also Haushalte sind. Der Flächenanteil von Vodafone liegt nur bei mehr als 75 Prozent. Folglich ist auf etwa einem Viertel der Fläche kein 5G zu empfangen, dafür aber häufig 4G. Die Konkurrenz ist bei dem sehr schnellen Übertragungsstandard weiter. Die Deutsche Telekom liegt nach eigenen Angaben bei mehr als 95 Prozent. Telefónica mit seiner Marke O2 ist in Sachen 5G-Abdeckung nur hauchzart vor Vodafone und knackte die 90-Prozent-Marke bereits Ende Juni 2032. Zu den 5G-Tarifen von der TELEKOM Übrigens: Kennen Sie schon die COMPUTER BILD-Speedtest-App? Mit ihr checken Sie Mobilfunknetze auf Herz und Nieren und tragen mit Ihrer Teilnahme nebenbei zur Auswertung des COMPUTER BILD-Netztests bei – danke dafür! Woran es beim 5G-Ausbau noch hapert Aus der Politik kommt wiederholt die Forderung nach einer flächendeckenden 5G-Abdeckung ("" bis an die letzte Milchkanne""). Richter betonte, dass dieses Ziel "" extrem herausfordernd"" sei. Zunächst sei es "" die Ambition, 5G mittelfristig möglichst für die gesamte Bevölkerung verfügbar zu machen. Tanja Richter weiter: "" Aber dafür müssen wir einige Hürden überwinden – Genehmigungen sind teilweise schwer zu bekommen. Standorte, die uns von Kommunen vorgeschlagen werden, passen nicht immer zur optimalen Netzplanung. Und die Zuwege zu den Standorten für den Verkehr und Strom sind sehr lang. Teilweise müssten wir über Kilometer hinweg Strom- und Glasfaserkabel an einen Standort bringen, um 5G dort auch in ländliche Regionen zu bringen, wo fast keine Menschen mit ihren Smartphones unterwegs sind."" Bei der Erschließung abgelegener Standorte seien Kooperationen mit den Ländern daher wichtig. "" Förderprojekte und andere Partnerschaften helfen beim Netzausbau"", sagt Frau Richter. In Hessen und Bayern klappt das offenbar schon sehr gut. Finanzielle staatliche Unterstützung sei nötig. Richter betonte, dass der Ausbau der verbliebenen zehn Prozentpunkte bei der Haushaltsabdeckung aufwendig und teuer werde. Dementsprechend dringlich sei es, die Netzbetreiber an anderer Stelle zu entlasten. Sie untermauerte die Forderung ihrer Firma, im kommenden Jahr auf eine Mobilfunk-Auktion zu verzichten und die Frequenznutzung stattdessen zu verlängern. Bei der Auktion 2019 hatte sich Vodafone zur Zahlung von rund 1,9 Milliarden Euro verpflichtet. "" Eine andere Lösung wäre sinnvoll, damit die Investitionskraft der Unternehmen nicht geschmälert wird"", sagt Frau Richter. Bei einer Verlängerung könnte Vodafone "" stark in neue Masten, statt in neue Frequenzscheine investieren"". In der politischen Diskussion ist eine Verlängerung von Frequenz-Nutzungsrechten, bei der die Firmen nur recht niedrige Gebühren zahlen würden, sich im Gegenzug aber zur Erfüllung von Ausbauvorgaben verpflichten würden. 5G: Von der Nische zum Massenphänomen"
f3a795d6-8011-4a14-8ea0-f669e2abb43d,2023-08-22 09:38:00+00:00,"Die Deutsche Telekom baut derzeit das Glasfasernetz in Murr aus. Da mag es so manchem Haushalt nur logisch erscheinen, wenn ein Angebot für einen Telefon- und Internetanschluss von 1N Telecom im Briefkasten steckt. Doch dieses Unternehmen hat mit der Telekom nichts zu tun."
d5a5143e-e9f0-445a-a2c0-dd6976913bc1,2023-08-22 17:16:30+00:00,"Die Deutsche Telekom zeigt alle 51 Spiele der Fußball-Europameisterschaft (EM) im kommenden Jahr auf ihrer kostenpflichtigen Streamingplattform Magenta TV. „Die Euro 2024 hat für die Telekom höchste Relevanz“, sagte Wolfgang Metze, seit August neuer Geschäftsführer für das Privatkundengeschäft, am Dienstag in Köln: „Wir reden hier über die Heim-EM in unserem Land.“ Bis zu zwölf Stunden am Tag will der Konzern zur EM Fußballinhalte auf seiner Plattform übertragen, etwa mit Taktik-Einstellungen oder Konferenzen bei gleichzeitig stattfindenden Spielen."
