114878f9-d872-4ad2-bdbc-7b99a6c5e52b,2023-02-22 10:33:35+00:00,"Stuttgart, 22. Februar 2023 MEDIENINFORMATION Telekom setzt Glasfaserausbau in Stuttgart fort Ausbaugebiet mit rund 5.600 Haushalten in Heumaden Mehr Tempo: Geschwindigkeiten bis 1.000 Mbit/s Digitale Infoveranstaltung am 14.03. auf www.telekom.de/glasfaser-events _______________________________________________________________ Mit hohem Tempo setzt die Telekom ihren Glasfaserausbau in Stuttgart fort. Am 22.02.2023 präsentiert Josip Nadj, Regio-Manager im Vertrieb der Telekom für die Landeshauptstadt, anlässlich der Sitzung des Bezirksbeirats das nächste Ausbaugebiet. „Bereits heute haben über 50.000 Haushalte in Stuttgart die Möglichkeit, einen Glasfaseranschluss der Telekom zu buchen“, sagt Nadj. „Wir freuen uns, dass es als nächstes für rund 5.600 Haushalte in Heumaden weitergeht. Ab Anfang März können die neuen Glasfaseranschlüsse gebucht werden. Im Frühjahr starten wir mit den Verlegearbeiten.“ Marius Hihn hält als Projektleiter für den Glasfaserausbau der Telekom in Stuttgart alle Fäden in der Hand und den Kontakt zum Bauamt. Auch in Botnang, Feuerbach, Stuttgart-Süd und -West wird die Telekom im Laufe des Jahres neue Glasfaserleitungen in die Erde bringen. Interessenten können sich bereits jetzt entweder für einen Anschluss vormerken lassen oder - wo möglich – schon buchen. Das neue Netz ermöglicht Bandbreiten bis zu 1 Gigabit pro Sekunde (GBit/s). Es ist so leistungsstark, dass Arbeiten und Lernen zuhause, Video-Konferenzen, Gaming und Streamen gleichzeitig möglich sind. Nutzerinnen und Nutzer können auf die stetig wachsenden digitalen Anforderungen flexibel reagieren. „Wir freuen uns, dass der Ankerinvestor unseres Gigabitprogramms, die Deutsche Telekom, den Ausbau in weiteren Stadtteilen von Stuttgart fortführt. So kommen wir der flächendeckenden Glasfaserversorgung in der Region stetig näher, können die höchste Ausbaugeschwindigkeit in ganz Deutschland beibehalten und bleiben beim regionalen Gigabitprogramm im Zeitplan“, erklärt Hans-Jürgen Bahde, Breitbandbeauftragter der Region und Geschäftsführer der Gigabit Region Stuttgart GmbH (GRS). Die Telekom errichtet das Netz im Open Access: Es steht auch für andere Inhalteanbieter offen, deshalb können auch Kundinnen und Kunden von der höheren Geschwindigkeit profitieren, die nicht bei der Telekom sind. Ob eine entsprechende Vereinbarung vorliegt, kann beim jeweiligen Anbieter abgefragt werden. Verschiedene Buchungs- Informationsmöglichkeiten Am 14.03.2023 um 19:00 Uhr lädt die Deutsche Telekom interessierte Bürger*innen zu einer digitalen Informationsveranstaltung ein, die Einwahl erfolgt über den Link www.telekom.de/glasfaser-events. Josip Nadj, Regiomanager im Infrastrukturvertrieb der Telekom, stellt die neuen Ausbaugebiete in Heumaden und Stuttgart-Ost vor und erklärt, wie der Anschluss ins Haus kommt. Im Chat beantwortet er alle Fragen rund um die Möglichkeiten des Glasfaseranschlusses sowie zu den Tarifoptionen. Der Vortrag wird aufgezeichnet und kann auf der Website auch nachträglich im Archiv noch abgerufen werden. Im Telekom Shop in der Königstr. 34 in 70173 Stuttgart können Interessenten sich ab sofort informieren und ihren Anschluss buchen. Auch auf der Website www.telekom.de/glasfaser können sie den Glasfaserhausanschluss beauftragen. Infos gibt es zudem über einen Anruf bei der kostenfreien Hotline unter 0800/ 22 66100. Kooperation zwischen Deutscher Telekom und der Gigabit Region Stuttgart Im Fokus des Gigabitprojekts steht der partnerschaftliche Ausbau des ultraschnellen Glasfasernetzes. An dem Ausbauprogramm beteiligen sich derzeit 175 Kommunen inklusive der Stadt Stuttgart sowie den fünf benachbarten Landkreisen Böblingen, Esslingen, Göppingen, Ludwigsburg und Rems-Murr. Bis zum Jahr 2025 sollen nicht nur 50 Prozent der Haushalte und alle Unternehmen, sondern auch die Schulen in der Region schnell ins Internet kommen. Bis 2030 sollen 90 Prozent aller Haushalte Zugang zu einem Glasfaseranschluss haben. Die Rahmenvereinbarung mit der Telekom sieht zudem vor, ein leistungsstarkes 5G-Netz zügig aufzubauen. In deren Mobilfunknetz können bereits knapp 95 Prozent aller Haushalte 5G nutzen und über 99 Prozent der Bevölkerung 4G/LTE. In dem Ballungsraum leben rund 2,8 Millionen Menschen. In der Region Stuttgart sind weitere Unternehmen im Glasfaserausbau aktiv. Deutsche Telekom AG Corporate Communications Tel.: 0228 181 – 49494 E-Mail: medien@telekom.de Weitere Informationen für Medienvertreter*innen:"
d7a3bb5b-dcda-4bc1-96c1-441af4ac2270,2023-02-23 07:22:00+00:00,"Die Deutsche Telekom will 2023 noch mehr verdienen. Der operative Gewinn inklusive Leasingkosten (Ebitda AL) solle im laufenden Jahr um vier Prozent auf fast 41 Milliarden Euro steigen, teilte der DAX-Konzern am Donnerstag in Bonn mit. Die Aktie der Deutschen Telekom hat zuletzt ein neues Mehrjahreshoch erreicht. Der Konzern hatte sich im vergangenen Jahr unter anderem von seinem Niederlande-Geschäft getrennt und die Funkturmtochter GD Towers veräußert, weswegen die Telekom einen Pro-Forma-Vorjahreswert als Basis nimmt. Der freie Mittelzufluss (FCF AL) solle auf dieser Basis von 11,2 Milliarden Euro um mindestens 40 Prozent auf mehr als 16 Milliarden Euro klettern. Im Jahr 2022 steigerte die Deutsche Telekom den Konzernumsatz im Vergleich zum Vorjahreszeitraum um 6,1 Prozent rund 114,4 Milliarden Euro. Das um Sondereffekte bereinigte Ergebnis vor Zinsen, Steuern und Abschreibungen inklusive Leasingkosten (Ebitda AL) stieg um 7,7 Prozent auf 40,2 Milliaden Euro. Damit erreichte der Vorstand sein eigenes Ziel, die Telekom entwickelte sich zudem besser als von Analysten erwartet. Unter dem Strich verdiente der Telekom-Konzern etwa acht Milliarden Euro nach knapp 4,2 Milliarden Euro im Vorjahr. Analysten hatten hier im Vorfeld mit 7,7 Milliarden Euro gerechnet. Die Dividende soll, wie bereits im November 2022 erklärt, auf 70 Cent je Aktie steigen. „Die Verwerfungen in der Welt und ihre Folgen lassen auch die Telekom nicht unbeeindruckt“, sagte der Vorstandsvorsitzende Tim Höttges. „Dank konsequenter Umsetzung unserer Strategie haben wir 2022 dennoch alle unsere Ziele erreicht.“ Die Prognose für 2023 sieht einen Anstieg beim bereinigten Ebitda AL um vier Prozent auf rund 40,8 Milliarden Euro vor. Der Pro-forma-Wert für 2022 auf Basis der aktuellen Konzernstruktur belief sich auf 39,3 Milliarden Euro. Der Free Cashflow AL soll von pro-forma 11,2 Milliarden Euro um mindestens 40 Prozent auf mehr als 16 Milliarden Euro steigen."
17ee2297-2039-4b3b-8219-5a53a61a59c3,2023-02-23 08:38:09+00:00,"Es gibt da dieses erstaunliche Phänomen. Man nehme eine Bürste, einen Stift oder ein anderes Objekt, das mit ein bisschen Fantasie einem Mikrofon ähnelt, und halte es jemandem vors Gesicht. Jetzt in journalistischer Manier eine beliebige Frage stellen. Na, beobachten Sie eine leichte Nervosität, stellt sich das Gegenüber etwas gerader hin, antwortet ein bisschen lauter als normal – obwohl ihm oder ihr natürlich klar ist, nicht wirklich ein Interview vor der Weltöffentlichkeit zu geben? Ja, manchmal reichen schon kleine Gesten aus, um jemandem zu demonstrieren: Du bist sichtbar. Menschen wünschen sich in der Regel, dass ihr Tun gesehen wird. Dass andere ihnen Feedback geben. Laut einer Studie der Hochschule Niederrhein aus dem vergangenen Jahr hat sich der Wunsch von Arbeitnehmenden nach Kommunikation auf Augenhöhe mit Führungskräften sowie nach Wertschätzung und Anerkennung seit 2015 drastisch verstärkt. Gleichzeitig – und das ist kein Widerspruch – scheuen viele die große Bühne, wollen die Rückmeldung lieber im vertraulichen Gespräch. Und dann entscheidet auch das eigene Arbeitsfeld oft darüber, wie sehr man im Rampenlicht steht. „Innerhalb des Konzerns ist nicht so richtig sichtbar, was mein Team alles bewirkt“, sagt zum Beispiel Tamara Rehmer. „Wir arbeiten eher unter Deck.“ Rehmer ist Teamleiterin Technik, First-Line VoIP, Deutsche Telekom. Im sogenannten Incident Management beheben ihre 30 Mitarbeitenden in Schichtdiensten technische Probleme im Netzbetrieb. Das heißt: Wenn alles rund läuft, fällt diese wertvolle Arbeit im Konzern nicht weiter auf. Rehmer grübelte, wie sie die Verdienste der Einzelnen stärker ins Rampenlicht rücken könnte. Als ihr Vorgesetzter sie und andere Teamleitungen 2018 aufrief, jeweils eine strategische Neuerung einzuführen, wagte sie ein besonderes Experiment: Jede und jeder aus ihren Teams sollte im Folgejahr bei Interesse die Gelegenheit bekommen, Rehmers Aufgaben zu übernehmen und „Führungskraft für einen Monat“ zu werden. Den Scheinwerfer aufstellen „Da waren so viele motivierte Leute um mich herum, die nach mehr Verantwortung lechzten. Ich wollte sie in den Vordergrund treten lassen“, erklärt Rehmer heute, vier Jahre später, die Idee. Die Mitarbeitenden waren angetan. Manche preschten gleich vor, wollten am liebsten schon den Januar übernehmen. Andere hielten sich im Hintergrund, akzeptierten aber, dass jemand aus ihrer Hierarchieebene die Leitung übernahm. Wer auch immer die Position einnahm, durfte gemeinsam mit Rehmer an Meetings mit höheren Führungsebenen teilnehmen und Reformen einführen. Dabei wurden ungeahnte Fähigkeiten sichtbar, wie sie erzählt: „Ein Kollege entpuppte sich als toller Redner, als er unseren Vorstandsmitgliedern unsere Aufgaben und Lösungsansätze erklärte. Ein anderer tüftelte während seines Monats als Chef ein kluges neues System zur technischen Ticketauswertung aus.“ Wie sie geahnt hatte: Es hatten viele unentdeckte Talente in ihrem Team geschlummert. Mit ihrem Experiment hatte Rehmer nun einen Scheinwerfer aufgestellt, der sich genau darauf richtete. Die Teamchefin selbst hielt sich über das Jahr im Hintergrund, coachte und beriet ihre temporären Vertretungskräfte. „Ich beobachte Erfolge gerne aus der zweiten Reihe“, sagt sie. Und doch war es am Anfang nicht ganz leicht loszulassen, zumal kleinere Pannen nicht ausblieben – wenn etwa die Monatsführungskraft ein Problem zu schnell nach oben eskalierte oder interne Debatten zu emotional führte. „In solchen Momenten habe ich kurz gezuckt und dann die Situation mit der Person in Ruhe durchgesprochen, erklärt, wie es anders geht.“ Sie habe selbst während dieser Zeit viel Anerkennung für HR gewonnen, sagt die Teamchefin. „Es ist extrem anspruchsvoll, Menschen zu coachen und zu befähigen.“ HR: A Seat at the Table Wo wir bei der Sichtbarkeit von HR wären. Oder genauer: der Sichtbarkeit des Werts, den das Personalmanagement in Unternehmen schafft, der nicht immer vollumfänglich in Zahlen zu bemessen ist. An Scheinwerfern und Mikrofonen fehlt es oft noch immer: In vielen Vorständen ist bislang kein Stuhl für HR vorgesehen. Beim Automobilzulieferer Leoni, einem global agierenden Hidden Champion mit Hauptsitz in Nürnberg, war das lange auch so. Vor einem Jahr hat sich das aber geändert – mit dem Eintritt von Ursula Biernert als Chief Human Resources Officer und Arbeitsdirektorin. Kommt der erhöhte Stellenwert von Personalbelangen – in Biernerts Aufgabenzuschnitt verknüpft mit Nachhaltigkeitsthemen – bei den Menschen an? „Definitiv, Sie hören von mir ein Ja mit drei Ausrufezeichen“, sagt die CHRO entschieden. „Ein Seat at the Table, wie es in den USA so schön heißt, bringt nicht nur mehr Einfluss mit sich, sondern auch eine enorme Sichtbarkeit von HR, sowohl innerhalb als auch außerhalb des Unternehmens.“ Für Leoni arbeiten mehr als 100.000 Menschen aus 28 Ländern, und das erfordert einiges an People Management. Für Biernert bedeutet das auch, dass sie persönlich sichtbar und nahbar sein möchte, es den Menschen im Unternehmen erleichtern will, mit ihr und miteinander in Kontakt zu treten. Als ein Vehikel dafür nutzt sie Linkedin. Neuigkeiten zu Personal-, Führungs- und Nachhaltigkeitsthemen postet sie meist auf Deutsch und Englisch, um möglichst viele Mitarbeitende zu erreichen. „Natürlich kann mich jeder per E-Mail anschreiben“, sagt sie. „Aber ein Post in solchen Netzwerken – zu einem Purpose-Thema, einer kleinen Geschichte, oder einem Event – kann ein Türöffner sein, sich auszutauschen, die Hemmschwelle für Einzelne senken, sich einzubringen, ihre Meinung sichtbar zu machen.“ Sie sieht sich als eine Art Markenbotschafterin für Leoni – und nicht nur sich selbst. Natürlich sei es wichtig, welche Werte, welche Kultur und welche Themen die Vorstandsmitglieder nach außen transportierten. „Aber im Prinzip sind alle Beschäftigten, die sich als Teil eines Unternehmens zu erkennen geben, automatisch Markenbotschafterinnen und -botschafter. Und wir möchten sie auch dazu ermuntern, sich zu vernetzen und sichtbar zu machen, dass sie Teil der Leoni-Familie sind.“ Bei vielen Arbeitgebern ist diese Art des Sichtbarmachens von Angestellten weiter auf dem Vormarsch. Die Kommunikations- und Strategieberaterin Kerstin Hoffmann beschäftigt sich seit mehr als zehn Jahren mit dem Thema Corporate Influencer, die Nachfrage wächst, wie sie sagt. Mit der Pandemie hat dieser Faktor nochmals an Relevanz gewonnen: Wie unverzichtbar digitale Kanäle sind, haben jetzt auch die meisten derjenigen begriffen, die Social Media bisher noch skeptisch gegenüberstanden. Hoffmann sagt: „Den Entscheiderinnen und Entscheidern in Unternehmen wird immer stärker klar, dass man das Thema gar nicht vermeiden kann. Es gibt immer Mitarbeiter-Markenbotschafter, gleich wie man sie nennt. Weil Beschäftigte über ihre Erfahrungen im Job sprechen und in digitalen Medien zunehmend sichtbar sind. Sobald Menschen als Unternehmensangehörige erkennbar sind, wirken sich ihre Äußerungen und Handlungen auf die Marke aus.“ Corporate Influencer: die Extradosis ­Sichtbarkeit Die Frage ist also nur: Gestalten die Beteiligten ihre Rolle hier bewusst und werden dabei vom Arbeitgeber unterstützt – oder überlassen sie es dem Zufall, wer mit welchen Aussagen im Lichtkegel steht? „Das ist ein entscheidendes Thema, das definitiv nicht in die Orchideenecke gehört“, sagt Hoffmann. Sichtbarkeit für die Arbeitgebermarke lässt sich gut über starke Persönlichkeiten aus den eigenen Reihen generieren. Bislang haben vor allem große Unternehmen die Personalstärke, umfangreiche Programme umzusetzen – an Hoffmann wenden sich aber auch viele mittelständische Arbeitgeber und neuerdings auch Behörden. Corporate-Influencer-Strategien gibt es in den verschiedensten Abstufungen und Formen – vom Schaffen grundlegender Social-Media-Richtlinien bis hin etwa zu konkret benannten Jobbotschafterinnen und -botschaftern wie etwa bei der Otto Group. Am wichtigsten für ein gelingendes Corporate-Influencer-Projekt sind laut Hoffmann: Wertschätzung, Unterstützung – und Vertrauen. Es geht eben nicht darum, die Influencer genauestens zu briefen, um sie als PR-Kanäle zu instrumentalisieren. HR und Kommunikation müssen lernen zuzulassen, dass sich die Persönlichkeiten aus dem Unternehmen mit der Pluralität ihrer Stimmen in den internen und externen Diskurs einbringen. „Steuerung ist eine Illusion, man kann und sollte nur unterstützen“, sagt Beraterin Hoffmann. Und Arbeitgeber sollten sich überlegen, ob und in welchem Umfang sie konkrete Programme aufsetzen möchten, ob sie zunächst nur einige Corporate Influencer in ein Pilotprojekt aufnehmen oder ob sie gleich eine breite Basis schaffen, auf der sich alle Mitarbeitenden als Markenbotschafter verstehen. Eine typische Befürchtung vieler Arbeitgeber: die Beschäftigten könnten sich unbedacht oder gar negativ über das Unternehmen äußern. Doch je besser die Kultur, desto unwahrscheinlicher ist das. Eine andere Sorge ist laut Hoffmann: „Uns werden die guten Leute abgeworben, wenn sie zu sichtbar sind.“ Doch die Expertin kann hier beruhigen: Corporate-Influencer-Programme steigern erfahrungsgemäß eher die Identifikation mit dem Arbeitgeber. Ruft ein Unternehmen ein Programm ins Leben, müssen erst einmal passende Mitwirkende gefunden werden. Hier kann ein Aufruf innerhalb des Unternehmens helfen. Oft neigen die Verantwortlichen dazu, den Blick erst einmal nur auf solche Personen zu richten, die bereits über eine große Reichweite verfügen und viel Social-Media-Erfahrung haben. Das ist nicht immer die beste Strategie, findet die Expertin: „Wenn man zusätzlich Menschen in das Projekt einbindet, die sich noch nicht so auskennen oder Social Media sogar kritisch gegenüberstehen, dann kann man viel mehr lernen.“ Es geht zudem nicht darum, ab Tag eins jede Menge Content zu produzieren – manchmal ist gezieltes und unaufgeregtes Netzwerken ohnehin am wirkungsvollsten. Ein Experiment mit Folgen Generell gilt: Entscheidend ist nicht, wer am lautesten kommuniziert oder am meisten Aufmerksamkeit auf sich zieht. Auch wer sich lieber im Hintergrund hält, anderen zuhört und sie unterstützt, kann die Kultur eines Unternehmens mitunter exzellent verkörpern und transportieren – Ängste, in einer eher stilleren Rolle unsichtbar zu werden, sind oft unbegründet. So war es auch bei Teamchefin Tamara Rehmer während ihres selbsterdachten Führungsrollentauschs bei der Telekom. „Eine meiner Vertretungen hat einen so guten Job gemacht, dass ein anderer Teamleiter auch Monate später immer ihn angerufen hat – und nicht mehr mich“, erinnert sich Rehmer. „Das hat mich einerseits gefreut, andererseits dachte ich mir: Wenn das jetzt überall so läuft und mich niemand mehr als eigentliche Ansprechpartnerin wahrnimmt, habe ich mir ein Eigentor geschossen.“ So kam es nicht, ihre Coachingfunktion wurde honoriert, nach dem Jahr kehrte sie in ihre Ursprungsrolle zurück. Was sie besonders stolz macht, ist, dass ihr Experiment Früchte getragen hat: Durch ihren Monat als temporäre Führungskräfte sind deutliche Führungsqualitäten bei vier der Teammitgliedern sichtbar geworden. Rehmer förderte sie weiter, übergab ihnen mehr Verantwortung. Nun wurden den Vieren offizielle Führungsrollen angeboten, die sie zum Jahresbeginn 2023 übernommen haben. Ohne ihren Monat im Rampenlicht wäre es womöglich nie dazu gekommen, schätzt Rehmer. Das Experiment, glaubt sie, hat ihnen einen Schub versetzt, einen Ansporn gegeben, auf dieser Anerkennung aufzubauen. Die Sichtbarkeit hat ihre Magie entfaltet."
6b9c0775-9cc5-4be4-8d3f-90e84f8e0dcc,2023-02-23 09:46:00+00:00,"Starker Dollar sorgt für Rekordgewinn Telekom-Aktie steigt auf 22-Jahres-Hoch Einmal mehr hat die Deutsche Telekom von ihrer US-Tochter T-Mobile profitiert. Ein starker Dollar schob zugleich Umsatz und Gewinn im Jahr 2022 an. Die Aktie klettert auf das höchste Niveau seit 22 Jahren. 23.02.2023, 16.12 Uhr Die Dollar-Stärke hat der Deutschen Telekom im vergangenen Jahr ein Rekordergebnis beschert. Sie profitierte dabei von den brummenden Geschäften bei der US-Tochter T-Mobile. ""Die amerikanische Geschichte geht zu 100 Prozent auf"", sagte Firmenchef Tim Höttges am Donnerstag während der Bilanzpressekonferenz in Bonn. Darüber hinaus können Telekom-Aktionäre auf weiter steigende Dividenden hoffen. Denn der für die Ausschüttung maßgebliche, um Einmaleffekte bereinigte Gewinn werde 2023 voraussichtlich auf 1,60 von 1,50 Euro je Aktie steigen, prognostizierte das Unternehmen. Für das abgelaufene Jahr sollen 0,70 Euro je Aktie gezahlt werden. Die Aktie der Deutschen Telekom kletterte am Donnerstag zeitweise auf das höchste Niveau seit 22 Jahren. T-Mobile gewann im vergangenen Jahr mehr als vier Mal so viele Kunden hinzu wie der Bonner Mutterkonzern. Außerdem fahre der US-Mobilfunker nun die Früchte seiner Fusion mit dem Rivalen Sprint ein. Die Synergien würden im laufenden Jahr um mindestens 20 Prozent auf bis zu 7,5 Milliarden Dollar wachsen, während die Integrationskosten um gut 80 Prozent auf weniger als eine Milliarde Dollar fielen. Mehrheitsübernahme von T-Mobile in Reichweite Zudem liegt die geplante Mehrheitsübernahme bei T-Mobile in Reichweite. Zwar wollte Höttges keinen Zeitrahmen nennen, wann die Beteiligung, die aktuell bei 49,6 Prozent liege, diese Schwelle überschreitet. ""Aber das kommt so sicher wie das Amen in der Kirche."" Ziele teilweise übererfüllt Auch beim Erreichen der 2021 ausgegebenen Mittelfrist-Ziele sieht Höttges sein Unternehmen auf gutem Weg. Die aktuellen Zahlen bewegten sich am oberen Ende der angepeilten Spanne und teilweise darüber. Im vergangenen Jahr stiegen die Erlöse um 6,1 Prozent auf ein Rekordhoch von 114,4 Milliarden Euro. Der bereinigte operative Gewinn erreichte mit 40,2 Milliarden Euro ebenfalls einen Bestwert. Das Betriebsergebnis werde 2023 um weitere vier Prozent steigen. ""Der Geschäftsbericht und der Ausblick bestätigen grundsätzlich unsere positive Sicht der Dinge"", kommentierte DZ-Bank-Analyst Karsten Oblinger. Er bekräftige seine Kaufempfehlung für die T-Aktie. Sie stieg um bis zu 1,4 Prozent und war mit 21,40 Euro so teuer wie zuletzt vor fast 22 Jahren. Netzausbau geht voran Zum Thema Netzausbau sagte Höttges, dass in Deutschland 95 Prozent der Bevölkerung mit dem schnellen 5G-Mobilfunkstandard erreicht würden. Beim schnellen Internet per Glasfaser würden in Deutschland inzwischen 1,35 Millionen Haushalte erreicht. Telekom-Konkurrent Vodafone hatte zu Monatsbeginn mit seinen Geschäftszahlen enttäuscht. Der britische Konzern kündigte außerdem dem Abbau von 500 Stellen im Hauptquartier an. Telefonica Deutschland fuhr dagegen dank eines anhaltend starken Kundenzustroms ein Rekordergebnis ein. rei/Reuters"
23f9e7bf-6f39-468f-b519-ae619c614b74,2023-02-23 16:00:00+00:00,"Softwareexperten 1000 Russen arbeiten von anderen Standorten Ungefähr die Hälfte der 2000 Softwareentwickler, die bis zum vergangenen Jahr von Russland aus für die Telekom tätig waren, hat ein Angebot der Konzerns angenommen, von anderen Standorten aus für die Telekom zu arbeiten, sagte Telekom-Chef Timotheus Höttges. Viele seien jetzt mit ihren Familien im griechischen Thessaloniki stationiert, wo es eine große russische Community gebe. Andere würden von Spanien, Deutschland, Polen oder Ungarn aus arbeiten. Nach Beginn des Angriffskriegs auf die Ukraine hatte sich die Deutsche Telekom im März aus Russland zurückgezogen. Zuvor gab es in Sankt Petersburg einen großen Standort zur Software-Entwicklung sowie zwei kleinere Ableger in anderen russischen Städten. mah"
