96279125-ee7d-4e42-9897-a793540f88cc,2021-11-16 14:30:00+00:00,"Die E-Sports-Branche wächst und wächst. Das erkennt man aber nicht nur an der steigenden Anzahl an Wettbewerben und Organisationen. Auch immer mehr große Unternehmen erkennen, dass sich im E-Sport attraktive Werbemöglichkeiten bieten. In diesem Beitrag erfahrt ihr, welche die bekanntesten E-Sports Sponsoren in Europa sind. In den frühen Anfängen wurden Ligen, Teams oder Events hauptsächlich von Marken aus der Branche selbst gesponsert. So zum Beispiel Intel: Der amerikanische Elektronik-Gigant hat schon früh in E-Sports investiert und sponsert heute mit der europäischen Electronic Sports League (ESL) unter anderem das größte E-Sports-Unternehmen der Welt. Mittlerweile erkennen aber auch immer mehr branchenfremde Sponsoren das Werbepotenzial von E-Sports. Die zunehmende Vielfalt der E-Sports-Szene unterstützt dies weiter. In Wettbewerben wie der Virtual Bundesliga haben zum Beispiel viele Clubs die gleichen Trikot-Sponsoren wie in der normalen Bundesliga. Aber auch große Lotto-Unternehmen finden ihren Weg unter die Sponsoren: Die E-Sports-Abteilung des FSV Mainz 05 wird zum Beispiel vom Lotto Rheinland-Pfalz gesponsert. Damit kommt das Unternehmen genau richtig. Der berühmte El Gordo Werbespot hat auch in Deutschland jüngst das Interesse am Lotto-Spielen wieder geweckt. Immer mehr Deutsche wollen El Gordo online spielen: Hier könnt ihr euch über die jährliche Weihnachtslotterie informieren. Diese bekannten Unternehmen sponsern E-Sports in Europa E-Sports-Organisationen und -Ligen werden von einer Reihe an Unternehmen gesponsert. Dazu zählen auch immer mehr Marken, die auf den ersten Blick nichts mit E-Sports zu tun haben. In der nachfolgenden Liste findet ihr eine kleine Auswahl bekannter Sponsoren aus dem europäischen Raum in zufälliger Reihenfolge. Es ist bestimmt die ein oder andere Überraschung dabei! 1. Red Bull Am Energydrink-Giganten kommt niemand vorbei. Das österreichische Unternehmen ist aus einer Reihe an Sportarten nicht mehr wegzudenken und ist auch im E-Sports aktiv. Dort sponsert Red Bull in Europa verschiedene E-Sports-Organisationen, die in Spielen wie Dota 2, CS:GO, League of Legends oder auch Fortnite vertreten sind. Bei der League of Legends Weltmeisterschaft 2019 in Berlin, Madrid und Paris war Red Bull sogar einer der Hauptsponsoren. 2. Monster Energy Monster macht es der Konkurrenz nach: Auch der amerikanische Energydrink-Hersteller ist im europäischen E-Sports breit vertreten und sponsert gleich mehrere Organisationen. Dazu gehören unter anderem das erfolgreiche Team Liquid oder die britische Organisation Fnatic. Dazu hat Monster jüngst einen Werbedeal mit der ESL abgeschlossen. Dadurch sponsert die Energydrink-Marke jetzt unter anderem die ESL Pro Tour CS:GO oder die ESL One. 3. Telekom Die deutsche Telekom ist europaweit vielleicht nicht der bekannteste Sponsor. Um zu zeigen, wie breit das Spektrum der Sponsoren ist, hat sich das Unternehmen aber einen Platz in der Liste verdient. Die Telekom ist seit 2018 Technologiepartner der deutschen E-Sports-Organisation SK Gaming und ging im Jahr 2019 sogar noch einen Schritt weiter: Das Unternehmen investierte mit einem Anteil von 25% direkt in die E-Sports-Organisation aus Köln. 4. Mercedes Benz Der E-Sports-Hype macht auch vor der Automobilbranche nicht Halt! Die deutsche Marke Mercedes Benz zeigt sich hier als Vorreiter: Bereits 2017 schloss Mercedes einen Sponsoring Vertrag mit der ESL ab und wurde wenig später zum weltweiten Mobilitätspartner des Unternehmens. Seit 2019 ist Mercedes als erster Automobilhersteller Teilhaber von SK Gaming und setzt sich im Rahmen des Projekts Avarosa für mehr Chancengleichheit im E-Sports ein. 5. Adidas Der Sportartikelhersteller aus Herzogenaurach ist schon seit 2006 als Sponsor in der E-Sports aktiv. Heute sponsert das deutsche Unternehmen ebenfalls verschiedene Organisationen: So ist es Sponsor des in mehreren Spielen vertretenen Team Vitaly aus Frankreich und seit Anfang 2021 Ausstatter der Berliner Organisation G2 Esports."
53edc6f6-0fd6-4f9f-9fb8-0e85fdbb5406,2023-02-01 10:40:16+00:00,"Ergolding, 1. Februar 2023 MEDIENINFORMATION 6.100 Glasfaser-Anschlüsse für Markt Ergolding Gigabit Geschwindigkeit möglich Kostenfreien Hausanschluss sichern: www.telekom.de/glasfaser _______________________________________________________________ Die Telekom baut in der Marktgemeinde Ergolding ein Glasfasernetz für rund 6.100 Haushalte und Unternehmen. Die Arbeiten beginnen im Frühjahr 2024. Das neue Netz ermöglicht Privatkund*innen hohe Bandbreiten bis 1 Gbit/s (Gigabit pro Sekunde). Außerdem können Unternehmen aus Ergolding künftig Geschäftskundentarife bis 100 Gbit/s buchen. Damit haben Kund*innen einen superschnellen Anschluss für digitales Lernen und Arbeiten, Streaming und Gaming, alles gleichzeitig. Bürgermeister Andreas Strauß hebt die Bedeutung von schnellen Internetverbindungen hervor: „Glasfaser ist die Schlüsseltechnologie für unsere digitale Gesellschaft. Das neue Netz erhöht die Attraktivität unserer Kommune. Es sichert die Zukunftsfähigkeit als Wohn- und Wirtschaftsstandort. Der Glasfaseranschluss steigert außerdem den Wert einer Immobilie.” „Hohe Geschwindigkeiten am eigenen Anschluss sind wichtig. Schließlich soll im WLAN zuhause und im Betrieb alles stabil laufen. Wer sich bis zum Beginn der Bauarbeiten für einen Glasfaser-Anschluss entscheidet, bekommt ihn kostenfrei. Hauseigentümer*innen sparen damit 799,95 Euro“, sagt Harald Jungmeier, Regionalmanager der Telekom. Was jetzt wichtig ist Der Glasfaseranschluss kommt nicht von allein ins Haus. Wer als Immobilienbesitzer*in einen Glasfaseranschluss haben will, muss der Telekom das Einverständnis geben, den neuen Anschluss zu legen. Auch wer zur Miete wohnt, kann den Glasfaseranschluss bei der Telekom beantragen: Sie kontaktiert die Vermieter*innen. Dann wird besprochen, wo die Glasfaser ins Haus kommt und wie sie im Haus verläuft. Auch Mieter können Glasfaser bekommen Jeder Mieter kann einen Glasfaseranschluss bestellen. Solange dem Vermieter keine Kosten entstehen, kann dieser seine Zustimmung nicht verweigern. Die Telekom wird die Baumaßnahme mit dem Eigentümer abstimmen. Gleiches gilt für Eigentümer in Mehrparteienhäusern: Auch sie können einen Glasfaseranschluss beantragen. Es ist sinnvoll, im Zuge des Glasfaser-Ausbaus alle Wohnungen mit einem Anschluss auszustatten. Denn ein Glasfaseranschluss bedeutet für den Eigentümer eine erhebliche Wertsteigerung. Außerdem ist eine Immobilie mit Glasfaseranschluss für die Zukunft bestens gerüstet. Auch lässt sie sich einfacher vermieten oder verkaufen. Darüber hinaus bietet der Glasfaser-Anschluss alle Möglichkeiten für digitale Anwendungen: Zum Beispiel Homeoffice-Anbindung, Smart Home, IP-TV, Streaming Dienste, Online Gaming oder auch Telemedizin. Mehr Informationen zur Verfügbarkeit und den Tarifen der Telekom: Telekom Shop Telekom Partner Shop www.telekom.de/glasfaser Hotline 0800 22 66 100 (kostenfrei) Für Unternehmen aus Ergolding Hotline 0800 330 6709 (kostenfrei) E-Mail: vollglas@telekom.de www.telekom.de/jetzt-vollglas Deutsche Telekom AG Corporate Communications Dr. Markus Jodl, Pressesprecher Tel.: 0228 181 – 49494 E-Mail: medien@telekom.de Weitere Informationen für Medienvertreter*innen:"
c7e4da3d-8729-4eb2-843a-3c4b12a18917,2023-02-02 10:32:00+00:00,"Telekommunikationsanbieter wie Deutsche Telekom, Vodafone & Co. überbieten sich und schnüren immer günstigere Tarife. Nur so können sie im hart umkämpften Markt, der kaum noch Neukunden und -kundinnen ohne einen Mobilfunkanschluss oder Internetzugang bietet, langfristig bestehen. Daher ist es für die Unternehmen umso wichtiger, Inter­essenten und Interessentinnen mit möglichst lukra­tiven Ange­boten von Mitbe­wer­bern wegzu­locken – im digitalen Zeitalter meist über das Internet. Doch es gibt sie noch, die klassischen Drückerkolonnen, die von Haustür zu Haustür ziehen und unbedarften Bürgern Verträge aufschwatzen, die sie niemals haben wollten. Diese Erfahrung mussten zuletzt verstärkt Bürgerinnen und Bürger in Karls­ruhe machen, die von Vertriebsmitarbeitenden der Deutschen Telekom belogen und zu einem Vertragsabschluss gedränkt wurden. Stadtwerke ziehen sich angeblich zurück Das geht jedenfalls aus ein Bericht von Golem hervor, der sich auf mehreren Artikeln lokaler Medien stützt. Demnach war in Kalsruhe ein Zwei-Mann-Team in einem Haus mit 200 Parteien unterwegs und setzte dort vor allem ältere Bewohner und Bewohnerinnen unter Druck. Sie behaupteten unter anderem, dass sich die die örtli­chen Stadt­werke aus dem Glas­faser­ausbau zurück­gezogen hätten und stattdessen das Netz der Deutschen Telekom mitnutzten. Daher könne der Kunde oder die Kundin auch gleich direkt bei der Telekom unter­schreiben. Doch all das ist schlicht gelogen – genauso wie die Versi­che­rung, dass die Haus­besuche der Verkaufs­teams mit Haus­ver­wal­tung und Haus­meister abge­stimmt seien. Ähnlicher Vorfall in Köln Einen ähnlichen Vorfall gab es zuvor bereits in Köln: Dort behaupteten Vertriebsmitarbeitende der Deutschen Telekom, dass das Netz der regio­nalen Tele­fon­gesell­schaft Netco­logne abge­schaltet werde. Doch auch das entspricht nicht der Wahrheit. Dementsprechend hart fiel auch die Reaktion von Netco­logne aus: ""Wir sind extrem ärgerlich, dass die Telekom mit solchen Drückerkolonnen arbeitet, die unsere Kunden aktiv belügen. Die sagen, das Netcologne-Netz wird abgeschaltet, gerade zu älteren Menschen, um sie dann zu einem Abschluss zu nötigen"" , so der Chef der regionalen Telefongesellschaft Timo von Lepel. Telekom bestätigt Besuche von Mitarbeitenden Die Deutsche Telekom bestätigte gegenüber den ""Badischen Neuesten Nachrichten"", dass Vertriebsmitarbeitende in ihrem Auftrag in Karlsruhe unterwegs gewesen seien. Es sei aber keines­falls im Sinne des Konzerns, wenn dabei mit falschen Infor­mationen gear­beitet werde. Die Telekom erwarte von ihren Vertriebs­part­nern ""eine quali­täts­volle und ehrliche Bera­tung"". Darüber hinaus werde jeder Kunde inner­halb von 24 Stunden nach dem Vertrags­abschluss an der Haustür ange­rufen. Im Gespräch werden den Angaben zufolge noch­mals alle wich­tigen Produkt­infor­mationen bespro­chen und Fragen gegebenenfalls beantwortet. Sie sind hereingefallen? Das müssen Sie jetzt tun! Sie sind bei einem Besuch von Vertriebsmitarbeitenden auf die Versprechungen hereingefallen und haben einen günstigen Mobilfunk- beziehungsweise Internetvertrag ergattert, der – wie sich später herausstellt – in Wirklichkeit aber überteuert ist? Keine Sorge: Für Haustürgeschäfte existiert ein besonderes Widerrufsrecht, auf dessen Grundlage Privatpersonen ihren Rücktritt von Haustürgeschäften innerhalb von 14 Tagen erklären können. Das machen Sie am besten schriftlich und per Einschreiben. Bei zugesandter Hardware fordern Sie einen Retourenschein vom jeweiligen Unternehmen an. Abgebuchte Geldbeträge sollten Sie nicht einfach zurückbuchen, da dieser Vorgang oft automatisiert Inkassoaufträge nach sich zieht."
47b14900-7fe7-417c-8516-4ac1ad72c74d,2023-02-02 10:37:02+00:00,"2. Februar 2023, 11:37 Uhr | Lesezeit: 10 Minuten Noch immer sind Frauen in Führungspositionen von Tech-Unternehmen keine Selbstverständlichkeit. Aber es gibt sie, und ihre Zahl steigt erfreulicherweise auch. TECHBOOK stellt elf der einflussreichsten Vertreterinnen der Technologie-Branche vor. Susan Wojcicki – Chief Executive Officer bei YouTube Angefangen hat der steile Aufstieg von Susan Wojcicki in einer Garage in Menlo Park im Silicon Valley. Die wurde 1998 von Larry Paige und Sergej Brin (der neun Jahre später Wojcickis Schwester Anne heiraten sollte) gemietet. Hier hoben die beiden Gründer die Internetsuchmaschine Google aus der Taufe, die sich zu einem Konzern entwickeln sollte, der heute unter dem Namen Alphabet Inc. eines der wertvollsten Unternehmen der Welt ist. Schon ein Jahr später, 1999, holten die beiden Wojcicki dazu. Sie wurde die erste Marketingmanagerin von Google und war dafür verantwortlich, dass das Google-Logo an besonderen (Feier-)Tagen sein Erscheinungsbild ändert. 2014 wechselte die gebürtige Kalifornierin dann als neuer Chief Executive Officer zu YouTube. Dort brachte sie die Spiele-Plattform YouTube Gaming und die Streaming-Dienste YouTube Music und YouTube TV auf den Weg. Nicht zuletzt deshalb wurde die fünffache Mutter 2017 auf Rang 6 der „100 mächtigsten Frauen der Welt“-Liste Liste des „Forbes“-Magazin geführt. Lesen Sie auch: Google – eine Geschichte über eine Garage und eine 1 mit vielen Nullen Antje Williams – Senior Vice President 5G Campus Network bei Deutsche Telekom Das Handelsblatt hat Antje Willams kürzlich als „Mrs. 5G der Telekom“ bezeichnet. Und das zurecht. Denn seit 2018 ist es Williams Aufgabe, Industrieparks, Lagerhallen und Krankenhäuser mit dem Mobilfunkstandard der vierten und fünften Generation auszustatten. Mobilfunk sei WLAN oft überlegen, so Williams in einem Interview mit dem „Handelsblatt“. Ein eigenes Mobilfunknetz, ein sogenanntes Campusnetz auf dem Firmengelände, sei für Unternehmen die bessere Wahl. Denn selbst die eigentlich perfekte Abdeckung eines Industriegeländes durch das öffentliche Mobilfunknetz reiche für die Anforderungen der Wirtschaft oft nicht aus. „Fertigung braucht etwa eine doppelte Absicherung gegen Ausfälle und hohen Datendurchsatz“, sagte die 5G-Expertin damals. Verblüffend: eigentlich ist Williams studierte Juristin, und ihre Laufbahn begann sie Anfang der 00er-Jahre noch in der Rechtsabteilung der Telekom. https://oembed/techbook/affiliate/0d67bb538e2df0fa4c020b0a899588165635cdd38bf2ae8b4f567a5c242f2d3c/b6e44ea0-940f-43c7-93ea-971f6546c765/embed Sabine Bendiek – Chief People Officer bei SAP Die Unternehmensberatung McKinsey, das Technologie-Beratungsunternehmen Booz Allen Hamilton, der Computer-Hersteller Dell – Sabine Bendiek hatte bereits früh in ihrer Karriere Führungspositionen bei einer Reihe bedeutender amerikanischer Unternehmen inne. Das zeigt einmal mehr, dass die Geschlechtergerechtigkeit in den USA bereits deutlich weiter vorangekommen ist als in Deutschland. 2016 übernahm Bendieck als erste Frau die Geschäftsführung von Microsoft Deutschland. Immer wieder warb sie nun für mehr Frauenpower in Tech-Berufen, was sie zum Role Model im Streben für mehr Gleichbehandlung machte. Anfang 2021 schließlich wechselte die heute 56-Jährige in den Vorstand von SAP, wo sie seitdem als Chief People Officer ihr wichtigstes Anliegen noch eindrücklicher vorantreiben kann. Anna Dimitrova – Chief Strategy and Transformation Officer bei Vodafone Deutschland Seit März 2022 ist Anna Dimitrova Chief Strategy and Transformation Officer von Vodafone Deutschland, wo sie zuvor vier Jahre lang als Geschäftsführerin Finanzen & Strategie tätig war. Sie liebe Menschen, Zahlen und Herausforderungen, hat Dimitrova gegenüber dem „Handelsblatt“ einmal gesagt. Und der hervorragende Ruf, der der gebürtigen Bulgarin vorauseilt, zeigt, dass sich bei ihr zur Liebe auch große Expertise gesellt. Was nicht zuletzt durch die Tatsache belegt wird, dass Vodafone Deutschland sehr gut durch die Corona-Krise gekommen ist. Sympathische Anekdote am Rande: Bei ihrer Aufnahmeprüfung für ein globales Führungskräfteprogramm war Dimitrova einst durchgefallen, wie sie dem „Handelsblatt“ freimütig erzählte. Beim Softskill-Test im Wald waren der heute 46-Jährigen, die in der Schule nur Russisch und für besagten Test ausschließlich englische Fachbegriffe für den Arbeitsalltag gelernt hatte, schlichtweg die Vokabeln ausgegangen. Ihr damaliger Chef aber gab Dimitrova eine zweite Chance. Er wolle ja keine Försterin einstellen, sondern brauche eine Businessfrau, lautete seine Begründung. Carol Shaw – die erste Spieldesignerin und Programmiererin Ihre Hochphase liegt nun schon eine Reihe von Jahren zurück. Doch jeder, der sich auch nur ansatzweise für die Geschichte des Computerspiels interessiert, dürfte den Namen Carol Shaw schon einmal gelesen oder gehört haben. Denn die 1955 im kalifornischen Palo Alto geborene US-Amerikanerin gilt als die erste weibliche Computerspielentwicklerin. So entwickelte sie 1979 mit 3D Tic-Tac-Toe“ für die Spielkonsole Atari 2600 ein Spiel, das heute ebenso Legendenstatus genießt, wie ihre weiteren Schöpfungen – „Video Checkers“ und „River Raid“. Genau genommen ist die Hoch-Zeit von Atari in den späten 70er und frühen 80er Jahren ohne Shaw kaum vorstellbar. Das Online-Magazin „Videogeschichten“ nennt dann auch das 1982 von Shaw für das Atari-Splitterunternehmen Activision präsentierte „River Raid“ „einen knallharten Actionshooter und ein echtes Meisterwerk“. Und auch wenn Shaw schon vor rund zwanzig Jahren in den Ruhestand ging, zählt ihre Meinung nach wie vor viel in der Spiele-Branche. So wurde ihr 2017 bei den Game Awards für „River Raid“ der „Industry Icon Award“ verliehen. Lesen Sie auch: Wie wird man Spiele-Programmierer? Christine Spiten – Ingenieurin und Mitgründerin von Blueeye Robotics Christine Spiten hat es sich zum Ziel gesetzt, mit ihrer Arbeit gleichzeitig die Forschung zu unterstützen wie auch die Öffentlichkeit für die Auswirkungen der globalen Erderwärmung zu sensibilisieren. Die norwegische Ingenieurin ist Mitgründerin von Blueeye Robotics. Das Start-up stellt seit 2015 per Smartphone steuerbare Unterwasserdrohnen her, die 150 Meter tief tauchen und anhand verschiedener Parameter Aufschluss darüber geben, wie es bestellt ist um das Leben in unseren Ozeanen. Spiten, die 2007 auch schon Segel-Champion ihres Landes war, wurde 2018, als gerade einmal 28-Jährige, in die „The World’s Top 50 Women in Tech“-Liste des renommierten Wirtschaftsmagazins „Forbes“ aufgenommen. Bei Blueeye Robotics verantwortet sie Design, Entwicklung und Verkauf der Drohnen. Mariam Kaynia – Director of Architecture, Strategy und Analytics bei Telefónica Germany Mariam Kaynia soll Telefónica in die Zukunft führen. Als Director of Architecture, Strategy and Analytics verantwortet die im Iran geborene Kaynia, die auch die norwegische Staatsbürgerschaft besitzt, das bisher „größte IT-Transformationsprogramm des Unternehmens“, wie es Telefonica selbst nennt. Künftig werde Telefónica dadurch Innovationen noch schneller in den Markt bringen können, die Zuverlässigkeit seiner Systeme erhöhen und die Kundenzufriedenheit erheblich verbessern, so Kaynia, die Master-Abschlüsse in den Bereichen drahtlose Kommunikation und Elektrotechnik besitzt, im Gespräch mit dem „Handelsblatt“. So würde man die Kosten für den Betrieb sämtlicher Anwendungen „ab 2025 im Vergleich zu heute um bis zu 30 Prozent senken“, stellt sie in Aussicht. Die 39-Jährige, die 2010 an der Technisch-Naturwissenschaftlichen Universität Norwegen promovierte und 2019 zu Telefónica wechselte, war während der dazwischen liegenden Jahre als Beraterin für die Unternehmensberatung McKinsey & Company in Deutschland tätig, zuletzt sogar als Associate Partner. Constanze Hufenbecher – Vorständin und Chief Digital Transformation Officer Infineon Als erste Frau überhaupt zog Constanze Hufenbecher 2021 in den Vorstand von Infineon ein. Wie groß die Wertschätzung ist, zeigte sich auch daran, dass man eigens für die heute 53-Jährige einen neuen Posten schuf, den des Chief Digital Transformation Officer. Für Hufenbecher bedeutet diese etwas ausufernde Berufsbezeichnung nicht weniger, als dass sie das Münchner Tech-Unternehmen mithilfe der ihr unterstehenden, 1500 Fachkräfte starken IT-Abteilung in die digitale Zukunft führen soll. Dass ihr dies gelingen wird, daran zweifelt niemand. Schließlich kann die studierte Betriebswirtschaftlerin, die im Übrigen zwischen 2004 und 2009 schon einmal für Infineon tätig war, u. a. als Vice President und General Manager Business Line Manufacturing & Technology Services auf wertvolle Erfahrungen auch bei anderen Top-Unternehmen zurückgreifen. So bekleidete die zweifache Mutter in der Vergangenheit auch schon Führungspositionen bei Bertelsmann, beim Vertriebsdienstleister Deutscher Pressevertrieb (DPV) und bei Lufthansa, hier als Vorständin von Lufthansa Technik. Tal Rabin – Dozentin für Informatik University of Pennsylvania/Head of Cryptography Research Group IBM „Business Insider“ erklärte Tal Rabin 2014 zu einer der „22 einflussreichsten Ingenieurinnen der Welt“. Forbes zählte die US-Amerikanerin 2018 zu den „Top 50 Women In Tech“. Die promovierte Informatikerin und Hochschuldozentin für Informatik an der University of Pennsylvania hat bisher an über 100 wissenschaftlichen Arbeiten und Studien mitgewirkt und konnte sich auf diesem Wege einen hervorragenden Namen in Fachkreisen machen. Rabins erklärtes Ziel ist es, Online-Kommunikation für uns alle sicherer zu machen. Entsprechend konzentriert sich ihre Forschung von je her auf Kryptografie (Wissenschaft der Verschlüsselung von Informationen). Sie zeichnet verantwortlich für die Entwicklung der effizientesten und sichersten Verschlüsselungsalgorithmen weltweit und hat in den USA mehrere Patente angemeldet. Ende der 90er Jahre leitete sie zudem die Forschungsgruppe Kryptografie am Thomas J. Watson Research Center, dem Sitz der IBM-Sparte für Forschung und Entwicklung. Lesen Sie auch: Wie werde ich Online-Marketing-Manager? Heike Riel – Quantenforscherin bei IBM Die ursprünglich als Möbeltischlerin gestartete Heike Riel, die später an den Universitäten Erlangen-Nürnberg und Bayreuth Physik studierte und in Bayreuth 2003 auch promovierte, zählt heute zu den bedeutendsten Physikerinnen weltweit. Ihr Ziel: Unternehmen sollen Zugriff auf leistungsfähige(re) Systeme erhalten, also auf deutlich effizientere Quantencomputer. Bereits seit 1998 arbeitet die heute 51-Jährige im IBM-Forschungslabor im schweizerischen Rüschlikon, nahe Zürich, an diesem Ziel und leitet dort seit 2008 die Nanoscale Electronics Group. https://oembed/techbook/affiliate/66be5e35c89f5e6cb8f0c7ddaf8737671c2813aa4a04f22101a7efcdbc89b279/b6e44ea0-940f-43c7-93ea-971f6546c765/embed Welches Ansehen Riel genießt, das zeigen gerade auch die vielen Preise und Auszeichnungen, die sie in den vergangenen Jahren erhalten hat. So verlieh man ihr 2005 den „Preis für Angewandte Physik der Schweizer Physikalischen Gesellschaft“ für ihre „herausragenden Beiträge zur Etablierung von OLED als konkurrenzfähige Technologie in der Flachbildschirmtechnik“. 2013 hielt Riel dann bereits stolze 27 Patente. 2015 wurde sie in die altehrwürdige Leopoldina gewählt, die Nationale Akademie der Naturwissenschaften. Wohl noch bedeutender für sie selbst aber dürfte die Verleihung des Status eines „IBM Fellow“ sein, die ihr 2013 zuteilwurde. Schließlich genießen IBM Fellows in der Industrieforschung dank voller Unterstützung durch IBM Freiräume, wie sie sonst kaum irgendwo in der Forschung zu finden sind. Amy Hood – Chief Financial Officer bei Microsoft Welchen Stellenwert sich die US-Amerikanerin Amy Hood in den vergangenen zehn Jahren erarbeitet hat – seit 2013 ist Hood erster weiblicher Chief Financial Officer von Microsoft, also Finanzchefin des Unternehmens –, das hat die Zeitschrift „Forbes“ im vergangenen Jahr sehr eindrücklich und schwarz auf weiß belegt. Denn das Wirtschaftsmagazin wählte die 51-Jährige, die insgesamt bereits seit 2002 bei Microsoft arbeitet, 2022 auf Platz 28 seiner Liste der „100 mächtigsten Frauen der Welt“. Kein Wunder eigentlich, konnte Hood seit 2013 doch 57 Geschäftsabschlüsse tätigen, darunter 2018 einen Mega-Deal. Damals erwarb sie für rund 7,5 Milliarden US-Dollar GitHub, eine Online-Plattform für Software-Entwicklungsprojekte. Ehrgeizige und zugleich erfolgreiche Geschäfte wie dieses, ließen den Aktienkurs von Microsoft bereits in den ersten fünf Jahren ihrer Amtszeit als CFO um nahezu 300 Prozent steigen. Gossip am Rande: Hood und ihr Ehemann halten eine Minderheitsbeteiligung am Major League Soccer-Verein aus Seattle, den Seattle Sounders."
