69621c92-49aa-4ef0-a217-b7d0585659e4,2023-12-16 11:00:00,"Berlin. Russland ist momentan das am meisten sanktionierte Land der Welt. Laut der Statistikplattform Statista kommt das Land auf 14.081 Sanktionsmaßnahmen gegen Individuen und Institutionen. Zum Vergleich: Auf dem zweiten Platz ist der Iran mit 4191. Bereits recht früh nach Inkrafttreten der Sanktionen postulierten Experten im Westen und in Russland den baldigen Untergang der russischen Wirtschaft. Weiterlesen nach der Anzeige Selbst Kremlsprecher Dmitri Peskow gab diesen November gegenüber der russischen Nachrichtenagentur TASS zu, dass die russische Wirtschaft im vergangenen Jahr vor dem Kollaps stand. Trotzdem hat sich das russische Bruttoinlandsprodukt (BIP) nach einem anfänglichen Kriegsschock stabilisiert und wächst derzeit sogar leicht. Warum bleibt der große Crash aus und wie lange kann Russland die Kriegsmaschinerie weiter am Laufen halten? Weiterlesen nach der Anzeige Russland verdient noch immer viel Geld mit dem Export von Öl und Gas Stabilisierend wirken vor allem zwei Faktoren: Zum einen exportiert Russland immer noch eine substantielle Menge an Öl und Gas, vor allem in Länder wie China, Indien, aber auch noch in einige EU-Länder und die Türkei. Zum anderen ist Russland durch die Krisen der vergangenen 20 Jahre gut in der Vorsorge geworden und hat Geld für schwierige Zeiten zurückgelegt. Bereits 2004 richtete Moskau einen sogenannten Stabilitätsfonds ein, mit dessen Hilfe unkompliziert Geld in wichtige Industrien fließen kann. Ebenso verpflichtete der Kreml Schlüsselindustrien wie den Öl- und Gassektor dazu, Rücklagen aufzubauen. Solche Maßnahmen tragen zwar dazu bei, die Wirtschaft zu stabilisieren, mit nachhaltigem Wachstum habe das aber nichts zu tun, sagt Alexandra Prokopenko, Ökonomin am Zentrum für Osteuropa- und internationale Studien (ZOiS) in Berlin. „Die Toppriorität für die russische Regierung ist derzeit die Finanzierung des Militärs.“ Laut Daten des Wilson Centers, eines unabhängigen US-amerikanischen Forschungszentrums, gab Russland dieses Jahr etwa 160 Milliarden für Rüstung aus. Das entspricht 40 Prozent seines Budgets oder 10 Prozent des BIP. Obwohl Moskau viel Geld ins Militär pumpt, profitieren aber auch zivile Industrien von staatlichen Investitionen. Deshalb wird es laut Prokopenko auch nicht so schnell passieren, dass sich der Lebensstandard für den russischen Durchschnittsbürger verschlechtert. „Man muss auch sehen, dass vielen Russen die gesteigerte allgemeine Nachfrage durch den Krieg zugutekommt“, sagt die Ökonomin. „Und das sind nicht nur Bereiche, die direkt mit der Waffenindustrie zu tun haben. Auch Lebensmittelproduzenten oder Kleiderhersteller fahren mit dem Krieg Profite ein.“ Weiterlesen nach der Anzeige Der große Schock kommt für Russland nach dem Krieg Langfristig kommen jedoch trotz des Kriegshochs eine Reihe von Problemen auf das Land zu. Helmut Klüther, Russlandexperte an der Uni Greifswald, führte in einer Studie zu den wirtschaftlichen Folgen des Krieges für Russland an, dass 200.000 bis 250.000 russische Unternehmen infolge der westlichen Sanktionen schließen mussten. Über 700.000 Fachkräfte haben das Land aufgrund des Krieges verlassen. Auch die eingezogenen Soldaten fehlen der russischen Wirtschaft als Arbeitskräfte. Der große Schock erwartet Russland laut Prokopenko spätestens dann, wenn es wieder von einer Kriegs- in eine zivile Wirtschaft wechselt. Zum einen werde die künstlich geschaffene Nachfrage schlagartig einbrechen, zum anderen werde Russland dann umso stärker die Effekte der westlichen Sanktionen zu spüren bekommen. Bis es so weit ist, wird es laut der Ökonomin aber wahrscheinlich noch dauern. „Für das Jahr 2024 habe Russland noch mehr als genug finanzielle Ressourcen, wahrscheinlich auch für 2025“, sagt Prokopenko und fügt hinzu: „Vorausgesetzt, die Intensität des Krieges bleibt in etwa so wie jetzt und der Öl- und Gaspreis bleiben einigermaßen stabil.“ Ebenso ist es möglich, dass Putin nach seiner voraussichtlichen Wiederwahl zum Präsidenten im kommenden Jahr weitreichende politische und wirtschaftliche Maßnahmen beschließt, um den Krieg am Laufen zu halten. „Normalerweise nutzt Putin den Beginn eines neuen Wahlzyklus dazu, unpopuläre Entscheidungen treffen. Das könnte etwa eine neue Mobilisationswelle sein oder weitere Steuererhöhungen.“"
2a595941-aef8-4c48-a872-f7dc7d6525f8,2023-12-16 16:02:00,"SPIEGEL: China steckt in der Deflation fest, die US-Ratingagentur Moody’s hat den Ausblick für die Kreditwürdigkeit der Volksrepublik gesenkt. Was ist da los? Walk: Die Führung in Peking hatte gehofft, dass die Konjunktur nach dem Ende des Lockdowns zu Beginn dieses Jahres richtig anziehen wird, doch das war nur im ersten Quartal der Fall. Nominal wächst Chinas Wirtschaft kaum noch. SPIEGEL: Wieso? Walk: Weil die Immobilienbranche schwächelt. Sie macht 25 Prozent des Bruttoinlandsprodukts aus, dadurch geht es gleich der gesamten Wirtschaft schlecht. Peking versucht zwar, den aufgeblähten Immobiliensektor kontrolliert zu schrumpfen, aber das ist nicht so einfach. Zudem sind private Investoren und Konsumenten enorm verunsichert und halten sich zurück. Ein Grund sind die starken regulatorischen Eingriffe, vor allem in der Technologiebranche. Walk: Ich weiß es nicht. Aber denken Sie nur daran, dass die Regierung 2021 völlig überraschend den Markt für private Nachhilfe zerschlagen hat. Es gab viele börsennotierte Anbieter, deren Geschäft boomte, weil es für Chinesen lebenswichtig ist, auf die richtigen Schulen und Universitäten zu kommen. Damit war von einem Tag auf den anderen Schluss. So etwas verunsichert. Walk: Das Regime kontrolliert die Notenpresse und hängt nicht von ausländischen Investitionen ab, es hat also alle Möglichkeiten. Die große Schwäche ist der private Konsum. Und da gibt es große Vorbehalte in der Kommunistischen Partei, ob es sinnvoll ist, die Binnennachfrage zu stimulieren. Kritiker sagen, das sei Geldverschwendung und wollen lieber in Infrastruktur oder Technologie investieren. Der Kampf wird gerade ausgefochten. SPIEGEL: Was heißt das für den Westen? Walk: Durch die Deflation in China werden Exportprodukte von dort für uns billiger. Das hilft uns sehr im Kampf gegen die Inflation. Nicht so gut ist, dass Chinas Banken gerade enorm viele Kredite ausreichen, um Industriekapazitäten aufzubauen, etwa im Maschinenbau oder bei erneuerbaren Energien. Chinas Unternehmen werden so gepäppelt, sie können ihre Produkte im Ausland günstig anbieten. Deutschen Firmen haben das Nachsehen, vor allem die Autobauer."
4dfa0409-c00e-4d42-99b6-16ab2fa5b61f,2023-12-17 18:10:00,"Al Hilal gegen Al Nassr, das Derby von Riad ist das wohl wichtigste Fußballspiel Spiel in der saudi-arabischen Profiliga. Mehr als 50.000 Zuschauer verfolgen das Spiel Anfang Dezember im König-Fahd-Stadion. Die überwiegend jungen Fans singen, schwenken Fahnen, zünden Leuchtraketen. Wenige von ihnen tragen den traditionellen Thawb, das weiße knöchellange Gewand, das in Riad sonst allgegenwärtig ist. Auch einige Frauen sind im Stadion. Vor zehn Jahren war das in Saudi-Arabien noch undenkbar, sagt der saudische Nahostexperte Aziz Alghashian: „In den vergangenen zwei Jahrzehnten hat sich unter den jungen Menschen viel Frust ausgebreitet. Sie wussten nicht, wie sie ihre Energie sinnvoll nutzen konnten. In Riad gab es kaum Freizeitmöglichkeiten. Es war zwar viel Geld vorhanden, aber das wurde nicht investiert. Das ändert sich nun. Es gibt nun viele Investitionen in diese Generation.“ Recherche von ""Play the Game"" Die wichtigsten Köpfe der saudi-arabischen Sport-Offensive Recherche von ""Play the Game"" Die wichtigsten Köpfe der saudi-arabischen Sport-Offensive Die Vergabe der Fußball-WM 2034 an Saudi-Arabien ist nur noch Formalität. Die Sportstrategie des Königreiches geht Stück für Stück auf. Dahinter steckt nicht nur Kronprinz Mohammed bin Salman, wie eine Recherche von ""Play the Game"" zeigt. Vergabe der Fußball-WM Saudi-Arabien und die WM 2034 - wie es dazu kam und wie es weitergeht Saudi-Arabien hat die WM 2034 so gut wie sicher. Das Land bekam das Turnier auf dem Silbertablett serviert. Doch wie kam es dazu? Kommentar zur WM-Vergabe 2034 Der DFB verrät seine Werte Die Fußball-WM 2034 wird wahrscheinlich in Saudi-Arabien stattfinden. Der DFB, der nach der WM in Katar Werte wie Menschenrechte und Transparenz hochhalten wollte, schweigt. Dabei hätte es längst einen Aufschrei geben müssen, kommentiert Marcus Bark. Ronaldo hilft mit großer Reichweite Die jüngere Generation kann mit den alten Eliten aus Religion und Stammesnetzwerken immer weniger anfangen. Die Jüngeren wollen sich freier und kreativer entfalten. Und die neue milliardenschwere Sportindustrie, unter anderem im Fußball, in der Formel 1 und im Golf, biete dafür eine Plattform, sagt Aziz Alghashian: „Saudi-Arabien diversifiziert seine Wirtschaft. Die hohen Öl-Einnahmen sollen langfristig in den Aufbau anderer Industrien fließen. Dabei geht es um Tourismus und die Öffnung für ausländische Investitionen. Auch Fußballer wie Ronaldo mit ihrer großen medialen Reichweite erzeugen Öffentlichkeit dafür.“ Laut Weltbank liegt die Jugendarbeitslosigkeit in Saudi-Arabien bei 24 Prozent. Jedes Jahr drängen mehr als 250.000 Menschen auf den Arbeitsmarkt. Immer mehr saudische Staatsangehörige müssen Jobs übernehmen, die Jahrzehnte lang von Migranten aus Südasien ausgefüllt wurden. Um die Identifikation mit der Transformation zu stärken, schürt das Königshaus einen saudischen Nationalismus. Auch der Sport soll neue Freizeitangebote und neue Jobs schaffen, sagt der Islamwissenschaftler Sebastian Sons: „Und da spielt eben natürlich Fitness und Gesundheit eine gewisse Rolle, gerade auch vor dem Hintergrund, dass gerade viele junge Menschen extrem in Anspruch genommen werden, die Erwartungshaltung extrem hoch ist, im Job auch wirklich zu performen und Leistungen zu erbringen, die ihre Eltern niemals erbringen mussten. Weil es damals eben nicht notwendig war. Aber mittlerweile ist der Konkurrenzkampf enorm auf dem Arbeitsmarkt, für Frauen wie für Männer.“ Fußball-WM 2034 Warum eine WM in Saudi-Arabien auch eine Chance ist Fußball-WM 2034 Warum eine WM in Saudi-Arabien auch eine Chance ist Die Fußball-WM 2034 wird höchstwahrscheinlich in Saudi-Arabien stattfinden. Für Deutschland sei das durchaus eine Chance, sagte Islamwissenschaftler Sebastian Sons im Dlf. Denn der Westen habe in Nahost zuletzt massiv an Glaubwürdigkeit verloren. Sportswashing Saudi-Arabien bewirbt sich um Handball-WM Saudi-Arabien investiert massiv in den Sport. Nicht nur die Fußball-WM 2034, sondern auch andere Sportereignisse sollen in dem Wüstenstaat stattfinden. So bewirbt sich die saudi-arabische Handball-Föderation SAHF um die Austragung einer Männer-Handball-WM. Kommentar zur WM-Vergabe 2030 Die FIFA öffnet Saudi-Arabien die Tür Die Fußball-WM 2030 wird in sechs Ländern auf drei Kontinenten stattfinden. FIFA-Präsident Gianni Infantino hat damit eine Lösung gefunden, die nur außerhalb des FIFA-Systems Verlierer produziert, kommentiert Dlf-Redakteur Maximilian Rieger. Frauen bei den Saudi Games Bis Anfang Dezember fanden in Riad die „Saudi Games“ statt, ein großes Sportfestival. Ein zentraler Ort war die „Fan Zone“, ein Campus mit Sporthallen, Beachsoccer und Basketballcourt. Zudem Zelte für Esports und Filmvorführungen. Daneben eine Konzertbühne und Infostände für gesunde Ernährung. Bereits zum zweiten Mal nahm Amira in einem Kraftsport an den „Saudi Games“ teil. Sie ist Mitte 30, ihren richtigen Namen möchte sie nicht nennen: „In meiner Jugend gab es keinerlei Sportangebote für Mädchen und Frauen. Es gab nicht mal Fitnessstudios. Ich habe immer gedacht, dass ich das Land verlassen muss, um sportlich erfolgreich zu sein.“ Über Jahrzehnte prägte in Saudi-Arabien der Wahhabismus den Alltag, eine streng konservative Auslegung des sunnitischen Islam. Kinos und Konzerte waren untersagt. Frauen durften kein Auto fahren, mussten separate Eingänge benutzen und benötigten für viele Anliegen die Erlaubnis eines männlichen Vormunds. Auch Amira wurde von der Religionspolizei gestoppt und darauf hingewiesen, wenn ihr Kopftuch verrutscht war: „Noch 2017 war es so, dass ich nicht in Saudi-Arabien leben wollte. Aber jetzt ist das anders. Unsere Regierung gibt uns das Gefühl, dass wir Frauen eine wichtige Rolle bei der Transformation spielen. Und ich möchte dieses Gefühl in den sozialen Medien weitergeben. Ich möchte Mädchen und junge Frauen für Sport inspirieren.“ Saudi-Arabiens Transferoffensive Das Financial Fairplay und die Petrodollars Saudi-Arabiens Transferoffensive Das Financial Fairplay und die Petrodollars Saudi-arabische Investoren haben im Sommer für fast 700 Millionen Euro Stars aus dem europäischen Fußball in die heimische Pro League gelockt. Die Transferoffensive aus der Wüste stellt auch das Financial Fairplay vor neue Herausforderungen. Ronaldo, Newcastle, LIV-Golftour Welche Ziele Saudi-Arabien im Sport verfolgt Cristiano Ronaldo, Karim Benzema, LIV-Golftour: Saudi-Arabien investiert massiv in den Sport. Das Land wolle so Einfluss gewinnen, sagt Journalist Robert Chatterjee im Dlf. EU-Politiker Hannes Heide nimmt die Sportverbände in der EU in die Pflicht. Sport als Gesundheitsförderung Die zentrale Figur in der Transformation ist der saudische Kronprinz Mohammed bin Salman. Im Westen gilt er als brutaler Herrscher, der sogar Journalisten wie Jamal Khashoggi ermorden lässt. In Saudi-Arabien beschreiben ihn Jüngere wie Amira als Reformer, der die Religionspolizei entmachtet hat. Und dabei stets die Wirtschaft im Blick hat: 1990 waren nur elf Prozent der Frauen in Saudi-Arabien erwerbstätig. Mittlerweile sind es dreimal so viel. Die Aufhebung des Fahrverbots für Frauen 2018 soll die Wirtschaftsleistung laut Bloomberg jährlich um 90 Milliarden Dollar gesteigert haben. Zahlen wie diese sind wichtig für die Monarchie, sagt der Islamwissenschaftler Sebastian Sons. Denn mit einem hohen Wohlstandsniveau sinkt auch die Wahrscheinlichkeit für Proteste: „Eine zunehmende Demokratisierung Saudi-Arabiens wird es nicht geben. Was man aber in Saudi-Arabien durchaus erlebt, ist ein breiter gesellschaftlicher Diskurs zu Themen, die der Staat erlaubt. Es gibt rote Linien, und die müssen eingehalten werden, aber es gibt eben auch Themen, die durchaus in Saudi-Arabien kritisch diskutiert werden. Beispielsweise mangelnder bezahlbarer Wohnraum, fehlender öffentlicher Nahverkehr. Zum Beispiel auch den Mangel an Sportlehrern.“ Fusion von PGA und LIV Wie Saudi-Arabien sich in den Golf-Sport eingekauft hat Fusion von PGA und LIV Wie Saudi-Arabien sich in den Golf-Sport eingekauft hat Monatelang hat sich die PGA-Tour gegen die saudische Konkurrenz-Serie LIV gewehrt. Die Fusion der beiden Organisationen überrascht Spieler wie Rory Mcllroy. Er habe sich wie ein ""Opferlamm"" gefühlt - jetzt will er das Beste aus der Situation machen. Golf-Touren Was steckt hinter dem Zusammenschluss von PGA und LIV? Seit Gründung der von Saudi-Arabien finanzierten Golftour LIV stand die nordamerikanische PGA-Tour in Fundamentalopposition. Jetzt haben sie sich überraschend zusammengeschlossen. Ein Überblick. Nach Konflikten im Golfsport PGA Tour, DP World und LIV Golf fusionieren Mit viel Geld hat Saudi-Arabien mit der LIV-Golf versucht, der PGA Tour Konkurrenz zu machen. Der Konflikt führte die beiden Organisationen bis vors Gericht. Jetzt verkünden beide überraschend, fusionieren zu wollen. Neuer Vorsitzender wird Yasir Al-Rumayyan. Im Februar findet in Riad zum dritten Mal ein Marathon statt. Fast 20 Prozent der Bevölkerung in Saudi-Arabien leben mit Diabetes, rund 50 Prozent mit Übergewicht. Die Regierung möchte die Zahl der Menschen, die mindestens einmal pro Woche Sport treiben, bis 2030 von 13 auf 40 Prozent steigern. Das würde das Gesundheitssystem entlasten und die wirtschaftliche Produktivität stärken. Und so lange diese Produktivität wächst, so lange ist wohl auch die Stabilität der Monarchie gesichert."
bedd2544-75be-4256-a038-9f80a7285a16,2023-12-17 23:00:00,"München. Bayerns Wirtschaft kommt derzeit nicht recht vom Fleck. Und auch die Perspektiven lassen wenig Raum für große Zuversicht. So lautet zum Ende des Jahres die unerfreuliche Interpretation des „Weißbier“-Indexes, des Konjunkturbarometers der Vereinigung der Bayerischen Wirtschaft (vbw). Aus Sicht der vbw dürfte die bayerische Wirtschaft 2023 in etwa auf dem Niveau des Vorjahres verharren. „Die Konjunktur bleibt schwach, die Wirtschaftslage hat sich im Verlauf des Jahres verschlechtert“, sagt vbw-Präsident Wolfram Hatz. „2023 ist ein Jahr der wirtschaftlichen Stagnation.“ Der vbw-Index ist gegenüber dem Frühjahr 2023 von 101 auf 93 Punkte gefallen. Unter 100 Punkten lag der Index zuletzt 2021 zu Zeiten der Corona-Pandemie. Auch die vier Teilindizes für die Bereiche Konjunktur und Beschäftigung haben sich verschlechtert – zum Teil deutlich. „Die schwache Konjunktur hinterlässt damit allmählich ihre Spuren auf dem Arbeitsmarkt“, erklärt Hatz. Pessimistischer Blick in die Zukunft sorgt für Zurückhaltung bei Konsum und Investitionen Unternehmen und Verbraucher schauten aktuell eher pessimistisch in die Zukunft, beobachtet der vbw-Präsident. Das führe zur Zurückhaltung bei Konsum und Investitionen. „Die Unsicherheiten sind groß“, betont Hatz. „Die kaum gebremste Inflation, die anhaltend hohen Energiekosten, die gestiegenen Zinsen, die schwache Weltwirtschaft sowie der Mangel an Fach- und Arbeitskräften belasten die Unternehmen im Freistaat.“"
8d2a5fa1-d2be-4436-b372-c03d0322b454,2023-12-18 11:02:04,"Die Hoffnungen auf eine konjunkturelle Besserung über Weihnachten haben sich nicht erfüllt. Das ifo-Geschäftsklima sank im Dezember unerwartet nach zuvor zwei Anstiegen in Folge. Die Stimmung in den Chefetagen der deutschen Wirtschaft hat sich zum Jahresende überraschend eingetrübt. Das Ifo-Geschäftsklima sank im Dezember zum Vormonat um 0,8 Punkte auf 86,4 Zähler, teilte das Münchner ifo-Institut zu seiner Umfrage unter rund 9.000 Führungskräften mit. Von der Nachrichtenagentur Reuters befragte Fachleute hatten mit einem Plus auf 87,8 Punkte gerechnet. Im Oktober und im November hatte es jeweils Anstiege gegeben. Die Unternehmen beurteilten ihre aktuelle Geschäftslage und ihre Aussichten für die kommenden Monate wieder pessimistischer. ""Die Konjunktur bleibt auch in der Weihnachtszeit schwach"", sagte ifo-Präsident Clemens Fuest. Sorgenkind Industrie In der Industrie fiel der Geschäftsklimaindex merklich. ""Insbesondere energieintensive Branchen tun sich schwer"", erläuterte Fuest. Im Dienstleistungssektor verbesserte sich die Stimmung hingegen leicht. Die Firmen berichteten von weniger Skepsis bei den Aussichten für das kommende Halbjahr. In der Gastronomie verbesserte sich zwar die Geschäftslage. ""Die Erwartungen sind regelrecht abgestürzt"", erklärte Klaus Wohlrabe, Leiter der Ifo-Umfragen. Zugleich gehen die Preiserwartungen durch die Decke."" Grund dafür sei das Ende der reduzierten Mehrwertsteuer auf Speisen zum Jahreswechsel: Dann werden wieder 19 statt der bislang sieben Prozent fällig. ""Die Preise werden steigen in der Gastronomie"", sagte Wohlrabe. Auch der Einzelhandel blicke alles andere als euphorisch auf das laufende Weihnachtsgeschäft. Im Bauhauptgewerbe fiel der Index sogar auf den niedrigsten Wert seit September 2005. ""Eine kalte Dusche"" Jörg Krämer, Chefvolkswirt der Commerzbank bezeichnete die Daten als eine ""kalte Dusche“. ""Die deutschen Unternehmen haben einfach zu viel zu verdauen, etwa ein neues Zinsumfeld, dauerhaft hohe Energiepreise und eine jahrelange Erosion der Standortqualität"", stellt Krämer fest. Die Haushaltskrise sei in diesem Zusammenhang nicht hilfreich. Eigentlich habe in den vergangenen Wochen vieles für ein Ende der konjunkturellen Talfahrt gesprochen, zumal am Horizont die Aussicht auf sinkende Leitzinsen für 2024 hell aufleuchte, meint Jens-Oliver Niklasch, Ökonom bei der LBBW. ""Doch mit den jüngsten Zahlen aus der Industrie sind die Abwärtsrisiken wieder stärker in den Vordergrund getreten."" Damit dürften sich die konjunkturellen Aussichten weiter verschlechtern. Die deutsche Wirtschaft war im Sommer leicht geschrumpft. Bei einem weiteren Rückgang des Bruttoinlandsproduktes im laufenden Quartal droht ein Rückfall in eine vorübergehende, sogenannte technische Rezession. Konjunkturprognosen werden pessimistischer Viele führende Wirtschaftsforschungsinstitute wie das ifo, das Berliner DIW und das IWH aus Halle haben ihre Prognosen für 2024 gesenkt und erwarten nur noch 0,5 bis 0,9 Prozent Wachstum. Das gewerkschaftsnahe IMK geht sogar davon aus, dass die Wirtschaft 2024, genau wie in diesem Jahr, um 0,3 Prozent schrumpft. ""Kürzungen bei den Staatsausgaben, höhere Abgaben und die zusätzliche Unsicherheit über die weitere Förderung von Klimaschutzprojekten dürften den bremsenden Effekt von hohen Zinsen und verhaltener Entwicklung der Weltwirtschaft verstärken"", erklärten die Forscher in ihrer am Montag veröffentlichten Prognose. Auch die Commerzbank rechnet Krämer zufolge für das gesamte Jahr 2024 mit einem von 0,3 Prozent: ""Mit dieser Prognose liegen wir noch immer deutlich unter dem Konsens von 0,4 Prozent, wobei sich dieser seit Monaten in unsere Richtung bewegt“, so der Experte. ""Alles in allem gehen wir davon aus, dass die derzeitige Stagnation und leichte Rezession anhalten wird"", kommentiert Carsten Brzeski, Chefvolkswirt der ING. Das Risiko, dass 2024 ein weiteres Rezessionsjahr sein werde, habe sich deutlich erhöht. ""Es wäre das erste Mal seit Anfang der 2000er-Jahre, dass Deutschland eine zweijährige Rezession durchläuft, auch wenn es sich um eine flache Rezession handeln dürfte"", so Brzeski."
