2c5a6b7b-0a9a-4daf-8df5-76588b2bb402,2023-05-04 13:50:03+00:00,"Der Autokonzern verfolgt den Plan unterdessen ohne Bosch weiter. Volkswagen und das Tochterunternehmen PowerCo hielten an dem Plan fest, sich künftig in der Ausrüstung von Batteriezellfabriken zu engagieren, erklärte ein VW-Sprecher. ""Wir sind dazu in Gesprächen mit potenziellen Partnern. Über die genaue Konstellation werden wir zu gegebener Zeit informieren."" Boschs Partnerschaft mit Volkswagen zur Digitalisierung der VW-Batteriefabriken bestehe weiter, erklärte Hartung. Boschs Digitalchefin Tanja Rückert sagte, dabei gehe es zum Beispiel um Lösungen, den mit bis zu 15 Prozent hohen Ausschuss bei den Batteriezellen zu verringern. Bosch liefere Software für die VW-Zellfabriken. Da es bei der Digitalisierung generell auf Tempo ankomme, könnten die Firmen ""besser auf Projektebene als in einem solchen Konstrukt"" zusammenarbeiten, sagte sie mit Blick auf das abgesagte Joint Venture. Quartalsgewinn steigt um 35 Prozent auf 7 Milliarden Euro Die Absatzerholung in Europa und den USA hat den Gewinn von Volkswagen zu Jahresbeginn kräftig steigen lassen. Das bereinigte Betriebsergebnis kletterte im ersten Quartal um 35 Prozent auf 7,1 Milliarden Euro, wie Europas größter Autokonzern am Donnerstag mitteilte. Einschließlich Sondereffekten aus der Absicherung gegen den Anstieg der Rohstoffpreise brach das Ergebnis jedoch um 31 Prozent ein. Analysten hatten mit einem noch höheren Rückgang gerechnet. Im Vorjahr hatte Volkswagen durch die Bewertung von Sicherungssinstrumenten einen Buchgewinn von 3,5 Milliarden Euro verbucht. 2023 kehrte sich der Effekt wegen sinkender Rohstoffpreise um und Volkswagen verbuchte einen negativen Effekt von 1,3 Milliarden Euro. Den Ausblick für das laufende Jahr bekräftigte der Vorstand um Konzernchef Oliver Blume dennoch. Der Konzernumsatz legte um mehr als ein Fünftel auf 76 Milliarden Euro zu und stieg damit deutlich stärker als die Auslieferungen, die um 7,5 Prozent wuchsen. Dabei machte der Autokonzern einen Absatzrückgang in China, dem größten Einzelmarkt der Wolfsburger, durch eine kräftige Steigerung in Westeuropa und Nordamerika wett. Mit einer Rendite vor Bewertungseffekten von 9,3 Prozent sieht sich der Konzern auf Kurs zu seinen Jahreszielen. ""Mit dieser soliden Performance und einem Auftragsbestand von 1,8 Millionen Fahrzeugen zum Ende des ersten Quartals bestätigen wir unseren Ausblick für das Geschäftsjahr 2023"", erklärte Finanzchef Arno Antlitz, der auch das operative Geschäft des Konzerns leitet. Bei den Marken stach besonders die früher schwächelnde Volumengruppe mit VW, Skoda, Seat und der Transportersparte hervor. Ihr Ergebnis verdoppelte sich auf gut 1,7 Milliarden Euro. Bei der Markengruppe Premium mit Audi halbierte sich das operative Ergebnis dagegen wegen der Rohstoffabsicherungsgeschäfte. Die renditestarke Sportwagentochter Porsche zog mit einem operativen Gewinnplus von mehr als 25 Prozent eigene Kreise. Die Softwaresparte Cariad, in der die Software für die neuen Elektroautos entwickelt wird, verbuchte wegen hoher Anlaufkosten einen Verlust von 429 (Vorjahresminus 416) Millionen Euro."
6cb9d8d0-a265-4c52-affa-a8697300f69d,2023-05-05 06:11:36+00:00,"Zu den chinesischen Startups, die in ihrer Heimat mehr Elektroautos verkaufen als die zuvor dort dominierende deutsche Marke Volkswagen, zählt das inzwischen an der US-Börse notierte Unternehmen Nio. Seit vergangenem Jahr sind seine im Premium-Segment angesiedelten Elektroautos auch in Deutschland zu haben, spielen mit zusammen 136 Neuzulassungen im ersten Quartal dieses Jahres bislang aber kaum eine Rolle. Doch das soll sich ändern: Wie der Mitgründer und CEO sagt, macht ihm selbst Tesla keine Angst. Und den großen Konkurrenten Volkswagen will William Li mit einer neuen Elektroauto-Marke auch in Europa unter Druck setzen. Nio sieht sich nicht in Tesla-Segment Nachdem Tesla seine Preise Anfang dieses Jahres zunächst in China gesenkt hatte, zogen mehrere lokale Hersteller wie insbesondere BYD nach. Nio aber wollte sich in einen solchen Preiskrieg nicht verwickeln lassen und hält bislang daran fest: „Wir werden da nicht mitmachen“, sagte Li vergangene Woche in einem Interview mit dem Spiegel. Insbesondere im Premium-Segment müsse ein gutes Auto seinen Preis haben, auch wegen der Restwerte. Die eigenen Elektroautos seien bereits rund 20.000 Dollar teurer als vergleichbare von Tesla, die in China nur 6 Prozent Marktanteil hätten. Eine Besonderheit bei Nio ist, dass das Unternehmen nicht nur eigene Standorte für schnelles Laden aufbaut, sondern auch ein Netz von Stationen für Akku-Tausch (s. Foto oben). In China gibt es bereits mehr als 1000 davon, in Europa laut dem Spiegel-Bericht bislang 13 statt geplanter 20, was laut Li an komplizierten Genehmigungen und Fachkräfte-Mangel liegt. Dabei hätten von den Stationen nicht nur die eigenen Kunden Vorteile, sondern auch die Kommunen, in denen sie stehen: Die dort vorgehaltenen Elektroauto-Batterien könnten auch Strom ins Netz einspeisen. Auch wenn er erklärte, in einem anderen Segment tätig zu sein als Tesla, sagte Li in dem Interview weiter, durch die branchenweit sinkenden Preise werde das Nio-Ziel, in diesem Jahr profitabel zu werden, schwieriger zu erreichen. Trotzdem solle der Aufbau von Akku-Stationen beschleunigt werden, und beginnend in diesem Mai wolle das Unternehmen fünf neue Elektroauto-Modelle auf den Markt bringen, um das Umsatz-Wachstum in Gang zu halten. Europa-Marke für billigere Elektroautos Zu dem bislang mäßigen Verkaufserfolg in Deutschland sagte Li, auf solchen gesättigten Märkten müsse man Geduld haben. Das digitale Angebot von Nio werde in einem Entwicklungszentrum in Berlin an europäische Kundenwünsche angepasst. Zudem gebe es in Europa viel Nachfrage nach Elektroautos im kleinen und kompakten Format – und auch die will das chinesische Unternehmen bedienen: Li kündigte zwei zusätzliche Marken neben Nio an, eine davon ausdrücklich auf den europäischen Markt ausgerichtet und für das Preis-Segment unterhalb von 30.000 Euro."
8af6ab91-2f38-4f05-9ba1-e4f5b7ed918d,2023-05-05 09:00:00+00:00,"Die Lkw-Branche befindet sich im Umbruch: Im Jahr 2035 werden mehr als die Hälfte der neu zugelassenen Lkw in Europa, den USA und China elektrisch angetrieben sein. Das zeigt eine Studie der Unternehmensberatung McKinsey & Company. Für die Hersteller gehen mit der Transformation hohe Investitionskosten einher – kein leichtes Unterfangen in der stark konjunkturabhängigen Branche. Hinzu kommt, dass die Studienautoren von einer künftig stagnierenden Nachfrage nach Trucks und Transporter ausgehen. Worauf es für Abnehmer wie etwa Spediteure also ankommt, sind hochmoderne und kosteneffiziente Fahrzeuge. Der Lkw-Produzent Traton will bis 2025 bereits acht von zehn seiner leichten Nutzfahrzeuge elektrifizieren. Das Unternehmen zählt mit den Marken Scania, MAN, Volkswagen Truck & Bus, Navistar und RIO zu den weltweit führenden Nutzfahrzeugherstellern. Die Dachgesellschaft gehört mehrheitlich der Volkswagen AG und firmierte noch bis zum Jahr 2018 unter dem Namen Volkswagen Truck & Bus. Traton hat Anfang Mai seine Ergebnisse für das Auftaktquartal 2023 veröffentlicht. Für die drei Monate bis Ende März meldete das Unternehmen einen Umsatz in Höhe von rund 11,2 Mrd. Euro, verglichen mit 8,5 Milliarden im Vorjahresquartal. Unter dem Strich ergab das einen Nettogewinn von 555 Mio. Euro gegenüber 422 Millionen ein Jahr zuvor. Den gestiegenen Absatzzahlen steht eine schwächelnde Auftragslage gegenüber: Traton verzeichnete im Vergleich zum ersten Quartal 2022 mit minus 28 Prozent deutlich weniger Aufträge. Dies sei unter anderem darauf zurückzuführen, dass die unterschiedlichen Traton-Marken aufgrund eines bereits sehr hohen Auftragsbestands restriktiv beim Neugeschäft agieren würden. Der Kurs der Traton-Aktie hat seit Jahresbeginn um mehr als 40 Prozent zugelegt und notiert heute bei 20,30 Euro. Im Vergleich zum IPO-Preis ist das aber immer noch ein Minus von mehr als 23 Prozent. So ist das Unternehmen auch trotz der jüngsten Rally weiterhin sehr günstig bewertet: Das Kurs-Gewinn-Verhältnis (KGV) auf Basis der erwarteten Gewinne für das laufende Fiskaljahr liegt bei 5. Deutsche Bank Research hat das Kursziel für Traton von 35 auf 38 Euro angehoben und die Einstufung auf „Buy“ belassen. Traton habe nach vollständigen Quartalszahlen das Jahresziel erhöht, was den schwachen Auftragseingang kompensiere. Daimler Truck strebt CO2-Neutralität bis 2039 an Der mit Abstand größte Lkw-Hersteller der Welt, gemessen sowohl am Umsatz als auch der Anzahl verkaufter Fahrzeuge, ist Daimler Truck. Das Unternehmen entstand durch Abspaltung von der Mercedes-Benz Group (vormals Daimler AG) und ist seit Dezember 2021 an der Börse in Frankfurt notiert. Heute vertreibt Daimler Truck Lkw unter den Marken Mercedes-Benz, Bharat Benz, Freightliner, Western Star und Fuso. Daimler stellt sich ebenso neu auf und plant die Herstellung von Wasserstoff-Lkw, die eine Reichweite von rund tausend Kilometern haben sollen. Bis zum Jahr 2039 sollen alle Fahrzeuge der Marke Mercedes-Benz CO2-neutral werden. Daimler Truck wird seine Bücher zum ersten Quartal 2023 am 9. Mai veröffentlichen. Doch schon im Vorfeld sprach der Lkw-Produzent von einer im Jahresvergleich stärkeren Nachfrage und von höheren Verkaufszahlen. Laut vorläufigen Zahlen stieg der Umsatz um 23 Prozent auf 12,6 Mrd. Euro. Das Daimler-Papier notiert bei einem Kurs von 28,50 Euro. Damit beläuft sich das Minus seit Jahresbeginn auf rund drei Prozent, seit dem Börsengang auf knapp sechs Prozent. Mit einem KGV (2023e) von 7,5 ist Daimler Truck etwas höher bewertet als Traton. Das Analysehaus Jefferies hat das Kursziel für Daimler Truck nach vorläufigen Quartalszahlen von 38 auf 40 Euro angehoben und die Einstufung auf „Buy“ belassen. Der Jeffries-Analyst Himanshu Agarwal bevorzugt Daimler Truck vor Traton und dem schwedischen Wettbewerber Volvo."
98916573-7aaa-4ad6-8e84-56b3249622ef,2023-05-06 08:32:28+00:00,"Vor zwei Wochen stand er noch in Schanghai auf der Bühne, um vor Besuchern der größten Automesse der Welt über Software-Entwicklung für den chinesischen Markt zu reden. Aber jetzt ist ist klar: Die Tage von Dirk Hilgenberg als Chef der Volkswagen-Tochtergesellschaft Cariad sind gezählt. Wie aus informierten Kreisen zu vernehmen ist, will der VW-Vorstandsvorsitzende Oliver Blume den 58 Jahre alten Software-Manager absetzen. Auch für seine amtierende Führungsmannschaft wird es eng."
96fdcda7-c126-4fb4-976c-aa1d2217452a,2023-05-08 06:43:56+00:00,"Volkswagen entlässt fast den kompletten Vorstand der mit Problemen kämpfenden Softwaretochter Cariad. Der Aufsichtsrat von Cariad soll dies zeitnah beschließen, hieß es am Wochenende aus Unternehmenskreisen. Nach SPIEGEL-Informationen wird Peter Bosch, aktuell Vorstand der britischen Nobelmarke Bentley, neuer Chef der VW-Softwareeinheit. Insgesamt drei Vorstände der Sparte werden demnach ausgetauscht. Der Wechsel an der Cariad-Spitze ist ein radikaler Neustart der für die Zukunft des VW-Konzerns zentralen Sparte – und der erste große Durchgriff des neuen VW-Chefs Oliver Blume, acht Monate nach seinem Amtsantritt. Laut »Handelsblatt« , das zuvor über den Wechsel berichtet hat, steht auch eine Neuordnung der Arbeitsabläufe an. In das Führungsgremium würden zwei Techniker berufen, heißt es in der Zeitung unter Berufung auf Unternehmenskreise. Sollte es so kommen, würde einzig Personalvorstand Rainer Zugehör bleiben. Ein Volkswagen-Sprecher hatte am Wochenende mitgeteilt: »Wir analysieren aktuell die Situation der Cariad und der Projekte sehr genau.« In diesem Zuge seien bereits Entscheidungen getroffen worden. Beispielsweise seien Softwarearchitekturen zeitlich geordnet worden. Der Ausbau der Softwarekompetenz bleibe ein wichtiger Bestandteil der Konzernstrategie. Sorge vor teuren Verzögerungen? Verzögerungen in der Softwareentwicklung hatten im vergangenen Jahr zur Entlassung von Konzernchef Herbert Diess geführt. Er war Anfang September von Porsche-Chef Oliver Blume abgelöst worden, der seither den Konzern und den börsennotierten Sportwagenbauer in Personalunion führt. Blume entzerrte die Softwareabläufe und sorgte so dafür, dass wieder Ruhe in dem Konzern einkehrte. Hinter dem Umbau steht laut »Handelsblatt« die Sorge, dass es kostspielige Verzögerungen bei dringend benötigter Software geben könnte. Durch die Probleme bei Cariad war es bei wichtigen Fahrzeugprojekten wie dem Porsche e-Macan und dem Audi Q6 e-tron zu Verzögerungen gekommen. Zugleich gilt für Cariad aktuell ein strenger Sparkurs. Die noch von Diess angestoßene sogenannte Einheitssoftware 2.0, mit der nach ursprünglichen Plänen das neue Flaggschiff Trinity ab 2026 autonomes Fahren nach Level 4 ermöglichen sollte, wurde um zwei Jahre verschoben. Der Aufsichtsrat von Cariad könnte sich bereits zu Wochenbeginn mit der Neuaufstellung befassen. Für Mittwoch hat Volkswagen seine Aktionäre zur Hauptversammlung nach Berlin eingeladen. Das Thema dürfte bereits auf der VW-Aufsichtsratssitzung am Dienstag zur Sprache kommen."
ba64cb71-dd5a-4d3e-b691-8d24a6ea4a0a,2023-05-08 14:17:00+00:00,"Nach dem glücklosen Dirk Hilgenberg, der einst von BMW zu Volkswagen kam, soll jetzt ein Hausgewächs die Wende in der krisengeplagten Softwaresparte Cariad bringen. Zum 1. Juni übernimmt Peter Bosch den Führungsposten in der VW-Tochtergesellschaft, die eigentlich die Autosoftware für die Zukunft schreiben soll, aber stattdessen mit gravierenden Problemen kämpft. Bosch war Produktionschef bei Bentley und half mit, die britische Luxusmarke vom Sorgenkind zum Gewinnbringer im Konzern zu machen. Das, so zumindest das VW-Narrativ, qualifiziert ihn nun für höhere Aufgaben."
51095731-c0bd-4604-bfd6-156a412336c9,2023-05-09 07:00:25+00:00,"Seine erste Karriere hatte Maurice Neligan (56) als klassischer Carguy in Großkonzernen. Siemens, Continental, MAN – der gebürtige Ire arbeitete sich über 20 Jahre in der deutschen Autoindustrie nach oben. Doch 2017 hatte er genug. Dem ""Handelsblatt"" sagte Neligan vor Kurzem, mit dem Dieselskandal rund um Volkswagen sei ihm klar geworden, dass der Verbrenner seinem Ende entgegensteuere. Für sich selbst sah Neligan darin eine Chance: Er gründete in München eine Ladesäulen-Firma namens Jolt Energy. Neligan will das Schnellladen in Innenstädte bringen. Dort gibt es heute zumeist nur langsame AC-Säulen mit maximal 22 Kilowatt Ladeleistung. Mehr lässt das Stromnetz vielerorts nicht zu. Wenn doch, wären für den Anschluss ans Mittelspannungsnetz größere Bauarbeiten nötig. Neligans Lösung: Jolts Ladesäulen nutzen integrierte Batterien als Pufferspeicher. Sie kommen so mit einem Anschluss ans Niederspannungsnetz aus und können trotzdem bis zu 320 Kilowatt abgeben. E-Autofahrer sollen so Strom für 200 Kilometer Reichweite in zehn Minuten nachladen können. Die Idee hat bei Infrared Capital Partners verfangen. Der Infrastruktur-Kapitalgeber stattet Jolt Energy jetzt mit 150 Millionen Euro aus. Das Geld solle in den Aufbau von ""Tausenden Schnellladestationen in europäischen und nordamerikanischen Städten"" fließen, teilte das Start-up mit. Mittelfristig wird das Unternehmen dafür weiteres Fremdkapital benötigen. Die idealen Standorte für seine Säulen vermutet Jolt Energy an Tankstellen, Supermärkten, Hotels oder Restaurants, auch mit Kommunen, Flughäfen oder Bahnhöfen sucht das Start-up das Gespräch. Aufbau und Betrieb übernehme man selbst im Gegenzug für Standorte in guten Lagen. Deren Grundstückseigentümer müssten nichts investieren und könnten über ein Mietmodell oder eine Umsatzbeteiligung wirtschaftlich von den Säulen profitieren. Neligan selbst will mit dem Weiterverkauf des Stroms Geld verdienen. Die integrierten Speicher füllt Jolt Energy im besten Fall dann auf, wenn an den Strombörsen Ökostrom im Überfluss verfügbar ist. Neben dem Stromhandel will Neligan aber auch mit Reklame Geld verdienen: Ausgestattet mit einem großen Display eignet sich die Ladesäule ""Jolt Merlin One"" als digitale Litfaßsäule. Konkurrenz vom Ex-Arbeitgeber Reklame in eigener Sache hat auch Neligan drauf: ""Unsere ultra-schnellen Ladestationen mit leistungsstarken Batteriespeichern sind das fehlende Bindeglied, um die Energie- und Verkehrswende in Städten zu beschleunigen."" Allein auf weiter Flur ist er mit seiner Idee aber nicht. Mit ""Numbat"" verfolgt ein weiteres Start-up einen ähnlichen Ansatz. Das Unternehmen aus Kempten im Allgäu rechnet 2024 nach eigenen Angaben mit einem dreistelligen Millionenumsatz. Bekanntester Numbat-Kunde ist die Supermarktkette Feneberg. Auch mit einem seiner ehemaligen Arbeitgeber konkurriert Maurice Neligan: dem Volkswagen-Konzern. Der bietet über seine Lade-Tochter Elli ebenfalls Schnellladesäulen mit integrierten Pufferspeichern an. Abnehmer sind beispielsweise Eon, BP und Shell. Mit Audi experimentiert noch eine weitere VW-Tochter mit Pufferspeichern und betreibt drei sogenannte ""Charging Hubs"" in Nürnberg, Zürich und Berlin. Neben der starken Konkurrenz ist auch die Bürokratie hierzulande eine Hürde für Neligan. Der Anschluss ans Niederspannungsnetz kann sich selbst an fertigen Ladestandorten monatelang ziehen. In Deutschland ist Jolt Energy laut eigener Website bis dato an neun Esso-Tankstellen in großen Städten vertreten. Bis Ende des Jahres will das Unternehmen ""weitere 100"" Säulen hierzulande installieren. Vorausgesetzt, Abnehmer und Stadtwerke spielen mit."
d55166e8-1c4f-46a5-b1be-177d3425de70,2023-05-09 12:07:56+00:00,"Im Streit über die Menschenrechtssituation in der chinesischen Uiguren-Provinz Xinjiang erhöhen Investoren den Druck auf Volkswagen. Die Fondsgesellschaften Deka Investment und Union Investment fordern eine unabhängige Untersuchung der Aktivitäten von Europas größtem Autobauer in der Region im Nordwesten Chinas, aus der es Vorwürfe wegen Verbrechen gegen die Menschlichkeit gibt. »Bringen Sie Licht ins Dunkel und zeigen Sie, dass Sie verantwortungsvoll und nachdrücklich die Menschenwürde achten«, sagte Ingo Speich, Leiter Nachhaltigkeit und Corporate Governance bei Deka Investment, in einem vorab verbreiteten Redetext zu dem Aktionärstreffen am Mittwoch in Berlin. Eine solche Transparenzoffensive mache sich auch am Kapitalmarkt bezahlt, sagte Speich weiter. Denn solange kein lückenloser Beweis erbracht sei, werde das Reputations- und Klagerisiko bleiben. »Stellen Sie ihren Partnern gegenüber die Forderung auf, ein unabhängiges Audit durchführen zu lassen, das zeigen kann, dass VW und seine Vertragspartner nichts zu verbergen haben.« Auch Janne Werning von Union Investment fordert eine externe Überprüfung der VW-Aktivitäten in Xinjiang. »Es ist in unser aller Interesse zu wissen, was dort passiert, und dann, falls nötig, Konsequenzen zu ziehen«, sagte er laut Redemanuskript. In den vergangenen Jahren hat es wiederholt Berichte über Zwangsarbeit und Umerziehungslager in der Provinz Xinjiang gegeben. VW: Keine Anhaltspunkte für Verletzungen der Menschenrechte Während der Hauptversammlung im CityCube Berlin wollen sich auch Vertreter uigurischen Minderheit zu Wort melden. Sie sprechen im Namen des Dachverbands der Kritischen Aktionäre, der sich wegen der Menschenrechtssituation in Xinjiang gegen die Entlastung des VW-Vorstands ausspricht. Anleger weltweit legen zunehmend Wert darauf, dass sogenannte ESG-Kriterien beherzigt werden, also Prinzipien für ökologische wie soziale Nachhaltigkeit und für »Governance« als gute Unternehmensführung. Volkswagens China-Vorstand Ralf Brandstätter hatte nach einem Besuch in der Region Xinjiang Ende Februar erklärt, er habe keine Anhaltspunkte für Menschenrechtsverstöße in der Fabrik gefunden, die Volkswagen dort betreibt. Er habe ausführlich mit sieben Mitarbeitern gesprochen, darunter Angehörigen der muslimischen Minderheit der Uiguren, die in China unterdrückt wird."
b9b31753-3dfa-4f25-be66-d86a760a45ac,2023-05-09 18:15:29+00:00,"Einen Tag nachdem Volkswagen mit dem Umbau seiner Software-Sparte Cariad ein Beben in Wolfsburg ausgelöst hat, legt der Konzern mit einer Kooperation für Assistenzsysteme nach. Das israelische Unternehmen Mobileye wird zum strategischen Partner, um autonome Fahrzeuge zu entwickeln und auf den Markt zu bringen, wie am Dienstag bekannt wurde. So soll die Hannoversche Marke VW Nutzfahrzeuge die Technik von Mobileye nutzen, um in ihrem Projekt Moia vollautomatische Sammeltaxis zu bauen. Volkswagen-Chef Oliver Blume hatte zuvor schon angekündigt, den Wolfsburger Konzern in der Entwicklung stärker für externe Partner zu öffnen, um nach vielen Rückschlägen endlich Tempo zu gewinnen."
95f9f099-49dd-4def-9781-1a478db2cecc,2023-05-10 10:36:40+00:00,"Menschenrechtsgruppen und Klimaaktivisten haben die Aktionärsversammlung von Volkswagen gestört und zeitweise Tumulte ausgelöst. Vertreter einer Gruppe riefen während der Rede von Konzernchef Oliver Blume Parolen und hielten Transparente hoch. Auf einem Plakat hieß es: ""Uigurische Zwangsarbeit bei VW beenden"". Eine Person versuchte während der Hauptversammlung eine Torte auf Aufsichtsratsmitglied Wolfgang Porsche zu werfen, der am Mittwoch seinen 80. Geburtstag feierte. Der Cousin des 2019 verstorbenen Firmenpatriarchen Ferdinand Piech ist Aufsichtsratschef der Familienholding Porsche SE, die die Mehrheit an Volkswagen hält. In einer Stellungnahme reagierte der Autobauer verärgert auf die massive Störung seiner Hauptversammlung. Friedliche Proteste seien ein demokratisches Mittel der freien Meinungsäußerung. Die Beschädigung von fremdem Eigentum und der Eingriff in die Rechte anderer sowie die mögliche Gefährdung der Gesundheit von Beteiligten, stehe in Widerspruch dazu. Zugleich erneuerte Volkswagen seine Bereitschaft zum konstruktiven Dialog mit seinen Kritikern. Aktionärstreffen der Wolfsburger waren in den vergangenen Jahren wiederholt Ziel von Protesten. So heftig wie diesmal waren die Störungen aber selten. Klimaschutz-Aktivisten blockieren Zufahrt Auch vor dem City-Cube gab es Proteste. Die Polizei verhinderte den Versuch von Vertretern der Gruppe ""Scientist Rebellion"", sich auf dem Platz vor dem Veranstaltungsort im Berliner Westend festzukleben. In einem Flugblatt warf die Initiative dem Wolfsburger Konzern vor, ""zu viele Autos"" zu verkaufen. Der Ausstoß des Klimagifts CO2 durch den Transportsektor habe ein bedrohliches Ausmaß angenommen. VW könne durch ein Umschwenken der Produktion hin zu Zügen und Schieneninfrastruktur positiv zur Verkehrswende beitragen. Vertreter der Gruppe ""Letzte Generation"", die durch zahlreiche Klebeaktionen auf Straßen bekannt ist, blockierten den Verkehr zum Ort der Aktionärsversammlung. Dort protestierten auch Vertreter der uigurischen Minderheit in China. Bei der vom Weltkongress der Uiguren organisierten Aktion wurden Transparente gezeigt, auf denen der chinesischen Regierung Menschenrechtsverstöße vorgeworfen wurden. Der Dachverband der Kritischen Aktionäre hat sich des Themas angenommen und einen Antrag gegen die Entlastung des VW-Vorstands gestellt. Volkswagen betreibt ein Werk in der chinesischen Uiguren-Provinz Xinjiang, aus der es Vorwürfe wegen Verbrechen gegen die Menschlichkeit gibt. Der Konzern hat mehrfach erklärt, nicht an Menschenrechtsverletzungen beteiligt zu sein. Kritik an VWs Umgang mit China Blume, der im vergangenen September Herbert Diess an der Konzernspitze abgelöst hatte, erläuterte den Aktionären seine Strategie für die nächsten Jahre. Wegen der Proteste traten die Aussagen jedoch in den Hintergrund. Kritik von Aktionärsvertretern richtete sich unter anderem auf die niedrige Bewertung von Volkswagen an der Börse und die Doppelrolle von Blume als Chef des börsennotierten Sportwagenbauers Porsche AG. Später störte eine Aktivistin mit nacktem Oberkörper die Rede von Konzernchef Oliver Blume mit lauten Rufen und einem Plakat: Gegenstand der Kritik war das Festhalten von VW am chinesischen Werk in der Provinz Xinjiang. Die Frau wurde von Sicherheitskräften aus dem Versammlungssaal geführt. Danach fuhr Blume mit seinen Ausführungen fort. Auch später gab es noch eine kurze Unterbrechung der Versammlung durch lautes Rufen. Kritik am VW-Werk in Xinjiang gibt es schon seit Langem. Auch vor dem Versammlungsgebäude demonstrierten Menschen dagegen. Die in der Provinz lebende muslimische Minderheit der Uiguren wird laut Menschenrechtsorganisationen gezielt von der Regierung in Peking unterdrückt. VW wird vorgeworfen, nicht genug gegen mutmaßliche Zwangsarbeit bei dortigen Zulieferern zu tun. VW hält dagegen, dass es in dem Werk keine Anzeichen für Menschenrechtsverletzungen gebe. Chef von VW und Porsche: Kritik an Blumes Doppelrolle Erneut dürfte zur Sprache kommen, dass Blume den VW-Konzern und Porsche dauerhaft gleichzeitig führen will. Das hatte nicht nur bei Experten für gute Unternehmensführung für Stirnrunzeln gesorgt. Zudem steht die Wiederwahl von Aufsichtsratsmitgliedern an, darunter auch der Familienvertreter Wolfgang Porsche. Er hat die für das Gremium geltende Regelaltersgrenze von 75 Jahren zwar bereits überschritten. Da er einer der größten Aktionäre ist, empfiehlt der Aufsichtsrat seine Wiederwahl dennoch. Porsche wird am Tag der Hauptversammlung 80 Jahre alt und soll für eine volle Amtszeit von fünf Jahren erneut in das Gremium einziehen. Die Mehrheitsverhältnisse bei Volkswagen sind klar verteilt. Die Holding der Eigentümerfamilien Porsche und Piëch, die Porsche SE, hält mit 53 Prozent den größten Stimmrechtsanteil vor dem Land Niedersachsen mit 20 Prozent und dem Staatsfonds aus Katar mit 17 Prozent. Die Vorzugsaktionäre haben dagegen kein Stimmrecht."
