539742a8-482c-4254-96a9-6004a63d246f,2023-05-22 08:35:36+00:00,"Miele Austria bekam einen ID. Buzz Cargo für die Kundendienstflotte überreicht. Am Bild: Dipl Ing. Martin Meindl (Director Customer and Consumer Service Miele Austria, Croatia & Slovenia), Ing. Rainer Ganisl (Head of Technical Management Miele Austria), Wolfgang Bell (Prokurist Director Finance, Administration and Logistics Miele Austria), Miriam Walz (Markenleiterin Volkswagen Nutzfahrzeuge) sowie Florian Zöpfl (Porsche Austria, Leiter Group Fleet - Großabnehmer, Flotten und Direktkunden Konzern). (Foto: VW) Der Miele Kundendienst ist in einigen europäischen Ländern – auch in Österreich – künftig elektrisch unterwegs – mit einem speziell für den Miele Kundendienst ausgestatteten ID. Buzz Cargo. Dieser wurde unlängst von Volkswagen an Miele übergeben. Nun ist auch bei Miele ein ID. Buzz (der im April 2022 vorgestellte „Stromer“ von Volkswagen Nutzfahrzeuge) im Einsatz. In der MoonCity Salzburg haben Florian Zöpfl (Porsche Austria, Leiter Group Fleet – Großabnehmer, Flotten und Direktkunden Konzern) und Miriam Walz (Markenleiterin Volkswagen Nutzfahrzeuge) das Fahrzeug an Wolfgang Bell (Prokurist Director Finance, Administration and Logistics Miele Austria) übergeben. Damit ist Miele unter den ersten Kunden in Österreich, die einen individualisierten, vollelektrischen ID. Buzz Cargo einsetzen. Der Kundendienst hat seine Freude damit, wie Miele berichtet. Alles dreht sich um den ID. Buzz. Seit der Weltpremiere im April letzten Jahres freuen sich Privatkunden und gewerbliche Kunden gleichermaßen auf den sympathischen Stromer von Volkswagen Nutzfahrzeuge. Auch bei Miele löst der Einsatz des blitzroten ID. Buzz Cargo im Kundendienst große Freude aus. „Mit dem ID. Buzz haben wir ein sympathisches Modell, das für nachhaltige Mobilität der Zukunft steht. Wenn nun auch Miele den ID. Buzz Cargo in die Flotte aufnimmt, so freut uns das sehr, denn nur gemeinsam können wir den Weg zur CO2-Neutralität beschreiten“ sagt Florian Zöpfl, Porsche Austria. Miele setzt die unübersehbar gebrandeten Servicefahrzeuge in Deutschland, Spanien, Norwegen, Großbritannien und in Österreich im Kundendienst ein. Neben der für die Firma Miele typischen roten Sonderlackierung wurden im Rahmen eines gemeinsamen Entwicklungsprozesses zwischen Miele, dem Umbaupartner Würth und Volkswagen Nutzfahrzeuge spezielle Kundenwünsche umgesetzt. So findet sich bereits ab Werk im Laderaum ein auf die Anforderungen der Service-Mitarbeitenden ausgerichteter Ausbau mit Regalsystemen zur Verstauung von Materialien, Ersatzteilen und Werkzeugen. Eine Mittelkonsole mit integriertem Klapptisch dient dem Fahrer als Arbeitsplatz. „Ich freue mich, dass wir endlich den ersten ID. Buzz Cargo an unseren Kunden Miele übergeben können und unser vollelektrischer Lieferwagen somit auch in Österreich auf die Straße kommt“ fügt Miriam Walz, Markenleiterin Volkswagen Nutzfahrzeuge an. Volkswagen Nutzfahrzeuge beschreibt den ID. Buzz Cargo als vollwertiges Nutzfahrzeug und als vollwertigen Kundendienstwagen – „maßgeschneidert für die unterschiedlichsten Einsätze und passend für die spezifischen Anforderungen der Nutzer“. Die Einsätze des ID. Buzz Cargo in Europa sollen wertvolle Erkenntnisse für die weitere Elektrifizierung der Miele Serviceflotte sowie für die weitere Optimierung und Erweiterung des kundenindividuellen Angebotes von Volkswagen Nutzfahrzeuge bringen."
df50b1d4-584f-48de-8ba1-e1e18b6ddb5c,2023-05-22 15:17:04+00:00,"Ford hat sich in Kanada langfristig die Versorgung mit dem Batterierohstoff Lithium für den Bau von E-Autos gesichert. Mit dem Unternehmen Nemaska Lithium sei ein Vertrag über die Lieferung von Lithiumprodukten geschlossen worden, der auch das für Akkus wichtige Lithiumhydroxid umfasse, teilte der zweitgrößte US-Autobauer am Montag mit. Mit der Vereinbarung will Ford-CEO Jim Farley (60) seinen Plan untermauern, die Produktion von batteriegetriebenen Autos bis Ende 2026 auf zwei Millionen Einheiten pro Jahr zu steigern. Anfang des Jahres hatte sich der US-Autokonzern bereits den Unternehmen PT Vale und Zhejiang Huayou Cobalt für eine 4,5 Milliarden Dollar teure Nickelverarbeitungsanlage in Indonesien angeschlossen. Auch andere Autobauer schließen derzeit Verträge zur Sicherung ihrer Rohstoffversorgung in Kanada. Volkswagen etwa will dort sein größtes Batteriezellwerk bauen . Der Konzern will in Nordamerika wachsen. Kanada speziell biete Kooperationsmöglichkeiten für weitere Wertschöpfungsfelder, Rohstoffe und erneuerbare Energien, begründete VW-Chef Oliver Blume (54) die Entscheidung im mm-Interview. Der europäisch-amerikanische Stellantis-Konzern hat ähnliche Pläne, streitet derzeit mit der kanadischen Regierung aber über Subventionen. Aus diesem Anlass bekräftigte der Konzern auch das Ziel eines bereinigten Ergebnisses vor Steuern und Zinsen für dieses Jahr zwischen neun und elf Milliarden Dollar. Der Barmittelzufluss (Cashflow) soll bei sechs Milliarden Dollar liegen. Ford geht weiterhin davon aus, dass seine E-Auto-Sparte in diesem Jahr tiefrote Zahlen schreiben wird."
15bf5e2f-baf8-4977-883b-730c68ef34a7,2023-05-22 19:40:30+00:00,"Vor der Hauptversammlung von Volkswagen wurden Stimmen laut, die einen Generationswechsel im Aufsichtsrat forderten. In der von den Familien Porsche und Piëch beherrschten Beteiligungsgesellschaft Porsche Automobil Holding SE, die Europas größten Autokonzern steuert, steht ein solcher Wechsel jetzt bevor. Allerdings anders, als viele erwartet haben. Denn während die beiden 80 und 81 Jahre alten Familienoberhäupter Wolfgang Porsche und Hans Michel Piëch im Aufsichtsrat weitermachen, scheidet der 52 Jahre alte Stefan Piëch zum Aktionärstreffen am 30. Juni aus. Ihn soll seine 29 Jahre alte Halbschwester Sophie Piëch ersetzen, ist der Einladung zur Hauptversammlung zu entnehmen. „Dr. Stefan Piëch steht für die kommende Amtszeit nicht zur Verfügung, da er sich um seine eigenen Unternehmensbeteiligungen und solche der Familie Piëch kümmern wird“, teilte die Porsche SE darin mit."
a8171628-3a4b-4580-bbb1-2828f124470f,2023-05-23 06:00:00+00:00,"Volkswagen hat bereits eine Fabrik gebaut, in der Batterien für Autos hergestellt werden. Diese Fabrik befindet sich in Niedersachsen. Aber jetzt sagt Volkswagen, dass sie keine Pläne haben, eine zweite Batteriefabrik zu bauen. Der Grund dafür sind die hohen Strompreise in Deutschland. Strom ist sehr wichtig für die Herstellung von Batterien, und wenn der Strom teuer ist, wird auch die Herstellung der Batterien teuer. Diese Information wurde durch eine Nachricht des Spiegel-Magazins bekannt gegeben. (Spiegel, 19.05.2023) Die Herstellung von Batteriezellen ist eine wichtige Technologie für die Zukunft, erfordert jedoch viel Energie. Stephan Weil, Mitglied des VW-Aufsichtsrats und Ministerpräsident von Niedersachsen, hat sich immer wieder für den Bau einer zweiten sogenannten Gigafabrik in Emden eingesetzt. Allerdings hat VW ihm vorgerechnet, dass eine solche Fabrik wirtschaftlich nicht rentabel wäre. Aus diesem Grund hat der Politiker Ende April eine Initiative gestartet, um einen staatlich subventionierten Transformationsstrompreis von 7 Cent pro Kilowattstunde einzuführen. Dadurch soll Deutschland im Wettbewerb mit den USA und Asien wettbewerbsfähiger werden. Derzeit liegt der Preis für die Kilowattstunde in Deutschland für Unternehmen bei 13 Cent. Deutsche Automobilindustrie sucht Unterstützung von Staat: Batteriefabriken und hohe Energiepreise im Fokus Die deutschen Automobilmanager haben sich deshalb bereits mit Bundeskanzler Olaf Scholz getroffen. Laut Informationen des Spiegels waren auch die hohen Energiepreise ein Thema bei diesem Treffen. Der Bund und das Land Schleswig-Holstein sagten bereits ihre Unterstützung für die Ansiedlung einer geförderten Batteriefabrik des Unternehmens Northvolt in Heide zu. Stephan Weil, Ministerpräsident von Niedersachsen, erhält bei dieser Entscheidung Unterstützung von Volkswagen-Chef Oliver Blume. Blume betont, dass die Automobilindustrie Planungssicherheit für zukünftige Investitionen benötigt. Volkswagen plant, bis 2030 Zellfabriken mit einer Kapazität von etwa 240 Gigawattstunden in Europa aufzubauen. Derzeit wird bereits eine Batteriefabrik in Salzgitter, Niedersachsen, gebaut. Zusätzlich plant Volkswagen den Bau einer weiteren Fabrik in Sagunto, Spanien. Darüber hinaus plant das Unternehmen den Bau seiner ersten Batteriefabrik außerhalb Europas in Kanada. Es gibt auch Gespräche über den möglichen Bau einer Fabrik in Osteuropa, obwohl diese noch nicht abgeschlossen sind."
5c9dfa88-1e4f-4d27-8ee4-65c553c03bdb,2023-05-24 11:46:51+00:00,"2023 könnte ein erfolgreiches Jahr für Aktionäre werden: Trotz der wirtschaftlichen Unsicherheit schütten die globalen Unternehmen einem Fondsanbieter zufolge so hohe Dividenden aus wie noch nie. Aktienanleger können sich im laufenden Jahr womöglich auf so hohe Dividenden freuen wie noch nie. Das britische Fondshaus Janus Henderson hat seine Prognose angehoben und erwartet nun weltweite Gewinnausschüttungen in Höhe von 1,64 Billionen US-Dollar. Das wäre ein Rekord und ein Plus von mehr als fünf Prozent gegenüber 2022. Auch wenn sich das Dividendenwachstum mit der Abschwächung der Weltwirtschaft infolge der Inflation und steigender Zinsen verlangsame, habe sich die Lage zuletzt verbessert, so die Fondsmanager. Hauptgründe seien die noch nicht abgeschlossene Erholung im europäischen Bankensektor nach der Corona-Pandemie und eine außergewöhnlich hohe Zahl von einmaligen Sonderdividenden zu Jahresbeginn. Diese hätten dafür gesorgt, dass die weltweiten Dividenden im ersten Quartal um zwölf Prozent auf ein Rekordniveau von 326,7 Milliarden US-Dollar kletterten. Moller-Maersk an der Spitze Nach der Untersuchung des Fondsanbieters, die tagesschau.de vorliegt, erhöhten weltweit 95 Prozent der Unternehmen ihre Dividenden oder hielten sie konstant. Am meisten zum Wachstum trugen im ersten Quartal Banken und Ölproduzenten bei. Doch auch Automobilhersteller hätten ein starkes Ergebnis und hohe Sonderdividenden verzeichnet. Niedrige Ausschüttungen habe es dagegen infolge niedriger Rohstoffpreise vor allem im Bergbau gegeben. Die Dividenden in dem Sektor sanken laut der Studie um ein Fünftel. Ansonsten habe es wenige Ausreißer gegeben. Auf dem ersten Platz der Top-Dividendenzahler stand im ersten Quartal der dänische Schifffahrts-Konzern A.P. Moller-Maersk. Die Reederei erzielte 2022 aufgrund einer starken Nachfrage und hoher Frachtpreise erneut einen Rekordgewinn. Davon schüttete das Unternehmen eine reguläre Dividende von 2000 Kronen je Aktie und eine Sonderdividende von 2300 Kronen je Aktie aus. Insgesamt erhielten die Anleger also fast 600 Euro pro Anteilsschein. Zusammen mit neun weiteren Konzernen war Moller-Maersk Janus Henderson zufolge für 19 Prozent der Dividenden verantwortlich. Rekordsumme auch in Deutschland erwartet In Deutschland zahlte Volkswagen im ersten Quartal eine Sonderdividende in Höhe von 6,3 Milliarden US-Dollar, die aus den Erlösen des Börsengangs von Porsche stammt. Es sei die weltweit achtgrößte Sonderdividende seit Beginn der Datenerhebung 2009, teilte Janus Henderson mit. Die Gesamtdividende in Deutschland stieg dadurch in den ersten drei Monaten des Jahres um 110 Prozent auf 11,4 Milliarden US-Dollar (10,6 Milliarden Euro). Ohne Berücksichtigung der Sonderdividende und Wechselkurseffekte kletterte sie um 3,6 Prozent. Insgesamt wollen die 750 Aktiengesellschaften in Deutschland 2023 rund 75 Milliarden Euro in diesem Jahr an ihre Anteilseigner ausschütten - auch das wäre eine Rekordsumme und neun Prozent mehr als im Vorjahr. Das geht aus Berechnungen der Deutschen Schutzvereinigung für Wertpapierbesitz (DSW) und des isf Institutes for Strategic Finance an der FOM Hochschule hervor. Vor allem Aktionäre der DAX-Konzerne profitieren dabei vom Dividendenregen: Die 40 Konzerne der obersten deutschen Börsenliga schütten geschätzt 52,5 Milliarden Euro aus. Das starke Wachstum basiert neben VW allerdings vor allem auf einem Unternehmen, das seine Ausschüttungen in diesem Jahr beinahe verdoppelt: Hapag-Lloyd. Die Traditionsreederei thront mit einer Zahlung von 11,1 Milliarden Euro an der Spitze und steht allein für knapp 15 Prozent der gesamten Ausschüttungen der deutschen Börsenkonzerne. Nachdem die Containerschifffahrt vor Corona lange Zeit von Überkapazitäten und niedrigen Margen geprägt war, konnte Hapag-Lloyd im Geschäftsjahr 2022 von den gestiegenen Frachtraten massiv profitieren und ein Ergebnis von 17,5 Milliarden Euro einfahren. Mit Informationen von Till Bücker, ARD-Finanzredaktion."
7a3d503c-e452-4492-8bc1-172a662334a8,2023-05-25 14:26:20+00:00,"Wolfsburg. Endlich: Nach zehn Jahren wird bei VW in Wolfsburg wieder gefeiert. Mehr als 300.000 Mitarbeiter, Familienmitglieder und Freunde werden kommen. Wenn VW ein Familienfest feiert, dann wird die Party etwas größer: Das Unternehmen erwartet am 23. und 24. September bis zu 300.000 Gäste im Stammwerk. Das sind deutlich mehr als beim letzten Familienfest vor zehn Jahren. Entsprechend hoch ist der organisatorische Aufwand, den das Unternehmen treibt, damit auch alles klappt. Das Organisationsteam umfasst 250 Mitarbeiter Mit „Herz in die Zukunft“ lautet das Motto. Vorab ist allerdings sehr viel Verstand gefragt, denn eine zweitägige Veranstaltung mit diesen Dimensionen verlangt eine akribische Vorarbeit. Allein schon die Anreise stellt die verkehrliche Infrastruktur der VW-Hauptstadt vor einige Herausforderungen. Gastgeber ist VW-Standortleiter Rainer Fessel. Ihm arbeitet ein Team von 250 Mitarbeiterinnen und Mitarbeitern zu. „Um unser Werk Wolfsburg in eine Veranstaltungsfläche zu verwandeln, muss viel geplant, abgestimmt, vorbereitet und entschieden werden“, betont der Manager in einer internen VW-Mitteilung. „Wir möchten unseren Gästen möglichst viele Hallen zeigen und ihnen so einen echten Einblick in unsere Welt der Automobilproduktion bieten.“ Die Auflagen sind streng Für die Organisation werden auch externe Aufträge vergeben, denn selbst ein so großes Unternehmen wie VW ist bei den Themen Absperrungen, Sicherheits- und Rettungskräfte, Gastronomie, Zelte, Bildschirme und Technik auf professionelle Unterstützung angewiesen. Da das Werk als sogenannter Störfallbetrieb gilt, müssen auch die gesetzlichen Auflagen in enger Abstimmung mit der Stadt Wolfsburg berücksichtigt werden. Wegen dieser hohen Sicherheitsauflagen findet das Fest auch nur in bestimmten Bereichen des riesigen Fabrikgeländes statt. Gesucht werden Talente aus der Belegschaft Das Programm ist an beiden Tagen identisch. Die eingeladenen Mitarbeiter können sich aussuchen, ob sie am Samstag oder lieber am Sonntag mitfeiern wollen. Wegen des zu erwartenden hohen Verkehrsaufkommens sollen auch zusätzliche Stellmöglichkeiten für Gäste geschaffen werden, die mit dem Fahrrad kommen. Für die musikalische und sonstige Programmgestaltung sollen neben den Fachbereichen auch Talente aus der Belegschaft sorgen. Eine Jury ist gerde dabei, die Mitwirkenden auszusuchen. Da allein im Werk über 60.000 Menschen arbeiten, wird es an Talenten aller Art nicht mangeln. Der September wird ohnehin ein besonderer Monat bei VW in Wolfsburg. Vor dem Familienfest findet die große Weltpremiere des neuen Tiguan am Konzernsitz statt. Auch das gab es lange nicht mehr. Mehr wichtige Nachrichten zu Volkswagen lesen: VW – Auf Kuschelkurs mit Investoren Trockenbeschichtung: VW will neue Batterie-Technologie nutzen Spendenlauf: VW-Beschäftigte joggen durch das Stammwerk VW feiert den Bulli: Mehr Party geht nicht Irre Auktion: VW verdient 25 Millionen Euro in 8 Minuten"
024f4ba5-48ab-46be-9de1-72779b27bda3,2023-05-26 04:50:14+00:00,"Auch an BMW (Bayerische Motoren Werke) geht die Verkehrswende nicht unbemerkt vorbei. Seit Jahren bemüht sich der deutsche Automobilkonzern darum, seinen erstarkenden Konkurrenten das Wasser zu reichen. Im Segment der Elektroautos gehören dazu vor allem namhafte Marken wie VW (Volkswagen) und Tesla. Doch hat das Unternehmen bereits konkrete Pläne, die ihm neue Vorteile verschaffen sollen. Elektroautos: BMW hat ambitionierte Pläne Während VW einen Markt nach dem anderen erobert, scheint BMW mit seinen Stromern noch immer in vielen Punkten hinterherzuhinken. Grund dafür könnte mitunter die Preisklasse sein, in der sich der Premiumhersteller überwiegend heimisch fühlt. Vor allem im Kontext der E-Mobilität, die ohnehin unter einem Preisproblem leidet, bringt das nicht unwesentliche Hürden mit sich. Klar ist: Auch mit teuren Elektroautos kann BMW wettbewerbsfähig sein – doch müssen diese auch einen entsprechenden Mehrwert liefern. Zu diesem könnten nun Zulieferer wie CATL und EVE Energy beitragen. Schon im September 2022 verriet BMW, seine „Neue Klasse“ mit Batterien ausstatten zu wollen, die über einen „Durchmesser von 46 Millimetern und zwei unterschiedlichen Höhen von 95 und 120 Millimetern“ verfügen. „Wir planen eine kompakte Limousine im Segment der 3er-Reihe und einen sportlichen SUV“, erklärte Oliver Zipse, Vorstandsvorsitzender der BMW AG, zuversichtlich. „Bis zum Ende des Jahrzehnts soll die Neue Klasse bereits mehr als die Hälfte unseres weltweiten Absatzes ausmachen.“ Auch interessant: „Radikale“ Elektroauto-Revolution: Fisker verschiebt Start von Rekord-Nachfolger Zulieferer bereiten sich vor Die Batterien der Elektroautos der Neuen Klasse sollen neben einem neuen Design und ihrem geänderten Format über eine erhöhte Spannung von rund 800 Volt verfügen. „Einer der Vorteile ist, dass diese höhere Spannung das Aufladen der Energie an DC-Schnellladestationen beschleunigt“, so das Unternehmen. „Die dortige Stromstärke von bis zu 500 Ampere verkürzt die Ladezeit von 10 auf 80 Prozent um etwa 30 Prozent.“ EVE könnte die Batteriezellen liefern, die es für den pünktlichen Marktstart der neuen Serien in zwei Jahren braucht. „Die Entwicklung großer zylindrischer Batterien und großer LFP-Batterien durch EVE Energy gewinnt weiter an Schwung, und dank des Designs großer zylindrischer Batterien und großer LFP-Batterien selbst werden ihre Herstellungskosten erheblich sinken, was auch zu einer deutlichen Senkung der Systemkosten führen wird. […] Die zylindrischen Großbatterien 4695 von EVE Energy werden in diesem Jahr in die Massenproduktion gehen, während der Bau einer Giga-Fabrik für 60-GWh-LFP-Großbatterien begonnen hat.“ EVE Energy Quellen: BMW Group; EVE Energy"
947c4e9d-f6a9-4ac8-b6ed-47c2c6dc69e9,2023-05-26 05:14:41+00:00,"Der deutsche Autobauer Volkswagen und sein Tochterunternehmen Audi haben sich offenbar im Rahmen des Dieselbetrugsskandals mit dem US-Bundesstaat Texas auf eine Schadensersatzzahlung in Höhe von 85 Millionen Dollar geeinigt. Wie der texanische Generalstaatsanwalt Ken Paxton am Donnerstag in einer Erklärung mitteilte, haben die Unternehmen der Einigung grundsätzlich zugestimmt. »Wenn ein Unternehmen glaubt, sich der Verantwortung entziehen zu können, wenn es gegen texanische Gesetze verstößt, Texaner gefährdet und unsere Umwelt verschmutzt, liegt es völlig falsch. Volkswagen und Audi haben das auf die harte Tour herausgefunden und jetzt zahlen sie den Preis.« Anfang dieses Monats hatte der Oberste Gerichtshof von Texas entschieden, dass die Umweltklage des Bundesstaates gegen Volkswagen und Audi fortgesetzt werden kann. Volkswagen lehnte eine Stellungnahme zu dem Fall bisher ab. Das Unternehmen hatte zuvor die durch den Abgasskandal ausgelösten Klagen in den USA für mehr als 20 Milliarden Dollar beigelegt. Gerichte haben jedoch entschieden, dass das die Wolfsburger nicht davor schützt, weiterhin von lokalen und staatlichen Behörden zur Rechenschaft gezogen zu werden."
068e2506-04c6-4b4c-ac69-cba225d86b52,2023-05-26 08:51:28+00:00,"Dieselskandal VW und Audi einigen sich mit Texas auf Strafzahlung Der VW-Konzen hat sich im Dieselskandal mit dem US-Bundesstaat Texas auf eine Schadensgeldzahlung in Höhe von 85 Millionen Dollar geeinigt. Zuvor hatte Volkswagen bereits rund 20 Milliarden Dollar wegen des Abgasskandals an Kläger in den USA gezahlt. 26.05.2023, 10.51 Uhr Der deutsche Autobauer Volkswagen mit CEO Oliver Blume (54) und das Tochterunternehmen Audi haben sich offenbar im Rahmen des Dieselbetrugsskandals mit dem US-Bundesstaat Texas auf eine Schadensgeldzahlung in Höhe von 85 Millionen Dollar geeinigt. Wie der texanische Generalstaatsanwalt Ken Paxton am Donnerstag in einer Erklärung mitteilte, haben die Unternehmen der Einigung grundsätzlich zugestimmt. ""Wenn ein Unternehmen glaubt, sich der Verantwortung entziehen zu können, wenn es gegen texanische Gesetze verstößt, Texaner gefährdet und unsere Umwelt verschmutzt, liegt es völlig falsch. Volkswagen und Audi haben das auf die harte Tour herausgefunden und jetzt zahlen sie den Preis"", so Paxton. Anfang dieses Monats hatte der Oberste Gerichtshof von Texas entschieden, dass die Umweltklage des Bundesstaates gegen Volkswagen und Audi fortgesetzt werden kann. Volkswagen lehnte eine Stellungnahme zu dem Fall bisher ab. Das Unternehmen hatte zuvor die durch den Abgasskandal ausgelösten Klagen in den USA für mehr als 20 Milliarden Dollar beigelegt. Wie Gerichte jedoch entschieden, schützt das VW nicht davor, weiterhin von lokalen und staatlichen Behörden zur Rechenschaft gezogen zu werden. In Deutschland hatte zuletzt der frühere Audi-Chef Rupert Stadler (60) im Betrugsprozess um den Dieselskandal Fehlverhalten gestanden. Damit ist Stadler das erste Mitglied des VW-Konzernvorstands, das vor Gericht den Vorwurf des Betrugs durch Unterlassen eingeräumt hat. Nach dem Geständnis könnte der seit September 2020 dauernde Prozess demnächst zum Abschluss kommen – voraussichtlich im Juni. Allerdings läuft noch ein milliardenschwerer Musterprozess von Investoren, zuletzt hatte das Oberlandesgericht (OLG) Braunschweig eine umfangreiche Beweisaufnahme für nötig erklärt. In dem Prozess nach dem Kapitalanleger-Musterverfahrensgesetz (KapMug) wird seit 2018 um Schadenersatz für Investoren gestritten, die nach dem Auffliegen der Diesel-Affäre bei VW Kursverluste in Milliardenhöhe erlitten hatten. frm/Reuters"
