b73d05b1-26e4-4c25-9d86-a94e700379f0,2021-12-06 05:35:00+00:00,"Berlin ist, anders als international üblich, kein Standort vieler deutscher Konzerne und besitzt ein geringeres nominales Bruttoinlandsprodukt pro Kopf als der landesweite Durchschnitt. Das ist europaweit einmalig, da Hauptstädte gemeinhin zu den wohlhabenderen Regionen des Landes zählen. Die Volkswagen Gruppe ist derzeit klar größtes Unternehmen Deutschlands. Mit einem Gesamtumsatz von 295,7 Milliarden US-Dollar überragt der Volkswagenkonzern auch 2022 die Mercedes Benz Gruppe und die Schwarz Gruppe mit großem Abstand. Insgesamt sind gleich drei Autokonzerne unter den zehn größten deutschen Unternehmen vertreten und damit mehr als aus jeder weiteren Branche. Der Einzelhandel sowie die Versicherungsbranche stellt je zwei weitere Firmen: Aldi und die Schwarz Gruppe sowie Allianz und die Munich Re. Hier geht es direkt zu den TOP 10! Hamburg führt als Standort großer deutscher Unternehmen Im Städtevergleich ist Hamburg mit 34 Unternehmen der wichtigste Standort für die deutschen Top-500-Unternehmen – noch vor München (33), Frankfurt (25) sowie Düsseldorf und Berlin (je 20). Volkswagen Gruppe Gleich zwei der drei hier gelisteten deutsche Autobauer schaffen es zudem unter die zehn größten Unternehmen Europas. Volkswagen (Platz 3) und die Mercedes Benz Gruppe (Platz 6, ehemals Daimler) sind dabei zwei Konzerne stellvertretend für die für die deutsche Wirtschaft immens wichtige deutsche Automobilindustrie, welche weltweit wertmäßig die meisten Autos exportiert. Die Automobilbranche steht neben hundert Tausenden Arbeitsplätzen auch für 16,9% aller wertmäßigen deutschen Exporte, knapp nach dem Maschinenbau (17,5%), für den zweitwichtigsten Wirtschaftszweig Deutschlands überhaupt. Die Volkswagen-Gruppe, welche neben Volkswagen Automarken wie Bentley, Bugatti, Lamborghini, Seat, Skoda, Audi, Porsche, MAN sowie Scania zu seinen Marken zählt, ist nach Verkaufsvolumen (10,88 Mio. St.) derzeit international größter Autokonzern. Schwarz-Gruppe: Lidl & Kaufland Die nähe Heilbronn ansässige Schwarz-Gruppe ist mit seinen Supermarktketten Lidl und Kaufland europaweit, gemessen an den Verkaufserlösen, der größte Einzelhändler und weltweit die Nummer vier mit weltweit 550.000 Beschäftigten. Der sich vollständig im Familienbesitz befindliche Konzern zählt damit zu den drei größten europäischen Konzernen im Privatbesitz. Darüber hinaus kommt Lidl-Gründer Dieter Schwarz mit seinen Unternehmensanteilen aktuell auf ein Vermögen von geschätzten 40,2 Milliarden Euro und ist somit reichster Deutsche. Bosch & Siemens Bosch ist der weltgrößte Automobilzulieferer und Hersteller zahlreicher Elektrogeräte. In Deutschland beschäftigt der Konzern 139.500 Personen, weltweit sind es 421.000. Bosch ist in 190 Ländern vertreten und zählt weltweit zu den größten Unternehmen im Bereich der Elektrotechnik. Begonnen hatte alles 1886 mit der Gründung einer Werkstatt in einem Hinterhof Stuttgarts, in dem an dem ersten Magnetzünder für Gasmotoren bei Autos gebastelt wurde. 10 Jahre später ging Bosch mit dem weltersten Magnetzünder für Automotoren in Serienproduktion und damit der Sprung hin zu einem Weltkonzern. Die Firmengeschichte Siemens, dem durch Abspaltungen inzwischen nach Umsatz lediglich 13. größten Unternehmen Deutschlands beginnt mit der Gründung der „Telegraphen Bau-Anstalt von Siemens & Halske“ von Werner Siemens und Johann Halske im Jahr 1847. Das Unternehmen entwickelte sich innerhalb kürzester Zeit von einer kleinen Werkstatt zu einem der weltweit größten Technologieunternehmen. So baute Siemens bereits ein Jahr nach dessen Gründung die europaweit erste Langstrecken-Telegraphenverbindung zwischen Berlin und Frankfurt. Die wertvollsten deutschen Unternehmen Deutschlands größtes Software- und IT-Unternehmen SAP ist Stand Mai 2023 erneut das wertvollste deutsche Unternehmen. Dessen Börsenwert beläuft sich auf rund 124,0 Milliarden US-Dollar und damit annähernd 27 Milliarden mehr als der Versicherungsriese Allianz. Europas größter Autobauer, Volkswagen, ist in diesem Jahr nur auf Rang vier. 1. SAP: 124,0 Mrd. US-$ 2. Allianz: 96,4 Mrd. US-$ 3. Deutsche Telekom: 91,7 Mrd. US-$"
79c29ec2-f2c3-439d-9723-b5765a5bde42,2023-05-03 07:38:07+00:00,"Demnach erhält er eine Bewährungsstrafe, wenn er ein Geständnis ablegt und bereit ist, eine Geldauflage von 1,1 Millionen Euro zu zahlen. Die Staatsanwaltschaft stimmte dieser sogenannten Verständigung ebenfalls zu. Laut Richter Stefan Weickert ist »ein vollumfängliches Geständnis« vorgesehen. Dafür versprach Weickert dem Manager, die geplante Freiheitsstrafe von anderthalb bis zwei Jahren zur Bewährung auszusetzen. Weiterer Bestandteil der am Mittwoch geschlossenen Verständigung von Stadler, Gericht und Staatsanwaltschaft ist, dass Stadler nach dem Urteil eine Geldauflage von 1,1 Millionen an die Staatskasse oder an gemeinnützige Organisationen zahlt. Details dazu wie auch zum genauen Strafmaß wird das Gericht nach Angaben eines Sprechers erst im Urteil festlegen. Wenn das Gericht Stadlers geplante Erklärung als Geständnis anerkennt, müsste der 60-Jährige nicht erneut ins Gefängnis. Er saß 2018 bereits einige Monate in Untersuchungshaft und musste damals als Audi-Chef und Volkswagen-Konzernvorstand abtreten. Der Strafprozess um geschönte Abgaswerte bei Dieselautos des Volkswagen-Konzerns läuft seit mehr als zweieinhalb Jahren in München. Seit September 2020 steht Stadler vor Gericht, zusammen mit dem ehemaligen Audi-Motorenchef und Porsche-Entwicklungsvorstand Wolfgang Hatz und einem Ingenieur. Hatz und der Ingenieur haben gestanden, Motoren manipuliert zu haben. Damit wurden laut Anklage gesetzliche Abgaswerte zwar auf dem Prüfstand, aber nicht auf der Straße eingehalten. Audi-Chef Stadler soll es nach dem Auffliegen des Skandals versäumt haben, den Verkauf der manipulierten Autos zu stoppen. Das Gericht sieht einen Großteil der Anklagevorwürfe als so gut wie erwiesen an. Richter Stefan Weickert hatte deswegen allen drei Angeklagten Freiheitsstrafen von anderthalb bis zwei Jahren angedroht, die bei Geständnissen zur Bewährung ausgesetzt werden könnten. Bei dem Ingenieur stimmte die Staatsanwaltschaft einem solchen Deal zu, bei Hatz jedoch nicht. Allerdings ist das Gericht nicht an das Votum der Staatsanwaltschaft gebunden."
e54db6b1-0769-4769-852b-7d6e3fe96a45,2023-05-03 11:27:59+00:00,"E-Mail Teilen Mehr Twitter Drucken Feedback Fehler melden Sie haben einen Fehler gefunden? Bitte markieren Sie die entsprechenden Wörter im Text. Mit nur zwei Klicks melden Sie den Fehler der Redaktion. In der Pflanze steckt keine Gentechnik Aber keine Sorge: Gentechnish verändert sind die Wer in der aktuellen Krise die widerstandsfähigsten Aktien sucht, der sollte sich am freien Cashflow der Konzerne orientieren. Der verrät, welches Unternehmen noch genug Reserven auf dem Sparkonto hat. Wir haben 160 deutsche Aktien analysiert. 2022 war ein Seuchenjahr für die Festgeldkonten deutscher Konzerne. Binnen zwölf Monaten schmolz der freie Cashflow der 160 Unternehmen aus den führenden Aktienindizes Dax , MDax und SDax von 109 auf nur 65 Milliarden Euro zusammen. Der freie Cashflow bezeichnet die Summe an Geld, die Konzernen bleibt, nachdem sie all ihre Ausgaben von Gehältern über Rohstoffe und Strom bis zu Dividenden ausgegeben haben – also das Geld, was sie für schlechte Zeiten zurücklegen können. Die kamen im vergangenen Jahr in Form von Energiekrise, hoher Inflation und Zinserhöhungen. Das erhöhte nicht nur die Ausgaben vieler Konzerne massiv, sondern verteuert auch Investitionen, die normalerweise über Kredite finanziert werden. Konzerne, die jetzt also noch viel Geld übrig haben, haben damit einen Vorteil. Sie können teure Extra-Ausgaben aus der eigenen Tasche bezahlen. Das ist gut für Anleger, denn mutmaßlich haben diese Konzerne nicht nur in der Vergangenheit besser gewirtschaftet, sondern haben damit auch für die nahe Zukunft bessere Chancen. DAX Performance-Index 18.891,85 Pkt. -141,79 (-0,74%) Xetra 1 Tag 6 Monate Nicht umsonst ist der freie Cashflow ein Indikator, dem viele Profi-Investoren großes Gewicht beimessen. Ganz vorne dabei steht Warren Buffett. Er nennt den Indikator auch „die Einnahmen des Besitzers“, denn schließlich könnte sich der Eigner einer Firma den erwirtschafteten Überschuss selbst auszahlen. Für die Bewertung einer Aktie ist aber nicht allein die Höhe des freien Cashflows wichtig. In der Regel wird der Überschuss deswegen zum Unternehmenswert in Relation gesetzt. Letzterer ergibt sich bei börsennotierten Unternehmen aus der Marktkapitalisierung an der Börse zuzüglich der Nettoverschuldung. Die Logik hinter diesem „Free Cash Flow Yield“ ist einfach: Wenn ein Unternehmen mit nur einer Million Euro Wert 500.000 Euro Überschuss erwirtschaftet, hat der Vorstand weit bessere Arbeit geleistet, als wenn ein Unternehmen mit einer Milliarde Wert dieselbe Summe am Ende über behält. Diese Konzerne wirtschaften 2023 am besten Um herauszufinden, welche Konzerne nach Corona- und Energiekrise über die besten Voraussetzungen verfügen, haben wir die 160 Aktien der deutschen Indizes Dax, MDax und SDax über den Zeitraum von 2019 bis 2024 analysiert. Für das aktuelle und das kommende Jahr bedienen wir uns dabei den Schätzungen von Analysten. Die sind zwar wohlüberlegt, können aber durch Ereignisse jederzeit über den Haufen geworfen werden. Als erstes gehen wir davon aus, dass Sie in keinen Konzern investieren sollten, dessen freier Cash Flow während der vergangenen Krisenjahre ins Negative rutschte. Wir wollen schließlich die Konzerne finden, denen auch in der Krise das Geld nicht ausgeht. Das reduziert die Auswahl aber bereits immens. Von den 160 Aktien bleiben danach nur noch 76 übrig. Abgezogen sind hier auch eine Handvoll, bei denen die Datenlage für unsere Analyse nicht ausreicht, zum Beispiel, weil sie wie Daimler Truck erst nach 2019 an die Börse gingen. Unter denen, denen in der Krise das Geld ausging, sind prominente Beispiele. Aus dem Dax fallen etwa Airbus , Rheinmetall , Adidas , RWE , E.ON , Vonovia , die Deutsche Bank und Siemens Energy bereits aus dem Rennen. Unter den 76 Konzernen, die übrig bleiben, stechen die Autokonzerne hervor. Sie sollen 2023 trotz aller Krisen die höchsten Free-Cashflow-Renditen erwirtschaften. Volkswagen steht mit 26,8 Prozent an der Spitze, gefolgt von Mercedes Benz (21,3 Prozent) und BMW (16 Prozent). Auf den weiteren Plätzen folgen der Vermögensverwalter DWS (15,4 Prozent) und der Internet-Anbieter United Internet (14,2 Prozent). Am anderen Ende steht der Tech-Anbieter Hypoport (0,8 Prozent) hinter dem Halbleiterhersteller Elmos (1,1 Prozent) und dem Online-Shop Zalando (1,5 Prozent). Gerade bei Tech-Unternehmen sind die Cash-Reserven 2022 stark geschmolzen. Der Depot-Vergleich von FOCUS online (Anzeige) Profitieren Sie von den Bewegungen an den Finanzmärkten. Grundlage hierfür ist stets ein Depot. Hier finden Sie Ihren Bedürfnissen entsprechende Angebote. Diese Konzerne sind am konstantesten Aber: Für die Entscheidung für oder gegen eine Aktie ist schließlich auch entscheidend, wie zuverlässig ein Konzern Überschüsse erwirtschaftet. Ein schlechtes Jahr 2022 kann durch äußere Umstände begründet sein, ebenso wie viele Konzerne in der Corona-Pandemie von hohen Gewinnen profitierten. Deswegen ist eine weitere Metrik, nach der wir die deutschen Aktien beurteilen, um wie viele Prozentpunkte sie ihre Free-Cashflow-Rendite von 2019 bis 2024 steigern werden. Auch hierbei liegen die Autobauer vorne. Mercedes Benz liegt diesmal mit 18,2 Prozent vor Volkswagen (8,7 Prozent) und BMW (8,0 Prozent). Die DWS Group schiebt sich mit 12,2 Prozent in die Phalanx der Dax-Konzerne auf den zweiten Platz. Enttäuschende Werte am anderen Ende der Skala liefern hingegen Elmos mit minus 11,6 Prozent, der Modehändler Hugo Boss mit minus 5,1 Prozent und der Baukonzern Hochtief mit minus 4,8 Prozent. Wenn Sie in keinen Konzern investieren wollen, dessen Free-Cashflow-Rendite von 2019 bis 2024 sinkt, reduziert sich ihre Auswahl auf 62 Aktien. Welche von denen nun die beste Kaufempfehlung ist, lässt sich so einfach nicht sagen. Ein erster Schritt ist oft, die aktuelle Free-Cashflow-Rendite und das Wachstum derselbigen zusammenzurechnen. Dann läge Mercedes Benz mit 40 Punkten vor Volkswagen mit 36, der DWS Group mit 28 und BMW mit 24. Wie viel Überschuss ein Konzern erwirtschaftet, sollte ein wichtiges Argument für oder gegen einen Aktienkauf sein, aber beileibe nicht Ihr einziges. Sie können die 62 Konzerne aus unserer Liste als Startpunkt nehmen und von dort aus weitere Indikatoren überprüfen, etwa die Entwicklung von Umsätzen, Gewinnen und Schulden und die Relation der Fundamentaldaten zum aktuellen Aktienkurs. Erst, wenn alle Daten passen, sollten Sie eine Aktie wirklich kaufen. Folgen Sie dem Autor auf Facebook Folgen Sie dem Autor auf Twitter"
02a40d7a-559a-4cd7-889e-fdae9c46690b,2023-05-04 05:53:38+00:00,"Volkswagen hat beim operativen Gewinn zu Jahresbeginn deutlich zugelegt. Angeschoben durch den Verkauf besonders renditestarker Fahrzeuge und die Absatzerholung in Europa und Nordamerika sprang das bereinigte Betriebsergebnis im ersten Quartal um 35 Prozent auf 7,1 Milliarden Euro, wie Europas größter Autokonzern am Donnerstag mitteilte. Einschließlich Sondereffekten brach das Ergebnis allerdings um 31 Prozent auf 5,7 Milliarden Euro ein. Analysten hatten hier mit noch weniger gerechnet. Im Vorjahr hatte Volkswagen durch die Bewertung von Sicherungsinstrumenten einen Buchgewinn von 3,5 Milliarden Euro verbucht. 2023 kehrte sich der Effekt um und Volkswagen verbuchte negative Effekte aus Rohstoffsicherungsgeschäften von 1,3 Milliarden Euro. Den Ausblick für das laufende Jahr bekräftigte der Vorstand dennoch. Der Konzernumsatz legte um gut ein Fünftel auf 76 Milliarden Euro zu. Hier hatten die Experten nach Daten von Refinitiv deutlich weniger erwartet. Für 2023 peilt der Konzern ein Umsatzplus zwischen zehn und 15 Prozent und eine operative Rendite zwischen 7,5 und 8,5 Prozent an. Damit käme der Autokonzern auf einen Konzernumsatz zwischen 307 und 320 Milliarden Euro. Die Verkäufe der Wolfsburger erholten sich insbesondere in Europa und Nordamerika, während die VW-Gruppe in China erhebliche Probleme hatte. Finanzvorstand Arno Antlitz sprach dennoch von einem „vielversprechenden Start in das Geschäftsjahr 2023“."
5ce3a0df-84fc-43d7-bfa4-d35099179711,2023-05-04 11:51:49+00:00,"Die deutschen Autobauer BMW und VW sind gut in das neue Jahr gestartet. Trotzdem bereitet die wachsende Konkurrenz durch chinesische Automarken den deutschen Herstellern Sorgen. Die Autobauer BMW und VW haben im ersten Quartal überraschend gute Ergebnisse erzielt, wie die Unternehmen am Donnerstag mitteilten. BMW: Hohe Nachfrage nach Luxus- und E-Modellen BMW hat dank der vollständigen Einbeziehung des China-Geschäfts ein deutliches Umsatzplus eingefahren. Die weiterhin hohen Preise für Neu- und Gebrauchtwagen wirkten sich ebenfalls positiv auf das Münchener Konzern aus, auch wenn etwas weniger Autos als im Vorjahr ausgeliefert wurden. Die Erlöse sind im ersten Quartal um 18,3 Prozent auf 36,9 Milliarden Euro gestiegen sind, wie der Autobauer bekannt gab. Auch die operative Leistung überzeugte, insbesondere aufgrund der hohen Nachfrage nach Spitzenmodellen und Elektroautos. Die Gewinnmarge im Kerngeschäft mit Autos verbesserte sich auf 12,1 Prozent nach 8,9 Prozent im Vorjahr und lag damit über der eigenen Zielmarke von acht bis zehn Prozent. Trotz des guten Abschneidens zu Jahresanfang hält der Finanzvorstand Nicolas Peter weiter an der ursprünglich für 2023 ins Auge gefassten operativen Marge im Autogeschäft fest: Diese soll im Gesamtjahr acht bis zehn Prozent betragen. ""Die geopolitische und makroökonomische Situation bleibt weiter angespannt"", so Peter. Im wichtigsten Markt China dürfte sich nach Abklingen der Covid-Pandemie der Wettbewerb verschärfen, erwartet das Unternehmen. Unter dem Strich gab es für die Münchner einen deutlichen Gewinnrückgang von fast zwei Dritteln auf 3,66 Milliarden Euro, weil ein einmaliger Bewertungseffekt aufgrund der Übernahme in China im vergangenen Jahr wegfiel. VW steigert Betriebsgewinn um ein Drittel Auch VW ist robust in das Jahr gestartet: Der größte Deutsche Autobauer konnte seinen Umsatz im ersten Quartal um 22 Prozent auf 76 Milliarden Euro steigern. Der bereinigte Betriebsgewinn stieg kräftig um 35 Prozent auf 7,1 Milliarden Euro. Unter dem Strich standen aber 4,7 Milliarden Euro, weil VW Sondereffekte aus der Absicherung gegen den Anstieg der Rohstoffpreise abziehen musste. Analysten hatten hier jedoch mit einem größeren Absturz gerechnet. Wie das Unternehmen am Donnerstag berichtete, stabilisierte sich die Lage trotz anhaltender Lieferschwierigkeiten bei Auto-Elektronik wieder etwas. Insbesondere in Europa und in Nordamerika erholten sich die Verkäufe, während die Volkswagen-Gruppe in China erhebliche Probleme hatte. Finanzvorstand Arno Antlitz sprach dennoch von einem ""vielversprechenden Start in das Geschäftsjahr 2023"". Er sagte: ""Wir bereiten uns auf einen starken Wettbewerb vor. Aber wir erwarten auch ein starkes zweites Quartal."" Antlitz deutete an, es dürfte schwierig werden, hohe Ausgaben für Zulieferungen auf die fertigen Wagen aufzuschlagen. VW müsse daher Arbeitskosten und Produktivität im Blick behalten. ifo-Umfrage: Gedämpfte Erwartungen in der deutschen Autoindustrie Die guten Ergebnisse sind jedoch also nicht ungetrübt: Nach einer aktuellen ifo-Umfrage sind die Erwartungen in der deutschen Autoindustrie gedämpft. Das entsprechende Barometer stieg nur leicht auf 2,2 Punkte, nach 1,2 Zählern im März, wie das Münchner ifo-Institut zu seiner monatlichen Umfrage mitteilte. ifo-Experte Oliver Falck erklärte mit Blick auf die Umfrageergebnisse: ""Die Automobilmesse in Shanghai im April hat der deutschen Automobilbranche klar vor Augen geführt, dass der Wettbewerb in der neuen Elektromobilitätswelt auf dem für die deutschen Autobauer so wichtigen chinesischen Markt aber auch darüber hinaus härter wird."" Chinesische Konkurrenz setzt deutschen Autobauern zu Zusammen verkauften die deutschen Hersteller im vergangenen Jahr nur knapp fünf Prozent aller voll- und teilelektrischen Autos in China - die lokale Konkurrenz dagegen 76 Prozent. Auch am Gesamtmarkt einschließlich der Verbrenner werden die chinesischen Marken die Ausländer nach Expertenschätzung bis Mitte des Jahrzehnts unter 50 Prozent Marktanteil gedrückt haben. Ein Erfolgsfaktor dabei seien niedrigere Kosten bei E-Autos, sagte Thomas Luk, Autoexperte und Partner der Unternehmensberatung Kearney. ""Es gelingt ihnen, Premiumprodukte zu demokratisieren und leistungsfähige Produkte zu erschwinglichen Preisen anzubieten."" Für Volkswagen, Mercedes-Benz und BMW steht dabei viel auf dem Spiel: Sie verkaufen etwa jedes dritte Auto auf dem weltweit größten Markt. Der chinesische Elektroautohersteller BYD konnte im ersten Quartal auf seinem Heimatmarkt die Kernmarke VW als Marktführer ablösen. Mit Informationen von Emal Atif, tagesschau.de"
17942d4e-a1a2-46ef-aeb0-e7df509993e6,2023-05-04 12:24:08+00:00,"Schnelle Antworten auf Anfragen, ständige Verfügbarkeit, Zeitersparnis und mehr Zufriedenheit – Chatbots und KI könnten den Kundenservice verbessern. Trotzdem nutzen nur fünf der DAX-40-Unternehmen Chatbots. Das hat eine Untersuchung der Gisma University of Applied Sciences ergeben. Lediglich E.ON, Allianz, SAP, Deutsche Telekom und Mercedes-Benz verwenden ein solches Kontakttool. Sechs Unternehmen bieten einen Kunden- oder Live-Chat mit Angestellten an. Bei allen DAX 40-Unternehmen findet man auf der Website eine Telefonnummer, auch wenn es sich dabei teilweise nur um einen Verweis im Impressum und nicht um eine ausgewiesene Kundenhotline handelt. Per Anruf kann man die meisten Unternehmen aber meist nur tagsüber zu regulären Geschäftszeiten erreichen. Ebenfalls beliebt ist der Kontakt via E-Mail. Kunden können an 33 der 40 Unternehmen (83 Prozent) E-Mails schicken. Auf Platz drei der am häufigsten angegebenen Kontaktmöglichkeiten liegt das Fax: Mehr als die Hälfte der Unternehmen (60 Prozent) geben eine Faxnummer an. Dabei kann die Übermittlung personenbezogener Daten mittels Fax ein Verstoß gegen die DSGVO sein. Alle DAX 40-Unternehmen sind in den sozialen Medien vertreten. 93 Prozent sind auf Twitter, 86 Prozent auf Facebook und 83 Prozent auf Instagram präsent. Die meisten Kontaktmöglichkeiten finden Kunden bei E.ON und Volkswagen: Sieben der neun untersuchten Optionen werden bei den beiden Unternehmen angeboten. Während bei E.ON die digitale Assistentin Anna zur Verfügung steht, können Verbraucher bei Volkswagen mit einem Menschen chatten, insofern gerade einer verfügbar ist. Die wenigsten Kontaktmöglichkeiten bieten Infineon, Daimler Truck und Brenntag. Die drei Unternehmen können Kunden nur per Telefon, E-Mail oder über die sozialen Medien erreichen."
f5bc1c1f-da6e-4d0c-85dc-d7c608902eb2,2023-05-04 13:05:00+00:00,"Mit dem ID.4 und dem ID.5 hat der Volkswagen-Konzern bereits zwei gefragte Elektro-SUVs im Programm. An deren Erfolg will das Unternehmen nun offenbar mit weiteren Fahrzeugen dieses Typs anknüpfen. Das berichtet die britische Website Autocar.co.uk unter Berufung auf VW-Chef Thomas Schäfer. Demnach plant der Autobauer für die kommenden Jahre gleich drei neue Modelle. Den Anfang macht ein mittelgroßer Stromer, den Autocar als elektrifizierten Tiguan bezeichnet. Der Wagen soll optisch traditioneller und hochkantiger ausfallen als der ID.4 und der ID.5. Den technischen Unterbau liefert die von VW bereits offiziell angekündigte Plattform MEB+, eine aufgebohrte Variante des aktuellen Elektro-Baukastens MEB. Die soll vor allem mit Reichweiten von bis zu 700 Kilometern und einer Ladeleistung von bis zu 200 Kilowatt auftrumpfen. Da MEB+ erst 2025 erscheint, dürfte auch der mutmaßliche E-Tiguan frühestens in diesem Jahr vom Band laufen. Nach dessen Release widmet sich VW dem Bericht zufolge einem günstigeren und kompakteren SUV, das an eine elektrifizierte Variante des VW T-Cross erinnern und in abgewandelter Form auch bei Skoda und Cupra erscheinen soll. Luxus-Stromer auf Basis von Trinity Aufgrund seines einsteigerfreundlichen Kostenpunkts könnte der Wagen laut Bericht als ID.2X erscheinen. Die Basis bildet in diesem Fall eine für kleinere Stromer geplante Plattform namens MEB Entry, an der VW gegenwärtig arbeitet. Sobald das neue Spar-SUV über die Straßen rollt, nimmt Volkswagen laut Bericht ein echtes Luxusmodell in Angriff, bei dem es sich um ein Premium-Crossover-SUV handelt. Der Wagen soll technisch alle Register ziehen und zum neuen Vorzeigemodell für den Volkswagen-Konzern avancieren."
