6f67ee82-dbf2-468a-a3ae-7cac2705607a,2023-12-11 08:16:21,"Die COP28 in Dubai ist auch ein Treffen für Industrievertreter aus aller Welt, deren Branchen mitten in Transformationsprozessen stecken. Was erwarten Konzerne wie Bayer oder ThyssenKrupp? Dubai ist der größte Klimagipfel aller Zeiten - weil sich diese Konferenzen nach Ansicht von Fachleuten zu Umsetzungsmessen entwickelt haben: Man diskutiert nicht länger darüber, ob man Klimaschutz macht, sondern wie - und dabei will die deutsche Industrie mitreden. Und mitverdienen. Die Vorgaben der Pariser Klimavereinbarung könne sie erfüllen, betont Stefan Wenzel, Parlamentarischer Staatssekretär im Bundeswirtschaftsministerium: Die Industrie sei ""ready"" für das 1,5-Grad-Ziel, sagt er: ""Wir hatten Industrievertreter am Tisch von SiemensEnergy, die weltweit gefragt sind als Experten für Stromnetze, oder ThyssenKrupp, die seit 100 Jahren Elektrolyseanlagen bauen. Das war immer eine Nische, jetzt wird es ein weltweit nachgefragtes Produkt."" Emissionen senken und neue Technologien entwickeln ThyssenKrupp betreibt in Duisburg das größte deutsche Stahlwerk. Insgesamt ist die Stahlproduktion für sieben Prozent des Kohlendioxidausstoßes in Deutschland verantwortlich. Das soll sich ändern, indem sie bei der Eisengewinnung auf Wasserstoff setzt. ThyssenKrupp will außerdem Zement- und Düngerfirmen mit neuen Technologien helfen, Emissionen zu senken. In Dubai habe der Konzern dazu Vereinbarungen abgeschlossen, erklärt Vorstandschef Miguel Ángel López Borrego. Eine ""sehr starke Zusammenarbeit"" zwischen Politik und Industrie sei notwendig, um die Klimaziele zu erreichen: ""Hier geht es darum, Partnerschaften zu schließen, mit der Politik zusammenzuarbeiten, um die Partnerschaften zwischen Unternehmen möglich zu machen und das voranzutreiben."" Vom Kohlekraftwerk zu Wind- und Sonnenstrom Die LEAG will in Dubai ihre sogenannte Gigawattfactory vorantreiben. Sie zählt zu Deutschlands größten Stromerzeugern mit Braunkohlekraftwerken in der Lausitz und plant, auf ehemaligen Bergbauflächen Anlagen für Wind- und Sonnenstrom zu bauen - mit rund 7.000 Megawatt Leistung. Auch der LEAG-Vorstandsvorsitzende Thomas Kramer ist beim Gipfel: ""Ich bin mir sicher, dass wir durch den Druck, den wir haben, die Energiewende zu gestalten auf der Welt, viele neue Produkte sehen werden."" Die Landwirtschaft hat den Klimawandel mitverursacht und leidet massiv unter den Folgen. Chemieriese Bayer bietet Lösungen an, um Pflanzen widerstandsfähiger gegen Dürren und Überschwemmungen zu machen und Emissionen zu senken - etwa bei Reis, dessen Anbau das Klimagas Methan verursacht und beim Nassreisanbau enorme Wassermengen verbraucht. Bayer-Cheflobbyist Matthias Berninger verweist auf Entwicklungen seines Konzerns für den Trockenreisanbau: ""Wir reduzieren die Methanemissionen, wir brauchen 20 bis 40 Prozent weniger Wasser, um die gleiche Menge Reis zu produzieren. Und es hat eine Zugangskomponente, weil vor allem Kleinbauern auf diese Innovation angewiesen sein werden."" ""Wir brauchen Versorgungssicherheit"" Die in Dubai heftig umstrittene Abkehr von fossilen Energien stellt auch die deutsche Wirtschaft vor Probleme. Der stellvertretende Geschäftsführer des Bundesverbandes der Deutschen Industrie (BDI), Holger Lösch, sagt, gesucht sei ein Weg mit sehr viel mehr Erneuerbaren. ""Aber wir brauchen auch Versorgungssicherheit."" Und im Moment gebe es in Deutschland eine Situation, ""die ich nicht anders als mit Fossilen gewährleistet sehe - möglicherweise auf eine gewisse längere Zeit."" Beim BDI herrscht Skepsis vor, was einen schnellen Ausstieg aus der Nutzung von Kohle, Öl und Gas angeht. Aber Aufbruchstimmung in Dubai mit Blick auf die Chancen für die Wirtschaft beim Klimaschutz. ""Wir wollen natürlich auch künftig wettbewerbsfähig bleiben oder wieder werden, zum Beispiel bei Batterien oder Solarmodulen"", sagt Staatssekretär Wenzel. Wenn weltweit immer mehr Unternehmen klimaneutral produzieren, ist das gut fürs Klima und für die deutsche Wirtschaft. Denn Unternehmen aus Deutschland und der EU mit hohen Auflagen sind im Nachteil gegenüber Firmen aus Drittstaaten, die weniger auf Klimaschutz achten und dadurch kostengünstiger herstellen können. Deutsche Konzerne hoffen deshalb in Dubai auf strategische Partnerschaften von Ländern für einen gemeinsamen Weg zur Klimaneutralität."
d82465d0-8920-4681-974b-7518e54f8f99,2023-12-11 10:12:34,"Bildrechte: picture alliance/dpa | Klaus-Dietmar Gabbert Unternehmen Deutsche Wirtschaftsverbände sehen AfD nicht als konstruktiven Verbündeten Hauptinhalt 11. Dezember 2023, 11:12 Uhr Die AfD steht in Umfragen bei Rekordwerten. Nächsten Jahr stehen in Thüringen und Sachsen Wahlen an. Zunehmend stellt sich die Frage: Wie steht die Wirtschaft zur AfD? Tatsächlich sieht ein Großteil der deutschen Wirtschaftsverbände die AfD nicht als einen konstruktiven Verbündeten an. Anders könnte es aber bei Selbstständigen und Handwerkern aussehen. Bildrechte: MDR/Isabel Theis Ein Großteil der deutschen Wirtschaftsverbände beurteilt die AfD nicht als konstruktive politische Kraft. Unter Selbstständigen und Handwerkern dürfte die AfD mehr Anhänger haben. Weil für Unternehmen der Export und der Zugewinn ausländischer Fachkräfte wichtig ist, vertreten sie häufig andere Werte als die AfD. ""Wer Menschen ausgrenzt, begrenzt seine Möglichkeiten"" oder ""Wer sich abschottet, macht dicht"" – das sind Sätze, die der Thüringer Jenoptik-Konzern derzeit auf Plakaten veröffentlichen lässt. Mitarbeiter werben darauf für eine offene und tolerante Gesellschaft. Geschäftsführer Stefan Traeger sagt, man plakatiere bewusst in zwei Bundesländern: ""Da stehen Landtagswahlen an im nächsten Jahr in Thüringen und in Sachsen. Das sind, glaube ich, schon sehr wichtige Wahlen. Da werden Richtungsentscheidungen getroffen. Deswegen ist jetzt eine gute Zeit, auch als Unternehmer zu sagen, welche Werte für uns wichtig sind."" Traeger, gebürtiger Thüringer, wird zum ersten Mal politisch so deutlich. Der Name AfD geht ihm zwar nicht über die Lippen, klar wird trotzdem, dass er deren Aufstieg problematisch findet. Wirtschaftsverbände bewerten AfD negativ Das Institut der deutschen Wirtschaft in Köln wollte wissen, wie die großen Wirtschaftsverbände zur AfD stehen. Dafür hat Knut Bergmann mehr als 100 Verbandsgeschäftsführer befragt. Das Ergebnis: überraschend eindeutig. ""Tatsächlich wird in der Befragung, die wir gemacht haben, die AfD nicht als konstruktive politische Kraft beurteilt. Ganz und gar nicht. Sondern da gibt es ausnehmend negative Stimmen. Tatsächlich gibt es kaum Verbände, die in irgendeiner Art und Weise Verbindungen zur AfD haben. Sie wird nicht als ein konstruktiver Verbündeter angesehen"", sagt Bergmann."
d4c604db-07b6-4b0f-ad75-21ad1b2c2b2a,2023-12-11 12:33:51,"Die Wirtschaftskrisen der vergangenen Jahre treffen die Deutschen noch härter als befürchtet. Der Konjunktureinbruch durch die Pandemie und vor allem die aktuelle Teuerungswelle brocken Beschäftigten heftige Verluste ein. So lagen die Tariflöhne im September real, also abzüglich der Inflation, vier Prozent niedriger als Anfang 2015. Das heißt: Millionen Arbeitnehmer verdienen weniger als vor einem knappen Jahrzehnt - ein seltenes Wohlstandsminus. Wer Mindestlohn bezieht, wurde davor nur durch die politisch umstrittene Erhöhung der Ampelregierung bewahrt."
2e738fa9-5ef3-4b7f-a274-edbf6eae4c62,2023-12-11 15:33:41,"Der russische Angriffskrieg hält an – und die Unterstützung des Westens für die Ukraine bröckelt. Auch im Gazastreifen wird gekämpft, seit die Terrorgruppe Hamas Israel am 7. Oktober angegriffen hat – und ein Ende ist nicht in Sicht. Und dann ist da noch die Klimakrise, die viele weitere geopolitische Konflikte mit sich bringen könnte. Wie gefährlich können diese Schocks der Weltwirtschaft werden, droht eine globale Rezession? Und welche Folgen hätte das für uns und wie sollten wir uns vorbereiten? Um diese Fragen geht es in der 56. Folge von Ist das eine Blase?, dem Wirtschaftspodcast von ZEIT ONLINE und DIE ZEIT. Zu Gast ist dieses Mal Moritz Schularick. Der renommierte Ökonom leitet seit Juni 2023 das Kiel Institut für Weltwirtschaft (IfW). Schularick sagt: Die Weltwirtschaft habe eine ""kräftige Erkältung"" – und es könnte schlimmer kommen, wenn infolge der Kriege und Krisen beispielsweise der Ölpreis steige oder das Rote Meer für Containerschiffe infolge von Raketenangriffen unpassierbar würde. Im Podcast warnt Schularick auch davor, dass die Unterstützung der Ukraine bröckelt; schon jetzt sind neue finanzielle und militärische Hilfen laut Zahlen des IfW auf den niedrigsten Stand seit Beginn des russischen Angriffskriegs gefallen. Es sehe danach aus, dass Putins Strategie, auf nachlassende Unterstützung zu setzen, aufgehen könne, sagt Schularick. Das sei nicht nur ""eine absolute Katastrophe für uns in Europa"", eine Niederlage der Ukraine würde Deutschland ""auch viel, viel mehr kosten"", als das Land jetzt bei seiner Verteidigung zu unterstützen. Doch die Bundesregierung mache eine ""extrem kurzsichtige Politik, die sich leider einreiht in den geopolitischen, geoökonomischen Blindflug der letzten zwei Jahre"", kritisiert Schularick. Besonders schwere ökonomische Folgen hätte es auch, wenn es tatsächlich zu einem Krieg um Taiwan komme. Deutschland müsse sich auf einen solchen ""Super-GAU"" vorbereiten und seine Abhängigkeit von China reduzieren, sagt Schularick. Zugleich wirbt der Ökonom dafür, bestimmte wichtige Technologien nicht mehr nach China zu exportieren, nach dem Motto: ""Stopp, das geht hier nicht mehr raus."" Außerdem ist im Podcast Kolja Rudzio zu Gast, Wirtschaftsredakteur bei der ZEIT, und erläutert, warum die Ökonomin Gita Gopinath vom Internationalen Währungsfonds vor einer Blockbildung warnt. Im Wirtschaftspodcast Ist das eine Blase? sprechen Carla Neuhaus, Jens Tönnesmann und Zacharias Zacharakis immer montags über das, was die Welt im Innersten zusammenhält: Geld, Macht, Gerechtigkeit. Immer mit einem Experten aus der Redaktion, einem Gast – und einem Tier."
5393ec37-f317-45c2-a78c-a6748b989905,2023-12-11 18:40:03,"Nur wenn Elektroautos mit grünem Strom hergestellt und betrieben werden, können sie auch tatsächlich klimafreundlicher sein. Bisher ist vor allem die Produktion der Batterie und der dafür nötigen Rohstoffe eine Last für das Klima. Dies ergibt eine ausführliche Studie von Antriebsexperten des Vereins Deutscher Ingenieure (VDI) in dessen Gesellschaft für Fahrzeug- und Verkehrstechnik. Die VDI-Studie hat Kompaktmodelle verglichen, darunter das Volkswagen-Elektromodell ID.3 mit verschiedenen Batteriegrößen (62 und 82 kWh), einen Volkswagen Golf mit Dieselmotor, einen benzingetriebenen Ford Focus sowie ein Plug-in-Modell des Volkswagen Golf."
26b9950f-2149-48e9-ad83-9b7a480060e2,2023-12-12 07:56:00,"Ein breites Lächeln, beide Daumen nach oben gereckt, umrahmt von müden Kollegen: Mit diesem Foto meldete sich EU-Binnenmarktkommissar Thierry Breton am Freitag um kurz vor Mitternacht aus einem Brüsseler Verhandlungssaal. Etwas „Historisches“ sei ihnen gerade gelungen, frohlockt Breton via Kurznachrichtendienst X. Der Grund für seine Euphorie: Das Europäische Parlament, der Rat und die Kommission haben am Freitag nach langen Verhandlungen eine politische Einigung über den sogenannten „AI Act“ erzielt. Das Gesetz zur Regulierung von Künstlicher Intelligenz gilt als weltweit erstes KI-Regelwerk und ist eines der wichtigsten digitalpolitischen Vorhaben der Europäischen Union. Die Euphorie aus Brüssel wird in Deutschland jedoch nicht von allen geteilt. Wirtschaftsverbände warnen vor einer Fortschrittsbremse, während Bürgerrechtler eine zu lasche Regulierung beklagen. Worum geht es also genau? Drei Knackpunkte Der AI Act soll grob gesagt dafür sorgen, dass sich Künstliche Intelligenz an die Grundrechte hält. Es soll den sicheren Einsatz von KI-Anwendungen wie ChatGPT regeln und die Bürger vor Überwachung, Manipulation und Diskriminierung durch Algorithmen schützen. Zudem soll es Rechtssicherheit schaffen. Das bedeutet in der Praxis eine strengere Kontrolle der Unternehmen, die KI-Modelle entwickeln. Zuletzt drehten sich die Verhandlungen vor allem um drei Knackpunkte: Zurückhaltender Zuspruch der Digitalwirtschaft In Fachkreisen wird der Kompromiss der EU seit dem Wochenende heiß diskutiert. Generell gibt es dabei aus der Industrie viel Zuspruch für Bretons Ambitionen, einen weltweiten Standard zu setzen und Rechtssicherheit für Unternehmen zu schaffen. „Es ist gut, dass Europa hier den ersten Stein wirft“, sagt etwa Vanessa Cann, Vorständin beim KI Bundesverband und Gründerin des KI-Start-ups Nyonic, im Gespräch mit Capital. Die Schwammigkeit des Entwurfs sei für Start-ups jedoch ein Problem. In Teilen werfe der AI Act mehr Fragen auf, als er beantworte. Das Gesetz drohe zum „Bürokratietiger“ zu werden, so Cann. Ähnlich äußerte sich auch Christoph Stresing, Geschäftsführer des deutschen Start-up-Verbands. Vor allem jungen Unternehmen drohe eine Benachteiligung im internationalen Wettbewerb. „Denn anders als Großkonzerne haben sie weniger Ressourcen, um den Anforderungen gerecht zu werden“, sagt Stresing zu Capital. Bernhard Rohleder, Chef des Digitalverbands Bitkom warnte am Wochenende sogar vor einer Schwächung des KI-Standorts Europa. „Der gestern Nacht erzielte Kompromiss schießt insbesondere bei der Regulierung generativer KI über das Ziel hinaus“, so Rohleder in einem Kommentar bei der Karriereplattform Linkedin. Mit generativer KI sind Programme wie ChatGPT gemeint, die auf Knopfdruck menschenähnliche Inhalte wie Gedichte, Hausarbeiten und Kunstwerke erstellen. Die EU schreibt ihnen mit dem AI Act nun strengere Transparenzregeln in Bezug auf die verwendeten Daten vor. Besonders Frankreich und Deutschland hatten hier zuletzt für laschere Regeln lobbyiert, um heimischen Start-ups wie Aleph Alpha und Mistral AI die Aufholjagd gegen US-Unternehmen wie OpenAI und Google zu erleichtern. Warnung vor Schlupflöchern Bürgerrechtlern geht der AI Act in vielen Punkten hingegen nicht weit genug. Sie warnen vor allem vor Gefahren für die Grundrechte. „Leider hat es die EU verpasst, biometrische Videoüberwachung im öffentlichen Raum einen klaren Riegel vorzuschieben“, twitterte etwa Markus Beckedahl, Netzaktivist und Gründer des Fachportals Netzpolitig.org. Die Formulierungen im AI Act lasse „Schlupflöcher groß wie Scheunentore offen“. Hintergrund ist, dass der Gesetzesentwurf unter anderem eine Ausnahme für die Strafverfolgung vorsieht. Behörden dürfen Echtzeit-Überwachung demnach für gezielte Ermittlungen verwenden. Die Nichtregierungsorganisation Algorithm Watch spricht ebenfalls von „großen Schlupflöchern“, allerdings mit Blick auf die Einstufung von Hochrisiko-Anwendungen. Die Tatsache, dass Unternehmen selbst einstufen dürften, ob ihre Programme überhaupt eine Hochrisikotechnik sind, erschwere ihre Kontrolle. Noch ist der AI Act allerdings nicht final. Der Kompromiss in Brüssel ist vor allem eine Einigung auf politischer Ebene. Beim Schärfegrad gibt es durchaus noch Spielraum. Denn viele technische Details müssen in den kommenden Wochen hinter den Kulissen noch ausgehandelt werden – und die sind oft entscheidend."
401bf410-ab6a-42c7-bd3b-c01065508b91,2023-12-12 08:34:22,"Was schon die Erwartung von niedrigeren Zinsen bewirken kann, lässt sich gut an der Börse ablesen. Dort ist zum Beispiel der DAX gerade auf ein Rekordniveau gestiegen. Umgekehrt konnte man bei den Immobilien zuletzt feststellen, wie schädlich höhere Zinsen sein können. So gesehen ist es eine gute Nachricht, dass 2024 tatsächlich die Zinsen aller Voraussicht nach sinken werden. Für Sparer könnte es allerdings heißen, dass die fetten ""Jahre"" bei der Geldanlage schon bald wieder vorbei sind. Ungeduldiges Warten auf Zinssenkungen von Fed und EZB Die Märkte haben Zinssenkungen nicht nur in den USA, sondern auch in Europa vorweggenommen und in die aktuellen Kurse schon eingepreist. Für die Marktteilnehmer geht es auch bei der Europäischen Zentralbank nur noch darum, ob EZB-Präsidentin Christine Lagarde – vielleicht im April –zum Frühjahr oder nicht doch erst im Sommer oder gar Herbst ihre Geldpolitik lockern wird. Angesichts der niedrigeren Inflation im ganzen Euroraum hat die EZB eine längere Zinspause eingelegt. Zinsen für Verbraucher und Hausbauer schon gesunken Bereits in dieser Pause haben sich Immobilienkredite zumindest etwas verbilligt. So berichten die Experten von Dr. Klein, dass die Preise für Baufinanzierungen bereits im November deutlich gesunken sind. Günstige Darlehenszinsen lagen demnach zwischen 3,69 Prozent und 4,23 Prozent – je nach Laufzeiten. Ein weiterer Punkt ist in diesem Zusammenhang, dass viele jetzt auf die niedrigeren Zinsen warten und erst einmal nichts unternehmen. Wenn Kredite dann billiger sind, verbessern sich damit auch die Bedingungen für Investitionen. Aktuell sind die Finanzierungsbedingungen eher ungünstig, was vor allem die Bauwirtschaft lähmt. Wenn diese Wachstumsbremse gelockert wird, dürfte sich auch die deutsche Wirtschaft insgesamt wieder schneller erholen, und ihre Schwächephase überwinden. Bröckelnde Sparzinsen, aber noch stärker fallende Inflationsrate Für Sparer sind die Prognosen dagegen vorerst noch einigermaßen stabil: Ende 2023 und in den ersten beiden Quartalen 2024 seien 4,0 Prozent Verzinsung beim Festgeld noch möglich, was aber auch schon stark von einer längeren Laufzeit abhängig sei. Bei ""Tagesgeldvergleich.net"" heißt es aber, dass für zweijähriges Festgeld im Schnitt nur noch 3,23 Prozent geboten würden. Bei kürzeren Anlagen für drei Monate seien die Sparzinsen schon von 3,1 Prozent auf 2,9 Prozent zurückgegangen. Die Sparer sind aber immer noch in der selten günstigen Ausnahmesituation, dass ihre Zinsen für Geldanlagen aktuell höher sind, als es die Inflationsrate zuletzt war (diese gab die EZB für November nur noch mit 2,4 Prozent an). Neben den hohen Zinsen spricht auch die niedrige Inflation dafür, dass die Wirtschaft im Moment etwas gelähmt ist, vor allem in Deutschland. Niedrigere Zinsen für Deutschland besonders wichtig Das schwache Wachstum und die drohende Rezession in Deutschland, dem größten Euroland mit seinen ungelösten Haushaltsproblemen durch die Schuldenbremse, das alles könnte die Europäische Zentralbank nachdenklich gemacht haben. Die Inflation ging zuletzt deutlich zurück und könnte mittelfristig, also binnen zwei Jahren, den EZB-Zielwert von zwei Prozent erreichen. Das gibt der Notenbank neuen Handlungsspielraum. Wenn der aktuell wichtigste Leitzins zu lange auf seinem derzeit hohen Niveau von 4,5 Prozent bleibt, droht die Konjunktur zu kippen. Erwünscht ist aber vielmehr eine sogenannte sanfte Landung, bei der es nur zu einem leichten Abschwung kommt – ohne tiefgreifende Einschnitte. Was läge also näher, als 2024 die Leitzinsen zu senken, und zwar gleich mehrfach. Deutsche Bank erwartet rasche Folge von Zinssenkungen Vor diesem Hintergrund glauben die meisten Analysten, dass sich für die EZB ein Handlungsdruck aufbaut zu einer raschen Lockerung ihrer Geldpolitik. Am weitesten gehen dabei die Experten der Deutschen Bank: Die Notenbank werde die Zinsen für den Euro nicht wie bisher erwartet erst im Juni zum zweiten Halbjahr senken, sondern schon im April gleich zu Beginn des zweiten Quartals. In einer ersten Prognose war die Deutsche Bank noch davon ausgegangen, dass die EZB mit ihrem ersten Schritt noch bis September warten würde. Die Analysten der Diba hielten das ebenfalls für wahrscheinlich. Doch auch im Herbst 2024 wären immer noch mehrere Zinssenkungen möglich. ""Früher, schneller, weiter, deutlicher"" könnten Zinssenkungen ausfallen Es gebe sogar eine ""signifikante Chance"", dass es schon im März zum ersten Mal passiert, heißt es nun bei der Deutschen Bank, wobei es sich natürlich um eine Fehleinschätzung handeln könnte. Ist es nicht zu früh, jetzt schon einen ""Zins-Crash"" auszurufen, etwa für Renditen von Zinspapieren wie Staatsanleihen? Ende 2024 könnte der Notenbankzins demzufolge schon 1,5 Prozent unter dem Niveau von heute liegen, der wichtigste Leitzins würde dann nur noch 3,0 Prozent betragen, heißt es bei der Deutschen Bank. Die Diba hält dagegen drei kleinere Zinssenkungen um 0,75 Prozentpunkte für möglich, was einem Leitzins von 3,75 Prozent zum Ende des nächsten Jahres entsprechen würde. Zeit und Umfang der neuen Abwärts-Wende sind also bei den Experten umstritten. Starke Auswirkungen auf Vermögenswerte wie Aktien und Immobilien Nicht nur Börsenkurse lassen sich von höheren Zinsen beflügeln – bei Aktien wie bei Anleihen. Für die meisten Anleger in Deutschland zählt ohnehin mehr der Immobilienbesitz. Die Preise für Wohnungen sind wegen des kurzfristigen Zinsanstiegs nur noch schwer zu finanzieren. Dasselbe gilt für viele Bauleistungen, die sich seit dem Ukraine-Krieg auch noch stark verteuerten, genauso wie zahlreiche Rohstoffe und Energie. So ist zu hoffen, dass die Bauwirtschaft mit den niedrigeren Zinsen ab Mitte nächsten Jahres aus dem aktuellen Tief herausfindet."
