d0924b29-4f9a-4c19-bd87-06d4cf515cb8,2023-05-10 11:01:41+00:00,"Seine Geburtstagstorte hatte sich Wolfgang Porsche wohl anders vorgestellt: Der Vertreter der Sportwagendynastie verbringt seinen 80. Geburtstag auf der Volkswagen-Hauptversammlung und wurde dort von Aktivisten ins Visier genommen. Während der Eröffnungsworte von Aufsichtsratschef Hans Dieter Pötsch warf eine Person Kuchen auf das Podium. Damit sollte offenbar Wolfgang Porsche als Vertreter der Eigentümerfamilien getroffen werden. Der Kuchen verfehlte jedoch sein Ziel. Nur an der weißen Bande vor Porsches Platz auf dem Podium war danach eine breiige Masse zu sehen. Es war jedoch nicht die einzige Störung des Aktionärstreffens, das in Berlin stattfindet. Menschenrechtsgruppen und Klimaaktivisten nutzten die Hauptversammlung für ihren Protest. Eine Aktivistin mit nacktem Oberkörper störte die Rede von Konzernchef Oliver Blume mit lauten Rufen und einem Plakat. Auslöser ihrer Kritik war das Festhalten von VW am chinesischen Werk in der Provinz Xinjiang. Auf einem Plakat hieß es: »Uigurische Zwangsarbeit bei VW beenden«. Die Frau wurde von Sicherheitskräften aus dem Versammlungssaal geführt. Danach fuhr Blume mit seinen Ausführungen fort. Auch später gab es noch eine kurze Unterbrechung der Versammlung durch lautes Rufen. Aufsichtsratschef Hans Dieter Pötsch forderte die Protestierenden mehrfach auf, Störungen zu unterlassen. Auf deren Vorwürfe ging er nicht ein. In einer Stellungnahme reagierte der Autobauer verärgert auf die massive Störung seiner Hauptversammlung. Friedliche Proteste seien ein demokratisches Mittel der freien Meinungsäußerung. Die Beschädigung von fremdem Eigentum und der Eingriff in die Rechte anderer sowie die mögliche Gefährdung der Gesundheit von Beteiligten stehe in Widerspruch dazu. Zugleich erneuerte Volkswagen seine Bereitschaft zum konstruktiven Dialog mit seinen Kritikern. Aktionärstreffen der Wolfsburger waren in den vergangenen Jahren wiederholt Ziel von Protesten. So heftig wie diesmal waren die Störungen aber selten. Volkswagen unterhält ein Werk in der chinesischen Provinz Xinjiang. Die dort lebende muslimische Minderheit der Uiguren wird laut Menschenrechtsorganisationen gezielt vom kommunistischen Regime in China unterdrückt. Volkswagen hat wiederholt erklärt, nicht an Menschenrechtsverletzungen beteiligt zu sein. Das vergangene Jahr bei Volkswagen war turbulent, unter anderem musste der langjährige Chef Herbert Diess (64) an der Konzernspitze dem jüngeren Porsche-Chef Blume (54) weichen. Blume soll dem Autoriesen wieder mehr Teamgeist beibringen – aber auch operative Probleme wie die kriselnde Softwareentwicklung und das schwächelnde Geschäft in der einstigen VW-Bastion China lösen. Zudem steht die Wiederwahl von Aufsichtsratsmitgliedern an, darunter auch der Familienvertreter Wolfgang Porsche. Er hat mit 80 Jahren die für das Gremium geltende Regelaltersgrenze von 75 Jahren zwar bereits überschritten. Da er einer der größten Aktionäre ist, empfiehlt der Aufsichtsrat seine Wiederwahl dennoch. Porsche ist der Cousin des 2019 verstorbenen Firmenpatriarchen Ferdinand Piëch und Aufsichtsratschef der Familienholding Porsche SE, die die Mehrheit an Volkswagen hält. Er soll für eine volle Amtszeit erneut in den VW-Aufsichtsrat einziehen. »Ich will mich noch einmal für fünf Jahre wählen lassen. Dann ist aber Schluss«, sagte Porsche der Nachrichtenagentur dpa. Beim gleichnamigen Sportwagenbauer wiederum sitzt der Automanager seit bereits 45 Jahren im Aufsichtsrat und ist dort seit 2007 auch Vorsitzender. Porsche will Familie einen Wolfgang Porsche sagte, er sei durch die ständigen Streitereien mit seinem 2019 verstorbenen Cousin und früheren VW-Patriarchen Ferdinand Piëch geprägt. Nun wolle er dafür sorgen, dass die Familie nach außen und in Aufsichtsratssitzungen mit einer Stimme spreche. »So viel haben wir gelernt: Dass wir uns erst austauschen und dann in eine Sitzung gehen.« Mit dem heutigen Piëch-Oberhaupt, Ferdinands Bruder Hans Michel (81), verstehe er sich gut. Beim Börsengang der Porsche AG im September 2022 sicherte sich die von den Familien kontrollierte Porsche SE eine Sperrminorität und damit wieder direkten Einfluss beim Sportwagenbauer. »Das war schon eine Voraussetzung für den Börsengang«, erklärte Porsche den Deal. Darüber hinaus habe Porsche jetzt wieder mehr Eigenständigkeit und Volkswagen frische Milliarden für die Transformation. Dieser Deal und die Machtkonzentration bei den Milliardärsfamilien sorgten aber auch immer wieder für Kritik. Die Mehrheitsverhältnisse bei Volkswagen sind klar verteilt. Die Holding der Eigentümerfamilien Porsche und Piëch, die Porsche SE, hält mit 53 Prozent den größten Stimmrechtsanteil vor dem Land Niedersachsen mit 20 Prozent und dem Staatsfonds aus Katar mit 17 Prozent. Die Vorzugsaktionäre haben dagegen kein Stimmrecht."
dbbfdc73-253d-4702-9fa5-c3a6a06456e8,2023-05-11 08:37:00+00:00,"Anzeige Es sollte das „Jahr des Lieferns“ werden – so hatte es der Chef der Software-Sparte von Volkswagen, Dirk Hilgenberg, Anfang 2023 noch versprochen. Doch er wird nicht mehr dazu kommen. Seit ihrer Gründung stand die VW-Tochtergesellschaft Cariad unter permanenter Kritik, und endlich wollte Hilgenberg das Blatt wenden. Doch nun hat der Aufsichtsrat des Unternehmens den Manager entlassen – und mit ihm fast den gesamten Vorstand von Cariad. Auf Basis ausführlicher Analyse habe man „konkrete Schlüsse gezogen“ und nehme „eine tief greifende Weiterentwicklung von Cariad vor“, kommentierte Konzernchef Oliver Blume die Entscheidung. Anzeige Ab Juni übernimmt der bisherige Produktionsvorstand der britischen Konzerntochter Bentley, Peter Bosch, den Software-Chefposten. Er sei „der richtige CEO zur richtigen Zeit“, sagte Blume. „Er ist Stratege, Umsetzer und Teamplayer.“ Der Manager Bosch übernimmt mit Cariad das wichtigste Zukunftsprojekt im Volkswagen-Konzern – und das mit den größten Problemen. Der frühere Vorstandschef Herbert Diess hatte das Unternehmen 2020 gegründet und als Ziel ausgegeben, das „zweitgrößte Softwareunternehmen Europas nach SAP“ aufzubauen. Bisher ist davon noch wenig zu sehen. Anzeige Mehr zu Elektroautos Weltplus ArtikelElektro für Jedermann Weltplus ArtikelGünstiger, effizienter, leichter Weltplus ArtikelNio ET7 im Alltagstest Tatsächlich gilt Software als das entscheidende Zukunftsfeld in der Automobilindustrie, sie ist für die Konzerne wichtiger als Batterien oder Elektroantriebe. Die Software bringt alle Funktionen des Fahrzeugs zusammen, von der Motorsteuerung bis zur Musikanlage. Auch Eigenschaften wie die Reichweite oder das Fahrverhalten hängen maßgeblich von der Programmierung ab. Für Diess war klar, dass Volkswagen in diesem Bereich möglichst viel eigene Kompetenz aufbauen und den größten Teil seiner Programme künftig selbst schreiben sollte. Doch von Anfang an klafften Anspruch und Wirklichkeit bei Cariad weit auseinander. Die Fehler und Verzögerungen in der Entwicklung neuer Software hatten dazu geführt, dass Audi und Porsche den Start wichtiger neuer Modelle um mehr als ein Jahr verschieben mussten. Das hat Diess letztlich den Chefposten gekostet. Neuer Cariad-Chef ist intern gut vernetzt Nun greift sein Nachfolger Oliver Blume bei Cariad durch. Schon im vergangenen Jahr hatte er mit seinem Amtsantritt unrealistische Pläne in der Softwareentwicklung gestoppt und die zeitlichen Abläufe neu sortiert. Jetzt wird sich auch die Struktur des Unternehmens ändern, die Personalien drücken das deutlich aus. Der neue Cariad-Chef arbeitet seit zwölf Jahren im VW-Konzern. Vor seinem Wechsel zu Bentley war Bosch in Wolfsburg bei der Marke Volkswagen für Strategie und Produktion zuständig. Als Produktionsvorstand bei Bentley war er auch Blume unterstellt, der im Konzernvorstand die Produktion verantwortet hatte. Anders als die bisherige Führungsriege von Cariad hat Bosch also einen direkten Draht zum Konzernchef – und ein Netzwerk innerhalb des Konzerns. Daran mangelte es dem Physiker Hilgenberg, der von BMW zu Volkswagen gekommen war, ebenso wie seiner Vorstandskollegin Lynn Longo, die zuvor bei der US-Streamingplattform SiriusXM gearbeitet hatte. Sie sind ihre Vorstandsposten nun los, genauso wie Finanzvorstand Thomas Sedran, seit 2015 im Konzern und kurzzeitig Chef der VW-Nutzfahrzeugsparte. Sie sollen andere Aufgaben im VW-Konzern bekommen. Einzig Personalchef Rainer Zugehör darf seinen Cariad-Posten behalten. Künftig sollen noch „zwei ausgewiesene Software-Experten“ den Vorstand ergänzen. Konzernchef Blume zielt mit der Neubesetzung aus Sicht von Vertrauten nicht nur auf einen besseren Durchgriff bei der Software-Tochter, sondern auch auf mehr Kooperation innerhalb der Gruppe. Bisher hatten sich vor allem Audi und Cariad intern stets gegenseitig die Schuld gegeben für die teuren Verzögerungen bei der Einführung neuer Produkte. Audi fällt hinter Konkurrenz zurück Ursprünglich hätte die intern 1.2 genannte Software für die neuen Audi- und Porsche-Modelle bereits im vergangenen Jahr fertig sein sollen, nun werde sie bis Ende 2023 laufen, heißt es im Konzern. Dann können der Audi Q6 etron und der elektrische Macan von Porsche endlich auf den Markt kommen – zwei Modelle, die Milliardenbeträge einspielen sollen. Vor allem Audi ist dringend angewiesen auf dieses und weitere neue Modelle. Die Marke hat im Vergleich zu BMW und Mercedes-Benz kaum Elektro-Modelle zu bieten, was sich deutlich in den Absatzzahlen niederschlägt. Auch beim Gewinn hinkt Audi seinen Konkurrenten deutlich hinterher. Ein Grund für die Verzögerung der Software waren die strukturelle Überlastung von Cariad und der Aufbau der neuen Organisation während laufender Entwicklungsprojekte. Neben dem neuen Programm für die Premium-Marken müssen die Entwickler auch die laufenden Systeme von Volkswagen pflegen und sie sollen, drittens, ein völlig neues Betriebssystem programmieren, das künftig in fast allen Fahrzeugen des Konzerns laufen soll. Lesen Sie auch Weltplus ArtikelGünstiger als 25.000 Euro Den Start dieser Zukunfts-Software (2.0) hat Blume auf die zweite Hälfte des Jahrzehnts verschoben, aktuell wird 2028 angepeilt. Bis dahin müssen die Fahrzeuge der Massenmarken VW, Skoda, Cupra mit dem laufenden System zurechtkommen – dessen weitere Entwicklung begrenzt ist, weil die Computerleistung in den Fahrzeugen nicht nachträglich gesteigert werden kann. Die große Vision eines deutschen Auto-Betriebssystems, das beispielsweise mit Android Auto von Google konkurrieren wird, ist durch die Neuorganisation von Cariad mindestens aufgeschoben, wenn nicht aufgehoben. Autohersteller wie VW bauen ihre Software ähnlich wie die Fahrzeuge selbst aus vielen Einzelteilen zusammen, die von Zulieferern kommen. An dem Betriebssystem für die neuen Audi-Fahrzeuge sollen mehr als 80 Lieferanten beteiligt sein, die Programm-Bausteine liefern. Bosch und VW planen Software Vorstandschef Blume selbst betont, dass der Konzern weiter und verstärkt auf Kooperationen setzen wolle. In China arbeitet Cariad gemeinsam mit dem lokalen Unternehmen Horizon Robotics am automatisierten Fahren, in Europa gibt es eine Entwicklungspartnerschaft mit Bosch. Noch stammt das System zum automatisierten Fahren, mit dem die Autos des Konzerns beispielsweise die Spur halten können, größten Teil von der Intel-Tochter Mobileye. Das neue System von Bosch und VW soll diese Software irgendwann ablösen. Doch bis dahin werden sicher noch Jahre vergehen. „Alles auf Aktien“ ist der tägliche Börsen-Shot aus der WELT-Wirtschaftsredaktion. Jeden Morgen ab 5 Uhr mit den Finanzjournalisten von WELT. Für Börsen-Kenner und Einsteiger. Abonnieren Sie den Podcast bei Spotify, Apple Podcast, Amazon Music und Deezer. Oder direkt per RSS-Feed."
6e43d72c-2bdb-4987-9ba9-3816d7acb6c4,2023-05-11 13:21:16+00:00,"Straßenblockaden, Klimaproteste vor dem Versammlungsgebäude, Störaktionen in der Halle, eine fliegende Torte, die Wolfgang Porsche nur knapp verfehlte - es ging wahrlich hoch her in dieser Woche bei der Hauptversammlung von Volkswagen, der mit 670 000 Mitarbeitenden Europas größter Industriekonzern ist. Natürlich sind gewaltsame Proteste und tätliche Angriffe auf VW-Verantwortliche nicht akzeptabel. Nicht nur bei Aktionärstreffen müssen sich alle an die Regeln halten. Nur dann ist eine konstruktive Diskussion möglich."
e58dd767-c3a9-4519-80b4-9effb95f5213,2023-05-12 12:35:49+00:00,"Der schwedische Hersteller Northvolt hat sich zu seinen Plänen bekannt, in Schleswig-Holstein Batteriezellen für Elektroautos zu produzieren. Bund und Landesregierung wollen den Bau der Fabrik subventionieren. Die Bundesregierung und das Land Schleswig-Holstein haben mit der Zusage von Subventionen den Weg für eine milliardenschwere Investition des schwedischen Batterieherstellers Northvolt in Deutschland geebnet. Die Förderung der geplanten Batteriezellen-Fabrik in der holsteinischen Kreisstadt Heide stehe aber noch unter dem Vorbehalt der beihilferechtlichen Genehmigung durch die EU-Kommission, teilten das Bundeswirtschaftsministerium, die Landesregierung und Northvolt mit. Davon macht das Unternehmen die endgültige Entscheidung abhängig. Etwa 3000 Arbeitsplätze könnten entstehen ""Northvolt hat verdeutlicht, dass die Investition in Heide vorbehaltlich einer Förderung erfolgt, die die Europäische Kommission unter Wahrung des Wettbewerbsrechts genehmigt"", erklärte das Bundeswirtschaftsministerium. Über die Höhe der Förderung sei noch nicht final entschieden worden. Nach einem Bericht der Nachrichtenagentur Reuters könnte Northvolt rund eine halbe Milliarde Euro Unterstützung bekommen. Die Investitionen des schwedischen Konzerns für die Anlagen in Heide würden sich dann auf rund drei bis fünf Milliarden Euro belaufen. In Heide, rund hundert Kilometer nordwestlich von Hamburg, sollen nach ersten Planungen etwa 3000 Beschäftigte tätig sein. Das jährliche Produktionsvolumen nach Hochlauf der Fabrik soll 60 Gigawattstunden betragen und rund eine Million Elektrofahrzeuge mit Batteriezellen versorgen. Wettlauf um Subventionen ""Mit diesem Engagement der Bundesregierung im Rücken hat Northvolt beschlossen, die nächsten Schritte für den Ausbau in Heide zu gehen"", erklärte der Gründer und Chef von Northvolt, Peter Carlsson. Zuvor waren Zweifel aufgekommen, ob Northvolt zugunsten eines Standorts in Nordamerika den bereits geplanten Bau in Heide aufschieben könnte. Northvolt hatte im Februar 2022 den Bau der Fabrik angekündigt. Im Herbst stellte Carlsson das Projekt aber wieder in Frage und nannte als Grund vor allem die stark gestiegenen Energiepreise in Deutschland. Er sagte damals außerdem, Northvolt ziehe eine Priorisierung der Expansion in den USA wegen dortiger üppiger Subventionen in Betracht. Die Bundesregierung und die EU hatte er zu höheren Beihilfen aufgefordert. Hintergrund des Ringens um den Standort war das US-Subventionsprogramm ""Inflation Reduction Act"". ""Eines der wichtigsten Leuchtturmprojekte"" Bundeswirtschaftsminister Robert Habeck erklärte: ""Mit den nächsten Schritten bei Northvolt kann sich Deutschland auf eines der wichtigsten Leuchtturmprojekte der Energie- und Verkehrswende freuen, das Tausende von Green-Tech-Arbeitsplätzen schaffen wird."" Alle Beteiligten streben laut Ministerium an, die Voraussetzungen noch in diesem Jahr zu erfüllen, damit die Bauarbeiten beginnen können. Eine Auslieferung von Batteriezellen aus Heide soll im Jahr 2026 starten. Größer als Fabriken von VW Mit der geplanten Jahreskapazität von 60 Gigawattstunden würde die Northvolt-Fabrik zu den sogenannten ""Gigafactorys"" gehören. Sie wäre größer als jeder der beiden von Volkswagen im niedersächsischen Salzgitter sowie in Spanien geplanten Standorte - aber kleiner als die 100-Gigawatt-Anlage, die der chinesische Hersteller CATL in Ungarn bauen will."
d52b4f43-c01e-4585-bde1-f6268d99374b,2023-05-12 15:16:10+00:00,"Was sich bei auf dem Gelände des Mercedes-Werkes in Sindelfingen abgespielt hat, ist einfach nur grausam. Zwei Menschen haben dort ihr Leben verloren. Ein Vorfall, der auch VW fassungslos zurücklässt. Die Schüsse fielen auf dem Werksgelände in Halle 56 (News38 berichtete). Ein Horrorszenario, das sich nicht wiederholen soll. Weder bei Mercedes noch soll es sich anderswo, beispielsweise bei Konkurrent VW, abspielen. Tödliche Schüsse im Mercedes-Werk Ein 53-Jähriger soll am Donnerstagmorgen zwei Kollegen der Logistikforma Rhenus erschossen haben. Einer der beiden 44-Jährigen starb noch vor Ort, der andere wenig später im Krankenhaus. Sowohl der mutmaßliche Täter als auch die beiden Opfer arbeiteten gemeinsam in der Produktionshalle. Das Tatmotiv? Bislang unklar. Das will die Ermittlungsgruppe „Halle“ jetzt herausfinden. Der mutmaßliche Täter wurde bereits einem Haftrichter vorgeführt, doch er schweigt zu den Vorwürfen, teilten Polizei und Staatsanwaltschaft am Freitag (12. Mai) mit. Konkurrent VW zeigt Anteilnahme Mercedes zeigt sich angesichts der schockierenden Tat fassungslos. „Wir sind tief geschockt und traurig über die tragischen Nachrichten aus Sindelfingen“, teilte die Mercedes-Benz-Gruppe mit. „Unsere Gedanken sind bei den Opfern, deren Familien und Kollegen.“ Gleichzeitig betonte der Konzern, dass es keine weitere Gefahr für die Kollegen in Sindelfingen gebe. Auch Konkurrent Volkswagen zeigt sich fassungslos angesichts der Tat im Mercedes-Werk. „Volkswagen bedauert die Vorkommnisse bei Mercedes in Sindelfingen und wir sind in Gedanken bei den Angehörigen der Betroffenen“, teilte ein Sprecher auf Nachfrage von News38 mit. Mehr News: VW-Mitarbeiter macht sich in der Krise Luft – „Da werde ich böse“ VW-Vorstand mit klarer Ansage an Mitarbeiter – „Steht zu viel auf dem Spiel“ VW-Krise: Ordentlich Druck auf dem Kessel! Mitarbeiter starten Mega-Demo – nur ein erster Vorgeschmack? VW-Krise: Schock für Mitarbeiter! Konzern schließt Bistros VW-Mitarbeiter gehen auf die Barrikaden – es geht ums Geld Der Konzern weiß, was es bedeutet, für die Sicherheit Tausender Mitarbeiter sorgen zu müssen. Auch Volkswagen sei es ein Anliegen, dass so etwas nicht passiert. „Zur Eingrenzung von Gefährdungen der Mitarbeiter, Besucher und Partnerfirmen auf den Liegenschaften der Volkswagen AG werden permanent Sicherheitskonzepte erarbeitet und an die jeweiligen Situationen angepasst“, betont der Konzern knapp auf Nachfrage von News38. (abr mit dpa)"
17a30f5a-f981-4b09-b43c-7125a9f733f8,2023-05-15 10:00:15+00:00,"15.05.2023 Volkswagen plant, ein Elektroauto in der Preisklasse von rund 20.000 Euro anzubieten. VW-Chef Oliver Blume bezeichnete dies in einem Interview mit der Bild am Sonntag als “übernächsten Schritt” für das Unternehmen. © Volkswagen Preislich unterhalb des ID.2all Bereits im März hatte VW den elektrischen Kleinwagen ID.2all angekündigt, der weniger als 25.000 Euro kosten soll und eine Reichweite von 450 Kilometern sowie Frontantrieb bietet. Mit den E-Fahrzeugen im niedrigen Preissegment möchte VW den Druck auf die Konkurrenz erhöhen. Beispielsweise bietet Dacia den Spring bereits für rund 20.000 Euro an. Renault wiederum plant, 2024 einen elektrischen Kleinwagen in der Preisklasse des VW ID.2all auf den Markt zu bringen – auch der Opel-Mutterkonzern Stellantis hat ähnliche Pläne. Hast Du Pläne für einen Neuwagen? Dann schaue Dir jetzt die günstigen Angebote im Onlineshop von MeinAuto.de an! Mit unserem Konfigurator hast Du die Möglichkeit, Dir die Ausstattung Deines Lieblingsmodells selbst zusammenzustellen. Überzeuge Dich auch von unseren attraktiven Finanzierungs- und Leasingangeboten und spare noch heute bares Geld! Mit uns kommst Du schnell & bequem zum Neuwagen"
3b54347a-2cb9-481f-9e1a-b9890a0a3de9,2023-05-16 13:50:41+00:00,"Moskau. Der Volkswagen-Konzern hat nach Medienberichten in Moskau die Genehmigung für den Verkauf seiner Vermögenswerte in Russland für 125 Millionen Euro an den russischen Autohändler Avilon erhalten. Einen entsprechenden Antrag habe die Regierungskommission zur Kontrolle über Auslandsinvestitionen abgesegnet, berichtete die Nachrichtenagentur Interfax am Dienstag in Moskau unter Berufung auf Verhandlungskreise. Weiterlesen nach der Anzeige VW war seit vielen Jahren in Russland aktiv gewesen und eröffnete 2007 in Kaluga knapp 200 Kilometer südwestlich von Moskau eine eigene Fabrik. Im Frühjahr 2022, nach Beginn des russischen Angriffskrieges gegen die Ukraine, hat VW neben anderen westlichen Autobauern die Produktion in Russland eingestellt. VWs größtes Werk in Russland: 4000 Mitarbeiter in Kaluga Avilon erhält die volle Kontrolle über die Volkswagen Group Rus und deren Tochtergesellschaften, darunter auch mehrere Firmen für den Verkauf von Lastwagen der Marke Scania. „Derzeit ist die Volkswagen AG dabei, ihre Anteile an der Volkswagen Group Rus und damit auch das Werk Kaluga mit seinen mehr als 4000 Mitarbeitern an einen namhaften russischen Investor zu verkaufen“, teilte das Unternehmen in Wolfsburg dazu lediglich, ohne weitere Details zu nennen. Weiterlesen nach der Anzeige Die hochmoderne Fabrik gilt als der wichtigste Vermögenswert von VW in Russland. Nach Angaben von Russlands Vizeregierungschef Denis Manturow läuft bereits die Suche nach einem Vertragspartner aus Südostasien, um die Produktionsstätte wieder in Betrieb zu nehmen. Der Verkauf wurde durch eine Klage des früheren VW-Fertigungspartners Gaz – zu Sowjetzeiten bekannt für den Bau der Wolga-Limousine – verzögert. Gaz hatte VW auf Schadenersatz in dreistelliger Millionenhöhe für die Kündigung des Abkommens verklagt. Ein Gericht in Russland hat die Klage inzwischen abgewiesen. Welche Folgen hat der Rückzug westlicher Autobauer aus Russland? Der Rückzug westlicher Autobauer aus Russland hat zu einem deutlichen Einbruch der Fahrzeugproduktion im Land geführt. 2022 wurden laut dem Unternehmensverband AEB lediglich 687.000 Neufahrzeuge verkauft – im Jahr zuvor waren es noch 1,667 Millionen Neuwagen. Inzwischen wurden einige Werke von russischen Investoren übernommen; oft zu einem symbolischen Preis und mit einer Rückkaufoption. So hatte der französische Autobauer Renault im vergangenen Sommer seine Mehrheitsbeteiligung am Lada-Bauer Avtovaz für einen Euro an den russischen Staat übergeben."
c7f1fcf2-016f-4df8-a8a3-f1147bde0ce2,2023-05-16 15:42:53+00:00,"VW war seit vielen Jahren in Russland aktiv gewesen und eröffnete 2007 in Kaluga knapp 200 Kilometer südwestlich von Moskau eine eigene Fabrik. Im Frühjahr 2022, nach Beginn des russischen Angriffskrieges gegen die Ukraine, hat VW neben anderen westlichen Autobauern die Produktion in Russland eingestellt. Avilon erhält die volle Kontrolle über die Volkswagen Group Rus und deren Tochtergesellschaften, darunter auch mehrere Firmen für den Verkauf von Lastwagen der Marke Scania. ""Derzeit ist die Volkswagen AG dabei, ihre Anteile an der Volkswagen Group Rus und damit auch das Werk Kaluga mit seinen mehr als 4000 Mitarbeitern an einen namhaften russischen Investor zu verkaufen"", teilte das Unternehmen in Wolfsburg dazu lediglich, ohne weitere Details zu nennen. Die hochmoderne Fabrik gilt als der wichtigste Vermögenswert von VW in Russland. Nach Angaben von Russlands Vizeregierungschef Denis Manturow läuft bereits die Suche nach einem Vertragspartner aus Südostasien, um die Produktionsstätte wieder in Betrieb zu nehmen. Der Verkauf wurde durch eine Klage des früheren VW-Fertigungspartners Gaz – zu Sowjetzeiten bekannt für den Bau der Wolga-Limousine – verzögert. Gaz hatte VW auf Schadenersatz in dreistelliger Millionenhöhe für die Kündigung des Abkommens verklagt. Ein Gericht in Russland hat die Klage inzwischen abgewiesen. Der Rückzug westlicher Autobauer aus Russland hat zu einem deutlichen Einbruch der Fahrzeugproduktion im Land geführt. 2022 wurden laut dem Unternehmensverband AEB lediglich 687.000 Neufahrzeuge verkauft – im Jahr zuvor waren es noch 1,667 Millionen Neuwagen. Inzwischen wurden einige Werke von russischen Investoren übernommen; oft zu einem symbolischen Preis und mit einer Rückkaufoption. So hatte der französische Autobauer Renault im vergangenen Sommer seine Mehrheitsbeteiligung am Lada-Bauer Avtovaz für einen Euro an den russischen Staat übergeben."
