40a1fc7e-8cd8-42e2-9c6e-258a34f5bb08,2023-12-19 10:13:00+00:00,"Startseite Lokales Fürstenfeldbruck Olching Hightech-Firma will erweitern - doch Fläche liegt im Hochwassergebiet Von: Hans Kürzl Der Zeitpunkt passte, zumindest den Kritikern: Gerade jetzt, wo Olching mit einem Rekord-Grundwasser-Pegel zu tun hat, wurde die Erweiterung einer Firma beraten. Olching – Das Pikante: Die betreffende Fläche liegt im Hochwassergefahrengebiet. Dafür muss in jedem Fall ein Ausgleich geschaffen werden. Die Olchinger Hightech-Firma „Laser Components“ mit aktuell 160 Mitarbeitern will expandieren. Der Stadtrat beriet in seiner jüngsten Sitzung über die notwendigen baurechtlichen Schritte. Stichwort: Erweiterung des Gewerbegebiets auf derzeit noch brachliegenden grünen Wiesen. Kritik kam von Ewald Zachmann (FO). Die Expansion dürfe nicht um jeden Preis geschehen, wie er sagte. Er wollte der Änderung von Flächennutzungs- und Bebauungsplan im sogenannten Gewerbegebiet III nicht zu stimmen. Ihm folgten aber nur zwei weitere Stadtratsmitglieder. Die Mehrheit gab grünes Licht. Die fragliche Fläche Es geht konkret um die Fläche zwischen Roggensteinerstraße und Münchner Straße, quasi südöstlich der Werner-von-Siemens-Straße. Dort ist das Unternehmen ansässig, das seine Erweiterungspläne mit einem jährlichen Zuwachs von bis zu 20 Mitarbeitern begründet. Bis Ende des Jahrzehnts lande man bei einer Zahl von über 250 Mitarbeitern. Laut Sitzungsvorlage stünden ebenso Unternehmenszukäufe im Raum. Zachmann nahm das zwar zur Kenntnis, äußerte aber heftige Bedenken. „Wir beklagen immer, wenn Flächen zugebaut werden und Wasser an andere Orte verdrängt wird“, betonte er. Nach seinen Informationen sei das für die Produktion geplante Areal als Überschwemmungsgebiet festgesetzt. „Olching ist in Sachen Hochwasser ein gebranntes Kind.“ Deshalb sollte man Zachmanns Meinung nach einer Firma mit Expansionsbedarf nicht bedingungslos entgegenkommen. „Zumal wir Alternativen haben“, fuhr Zachmann fort. Man könne in die Höhe bauen. Außerdem entwickle die Stadt im Gewerbepark an der Bundesstraße 471 in Geiselbullach neue Flächen. (Übrigens: Alles aus der Region gibt‘s jetzt auch in unserem regelmäßigen FFB-Newsletter.) Dem hatte die Bauverwaltung zum einen entgegengesetzt, dass ersten Berechnungen nach eine Verdoppelung der derzeitigen Betriebsfläche notwendig sei. „Dies ist auf dem Bestandsgrundstück nicht möglich“, hieß es in der Sitzungsvorlage. Aufstockung Allenfalls könne der Bedarf des Unternehmens durch eine Aufstockung um drei Geschosse gedeckt werden. „Das erscheint weder planerisch noch baukonstruktiv realistisch“, hieß es seitens der Olchinger Bauverwaltung weiter. Auch eine Verlagerung in den Gewerbepark sei grundsätzlich vorstellbar. Dem aber hatte sich das Unternehmen widersetzt und „von der denkbar schlechtesten Lösung“ gesprochen. Dass das zu überplanende Gebiet innerhalb der Hochwassergefahrenfläche liege, räumte man seitens der Verwaltung ein. Man befinde sich jedoch mit dem Wasserwirtschaftsamt in Gesprächen. Daraus ergab sich ein erstes Ergebnis: Sollte sich der geplante Standort als alternativlos erweisen, sei das Vorhaben realisierungsfähig. Allerdings müssten dann nördlich der Herbststraße ausreichend Retentionsflächen für Hochwasser geschaffen werden. Dies bedarf der Zustimmung aller betroffenen Grundstückseigentümern. Eine Diskussion zu dem Thema gab es nicht. Auch interessant: In den Kellern laufen schon die Pumpen – Schleuse freigefischt – See am Überlaufen Noch mehr aktuelle Nachrichten aus dem Landkreis Fürstenfeldbruck finden Sie auf Merkur.de/Fürstenfeldbruck."
38ad2f65-890b-4d5b-b4c9-451916cb0831,2023-12-20 08:09:23+00:00,"Deutsche Konzerne und die Gerüchte über Massenentlassungen „Telekom entlässt 15 000 Mitarbeiter, Siemens 7 000, Opel 4 000, VW 30 000, Dt. Bank 7 000 usw. Und Deutschland schreit nach ausländischen Fachkräften!?“ – so der Text eines Sharepics auf Facebook: Dieses Sharepic kursiert in unterschiedlichen Darstellungen übrigens bereits seit mindestens vier Jahren: Eine genaue Untersuchung dieser Behauptungen ist notwendig, um den Wahrheitsgehalt zu ermitteln und Fehlinformationen zu korrigieren. Deutsche Telekom: Die Wirklichkeit hinter den Zahlen Es gibt keine stichhaltigen Beweise für die Behauptung, die Deutsche Telekom habe 15.000 Mitarbeiter entlassen. Im Jahr 2016 wurde über Umstrukturierungen des Unternehmens berichtet, von denen 15.000 Mitarbeiter betroffen sein sollen, jedoch nicht im Zusammenhang mit Entlassungen. Im Oktober 2023 gab es Medienberichte über Sparpläne und einen Stellenabbau bei der Telekom, von dem rund 2.000 Stellen betroffen sein sollen. Siemens: Blick in die Vergangenheit Siemens kündigte 2017 den Abbau von rund 7.000 Stellen an, davon etwa die Hälfte in Deutschland. Diese Zahl wurde auch in einer Meldung aus dem Jahr 2021 genannt, bezog sich aber auf die Ausgliederung des Geschäfts mit Großantrieben und betraf rund 2.000 Stellen in Deutschland. Opel: Die Situation im Kontext Im Jahr 2018 wurde berichtet, dass bei Opel bis 2020 mehr als 4.000 Beschäftigte das Unternehmen verlassen würden, hauptsächlich über Abfindungen und Vorruhestandsregelungen. Im Jahr 2022 sollte es laut „Wirtschaftswoche“ weitere Stellenstreichungen geben, allerdings wieder im Rahmen von Freiwilligenprogrammen. Volkswagen: Gerüchte und Wirklichkeit Spekulationen über einen Abbau von 30.000 Stellen bei Volkswagen gab es immer wieder, aber keine konkreten Belege. Der Konzern dementierte diese Zahl im Oktober 2021. Im Mai 2023 kündigte die IG Metall eine Beschäftigungssicherung bis 2029 an. Gerüchte über einen Stellenabbau basierten vor allem auf Einsparzielen des Unternehmens. Deutsche Bank: Globale Perspektive Im Jahr 2018 kündigte die Deutsche Bank an, weltweit 7.000 Stellen abbauen zu wollen, um betriebsbedingte Kündigungen zu vermeiden. Dieser Plan war nicht spezifisch auf Deutschland beschränkt. Fazit – deutsche Konzerne planen keine Massenentlassungen Eine detaillierte Überprüfung der im Internet kursierenden Gerüchte zeigt, dass die meisten Meldungen über Massenentlassungen bei deutschen Großkonzernen entweder veraltet, aus dem Zusammenhang gerissen oder schlicht erfunden sind. – Wie auch Sprecher von Telekom, Siemens, Opel, Volkswagen und Deutscher Bank gegenüber der DPA im Dezember 2023 bestätigten, dass die angeblichen Zahlen „falsch“ oder „frei erfunden“ seien. Für weitere verlässliche und aktuelle Informationen abonnieren Sie den Mimikama-Newsletter und nutzen Sie das umfangreiche medienpädagogische Angebot von Mimikama. Quelle: DPA Lesen Sie auch:"
ee3258b2-fc46-4f64-af73-eab44cf5fdeb,2023-12-20 16:14:59+00:00,"Start-up Gestalt Robotics : KI-Kenner aus Kreuzberg Von Stefan Paravicini 20.12.2023, 17:14Lesezeit: 5 Min. Jens Lambrecht (links) mit seinen Mitgründern Thomas Staufenbiel und Eugen FunkGestalt Robotics Die Berliner Software-Firma Gestalt Robotics liefert KI-Anwendungen für Industriekunden wie Siemens oder die Deutsche Bahn. Jetzt denkt Gründer Jens Lambrecht darüber nach, externe Investoren an Bord zu holen. Der erste Eindruck ist typisch für ein Berliner Start-up. Das Büro von Gestalt Robotics liegt im angesagten Wrangelkiez im Gewerbegebiet „Höfe am Osthafen“. Die Atmosphäre in dem Kreuzberger Industrieloft ist lässig und unprätentiös, genau wie die etwa zwei Dutzend Softwareentwickler und Verkaufsspezialisten, die an diesem Vormittag im Büro arbeiten. Zugang zu allen FAZ+ Beiträgen 11,80 € jetzt nur 0,99 € Jetzt Zugang 11,80 € für nur 0,99 € abonnieren? Mit einem Klick online kündbar Digitalisierung: Der steinige Weg zu einer smarten Verwaltung Wer umzieht, muss für die Anmeldung nicht mehr zum Amt. Doch das klappt längst nicht überall. Was sich ändern muss. Geldpolitik: Fed abschaffen? Elon Musk gefällt das Ein Konflikt ist in Amerika programmiert: Trumps Politik wirkt tendenziell inflationär. Seine Berater finden, der Präsident müsse Einfluss auf die Geldpolitik nehmen können. Standards für die Industrie: Wie „Made in China“ das neue „Made in Germany“ werden soll Der Herr der DIN schlägt Alarm: Nicht nur die Industrie leidet, sondern auch der deutsche Einfluss auf die Industrienormen. China weiß, dass es selbst die Regeln setzen kann."
939544a9-1065-4d19-8f4a-dbe9f9692759,2023-12-21 10:10:00+00:00,"Siemens hat acht Prozent der Anteile an Siemens Energy in seinen Pensionsfonds übertragen. Das Paket dürfte laut Daten der Londoner Börse einen Wert von 700 Millionen Euro haben. In der Folge sinkt die Beteiligung von Siemens an Siemens Energy auf 17,1 Prozent. Bereits am 28. Juni hatte Siemens 6,8 Prozent der ehemaligen Tochter an den Pensionsfonds übertragen. Die Siemens Aktie hat in dem Zuge zwei Prozent zugelegt. Siemens Energy ist seit 9. Juli 2020 von Siemens abgespalten, seit der Börsennotierung von Siemens Energy im März 2021 trennt sich Siemens schrittweise von der Beteiligung. Pensionsfonds hält 14,8 Prozent der Anteile von Siemens Energy Die Weitergaben an den konzerneigenen Pensionsfonds ist umstritten, beispielsweise die Wirtschaftswoche schreibt von einem „buchhalterischen Trick“, der den Siemens-Aktionären schaden könnte. Im Pensionsfonds befinden sich nun insgesamt 14,8 Prozent der Anteile von Siemens Energy. Bereits in der Vergangenheit waren zehn Prozent der Aktien im Fonds gelandet, diese sind mittlerweile verkauft, wobei die Meldepflicht dazu erst ab einer gewissen Schwelle greift. Von daher ist nicht nachzuvollziehen, zu welchem Preis die Aktien veräußert wurden – am 20. Dezember 2023 hat die Aktie einen Wert von 11,45 Euro. Das Allzeithoch lag am 8. Januar 2021 bei 33,43 Euro, das Tief am 27. Oktober 2023 bei 7,49 Euro. Unterm Strich keine wirkliche Entlastung für Siemens Aus Anlegersicht sind die Anteile daher nicht gerade willkommen, Siemens wiederum dürfte zumindest auf den ersten Blick froh sein, die direkte Beteiligung weiter herunterzufahren und hatte bereits mehrfach angekündigt, weitere Anteile abstoßen zu wollen. Sollte der Pensionsfonds durch den Übertrag der Aktien Verluste machen, muss Siemens diese ausgleichen. Für die Pensionäre ist der Schritt daher irrelevant und auch Siemens hat sich etwaigen Risiken nicht entledigt, sondern sie lediglich verschoben. Für Anleger bedeutet das, dass der Pensionsfonds Teilhaber an einer Hochrisiko-Aktie ist, deren Verluste möglicherweise ausgeglichen werden müssen. Denn ob sich die Bilanz von Siemens Energy und Gamesa in absehbarer Zeit ändern wird, bleibt zumindest fraglich. Weitere Informationen will Siemens im Rahmen der Veröffentlichung der Ergebnisse zum ersten Quartal am 8. Februar 2024 mitteilen. Siemens Energy schreibt seit Jahren Milliardenverluste Siemens Energy hat Probleme mit einer eigenen Tochtergesellschaft, der spanischen Gamesa. Der Hersteller von Windkraftanlagen benötigt milliardenschwere Staatsgarantien, um das Auftragsbuch abzuarbeiten. Laut Handelsblatt soll sich der Wert auf 7,5 Milliarden Euro belaufen. Siemens sichert ein mögliches Ausfallrisiko bei der ehemaligen Tochter ebenfalls mit einer Milliarde Euro ab, will in Zukunft jedoch keine weiteren Garantien vergeben. Insgesamt sollen die Garantien aller Beteiligten 15 Milliarden Euro betragen. Siemens Energy hat im abgelaufenen Geschäftsjahr 4,6 Milliarden Euro Verlust eingefahren. Siemens-Finanzvorstand Ralf Thomas legt sein Mandat im Aufsichtsrat von Siemens Energy auch deshalb zum 26. Februar 2024 nieder. An dem Tag steht die nächste Hauptversammlung an. Die Siemens Energy Aktie hat in den letzten fünf Jahren die Hälfte an Wert verloren, seit Jahren kämpft das Unternehmen mit Problemen in der Windkraftsparte, es gibt Technik- und Kostenprobleme. Um die Mängel bei den Windturbinen in den Griff zu bekommen, wurde im September der Vertrieb von gewissen Onshore-Turbinen ausgesetzt. Immerhin läuft das Geschäft rund um Gas, Netze und Industrietransformation besser, reichen aber nicht, um die Verluste auszugleichen."
843a18ee-1b5e-4fae-a25d-bbfd48bd51e7,2023-12-21 13:42:43+00:00,"Ørsted kündigte aber an, mit der britischen Regierung die langfristig garantierte Einspeisevergütung nachzuverhandeln. Voriges Jahr hatte Ørsted den Zuschlag bekommen, doch zu einem rekordniedrigen Preis von nur 37,35 Pfund je Megawattstunde. Inzwischen hat die Londoner Regierung die Einspeisevergütung für neue Projekte um zwei Drittel auf 73 Pfund je Megawattstunde angehoben. Da sich diese Zahlen auf Preise von 2012 beziehen, dürfte die garantierte Vergütung in den nächsten Jahren in Richtung 100 Pfund gehen. Der Aktienkurs von Ørsted stieg nach der Ankündigung um rund 3 Prozent. Seit Jahresanfang ist der Börsenwert des globalen Marktführers von Offshore-Windenergie allerdings um 43 Prozent gefallen. Dies weist auf die schweren Probleme hin, in denen die Offshore-Branche steckt. Viele Länder haben in den vergangenen Jahren die Vergütung des erzeugten Stroms von Garantien auf Auktionen umgestellt, darunter auch Deutschland. Projektentwickler wie Ørsted geben den aus den Auktionen resultierenden Kostendruck auf die Turbinenhersteller weiter. Windparks in den USA aufgegeben Die „großen Vier“ Nordex , Siemens Energy , Vestas und GE teilen sich aktuell knapp 90 Prozent des Marktes außerhalb Chinas. Deren Margen sind in den vergangenen Jahren deutlich gesunken und haben lange Verluste geschrieben. Preissenkungen mussten durch massive Kosteneinsparungen kompensiert werden. Zu gestörten Lieferketten gesellen sich gestiegene Zinsen sowie Kostensteigerungen durch die Inflation, die Turbinenhersteller besonders hart treffen. Denn ein großer Teil ihrer Kosten resultiert aus dem Einkauf von Stahl, Energie und Transportdienstleistungen. Projektentwickler Ørsted hatte in der vergangenen Woche mit den Bauarbeiten für einen weiteren Offshore-Windpark in der deutschen Nordsee begonnen. Borkum Riffgrund 3 soll bis 2025 mit einer Leistung von 913 Megawatt der bislang größte Offshore-Windpark Deutschlands werden. Auch vor Norderney baut der dänische Konzern aktuell einen Windpark, Gode Wind 3. In den USA hingegen hatte er Anfang November zwei gigantische Windparks aufgegeben und auf die hohe Inflation, steigende Zinsen und Engpässe in den Lieferketten verwiesen. Im Rahmen des „Inflation Reduction Act“ wären Ørsted hohe Steuergutschriften auf die Investitionen gewährt worden. Die Projekte Ocean 1 und 2 hätten zusammen eine Kapazität von 2,5 Gigawatt gehabt."
205985ae-3402-43e6-83e4-e76fafc565a2,2023-12-21 16:39:46+00:00,Weihnachtsmarkt für den guten Zweck siemens.com
047c2510-be4b-4b2b-83c9-e167ae7b02a2,2023-12-22 10:55:17+00:00,"Im ""Schwarzbuch Börse"" fasst die Schutzgemeinschaft der Kapitalanleger die größten Pleiten und Skandale am Aktienmarkt zusammen. Welche Unternehmen im vergangenen Jahr negativ aufgefallen sind. Mal wieder eine Bank, mal wieder die Banker, das Management und die Aufsicht: Die Aktie der Schweizer Bank Credit Suisse hat 2007 bei über 90 Schweizer Franken notiert, am Ende wurden die Aktionäre mit 76 Rappen abgespeist - bei der Übernahme durch die Großbank UBS. Marc Liebscher Vorstandsmitglied der Schutzgemeinschaft der Kapitalanleger (SdK) sagt dazu: ""Es wurden nicht die notwendigen Konsequenzen aus dem Fall Credit Suisse gezogen."" Windkraft Desaster bei Siemens Energy Doch auch aus dem deutschen Aktienleitindex DAX hat es mal wieder ein Unternehmen in das Schwarzbuch der SdK geschafft: Siemens-Energy mit dem Windkraft-Desaster. Die Aktie hat 2023 für einen DAX-Wert ein seltenes Kunststück gleich zweimal hinbekommen: einen Tagesverlust von rund einem Drittel. Siemens Energy ist weiter im deutschen Leitindex. Gibt es da nun Hoffnung? ""Ob es Hoffnung gibt bei Siemens Energy, das kann leider im Moment nur der Vorstand von Siemens Energy beantworten, weil allein die - so hoffen wir - Einsicht haben in das, was bei ihrer Tochter Gamesa schiefläuft"", sagt Liebscher. Und auch ein ehemaliger DAX-Konzern, der frühere bayerische Zahlungsdienstleister Wirecard, hat es nach 2020 nochmals ins Schwarzbuch geschafft. ""Am meisten überrascht hat uns die schleppende Aufarbeitung des Wirecard-Skandals"", so der SdK-Vorstand. Skandale, Missstände und Pleiten - Wirecard ist der bislang größte Wirtschaftsskandal der Bundesrepublik. Auf allen Ebenen komme die Aufarbeitung nicht schnell genug voran, kritisiert das neue Schwarzbuch. ""Geringe Kapitalmarktkompetenz bei Behörden"" Auch auf weitere Enttäuschungen am Aktien- und am Anleihemarkt weist die SdK hin - insbesondere bei Anleihen von mittelständischen Unternehmen. So prangert die Schutzgemeinschaft Behördenversagen an. ""Allgemein haben wir bei den deutschen Behörden ganz geringe Kapitalmarktkompetenz. Sei es bei Gerichten, sei es bei Staatsanwaltschaften"", sagt Liebscher. ""Wann immer wir Verwerfungen am Kapitalmarkt haben, sind Gerichte, Staatsanwaltschaften, aber auch die Aufsichtsbehörden wie die BaFin dem nicht gewachsen."" Wobei neue Gesetze nicht immer helfen. So findet sich das ""StaRug"" im Schwarzbuch - das Gesetz über den Stabilisierungs- und Restrukturierungsrahmen für Unternehmen. Für Privatanleger bringt es aus Sicht der SdK auf Druck der Finanzlobby Risiken. ""Das StaRug gibt sinnvolle Möglichkeiten Unternehmen zu restrukturieren, aber es kann auch missbraucht werden, um Aktionäre intransparent und gegen ihren Willen aus dem Unternehmen zu drängen. Und wir befürchten, dass das 2024 noch massiv zunehmen wird."" Geldanlage in ETFs mindert Risiken Dennoch lautet das wichtige positive Fazit von SdK-Vorstandsmitglied Marc Liebscher. ""Man darf nicht anhand dieser Einzelkatastrophen auf die Aktie und den Aktienmarkt insgesamt schließen. Das ist auch ein Fehler, den die Deutschen sehr gerne machen."" Von daher rät die Schutzgemeinschaft der Kapitalanleger auch dazu, das eigene Geld breit gestreut in Fonds oder ETFs (Exchange Traded Funds) anzulegen - gerade am Anfang, bevor man dann in gewissem Rahmen auch Einzelaktien oder Anleihen ins Depot nimmt. Der Tipp: Anleger sollten sich immer Informieren und bei den eigenen Investments am Ball bleiben."
06e1c1dc-5ad4-46be-8e2b-dc14a8838c77,2023-12-24 05:30:13+00:00,"Die Welt kennt ihn als ""Märchenkönig"". Doch König Ludwig II. war mehr als das. Er setzte auf modernste Technik in seinem Königreich und förderte dort ansässige Unternehmen. So entstanden in Bayern etwa das erste fest installierte Kraftwerk der Welt sowie das erste elektrisch beleuchtete Theater in Deutschland. Zum Artikel ""Der Märchenkönig: Ludwig II. – sein Leben, seine Zeit"" Ludwigs Prunkschlitten: Eine technische Sensation Im Marstallmuseum in München-Nymphenburg sind Beispiele zu sehen, wie Ludwig II. Bayern in die Moderne geführt hat. So schlummert etwa im Prunkschlitten des Märchenkönigs eine technische Sensation. Das Fahrzeug verfügt über eine elektrische Beleuchtung – vermutlich die erste der Welt. Eingebaut, kurz nachdem Thomas Edison die Glühbirne zum Patent angemeldet hatte. ""Muss wie ein Ufo ausgesehen haben"" ""Die Batterie war im Kasten unter der Sitzbank untergebracht"", erklärt Heinrich Piening von der Bayerischen Schlösserverwaltung. Auf der Rückseite des Fahrkastens gab es einen Schalter und ein sogenanntes Potentiometer, um die Helligkeit einstellen zu können. ""Die Birnen waren sehr empfindlich, sie müssen sehr hell gewesen sein."" Ein Ölgemälde im Marstallmuseum zeigt, wie das Ganze wohl gewirkt haben muss: Ludwig gleitet durch die verschneite Landschaft des Graswangtals bei Linderhof – im grellen Licht der elektrischen Beleuchtung. ""Es gibt Beschreibungen, dass der König damit gefahren ist, und das muss wie ein Ufo ausgesehen haben"", sagt Piening. Wie durch ein Wunder hat eine originale Glühbirne dieses Schlittens Revolution und zwei Kriege überstanden. Sie befindet sich mittlerweile in Regensburg, im Haus der Bayerischen Geschichte, und ist sogar noch funktionstüchtig. Ebenfalls dort: ein Generator aus Ludwigs Schloss Linderhof. Er lieferte seinerzeit den Strom für die Beleuchtung der Venusgrotte, die der König dort bauen ließ – mit allem, was an Technik in der damaligen Zeit möglich war. Dafür beschäftigte er die bekanntesten Forscher und Ingenieure des 19. Jahrhunderts. Es entstand das erste fest installierte Kraftwerk der Welt. Mitten im Gebirge eine technische Meisterleistung, von der kaum einer seiner Untertanen etwas ahnte. Zu sehen ist von dem Kraftwerk heute fast nichts mehr. Denn in den 30er-Jahren des vergangenen Jahrhunderts wurden die Maschinen herausgerissen und verschrottet. Ludwig II. – ein Vorreiter in Sachen Beleuchtung Ludwig II. setzte auf die modernste Technik in seinem Königreich und förderte damit auch hier ansässige Unternehmen, wie Christoph Frank vom Siemens Historical Institute erklärt: ""Das hat sich ausgewirkt auf alle Firmen, die im elektrotechnischen Bereich tätig waren. Nicht nur auf Siemens, sondern auch auf die anderen Firmen. Ludwig war mit dieser Beleuchtung seiner Grotte im Endeffekt eine Art Vorreiter."" Dieses Beispiel zeige, was möglich sei, ""wenn ein interessierter Kunde mit einem Anbieter von technologischen Lösungen zusammenarbeitet. Und es war auch eine Demonstration dessen, was technisch machbar ist."" Das erste elektrisch beleuchtete Theater Deutschlands Nur wenige Jahre später ist es wiederum Ludwig II., der diese Technologie für die Allgemeinheit einsetzt. Er will das Münchner Nationaltheater elektrifizieren. Nicht mit Kohlebogenlampen, sondern mit den wesentlich leiseren Glühbirnen, wie auf dem Programmzettel der Premiere im Jahre 1885 stolz vermerkt ist. Ludwig II. will Bevölkerung für neue Technologien begeistern Bayern, damals noch überwiegend ein Agrarstaat, sollte beim Fortschritt ganz vorne mitspielen. Deshalb gründet Ludwig II. die heutige Technische Universität München (TU), kümmert sich persönlich um die hochkarätige Besetzung der Lehrstühle und beruft große Forscher an die TU. Unter ihnen ist zum Beispiel Carl von Linde, der Erfinder der künstlichen Kühltechnik und Gründer des gleichnamigen Weltunternehmens. Noch heute profitieren viele Branchen von Lindes Erfindung, etwa das Brauwesen. Auf Schloss Kaltenberg leitet ein Nachkomme Ludwigs II. die König-Ludwig-Brauerei: Prinz Luitpold von Bayern. Für den bayerischen Prinzen ist es kein Zufall, dass Ludwig II. Forscher und Erfinder angeworben hat: ""Er hat erkannt, was man mit Technik machen, wo sie zu einem angenehmeren Leben führen oder zur Umsetzung von Zielen dienen kann. Da hat er ein extrem gutes Gespür gehabt."" Auch wenn weltweit vor allem die Königsschlösser bekannt sind: Was Ludwig II. an Technik eingeführt hat, prägt Bayern nach wie vor. Einige Unternehmen, die er damals gefördert hat, gehören heute zu den Tragsäulen der bayerischen Wirtschaft."
0118643a-6ba3-4fcb-bdc5-368fc7d7de12,2023-12-25 09:44:05+00:00,"Die ersten Fragen gehen zurück in die Kindheit, in die Zeit vor 60 Jahren im Bayerischen Wald, als er noch der kleine Josef Käser war und nicht Joe Kaeser, der überall bekannte Topmanager und Welterklärer. Den amerikanisierten Namen hat er erst viel später angenommen, als er schon längst auf dem Weg nach oben war im Siemens-Konzern."
