fec97439-7aa9-47e8-97f6-e2f2a18dfa93,2023-12-11 09:34:26+00:00,"„Ein Kamerahandy? Brauche ich nicht. Ein Handy ist zum Telefonieren da; eventuell noch um SMS zu schreiben. Außerdem macht die Kamera total schlechte Bilder.“ So in etwa klang ein Skeptiker Ende der 90er-Jahre, als er gegen den unvermeidlichen Fortschritt des Handys rebellierte. Und nun? Aus dem Handy ist ein Computer im Hosentaschenformat geworden. Die Smartphone-Kamera hat die kompakte Digitalkamera ersetzt und WhatsApp die SMS. Das erste Handy Vor mehr als 30 Jahren machte Motorola mit dem DynaTac 8000X den Anfang und brachte das erste Handy auf den Markt. Das Telefonieren, wie man es bis dahin kannte, wurde im Jahr 1983 neu erfunden. Plötzlich war man dazu in der Lage, auch von unterwegs aus Freunde und Verwandte zu erreichen. Das DynaTac 8000X stets bei sich zu haben, war allerdings eine Herausforderung: Das „Handy“ war mit Maßen von 33 x 4,5 x 8,9 Zentimetern und einem Gewicht von 800 Gramm nicht gerade handlich. Im Vergleich: Aktuelle Smartphones sind im Schnitt um 90 Prozent flacher und bringen ein Achtel des Gewichts auf die Waage. Trotz des vergleichsweise hohen Preises von knapp 4.000 US-Dollar verkaufte Motorola innerhalb eines Jahres über 300.000 Geräte. 1992, knapp zehn Jahre später, erhielt auch Deutschland sein erstes Handy. Mit 520 Gramm war das Motorola International 3200 etwas leichter als das DynaTac 8000X und unterstützte als eines der ersten Handys den GSM-Standard. Anfangs war es, inklusive Vertrag bei D1 oder D2, ab etwa 3.000 D-Mark erhältlich. Rechnet man die Inflation mit ein, wären das heutzutage in etwa 2.500 Euro. Das erste Klapphandy Im Jahr 1989 brachte der damalige Innovator Motorola mit dem MicroTac das erste Klapphandy auf den Markt. Eine GSM-Variante kam 1994 nach Deutschland. Der Marktpreis lag damals bei 3.500 US-Dollar; heute über 6.000 Euro. Das erste Slider-Handy Gut zehn Jahre nachdem das erste Klapphandy der Welt vorgeführt wurde, brachte das deutsche Unternehmen Siemens mit dem SL10 im Jahr 1999 das erste Handy mit Slider-Funktion auf den Markt. Das 129 x 50 x 26 Millimeter große Gerät hatte ein Farbdisplay mit einer Auflösung von 97 x 54 Pixeln. → Kanntest du sie alle? Diese 5 geheimen Funktionen hat auch dein Smartphone Das erste Handy mit Farbdisplay Lange Zeit waren Handy-Displays monochrom, was bedeutet, dass lediglich zwei Farben angezeigt wurden – meist Schwarz und Grün. Diese Technik kommt heutzutage noch bei vielen Taschenrechnern zum Einsatz, nicht aber in Handys. Bereits 1997 stellte Siemens mit dem S10 das erste Handy mit einem farbigen Display vor. Es zeigte zwar nur vier verschiedene Farben an, jedoch konnten viele Hersteller erst Jahre später gleichziehen. Vier Jahre später kam mit dem Ericsson T68 das erste Handy mit einem echten Farbdisplay auf den Markt, welches 256 Farben darstellen konnte. Das erste Kamerahandy Im Jahr 1999 wurde klar, dass ein Handy in Zukunft nicht nur zum Telefonieren und SMS schreiben verwendet, sondern auch als Kamera zweckentfremdet wird. Das erste Handy, das Fotos in einer bescheidenen Qualität aufnehmen konnte, hieß „Camesse“, kam von Toshiba und nur in Japan auf den Markt. → Mit dem Smartphone fotografieren: 10 Tipps für das perfekte Foto Erst drei Jahre später, nachdem Hersteller wie Ericsson oder Motorola Handys mit ansteckbaren Kameras gezeigt hatten, hatte auch Deutschland mit dem Nokia 7650 sein erstes Handy mit integrierter Kamera. Das Telefon vereinte eine ganze Reihe neuer Technologien in einem mit 114 x 56 x 26 Millimetern dicken Slider-Gehäuse. Das Display erreichte eine Auflösung von damals beachtlichen 176 x 208 Pixeln bei 4.096 Farben. Das Sharp GX 30 war das erste Fotohandy mit einer 1-Megapixel-Kamera. Die Kamera in Handys entwickelte sich in den darauffolgenden Jahren von einer lauen Brise zu einem Tornado. Heute haben viele Smartphones sogar vier oder fünf Objektive mit verschiedenen Brennweiten. Das erste Handy mit MP3-Player Um den Platz des ersten Handys mit MP3-Player streiten sich gleich zwei Handy-Modelle: Sowohl das Samsung M100 als auch das Siemens SL45 erlaubten es Ende 2000, Musik über einen Kopfhörer direkt vom Handy abzuspielen. Das SL45 verfügte dabei als erstes Handy der Welt über eine austauschbare 32 Megabyte große MMC-Speicherkarte. Das machte es einfacher, neue Lieder vom PC auf das Handy zu übertragen. Samsung hatte den Speicher fest verbaut. Beide Handys glänzten übrigens mit einer technischen Besonderheit: Die Kopfhörer enthielten gleichzeitig ein Mikrofon, um sie als Freisprecheinrichtung zu verwenden. Das erste Handy mit integrierter Antenne Wieder war es Nokia, das die Handywelt um eine kleine aber entscheidende Sache bereicherte: Das Nokia 3210 kam 1999 auf den Markt und war das erste kommerziell erfolgreiche Handy ohne externe Antenne. Die Möglichkeit, das Aussehen durch austauschbare Abdeckschalen (von Nokia „Xpress-on“ genannt) individuell zu verändern, machte das 3210 ebenfalls zu einem der beliebtesten Modelle seiner Zeit. So konnte man zwar bereits beim Vorgänger, dem Nokia 5110, schon die Frontschale austauschen, beim 3210 war aber auch die Rückschale austauschbar. Das erste Handy mit Browser Um auch von unterwegs aus auf dem aktuellen Stand zu sein, wurde das Internet in kleinen Schritten auf das Handy gebracht. Dabei entbrannte durch den Internet-Boom Ende der 90er-Jahre ein Wettrennen um das erste WAP-kompatible Handy auf dem deutschen Markt. Das erste Handy mit WAP-Zugang, das in Deutschland in den Handel kam, war schließlich das Siemens S25. Leider zu früh, hatte es doch den falschen WAP-Standard 1.0 an Bord, der nicht mehr unterstützt wurde. Das erste Handy mit WAP-Browser des Standards 1.1 war das Nokia 7110, das auch in anderer Hinsicht Kunden begeistern konnte: Es war das erste Handy mit einem automatischen Slider, der die Tastatur per Tastendruck freigab. Das erste Handy mit Bluetooth Nachdem Hersteller einige ihrer Handys mit Infrarotschnittstellen ausgestattet hatten, war es Ericsson im Jahr 2001, die mit dem T39 das erste Handy mit Bluetooth auf den Markt brachten. Damals hatte ein High-End-Handy Ausstattungsmerkmale wie HSCSD, GPRS, eine Infrarotschnittstelle, E-Mail-Funktionalität und WAP. Das erste Smartphone Offiziell wird die Erfindung des ersten Smartphones IBM zugesprochen. 1992 wurde auf der Computermesse Comdex in Las Vegas das „Simon“ vorgestellt. Es besaß einen Touchscreen und viele wichtige Organizer-Funktionen. Eine Weltneuheit, die aber zum damaligen Zeitpunkt kaum Zuspruch fand. Zu teuer und zu unnütz kam den potenziellen Kunden das Smartphone damals vor. Man hatte mit dem Gerät zwar ein Telefon, PDA und Pager stets dabei und konnte sogar Faxe empfangen, allerdings hatte das Simon Ausmaße von 200 x 64 x 38 Millimetern und brachte 510 Gramm auf die Waage. Zudem schreckte der Preis von rund 900 US-Dollar (heute etwa 1.400 Euro) die Käuferschaft ab. → Smartphone mit guter Kamera für 1.000 Euro? So viel musst du wirklich ausgeben Gleichzeitig war das Simon auch das erste Handy, das über einen Touchscreen bedient werden konnte. 2002 gelang es erstmals Ericsson, im P800 einen Farb-Touchscreen zu verbauen, ehe LG im Jahr 2007 mit dem Prada das erste Smartphone mit einem kapazitiven Touchscreen vorstellte. Der Begriff „Smartphone“ wurde erst fünf Jahre später (1997) von Ericsson kreiert, als das schwedische Unternehmen sein Konzept „GS88 Penelope“ als „Smart Phone“ beschrieb. Im Jahr 1996 brachte Nokia mit dem 9000 Communicator das erste Smartphone, das für die breite Masse gedacht war. Die Communicator-Reihe etablierte sich schon nach kurzer Zeit als eine eigene Gattung. Das erste Handy mit GPS-Modul Um unterwegs die Orientierung zu behalten, kombinierte der finnische Hersteller Benefon ein Handy mit einem GPS-Empfänger. Das Benefon ESC! wurde 1999 vorgestellt und stieß vor allem im Outdoor-Bereich auf Zuspruch. Das Gerät war 129 x 49 x 23 Millimeter groß und 150 Gramm schwer. Mit einem Lithium-Ionen-Akku erreichte man eine Standby-Zeit von bis zu zehn Tagen. Zur Standardausrüstung gehört ein Daten- und Fax-Modem. Das erste iPhone Im Jahr 2007 präsentierte Steve Jobs das erste iPhone. Zugleich war es Apples Start in das Handysegment. Heute ist das iPhone das Zugpferd des Unternehmens. Die Reihe gehört zu einer der beliebtesten weltweit. Die Modelle der iPhone-6-Generation wurden bis heute über 222 Millionen Mal verkauft. Damit belegt Apple den ersten Platz in der Liste der meistverkauften Smartphones mit Touchscreen aller Zeiten. Das erste Smartphone mit Android"
aac8515c-9b56-41c8-803b-6475df1cb097,2023-12-12 11:00:00+00:00,"CAPITAL: Herr Hüttmann, der Dax-Konzern SAP will Mitarbeitende stärker nach Leistung bewerten und sogar Noten geben. Ist das zeitgemäß? AXEL HÜTTMANN: Dieses Konzept kommt sicherlich aus dem vergangenen Jahrtausend, aber es ist auch heute noch absoluter Standard. SAP kehrt lediglich zu etwas zurück, was in den meisten Unternehmen in Deutschland ohnehin existiert. Deswegen bin ich erstaunt, wie viel Diskussion es jetzt darum gibt. Die Welle von Emotionen, die da losgebrochen ist, wirkt fast wie eine Art Glaubenskrieg. Nur weil ein Leistungssystem Standard ist, muss es nicht sinnvoll sein. Ich bin überzeugt, dass es nicht grundsätzlich schlecht ist. Denn es zwingt zu ehrlicher Kommunikation mit den Mitarbeitenden. Früher haben Manager lange im stillen Kämmerlein diskutiert, wer befördert wird. Die Kriterien, an denen Leistung bemessen wurde, waren oft unklar. Auch heute können sich Menschen in einem Gespräch noch missverstehen. Eine Bewertung ist hingegen eindeutig, auch wenn sie manchmal schmerzhaft ist. Sie eröffnet mir als Mitarbeiter auch die Chance, zu lernen und zu wachsen. Welche standardisierten Leistungsbewertungssysteme sind heute üblich in deutschen Unternehmen? SAP wendet jetzt ein individuelles System an, bei dem Einzelpersonen relativ holzschnittartig bewertet werden. Es gibt Systeme auf kollektiver Ebene, wo man als Team bestimmte Ziele erreichen muss. Dabei werden alle gleich bewertet, auch wenn einer vielleicht mehr zum Erfolg oder Misserfolg beigetragen hat als ein anderer. Andere Konzepte arbeiten mit strukturierten Fragenkatalogen, die zunächst von den Mitarbeitern und dann von den Führungskräften bearbeitet werden. Davon geht der Trend allerdings weg, weil es oft zu Pseudodiskussionen führt. Am Ende muss schließlich ein aggregierter Wert rauskommen. Das System von SAP soll Mitarbeitende offenbar in drei Klassen einteilen: „Performer“, „Achiever“ und „Improver“. Welche anderen deutschen Unternehmen machen das ähnlich? Ich schätze, dass 70 Prozent der Dax-Unternehmen irgendeine Art der Leistungsbeurteilung haben, also Mitarbeitende nach Potenzial und Performance bewerten und in eine Matrix einsortieren. Die Skalen unterscheiden sich vielleicht, aber die Logik der einschlägigen Softwaresysteme, wie Success Factors und Workday, funktioniert ähnlich. Die verkauft SAP ja sogar selbst. Bisher hat SAP bewusst auf standardisierte Leistungen verzichtet. Warum jetzt die Kehrtwende? Das kann ich nicht beurteilen. Aber die Masse der Mitarbeitenden bei SAP macht einen ordentlichen Job, 90 Prozent werden ihre Erwartungen voraussichtlich erfüllen. Es geht darum, die Personen herauszufinden, die außergewöhnlich gute Leistungen erbringen und die, mit denen man nicht zufrieden ist. Siemens ist beispielsweise ein anderes großes deutsches Unternehmen, das mit sogenannten Growth Talks, also Wachstumsgesprächen, qualitativ bewertet. Bei Google, Apple und anderen im Silicon Valley ist das genauso. Eine quantifizierte Beurteilung gibt es dann aber trotzdem einmal im Jahr, damit man weiß, wer welche Gehaltserhöhung bekommt oder befördert werden kann. Und aus unternehmerischer Sicht ist das vollkommen nachvollziehbar. Es geht bei der Performance-Bewertung also auch darum, besonders gute Mitarbeitende zu identifizieren? Ja, das ist eine Seite der Beurteilung: Wen befördere ich? Wem gebe ich Projekte, die erfolgskritisch sind? Was bei SAP letztlich genau an die Bewertung geknüpft sein wird, also ob das Boni, Karrierechancen oder etwas anderes ist, weiß man noch nicht. Klar ist aber, dass das Unternehmen entwicklungsorientiert denkt und das muss für mich als Mitarbeitender nicht kritisch sein. Wer am unteren Ende der Skala landet, soll Weiterbildungsangebote bekommen. Inwiefern dient das Modell aber auch dazu, die Leistungsschwachen auszusortieren? Theoretisch macht das Modell das möglich, praktisch ist es aber nur bedingt zum Aussortieren geeignet. In Deutschland könnte ich auf dieser Basis niemanden entlassen, dafür müssen schon massive Verfehlungen für vorliegen. Der SAP-Betriebsrat hält es für sehr problematisch, eventuell vermeintliche „Minderleister“ zu stigmatisieren. Würden Sie die Einschätzung teilen? Aus meiner Sicht geht es vor allem darum, wie man über die Bewertung redet und welche Konsequenzen daraus folgen. Dass jemand die Erwartungen nicht erfüllt, kann ja unterschiedlichste Gründe haben: im persönlichen Umfeld, im Team, vielleicht sind die Erwartungen gar nicht klar oder es ist wirklich ein Haltungsthema. Für den einzelnen Betroffenen kann das eine kritische Situation sein, aber häufig merkt der Rest der Belegschaft ohnehin, wer mitzieht und wer sich eher zugunsten anderer ausruht. Wenn dann die Richtigen identifiziert werden, finden das die, die sich anstrengen eher hilfreich als schädlich. Einige könnten sich unter Druck gesetzt fühlen, mehr Leistung zu bringen. Der Betriebsrat hat bereits davor gewarnt, das Arbeitsklima könne sich verschlechtern. Es wird mit Sicherheit Menschen geben, die die neue Bewertung als stressig empfinden. Aber es gibt so viele Unternehmen, die dieses System haben und bei denen das Betriebsklima gut ist. Das Entscheidende ist die kulturelle Wirkung von so einer Maßnahme und dass man regelmäßiges Feedback etabliert. Dann muss am Ende niemand von einer Bewertung überrascht sein. Was bedeutet der Kurs der „Performance-Kultur“ für die Außenwirkung des Unternehmens, gerade mit Blick auf die Attraktivität für Fachkräfte und junge Bewerber? Nach meinem Gefühl wird die Attraktivität von SAP als Arbeitgeber kaum darunter leiden. Wenn ich Leistung als negativ empfinde und davon gestresst bin, dann schreckt mich das vielleicht ab. Aber eigentlich möchte doch jeder erfolgreich im Job sein und in einem erfolgreichen Unternehmen arbeiten. Ich sehe in dem Kurs eher ein klares Zeichen an Bewerber: Wer Dienst nach Vorschrift machen und bloß keinen Stress haben möchte, ist für ein agiles Softwareunternehmen wahrscheinlich nicht der Richtige."
d87fb715-3278-48cd-9824-ca3d92ca4703,2023-12-12 15:15:26+00:00,"Erlangen. Das Forschungsparadigma war lange eindeutig. „Wir haben umgedacht und statt mit größer und stärker mit weniger mehr erreicht“, erklärt Stephan Biber fast philosophisch. Der Elektrotechnikingenieur spricht von Magnetresonanztomographen (MRT), umgangssprachlich auch „die Röhre“ genannt. Die gibt es seit vier Jahrzehnten, wovon eine Hälfte der Weltbevölkerung aber nur vom Hörensagen weiß. Denn bislang waren die wuchtigen Geräte der reicheren Hälfte der Menschheit vorbehalten. Um das zu ändern, haben Biber, sein ebenfalls bei Siemens Healthineers forschender Kollege David Grodzki und der Erlanger Uniprofessor Michael Uder ein völlig neues MRT-Gerät für alle entwickelt. Dafür hat das Forschertrio gerade den Deutschen Zukunftspreis erhalten. Weiterlesen nach der Anzeige Bisherige MRT, die vom Meniskusriss bis zum Lebertumor viele Verletzungen und Krankheiten in einem menschlichen Körper sichtbar machen, hatten mehrere Nachteile. Zum einen passen sie größenbedingt durch keine normale Kliniktür. So manches Gebäude musste schon um einen MRT herumgebaut werden. Zum anderen ist die Röhre mit Durchmessern von 60 bis 70 Zentimetern so klein, dass ängstliche Kinder und klaustrophobische Erwachsene davor zurückschrecken. Vor allem sind die Geräte aber in Anschaffung und Unterhalt sehr teuer. KI macht’s möglich Das alles hat das Forschertrio auf einen Schlag geändert und zwar per revolutionärem Denkansatz. „Das Herzstück eines MRT ist der Magnet, und den haben wir gegen den Trend kleiner, also schwächer gemacht“, sagt Grodzki. Eigentlich hätte das auf Kosten der Bildqualität gehen müssen. Hat es aber nicht. „Wir konnten das durch den Einsatz von Künstlicher Intelligenz ausgleichen“, erklärt Biber. Die Idee war riskant. „Als wir angefangen haben, gab es eine solche KI noch nicht“, verrät Kollege Grodzki. Weiterlesen nach der Anzeige Das war vor rund zehn Jahren. Intern alle vom Forschungsansatz zu überzeugen sei die Hauptschwierigkeit gewesen, erinnern sich beide Siemensianer. Vor allem dem Management sei es bei vielen Millionen Euro Entwicklungskosten bei langer Laufzeit nicht leichtgefallen, grünes Licht zu geben. Locken konnte das Forschertrio mit neuen, bisher verschlossenen Märkten. Jetzt 80 Zentimeter Röhrendurchmesser entschärften das Gefühl von Angst und Klaustrophobie. Auch übergewichtige Wohlstandsmenschen passen nun ins Gerät. In der Anschaffung ist das immer noch mehrere Hunderttausend Euro kostende MRT jetzt 40 Prozent günstiger als bisher handelsüblich, verrät Biber. Auch die Verbrauchskosten wurden drastisch reduziert. Bisherige MRT brauchen eine Kühlung mit 1000 Litern flüssigem Helium. Fällt der Strom aus, was im globalen Süden häufiger passiert, verdampft das teure und mancherorts kaum zu beschaffende Helium. Auch im Jemen oder Sambia einsetzbar „Unser MRT braucht statt tausend unter einem Liter Helium“, betont Biber und nennt noch einen weiteren wichtigen Vorteil. Bisher seien MRT kompliziert zu bedienen gewesen und Fachkräftemangel global ein Problem. „In wenigen Stunden kann man jedem erklären, wie man unser Gerät bedient“, versichert der 47-Jährige. Weiterlesen nach der Anzeige Als Folge aller Neuerungen steht das revolutionäre MRT, das erst seit Mitte 2021 am Markt ist, heute schon im Jemen oder Sambia. In dem südafrikanischen Land ist es nach Wissen der Forscher das erste MRT überhaupt, im Jemen das erste neue Gerät seit einem Jahrzehnt. Hunderte sind global bestellt. Seit die Forscher für den Deutschen Zukunftspreis nominiert wurden, den Bundespräsident Frank-Walter Steinmeier überreicht hat, steige die Nachfrage exponentiell, verrät Grodzki. Davon profitiert auch Siemens Healthineers, das bei bildgebendem Großgerät mit einem Weltmarktanteil von 37 Prozent global führt. Demokratisierung der Medizintechnik Auf den Forschungsstandort Deutschland lassen die Siemensianer nichts kommen. „Hier haben wir ein MRT entwickelt, das Menschen in der ganzen Welt helfen kann“, sagt Biber sichtlich stolz. Mehrere Hundert Experten vor allem aus Erlangen, aber auch anderen Standorten in Großbritannien oder China haben in der Spitze zugearbeitet. Der erste Prototyp im Praxiseinsatz wurde in den USA getestet. Über 50 Patente stecken im „MRT für alle“. Gewonnene Erkenntnisse wie einfache Benutzerführung oder KI-Unterstützung wollen die Siemensianer nun auch auf anderes medizintechnisches Großgerät übertragen und damit etwas forcieren, das Konzernchef Bernd Montag die Demokratisierung der Medizintechnik nennt. Einlösbar machen ein solches Versprechen Forscher wie Grodzki, Biber und Uder."
3c8ff959-ef40-4224-9fa6-57d3a3295c7a,2023-12-13 11:45:00+00:00,"Hochrangige Vertreter der Landespolitik haben die Verantwortlichen von Outokumpu Nirosta in Krefeld bereits von den Vorzügen des nachhaltig produzierten Stahls Circle Green überzeugen können. Nun kommt der erste Großkunde hinzu, der die Vorzüge des nachhaltigen Edelstahls für sich entdeckt hat – das deutsche Technologieunternehmen Siemens. In Krefeld wird der finnische Stahl nach Kundenwünschen veredelt. Das heißt, die Edelstahlbleche werden in der Oberfläche und in den Maßen nach Kundenerfordernis bearbeitet."
a5633244-9dda-43b4-9c16-5eef6d6ecaaf,2023-12-14 06:02:33+00:00,"Nürnberg (dpa) - Wer die Werbeagentur von Magnus Hetz in Nürnberg betritt, muss erstmal durch die Kontrolle. Sobald sich die Tür öffnet, kommt die Französische Bulldogge Klärchen aufgeregt angeschossen, beschnuppert den Besuch und ganz besonders dessen Taschen - es könnte sich schließlich etwas Leckeres darin verstecken. Dadurch sei das Eis meist schnell gebrochen, erzählt Hetz. „Da hat man sofort ein Gesprächsthema.“ Seit sieben Jahren ist Klärchen als Bürohund in der Agentur und nicht nur deren Aushängeschild in den sozialen Medien. „Sie ist sowohl Entspannungs- als auch Sicherheitsmanagerin“, sagt Hetz lachend. Neben den Taschenkontrollen hilft sie den Mitarbeitenden auch bei der Arbeit - zumindest indirekt. „Wenn mir keine Idee kommt, schnappe ich mir Klärchen und gehe mit ihr eine Runde an der frischen Luft“, erzählt Mitarbeiterin Anette Rehm. Und wenn sie im Winter am Schreibtisch sitze, klettere Klärchen auf ihren Schoß und wärme sie. Der aktuelle Stand Natürlich ist die Agentur von Hetz eher klein und Klärchen seine Hündin - was aber Zufall sei und nicht Chefprivileg, betont Hetz. Doch Beispiele wie diese gibt es dem Bundesverband Bürohund zufolge inzwischen etliche in Deutschland und das auch in großen Firmen. „Es ist nicht mehr ganz so exotisch, Hunde am Arbeitsplatz anzutreffen wie es früher einmal war, aber sie sind auch keine Selbstverständlichkeit in den Büros“, sagt Nadia Wattad vom Deutschen Tierschutzbund. Dieser wirbt jedes Jahr mit dem Aktionstag „Kollege Hund“ für ein Miteinander von Mensch und Vierbeiner bei der Arbeit. Haustier-Boom hat auch Folgen für die Arbeitgeber Während der Corona-Zeit haben sich viele Menschen einen Hund angeschafft, weil sie im Homeoffice mehr Zeit für ein Haustier hatten. Und das hat nun Folgen für die Unternehmen. „Nach der Pandemie hatten wir eine Verdreifachung der Kontaktaufnahmen vor allem von Unternehmen, darunter auch viele weltweit tätige Konzerne“, sagt Markus Beyer, Vorsitzender des Bürohunde-Verbands. Auch der Arbeitskräftemangel führt seiner Ansicht nach zu einem Umdenken bei den Unternehmen. „Die Personalabteilungen haben registriert, dass die Genehmigung, den eigenen Hund mitzubringen, hilfreich bei der Mitarbeiterbindung und beim Recruiting sein kann.“ So prüft Siemens das Thema gerade an verschiedenen Standorten deutschlandweit. „Grundsätzlich sehen wir in Bezug auf Hunde im Büro einen erhöhten Bedarf, weil unsere Mitarbeitende dies vermehrt nachfragen“, teilte eine Sprecherin mit. Möglich wäre zum Beispiel ein Hunde-Büro, in dem die Angestellten Arbeitsplätze für sich und ihren Hund buchen könnten. Auch über die Einrichtung einer Tagesstätte für Hunde werde parallel nachgedacht. Betriebsvereinbarung und Chief Dog Officer Einen Anspruch darauf, seinen Hund mit ins Büro zu nehmen, gibt es nicht. Wenn Vorgesetzte und das Team zustimmten, sollte eine Betriebsvereinbarung getroffen werden, in der die Rechte und Pflichten aller Beteiligten stehen, empfiehlt Beyer. Wichtig sei auch eine hundefreie Zone für Mitarbeitende, die Angst vor Hunden haben oder an Allergien leiden. Idealerweise ernenne das Unternehmen einen Chief Dog Officer, also quasi eine oder einen hauptamtlichen Hundebeauftragten - so jemanden wie Kerstin Drobniewski. Eigentlich ist Drobniewski Sachbearbeiterin beim Medienkonzern Axel Springer in Berlin, seit zwölf Jahren kümmert sie sich aber zusätzlich um die Bürohunde. Etwa 250 seien es aktuell, sagt Drobniewski. „Die Nachfrage hat etwas nachgelassen. Der Hype war vor zwei Jahren.“ Trotzdem seien täglich 50 bis 80 Hunde im Haus. Hausausweis für Hunde Einlass erhalten aber nur die, die einen Hausausweis besitzen - und dafür müssen Frauchen oder Herrchen einen Antrag bei Kerstin Drobniewski stellen, für den unter anderem Impfpass, Haftpflichtversicherung und die Zustimmung des Teams Voraussetzung sind. Danach schaue sie sich den Hund genauer an und mache verschiedene Tests, erläutert Drobniewski. Die Halterin oder der Halter müssen dem Hund zum Beispiel ein Leckerli aus dem Maul holen oder ihn zu sich rufen, während ihn die Chief Dog Officer mit einem Plüschtier ablenkt. Die Vorteile „Studien belegen, dass Hunde am Arbeitsplatz die Zufriedenheit der Mitarbeitenden, deren Motivation und das Arbeitsklima fördern“, sagt Tierschutzbund-Sprecherin Wattad. Das gilt aber nicht nur für die Besitzerinnen und Besitzer der Hunde. „Auch Mitarbeitende ohne Hund profitieren von der Anwesenheit, weil sie den Hund streicheln können oder sich bei Spaziergängen anschließen“, sagt Beyer. Das reduziere Stress und unterbreche das ständige Gedankenkarussell. „Man kommt runter“, bestätigt Drobniewski. Auch die Hunde profitieren Hunde wollen nach Angaben des Deutschen Tierschutzbunds so viel Zeit wie möglich mit ihren Bezugsmenschen verbringen. Insofern sei es ideal, wenn sie diese ins Büro begleiten könnten - sofern dabei auf die tierischen Bedürfnisse Rücksicht genommen werde, sagt Expertin Wattad. Wenn ein Hund vor dem Büro und in der Mittagspause ausreichend Bewegung bekomme, verbringe dieser tagsüber lange Zeit mit Ruhen und Schlafen. Aber: „Nicht jeder Hund ist als Bürohund geeignet“, meint Beyer vom Bürohunde-Bundesverband. Das sei vor allem abhängig von der Persönlichkeit des Hundes und seinem Verhältnis zum Menschen. Probleme mit Hunden hat es bei Axel Springer jedenfalls bisher nicht gegeben. „Wir haben hier noch nie Ärger gehabt und noch nie eine Beschwerde“, sagt Drobniewski. Sie selbst beobachte regelmäßig Hunde, die kurz vor dem Bürogebäude an der Leine zerrten, weil sie schnell hineinwollten. „Die fühlen sich wohl hier“, meint sie. © dpa-infocom, dpa:231214-99-292134/2"
