774c9634-1939-49d2-a0e6-95d0afb9efb6,2024-06-15 15:44:13,"In Sachsen-Anhalt sind 500 Stellen in der Landesverwaltung unbesetzt. Im Wettbewerb um Fachkräfte stehen öffentlicher Dienst und Wirtschaft in Konkurrenz – unter unfairen Bedingungen, kritisiert der Hauptgeschäftsführer der IHK Halle. Ein Unternehmen aus Magdeburg hat keine Probleme, Fachkräfte zu gewinnen. In der Verwaltung muss sich aber einiges ändern, heißt es aus Politik und Wirtschaft. 500 Stellen, das entspricht in Sachsen-Anhalt der Mitarbeiterzahl eines größeren Mittelständlers. So viele Stellen blieben in der Landesverwaltung im letzten Jahr unbesetzt – das ist das Ergebnis einer Kleinen Anfrage von Kristin Heiß, Finanzpolitikerin in der Landtagsfraktion der Linken. Für Heiß zeigt sich darin ein grundlegendes Problem: ""Es gibt eine hohe Fluktuation von Personal im Land und es dauert sehr lange, bis neues Personal überhaupt eingestellt wird."" Neueinstellungen könnten mitunter bis zu acht Monate dauern, weswegen so mancher Bewerber wieder abspringen würde. Bildrechte: MDR/Uli Wittstock Landesverwaltung von Sachsen-Anhalt – ein Sanierungsfall? Inzwischen hat sich offenbar herumgesprochen, dass die Stimmung innerhalb der Verwaltung nicht die beste ist. Für Kristin Heiß mehren sich die Anzeichen, dass es grundlegende Probleme gibt: ""Woran liegt das denn, dass die Leute sehr lange krank sind? Es gibt Kollegen, die einen Burn-out haben oder auch einen Bore-out."" Während Burn-out der Folge einer Überlastung ist, steht der Begriff Bore-out für das Gegenteil: Es betrifft Menschen, die am Arbeitsplatz an Langeweile und Unterforderung leiden. Woran liegt das denn, dass die Leute sehr lange krank sind? Es gibt Kollegen, die einen Burn-out haben oder auch einen Bore-out. Kristin Heiß Landtagsabgeordnete Die Linke Aus Sicht der Finanzpolitikerin sind das Folgen eines Leitungsproblems: ""Ich habe den Eindruck, dass in der Landesverwaltung nicht bekannt ist, wer da wo was macht. Natürlich gibt es einen Geschäftsverteilungsplan und es gibt Organigramme, aber das wurde schon lange nicht mehr überprüft."" Derzeit gebe es nicht einmal Tätigkeitsbeschreibungen für alle Stellen im Landesdienst, so Heiß. Es sei dringend notwendig, die Landesverwaltung neu aufzustellen: ""Das tut aber keiner, weil das eine unangenehme Aufgabe ist. Und das möchte weder der Finanzminister machen noch irgendein Fachminister, der ja für das jeweilige Ministerium verantwortlich ist."" Im Durchschnitt verdient man Brockmeier zufolge im öffentlichen Dienst in Sachsen-Anhalt bei vergleichbarer Tätigkeit bis zu zwanzig Prozent mehr im Vergleich zur gewerblichen Wirtschaft. Allerdings sei klar, dass auch die öffentliche Hand qualifiziertes Personal brauche. Brockmeier ist kein Revoluzzer, der mit Feuer und Schwert die Verwaltung ausräuchern würde: ""Wir haben einen ganz engen Kontakt zu Bürgermeistern und Landräten und wissen, dass die händeringend nach Fachleuten suchen."" Es gehe nun darum, kritisch zu hinterfragen, welche Verwaltung welche Aufgaben übernimmt und welche Aufgaben möglicherweise entfallen könnten. Unternehmen aus Magdeburg: IT-Fachkräfte haben Lust auf große Projekte Allerdings gibt es auch Firmen in Sachsen-Anhalt, die nicht über Fachkräftemangel klagen. Eines davon ist das Magdeburger KI-Unternehmen Polarith. Geschäftsführer Martin Kirst nennt als wesentlichen Grund nicht das Geld, sondern die Arbeit: ""Wer im Bereich IT tätig ist, will nicht in der nächstbesten Desktop-Applikation landen oder für Büros Verwaltungsanwendungen programmieren. Die haben Lust auf große Projekte."" Bildrechte: MDR/Uli Wittstock Solche bietet die Firma Polarith, die mit 14 IT-Experten unter anderem große Seehäfen betreut. Zudem biete die kleine Firma mehr Entscheidungsspielraum und weniger Hierarchien, sodass die Beschäftigten zufriedener seien, auch wenn das Gehalt etwas unter dem des öffentlichen Dienstes liege. Blickt man jedoch auf die Struktur der Wirtschaft in Sachsen-Anhalt, dann ahnt man, dass solche Beispiele eher selten sein dürften."
5d91b7ac-65d0-4336-9704-1cbef85fc3d1,2024-06-15 16:00:00,"Startseite Wirtschaft Putin bereitet neue Phase der Kriegswirtschaft vor – aber Russland zerbricht daran Von: Bona Hyun Putin will Russland auf eine jahrzehntelange Kriegswirtschaft einstellen – doch das birgt Risiken. Denn die Folgen der Sanktionen holen ihn ein. Moskau – Erstmals mehr Geld für Militär und Sicherheit als für Sozialausgaben: Kremlchef Wladimir Putin schwört Russland nach mehr als zwei Jahren seines Angriffskrieges gegen die Ukraine auf einen Ausbau der Kriegswirtschaft ein. Das Land stelle sich auf eine jahrzehntelange Kriegswirtschaft ein, hieß es auf dem 27. St. Petersburger Internationalen Wirtschaftsforum (SPIEF). „Heute ist der militärisch-industrielle Komplex die Lokomotive der Wirtschaft“, sagte der russische Ökonom Pjotr Fradkow. Was offenbar viele in Russland nicht wahrhaben wollen: genau diese wirtschaftliche Abhängigkeit vom Krieg wird sich rächen. Milliarden für Militär: Putin schickt Russlands Wirtschaft ins Verderben Seit dem Ukraine-Krieg hat Putin die Ausgaben für das Militär angekurbelt, um die Produktion im Rüstungssektor zu steigern. Putin habe eine ganze Liste von Anweisungen für die Entwicklung des Rüstungssektors unterschrieben, um noch mehr Waffen und Munition zu produzieren, sagte der erste Vizeregierungschef Denis Manturow auf dem (SPIEF), welches seit Mittwoch (5. Juni 2024) läuft und Samstag endet. Allein für den Haushaltsposten Verteidigung gibt der Kreml in diesem Jahr umgerechnet etwa 110 Milliarden Euro aus. Hinzu kommen weitere 34 Milliarden Euro für die Bereiche nationale Sicherheit und Sicherheitsorgane. Insgesamt sind das 38,6 Prozent aller Ausgaben des russischen Etats oder acht Prozent des Bruttoinlandsprodukts. Angesichts westlicher Waffenlieferungen an die Ukraine, die damit auch russisches Staatsgebiet beschießen will, drohte Putin bei dem Forum mit einer „asymmetrischen Antwort“. Moskau könnte demnach künftig russische Waffen an jene Länder liefern, die im Konflikt stünden zu den USA und anderen Nato-Mitgliedern. Russlands Wirtschaft wirklich robust wie Putin darstellt? Einbruch bei Öl und Gas Putin machte auch deutlich, dass sich Russland gegen die Erwartung vieler bisher gut behaupte gegen die Strafmaßnahmen des Westens. Westliche Experten bestätigen, dass die russische Wirtschaft trotz des Drucks durch die Sanktionen vergleichsweise robust sei. Doch zugleich wächst die Sorge, dass Russlands Wirtschaft an den Folgen des kriegsbedingten Wachstums zerfallen wird. Investitionen, die Russland gerade tätigt, seien keine, „die langfristig einen positiven Effekt auf die Wirtschaft haben“, sagte Prof. Dr. Michael Rochlitz, Universität Oxford zum ZDF am 5. Juni 2024. Russland sei im Moment zudem extrem abhängig von Öl- und Gaspreis. Russlands Wirtschaft musste bereits wegen des Ukraine-Kriegs verheerende Einbrüche beim Export von Gas hinnehmen, wie man auch am jüngsten Beispiel Gazprom sieht: Russlands Energieriese hatte im Jahr 2021 noch über 174 Milliarden Kubikmeter Erdgas in europäische Länder exportiert. 2023 beliefen sich die Erdgaslieferungen von Gazprom nach Europa jedoch nur noch auf 28,3 Milliarden Kubikmeter, wie Berechnungen der Nachrichtenagentur Reuters zeigen (Stand Januar 2024). Erstmals seit 1999 erzielte das Unternehmen keine Gewinne. Aufgrund der westlichen Sanktionen fällt es Putin immer schwerer, Abnehmer für russisches Gas zu finden. Ein wichtiges Gaspipeline-Projekt mit China droht zu scheitern. Sanktionen gegen Russlands Wirtschaft wirken sich auf Finanzsektor aus Ähnliche Wirkungen haben auch Sanktionen auf Russlands Geschäfte im Finanzsektor. Besonders seit der Androhung der USA, härter gegen Institute vorzugehen, die Russland finanziell unterstützen, haben viele Banken Russland den Rücken zugewandt. Chinas Banken haben den Zahlungsverkehr eingestellt und die Annahme von Yuan-Zahlungen aus Russland gestoppt. Auch Banken aus der Türkei und den Vereinigten Arabischen Emiraten machten einen Rückzieher. „Blutgerinnsel haben sich in allen Hauptgefäßen gebildet“, sagte Russlands Ex-Finanzminister Michail Zadornov dazu. Zudem erschweren laut Wladislaw Inosemzew, Direktor des Moskauer Zentrums zur Erforschung postindustrieller Gesellschaften, die westlichen Sanktionen generell Transaktionen. Der Kapitalabfluss finde kaum noch statt, weil die EU Konten für Russen geschlossen habe, sagte er im Gespräch mit der Welt. Russlands Wirtschaft sei wie „ein geschlossener Dampfkessel voller Geld“, sagte Oleg Vjugin, ehemaliger Vizechef der russischen Zentralbank ebenfalls zur Welt. (bohy mit Material der dpa)"
0918caed-69e7-4b18-9c86-39f854cada7b,2024-06-15 17:10:00,"Der sportliche Sieger der Fußball-Europameisterschaft 2024 in Deutschland steht noch nicht fest, schließlich hat das Turnier gerade erst begonnen. Dennoch gibt es schon einen großen Gewinner der EURO 2024: die UEFA. Der europäische Fußballverband rechnet als Veranstalter des Turniers mit einem Gewinn von mehr als einer Milliarde Euro. UEFA EURO 2024 UEFA-Präsident Ceferin: Fußball macht Menschen patriotischer UEFA EURO 2024 UEFA-Präsident Ceferin: Fußball macht Menschen patriotischer Die Erwartungen an diese Fußball-EM sind gigantisch. Auch UEFA-Präsident Aleksander Ceferin hofft nicht nur auf schönen Fußball: Er erwarte, dass beim Turnier europäische Einheit demonstriert werde, denn davon sei aktuell nicht viel zu spüren. Teurer als erwartet Fußball-EM in Deutschland - wer zahlt? Am Freitag startet die Fußball-EM in Deutschland. Und schon jetzt ist klar, das Turnier wird teurer als gedacht. Die Kosten trägt vor allem der Steuerzahler. Die Städte erhoffen sich jedoch wirtschaftliche Effekte. Fragen und Antworten. Innenministerin Nancy Faeser Fußball-EM soll ""vor allen Dingen zum Zusammenhalt beitragen"" Innenministerin Nancy Faeser (SPD) empfiehlt trotz angespannter Sicherheitslage, die EM zu genießen. Fußball und Gemeinschaft sollten im Fokus stehen. Für die Polizei bedeute die EM ein ""großer Kraftakt"", dies sei jedoch zu stemmen, so die Ministerin. Auf der anderen Seite steht in dieser UEFA-Rechnung der Ausrichter. Nach Recherchen des ZDF und des Nachrichtenmagazins ""Der Spiegel"" kostet die Fußball-EM den deutschen Steuerzahler 650 Millionen Euro. Alleine auf die Ausrichterstädte kommen laut ""Correctiv.Lokal"" und ""FragDenStaat"" 295 Millionen Euro an Kosten zu. Teile der UEFA-Gewinne gehen nach dem Turnier übrigens an die europäischen Fußballverbände – an die Städte fließt nichts zurück. Fußball-EM: Schub für deutsche Wirtschaft ist Wunschtraum In Deutschland hält sich dennoch hartnäckig die Hoffnung, dass die Wirtschaft vom Turnier profitieren kann. So sagte etwa Stephan Keller (CDU), Oberbürgermeister der Stadt Düsseldorf, zuletzt gegenüber der Tagesschau: ""Wir glauben, dass wir wirtschaftlich von diesem Turnier profitieren werden, denn es kommen Hunderttausende Menschen in unsere Stadt, die hier Geld ausgeben werden."" Doch ist diese Hoffnung auf einen Wirtschaftsschub für die Hotel-, Gastronomie und Veranstaltungsbranche in Deutschland begründet oder nur ein Wunschtraum? Dr. Matthias Fett, Dokumentar beim SPIEGEL, erklärt dazu: ""Es gibt keine Anzeichen dafür, dass Fußball-Europameisterschaften sich positiv auf die Wirtschaft des Gastgeberlandes auswirken. In der Vergangenheit lag der Effekt einer EM auf das Wirtschaftswachstum bei einem Dreiviertel-Prozentpunkt im Minus. Das heißt, selbst wenn die Wirtschaft gewachsen ist, hat die Fußball-EM einen negativen Effekt ausgelöst."" Fett, der sich seit rund zehn Jahren mit der Frage beschäftigt, ob ein Großturnier der Wirtschaft zuträglich ist, ergänzt: ""Die UEFA pocht auf bestimmte Steuererleichterungen. Die Umsätze, die während der EM im Rahmen des Turniers geschehen, kommen dem deutschen Staat nicht so zugute."" Natürlich könnte die Wirtschaft etwa durch ausgebuchte Hotels profitieren. ""Aber den letztendlichen Effekt kann man wohl erst danach feststellen."" Warum eine Fußball-WM wirtschaftlicher als eine EM ist Diese Einschätzung passt nicht wirklich zum Versprechen der DFB-Verantwortlichen im Vorfeld der EM, niemand werde ein Minus machen und Steuereinnahmen würden sprudeln. Der Deutsche Fußball-Bund dachte dabei wohl auch an die Weltmeisterschaft 2006 zurück, das ""Sommermärchen"" im eigenen Land. Damals stieg das Bruttoinlandsprodukt pro Kopf um 1,6 Prozent. ""Der Unterschied ist, dass es sich um eine Weltmeisterschaft gehandelt hat. Das insgesamte Pro-Kopf-Wachstum lag 2006 sogar höher"", erklärt Volkswirtschaftsexperte Fett. ""Die Fußball-WM hat laut meinem Modell aber 1,6 Prozent dazugesteuert, was ein enormer Effekt ist. Das ist darin begründet, dass die FIFA in diesem Zeitraum – seit 1990 bis 2006 – profitabel für die Gastgeberländer war."" Matthias Fett unterstreicht dabei: ""Die Fußball-Europameisterschaft ist leider nur das zweitgrößte Fußballspektakel der Welt. Dementsprechend ist die Motivation der Gastgeberländer anders als bei der Organisation einer FIFA-Fußball-WM. Die Kosten für die Organisation einer WM sind mittlerweile schon im zweistelligen Milliardenbereich."" Demgegenüber investiert Deutschland nun ""nur"" einen dreistelligen Millionenbetrag. Denn im Vordergrund standen keine Stadion-Neubauten und weitergehende Infrastrukturmaßnahmen, wie es bei Weltmeisterschaften üblicher ist. Für die EM in Deutschland ging es vor allem um die Modernisierung bestehender Arenen und Verkehrsanlagen. Außerdem müsse sich Deutschland laut Matthias Fett nicht - wie etwa 2006 bei der WM - mit einer großen Image-Kampagne den europäischen Nachbarn vorstellen. Er erklärt: ""Wenn man weniger in das Turnier reinsteckt, kann man sich natürlich auch weniger Impulse aus dieser EM erhoffen."" jti"
cba1e731-4f37-4339-8bf0-9a3ce48768ad,2024-06-17 09:24:22,"Das Thema Compliance hat in den letzten Jahren zunehmend an Bedeutung gewonnen und ist in den Reigen der Management- und Aufsichtsgremien spätestens seit der Siemens-Affäre nicht mehr wegzudenken. Längst sehen sich nicht mehr nur internationale börsennotierte Konzerne mit dem Erfordernis eines angemessenen und wirksamen Compliance Management Systems (CMS) konfrontiert. Auch Geschäftsführungen und Aufsichtsräte mittelständischer und kleinerer Unternehmen müssen sich zunehmend mit der Frage nach Compliance-Pflichten und deren konkretem Umfang befassen. Das Geflecht sanktionsbewährter Unternehmensregulierung wird zunehmend engmaschiger und auch mit der Einführung eines „echten“ Unternehmensstrafrechts ist nach wie vor zu rechnen. Neben einer möglichen strafrechtlichen Verantwortung gegenüber der Allgemeinheit sind für Geschäftsleiter vor allem die Legalitäts- und Compliance-Organisationspflichten zum Schutz der eigenen Gesellschaft und deren Vermögenwerten in den Fokus gerückt, insbesondere wenn es um das Fehlverhalten der eigenen Mitarbeiter geht. OLG Nürnberg konkretisiert Anforderungen an Compliance-Management Vor der Entscheidung des OLG Nürnberg galt lange Zeit die Entscheidung des LG München I „Siemens/Neubürger“ (Urteil vom 10.12.2013 – 5 HK O 1387/10) als maßgeblicher gerichtlich verprobter Anhaltspunkt für die Frage der Haftung von Gesellschaftsorganen für Compliance-Verstöße. Das LG München I hatte sich damals im Lichte des internationalen Siemens Korruptions- und Schwarzgeldskandals mit der Ausgestaltung von Compliance Management Systemen und hiermit einhergehenden Organisationspflichten des Vorstandes einer Aktiengesellschaft auseinandergesetzt. Nun hat sich auch das OLG Nürnberg als erstes Oberlandesgericht mit dem Umfang der Sorgfalts- und Leistungspflichten eines GmbH-Geschäftsführers im Zusammenhang mit den Anforderungen an ein CMS befasst und ausdrücklich bestätigt, dass aus der allgemeinen Legalitätspflicht des Geschäftsführers eine Pflicht zur Errichtung eines CMS erwächst. Der Sachverhalt Konkret ging es in der Entscheidung des OLG Nürnberg um Schadensersatzansprüche einer im Mineralölhandel tätigen Kommanditgesellschaft (KG) gegen den Geschäftsführer ihrer Komplementärs- GmbH. Die klagende KG gab Tankkarten an ihre Großkunden aus, mit denen diese bargeldlos und auf Kredit bei den Tankstellen der Klägerin Kraftstoff tanken konnten. Ein langjähriger Mitarbeiter der KG hatte einigen Großkunden die vertragswidrige Überziehung ihres mit den Tankkarten eingeräumten Kreditlimits ermöglicht, indem er Geschäftsvorgänge in der Abrechnungssoftware bewusst falsch zuordnete, Rechnungen umadressierte und Beschwerdevorgänge an sich zog. All dies war dem beklagten Geschäftsführer nicht aufgefallen, auch weil bei der Tankkartenausgabe und -verwaltung entgegen vorausgegangener Beschlüsse des Beirats der KG das Vier- Augen-Prinzip nicht eingehalten wurde. Als die Untreuehandlungen des Mitarbeiters schließlich ans Licht kamen, hatte sich bei der Klägerin bereits ein Schaden in Höhe von mehreren hunderttausend Euro materialisiert. Diesen wollte die KG vom Geschäftsführer ihrer Komplementärs-GmbH ersetzt haben. Das LG Nürnberg-Fürth hatte der Klage der KG im Wesentlichen stattgegeben. Auf die Berufung des Beklagten hin bestätigte das OLG Nürnberg die Entscheidung des LG in den wesentlichen Punkten. Die Kernaussagen der OLG-Entscheidung Im Einzelnen sind dem Urteil die folgenden Kernaussagen zu entnehmen: Pflicht zur Einrichtung eines CMS: Die Geschäftsführung muss im Rahmen ihrer Sorgfaltspflicht „organisatorische Vorkehrungen [treffen], die die Begehung von Rechtsverstößen durch die Gesellschaft oder deren Mitarbeiter verhindern“. Der hierbei grundsätzlich zustehende Ermessensspielraum (Business Judgment Rule) wird überschritten, wenn „aus der Sicht eines ordentlichen und gewissenhaften Geschäftsmannes das hohe Risiko eines Schadens unabweisbar ist und keine vernünftigen geschäftlichen Gründe dafür sprechen, es dennoch einzugehen“. Pflicht zur Unternehmenskontrolle: Die Intensität der erforderlichen Unternehmenskontrolle beurteilt sich nach Gefahrgeneigtheit und Relevanz der maßgeblichen Vorschriften und der objektiven Zumutbarkeit der Aufsichtsmaßnahmen. Erforderlich, aber in aller Regel auch ausreichend sollen stichprobenartige Prüfungen sein, wenn sie den Mitarbeitern ein gewisses Kontrollniveau und eine entsprechende Entdeckungswahrscheinlichkeit vor Augen führen. Anhaltspunkte für Fehlverhalten sind unverzüglich zu untersuchen. Eine gesteigerte Überwachungspflicht besteht, soweit in der Vergangenheit bereits Unregelmäßigkeiten im Unternehmen vorgekommen sind. Überwachung der Überwacher: Delegiert die Geschäftsführung ihre Compliance-Pflichten auf nachgeordnete Mitarbeiter, z. B. aus der Compliance-, Rechts- oder Revisionsfunktion, reduziert sich die Überwachungspflicht auf die ihr hierbei unmittelbar unterstellten Mitarbeiter und deren Führungs- und Überwachungsverhalten. Die Letztverantwortung verbleibt dabei stets bei der Geschäftsführung. Anerkannte Kontrollverfahren: Verstöße gegen in der Branche anerkannte Organisationsstandards wie z. B. das Vier-Augen-Prinzip begründen in der Regel einen Verstoß gegen die Sorgfaltspflicht. Ein solcher Organisationsstandard darf dabei nicht nur intern niedergeschrieben sein, sondern muss auch konkret durchgesetzt und überwacht werden. Findet sich für die praktische Umsetzung und Kontrolle kein geeignetes Personal, muss die Geschäftsführung diese Aufgabe selbst übernehmen. Beweislastumkehr zu Lasten der Geschäftsführung: Im Fall der Fälle muss die Geschäftsführung darlegen und ggf. beweisen, dass sie ihren Sorgfaltspflichten nachgekommen ist und sie kein Verschulden trifft, oder der Schaden auch bei rechtmäßigem Alternativverhalten eingetreten wäre. Nur die Geschäftsführung selbst kennt die konkreten Umstände ihres Verhaltens, während die von ihr geführte Gesellschaft in diesem Punkt stets in Beweisnot gerät. Wichtige Konsequenzen des Urteils für die Geschäftsführungs-Praxis Die Entscheidung des OLG Nürnberg macht deutlich, dass die intensive Auseinandersetzung mit Compliance-Sorgfaltspflichten nicht nur für internationale Konzerne, sondern gerade auch für mittelständische Unternehmen und ihre Geschäftsführungsorgane unumgänglich ist. Aus den ausdrücklich formulierten Anforderungen des OLG lassen sich die folgenden wesentlichen Maßgaben für die Praxis ableiten: Art und Umfang von Compliance Management und Kontrolle unterliegen dem Ermessen der Geschäftsleitung. Eine pflichtgemäße Ermessenausübung setzt dabei stets die Kenntnis und Adressierung der tatsächlichen Risikosituation des Unternehmens voraus. Die Compliance-Risikoanalyse bildet daher stets die Ausgangsbasis für die Etablierung und Aufrechterhaltung eines effektiven CMS. Neben stichprobenartigen Prüfungen gehört auch die qualifizierte Untersuchung und Aufklärung von möglichem Fehlverhalten zum Pflichtenkanon der Geschäftsführung. Die neuen Regelungen zum Hinweisgeberschutz sind eine ernstzunehmende Herausforderung, gerade auch für mittelständische Unternehmen, deren Organisationen oftmals (noch) nicht über die Erfahrung und notwendige Expertise im Umgang mit internen Untersuchungen verfügen. Letztverantwortung der Geschäftsführung bedeutet nicht nur Kontrolle des nachgeordneten Mitarbeiters. Die Auswahl der richtigen Personen, umfassende Informierung und hinreichende Qualifizierung und Befähigung – auch durch Budget und (zeitliche) Ressourcen – sind die Voraussetzungen für eine wirksame Compliance-Delegation und mögliche Enthaftung. Reine Lippenbekenntnisse und formale Stellenbeschreibungen sind hingegen unzureichend. Ein CMS darf keinesfalls nur auf Papier verfasst, sondern muss auch in die Tat umgesetzt werden. Tatsächlich muss sich die Geschäftsführung regelmäßig einen Eindruck davon verschaffen, ob das CMS in der Unternehmenspraxis auch funktioniert – hierfür ist ein angemessenes Monitoring und regelmäßiges (Selbst-) Testing unverzichtbar. Und: Auch nachträgliche Compliance-Maßnahmen lohnen sich Die beruhigende Nachricht ist: Es ist nie zu spät anzufangen! Auch das reflektieren Gesetzgebung und Rechtsprechung mittlerweile deutlich. So gilt bereits seit Novellierung des deutschen Kartellrechts im Januar 2021 für Kartellrechtsverstöße die Möglichkeit zur sog. Compliance-Defense, mit deren Hilfe Unternehmen etwaige Bußgeldzahlungen für wettbewerbsrechtliche Verstöße verringern können (§ 81d GWB). Darüber hinaus hat auch der BGH im April 2022 ausdrücklich bestätigt, dass bei der Bußgeldbemessung nach §§ 30, 130 OWiG wegen Verstoßes gegen die der Geschäftsleitung erwachsenden Leitungs-, Koordinations-, Organisations- und Kontrollpflichten Compliance-Maßnahmen zur „Selbstreinigung“ und die Einführung eines Hinweisgebersystems bußgeldmindernd berücksichtigt werden dürfen (BGH, Beschluss vom 27. April 2022 – 5 StR 278/21). Fazit Das Urteil des OLG Nürnberg macht unmissverständlich deutlich, dass ein angemessenes und effektives CMS zum Kern der Geschäftsführungspflichten gehört und Unternehmensleiter sich intensiv mit der Ausgestaltung, Kontrolle und Fortentwicklung der eigenen Compliance-Organisation beschäftigen müssen. Ansonsten kann es zivil- wie strafrechtlich ausgesprochen teuer werden. Tatsächlich gilt es im Fall der Fälle eine individuell angemessene und tatsächlich gelebte Compliance-Praxis darlegen zu können. Ein derart effektives CMS entsteht nicht auf Knopfdruck und wird auch nicht in Perfektion verlangt – gefordert werden aber ein verantwortungsvolles Risikobewusstsein, ernstgemeinte Mitigationsbestrebungen und -maßnahmen, ein kritisches Hinterfragen und eine kontinuierliche Weiterentwicklung anhand der tatsächlichen Unternehmensbedürfnisse. Jetzt ist der Zeitpunkt, dies strategisch in Angriff zu nehmen."
