78e48f13-25df-4b61-991d-220205d47c36,2024-04-02 12:10:06+00:00,"Mit einer gemeinsam entwickelten KI-basierten Roboterlösung wollen Siemens, Universal Robots und Zivid das Kommissionieren in Fulfillment-Zentren automatisieren. Mit der KI-Picking-Lösung können Logistik- und E-Commerce-Unternehmen Artikel unabhängig von Form, Größe und Trübung oder Transparenz via Cobot kommissionieren. Zum Einsatz kommen dazu eine KI-Vision-Software von Siemens, Roboter von Universal Robots und 3D-Kamereas von Zivid. Konkret sind dies: die Deep Learning basierte, vortrainierte Bildverarbeitungssoftware Simatic Robot Pick AI von Siemens befähigt Roboter, Aufgaben auszuführen, die bisher manuell bewältigt wurden. der UR20 Cobot von Universal Robots mit seiner langen Reichweite und seinem kompakten Design hebt selbst schwere Objekte über ausgedehnte Arbeitsbereiche hinweg. Die 3D-Kamera 2+ M130 von Zivid kann selbst transparente und durchsichtige Gegenstände zuverlässig erfassen. Die Lösung wurde in den letzten Wochen bereits auf Messen in Europa und Nordamerika vorgestellt – unter anderem auf der Logimat in Stuttgart. Ebenso wird sie vom 22. bis 26. April auf der Hannover Messe und vom 6. bis zum 9. Mai auf der Automate in Chicago zu sehen sein. Bahnbrechende Lösung für die Intralogistik Das sagen die drei Partner: „Wir freuen uns, gemeinsam mit Universal Robots und Zivid eine bahnbrechende Lösung für die Intralogistik einzuführen“, sagt Ignacio Moreno, Business Development Manager bei Siemens. „Wir nutzen fortschrittliche Bildverarbeitung mit kollaborativer Robotik und unserer Simatic Robot Pick AI. Entstanden ist eine Anwendung, mit der Nutzer mühelos in jeder Umgebung automatisiert kommissionieren.“ „Es gibt ein enormes Potenzial und eine große Nachfrage nach Automatisierung in Fulfillment-Zentren und der E-Commerce-Branche. Unsere Anwendung lässt sich einfach nutzen und integrieren – so, wie es Nutzer erwarten, wenn die führenden Anbieter von Bildverarbeitung und Erkennungssoftware sowie Robotik zusammenarbeiten“, sagt Daniel Friedman, Global Director, Strategic Partnerships bei Universal Robots. „Indem wir unsere 3D-Kamera mit den Technologien von Siemens und UR kombinieren, entsteht eine robuste Lösung, die den dynamischen Anforderungen der Logistik- und E-Commerce-Branche gewachsen ist“, sagt Amy Landau, Product Marketing Engineer bei Zivid. „Durch unsere Zusammenarbeit machen wir es jedem möglich, zuverlässig automatisiert zu kommissionieren.“ https://www.universal-robots.com/de Mehr zum Thema Cobot"
1f13e126-f2e9-4ea9-913f-3cce01837021,2024-04-02 20:12:44+00:00,"Nach vielen neuen Höchstständen in Folge haben die Börsen den Monat April mit einem deutlichen Rückschlag begonnen. Zweifel an schnellen Zinssenkungen durch die Notenbanken machen sich auf dem Börsenparkett breit. Die US-Börsen in New York haben den ersten Handelstag des Monats April tief im Minus beendet. Genauso war es zuvor dem DAX in Frankfurt ergangen. Die Stimmung an den Aktienmärkten ist angeknackst. An der Wall Street scheint die scheinbar endlose Hausse am Aktienmarkt einem Ende entgegen zu steuern. Der Dow-Jones-Index der US-Standardwerte büßte bis zum Handelsschluss am Abend 1,0 Prozent auf 39.170 Punkte ein. Fast ebenso deutlich bergab ging es beim Auswahlindex der US-Technologiebörse Nasdaq, dem Nasdaq 100. Er ging mit minus 0,9 Prozent auf 18.122 Zähler aus dem Handel. Eine Reihe von Konjunktursignalen sorgt bei den Marktteilnehmern für Zweifel daran, dass die US-Notenbank Federal Reserve (Fed) schnell die Leitzinsen senkt. So waren sowohl Daten zur US-Industrie als auch zum Arbeitsmarkt besser ausfallen als erwartet. Nun machten sich die Anleger Sorgen, dass auch die offiziellen US-Arbeitsmarktdaten am Freitag überraschend stark ausfallen könnten, so Chefstratege David Russell von der Investitionsplattform TradeStation. Die Fed versucht bislang, mit erhöhten Zinsen die Inflation zu bekämpfen und den heiß gelaufenen Arbeitsmarkt abzukühlen. Mit rund fünf Prozent Kursverlust belegte die Aktie des E-Auto-Hersteller Tesla den letzten Platz im Nasdaq 100. Tesla hat im vergangenen Quartal den ersten Rückgang bei Auslieferungen seit der Corona-Pandemie verbucht. Die von Tech-Milliardär Elon Musk geführte Firma brachte zwischen Januar und März nach eigenen Angaben 386.810 ihrer Elektroautos zu den Kunden. Im Vorjahresquartal waren es fast 423.000 gewesen. Analysten hatten für das erste Vierteljahr 2024 im Schnitt mit einem Anstieg auf gut 449.000 Auslieferungen gerechnet. Erfreulicher verlief der Handelstag für GE Vernova. Die Aktien des von General Electric (GE) abgespaltenen Energietechnik-Unternehmens feierten ein erfolgreiches Börsendebüt und schlossen im Plus. Aus General Electric ist damit der US-Luftfahrtkonzern GE Aerospace geworden. Damit soll laut Analyst Robert Czerwensky von der DZ Bank die Fokussierung auf das Luftfahrttechnik-Geschäft kenntlich gemacht werden. Czerwensky zufolge ist mit der Abspaltung von GE Vernova durch den Börsengang der jahrelange Konzernumbau abgeschlossen worden. Auch der DAX hatte am Nachmittag mit deutlichen Verlusten den XETRA-Handel abgeschlossen. Am Vormittag hatte der deutsche Leitindex mit 18.567 Punkten noch ein erneutes Allzeithoch erklommen. Danach aber ging es stetig bergab. Im Gefolge der schwach gestarteten US-Börsen betrug das Minus am Ende 1,1 Prozent auf 18.283 Zähler. Inflationsdaten aus Deutschland konnten die Investoren am Nachmittag nicht zu neuen Käufen anregen. Die Inflation ist auch wegen der erstmals seit 2015 billiger gewordenen Nahrungsmittel auf den tiefsten Stand seit fast drei Jahren gefallen. Im März stiegen die Verbraucherpreise nur noch um 2,2 Prozent zum Vorjahresmonat, wie das Statistische Bundesamt zu seiner Schätzung mitteilte. Im Februar hatte die Teuerungsrate noch 2,5 Prozent betragen. Von Februar auf März stiegen die Preise um 0,4 Prozent. ""Auf den ersten Blick kann man sich entspannt zurücklehnen, weil die Inflation wieder fast beim EZB-Ziel liegt"", so Jörg Krämer, Chefvolkswirt der Commerzbank. ""Aber die Details mahnen zur Vorsicht. Ohne die schwankungsanfälligen Preise für Energie und Nahrungsmittel steigen die Verbraucherpreise seit der Jahreswende wieder deutlich schneller als von der EZB angestrebt."" Die europäische Gemeinschaftswährung notiert derzeit bei 1,0766 Dollar und damit in etwa auf dem gestrigen Niveau. Den Euro können damit die aktuellen Teuerungsdaten aus Deutschland nicht aus seinem Seitwärtstrend gegenüber dem US-Dollar befreien. Die Erwartung einer stärkeren Nachfrage aus China und den USA sowie Sorgen über die geopolitische Lage in Nahost treiben die Ölpreise an. Die Nordsee-Rohölsorte Brent verteuert sich derzeit um 1,3 Prozent auf 88,34 Dollar. ""Einerseits deutet die unerwartet gute Konjunktur in China und den USA auf eine künftig steigende Nachfrage hin"", so Stratege Yeap Jun Rong vom Broker IG. ""Andererseits schürt die Beteiligung des wichtigen Produzenten Iran an den Spannungen in Nahost neue Versorgungsängste."" Im DAX schloss die Aktie von Siemens Energy rund 2,5 Prozent höher und trotzte damit dem Abwärtstrend. Auch die als defensiv geltenden Titel von Henkel zu den größten Kursgewinnern. Am Ende der DAX-Liste notierte die Aktie des Wohnungskonzerns Vonovia. Sie litt darunter, dass die amerikanische Investmentbank Goldman Sachs sie von der ""Conviction List"" für besonders aussichtsreiche Aktien gestrichen hat. Rüstungsaktien wurden im Tagesverlauf von Aussagen des Finanzministers befeuert: Christian Lindner sieht im Bundeshaushalt ab 2028 einen Spielraum von bis zu neun Milliarden Euro zur Aufstockung des Verteidigungsetats. Im DAX sorgte diese Aussage bei Rheinmetall für einen neuen Höchststand von 535 Euro. Im MDAX stiegen Hensoldt deutlich. Die Lufthansa sucht gezielt nach Fachkräften mit Berufserfahrung, die in Teilzeit arbeiten wollen. Gesucht werde in den Bereichen Finanzen und IT, teilte das Unternehmen am Dienstag in Frankfurt mit. Die Teilnehmerinnen und Teilnehmer sollen demnach eine einjährige Orientierungsphase durchlaufen, in der sie verschiedene Abteilungen des Konzerns kennenlernen können. Sie können ihr Arbeitszeitmodell zwischen 70 und 80 Prozent einer Vollzeitstelle wählen. Das Programm sei Auftakt für ein unbefristetes Beschäftigungsverhältnis und enthalte auch individuelles Coaching und spezielle Schulungen. Der weltgrößte Flugzeughersteller Airbus hat im März laut Insidern deutlich mehr Flugzeuge ausgeliefert als in den Monaten zuvor. Insgesamt habe der Hersteller etwa 65 Jets an seine Kunden übergeben, so die Nachrichtenagentur Bloomberg. Damit summieren sich die Auslieferungen des ersten Quartals auf etwa 145 Maschinen. Das entspricht etwa 18 Prozent des Jahresziels von etwa 800 Flugzeugen. Ein Sprecher des DAX-Konzerns wollte die Informationen vor der Veröffentlichung der offiziellen Zahlen nicht kommentieren. Der deutsche Cloud-Anbieter Ionos hat einen Großauftrag von der Bundesverwaltung für den Aufbau einer besonders strikt abgesicherten Computer-Cloud-Lösung erhalten. Das teilte das Unternehmen heute in Karlsruhe mit. Die ""private Enterprise-Cloud"", die unter anderem vom Bundesamt für Sicherheit in der Informationstechnik (BSI) zertifiziert wurde, soll in den Rechenzentren des Informationstechnikzentrums Bund betrieben werden. Die Aktie schnellte im Handelsverlauf um bis zu elf Prozent auf 23,60 Euro und war damit der größte Gewinner im Kleinwerteindex SDAX. Der Büroflächen-Vermieter WeWork will bis Ende Mai gesundgeschrumpft aus der Insolvenz entkommen. Man habe die Mieten in Verhandlungen mit den Eigentümern von 150 Standorten um mehr als acht Milliarden Dollar herunterverhandelt, teilte das Unternehmen mit. Das seien mehr als 40 Prozent der Mieten, die damit dem veränderten Marktumfeld angepasst würden. Rund 150 Standorte würden aufgegeben, indem man die Mietzahlungen in der Insolvenz eingestellt oder Vereinbarungen mit den Vermietern geschlossen habe. Das Insolvenzverfahren soll zum 31. Mai aufgehoben werden."
d39f7810-0aed-4fb8-8391-ae1bcd88f56d,2024-04-03 04:31:30+00:00,"Der Aufwärtstrend am deutschen Aktienmarkt setzt sich fort. Der Leitindex Dax erreicht fast täglich ein neues Hoch, das Durchbrechen der Marke von 19’000 Punkten scheint nur eine Frage der Zeit. Der breite HDax, der die Werte aller 110 Unternehmen aus den Indizes Dax, MDax und TecDax zusammenfasst verzeichnet seit Anfang Jahr ein Plus von gut 9%, womit das Barometer besser abschneidet als der europäische Vergleichsindex Stoxx 600 (+7%). Die weiterhin gute Stimmung am Aktienmarkt bringt die Leerverkäufer zunehmend auf den Plan. Nachdem sie ihre Wetten gegen deutsche Aktien seit Mai 2023 kontinuierlich abgebaut hatten, ist das Short-Volumen an der deutschen Börse im Februar erstmals gestiegen. Im März haben sich die Wetten nun den zweiten Monat in Folge erhöht – auf ein Volumen von 22,3 Mrd. €. Damit ist der Gesamtwert aller Short-Wetten am deutschen Aktienmarkt in den vergangenen zwei Monaten um mehr als ein Drittel gestiegen. Die Werte basieren auf Zahlen des US-Datenanbieters S3 Partners, die The Market vorliegen. Den Short-Sellern scheint die Rally offenbar zunehmend suspekt. Leerverkäufer leihen sich Aktien, verkaufen sie am Markt und hoffen, sie später günstiger zurückkaufen zu können – um sie dann dem Eigentümer zurückzugeben. Geht die Wette auf, streichen sie die Differenz aus dem Verkaufs- und dem Rückkaufspreis als Gewinn ein. The Market beleuchtet regelmässig, gegen welche deutschen Aktien die grössten Short-Wetten laufen (die grössten Short-Positionen unter den Schweizer Aktien finden Sie hier). Sartorius und Siemens Energy weiterhin an der Dax-Spitze Im Dax hat sich in der ersten Reihe der am meisten leerverkauften Aktien wenig getan. Die Spitzenplätze belegen weiterhin die Vorzugsaktien von Sartorius (Short-Quote: +13,9%) sowie Siemens Energy (+7,8%), wobei sich die Short-Quote bei ersteren leicht erhöht, bei letzteren leicht verringert hat. Während die Sartorius-Aktie seit Anfang Jahr leichte Zugewinne verzeichnete, haben sich die Leerverkäufer mit den Titeln von Siemens Energy zuletzt ordentlich die Finger verbrannt. Das Plus seit Anfang Jahr: 43%. Porsche Stärker ausgebaut wurden die Wetten gegen die Porsche AG, wo sich der Leerverkaufsanteil von 4,4 auf 6,8% erhöht hat. Für den deutschen Sportwagenhersteller dürfte 2024 zu einem Übergangsjahr werden. Zwar bringen die Stuttgarter noch in diesem Jahr neue Versionen des Panamera und des E-Sportwagens Taycan sowie das lange erwartete vollelektrische SUV-Modell Macan auf den Markt. Bis sich der Modellwechsel voll durchschlägt, dürfte es jedoch gemäss Experten noch bis ins kommende Jahr dauern. Porsche-Chef Oliver Blume, der gleichzeitig CEO des Mutterkonzerns Volkswagen ist, blickt denn auch vorsichtig auf das Jahr 2024, wie er Mitte März im Rahmen der Ergebnispräsentation mitteilte. Das Zielband für die operative Marge fiel mit 15 bis 17% tiefer aus als von Analysten erwartet. An dem mittelfristigen Ziel von 17 bis 19% sowie den langfristig anvisierten 20% wird jedoch weiter festgehalten. Die Aktie, die im vergangenen Jahr aufgrund der sportlichen Bewertung deutlich einbüsste, befindet sich seit Anfang Jahr im Aufwärtstrend – daran änderten auch die vorsichtigen Worte von Blume vor einigen Wochen nichts. Während die Börse bereits ins nächste Jahr schaut, scheinen die Leerverkäufer die Möglichkeit kurzfristiger Schwächen höher zu gewichten. BASF Neu in den Top Ten der am meisten leerverkauften Dax-Aktien ist BASF. Die Short-Quote beim weltgrössten Chemiekonzern ist mit 2,1% zwar nicht exorbitant hoch, hat sich in den vergangenen vier Wochen jedoch mehr als verdoppelt. Nicht zuletzt durch mehrere Analystenaufstufungen befeuert, haben die Titel zuletzt den höchsten Stand der letzten zwölf Monate erreicht. Als frühzyklisches Unternehmen – BASF stellt vor allem Vorprodukte für die Industrie her – steht der Chemieriese mit Sitz in Ludwigshafen bei einer möglichen konjunkturellen Belebung der Industrie in der allerersten Reihe. Zwar sehen die Analysten 2024 operativ noch als Übergangsjahr für BASF, doch mit Blick auf eine Besserung im Jahr 2025 lohnt es sich gemäss dem US-Brokerhauses Stifel, die Aktien schon jetzt auf dem Zettel zu haben. Vor allem ein sich verbesserndes makroökonomisches Umfeld, positive Signale aus China sowie Fortschritte beim defizitären Produktionsstandort Ludwigshafen führen zu der Kaufempfehlung der Stifel-Analysten. Während auch The Market die Titel im Best Ideas Portfolio hält, kommen die Kursavancen für einige Short-Seller hingegen offenbar zu früh. Nagarro Auch am breiten Markt hat sich auf den Spitzenplätzen der am meisten leerverkauften Aktien wenig getan. Die Top Ten wird von Nagarro angeführt. Der IT-Dienstleister gehörte während der Coronapandemie zu den Überfliegern an der Börse, geriet jedoch Anfang 2023 wegen kritischer Berichte – unter anderem von der Wirtschaftswoche – über die Führungsstruktur und den Bilanzierungsmethoden ins Visier der Short-Seller. Zudem folgten mehrere Prognosesenkungen infolge steigender Kosten und eines rückläufigen Umsatzes. Zwar scheint das Münchner Unternehmen seine Governance-Probleme in den Griff zu bekommen. Im Herbst wurde KPMG als Prüfer angestellt und die Bilanzstrukturen an die eines weltweit tätigen Konzerns angepasst, was der Aktie zwischenzeitlich Schub verleihen konnte. Doch der Marktausblick bleibt herausfordernd, was die Leerverkäufer am Ball bleiben lässt. Sie spekulieren auf eine weitere Eintrübung auf der Umsatz- und Gewinnseite. Nordex Ausgebaut wurden die Wetten gegen die Aktien von Nordex, die damit vom sechsten auf den dritten Platz vorgerückt sind. Der Windturbinenhersteller hat – wie seine Konkurrenten – schwierige Jahre hinter sich, die mit sinkendem Umsatz und schwindender Marge einhergingen. Die Branche arbeitet noch immer Altaufträge ab, die zu nicht kostendeckenden Preisen abgeschlossen wurden. Angesichts der Bekräftigung des Managements, mittelfristig eine Ebitda-Marge von 8% erreichen zu wollen, keimten Ende Februar Hoffnungen auf, dass die margenträchtigere Neuaufträge bald die Oberhand gewinnen könnten. Den Aktien hat dies seitdem Auftrieb verliehen, seit Ende Februar beträgt das Kursplus rund 24%. Auch The Market sieht Windaktien in einer neuen Ausgangslage: Der Tiefpunkt scheint durchschritten, und die Zukunft spricht für steigende Margen und höhere Aktienkurse. Thyssenkrupp Nucera Auch das Thyssenkrupp-Spin-off Nucera ist verstärkt in den Fokus der Short-Seller geraten. Der Leerverkaufsanteil hat sich von 14,6 auf 17% erhöht. Die Wasserstofftochter wurde von Thyssenkrupp im Juli 2023 an die Börse gebracht und hat seitdem rund 40% an Marktwert verloren. Zwar ist das Unternehmen kaum mit negativen Nachrichten aufgefallen, doch Wasserstoffaktien haben seit längerem einen schweren Stand an der Börse. Andere Werte wie Plug Power oder Nel Asa haben in derselben Periode gar bis zu 70% verloren. Die Aktie von Nucera wird aufgrund seiner soliden Bilanz und seinen Geschäftsaussichten von Analysten denn auch als Top Pick unter den Wasserstoffwerten gesehen. Das Unternehmen produziert Elektrolyseure, die für die Herstellung von Wasserstoff gebraucht werden. Wasserstoff ist ein wichtiger Teil der Energiewende, doch die Stimmung um Clean-Energy-Aktien ist weiterhin trübe. Solange sich der Sektor nicht aufhellt, dürften die Leerverkäufer am Ball bleiben – und der Aktienkurs unter Druck. Deutsche Pfandbriefbank Weiter im Fokus der Leerverkäufer ist zudem die Deutsche Pfandbriefbank, wo sich die Short-Quote um einen Prozentpunkt auf knapp 19% erhöht hat. Die Aktie befindet sich seit rund einem Jahr im Abwärtstrend, hat sich im März jedoch etwas gefangen. Dem Münchner Kreditinstitut fällt das umfangreiche Engagement im kriselnden US-Gewerbeimmobilienmarkt auf die Füsse. Der Markt sieht in den Aktien eine gute Short-Möglichkeit."
596ebaef-19f2-4298-a95e-446a1cf4f70d,2024-04-04 14:18:02+00:00,Interview mit Industrial-Metaverse-Expertin siemens.com
e0af06b3-7a9b-4b61-be3c-558675da0281,2024-04-05 07:52:38+00:00,"Laut dem Wirtschaftsmagazin Forbes gibt es weltweit so viele Milliardäre wie noch nie zuvor: 2.781 Menschen haben ein Vermögen von über einer Milliarde US-Dollar. Neu im Club der Milliardäre sind seit diesem Jahr auch drei Münchner: Martin Klenk, Bastian Nominacher und Alexander Rinke, die Gründer des Technologie-Unternehmens Celonis. Das jeweilige Vermögen der Münchner Gründer liegt laut Forbes-Magazin zwischen 1,1 und 1,2 Milliarden US-Dollar. Im weltweiten Milliardärsranking belegen sie damit zwar eher die hinteren Plätze (2.410 und 2.545 von 2.781), sind aber zumindest unter den deutschen Neulingen die einzigen Milliardäre ohne vererbtes Vermögen. Zum Artikel: Ist Bayern das neue ""Silicon Valley Europas""? Vom Uni-Projekt zum Milliarden-Unternehmen Was sie heute zu Milliardären macht, begann im Jahr 2011 als studentisches Projekt: Die drei Studenten (unter anderem Informatik, Mathematik und Management) trafen sich zum ersten Mal bei der ehrenamtlichen Unternehmensberatung in München, um praktische Erfahrung zu sammeln. Bei der Analyse von Abläufen innerhalb der Unternehmen entstand die Idee zu einer Software, die die drei Gründer später reich gemacht hat: Process Mining. Das ist eine Technologie, um Prozesse innerhalb eines Unternehmens zu verstehen und zu verbessern, indem die Daten aus den IT-Systemen analysiert werden. Eine der ersten Analysen führten die drei Gründer beim Bayerischen Rundfunk durch. Mit welcher Technologie die Münchner reich wurden Heute entwickelt und verkauft Celonis Softwarelösungen für Unternehmen, die es ermöglichen, Geschäftsprozesse zu analysieren, zu optimieren und zu überwachen – mithilfe von Datenanalyse und KI-Technologien. So lassen sich in Echtzeit wichtige Vorgänge in den unterschiedlichsten IT-Systemen kontrollieren, um Fehler und Schwachstellen aufzuspüren. Immer mehr Unternehmen hoffen, damit ihre Produktivität und Effizienz steigern zu können. Weltbekannte Unternehmen wie Siemens oder Uber gehören zu den Kunden des Unternehmens, das weltweit über 3.000 Mitarbeitende beschäftigt – in München, aber unter anderem auch in New York und Madrid. Wie einzigartig ist Deutschlands wertvollstes Startup? Investoren bewerten Celonis inzwischen mit 13 Milliarden Dollar, und die Gründer besitzen immer noch wesentliche Anteile. Branchenexperten schätzen den stark wachsenden Markt für Process Mining auf mehrere Milliarden Euro und sehen die Münchener Softwareschmiede dabei als einer der führenden Anbieter. Wie wichtig oder einzigartig die Fähigkeiten von Celonis sind und ob andere viel größere Softwarehäuser wie SAP etwas ähnliches nicht auch können, lässt sich ohne Insiderwissen nur schwer beurteilen. Wie könnte die Erfolgsgeschichte weitergehen? Das frühere Führungsteam um die drei Gründer Klenk, Nominacher und Rinke hat sich weiterentwickelt. Dabei stoßen inzwischen auch externe Top-Manager hinzu. So wurde zuletzt Carsten Thoma als Verstärkung in das Führungsteam geholt, der seine eigene Firma einst äußerst erfolgreich an SAP verkaufte und bei Celonis seit 2016 im Vorstand sitzt. Das Manager Magazin berichtet, dass Celonis auf dem Weg sei, vom kleinen Start-up in München zu einem richtigen Konzern zu werden, mit allem, was dazugehört. Börsengang oder Verkauf an Konkurrenten? Am Ende dieser Entwicklung könnte auf der Kapitalseite ein Börsengang stehen. In mehreren Finanzierungsrunden mit privaten Investoren (Private Equity) ist die Bewertung immer weiter gestiegen. Einige dieser Investoren wollen diese Erfolgsgeschichte vielleicht vergolden und Kasse machen. Um solche Bewertungsgewinne zu realisieren, bietet sich häufig ein Teilverkauf über die Börse an. Dabei werden meist nur einige Anteile in Form von Aktien an den Markt gebracht, zur Gewinnung von frischem Kapital und auch zur Abfindung von Alt-Aktionären. Wer von ihnen das will, kann dabei aussteigen – oder drinbleiben und auf eine zusätzliche Wertsteigerung hoffen. Häufig gelingt es, über die Börse die Bewertung weiter kräftig nach oben zu treiben. Auch Big-Tech-Unternehmen könnten Interesse haben Bei Software- und anderen Hightech-Unternehmen finden an Stelle von Börsengängen oft auch Übernahmen durch Konkurrenten statt. Bei Unternehmens-Software hieße das, dass SAP oder Oracle vielleicht Interesse an dem hätten, was Celonis macht. Und wenn das Programm noch stärker verbreitet wäre, könnten auch Big-Tech-Unternehmen wie Google oder Microsoft für sich einen Sinn darin sehen, so etwas zu erwerben. In der Branche beobachtet man einander sehr genau. Ähnlich wie für gute Spieler von Fußball-Vereinen gibt es hier ein Scouting von guten Ideen. Und bevor ein anderer Software-Riese zuschlägt, kaufen Big Techs viele kleinere Konkurrenten reihenweise auf, damit sie kein anderer haben kann. Wenn also Celonis wirklich eine echte Umwälzung in Sachen Process Mining auslösen kann und zu einem Programm wird, das vielleicht jedes zweite Unternehmen in bestimmten Branchen haben will, dann dürfte es bald das sprichwörtliche Angebot eines Konkurrenten geben, das man nicht ablehnen kann. Berühmteste Newcomerin unter den Milliardären Neben den drei Münchner IT-Milliardären finden sich noch über 260 weitere Milliardärs-Neulinge auf der Liste. Die berühmteste Newcomerin hat in ihrer Branche bereits sämtliche Rekorde gebrochen: Popstar und Künstlerin Taylor Swift. Die 34-Jährige hat laut den Schätzungen von Forbes neben den Einnahmen aus ihren Musikverkäufen dank der Gewinne aus ihrer aktuellen Welt-Tournee die Milliarde-Dollar-Marke geknackt – und das mit 152 Konzerten auf fünf Kontinenten. Im Februar gewann Swift bereits zum vierten Mal den US-Musikpreis Grammy für das beste Album des Jahres und stellte damit einen Rekord auf. Damit ist sie laut Forbes die erste Musikerin, die allein durch ihre Musik ein Milliarden-Vermögen generiert hat. Unter den Milliardären gibt es zwar noch andere Musikgrößen wie Rihanna oder Jay-Z, doch die haben ihre Einnahmen auch aus anderen Geschäftszweigen wie Mode oder Alkoholvertrieb. Wie die Liste der Milliardäre entsteht Insgesamt sind auf der Forbes-Liste der weltweiten Milliardäre [externen Link, möglicherweise Bezahlinhalt] 256 Personen neu, aus Deutschland neben den Celonis-Gründern unter anderem die Fielmann-Erben. Insgesamt gibt es laut der Liste weltweit 2.781 Personen, die ein Vermögen von über einer Milliarde Euro besitzen. Milliardärs-Charts bedienen sich übrigens zumeist öffentlich zugänglicher Informationen zu Vermögenswerten wie Aktien, Immobilien, Kunstobjekten und anderen Luxusgütern. Die Angaben gelten als nicht exakt und sind teilweise auch umstritten. Mit Informationen von dpa und AFP. Transparenzhinweis: In einer früheren Fassung des Textes war die Position von Carsten Thoma im Unternehmen nicht korrekt benannt. Thoma ist nicht Co-CEO, sondern President bei Celonis. Das haben wir am 4.4.24 geändert. Im Audio: Musikerin Taylor Swift – ein weltweites Phänomen."
