a71c792a-2c37-4044-a5d3-e02ff453dd2b,2024-06-24 12:12:47,"JUVE: Als Sie 2007 als Chief Compliance Officer zu Siemens kamen, steckte der Konzern schon fast ein Jahr in der Untersuchung zu internationalen Korruptionsvorwürfen, die amerikanische Behörden initiiert hatten. Compliance war damals in Deutschland ein inhaltsleeres Fremdwort. Wie haben Sie die Leere gefüllt? Dr. Andreas Pohlmann: Zunächst einmal habe ich sie nicht alleine gefüllt, sondern gemeinsam unter anderem mit dem Vorstand und General Counsel Peter Solmssen. Wir kamen fast zeitgleich zu Siemens und haben uns – immer wieder auch in einem konstruktiven Streit – daran gemacht, die Krise zu managen, eine Compliance-Struktur aufzubauen und die Unternehmenskultur zu verändern. Das ist eine Menge auf einmal – was waren zentrale Elemente, um diese Aufgaben umzusetzen? Ein wichtiger Punkt war, dass Siemens mit einer neuen, völlig unbelasteten Unternehmensspitze weitermachen konnte, die die Notwendigkeit von Veränderung verstanden hatte. Es ist immer wieder schwierig, Alt-Vorständen und -Aufsichtsräten deutlich zu machen, dass sie letztlich die Verantwortung tragen und Konsequenzen ziehen müssen. An diesem Problem hat sich eigentlich bis heute nicht so viel geändert. Sie und Solmssen haben damals Unmengen von Interviews gegeben. Das ist nicht gerade die Kernzuständigkeit eines Juristen … Stimmt, aber es war essenziell, und das ist es bis heute. An der Reaktion vieler Unternehmen im Krisenfall hat sich seit damals wenig geändert: Es herrscht zunächst eine Mischung aus Panik und Schockstarre, verbunden mit Mauern oder Kleinreden. Das war schon 1993 in der Störfallkrise bei Hoechst so und bei Siemens nicht viel anders. Jemand muss überzeugend gegensteuern, um den Reputationsschaden nicht zu vergrößern und die Untersuchungsbehörden nicht gegen sich aufzubringen. Das ist aber auch eine Frage der Governance-Struktur, oder? Ja. Sie brauchen möglichst schnell nach einer Krise und dann auch dauerhaft einen glaubwürdigen Gatekeeper, der nicht für alle Risiken verantwortlich ist, aber sie im Auge hat. Sonst passiert sowas wie der Dieselskandal bei VW. Niemand – auch nicht die Rechtsabteilung – fühlte sich als Gatekeeper für die technische Compliance zuständig. Sie haben damals bei Siemens in relativ kurzer Zeit eine gigantische Compliance-Abteilung von mehr als 600 Mitarbeitenden aufgebaut. War das nötig? Definitiv. Eine fundamentale Veränderung in einem Unternehmen bedarf immer auch eines gewissen Drucks und sehr, sehr viel Kommunikation. Es ging darum, den Kulturwandel in jeden Winkel des Unternehmens zu tragen. Viele der neuen Compliance-Mitarbeitenden kamen aus dem Unternehmen, für sie war es auch eine Chance und ein Sprungbrett für andere Positionen. Als ich 2010 zu Ferrostaal kam, war das viel schwieriger. Da musste ich mir zum Beispiel von den Unternehmensjuristen anhören: „Das können wir nicht, das haben wir nicht gelernt.“ Dahinter steckt ja auch Angst – ist das nicht nachvollziehbar? In gewisser Weise schon. Eine Unternehmenskrise schafft, gerade wenn der interne und externe Druck zur Aufarbeitung groß ist, immer eine enorme Unsicherheit. Viele Mitarbeitende trauen sich kaum noch, eine Entscheidung zu treffen. Das habe ich bei Ferrostaal ebenso gesehen wie später als Chief Compliance Officer von SNC-Lavalin in Kanada. Auch in diesen Zeiten der Unsicherheit gilt: Reden, reden, reden. Wenn Sie heute in derselben Position wären wie 2007, was würden Sie anders machen? Tatsächlich sind die Grundlagen, einen notwendigen Veränderungsprozess zu managen und die weltweit passenden Governance-Strukturen zu etablieren, heute nicht so anders als damals. Ich war schon damals überzeugt, dass das ein ganzheitlich zu betrachtendes Thema ist. So haben wir es damals verstanden und so arbeiten wir auch als Berater in unserer Kanzlei. Was sich geändert hat, sind allerdings die Compliance-Inhalte und die gesellschaftlichen Erwartungshaltungen. Das heißt? Korruption und Kartellrecht waren seinerzeit die beherrschenden Risikofaktoren für die meisten Unternehmen. Die sind bis heute wichtig. Dazu kommen aber heute die Produkt- oder technische Compliance, die Analyse von Daten, etwa um Zahlungs- und Warenströme nachzuverfolgen, und ESG-Aspekte oder Datenschutz. Überfrachtet das eine Compliance-Funktion nicht? Es geht nicht darum, die Verantwortung für alles zu tragen, aber Standards zu entwickeln und skalierbare Prozesse. Die Compliance-Abteilungen sind prädestiniert, um Prozesse für neue Anforderungen wie das Lieferkettengesetz oder den KI-Act zu organisieren, denn sie sind inzwischen meist interdisziplinär besetzt. Aber zusätzlich braucht es auch den besagten Gatekeeper. Im angloamerikanischen Rechtsraum spricht man von dieser Position ja nicht umsonst vom General Counsel – das ‚General‘ ist durchaus ernst gemeint. „Legal Operations gehört ins Studium!“ Kontinentaleuropa ist aber ganz anders sozialisiert. Ja schon, aber das wird und muss sich ändern. Wie wichtig es ist, jemanden zu finden, der diese Rolle ausfüllt, habe ich gerade als Monitor bei Ericsson erlebt. Der Eintritt von Scott Dresser 2022, der Recht und Compliance im Management verantwortet, hat dort alles verändert. Aber auch er ist ein Amerikaner! Zugegeben! Aber mir würden auch ein paar deutsche Juristen einfallen, die das können. Das operative Management muss das dann aber auch aushalten und zuhören. Eigentlich sollte das unmittelbar einleuchten, denn die Rechtsprechung zu Verantwortung und Haftung von Vorstand und Aufsichtsrat ist doch in Deutschland sehr eindeutig. Das Modell der Deutschen Bahn mit einem freiwilligen Monitorship könnte daher auch durchaus Schule machen, denn so kann der Aufsichtsrat relativ gut nachweisen, dass das Unternehmen ein effektives Compliance-System und den richtigen kulturellen Ansatz hat. Was muss ein deutscher Jurist unbedingt noch lernen, um Compliance-Autoritätsperson zu werden? Legal Operations gehört ins Studium oder Referendariat, ebenso Kommunikation und Krisenmanagement. Auch ein ausgeprägtes Prozessverständnis ist heute zwingend – es ist eben nicht jeder Fall anders. Und last but not least eine hohe Bereitschaft, interdisziplinär zu arbeiten. Meines Erachtens gehören auch Themen wie Ethik und Integrität in die Ausbildung – nicht nur bei Juristen, sondern auch bei den BWLern. Ein Seminar über Rechtsphilosophie ist da ein bisschen wenig. Lassen Sie uns zum Schluss noch ein bisschen Kaffeesatz lesen: Welche Herausforderungen kommen auf ein so breit angelegtes Legal Risk Management zu? Viele. KI wird zwar das ein oder andere erleichtern, etwa die Due Diligence von Drittanbietern, Geheimhaltungsverträge oder Geschenkerichtlinien. Aber das ist am Ende ein Tropfen auf dem heißen Stein. Die Regelungsdichte wird weiter zunehmen und mit ihr auch der Druck auf die Unternehmen, also den Vorstand und den Aufsichtsrat. In den USA zeichnet sich bereits ab, dass die Strafverfolgung härter werden wird. Auch geopolitisch wird die Lage eher noch schwieriger werden. Damit werden Sanktionen immer mehr zu einem Inhouse-Thema. Bei vielen Unternehmen ist die Risikoanalyse in diesem Punkt noch zu schwach. Lassen Sie uns bitte auf einer positiveren Note aufhören! Gerne! Die Bedeutung von Recht, Compliance und Revision wird deutlich zunehmen. Und eines ist auch klar: Die meisten Mitarbeitenden wollen ja alles richtig machen. Letztlich geht es also um Guidance und Kultur. Und da bietet die Frage „Will ich das, was ich gerade tue, auf Seite 1 der Zeitung lesen?“ schon eine ganz ordentliche Orientierung. Zur Person: Dr. Andreas Pohlmann war gerade einmal vier Jahre im Job, als er erstmals in einem Krisenstab saß: 1993 kam es bei Hoechst zum sogenannten Rosenmontags-Unfall, einem Störfall, bei dem ein chemisches Gemisch als ,gelber Regen‘ niederging. Pohlmann war dort unter anderem Leiter der Aufsichtsratsangelegenheiten und Leiter der Government Relations. Ab 2000 sammelte er erste US-Erfahrungen bei Celanese. Dort war er in den folgenden Jahren unter anderem Vorstandsvorsitzender der deutschen AG und Mitglied des internationalen Executive Committees. 2007 übernahm er seine wohl bekannteste Position: Er wurde Chief Compliance Officer bei Siemens, die gerade bis zum Hals in einer internationalen Korruptionsaffäre steckte. Rund drei Jahre lang baute er dort die Compliance-Abteilung auf und führte gemeinsam mit Vorstand Peter Solmssen den Konzern durch die Krise und die durch die US-Behörden initiierte interne Untersuchung. 2010 rückte er in den Vorstand von Ferrostaal auf, ein weiteres Unternehmen mit Korruptionsproblemen. 2012 gründete er Pohlmann & Company, sein eigenes Beratungsunternehmen für Compliance und Governance. Aufgaben in Unternehmen übernahm er jedoch weiterhin. 2013 als Chief Compliance Officer des Baukonzerns SNC-Lavalin, der damit als erster in Kanada nach einer Krise eine Compliance-Funktion etablierte. 2015 rückte Pohlmann schließlich in ein Sonderkomitee des halbstaatlichen brasilianischen Ölkonzerns Petrobras auf, das den sogenannten Lava-Jato-Korruptionsfall intern untersuchen sollte – einen der größten Korruptionsskandale weltweit. 2016 beriefen ihn das US-Justizministerium und die US-Börsenaufsicht parallel zum südamerikanischen Engagement als Monitor für das niederländische Telekommunikationsunternehmen Veon. 2020 folgte das zweite Monitorship im Auftrag der Amerikaner: Pohlmann übernahm die Rolle bei der schwedischen Mobilfunkfirma Ericsson. Schon zu Beginn des Auftrags stand fest, dass dies sein letztes großes juristisches Projekt sein würde."
ede01c73-d346-417d-b00e-7f79fde9e6a2,2024-06-24 12:27:15,"Im ersten Halbjahr dieses Jahres hat es so viele Insolvenzen gegeben wie seit fast zehn Jahren nicht mehr. Auch Privatleute sind öfter betroffen. Arbeitsplätze sind durch die Insolvenzen nicht zwangsläufig in Gefahr. Die Zahl der Unternehmensinsolvenzen in Deutschland ist wegen der schwachen Konjunktur in den ersten sechs Monaten des Jahres um fast 30 Prozent im Vorjahresvergleich angestiegen. Die Auskunftei Creditreform registrierte rund 11.000 Firmenpleiten, wie sie heute mitteilte. Das markiere den höchsten Stand seit fast zehn Jahren. Zuletzt hatte es so viele Insolvenzen im Jahr 2016 gegeben. Im ersten Halbjahr 2024 mussten laut Creditreform deutlich mehr mittlere und große Unternehmen Insolvenz anmelden. Besonders betroffen sei die Dienstleistungsbranche, sie verzeichnete 6.500 Pleiten und legte damit um knapp 35 Prozent zu. Einen starken Anstieg gab es auch im Handel (plus 20,4 Prozent), im Baugewerbe (plus 27,5) und im verarbeitenden Gewerbe (plus 21,5). Vor allem bei größeren Unternehmen liegt das Insolvenzgeschehen weit über dem Niveau der vergangenen Jahre. Insolvenz kann auch Sanierungsperspektive bringen Nach Schätzungen von Creditreform waren rund 133.000 Beschäftigte im Zeitraum von Januar bis Juni 2024 von einer Insolvenz betroffen. Im Vorjahreszeitraum waren es etwas weniger gewesen - 125.000. Creditredorm betont, das heiße nicht unbedingt, dass diese Menschen ihren Job verlieren: Der Fokus des Insolvenzrechts liege auf Sanierungen und auf dem Erhalt von Unternehmen sowie Arbeitsplätzen, erläuterte Patrik-Ludwig Hantzsch, Leiter der Creditreform Wirtschaftsforschung. Das erkläre zum Teil auch den Anstieg der Fallzahlen in den vergangenen Jahren. Unternehmen würden die Insolvenz ""zunehmend als Chance in der Krise"" begreifen. Auch Verbraucher melden öfter Insolvenz an Auch bei den Verbraucherinnen und Verbrauchern stiegen die Insolvenzzahlen im ersten Halbjahr: Creditreform registrierte 35.400 Fälle und damit 6,7 Prozent mehr als im Vorjahreszeitraum. Dafür dürfte neben der hohen Inflation und der Zinswende, die zu höheren Darlehenszinsen führte, auch weiterhin die Novelle des Verbraucherinsolvenzrechts Ende 2020 verantwortlich sein, erklärte die Auskunftei: Die Reform ermöglicht Privatpersonen eine schnellere Restschuldbefreiung und macht das Verfahren für Schuldner so interessanter. Creditreform rechnet damit, dass im weiteren Verlauf des Jahres die Insolvenzen weiter zunehmen und im Gesamtjahr erstmals wieder das Vor-Corona-Niveau übersteigen werden. In den Zahlen spiegelten sich die ""aufgestauten Probleme der zurückliegenden Krisen"", so die Auskunftei. Viele Unternehmen hätten zudem ein Schuldenproblem und könnten aufgrund der schlechten Wirtschaftslage den Zahlungsverpflichtungen aus eigener Kraft derzeit kaum nachkommen."
c4071c19-de80-40ab-b6de-e26c9fb9fa6a,2024-06-24 12:54:31,"Erst vor einer Woche hat das Ifo-Institut seine Konjunkturprognose nach oben angehoben – doch heute ist der leichte Optimismus schon wieder verflogen. Der Ifo Geschäftsklimaindex, der die Stimmung in den Chefetagen widerspiegelt, ist von 89,3 auf 88,6 Punkte gefallen. Im April lag der Wert noch bei 89,4. ""Wir hatten ein paar positive Konjunkturdaten in den letzten Monaten, mit den Zahlen heute allerdings fürchte ich, dass diese kleine Aufhellung schon wieder in Frage gestellt ist."" Prof. Clemens Fuest, Präsident Ifo-Institut Dabei hat sich die aktuelle Geschäftslage kaum verändert, aber viele Unternehmen sind einfach pessimistischer, was die nächsten Monate angeht. Das zentrale Problem, vor allem im verarbeitenden Gewerbe und in der Bauindustrie, sind die fehlenden Aufträge. Und die wiederum haben viel mit dem mangelnden Vertrauen der Investoren zu tun. ""Wir sind ja bei den Investitionen immer noch unter dem Niveau von 2019, dabei müssten die Investitionen eigentlich steigen, denn wir haben so viele Themen: Dekarbonisierung, Strukturwandel, aber es fehlt da einfach das Vertrauen."" Prof. Clemens Fuest Gemeint ist das Vertrauen in den Standort Deutschland. Helfen könnte derzeit nur eine Verbesserung der Rahmenbedingungen durch die Politik, so Fuest. Doch die lasse auf sich warten. Sektoren zeigen unterschiedliche Entwicklungen Im Verarbeitenden Gewerbe hat das Geschäftsklima nach drei Anstiegen in Folge einen Rückschlag erlitten. Die Unternehmen waren für die kommenden Monate wieder skeptischer. Insbesondere der sinkende Auftragsbestand bereitete den Firmen Sorgen. Mit den laufenden Geschäften waren sie jedoch etwas zufriedener. Im Dienstleistungssektor ist der Index gestiegen. Die Dienstleister beurteilten ihre aktuelle Lage besser. Auch der Ausblick auf das zweite Halbjahr hellte sich weiter auf. Insbesondere im Beherbergungsgewerbe besserte sich die Stimmung, während die Gastronomie sich eher unzufrieden zeigte. Im Handel hat sich das Geschäftsklima merklich verschlechtert. Bei den Geschäftserwartungen nahmen die skeptischen Stimmen deutlich zu. Auch die Urteile zu den laufenden Geschäften wurden nach unten korrigiert. Von der schlechten Entwicklung waren der Groß- und Einzelhandel gleichermaßen betroffen. Im Bauhauptgewerbe hat der Index leicht zugelegt. Dies war auf weniger pessimistische Erwartungen zurückzuführen. Die aktuelle Lage wurde hingegen schlechter beurteilt. Auftragsmangel bleibt ein zentrales Problem. Experte sieht Dauerstagnation Die Beurteilung der Lage trete auf der Stelle, die Erwartungen trübten sich wieder ein – und das alles auf ohnehin niedrigem Niveau. So kommentierte ein Analyst der Landesbank Baden-Württemberg (LBBW) den aktuellen Ifo-Geschäftsklimaindex. ""Diese Zahl ist so schlecht wie sie aussieht. Ein Aufschwung findet in Deutschland nicht statt. Derzeit ist unklar, woher der erhoffte Wachstumsschub für das Jahr 2025 kommen soll."" Jens-Oliver Niklasch, LBBW Vermutlich sei die Wirtschaftsleistung im laufenden zweiten Quartal nahe der Stagnation und für das dritte Quartal fehle ebenfalls die Phantasie für bessere Zahlen. ""Und so richtet man sich allmählich in der Dauerstagnation ein"" sagte Niklasch. Mit Informationen von Reuters"
e0d7dbbc-ec50-4ec1-b0be-40fac1a97435,2024-06-24 13:03:54,"Das Wachstumschancengesetz der Bundesregierung mit Entlastungen für Firmen war nach einem Vermittlungsverfahren von Bundesrat und Bundestag vom Volumen her deutlich geringer ausgefallen als geplant. Scholz sagte auf die Frage, ob sich die Koalition auf einen Entwurf zum Haushalt 2025 einige: „Ja.“ Es sehe sehr danach aus. Der Entwurf solle im Juli vom Kabinett beschlossen werden. In der Bundesregierung laufen derzeit Verhandlungen über den Bundeshaushalt 2025. Es müssen Milliardenlöcher gestopft werden. Mehrere Ressorts wollen Sparvorgaben von Finanzminister Christian Lindner (FDP) nicht einhalten. Die Koalition plant außerdem ein „Dynamisierungspaket“, um das Wachstum anzukurbeln. Scholz sagte, das Arbeitsangebot solle ausgeweitet werden, indem freiwilliges, längeres Weiterarbeiten deutlich attraktiver gemacht werde. Zudem sollten die Erwerbstätigkeit von Eltern erleichtert und Arbeitsanreize erhöht werden, auch steuerlich. „Zukunftsinvestitionen“ an erster Stelle Der Kanzler sagte weiter, „Zukunftsinvestitionen“ für Deutschland würden auch im nächsten Jahr hohe Priorität haben. Er sagte weiter mit Blick auf Energiepreise und den klimafreundlichen Umbau der Wirtschaft, ihm sei bewusst, dass die Transformation wegen eines unterschiedlichen Niveaus der Energiepreise weltweit eine Herausforderung für den Standort Deutschland darstelle. Er verwies auf Entlastungsmaßnahmen der Bundesregierung wie die Absenkung der Stromsteuer auf den europäischen Mindestsatz für produzierende Unternehmen. Die Bundesregierung spreche derzeit intensiv darüber, wie Entlastungen verstetigt werden könnten, machte der Kanzler deutlich. Unternehmen sollten Klarheit bekommen. Scholz versprach außerdem mehr Tempo etwa bei Planungs- und Genehmigungsverfahren und beim Ausbau der Stromnetze."
8f13d403-2ef3-45a6-8e1c-bc7961aa122a,2024-06-24 13:38:21,"414 Die Frühjahrs-Konjunktur-Umfrage der IHK Köln zeigt, dass sich die Industrie weiter in äußerst schwierigem Fahrwasser bewegt. Die Erwartungen der Unternehmen sind weiterhin negativ, auch wenn die Aussichten insgesamt nicht mehr ganz so trüb sind wie zu Jahresbeginn. Als Hauptprobleme sieht die IHK die schwer berechenbare Energie- und Klimapolitik mit ihren zeitlichen Vorgaben, die ständig wachsende Bürokratie sowie den Fachkräftemangel. Dr. Uwe Vetterlein, Hauptgeschäftsführer der IHK Köln, über die aktuelle Situation: „Die weniger schlechten Aussichten dürfen nicht über die strukturellen Risiken hinwegtäuschen.“ Die Politik sei nun gefordert, den Unternehmen schnellstmöglich eine schlüssige Perspektive für Investitionen in Deutschland aufzuzeigen. Die Unternehmen müssten Vertrauen in den Standort Deutschland zurückgewinnen. Deutschland dürfe den Anschluss an andere Industrienationen nicht noch weiter verlieren, so Vetterlein weiter. Ergebnisse für den gesamten IHK-Bezirk Der Konjunkturklimaindikator drückt die Gesamtstimmung der Wirtschaft aus. Im Frühjahr stieg er leicht auf 95 Punkte gegenüber 89 Punkten zu Jahresbeginn. Damit liegt er weiterhin deutlich unter dem jahrelang anhaltenden Durchschnitt von 109,6 Punkten. 23 Prozent der Unternehmen bezeichnen ihre Lage als schlecht. Das sind zwar zwei Prozent weniger als zu Jahresbeginn, trotzdem bleibt die Geschäftslage weiter angespannt. Denn nur noch 24 Prozent beurteilen ihre Lage als gut. Die Vorumfrage ergab hier noch 29 Prozent. Nur die noch recht gute Lage der Dienstleistungsunternehmen verhindert ein Abgleiten ins Minus. Insgesamt fallen die Aussichten der Unternehmen in allen Branchen weniger schlecht aus, was hoffen lässt, dass die Talsohle erreicht ist. So erwarten mit 14 Prozent mehr Unternehmen als vorher (Vorumfrage: 10 Prozent), dass sich die Geschäfte verbessern. Schlechtere Ergebnisse erwarten nur noch 24 Prozent (vorher 35 Prozent). Insgesamt betrachtet bewegen sich die Erwartungen aber im negativen Bereich. Weniger Investitionen Die insgesamt schlechte Lage schlägt sich auch, laut Konjunkturumfrage, nach wie vor auf die Investitionsneigung der Unternehmen nieder. 24 Prozent planen höhere Investitionen, 31 Prozent wollen jedoch weniger investieren. Auch wenn dies eine leichte Verbesserung gegenüber der Vorumfrage darstellt, erklärt Vetterlein: „Klar wird aber, dass Industrie und Handel deutlich weniger investieren wollen und der Dienstleistungsbereich die schlechten Zahlen nach oben zieht. Das darf nicht darüber hinwegtäuschen, dass die zukünftige Wettbewerbsfähigkeit unserer Unternehmen auf dem Spiel steht!“ Die Situation auf dem Arbeitsmarkt bleibt aufgrund der schwachen Nachfrage und der unklaren wirtschaftspolitischen Rahmenbedingungen weiter schwierig. Der Beschäftigungsindikator bleibt bereits zum dritten Mal im Minus. Das bedeutet hier, dass 24 Prozent mehr Unternehmen Personal abbauen wollen und 15 Prozent weniger Unternehmen Personal einstellen. In der Konsequenz stieg im Bezirk der IHK Köln die Arbeitslosenquote leicht an. Dr. Uwe Vetterlein: „Sichtbares Zeichen für einen schwierigeren Arbeitsmarkt ist, dass sich auch die Anzahl der offenen Stellen im Vergleich zum Vorjahr verringert hat.“ Besorgniserregend findet Vetterlein auch, dass 42 Prozent der Unternehmen laut Umfrage von Finanzierungsproblemen sprechen und 19 Prozent sogar über die Liquidität. Im Vergleich zur Vorumfrage haben sich die Finanzierungsbedingungen aber nicht weiter verschärft, was der sich etwas abschwächenden Inflation zuzuschreiben ist. Lage der Unternehmen in Köln leicht verschlechtert In Köln beurteilen 29 Prozent der Unternehmen (Vorumfrage: 31 Prozent) ihre aktuelle Lage als gut. 24 Prozent (vorher 29 Prozent) sehen ihre Lage als schlecht. Zudem wollen 31 Prozent weniger und nur noch 25 Prozent mehr investieren und 24 Prozent der Betriebe Stellen abbauen gegenüber 19 Prozent, die Arbeitsplätze schaffen wollen. Als Hauptrisiken sehen 57 Prozent der Kölner Unternehmen den Fachkräftemangel, 57 Prozent die Inlandsnachfrage und 53 Prozent die wirtschaftspolitischen Rahmenbedingungen. Unveränderte Lage im Rheinisch-Bergischen Kreis Im Rheinisch-Bergischen Kreis erscheint die Lage unverändert. Zwar betrachten mit 16 Prozent weniger Unternehmen als zu Beginn des Jahres (23 Prozent) ihre Lage als gut, aber mit 19 Prozent (30 Prozent) bezeichnen auch weniger Unternehmen ihre Situation als schlecht. Insgesamt sind die Betriebe hier weniger pessimistisch, denn elf Prozent (vorher fünf) gehen von einer Verbesserung aus. Und nur noch 25 Prozent (gegenüber 42 Prozent) gehen von einer schlechteren Entwicklung in den nächsten zwölf Monaten aus. Hauptrisiken sind für 59 Prozent die Inlandsnachfrage, für 58 Prozent der Fachkräftemangel und für 56 Prozent die wirtschaftspolitischen Rahmenbedingungen. Rhein-Erft-Kreis mit kleinen Veränderungen Wenig Veränderungen gibt es im Rhein-Erft-Kreis. 24 Prozent der Unternehmen (Vorumfrage: 24 Prozent) sehen die Lage als gut an, 20 Prozent als schlecht (vorher 24 Prozent). Deutlich besser sehen die Erwartungen für die kommenden zwölf Monate aus. Weiterhin acht Prozent sehen eine bessere Geschäftsentwicklung, allerdings nur noch 19 Prozent (38 Prozent) eine schlechtere. Hier gehen rund drei Viertel Unternehmen von einer gleichbleibenden Situation aus. Risiken für die wirtschaftliche Entwicklung sehen die Betriebe zu 66 Prozent im Fachkräftemangel, zu 52 Prozent in der Inlandsnachfrage und 48 Prozent in den Energiepreisen. Schlechtere Ergebnisse für den Oberbergischen Kreis Verschlechtert hat sich die Lage im Oberbergischen Kreis. Nur noch 13 Prozent der Unternehmen (vorher 16 Prozent) bewerten ihre Lage als gut, 33 Prozent dagegen eher schlecht (31 Prozent). Allerdings blicken sie dafür deutlich positiver in die Zukunft. 15 Prozent (vorher 10) sind überzeugt, dass sich ihre Lage in den kommenden zwölf Monaten verbessert. Zudem glauben nur noch 24 Prozent (vorher 44 Prozent) an eine schlechtere Entwicklung. Hier sehen 71 Prozent der Unternehmen die Hauptrisiken für die Zukunft in der Inlandsnachfrage, 58 Prozent in den Arbeitskosten und 57 Prozent im Fachkräftemangel. (Monika Eiden)"
