92f7c7ad-a7d4-4dcb-9c04-8ed6bb057cc4,2023-12-01 14:44:18+00:00,"Es passierte nicht von heute auf morgen. Der Aufstieg Erlangens zum größten Siemens-Standort weltweit zog sich über Jahre und Jahrzehnte hin, und viele Menschen aus der Region können dazu Geschichten erzählen. Saskia Kraußer zum Beispiel, seit 25 Jahren ist sie Siemens-Betriebrätin. Sie wuchs im fränkischen Ort Kersbach bei Forchheim auf, und ""gefühlt war da jeder Zweite bei Siemens"", sagt sie. Wer Kinder hatte, sagte denen: ""Siemens ist ein sicherer Arbeitsplatz, fangt da an."" Ihr Kollege Mario Savio kommt aus der Gegend von Bamberg, und auch da habe man seinen Kindern jahrzehntelang eingebläut: Gehe nicht auf den Bau, gehe nicht in die Landwirtschaft, gehe lieber in die Industrie. ""Am besten zu Siemens, die haben einen guten Namen."""
f050a145-596a-4393-a3dc-23ca546a52ce,2023-12-04 08:09:50+00:00,Einsatz auf vier Pfoten Siemens
30fce636-5fe2-432a-ade1-6a7de69a7043,2023-12-04 15:59:00+00:00,"Prestigeprojekt für Siemens: Der Münchner Technologiekonzern unterstützt den US-Chipriesen Intel bei der Umstellung seiner Fabriken auf eine neue Produktionstechnik, die kleinere Chip-Strukturen ermöglicht. Bei der auf drei Jahre angelegten Zusammenarbeit gehe es um eine höhere Effizienz in den Chip-Fabriken und dabei vor allem um eine verbesserte Energieeffizienz, wie die beiden Unternehmen am Montag mitteilten. Um besser mit dem taiwanischen Marktführer TSMC mithalten zu können, nimmt Intel Milliarden in die Hand, um die Produktion auf die EUV-Lithographie umzustellen. Effizienz im Fokus ""Intel hat große Expansionspläne, aber wir wollen sicherstellen, dass wir das mit äußerster Konzentration auf die natürlichen Ressourcen und unsere Verpflichtungen zu Netto-Null-Emissionen machen"", sagte Keyvan Esfarjani, der bei Intel für das operative Geschäft verantwortlich ist. Die EUV-Technologie, die mit ultravioletter Strahlung arbeitet, verbraucht sehr viel Energie und ist so zentral für die moderne Chipherstellung, dass wichtige Teile der Produktion drumherum angeordnet werden. Siemens verspricht sich davon Lerneffekte, um diesen Aufbau der Produktion auch auf andere Bereiche übertragen zu können. ""Andere Branchen gehen auch in diese Richtung"", sagte Cedrik Neike (50), der Chef der Industrieautomatisierungs-Sparte Digital Industries. ""(Halbleiter) sind die ersten, die sich das tatsächlich anschauen."" Neike verglich die Zusammenarbeit mit Intel mit jener, die Siemens mit dem Stuttgarter Autobauer Mercedes-Benz hat. Dort geht es um die Umstellung von Verbrenner- auf Elektromotoren. Siemens auch in Magdeburg involviert Für 30 Milliarden Euro baut Chipgigant Intel derzeit die neue Fabrik in Magdeburg, zehn Milliarden soll es vom Staat dazugeben. Zahlreiche Aufträge beim Bau und der Ausrüstung winken dadurch Siemens-Chef Roland Busch (59). Baustart für die Anlage in Magdeburg soll Ende 2024 sein, Vorarbeiten laufen schon. Produktionsstart ist frühestens 2027. Durch das Karlsruher Urteil ist die Förderung der Chipfabrik in Magdeburg allerdings derzeit unsicher. Intel ist aber zuversichtlich und hält an seinen Plänen fest. „Wir sind entschlossen, unser Vorhaben in Magdeburg wie geplant durchzuziehen“, sagte Esfarjanai gegenüber der ""Frankfurter Allgemeinen Zeitung"". Dafür arbeite man viel mit der Bundes- wie auch mit der Landesregierung von Sachsen-Anhalt zusammen."
cd040b79-62e0-402b-ab3b-304ed825b504,2023-12-04 18:12:00+00:00,"Startseite Region Wetteraukreis Veränderung an Firmenspitze Büdingen (red). Leinberger-Bau in Büdingen, ein Unternehmen der Vitronet-Gruppe, der hessische Generalunternehmer für die Umsetzung von technischen Infrastrukturprojekten, hat Jürgen Richter in die Geschäftsführung berufen. Das teilte die Firma Leinberger-Bau nun in einer Presseerklärung mit. Jürgen Richter kommt von den Stadtwerken Waiblingen, wo er in den vergangenen Jahren als Leiter im Bereich Service und Netze für die Technik in Bezug auf Neubaumaßnahmen, Entwicklung, Service und Instandhaltung verantwortlich zeichnete. Jens Günther, Vorsitzender der Geschäftsführung der Vitronet-Gruppe, ist überzeugt, mit Richter den richtigen Kandidaten für die erfolgreiche Entwicklung von Leinberger-Bau gefunden zu haben. »Herr Richter ist ein technisch versierter Ingenieur mit tiefem Verständnis für das operative Geschäft, der bereits langjährige Erfahrung in der Planung und Umsetzung von anspruchsvollen Bauprojekten im In- und Ausland gesammelt hat. Er überzeugt durch fachliche und soziale Kompetenz, die Fähigkeit zu termintreuer Planung sowie klarer Kommunikation. Ich freue mich auf die Zusammenarbeit und wünsche ihm viel Erfolg«, so Jens Günther. Über 30 Jahre Erfahrung Richter ist diplomierter Ingenieur für Maschinenbau/Energietechnik, verfügt über mehr als 30 Jahre Erfahrung in der Baubranche und war in verschiedenen Führungspositionen marktführender Unternehmen, zum Beispiel bei Siemens Energy, Mitsubishi Power und Bilfinger Mauell, tätig. Beim Traditionsunternehmen Leinberger, dessen 120 Mitarbeiter mit Stolz auf mehr als 60 Jahre Unternehmensgeschichte zurückblicken, wird sich Richter auf die Erarbeitung und Umsetzung eines Entwicklungsplanes mit klarer Ausrichtung auf Versorgungsinfrastruktur (Kabel, Strom, Nah- und Fernwärme, Gas) in der Region konzentrieren und so für neue Impulse und Wachstum sorgen. Mit Bauleistungen aus einer Hand haben sich die Büdinger Spezialisten für Leitungs-, Tief- und Straßenbau in der Region einen Namen gemacht, zum Kundenstamm zählen Provider, Energieversorger, Kommunen, Gewerbebetriebe, Bauunternehmen wie auch Privatkunden. Darauf baut der neue Geschäftsführer auf. »Qualität, Zuverlässigkeit, Termintreue und ein hohes Maß an Innovation sind unsere Grundwerte und das Erfolgsrezept des Unternehmens. Daran glaube und dafür stehe ich. Insbesondere liegt mir die Weiterentwicklung des Unternehmens in Richtung Baudienstleister mit hohem Beratungs- und Planungsanteil am Herzen, denn unsere Kunden schätzen nicht nur unsere Umsetzungsstärke, sondern auch das Know-how des Teams«, so Jürgen Richter. »Ich freue mich sehr auf die Zusammenarbeit mit den Kollegen und darauf, die Infrastruktur Hessens, aber auch Deutschlands aktiv mitzugestalten. Im Verbund mit Vitronet schaffen wir neue Verbindungen.« Mit Henoch Leinberger bildet Richter seit November die Doppelspitze der Leinberger-Bau GmbH. FOTO: RED"
bbe3a65b-85e4-4632-a03f-c707f36b36b0,2023-12-06 12:48:08+00:00,"Aldi Nord will die Onlineplattform X, ehemals Twitter, Anfang 2024 verlassen. Das berichtet das „Handelsblatt“ und beruft sich auf eine eigene Umfrage. Grund für den Rückzug ist demnach ein Werbefoto, das das Unternehmen Anfang November auf X veröffentlicht hatte. Darauf ist ein farbiger Mann zu sehen, der hinter einer weißen Frau durch einen Wald geht – eigentlich eine harmlose Werbung für Übergangsjacken. Doch Aldi Nord sah sich einer Flut von rassistischen Kommentaren ausgesetzt und beklagte sich, dass X kaum dagegen vorgehe. Nun will sich Aldi Nord, das seinen Account erst 2021 angelegt hatte, wieder vom Kurznachrichtendienst verabschieden. Weiterlesen nach der Anzeige Aldi Nord ist nicht allein mit dieser Entscheidung: Das „Handelsblatt“ fragte alle 40 Dax-Konzerne und die 20 größten Werbetreibenden aus Deutschland und kam zu dem Ergebnis, dass nur wenige große Unternehmen noch Werbebudgets für Elon Musks Social-Media-Plattform einplanen. Von 28 Dax-Konzernen, die geantwortet haben, haben acht – unter anderem die Allianz, BASF, Covestro und Mercedes – bezahlte Werbung auf X eingestellt, fünf weitere – darunter Volkswagen, Siemens und RWE – beendeten ihre Werbeaktivität auf X bereits vor einem Jahr. „Bedenken bei der Markensicherheit“ 13 Unternehmen – zum Beispiel Daimler Truck, die Deutsche Bank, Rheinmetall, Zalando und Infineon – verzichten ohnehin auf Anzeigen bei X. Laut Andreas Meffert, Vertriebsleiter Deutschland des Marktforschungsunternehmens Nielsen Media, habe der Dienst für hiesige Werbekunden seit jeher eine geringere Rolle als andere Social-Media-Plattformen gespielt, weil in Deutschland weniger Menschen X nutzen als in anderen Ländern. Weiterlesen nach der Anzeige Die Firmen aber, die bisher auf der Plattform geworben haben, fürchten nun um ihre Marke. Siemens Energy besiegelte das Ende seiner Werbemaßnahmen auf X im September, „als sich immer mehr herauskristallisiert hat, dass diskriminierenden Posts kaum bis gar kein Einhalt geboten wird“. Volkswagen hat dem Bericht zufolge seinen Marken schon im November 2022 empfohlen, ihre Werbeaktivitäten auf X „aufgrund von Bedenken bei der Markensicherheit bis auf Weiteres zu pausieren“. Merck nennt als Grund „die allgemein massiv gestiegene Menge an Hasskommentaren, Hetze und Falschmeldungen“, die man sehr kritisch sehe. Nicht nur in Deutschland springen Elon Musk die Werbekunden ab. Auch Apple, IBM oder Disney haben keine Lust mehr – sehr zum Unmut des Unternehmers. Der ließ Werbekunden, die ihre Anzeigen stornieren, wissen: „Go fuck yourself!“. „Beispielloser Rückgang für ein Social-Media-Unternehmen“ Musk hat nach der Übernahme von Twitter zahlreiche Änderungen vorgenommen. Er hat an den Moderationsteams gespart und stattdessen die sogenannten Community Notes eingeführt, in denen Nutzende selber kommentieren können, ob sie Inhalte vertrauenswürdig finden. Den blauen Haken, der damals für verifizierte Firmen, Institutionen oder Prominente stand, erhalten heute beliebige Nutzer gegen Bezahlung – ohne Überprüfung ihrer Identität. Weiterlesen nach der Anzeige Diese Entscheidungen sind fatal für X, das den Großteil seiner Einnahmen mit Werbung erzielt. Seit Elon Musk das Unternehmen übernommen hat, ist das Werbegeschäft eingebrochen. Das Marktforschungsunternehmen Insider Intelligence prognostizierte, dass die Werbeerlöse von X 2023 um 54 Prozent sinken werden – und das bereits vor der jüngsten Kontroverse. Das sei „ein beispielloser Rückgang für ein Social-Media-Unternehmen“, sagt Analystin Jasmine Enberg. Soziale Netzwerke sind eigentlich ein wachsender Bereich im Werbemarkt, weil Unternehmen hier Nutzerinnen und Nutzer gezielter ansprechen und Streuverluste vermeiden können. X will kleine Unternehmen umwerben Unter den Dax-Konzernen gab einzig Continental an, seine Werbeaktivitäten bisher nicht eingestellt zu haben. Jedoch spiele Werbung auf X „nur eine sehr untergeordnete Rolle“. Man beobachte die Entwicklung der Plattform weiter und bewerte das Vorhaben regelmäßig neu. Auch 1&1 antwortete, alle Social-Media-Kanäle weiterhin mit Bezahlmaßnahmen zu bespielen und Änderungen fortlaufend zu überprüfen. Derweil bemüht sich X um kleine und mittlere Unternehmen als Werbekunden und erklärte der „Financial Times“ am Freitag, sie seien „ein sehr wichtiger Motor, den wir lange unterschätzt haben“."
ea7d4861-d5c7-4b17-93b0-752252cd6fd8,2023-12-06 21:12:47+00:00,"Während dem DAX der zweite Rekordtag in Folge gelang, gerieten die Kurse in New York unter Druck. Neben der Zinsdiskussion beschäftigten die fallenden Ölpreise den Markt. Anders als die europäischen Märkte konnten die Börsen in New York zur Wochenmitte keine Dynamik entfalten. Der Dow Jones musste seine frühen Gewinne wieder abgeben und schloss 0,19 Prozent tiefer. Besonders die Kursverluste großer Ölkonzerne wie Exxon Mobil und Marathon Oil im Zuge des anhaltenden Ölpreisverfalls bremsten den Markt aus. Die Technologietitel gerieten im Verlauf noch stärker unter Druck. Der Nasdaq 100 gab 0,56 Prozent ab. Vom Arbeitsmarkt waren zuvor für die Börse eher günstige Daten gekommen. Die US-Unternehmen haben im November laut einer Umfrage des Personaldienstleisters ADP weniger Stellen geschaffen als von Experten erwartet. Unter dem Strich entstanden demnach 103.000 Jobs. Das schürte Hoffnungen auf eine baldige Lockerung der Geldpolitik der US-Notenbank Fed. ""Diese Daten sind genau das, worauf die Investoren gehofft haben: ein schwächeres Beschäftigungswachstum, das die Inflationsgefahr verringern kann"", sagte Peter Cardillo, Chefvolkswirt beim Finanzdienstleister Spartan Capital Securities. Im Gegensatz zum DAX haben die US-Indizes noch keine neuen Bestmarken aufgestellt. Allerdings sind sie mit dem deutschen Leitindex auch kaum vergleichbar: Der Dow Jones ist ein reiner Kurs-Index, während der DAX ein sogenannter Performance-Index ist. In seine Berechnung fließen also auch die gezahlten Dividenden der Unternehmen mit ein. Erreicht ein Aktienindex historische Höhen, lockt dies weitere Anleger an, die an den steigenden Kursen teilhaben wollen. Daher gilt ein Rekordhoch als eines der besten Kaufsignale, welche die Technische Analyse zu bieten hat. Dieses Phänomen war auch zur Wochenmitte zu beobachten. Der DAX erreichte im Verlauf einen Rekordstand von 16.727 Punkten und übertraf damit die erst am Dienstag erreichte Bestmarke von 16.551 Punkten. Am Ende schloss der Leitindex bei 16.656 Zählern, ein Plus von 0,75 Prozent. Zinssenkungsfantasien beflügelten die Kurse, machen sinkende Zinsen doch riskantere Anlagen, etwa in Aktien, attraktiver. ""Der Flurfunk an den Börsen vermeldet bereits Gerüchte, dass die Federal Reserve früher als erwartet die Zinswende einleiten werde. Solche Gedankenspiele beflügeln die Fantasie der Anleger und liefern den Treibstoff, dass auch Allzeithochs weiter gekauft werden"", sagte Frank Sohlleder, Marktanalyst für ActivTrades. An den Terminmärkten wird mit einer Wahrscheinlichkeit von mittlerweile mehr als 75 Prozent auf eine erste Zinssenkung der europäischen Währungshüter im März getippt. Bei der US-Notenbank Fed sind es rund 62 Prozent. Bezogen auf die EZB bezeichnete der slowakische Notenbankchef Peter Kazimir die Spekulationen auf eine Zinssenkung im ersten Quartal allerdings als ""Science Fiction"". Aber auch von der Saisonalität kommt weiter Rückenwind für die Aktienmärkte. Mit dem November haben die statistisch besten sechs Monate an der Börse begonnen. Seit seinem Tief Ende Oktober bei 14.630 Punkten hat der DAX in der Spitze bereits 13,4 Prozent hinzugewonnen. Allerdings ""kommt es Anfang Dezember oftmals zu einem Korrekturimpuls, ehe danach die klassische Weihnachtsrally einsetzt"", schreiben die Experten der HSBC. Wie Marktexperte Robert Rethfeld von Wellenreiter-Invest erklärte, haben vor allem die Papiere der Siemens-Familie die jüngste Rally angetrieben. So seien Aktien von Siemens Energy in den vergangenen vier Wochen um 24 Prozent gestiegen, Titel der Siemens AG um 23 Prozent. Continental, Vonovia, Fresenius, Adidas und HeidelbergCement konnten in den vergangenen vier Wochen ebenfalls zweistellig zulegen. ""Viele der zuvor gebeutelten Unternehmen profitieren von Zinsrückgängen und im Fall von Siemens und Siemens Energy von der Zusage von Staatsgarantien für Siemens Energy"", so Rethfeld. Der Euro ist zur Wochenmitte unter die Marke von 1,08 Dollar gerutscht. Am späten Abend wurde die europäische Gemeinschaftswährung bei 1,0761 Dollar gehandelt. Für die Feinunze Gold werden zur Stunde 2.025 Dollar gezahlt und damit 0,3 Prozent mehr als am Vorabend. Erst zu Wochenbeginn hatte das gelbe Edelmetall bei 2.135 Dollar ein neues Rekordhoch aufgestellt, war dann aber wieder zurückgefallen. Die Ölpreise gaben deutlich weiter nach. Ein Barrel (159 Liter) der Nordseesorte Brent zur Lieferung im Februar kostete am späten Abend 74,24 Dollar. Das waren 3,6 Prozent weniger als am Dienstag. Der Preis für die US-Sorte WTI fiel erstmals seit Anfang Juli unter die Marke von 70 Dollar. Und das, obwohl die Ölreserven in den USA in der vergangenen Woche überraschend deutlich gefallen sind. Die Bestände an Rohöl sanken im Vergleich zur Vorwoche um 4,6 Millionen auf 445,0 Millionen Barrel. Für Preisdruck sorgt dagegen seit einigen Tagen die Skepsis, die den jüngsten Förderentscheidungen des Rohölkartells OPEC+ entgegengebracht wird. Die Kürzungen wurden als freiwillig bezeichnet, daher wird am Markt an ihrer Umsetzung gezweifelt. Beim aktuellen Staatsbesuch des russischen Präsidenten Wladimir Putin in Saudi-Arabien dürfte es auch um eine Lastenteilung in dieser Frage gehen. Der Bitcoin notierte am späten Abend bei 40.940 Dollar. Gestern war die älteste und bekannteste Kryptowährung auf der Handelsplattform Bitstamp bis auf 44.490 Dollar gestiegen - und damit so teuer wie seit gut eineinhalb Jahren nicht mehr. Anleger spekulieren auf die baldige Einführung eines sogenannten Spot-ETF in den USA, mit dem direkt in Bitcoin investiert werden kann. In New York gab die Aktie von Alphabet leicht nach. Im Wettlauf bei Künstlicher Intelligenz will sich Google mit dem neuen Sprachmodell Gemini an die Spitze setzen. Dieses soll nicht nur mit dem Sprachmodell GPT4 des Konkurrenten OpenAI mithalten, sondern es auch übertreffen. Google-Chef Sundar Pichai erklärte zur Ankündigung von Gemini, dass der Wandel durch KI der ""tiefgreifendste in unserem Leben sein wird, weitaus größer als die Umstellung auf das Mobiltelefon oder auf das Internet davor"". Gemini kann nicht nur Texte generieren, sondern auch situationsabhängige Entscheidungen treffen. Google demonstrierte das System mit einem Videochat, bei dem Gemini Zeichnungen und Gesten des menschlichen Gegenübers sofort erkannte und richtig einordnete. McDonald's will seine Restaurantkette binnen vier Jahren auf 50.000 Läden ausbauen. Das Ziel solle bis zum Jahr 2027 erreicht werden, teilte der Fastfood-Konzern mit. Bisher zählt McDonald's mehr als 41.000 Restaurants. Durch die Neueröffnungen soll der systemweite Umsatz im nächsten Jahr um zwei Prozent und in den Jahren danach um 2,5 Prozent wachsen. Die Kennzahl umfasst sowohl die von McDonald's selbst betriebenen Läden als auch die Restaurants selbstständiger Franchise-Nehmer. Mit Abstand größter DAX-Verlierer war die Merck-Aktie mit einem Abschlag von 13 Prozent. Das Darmstädter Unternehmen muss einen bitteren Rückschlag in der Arzneimittelentwicklung hinnehmen. In der entscheidenden klinischen Studie der Phase III erreichte das Multiple-Sklerose-Mittel Evobrutinib nicht das primäre Ziel der Untersuchung. Barclays-Expertin Emily Field sprach von einer bösen Überraschung. Das Medikament zählte zu den größten Hoffnungsträgern von Merck in der Pharmapipeline. Vorstandschefin Belen Garijo traute ihm Blockbuster-Potenzial zu, also mögliche Spitzenumsätze in Milliardenhöhe. Spitzenreiter im DAX war die VW-Aktie mit einem Plus von 5,3 Prozent. Die von VW beauftragten Prüfer haben nach eigenen Angaben keine Hinweise auf Zwangsarbeit in dem umstrittenen Werk in der chinesischen Provinz Xinjiang gefunden. Der im Juli 2022 aufgekommene Verdacht und die MSCI-Warnung bezüglich des ESG-Ratings der Wolfsburger habe schwer auf den Aktien gelastet, urteilten die Analysten von Citi. Nun könnten deswegen abgesprungene Investoren ihre Positionen zumindest teilweise zurückkaufen. Der Autokonzern könnte noch vor Weihnachten sein neues Sparprogramm vorlegen. Nach den Worten von Betriebsratschefin Daniela Cavallo sei VW in den Verhandlungen auf der Zielgeraden. Bereits vor Weihnachten könnten die Eckpunkte feststehen, sagte sie auf einer Betriebsversammlung in Wolfsburg. Die Aktionäre des Gesundheitskonzerns Fresenius müssen auf eine Dividende für das laufende Jahr verzichten. Das ergibt sich aus der Entscheidung des Vorstands, die Staatszuschüsse für Energiekosten der Helios-Krankenhäuser von bis zu 300 Millionen Euro nicht zurückzuzahlen. Damit darf das Unternehmen für 2023 keine Dividenden ausschütten und keine Boni an Manager zahlen. Die Aktie der Fresenius-Tochter Fresenius Medical Care (FMC) litt auch unter einem Cyber-Sicherheitsvorfall bei einem US-Tochterunternehmen. Bei Cardiovascular Consultants (CVC) seien einige Computer-Systeme von einem Vorfall betroffen, bei dem ein Eindringling Daten gestohlen habe, teilte der Dialyse-Dienstleister mit. Die entsprechenden Datenbanken enthielten unter anderem auch Patienten-Daten von CVC. Eine Untersuchung sei eingeleitet worden. Bayer hat in den USA erneut eine juristische Niederlage einstecken müssen. Ein Geschworenengericht in Philadelphia verurteilte den DAX-Konzern zur Zahlung von 3,5 Millionen Dollar an eine Frau, die ihre Krebserkrankung auf den glyphosathaltigen Unkrautvernichter Roundup von Bayer zurückführt. Das Urteil könnte den Druck von Investoren auf den Konzern erhöhen, Tausende ähnlicher Klagen schnell beizulegen, um weitere hohe Gerichtsurteile zu vermeiden. Die Staatsanwaltschaft Frankfurt ermittelt wegen Qualitätsproblemen bei Continental. Dabei geht es um Qualitätsprobleme bei Schläuchen, die 2022 aufgefallen waren. Ein Continental-Sprecher sagte, das Unternehmen habe die Mängel selbst entdeckt und den Behörden gemeldet. Bei den Ermittlungen der Staatsanwaltschaft geht es um den Vorwurf, Continental könnte seine Abnehmer betrogen haben, indem Schläuche für Klimaanlagen geliefert worden seien, die nicht der vereinbarten Qualität entsprachen. Der weltgrößte Flugzeugbauer Airbus muss sich bei seinen Jet-Auslieferungen im Dezember deutlich sputen. Im Weihnachtsmonat müssen noch 97 Verkehrsflugzeuge den Weg zu ihren Käufern finden, damit der Hersteller sein Jahresziel von 720 Maschinen erreicht. Im November lieferte der DAX-Konzern 64 Flugzeuge aus und damit sieben weniger als im Oktober. Eine Lufthansa-Werbung für nachhaltiges Fliegen ist in Großbritannien verboten worden. Die Anzeige erwecke einen irreführenden Eindruck von der Umweltfreundlichkeit des Unternehmens, teilte die britische Werbeaufsicht Advertising Standards Authority mit. Ähnliche Anzeigen der Fluglinien Air France und Etihad wurden mit derselben Begründung verboten. Reiselust und höhere Preise bescheren TUI Rekordumsatz Die Rückkehr der Reiselust nach der Corona-Pandemie hat den weltgrößten Reisekonzern TUI im abgelaufenen Geschäftsjahr zurück in die schwarzen Zahlen gebracht. Auf die Aktionäre entfiel in den zwölf Monaten bis Ende September ein Überschuss von 306 Millionen Euro nach einem Verlust von 277 Millionen ein Jahr zuvor. Der Umsatz legte auch dank gestiegener Reisepreise um ein Viertel auf den Rekordwert von 20,7 Milliarden Euro zu. Der Rüstungszulieferer Hensoldt kauft den Münchner IT- und Sicherheitstechnik-Dienstleister ESG für mindestens 675 Millionen Euro. Das Verteidigungselektronik-Unternehmen erwirbt die ESG Elektroniksystem- und Logistik-GmbH vom Finanzinvestor Armira. Zum Kaufpreis könnten noch 55 Millionen Euro hinzukommen, je nachdem wie sich ESG 2024 entwickelt. Knapp sechs Jahre nach dem Abschied aus dem Leitindex DAX muss ProSiebenSat.1 nach seinem Kurssturz auch den Nebenwerteindex MDAX verlassen. Der bayerische Fernsehkonzern ist eines von drei Unternehmen, die am 18. Dezember vom MDAX in den Kleinwerteindex SDAX absteigen, wie die Deutsche-Börse-Tochter Qontigo am Abend mitteilte. Der schwäbische Anlagenbauer Dürr und der deutsch-spanische Metall-Recycler Befesa sind die beiden anderen. Sie werden durch den Gewerbeimmobilien-Investor Aroundtown, den Chip-Zulieferer Siltronic und Krones, den weltgrößten Hersteller von Getränkeabfüllanlagen, ersetzt. Landgericht weist Impfschadenklage gegen BioNTech ab Das Landgericht Rottweil hat heute eine Klage wegen eines mutmaßlichen Schadens durch eine Corona-Schutzimpfung abgewiesen. Geklagt hatte ein 58 Jahre alter Mann. Er wirft dem Impfstoffhersteller BioNTech vor, infolge einer Corona-Impfung auf dem rechten Auge fast vollständig erblindet zu sein. Der Mann verlangt vom Mainzer Unternehmen 150.000 Euro Schmerzensgeld und die Feststellung, dass ihm sämtliche weiteren Schäden zu ersetzen sind. Die 2. Zivilkammer sah die Voraussetzungen für Ansprüche aber als nicht gegeben an. Aktien von British American Tobacco (BAT) fielen auf ein neues Jahrestief. Das Unternehmen hatte im Rahmen der Eckdaten für das Geschäftsjahr 2023 mitgeteilt, dass es den organischen Umsatz nun am unteren Ende der bestehenden Spanne erwartet. Zudem schrieb der Konzern rund 25 Milliarden britische Pfund auf das US-Zigarettengeschäft ab."
