9d068625-4439-49f2-8f2c-568ab56444a7,2024-04-11 11:52:32+00:00,"34 Turbinen des Typs Siemens Gamesa arbeiten in einem Windpark bei Oslo. Zuletzt war fast die Hälfte wegen defekter Rotoren vom Netz. Nun verliert ein Windrad ein 72 Meter langes Rotorblatt. Noch sind die Gründe unklar. Doch der Hersteller hat seit Längerem massive Probleme. Ein von der Siemens-Energy-Tochter Gamesa gefertigtes Windrad hat in Norwegen ein 72 Meter langes Rotorblatt verloren. Bei dem Vorfall im Windenergie-Park Odal rund 90 Kilometer nordöstlich von Oslo wurde einem Odal-Vind-Sprecher zufolge niemand verletzt. Das 22 Tonnen schwere abgestürzte Rotorblatt sei Teil einer Siemens Gamesa 5.0-145-Turbine gewesen, die zur 4.X-Plattform der spanischen Siemens-Energy-Tochter Gamesa gehöre, sagte der Sprecher weiter. Gamesa kämpft seit Jahren mit Qualitätsproblemen im Geschäft mit Windturbinen an Land, betroffen ist auch die Plattform 4.X. Das spanische Unternehmen hat dem Mutterkonzern Milliardenverluste eingebrockt. ""Wie in solchen Fällen üblich, haben wir das Sicherheitsprotokoll gestartet und die Turbinen in dem Windpark gestoppt, zu Schaden gekommen ist niemand"", sagte ein Sprecher von Siemens Energy. ""Wir müssen die Ursache nun in Ruhe untersuchen, dazu sind wir in Kontakt mit dem Kunden."" Zu Details der Anlage und möglichen Folgen äußerte er sich nicht. Der Konzern hatte nach Qualitätsmängeln seine Turbinen der Onshore-Typen 4.X und 5.X vom Markt genommen. Im März hatte Siemens Energy erklärt, es wolle die revidierten Fassungen so schnell wie möglich in den Verkauf bringen. Wann das der Fall sein werde, bestimme der Konzern. Es sei noch zu früh für Aussagen, was die Ursache sei, sagte der Odal-Vind-Sprecher. Er wollte sich nicht dazu äußern, ob es bei dem Vorfall einen Zusammenhang mit den früheren Qualitätsproblemen gibt. Der Windpark ist mit 34 Turbinen des Typs Siemens Gamesa SG 5.0-145 bestückt, deren Rotoren jeweils einen Durchmesser von 145 Metern haben. Der Betreiber hatte bereits vor fast vier Wochen erklärt, dass 15 dieser Windräder wegen Rissen in Rotorblättern außer Betrieb seien."
01d1d98a-52ce-4f8a-ad3b-8c2852ebf191,2024-04-11 11:59:15+00:00,"Ein von der Siemens-Energy-Tochter Gamesa gefertigtes Windrad hat in Norwegen ein 72 Meter langes Rotorblatt verloren. Bei dem Vorfall im Windenergie-Park Odal wurde einem Odal-Vind-Sprecher zufolge niemand verletzt. Das 22 Tonnen schwere abgestürzte Rotorblatt sei Teil einer Siemens Gamesa 5.0-145-Turbine gewesen, die zur 4.X-Plattform der spanischen Siemens-Energy-Tochter Gamesa gehöre, sagte der Sprecher am Donnerstag weiter. Gamesa kämpft seit Jahren mit Qualitätsproblemen im Geschäft mit Windturbinen an Land, betroffen ist auch die Plattform 4.X. Das spanische Unternehmen hat dem Mutterkonzern Milliardenverluste eingebrockt. „Wie in solchen Fällen üblich, haben wir das Sicherheitsprotokoll gestartet und die Turbinen in dem Windpark gestoppt, zu Schaden gekommen ist niemand“, sagte ein Sprecher von Siemens Energy. „Wir müssen die Ursache nun in Ruhe untersuchen, dazu sind wir in Kontakt mit dem Kunden.“ Zu Details der Anlage und möglichen Folgen äußerte er sich nicht. Der Konzern hatte nach Qualitätsmängeln seine Turbinen der Onshore-Typen 4.X und 5.X vom Markt genommen. Im März hatte Siemens Energy erklärt, es wolle die revidierten Fassungen so schnell wie möglich in den Verkauf bringen. Wann das der Fall sein werde, bestimme der Konzern. Es sei noch zu früh für Aussagen, was die Ursache sei, sagte der Odal-Vind-Sprecher. Er wollte sich nicht dazu äußern, ob es bei dem Vorfall einen Zusammenhang mit den früheren Qualitätsproblemen gibt. Odal Vind hatte im vergangenen Monat erklärt, 15 der 34 Turbinen des Windparks wegen Schäden an den Rotorblättern gestoppt zu haben, die im Zusammenhang mit der Produktion stünden. Odal wurde nun bis zum Abschluss der Untersuchung geschlossen."
4bd2728e-1925-4cbc-b88a-5729177e97cd,2024-04-15 07:00:00+00:00,Siemens entscheidet sich für die vollständige Digitalisierung seines Avalmanagements mit Digital Vault Services Business Wire
269d35a7-4bb8-41f7-9842-40366209309b,2024-04-15 13:11:00+00:00,Schon Ende 2025 sollen etwa 40 Mitarbeiterinnen und Mitarbeiter von Siemens Healthineers das neue Gebäude in Röttenbach beziehen. Der Grundstein dafür wurde gelegt. In unmittelbarer Nähe zu bestehenden Standorten in Forchheim und Erlangen entsteht ein hochmodernes Arbeitsumfeld. Im „Siemens Healthineers IP Management Center“ wolle Siemens Healthineers in Zukunft alle Aktivitäten zum Management von Forschungs- und Entwicklungsleistungen sowie das Management der weltweiten Schutzrechte unter einem Dach zusammen bringen. Des ...
c5707fe5-8be4-405e-8cc9-f5b130fba275,2024-04-15 13:21:07+00:00,Demokratisierung der Technologie: ein globales Vorbild aus Sheffield Siemens
0447479b-6fb8-44ef-85e3-ccdd4ad486e3,2024-04-15 14:16:32+00:00,"Industrieautomatisierung Siemens Industrial Copilot: Der neue Lieblingskollege für die Industrieautomatisierung Anbieter zum Thema Die Kollaboration zwischen Siemens und dem Co-Creation-Partner Schaeffler lotet die Möglichkeiten von künstlicher Intelligenz in der Fertigung aus. Der auf generativer KI basierte Assistent Siemens Industrial Copilot könnte der neue Lieblingskollege werden. Generative künstliche Intelligenz (KI) ist bereits in aller Munde und unterstützt bei der Erstellung unterschiedlichster Inhalte. Sie hat ihr Potenzial schon auf vielfältige Art bewiesen, vor allem bei textbasiertem Arbeiten. Auch das Generieren von Codes ist möglich. Doch wie sieht es im industriellen Umfeld aus, wo beispielsweise bei der Planung von Anlagen ein hochwertiges Programm geschrieben werden muss? Die richtige Unterstützung würde nicht nur den wenigen Fachkräften in diesem Bereich zugutekommen, sondern könnte auch die Effizienz steigern und die Prozesse optimieren. Beim Versuch, ChatGPT einen Programmcode schreiben zu lassen, passiert allerdings häufig etwas Unerfreuliches: Die KI halluziniert, entwirft also einen Code, der stellenweise keinen Sinn ergibt. Die Lösung: ein dediziertes, in eine Entwicklungsumgebung integriertes Tool, das bereits im richtigen Kontext verankert ist. Siemens Industrial Copilot: Beeindruckendes Ergebnis einer erfolgreichen Partnerschaft Gemeinsam mit Microsoft hat sich Siemens zum Ziel gesetzt, den ersten Assistenten mit generativer künstlicher Intelligenz für die Industrieautomatisierung zu entwickeln, um die Zusammenarbeit von Mensch und Maschine entlang der gesamten Wertschöpfungskette zu erleichtern: den Siemens Industrial Copilot. Mit dem Motion-Technology-Unternehmen Schaeffler als erstem Pilotkunden wird der Industrial Copilot unter realen Bedingungen weiter perfektioniert. Der KI-Kollege punktet mit seiner Unkompliziertheit und seinem umfangreichen Expertenwissen: Ähnlich wie bei dem allseits bekannten ChatGPT, wird der Industrial Copilot mit Aufträgen, sogenannten Prompts, gefüttert, die aber keiner Programmiersprache entlehnt sein müssen. Man kann mit ihm in natürlicher Sprache kommunizieren, was seine Bedienung intuitiv und einfach gestaltet. Antworten werden auf fachlichem Niveau und in dem Code oder mit den technischen Details ausgegeben, die die Fachkraft benötigt. Copilot, generiere Code! Bei diesem gemeinsamen Projekt kommt der Industrial Copilot in zwei Varianten zum Einsatz: als Industrial Copilot fürs Engineering und Industrial Copilot für Operations. Für den ersten Anwendungsfall wird er über eine offene API-Schnittstelle an das Engineering-Framework Totally Integrated Automation Portal (TIA Portal) angebunden. Hier nutzen ihn die Automatisierungsprofis von Schaeffler bei der Erstellung von Code für speicherprogrammierbare Steuerungen (SPS), um Maschinen zu automatisieren. Der Industrial Copilot erzeugt automatisch Sequenzen für die Automatisierung von Maschinen oder Anlagen auf allgemein verständliche Prompts hin. Auf Wunsch passt er auch bestehende Bausteine an neue Anforderungen an, kopiert sie an andere Stellen oder benennt sie um, was in der Vergangenheit eine klassische Fehlerquelle darstellte. Wurde eine Maschine automatisiert, können die Engineering-Teams mit Hilfe des Copilot Bedienoberflächen für HMIs entwerfen – auch im Rahmen eines bereits bestehenden Design-Templates. Alles ok, Kollege? Maschine automatisiert, Bedienpanel entworfen – und das funktioniert jetzt? Auch das findet man mit KI-Unterstützung her­aus. Der Siemens Industrial Copilot schreibt einen Testcode und führt ihn aus; es sind nur kurze Funktions- und Parameterbeschreibungen nötig. Treten Fehler oder Funktionsausfälle auf, können Teams den ­Industrial Copilot Korrekturen vornehmen lassen. Fehler lassen sich auch im laufenden Betrieb identifizieren und so Stillstände vermeiden. Funktioniert eine Maschine nicht nach Wunsch, kommt der Industrial Copilot für Operations zum Einsatz: Er kann einen Check durchführen und zum Beispiel Wartungs- oder Reparaturaufgaben vorschlagen. Sind weniger erfahrene Mitarbeitende zuständig, unterstützt der KI-Kollege mit Schritt-für-Schritt-Reparaturinstruktionen. Siemens Industrial Copilot, gib mir eine zuverlässige Auskunft! Gemeinsam mit Schaeffler wurde im Industrial Copilot generative KI in einen industriellen Kontext eingebettet. Der Copilot ist mit den Maschinen, ihren Funktionen sowie dem Betrieb vertraut und kann auch Produktionsstatistiken oder andere grundlegende Informationen ausgeben, zum Beispiel bezüglich Engineering-Aufgaben. Fragen nach Funktionen im TIA Portal oder nach bestimmten Bausteinen im Code, nach Vorgehen bei Programmiervorhaben oder dem Ablauf von Workflows – der Industrial Copilot gibt Auskunft und erklärt bei Bedarf umfassend. Die Zeit, die man früher investieren musste, um ganze Hilfeforen zu durchforsten oder eigene Anfragen zu stellen, können Automatisierungsprofis heute besser investieren. Die Antworten des KI-Kollegen sind verständlich, fundiert und – das ist vermutlich das Wichtigste – ­korrekt. Denn der Siemens Industrial Copilot bewegt sich in der Industrieumgebung, in der er installiert wurde. Anders als ChatGPT, der sich bei komplexen Fragestellungen etwas Unwahres zusammenreimt, ist der Industrial Copilot domänen-spezifisch und baut auf dem Know-how von Siemens und Schaeffler auf, um zuverlässiger in seinen Aussagen zu werden. Jetzt Newsletter abonnieren Verpassen Sie nicht unsere besten Inhalte Geschäftliche E-Mail Bitte geben Sie eine gültige E-Mailadresse ein. Mit Klick auf „Newsletter abonnieren“ erkläre ich mich mit der Verarbeitung und Nutzung meiner Daten gemäß Einwilligungserklärung (bitte aufklappen für Details) einverstanden und akzeptiere die Nutzungsbedingungen. Weitere Informationen finde ich in unserer Datenschutzerklärung. Aufklappen für Details zu Ihrer Einwilligung Stand vom 11.01.2024 Es ist für uns eine Selbstverständlichkeit, dass wir verantwortungsvoll mit Ihren personenbezogenen Daten umgehen. Sofern wir personenbezogene Daten von Ihnen erheben, verarbeiten wir diese unter Beachtung der geltenden Datenschutzvorschriften. Detaillierte Informationen finden Sie in unserer Datenschutzerklärung. Einwilligung in die Verwendung von Daten zu Werbezwecken Ich bin damit einverstanden, dass der WIN-Verlag GmbH & Co. KG, Balanstraße 73, Gebäude Nr. 21A, EG, 81541 München, einschließlich aller mit ihr im Sinne der §§ 15 ff. AktG verbundenen Unternehmen (im weiteren: Vogel Communications Group) meine E-Mail-Adresse für die Zusendung von redaktionellen Newslettern nutzt. Auflistungen der jeweils zugehörigen Unternehmen können hier abgerufen werden. Der Newsletterinhalt erstreckt sich dabei auf Produkte und Dienstleistungen aller zuvor genannten Unternehmen, darunter beispielsweise Fachzeitschriften und Fachbücher, Veranstaltungen und Messen sowie veranstaltungsbezogene Produkte und Dienstleistungen, Print- und Digital-Mediaangebote und Services wie weitere (redaktionelle) Newsletter, Gewinnspiele, Lead-Kampagnen, Marktforschung im Online- und Offline-Bereich, fachspezifische Webportale und E-Learning-Angebote. Wenn auch meine persönliche Telefonnummer erhoben wurde, darf diese für die Unterbreitung von Angeboten der vorgenannten Produkte und Dienstleistungen der vorgenannten Unternehmen und Marktforschung genutzt werden. Falls ich im Internet auf Portalen der Vogel Communications Group einschließlich deren mit ihr im Sinne der §§ 15 ff. AktG verbundenen Unternehmen geschützte Inhalte abrufe, muss ich mich mit weiteren Daten für den Zugang zu diesen Inhalten registrieren. Im Gegenzug für diesen gebührenlosen Zugang zu redaktionellen Inhalten dürfen meine Daten im Sinne dieser Einwilligung für die hier genannten Zwecke verwendet werden. Recht auf Widerruf Mir ist bewusst, dass ich diese Einwilligung jederzeit für die Zukunft widerrufen kann. Durch meinen Widerruf wird die Rechtmäßigkeit der aufgrund meiner Einwilligung bis zum Widerruf erfolgten Verarbeitung nicht berührt. Um meinen Widerruf zu erklären, kann ich als eine Möglichkeit das unter https://kontakt.vogel.de/de/win. abrufbare Kontaktformular nutzen. Sofern ich einzelne von mir abonnierte Newsletter nicht mehr erhalten möchte, kann ich darüber hinaus auch den am Ende eines Newsletters eingebundenen Abmeldelink anklicken. Weitere Informationen zu meinem Widerrufsrecht und dessen Ausübung sowie zu den Folgen meines Widerrufs finde ich in der Datenschutzerklärung, Abschnitt Redaktionelle Newsletter. Kollege, was steht als nächstes an? Die aktuelle Partnerschaft mit Schaeffler konzentriert sich auf Maschinenbau und Automobilbranche. Aber die Weichen sind gestellt für viele weitere Branchen wie In­frastruktur, Transport und Healthcare sowie Fertigung für Konsumgüter. Mit den zuvor beschriebenen Aktivitäten kann der KI-­Kollege Teams schneller, effizienter und einfacher entwickeln lassen oder mit seinem Input Produktionen flexibler, resilienter und nachhaltiger machen. Und zwar nicht nur durch seinen Einsatz im ­Engineering oder Operations. Idealerweise wird der Indus­trial Copilot in Zukunft entlang der gesamten Wertschöpfungskette genutzt – vom ­Design bis zum Betrieb und Service. Richtig eingesetzt, lassen sich so der gesamte Entstehungsprozess von Anlagen verkürzen und darüber hinaus die Produktion dauerhaft optimieren. Klaus Rosenfeld, CEO der Schaeffler Group, ist bereits überzeugt: „Mit dieser gemeinsamen Partnerschaft treten wir in ein neues Zeitalter der Produktivität und Innovation ein.“ In allen Bereichen kann der Industrial Copilot Teams dabei unterstützen, unterschiedlichste Arbeiten zu reduzieren und mittels datenbasierter Vorschläge schnell zu reagieren. Das wirkt dem Fachkräftemangel entgegen und setzt die Ressourcen der vorhandenen Kräfte für höherwertige Aufgaben frei. Fachkräfte werden auch weiterhin benötigt. Denn man darf nicht vergessen, dass ein KI-Kollege zwar nützlich ist, aber ohne den Menschen nutzlos: Eine künstliche Intelligenz ist nur so gut wie die menschliche Intelligenz, die sie zu anzuleiten weiß. Am Ende ist der Siemens Industrial Copilot eben „nur“ ein Co-Pilot – aber ein überzeugender."
e00e67cc-e9c7-46b6-b9c8-f35d0883c0ec,2024-04-16 10:07:29+00:00,"Bisher gibt es zur Modellierung digitaler Zwillinge unterschiedliche Standards. Unter dem Dach der Standardisierungsorganisation W3C sollen nun zwei wichtige Beschreibungssprachen zusammengeführt werden. Digitale Zwillinge werden für Unternehmen immer wichtiger. Egal ob bei der Planung von Produktionskonzepten, Gebäuden oder medizinischen Operationen: Durch aktuelle Daten aus verschiedenen Quellen helfen sie, schneller und zuverlässiger Entscheidungen zu treffen. Allerdings ist die Landschaft im Internet der Dinge (IoT) bisher fragmentiert und es gibt unterschiedliche Beschreibungssprachen. Weil Unternehmen aber meist Lösungen unterschiedlicher Anbieter nutzen, führt das zu einem hohen Integrationsaufwand. Gemeinsam mit dem World Wide Web Consortium (W3C) wollen Siemens und Microsoft die „Digital Twin Definition Language“ (DTDL) deshalb nun mit dem „Thing Description Standard“ der internationalen Standardisierungsorganisation W3C zusammenführen. Die Konvergenz soll eine einfachere Systemintegration sowie Interoperabilität ermöglichen. Nahtlose Kommunikation für digitale Zwillingen ist das Ziel Als virtuelle Nachbildungen von physischen Objekten, Prozessen oder Systemen, die ihre realen Gegenstücke in einer digitalen Umgebung widerspiegeln, ermöglichen digitale Zwillinge Unternehmen die Überwachung, Prognose sowie Optimierung ihrer Anlagenleistung. Dies steigert die Effizienz bei gleichzeitiger Kostenreduktion. Die Standardisierung von Digital-Twin-Sprachen ist daher entscheidend für die Interoperabilität, um so eine nahtlose Kommunikation sowie Integration zwischen verschiedenen Digital-Twin-Systemen und -Plattformen zu gewährleisten. Siemens unterstützt bereits den aufstrebenden Thing Description Standard des W3C für zukünftige Produkte in den Bereichen Gebäudemanagement, Energieverteilung und Smart Grids. Nun sollen Kunden von der Erweiterung dieser Interoperabilitätsstrategie auf Microsoft Azure stark profitieren, das bisher auf die „Digital Twin Definition Language“ setzt. Thomas Kiessling, Chief Technology Officer bei Siemens Smart Infrastructure, sagt dazu: „Wir sehen die Konvergenz von zwei sehr ähnlichen Digital-Twin-Sprachen, wie DTDL und W3C Thing Description, als einen wesentlichen Schritt, der es unseren Kunden ermöglicht, die physische Welt auf eine Weise zu beschreiben, die nicht an bestimmte IoT-Plattformen gebunden ist.“ Durch die strategische Partnerschaft unterstreiche Siemens sein Bestreben, sowohl Kollaboration als auch Offenheit zu fördern. Das unterscheidet bisher die digitalen Zwillinge von Microsoft und dem W3C Die Digital Twin Definition Language von Microsoft ermöglicht die Modellierung der physischen Welt mit Azure-Diensten, während der W3C Thing Description Standard für eine interoperable Darstellung von Geräteschnittstellen und deren Einbindung in standardmäßige Industrieontologien sorgt. Beide Sprachen wiesen in der Anfangsphase der Annäherung viele konzeptionelle Gemeinsamkeiten auf. Erich Barnstedt, Chief Architect Standards, Consortia and Industrial IoT, Azure Edge and Platform Team, Microsoft Corporation, erklärt dazu: „Seit wir die Digital Twin Definition Language erfunden und ihre Spezifikation und Referenzimplementierungen als Open Source zur Verfügung gestellt haben, hatten wir vor, sie durch ein Konsortium wie W3C zu standardisieren. Daher ist die Zusammenführung von DTDL und W3C Thing Description in enger Partnerschaft mit Siemens der klare nächste Schritt auf unserem Weg, digitale Zwillinge in der Industrie zu demokratisieren.“"
dd8c26e2-1bbb-4924-be3d-080afa21230d,2024-04-16 13:47:20+00:00,"Natürlich ist in der Wirtschaft vieles aufeinander abgestimmt, das zeitliche Zusammenfallen dieser beiden Ereignisse aber dürfte reiner Zufall sein. Zwei Geschichten, zweimal Siemens, dazwischen 7700 Kilometer - und bei beiden Geschichten geht es um die Frage nach der Zukunft."
e9ae263b-0312-487c-b9a1-e1cf7ec25dd0,2024-04-16 14:25:00+00:00,"Monheims Gewerbesteuergestaltung hat in den letzten Jahren die Zahl der ansässigen Firmen stark steigen lassen. Bei einem der größten und weltweit agierenden Unternehmen der Stadt am Rhein führten dagegen sehr persönlich Gründe zur Standortwahl. Hans Georg Schukat, als 14-jähriger aus Ostpreußen geflohen, seit 1956 frischgebackener Ingenieur bei Siemens in Düsseldorf, heiratete in diesem Jahre die Monheimerin Hannelore und zog in die Stadt am Rhein. Nicht in der bei vielen Start-ups sprichwörtlichen Garage, sondern im Dachgeschoss an der Krischerstraße 27 gründeten die beiden ihre eigene Firma. Die „HG Schukat electronic Import Export“ begann mit dem exklusiven Vertrieb von US Vidicon-Röhren an Siemens. Hans Georg Schukat starb im Jahr 2012 im Alter von 82 Jahren."
3b2eca3b-5f2b-487d-b39a-ba104be2c707,2024-04-17 08:53:49+00:00,"Garching (dpa) - Siemens eröffnet einen neuen Forschungsstandort am Universitätscampus in Garching bei München. Im fertiggestellten ersten Bauabschnitt des Projekts sollen etwa 450 Siemens-Beschäftigte mit 150 Wissenschaftlern der Technischen Universität München an Zukunftstechnologien forschen, wie der Konzern am Mittwoch mitteilte. 2027 soll dann ein zweiter Bauabschnitt mit weiteren gut 630 Forschenden und Patent-Experten in Betrieb genommen werden. Insgesamt investiert Siemens in Garching rund 100 Millionen Euro. Der neue Standort dient der zentralen, die einzelnen Geschäftsbereiche übergreifenden Forschung. In diesem Bereich wird er laut Siemens der größte im Konzern sein. München war bis in die 2000er Jahre nicht nur Sitz der Siemens-Zentrale, sondern größter Produktionsstandort mit mehreren zehntausend Mitarbeitern inklusive der dazugehörigen Entwicklungsabteilungen. Den Großteil seiner einstigen Industriegeschäfte hat Siemens aber im Laufe der vergangenen dreißig Jahre ausgegliedert, deswegen ist der Standort München stark geschrumpft. Schwerpunkt ist heute Software für die Industrie, dies ist auch der Schwerpunkt im neuen Technologiezentrum. Der Forschungscampus Garching ist laut Siemens mit insgesamt 28.000 dort arbeitenden Menschen eines der größten Wissenschaftszentren in Europa. Neben dem Münchner Universitäten sind dort unter anderem noch Max Planck-Gesellschaft und Fraunhofer-Gesellschaft mit jeweils mehreren Instituten vertreten. © dpa-infocom, dpa:240417-99-704442/3"
