0c84abfe-5eac-417b-ad79-ea3e7816cf4c,2024-04-19 14:03:00+00:00,"19. April 2024, 16:03 Uhr | Lesezeit: 5 Minuten Sie waren einst große Hersteller technischer Geräte für Endverbraucher. Doch aus unterschiedlichen Gründen konnten sich die Unternehmen am Markt nicht halten und sind mittlerweile verschwunden. TECHBOOK zeigt fünf Unternehmen, die Sie vielleicht noch von früher kennen, die es aber nicht mehr gibt. Compaq Der Name Compaq thronte hierzulande ab Mitte der 90er-Jahre bis wenige Jahre nach der Jahrtausendwende auf vielen Heimcomputern. Der US-Hersteller begann Mitte der 1990er – vor vielen anderen – mit dem Bau von Desktop-PCs für den Heimgebrauch. Besonders beliebt, weil auch mit guter Ausstattung ausgeliefert, war Compaqs Presario-Reihe. Das Verschwinden von Compaq hat nichts mit Insolvenz zu tun. Vielmehr übernahm Tech-Riese Hewlett-Packard das Unternehmen im Zuge einer Fusion im Jahr 2002. In einigen Ländern, auch Deutschland seit 2008, wurde die Marke bis spätestens 2013 weitergeführt. Danach war auch mit dem Namen endgültig Schluss. Siemens Mobile Erinnern Sie sich noch an den letzten richtig großen deutschen Handyhersteller? Siemens Mobile zählte in den 90er-Jahren zu den ganz großen Marken im Handybereich und leistete Anfang des Jahrzehnts sogar Pionierarbeit bei den ersten Geräten für ein größeres Publikum. 2005 war für die Tochterfirma von Siemens dann Schluss. Die komplette und spannende Geschichte von Siemens Mobile finden Sie in unserem Artikel: Der Aufstieg und Fall des einstigen Handy-Riesen Siemens Mobile Netscape „Netscape Communications“ war eines der größten Software-Unternehmen im Bereich Internet Mitte der 1990er-Jahre. Popularität erreichte Netscape mit seinem Internetbrowser, dem „Netscape Navigator“. Bis ins Jahr 1996 war dies der beliebteste Browser auf Windows-PC und Macs weltweit. Für die Internet-Nutzer damals war es also in der Regel der erste Kontakt mit dem World Wide Web. Heute nicht mehr vorstellbar, aber für die Nutzung des Internetbrowsers musste man damals bezahlen. 39 US-Dollar kostete die erste Version. Der Platz an der Spitze der Browser – mangels Konkurrenz – blieb aber nicht lange. In dem sogenannten Browserkrieg musste der „Netscape Navigator“ in nur zwei Jahren das Feld fast komplett Microsofts neuem „Internet Explorer“ überlassen. Dieser kam kostenlos mit jedem Windows-PC und beendete nicht nur Netscapes Browserherrschaft, sondern läutete auch den Untergang des ganzen Unternehmens ein. Die letzte Version erschien im Jahr 2008, zehn Jahre nachdem Netscape praktisch von der Bildfläche verschwunden war. Der Geist lebt aber bis heute weiter. Basierend auf dem Code gründete man nämlich „Mozilla“ und meldete sich damit zurück ins Browsergeschäft. Palm Noch bevor Blackberrys das Non-plus-Ultra für Geschäftsleute waren, waren es oftmals die Organizer von Hersteller Palm. Die sogenannten PDAs (Personal Digital Assistant) sehen aus wie Steinzeit-iPhones. Um die Jahrtausendwende herum war Palm DER Hersteller für stiftgesteuerte Taschencomputer und hatte den – wenn auch kleinen – Markt größtenteils für sich. Geräte wie der „Palm Zire“ aus dem Jahr 2002 konnten dabei nicht viel mehr als ein Terminkalender, waren jedoch sehr handlich und nicht zuletzt auch irgendwie cool. Da die Geräte damit keinen Unterhaltungswert hatten und man auch nicht mit ihnen telefonieren konnte, blieb die Masse natürlich bei herkömmlichen Handys. Mit dem Aufkommen der Konkurrenz, vor allem durch Microsoft, und schließlich der Erfindung des Smartphones, endete die Relevanz von Palm. 2010 kaufte Hewlett-Packard das Unternehmen und verkauft die Namensrechte 2015 nach China. Kodak Der Fotoausrüster Eastman Kodak Company, oder kurz Kodak, gehörte früher zu den ganz großen Unternehmen der Tech-Branche. Bereits 1892 gegründet, feierte Kodak im 20. Jahrhundert einen wahren Boom. Vor allem der Kauf diverser deutscher Filmhersteller und Kamerawerke und die daraus resultierende Produktion von (Farb-)Filmen für Kameras trugen dazu bei. Anfangs hielt Kodak sogar der zunehmenden Digitalisierung stand. 1987 fertigte das Unternehmen die weltweit erste digitale Spiegelreflexkamera, die unter dem Namen Canon New F-1 Electro-Optic Camera vermarktet wurde. In den 90ern feierte man zudem mit der Photo-CD Erfolge. Auch einen Abstecher in den Bereich der digitalen Druckmaschinen machte Kodak, verkaufte diese Sparte aber Ende der 90er-Jahre. Am Ende konnte Kodak aber nicht mithalten. Anfang der 2000er verabschiedete sich das Unternehmen vom Verkauf bestimmter Kameras, später wurde auch die Fertigung von Schwarz-Weiß-Fotopapier eingestellt. Es folgten diverse Umstrukturierungen und Neuausrichtungen, die am Ende aber nichts brachten. Im Dezember 2011 stellte Kodak einen Insolvenzantrag und beendete 2012 die Produktion von Digitalkameras, Videokameras und digitalen Bilderrahmen. Im September des Folgejahres wurde das Kerngeschäft komplett aufgegeben und mit Kodak Alaris ein neues Unternehmen gegründet. Mehr zum Thema Ende einer Ära Canon verkauft seine letzte Analog-Kamera Ratgeber Was braucht man, um mit analoger Fotografie zu starten? Online-Dienste der 90er Was wurde aus Napster, Second Life und Co. Minolta Heutzutage stellt sich beim Kauf einer Kamera für viele die Frage: Canon oder Nikon? Im letzten Drittel des 20. Jahrhunderts war das aber noch anders. Da durfte man noch die Frage stellen: Canon, Nikon oder Minolta. Das japanische Traditionsunternehmen war in dieser Zeit nämlich der drittgrößte Kamera-Hersteller der Welt."
e575a472-cd31-4fbb-b951-c93cb98604f9,2024-04-20 16:00:00+00:00,"Startseite Wirtschaft „In Garching bauen wir etwas, was weltweit einzigartig ist“ - Warum Siemens 100 Millionen in Garching pumpt Von: Sebastian Hölzle Peter Körte, Technologie- und Strategiechef von Siemens, über die 100-Millionen-Euro-Investition im Münchner Umland. Garching - Siemens investiert 100 Millionen Euro in Garching (Landkreis München). Hier soll der größte der zwölf Forschungsstandorte im Konzern entstehen. Technologie- und Strategie-Chef Peter Körte erklärt die Idee dahinter. Garching soll der wichtigste Forschungsstandort im Siemens-Konzern werden. Warum haben Sie sich für Bayern entschieden und nicht für das Silicon Valley in Kalifornien oder Bangalore in Indien? Es geht nicht um ein „oder“, sondern um ein „und“. Neben Garching haben wir Forschungsstandorte auf der ganzen Welt, auch in Indien und Kalifornien. Weltweit arbeiten 2.000 Menschen in der Siemens-Forschung. Aber es stimmt: Garching wird unser wichtigster Forschungsstandort werden. Aber warum ausgerechnet dieser Standort? Das liegt daran, dass von den weltweit 2.000 Siemens-Forscherinnen und -Forschern schon heute etwa 1.000 in München-Neuperlach sitzen – und die ziehen jetzt nach Garching um. Und Forscher kann man nicht einfach ersetzen, daher bleiben wir in der Region. Nur ist Neuperlach ein Standort, der doch etwas abgeschieden liegt. Und Garching? In Garching öffnet sich Siemens der Welt. In Garching bauen wir etwas, was einzigartig ist und es so auf der Welt noch nicht gibt. Im Jahr 2027 werden über 1.000 Siemens-Forscherinnen und -Forscher in Garching arbeiten, und mit uns werden 150 Leute der TU München in das Gebäude einziehen. Wir gehen in Garching weg von einem Raumkonzept wie in Neuperlach, wo man noch etwas ungestört vor sich hin forschen konnte. Wir gehen mitten rein in eine Umgebung, in der man vernetzt zusammenarbeitet. In der Forschung ist das ein Novum. Was bringt die Vernetzung mit der TU München? Die TU München ist die beste technische Universität in Deutschland und eine der besten in Europa. Im Umfeld der TU sind etliche Start-ups entstanden, außerdem haben sich auf dem Campus-Gelände in Garching bereits etablierte Unternehmen angesiedelt, direkt neben uns steht beispielsweise das Gebäude von SAP. Gerade im Bereich der digitalen Forschung ist Zusammenarbeit extrem wichtig. An was genau forscht Siemens gerade? Bei einem Wirtschaftsunternehmen wie Siemens muss Forschung immer in einem konkreten Produkt münden. In Neuperlach war unser Forschungsschwerpunkt seit den 70er-Jahren die Mikroelektronik, jetzt kommt der nächste Schritt: Das industrielle Metaverse. Begriffe wie „industrielles Metaverse“ klingen sehr abstrakt. Was bedeutet das konkret? Ein Beispiel: Wenn wir heute für einen Kunden eine Fabrik bauen, dann existiert diese Fabrik zweimal. Zum einen in der realen Welt, hier stehen die Maschinen, hier finden die ganzen Abläufe statt, hier bewegt sich das Material hin und her. Parallel dazu gibt es ein digitales Abbild dieser Fabrik, wo alle Prozesse, die sich in der Realität abspielen, in Echtzeit spiegelbildlich abgebildet werden. Was bringt das? Der Vorteil ist, dass wir in der digitalen Fabrik jederzeit Wenn-Dann-Szenarien durchspielen können. Wir können simulieren, was passiert, wenn beispielsweise eine Maschine ausfällt. Oder vor zwei Jahren hatten wir den Fall, dass es weltweit zu Lieferengpässen kam. In der digitalen Welt können wir sofort prüfen, was passiert, wenn in der Fabrik die Teile ausgehen, und können unsere Produktion in der Realität diesem Engpass-Szenario anpassen. Es wirkt fast ironisch, dass ausgerechnet bei der digitalen Forschung der persönliche Kontakt so wichtig zu sein scheint. Den gemeinsamen Kaffee mit den Nachbarn auf dem Garchinger Campus kann offenbar eine Videokonferenz nur schwer ersetzen. In der Forschung, gerade in der digitalen, geht es um Vertrauen. Man muss wissen, mit wem man bereit ist, Daten zu teilen. Daher ist die persönliche Komponente extrem wichtig. Man muss sich kennen, man muss wissen, dass man sich aufeinander verlassen kann. Die technologische Entwicklung geht so schnell, dass man nicht jedes kleine Detail vorher vertraglich absichern kann. Worauf freuen Sie sich in Garching besonders? Wir haben hier einen Raum, der nennt sich Technikum. Hier gibt es beispielsweise fahrerlose Transportsysteme, die miteinander kommunizieren und interagieren können. Solche Systeme werden wir in Zukunft immer häufiger in Fabriken sehen. In Garching fahren diese Systeme schon heute."
990fda89-9425-429c-87fc-2d5079feb15a,2024-04-21 11:15:24+00:00,"Nach der Traditionsmarke Miele, deren Chefs Anfang des Jahres einen Teilumzug nach Polen aus Kostengründen ankündigten, sind es jetzt die Geschirrspülmaschinen und Haushaltsgeräte einer anderen klangvollen deutschen Marke, die nicht mehr bringen, was sie sollen: Die Bosch Siemens Hausgeräte (BSH), trotz des Namens seit bald zehn Jahren eine reine Bosch-Tochter, schrumpft im ersten Quartal des Jahres ungebremst weiter. Ein Minus beim Umsatz von vier Prozent steht in den Büchern. Gegensteuern will das Unternehmen, zu dem neben der Traditionsmarke Bosch auch zum Beispiel Neff, Siemens und Gaggenau gehören, durch Personalabbau. Weltweit werden mehr als 3000, im Inland immer noch 450 Arbeitsplätze gestrichen. Die Nachfrage der Verbraucher, durch Inflation und Immobilienkrise vorsichtig geworden, ist mau. Eine Zitterpartie für die rund um den Globus etwa 60.000 Beschäftigten, auch wenn BSH-Chef Matthias Metz versichert: „Wir haben einen klaren Zukunftsplan“. Ähnlich wie unlängst bei Miele stehen die Zeichen in diesem April allerdings auf Sturm. Es ist konzernweit allerdings ein vergleichsweise kleineres Unwetter. „In allen für uns wichtigen Branchen sind die Aussichten verhalten“ Denn das Unheil, das über dem bald 140-jährigen Konzern schwebt, bedroht vor allem die größte Sparte der Robert Bosch GmbH. Unter dem neuen Namen „Mobility“ vereinigt Bosch dort die Automobiltechnik mit IT. Die Sparte brachte 2023 gut 61 Prozent des Gesamtumsatzes ein. Im Gegensatz zu den Hausgeräten und Werkzeugen für den Endverbraucher (DIY-Sparte) muss sich der Autozulieferer mit einer Vielzahl von Veränderungen gleichzeitig herumschlagen. Das vergangene Jahr sei schwieriger gewesen als erwartet, konstatierte Bosch-Chef Stefan Hartung bereits bei Vorlage der Bilanzzahlen im Februar. Schlüssel zum zukünftigen Erfolg seien die Klimaschutz-Technologien – allerdings scheint die Nachfrage derzeit weltweit nachzulassen, was für die aufwendige Technik mit hohem Investitionsbedarf keine gute Nachricht ist. Mitverantwortlich, so Hartung: Die Sprunghaftigkeit bei den Rahmenbedigungen, wie etwa in Deutschland der überraschenden Abschaffung der E-Auto-Kaufprämien. Bosch sieht eine schwer kalkulierbare Entwicklung bei den langfristigen Kaufentscheidungen der Verbraucher. Gift für ein Unternehmen, das teure und zielgerichtete Innovation betreibt. „In allen für uns wichtigen Branchen sind die Aussichten verhalten“, warnte Bosch bereits vor dem Verlauf des Jahres 2024, in dem eine Trendwende nicht zu erwarten sei. Allenfalls zwei Prozent Wachstum trauen die international tätigen Stuttgarter der Weltwirtschaft in diesem Jahr zu, erst 2025 hofft Bosch auf Besserung. Überall gibt es im Hause Bosch „Anpassungsbedarf“ Zahlreiche Probleme allerdings scheinen hartnäckiger zu sein, als man es bei Bosch gern sähe. Die Vokabel „Anpassungsbedarf“ wird offenbar eine Konstante der nächsten Zeit. Darunter versteht Bosch in Hinblick auf die zuletzt stabilen Mitarbeiterzahlen keine betriebsbedingten Kündigungen, die man vertraglich bis 2027 ausgeschlossen hat. Allerdings müssen sich viele unter den knapp 134.000 Mitarbeiterinnen und Mitarbeitern in Deutschland auf unruhige Zeiten einstellen. In Deutschland allein stehen voraussichtlich 3700 Jobs zur Disposition. Bosch will durch Qualifizierungsmaßnahmen erreichen, Beschäftigte aus schwächeren Sparten in die stärkeren Bereiche zu übernehmen. Im Autozuliefergeschäft, so kann man es Bosch-Verlautbarungen entnehmen, reicht dies offenbar nicht aus: In Sachen „Anpassungsbedarf“, sprich Arbeitsplatzabbau, spricht man hier bereits mit den Arbeitnehmervertretungen. Hintergrund: Die tiefgreifenden Änderungen im Fokus der Autohersteller sorgen für komplett andere, teils neue Anforderungen an die Zulieferer. Bei Bosch soll der Bereich „Autonomes Fahren“ mit seinen Produkten Steuerungstechnik und Software besonders betroffen sein. Bosch investiert gleichzeitig im außereuropäischen Ausland, und selbst wenn die Geschäftsführung derlei Zusammenhänge nicht hören mag – der Trend geht branchenweit in Richtung Verlagerung aus Europa. Chinas Dominanz macht Herstellern zu schaffen, und damit auch den Zulieferern Dabei hatte Bosch als Elektronikzulieferer hierzulande lange besonders gut Karten. Angefangen einst beim berühmten ABS-Bremssystem, gelangen den Stuttgartern immer wieder Innovationen, die sich branchenweit als Standards etablierten. Heute arbeitet Bosch an Eigenentwicklungen bei Computerchips, die ebenfalls Standards werden sollen. Die speziellen SiC-Chips (Silizium-Karbid-Chips) auf Basis eigener Produktionstechnik sollen ab 2026 den Markt erreichen. Zuletzt übernahm Bosch ein Chipwerk in den USA, wo die Rahmenbedingungen durch die amerikanische Gesetzgebung, etwa das Investitionsförderprogramm Inflation Reduction Act (IRA), günstig sind. Ausgerichtet sind die teuren Innovationen auf eine Welt, in der Elektromobilität zum Alltag gehören wird. Ob dieser Plan so aufgeht, könnte durchaus noch einmal fraglich werden. Von daher ist es kaum verwunderlich, dass Bosch die derzeitige Entwicklung mit Sorge betrachtet. Vor allem die rasant steigenden Zahlen chinesischer Exporte auf dem E-Auto-Sektor machen den Stuttgartern zu schaffen, obwohl Bosch selbst in China vertreten ist. Allein 2023 allerdings verzeichneten die chinesischen Autohersteller hier ein Plus von 60 Prozent und stellten damit manche Preiskalkulation europäischer Konkurrenten auf den Kopf. Hauptleidtragender aufgrund seiner schieren Größe dabei: VW. Kaum verwunderlich, dass angesichts der weitgehend standardisierten Elektrotechnik der chinesischen Marken, allen voran BYD, starke Kostenvorteile auf Seiten der Asiaten zu verbuchen sind. Den so entstehenden Preisdruck geben die deutschen Hersteller an ihre Zulieferer weiter, die ihrerseits nach Stellschrauben suchen, ihre Kosten zu verringern. Sei es durch Stellenabbau, sei es durch Druck wiederum auf die eigenen Lieferanten, oder Firmenübernahmen im außereuropäischen Ausland, wo existierende Unternehmen bereits günstiger produzieren. Zulieferer und Auto-Riesen tragen Konflikte immer öffentlicher aus Insgesamt wird die Luft zunehmend dünner zwischen Zulieferern und Abnehmerindustrie. Und der Ton rauer. Die Autokonzerne erzielen insgesamt weiter auskömmliche Margen, vor allem durch die Konzentration auf den Verkauf höherwertiger Autos – bei den Zulieferern kommen dagegen Kostendruck und harsche Lieferanforderungen an. Man produziert im Einzelfall gerade noch kostendeckend, ist seitens des Branchenverbands CLEPA zu hören. Was früher im diskreten Gespräch untereinander geregelt worden sei, werde nun zunehmend in der Öffentlichkeit diskutiert, etwa wenn – wie unlängst bei BMW – Rückrufe im großen Stil wegen Problemen mit elektronischen Bremssystemen von Continental ins Haus stehen. Über die Kosten von bis zu 400 Millionen Euro darf dann gestritten werden. Bosch selbst liege derzeit im Clinch wegen Lieferproblemen mit Mercedes, berichtete das „Handelsblatt“ Anfang April. Die lachenden Dritten sind schnell ausgemacht – chinesische Hersteller, deren Strukturen staatlich reglementiert sind und von Peking ohne Widerspruchsmöglichkeit durchgesetzt werden. Stellenabbau? Ein „Kulturbruch“ im Traditionshaus Bosch Bei Bosch, gegründet von Robert Bosch 1886, galt der stetige Aufschwung seit Jahrzehnten als Ehrensache. Schließlich gehört Bosch zu mehr als 90 Prozent der am Gemeinwohl orientierten Robert-Bosch-Stiftung. Ihrerseits an diverse Wohltaten gewöhnte Bosch-Leute kannten die heute umlaufenden Vokabeln oft nur vom Hörensagen – Stellenabbau, Kurzarbeit, Leistungsverdichtung. Das alles sieht die IG Metall nun am Horizont. Die Gewerkschafter und Betriebsräte scheinen ihr Unternehmen nicht wiederzuerkennen, einen „Kulturbruch“ konstatiert ein Arbeitnehmervertreter angesichts der Pläne, Stellen abzubauen und umzusetzen – selbst wenn dies „sozialverträglich“ abgefedert werde. Und die Zumutungen erreichen durchaus auch die Spitzen-Fachleute in den Forschungs- und Entwicklungsbereichen, deren Arbeitszeiten - und damit auch Einkommen - reduziert werden könnten. Die Branchenkenner von CLEPA sehen es noch düsterer. Den seit 2018 bereits verschwundenen Arbeitsplätzen, etwa 60.000, würden noch viele weitere folgen. Denn es sei keineswegs ausgemacht, dass die neuen Produkte, also jene im Rahmen der Elektromobilität, mit ihren Anforderungen an Personal den Wegfall der Jobs, die am Verbrenner hängen, ausgleichen könnten. Der Markt, so Oliver Simon, Mitglied im Bosch-Gesamtbetriebsrat, gebe dies einfach nicht her. Firmengründer Robert Bosch konstatierte einst, eher verzichte er auf Geld, als auf das Vertrauen der Kunden. Beides könnte im Ernstfall nun ins Haus stehen."
937dfad3-994b-40ca-9e14-cff83c5837db,2024-04-22 04:51:26+00:00,"Berlin. Caren Miosga versuchte, AfD-Chef Tino Chrupalla zu stellen. Das gelang nur zum Teil, auch weil sie eine eigenwillige Strategie wählte. Kann ein Interview mit hohen Funktionären der AfD gelingen? Dabei werden zwangsläufig die Behauptungen der in Teilen rechtsextremen Partei transportiert, lautet ein Argument dagegen. Auf der anderen Seite hat man es mit einem Angebot zu tun, das derzeit laut Umfragen etwa 20 Prozent der Bundesbürger ansprechend finden. Da wirkt es schräg, das Spitzenpersonal dieses Angebots außen vorzulassen. An diesem Dilemma versuchte sich am Sonntagabend Caren Miosga. Zu Besuch war Tino Chrupalla, Co-Chef der AfD. Im zweiten Teil des Talks kamen außerdem die Journalistin Nadine Lindner und der frühere Siemens-Chef Joe Kaeser dazu. ParteiAlternative für Deutschland (AfD)Gründung6. Februar 2013IdeologieRechtspopulismus, Nationalkonservatismus, EU-SkepsisVorsitzendeTino Chrupalla und Alice Weidel (Stand: April 2023)Fraktionsstärke83 Abgeordnete im Bundestag (Stand: April 2023)Bekannte MitgliederJörg Meuthen (ehemals), Alexander Gauland, Björn Höcke Caren Miosga: Mit Maximilian Krah gegen Tino Chrupalla Für ihren Drahtseilakt wählte die Gastgeberin eine bemerkenswerte Strategie. Kein Wort über Björn Höcke und die Beobachtung der AfD durch den Verfassungsschutz; auch das Wort „rechtsextrem“ fiel kaum. Stattdessen konfrontierte Caren Miosga ihren Gast vor allem mit den Ausfällen von Maximilian Krah, dem Spitzenkandidaten der AfD für die Europawahl. So legt besagter Krah in einem Buch nahe, dass Frauen seltener über einen sehr hohen IQ verfügen und daher nicht so häufig in Spitzenpositionen zu finden seien. In einer Rede behauptete er zudem, dass bestimmte Kulturen unfähig seien, sich an einem modernen Flughafen zurechtzufinden. „Caren Miosga“: Mehr zur Talk-Sendung „Miosga“: „Iran-Strategie in Europa war äußerst naiv“ Söder bei „Miosga“: „Grüne müssen andere Meinung ertragen“ „Miosga“-Premiere mit Merz: „Nazikeule bringt nicht weiter“ Chrupalla versuchte zunächst, die Zitate und Einspieler wegzulächeln. Da müsse man Krah schon selbst fragen, versuchte sich der AfD-Chef herauszuwinden. Und überhaupt, vielleicht habe er das Buch ja gar nicht selbst geschrieben. Im Verlauf der Sendung war Chrupalla allerdings sichtlich genervt. „Ist das jetzt hier ein Buchclub?“, echauffierte er sich. Und: „Dann laden Sie doch Maximilian Krah ein!“ Konfrontation von Chrupalla: Die Systematik fehlte Man könnte nun einwenden, dass Chrupalla ja wirklich nicht für Krah sprechen kann. Nur ist Krah Spitzenkandidat der Partei für die Europawahl – und obendrein auch Mitglied des Bundesvorstands. Natürlich sind seine Gedanken in der Partei mehrheits- und anschlussfähig. Dem kann sich Chrupalla als Partei- und Fraktionschef nicht einfach entziehen. Steckbrief: Gründung, Mitglieder, Fakten – Die wichtigsten Infos zur AfD Rückblick: Geschichte der AfD – Erst Euroskeptiker, dann Rechtspopulisten Mitglieder: Das sind die wichtigsten Politikerinnen und Politiker der AfD Im Überblick: AfD-Politikerin Alice Weidel – Wohnort, Lebensgefährtin, Politik Aufstieg im Osten: Wie es sich anfühlt, wenn die AfD regiert Extremismusforscher: AfD-Verbot sinnvoll? „Könnte Erfolg haben“ Und doch sprang der Ansatz der Gastgeberin etwas zu kurz. Hätte man den in Teilen rechtsextremen Charakter der AfD nicht an weiteren wichtigen Personen, Äußerungen und Inhalten festmachen müssen? Hätte man nicht doch noch einmal über das Potsdamer Treffen sprechen sollen? Die extrem rechte Systematik der Partei wurde so nicht deutlich genug, sodass Chrupalla bei seinem Standpunkt – ein Einzelfall, das müssen Sie schon Herrn Krah fragen – bleiben konnte. Joe Kaeser stellt Chrupalla im Fall Görlitz Umso wichtiger war, dass Joe Kaeser einmal vorführte, was die AfD für den Wirtschaftsstandort Deutschland bedeuten kann. Der Rechtsruck des Landes werde im Ausland genau verfolgt, berichtete der frühere Siemens-Chef. „Ist Deutschland ein sicherer Platz, auch für die Fachkräfte, die mitkommen?“, diese Frage höre er nun häufiger. Verkehr: Wallbox fürs E-Auto kaufen? Experten warnen vor böser Falle Geld: Abfindung im Job kassieren? Diese Tipps sind bares Geld wert Altersvorsorge: Rente & Elternzeit – Ab welchem Einkommen Sie Verlierer sind Seinen Punkt machte Kaeser am Beispiel des Werks von Siemens Energy im sächsischen Görlitz fest. Von zuletzt 32 dort produzierten Turbinen sei nur eine einzige nach Deutschland verkauft worden. 52 Prozent seien in den Weltteil gegangen, über den Chrupallas Co-Chefin Alice Weidel sagte, dass von dort „Kopftuchmädchen“ und „Messermänner“ kämen. „Jetzt stellen Sie sich mal vor, unser Vertreter geht in diese Länder“, sagte Kaeser an Chrupalla gewandt. Das Fazit des Chrupalla-Interviews So richtig gelungen war diese Ausgabe von „Caren Miosga“ nicht. Dafür blieb zu verschwommen, wofür die AfD wirklich steht. Wer als Zuschauer unbedarft in den Talk ging, konnte am Ende meinen, dass Maximilian Krah wohl ein fragwürdiger Zeitgenosse ist. Über die AfD insgesamt lernte man aber nicht viel. Zugutehalten kann man Caren Miosga, dass sie Chrupalla aus der Reserve lockte. Das gelang an einer Stelle auch der Journalistin Nadine Lindner, die darauf hinwies, dass die AfD ein deutsches Deutschland wolle. „Entschuldigung, wir sind Deutschland! Natürlich soll die Identität so bleiben“, entfuhr es Chrupalla da. Es wäre gut gewesen, wenn die Gastgeberin da nachgebohrt hätte. Zur Ausgabe von „Caren Miosga“ in der ARD-Mediathek"
